source,domain,url,created_utc,title,text,query
rss,www.yankodesign.com,https://www.yankodesign.com/2026/01/13/longer-eprint-replaces-uv-dtf-and-rotary-printers-with-one-box/?utm_source=rss&utm_medium=rss&utm_campaign=longer-eprint-replaces-uv-dtf-and-rotary-printers-with-one-box,1768358794,"Longer ePrint Replaces UV, DTF, and Rotary Printers with One Box","Longer ePrint Replaces UV, DTF, and Rotary Printers with One Box

<p class=""rws-nl-img""><a href=""https://www.yankodesign.com/2026/01/13/longer-eprint-replaces-uv-dtf-and-rotary-printers-with-one-box/""><img alt="""" class=""attachment-post-thumbnail size-post-thumbnail wp-post-image"" height=""960"" src=""https://www.yankodesign.com/images/design_news/2026/01/longer-eprint-replaces-uv-dtf-and-rotary-printers-with-one-box/longer-eprint-first-dual-head-personal-uv-printer-01.jpg"" width=""1280"" /></a></p><h2 class=""rws-nl-title"" style=""text-align: center;"">Longer ePrint Replaces UV, DTF, and Rotary Printers with One Box</h2><div class=""rws-nl-excerpt"">A typical small studio or serious hobbyist handles printing across multiple devices and vendors. One machine for paper, maybe another for vinyl, a separate UV...</div>",
rss,www.yankodesign.com,https://www.yankodesign.com/2026/01/13/doomsday-ready-rezvani-tank-2026-looks-sharper-gets-bond-inspired-features/?utm_source=rss&utm_medium=rss&utm_campaign=doomsday-ready-rezvani-tank-2026-looks-sharper-gets-bond-inspired-features,1768354203,"Doomsday ready Rezvani Tank 2026 looks sharper, gets Bond-inspired features","Doomsday ready Rezvani Tank 2026 looks sharper, gets Bond-inspired features

<p class=""rws-nl-img""><a href=""https://www.yankodesign.com/2026/01/13/doomsday-ready-rezvani-tank-2026-looks-sharper-gets-bond-inspired-features/""><img alt="""" class=""attachment-post-thumbnail size-post-thumbnail wp-post-image"" height=""960"" src=""https://www.yankodesign.com/images/design_news/2026/01/doomsday-ready-rezvani-tank-2026-looks-sharper-gets-bond-inspired-features/Rezvani-Tank-2026-5.jpg"" width=""1280"" /></a></p><h2 class=""rws-nl-title"" style=""text-align: center;"">Doomsday ready Rezvani Tank 2026 looks sharper, gets Bond-inspired features</h2><div class=""rws-nl-excerpt"">Rezvani Motors stirred up the automotive market for armored vehicles in 2017 when they introduced the world to the Tank SUV. The promise of power,...</div>",
rss,www.yankodesign.com,https://www.yankodesign.com/2026/01/13/this-20-foot-shipping-container-fits-a-complete-home-for-two/?utm_source=rss&utm_medium=rss&utm_campaign=this-20-foot-shipping-container-fits-a-complete-home-for-two,1768350641,This 20-Foot Shipping Container Fits a Complete Home for Two,"This 20-Foot Shipping Container Fits a Complete Home for Two

<p class=""rws-nl-img""><a href=""https://www.yankodesign.com/2026/01/13/this-20-foot-shipping-container-fits-a-complete-home-for-two/""><img alt="""" class=""attachment-post-thumbnail size-post-thumbnail wp-post-image"" height=""960"" src=""https://www.yankodesign.com/images/design_news/2026/01/teeny-tiny-haus/teeny_tiny_haus_yanko_design_01.jpg"" width=""1280"" /></a></p><h2 class=""rws-nl-title"" style=""text-align: center;"">This 20-Foot Shipping Container Fits a Complete Home for Two</h2><div class=""rws-nl-excerpt"">The humble shipping container continues to prove its versatility in architecture, and Backcountry Containers&#8217; latest project showcases just how much function can be packed into...</div>",
rss,www.yankodesign.com,https://www.yankodesign.com/2026/01/13/inside-the-cheetos-cheesyverse-how-pepsico-turned-a-snack-brand-into-an-immersive-theme-park/?utm_source=rss&utm_medium=rss&utm_campaign=inside-the-cheetos-cheesyverse-how-pepsico-turned-a-snack-brand-into-an-immersive-theme-park,1768347001,Inside the Cheetos Cheesyverse: How PepsiCo Turned a Snack Brand into an Immersive Theme Park,"Inside the Cheetos Cheesyverse: How PepsiCo Turned a Snack Brand into an Immersive Theme Park

<p class=""rws-nl-img""><a href=""https://www.yankodesign.com/2026/01/13/inside-the-cheetos-cheesyverse-how-pepsico-turned-a-snack-brand-into-an-immersive-theme-park/""><img alt="""" class=""attachment-post-thumbnail size-post-thumbnail wp-post-image"" height=""960"" src=""https://www.yankodesign.com/images/design_news/2026/01/auto-draft/cheetos_cheesy_verse_1.jpg"" width=""1280"" /></a></p><h2 class=""rws-nl-title"" style=""text-align: center;"">Inside the Cheetos Cheesyverse: How PepsiCo Turned a Snack Brand into an Immersive Theme Park</h2><div class=""rws-nl-excerpt"">In July 2024, an event in Mexico City called the Cheetos Cheesy Verse invited people to experience the Cheetos brand in person. The large installation,...</div>",
rss,www.yankodesign.com,https://www.yankodesign.com/2026/01/13/this-pokedex-wallet-holds-3-pokemon-cards-along-with-your-cash-and-childhood-nostalgia/?utm_source=rss&utm_medium=rss&utm_campaign=this-pokedex-wallet-holds-3-pokemon-cards-along-with-your-cash-and-childhood-nostalgia,1768343420,This PokéDex Wallet Holds 3 Pokémon Cards Along With Your Cash And Childhood Nostalgia,"This PokéDex Wallet Holds 3 Pokémon Cards Along With Your Cash And Childhood Nostalgia

<p class=""rws-nl-img""><a href=""https://www.yankodesign.com/2026/01/13/this-pokedex-wallet-holds-3-pokemon-cards-along-with-your-cash-and-childhood-nostalgia/""><img alt="""" class=""attachment-post-thumbnail size-post-thumbnail wp-post-image"" height=""1080"" src=""https://www.yankodesign.com/images/design_news/2026/01/auto-draft/pokedex_wallet_1.jpg"" width=""1440"" /></a></p><h2 class=""rws-nl-title"" style=""text-align: center;"">This PokéDex Wallet Holds 3 Pokémon Cards Along With Your Cash And Childhood Nostalgia</h2><div class=""rws-nl-excerpt"">More like Gotta Cash &#8216;Em All, am I right?! Say hello to by far the nerdiest wallet I&#8217;ve ever had the pleasure to set my...</div>",
rss,www.yankodesign.com,https://www.yankodesign.com/2026/01/13/meet-the-iris-etrike-the-swat-kats-style-commuter-pod-that-doesnt-need-a-drivers-license/?utm_source=rss&utm_medium=rss&utm_campaign=meet-the-iris-etrike-the-swat-kats-style-commuter-pod-that-doesnt-need-a-drivers-license,1768339806,"Meet The IRIS eTrike, The SWAT Kats Style Commuter Pod That Doesn’t Need A Driver’s License","Meet The IRIS eTrike, The SWAT Kats Style Commuter Pod That Doesn’t Need A Driver’s License

<p class=""rws-nl-img""><a href=""https://www.yankodesign.com/2026/01/13/meet-the-iris-etrike-the-swat-kats-style-commuter-pod-that-doesnt-need-a-drivers-license/""><img alt="""" class=""attachment-post-thumbnail size-post-thumbnail wp-post-image"" height=""959"" src=""https://www.yankodesign.com/images/design_news/2026/01/meet-the-iris-etrike-the-swat-kats-style-commuter-pod-that-doesnt-need-a-drivers-license/iris_etrike_1.jpg"" width=""1280"" /></a></p><h2 class=""rws-nl-title"" style=""text-align: center;"">Meet The IRIS eTrike, The SWAT Kats Style Commuter Pod That Doesn&#8217;t Need A Driver&#8217;s License</h2><div class=""rws-nl-excerpt"">Remember the Cyclotron from SWAT Kats, that enclosed motorcycle where the rider sat inside a protective cockpit instead of perched on top like a regular...</div>",
rss,www.yankodesign.com,https://www.yankodesign.com/2026/01/13/legos-first-ever-pokemon-sets-transform-pikachu-eevee-and-kanto-legends-into-collectible-icons/?utm_source=rss&utm_medium=rss&utm_campaign=legos-first-ever-pokemon-sets-transform-pikachu-eevee-and-kanto-legends-into-collectible-icons,1768335311,"LEGO’s first-ever Pokémon sets transform Pikachu, Eevee, and Kanto legends into collectible icons","LEGO’s first-ever Pokémon sets transform Pikachu, Eevee, and Kanto legends into collectible icons

<p class=""rws-nl-img""><a href=""https://www.yankodesign.com/2026/01/13/legos-first-ever-pokemon-sets-transform-pikachu-eevee-and-kanto-legends-into-collectible-icons/""><img alt="""" class=""attachment-post-thumbnail size-post-thumbnail wp-post-image"" height=""960"" src=""https://www.yankodesign.com/images/design_news/2026/01/legos-first-ever-pokemon-sets-transform-pikachu-eevee-and-kanto-legends-into-collectible-icons/Lego-Pokemon-Set-1.jpg"" width=""1280"" /></a></p><h2 class=""rws-nl-title"" style=""text-align: center;"">LEGO’s first-ever Pokémon sets transform Pikachu, Eevee, and Kanto legends into collectible icons</h2><div class=""rws-nl-excerpt"">Pokémon franchise is turning 30 next month, and LEGO Group wants to celebrate the occasion with LEGO Pokémon sets. Following leaks and speculations, the official...</div>",
rss,www.yankodesign.com,https://www.yankodesign.com/2026/01/13/honor-magic8-lite-the-lightweight-phone-that-lasts-three-days/?utm_source=rss&utm_medium=rss&utm_campaign=honor-magic8-lite-the-lightweight-phone-that-lasts-three-days,1768328409,Honor Magic8 Lite: The Lightweight Phone That Lasts Three Days,"Honor Magic8 Lite: The Lightweight Phone That Lasts Three Days

<p class=""rws-nl-img""><a href=""https://www.yankodesign.com/2026/01/13/honor-magic8-lite-the-lightweight-phone-that-lasts-three-days/""><img alt="""" class=""attachment-post-thumbnail size-post-thumbnail wp-post-image"" height=""960"" src=""https://www.yankodesign.com/images/design_news/2026/01/honor-magic8-lite-the-lightweight-phone-that-lasts-three-days/honor-magic8-lite-review-03.jpg"" width=""1280"" /></a></p><h2 class=""rws-nl-title"" style=""text-align: center;"">Honor Magic8 Lite: The Lightweight Phone That Lasts Three Days</h2><div class=""rws-nl-excerpt"">There are phones that chase benchmarks and spec sheets. Then there are phones that quietly decide to solve a very boring and very real problem,...</div>",
rss,www.yankodesign.com,https://www.yankodesign.com/2026/01/13/nak-studio-imagines-a-hi-fi-stack-you-would-actually-want-on-display/?utm_source=rss&utm_medium=rss&utm_campaign=nak-studio-imagines-a-hi-fi-stack-you-would-actually-want-on-display,1768324839,NAK Studio Imagines a Hi-Fi Stack You Would Actually Want on Display,"NAK Studio Imagines a Hi-Fi Stack You Would Actually Want on Display

<p class=""rws-nl-img""><a href=""https://www.yankodesign.com/2026/01/13/nak-studio-imagines-a-hi-fi-stack-you-would-actually-want-on-display/""><img alt="""" class=""attachment-post-thumbnail size-post-thumbnail wp-post-image"" height=""960"" src=""https://www.yankodesign.com/images/design_news/2026/01/nak-studio-imagines-a-hi-fi-stack-you-would-actually-want-on-display/hifi-amplifier-cylindrical-control-panel-speakers-12.jpg"" width=""1280"" /></a></p><h2 class=""rws-nl-title"" style=""text-align: center;"">NAK Studio Imagines a Hi-Fi Stack You Would Actually Want on Display</h2><div class=""rws-nl-excerpt"">Most Hi-Fi gear still looks like anonymous black rectangles, even in carefully designed living rooms. Serious listeners often hide their amps and speakers in cabinets...</div>",
rss,www.yankodesign.com,https://www.yankodesign.com/2026/01/13/ilo-lamp-lets-soft-light-wander-between-rooms/?utm_source=rss&utm_medium=rss&utm_campaign=ilo-lamp-lets-soft-light-wander-between-rooms,1768321242,ILO Lamp Lets Soft Light Wander Between Rooms,"ILO Lamp Lets Soft Light Wander Between Rooms

<p class=""rws-nl-img""><a href=""https://www.yankodesign.com/2026/01/13/ilo-lamp-lets-soft-light-wander-between-rooms/""><img alt="""" class=""attachment-post-thumbnail size-post-thumbnail wp-post-image"" height=""960"" src=""https://www.yankodesign.com/images/design_news/2026/01/ilo-lamp-lets-soft-light-wander-between-rooms/ilo-lamp-09.jpg"" width=""1280"" /></a></p><h2 class=""rws-nl-title"" style=""text-align: center;"">ILO Lamp Lets Soft Light Wander Between Rooms</h2><div class=""rws-nl-excerpt"">Evenings drift from kitchen to dining table to balcony and back, while the nicest lamp stays tethered to a single socket. The small but persistent...</div>",
rss,www.archdaily.com,https://www.archdaily.com/1037642/underdream-hygge-lodge-arconnect-architects,1768348800,Underdream Hygge Lodge / ArCONNECT Architects,"Underdream Hygge Lodge / ArCONNECT Architects

<p><em>1. Two Temperaments and Two Scales of the Site</em> — The site is an independent old farm located outside a village at the foot of Cangshan Mountain. It is a long, narrow plot oriented east–west, with relatively shallow depth from north to south. To the north lies Shuangyuan Stream, one of the eighteen streams descending from Cangshan. The site is embraced by dense woodland, accompanied by the constant sound of flowing water, creating a secluded and tranquil mountain-forest atmosphere. To the south, the land opens dramatically toward vast farmland, where the nineteen peaks of Cangshan undulate across the horizon in full view, evoking an expansive pastoral scene reminiscent of the poetic line, ""Plucking chrysanthemums by the eastern fence, I leisurely glimpse the southern mountains."" The site thus possesses two distinct temperaments: mountain forest and pastoral landscape.</p>",
rss,www.archdaily.com,https://www.archdaily.com/1037029/ki-residence-studio-sanshou,1768330800,Ki Residence / Studio Sanshou,"Ki Residence / Studio Sanshou

<p>A 360-degree turnstile is the heart of our design, transforming the home into a changing medley of spaces. When closed, the wall blends into a shade of pink. With a slow, dramatic turn, the spaces beyond are revealed. Now, a maroon shelf and its contents are on full display.</p>",
rss,www.archdaily.com,https://www.archdaily.com/1014937/s-house-gubbins-polidura-arquitectos-plus-masarquitectos,1768323600,“S” House / Gubbins Polidura Arquitectos + MasArquitectos,"“S” House / Gubbins Polidura Arquitectos + MasArquitectos

<p>Punta Pite is located between <a href=""https://www.archdaily.com/tag/zapallar"">Zapallar</a> and Papudo, about 150 km north of Santiago, Chile. The site, as its name indicates, is a rocky point that juts into the sea. The task was to design a second home for a couple and their three children.</p>",
rss,www.archdaily.com,https://www.archdaily.com/1037609/jl-dam-house-garbin-arquitetos,1768316400,JL Dam House / Garbin Arquitetos,"JL Dam House / Garbin Arquitetos

<p>Implanted on a rugged plot of land at the edge of one of the arms of the Ibi&uacute;na reservoir, in the interior of S&atilde;o Paulo, Casa CR JL emerges from a careful reading of the topography and the existing landscape. The project begins with an understanding of the steep slope of the lot and the strong presence of water as structuring elements of the architectural proposal. From the outset, a solution was sought that not only adapted to the land but utilized its characteristics as spatial and landscape potential. The residence was designed for a young couple, with the premise of accommodating transformations over time, which led to the adoption of a modular system capable of allowing coherent future expansions. Currently, the house features five suites, a direct result of this progressive growth strategy.</p>",
rss,www.archdaily.com,https://www.archdaily.com/1037680/the-belvedere-restaurant-rudy-guenaire,1768305600,The Belvédère Restaurant / Rudy Guénaire,"The Belvédère Restaurant / Rudy Guénaire

<p>Le Belvédère is a <strong>200-seat restaurant</strong> located near Crillon-Le-Brave, in Provence. Located in the <strong>heart of nature,</strong> the restaurant boasts an incredible view of the famous Mont Ventoux. The site is operated by the Vertigo group, a pioneer of Parisian bistronomy, renowned for its exemplary product sourcing.</p>",
rss,www.archdaily.com,https://www.archdaily.com/1037335/house-c-xstudio,1768298400,House C / XStudio,"House C / XStudio

<p>House C transforms a minimal 32 m² apartment into a continuous, luminous interior landscape deeply connected to the sea. What was once a fragmented and irregular dwelling is reinterpreted as a single, legible space, freed from unnecessary partitions in order to allow a clear and uninterrupted reading of the whole. Only the bathroom remains enclosed, conceived as an autonomous cabin that preserves intimacy while reinforcing the perception of the apartment as a single room.</p>",
rss,www.archdaily.com,https://www.archdaily.com/1037748/designing-streets-through-the-lens-of-care,1768289400,Designing Streets Through the Lens of Care,"Designing Streets Through the Lens of Care

<p>Reflecting on the modern city, Walter Benjamin described the <a href=""https://en.wikipedia.org/wiki/Fl%c3%a2neur?utm_medium=website&amp;utm_source=archdaily.com"" target=""_blank""><em>flâneur</em></a>, a figure who walks without a defined destination, attentive to details, chance encounters, and the narratives that emerge from urban space. This way of being in the city, shaped by observation and openness to the unexpected, has long been in tension with the rationalist and functionalist ideals that came to guide urban planning throughout the twentieth century. Streets designed primarily for efficiency and flow rarely leave room for detours, pauses, or the coexistence of different rhythms of life.</p>",
rss,www.archdaily.com,https://www.archdaily.com/1037732/the-douban-museum-cswadi,1768287600,The Douban Museum / CSWADI,"The Douban Museum / CSWADI

<p>The Douban museum is located in Ande Town, within the prime irrigation area of Dujiangyan, where traditional farming culture intersects with modern sauce production, echoing the organic texture of the Western Sichuan Linpan. Surrounded by woodlands and bamboo with dotted farmhouses, it possesses a strong ecological foundation. Protecting this ecology became the project's guiding principle.</p>",
rss,www.archdaily.com,https://www.archdaily.com/1037471/a-responsible-addition-himacs-shapes-achieve-scs-certification-for-recycled-content,1768286700,A Responsible Addition: HIMACS Shapes Achieve SCS Certification for Recycled Content,"A Responsible Addition: HIMACS Shapes Achieve SCS Certification for Recycled Content

<p>In a balance of aesthetics, performance, and versatility, <a href=""https://www.lxhausys.com/eu-en?utm_medium=website&amp;utm_source=archdaily.com"" rel=""noopener"" target=""_blank"">HIMACS</a> shows a solid surface material of choice for many architects and designers. Taking a further step forward, the entire range of standard HIMACS sinks and basins is now officially SCS certified, containing a minimum of 8% pre-consumer recycled content. This certification enhances the material's technical and visual appeal by providing a more sustainable option without compromising quality or functionality.</p>",
rss,www.archdaily.com,https://www.archdaily.com/1037784/full-of-people-and-alive-once-again-in-conversation-with-holcim-award-grand-prize-winner-riwaq-centre-for-architectural-conservation,1768285800,"""Full of People and Alive Once Again"": In Conversation With Holcim Award Grand Prize Winner RIWAQ – Centre for Architectural Conservation","""Full of People and Alive Once Again"": In Conversation With Holcim Award Grand Prize Winner RIWAQ – Centre for Architectural Conservation

<p>Qalandiya: the Green Historic Maze, developed by <a href=""https://www.archdaily.com/tag/riwaq-centre-for-architectural-conservation/page/1"">RIWAQ – Centre for Architectural Conservation</a>, <a href=""https://www.archdaily.com/1036257/grand-prize-winners-announced-for-the-2025-holcim-foundation-awards?ad_source=search&amp;ad_medium=projects_tab&amp;ad_source=search&amp;ad_medium=search_result_all"">has been awarded the Grand Prize at the Holcim Foundation Awards 2025</a>, recognizing its sensitive and deeply contextual approach to heritage conservation in <a href=""https://www.archdaily.com/country/palestine/page/1"">Palestine</a>, <a href=""https://www.archdaily.com/1035453/holcim-foundation-for-sustainable-construction-reveals-20-winning-projects-of-the-2025-holcim-awards?ad_source=search&amp;ad_medium=projects_tab&amp;ad_source=search&amp;ad_medium=search_result_all"">selected among the 20 winners of this year's edition</a>. Located in Qalandiya, north of <a href=""https://www.archdaily.com/tag/jerusalem/page/1"">Jerusalem</a>, the project reactivates a historic village center long affected by political fragmentation, neglect, and spatial disconnection. Through an incremental rehabilitation strategy, the project restores deteriorated structures using traditional knowledge, local stone masonry, and native materials, transforming abandoned fabric into active public spaces while reinforcing environmental resilience through passive climate strategies and landscape-based infrastructure.</p>",
rss,www.archdaily.com,https://www.archdaily.com/1037656/langholmen-residence-mer-architects,1768284000,Långholmen Residence  / Mer Architects,"Långholmen Residence  / Mer Architects

<p>The Finnish coastal archipelago consists of over 80,000 islands. The islands began to emerge from the sea after the ice age, approximately 10,000 years ago. Their cliffs of mostly granite and gneiss have been polished smooth by the kilometers-tall ice sheet that had been pressing them down. The first inhabitants of the archipelago settled about 4000 years ago, and the biggest islands are still inhabited all year round.</p>",
rss,www.archdaily.com,https://www.archdaily.com/1037773/equatorial-guinea-relocates-its-capital-from-malabo-to-ciudad-de-la-paz-on-central-africas-mainland,1768282200,Equatorial Guinea Relocates Its Capital From Malabo to Ciudad de la Paz on Central Africa’s Mainland,"Equatorial Guinea Relocates Its Capital From Malabo to Ciudad de la Paz on Central Africa’s Mainland

<p><a href=""https://www.archdaily.com/tag/malabo"" rel=""noopener"" target=""_blank"">Malabo </a>served as the capital city of <a href=""https://www.archdaily.com/tag/equatorial-guinea"" rel=""noopener"" target=""_blank"">Equatorial Guinea</a> from the country's independence from Spain on October 12, 1968, until January 2, 2026, when <a href=""https://www.guineaecuatorialpress.com/noticias/decreto_ley_por_el_que_se_declara_la_ciudad_de_la_paz_djibloho_capital_de_la_republica_de_guinea_ecuatorial?utm_medium=website&amp;utm_source=archdaily.com"" rel=""noopener"" target=""_blank"">a decree issued by President Teodoro Obiang Nguema Mbasogo</a> officially transferred the capital to Ciudad de la Paz (""City of Peace""), located in Djibloho Province. Obiang formalized the move as part of a long-planned territorial reorganization. While the former capital remains an important economic center on Bioko Island, Ciudad de la Paz was conceived as a planned capital on <a href=""https://www.archdaily.com/tag/africa"" rel=""noopener"" target=""_blank"">Africa</a>'s mainland. <a href=""https://www.archdaily.com/187398/djibloho-equatorial-guinea%25e2%2580%2599s-future-capital-city-idf-ideias-do-futuro"" rel=""noopener"" target=""_blank"">The initiative to relocate the capital dates back to 2008, with construction beginning in 2011</a>. The new capital, also referred to as Djibloho, after the province, or Oyala, has been framed by the government as a decentralization effort aimed at improving national accessibility.</p>",
rss,www.archdaily.com,https://www.archdaily.com/1037685/from-wenzhou-to-nurnberg-7-unbuilt-cultural-projects-imagining-public-life,1768276800,From Wenzhou to Nürnberg: 7 Unbuilt Cultural Projects Imagining Public Life,"From Wenzhou to Nürnberg: 7 Unbuilt Cultural Projects Imagining Public Life

<p><a href=""https://www.archdaily.com/search/projects/categories/cultural-center"">Cultural institutions</a> represent an active field for unbuilt architectural exploration, reflecting how architects continue to question the role of public buildings in shaping <a href=""https://www.archdaily.com/search/projects/categories/urban-design"">urban life</a>. In this <a href=""https://www.archdaily.com/tag/unbuilt-architecture"">Unbuilt</a> edition, <a href=""https://www.archdaily.com/contact"">submitted by the ArchDaily community,</a> the selected proposals bring together a range of projects that engage with museums, exhibition centers, and diplomatic buildings as sites of <a href=""https://www.archdaily.com/tag/public-architecture"">public</a> encounter. Rather than treating these programs as fixed types, these projects approach them as evolving spatial settings through which cities engage with history, knowledge, and representation.</p>",
rss,www.archdaily.com,https://www.archdaily.com/1037698/woodhub-cf-moller,1768273200,WoodHub / C.F. Møller,"WoodHub / C.F. Møller

<p>A new office building that gathers several government agencies under one roof in the centre of <a href=""https://www.archdaily.com/tag/odense"">Odense</a> is a pioneer project in large scale timber construction and the largest timber office building in Denmark.</p>",
rss,www.archdaily.com,https://www.archdaily.com/1037669/cereus-house-circle-studio-architects,1768269600,Cereus House / Circle Studio Architects,"Cereus House / Circle Studio Architects

<p>Peeking above a 1915 Edwardian cottage sits a white curved shell, a contemporary extension to a weatherboard home in a heritage pocket in inner-west Melbourne. Cereus House brings light, height, and flow to the existing dwelling through the addition of two curved forms that overlook the north-facing backyard. The clients wanted a solid, thermally comfortable home with bright spaces and a connection to the outside. It needed to accommodate working from home, be a sanctuary for retreat, and connect to the couple's property behind for when family and friends visit. A part of the brief was to retain an oversized cereus cactus in the backyard's east.</p>",
