source,domain,url,created_utc,title,text,query
rss,www.yankodesign.com,https://www.yankodesign.com/2025/10/02/solopatch-is-an-assistive-tool-that-changes-everyday-independence/?utm_source=rss&utm_medium=rss&utm_campaign=solopatch-is-an-assistive-tool-that-changes-everyday-independence,1759399626,Solopatch is an assistive tool that changes everyday independence,"Solopatch is an assistive tool that changes everyday independence

<p class=""rws-nl-img""><a href=""https://www.yankodesign.com/2025/10/02/solopatch-is-an-assistive-tool-that-changes-everyday-independence/""><img alt="""" class=""attachment-post-thumbnail size-post-thumbnail wp-post-image"" height=""960"" src=""https://www.yankodesign.com/images/design_news/2025/09/solopatch-is-an-assistive-tool-that-changes-everyday-independence/solopatch-01.jpg"" width=""1280"" /></a></p><h2 class=""rws-nl-title"" style=""text-align: center;"">Solopatch is an assistive tool that changes everyday independence</h2><div class=""rws-nl-excerpt"">Solopatch is transforming the world of assistive tools with a simple yet powerful idea. Designed by Liu Chia-Yi , it is a thin, lightweight patch...</div>",
rss,www.yankodesign.com,https://www.yankodesign.com/2025/10/02/open-printer-gives-makers-a-fully-open-flexible-inkjet-platform/?utm_source=rss&utm_medium=rss&utm_campaign=open-printer-gives-makers-a-fully-open-flexible-inkjet-platform,1759394734,Open Printer Gives Makers a Fully Open Flexible Inkjet Platform,"Open Printer Gives Makers a Fully Open Flexible Inkjet Platform

<p class=""rws-nl-img""><a href=""https://www.yankodesign.com/2025/10/02/open-printer-gives-makers-a-fully-open-flexible-inkjet-platform/""><img alt="""" class=""attachment-post-thumbnail size-post-thumbnail wp-post-image"" height=""960"" src=""https://www.yankodesign.com/images/design_news/2025/09/open-printer-gives-makers-a-fully-open-flexible-inkjet-platform/open-printer-01.jpg"" width=""1280"" /></a></p><h2 class=""rws-nl-title"" style=""text-align: center;"">Open Printer Gives Makers a Fully Open Flexible Inkjet Platform</h2><div class=""rws-nl-excerpt"">Traditional inkjet printers have become increasingly frustrating for anyone who values flexibility, repairability, or creative experimentation. Locked-down firmware prevents modifications, expensive proprietary cartridges drain budgets,...</div>",
rss,www.yankodesign.com,https://www.yankodesign.com/2025/10/01/get-ready-for-humanism-inspired-robot-vacuums-that-blend-into-your-home-decor/?utm_source=rss&utm_medium=rss&utm_campaign=get-ready-for-humanism-inspired-robot-vacuums-that-blend-into-your-home-decor,1759369524,Get Ready For Humanism-inspired Robot Vacuums That Blend Into Your Home Decor,"Get Ready For Humanism-inspired Robot Vacuums That Blend Into Your Home Decor

<p class=""rws-nl-img""><a href=""https://www.yankodesign.com/2025/10/01/get-ready-for-humanism-inspired-robot-vacuums-that-blend-into-your-home-decor/""><img alt="""" class=""attachment-post-thumbnail size-post-thumbnail wp-post-image"" height=""960"" src=""https://www.yankodesign.com/images/design_news/2025/09/draft-roborock/Roborock_Qrevo_CurvX_Robot_Vacuum_and_Mop_01.jpg"" width=""1280"" /></a></p><h2 class=""rws-nl-title"" style=""text-align: center;"">Get Ready For Humanism-inspired Robot Vacuums That Blend Into Your Home Decor</h2><div class=""rws-nl-excerpt"">Most robot vacuums beg for your forgiveness with their awkward, boxy presence, but the Roborock Qrevo CurvX asks for a place in your home like...</div>",
rss,www.yankodesign.com,https://www.yankodesign.com/2025/10/01/nikons-pocket-binoculars-are-so-small-theyre-almost-invisible/?utm_source=rss&utm_medium=rss&utm_campaign=nikons-pocket-binoculars-are-so-small-theyre-almost-invisible,1759365027,"Nikon’s Pocket Binoculars Are So Small, They’re Almost Invisible","Nikon’s Pocket Binoculars Are So Small, They’re Almost Invisible

<p class=""rws-nl-img""><a href=""https://www.yankodesign.com/2025/10/01/nikons-pocket-binoculars-are-so-small-theyre-almost-invisible/""><img alt="""" class=""attachment-post-thumbnail size-post-thumbnail wp-post-image"" height=""959"" src=""https://www.yankodesign.com/images/design_news/2025/10/draft-nikon/nikon_4x10d_binoculars_1.jpg"" width=""1280"" /></a></p><h2 class=""rws-nl-title"" style=""text-align: center;"">Nikon&#8217;s Pocket Binoculars Are So Small, They&#8217;re Almost Invisible</h2><div class=""rws-nl-excerpt"">It is always a good day when a company re-releases a product that feels like it fell out of a different timeline. Nikon has done...</div>",
rss,www.yankodesign.com,https://www.yankodesign.com/2025/10/01/finally-a-tiny-house-built-for-long-term-living-meet-the-mark-vi-vic/?utm_source=rss&utm_medium=rss&utm_campaign=finally-a-tiny-house-built-for-long-term-living-meet-the-mark-vi-vic,1759361408,"Finally, A Tiny House Built For Long-Term Living: Meet The Mark VI – VIC","Finally, A Tiny House Built For Long-Term Living: Meet The Mark VI – VIC

<p class=""rws-nl-img""><a href=""https://www.yankodesign.com/2025/10/01/finally-a-tiny-house-built-for-long-term-living-meet-the-mark-vi-vic/""><img alt="""" class=""attachment-post-thumbnail size-post-thumbnail wp-post-image"" height=""960"" src=""https://www.yankodesign.com/images/design_news/2025/09/mark-vi-vic/mark_tiny_home_yanko_design_hero.jpg"" width=""1280"" /></a></p><h2 class=""rws-nl-title"" style=""text-align: center;"">Finally, A Tiny House Built For Long-Term Living: Meet The Mark VI &#8211; VIC</h2><div class=""rws-nl-excerpt"">The tiny house movement has long promised affordable, minimalist living, but many designs fall short in terms of long-term habitability. Australian company Sonic Steel is...</div>",
rss,www.yankodesign.com,https://www.yankodesign.com/2025/10/01/charlotte-robot-aims-to-build-a-200-square-meter-home-in-24-hours/?utm_source=rss&utm_medium=rss&utm_campaign=charlotte-robot-aims-to-build-a-200-square-meter-home-in-24-hours,1759357852,Charlotte robot aims to build a 200 square meter home in 24 hours,"Charlotte robot aims to build a 200 square meter home in 24 hours

<p class=""rws-nl-img""><a href=""https://www.yankodesign.com/2025/10/01/charlotte-robot-aims-to-build-a-200-square-meter-home-in-24-hours/""><img alt="""" class=""attachment-post-thumbnail size-post-thumbnail wp-post-image"" height=""960"" src=""https://www.yankodesign.com/images/design_news/2025/10/charlotte-robot-aims-to-build-a-200-square-meter-home-in-24-hours/charlotte-robot-.jpg"" width=""1280"" /></a></p><h2 class=""rws-nl-title"" style=""text-align: center;"">Charlotte robot aims to build a 200 square meter home in 24 hours</h2><div class=""rws-nl-excerpt"">Revealed during the International Astronautical Congress in Sydney, Charlotte is a six leg construction robot from Crest Robotics that targets speed as the central problem....</div>",
rss,www.yankodesign.com,https://www.yankodesign.com/2025/10/01/children-designed-this-award-winning-pavilion-and-it-only-cost-1000/?utm_source=rss&utm_medium=rss&utm_campaign=children-designed-this-award-winning-pavilion-and-it-only-cost-1000,1759354240,Children Designed This Award-Winning Pavilion. And It Only Cost $1000…,"Children Designed This Award-Winning Pavilion. And It Only Cost $1000…

<p class=""rws-nl-img""><a href=""https://www.yankodesign.com/2025/10/01/children-designed-this-award-winning-pavilion-and-it-only-cost-1000/""><img alt="""" class=""attachment-post-thumbnail size-post-thumbnail wp-post-image"" height=""960"" src=""https://www.yankodesign.com/images/design_news/2025/10/auto-draft/hi_ladders_high_1.jpg"" width=""1280"" /></a></p><h2 class=""rws-nl-title"" style=""text-align: center;"">Children Designed This Award-Winning Pavilion. And It Only Cost $1000&#8230;</h2><div class=""rws-nl-excerpt"">It’s easy to get lost in the sea of glossy architectural renders that flood our feeds daily; projects with nine-figure budgets and materials sourced from...</div>",
rss,www.yankodesign.com,https://www.yankodesign.com/2025/10/01/amazon-built-a-better-siri-and-homepod-mini-before-apple/?utm_source=rss&utm_medium=rss&utm_campaign=amazon-built-a-better-siri-and-homepod-mini-before-apple,1759350615,Amazon Built A Better Siri and HomePod Mini Before Apple…,"Amazon Built A Better Siri and HomePod Mini Before Apple…

<p class=""rws-nl-img""><a href=""https://www.yankodesign.com/2025/10/01/amazon-built-a-better-siri-and-homepod-mini-before-apple/""><img alt="""" class=""attachment-post-thumbnail size-post-thumbnail wp-post-image"" height=""960"" src=""https://www.yankodesign.com/images/design_news/2025/10/amazon-built-a-better-siri-and-homepod-mini-before-apple/amazon_echo_dot_max_1.jpg"" width=""1280"" /></a></p><h2 class=""rws-nl-title"" style=""text-align: center;"">Amazon Built A Better Siri and HomePod Mini Before Apple&#8230;</h2><div class=""rws-nl-excerpt"">It’s always a little funny watching the tech giants trip over each other, but I have to admit, I didn’t see this one coming. For...</div>",
rss,www.yankodesign.com,https://www.yankodesign.com/2025/10/01/the-tiny-workshop-that-conquered-britain-how-an-engineers-space-saving-genius-won-shed-of-the-year/?utm_source=rss&utm_medium=rss&utm_campaign=the-tiny-workshop-that-conquered-britain-how-an-engineers-space-saving-genius-won-shed-of-the-year,1759346112,The Tiny Workshop That Conquered Britain: How An Engineer’s Space-Saving Genius Won Shed Of The Year,"The Tiny Workshop That Conquered Britain: How An Engineer’s Space-Saving Genius Won Shed Of The Year

<p class=""rws-nl-img""><a href=""https://www.yankodesign.com/2025/10/01/the-tiny-workshop-that-conquered-britain-how-an-engineers-space-saving-genius-won-shed-of-the-year/""><img alt="""" class=""attachment-post-thumbnail size-post-thumbnail wp-post-image"" height=""960"" src=""https://www.yankodesign.com/images/design_news/2025/09/tiny-workshop/tiny_workshop_yanko_design_01.jpg"" width=""1280"" /></a></p><h2 class=""rws-nl-title"" style=""text-align: center;"">The Tiny Workshop That Conquered Britain: How An Engineer&#8217;s Space-Saving Genius Won Shed Of The Year</h2><div class=""rws-nl-excerpt"">In a world where garden space comes at a premium, Mike Robinson proved that size doesn&#8217;t matter when innovation takes center stage. The Plumstead engineer&#8217;s...</div>",
rss,www.yankodesign.com,https://www.yankodesign.com/2025/10/01/the-kyza-911-x-how-a-digital-artist-rewrites-porsches-most-sacred-icon/?utm_source=rss&utm_medium=rss&utm_campaign=the-kyza-911-x-how-a-digital-artist-rewrites-porsches-most-sacred-icon,1759339242,The Kyza 911-X: How a Digital Artist Rewrites Porsche’s Most Sacred Icon,"The Kyza 911-X: How a Digital Artist Rewrites Porsche’s Most Sacred Icon

<p class=""rws-nl-img""><a href=""https://www.yankodesign.com/2025/10/01/the-kyza-911-x-how-a-digital-artist-rewrites-porsches-most-sacred-icon/""><img alt="""" class=""attachment-post-thumbnail size-post-thumbnail wp-post-image"" height=""960"" src=""https://www.yankodesign.com/images/design_news/2025/10/the-kyza-911-x-how-a-digital-artist-rewrites-porsches-most-sacred-icon/Kyza-1.jpg"" width=""1280"" /></a></p><h2 class=""rws-nl-title"" style=""text-align: center;"">The Kyza 911-X: How a Digital Artist Rewrites Porsche’s Most Sacred Icon</h2><div class=""rws-nl-excerpt"">Porsche maintains one of the most conservative design philosophies in automotive history. For six decades, the 911&#8217;s distinctive silhouette has remained immediately recognizable, evolving gradually...</div>",
rss,www.archdaily.com,https://www.archdaily.com/1034666/major-architecture-events-and-heritage-initiatives-announced-worldwide-the-weeks-review,1759383000,Major Architecture Events and Heritage Initiatives Announced Worldwide: The Week’s Review,"Major Architecture Events and Heritage Initiatives Announced Worldwide: The Week’s Review

<p>September marks a shift in seasonality worldwide, bringing with it a renewed focus on cultural and <a href=""https://www.archdaily.com/search/events"" rel=""noopener"" target=""_blank"">architectural events</a> that encourage reflection on contemporary global challenges. This week's major news highlighted international <a href=""https://www.archdaily.com/tag/exhibitions"" rel=""noopener"" target=""_blank"">exhibitions </a>and design initiatives addressing questions of <a href=""https://www.archdaily.com/tag/resilience"" rel=""noopener"" target=""_blank"">resilience</a>, <a href=""https://www.archdaily.com/tag/urban-design"" rel=""noopener"" target=""_blank"">urban transformation</a>, and collective <a href=""https://www.archdaily.com/tag/future"" rel=""noopener"" target=""_blank"">futures</a>, alongside new projects dedicated to preserving both cultural and natural <a href=""https://www.archdaily.com/tag/heritage"" rel=""noopener"" target=""_blank"">heritage</a>. Across continents, biennales, urban developments, and restoration efforts are shaping a broader conversation on how architecture and design can foster adaptation, memory, and coexistence in rapidly changing environments.</p>",
rss,www.archdaily.com,https://www.archdaily.com/1034631/reclaiming-the-narrative-a-new-generation-of-museums-in-west-africa,1759377600,Reclaiming the Narrative: A New Generation of Museums in West Africa,"Reclaiming the Narrative: A New Generation of Museums in West Africa

<p>As countries in <a href=""https://www.archdaily.com/tag/africa"" rel=""noopener"" target=""_blank"">Africa</a> emerged from <a href=""https://www.archdaily.com/tag/colonialism"" rel=""noopener"" target=""_blank"">colonialism</a> in the mid-twentieth century, many expressed their independent identities through architecture. This process continues several decades later, exemplified by several new <a href=""https://www.archdaily.com/tag/museums"" rel=""noopener"" target=""_blank"">museums</a> in <a href=""https://www.archdaily.com/tag/west-africa"" rel=""noopener"" target=""_blank"">West Africa</a>, recently completed or in planning. Although varying in purpose and form, they have some common goals: addressing the need for restitution of many artifacts taken during colonialism and mostly kept in European museums; and defining a museum with local identity as opposed to a non-contextual import.</p>",
rss,www.archdaily.com,https://www.archdaily.com/1034579/suite-9-at-delft-university-of-technology-campus-studioninedots,1759374000,Suite 9 at Delft University of Technology Campus / Studioninedots,"Suite 9 at Delft University of Technology Campus / Studioninedots

<p>Suite 9 brings new life to the <a href=""https://www.archdaily.com/tag/delft"">Delft</a> University of Technology Campus with <strong>137 self-contained student residences.</strong> At the core of the building lies the<strong> 'Heart': a</strong> <strong>huge semi-outdoor space </strong>that defines Suite 9's striking profile and serves as the place where student life can spark into being.</p>",
rss,www.archdaily.com,https://www.archdaily.com/1034641/maison-le-sommet-chiasmus-partners,1759370400,Maison Le Sommet / Chiasmus Partners,"Maison Le Sommet / Chiasmus Partners

<p>In A Pattern Language (1977), Christopher Alexander proposed that residential buildings in cities should be no taller than six stories. Beyond this height, he argued, residents begin to detach from their street culture—not only physically but socially. Urban life becomes abstracted; the tactile and emotional immediacy of the street is lost. In Alexander's view, the vitality of a city is founded on a human scale—a sentiment echoed by Jane Jacobs, who championed the street as a stage for community life and advocated for diverse, walkable neighbourhoods where people live, work, and interact across social thresholds.</p>",
rss,www.archdaily.com,https://www.archdaily.com/1029828/the-wind-h-art-center-phase-i-jin-qiuye-architecture-studio,1759363200,The Wind H Art Center (Phase I) / Jin Qiuye Studio,"The Wind H Art Center (Phase I) / Jin Qiuye Studio

<p>The Wind H Art Center in the 751 District was converted from an industrial factory and its office buildings. Its renovation was done in three phases. Phase I is the main exhibition hall and an art shop. Its original building was an industrial factory from the 1980s with an office extension added in the 1990s. It has concrete columns on the east and west sides supporting a folded concrete roof, creating a column - free space. Before renovation, the southern side had a mezzanine level, while the rest was open - plan office space.</p>",
rss,www.archdaily.com,https://www.archdaily.com/1034638/korinda-house-bent-architecture,1759345200,Korinda House / Bent Architecture,"Korinda House / Bent Architecture

<p>Set gently across six acres of sloping bushland on Melbourne's fringe, Korinda House is a home of quiet resilience and deep connection — shaped not only by the contours of the land, but by the personalities, rhythms and rituals of the family who live within it.</p>",
rss,www.archdaily.com,https://www.archdaily.com/957746/a-new-college-in-a-french-village-coco-architecture-plus-jean-de-giacinto-architecture-composite,1759338000,A New College in a French Village / CoCo architecture + Jean de Giacinto Architecture Composite,"A New College in a French Village / CoCo architecture + Jean de Giacinto Architecture Composite

<p>A new college in a French village: an innovative learning environment, sustainable and pedagogical. The construction of buildings dedicated to education is a unique opportunity to see architecture participate in the transmission of knowledge in a playful way. The project aimed at setting an example in terms of comfort and brightness. It has been designed to facilitate its use by the operator, in particular for access management and security. Building a place of learning is an opportunity to develop curiosity and constructive awakening in the child. As in the construction of a shack, the assembly of the materials that form the building must be easily readable by students.</p>",
rss,www.archdaily.com,https://www.archdaily.com/1034564/varanda-house-esquadra-arquitetos,1759330800,Varanda House / Esquadra Arquitetos,"Varanda House / Esquadra Arquitetos

<p>Designed to make the most of the native vegetation and enhance the natural beauty of the land, Casa Varanda was born from a careful listening to the place itself. The project was built on a spacious lot with a gentle slope and rich vegetation of Cerrado trees such as paineiras and other species.</p>",
rss,www.archdaily.com,https://www.archdaily.com/999512/the-school-of-social-development-studio-berardi-miglio,1759320000,The School of Social Development / studio berardi miglio,"The School of Social Development / studio berardi miglio

<p>The humanitarian organization Jay Nepal asked us to plan a school and volunteer center in a very remote place, a small and very poor village called Bodgaun in Nepal, about three hour's drive north of the capital Kathmandu. From the very beginning, we were aware that realizing this project, in many aspects, would be a complex challenge: having started the planning during the pandemic, we had not been able to visit the site, the financial resources were very limited (about one hundred thousand euros) and the planning and realization time was tight.</p>",
rss,www.archdaily.com,https://www.archdaily.com/1034608/apartment-31-ns-studio,1759312800,Apartment 31  / NS Studio,"Apartment 31  / NS Studio

<p>The <a href=""https://www.archdaily.com/tag/tbilisi"">Tbilisi</a> apartment is designed to offer a balance of comfort, aesthetic sophistication, and adaptability. Spanning 170 m², the goal was to create a space where the overall design serves as a versatile backdrop, allowing the apartment to shift in character depending on the residents' needs and moods. This is achieved through a carefully chosen combination of materials, colors, and furnishings that can easily be updated or changed, giving the space both functional and visual flexibility.</p>",
rss,www.archdaily.com,https://www.archdaily.com/1034619/the-industrial-skyline-transforming-chinas-decommissioned-factories-into-cultural-venues,1759303800,The Industrial Skyline: Transforming China's Decommissioned Factories into Cultural Venues,"The Industrial Skyline: Transforming China's Decommissioned Factories into Cultural Venues

<p>Across <a href=""https://www.archdaily.com/search/projects/country/china"" rel=""noopener"" target=""_blank"">China</a>, a legacy of vast <a href=""https://www.archdaily.com/1032522/a-different-type-of-rurality-designs-for-post-industrial-heritage-transformation?ad_source=search&amp;ad_medium=search_result_articles"" rel=""noopener"" target=""_blank"">industrial structures </a>stands decommissioned, as a direct result of the nation's economic shift to different forms of industry. These buildings are defined by their colossal height and deep structural capacity. Today, they present an architectural challenge for <a href=""https://www.archdaily.com/1031298/from-expansion-to-enhancement-shanghais-urban-development-framework?ad_source=search&amp;ad_medium=search_result_articles"" rel=""noopener"" target=""_blank"">contemporary urban renewal</a> and a new topic for <a href=""https://www.archdaily.com/tag/heritage-restoration"" rel=""noopener"" target=""_blank"">heritage preservation</a>. As they become absorbed by growing urban developments, architects are tasked with translating them into functional, public-facing assets. Thus, recent interventions are capitalizing on defining elements such as furnaces and chimneys to help reposition these massive complexes as critical urban landmarks.</p>",
rss,www.archdaily.com,https://www.archdaily.com/1034266/homa-house-homa-studio,1759302000,Homa House / HOMA Studio,"Homa House / HOMA Studio

<p>It all begins with the earth. A project emerges, rooted deeply in the land it inhabits — not merely as a nod to ancestry or locality, but as an invitation to reimagine what living can be. This is a home fully<br />protected, quietly experimental, unfolding through a series of nuanced and intriguing moments.</p>",
rss,www.archdaily.com,https://www.archdaily.com/1033821/eliminating-the-barrier-between-indoor-spaces-and-nature,1759301100,Eliminating the Barrier Between Indoor Spaces and Nature,"Eliminating the Barrier Between Indoor Spaces and Nature

<p>For centuries, architecture has been shaped by the aspiration to create a smooth transition between the indoors and the outdoors. Today, technologically sophisticated window and facade systems allow architects to design open, light-flooded room concepts without losing heat. The <a href=""https://www.archdaily.com/catalog/us/companies/2058/solarlux"">Solarlux</a> cero maximum sliding window can eliminate the boundaries between spaces, demonstrated most impressively when large-format elements replace building corners. This is a technical achievement accomplished entirely without supports that disrupt the view. <a href=""https://solarlux.com/en/?utm_campaign=DE+BE+Architekt&amp;utm_medium=Portaleintrag&amp;utm_source=Archdaily"" target=""_blank"">cero</a> creates a direct, immediate connection to nature that goes far beyond what standard solutions can offer.</p>",
rss,www.archdaily.com,https://www.archdaily.com/1034639/milans-2026-olympic-village-by-som-completed-ahead-of-winter-games,1759300200,Milan’s 2026 Olympic Village by SOM Completed Ahead of Winter Games,"Milan’s 2026 Olympic Village by SOM Completed Ahead of Winter Games

<p>The first images have been released of the completed <a href=""https://www.archdaily.com/1033956/soms-olympic-village-for-milano-cortina-2026-combines-athlete-housing-with-long-term-urban-use"">Athletes' Village for the 2026 Winter Olympics</a> in <a href=""https://www.archdaily.com/tag/milan"">Milan</a>, following its official handover to the <a href=""https://www.archdaily.com/tag/milano-cortina-2026"">Milano Cortina</a> Foundation ahead of the <a href=""https://www.archdaily.com/tag/winter-olympics/page/1"">Games</a> in February. Developed by <a href=""https://www.archdaily.com/professional/coima-srl?ad_source=search&amp;ad_medium=search_result_professionals"">COIMA</a> and designed by <a href=""https://www.archdaily.com/tag/skidmore-owings-and-merrill"">Skidmore, Owings &amp; Merrill (SOM)</a>, the project has been envisioned as both a <a href=""https://www.archdaily.com/tag/temporary"">temporary</a> <a href=""https://www.archdaily.com/tag/residence"">residence</a> for athletes and a long-term urban asset for the <a href=""https://www.archdaily.com/tag/city"">city</a>. Delivered in 30 months and ahead of schedule, the Village is located within the Porta Romana <a href=""https://www.archdaily.com/tag/railway"">railway</a> yard, and comprises six new residential buildings and the <a href=""https://www.archdaily.com/tag/restoration"">restoration</a> of two <a href=""https://www.archdaily.com/tag/historic"">historic</a> structures: the former Squadra Rialzo locomotive workshop and the Basilico building. Together, they provide <a href=""https://www.archdaily.com/tag/housing"">housing</a> for athletes during the <a href=""https://www.archdaily.com/tag/winter-olympics/page/1"">Games</a>, along with 40,000 square meters of <a href=""https://www.archdaily.com/tag/community"">community</a> spaces, landscaped <a href=""https://www.archdaily.com/tag/courtyard"">courtyards</a>, and three <a href=""https://www.archdaily.com/tag/sports"">sports</a> courts.</p>",
