source,domain,url,created_utc,title,text,query
youtube,,https://www.youtube.com/watch?v=ZA1R-UCml5E,1759385487,#fashion #lifeisbutadream #cardigan,"Discover the latest jeans, trousers, tops, shirts, dresses, kurti, dupatta, abaya, casual wear, office wear, party wear outfit ideas for ...",women's fashion trends
youtube,,https://www.youtube.com/watch?v=H8e4KJs-QZ0,1759384825,"Party Dresses, Cocktail Dresses &amp; Evening Gowns 2025 | Stylish Women’s Fashion Trends","Hello there lovelies Welcome to our channel, on this channel we are sharing with you some of our elegant, sophisticated and very ...",women's fashion trends
youtube,,https://www.youtube.com/watch?v=6nrnQSkdN6s,1759383851,#fashion #lifeisbutadream #ootd,"Discover the latest jeans, trousers, tops, shirts, dresses, kurti, dupatta, abaya, casual wear, office wear, party wear outfit ideas for ...",women's fashion trends
youtube,,https://www.youtube.com/watch?v=VzQJ-5nRm6Q,1759383122,TENDENCIAS DE MODA OTOÑO INVIERNO 2025 #tendenciasdemoda,,women's fashion trends
youtube,,https://www.youtube.com/watch?v=wACoiOXkTjo,1759383034,Gujarati watsapp status song #whatsappstatus #love #gujratistetus #fashiontrends #comedy #fashiontre,,women's fashion trends
youtube,,https://www.youtube.com/watch?v=gdtl6l6y1JE,1759378123,💐 ZARA NEW WOMEN’S FALL 2025 COLLECTION 💝 TOP FASHION TRENDS &amp; LATEST ARRIVALS,"Get up to 15% of the additional cashback from over 3500 online stores, incl. Macy's, H&M, and Uniqlo with RAKUTEN Cashback ...",women's fashion trends
youtube,,https://www.youtube.com/watch?v=Np_65IK5R94,1759378003,🥰 Round Pair 🛍️ #onlineshopping #womensnewcollection #fashiontrends #ecofriendlyclothing,,women's fashion trends
youtube,,https://www.youtube.com/watch?v=-iC-3QjEaLI,1759375800,Gujarati watsapp status song #whatsappstatus #love #gujratistetus #fashiontrends #comedy #shortvideo,,women's fashion trends
youtube,,https://www.youtube.com/watch?v=nXr4GBDaqQY,1759356188,🤩NOVIDADES MODA FEMININA PADRÃO BOUTIQUE,"As principais tendências da Moda você encontra aqui! Lançamentos moda feminina padrão boutique nas grades de tamanhos P, ...",women's fashion trends
youtube,,https://www.youtube.com/watch?v=wO6v9OVMcLo,1759333518,#trending #love #fashiontrends #viral #shortvideos #share #new #song #cover #like #follow #new,,women's fashion trends
youtube,,https://www.youtube.com/watch?v=k_SZNtZvb0I,1759330968,Viste elegante con TRAJE SASTRE. #fashion #moda #aesthetic #oldmoney #fashiontrends,https://youtube.com/shorts/OpZWIkZ7bLQ.,women's fashion trends
youtube,,https://www.youtube.com/watch?v=iJ9V_C_JxQI,1759330891,Fall 2025 Accessory Trends That Actually FLATTER Women Over 50,"Fall 2025 accessory styling made simple! Discover how to elevate your look with a cape, scarf, and faux fur collar—three timeless ...",women's fashion trends
youtube,,https://www.youtube.com/watch?v=bLvMjsDXk7k,1759327265,ZARA NEW WOMEN&#39;S COLLECTION  A/W 2025 | ZARA NUEVA COLECCION MUJER OTOÑO - INVIERNO 2025,00:00 ZARA New Women's Collection A/W 2025 00:10 ZARA New Arrivals October 2025 19:57 ZARA x Disney / Zara & Harry ...,women's fashion trends
youtube,,https://www.youtube.com/watch?v=3QX8yyD1kCs,1759326020,Return Policy #khatoonejannat #onlineshopping #fashionstyles #traditionalcloth #saree #fashiontrends,khatoonejannat Firdous rabi centre Brandedcutpieces Branded cut pieces Bin anwar Dhanak fashion sapphire bareeze fashion ...,women's fashion trends
youtube,,https://www.youtube.com/watch?v=5kNIcWIQo5Y,1759320924,#fashion #lifeisbutadream #cardigan,"Discover the latest jeans, trousers, tops, shirts, dresses, kurti, dupatta, abaya, casual wear, office wear, party wear outfit ideas for ...",women's fashion trends
youtube,,https://www.youtube.com/watch?v=Qe-tmJ7rUMA,1759320050,Best Fashion Trends 2025//Stylish and Trendy Outfits for Ladies #fashionhub ,Best Fashion Trends 2025//Stylish and Trendy Outfits for Ladies #fashionhub Thanks for watching.,women's fashion trends
youtube,,https://www.youtube.com/watch?v=uQrQQqe_JAM,1759317305,Объемные плечи: главный тренд осени,"Трансформируемся этой осенью! Даже идеальные ""песочные часы"" превращаются в ""перевернутый треугольник""!",women's fashion trends
youtube,,https://www.youtube.com/watch?v=WHxJf19h4qc,1759314053,The Best Street Style From Milan SS26 #fashion #style #trends #streetstyle #moda #패션,,women's fashion trends
youtube,,https://www.youtube.com/watch?v=rDucne7JITE,1759400155,Asian Streetwear 2025 | Viral Global Trends #fashiontrends #chinesefashion,Asian Streetwear 2025 | Viral Global Trends #fashiontrends #chinesefashion #チャイナ美女 #chinesestreetfashion #chinesegirl ...,streetwear 2025
youtube,,https://www.youtube.com/watch?v=_NXp0u9zZkM,1759399376,“Celana Cargo LEGEND – Slim Fit Adem &amp; Kuat!”,"Bukan cargo biasa! Slim fit stretch adem, awet & stylish. Wajib punya! Buat kamu yang mau order silahkan kunjungi toko kami ...",streetwear 2025
youtube,,https://www.youtube.com/watch?v=n5lQ-UvnMuQ,1759399284,addict(s)　2025A/Wコレクション　Vol.25 #fashion #mensfashion #clothing #streetwear #pant #ootd,メンズセレクトショップaddict(s)で取り扱っている2025AWコレクションのアイテム紹介になります。,streetwear 2025
youtube,,https://www.youtube.com/watch?v=gCmkr9WITv4,1759388444,Must Have Jeans Pants Under ₹699 👖🔥 Budget Fashion Finds! #shorts #fashion #style,Must Have Jeans Pants Under ₹699 Budget Fashion Finds! Upgrade your wardrobe with these must-have jeans pants ...,streetwear 2025
youtube,,https://www.youtube.com/watch?v=w5DCLjZu0h8,1759374392,🔥 Trending 2025 Sneakers You Need in | Viral Must-Have.  #sneakers,"Experience the ultimate unboxing of 2025's most hyped sneakers! These luxury style kicks bring premium craftsmanship, ...",streetwear 2025
youtube,,https://www.youtube.com/watch?v=xq7y78lUYVw,1759370464,【2025 Fall/Winter Streetwear | Custom Knittedwear Collection】 🔥🔥,"We offer a variety of styles: polo shirts, T-shirts, jackets, crewneck sweatshirts, and more. Fabric thickness and craftsmanship are ...",streetwear 2025
youtube,,https://www.youtube.com/watch?v=xPISg6wkP2Q,1759368656,Best Streetwear Outfits of 2025 | Urban Fashion Style #chinastreetfashion #streetfashiongirls,st Streetwear Outfits of 2025 | Urban Fashion Style #chinastreetfashion #streetfashiongirls Welcome to Fashion Walk! In this video ...,streetwear 2025
youtube,,https://www.youtube.com/watch?v=Hzdya7AJgRw,1759366880,🔥 Stylish Sneaker Unboxing | Trendy Sports Shoes 2025#SneakerUnboxing #SneakerReview #SportsShoes,Stylish Sneaker Unboxing | Trendy Sports Shoes 2025 #SneakerUnboxing #SneakerReview #SportsShoes #TrendyShoes ...,streetwear 2025
youtube,,https://www.youtube.com/watch?v=dp71HrjOdAE,1759360533,Luxury Minimal Streetwear | White Romper Trend 2025 #outfit #model #ootd #fashion #fashiontrend #fyp,"From luxury runways to urban streets, the white romper aesthetic is going viral . A bold yet refined choice, combining elegance + ...",streetwear 2025
youtube,,https://www.youtube.com/watch?v=CFlaNUi37O8,1759343413,anime streetwear vibes 👕🔥 best anime t-shirt collection 2025 #freefire #ootdguide #animeclothing,anime streetwear vibes best anime t-shirt collection 2025 unleash your anime style with inkwear nation's latest streetwear ...,streetwear 2025
youtube,,https://www.youtube.com/watch?v=dKsrDAVsEgs,1759341645,Ces tendances mode doivent s&#39;arrêter en 2025 ❌️,,streetwear 2025
youtube,,https://www.youtube.com/watch?v=sVdTaBPZxH8,1759335203,Compleuri Trendy 2025 – Outfit rapid &amp; ieftin 💎,"Compleuri de vară – stil și confort într-un singur outfit! Alege seturi moderne cu tricou și pantaloni scurți, perfecte pentru zilele ...",streetwear 2025
youtube,,https://www.youtube.com/watch?v=IYeFjiWjl3g,1759332153,🔥 Top 6 Hoodie Types You Must Try in 2025 | Hoodie Style Guide 😎✨ #fashion #hoodedits #amazonfinds,"Looking for the coolest hoodie styles in 2025? ✨ From oversized hoodies to graphic hoodies, we've covered the most trendy ...",streetwear 2025
youtube,,https://www.youtube.com/watch?v=cff5CglRXh8,1759330874,Streetwear Highlights ✦ 5 Urban Fashion Looks 2025,"Five unique outfits, one short: from bold leather and chic dresses to casual denim and sporty hoodies. UrbanSynth captures the ...",streetwear 2025
youtube,,https://www.youtube.com/watch?v=WmC-UqnkfXI,1759316466,Le 5 migliori sneakers della settimana - 22/28 Settembre 2025,"Sneaker della settimana: 22-28 Settembre Decine di release, ma quante valgono davvero l'acquisto? 1️⃣ Asics x 18 East ...",streetwear 2025
youtube,,https://www.youtube.com/watch?v=8FYXIseXaYE,1759299177,Top Compleuri Trening 2025 💎Confort &amp; Stil🔥,"LINK IN BIO PENTRU PRODUSE     ✨ Confort maxim, stil urban și vibe modern – compleurile de trening sunt alegerea ...",streetwear 2025
youtube,,https://www.youtube.com/watch?v=KbQt-JwMLe0,1759296598,Chinese Streetwear 2025 | Global Style Inspiration  #fashiontrends #chinesestreetfashion,"Experience the rise of Chinese Streetwear 2025, where bold designs from Shanghai and Beijing spark global street style trends.",streetwear 2025
youtube,,https://www.youtube.com/watch?v=g7K1F1HscRQ,1759282700,“Streetwear Outfit Ideas 2025 🔥 #fashion#shorts#shortvideo#yt shorts#viral#viralvideo#video#yt#ootd,Casual Outfit Ideas for Girls | Everyday Lookbook” #FashionTips #StyleHacks #OutfitIdeas #StyleTips #FashionShorts#OOTD ...,streetwear 2025
youtube,,https://www.youtube.com/watch?v=7N04S3rRM50,1759257010,anime streetwear vibes 👕🔥 best anime t-shirt collection 2025,anime streetwear vibes best anime t-shirt collection 2025 unleash your anime style with inkwear nation's latest streetwear ...,streetwear 2025
youtube,,https://www.youtube.com/watch?v=B_ypwOKV9YU,1759255670,"*NEW* STREETWEAR + SOLARIS OWL BUNDLES! Overwatch 2 Shop Update [September 30th, 2025]",WoW.,streetwear 2025
youtube,,https://www.youtube.com/watch?v=uVVsKbiwEIE,1759255297,DROP 3/2025: @mad_enlatados 🔥qual sua favorita?já disponível em nosso website.,,streetwear 2025
youtube,,https://www.youtube.com/watch?v=V9kQsU9BEBY,1759254429,Best street fashion to wear 2025 #fashion #drip #streetwear #outfit,,streetwear 2025
youtube,,https://www.youtube.com/watch?v=3P1WD2MdpW8,1759249737,Trendy Men’s T-Shirts 2025 | Stylish Streetwear &amp; Casual Outfit Ideas #glowingskin #shorts,"Discover the latest men's T-shirt trends of 2025! From streetwear to casual outfits, these T-shirts bring style, comfort, and premium ...",streetwear 2025
youtube,,https://www.youtube.com/watch?v=9r1MjM9UOsU,1759248017,"Dress to impress, save more! Shop the sale. #myntrabff2025  #3xdiscounts",,streetwear 2025
youtube,,https://www.youtube.com/watch?v=RT8e_vCutio,1759246103,In big 2025?💔 #drip #clips #fashion #viral #streetwear,,streetwear 2025
rss,smashingmagazine.com,https://smashingmagazine.com/2025/09/desktop-wallpaper-calendars-october-2025/,1759230000,Shades Of October (2025 Wallpapers Edition),"Shades Of October (2025 Wallpapers Edition)

How about some new wallpapers to get your desktop ready for fall and the upcoming Halloween season? We’ve got you covered! Following our monthly tradition, the wallpapers in this post were created with love by the community for the community and can be downloaded for free. Enjoy!",
rss,smashingmagazine.com,https://smashingmagazine.com/2025/09/from-prompt-to-partner-designing-custom-ai-assistant/,1758880800,From Prompt To Partner: Designing Your Custom AI Assistant,"From Prompt To Partner: Designing Your Custom AI Assistant

What if your best AI prompts didn’t disappear into your unorganized chat history, but came back tomorrow as a reliable assistant? In this article, you’ll learn how to turn one-off “aha” prompts into reusable assistants that are tailored to your audience, grounded in your knowledge, and consistent every time, saving you (and your team) from typing the same 448-word prompt ever again.",
rss,smashingmagazine.com,https://smashingmagazine.com/2025/09/intent-prototyping-pure-vibe-coding-enterprise-ux/,1758733200,Intent Prototyping: The Allure And Danger Of Pure Vibe Coding In Enterprise UX (Part 1),"Intent Prototyping: The Allure And Danger Of Pure Vibe Coding In Enterprise UX (Part 1)

Yegor Gilyov examines the problem of over-reliance on static high-fidelity mockups, which often leave the conceptual model and user flows dangerously underdeveloped. He then explores whether AI-powered prototyping is the answer, questioning whether the path forward is the popular “vibe coding” approach or a more structured, intent-driven approach.",
rss,smashingmagazine.com,https://smashingmagazine.com/2025/09/ambient-animations-web-design-principles-implementation/,1758546000,Ambient Animations In Web Design: Principles And Implementation (Part 1),"Ambient Animations In Web Design: Principles And Implementation (Part 1)

Creating motion can be tricky. Too much and it’s distracting. Too little and a design feels flat. Ambient animations are the middle ground &mdash; subtle, slow-moving details that add atmosphere without stealing the show. In this article, web design pioneer Andy Clarke introduces the concept of ambient animations and explains how to implement them.",
rss,smashingmagazine.com,https://smashingmagazine.com/2025/09/psychology-trust-ai-guide-measuring-designing-user-confidence/,1758276000,The Psychology Of Trust In AI: A Guide To Measuring And Designing For User Confidence,"The Psychology Of Trust In AI: A Guide To Measuring And Designing For User Confidence

With digital products moving to incorporate generative and agentic AI at an increasingly frequent rate, trust has become the invisible user interface. When it works, interactions feel seamless. When it fails, the entire experience collapses. But trust isn’t mystical. It can be understood, measured, and designed for. Here are practical methods and strategies for designing more trustworthy and ethical AI systems.",
rss,smashingmagazine.com,https://smashingmagazine.com/2025/09/how-minimize-environmental-impact-website/,1758189600,How To Minimize The Environmental Impact Of Your Website,"How To Minimize The Environmental Impact Of Your Website

As responsible digital professionals, we are becoming increasingly aware of the environmental impact of our work and need to find effective and pragmatic ways to reduce it. James Chudley shares a new decarbonising approach that will help you to minimise the environmental impact of your website, benefiting people, profit, purpose, performance, and the planet.",
rss,smashingmagazine.com,https://smashingmagazine.com/2025/09/serpapi-complete-api-fetching-search-engine-data/,1758042000,SerpApi: A Complete API For Fetching Search Engine Data,"SerpApi: A Complete API For Fetching Search Engine Data

From competitive SEO research and monitoring prices to training AI and parsing local geographic data, real-time search results power smarter apps. Tools like SerpApi make it easy to pull, customize, and integrate this data directly into your app or website.",
rss,smashingmagazine.com,https://smashingmagazine.com/2025/09/functional-personas-ai-lean-practical-workflow/,1758009600,"Functional Personas With AI: A Lean, Practical Workflow","Functional Personas With AI: A Lean, Practical Workflow

For too long, personas have been created with considerable effort, only to offer limited value. Paul Boag shows how to breathe new life into this stale UX asset and demonstrates that it’s possible to create truly useful functional personas in a lightweight way.",
rss,smashingmagazine.com,https://smashingmagazine.com/2025/09/creating-elastic-bounce-effects-expressive-animator/,1757930400,Creating Elastic And Bounce Effects With Expressive Animator,"Creating Elastic And Bounce Effects With Expressive Animator

Elastic and bounce effects have long been among the most desirable but time-consuming techniques in motion design. Expressive Animator streamlines the process, making it possible to produce lively animations in seconds, bypassing the tedious work of manual keyframe editing.",
rss,smashingmagazine.com,https://smashingmagazine.com/2025/09/ux-strategies-real-time-dashboards/,1757689200,From Data To Decisions: UX Strategies For Real-Time Dashboards,"From Data To Decisions: UX Strategies For Real-Time Dashboards

Real-time dashboards are decision assistants, not passive displays. In environments like fleet management, healthcare, and operations, the cost of a delay or misstep is high. Karan Rawal explores strategic UX patterns that shorten time-to-decision, reduce cognitive overload, and make live systems trustworthy.",
rss,smashingmagazine.com,https://smashingmagazine.com/2025/09/integrating-css-cascade-layers-existing-project/,1757498400,Integrating CSS Cascade Layers To An Existing Project,"Integrating CSS Cascade Layers To An Existing Project

The idea behind this is to share a full, unfiltered look at integrating CSS Cascade Layers into an existing legacy codebase. In practice, it’s about refactoring existing CSS to use cascade layers without breaking anything.",
rss,smashingmagazine.com,https://smashingmagazine.com/2025/09/designing-tv-principles-patterns-practical-guidance/,1756980000,"Designing For TV: Principles, Patterns And Practical Guidance (Part 2)","Designing For TV: Principles, Patterns And Practical Guidance (Part 2)

After covering in detail the underlying interaction paradigms of TV experiences in [Part 1](https://www.smashingmagazine.com/2025/08/designing-tv-evergreen-pattern-shapes-tv-experiences/), it’s time to get practical. In the second part of the series, you’ll explore the building blocks of the “10-foot experience” and how to best utilise them in your designs.",
rss,smashingmagazine.com,https://smashingmagazine.com/2025/08/desktop-wallpaper-calendars-september-2025/,1756627200,A Breeze Of Inspiration In September (2025 Wallpapers Edition),"A Breeze Of Inspiration In September (2025 Wallpapers Edition)

Could there be a better way to welcome the new month than with a new collection of desktop wallpapers? We’ve got some eye-catching designs to make your September just a bit more colorful. Enjoy!",
rss,smashingmagazine.com,https://smashingmagazine.com/2025/08/prompting-design-act-brief-guide-iterate-ai/,1756461600,"Prompting Is A Design Act: How To Brief, Guide And Iterate With AI","Prompting Is A Design Act: How To Brief, Guide And Iterate With AI

Prompting is more than giving AI some instructions. You could think of it as a design act, part creative brief and part conversation design. This second article on AI augmenting design work introduces a designerly approach to prompting: one that blends creative briefing, interaction design, and structural clarity.",
rss,smashingmagazine.com,https://smashingmagazine.com/2025/08/designing-tv-evergreen-pattern-shapes-tv-experiences/,1756299600,Designing For TV: The Evergreen Pattern That Shapes TV Experiences (Part 1),"Designing For TV: The Evergreen Pattern That Shapes TV Experiences (Part 1)

TV interface design is a unique, fascinating, and often overlooked field. It’s been guided by decades of evolution and innovation, yet still firmly constrained by its legacy. Follow Milan into the history, quirks, and unshakable rules that dictate how we control these devices.",
rss,smashingmagazine.com,https://smashingmagazine.com/2025/08/optimizing-pwas-different-display-modes/,1756195200,Optimizing PWAs For Different Display Modes,"Optimizing PWAs For Different Display Modes

Progressive Web Apps (PWAs) are a great way to make apps built for the web feel native, but in moving away from a browser environment, we can introduce usability issues. This article covers how we can modify our app depending on what display mode is applied to mitigate these issues.",
rss,smashingmagazine.com,https://smashingmagazine.com/2025/08/week-in-life-ai-augmented-designer/,1755849600,A Week In The Life Of An AI-Augmented Designer,"A Week In The Life Of An AI-Augmented Designer

If you are new to using AI in design or curious about integrating AI into your UX process without losing your human touch, this article offers a grounded, day-by-day look at introducing AI into your design workflow.",
rss,smashingmagazine.com,https://smashingmagazine.com/2025/08/double-edged-sustainability-sword-ai-web-design/,1755684000,The Double-Edged Sustainability Sword Of AI In Web Design,"The Double-Edged Sustainability Sword Of AI In Web Design

AI has introduced huge efficiencies for web designers and is frequently being touted as the key to unlocking sustainable design and development. But do these gains outweigh the environmental cost of using energy-hungry AI tools?",
rss,smashingmagazine.com,https://smashingmagazine.com/2025/08/beyond-hype-what-ai-can-do-product-design/,1755522000,Beyond The Hype: What AI Can Really Do For Product Design,"Beyond The Hype: What AI Can Really Do For Product Design

AI tools are improving fast, but it’s still not clear how they fit into a real product design workflow. Nikita Samutin walks through four core stages &mdash; from analytics and ideation to prototyping and visual design &mdash; to show where AI fits and where it doesn’t, illustrated with real-world examples.",
rss,uxdesign.cc,https://uxdesign.cc/building-a-product-that-doesnt-exist-2a0f65896ccb?source=rss----138adf9c44c---4,1759359554,Building a product that doesn’t exist,"Building a product that doesn’t exist

<div class=""medium-feed-item""><p class=""medium-feed-image""><a href=""https://uxdesign.cc/building-a-product-that-doesnt-exist-2a0f65896ccb?source=rss----138adf9c44c---4""><img src=""https://cdn-images-1.medium.com/max/2600/1*xXUhOcVhEUc9MPxsPYOsXw.png"" width=""4444"" /></a></p><p class=""medium-feed-snippet"">Designers, product, and engineers are all guided by the &#x201c;Product Ideal.&#x201d; The problem is, they&#x2019;re all seeing a different one.</p><p class=""medium-feed-link""><a href=""https://uxdesign.cc/building-a-product-that-doesnt-exist-2a0f65896ccb?source=rss----138adf9c44c---4"">Continue reading on UX Collective »</a></p></div>",
