source,domain,url,created_utc,title,text,query
rss,www.nytimes.com,https://www.nytimes.com/2025/09/27/business/media/neil-kraft-dead.html,1759170518,"Neil Kraft, Visionary Adman Who Sold ‘a Mood and a Lifestyle,’ Dies at 67","Neil Kraft, Visionary Adman Who Sold ‘a Mood and a Lifestyle,’ Dies at 67

His ads for Calvin Klein and others captured a fizzy moment in the 1980s and ’90s, featuring celebrities like the young rapper Marky Mark wearing nothing but underwear and a grin.",
rss,www.nytimes.com,https://www.nytimes.com/2025/09/27/style/versace-dario-vitale.html,1759069340,"At Versace, Dario Vitale’s Debut Gets Down and Dirty","At Versace, Dario Vitale’s Debut Gets Down and Dirty

Dario Vitale reinvents the brand with sex, suggestion and a bit of fun.",
rss,www.nytimes.com,https://www.nytimes.com/2025/09/27/style/erica-taylor-midlife-makeup.html,1758963655,Erica Taylor Is Social Media’s Midlife Makeup Guru,"Erica Taylor Is Social Media’s Midlife Makeup Guru

Erica Taylor wants you to forget everything you learned about makeup in high school.",
rss,www.nytimes.com,https://www.nytimes.com/2025/09/27/style/gen-z-divorce.html,1758963606,How Does Gen Z Divorce Look Different?,"How Does Gen Z Divorce Look Different?

For one thing, speed is of the essence.",
rss,www.nytimes.com,https://www.nytimes.com/2025/09/26/obituaries/mel-taub-puzzles.html,1758943581,You Asked for More of Mel Taub’s Puzzles. Here Are Three.,"You Asked for More of Mel Taub’s Puzzles. Here Are Three.

With his Puns and Anagrams puzzles, Mr. Taub made solvers groan and grin for decades. After he died this month, readers expressed appreciation for his work.",
rss,www.nytimes.com,https://www.nytimes.com/2025/09/26/style/harry-styles-marathon-tracksmith.html,1758916465,Harry Styles Surprised Tracksmith by Wearing Their Shorts in Berlin Marathon,"Harry Styles Surprised Tracksmith by Wearing Their Shorts in Berlin Marathon

When Harry Styles shocked the running world with a sub-three-hour marathon, he wore Tracksmith shorts. He isn’t sponsored by the company, but they’re big fans.",
rss,www.nytimes.com,https://www.nytimes.com/2025/09/26/style/ny-philharmonic-gala-alec-baldwin.html,1758908338,"At New York’s Philharmonic Gala, Alec Baldwin Cheers Gustavo Dudamel","At New York’s Philharmonic Gala, Alec Baldwin Cheers Gustavo Dudamel

“Dudamel is our Bernstein,” Mr. Baldwin said at the New York Philharmonic’s opening night gala on Thursday.",
rss,www.nytimes.com,https://www.nytimes.com/2025/09/26/style/ivana-lowell-house-of-guinness-netflix.html,1759241893,A Guinness Heiress Goes to Netflix,"A Guinness Heiress Goes to Netflix

Ivana Lowell talks about spinning her high-drama family tales into “House of Guinness” with the “Peaky Blinders” creator Steven Knight.",
rss,www.nytimes.com,https://www.nytimes.com/2025/09/26/style/prada-spring-2026.html,1758881309,The Prada Guide to Dressing for Doomsday,"The Prada Guide to Dressing for Doomsday

Bras, bloomers and fancy frocks were all in the mix. But it’s not about the items; it’s about the approach.",
rss,www.nytimes.com,https://www.nytimes.com/2025/09/26/style/sylvia-macmillan-phoebe-philo-nails-nikeskims.html,1758889811,"Sylvie MacMillan’s Hot New Nail Trend, NikeSkims and More Fashion News","Sylvie MacMillan’s Hot New Nail Trend, NikeSkims and More Fashion News

Sylvie Macmillan’s square muted nails have been called “the manicure for fall.” Plus, clothing lines from Kim Kardashian and a Gen Z domestic diva.",
rss,www.nytimes.com,https://www.nytimes.com/2025/09/26/style/ilaria-icardi-jewelry-julia-roberts.html,1759162556,Her Side Gig Is Designing Jewelry for Julia Roberts,"Her Side Gig Is Designing Jewelry for Julia Roberts

After years in the fashion trenches, Ilaria Icardi made a foray into accessories. It’s been golden.",
rss,www.nytimes.com,https://www.nytimes.com/2025/09/26/style/raye-schiller-joseph-nemanpour-wedding.html,1758893176,Gender Bending Jewish Traditions With a Little Humor,"Gender Bending Jewish Traditions With a Little Humor

Raye Schiller, a standup comedian, could always recognize Jay Nemanpour’s laugh in a crowd.",
rss,www.nytimes.com,https://www.nytimes.com/2025/09/26/style/lena-wilson-nadine-santoro-wedding.html,1758859222,A Soul Mate Hidden in Plain Sight,"A Soul Mate Hidden in Plain Sight

Nadine Santoro and Lena Wilson met online in 2016 and became close friends. Years later, they realized they were in love.",
rss,www.nytimes.com,https://www.nytimes.com/2025/09/26/style/wolfgang-ruth-camilo-osorio-wedding.html,1758859219,They Never Expected Their Spanish Lessons to Go Viral,"They Never Expected Their Spanish Lessons to Go Viral

When Juan Osorio began teaching Wolfgang Ruth his native language, their bond (and their following) quickly grew.",
rss,www.nytimes.com,https://www.nytimes.com/2025/09/26/style/hadley-mendelsohn-charles-lewis-wedding.html,1758859215,The Spooky Wedding of Her Dreams (or Nightmares),"The Spooky Wedding of Her Dreams (or Nightmares)

Hadley Mendelsohn, a horror and true crime aficionado, and Charles Lewis met while both were spending the early weeks of the pandemic in Florida. Each took a leap of faith.",
rss,www.nytimes.com,https://www.nytimes.com/2025/09/26/style/sarah-rappaport-daniel-davies-wedding.html,1758859214,He Drove From Wales to London to Take Her to Lunch,"He Drove From Wales to London to Take Her to Lunch

Daniel Davies took a chance by asking Sarah Rappaport out, then driving three hours to meet her. She, in turn, got “butterflies.”",
rss,www.nytimes.com,https://www.nytimes.com/2025/09/26/style/dress-rehearsal-for-a-wedding-ill-never-attend.html,1758859207,Dress Rehearsal for a Wedding I’ll Never Attend,"Dress Rehearsal for a Wedding I’ll Never Attend

When I told my 15-year-old daughter I was dying, she asked me to take her wedding dress shopping before I go.",
rss,www.nytimes.com,https://www.nytimes.com/2025/09/25/style/rashid-johnson-dutchman-bathouse.html,1758893749,Rashid Johnson Stages ‘Dutchman’ at Russian and Turkish Baths,"Rashid Johnson Stages ‘Dutchman’ at Russian and Turkish Baths

No phones, no street clothing. The artist Rashid Johnson has returned to the Russian and Turkish Baths with Amiri Baraka’s incendiary play “Dutchman.”",
rss,www.nytimes.com,https://www.nytimes.com/2025/09/25/style/meredith-marks-rhoslc-rumors-nastiness-game.html,1758811506,Meredith Marks Talks RHOSLC Rumors and Nastiness Party Game,"Meredith Marks Talks RHOSLC Rumors and Nastiness Party Game

The “Real Housewives of Salt Lake City” star is back for Season 6 and has a new party game for her fans aimed at building relationships, rather than drama.",
rss,www.nytimes.com,https://www.nytimes.com/2025/09/25/world/asia/south-korea-tattoo-law.html,1758807694,"After Centuries of Stigma, South Korea Moves to Legalize Tattoo Artists","After Centuries of Stigma, South Korea Moves to Legalize Tattoo Artists

For years, South Korean tattooists have had to work in underground studios or windowless backrooms. They may soon be able to practice their craft in the open.",
gnews,news.google.com,https://news.google.com/rss/articles/CBMirgFBVV95cUxQZFVueTJoV1pnZ3pNSXFFTFhGNDVHQmVxQlN1OUZrOU00RHB1azJWY2pqR29fT2dTVEhvdUl1N0tTcjRuYy1jc1RjVDVoVzFraXN6VV9wVDV1V3FfUGIzV21Ia0pDakVSb2pOcjR0cktaNi1wVEhMZXFFWG5TRm1QRFFibVNMd2hpTVppNnJ1UUFPbWs4STRwcDZlaXBWOXdCdjNnMU1lWDdLSXFrQ2c?oc=5,1759368152,2025 Summer New Mens Fashion Trend Elegant Casual Thin Polo Shirt. S-3x - The San Joaquin Valley Sun,2025 Summer New Mens Fashion Trend Elegant Casual Thin Polo Shirt. S-3x - The San Joaquin Valley Sun,fashion trend
gnews,news.google.com,https://news.google.com/rss/articles/CBMickFVX3lxTE1ZYzFjb3VBSTJnNWktYm9Yd0syMVM4SUJ2VkpaSi1HdUtVaVFpVVVFT2lkQ3FKMlozRVVZYXV5MVhTajRaY29admtlMl9MRVhERVdTR3U3N3JZSS1YWVZVbm16akdBNlRzTGxzN1RHSUdTUQ?oc=5,1759350496,"Explaining Moto Boho, the 2025 Fashion Trend Blending Romanctic and Rugged Aesthetics - L'OFFICIEL USA","Explaining Moto Boho, the 2025 Fashion Trend Blending Romanctic and Rugged Aesthetics - L'OFFICIEL USA",fashion trend
gnews,news.google.com,https://news.google.com/rss/articles/CBMidEFVX3lxTE8tWEluYkhtRVM2WkNNSUlLSElfeTRXWkwwc3FSeTB6N1h0VUI2NVNTMVhoZHJOVTVYc2ZIXzFWUWlDNUR4RFFGOGJWbnJVZE4xSVNRc2RxYzVFT18tMkoxWGM1OWFackt2cE9TczYxSS1ZaEhB0gF6QVVfeXFMTUU2cEpuWDJuUDVINkRTNHBBOTZPc20zYlhpVGhoanlMa0xMQl9fbDdnMWVJVDc2VXI2SnRFQ1c4RkU3bTN4WkY2N1J1V05MRWNoSWp4YkJUUURkc1FIY1kyRjduU1ZsRHZIVl95V1pDYVh0Qm05NzVJMGc?oc=5,1759154580,"How to wear the perfect-for-fall burgundy trend, according to stylists - CNN","How to wear the perfect-for-fall burgundy trend, according to stylists - CNN",fashion trend
gnews,news.google.com,https://news.google.com/rss/articles/CBMi6AFBVV95cUxOdG9qYjl3YWsyMzA5bjZxanpqYWRPQjhObGpaQnlOSmRtUm4yQ0IxdDF4M1hNVVpxV2xjVGlUeUtwcFgtVnE1UTJob0ZuZ3VXNWZMY01iQjJicWdlWUw4Vl9fM2RDUExENE1uY1NiT01YQnJPejJXQXQ0TWoyZHY1X29IYm80aEZDWFVVYjZQeTR3OVI1eElzRFRoeUdyWTQ4Z1dCQlROZC1LYmlYdUtQbGd4b3I5dFFsbGx2VkFoNWo0M0xXZkE3S2tQUlg2cU9pZlplbHN3a3pxWDBlZjBaQ1FkMEhyaTR6?oc=5,1759338829,Fashion Trend Light Luxury All Match Cute Bear Patterned Titanium Steel And Alloy Necklace With Polishing Treatment - The San Joaquin Valley Sun,Fashion Trend Light Luxury All Match Cute Bear Patterned Titanium Steel And Alloy Necklace With Polishing Treatment - The San Joaquin Valley Sun,fashion trend
gnews,news.google.com,https://news.google.com/rss/articles/CBMijwFBVV95cUxQRW9YU2ZKRGFyVlBHdzI4OXVOLTlxSUp2b1dmZFBxZlVSUDlCUnRfN295eGJOTjRHODdjNEpKcmJqeFJvdllUY1dfbXdIZnRhaDRmZFFPNkVua0VOTEF5d29GVVo5Zm5tRk1ueG9JQWpOUW5QTUx6RmozOHoyT3YwdVc0VmtfRnQyM05FY1gzWQ?oc=5,1759258575,Horse Girl Fashion Is Back in the Saddle! How To Wear It for Fall 2025 - The Pioneer Woman,Horse Girl Fashion Is Back in the Saddle! How To Wear It for Fall 2025 - The Pioneer Woman,fashion trend
gnews,news.google.com,https://news.google.com/rss/articles/CBMi8gFBVV95cUxQdHFQak4tQmtIcHVXZDhnSjk2elJjYW02UFlUYkpoTnVCYVNia3BiZTYtc01HSHNiZC1iRlF2UkhrXzNfY085TVZqVlpYVGh4YUM0TDRYZ0NTSmg2cWFEdGVoejZHS2hjTjBmTm9BVXVaRHEtNERSWlVKWFJEUmZjN0ZHcENwdDlvdnNual9kcjJkcEZtR3d0b1hkUGVoR0hsci1fcmQwUWlzc1VSNjNkRVF5bkVSak5OYUE4TTAwSUdxZjNrY1g2clVCbnRjdTQ0SkN4VGNTRzRESEFTMFNZUFFfaEQ0OUxtTC1MRXU3bU1CQQ?oc=5,1759338258,2025 European and American Fashion Trend Stainless Steel Various Hydraulic Earrings Assorted Earrings 18k Plated Wholesale - The San Joaquin Valley Sun,2025 European and American Fashion Trend Stainless Steel Various Hydraulic Earrings Assorted Earrings 18k Plated Wholesale - The San Joaquin Valley Sun,fashion trend
gnews,news.google.com,https://news.google.com/rss/articles/CBMixwFBVV95cUxOLWk5WE5YZ1NOVjNwdldRSU4tWGdQUmxBeVJnejdYbHFFckZud05xSlJxZk1pczFBa3NXYjlwRW1TQjlaX185anpCdUR2Z0xfZzBkM2N4X0Q4N1JoakppMmpQYTJSWlFOVThpV0tYS2Z5UjZQZzlUQ0R1RUhfMTJVOVo4TllZeFFsRVU0MnUyTmh2RW52YVFBUVBfdzRZUGtnWDRJNzE2bHctV3RXMEdYNENnWWh0YS03RXNLOXlyNzRnUkRuWjFN?oc=5,1759371173,Women's Brown Belt Trend Belt with Gold Buckle Fashion Leather Waist Belt for Jeans Pants - The San Joaquin Valley Sun,Women's Brown Belt Trend Belt with Gold Buckle Fashion Leather Waist Belt for Jeans Pants - The San Joaquin Valley Sun,fashion trend
gnews,news.google.com,https://news.google.com/rss/articles/CBMi6gFBVV95cUxNZko1Ul9KOE5rQmhZQXVHeVlaOTZiYUxhNUZkbzJnY0dTb1loM3J6aWduaEMtS2hyZ2N0TnlRVmdlUXFaanoyWlNLTE5QQVg5czItWk9zbWNTV19WenVheU9tbFBhRGdmQ2pmMlNrSm5sT0wtRnpXTVZQNXVHN3VVZGJOclp2dml0UlRUQ2ltQ1VKUzNDSHdzWDEyR2FiTG9wWUNlalM4UzN2SEhSSWFlckpOc2ZfTTh3VXduSzVJa09OQ1QyVjdNaW8zc1dUdENQUU9SZS1JSnp2aTFfZTV1eDVkR0JDaDBXc3c?oc=5,1759367454,Women Fashion Woolen Coats Winter Trend Cotton White And Khaki Lapel Jackets Woman Warm Streetwear Mujer Casaco Y2k - The San Joaquin Valley Sun,Women Fashion Woolen Coats Winter Trend Cotton White And Khaki Lapel Jackets Woman Warm Streetwear Mujer Casaco Y2k - The San Joaquin Valley Sun,fashion trend
gnews,news.google.com,https://news.google.com/rss/articles/CBMi7gFBVV95cUxNRXFxeVBUaHFFSVlOR1AtNExUZGI0WEpyUm41TV9MMFNWbXVnY19QZWxlRkg2Y1JfTS10MWR4M0YwaU9VV1V1dHFNdzJINjFCaVBrWktscHdSTEJEUXdlUGhDUEFYMlFfNFEzMExQNFF1R1hyRnZ3Q2ZZYTRMRExyNWh2OHJHUVVhRHdnYTZ6bUZYRzZ5TVVrcUZCYjgycU5tM0taNEh2V0E2YU1rZXlzRjVSWGRsdzJZejJDOTVVcjI0WG5DVXZhcEpGM2tHRE1NSkM2d1c4RDZoYnpEUS12aFF6LU1KaTRGNjREYWdn?oc=5,1759345187,PrinStory Women's Ruffle Tops Summer Casual Short Sleeves Knit Shirts Round Neck Tunic Top for Women 2025 Fashion Trend - The San Joaquin Valley Sun,PrinStory Women's Ruffle Tops Summer Casual Short Sleeves Knit Shirts Round Neck Tunic Top for Women 2025 Fashion Trend - The San Joaquin Valley Sun,fashion trend
gnews,news.google.com,https://news.google.com/rss/articles/CBMiywFBVV95cUxOWlJFVzBiT2pFcmJHM3FEYXdUZVNmbU9iaHJvdk1jR3NjQU9Ha3dDcUJyc2xlNWJna1NOazFneTYtLS1SREN0ZUxRX0FWRkZ2akVnTk5TZHFIVFhoT2NGMm9wY1p6MnNFbWVhanYwZXo1dVhOdGVzRkd3RHFkNEFuNVRyUW5JMDN1akt1UkJUZWhBSGpaY3lDTnFFSHJkcEM5a1AxY0VfM0xPTTk1UEtyQ1BXOUpiYXkxWjZ6a201cWtEMnlFQWNZOWRRZw?oc=5,1759323134,Men Leather Loafers Slip On Dress Shoes Casual British Style Black Fashion Trend Comfortable - The San Joaquin Valley Sun,Men Leather Loafers Slip On Dress Shoes Casual British Style Black Fashion Trend Comfortable - The San Joaquin Valley Sun,fashion trend
gnews,news.google.com,https://news.google.com/rss/articles/CBMizAFBVV95cUxPMFZzUGhlMHVKcmtJNUVPLWFmSHg4Skp4S3ZmdWhkcUhvLXdBTUU0dlJFVFNrNFFDLVIyLXNIUHB0aWo2YmZEX3NweEc3eGtzaV9FUGNUS3hVMUx1TnAtVUJjZXFlMUhXM0FwaHhBRThPOWZhYThuS0RDaTBvbnpQbVJycnBmMlZsVm9scTNITW5KQnNGRm1tQUJCMDJWbmlYRlRWa1YyaTBDb1NuV3NweDRpU05zZURnQ3NrNHFQVjZnNFViY0JLc2lXc2c?oc=5,1759373186,FEISEDY Vintage Square Polarized Cat Eye Sunglasses for Women Men Trendy Fashion Sunnies B2382 - The San Joaquin Valley Sun,FEISEDY Vintage Square Polarized Cat Eye Sunglasses for Women Men Trendy Fashion Sunnies B2382 - The San Joaquin Valley Sun,fashion trend
gnews,news.google.com,https://news.google.com/rss/articles/CBMi5gFBVV95cUxNY3ZZS29uZXR1cjNPdEZsZUZvN3VLTTh4UEg5VEVPblhVeUZ4Q0txbnJXS2pPalRCUlc2b0J3SFlmUWNldS1NRjRQNmE1ZDJEdk90Y2g2UUdrWTBFYVd1LUdINVNTUkZMUTNCQXNodnJqWkt6UzAwYmh1TWZRam4yd0RRY0JJQUhZdWNyVjMyVHpJZFZFTkk1dXU4aDBEZU9KejNPeklrek5uQnBsc3lnUzJNVnQ4SUFLRlFlXzM4VmxtWHpHZ0U5S3hycUREOTFTR0xXVUo3YW1UblBGV3Bja3VWdW41dw?oc=5,1759335244,bullabulling Fashion Narrow Rectangle Sunglasses For Women One Piece Shades Futuristic Y2K Punk Style Sun Glasses - The San Joaquin Valley Sun,bullabulling Fashion Narrow Rectangle Sunglasses For Women One Piece Shades Futuristic Y2K Punk Style Sun Glasses - The San Joaquin Valley Sun,fashion trend
gnews,news.google.com,https://news.google.com/rss/articles/CBMi7AFBVV95cUxONndlX0R2eW9pZWN3TlNSUnpzcW1TNVdPZktSdWN5bDZISjgwWHkzNi0wSWc5Z3VvSlFaTmszbS05ZFk5cmpWR0p5NTFlRnl4cndSZWV6VW5xMks4bFZIVnRwSjZpMmx6NUl6bUJSZWhmWjVYMDctcnI1TmVOOEtnYXRhQXBBS1FZa0phWGlGdHRKUjh0M0FVTUVxUTNwVFU2X0ZIc044U05VUUNlNlNOaDM4eHFadTJ3d3pFemF4VFJzTG1XVnYwOHdxWURWeHpQS2o1cUwtdEV1bHZPUWZ1ZTlocUtzSGhKZGh3NQ?oc=5,1759353921,Womens Cropped Corduroy Jackets Button Down Casual Shacket Jackets Fashion Teen Girls Long Sleeve Y2K Going Out Coats - The San Joaquin Valley Sun,Womens Cropped Corduroy Jackets Button Down Casual Shacket Jackets Fashion Teen Girls Long Sleeve Y2K Going Out Coats - The San Joaquin Valley Sun,fashion trend
gnews,news.google.com,https://news.google.com/rss/articles/CBMi9AFBVV95cUxQTEloUFlheDQxc2w1Q0RzN3JBbGE4Y21NTklNREh1OVRYQnJKeDRUOXZhYkpVN3VSNGU5c2cyZzUwc0o3U2tiN1JvOUMtVWtZTm9BMXJLMGk1T0JWb3J6M08xQzFsSFlYSHNfQmJZVjlCYzBzMnBaOVJnbWVROHdCei1peEkyNU1VUlNGQl9tZV9PSE5sekh2eVdtNkdKUHRCd3AweU5WT0FmdW95YlFsTmRCQUR1UmltMFhHRnI2QU02UndvS1RjTldjcG1pYXdPOUh6czhXd1FoSjZsU1lHanJBUGZwU3RmZzNRTXBNUDU0YjNJ?oc=5,1759348093,Autumn Minimalist Long Sleeve Button up Shirt Women Korean Style Solid Tie Oversize Shirts Blouse Loose Clothes Autumn Tops - The San Joaquin Valley Sun,Autumn Minimalist Long Sleeve Button up Shirt Women Korean Style Solid Tie Oversize Shirts Blouse Loose Clothes Autumn Tops - The San Joaquin Valley Sun,fashion trend
gnews,news.google.com,https://news.google.com/rss/articles/CBMi6AFBVV95cUxOYUxRa0p6TjRmR0JNQ3gzTVIxa0VVWTctM0N5bG00SnlUMjRhdnpIdmhfU1Y2Z0tLQWhwbk93ZGNWQk5RdHBVbEEzeGpCYXl2XzZoaWFhdkFORUtxQzBzV2puUEZQS2dBVFltNkl2X3g3ZlBqYXNoTHd2REIyWHRIajNzT0Q0VnhTaDhuYzBqQXVHbDhacGg4aDg5RGxHcXl1ZkdpSXBtSGNHckV3WmdjZ2xVdldrd2JIbWlPd096WUdaa3FWM1d2cWZWZjFQbW1yQkp5VXk2SmZpVEVCZHlXQUQxdFVlVG1V?oc=5,1759336974,SCREENSHOT-Track Pants Fashion P41902 Mens Premium Straight Fit Athletic Fitness Fashion Urban Streetwear Bottoms - The San Joaquin Valley Sun,SCREENSHOT-Track Pants Fashion P41902 Mens Premium Straight Fit Athletic Fitness Fashion Urban Streetwear Bottoms - The San Joaquin Valley Sun,fashion trend
gnews,news.google.com,https://news.google.com/rss/articles/CBMi1wFBVV95cUxQc2xrZHhpVk1KaU9JdXlMdlRDQ0VxeUVzaFdMdU9jamJqcEhqcTNlNkI4eVFOQVFRMDVjTlhnWUZiT2VTS3dUMEk5X0N5RjhCVkpzVmZST2VHd2Q0U3NUMlRyMmw3ZnJBS3dWWXY5akNPZXp2WWQ3Q0g5dW5qeVo2RFhfNVpBNlpJdnA1ZC1BcU8xSjFGenFuTEd1UXNiQ2d0X3RFei1KT2JQTWdSX2toSXJTMUxQRkRwNzZtWGtaZXpQeDFKN2FxZTUxYjFsaG9FOGk1MWRuRQ?oc=5,1759350287,SCREENSHOT Mens Urban NYC Graffiti Hip Hop Fleece Pants Active Fashion Drawstring Sweatpants Bottoms - The San Joaquin Valley Sun,SCREENSHOT Mens Urban NYC Graffiti Hip Hop Fleece Pants Active Fashion Drawstring Sweatpants Bottoms - The San Joaquin Valley Sun,fashion trend
gnews,news.google.com,https://news.google.com/rss/articles/CBMi8AFBVV95cUxQa0VzQTNNVngxR1dSYWV0RFpqM01CN2VYRUM0aE5ZV3U1bWR1UEFQYzkzTXlQZlJmN3NBWjBaMmdYSFN6TXp0SlY1RUU1MDRhRHJtTHpLNGw5eEg1Q0lOWm9ZU0Zma3hrOHRBcWhIUGl2SnZjZnd4eDZfcVNmbUZ3M09zWkVpaUl0Y3kxWmFFQXpDeE1OSHdVYWExOWRrZl9rV3FNR3hJa3ByTmJETFUzYkw5ZmJ2dW9RYkJnSmhlNDRFdDg0d2ZSY0p0RUFsaW5SaXVfSFRLVmE2VHhTTUxrelhZNkR0SXFkVHdMNzUwOWU?oc=5,1759347264,willochra Rimless Y2k Sunglasses For Women Men Rectangle Vintage glasses Fashion Metal Sunglass Frameless Retro Eyewear - The San Joaquin Valley Sun,willochra Rimless Y2k Sunglasses For Women Men Rectangle Vintage glasses Fashion Metal Sunglass Frameless Retro Eyewear - The San Joaquin Valley Sun,fashion trend
gnews,news.google.com,https://news.google.com/rss/articles/CBMi-wFBVV95cUxORnRvZkNWQ0dFdkYzT2NQdDMyb2NFYlhDYzZOMVlJMFdlS0F2WENoeGpoU0ljRGgxU2VTZXJmYnYxeTJkRW9HOUt6WXpmSEpvcVBDYV81LXNqMkgzTkNnMjNTQ21nV1ZVUG5EUkVOblo3MUhxSGhTTHlKOERzaG1ZXzQ2LWZmSGNndDNzVEdFTlZMZkpPN3VfODFMU1VVZkg1aUhybDJTNTc5R3RnS0tWeTY3V2xwb1NYNEpLaGlxQ1FFRlJTSEhJX3g3dDhBZWRSUlk3NjRZNy1YcW04SGFNWnlzRTVYX2wyYldHcUR2dHRCY2RnWnhzREFyTQ?oc=5,1759343297,2023 HOT Summer Outdoor Casual Slippers Sexy Fashion Platform Flip Flops Designer High Heels Sandals Wedges Pumps Shallow Slides - The San Joaquin Valley Sun,2023 HOT Summer Outdoor Casual Slippers Sexy Fashion Platform Flip Flops Designer High Heels Sandals Wedges Pumps Shallow Slides - The San Joaquin Valley Sun,fashion trend
gnews,news.google.com,https://news.google.com/rss/articles/CBMirwFBVV95cUxOdVlXdUtuY0RvbWRZVnhEYVBSYU1CYUQ5NmYzRUx5YzRlWDVGMHR4ZDhzcnNzeVRHcVBuR0FpYjZCQ2huUDItazlDaml3dkVWN09HYVNncHc5cEdJMU1DUVF3REsyZDJ0TG9OYW9lMVpyRUhLYXJaNWJ6aW0xYXEwMmtVeDNkaURHY2cwa3FqdGIyN2R0QngxeW1fTGdWQ0hCTG56MlF1M21ucmY3enBF?oc=5,1759350892,Kursan Retro Small Oval Sunglasses for Women with Thin Face Narrow Style - The San Joaquin Valley Sun,Kursan Retro Small Oval Sunglasses for Women with Thin Face Narrow Style - The San Joaquin Valley Sun,fashion trend
gnews,news.google.com,https://news.google.com/rss/articles/CBMi5AFBVV95cUxNSDFVa0JiVE90bjQ2azkxajVRejdWdm5paWdNLXNoQzBIdjh2cjdPZWcyNW1QdVNSNHJXaEEyTDhhNldrbHNhclRSV2k3Q2d4Q3lqR21PdXVlRzY3ZEluZkpFY1pNLXVOQjRfNldWLTB4VTMwZU40c1ZXS0d2VFhrRkxVMl9TdHdUcENOd084MXB3bUJtV3lUUlNrT3dHNEZPRlMtQ0JhYWtaZmpoRmU5LUh5c0hWX3BrVklWM3BlUVZORF9WaTZtN29EeDN5YXlfNmYzbHpJbnkyeElJREs0eVRoYno?oc=5,1759330930,Summer New Pointed Solid Color Simple Shallow Mouth Comfortable Women'S Outwear Back Strap Fashion Sandals Women - The San Joaquin Valley Sun,Summer New Pointed Solid Color Simple Shallow Mouth Comfortable Women'S Outwear Back Strap Fashion Sandals Women - The San Joaquin Valley Sun,fashion trend
gnews,news.google.com,https://news.google.com/rss/articles/CBMilgFBVV95cUxPSXljeGxEXzB2c04xQ1NjWE5yQ2ZvLTgwMEdhVHAzbTFtRm83a2QyNjZoakx0NXFueWRuRW5nWlR4bkhTbS1WWm5zVm82TXo0OEtLWUtiSWlCbkd4bXNlVm92S2FTZFVtbDE2QnJmUDgtc2l1TmJNc3RDMDNHaS13Y2pTeUt6ZmUwb3llazY1bk95Q3FhWWc?oc=5,1759346600,Paris Street Style Stars Are Proving That This Cool Girl Haircut Is Never a Bad Idea - Marie Claire,Paris Street Style Stars Are Proving That This Cool Girl Haircut Is Never a Bad Idea - Marie Claire,fashion trend
gnews,news.google.com,https://news.google.com/rss/articles/CBMihgFBVV95cUxOT29yTW4ybU8yMk9GOUFSZ3hmc1FualFLRU1jcmN6UVB5TTNwUVVCdTltOG8xd1Y2S2kxNC1FNjJRUVd5OGFnSi1XT3NnS0FackNYZkd6M21vWFQ4LXMyQUpxRXV4NGZDX3dvaTd2Qmk1SEg0UUxuZ3p5cFZjZ1d4SmxFa21BUQ?oc=5,1759383146,4 Anti-Trend Outfits I Spot Every Time I'm in Europe - Who What Wear,4 Anti-Trend Outfits I Spot Every Time I'm in Europe - Who What Wear,fashion trend
gnews,news.google.com,https://news.google.com/rss/articles/CBMirAFBVV95cUxPT3ZYR3RrZlBRZDV3cFRDcU9JaVBKYkE4RTBWQjJCekYzZ2x4cE9zajhJeHZDdHFOdlJpYy16N09NVTFQbHpkel9oU2N5UnAxeWZsYngzN3BDMUZGT1RQMTUwUW5ucVByTWV3LWt0V2p6Yzg4c3Vsdkd6M3NHbk1EeGFLWjdzbTc4U0tmQm9RcHp0ZGRXTkFRdHQ1ZzdQbU1EdnNXRXR6dGhDZ3VW?oc=5,1759344913,7 Trends Spotted by Retailers During Milan Fashion Week - WWD,7 Trends Spotted by Retailers During Milan Fashion Week - WWD,fashion trend
gnews,news.google.com,https://news.google.com/rss/articles/CBMiqAFBVV95cUxQUjhycEZHZjB2VlJVckY3Vm5rRE5ibzZ3ZFhrOFBFRlQ1Wk4yY2o1S0E4ZVFNdDRkN29jSU9mdlJONldYTEpIb1BDY0JGRHhiT2hNTEJFVHljRVdIWFBwOUt0MVk3emdtdFVZNGlUUXVXTlRtckY1ZDU3Q21IcVVENG1KQkFLdE9MWHlfU29qcWFyNlY4T3JHNU1abFdyRlZBaUh1c1UzVWc?oc=5,1759348879,Laura Dern Swaps Sitting in the Gabriela Hearst Front Row for Walking Its Paris Fashion Week Runway - Marie Claire,Laura Dern Swaps Sitting in the Gabriela Hearst Front Row for Walking Its Paris Fashion Week Runway - Marie Claire,fashion trend
gnews,news.google.com,https://news.google.com/rss/articles/CBMigAFBVV95cUxNY1VMQlphSXhSV2tvNU9CVjRrYXU5dWxLVXlLSVhrb2JISmNtbHMzbzJENFRDZEYwZ3F6WXlzUzZ6NV9vZ2RGd0xvci11aDljaVRmOWR5YTZ0WS1sMkNFSldVeHc5WjFZQVZFakYwajlFOWEyZ1BCX1dWWk53VjZKUQ?oc=5,1759352923,The Barn Jacket Is Back! Here Are the Best Styles for Everyday Wear - The Pioneer Woman,The Barn Jacket Is Back! Here Are the Best Styles for Everyday Wear - The Pioneer Woman,fashion trend
gnews,news.google.com,https://news.google.com/rss/articles/CBMijgFBVV95cUxPeTN0ckJ5Wk9nVHZnTFBkRHFJczBFS25MWnlpOWpBSWRRM0xhejhVdGRBVnRGV0JjY1lBU0s1aVFWQlF1TjB0WldWNWNYX3RsZVhQTzl0ZVZ3N09QY3gwQS1ZZTdLdVNaVkJTa040YWUyZmVfUU1wOFFrM3dWdGN3MnVzUDRqUnhFVFkyNjRB?oc=5,1759246659,5 Street Style Trends From Milan Fashion Week That Will Be Everywhere This Fall - Who What Wear,5 Street Style Trends From Milan Fashion Week That Will Be Everywhere This Fall - Who What Wear,fashion trend
gnews,news.google.com,https://news.google.com/rss/articles/CBMidkFVX3lxTE56ald2RUNoOVMtTVpySzRLSkVQdV9aaDJJUk5hQnlVUDk3dWRpM05zOHREOG1lcVI0Y0xEWlROWkVKUVpwQWhVX1U0SWNYNXFhYUNQZURNR1NiaG5hN1hjaFVta2dYUTBHMFVNd1dKcEQ5eXdYcUE?oc=5,1759397559,Blue and Brown Is the Surprise Colour Pairing Stylish Women Are Wearing This Autumn - Marie Claire UK,Blue and Brown Is the Surprise Colour Pairing Stylish Women Are Wearing This Autumn - Marie Claire UK,fashion trend
gnews,news.google.com,https://news.google.com/rss/articles/CBMifEFVX3lxTE9wNGtJSk1JMGc2amNBT2Z2WVR1UnN3eDlLY1BRSU1mS0xsaE52eF81YWhYMXQzaWZFWmQ2SUhkejloYkhsSVdiZno0RzNCZ3pDYkNVOUJwOWw3MXp5a3VkcFVHdzZQY0NVUUFvYTRLUHlhTUhSQjJKWUdUU3g?oc=5,1759323167,The decline of good TV fashion - The Miami Hurricane,The decline of good TV fashion - The Miami Hurricane,fashion trend
gnews,news.google.com,https://news.google.com/rss/articles/CBMikAFBVV95cUxQWHpGcy1zYzA3RjJRWW5sUGRCMHcyUEw0cl81bmc3TG81V3pDOElwVlQ2VUhFbXJPQWt1SFJldE9lc1NCTERRT0o0S2xZeDQ1YTRWZHdYa3VPcDMzdFlWQm11UU9zc05xUzFBWmZtVndFWnNvenZtZ2k4ajhoNGVWYUlwR0UwS0piZHdad3N5TDA?oc=5,1759235959,I’m Calling It—These are the 5 Most Stylish Trends From Milan Fashion Week - Who What Wear,I’m Calling It—These are the 5 Most Stylish Trends From Milan Fashion Week - Who What Wear,fashion trend
gnews,news.google.com,https://news.google.com/rss/articles/CBMilwFBVV95cUxPanVwSW5LYmROblFRcnVxR3AwRTFodGQ5bWMyNHJtVXNUN01zc0YwYy1jVEx4WFg4LV9pSTVzZXg1M3ZFbTRxd0o1aHF5N2F2bHRNTk9kZ0NIMG9hZlNrNGp1dmptZ0xLNm5PekxSUXVFaUpyN1BCOWQ4SVlpOEN0NjNfRDcxOEhaNEdiX0o1MWdxVjR4aE5B?oc=5,1759344671,Kendall Jenner's Twist on the Socks-With-Loafers Trend Lets Her Blend Right in With Stylish Parisians - Marie Claire,Kendall Jenner's Twist on the Socks-With-Loafers Trend Lets Her Blend Right in With Stylish Parisians - Marie Claire,fashion trend
gnews,news.google.com,https://news.google.com/rss/articles/CBMi-gFBVV95cUxOUjc1Y25QUUNZV2RtOHBtaVdXUXpfLWhRMXhpLUNUUXF2dlRJN05jck8xSGFiNlhxcjE0RU1UU2pMaDBQWWZBTi1YbHJLMGtNQjBGcGFMWHJDQ0FsbHRGMC1GcmtCOXRyem1LMWp0OGxoSzJlWXNJdU5JRWRNMmxJNUNvaU0xVXkwd2R6MVhxVEZPYzB5RjhFamtFVjZyRXlaWng2XzlZNFVBOW15enl2Smd5c3FhX0huSWZ6UVl0TzVLMHBnSWpvNVZMQlBxUWhtcGsxZk9aNFNLa19nektCbnhqb3oyenFrM0k3WVRpNlJQVEpjTTltMFpn?oc=5,1759330808,Sexy Naughty Cosplay Christmas Party Costume Strapless Velvet Satin Xmas Babydoll Short Dress Woman Santa Cute Role Play Outfit - The San Joaquin Valley Sun,Sexy Naughty Cosplay Christmas Party Costume Strapless Velvet Satin Xmas Babydoll Short Dress Woman Santa Cute Role Play Outfit - The San Joaquin Valley Sun,fashion trend
gnews,news.google.com,https://news.google.com/rss/articles/CBMikgFBVV95cUxNUFRiNzRqbzZaWTRVRHZrekpLQ3lWSmZLWkRzbXdkSkRZWVJnUkRPRW5kaXJHUkpBa1VVTjI2OEdVVHRqcU8xRXVQYVhnR195Zi1nTHEtSnc1Qk1XV2dkSllvWTRmTXItblFORnFsYlIyQUtTa1NFMU5BcTBMQ05PdklHNzdmZktsc1ZTcng2UVNVdw?oc=5,1759338756,Bella Hadid's Paris Fashion Week Takeover Reaches New French Girl Heights With Polka-Dots and Denim Capris - Marie Claire,Bella Hadid's Paris Fashion Week Takeover Reaches New French Girl Heights With Polka-Dots and Denim Capris - Marie Claire,fashion trend
