source,domain,url,created_utc,title,text,query
rss,www.refinery29.com,https://www.refinery29.com/en-us/korean-digital-perm-hairstyle?utm_source=feed&utm_medium=rss,1766088407,I Got A Korean Digital Perm — & It’s My Most Complimented Hairstyle Yet,"I Got A Korean Digital Perm — & It’s My Most Complimented Hairstyle Yet

<p>I’ve wanted <a href=""https://www.refinery29.com/en-us/perms-in-style-trend-types"">a perm</a> for years now, but with the amount of <a href=""https://www.refinery29.com/en-us/igk-antisocial-midnight-silk-mask-review"">damage my hair</a> went through with multiple bleaching sessions (I had a pastel pink phase), I had to wait until I had a full head of virgin hair. When I told one of my best friends I was finally about to get a Korean digital perm, she was horrified and said I would probably regret it. Look, I get it. The perm is controversial. You probably instantly think of giant fluffy ’80s hairdos or tight ringlets. But unlike traditional perms, the Korean style uses heat technology to create softer curls, which appear more natural. </p>



<p>My hair is naturally straight with a slight wave that becomes more obvious the shorter it is. I also have incredibly thick and heavy lengths, so when I use a curling iron, I have to douse my hair in hairspray to ensure the curls don’t fall out. As somebody who’s always wanted curly hair, getting a Korean digital perm was an easy decision. Both my older brother and sister have perms, so I was confident going in. I went to my hairstylist Chloe Choi at <a href=""https://www.chloehair.com.au/"">Chloe Hair &amp; Beauty</a>, but Korean perms are becoming more popular in salons worldwide. Together, we discussed what could be done while looking at some photos I’d brought along for inspiration. She confirmed that my hair type is frizzy with a slight natural wave, and we settled on a direct digital perm to create some tighter curls. </p>



<blockquote class=""instagram-media"" style=""border: 0; margin: 1px; padding: 0; width: 99.375%;""><div style=""padding: 16px;""> <a href=""https://www.instagram.com/reel/DR4OcroCWSB/?utm_source=ig_embed&amp;utm_campaign=loading"" rel=""noopener noreferrer"" style=""line-height: 0; padding: 0 0; text-align: center; text-decoration: none; width: 100%;"" target=""_blank""> <div> <div style=""background-color: #F4F4F4; height: 40px; margin-right: 14px; width: 40px;""></div> <div> <div style=""background-color: #F4F4F4; height: 14px; margin-bottom: 6px; width: 100px;""></div> <div style=""background-color: #F4F4F4; height: 14px; width: 60px;""></div></div></div><div style=""padding: 19% 0;""></div> <div style=""height: 50px; margin: 0 auto 12px; width: 50px;""></div><div style=""padding-top: 8px;""> <div style=""color: #3897f0; font-family: Arial,sans-serif; font-size: 14px; font-style: normal; font-weight: 550; line-height: 18px;"">View this post on Instagram</div></div><div style=""padding: 12.5% 0;""></div> <div style=""margin-bottom: 14px;""><div> <div style=""background-color: #F4F4F4; height: 12.5px; width: 12.5px;""></div> <div style=""background-color: #F4F4F4; height: 12.5px; width: 12.5px; margin-right: 14px; margin-left: 2px;""></div> <div style=""background-color: #F4F4F4; height: 12.5px; width: 12.5px;""></div></div><div style=""margin-left: 8px;""> <div style=""background-color: #F4F4F4; height: 20px; width: 20px;""></div> <div style=""width: 0; height: 0; border-top: 2px solid transparent; border-left: 6px solid #f4f4f4; border-bottom: 2px solid transparent;""></div></div><div style=""margin-left: auto;""> <div style=""width: 0px; border-right: 8px solid transparent;""></div> <div style=""background-color: #F4F4F4; height: 12px; width: 16px;""></div> <div style=""width: 0; height: 0; border-left: 8px solid transparent;""></div></div></div> <div style=""margin-bottom: 24px;""> <div style=""background-color: #F4F4F4; height: 14px; margin-bottom: 6px; width: 224px;""></div> <div style=""background-color: #F4F4F4; height: 14px; width: 144px;""></div></div></a><p style=""color: #c9c8cd; font-family: Arial,sans-serif; font-size: 14px; line-height: 17px; margin-bottom: 0; margin-top: 8px; overflow: hidden; padding: 8px 0 7px; text-align: center;""><a href=""https://www.instagram.com/reel/DR4OcroCWSB/?utm_source=ig_embed&amp;utm_campaign=loading"" rel=""noopener noreferrer"" style=""color: #c9c8cd; font-family: Arial,sans-serif; font-size: 14px; font-style: normal; font-weight: normal; line-height: 17px; text-decoration: none;"" target=""_blank"">A post shared by Rachel &amp; Jeremy 🌍Travel Couple (@thekiwicouple)</a></p></div></blockquote>




<p>There are a handful of benefits to a Korean perm: “Normal perms mean sometimes you can’t see definition in the curls, but with digital perms you can,” said Choi, who used to work at a salon in Myeong-dong, South Korea, before moving to Sydney. Before we started with my perm, Choi recommended starting with a Japanese Tokio Treatment, which helps repair hair from the inside out. By replenishing it with keratin, it strengthens, moisturizes, and smooths each hair strand. “A lot of people really like this brand,” Choi explained. “It’s a repairing treatment, and it adds moisture to your hair. Some people will come back after their perms get dry and then have another Tokio Treatment,” she told me.</p>



<h2>What is a Korean digital perm?</h2>



<figure><img src=""https://www.refinery29.com/images/11947860.jpg?width=768&amp;height=1024&amp;fit=bounds&amp;crop=3%3A4"" /></figure>



<figure><img src=""https://www.refinery29.com/images/11947861.jpg?width=768&amp;height=1024&amp;fit=bounds&amp;crop=3%3A4"" /></figure>



<p>Choi started by washing my hair and applying the Tokio Treatment, before setting up an additional hot steam treatment to help hydrate each strand of hair. The steam “opens” up the hair cuticle, allowing moisture and products to absorb. After getting a small trim where Choi enhanced my layers, my hair was rewashed with a pH-balancing shampoo. She then followed this with a Korean product that protects the hair from the typically harsh perming chemicals used to break and reset the protein bonds in the hair. It’s this which results in a curl or wave. </p>



<p>Next, Choi placed the digital perm lotion directly onto my hair and rolled sections tightly into curlers to take shape, then plugged each curler in, allowing them to be set by heat. Choi told me that my hair was “strong”, so we had to wait over 20 minutes before it started to set. Then we headed back to the basin where my hair was washed with a neutralizer, snapping the protein bonds back into place. Et voilà! I was now a member of the curly hair club.</p>



<h2>How do you style a Korean digital perm?</h2>



<p>To style my hair, Choi gave me a slight side part, which created a more voluminous look from the scalp. She added some curl cream to define the waves and recommended investing in some good products. Her top tip? “If you have frizzy hair and you want to style it while it’s dry, mix curl cream with a little bit of water in your palms before using it on your hair,” she said. “This helps get rid of the frizz and also hydrates it.”</p>



<p>Styling a digital perm at home isn’t too difficult, either. I have a sensitive scalp, so I’ve purchased some sulfate-free shampoo and conditioner. Sulfate-free products will also prolong the perm’s results. I wash my hair with lukewarm water in the shower before scrunching up the curls with a microfiber towel. Next, I add curl cream to define my curls and continue to scrunch them upwards, before using my <a href=""https://go.skimresources.com?id=30283X879131&amp;xs=1&amp;url=https%3A%2F%2Fwww.laifentech.com%2Fproducts%2Flaifen-se-2-high-speed-hair-dryer"" rel=""noreferrer noopener"" target=""_blank"">Laifen Hair Dryer</a> (a Dyson dupe) with a diffuser to blow-dry the perm in place. </p>



<figure><img src=""https://www.refinery29.com/images/11947863.jpg?width=768&amp;height=1024&amp;fit=bounds&amp;crop=3%3A4"" /></figure>



<figure><img src=""https://www.refinery29.com/images/11947864.jpg?width=768&amp;height=1024&amp;fit=bounds&amp;crop=3%3A4"" /></figure>



<h2>How long do you have to wait after a Korean perm to wash your hair?</h2>



<p>Your stylist will let you know how long you should go without washing your perm à la <em>Legally Blonde</em>. For me, I had to wait a minimum of 48 hours before washing my hair after getting my digital perm.</p>



<h2>Can a Korean digital perm cause damage to your hair?</h2>



<p>A digital perm uses chemicals that alter your hair structure and heat to set it in place, so most hairstylists recommend doing it on virgin hair. They also recommend steering clear of perms if your hair is bleached, chemically straightened, or very fine. Bleach in particular weakens the hair by breaking its bonds, which means perm solutions don’t interact well with it. Ultimately, the hair often lacks the strength to hold a set shape, making the process more likely to fail.</p>



<h2>How do you take care of your Korean perm?</h2>



<p>Getting a perm might increase frizz if your hair is prone to it. This is because when the chemical process weakens the hair, it also lifts the cuticle. I’d recommend investing in a <a href=""https://go.skimresources.com?id=30283X879131&amp;xs=1&amp;url=https%3A%2F%2Fwww.nordstrom.com%2Fs%2Fslip-pure-silk-pillowcase%2F4186794%3Fsrsltid%3DAfmBOopqmzmVbIIqoypAqEzT6eEntgnIoFgt2xwHEu4gn-JL76f3n-bF"" rel=""noreferrer noopener"" target=""_blank"">silk pillowcase</a> or a <a href=""https://go.skimresources.com?id=30283X879131&amp;xs=1&amp;url=https%3A%2F%2Fwww.nordstrom.com%2Fs%2Fwomens-mulberry-silk-bonnet-with-long-ribbons%2F8701502%3F"" rel=""noreferrer noopener"" target=""_blank"">silk bonnet</a> to help keep the frizz to a minimum. Also try a moisturizing leave-in hair product like <a href=""https://go.skimresources.com?id=30283X879131&amp;xs=1&amp;url=https%3A%2F%2Fwww.sephora.com%2Fproduct%2Fk18-hair-molecular-repair-hair-oil-P505266"" rel=""noreferrer noopener"" target=""_blank"">K18 Biomimetic Hairscience Molecular Repair Hair Oil</a>, which contains peptides, avocado oil, and squalane to help smooth and repair the broken bonds that lead to frizz. </p>



<h2>How do you ask for a Korean digital perm?</h2>



<p>Doing your research and choosing a properly qualified expert is key. I would also recommend bringing reference photos so your stylist can see which kind of curl you are after. It’s also important to discuss your hair health and type, and whether a perm will cause extra frizz or breakage for you. </p>



<p>I can safely say that having a digital perm has led to more conversations about my hair than I’ve had in years — and it looks <em>much</em> healthier than my pastel pink or purple-silver combo. I’m able to wake up with voluminous hair ready to go, and if I need to style it a little bit, I can just use some curl cream, which also helps hydrate my hair. It’s less maintenance than colored hair, so I’m convinced I’m a perm girl for life. </p>
<p><strong>Like what you see? How about some more R29 goodness, right here?</strong></p><p><a href=""https://www.refinery29.com/en-us/bob-haircut-trends-2026?utm_source=rss&amp;utm_medium=rss_linkback1"">12 Bob Haircuts You’ll See Everywhere In 2026</a></p><p><a href=""https://www.refinery29.com/en-us/haircut-trends-2026?utm_source=rss&amp;utm_medium=rss_linkback2"">Bobs &amp; Bangs: 17 Revamped Haircut Trends For 2026</a></p><p><a href=""https://www.refinery29.com/en-us/j-shape-haircut-trend?utm_source=rss&amp;utm_medium=rss_linkback3"">I Got The J-Shape Haircut &amp; Found My Forever Style</a></p>",
