source,domain,url,created_utc,title,text,query
rss,www.nytimes.com,https://www.nytimes.com/2025/12/19/style/simone-gaillard-michael-craver-wedding.html,1766120416,She Traded Her Beach Vibes for Chickens and Chestnuts,"She Traded Her Beach Vibes for Chickens and Chestnuts

Michael Craver and Simone Gaillard knew instantly they wanted to be together. Less certain was whether she’d be interested in his farmhouse.",
rss,www.nytimes.com,https://www.nytimes.com/2025/12/19/style/grace-aki-f-haynie-wedding.html,1766185275,When a Performer Met a Playwright,"When a Performer Met a Playwright

Like the characters in “When Harry Met Sally …” a film Grace Aki loves, she and F Haynie had a tepid start, and eventually, a romance.",
rss,www.nytimes.com,https://www.nytimes.com/2025/12/19/style/modern-love-revenge-of-the-people-pleaser.html,1766120405,The Revenge of the People Pleaser,"The Revenge of the People Pleaser

After being assaulted, I worked for years to make myself invisible. Ryan saw me anyway.",
rss,www.nytimes.com,https://www.nytimes.com/2025/12/18/books/sue-bender-dead.html,1766096087,"Sue Bender, Who Wrote About Living With the Amish, Dies at 91","Sue Bender, Who Wrote About Living With the Amish, Dies at 91

“Plain and Simple,” her best-selling 1989 book, was a go-to text of the anti-materialist movement known as voluntary simplicity.",
rss,www.nytimes.com,https://www.nytimes.com/2025/12/18/technology/elon-musk-daycare-school.html,1766052119,Sleep Cots and Graham Crackers at Elon Musk’s Child Care Program,"Sleep Cots and Graham Crackers at Elon Musk’s Child Care Program

Mr. Musk has ambitions to remake education, but his latest effort to open an elementary school in Texas appears to have faltered.",
rss,www.nytimes.com,https://www.nytimes.com/2025/12/18/well/mind/ask-therapist-holidays-divorce-parents-guilt.html,1766052049,How Do I Navigate Divorced Parents Over the Holidays?,"How Do I Navigate Divorced Parents Over the Holidays?

Our Ask the Therapist columnist, Lori Gottlieb, advises a reader who tries to balance the needs of her divorced parents — but often ends up in tears.",
rss,www.nytimes.com,https://www.nytimes.com/2025/12/18/well/family/estranged-estrangement-advice.html,1766052016,When Your Family Is Estranged During the Holidays,"When Your Family Is Estranged During the Holidays

Familial feuds have ripple effects, experts say.",
rss,www.nytimes.com,https://www.nytimes.com/2025/12/17/style/tiny-modern-love-stories-good-riddance-christmas.html,1766010283,"Tiny Love Stories: ‘Good Riddance, Christmas’","Tiny Love Stories: ‘Good Riddance, Christmas’

Modern Love in miniature, featuring reader-submitted stories of no more than 100 words.",
rss,www.nytimes.com,https://www.nytimes.com/2025/12/17/style/holiday-etiquette-questions.html,1765980003,"Your Holiday Dilemmas, Solved!","Your Holiday Dilemmas, Solved!

Our columnist offers guidance on holiday travel, gift exchanges and seasonal hospitality. (Must it extend to electric vehicle charging?)",
rss,www.nytimes.com,https://www.nytimes.com/2025/12/17/podcasts/the-birds-nest-womens-retirement-community-tiny-homes.html,1765965724,I Cashed Out My 401(k) to Build a Women-Only Retirement Community,"I Cashed Out My 401(k) to Build a Women-Only Retirement Community

The Bird’s Nest is experimenting with a different way to age.",
rss,www.nytimes.com,https://www.nytimes.com/2025/12/16/style/street-style-look-red-coat.html,1765893603,Street Style Look of the Week: A Bright Red Coat,"Street Style Look of the Week: A Bright Red Coat

Red outerwear (and like-colored socks) cheered up an ensemble spotted in Tokyo.",
rss,www.nytimes.com,https://www.nytimes.com/2025/12/16/style/neckties-trend.html,1765917278,Why Can’t We Leave the Necktie Alone?,"Why Can’t We Leave the Necktie Alone?

Bizarre attempts to revive the necktie are leaving us cold.",
rss,www.nytimes.com,https://www.nytimes.com/2025/12/16/style/bhavitha-mandava-chanel-model.html,1765905965,Bhavitha Mandava Was Discovered on the Subway. Then She Walked a Chanel Runway.,"Bhavitha Mandava Was Discovered on the Subway. Then She Walked a Chanel Runway.

After Bhavitha Mandava appeared in the luxury house’s latest show, she became the most talked-about model of the season. She’s as surprised about it as everyone else.",
rss,www.nytimes.com,https://www.nytimes.com/2025/12/16/style/new-womens-right-feminism.html,1765900992,"Fighting for Femininity, Not Feminism on the New Women’s Right","Fighting for Femininity, Not Feminism on the New Women’s Right

A group of young conservatives feel that the pressures they face as 20-something women have been made worse by the liberal feminism that defined their youth.",
rss,www.nytimes.com,https://www.nytimes.com/2025/12/15/style/steven-smith-crocs-yeezy-designer.html,1765919134,"How Steven Smith, Former Yeezy Designer for Kanye West, Is Remaking Crocs","How Steven Smith, Former Yeezy Designer for Kanye West, Is Remaking Crocs

Steven Smith worked for Yeezy, New Balance and Nike, where he created some of the most famous sneakers of all time. Now he’s making foam clogs.",
rss,www.nytimes.com,https://www.nytimes.com/2025/12/15/style/best-breakup-lines.html,1765926769,The 52 Best Breakup Lines (Said in Real Life),"The 52 Best Breakup Lines (Said in Real Life)

To mark the winter holidays — an especially popular time to break up — we asked people around the world for their most striking parting words to each other.",
gnews,news.google.com,https://news.google.com/rss/articles/CBMiiwFBVV95cUxPN3VGY0ttZnlwRURTZUJScEhUaXB4TWVCZ3l1bE1taU01Sl9KVU1vNG9XOHBscVZ4Y21yZnRVc3BnbGk0cGNQYmp5c0JUcGwtd1pTZWxtWEFyYkYtTUcyYU9ZUkZyR09pX1BkQ2Y3X0pIZmN1bVdUbTVHWGNMZ3VycXZqRXlXOER2aDRF?oc=5,1766311200,Pinterest Just Declared 3 Fashion Trends on the Verge of Going Viral in 2026 - Who What Wear,Pinterest Just Declared 3 Fashion Trends on the Verge of Going Viral in 2026 - Who What Wear,fashion trend
gnews,news.google.com,https://news.google.com/rss/articles/CBMicEFVX3lxTFBac0E3MGNPY0hNWnFnMS11WDdfVGdSZGdIVEh4eTJ4SUs2RVZJb1RiTklQQi1adkwyazFvSzV2djNHLWVuRkNHQlVkSXN6bkpDOHUzUzlqa0w2cVpERnVmaTI1Q0RHbkF5MDVDbmpPSHc?oc=5,1766056767,Your 2026 Fashion Edit: What’s ‘In’ for the Year Ahead - Camille Styles,Your 2026 Fashion Edit: What’s ‘In’ for the Year Ahead - Camille Styles,fashion trend
gnews,news.google.com,https://news.google.com/rss/articles/CBMikgFBVV95cUxQcTMydndUdDdrVUdCQ2NGc3pVekdnVkRVSHktVWNYSENxdTJaTnJ1RVBOZWJQa1RxYXRnMTQzSzlxV21nSFZwYlFhQUZFc2NFNEJfQXZnOXJoS3MxX3NsWFFiRk1LM1VFVjZ6QURBcUV3dnVodmIzWXNIMHQ0VFhyQUcwM3ZIN2NFeVZxZ2lsLUN1UQ?oc=5,1766232000,The Latest Kid Fashion Trend Is Surprisingly Sweet - Good Housekeeping,The Latest Kid Fashion Trend Is Surprisingly Sweet - Good Housekeeping,fashion trend
gnews,news.google.com,https://news.google.com/rss/articles/CBMid0FVX3lxTE5aWkRwcEhVd1JRZ0JLbHM3X1NTQmE0VkV1TmNYYjlRZjBtYzBMUkpHWFQ1TjFhRjFNR2NzS3hPdWQ0dDl3d0YtcVhkSjJqcHpjYklKQWpNQnpNNU1NUnAxa2poRlF2TFdTMUdidnlxQTBhbFZmeEln?oc=5,1766091120,The 3 Fashion Trends I’m Letting Go of in 2026—And What I’m Wearing Instead - Marie Claire,The 3 Fashion Trends I’m Letting Go of in 2026—And What I’m Wearing Instead - Marie Claire,fashion trend
gnews,news.google.com,https://news.google.com/rss/articles/CBMibkFVX3lxTE9KaU5GSjZPVlBFOFBiUzg5aTJ2Q0laamFyNl9JaWU3WFpYZXdkcXE0MXo3eEIwdV9ENGcyTkt6NEhmREloTWtyVGFJYmMxc0R0WHVmeERsTE9QVkhCY05zdjR1MC1mUUZPTl9RaUVR?oc=5,1765995531,The Top 2026 Fashion Trends to Wear All Year Long - ELLE Canada Magazine,The Top 2026 Fashion Trends to Wear All Year Long - ELLE Canada Magazine,fashion trend
gnews,news.google.com,https://news.google.com/rss/articles/CBMiiAFBVV95cUxOTUlsLTFpdHdDYm1CdG9BQWp5S0UxOUR5VDZlb2dsS2ZkTlpHYm51dk44bDlpUWVoOVVnc21remk5eGZGemhXZ3hFNDdrcHpPZFhlejdSLXlwT0llekxkaWxLa1hoVUFkSEJsMWNJTi1kUTMxTHNCZFlMa2d3Z3V5WkZXeEhxYTZo?oc=5,1766322000,"I Found Winter Fashion Deals on Levi’s, Ugg, and Kate Spade From Amazon’s Secret Outlet—Starting at $10 - instyle.com","I Found Winter Fashion Deals on Levi’s, Ugg, and Kate Spade From Amazon’s Secret Outlet—Starting at $10 - instyle.com",fashion trend
gnews,news.google.com,https://news.google.com/rss/articles/CBMi5wFBVV95cUxOcmt1Y0xJVEM4eHJKNlY3LVE4MzVROWRVVGZ1NHlGdGhUMXNoRmtQcXoxOGlHTTlmQTU2U2lmc3F4XzNOLVJRLVlkV1VUUHlCZWc3S2JQekttTGJOcW1nTmNjdE1Za0FGdXRlMFV3RUxnY0RFdW9rRFBfUURrb2JWVDdBR2ljNl9WUFhyVFJZV0VpX1lNak5pVFFYckpvaEJ6VTZkYW9uX0hrN25wY1o5YU5JLXJWQ3FjX2tXSFRZUHdWZzZ2S3FxSzN4amVmel9uV2hVSldkU3JmZGE1YW9GelB0ZjZmZDg?oc=5,1766298654,"Quilted floral vests, part of the 'halmaenial' trend, are the new winter look - Korea JoongAng Daily","Quilted floral vests, part of the 'halmaenial' trend, are the new winter look - Korea JoongAng Daily",fashion trend
gnews,news.google.com,https://news.google.com/rss/articles/CBMihwFBVV95cUxNVlQxZ0lndGlqd1MzRUQza0lQamNSaHBNRlFKVGZWZW0yQm5Bdkk2R09acjMzRUU3YjNrYUt2NG9XeWNQTDFucGZzdUFRSDk1NHZraFlQTVZDa2Jwdzh1Nk1DSWpraDBHMDFNZXNlaUlxX2RVRVBESVRLNUlvWTBCY1p3V1hGQXc?oc=5,1766160120,Move over Bluetooth: wired headphones are back – and suddenly cool again - The Guardian,Move over Bluetooth: wired headphones are back – and suddenly cool again - The Guardian,fashion trend
gnews,news.google.com,https://news.google.com/rss/articles/CBMikgFBVV95cUxQQjZ2cS1yVHp5Z2FvS0R6cVBESm5wd2VvMU5sSFBTR1BGTjFMMGQwcUVvc1pmU29fNnRHWXZWMkxVem95dldXMzNPWkxOT1E3VGJjZHJKMUFWQkVFLXdXMW5aNlVWTE5LaXNqUnQwbV94YUUtTjFpUGZSZWRIeTdSVF91MVVMTzlYaTF0MmtENW9TQQ?oc=5,1766001159,We’re Coming Undone… and So Are Our Clothes - harpersbazaar.com,We’re Coming Undone… and So Are Our Clothes - harpersbazaar.com,fashion trend
gnews,news.google.com,https://news.google.com/rss/articles/CBMiigFBVV95cUxOYlVzX0pSa1N1WE5CRHVGRXhEakVuZlNoQlpjWVdVeXBoQVg1aU5GRjRFWTc2NXFFQ3ZmRGFhVGZxbU9HTkVTQ3lVaHhSM3lOdF9KelU3V0ZEMTNvcGVqNkpLek1LN29iSWNOOEFZVjRIMkhhaVA1TFZreEFzSUV0Wi1BbUVOYm5DT3fSAY8BQVVfeXFMTWhPbnY5VEpRakUwek1rQzlUcE5NX3BqcHdIOUJRTlIyWnBxdFRCZkVmV0hHRWZIbmNWUGs1VEVsM1NSSU5yV3VWZjljd3M2NnJyMHNia3VOVzJsaW1mSnRSMW9lNDEtdFZyQlRybWZQRlgxZHUzMXpmSEtfMUZibzljN2tFSFFVQ0p3WEdDVzQ?oc=5,1766050518,10 fashion trends set to dominate early 2026 - Diva Magazine,10 fashion trends set to dominate early 2026 - Diva Magazine,fashion trend
gnews,news.google.com,https://news.google.com/rss/articles/CBMiY0FVX3lxTE1yTFM5OVN4ZjRDOEFwbjhrTFNXX3dxaWRJb2FnOUpjSGJ2VHlSN2t3cmJrU1dVeFVQNTh1ZVM0eWpxaGVfNy1KN1Z6ZTI5WXlfNUhUVmwyRzNmcHRZZzlJenIyb9IBaEFVX3lxTE13NmdEUXVxT0llWHVZaUxNMmhXdFV4dXRmVXVXRFBWYjI4U0k1VlFFYlNJUHJaTWtjaFVrdG53SklsTURkRG9Ra2NJZUNibTdIT2lNcWZrMmcwRDRNYXVaMFRqZEd2bDl1?oc=5,1766286976,Breakfast-Inspired Fashion Capsules - Trend Hunter,Breakfast-Inspired Fashion Capsules - Trend Hunter,fashion trend
gnews,news.google.com,https://news.google.com/rss/articles/CBMifkFVX3lxTE5QYUhrd0pXYTM0TUlKRDVBZmo2dVAyTTdSbUVwSktpNHpMMUtWQXFXVVpybE81NGpXaG85cS1MNFZacmYxTzdKODhGODB1Qzd4ZGxpSDFJZzBLZjN0U0ZxRjJZZjVFRFNjR3FsSEhSWHdaQXFGbzRHbHVLeEFudw?oc=5,1766239200,Pinterest Predicts 6 Big Fashion Trends for 2026—and One Is a Throwback Grandma Never Gave Up - Real Simple,Pinterest Predicts 6 Big Fashion Trends for 2026—and One Is a Throwback Grandma Never Gave Up - Real Simple,fashion trend
gnews,news.google.com,https://news.google.com/rss/articles/CBMi-gFBVV95cUxQeGZndkgyei1PQnVldmR0LVoxM1JjMlVrUXMxbFM2MjRqTmVjV1BYMmJ0VTBfaWVXd28ta2pyblIzTkFXcXlNd05fckRQTnY0S1hZMUZWZHZ1YlVtQWtyMHNoN0F0aUZadWRTeUFLQVgyRUhhWEVKWmJ6YnNPRHYzNm5RRVJ4Wk96YnFKYmZTZUFSbFZhT25CaEw3c1F3QWdoRG41Y2NiOTlyaUZBVkRCaTh2aGMyMUVERDVFWm5KeDFnZ24zaUdBTy1sandGVGdnbjNKZFNmaW4yZ2NKVVRWMWgxaDBiUFVhUUFHSjQ3ZEN0c3FGTmdkZ3J3?oc=5,1766249218,Dressing like a 2000s R&B dancer: The unexpected fashion trend - MSN,Dressing like a 2000s R&B dancer: The unexpected fashion trend - MSN,fashion trend
gnews,news.google.com,https://news.google.com/rss/articles/CBMifEFVX3lxTE94bVNhc0hJYndUbnJfTHI0LVZfeThwT0ItUGt5cjNRaUc4eUtvZ051SUFOYXhOYUI2RUkxZVdhdkxydmkxQ3V0ajBha2NMQ1hlUmMxWWxOOU9ZUVF0bTYzX3FRNm1sa0Q3al9LX0ZHT3M1d0RPOXJzekIzN3o?oc=5,1765991123,Princess Charlotte Twins with Mom Kate Middleton in This Huge 2024 Fashion Trend - PureWow,Princess Charlotte Twins with Mom Kate Middleton in This Huge 2024 Fashion Trend - PureWow,fashion trend
gnews,news.google.com,https://news.google.com/rss/articles/CBMiZEFVX3lxTE9KZjRhRnlHZVJ6REd3MjkxSXQxRnMtRXRHd1dFWUxwdWlJZWdfQUh3LVhIZXRpMjFnQ2NhVFlfSDQtMkJyaTFWQ3QxQmxqd2g0LXE2OHVSV2lWa1dKUFNDdGlHNzU?oc=5,1765828307,"15 Fashion Trends That Will Be Everywhere in 2026: Chocolate Brown, '80s Maximalism, Brooches, and More - Teen Vogue","15 Fashion Trends That Will Be Everywhere in 2026: Chocolate Brown, '80s Maximalism, Brooches, and More - Teen Vogue",fashion trend
gnews,news.google.com,https://news.google.com/rss/articles/CBMiqgFBVV95cUxPellZVGotbkN4R3dzb3BuS1B3YlgwZ2ZUbEkySDlBN2JlaVpGSXd6azBTOW9YcnkyRU1NS0hNZ0FjMXlScHM0YWJXeXJOWVpSMXVrNWI2Y0RvdEZPbU1tTVFtQ1J4OGZRTVlxSnBiTlR3UlhjV0dXclFtTFNwSlpZRlRxNjYzUEJJc3ZWQTBqSXdCOV9MMEZkbThiekJNeWFHUVgtcXRBNFVNQdIBrwFBVV95cUxQR01hR05KdWRLZzNVWDE5X2xoLVctV1ZIOExvVmtNUkFBWU1QOU90TmVJRDZ3S0JpQmpqeWQ3TTZNNlBENEJNc2tTWEJ5aHdoTzRnSkZ6dm9CazhvMkZzN0MzcEV4Sk1ENnEtOU9fYktid2VBRnZLV1J3Rmg4M1ltVDRfZEhqdVNTeXdhbFJITU1icHQ2dnc0eUpkSFdBNUd4c25ZMHlBdWpXNjRaZS1n?oc=5,1766325154,Would you wear Manish Malhotra sneakers to an Indian wedding? - Lifestyle Asia Hong Kong,Would you wear Manish Malhotra sneakers to an Indian wedding? - Lifestyle Asia Hong Kong,fashion trend
gnews,news.google.com,https://news.google.com/rss/articles/CBMivgFBVV95cUxOTlZ6UUtTZmxILWFBcDIzMUNtWWFPZFZ2UlFQandTbmRTT2FwVHBRQ1VCX0sxRjgxQnFTclhhQVRhX2djZ3RaanJNb2dOMTd2Wk1YY3FKejdnYmk4UFNidlNOdkV3S0hpSUZxVmU1WXN0a0VyQVRRSTh4emRZeno0aGIxR2I5M2xGWHIwdjgxX0ZEbVVxXzdmTlltMDhPbWRDYjMwMndzT0dEM0dwelFZWno5UUY1bm1UWHZyOVl3?oc=5,1766049540,The biggest fashion trends tipped to take over the high street in 2026 - The Independent,The biggest fashion trends tipped to take over the high street in 2026 - The Independent,fashion trend
gnews,news.google.com,https://news.google.com/rss/articles/CBMi4gFBVV95cUxOeURLa0l4RWVHRmdPcjdPMjVpZnUtLXBKZEFqa1dub3FmcldtV2NsUWV4a29UZ3VxQTlJODZrOENPZ242cUtSb1ZCU3U5cU9WTmlCa0VrVDRSTktZZzJrUVhnd2RVTDNlWTdVX3lGRW42WW1yWWsxcHdkVk83R1dHNVpZRjhTODVtb3ZZMi1xbEQ0UklaOENCR0FqcmdXYThYRUVjVnM3bU95TlU1aFpYUjQ2dGJ4ZWZfQUxDYmxRal9HZlZCYVY0bHp5MkI2OFFzamItMmJDUHlMVUozM21fb0F3?oc=5,1766062826,The Princess Of Wales Chooses One Of 2025's Breakout Fashion Trends For Christmas Portrait - ELLE,The Princess Of Wales Chooses One Of 2025's Breakout Fashion Trends For Christmas Portrait - ELLE,fashion trend
gnews,news.google.com,https://news.google.com/rss/articles/CBMiZ0FVX3lxTE8tamRhY0szeXBZbTBNRlVmQnA0cHJ4c1hvakpTdHp5eWFoV0c3YUVMZ25NclF3c1U0WlpXQ1Q4TVQtQnc4b3pGamNMdFZFd2ZoN09rM1RuVG5TNDk2WmV4cjZsNEJHTzTSAWxBVV95cUxNNzFwUFNhVkE3RWlwUTVrY21wT2dObTZJSjUxLVFHWUJmUmNGZmNkMXVhSndvRzZfa09xeUVyTWVMcnpQTk1mczNjSTVobDduN1dzOHFCMUZ2ZG9ick5SSmZVRmJmTmdxd1d1eXY?oc=5,1766289076,Portrait-Style High-Fashion Campaigns - Trend Hunter,Portrait-Style High-Fashion Campaigns - Trend Hunter,fashion trend
gnews,news.google.com,https://news.google.com/rss/articles/CBMigwFBVV95cUxPa1NIMm1VV2V1clR5TXdWOHdFUVdMNHNXdHNWSkw5cEpDVGgzaTM0RkdBY3FCOFA1bzhuR0pPUnd3aW85YnRmd01fR1JQWlFTdUY0X3BGUkE3ZEh6aWp3RVRtRjF0ajVROVYxWXhMVWEyLW44eFhwX3Yyc3kzUlJtWGVSQQ?oc=5,1766175862,I’m Swapping My Ballet Flats for This Dainty Winter Shoe Trend - Marie Claire,I’m Swapping My Ballet Flats for This Dainty Winter Shoe Trend - Marie Claire,fashion trend
gnews,news.google.com,https://news.google.com/rss/articles/CBMibkFVX3lxTFBKRlZxWDZ1NVVCajdMdjZ2dGVHVUFSOHdaVVBVWkxJNG1wd1N5MHF2a1RHUXZkTzVYdmpLWTMxTzhtb0hmNTZWazNpT1E2UFJoWEcyS0lzakFTbkYydUk2VlRSTFAtY2NHbFBxaUZR?oc=5,1766044800,Looking Back at Billie Eilish’s Fashion Evolution - Vogue,Looking Back at Billie Eilish’s Fashion Evolution - Vogue,fashion trend
gnews,news.google.com,https://news.google.com/rss/articles/CBMibEFVX3lxTE5SalVpQXpXVmRqckxZandvczFxczl0SnVNQjNDT1RlckhKRTY3eldYYWJZMGhPZUVULXg0T09iMzhfWjRxbXoyZTdSbml0S1duWUZJZmZqUmZRdlpjR0ttQ2lxakNObVpETE82Rw?oc=5,1766074807,I'm a Denim Expert—These 4 Styles Are Trending in 2025 - Who What Wear,I'm a Denim Expert—These 4 Styles Are Trending in 2025 - Who What Wear,fashion trend
gnews,news.google.com,https://news.google.com/rss/articles/CBMiugFBVV95cUxOS0t1MzJuZk12Smh3XzdUMUpKaGdlaGxIcW8xNjZ3LTlsTEpwdGJ2WUx6dUZpaVpLNFB3V2s2QVRycENERGNic2E1d0N1MVpNMnQ0UmdtNlo0Qnl3am5rMGJ6T1VPUktGUUVMWjJaOEJCbFdNSGlCamFhdTdMdTJ1VUVNbmNYMDI1WnI0dVh5VE01Z1pCUGxIdTh2OEhMVFVpcW1nVV9fVGw1dVV4T0NZZTUyNGRWOGRQRGc?oc=5,1766256501,Hailey Bieber Elevates 2025's Sweatpants and Slippers Trends With an Oversize Leather Tote and a Long Winter Coat - Marie Claire,Hailey Bieber Elevates 2025's Sweatpants and Slippers Trends With an Oversize Leather Tote and a Long Winter Coat - Marie Claire,fashion trend
gnews,news.google.com,https://news.google.com/rss/articles/CBMihAFBVV95cUxNdEg5NXl6NjJlRGxYNHBZU21Cc1VLUG5ZM0RPV1JZU3ZLYWJXbkFObGNYNlNKd2k2UU1obFNWaTVKdWNrcWowSW4tRDBaaWlWbzEtMG80MDBpNjlPVGNGMTlqMnE3TEZRZExyXzdEckw5a2dwLW1SWmNpeVN0NmtZNE1ndEM?oc=5,1764576000,A look back at 2025's biggest fashion trends - Daily Tar Heel,A look back at 2025's biggest fashion trends - Daily Tar Heel,fashion trend
gnews,news.google.com,https://news.google.com/rss/articles/CBMicEFVX3lxTFBQTkVrRXBJVURTTzZ0elJHbC00eTVMbThHSm5teHY1SC1iX19vTnctcWxPNzROREZYMzNXNFd1OHZDUnl2aEFFbUZEUWZoMWl0Zm85NmhDOGhxZllfSG1Lc3NCWDlzZmtfRXk2a3IwUDA?oc=5,1766157139,The 5 Best ‘Emily in Paris’ Looks from Season 5 - PureWow,The 5 Best ‘Emily in Paris’ Looks from Season 5 - PureWow,fashion trend
gnews,news.google.com,https://news.google.com/rss/articles/CBMie0FVX3lxTE05X2wzTjRpVlFkRDlMeW9hc1hSM29QMnRmY3hxVE80VXB3YTFhcmY4SDR2ajNiNi1IeVVITVRuUWdGTHgyZ2VmeGxEQU1FOTZCd2twZjZ4eVplbXVGSFIxUWpZemMzb3ktUDhXeWR6eEJPRGpLZ1pMQTFoVQ?oc=5,1765988833,The most controversial fashion trend of the 2010s is making its comeback - Indy100,The most controversial fashion trend of the 2010s is making its comeback - Indy100,fashion trend
gnews,news.google.com,https://news.google.com/rss/articles/CBMi5wFBVV95cUxPd0lZRFR3TVhWOWdhY2JxVHR1LW5NNUtBRHpnZFBvM3RmajBGaWtucWpGT05ub3liNVc4eGxoX19rZ1hpTGZHclp2dExaMTFaVGM0a0locVJHWmtPa2lITHJSLVZ0azRzaldwU0dwN1JCcXhkekhtdVBqNFQ5ZkxuZldmbkpEb1V0SC1GS1J4ejRCWkVIdjJDckNDWUNiN2FORzdhbmVhNXhudFZObjNoUjIzX2RERTVhWXItSWdkT1FmQnNfOGN2dGs4emZteEFjZW90YkVHTEN2Z0R1RzA3UVM4X2xkZ2s?oc=5,1766081401,Stitch Fix Unveils the Top Trends of Women’s Fashion in 2025 and the Style Shift to Watch for in 2026 - The Citizen Newspaper Group,Stitch Fix Unveils the Top Trends of Women’s Fashion in 2025 and the Style Shift to Watch for in 2026 - The Citizen Newspaper Group,fashion trend
gnews,news.google.com,https://news.google.com/rss/articles/CBMid0FVX3lxTE1yMXhyNVE0WDlpekNJV1lidEk0Y2dYWXlhRzMzZnByWjY2d3ZZSUpzaXVpR0lVZ2phTmRWSlJrcVp3WlpLM0p6cnh2ZW9TVEt1T2tFOW43ODNldjdJLTkydmNOQVlKNURZOVpzZEltOVRVaXV0QU5v?oc=5,1766059200,It's Happening: In-the-Know Fashion People Are Shelving White Sneakers for These 6 Colors - Who What Wear,It's Happening: In-the-Know Fashion People Are Shelving White Sneakers for These 6 Colors - Who What Wear,fashion trend
gnews,news.google.com,https://news.google.com/rss/articles/CBMiywFBVV95cUxQLUlZalZDTW5xcURkTFlaTUFqcDFJNjlNLWRyTHV4X0NTVFM3MjdMVUE0ZkFIamVNR3ZQcVZ3bkdyWGY5bE5qM0trWk5sUkdndlcyNFNxMUR5eUFZZjFFZkp2M25VWXJENTQ1X1BqWHZTdVZ3SDB1SVVsaXRsbzNnUWRYajNMSVlkQ0dUNWlIWmwtWDNnZ01mNVliQ21meDI3eDZQMEc2c181SVpoWjFuUmQxZ3dtTGNZeE14RVpfRWY2Y0RBSFNod3RVTQ?oc=5,1766154318,The Architect of Style: Kyle Smith on His Groundbreaking Journey as the NFL’s First Fashion Editor - bet.com,The Architect of Style: Kyle Smith on His Groundbreaking Journey as the NFL’s First Fashion Editor - bet.com,fashion trend
gnews,news.google.com,https://news.google.com/rss/articles/CBMiogFBVV95cUxNSmhNNkY3c3YyX3cxMTZ1bTR1dWRLekFhRzk5STN5aGxXckhmdm5qTUpMSzlwVkFJalUxZ2pHWjBHX3I1NUk3WWtBMWtTVVAyLTlLWVJUX2M4Z2NONGxYaEhjNWNOZ3VScm94RlpWQ05paDVDWjExTFM4WHN5RVYta1R5S29zNGhkMENSeUY3UXhOWFR0Y1pzMHdPeVRBS194bFE?oc=5,1766083254,Is Character Dressing Going To Be Our 2026 Obsession? - Hypebae,Is Character Dressing Going To Be Our 2026 Obsession? - Hypebae,fashion trend
gnews,news.google.com,https://news.google.com/rss/articles/CBMiakFVX3lxTE5qbFJNYWJkcnF3b1VMaFl5VlhMOVc0UlhMbTh2UF9aYzQtNFE1bWwzOThCWGllWkFwcVNfMTMyMnJpeFBtRGVIY2JxR1J1SzNtQTZFQ0ZpUTMtQnIyRHNHYWYtVVVKY2xtaWc?oc=5,1766095877,I Just Got Back From the French Alps—5 Après-Ski Trends the Fashion Crowd Is Wearing - Who What Wear,I Just Got Back From the French Alps—5 Après-Ski Trends the Fashion Crowd Is Wearing - Who What Wear,fashion trend
gnews,news.google.com,https://news.google.com/rss/articles/CBMidEFVX3lxTE5GZk1nNTV2bGRhQjQ4aThwYWIyOUl6cjA4cjNvOXV0TEVuRkFJam1XZnAyOWJkbzBmbzFHRWZHZFV4WjZsdlV3OU9XRkhNTjE2X3Njbjd5bHJYVnIxUTFtclBBN0NjUGdJSTd6YjhkMnNTbVZo?oc=5,1765958400,The In and Out Denim Trends for 2026 - Who What Wear,The In and Out Denim Trends for 2026 - Who What Wear,fashion trend
gnews,news.google.com,https://news.google.com/rss/articles/CBMieEFVX3lxTFBaZ1NPWFB0Z0FIQkZqTTFNYjF6THlaVjZTY0dzUkx0NHdJR21yY0VZclU1WXUwME9OMHFIOEp4LTkzd2JNOENHU19jaVhRM3J6NDhDdUlvV0JJZWVrd1dzeXBodF84dzN4RDB4cGVUTm9FM2xZaFZMUQ?oc=5,1765440000,The 7 Biggest TikTok Fashion Trends of 2026 - Who What Wear,The 7 Biggest TikTok Fashion Trends of 2026 - Who What Wear,fashion trend
gnews,news.google.com,https://news.google.com/rss/articles/CBMikgFBVV95cUxQUTBsNmNEQU91N005M2s2T2dhcWpFcl9obkxuWW5xNmdrN1JEVFppaVVRUXNiMlIybmxiekQwMGNSalJnc2lSVnV1WW91cHBuc3hTZ0xFeFhfN25pUU1fbl91TU04eWY5eDlvSkd5OWktNjBJYlBVZEE4elRRZTRaUkcxekZMQmc5SlN0Y01OYndzUQ?oc=5,1766066584,How the Quarter Zip Became More than Just a Trend - harpersbazaar.com,How the Quarter Zip Became More than Just a Trend - harpersbazaar.com,fashion trend
gnews,news.google.com,https://news.google.com/rss/articles/CBMickFVX3lxTE1VLXJ4dVhoUlVIYk5uNHRjQ3JkNnhIVWZYUTE1M3hmZVVtOTBMQS1XZDRfRWVtRXQyVWNGMkNsUGxNa2hiaTJRS1dUR1daUnBEQlRueVpJUFg5YUNscXNYQTBOdlVieWhXZUxoaWt2VnlwQQ?oc=5,1766043900,"7 ""Ugly"" Shoe Trends That Will Be Huge in 2026 - Who What Wear","7 ""Ugly"" Shoe Trends That Will Be Huge in 2026 - Who What Wear",fashion trend
gnews,news.google.com,https://news.google.com/rss/articles/CBMif0FVX3lxTE85aC1qRzNNRUVhdS1BUGxQSTdUanZHRHEtMXdvRjVxd3FuOVdLaWRGeVlSak80X016YWpEVDlTUjI1Z2tpNEo0eTZhNjNkX3Z0dmk1UkUyaDNhTFBvSVA1YlRyX0ZfNHVreFVDclBZMGZrYmFPYndKLVNqc3JjcVU?oc=5,1765440000,2026 might be the year we finally give up on fashion trends - Fast Company,2026 might be the year we finally give up on fashion trends - Fast Company,fashion trend
gnews,news.google.com,https://news.google.com/rss/articles/CBMidEFVX3lxTE12RXhaYWhQTkVpQlBqOUtlN2otVFhaV3pScjBndFo0cnVST1RDNzFmMjVnbEdEaVVwWUVpc1VqM05GZnhIQmhNWktSc3lzYUFkSm80OG9GQWFXTEJEOE1aV2U3MkoyUWNMODJkRF9wOXp0TVln?oc=5,1766043900,5 Chic Knee-Length Skirt Trends Set to Be Everywhere in 2026 - Who What Wear,5 Chic Knee-Length Skirt Trends Set to Be Everywhere in 2026 - Who What Wear,fashion trend
gnews,news.google.com,https://news.google.com/rss/articles/CBMia0FVX3lxTFBIelFUSU1PODhMeVlhVnZoRzZTTDFaQkNHUk9ORnZJcTFac2I5SUZHSDB4VzJWXzFvQnlud213UjdqY0pDR0N3aTllQlNpUU54QV8tM2xpLUdKMkI2bnJKaGhhbW5GWG13S0VN?oc=5,1766131200,"I’ve Never Been a Big Denim Person, But These 7 Trends Have Convinced Me to Give It a Go - Who What Wear","I’ve Never Been a Big Denim Person, But These 7 Trends Have Convinced Me to Give It a Go - Who What Wear",fashion trend
gnews,news.google.com,https://news.google.com/rss/articles/CBMif0FVX3lxTFBnRlBiVEZTWHA1MGdHN0dNZUJmdGt3aGFDRjBCLTRGaklpbWNrVnVqaFljLTBMUzhRU2lubEFlQk1GWUpHaWRZSmFfU2dqNWRLSTJSSEdTci1GbDlCNE9fMTU4QnFFVkpvX0NpNGFqMWxxVlJEX3ZmRFNlNjN6TVk?oc=5,1766159584,We Love This Ceramist’s Monochromatic Holiday Style - Chatelaine,We Love This Ceramist’s Monochromatic Holiday Style - Chatelaine,fashion trend
gnews,news.google.com,https://news.google.com/rss/articles/CBMidEFVX3lxTE5yZlZ6Z19UUzZPbzZfLVUwczJfa2ctc0NKdFowRl81R2p4dElFVC1DQVdQMF9sMEQxX203STM1ZHloQU9UNWRnbHk2eXlMZ1V2SklGREgyUmRxQUZERlVzYzZkckFqbmxMSThaZFFuVk9HcHdr?oc=5,1766130300,"Sorry, Flats, These Stylish Heels Are Set to Take Over Our 2026 Wardrobes - Who What Wear","Sorry, Flats, These Stylish Heels Are Set to Take Over Our 2026 Wardrobes - Who What Wear",fashion trend
gnews,news.google.com,https://news.google.com/rss/articles/CBMiigFBVV95cUxPTjVxTm1nZm5GcWpuc0lzUmViLTZQRU5aWERaVkhESWxWS0NOaUVRNnRleVRyTGxnYkduNUVhTnVCODljTDVWcTRvZ211RUROb01UcDVpbWxiZDNKRTlMWEN0WWRIZGhXeVI2OVVIZ3BXRFBfckFDMi1iX2VFaTJ2cHdEZ0J1dDdhN0E?oc=5,1766185793,Lingerie-inspired looks are big this winter — here’s how to style the trend - cbc.ca,Lingerie-inspired looks are big this winter — here’s how to style the trend - cbc.ca,fashion trend
gnews,news.google.com,https://news.google.com/rss/articles/CBMigAFBVV95cUxQY3JkQ2o0S3JuLUpmTjBsdnp3M3JnMldHSUFXZmJBVDZQeWRPVlJaaHh3UHVWSkdQOWVNczVLOGFJNlFEZkFxMU11QTR1aDdrelprTlZDY25JTGVoa1dYNHBjeGNJb3F3RnNjV2VpeUtBRDdQTVBVclNvckg1TjZ2Wg?oc=5,1766214000,Prepare Yourself—These Maximalist Accessory Trends Are Set to Take Over in 2026 - Who What Wear,Prepare Yourself—These Maximalist Accessory Trends Are Set to Take Over in 2026 - Who What Wear,fashion trend
gnews,news.google.com,https://news.google.com/rss/articles/CBMilAFBVV95cUxOdTR1Y3R2R2J2c1g0a2RGWGZ6WElXSjlsZ3FRZzVGYk1nR0paaVAxbkFMVHpHTGlHYzVjTUhUc3FlX01KbmxHbkQ2SmVmemVBV2hTS05LYnJDSTBvaDU5dzhLcW0xWTdNc01EUHdPYWRZZ0Ffak9tTEZNYlZmWWF3RnplazVaZVpxRm1OcFZYdGVqRlhC?oc=5,1766306772,Va-va-voom fashion trend Blake Lively & Kylie Jenner are loving this Christmas - it gives you an instant boob job - The Irish Sun,Va-va-voom fashion trend Blake Lively & Kylie Jenner are loving this Christmas - it gives you an instant boob job - The Irish Sun,fashion trend
