source,domain,url,created_utc,title,text,query
rss,uxdesign.cc,https://uxdesign.cc/contemporary-design-doesnt-just-reflect-nihilism-it-creates-it-4b8617293462?source=rss----138adf9c44c---4,1759143278,"Contemporary design doesn’t just reflect nihilism, it creates it.","Contemporary design doesn’t just reflect nihilism, it creates it.

<h4><em>How what we build transforms our condition and shapes the very fabric of meaning.</em></h4><figure><img alt=""A clear glass jar with a wide mouth and smooth, rounded edges is centered against a dark background, conveying simplicity and minimalism."" src=""https://cdn-images-1.medium.com/max/1024/1*dj3PndoL2sZnFGwhjEPyuA.png"" /><figcaption>Image source: <a href=""https://www.freepik.com/premium-ai-image/empty-glass-jar-black-background_352966379.htm"">freepik.com</a></figcaption></figure><p>It should come as no surprise to those paying attention that <a href=""https://iep.utm.edu/nihilism/"">nihilism</a> — the belief that life lacks inherent meaning — has become <a href=""https://www.thefp.com/p/robin-westman-and-the-rise-of-american-nihilism-minneapolis-shooting"">increasingly prevalent</a>. However, these days it appears not as a defiant rejection of values, but as a quiet erosion of purpose met with a shrug of apathy.</p><p>Ends are replaced by metrics, conviction by convenience, and narrative by feeds. Secularism, politics, ideology, and technology are often blamed. However, another force hides in plain sight — design.</p><p>If one had to describe what nihilistic design looks like, it would be sterile, stripped of conviction, void of meaning, and soulless. Sound familiar?</p><p>Those same traits could be used to describe how many <a href=""https://www.thesecretdeveloper.com/blog/why-logos-are-gettingnbspboring"">brands</a>, <a href=""https://takt.com/articles/why-good-ux-is-making-websites-boring-and-how-to-fix-it/"">websites, and apps</a> appear today. No color, no texture, no shape— just flat, black and white, afraid to offend, and content to remain barren.</p><figure><img alt=""A collage of various webpage screenshots: OpenAI’s homepage, Google search, Facebook login, a social media platform, NVIDIA’s article, Apple products, Adidas shopping, and a fitness brand site."" src=""https://cdn-images-1.medium.com/max/1024/1*8ublcl5lGeZitYR0XPuiUQ.png"" /><figcaption>Screen images of OpenAI, Google, Facebook, X, Nvidia, Apple, Adidas, and Nike.</figcaption></figure><p>We like to think design reflects culture. The <a href=""https://www.vam.ac.uk/articles/the-baroque-style?srsltid=AfmBOorubuaM7Snv5M_p9U5B8ZpV5oc3rLu0axgNjmUbkj6KroOSsSFp"">ornament of the Baroque in the 17th century</a>, the geometric rigor of <a href=""https://www.britannica.com/art/Art-Deco"">Art Deco in the 1920s</a>, the <a href=""https://www.popbae.com/blogs/trends/summer-in-neon?srsltid=AfmBOoo9lDJUkloWIryj199z_wvnX_Gf1PVDfFYLcxG3u-m5OugoYfNF"">neon excess of the 1980s</a> — each seems like a mirror of the society that created it.</p><p>But what if this familiar story has it backwards? What if culture is not simply echoed in design, but shaped by it? What if the sterile and hollow interfaces we produce today are not passive reflections of nihilism, but active producers of it?</p><p>This idea has deep philosophical roots. <a href=""https://www.wilde-online.info/the-decay-of-lying-page15.html"">Oscar Wilde once argued that life imitates art</a> far more than art imitates life. <a href=""https://plato.stanford.edu/entries/nietzsche-aesthetics/"">Friedrich Nietzsche believed that aesthetics precede truth,</a> that existence itself is justified only as an aesthetic phenomenon. <a href=""https://web.mit.edu/allanmc/www/mcluhan.mediummessage.pdf"">Marshall McLuhan declared that the medium is the message,</a> and <a href=""https://plato.stanford.edu/entries/baudrillard/"">Jean Baudrillard pushed it further</a>, claiming that signs and images no longer reflect reality but generate it.</p><p>If this is true, the pattern is unmistakable—design doesn’t just record meaning, it scripts it. And once design withers, culture follows close behind.</p><h4>From story to feed</h4><p>Cultural forms once carried narrative. Cathedrals told stories in stone and glass. Novels and films offered beginnings, middles, and ends that gave coherence to life. Even broadcast television moved within familiar arcs.</p><figure><img alt=""Panoramic view of Paris at sunset, highlighting the golden dome of Les Invalides and the modern Montparnasse Tower amidst historic architecture. Warm, vibrant tones."" src=""https://cdn-images-1.medium.com/max/1000/1*yjxUVTkh6xVmKbl6sJcACg.jpeg"" /><figcaption>Montparnasse and Les Invalides, Paris | Image source: <a href=""https://pixers.us/stickers/tour-montparnasse-and-les-invalides-paris-45670313"">pixers.us</a></figcaption></figure><p>Today that coherence is harder to find. Much can be said about the bland architecture of our cities and the thinning narratives of contemporary movies and novels, but one of the most concerning shifts has been in the evolution of streaming television.</p><p>Television experiences that once delivered episodes with self-contained stories now lean heavily on season-long arcs—<a href=""https://medium.com/a-suburban-prison/why-are-tv-shows-canceled-9b95db46a4a4""> arcs that may never conclude if the series is canceled</a>. Stories hang suspended, deferred, or abandoned, and audiences grow accustomed to living with open loops, each pause just another cue to crave the next dopamine hit that never truly satisfies.</p><p>Nowhere are open loops more pervasive than the internet, especially social media. Here, design has abandoned narrative architecture altogether. Scroll-based feeds deliver hours of endless, unresolved experience. Search itself has become infinite — every query spawning new links, new threads, new rabbit holes without finality. These systems do not merely reflect shortened attention spans—they train us into them.</p><p>What’s lost in this shift is the <a href=""https://medium.com/digital-media-society-spring-2020/the-impact-that-streaming-sites-have-on-society-ef45c37f2efe"">collective experience</a>. Once, cultural scarcity bound people together — shared stories, shared rituals, shared meanings that culminated. Meaning deepened because it was finite, because it felt resolved. Now we chase a superficial sense of significance in the infinite. But infinity never resolves. It offers no closure, only the perpetual lure of what lies just beyond.</p><h4>The myth of neutrality</h4><p>Minimalism and modernism complicate the story further. These movements, and their descendants in today’s flat digital interfaces, often parade as neutral. The grid, the sans serif, the clean white background — all claim to transcend culture, to present the universal. But neutrality is a myth. Every omission is a worldview.</p><p>By removing ornament, context, and symbol, design does not simply clear space for function — it establishes an aesthetic where emptiness itself becomes a virtue. This virtue is not neutral—it is rooted in Western Enlightenment ideals of rationality and order. A stripped-down interface tells us that depth is clutter, that meaning is noise, that efficiency is the highest good.</p><p>This unraveling of layered meaning now reaches even long-form writing. Articles like this, which should invite reflection, are met with readers possessed by the demand for expediency — brevity, punch, imagery. Platforms like Instagram and X (Twitter) have trained us to crave immediacy over depth. Pictures replace paragraphs, glances replace grasp, and culture learns to settle for surfaces.</p><h4>Reason without conviction</h4><p>What makes this drift even more insidious is the way design has cloaked itself in the language of reason. Research, usability testing, and A/B experiments all serve as proof that design is objective. Yet philosophy has long shown that reason cannot prove itself.</p><p>As <a href=""https://plato.stanford.edu/entries/kant/"">Immanual Kant</a> observed, reason always bumps against the limits of what it can justify. <a href=""https://plato.stanford.edu/entries/hume/"">David Hume</a> warned that no amount of empirical observation can bridge the gap from “is” to “ought.” <a href=""https://plato.stanford.edu/entries/goedel/"">Kurt Gödel</a> demonstrated that even mathematics, the purest structure of reason, contains truths that cannot be proven within its own system. And <a href=""https://plato.stanford.edu/entries/nietzsche/"">Nietzsche</a> reminded us that what we take as “truth” often conceals underlying values and power.</p><p>When design insists that data is its foundation, it forgets that even data rests on faith — in our senses, our instruments, and our frameworks. What presents itself as objectivity quickly slides into <a href=""https://plato.stanford.edu/entries/relativism/"">relativism</a>, guided not by conviction but by whichever metric performs best in an experiment. Meaning evaporates in the process. Usability without story, efficiency without soul — these become the hallmarks of design that has abandoned belief in meaning itself.</p><figure><img alt=""Cartoon of two men analyzing a dashboard with charts. A janitor nearby discards a paper. Caption reads, “Do we trust this data?” conveying skepticism."" src=""https://cdn-images-1.medium.com/max/900/1*5niuoxNYCmrP5Fr_COXeGw.png"" /><figcaption>Illustration by <a href=""https://dataedo.com/cartoon/tag/trust-data"">Piotr Kononow</a></figcaption></figure><h4>AI and the acceleration of emptiness</h4><p>Artificial intelligence is the logical extension of this trajectory — an engine built on reason based technology—data, pattern recognition, statistical inference — yet stripped of the conviction or belief that gives form meaning.</p><p>An AI-generated logo may look polished, but beneath the surface there is nothing. It is statistically coherent but culturally vacant, a reflection of averages without values.</p><p>Scaled up, these outputs flood culture with forms that only pretend to carry meaning. The danger is not simply their hollowness, but the way they train us to accept hollowness as normal.</p><p>Worse, their conversational mimicry — the illusion of a voice that “understands” — <a href=""https://uxdesign.cc/building-trust-in-opaque-systems-ce38cef741b6"">creates trust where none is warranted</a>. We begin to trust the simulation of meaning rather than meaning itself.</p><p>When design can be generated in seconds, we learn to value speed over depth, convenience over conviction. The more we consume forms without substance, the more we adapt to their vacancy.</p><p>AI doesn’t just produce empty surfaces — it trains us to stop expecting meaning at all. And that quiet erosion of expectation is what makes it an accelerant of nihilism.</p><h4>Design as an engine of nihilism</h4><p>In contemporary design the inversion becomes clear. It doesn’t merely display nihilism — it drives it. Infinite feeds manufacture distraction. Minimalist sameness recasts emptiness as elegance. AI systems hint at human replaceability and then condition us to accept it.</p><p>Today’s interfaces aren’t passive reflections of culture. They script the way we see, think, and value. In their hollow repetitions they embed a lesson— nothing lasts, everything is disposable, and meaning is irrelevant.</p><p>Once these forms take hold, culture completes the circuit. Users absorb the cues and stop expecting depth. The less story, symbolism, or conviction design provides, the more indulgent such elements appear when they do surface.</p><p>The loop accelerates until the pursuit of meaning seems archaic. Emptiness is marketed as efficiency, even clarity. And here lies the danger—nihilism does not remain an abstract idea but becomes a lived condition.</p><p>At that point design doesn’t follow culture — it steers it, training us not only to live without meaning but to stop wanting it. That is how nihilism, once a philosophical diagnosis, becomes the default atmosphere of everyday life. And sadly, we are in the midst of such decay.</p><h4>Toward a design of meaning</h4><p>If this diagnosis is right, then design carries more responsibility than we often admit. It is not neutral. It is not merely reactive. It is formative. Which means that if design has played a role in producing nihilism, it can also play a role in resisting it.</p><p>The challenge is not to restore some lost objectivity — that foundation never existed. The challenge is to create values where none are given. Nietzsche saw this as the only way through nihilism — to become creators of meaning rather than its mourners.</p><p><a href=""https://plato.stanford.edu/entries/kierkegaard/"">Søren Kierkegaard</a>, too, understood that escaping despair required more than reason—it demanded a leap of faith, an act of commitment that could not be justified in advance.</p><p>For design, that means reintroducing narrative into interfaces, reclaiming symbolism, and insisting that even in a secular and fragmented modern society, design can be an act of conviction rather than resignation. Meaning doesn’t emerge from an infinite feed of possibilities but from forms that resolve, gestures that culminate, and experiences that cohere.</p><p>Some designs already gesture in this direction. <a href=""https://duolingo-papers.s3.amazonaws.com/reports/Duolingo_whitepaper_duolingo_method_2023.pdf"">Duolingo, for example, transforms small units of repetition into a narrative of progress</a> — each lesson resolves, each milestone carries symbolic weight. It shows that interfaces need not be hollow loops of engagement, but can script arcs of meaning that accumulate over time.</p><figure><img alt=""“Left side: An orange flame and ‘5 day streak’ indicate practice consistency. Calendar shows checked days from Tuesday to Saturday. Right side: Options for 7, 14, 30, and 50 day streaks, with 50-day ‘unstoppable’ chosen. A cheerful green owl holds an orange and a message notes increased course completion likelihood. Blue buttons read ‘Continue’ and ‘Commit to my goal’."" src=""https://cdn-images-1.medium.com/max/1024/1*eFBTUUqCOgDRLXdvrW78iA.png"" /><figcaption>Image source: <a href=""https://www.asquared.uk/insights/app-delight-duolingo"">asquared.uk</a></figcaption></figure><p>Another app that embodies a design philosophy that counters unbroken scroll and cultural drift is <a href=""https://almanac.upenn.edu/articles/in-the-word-game-wordle-a-case-for-pure-play"">Wordle</a> —with its one puzzle a day. Its strength lies in its boundary—you can’t binge it, and its closure is literal and shared.</p><p>Because the puzzle is the same for everyone, it becomes a point of convergence — a common experience across strangers and communities. The resolution is built in, and that closure is what gives it weight.</p><figure><img alt=""A smartphone displays the Wordle game with guesses: GROUP, PRESS, PRANK. Green and yellow letters indicate correct or misplaced letters."" src=""https://cdn-images-1.medium.com/max/750/1*Ay9jYHtiHwmxoUeka_nZoA.jpeg"" /><figcaption>Photo by Jakub Porzycki/NurPhoto via AP.</figcaption></figure><p>Designers cannot avoid their role in molding society. Every decision is ethical labyrinth. Every omission shapes culture. Every interface is an argument about how meaning works. If our designs are hollow, they will train us into hollowness. If they carry conviction, they will cultivate conviction.</p><h4>Choosing meaning</h4><p>We like to say design reflects culture, but that’s only half the truth. Culture also reflects design. And the interfaces we are building today don’t just echo nihilism — they embed it, normalize it, and accelerate it. The real question isn’t whether design has agency, but whether designers are willing to own the meanings they create — or the voids they leave behind.</p><p>Part of the work is rhetorical. Designers can <a href=""https://www.nngroup.com/articles/rhetorical-triangle/"">learn to reframe meaning</a> as a kind of metric in itself — arguing that coherence builds retention, that conviction breeds loyalty. If the industry only speaks numbers, then one task is to translate values into that language without losing the values themselves.</p><p>If we refuse that responsibility, our interfaces will go on teaching the same lesson, swipe after swipe—that meaning itself is negotiable, optional, disposable. And the more we live inside those lessons, the more we risk losing the very capacity to imagine life beyond the abyss.</p><p><strong><em>Don’t miss out! </em></strong><a href=""https://micbuckcreative.medium.com/subscribe""><strong><em>Join my email list</em></strong></a><strong><em> and receive the latest content.</em></strong></p><img alt="""" height=""1"" src=""https://medium.com/_/stat?event=post.clientViewed&amp;referrerSource=full_rss&amp;postId=4b8617293462"" width=""1"" /><hr /><p><a href=""https://uxdesign.cc/contemporary-design-doesnt-just-reflect-nihilism-it-creates-it-4b8617293462"">Contemporary design doesn’t just reflect nihilism, it creates it.</a> was originally published in <a href=""https://uxdesign.cc"">UX Collective</a> on Medium, where people are continuing the conversation by highlighting and responding to this story.</p>",
rss,uxdesign.cc,https://uxdesign.cc/when-innovation-gets-stuck-apple-tesla-and-the-path-fixation-trap-b10afde018e0?source=rss----138adf9c44c---4,1759096158,"When innovation gets stuck: Apple, Tesla, and the path fixation trap","When innovation gets stuck: Apple, Tesla, and the path fixation trap

<div class=""medium-feed-item""><p class=""medium-feed-image""><a href=""https://uxdesign.cc/when-innovation-gets-stuck-apple-tesla-and-the-path-fixation-trap-b10afde018e0?source=rss----138adf9c44c---4""><img src=""https://cdn-images-1.medium.com/max/1920/1*pMptj_tnnxfyUv8CASqiag.jpeg"" width=""1920"" /></a></p><p class=""medium-feed-snippet"">Apple&#x2019;s comfort in the familiar contrasts with Tesla&#x2019;s risk-taking. Here&#x2019;s what UX and design can learn from both.</p><p class=""medium-feed-link""><a href=""https://uxdesign.cc/when-innovation-gets-stuck-apple-tesla-and-the-path-fixation-trap-b10afde018e0?source=rss----138adf9c44c---4"">Continue reading on UX Collective »</a></p></div>",
gnews,news.google.com,https://news.google.com/rss/articles/CBMihwFBVV95cUxQRS15aDM5dnZfZjRFR3lBVGw4RWZ4UTBBMWl0ZDlTQTdlWmxiSmszVVU0aGNVMnRfdnY0N1RsNmJUWktXNVEyWmcwME1yVS14N2gyVkhKWVlNVkJVNXdYdFE5bE43SndJR0NNUXdKN1V4YlZEUHpVN2dMX04zajNHOG9pUDlmaVE?oc=5,1755932400,"Graphic design - 20th Century, Typography, Visual Communication - Britannica","Graphic design - 20th Century, Typography, Visual Communication - Britannica",graphic design trend
gnews,news.google.com,https://news.google.com/rss/articles/CBMiyAFBVV95cUxOWU93RVNXTVRpclZ0dXhzSXM2SExEZEFyellKQzI1eFlKS3NiWW10S1RzbUlQcEdFMG9GYjBLYWpxMjFKcFNQdzVBek81akxCRnM3ektmUUdYT0lwWmZ4NVBVaGg4WFF1XzVIMzhySktNT0pEb0szcFY5V1dkMlNnb0lJYUpiU0R4a0NJNC13blc5WGtVNm5uQ1JCeF9vRlI2TE93OENfR2w5UFdqRzVDNFc0SmdwVUtsZkZGMG9MRWRobTFrSEgyVQ?oc=5,1755932400,Bose jumps on 2025's most viral colour trend with ingenious packaging design - Creative Bloq,Bose jumps on 2025's most viral colour trend with ingenious packaging design - Creative Bloq,graphic design trend
gnews,news.google.com,https://news.google.com/rss/articles/CBMihAFBVV95cUxPcE1WcjRtVy1hbWRQNHhYX3lPRnNKenYySmNkYlhCd2ttTW9KcXMwdGlsZnB6cm9NY3BSeEs5ZWpBN1poa19HaGRSTDl5RGRUNHlmbk1pRkU5UHFqZUNmaXgyVzlzWVhLTnF0ZjEzeldzSmhCaTlqWFZSWXdiM1pONGg4V00?oc=5,1757660400,Why Intelligence-First (IX) Design Outshines UI/UX - A Trend Report by Digital Silk Web Design Agency - Yahoo Finance,Why Intelligence-First (IX) Design Outshines UI/UX - A Trend Report by Digital Silk Web Design Agency - Yahoo Finance,web design trend
gnews,news.google.com,https://news.google.com/rss/articles/CBMiWEFVX3lxTE9WbUM4MjM5dVlyWnZ1M3ZuemUwMVE3ckk3UnNYZmc0WUdCcW9uSzBhMmxla0FkU25RSVJlTlJCWnd4X2ZHSkhlMWRHQUhwSEE0RmNUN05zWHM?oc=5,1755586800,Top 10 Frontend Trends in 2025 - Netguru,Top 10 Frontend Trends in 2025 - Netguru,web design trend
gnews,news.google.com,https://news.google.com/rss/articles/CBMinwFBVV95cUxPc3ZEV2RNZF9aU1k1aGhfdVdYTy1iRlZxdHNnQjVCTElvNl8ycU1LX1pzM1hWMm5XZUtUbXhGTmlCLS0yY3U3UF8tdFRORDRGQUtlWVVLTHZMRnJDbENKNUhVc0w3Tm56eXpxeWZBZ3E2RXhqSnpremJ4UWhYdVVkdlpGWHB6U0ZZQ3phYWhVZXc2SllkSjVOU2pwbnN2TjTSAaQBQVVfeXFMTU9vOHdya25IcHRmajF2Nmc0R1psRTBsM2d3TU9VanhQSTdpbF9lUGtmNWdIWndsMHJKa0c1OGxTWFdPd0lmTE1nZ2JVQXdIZG5iVU9JRG9HUVRLRkRaWU1JWXBpemhsVDBzYW40NlFBZzFwYU9DZWVMSGdSTkN4azdzeDhrM1JSeXlOQTcyUVB6UWtrOHd5VTVIeERtalVBeHFWRVc?oc=5,1758914989,"Deadly shooting at Dallas ICE facility follows trend of sniper-type incidents: Experts - ABC News - Breaking News, Latest News and Videos","Deadly shooting at Dallas ICE facility follows trend of sniper-type incidents: Experts - ABC News - Breaking News, Latest News and Videos",typography trend
gnews,news.google.com,https://news.google.com/rss/articles/CBMifkFVX3lxTFBKZWc5cWxYZjZvWE1IWHdEcGo3WlQwOThfV3Jvb1U1WGo5Wk9maXoyc0Y4aFl4ZmRHMlVad2dyRnhvVGR2eGp4WDdVMEZOaEc1aUFNWlNIR0N3VFgzUUEwNl8yVkdQTU5jWVlNYWc2ZG91M2ozNkNhTlNQZV9Zdw?oc=5,1756278000,Letter Jewelry Spells Success These Days - The New York Times,Letter Jewelry Spells Success These Days - The New York Times,typography trend
gnews,news.google.com,https://news.google.com/rss/articles/CBMiygFBVV95cUxOUkJIcnJ0TGZBSDB3akw0ZzBiSzZJN18wdm9YVGR3SW1sWG8tamVSNGxtdEhXVnp0Yy1pR2toQUZ3Sm96Z2dpT1pCY2RhQzhudjkxX0t0cjM3TTQwQ1g2ZFJlUEE0VG8xekZYemJWeTJEYjZwSlRUdlFWYTM2ZV9LRm1GWGZoak9kMG45ZHUtUUpaZ3NZeWNZUWVhNm4yLUR5dlBLUHpzMEtQOEl0a0pSSGViWTZmVF9BQmlXN3dJRkNzRTg2T2E4NXVB?oc=5,1758816180,Fluid Typography and Variable Fonts Take Over - Trends by Digital Silk Web Design Agency - Newsfile,Fluid Typography and Variable Fonts Take Over - Trends by Digital Silk Web Design Agency - Newsfile,typography trend
youtube,,https://www.youtube.com/watch?v=7rPdjIwF4yE,1759394555, Graphic design  on canva #informativeLogo t#clothingdesign # latest  trends ,,graphic design trends
youtube,,https://www.youtube.com/watch?v=5c1PPg-ncbE,1759389914,Logo Design Trends 2025 | Stay Ahead of the Curve!,"Welcome to my channel, where creativity meets the future of design! ✨ In this series, I'll guide you through the hottest logo ...",graphic design trends
youtube,,https://www.youtube.com/watch?v=jrBbac0-odE,1759380700,How #poodi Became An Art Movement,"How #poodi Became An Art Movement fashion inspiration, design trends, creative designs, bohemian prints, artistic designs, ...",graphic design trends
youtube,,https://www.youtube.com/watch?v=TvBruyGNInQ,1759363240,Trendware Episode: Motion Typography and Sensory Branding,"A 50-second deep dive into the latest graphic design trends focusing on motion typography, immersive branding, and practical ...",graphic design trends
youtube,,https://www.youtube.com/watch?v=7P4cZrZ1-IQ,1759363208,Beyond the Grid PixselPulse Quick Trends and Tools,"Explore concise insights into current graphic design trends, photography tips, animation tricks, and platform savvy storytelling for ...",graphic design trends
youtube,,https://www.youtube.com/watch?v=hUcmSPf5PZM,1759343176,Do you like colour within design? #designtrends #productdesign #industrialdesign #graphicdesign,,graphic design trends
youtube,,https://www.youtube.com/watch?v=IUgrLKkmjRA,1759312835,𝗪𝗘’𝗥𝗘 𝗛𝗜𝗥𝗜𝗡𝗚: 𝗚𝗥𝗔𝗣𝗛𝗜𝗖 𝗗𝗘𝗦𝗜𝗚𝗡𝗘𝗥 #NowHiring #graphicdesigner  #VirtualExpertsPH #SanJoseAntique,"Location: Cabasan Building, San Jose, Antique 🖥️ Work Setup: Full-Time | On-Site | Monday to Friday Virtual ...",graphic design trends
youtube,,https://www.youtube.com/watch?v=G9FhTp-_FcM,1759286493,트렌딩 HDR 4K | 액션 시퀀스 효과 | Photoshop SDC 편집 | CC + BP Drop #A380F #664 Netto Doch ,English (EN): Discover the latest video editing and graphic design trends! From new trending glowing effect video editing to ...,graphic design trends
youtube,,https://www.youtube.com/watch?v=qrYttfNC9wE,1759276874,Trendscapes 2025 From AI Ideation to Tactile Branding,An educational yet entertaining overview of emerging graphic design trends and practical takeaways for all levels. This episode ...,graphic design trends
youtube,,https://www.youtube.com/watch?v=m6YbRrxyp0U,1759260828,Alaa Hesham-Graphic Designer and Video Editor,"I am Alaa Hesham, a graphic designer and video editor with solid hands-on experience in graphic design, photography, and ...",graphic design trends
youtube,,https://www.youtube.com/watch?v=AwFv7KL4eOM,1759255221,Leaflet Design - Graphic Design full course Bangla Tutorial - গ্রাফিক্স ডিজাইন বাংলা টিউটোরিয়াল,কোর্স ফি - ২০০০ টাকা (প্রতি মাসে) [সকল ক্লাশ অনলাইন এ করানো হবে] বেজ ১: ...,graphic design trends
youtube,,https://www.youtube.com/watch?v=b_Dhhi8HuRc,1759239875,3D logo design in CorelDRAW | Easy logo design | Coreldraw tutorial | #viral @Aadi_Graphics,3D logo design in CorelDRAW | Easy logo design | Coreldraw tutorial | #viral @Aadi_Graphics your queries 3d logo design in ...,graphic design trends
youtube,,https://www.youtube.com/watch?v=dkdVC57TaV0,1759232547,트렌딩 HDR 4K | 꽃 색상 교체 | Photoshop SDC 편집 | CC + BP Drop #A380F #664 N.D YT,English (EN): Discover the latest video editing and graphic design trends! From new trending glowing effect video editing to ...,graphic design trends
