source,domain,url,created_utc,title,text,query
rss,uxdesign.cc,https://uxdesign.cc/designing-the-3-layers-of-ai-context-9a35a5f6e63a?source=rss----138adf9c44c---4,1766092821,Designing the 3 layers of AI context,"Designing the 3 layers of AI context

<div class=""medium-feed-item""><p class=""medium-feed-image""><a href=""https://uxdesign.cc/designing-the-3-layers-of-ai-context-9a35a5f6e63a?source=rss----138adf9c44c---4""><img src=""https://cdn-images-1.medium.com/max/2526/1*AC5KhEsCkrjnz5-MEBMlJg.png"" width=""2526"" /></a></p><p class=""medium-feed-snippet"">A UX framework for structuring library, conversation, and memory in LLM interfaces</p><p class=""medium-feed-link""><a href=""https://uxdesign.cc/designing-the-3-layers-of-ai-context-9a35a5f6e63a?source=rss----138adf9c44c---4"">Continue reading on UX Collective »</a></p></div>",
rss,uxdesign.cc,https://uxdesign.cc/keep-making-ai-will-not-save-you-402023b808fc?source=rss----138adf9c44c---4,1766060349,Keep making (AI will not save you),"Keep making (AI will not save you)

<div class=""medium-feed-item""><p class=""medium-feed-image""><a href=""https://uxdesign.cc/keep-making-ai-will-not-save-you-402023b808fc?source=rss----138adf9c44c---4""><img src=""https://cdn-images-1.medium.com/max/2388/1*4ZsibUXyomAMfufYXBeUgQ.png"" width=""2388"" /></a></p><p class=""medium-feed-snippet"">Why growing your conceptual abilities via sketching and idea generation will help you compete with AI and against AI.</p><p class=""medium-feed-link""><a href=""https://uxdesign.cc/keep-making-ai-will-not-save-you-402023b808fc?source=rss----138adf9c44c---4"">Continue reading on UX Collective »</a></p></div>",
rss,uxdesign.cc,https://uxdesign.cc/3-color-contrast-mistakes-designers-still-make-68cc224735b3?source=rss----138adf9c44c---4,1765973643,3 color contrast mistakes designers still make,"3 color contrast mistakes designers still make

<h4><em>WCAG color contrast is more than just text</em></h4><p>Most designers know the basics of web accessibility and color contrast. We’ve memorized that “normal text” (<a href=""https://www.w3.org/WAI/WCAG21/Understanding/contrast-minimum.html#dfn-large-scale"">24 CSS pixels and below</a>) needs to meet a 4.5:1 contrast ratio with its background, and “large text” (greater than 24 CSS pixels) needs to meet a 3:1 ratio.</p><p><strong>But WCAG (</strong><a href=""https://www.w3.org/WAI/WCAG21/Understanding/""><strong>Web Content Accessibility Guidelines</strong></a><strong>) color contrast requirements don’t stop at text.</strong> There are lesser known WCAG success criteria (or “rules”) that are still very important for inclusive design; these ensure interfaces are usable to users with low vision or color blindness.</p><figure><img alt=""Viewing YouTube’s homepage with different vision simulations, like red-green color blindness and sun-glare"" src=""https://cdn-images-1.medium.com/max/1024/1*-l5gevfqLDE88Ha5TisA6g.png"" /><figcaption>Viewing YouTube’s homepage with different vision simulations, like red-green color blindness</figcaption></figure><p>Some of these forgotten requirements circle around UI components, inline links, and data visualizations, which all have color contrast rules of their own. When these details are overlooked, users can’t tell what’s interactive, what’s linked, or what the data is actually saying (even if all the text uses accessible colors).</p><p>And these accessibility gaps aren’t edge cases. They show up in mature Design Systems, enterprise products, and well-intentioned designs because they live outside the accessibility standards designers tend to learn and adopt.</p><p>To avoid these gaps for the future, let’s go over 3 ongoing color contrast issues, how WCAG applies beyond text, and who exactly is impacted by color contrast.</p><blockquote><strong>Note</strong><em>: I reference WCAG 2.1, Level AA standards. If your product needs to comply with Level AAA, required color contrast ratios increase (i.e., </em><a href=""https://www.w3.org/WAI/WCAG21/Understanding/contrast-enhanced.html""><em>normal text needs a 7:1 ratio</em></a><em> with its background).</em></blockquote><h3>UI components that look accessible (but aren’t)</h3><p>WCAG criteria: <a href=""https://www.w3.org/WAI/WCAG21/Understanding/non-text-contrast.html"">SC 1.4.11: Non-Text Contrast (Level AA)</a></p><p>In plain english, this WCAG criteria requires that non-text UI elements that are interactive or communicate meaning have a <strong>minimum of 3:1 contrast ratio</strong> against adjacent colors (like the UI background).</p><p>But what is covered by “UI elements”? Basically, anything that a user can interact with or needs to see to use; such as:</p><ul><li>Buttons and button states</li><li>Form fields and their borders</li><li>Checkboxes, radio buttons, and toggles</li><li>Focus indicators</li><li>Icons that convey meaning or affordance</li></ul><figure><img alt=""Spirit includes text fields that do not meet contrast requirements with a 1.6:1 ratio"" src=""https://cdn-images-1.medium.com/max/1024/1*mzlbjZWOHK27EOSS3N1QaQ.png"" /><figcaption><a href=""https://www.spirit.com/flight-status""><em>Spirit</em></a><em> includes text fields that do not meet contrast requirements with a 1.6:1 ratio; calculated with </em><a href=""https://webaim.org/resources/contrastchecker/""><em>WebAim’s Contrast Checker</em></a></figcaption></figure><blockquote><strong>Important note</strong><em>: If color contrast fails WCAG standards from the Design System level, the failure is replicated across all product adopters; it’s critical to check system UI component’s color contrast.</em></blockquote><h4>What designers miss and why it matters</h4><p>This is where many designs that are intended to be accessible quietly fail. Since these UI elements don’t contain text, they’re excluded from color contrast checks. And yes, text is very important to check, but so are the UI elements that provide any product its functionality.</p><p><strong>Common gaps within UI elements include:</strong></p><ul><li>Input borders that blend into the product background</li><li>Custom focus indicators that rely on subtle color shifts instead of high-contrast</li><li>Icon-only controls (like buttons) that don’t meet contrast on their own</li></ul><p><strong>When UI elements lack minimum contrast, users can’t reliably:</strong></p><ul><li>Identify what’s interactive or understand UI component states (like hover)</li><li>Navigate interfaces using only their keyboard</li><li>Complete forms without repetitive errors</li></ul><figure><img alt=""BBC includes a primary CTA that meets contrast requirements with a 4.58:1 ratio"" src=""https://cdn-images-1.medium.com/max/1024/1*9lBpa8t8UhfH8HfsgOkvOQ.png"" /><figcaption><a href=""https://www.bbc.com/""><em>BBC</em></a><em> includes a primary CTA that meets contrast requirements with a 4.58:1 ratio; calculated with </em><a href=""https://webaim.org/resources/contrastchecker/""><em>WebAim’s Contrast Checker</em></a></figcaption></figure><h4>Who are the users impacted?</h4><p>Though low-contrast UI elements affect everyone at some capacity (you might have to do some squinting), they make products unusable to people like:</p><ul><li>Users with low vision who need distinct visual styling</li><li>Keyboard users who depend on focus indicators that stand-out on the UI</li><li>Older users experiencing reduced contrast sensitivity</li><li>Users in low-contrast environments (i.e., sun-glare, small screens, fluorescent lights)</li></ul><blockquote><strong>Note</strong><em>: To check a UI component’s contrast (or any element that needs contrast), you can also use </em><a href=""https://chromewebstore.google.com/detail/web-disability-simulator/olioanlbgbpmdlgjnnampnnlohigkjla?hl=en&amp;pli=1""><em>Web Disability Simulator</em></a><em> on any web page to simulate how it looks for users with color-blindness or cognitive disabilities.</em></blockquote><figure><img alt=""Red-green color blind simulation on YouTube with the Web Disability Simulator Chrome extension"" src=""https://cdn-images-1.medium.com/max/1024/1*QWZyIWC5rf7neuUBx-RhKQ.png"" /><figcaption><em>Red-green color blind simulation on </em><a href=""https://www.youtube.com/""><em>YouTube</em></a><em> with the </em><a href=""https://chromewebstore.google.com/detail/web-disability-simulator/olioanlbgbpmdlgjnnampnnlohigkjla?hl=en&amp;pli=1""><em>Web Disability Simulator</em></a><em> Chrome extension</em></figcaption></figure><h3>Data visualizations with low contrast</h3><p>WCAG criteria: <a href=""https://www.w3.org/WAI/WCAG21/Understanding/non-text-contrast.html"">SC 1.4.11: Non-Text Contrast (Level AA)</a></p><p>This accessibility gap references the same WCAG standard as UI components from above. But though data visualizations (data viz) may not always be interactive, they’re communicating meaningful information. Because of this, data viz must be perceivable without relying only on color and must meet a <strong>minimum 3:1 contrast ratio</strong> against adjacent colors.</p><p>This standard applies to:</p><ul><li>Chart lines, bars, and segments</li><li>Data points and markers</li><li>Axes, gridlines, or any reference lines that convey meaning</li><li>Legends or other visual keys</li></ul><figure><img alt=""Datylon includes a pie chart example that does not meet contrast requirements with a 1:1 ratio"" src=""https://cdn-images-1.medium.com/max/1024/1*1OTh5HfA1C-vKeF7ZsJWag.png"" /><figcaption><a href=""https://www.datylon.com/resources/chart-library/pie-chart""><em>Datylon</em></a><em> includes a pie chart example that does not meet contrast requirements with a 1:1 ratio; calculated with </em><a href=""https://webaim.org/resources/contrastchecker/""><em>WebAim’s Contrast Checker</em></a></figcaption></figure><h4>What designers miss and why it matters</h4><p>Data viz is an already complex and complicated UI element, so it’s even more difficult to bake in accessibility guidelines (especially if it’s being retrofitted). But color contrast issues are frequently found in charts and heatmaps that use the brand’s color palette rather than accessibility-tested colors.</p><p><strong>Common issues with data viz include:</strong></p><ul><li>Chart colors that are distinguishable in isolation but fail 3:1 contrast when touching one another</li><li>Data series using colors that aren’t distinguishable for color-blind users (i.e., red-green)</li><li>Thin gridlines with low contrast that disappear against the background</li><li>Charts that use multiple colors without secondary text indicators</li><li>Legends that depend on matching colors instead of labels or patterns</li></ul><p><strong>When data viz lack contrast and use color alone, users can’t:</strong></p><ul><li>Clearly and quickly understand trends in the data set</li><li>Confidently compare data without the feeling of guessing</li><li>Lose access to critical insights (especially when the data isn’t provided in another way)</li></ul><h4>Who are the users impacted?</h4><p>Again, all users are affected on some level by low contrast data viz. But other users need to be considered when designing the different types of charts so they can perceive and comprehend the same information as everyone else.</p><p>Some of these users include:</p><ul><li>Color-blind users (especially those with red-green color blindness)</li><li>Users with low vision who need high contrast for visual distinction</li><li>Users with cognitive disabilities who benefit from redundant cues</li><li>Users viewing charts on small screens or in poor lighting</li></ul><figure><img alt=""IBM Carbon includes a pie chart example that meets contrast requirements with a 7.76:1 ratio"" src=""https://cdn-images-1.medium.com/max/1024/1*_Gsff7Yx_6gvh6DmjX7Djg.png"" /><figcaption><a href=""https://carbondesignsystem.com/data-visualization/simple-charts/#pie""><em>IBM Carbon</em></a><em> includes a pie chart example that meets contrast requirements with a 7.76:1 ratio; calculated with </em><a href=""https://webaim.org/resources/contrastchecker/""><em>WebAim’s Contrast Checker</em></a></figcaption></figure><blockquote><strong>Note</strong><em>: Simply by adding a white border between data viz elements, the colors become more distinguishable and meet accessibility guidelines.</em></blockquote><h3>Inline links that rely on low contrast color</h3><p>WCAG criteria: <a href=""https://www.w3.org/WAI/WCAG21/Understanding/use-of-color.html"">SC 1.4.1: Use of Color (Level A)</a></p><p>Color cannot be the only visual means used to indicate a link on a web page. But not only that, inline links also must have <strong>at least 3:1 contrast</strong> against surrounding body text to be distinguishable (especially when the link doesn’t have an additional visual cue, <a href=""https://www.w3.org/TR/WCAG20-TECHS/F73.html"">like an underline or bold font weight</a>).</p><figure><img alt=""Atlanta’s Department of Transportation includes inline links that do not meet contrast requirements with a 1.58:1 ratio"" src=""https://cdn-images-1.medium.com/max/1024/1*k_84e7wKBM0IOAXis1ljeA.png"" /><figcaption><a href=""https://atldot.atlantaga.gov/""><em>Atlanta’s Department of Transportation</em></a><em> includes inline links that do not meet contrast requirements with a 1.58:1 ratio; calculated with </em><a href=""https://webaim.org/resources/contrastchecker/""><em>WebAim’s Contrast Checker</em></a></figcaption></figure><h4>What designers miss and why it matters</h4><p>Inline links are such simple and subtle UI components; it’s easy to miss the checks needed to ensure accessibility. Designers typically think that since a paragraph of text meets the 4.5:1 color ratio requirement, any inline link using the same text color within the paragraph also passes. Since links are interactive elements, they have additional guidelines other than passing the color requirements for text.</p><p><strong>Frequent issues with inline links include:</strong></p><ul><li>Links that are differentiated only by an underline when the link receive mouse hover or keyboard focus</li><li>Link colors that meet contrast against the background, but not against adjacent text</li><li>Underlines removed for aesthetic or simplicity reasons</li></ul><p><strong>When inline links aren’t clearly distinguishable, users can’t:</strong></p><ul><li>Easily comprehend what’s interactive (especially when hidden in body copy)</li><li>Efficiently navigate a website or product page</li><li>Find important actions or information they need to complete a task</li></ul><h4>Who are the users impacted?</h4><p>I’ve said it before, and I’ll say it again… this affects all users at some capacity. Inline links are not as recognizable to any user when the underline affordance or high contrast color is taken away. But for some users, it becomes impossible to identify links that could lead the user to information or product pages they need.</p><p>Users to consider when designing inline links include:</p><ul><li>Color-blind users who may not perceive color differences</li><li>Users with low vision who require visual affordances with high contrast</li><li>Users with cognitive disabilities who benefit from consistent patterns</li><li>All users scanning content quickly</li></ul><blockquote><strong>Note</strong><em>: A simple rule of thumb is to make a link look like a link for optimal usability and accessibility.</em></blockquote><figure><img alt=""Gov.UK includes inline links that meets contrast requirements with a 3.81:1 ratio AND are underlined"" src=""https://cdn-images-1.medium.com/max/1024/1*3rOPtaAXaJBwGlfl3wKXcg.png"" /><figcaption><a href=""https://www.gov.uk/how-to-have-your-benefits-paid""><em>Gov.UK</em></a><em> includes inline links that meets contrast requirements with a 3.81:1 ratio AND are underlined; calculated with </em><a href=""https://webaim.org/resources/contrastchecker/""><em>WebAim’s Contrast Checker</em></a></figcaption></figure><p><strong>UI components, inline links, and data visualizations often fall outside the mental checklist of color contrast and accessible design.</strong> WCAG covers these elements, but it’s often overlooked when focusing on adequate contrast for text. This leads to websites and interfaces that look high contrast, but are near impossible to use for some user groups.</p><p>By spreading awareness to these accessibility gaps, we can expand how we define color contrast and better apply ideal accessibility practices. When these requirements are built into components, patterns, and Design Systems from the start, accessibility stops being a last-minute fix (or remediation plan) and becomes part of the design process.</p><img alt="""" height=""1"" src=""https://medium.com/_/stat?event=post.clientViewed&amp;referrerSource=full_rss&amp;postId=68cc224735b3"" width=""1"" /><hr /><p><a href=""https://uxdesign.cc/3-color-contrast-mistakes-designers-still-make-68cc224735b3"">3 color contrast mistakes designers still make</a> was originally published in <a href=""https://uxdesign.cc"">UX Collective</a> on Medium, where people are continuing the conversation by highlighting and responding to this story.</p>",
rss,uxdesign.cc,https://uxdesign.cc/designing-product-delighters-people-remember-and-share-d7efd29a0379?source=rss----138adf9c44c---4,1765926245,Designing product delighters people remember and share,"Designing product delighters people remember and share

<div class=""medium-feed-item""><p class=""medium-feed-image""><a href=""https://uxdesign.cc/designing-product-delighters-people-remember-and-share-d7efd29a0379?source=rss----138adf9c44c---4""><img src=""https://cdn-images-1.medium.com/max/2400/1*84iOQ9FdVgC9tWmJ8CFW3Q.png"" width=""2400"" /></a></p><p class=""medium-feed-snippet"">Why moments like Spotify Wrapped get shared everywhere, and how products like Figma and Duolingo design small delights</p><p class=""medium-feed-link""><a href=""https://uxdesign.cc/designing-product-delighters-people-remember-and-share-d7efd29a0379?source=rss----138adf9c44c---4"">Continue reading on UX Collective »</a></p></div>",
rss,uxdesign.cc,https://uxdesign.cc/your-users-dont-need-training-they-need-scaffolding-10acd8270022?source=rss----138adf9c44c---4,1765926230,Your users don’t need training. They need scaffolding.,"Your users don’t need training. They need scaffolding.

<div class=""medium-feed-item""><p class=""medium-feed-image""><a href=""https://uxdesign.cc/your-users-dont-need-training-they-need-scaffolding-10acd8270022?source=rss----138adf9c44c---4""><img src=""https://cdn-images-1.medium.com/max/612/1*npJoMqO-8IJw23_qkfAdXQ.jpeg"" width=""612"" /></a></p><p class=""medium-feed-snippet"">Get new users doing instead of learning</p><p class=""medium-feed-link""><a href=""https://uxdesign.cc/your-users-dont-need-training-they-need-scaffolding-10acd8270022?source=rss----138adf9c44c---4"">Continue reading on UX Collective »</a></p></div>",
rss,uxdesign.cc,https://uxdesign.cc/why-cleaner-design-slides-arent-the-answer-to-getting-your-team-to-buy-in-1ccb203e29a0?source=rss----138adf9c44c---4,1765887256,Why cleaner design slides aren’t the answer to getting your team to buy in,"Why cleaner design slides aren’t the answer to getting your team to buy in

<div class=""medium-feed-item""><p class=""medium-feed-image""><a href=""https://uxdesign.cc/why-cleaner-design-slides-arent-the-answer-to-getting-your-team-to-buy-in-1ccb203e29a0?source=rss----138adf9c44c---4""><img src=""https://cdn-images-1.medium.com/max/2600/1*LLl1zhFwWMQQAivmOpIpoQ.jpeg"" width=""6000"" /></a></p><p class=""medium-feed-snippet"">Information is cheap, but attention is expensive: why design presentations fail</p><p class=""medium-feed-link""><a href=""https://uxdesign.cc/why-cleaner-design-slides-arent-the-answer-to-getting-your-team-to-buy-in-1ccb203e29a0?source=rss----138adf9c44c---4"">Continue reading on UX Collective »</a></p></div>",
gnews,news.google.com,https://news.google.com/rss/articles/CBMickFVX3lxTE1rMHNBX1V5VHEyLThjeFN4LTFqd0FnWWY1eTRGNnhOdXV4NGlmWGxQby0zWWJQdklOSzRXV3FtNGUtdllkVXB5bW0wUzU2cDNGRW1MV2hpNXVDSzdHb0ZCaTJfQ2JlT2pPOE9DTTAxSzZhUQ?oc=5,1766137092,Decoding China’s “New Ugly” Graphic Design: The Rise of Intentional Imperfection - RADII,Decoding China’s “New Ugly” Graphic Design: The Rise of Intentional Imperfection - RADII,graphic design trend
gnews,news.google.com,https://news.google.com/rss/articles/CBMihwFBVV95cUxQRS15aDM5dnZfZjRFR3lBVGw4RWZ4UTBBMWl0ZDlTQTdlWmxiSmszVVU0aGNVMnRfdnY0N1RsNmJUWktXNVEyWmcwME1yVS14N2gyVkhKWVlNVkJVNXdYdFE5bE43SndJR0NNUXdKN1V4YlZEUHpVN2dMX04zajNHOG9pUDlmaVE?oc=5,1765353600,"Graphic design - 20th Century, Typography, Visual Communication - Britannica","Graphic design - 20th Century, Typography, Visual Communication - Britannica",graphic design trend
gnews,news.google.com,https://news.google.com/rss/articles/CBMimwFBVV95cUxQMk9URjRjTmt6a3BUN3Atd21XdnhENU4xUUEtMUZDXzRRZ24wcGRjb01JeVlFN2dXeFBiUHVYSmtqeWx5SFVaeXZaaHZqRmticG9SZnJZZm1tcDdBbkVHSVg3Q1poLUV5SkxRZzA4YUFmcjAyWVZlVWVsMGFCcEhmTVUwV1hzOGhPd05ZLUpDeXZUMl9SUXlRVzBzMA?oc=5,1765870350,Adobe's creative trends report embraces the silliness of AI - Creative Bloq,Adobe's creative trends report embraces the silliness of AI - Creative Bloq,graphic design trend
gnews,news.google.com,https://news.google.com/rss/articles/CBMidEFVX3lxTFBGVVJ2cDZhaVlBVkhTeGRDSEVBaG00UTNZR0lNdjRUZHpiMDRWOElLa3dNek9mNW1KWDBCQ1l6Slo0VzlQMGpjT3Q2Q212R1UwSUNNbWtvTVR3SkEyZzJYQ1FTWmdHaTJyZWRkOGJrbTBoVk54?oc=5,1765905976,Which Visual Trend Needs to Die in 2026? - Little Black Book | LBBOnline,Which Visual Trend Needs to Die in 2026? - Little Black Book | LBBOnline,graphic design trend
gnews,news.google.com,https://news.google.com/rss/articles/CBMiaEFVX3lxTE5XY0RHaHRyT2hIMG4yYVI0Q05MSDBHUDdUM0I1ZXQxMnBsRXRlV21Zb3RIeFdNN2o0TGltUUpBenhxVWNza09OTUJHVloxZFhENEF4UHRDekgxTTZoeVdKR3lad1FvZEVw?oc=5,1765353600,Graphic Design Trends : What's Hot [2026] - Simplilearn.com,Graphic Design Trends : What's Hot [2026] - Simplilearn.com,graphic design trend
gnews,news.google.com,https://news.google.com/rss/articles/CBMirAFBVV95cUxNajdCYkxpOXhqYWtiTXQ5cFBVdlpYd1BhME5zOTN0VWc5NjllNzkyQWxLR0xpZVNEUG9nNFVfZnN6VlRjV3BEUWU3MkZtSUVDWVFCQTdIbFBBaG5YVVZTbXJmT182Zy0zX2lBVEZFT2E5ajR1cjQ1VWZ3OGhoNV8zbHhOdWQtNnNxM3k4R09fdlV0QVZ6ckVXdm1tMEY5WVhVbWRfUHRjcnhFWHZN?oc=5,1763971200,People instead of algorithms – 10 graphic design trends for 2026 - Organisator,People instead of algorithms – 10 graphic design trends for 2026 - Organisator,graphic design trend
gnews,news.google.com,https://news.google.com/rss/articles/CBMifkFVX3lxTE9iT0dnQ2o3alBOUDlvT180S2dYbng5REJHSGF4V3pISzJqVWJPVHYwUFh3RnNHYTZmald0T00tVk45OVRqS1o0bDZ0c0dFSXF1T3FLMUNlUWFJRWt6RnctcV83eFZhT2JlMGM2SW0yQllXVTU2eW9SY1RCcGJKZw?oc=5,1765981080,91% of Users Demand Better UX: What Your Brand Must Do in 2026 - DesignRush,91% of Users Demand Better UX: What Your Brand Must Do in 2026 - DesignRush,web design trend
gnews,news.google.com,https://news.google.com/rss/articles/CBMiUkFVX3lxTE1MZDF0dGdEUFFSLUxZRjF4QVNzWlF2RTBUaXlCdHp0N04zQWc4VmlKaktyVmdsRUV6eVBMZTFFTnhYa0lDTmZZanc3ZVpNc1NxNVE?oc=5,1763539200,How Card UI Patterns Dominate Web Design - Designmodo,How Card UI Patterns Dominate Web Design - Designmodo,web design trend
gnews,news.google.com,https://news.google.com/rss/articles/CBMiWEFVX3lxTE9WbUM4MjM5dVlyWnZ1M3ZuemUwMVE3ckk3UnNYZmc0WUdCcW9uSzBhMmxla0FkU25RSVJlTlJCWnd4X2ZHSkhlMWRHQUhwSEE0RmNUN05zWHM?oc=5,1763366400,Top 10 Frontend Trends in 2025 - Netguru,Top 10 Frontend Trends in 2025 - Netguru,web design trend
gnews,news.google.com,https://news.google.com/rss/articles/CBMiU0FVX3lxTFBLcFRsY3QzeDNvZUstLVdncV8xUUFaNmcwYUlLZENYOThJaXJYQ0VkZ3Q1UTZxWGVVTDNRZXFEREd5MzN5OHdjc2xkN3IxXzNndEpr?oc=5,1763539200,Fresh Trend in Navigation: Full-Screen Menus - Designmodo,Fresh Trend in Navigation: Full-Screen Menus - Designmodo,web design trend
gnews,news.google.com,https://news.google.com/rss/articles/CBMiT0FVX3lxTE1HV2ppY1oySC1FZEM0S1h3QXkzMlUxYS1KV2JrVTNnZ0RlcEw4QjQ5YThRZFkyc0hBdDhRU280a3k0b182bndjZXFvMUlVQkk?oc=5,1763539200,Tabbed Widgets in Web Design: UI Examples & Free Plugins - Designmodo,Tabbed Widgets in Web Design: UI Examples & Free Plugins - Designmodo,web design trend
gnews,news.google.com,https://news.google.com/rss/articles/CBMisgFBVV95cUxPM0kweW1QNENpcHdNZEpPM0dZcWg1dUd1Uzl1cE9NY2prX1V6d1Jkdl9TeV9TUDRVVWNNc2YtWVRBd1FPSm5LNWVzTnFZOF91RFFUZktvZUJ6Z29wWk5RM0JzZ2V6OHVEZzZHbjAwamgzdVJqazJBY3VrU0d4d1ZRcVBWT2lVTG0yRE5weS1JMXBIQzhqZkRMUE8zOWFqb2RFaFBRa0VSQy1femltaE5zZVFn?oc=5,1766210744,"What is the yellow font trend, and why is is all over TikTok? - Creative Bloq","What is the yellow font trend, and why is is all over TikTok? - Creative Bloq",typography trend
gnews,news.google.com,https://news.google.com/rss/articles/CBMiSkFVX3lxTFBTb21zbzJmbWdrMk5YUlQ4YWlmc19BS2dPNWtrdU5iYUZNRmNLcVNNQ2ExMngtN25rNlBya2QycVBoQkIyX0JkSjdn?oc=5,1763539200,"Free Fonts You’ll Want to Use Now, Trends and Examples - Designmodo","Free Fonts You’ll Want to Use Now, Trends and Examples - Designmodo",typography trend
gnews,news.google.com,https://news.google.com/rss/articles/CBMirgFBVV95cUxOXy1kaUdpX2JmMDBIY3BWU2xScjhOYjJPMTBnVmlERVJ3QThIcWZXd2NOLWFSaXZoYUZsNFczbmF1U2dheDBBckdCM3g0aVBhMXhDbTVmNkNBTmdmR05UdkNYcHduaE9KbG5MS09NSVBFR3dHNVBZOTE4UFU1S1Z6WWwwcjI1eXBXLV92dENUNW82MEsxcXUzODMycndsaDRWNnhrQVlfUXNVa01LT1E?oc=5,1763452800,"Is it just me, or is this font suddenly everywhere? - Creative Bloq","Is it just me, or is this font suddenly everywhere? - Creative Bloq",typography trend
