source,query,url,created_utc,title,text
youtube,beauty trends,https://www.youtube.com/watch?v=PZ4-thtUpCc,1775125721,katseye members and their beauty trends !!!!!!#skz_felix-c4t#katseye#idols#shorts#fypシ#subscribe#sub,
youtube,beauty trends,https://www.youtube.com/watch?v=irOy1EN8gUE,1775118950,Cắt chia phấn Nars #makeup #lamdep #xuhuong,
youtube,beauty trends,https://www.youtube.com/watch?v=gF_lScgbG8M,1775105684,Ели такую красоту? #тренды,
youtube,beauty trends,https://www.youtube.com/watch?v=ZMgfIF58Lcg,1775102425,Soft Pretty Hands + Full Korean Lips ✨ Hand &amp; Lip Beauty Tips ✨️,Soft Pretty Hands + Full Korean Lips ✨ Hand & Lip Beauty Tips : Want soft pretty hands and full Korean style lips? ✨ In this ...
youtube,beauty trends,https://www.youtube.com/watch?v=sJ8TgCo8D98,1775096017,SKINCARE THEO NGƯỜI KHÁC - ĐÚNG HAY SAI???,Skincare không phải trend… mà là hiểu da mình Đừng để routine của người khác phá da bạn nha! Bạn thuộc team nào: ...
youtube,beauty trends,https://www.youtube.com/watch?v=qyGpZMPzSLk,1775091863,#shorts #beautyportrait #closeupphotography #beautyphotography #beautytrends #classicbeauty,"Beauty photographers, what the same beauty for your photos? I can help you! Attention for every detail is guaranteed   ..."
youtube,beauty trends,https://www.youtube.com/watch?v=FyMQvWgutMs,1775089822,What are out thoughts?? #pinkpowder #trending #makeuptrends #beautytrends #settingpowder,What are out thoughts?? #pinkpowder #trending #makeuptrends #beautytrends #settingpowder.
youtube,beauty trends,https://www.youtube.com/watch?v=qh6SB-uu91w,1775089309,Childhood Stolen by Beauty Trends #2026 #islamicshorts #religion #ij113gb #islamicreminder #like,
youtube,beauty trends,https://www.youtube.com/watch?v=15b09ZKi178,1775088608,ترندات تجميل مختلفه هتوفرلك فلوسك,
youtube,beauty trends,https://www.youtube.com/watch?v=FjshJqbiLOM,1775082392,Stay with me now bangstutorial #Shorts #yourdreamgur1,"Stay with me now bangstutorial Stay with me now bangstutorial Stay with me now bangstutorial Welcome to a world of beauty, ..."
youtube,beauty trends,https://www.youtube.com/watch?v=qxv1OraBmg8,1775077411,1985 Avon Catalog #1980s #80s #makeup #beauty #vintage #beautyproducts #avon #nostalgia #trends,
youtube,beauty trends,https://www.youtube.com/watch?v=-Chws7bVsq8,1775075339,Арт на вб (копировать вместе с буквами WW): #WW291649 #trends #обзорывб #beauty #юмор,
youtube,beauty trends,https://www.youtube.com/watch?v=PA1AuGcYgK0,1775072897,Let’s break down the beauty trends and start say the truth #beautytreatment #viral #fakeeyelashes,
youtube,beauty trends,https://www.youtube.com/watch?v=JDp4q7rqF7o,1775055619,Ranking the NEWEST Viral Makeup Trends! 💄✨ #makeupinspo   #trendingbeautytips   #shorts,"Welcome back   We are diving into the freshest and most viral makeup trends of the season. From ""dewy glass skin"" to the latest ..."
youtube,beauty trends,https://www.youtube.com/watch?v=eITnfaS4Nx8,1775052908,Azfar Rehman Talks About Botox &amp; Modern Beauty Trends| 365 Entertainment,365newspk #365entertainment #NadiaKhan #riseandshine #azfarrehaman Azfar Rehman Talks About Botox & Modern Beauty ...
youtube,beauty trends,https://www.youtube.com/watch?v=qnbQEyVWUr8,1775052503,Different Beauty trends,
youtube,beauty trends,https://www.youtube.com/watch?v=qTNCgBXejO8,1775051567,Revolutionary Chinese Style Cheongsam: Unveil the Beauty of Shangqiu&#39;s New Designs,Discover the latest Chinese-style hanging-neck cheongsams from Shangqiu. Uncover the allure of traditional beauty with a ...
youtube,beauty trends,https://www.youtube.com/watch?v=YWY_ULvQkEM,1775050388,Коричневая блузка  арт #776447496 #красота #блузка #валберис #покупки #тренды #юмор,
youtube,beauty trends,https://www.youtube.com/watch?v=f1l1d3OvwSA,1775048178,Longyan Hair Reception: Feather Hair Extensions Unveiled,Discover the allure of feather hair extensions at our Longyan hair reception! Elevate your style effortlessly Join us at the Longyan ...
youtube,beauty trends,https://www.youtube.com/watch?v=gzWam8SLq9g,1775046698,Polka Dot Nails #nails #nailart #nailinspo #naildesign #polkadotnails #polkadot #beautytrends #nail,
youtube,beauty trends,https://www.youtube.com/watch?v=hnKqV9041Gs,1775044856,GLOW UP MAGIC! ✨🎀 Mind-Blowing Beauty Trends &amp; Hair Makeovers by 123 GO!,"Is it magic or just genius?! ✨   Today on 123 GO! Planet, we're taking the ""glow up"" to a whole new level! From boring hair to ..."
youtube,beauty trends,https://www.youtube.com/watch?v=eU5yIip9PT0,1775041243,Viral Gold Hair Chain 😍 Luxury Hair Jewelry Trend 2026 ✨ Bridal Hair Hack #Shorts,This stunning gold hair chain jewelry is the latest viral beauty trend of 2026 ✨ A perfect hair accessory for long hair that gives a ...
youtube,beauty trends,https://www.youtube.com/watch?v=UxELpV6BD_A,1775037739,Wishcare moisturizer #shorts #youtubeshorts #explore #exploremore #viral #viralreels #beauty #trends,
youtube,beauty trends,https://www.youtube.com/watch?v=zy__adeJYiI,1775030955,Top Beauty Hack: Essential Wig Replacement Tool for Alluring Locks,WigReplacement HairTools BeautyEssentials HairCare Wigs BeautyTrends HairStyling ElegantLook Lifestyle HairReplacement ...
youtube,beauty trends,https://www.youtube.com/watch?v=6ilewy7ddJc,1775017803,😎🤙❤️ #youtube #youtubeshorts #love #viral #beautytrends #youtuber #oldphotos #viralcontent #shorts,glowgirldiaries99 #BeautyReel #ReelEdits #Viral #BeautyEdits #ViralBeauty #ReelBeauty #EditingMagic #FYP #Trendingnow ...
youtube,skincare routine trend,https://www.youtube.com/watch?v=ylKjLSXA9Vk,1775106995,Love being a dermatologist… it truly feels like living a little fairy tale🧚‍♀️ #skincare #shortvideo,"Love being a dermatologist… it truly feels like living a little fairy tale ‍♀️✨ Dressing up for work because aesthetics is our vibe, ..."
youtube,skincare routine trend,https://www.youtube.com/watch?v=sJ8TgCo8D98,1775096017,SKINCARE THEO NGƯỜI KHÁC - ĐÚNG HAY SAI???,Skincare không phải trend… mà là hiểu da mình Đừng để routine của người khác phá da bạn nha! Bạn thuộc team nào: ...
youtube,skincare routine trend,https://www.youtube.com/watch?v=ewdB54wKz8Q,1775077722,Skincare Routine Men’s Today #beard #adi #youtube #viral #shorts  #usa #uk #trend,Skincare Routine Men's #beard #adi #youtube #usa #uk #shorts #short #viral #trend.
youtube,skincare routine trend,https://www.youtube.com/watch?v=KRNMDxwc31Y,1775062674,just an important reminder 💌 #acne #skincare #trending #skincareroutine #viral,
youtube,skincare routine trend,https://www.youtube.com/watch?v=qLhum8ANtr4,1775057433,Treat Stubborn Acne at Home #easyrecipe #youtubeshorts #skincareroutine,Treat Stubborn Acne at Home Related Tags; stubborn acne marks treatment stubborn acne stubborn acne treatment stubborn ...
youtube,skincare routine trend,https://www.youtube.com/watch?v=wEDunSwN-z4,1775053107,This ‘7-Day Glow’ Trend Needs a Reality Check 🚨,"When every product gives “instant results,” it's time to question what's real Know how skincare actually works — watch till the ..."
youtube,skincare routine trend,https://www.youtube.com/watch?v=VFdOjyT5T70,1775052120,Glow Skin in 10 Days 😍 | Easy Home Remedy #skincare #ytshorts #shorts #newyoutuber #shortsviral,Glow Skin in 10 Days | Easy Home Remedy #skincare #ytshorts #shorts #newyoutuber #shortsviral This is my first face video ...
youtube,skincare routine trend,https://www.youtube.com/watch?v=dX5zh9uQ8I8,1775052046,Don&#39;t jump into the next skincare trend #skincare #ataiimdskincare #skincareroutine,Shop at ataiimdskincare.com.
youtube,skincare routine trend,https://www.youtube.com/watch?v=fBTVop1rVUY,1775044637,Hy Cutie&#39;s 🫶🏻💗🎀 #skincare #tipsbypinks #minivlog #skincareroutine #tips #shortvideo #shorts,shortvideo #skincare #tipsbypinks #minivlog #skincareroutine #tarot #tips #trending #trendingshorts #travel #trend #craft #shorts ...
youtube,skincare routine trend,https://www.youtube.com/watch?v=vQjF_mgH6NU,1775043827,Hailey Bieber just made a new skincare trend! 🙆🏻‍♀️,Kinpur hair mask is available on Amazon! #haileybiebers #hailey #rhode #skincare #skincareroutine #skincaretips.
youtube,skincare routine trend,https://www.youtube.com/watch?v=XdCYRHEXkAA,1775024165,How to know your skin type 👍🏻#skincare #tipsandtricks #yutubeshorts #trend #beauty #skincareroutine,
youtube,skincare routine trend,https://www.youtube.com/watch?v=6jbn1WV_0FU,1775020812,Best Suppliment For Brides #shorts #ytshorts #trending #viral #youtubeshorts #youtube #trend #bride,"Best Suppliment For Brides Disclaimer - I am not a dermatologist, The information provided in this video is based on my personal ..."
youtube,skincare routine trend,https://www.youtube.com/watch?v=x5yi_PYIhGQ,1775019064,Stop following this Hailey Bieber Rhode skincare trend 🤦‍♀️,"hailey beiber rhode skin night cream K-beauty, korean skincare, skincare, sephora kbeauty, ulta beauty olive young #kbeauty ..."
youtube,skincare routine trend,https://www.youtube.com/watch?v=Ec4HyuwlTKI,1774994548,||Skincare routine before church|| #foryou #trend #viralvideo #fyp,
youtube,skincare routine trend,https://www.youtube.com/watch?v=a7uLd4Kvi38,1774994119,Desc ::🛍️:: #preppy #ViralVideo #trend#skincare #grwm #fyp #shorts #viral #youtubeshorts #lifestyle,ib: @vlogsby_stellaa go sub! : emoji combo: ​⁠​⁠@ go sub! : collab w/ ​⁠ ​⁠@fiImed.by.k go sub! : audio ib: ...
youtube,skincare routine trend,https://www.youtube.com/watch?v=twphJDY-cx4,1774990196,glass skin is like a trend rn 😭 #skinglow #skincareroutine #brightskin #glowup,
youtube,skincare routine trend,https://www.youtube.com/watch?v=C-QgOAdkNfA,1774981879,#sephora #makeup #beauty #skincare #glow #routine #fyp #viral #trend #foryou #selfcare #abc,
youtube,skincare routine trend,https://www.youtube.com/watch?v=tZNCiM2dS9g,1774980035,Skincare #yt #skincareroutine #skincareproducts #chemistatplay #viralvideo #trend #youtube #shorts,"youtube shorts, youtube youtube, mini vlog songs, skincare shorts, skincare asmr, skincare shopping, skincare videos, skincare ..."
youtube,skincare routine trend,https://www.youtube.com/watch?v=mHd8W1uhXYM,1774979529,BIOTIQUE’s sunscreen review ☀️ #productreview #sunscreen #summer  #skincare #trend #viral #shorts,Get yours now!! #ad #skincare #skincareroutine #skincaretips #tips #summerspecial.
youtube,skincare routine trend,https://www.youtube.com/watch?v=9e5i_vlqGgA,1774978570,#hair #elvive #haircare #beauty #routine #shine #healthyhair #viral #fyp #foryou #trend #glowup #abc,
youtube,skincare routine trend,https://www.youtube.com/watch?v=9-7JcB7S6Fg,1774976450,Glow from within ✨ #glowingskin  #shorts #trending,shortvideo #shorts #explore #trending #viral #makeup #glam #ytshorts #trend #transition #glowingskin.
youtube,skincare routine trend,https://www.youtube.com/watch?v=aVWxRukwD84,1774976053,vitamin c serum used for daily glow ✨ derma co  #skincare #fyp  #dermatologist,the derma Co vitamin c serum used for daily glow ✨ dark and unglowing skin work acne marks darkness fades 10% vitamin c ...
youtube,skincare routine trend,https://www.youtube.com/watch?v=FzgotPO0cCY,1774967400,Morning skincare Part 2 #shortsfeed #shorts #trending #fyp #skincare #skincareroutine #makeup #skin,Morning skincare Part 2 #shortsfeed #shorts #trending #fyp #skincare #skincareroutine #makeup #skin #skincaretips ...
youtube,skincare routine trend,https://www.youtube.com/watch?v=Ry7yXJV8AE4,1774962661,Sunday Skincare Routine 🎀#shorts #youtubeshorts #glowingskin #skincareroutine #viral #trending,Sunday Skincare Routine #shorts #youtubeshorts #glowingskin #skincareroutine #viral #trending @radhatrisha #shortsfeed ...
youtube,skincare routine trend,https://www.youtube.com/watch?v=8ho_8ykwP0A,1774962000,This Trend Is WILD 😭💖,
youtube,makeup trend 2025,https://www.youtube.com/watch?v=obxPlctaWVI,1775093400,bridal makeup look 😍💗 #pmdesigner #viral #fashion,bridal makeup look #pmdesigner #viral #fashion . . . . . . . follow My channel support me ...
youtube,makeup trend 2025,https://www.youtube.com/watch?v=uIcWFQNvVno,1775051696,Full Bridal Makeup &amp; Hairstyle Step by Step | Indian Bridal Look 2025 | Radhika Thakkar,POV: Your wedding morning in the hands of an artist No stress. No panic. Just pure transformation energy ✨ This stunning ...
youtube,makeup trend 2025,https://www.youtube.com/watch?v=OjXwSOKkfUA,1774982351,#eyeshadow #makeup##makeuptutorial #2025#trending #short,
youtube,makeup trend 2025,https://www.youtube.com/watch?v=oxlw5UyoYjw,1774967400,No makeup look..😌 #trending #makeup #khushinigam #youtubeshorts #viral #shorts #makeupartist,No makeup look..   #trending #makeup #khushinigam #youtubeshorts #viral #shorts #makeupartist #shortsfeed #shorts #short ...
youtube,makeup trend 2025,https://www.youtube.com/watch?v=xQPLPpCuBWE,1774915200,Autumn Winter 2025 26 Front-Row Preview,"A concise look at the upcoming autumn winter 2025 26 trends. It covers key clothing styles, makeup looks, and styling tips to stay ..."
youtube,makeup trend 2025,https://www.youtube.com/watch?v=QDQblNYuht8,1774889631,create a cute look ✨ #makeup #wedding #love #fashion #bride #bridalmakeup #mua #ytshorts #ytviral,soft makeup look ✨ idea Jodha Akbar serial song in aankho me tum jab se hogaye gum #trending​ #jodhabai​ ...
youtube,makeup trend 2025,https://www.youtube.com/watch?v=JY0r9H3UXVQ,1774713615,Ranking The BEST Celebrity Makeup Trend! (no.1 is insane🤯),"Ranking The BEST Celebrity Makeup Trend! (no.1 is insane  ) I remix viral moments, crazy reactions, and standout clips by ..."
youtube,makeup trend 2025,https://www.youtube.com/watch?v=M3fx9ceZKe4,1774710562,#eyeshadow #makeup##makeuptutorial #2025#trending #short,
youtube,makeup trend 2025,https://www.youtube.com/watch?v=GLiEMYEtcp0,1774699227,Normal makeup look transition 🤯 #shorts,Normal makeup look transition #shorts YOUR QUERIES:- power of makeup the power of makeup power of makeup (poppy ...
youtube,makeup trend 2025,https://www.youtube.com/watch?v=SZsYUgRQMNA,1774616558,A 2025 Frankenstein inspired makeup look.,"As Frankenstein (2025) walked away with the Oscar win for best makeup, I decided to give the makeup look a try for myself."
youtube,makeup trend 2025,https://www.youtube.com/watch?v=hOmrZMzG2e8,1774609200,Soft makeup looks on sarrhi white and gold makeup shorts #makeup #sarri #wajidkhanmua #youtubeshorts,Soft makeup looks on sarrhi white and gold makeup shorts #makeup #sarri #wajidkhanmua #youtubeshorts Queries discuss in ...
youtube,makeup trend 2025,https://www.youtube.com/watch?v=7HL5NteWDkY,1774599738,#muslimbridalmakeup #look #2025 #reelvideo #yoytubeshorts,
youtube,makeup trend 2025,https://www.youtube.com/watch?v=hPpEVuooUCY,1774576834,power of makeup 💄 #shorts,power of makeup #shorts YOUR QUERIES:- power of makeup the power of makeup power of makeup (poppy playtime) the ...
youtube,makeup trend 2025,https://www.youtube.com/watch?v=_ABLWC761Fs,1774521325,Habibi makeup transition trend📈#trendingreels #trendingshorts #2026 #viralvideo #transition,
youtube,makeup trend 2025,https://www.youtube.com/watch?v=fjtfBT8dKzI,1774492200,2025🆚2026 Korean Blush hack ✨♥️#makeup#trending#viral#viralvideo#shortsmakeup#shorts,2025  2026 Korean Blush hack ✨♥️#makeup#trending#viral#viralvideo#shortsmakeup#shorts.
youtube,makeup trend 2025,https://www.youtube.com/watch?v=Ks93NCyuUXY,1774454437,Ranking BEST Unrecognizable Makeup TREND #shorts #tiktok #makeuptransformation,Unrecognizable Makeup - Rank That are taking over the beauty world with viral impact. This trend showcases extreme makeup ...
youtube,makeup trend 2025,https://www.youtube.com/watch?v=gguwHcAvRr8,1774425640,Best chinese hanfu makeup transition 🤯 #shorts,Best chinese hanfu makeup transition #shorts YOUR QUERIES:- power of makeup the power of makeup power of makeup ...
youtube,makeup trend 2025,https://www.youtube.com/watch?v=UamXO-RWfCc,1774366231,Normal makeup look transition 🤯 #shorts,Normal makeup look transition #shorts YOUR QUERIES:- power of makeup the power of makeup power of makeup (poppy ...
youtube,makeup trend 2025,https://www.youtube.com/watch?v=an5Iic6TwcA,1774317601,Simple makeup look transition 🤯 #shorts,Simple makeup look transition #shorts YOUR QUERIES:- power of makeup the power of makeup power of makeup (poppy ...
youtube,makeup trend 2025,https://www.youtube.com/watch?v=RCZjI8AFSv8,1774267244,Beautiful makeup look  transition 🤯 #shorts,Beautiful makeup look transition #shorts YOUR QUERIES:- power of makeup the power of makeup power of makeup (poppy ...
youtube,makeup trend 2025,https://www.youtube.com/watch?v=EiNL1i9-GTU,1774253847,Power Of Makeup💄☠️ [43] With &quot;QMIIR ~ TIKI TIKI [slowed]&quot; Song,"Power Of Makeup  ☠️ [43] With ""QMIIR ~ TIKI TIKI [slowed]"" Song You won't believe the power of makeup ☠️ This ..."
youtube,makeup trend 2025,https://www.youtube.com/watch?v=G9elROD_-L8,1774245607,অন্তরা ঈদে কিভাবে সাজলো । My EID Makeup Look 💄 | Nusrat Jahan Ontora EID Makeup 🌙🪞,
youtube,makeup trend 2025,https://www.youtube.com/watch?v=3a57ldCqQfI,1774244490,who won this trend ❓🤔 #tiktoktrend #danthy #dance  #makeup #makeuptransition #tiktok2026 #trend,tiktokmakeup #tiktokmakeuptrend #tiktokmakeuptransitions #makeuptransition #makeuptransformation #tiktoktransformation ...
youtube,makeup trend 2025,https://www.youtube.com/watch?v=o5sQePGoZ4E,1774234860,Flawless Makeup look For Wedding 😌💖#bridelmakup #makeuptutorial #shortsfeed #viral #fashion#trending,Flawless Makeup look For Wedding #bridelmakup #makeuptutorial #shortsfeed #viral #fashion#trending Aslam o alikum ...
youtube,makeup trend 2025,https://www.youtube.com/watch?v=0x2z2YRl0To,1774180806,Normal makeup look transition 🤯 #shorts,Normal makeup look transition #shorts YOUR QUERIES:- power of makeup the power of makeup power of makeup (poppy ...
