source,domain,url,created_utc,title,text,query
rss,www.refinery29.com,https://www.refinery29.com/en-us/what-is-dermatosis-papulosa-nigra-dpn?utm_source=feed&utm_medium=rss,1780417507,I Thought My Hyperpigmentation Was Acne Scarring — Until A Dermatologist Told Me Otherwise,"I Thought My Hyperpigmentation Was Acne Scarring — Until A Dermatologist Told Me Otherwise

<div><figure><img src=""https://www.refinery29.com/images/11985301.jpg?width=853&amp;height=1024&amp;fit=bounds&amp;crop=853%3A1024"" /></figure></div>



<p>After more than a decade as a beauty editor, I’ve gotten pretty good at identifying common skin concerns. Am I a dermatologist? Absolutely not. But after years of interviewing experts and reporting on the latest treatments, I’d like to think I know more than the average person. </p>



<p>That’s why I was surprised when a casual conversation at dinner during the American Academy of Dermatology’s annual meeting in Denver left me stumped. While chatting with New York-based dermatologist <a href=""https://www.instagram.com/dr.victoriahumphrey/"">Dr. Victoria Humphrey</a>, I pointed out a cluster of spots on my cheekbones and asked what she thought they were. When I first noticed them a few years ago, I assumed they were acne marks, despite not remembering any major breakouts in that area. Later, I wondered if they might be sun spots from my years living in Miami. As it turns out, they were neither. Dr. Humphrey quickly identified them as dermatosis papulosa nigra (DPN), a common benign skin condition sometimes nicknamed <a href=""https://www.refinery29.com/en-gb/dermatosis-papulosa-nigra-black-skin"">“Black girl freckles.”</a></p>



<p>As a mixed-race woman (Japanese and Puerto Rican), the diagnosis caught me off guard. While DPN is most commonly associated with Black skin, it can also affect people of Asian, Hispanic, and other ethnicities. My spots are a lighter brown than what’s often seen on Black skin, but they fit the classic description: clustered in pattern, slightly raised, and unresponsive to every brightening serum I’d tried, including my beloved SkinCeuticals C E Ferulic. </p>



<p>Ahead, here’s everything I learned about DPN, from what causes it to the treatment options worth considering.</p>



<div>DashDividers_1_500x100</div>



<h2>What is DPN, and how does it differ from skin tags, moles, or other hyperpigmentation? </h2>



<p>DPN is a benign skin condition that typically begins appearing in your late 20s or early 30s as small, raised spots that cluster together. While they’re most commonly found on the cheeks, eyelids, and temples, they can also pop up on the neck, chest, shoulders, and upper back. If you’re still not sure what DPN looks like, there’s a good chance you’ve seen it before: “Morgan Freeman is probably the most recognizable celebrity with DPN, which is why people often search for the condition online as ‘Morgan Freeman moles,’” says Dr. Humphrey.</p>



<figure><img src=""https://www.refinery29.com/images/11985464.jpg?width=853&amp;height=1024&amp;fit=bounds&amp;crop=853%3A1024"" /></figure>



<p>This is the point in the conversation where I was shocked at how much of this was new information — but one reason DPN often flies under the radar is because it’s easy to mistake for other common skin concerns, especially hyperpigmentation, moles, or skin tags. </p>



<p>Here’s how Dr. Humphrey explains the difference: “Skin tags are soft, fleshy, and usually found in folds like the neck or underarms,” she says, adding, “Warts have a rough, cauliflower-like texture and can appear anywhere on the body, from the face to the feet.” Then there’s moles: “These can be flat or raised, they grow from deeper layers of the skin and often appear singly or scattered randomly across the body,” she says. And finally, DPN: “By comparison, DPN spots are dark, consistently pigmented, and almost always found in clusters. They sit on the surface of the skin and follow a characteristic pattern on the face.” </p>



<div>DashDividers_1_500x100</div>



<h2>What causes DPN? </h2>



<p>For years, I was convinced my smattering of brown spots were age- and sun-related. As it turns out, they appeared around the same time DPN commonly begins to develop — though I’ll probably never know whether my years spent living in sunny Florida influenced how many showed up. What dermatologists do know is that genetics plays the biggest role. “If your parents or grandparents have it, there is a high likelihood you will too,” Dr. Humphrey explains. </p>



<p>As for my own case? UV exposure may not be completely off the table. “Sun exposure likely plays a role in how many spots develop and how quickly, but it doesn’t cause DPN on its own,” says Dr. Humphrey. Good to know — and an important reminder to never sleep on <a href=""https://www.refinery29.com/en-us/best-sunscreen-products-2026-spf-awards"">sun safety</a>. </p>





<div>DashDividers_1_500x100</div>



<h2>How do you treat DPN? </h2>



<p>I’d made the grave error years ago trying to scrape and pick them off; learn from my mistakes and don’t try this at home! Unfortunately, DPN doesn’t respond to topical treatments like vitamin C, exfoliating acids, or retinoids, so if you’re interested in removal, an in-office procedure is your best bet. </p>



<p>According to Dr. Humphrey, treatment options include electrodesiccation (using a tiny electric needle to zap each spot), curettage (gently scraping them away), laser treatments, cryotherapy (freezing the spots with liquid nitrogen), or simple snip removal with surgical scissors. “Of these, the electric needle method and certain lasers tend to work best for darker skin tones because they allow the most precision with minimal trauma to surrounding skin,” she explains. </p>



<blockquote cite=""https://www.tiktok.com/@dr.ugonabo/video/7600595906387266823"" class=""tiktok-embed""> <section> <a href=""https://www.tiktok.com/@dr.ugonabo?refer=embed"" rel=""noopener noreferrer"" target=""_blank"" title=""@dr.ugonabo"">@dr.ugonabo</a> Stitch with @terruhashi explaining DPNs. In short, harmless but they do bother some people so we can remove them. <a href=""https://www.tiktok.com/tag/dpns?refer=embed"" rel=""noopener noreferrer"" target=""_blank"" title=""dpns"">#dpns</a> <a href=""https://www.tiktok.com/tag/dpnremoval?refer=embed"" rel=""noopener noreferrer"" target=""_blank"" title=""dpnremoval"">#dpnremoval</a> <a href=""https://www.tiktok.com/tag/dermatosispapulosanigra?refer=embed"" rel=""noopener noreferrer"" target=""_blank"" title=""dermatosispapulosanigra"">#dermatosispapulosanigra</a> <a href=""https://www.tiktok.com/tag/dermatologist?refer=embed"" rel=""noopener noreferrer"" target=""_blank"" title=""dermatologist"">#dermatologist</a> <a href=""https://www.tiktok.com/tag/moleremoval?refer=embed"" rel=""noopener noreferrer"" target=""_blank"" title=""moleremoval"">#moleremoval</a> <a href=""https://www.tiktok.com/music/original-sound-7600595923551324949?refer=embed"" rel=""noopener noreferrer"" target=""_blank"" title=""♬ original sound - Dr. Ugonabo - Dermatologist"">♬ original sound – Dr. Ugonabo – Dermatologist</a> </section> </blockquote> 



<p>As with most cosmetic dermatology procedures, DPN removal isn’t cheap, and since it’s considered a cosmetic procedure, it’s not typically covered by insurance. Expect to pay anywhere from $250 to $1,000 per session, depending on the number of spots being treated and your provider. </p>



<div>DashDividers_1_500x100</div>



<h2>Are there any risks to DPN removal? </h2>



<p>Any of the professional removal methods listed above are generally very safe, but there are a few rare risks to keep in mind, especially for darker skin tones. </p>



<p>Per Dr. Humphrey, post-inflammatory hyperpigmentation is the most common complication she sees in patients. “The skin responds to irritation by producing extra pigment, [sometimes] leaving a dark mark where the spot was removed,” she says. In some cases, the opposite can happen, where the treated area loses pigment and looks lighter than the surrounding skin. </p>



<p>People with deeper skin tones may also have a higher risk of scarring or keloids — raised, thickened scar tissue that can form at the treatment site. (Keloids are also commonly seen with certain body piercings.) None of this should discourage anyone from seeking treatment for DPN, though, if you want to. “These risks are real, but a skilled provider who regularly treats patients with melanated skin will know how to minimize them,” Dr. Humphrey says. </p>



<blockquote cite=""https://www.tiktok.com/@drjennyliu/video/7511706860135664942"" class=""tiktok-embed""> <section> <a href=""https://www.tiktok.com/@drjennyliu?refer=embed"" rel=""noopener noreferrer"" target=""_blank"" title=""@drjennyliu"">@drjennyliu</a> Your wisdom spots!! I love electrocautry treatment for skin of color to avoid PIH <a href=""https://www.tiktok.com/tag/dermatology?refer=embed"" rel=""noopener noreferrer"" target=""_blank"" title=""dermatology"">#dermatology</a> <a href=""https://www.tiktok.com/tag/dermatosispapulosanigra?refer=embed"" rel=""noopener noreferrer"" target=""_blank"" title=""dermatosispapulosanigra"">#dermatosispapulosanigra</a> <a href=""https://www.tiktok.com/tag/skintag?refer=embed"" rel=""noopener noreferrer"" target=""_blank"" title=""skintag"">#skintag</a> <a href=""https://www.tiktok.com/tag/skintageremoval?refer=embed"" rel=""noopener noreferrer"" target=""_blank"" title=""skintageremoval"">#skintageremoval</a> <a href=""https://www.tiktok.com/tag/warts?refer=embed"" rel=""noopener noreferrer"" target=""_blank"" title=""warts"">#warts</a> <a href=""https://www.tiktok.com/tag/skincaretiktok?refer=embed"" rel=""noopener noreferrer"" target=""_blank"" title=""skincaretiktok"">#skincaretiktok</a> <a href=""https://www.tiktok.com/tag/dermatologist?refer=embed"" rel=""noopener noreferrer"" target=""_blank"" title=""dermatologist"">#dermatologist</a> <a href=""https://www.tiktok.com/tag/skintok?refer=embed"" rel=""noopener noreferrer"" target=""_blank"" title=""skintok"">#skintok</a> <a href=""https://www.tiktok.com/tag/dermtok?refer=embed"" rel=""noopener noreferrer"" target=""_blank"" title=""dermtok"">#dermtok</a> <a href=""https://www.tiktok.com/music/New-Flame-but-I-promise-you-feat-Usher-Rick-Ross-7289503994026805250?refer=embed"" rel=""noopener noreferrer"" target=""_blank"" title=""♬ New Flame (but I promise you) (feat. Usher &amp; Rick Ross) - Chris Brown"">♬ New Flame (but I promise you) (feat. Usher &amp; Rick Ross) – Chris Brown</a> </section> </blockquote> 



<p>One last thing to know: treatment removes the spots you already have, but new ones can still develop over time. “There’s no way to prevent that, and it’s not a sign that anything went wrong — it’s just how DPN works,” Dr. Humphrey says. “Think of it less as a one-time fix and more as ongoing maintenance, similar to how you might manage other skin concerns over time.” </p>



<p>As with moles and birthmarks, any changes in shape, size, or color are a good reason to book an appointment with a trusted dermatologist. “DPN is completely harmless from a medical standpoint, but there are situations where you should get a spot checked by a board-certified dermatologist,” Dr. Humphrey says. Those include if a spot bleeds without being scratched or irritated, or if it looks noticeably different from other spots on your body. </p>



<div>DashDividers_1_500x100</div>



<h2>Final Thoughts </h2>



<p>DPN isn’t something I necessarily thought about every day, but learning what it actually is has definitely shifted how I see my skin. What once felt like a mystery at best and a stubborn game of Whack-A-Mole at worst — is just a common condition in skin of color, like mine. I’m also aware that my DPNs are relatively small and mostly confined to my temples and back — but it was still something that stood out every time I looked at my skin in the mirror. And like so many beauty concerns, the choice to treat it or not ultimately comes down to personal preference, not medical necessity. </p>
<p><strong>Like what you see? How about some more R29 goodness, right here?</strong></p><p><a href=""https://www.refinery29.com/en-us/rice-fragrance-perfume-trend?utm_source=rss&amp;utm_medium=rss_linkback1"">Don’t Want To Smell Like Anyone Else? Try Rice</a></p><p><a href=""https://www.refinery29.com/en-us/keren-bartov-esthetician-skincare-advice?utm_source=rss&amp;utm_medium=rss_linkback2"">7 Skincare Rules A Met Gala Esthetician Taught Me</a></p><p><a href=""https://www.refinery29.com/en-us/zara-larsson-midnight-sun-style-get-the-look?utm_source=rss&amp;utm_medium=rss_linkback3"">Zara Larsson Midnight Sun Guide To Summer-Maxxing</a></p>",
rss,www.refinery29.com,https://www.refinery29.com/en-us/red-light-tanning-bed-risks-dangers?utm_source=feed&utm_medium=rss,1780412447,"Those Red Light Tanning Beds? Yeah, They’re A Scam","Those Red Light Tanning Beds? Yeah, They’re A Scam

<div><figure><img src=""https://www.refinery29.com/images/11921332.jpg?width=853&amp;height=1024&amp;fit=bounds&amp;crop=853%3A1024"" /></figure></div>



<p><em>Welcome to <a href=""https://www.refinery29.com/en-us/sun-blocked"">Sun Blocked</a>, Refinery29’s global call to action to wake up to the serious dangers of tanning. No lectures or shaming, we promise. Instead, our goal is to arm you with the facts you need to protect your skin to the best of your ability, because there’s no such thing as safe sun.</em></p>



<p>“They are much safer as the red light has the opposite effect of [UV], it protects your skin.” </p>



<p>I wince as I read this. I’m exchanging emails with 19-year-old Crisiant, who uses a red light <a href=""https://www.refinery29.com/en-us/tanning-bed-addiction-skin-risks"">tanning bed</a> roughly every six weeks. Last year, she discovered that a tanning salon in her area had two of these beds, and she assumed they would be better for her skin.</p>



<p>These machines‚ also known as collagen-boosting tanning beds, combine ultraviolet (UV) light — which tans the skin — with tubes that emit red light. Even if you’ve never stepped inside one, you’ve probably seen red light before. From <a href=""https://www.refinery29.com/en-us/led-face-mask-red-light-skin-benefits"">LED face masks</a> to full-body treatments that immerse the skin in red light, these devices have become skincare staples, promising to boost collagen, reduce acne, and heal skin. </p>



<figure><blockquote class=""has-text-color has-black-color""><p>Collagen [tanning beds] make no logical sense at all. [Beds] that deliver UV radiation are harmful and cause skin cancers, full stop. Cloaking them as something good for your skin health is totally disingenuous. </p><cite>Dr. Clare Kiely, consultant dermatologist</cite></blockquote></figure>



<p>Later, on the phone, it sounds like Crisiant is well aware of the dangers of regular tanning beds. She first tried one aged 18, but learning more about the risks put her off: “If you [use] one now and then, I didn’t think it’d be too bad, but I didn’t want to do it consistently because I knew how dangerous they were,” she tells me.</p>



<p>To Crisiant, red light tanning beds felt different — a little safer: “It still gives you a tan while doing your skin good,” she says. “I went on it once and noticed [a difference] within the same day. I had a really bad breakout on my face, and it sort of soothed and cleared my skin. It was really strange as [tanning beds] have never done that for me before.” It also made her feel more confident. </p>



<p>It’s not hard to see why Crisiant thinks these machines are a safer, even beneficial alternative to regular tanning beds — and she’s not the only one. But it highlights worrying misconceptions around red light tanning beds and their damage. Head to TikTok or Instagram, and you’ll find countless <a href=""https://www.tiktok.com/@outspoken_the_podcast/video/7223185692933852417"">videos posted by people</a> who are convinced these beds can be used safely and that the risk of burning is lower.</p>



<p>But that’s not true. Combining red light with UV in a tanning bed counteracts any of the potential benefits. Consultant dermatologist <a href=""https://www.drclarekiely.com/"" rel=""noreferrer noopener"" target=""_blank"">Dr. Clare Kiely</a>, cofounder of <a href=""https://theskindiary.com/"">The Skin Diary</a>, puts it plainly: “Collagen [tanning beds] make no logical sense at all.”</p>



<h2>Is red light safe for our skin? </h2>



<p>It is important to point out the differences between a red light-only bed and a tanning bed that emits both UV and red light. “Red light therapy without UV is a very different proposition,” confirms consultant dermatologist <a href=""https://www.instagram.com/drderrickphillips/"">Dr. Derrick Phillips</a>. “It is generally considered safe and may help with things like <a href=""https://www.refinery29.com/en-us/led-face-mask-red-light-skin-benefits"">inflammation, wound healing</a>, and improving overall skin tone. However, the results do tend to be subtle, and I always remind patients that it’s not a quick fix.” <a href=""https://www.instagram.com/dr.beibei.dermatology/"">Dr. Beibei Du-Harpur</a>, scientific engagement lead at The Skin Diary, agrees: “More clinical evidence is needed to confirm the effectiveness [of red light] as a treatment for the skin, but there have been promising <a href=""https://pmc.ncbi.nlm.nih.gov/articles/PMC10311288/"" rel=""noreferrer noopener"" target=""_blank"">small studies</a> from a skin aging perspective.” </p>



<p>The bottom line? On its own, red light is low-risk. But its popularity in skincare has made some see red light tanning beds as a good thing.</p>



<figure><blockquote class=""has-text-color has-black-color""><p>Not only does UV increase your risk of skin cancer, it breaks down collagen — the very thing red light is supposed to help boost — and speeds up the skin’s aging process. In other words, any benefits of red light are immediately cancelled out by the UV. </p></blockquote></figure>



<h2>Are red light tanning beds ‘safer’ to use than regular tanning beds? </h2>



<p>The World Health Organisation has classed UV-emitting tanning devices <a href=""https://www.iarc.who.int/media-centre-iarc-news-32/"">as carcinogenic</a> to humans since 2009. It doesn’t matter if UV comes from a tanning bed that also emits red light; it still causes damage to our DNA. Not only does UV increase your risk of skin cancer, but it breaks down collagen — the very thing red light is supposed to help boost — and speeds up the skin’s aging process. In other words, any benefits of red light are immediately cancelled out by the UV. </p>



<p>Dr. Kiely says that those who market machines combining UV with collagen-boosting red lights can’t have a good understanding of how light affects our skin. Why? It just doesn’t make sense: “[Tanning beds] that deliver UV radiation are harmful and cause skin cancers, full stop,” she says. “Cloaking them as something good for your skin health is totally disingenuous.” </p>



<p>Dr. Phillips agrees and sees no evidence that combining red light with UV neutralizes the harm. “If anything, it gives a misleading impression of safety,” he says. “These are still [tanning beds] emitting UV radiation, and they carry all the same risks as traditional tanning beds. From a dermatological perspective, they’re just as concerning.”</p>



<h2>Why do people still use tanning beds despite the dangers? </h2>



<p>It’s difficult to say how many of these red light and UV machines exist, but <a href=""https://www.ibisworld.com/united-states/number-of-businesses/tanning-salons/1721/"">IBISWorld</a>, a global industry research platform, reports that there were more than 28,000 tanning salons in the United States in 2024. A quick Google reveals that plenty offer combined UV-red light beds.</p>



<p>The <a href=""https://www.refinery29.com/en-us/tanning-bed-addiction-skin-risks"">reasons why people use</a> beds like these are complex. Bronzed skin remains <a href=""https://www.refinery29.com/en-us/tanned-skin-beauty-standard-sexist"">a beauty ideal</a>, and among younger people, tanning beds are still seen as trendy. Crisiant hints that this is partly why she first tried one: “You see all the girls getting these [tanning beds] and a nice tan from it,” she says. “I feel like they are that phase that doesn’t end for a lot of people.” </p>



<p>Some credit tanning beds for boosting their mood. Others believe they help them get enough vitamin D — <a href=""https://www.aad.org/public/diseases/skin-cancer/surprising-facts-about-indoor-tanning"">a proven myth</a>. Another misconception is that they can help improve skin conditions like <a href=""https://www.refinery29.com/en-us/tanning-beds-eczema-treatment-dermatologist-advice"">acne or eczema</a>, but prolonged use of tanning beds can actually <a href=""https://www.refinery29.com/en-us/tanning-beds-eczema-treatment-dermatologist-advice"">worsen these conditions</a> and weaken the skin over time, making it more susceptible to infection. </p>



<p>Then there’s the theory that using tanning beds occasionally or for short bursts makes it “safer” — something I thought was true as a teenager. Because sun damage isn’t always visible right away, it’s easy to underestimate the harm. Even those who understand their risks struggle to stop using them, with some describing themselves as <a href=""https://www.refinery29.com/en-us/tanning-bed-addiction-skin-risks"">feeling “addicted”</a>. </p>



<h2>If tanning beds are so dangerous, why aren’t they banned? </h2>



<p>While tanning beds remain so widely available, often without clearly displayed warnings, there is always a risk that people may assume that they are somewhat safe, or they’d be banned. Refinery29’s stance is clear: <a href=""https://www.refinery29.com/en-us/2023/05/11401740/ban-tanning-beds-for-minors-us-petition-sign"">tanning beds should be banned</a>, as they are in Iran, Brazil, and Australia. Just one session before age 35 more than <a href=""https://www.skincancer.org/skin-cancer-information/skin-cancer-facts/"" rel=""noreferrer noopener"" target=""_blank"">doubles your lifetime risk</a> of melanoma, a skin cancer that can spread to other parts of the body. Red light doesn’t change that. </p>



<p>That’s why many experts support a tanning bed ban and agree that the growing trend for red light beds is another reason it’s needed: “The messaging of these collagen-boosting [tanning beds] confuses those who may not understand the detrimental effects that [tanning beds] have on our skin,” says Dr. Du-Harpur. She adds this is particularly dangerous given beauty standards around having a “healthy” tan — a phrase that doesn’t make any sense when a tan is our skin’s damage response to UV. Marketing red light tanning beds as collagen-boosting, she adds, “will encourage people to risk their health in the name of beauty and present an illusion that it may be safer or different to a conventional UV-focused [tanning bed].” She stresses, “They aren’t safe — with or without red light therapy.”</p>



<p>When I ask Crisiant if anything might put her off using a red light tanning bed, she says it’s like she has “a devil and an angel on each shoulder.” She might change her mind one day, but she can’t say she’ll stop for now. Crisiant isn’t against a tanning bed ban, though: “Even though I use them, if they were [banned] I don’t think I’d be massively annoyed because I know that the government would be doing it for our benefit,” she says. </p>



<p>Little has changed since Refinery29 reported on what it would take for <a href=""https://www.refinery29.com/en-gb/sunbed-ban-unregulated-uv-exposure-risks"">tanning beds to be banned entirely</a> last May. Sadly, <a href=""https://www.refinery29.com/en-us/2024/03/11696987/wisconsin-tanning-bed-ban-teenagers-skin-cancer"">only a handful of US states</a> have a blanket ban. But if we’re serious about tackling <a href=""https://melanomafocus.org/news-blog/half-of-brits-get-sunburnt-every-year-as-skin-cancer-rates-rise/"">rising skin cancer rates</a>, intervention is needed. At the very least, more regulation around any kind of tanning bed use, or better yet, a total ban.</p>
<p><strong>Like what you see? How about some more R29 goodness, right here?</strong></p><p><a href=""https://www.refinery29.com/en-us/tanned-skin-beauty-standard-sexist?utm_source=rss&amp;utm_medium=rss_linkback1"">The Sexist History Behind Our Obsession With A Tan</a></p><p><a href=""https://www.refinery29.com/en-us/best-sunscreen-products-2026-spf-awards?utm_source=rss&amp;utm_medium=rss_linkback2"">The Very Best Sunscreens Worth Your Money In 2026</a></p><p><a href=""https://www.refinery29.com/en-us/wearing-sunscreen-spf-daily-affordable?utm_source=rss&amp;utm_medium=rss_linkback3"">SPF Is Pricey — Here&#039;s How To Maximize Every Drop</a></p>",
