source,query,url,created_utc,title,text
youtube,beauty trends,https://www.youtube.com/watch?v=XS7d7Tc3TLk,1776261650,Virtual Try Ons &amp; Beyond Unlocking 2026 Tech Beauty Trends!,"Endata released the ""2026 AI+ Beauty Consumption Trend Report: Technology Empowerment, Accurately Defining the New ..."
youtube,beauty trends,https://www.youtube.com/watch?v=YeL2tT5yuI8,1776258069,Exploring Cosmetic Trends That Focus on Simplicity and Natural Beauty Looks,Exploring Cosmetic Trends That Focus on Simplicity and Natural Beauty Looks.
youtube,beauty trends,https://www.youtube.com/watch?v=cieLtANJX0c,1776257223,MARÉE #morningroutine #beautyessentials #beautytrends #skincare,Focusing on healthy habits today. It's all about taking care of yourself from the inside out.
youtube,beauty trends,https://www.youtube.com/watch?v=A0sSkuH1B9Y,1776255207,MARÉE #consistency #beautycare #beautytrends #hairgoals,Just showing some love to my skin and hair. Small steps lead to big changes.
youtube,beauty trends,https://www.youtube.com/watch?v=xGewvT6tY_s,1776253714,"Cheap Stone, Expensive Lie 😱","Crystal Deodorant is going viral across the USA and Europe, where people are paying ₹1000–₹4000 for this “natural deodorant ..."
youtube,beauty trends,https://www.youtube.com/watch?v=d9hVfokDrrA,1776252229,MARÉE #beautyessentials #skintok #hairgrowth #beautytrends,Focusing on healthy habits today. It's all about taking care of yourself from the inside out.
youtube,beauty trends,https://www.youtube.com/watch?v=YQxJiPPXFCs,1776251097,MARÉE #beautytrends #naturalbeauty #skincaretips #maree,Just showing some love to my skin and hair. Small steps lead to big changes.
youtube,beauty trends,https://www.youtube.com/watch?v=Lk4JkrDcS_A,1776250994,MARÉE #routine #consistency #beautytrends #healthyskin,Trying out some essentials and loving the results so far. Have you tried these yet?
youtube,beauty trends,https://www.youtube.com/watch?v=g9p9i9YOkGA,1776250697,MARÉE #hairgoals #beautyessentials #glowingskin #beautytrends,Focusing on healthy habits today. It's all about taking care of yourself from the inside out.
youtube,beauty trends,https://www.youtube.com/watch?v=3xFOW-4_-_I,1776249277,#ChineseGirl #AsianBeauty #LifestyleVlogs #FashionInspiration #DailyLife #TravelVlogs #BeautyTrends,"Welcome to our channel where we explore the beauty, culture, and lifestyle of Chinese girls through engaging and creative ..."
youtube,beauty trends,https://www.youtube.com/watch?v=LYolGDBeJaw,1776249031,Skin Glow + Weight Loss Drink | Best Detox Water Recipe” #viral #beauty #skincare #shorts,
youtube,beauty trends,https://www.youtube.com/watch?v=Iin-h27kIjI,1776248428,MARÉE #beautyessentials #routine #glowingskin #beautytrends,Taking a moment for myself today. These products make the process so much better.
youtube,beauty trends,https://www.youtube.com/watch?v=6R8SYIcj9eM,1776245067,#trends,
youtube,beauty trends,https://www.youtube.com/watch?v=ulIY-tzFY8k,1776244957,Reallly? 💗💌beauty tips🌸 #beautytips #glowup #fyp #girl #beautyhacks #kbeauty #beauty #aesthetic,"Unlock the secrets of K-beauty! Get glowing skin, lumpy lashes, and pouty lips with these easy Korean beauty tips! #KBeauty ..."
youtube,beauty trends,https://www.youtube.com/watch?v=i6571E6pZSU,1776235665,Curves On The Runway 💃🏾🔥| Beauty Trends Redefining Style &amp; Glamour!! ❤️👸🏾,"THANKS FOR WATCHING! And Please Subscribe, ""Hey, guys! If you're enjoying this video and want to show your support in a ..."
youtube,beauty trends,https://www.youtube.com/watch?v=NyNu4Yi9TeA,1776234154,озон 1598036703 #косметика #уход #уходзакожей #крем #воск #озон #распаковка #обзор #красота #тренды,
youtube,beauty trends,https://www.youtube.com/watch?v=kpA18caBZKU,1776233697,How Korean girls did makeup 200 years ago vs. today,kbeauty #kculture #koreanmakeup #beautytrends #koreanskincare.
youtube,beauty trends,https://www.youtube.com/watch?v=A_6OfGijz7o,1776232905,один из любимых активов ✨ #skincare #beauty  #shorts #trend #makeup #рек #тренды,
youtube,beauty trends,https://www.youtube.com/watch?v=6wsKA7tRUOM,1776232008,Sữa tắm thơm nhất Thuỷ từng xài 😘 #trend #lamdep,Đừng quên theo dõi kênh của Thuỷ để học thêm nhiều tips xinh nhaa. Đừng quên like và subscribe để ủng hộ và nhận thông báo ...
youtube,beauty trends,https://www.youtube.com/watch?v=nbjG99zvmNw,1776231980,Đừng khai cọ đầu năm nếu chưa làm thue tục này 😚 #trend #lamdep,Đừng quên theo dõi kênh của Thuỷ để học thêm nhiều tips xinh nhaa. Đừng quên like và subscribe để ủng hộ và nhận thông báo ...
youtube,beauty trends,https://www.youtube.com/watch?v=Ng7_t3lVzVw,1776224734,SERIES BEAUTY MAP EP.08: CÓ NÊN LÀM ĐẸP THEO TREND? VÌ SAO NHIỀU NGƯỜI CHỈNH HOÀI VẪN CHƯA ĐẸP?,"Không phải trend nào cũng “đu” là đẹp. Có những dáng mày nhìn rất ""cuốn""… nhưng đó là khi nằm trên gương mặt người khác."
youtube,beauty trends,https://www.youtube.com/watch?v=ZRmV83ceAXY,1776216298,#makeup #lipstick #makeuptutorial #beautytrends #lipliner,
youtube,beauty trends,https://www.youtube.com/watch?v=Gfl2kJt0wqs,1776197342,Sephora Kids GRWM TikTok Compilation 💄😂 | Cute &amp; Viral Makeup Moments,Get ready to enjoy the cutest and funniest Sephora Kids GRWM TikTok Compilation! This video is packed with adorable Get ...
youtube,beauty trends,https://www.youtube.com/watch?v=LDFABb7qUKU,1776195004,Thank God We Left The 2024 Beauty Trends Behind! 🙅‍♀️💄 #1minute #meme #memes #funny #funnymemes,Thank God We Left The 2024 Beauty Trends Behind! ‍♀️   #1minute #meme #memes #funny #funnymemes Description The ...
youtube,beauty trends,https://www.youtube.com/watch?v=-f9i2WYoUUA,1776193286,Grwm for school #fypシ゚viral #trends #viral #comment #subscribe #like,
youtube,skincare routine trend,https://www.youtube.com/watch?v=hVBcxT8yZz4,1776262403,Skincare routine🌸#youtubeshorts #skincare #morning routine #morningskincare #morningskincareroutine,Skincare routine  #youtubeshorts #skincare #morning routine #morningskincare #morningskincareroutine baisa ...
youtube,skincare routine trend,https://www.youtube.com/watch?v=yzoeo2NAkZw,1776260999,Night routine 🫧 #gurwm #grwm #skincare #selfcare #fyp #viral #trend #boost #blowup #fypシ,
youtube,skincare routine trend,https://www.youtube.com/watch?v=BF5Rr6WyVaI,1776260976,Best remedy to cure Sun Burn #skincaretips #skincareroutine #skincareproducts #trending #trend,
youtube,skincare routine trend,https://www.youtube.com/watch?v=XXz2-kuggLo,1776257556,🎀#viral #shorts #shortvideo #skincare #fashion #beauty #skincareroutine #explore #explorepage #trend,"Skincare, Skincare Paglu, Skincare routine, Beauty, makeupaddict, skincareaddict, beautyaddict, makeuplover, skincarelover, ..."
youtube,skincare routine trend,https://www.youtube.com/watch?v=_5CGv247ovY,1776257180,Teenager Skincare Routine 🎀#aesthetic #beautytips#skincaretips #trendingshorts#trendingvideo#trend,
youtube,skincare routine trend,https://www.youtube.com/watch?v=ijqRB_H2Hq0,1776240057,Trying viral trend♥️ #trend #shorts #viral#bts #swim,Trying viral trend♥️ #trend #shorts #viral#bts #swim #trending let's fix your glow up routine ✨️ #skincare​#skincareproduct​ ...
youtube,skincare routine trend,https://www.youtube.com/watch?v=BVok7rOWkfo,1776234442,eye cream #eyecream  #eye #eyemakeup #skin #skincare #skincaretips  #skincareroutine #skintips,eye cream ‍♀️ #skin #skincare #skincaretips #skincareproducts #skincareroutine #skintips #morning #morningroutine ...
youtube,skincare routine trend,https://www.youtube.com/watch?v=1vGYicx5jxo,1776232804,🦄👼|| I love this sm! || #preppy #trending,I love this sm! - blow up? - sweets or chocolate? - I have swimming today! - brands-@b@bubbleskincare ...
youtube,skincare routine trend,https://www.youtube.com/watch?v=yY92aIL0lsI,1776231809,this turned out better in my head..😭,tags   : #fyp»viral #preppy #preppyaesthetic #aesthetic #algorithm #fypyoutube #shortvideos #shortsfeed #skincare #subscribe ...
youtube,skincare routine trend,https://www.youtube.com/watch?v=NvkfdxeD8HU,1776220219,yes I only have these many products 🙃#shorts #trending #trend #viral,Insane morning skincare routine for UNREAL glow 2026! You won't believe these results. [Your main link here] Finally sharing ...
youtube,skincare routine trend,https://www.youtube.com/watch?v=UUcsG3oOuHA,1776217827,This trend with my favourite #skincareproducts #skincareroutine #junkjournal #instagramreels update,
youtube,skincare routine trend,https://www.youtube.com/watch?v=V0kfVFZwzKM,1776194101,Nie każda pielęgnacja jest dla Ciebie - przestań kopiować trendy. #pielęgnacjatwarzy #skincare,
youtube,skincare routine trend,https://www.youtube.com/watch?v=clylcvFhwGA,1776182400,🌺🚌Sunny grwm for school•🌞||check desc||🏷️::#viralvideo #trend #like #love #tiktok #yt #jly #vlog,Welcome to my description•|| :: AHH OBSESSEDD!! ‍♀️:: school     :: im no longer doing collabs!! :: clips are VERY old ...
youtube,skincare routine trend,https://www.youtube.com/watch?v=0Vjpu6iw0S0,1776178759,Weekday Vlog #trendingshorts #vlog #trend #9to5life #corporatelife #girlthing #fypシ #1million #xp,Rise and shine! ☕️ Join me for a realistic morning as a single girl balancing a corporate career and a self-care routine. Before I ...
youtube,skincare routine trend,https://www.youtube.com/watch?v=mJzelgyaW6Y,1776157267,Stop Wasting Money on Dumb Beauty Trends,"In this episode of Seriously WTF, Corry and Nar go from coffee opinions and family flu chaos to the very real questions women ..."
youtube,skincare routine trend,https://www.youtube.com/watch?v=ImRcMFgoIZI,1776117631,Aloe Vera Soothing Gel 92% – Nature Republic Hydrating Korean Skincare Gel,Aloe Vera Soothing Gel 92% https://amzn.to/4c48QYW Nature Republic Hydrating Korean Skincare Gel Refresh and hydrate your ...
youtube,skincare routine trend,https://www.youtube.com/watch?v=mHnvdTPhWKI,1776110917,pilgrim 🩵🩷🩵🩷 #pilgrim #spf50 #skincare #selfcareroutine #skincareroutine #trend #sunscreen,Hey beauties I can made this photographi today apko kesa laga comment krke jarur batana Today I'm sharing my honest ...
youtube,skincare routine trend,https://www.youtube.com/watch?v=jWrb92BQ6Pg,1776109272,✨:: desc! :: ✨,love this sm! - text ib-@vlogswbela - emoji ib -@vlogswloisss - done all my homework.. - goviral? - will be posting ...
youtube,skincare routine trend,https://www.youtube.com/watch?v=d0Dbe4DkCww,1776109032,GUWM💗 Moje každotýdenní nedělní rutina.  #skincare #makeup #czsk #reletable #grwm #trend #vlog #cz,"Vždycky nejdýl zabírám koupelnu… a přesně ve chvíli, kdy si říkám ještě chvilku, už na mě máma klepe, ať jdu konečně spát ."
youtube,skincare routine trend,https://www.youtube.com/watch?v=LF2ZKLuvO_4,1776104384,cute grwm skincare #trend #cute #skincareroutine #skincare #grwm,
youtube,skincare routine trend,https://www.youtube.com/watch?v=p-SzfAyMb9c,1776096055,Glowing Skin in Minutes with Chia Seeds 😍✨ #youtubeshorts #shorts #ytshorts #trendingshorts #diy,Glowing Skin in Minutes with Chia Seeds ✨ #youtubeshorts #shorts #ytshorts #trendingshorts #diy #chiaseeds #skincare ...
youtube,skincare routine trend,https://www.youtube.com/watch?v=671PA75HPnk,1776095931,Life 9to5 #trendingshorts #corporatelife #minivlog #9to5life #aqualogica #fypシ #trend #relatable,Rise and shine! ☕️ Join me for a realistic morning as a single girl balancing a corporate career and a self-care routine. Before I ...
youtube,skincare routine trend,https://www.youtube.com/watch?v=kAkmWE11BcI,1776092235,Routine peau grasse. #viral #trending #viralvideo #live #skincare #youtube #video #trend #beautiful,
youtube,skincare routine trend,https://www.youtube.com/watch?v=3864r_sq_28,1776091466,trend dress #skincare #butiful #gospel #haveitoldyoulatelythatiloveyou #fashion #skincareroutine,
youtube,skincare routine trend,https://www.youtube.com/watch?v=Xz6s_vEhnHg,1776084451,IL TREND SKINCARE CHE DISTRUGGE LA TUA PELLE,Borse e occhiaie sono tra i problemi più difficili da combattere con la skincare antiage. Anche trattamenti viso di medicina estetica ...
youtube,makeup trend 2025,https://www.youtube.com/watch?v=IMuFXfIThI0,1776261976,What?I failed? #makeup #explorepage #beauty #inspo #makeuptutorial #viral #trending,makeup #beginnerfriendlymakeupforblackwomen #makeuptutorial #everydaymakeupforblackwomen #lipcombo #trending ...
youtube,makeup trend 2025,https://www.youtube.com/watch?v=dlBNHZpwn24,1776251692,Plouise Wedding Wish XL Eye Makeup Look!,"I did this eye makeup look in July 2025, the eyeshadow palette I used is Plouise's Wedding Wish XL eyeshadow palette."
youtube,makeup trend 2025,https://www.youtube.com/watch?v=HJrxDw3Rn0w,1776139584,trend ♥️#makeup #parlour #shorts #viralvideo #youtubeshorts #trending #viral #love #viralmusic#song,trend ♥️#makeup #parlour #shorts #viralvideo #youtubeshorts #trending #viral #love #viralmusic#song @ParlourTips ...
youtube,makeup trend 2025,https://www.youtube.com/watch?v=I2lm4sIebmo,1776137413,Beauty Is Every Shade❤️#makeup #youtubeshort #shortfeed #shorts #youtuber,Beauty Is Every Shade❤️#makeup #youtubeshort #shortfeed #shorts #youtuber Hello Friends I'm Sonia from Goa Follow me on ...
youtube,makeup trend 2025,https://www.youtube.com/watch?v=5N-BhqBHC9s,1776069787,Green Eye Makeup Look I Did In October 2025!,I used eyeshadows from BPerfect Cosmetics Carnival Interstellar Stacey Marie eyeshadow palette to do this Green eye makeup ...
youtube,makeup trend 2025,https://www.youtube.com/watch?v=obUQUEQ35vI,1776068153,My 2025 wrapped! Which look is your fav😈: #short #shorts #Ruthiemakeup,My 2025 wrapped! Which look is your fav  : #short #shorts #Ruthiemakeup.
youtube,makeup trend 2025,https://www.youtube.com/watch?v=KoZJHd6u9Zo,1775969848,Plouise Wedding Wish XL Eye Makeup Look!         (October 2025),"I did this eye makeup look in October 2025, the eyeshadow palette I used is Plouise's Wedding Wish XL eyeshadow palette."
youtube,makeup trend 2025,https://www.youtube.com/watch?v=ns-zvL4vqoI,1775910446,anya? | #cosplay #anya #trending #fypシ゚viral #tiktok,"trend video trend 2026 trend tiktok trend transisi muka trend transisi makeup trend 2025 trend tahun ini, trend hari ini,"
youtube,makeup trend 2025,https://www.youtube.com/watch?v=yscpGCZl6Ws,1775686668,Top five best transition from Danthy in march 2025 #viral #edit,bayonetta makeup trend.
youtube,makeup trend 2025,https://www.youtube.com/watch?v=t3Yh6aI6i5c,1775664032,#ushine #makeup #partymakeup  #shorts #youtubeshorts,ushine #makeup #partymakeup #shorts #youtubeshorts partymakeup party makeup by nikki party makeup tutorial party makeup ...
youtube,makeup trend 2025,https://www.youtube.com/watch?v=a3SCDaj3N2c,1775566853,Peachy Glam Bridal Look - Perfect for Spring 2025 🌸 #bridalmakeup  #springwedding  #softglambride,"This spring bridal makeup look is everything a bride could want - warm peachy tones, copper shimmer eyes, glowy skin and a lip ..."
youtube,makeup trend 2025,https://www.youtube.com/watch?v=HWHFMM4-pyU,1775537977,"K-Beauty Trend - Call It Blushed or Flushed, the K-Beauty Look Is Trending","Excerpts from. NYTimes for educatinal and cultural purposes: NYTimes/Sept 8, 2025 by Haemin Kwak Call It Blushed or Flushed, ..."
youtube,makeup trend 2025,https://www.youtube.com/watch?v=mE5mmU55BjA,1775522303,Ranking These Aged Makeup Looks #makeup #trend #shorts,"We're diving into the creative world of ""Best Aged Makeup Trends""! ✨ This video highlights amazing fan interpretations, ..."
youtube,makeup trend 2025,https://www.youtube.com/watch?v=LPBk6zt17_E,1775521829,"2026 Danthy makeup transition trends,which one is Better  #makeup #shorts",makeup #makeuptransformation #transition #transformation #tiktok #trending #viral #youtubeshorts #fyp #danthy.
youtube,makeup trend 2025,https://www.youtube.com/watch?v=K2QvYu2OC9M,1775489421,পহেলা বৈশাখ Makeup Look ✨| Bengali new year makeup look 2026🌸 #beautyqueenmadhu #poilabaisakh #mfam,"Busness mail - madhumitaacharya1414@gmail.com poila baisakh makeup, poila baisakh makeup look, pohela boishakh makeup ..."
youtube,makeup trend 2025,https://www.youtube.com/watch?v=sFCI-J62QsE,1775397674,Which Spring Makeup do you prefer? 2025 or 2026? 🤔🌸 #dresstoimpress,"Comparing free preset makeup from 2025 with 2026 - from Spring/Petal and Tokyo updates   If you enjoyed watching, please ..."
youtube,makeup trend 2025,https://www.youtube.com/watch?v=PFmnB4-aiKo,1775390428,Best Chinese makeup transition ever 🤯 #shorts,Best Chinese makeup transition ever #shorts YOUR QUERIES:- power of makeup the power of makeup power of makeup ...
youtube,makeup trend 2025,https://www.youtube.com/watch?v=IZm9KlRfgnE,1775323737,This trend is so fun! #2025 #preppy #popular #makeup #skincare #viral #fyp #helpmemakethismakesense,
youtube,makeup trend 2025,https://www.youtube.com/watch?v=qDpYTf2j2Ks,1775304929,kicau mania makeup trend,
youtube,makeup trend 2025,https://www.youtube.com/watch?v=hZCbJzlcr-o,1775254575,Bee Mine Makeup Colaboration Creative Makeup 2025 #creativemakeup #makeupartist #bees,Bee Makeup Tutorial | Viral Honey Bee Look Step by Step | Easy Creative Makeup 2026 #creativemakeup ✨ Create a Stunning ...
youtube,makeup trend 2025,https://www.youtube.com/watch?v=iLlYmjvgMr4,1775232179,All my makeup looks here 2025 to 26 #softglamlook #bridalmakeover #makeupartist #indoremakeupartist,All my makeup looks here 2025 to 26 #softglamlook #bridalmakeover #makeupartist #indoremakeupartist.
youtube,makeup trend 2025,https://www.youtube.com/watch?v=fFrccNkwhWc,1775222385,Full Bridal Makeup &amp; Hairstyle Final Look 2025 | Indian Bridal Glam | Radhika Thakkar,She walked in as a girl & walked out as the most beautiful bride in the room Every detail. Every stroke. Every pin. All crafted with ...
youtube,makeup trend 2025,https://www.youtube.com/watch?v=Z3zdkzg7apY,1775190133,2025 Vs 2026 Lip liner Trend 💄#trending #pov #makeup #beauty #tips,
youtube,makeup trend 2025,https://www.youtube.com/watch?v=5bmg2UTLVDU,1775173587,Fiz a trend certinho? #makeup #maquiagem #makeupking #makeuptutorial,
youtube,makeup trend 2025,https://www.youtube.com/watch?v=TeWYs9XB0Xo,1775153360,HANNAH MONTANA Trend 😍🎙️ Habt ihr Hannah Montana geschaut? 🤍 #hannahmontana #makeuptrend,
