source,query,domain,url,created_utc,title,text
gnews,beauty trend,news.google.com,https://news.google.com/rss/articles/CBMicEFVX3lxTE96eFRtR1g5NG15VmJxdk9GX3B1V1FJdWRDdkJPb1pHMWk3d2pwMV81WFBURlJxaHRadVZTWUFKR1VSc21KX1lyVTUxa2NSa05nRmxUU1FRb1hFVWNvc2hDZ25YYUQ0Y09jMzNhLTZuWGk?oc=5,1777627800,The Vogue Business Beauty Trend Tracker - Vogue,The Vogue Business Beauty Trend Tracker - Vogue
gnews,beauty trend,news.google.com,https://news.google.com/rss/articles/CBMiZkFVX3lxTE55YVNKbVVLSGpVeENKazIxYW90cVVvcWJldHkzZ0dJR1JSMTMwNUdGWC0xdUg5WVRsRVJpdTlvUEZBeGNNR2FNTHl4SWhOQlAzdU5QazFiZFlvRndkRDhOOV9MNUxZQQ?oc=5,1778001543,Tired? The Met Gala Served Up Lots of Dark Circles Inspo - Allure,Tired? The Met Gala Served Up Lots of Dark Circles Inspo - Allure
gnews,beauty trend,news.google.com,https://news.google.com/rss/articles/CBMi6AFBVV95cUxNQ0g0eEktMzVaRGh2bzA1UVIwUDQxY3VtTnJOS0RCZ2l3WWZKeEJIVDBXcFY2UV94SURUN3J4QXpnWUpfMWZxOVZScms4a3FnMkhsUDFscnhqaFBBZmhBY1lfeWZqcUVJVHcyTmowcWw2QllDMGxGMGsxLWllZGtyLTZXcEJVdlJuN1FBc2FEVGhzRjU1V0RCRUg1MEV5UnhXcWU2RHdUc0ZWdnZxdEhQc3kxYmVJZUdxVHQyenZ5SndsemtlZU1hU2xFVXdHbXQtWGVscUJSU3lZd1F2OUZ3dEhxdEpxOHdx?oc=5,1778139065,Melamine Beauty Products Market Forecast to 2035: Growth Driven by E-Commerce and Premiumization - News and Statistics - IndexBox,Melamine Beauty Products Market Forecast to 2035: Growth Driven by E-Commerce and Premiumization - News and Statistics - IndexBox
gnews,beauty trend,news.google.com,https://news.google.com/rss/articles/CBMidEFVX3lxTE5iVWZhTmZVclk5VWJlOURZMUhsVDN1MEpDVGJOTTBWM1RFZGc3LWR2M2NLdlJ2b01PcG5Wb3BwR2pMeUZiZkVJV3Z3ZjJFUGctVFlGaHA5ZGNwaDYyTEpxa0ltWHlGQWFMUWxRN0NkdlF0aFFB?oc=5,1778080299,Matcha Make-up: the new natural and sophisticated beauty trend - nssgclub.com,Matcha Make-up: the new natural and sophisticated beauty trend - nssgclub.com
gnews,beauty trend,news.google.com,https://news.google.com/rss/articles/CBMihgFBVV95cUxQSEZJZ3FNNEJQYk5XOHhEQ3JTckJmaGJrVHQ2djk4WmxsTzlla0NLdkU0dVRFOWp2aUhwNm10LVZhQVVzWjl6RTFUMzdXNTI3OWxxNFRURUVtbHFOUWNOSWgzZkR2aVQ4WlVraGRvZnZtWmZFTi02S0RzVnZaSEZBemlWcGRQUQ?oc=5,1777990801,LookFantastic spotlights skin-first beauty in spring/summer trend report - Personal Care Insights,LookFantastic spotlights skin-first beauty in spring/summer trend report - Personal Care Insights
gnews,beauty trend,news.google.com,https://news.google.com/rss/articles/CBMikAFBVV95cUxQd3pHN0tHeVlCRGNBN3M4Z3ZaVGlwbGJKQWhEWnVtN0NOcmFuLXlEVzJrOTdWX2d3R0ptWURJY0pfRXZCQTFHcERVUzRBcDlUQ3dxR09jTW9fR2VyV2YySll3VzdGVHhQNXVMQWk4MzE3MWFISjMwLU0tQ05xYWxUMTFJMU9XZkFjdTVOeGtXemc?oc=5,1777948620,I’m Calling It: These Are the Met Gala 2026 Beauty Trends to Watch - Cosmopolitan,I’m Calling It: These Are the Met Gala 2026 Beauty Trends to Watch - Cosmopolitan
gnews,beauty trend,news.google.com,https://news.google.com/rss/articles/CBMiowFBVV95cUxPVjRnM2xfYTZwUzVtaGowREh3OVZpUUtsMy1uczFVSFc2enVUd1dyMG04WTJWc056eFUwRzZ3XzVncERraFd2RVZncDlMUmpQelY1WFhvTllnejVmMGVoelNSSnBuSjJHR3Z1TEJVVU1HLUlHWElldUt4RllaTzFuelg1bGFnMkRLUVhCUVhIZ0ZtRllHMnJ2Ry1WTGg3Rm5XVUhV?oc=5,1777993393,Blurred Lips Are the Prettiest Spring Makeup Trend at the 2026 Met Gala - glamour.com,Blurred Lips Are the Prettiest Spring Makeup Trend at the 2026 Met Gala - glamour.com
gnews,beauty trend,news.google.com,https://news.google.com/rss/articles/CBMiogFBVV95cUxOVktfbW9kQjZJM1c1YnVlS2ItcS1YZVNObWFlOS1pMU1meUktZUJMNmhlbXNXamRZNm5zWjdZdG1tdXFzbDNEci12cE1mMDlGQUc2T0JpUGl2V3Rzd1FaaTdNSFJ3TVdKempfa0hKdTFMNHpVZVdJYjRMeVlILVZ1TnNjdVlBZmFPN0FtWncwTmVqc0k1VTdJdFpBWTFNWlVuc2c?oc=5,1777935269,Met Gala 2026: The Invisible Beauty Trend Brands Are Paying Thousands For - Yahoo,Met Gala 2026: The Invisible Beauty Trend Brands Are Paying Thousands For - Yahoo
gnews,beauty trend,news.google.com,https://news.google.com/rss/articles/CBMijgFBVV95cUxOb21CMlBPUlZ0b3NOX0NWWXV1YVVWTVh6dDFJVTRTRjZFbm53bE0wQW1ZMXpNdUM3b0JiVTJyYS1DdTRlUVc1U3ZOdVJwRmZZVXA1Y3UxaHBXRENkZExpN0ZXVnlidTdWVV9UY2FzUjNCR1BwVnNVdV81a1NobUt0a21kNnZ5V1VzUUtmb1ln0gGTAUFVX3lxTE1tU2FURzRvbElISThuZTVDMGw2ZDJFTjRvcl9GWlNfdFFiOHVMSkFjQ0FqYkk5VFA4VHFjbktvaDE2SjVXXzZOLW5YVXdUN3pXOHVDZC1BM3pfaEkwU1FVZklMSUhxRW9lVTNkSnA5SlU5c24wNDh0b3pYS1V6T2Z6N1RtZVdwYmpLOVRUVXBvTkxoVQ?oc=5,1778099629,The 'no makeup makeup' trend is bigger than ever for summer 2026: What to know - Good Morning America,The 'no makeup makeup' trend is bigger than ever for summer 2026: What to know - Good Morning America
gnews,beauty trend,news.google.com,https://news.google.com/rss/articles/CBMidkFVX3lxTE90c0FsSlgwbGpqVkNPMWdCTVRTVUtQQmo1ZnRnY25aNFEyUXBLcXZ4cnF3UTUzZ2tWb2JlWnJkVW1qSXJ2ZnRzNXFGZ1RkRUVJSXNCVUN3bExsYnoyVFVWRTdFOS1QLXFvaU1xLXhBX2dneVZiTnc?oc=5,1777970528,Soapy Pedicures Were the Biggest Beauty Trend at the Met Gala 2026 - Teen Vogue,Soapy Pedicures Were the Biggest Beauty Trend at the Met Gala 2026 - Teen Vogue
gnews,beauty trend,news.google.com,https://news.google.com/rss/articles/CBMinwFBVV95cUxOYjlDZm12WUJLLW9fT1RlM3RXd0RmOUxTeGJuSUF6X2ZpcFRYVnJhN2FpemhIRko0NGhRN1lWQVh6MVFpTDNINm9kTktHM2ZYaGx1MENfaC1TQVdwN21jUDBfRDY4TmxkMEN6OEs0VTNxa3lSS0kyMkhVX25MLUgwODdmSkE2emtMbWdVUnhhQ3BuTWsxRFpDNjlwWTQ1elU?oc=5,1778129766,"Skincare-meets-makeup trend drives hybrid beauty shift, says GlobalData - Retail Asia","Skincare-meets-makeup trend drives hybrid beauty shift, says GlobalData - Retail Asia"
gnews,beauty trend,news.google.com,https://news.google.com/rss/articles/CBMickFVX3lxTFAtNnAwOTkzdFpINDJIOTBiSDk3ZWJDSW1uMG1RZnNmOUphU1J6ZlFySmdZbG1iR1c1YUtrdm9JLXJ3TzNHVHFvNkIwQ283dnlOWV85OTdic0VuSGQ4TThzdmdXZ0lwRmI4NDFkLU96a3NJQQ?oc=5,1778176122,Y2K Called and It’s Bringing Back Frosted Lips - Marie Claire,Y2K Called and It’s Bringing Back Frosted Lips - Marie Claire
gnews,beauty trend,news.google.com,https://news.google.com/rss/articles/CBMiogFBVV95cUxQX3ZpS0h4YnA5ZFFfTXhONmhJaXVIcTRGVkdHOUt4a0tjWlNLSkNBTlZpS2JyMC1oeEFheHRmZnprdE5jX0VRWm1MdWlyTGltU3I2VGliMzNZb2pBMFBWNnEzRVB3VjBoX3JLVDE3Y0ZBekVFWW9ONGhkeGpoNHg0dVB6RXE4OXg5ajM0RDFPZnVzYTlQSXVLelNCZUlMZ28wcmc?oc=5,1777947360,The Met Gala’s Boldest Beauty Trend? Invisible Eyebrows - ELLE,The Met Gala’s Boldest Beauty Trend? Invisible Eyebrows - ELLE
gnews,beauty trend,news.google.com,https://news.google.com/rss/articles/CBMimgFBVV95cUxQV3ZDUUZfMVpJODVaTXRPWXhHQWZ0ZXZMTzE4eG50UDlsRERwOVF1eldUWHR1YUQyYV9BU2haUlY5Xy1WeXJReEJMeTYzMTNCMVZ3SEt3Tk1sOW5HRGlIOXlXSkFPNXhCR29Ma2EyUjBVZXJjYWdCZXF0UHpGbHQtczd3MnFDcUJHd044c0JTeXlTME55ZFZZbzRn?oc=5,1778006940,"Mascara Is Over, According to the Met Gala Red Carpet - Harper's BAZAAR","Mascara Is Over, According to the Met Gala Red Carpet - Harper's BAZAAR"
gnews,beauty trend,news.google.com,https://news.google.com/rss/articles/CBMicEFVX3lxTE9sTk82QmhRUGFSVE0wRDhLRWNQclJLUmpWSlZJR3NPNWJIa2h5Mld5MERra1hfUGV6cWtwZVNXSEdraldKVmVMa2Y3Nzc5OUc5RmoyV29kOWlJVTY2UzVpalJiclFsX2x3czdUVWxtb1k?oc=5,1777014000,Watercolor Makeup Is Spring’s Softest — & Surprisingly Easy — Beauty Trend - Refinery29,Watercolor Makeup Is Spring’s Softest — & Surprisingly Easy — Beauty Trend - Refinery29
gnews,beauty trend,news.google.com,https://news.google.com/rss/articles/CBMijwFBVV95cUxNc3N4cm9LLTU4N3Y5bnNPVi10bjFuU1JXTXZJaTd1dzB0VlJMVTdacXVYME9kZ1NHS3lvSG5ScDhkTjdqVTB6em1Vb3dWN3hWcWtTSWZRbnZ2aTl0SEpMNXhvX283UUN5VDdtc0J0U0Zjb0xOY2FpTjFBNElCeG8wb1hWbGtjS0FaT1JiQVdHaw?oc=5,1777663020,The Beauty Trends Predicted to Make It Big at the 2026 Met Gala - WWD,The Beauty Trends Predicted to Make It Big at the 2026 Met Gala - WWD
gnews,beauty trend,news.google.com,https://news.google.com/rss/articles/CBMilwFBVV95cUxNNFM5QXdoZURLeTVYaGZZRDhjNmo5OTJrdjg4SFdlWlAxSUxRYklwc2ZJeFl6WENldTVjdHN6X3c5LWRjZGdIN2ZlRGViaFEtTDlzQUo4eVRRbmhXRzlYYkxBWjVIM1hQMXFBS0ZybEpnWGFMdTMwTkZ4OXhoYjlkXzNLM1RaWkliMm5qZnF2ZUZzZUpmd3lr?oc=5,1777570260,Latest spring beauty trend to try | Go-To Girlfriend - CBS News,Latest spring beauty trend to try | Go-To Girlfriend - CBS News
gnews,beauty trend,news.google.com,https://news.google.com/rss/articles/CBMiekFVX3lxTFBfSEsyQ21OUzRuTTA4TWUtOTRpcHhsTWFySERUVzMtbXJQWTBPU0NnUGZZM0dzLWdLVENYM0J1TEhBcDB4ZmpLdmZRdFI3Um9ZZHdoQzdRXzQ2RkJKT3VDREU5QzE1dzVBSEpqMjJFUnk1bUNmWVpoRzNR?oc=5,1778092260,The “Instagram Lip” Is Officially Dead — Here’s What Replaced It At The 2026 Met Gala - Refinery29,The “Instagram Lip” Is Officially Dead — Here’s What Replaced It At The 2026 Met Gala - Refinery29
gnews,beauty trend,news.google.com,https://news.google.com/rss/articles/CBMilgFBVV95cUxOQ0llWk4tOW4yMWg0TDktbGkzSlR6MDMzU2c2c2ZFLVFzUEgydGpPMVZISVNCeEwxcTVjUVZZV254Ry1mOHNnellzeFJRd0lpQnNpeEpLY2RCaURKQ3hjSW1oQTlUNUJzZm8zX1gtZHU0R0lTcFhpcG44anRMZUdZTmw0eVdXQUdwdGlGV29QeUktQkR5dmc?oc=5,1777945320,I Spot Beauty Trends for a Living—This Will Be the Most Popular Makeup Look to Come Out of the 2026 Met Gala - Cosmopolitan,I Spot Beauty Trends for a Living—This Will Be the Most Popular Makeup Look to Come Out of the 2026 Met Gala - Cosmopolitan
gnews,beauty trend,news.google.com,https://news.google.com/rss/articles/CBMiogFBVV95cUxObzVFYnBIUEZ4SjJ3c2dUbFJJTTAwVlRMOEUzODVLb2NYYzNWLVdJRER1bmUtVGQ0czRvM0ZkYVF6b3hLUDgwQldacGd1NHVDMHlsVjdQU2d4OUlCZG1Oc1JsYUlBYU9IX1ZTM244MlhzSzZ6Q3V3ZU9lSm8xVVpWTUNhbC1JcFV5emNFbkVrT1hMQzR3VTJkbm9VeW1nOGpCY3c?oc=5,1778017091,The Met Gala’s Most Memorable Beauty Moments Came From Black Women - Yahoo,The Met Gala’s Most Memorable Beauty Moments Came From Black Women - Yahoo
gnews,beauty trend,news.google.com,https://news.google.com/rss/articles/CBMigwFBVV95cUxPN2NNRmtqZjBzYThxWjIzeEJ4SXJIdWJ3RTlRaTFJOFlTY1owMGoyWENhMno5eXBfME1aazZCTWsyMXRjenBsZ3J6d0VDT2NsTUdWb1pfbXFiOUotWTBYSkFyWm8xRlFzT2sxS05TZGZEYXVUVjF6MFpNVWtLSGJvX3dIYw?oc=5,1777944706,The 2026 Met Gala Proved That Beauty Is Art—Every Glamorous Look We're Swooning Over - Who What Wear,The 2026 Met Gala Proved That Beauty Is Art—Every Glamorous Look We're Swooning Over - Who What Wear
gnews,beauty trend,news.google.com,https://news.google.com/rss/articles/CBMic0FVX3lxTE9hWU12U000M3lhWHlBYWxfVjJ2VThRVHJLUC1MVFdCT0ZHSDFXcEx0azJIdlRYeGlVaW5UaUJJNHA0cUFLbFgxMUIwNjZQRVNCZTBFcHBlTEZSbHk3VnM3cHRMMXdicDBkeTNxRC15NnZfMjQ?oc=5,1777788000,"Almost 4 Decades Later, And These Iconic '90s Makeup Looks Are Making a Comeback - Who What Wear","Almost 4 Decades Later, And These Iconic '90s Makeup Looks Are Making a Comeback - Who What Wear"
gnews,beauty trend,news.google.com,https://news.google.com/rss/articles/CBMikwFBVV95cUxOUl8zZEZpVVZLTXRWdExfb0lrQlFQN1NkSmp1dDlYWnNpRnduYnFac0Y2aU1UeDY4bkZpUHZJVGFKczRnVWNfcjBibEo4c2RNRHFIU3pYWnB0M2g1VklvOXVGMG5jVnVIRjlRSDNCcC1WdnItZXNHRXhQYlBCRVpWdU1tU2FyMnBBcUdMNGRkOFRFclk?oc=5,1777948680,Bleached Brows Make a Bold Play at the 2026 Met Gala - WWD,Bleached Brows Make a Bold Play at the 2026 Met Gala - WWD
gnews,beauty trend,news.google.com,https://news.google.com/rss/articles/CBMiqgFBVV95cUxQMndXdFNJazJPUjVHc2NwVUt1azZzRnpZMzNFcHFIVTFTVzJNNmsxYmQtUlRmOEswV083cUY0d3d2U0VkWFE0cU5LZmc4RUJ0WWVWdGd5bHU3YkVNeE5XVEQ3TEVzY1VGWlJ4WEtvVTFpSmpPRTdlamZVQzB2MTlMWEk5OU1FSlVrVVVkS3VJRXZfTF9tNmIyS2pqM0hmS0xhLWFqeWJQSFJ5QQ?oc=5,1777953810,Inside the ‘Barbie Drug’ Tanning Trend - WWD,Inside the ‘Barbie Drug’ Tanning Trend - WWD
gnews,beauty trend,news.google.com,https://news.google.com/rss/articles/CBMidEFVX3lxTE1jUWhEeGZXb2Y3MHMwbXNhMEppcHg3eHVTNXBHRjBoNVU0WXY4LTAwRlJBRDMxVHBHZGZ6VERtbFFVWjVPTEY4SVVBY1VhZXJEOERQTVBoXzZnNGNjM1pIcFJBYlF5U3VJVHZvUjBqNks2Z2s5?oc=5,1775718000,We Asked Southern Grandmas What Old-School Makeup Trend Should Come Back - Southern Living,We Asked Southern Grandmas What Old-School Makeup Trend Should Come Back - Southern Living
gnews,beauty trend,news.google.com,https://news.google.com/rss/articles/CBMiekFVX3lxTE8tUmM3U2ZiWUI3b0NRQXhBellfQTFFb2tQclF5VjVVWkt0azktc19vRlF6bVVmRmtTWGY3SjAxbVV0VlBiWWhKUmJmSmFzc2dEWl9fZTRCVkM3emlFYWh4UU9HUEdWei1LZVQ1YTJfQnVYT3g1OVI2SWZB?oc=5,1778095464,"The Case For ""Fawn Freckles,"" Summer’s Prettiest Makeup Trick - Bustle","The Case For ""Fawn Freckles,"" Summer’s Prettiest Makeup Trick - Bustle"
gnews,beauty trend,news.google.com,https://news.google.com/rss/articles/CBMijAFBVV95cUxNY09iOS13dHFEdS1HZnJoUGNwc1RodjN5NnhRcm5tb1lsVElyZGVCU1F1YU9yeG11QU9kN0pCWjN0WlczdVlyUU4tbWItM1M5Z2liUE1XZTBDdW5IS0s0cmpnaW9mZHIyTGNQZDg5NUFScW1ab3VLOHNDWXhQOVlXTVBmTmNCeGtzajNkXw?oc=5,1777986671,It's Official: The Dipped Manicure Is the 2026 Met Gala's Chicest Nail Trend - Who What Wear,It's Official: The Dipped Manicure Is the 2026 Met Gala's Chicest Nail Trend - Who What Wear
gnews,beauty trend,news.google.com,https://news.google.com/rss/articles/CBMibkFVX3lxTE5LdjFyZVZyVmZNeEotMDZOTlNRaW1KNHNDaDdPLVFnWlozVTI3MUYzS2xMRG55NDRIUm9pbFNkT2duOTlQUkJZbkhBQ0lQT1IzWlE1ckswYWhDdWZBSzdGYk9tRklNa0N0N0hVZFZB?oc=5,1777530540,“Wet” Lashes Are The Romantic Autumn Makeup Trend We Can’t Wait To Try - Refinery29,“Wet” Lashes Are The Romantic Autumn Makeup Trend We Can’t Wait To Try - Refinery29
gnews,beauty trend,news.google.com,https://news.google.com/rss/articles/CBMi1AFBVV95cUxPWHUxTmQtSkxnWWVaUWpkTzVvZDRqZVB6MUF0WUdON2JkOUFPMV9xNWxTODFiUVFSQ0xCZ2tsRmsxZkdneHBIUUxaaFNabC1oQVA3WEZ4TzlLaU9zemVNa1FEeXh1MnFXUkw0NGZqNXZyNFlreTI1NlgzbjJfZFNIM29RaFlwbzdCcjFxVE51Ri10YWg0VEw3MGRJLXBzem10dWVtY2NyVnBNdzdKdUh5bzNCcnl3dWYzTkxDdkJ0WTEtWWt3MHlzN0lXTEFnTGNqZnkwUg?oc=5,1778153624,"MFW 2026 beauty trends: 3 game-changing hair, make-up and nail looks to copy now - IOL","MFW 2026 beauty trends: 3 game-changing hair, make-up and nail looks to copy now - IOL"
gnews,beauty trend,news.google.com,https://news.google.com/rss/articles/CBMimwFBVV95cUxOaDFpVkh0akZSWVpOc2JjUVZUdHBSN2VJejVPRGhQaGZDT2dwNWNvZm8wTjBsWHZaeVVPUUlYUC1TbzFYeWlwVE1kbWVOSnMwanZXSkd0Z2RHeDhENGRoWjBLZ0RadzdjQXBNN2licWEzUmtQbzdsUTM5SnhtUURnQU4tOGFkSmVmdk5Wc1dhTDMtUXhldHROQ0xWUQ?oc=5,1774854000,"Festival Beauty: Hair Trends, Makeup Inspiration and More Ahead of the 2026 Season - WWD","Festival Beauty: Hair Trends, Makeup Inspiration and More Ahead of the 2026 Season - WWD"
gnews,beauty trend,news.google.com,https://news.google.com/rss/articles/CBMibEFVX3lxTFBxMkpseU5ZTnduYkxPY3VNWURiWHdNeENRNVNjTUZEZ3psU3F0VTFhVEJvemhMdnlZLWd2alZrbUJsME9yRlBmc3F2OVc0UWJCT245UlA0SzFDMmFvc2xFa19YejA4ZHVuR1dyRQ?oc=5,1775113200,"Amal Clooney Tests Out Spring’s Hottest Beauty Trend, the Blurred Lip - Vogue","Amal Clooney Tests Out Spring’s Hottest Beauty Trend, the Blurred Lip - Vogue"
gnews,beauty trend,news.google.com,https://news.google.com/rss/articles/CBMiigFBVV95cUxNNGtmUmZKaC0wRDVWRXlxR3Z0QXNNWXhUV3lMVXRVVDNCYk45ZUpDOU0wTWhfeGFXcVpmcmp1bVpoVUFIZHBKWFBLZng4eDJISm9uN3BQTTFPaXdWV21CUjlJbURHQTh4cU1uQ3RlR1VSdHZZLVNsUnZjZVptblVlMFREVlozeDlSVHfSAYoBQVVfeXFMT3YxS0pERVhCVlBKRVhRMUs2YW54OVlnZVlNNEVzLWtRa2owWExPU3d3M0VQR3RLWnpfQjIwN25fczFVT1NyZDN0d0xBb3c3RFRjaHc3ZEdCbWxZS1JSUEV4RHNzY0ZXRnFXODVGc2duUFZKSkVXNnZfOElTMlpkU1JIWFg4MlVIOGVR?oc=5,1775286000,How South Korea's K-beauty trend boosts soft power - DW.com,How South Korea's K-beauty trend boosts soft power - DW.com
gnews,beauty trend,news.google.com,https://news.google.com/rss/articles/CBMiX0FVX3lxTE5jTTVfaFhoTUdCbDlKdVZ4NVJQZTlJdG9raTFsbjFLbmRSWFc4Q0c5QVBpUTNNRlZRbzcyaWlFbkZTcFRxQ2ozVlhQX2FKTnhFLW1BNkllTTBHVU10M3Uw?oc=5,1774508400,The Playful Makeup Trend is Beauty’s Rebuttal to “Clean Girl” Minimalism - Vogue,The Playful Makeup Trend is Beauty’s Rebuttal to “Clean Girl” Minimalism - Vogue
gnews,beauty trend,news.google.com,https://news.google.com/rss/articles/CBMipAFBVV95cUxNSkRNckxZU3R0TTJNM1o2VVpFay14eXNtMU5JVERnU1AwVDlwSUxjNm5lVnhQRW5WX3hFeGtSYnh3MTYwNlpwV2xTMUlYMGNnVkdnemFveVZiZlhWX3FVTFdVUkJqUmNING9tZ05hbldzTWs1SXVnUktLNlNRcUIzMFhHQTNnN0hna1VLVHdGN0d5UzZldFFrLXpGTjI1Y2t0TUthQw?oc=5,1778003858,Khloe Kardashian’s Nighttime Skincare Routine Includes One Very Unexpected Ingredient - Us Weekly,Khloe Kardashian’s Nighttime Skincare Routine Includes One Very Unexpected Ingredient - Us Weekly
gnews,beauty trend,news.google.com,https://news.google.com/rss/articles/CBMibkFVX3lxTE1YQS1wdWsyemZVbU4taFMya1JiaDZLVjFPQ0FOcXBNempoY0VrbmNoZ2JXQVJBQnczdGxJRW9VY183Zm5lYVpTcWRYcG1yaXFrUmVwT05nZmtBb0g1S2VWX3ZDZGIzVFdTWWJtQ1ln?oc=5,1775545200,“Wet” Lashes Are The Romantic Spring Makeup Trend We Can’t Wait To Try - Refinery29,“Wet” Lashes Are The Romantic Spring Makeup Trend We Can’t Wait To Try - Refinery29
gnews,beauty trend,news.google.com,https://news.google.com/rss/articles/CBMiggFBVV95cUxNVjBGbU5OTTJNbGh4SUdybkRsbXlSZTFzM2lfQ1YtQmstM2dRMHBObVZBSUtqM0RueEtaaWVzN1B5TGJrN3owSEtveWd4ZTVpOGZXcHhrdnVMLVA5TmtpWlN4T3VZUnQxaFBjZDZ4bWhjeUZJQlozUFZLdUhwbDBIV1BR?oc=5,1774940400,5 new-era beauty trend upgrades seen at Cosmoprof Worldwide Bologna 2026 - Cosmetics Business,5 new-era beauty trend upgrades seen at Cosmoprof Worldwide Bologna 2026 - Cosmetics Business
gnews,skincare trend,news.google.com,https://news.google.com/rss/articles/CBMihgFBVV95cUxQSEZJZ3FNNEJQYk5XOHhEQ3JTckJmaGJrVHQ2djk4WmxsTzlla0NLdkU0dVRFOWp2aUhwNm10LVZhQVVzWjl6RTFUMzdXNTI3OWxxNFRURUVtbHFOUWNOSWgzZkR2aVQ4WlVraGRvZnZtWmZFTi02S0RzVnZaSEZBemlWcGRQUQ?oc=5,1777990801,LookFantastic spotlights skin-first beauty in spring/summer trend report - Personal Care Insights,LookFantastic spotlights skin-first beauty in spring/summer trend report - Personal Care Insights
gnews,skincare trend,news.google.com,https://news.google.com/rss/articles/CBMicEFVX3lxTE96eFRtR1g5NG15VmJxdk9GX3B1V1FJdWRDdkJPb1pHMWk3d2pwMV81WFBURlJxaHRadVZTWUFKR1VSc21KX1lyVTUxa2NSa05nRmxUU1FRb1hFVWNvc2hDZ25YYUQ0Y09jMzNhLTZuWGk?oc=5,1777627800,The Vogue Business Beauty Trend Tracker - Vogue,The Vogue Business Beauty Trend Tracker - Vogue
gnews,skincare trend,news.google.com,https://news.google.com/rss/articles/CBMinwFBVV95cUxOYjlDZm12WUJLLW9fT1RlM3RXd0RmOUxTeGJuSUF6X2ZpcFRYVnJhN2FpemhIRko0NGhRN1lWQVh6MVFpTDNINm9kTktHM2ZYaGx1MENfaC1TQVdwN21jUDBfRDY4TmxkMEN6OEs0VTNxa3lSS0kyMkhVX25MLUgwODdmSkE2emtMbWdVUnhhQ3BuTWsxRFpDNjlwWTQ1elU?oc=5,1778129766,"Skincare-meets-makeup trend drives hybrid beauty shift, says GlobalData - Retail Asia","Skincare-meets-makeup trend drives hybrid beauty shift, says GlobalData - Retail Asia"
gnews,skincare trend,news.google.com,https://news.google.com/rss/articles/CBMigAFBVV95cUxOUS1HbmlULXhMczF2WGMzZzlESUZWeDZ1ZWRnNGtoQ2lLaloxR3FubExGT1ByVkdwdy1DSnlEeG13SklzQlJQWWp6WTBpdFNRTGIyemJ2ZzA2YkxyRTdvQmFhQU5mMzcxYldDeXBDZ2hlWXNYZjRacjlfQ2JBeWpURA?oc=5,1775113200,TikTok Loves These Skin Care Trends — Should You? - UC San Diego Today,TikTok Loves These Skin Care Trends — Should You? - UC San Diego Today
gnews,skincare trend,news.google.com,https://news.google.com/rss/articles/CBMingFBVV95cUxNU3lOR2hhM29hNWxDVHhHeFR2MlJRcUF2ZFFhWDdQSkZvekpGLTAxMDVSMDVxNzh3dFktcUtCTy1DNEFhdjdNaFRTQ3hHLVVGajdoZDh5QmVPYzBUVG1xZkxVMFA4azhCbE1LSnFOQnZjem1fQjR1bjJfWmVpTmx0WmRYOEVVUkI0cFNLRGkzaVotRmVBdElKVmpubTZoUQ?oc=5,1774854000,Salmon sperm to bird droppings: The science behind bizarre skincare trends - BBC,Salmon sperm to bird droppings: The science behind bizarre skincare trends - BBC
gnews,skincare trend,news.google.com,https://news.google.com/rss/articles/CBMiowFBVV95cUxPS2xFaXBLT2pNemlidnpiSk5ScDl0SjFkSmtISE44OXJVZ2NQYUpBa3dhUnQtREpJNnN5M1dndlRuazRabHRuSGJFbWd4NWZ4bGE1X2dlbDdyRmpSQ0JyWjkwdVNkN1A3Q2pwU2dtOVJDU2JMQXNtZDB1OEJhUmlCQ19pSzkwRTJEQ3c1bWlsUFB4R2dTNnhZeVlDVmx5eXBwOEFZ?oc=5,1776322800,'Korean skincare trend' going viral on social media - KUSA.com,'Korean skincare trend' going viral on social media - KUSA.com
gnews,skincare trend,news.google.com,https://news.google.com/rss/articles/CBMi8AFBVV95cUxQN2FkRHNPWEZrelZKZkIzNlY0Z29ReVIzYTMzQV85MTZJd0VCTHJ5RjFGbEhNNEJ2NmVMS0lhMkctMDU1LW05TGgzSHlsNWxVY013SDk0RWo4UTQwU1pGci1JdTlVaHR5N2c0X0M3MHo3bXAyb05IWkFWXzAtRUhBRHVObE53dk9idkFlZmtPNmx5aW15TE5zaUN3eEo1cnNRQ085NklkZjNKbnVVYUM3VGhrVkZVa0YxeElZR1FlM2dfNzIwTzR0andUV1NQVHk4azh3TVhVX3hKRG5SMDZxRnA5bXRoMzU0U0dPWjY0MXnSAfYBQVVfeXFMT3dQa3FwcDRfc0E4YTVkQVBmdlJKdUNOUzJnVUJSbUpBTnM4SHpabXUwOEUzdC1iT0xrZ2YxV19jMTlaOGtoUURqVlR0RW16bHF1M1hlekJCTWNZOU9PVUE0SlNvQXNjS0VvVmJBZXRjSXRoTkd0anRpOVlsdWRueXltNm9zU1lEdnBvemMtMFotZHBpQWRKZ252bTJVZnROYnUzdmFyYjdPYXpRR0pQZDVMZmdlWGwySUVPZ2xEc2IwUV9jakk1MWd3VlRVbGY1Vk9JVndJT1NNdF9YWEdxbFFJLVFhQ0JYS3JfcS1raDZhaUJmUW1R?oc=5,1775890800,What is skin flooding? The viral skincare trend dominating your timeline in 2026 - The Times of India,What is skin flooding? The viral skincare trend dominating your timeline in 2026 - The Times of India
gnews,skincare trend,news.google.com,https://news.google.com/rss/articles/CBMibEFVX3lxTE45NmpYbk50Ry1jOFdkUXdCanJCaEhlN08ySndiZG93eDJVM0lwbTVjdU9kblA1U21oekZ5aThJcHB1ZlUtcmhYWGpxRzFsV28zakJIQWtlak5OTzVjUjV3ekhxN0k3ZTQ5YVdaNg?oc=5,1774854000,"Jelly Beauty And Jelly Skincare Are Taking Over, Here’s How To Master The Trend - Refinery29","Jelly Beauty And Jelly Skincare Are Taking Over, Here’s How To Master The Trend - Refinery29"
gnews,skincare trend,news.google.com,https://news.google.com/rss/articles/CBMiigFBVV95cUxOdmY2Yld5b1R3VWpBdnd4YmFFQTNUWFNHVEtIdGRRcEZKVlFwUF92V0ptZDg2Qzd4N1dvXzFOUjdoNWlmUm9nOTFRMW1oejhGRVlieTZ6UEFkMGllSGlRYXNsYlBQMkJmT3ZqcGxkOXBIVmY4SGF1WlB5NzJ5ajZHMHlVdzV2TjFhOEE?oc=5,1776322800,'Korean skincare trend' going viral on social media - Yahoo,'Korean skincare trend' going viral on social media - Yahoo
gnews,skincare trend,news.google.com,https://news.google.com/rss/articles/CBMibkFVX3lxTE9ldWVMLUNOZnMydTBVelZISllvblRBVVp3ZEdadWozS3o5MC1jZWtkTzZIZFJ3VUVjTFlvSTNyWXZ2SHdPMDVlV2VSMXVCSTVmRUpuWXhFSFJLcUFud3pCeXFXakJ3aXBndGZraU9B?oc=5,1775718000,"Peptides Are Everywhere In Skincare, Here’s How To Use Them Correctly - Refinery29","Peptides Are Everywhere In Skincare, Here’s How To Use Them Correctly - Refinery29"
gnews,skincare trend,news.google.com,https://news.google.com/rss/articles/CBMijgFBVV95cUxPNVY0aEJvWk90MFJuQ3I5TDF6OEtiNVBPRTl0MEZIOUtyeWVfcjhVYjRiNkZtUmxBLTJKSHYxUjdwbUxEWmRPMjM2Q2dDM0FHOFJXZC1qRnA4UkhOU1p2dXg2YXBLbE9MM3lPVzFHRmRTVV9HWWFzbzlSeUFocGpUYVBCTkcwQUJmMjNXeHJR?oc=5,1776409200,A Cosmetic Chemist Tested 678 Beauty Products—These Are the Biggest Trends - Good Housekeeping,A Cosmetic Chemist Tested 678 Beauty Products—These Are the Biggest Trends - Good Housekeeping
gnews,skincare trend,news.google.com,https://news.google.com/rss/articles/CBMifkFVX3lxTE92Y183NHBiN0tLZ25xVEVJdEFRcnBKYlgtMEpVQWhEMXBTSURXYVl3YVBCb28tR2hLakF3SVR4WW5LM3hYeGRLVTRJbkI2ZjBlWXB5NE9mM0VxNjJuT1FBeWdDY2dpWWdqNjc3NUV0MGY0Nl9YMmhvVjJNdzA2UQ?oc=5,1775458800,What are spicules in skincare? The K-beauty trend explained - Stylist,What are spicules in skincare? The K-beauty trend explained - Stylist
gnews,skincare trend,news.google.com,https://news.google.com/rss/articles/CBMivgFBVV95cUxQQUZ1UGRJTEQyX2k4Z3ZnUnV6eVJaR1hRUkR5dUtPSlgtVXRraHhmRzdkMThsYnRtT2lqZ3JrN204OEJ6enY1Yks0eGZMWk1KaWdrSjRvVGV4R2h0MURoeXdfRGoyOGp5bEk0Qi04MnRKWEQ3U2p4cTZ2bThaak5hWjhBRFpieHdWWDAwRV9ERDhJMm5lN2M2MnY5TTJKbUFiWkc0bktWcUxKR09tN21IUURVSE1ELVRYdTlYREpR0gHLAUFVX3lxTE5kV2dJeUFtOXJpeW5aOXZhcFFnVHZDLUF6RTVub1dZdzhUUzVkOUhaNE10YmZUVWo0eUJjMGxUWG55dGdaV3RxQ2RfVXVsSndTR3VQQzVFUG9VSl8xY1JtS3YyVkwyZmo0aWxqZXNocFEtOWxyNElZTExJbm5zX3pjUUwtSHE5bUxIeldzRGNNT0ZKbFNtMFJTSld2SEdwVjVDOHIwbllqSXZTWnpXcmE4X3l5dW1XdVBsSHRYanZWME9iVzI5czR3MnJZ?oc=5,1776236400,What Is Skin Flooding? The Viral Skincare Trend That Everyone's Talking About - Esquire India,What Is Skin Flooding? The Viral Skincare Trend That Everyone's Talking About - Esquire India
gnews,skincare trend,news.google.com,https://news.google.com/rss/articles/CBMitAFBVV95cUxPTnZnZWdTM2JqbG1kRHFoaUJ5c2JEWjhLLVBDSEJPZ0NhWjZaX1JrUEJxeTZaeEtMSVd4blNEY0lkLUg2YXFjc0kyZWNXZ0tfYzY4M0pwcHQ0WDE1NmlGSUh1YkFLdFU2dERGaUV6NzQwY1hnazNGSC1veW5WamRjQ0FqZDFia0hnR2VzcTBrU2xVcXVIT2V3NkxqcWpPUGFvRklxWGRENnBPT1k4R0RnRktpdU8?oc=5,1774767600,Forward-looking skincare trend analysis - MSN,Forward-looking skincare trend analysis - MSN
gnews,skincare trend,news.google.com,https://news.google.com/rss/articles/CBMilAFBVV95cUxNdDkweU5QS2RTdDVsYm1wSXdrRGlpSWpfMjJJUXB3V3didUU0aHczbWJWRFBGa2JveEEtTkRzR0dZUGRMdDZGNkwxYkk4ZGN5clpaSjhkNDB6R2FFd0kzUTFhVHpWTE0yUnFxaVVvWTRrRUE0LTBwOGhGbGp0dFVPdnpGMWlEQWsySjY2VGhWdGwxV3hn?oc=5,1775372400,Scientists weigh in on unusual salmon sperm skincare trend as they assess real results - UNILAD,Scientists weigh in on unusual salmon sperm skincare trend as they assess real results - UNILAD
gnews,skincare trend,news.google.com,https://news.google.com/rss/articles/CBMijAFBVV95cUxNZEwwTDNuTXVMSllQRG5NV0o5RnpuTk1SVTN6aU5MNHVyeTdVYXpEc1VONWlKZUtjV3daVE9weHJvUDZOX01BR2tFX2xUNHZ3andYdk5vOXJHaUF3U3R2MURsal8yNDhFOUdxQ2h0c3ZPNURtNmZJbW5MSDFJLU81c1hNYkkzMml0SlFRNw?oc=5,1775113200,‘Vaginal estrogen as a face filler? I think not’: Experts critique the new skincare trend - The Guardian,‘Vaginal estrogen as a face filler? I think not’: Experts critique the new skincare trend - The Guardian
gnews,makeup trend,news.google.com,https://news.google.com/rss/articles/CBMiowFBVV95cUxPVjRnM2xfYTZwUzVtaGowREh3OVZpUUtsMy1uczFVSFc2enVUd1dyMG04WTJWc056eFUwRzZ3XzVncERraFd2RVZncDlMUmpQelY1WFhvTllnejVmMGVoelNSSnBuSjJHR3Z1TEJVVU1HLUlHWElldUt4RllaTzFuelg1bGFnMkRLUVhCUVhIZ0ZtRllHMnJ2Ry1WTGg3Rm5XVUhV?oc=5,1777993393,Blurred Lips Are the Prettiest Spring Makeup Trend at the 2026 Met Gala - glamour.com,Blurred Lips Are the Prettiest Spring Makeup Trend at the 2026 Met Gala - glamour.com
gnews,makeup trend,news.google.com,https://news.google.com/rss/articles/CBMifkFVX3lxTFBQU0dyLXR0ZGNlaDlOZXQ1djdfa3paNUdvLW44UmduVjFuLWYzMG12NjBwZjg2Z1Q4N25BUXpVQ29qRmJ3dXRVSjEyQmdhNnFPSWt1bnNzZVZoZW1OMVB4RFBOX1JZcEllMkFIcmo0UnZSVERITmFPZEJyWDRyUQ?oc=5,1778095911,"The 'no makeup makeup' trend is bigger than ever for summer 2026: What to know - ABC News - Breaking News, Latest News and Videos","The 'no makeup makeup' trend is bigger than ever for summer 2026: What to know - ABC News - Breaking News, Latest News and Videos"
