source,domain,url,created_utc,title,text,query
gnews,news.google.com,https://news.google.com/rss/articles/CBMicEFVX3lxTE96eFRtR1g5NG15VmJxdk9GX3B1V1FJdWRDdkJPb1pHMWk3d2pwMV81WFBURlJxaHRadVZTWUFKR1VSc21KX1lyVTUxa2NSa05nRmxUU1FRb1hFVWNvc2hDZ25YYUQ0Y09jMzNhLTZuWGk?oc=5,1765535400,The Vogue Business Beauty Trend Tracker - Vogue,The Vogue Business Beauty Trend Tracker - Vogue,beauty trend
gnews,news.google.com,https://news.google.com/rss/articles/CBMickFVX3lxTFBPVlJvR2hTcnd2WDd0UHd1N2NVcG1HR2hQT1VLTDNlOVZtcVk5Z1BxaGxEOTByTF9admxHOHhocm5SSkpoWWEzRFhJdWdsRlBraHptdDdRemU3X014T2VTWmdVVkJBWVZaS2U3ZVdYVlZadw?oc=5,1765826654,Pinterest’s 2026 Beauty Forecast: The Trends to Know - NewBeauty,Pinterest’s 2026 Beauty Forecast: The Trends to Know - NewBeauty,beauty trend
gnews,news.google.com,https://news.google.com/rss/articles/CBMifEFVX3lxTFBmLVVMR1FlTnliRmRUcUhGaUxHVlAybzFMdF8wVE1YcUJXcGlTRDA2MVRGMHo5RFlkS1NRTndid2pkMjVEZE1yRVVzSU1fMjRUTmlWejU4YXA2bDVZdXFKLWkxVkVoMTdzalgwSXQ2NC1fbHB2US1hQjg2akk?oc=5,1765836799,Pinterest trends for 2026: How consumers are seeking to escape chaos - Premium Beauty News,Pinterest trends for 2026: How consumers are seeking to escape chaos - Premium Beauty News,beauty trend
gnews,news.google.com,https://news.google.com/rss/articles/CBMikAFBVV95cUxQS2ZGdjdyY2thZ1o3V256ZjYzSDZmS1lTRUhrUnJacFBhSndoTGxySnN6aXpocDFINnR5TjVLZkp2c0d5TmUxampnckpTdlBRVGhIVVp2NGcyRnE2OVRqVUEtbGVibnM4YnAwSXV4dk0yQkR2ZGdINlpFd3ZrU1RzNVBzZGtuVVdadDBxVW15NjU?oc=5,1765822811,As a Beauty Editor I Track Nail Trends for a Living—Here’s What’s Next for 2026 - Cosmopolitan,As a Beauty Editor I Track Nail Trends for a Living—Here’s What’s Next for 2026 - Cosmopolitan,beauty trend
gnews,news.google.com,https://news.google.com/rss/articles/CBMi6wFBVV95cUxQQ0RaRkppT3Zvbk1pbW5pYTUxdldsdXhEVXR2LTFnam9PdW0wcE1UWmpHNzBEWkppby1aTTI3aURHU1FfYWtTS2hFYUNfbHNlVDhwc2pJNVB6WDdIaTV4dDNsRUpXRlZTd1BCSDhBc2xKUEI4Y3cycm5GSVY4V21BRTZ4NVAzS21Qd2dINFBfVjRrd09HZV9DMEMzM2hQdU5lX2hKTWNRemJ3eHQzcTBLb0pnNno5NE9WbnZWbTFsV1hjckVEc1Z5dFJlSUQ2cG5UbHdnMlN0S1BaNWtvSUh6OEhDbUs4Nlk0NjBB?oc=5,1765797436,Jelly makeup – the oddly satisfying beauty trend that’s everywhere - The Weekly Times,Jelly makeup – the oddly satisfying beauty trend that’s everywhere - The Weekly Times,beauty trend
gnews,news.google.com,https://news.google.com/rss/articles/CBMiZ0FVX3lxTFBGUWRkMXA1UjJVaFpGS2N0ZGVMQWxVaVBxYUE1aUUtTl9EdzJwUWlHTTZJYVE1WXkzOExnbW41NU1QRy1JekI0VjFUdHo2RkhmajN6bjB6ak1PM1NtY2dhY08zXzJ3djA?oc=5,1765609200,"These Beauty Trends Will Be Huge In 2026, According To Vogue Staffers - British Vogue","These Beauty Trends Will Be Huge In 2026, According To Vogue Staffers - British Vogue",beauty trend
gnews,news.google.com,https://news.google.com/rss/articles/CBMikgFBVV95cUxQNjhheUFSRzBJRDlObUw3eThSNmtwQjB4TlAxcWpuOUxESVZHU3FLUDMyc05Md1B3Njk0X1pYbDVjaF9ONUNTSnAzcnBGZVFuX2wtbi1VX1hYSVVYOWI1Sm11ajNvZ0hIUjhHc19wUndha2RYOXZqX2djSFJSU2lPY3ZRMGx4cUFWUW53bVRNNm9BQdIBZEFVX3lxTE9oS01fVnBWdmZQbGhJbzdqOVRyLXgxNTBBeFVsZXZQZzlBQk0tX2tEVGx0TTdweHZwR3N4aXVKZFRtejZuSWtsREk3aVc3OXZmYUxxa3B4TGl3LTNaZElPekxXVmw?oc=5,1765462430,Is the K-Beauty Trend Really Worth All the Hype? - TODAY.com,Is the K-Beauty Trend Really Worth All the Hype? - TODAY.com,beauty trend
gnews,news.google.com,https://news.google.com/rss/articles/CBMieEFVX3lxTE9sR3hMQXdiTDQ5MkR0RWZHdmNkUm1MQTd2Y1lwMTZaMTJueDR3OVFqby10eklSZWEyeEdpZ3QwZ1RQc0pYZ2VmQlFpMUhINXhKU2o4SEZtQ1laMDNfVUl6dUVnU0NIVVhHYW92cUNKbHBRUHBVcXVvcQ?oc=5,1765824739,I'd Like to Formally Thank Sheer Tights for Showing Off My Winter Pedicure - Marie Claire,I'd Like to Formally Thank Sheer Tights for Showing Off My Winter Pedicure - Marie Claire,beauty trend
gnews,news.google.com,https://news.google.com/rss/articles/CBMihgFBVV95cUxPMC1tTVRZX3hzOTdIV1BVWExCRTVRUFI2MGxYVm8tTE1BUnR1cmFyeTRXQzdlNG5KejhuUVNrd0xrUDBjQVhKZDc1cEFoTTFEZWJkX0g5eVlDOTFDdGlqV2tubFhXWjBHdGRFRUhWaHRVN0hGaXpudHZGNEY4cF9IOEtQY09Bdw?oc=5,1764144000,Beauty Trend Forecast: The Ins and Outs for 2026 - WWD,Beauty Trend Forecast: The Ins and Outs for 2026 - WWD,beauty trend
gnews,news.google.com,https://news.google.com/rss/articles/CBMiuwFBVV95cUxObUtDUkpIRnJZaUl0ak1EQ3NJMUNvQTZKYklwa2c1VWx3UWNuckdTYl9CSnYyTHpnYS1SOTBPQl9QbmxYVHdDaWthV2pTdVZxa1hwZllZOVIybjMxMHVXa1ozQ2ExQ2lWZE1SUXNMWVliTThoTGQ4U2txc1gzSkdJUm1ocXBuM19sVlhCTnZ0V0NKZzdPZ1pvZ1owTm1WWlpCN0UtSUQzcFNtXzUtOEFxQ0RXdGI3UEdQT05v?oc=5,1765829412,The Social: Embrace The Cozy Beauty Trend With These 7 Must-Haves - CTV News,The Social: Embrace The Cozy Beauty Trend With These 7 Must-Haves - CTV News,beauty trend
gnews,news.google.com,https://news.google.com/rss/articles/CBMiiwFBVV95cUxNVTd1NmZ1Uy1fVlNCS2hfNHFzN3BtcFhhZEtJbHhOM1VNemx0cTVmMUJYWHdxMWhTZjFRTlNkclAxd2JVZ1lmdTJOYjF0WjRNdjFvWG5Da2xrQzJ3eEQxM1BYQ2RPN05LUlQyY1pCc2d0cmU4LTZhRkxTb2YwVlFKTjlURnZBYTlfSHF3?oc=5,1764662400,Cosmetics Business predicts the top 5 beauty trends of 2026 in new report - Cosmetics Business,Cosmetics Business predicts the top 5 beauty trends of 2026 in new report - Cosmetics Business,beauty trend
gnews,news.google.com,https://news.google.com/rss/articles/CBMigAFBVV95cUxPT3NqQ3RRTkQ4WWFHc1d0UmdkcVNaSHhsS0NYNmJHSlBybFpfbV9RdVp6RGNfV2dPSzQzU3RyVkdVWjRWYmw0S05LMG5pRVhOWDF3aGxQMjNLNWl6NFp0c1BoTUNZa2xnU215ejk2M2pHN2NTcjdISk9aMHdnamlSNQ?oc=5,1765544210,Pinterest’s 2026 beauty forecast signals the end of fast fads and fixed aesthetics - www.personalcareinsights.com,Pinterest’s 2026 beauty forecast signals the end of fast fads and fixed aesthetics - www.personalcareinsights.com,beauty trend
gnews,news.google.com,https://news.google.com/rss/articles/CBMi1gFBVV95cUxQZThDMDN2LU1hM0ZpX2tsNzM0MFZQQXA3MlRTZUlVMDNPSW93VkJiblZmdDhvNmhNNUtxRkVvYUl1WWlLRFM1M0t4aU1UbGo4TkVFYzdxOWhoLU1Ec09OTHVKRW4tSzNSbTdXU2k0bWhSQ19MRGVuNERvMm1EZlFVZGE2THQzaXlSeWZxZjdZZlVYLTNaVlpIdmg3amFqVjNGTmpDNGFjbkhBaHhYRW1XZm9KTEx3NXplR1JxN002dFo1T0tfRmRuSFlTUGNiTHlQUU5jSTlR?oc=5,1765549564,Frost Bitten Blush Is The Internet's New Favorite Winter Trend — Pink Blush Winter TikTok - L'OFFICIEL USA,Frost Bitten Blush Is The Internet's New Favorite Winter Trend — Pink Blush Winter TikTok - L'OFFICIEL USA,beauty trend
gnews,news.google.com,https://news.google.com/rss/articles/CBMib0FVX3lxTFBGLXR6Yzh4TVlFZ2VUSHMyOEsycGZBeG5BLVZnTTcwVlpxTVRWNkdZOUppMmI1NXdlZDdiUlVLZXd6YXFSMmIwdnB1T3U3OUxyc0tiZEt3WDhPWlF4X2ZOd3M4Q0x5VnZaY0xxSHcxOA?oc=5,1765573588,Blurred Lips Are the Cool-Girl Makeup Trend to Try This Winter - glamour.com,Blurred Lips Are the Cool-Girl Makeup Trend to Try This Winter - glamour.com,beauty trend
gnews,news.google.com,https://news.google.com/rss/articles/CBMiU0FVX3lxTE5qY3gwWFNuYlpReWk4NDRaellHSEYzU0NZYkVGcTMxWmUxTzhKRUx2MXlwbjVWU0xvYW9sbE04U3hoX2I4bGlSTWtrYzdmbzZHWkFB?oc=5,1765353600,Data Analytics & Consumer Insights Tools For Beauty Industry - Circana,Data Analytics & Consumer Insights Tools For Beauty Industry - Circana,beauty trend
gnews,news.google.com,https://news.google.com/rss/articles/CBMihwFBVV95cUxPUkNvVVUxR2VaSDcwekpjdnhVZllqTlBObTNWQzM2TTdua1prb3JFSE4zczZob2lQVS1Pa3pnc294Zi1Bc19Ea0ZjNW9uZGpCTXJFRk80cmtwbl9ScjNwc3VRUHFyYkhXM3VqSGVZaEZtZ0hsaER1Z0l2eF94NWhtMXdHZTZwdDA?oc=5,1764316800,The 6 Coziest and Coolest Winter Beauty Trends to Try Right Now - harpersbazaar.com,The 6 Coziest and Coolest Winter Beauty Trends to Try Right Now - harpersbazaar.com,beauty trend
gnews,news.google.com,https://news.google.com/rss/articles/CBMiU0FVX3lxTE5Zc2JEY1ZmRWdMczgxeGYwTFllU291enFXcmVnOHozRU5rU3dNS1BidWhLcFZLWEk2dENSWkpzVkFoLVJjVHFQaDBDSkxmQURFVllR?oc=5,1765831508,"On the front of Dr. Melaxin's functional brand 'Philshot' ampoule product, which has recently emerge.. - 매일경제","On the front of Dr. Melaxin's functional brand 'Philshot' ampoule product, which has recently emerge.. - 매일경제",beauty trend
gnews,news.google.com,https://news.google.com/rss/articles/CBMifkFVX3lxTFBHdFNMZFd2MWVBbjRYMG1aT0NkRkZEQjQ4SENBaUg0ZmZRdzh1WjNLRU1GNzlfRGpVWmtULUNITXVCSzhyd1MwQ1prNzdEQzNLNVNHRDdkVGNFYkNHLXNpaU5JOXhNSGZpNjY1b3F3RDh2YkhRUEo3T3JCLU8zQQ?oc=5,1765371600,"Bye Bye, Boring Shadows and Liners—Colorful Glam Is Trending for 2026 - Marie Claire","Bye Bye, Boring Shadows and Liners—Colorful Glam Is Trending for 2026 - Marie Claire",beauty trend
gnews,news.google.com,https://news.google.com/rss/articles/CBMinAFBVV95cUxNbzVlRTBBdWoxelRBT19FaWxOWDNXaVpFQXdlVl9VdmpaMWhxRW0tSURKaGhxSEJLbGtZOV9mQmViT1BLWFZvQWw2d05FMzZwSWtfNlBzZHBYdXJwUXI1cjYydGFSNV9ueHh1ZmdfeUkzNWtKdzNndHRnSXRaNzBCSWlJcWpRRnFHSXdCeWdzT0NnYWZJa1BTTWUydlc?oc=5,1765285290,Pinterest's 2026 beauty trend predictions: ‘Glitchy Glam’ and ‘Cool Blue’ set to dominate - Cosmetics Business,Pinterest's 2026 beauty trend predictions: ‘Glitchy Glam’ and ‘Cool Blue’ set to dominate - Cosmetics Business,beauty trend
gnews,news.google.com,https://news.google.com/rss/articles/CBMibkFVX3lxTE5wNWVvTTctLW03U3VyWFFkWXhGcllOUlRIUmdHWUw3VW9TZVFvOUpmNkVXeE1JWmtaM2tnN1dmUURBUElkZjJGSDJlLVZWZl96dGZyQWxQQlJFd3dnWkRzekZqR1V3TUhoc3BIYjdn?oc=5,1765568848,Target’s Beauty Section Is Expanding With More K-Beauty - NewBeauty,Target’s Beauty Section Is Expanding With More K-Beauty - NewBeauty,beauty trend
gnews,news.google.com,https://news.google.com/rss/articles/CBMiwwFBVV95cUxQT2F4cDd5T25jRGI1eXEyWGxQUk14X0dRcmt6YV9jU2h3OTUwazZ4alg1YXgxVlNXZms3VDBMZEVZYzlPNFpqd01vbkpicjNSdkU5YjdxWjY4RlRPN1BoZUxiNmhQaWJSOW5VRUhkUHN5UFhjYUhYNFVJLTlzTmgtQjQzNFJ3ak5NdE82YVBBZmU0ZndqS19YamRGVDFNVmhrdF9aaUtja1lfY2FxRFAta19vNW1Rb1ktd1RmeWRxVGxESnc?oc=5,1765189334,"Trust, treat culture and TikTok Shop: The beauty trends to watch for this holiday season - glossy.co","Trust, treat culture and TikTok Shop: The beauty trends to watch for this holiday season - glossy.co",beauty trend
gnews,news.google.com,https://news.google.com/rss/articles/CBMic0FVX3lxTFBJRkdhNWRadDRZZXVZdnFaU2V2bmVPLUR4VHUxWWtVTm5JaUVNX1VUNm9sa1hDSldUVXRxM2QxMEdwelVTUFhJUFhrUm1lZXpyR1NDRHN3TURmY3AyYUh6RERXaGhBR0xiTFlONkYtQTBzdnc?oc=5,1765782125,These Are Officially The 9 Bestselling Beauty Launches Of 2025 - Marie Claire UK,These Are Officially The 9 Bestselling Beauty Launches Of 2025 - Marie Claire UK,beauty trend
gnews,news.google.com,https://news.google.com/rss/articles/CBMipwFBVV95cUxNZjZwbXlLRjh5QXNOVHh3MGMyazB2LXJtekQ3NnJNTjV1WVBVblg2dENxV2NnZTNhVDlESHRLRkFsRDJwNzcxWU5Hb1F0OG90TXljcHlTUzZyZmgzck9iX3BsZDE1ZFl0UmlfUVNuMkFVTkNPeHBJZEVtcm5IRnZwcUZDZjNQdE1lbXFBZzhPbGtHcENVREQ2UXE3b2NqeUduM1dkM2xlTQ?oc=5,1765303476,The top fashion and beauty trends of 2025 - hyphenonline.com,The top fashion and beauty trends of 2025 - hyphenonline.com,beauty trend
gnews,news.google.com,https://news.google.com/rss/articles/CBMimAFBVV95cUxPb0p0N3o3eFFRU3RsaWNPSFdUaU1GWGwzY3c3NWRLNkVqMHBYbDVfRWRCRjdNOUc2Zkg4WHFfeDV2WFJpOXI3R0VTU3lGQ2xZMDVUUW9yT3ZhdEFqc01KZnFYNU96NEh5OG1tekc5aFpkSDZYcE1WamtETm5wYWt2V044UmJ1OHZ2T3h6UW5NQnhSeXg3MUZVR9IBpwFBVV95cUxQMVZuN19pZHJWN29CdWlWWF9VZk1TT1ZuSGt6Q3AtWnRXS0hBRl8tUmVGMmsydHhSVGc3NzJFbnhxU3RrQWZWZ0g3Zk45RXdNV3VFS1RlV3hJYkVJUERUNHpYdDdCSVQ5bUc3UHRMMFdoem5ReHFDaVhmUmwyQk9ZQXhCZ0QxRVE2RE05YU1LU3JkOFJzWFhMNHl4SmVxUlR1RTdFZXQxVQ?oc=5,1765794797,Hailey Bieber shocks fans with a major hair chop - see her new 'lob' - HELLO! Magazine,Hailey Bieber shocks fans with a major hair chop - see her new 'lob' - HELLO! Magazine,beauty trend
gnews,news.google.com,https://news.google.com/rss/articles/CBMi0AFBVV95cUxQVjZ2R0FEVlMzUXh2aXF0cTBmOWJVZUowR3NmZGQtZmgxLXNYTW00UVdmNENMcDRVUEVvazBabmpsWkowTWlXSVVEMVExZEQ5NFMwOVpfeVh5TzdGYVp5dW15TVZSMVQ0V1dCc2RQZTJPQU9LUWF2ZnVLM1FhSlNrcVZrRWMxR0JKUUZfVnA4YlFmZ3JiUy1zeFJLSUxad3FkM0ZzMTZ4ZktrV21iekszaV9TN3FqVVdpdUNOTWphd0hXMXFCaHZtNlp0WFFqTmRo?oc=5,1765591823,See How Sabrina Carpenter Gets Her Glowy Holiday Makeup Look — Makeup Tutorial Products - L'OFFICIEL USA,See How Sabrina Carpenter Gets Her Glowy Holiday Makeup Look — Makeup Tutorial Products - L'OFFICIEL USA,beauty trend
gnews,news.google.com,https://news.google.com/rss/articles/CBMiiAFBVV95cUxOVWpWVVVPY0JYWW5fcm5qRlpSRVRja1VFS2VNRXp3aGVud3QxUVdzTElqWHN4YUpKUEl1WkMyLU80TFlwQmpNQzNZcVFGWjFwOGFPM045M002cTVFcGdrVFctWENpSUo3Uk9WQXdibmNjQ05MNU50ME9wSkt3RFVva3dzNVFobUxJ?oc=5,1763107200,Korean Beauty Trends Are Going to Look Different in 2026 - ELLE,Korean Beauty Trends Are Going to Look Different in 2026 - ELLE,beauty trend
gnews,news.google.com,https://news.google.com/rss/articles/CBMif0FVX3lxTE1KMVpfUW9tcTZNVlVwV2F0dDdmdFBUcHZpYVl4SFRLdEFKSmhZUkpyN01lWTlnaFJOLXNZSzFfX2p2Y2R5YmVySWI4ZF9yWDJsazF0X2ZhVDJXbW53dDJEbVZMNzlibWstOWZPdXhtZlIwSmdrN292MERJOXNaU0nSAY4BQVVfeXFMT004YWJYR2Z1aV92NUJCSlJoVWZHTUdpV3BRZkNTTmN1MXpsSmU5SlJOSUdZVzE4azI3NVd5NG5penNiUkhZdHRTaTk3V25GcFhBazBoWUdWNkVGVDI3XzhzYXJ5MXZkdE5qajItVnloVzNkV3gwVHQ3LTVOSnpwTG5yenR0c2dUd3hBekY3QQ?oc=5,1765599060,Copper Nails are the must-have manicure trend everyone will be wearing this winter - HOLA,Copper Nails are the must-have manicure trend everyone will be wearing this winter - HOLA,beauty trend
gnews,news.google.com,https://news.google.com/rss/articles/CBMiiAFBVV95cUxOSUdRNkdPbnFaT0Z3bm1DR0NSSk5nUGZzdFVWNWJQLWhmeE51X2VmRG1jRFJldVJMSXBCNE4xUUVYQXIxMng0RllsOUY3LW1TMmhackI1ZENqc0FTeVFoYjVJbEF6ZWRfOGU2X0ZzN0JxMjRSYTg5RUpXUGtrbHZaQ1NSeG5oRTdG?oc=5,1763625600,2026 K-Beauty Forecast: Top 7 Data-Backed Trends - BeautyMatter,2026 K-Beauty Forecast: Top 7 Data-Backed Trends - BeautyMatter,beauty trend
gnews,news.google.com,https://news.google.com/rss/articles/CBMiYEFVX3lxTE12TDJkOGZFZFhybUFxVl9WQ1B2TDkzbjFEc2pFcmtMZVlJYVJZLWV3WTltWXVOYVhOdFpwQjNWWjl6MTdwV0NFZ0JGa1A3MmtiYm9ieEt4cFgzeEVDY0R0VA?oc=5,1763539200,The Forecast Is In: Here Are the 8 Winter Beauty Trends of 2026 - PureWow,The Forecast Is In: Here Are the 8 Winter Beauty Trends of 2026 - PureWow,beauty trend
gnews,news.google.com,https://news.google.com/rss/articles/CBMigAFBVV95cUxPa2dnTUcwVFpScWtqaUNITjFsNDVsR1NFSHpINW1xZ0J6Q3ZoVG12MDF6Y210VHJaQkFKZTBzaWFWUm1RTGRlZDFyWlRra2ZxOE1GMldzdFN1MnJiTktIWUw3QjVRQndZMEZMQ3VabFk2Uk1qdk14VTcwMEw3OFU1Vw?oc=5,1763625600,Is Your Scalp the New ‘It’ Body Part? - The New York Times,Is Your Scalp the New ‘It’ Body Part? - The New York Times,beauty trend
gnews,news.google.com,https://news.google.com/rss/articles/CBMihwFBVV95cUxQT2x1N040dFhXbnhDdkhCQWFQMnU5X295QW9Cakw4a0RnX1oyYnNjci1HaXVmUncybVVVZGVBTUlyLWFNdXN0dzFZVlhHUnVGMFQ5ZW9SZmtUYk9Ga1Bwc0doelJDTTFCNXRnVnowTXdpSkdOOUZzOTFiR2MzX3RwSjBvR2N6T3c?oc=5,1763539200,Cosmo’s Beauty Editor Predicts These 5 Makeup Trends Will Dominate The Winter 2025 Season - Cosmopolitan,Cosmo’s Beauty Editor Predicts These 5 Makeup Trends Will Dominate The Winter 2025 Season - Cosmopolitan,beauty trend
gnews,news.google.com,https://news.google.com/rss/articles/CBMia0FVX3lxTE5WcEJHVHpWanpMeHptTGwxbzBweVVidmhReFdfWVpOTXNEdHA3eDdpVXBWQlFncGpfSUlYNDlaZWhfV1R0R25ZUkhzMUZCbkhFYy10Rk1JVlJYTlA1Uk15M0N6dHZ1cTV6emRJ?oc=5,1765443600,"It's Official: '80s Nails Are Back—17 Fashion-Forward Designs Giving This ""Dated"" Trend New Life - Who What Wear","It's Official: '80s Nails Are Back—17 Fashion-Forward Designs Giving This ""Dated"" Trend New Life - Who What Wear",beauty trend
gnews,news.google.com,https://news.google.com/rss/articles/CBMic0FVX3lxTE1EN3hna2JhUFdaUks1bVhta25NekVhMWhtb2dvWVBLaG0yeENYc0ZJRzZFb1NxdHJlVEZlSlZyM0ZrOHJTV1VoUHFTTGFIbTNza0pnNTJldDBGWklkQm96WXJkc0Npbk1mQ3RVZHhKMDhIclE?oc=5,1765538332,I'm Calling It: The Chicest People Are Gearing Up to Enter 2026 With This Polished Hair Colour - Who What Wear,I'm Calling It: The Chicest People Are Gearing Up to Enter 2026 With This Polished Hair Colour - Who What Wear,beauty trend
gnews,news.google.com,https://news.google.com/rss/articles/CBMid0FVX3lxTE5HMHZobTlRSkxYd0d5bW5lX2F3X3ZqQUxaaEJDTmVfdVdXc0pOMFNPNlJZQkF1dGZ4cWR3Ni0zem95R0lhY1pVeVhreXM0eGZzNEFCMU90bGpuNk5hczBBZU81bGFUYkF2aTRjV3NyOXY3UktKUFYw?oc=5,1763712000,10 Holiday Beauty Trends to Try in 2025 - Who What Wear,10 Holiday Beauty Trends to Try in 2025 - Who What Wear,beauty trend
gnews,news.google.com,https://news.google.com/rss/articles/CBMiiwFBVV95cUxQbjRtczFmcXI2S3lWV281dEwzVVI1SnNUQkY5TmczWTdCdnJZMzdwS1hKN0hqTzk0dU1rd19FdWZYeGI0Ujc3ZDJKV21CUF9ESGpOUTFzaURtZjd6WnBkdTNnMUtwa0R4YWY1SGJrLWVCUktEY1cwbDl0QVQ2SkUyMUNZcHVqLUp1bDlR?oc=5,1765278000,I tried the $430 tuning fork facial. Here’s how it went - Los Angeles Times,I tried the $430 tuning fork facial. Here’s how it went - Los Angeles Times,beauty trend
gnews,news.google.com,https://news.google.com/rss/articles/CBMitAFBVV95cUxOTXBtbjVNSzBxa2c5SmpVam1DOTNDcEFhWjJBdU1nLW85TmxMNnpRM0NrTmZNQ05WUTBNRWpOdElSUTZrUWhSQzhpd0FnN0d4ZDN0ajJUdUNmTE1aRHhXWnFJRmI4Y3pHTk5rU0xRa1FwdjBMeU5zRmVPc2picWN4dkhkdEZ5cmZJODNoUm9EN3BnZ283YjlYWXlRTDVaeHpxUTVSWkxyQzFtb0N0QXRaeFNyQTI?oc=5,1762416000,Squeeze and go: Single-dose application poised to become key beauty trend – L Cosmetix - Cosmetics Design Asia,Squeeze and go: Single-dose application poised to become key beauty trend – L Cosmetix - Cosmetics Design Asia,beauty trend
gnews,news.google.com,https://news.google.com/rss/articles/CBMingFBVV95cUxNUmVONmlWZzR6dGFtbkVLWS1CNDh3MkhKMWphV1Jtd1ZWcklIVnc1cTdQTVhGTGdLb0dKa1lYZXpoSUduYWZaWldpRkRFNnBYLTlUWkJGVVMwNWRSMjlJRGd2MW9VemFXTEZyRy14R1F3WnJpU0hVR0VVRHJKZFpRdWJta1FhRkZjX2dzdjJ2VlUwcmItNFk4aDhCd21GZ9IBowFBVV95cUxQeGs1NTlRTW1XbFNLbDF5bmw1eHBIOXRhT0FmVE5EeE1wYmswd2JEN1dENXBnaXJ3ZlpoWDFMcHdQMFRoVHFNb1l5d05SS0Vxa3BpSjZmY3B5aW1QQVltM25KZ0pEemxzODUwMDNKVUxCbkJYYU1HZ2Q3YUZXaHRfdjlHYk9oczRkV09pOHF0LVNYSFB4QkpjU3lqdVVseVQyempj?oc=5,1763971200,The radiant 'Australian' beauty trend MILLIONS around the world are obsessed with right now - and how I've mastered it at home: POLISHED with Elise Wilson - Daily Mail,The radiant 'Australian' beauty trend MILLIONS around the world are obsessed with right now - and how I've mastered it at home: POLISHED with Elise Wilson - Daily Mail,beauty trend
gnews,news.google.com,https://news.google.com/rss/articles/CBMihgFBVV95cUxQWlhvQVdoc255azF1UHVzSEtsWDZ2VVRqdV8wV3ZzWFktREw1eHY5NklSaXhVWHI2R0RuZUNmcXRuZUVValhmcWhUNm5ZZHBPekFzelBWaDQwcFpDZlRwNVBPV3lsQUVjNTMzdU54Z19rc0tZeGZkakRoM29uTFVtY2ozXzhDQQ?oc=5,1765449915,"Pinterest Predicts 2026 reveals 21 trends set to shape beauty, wellness and client behaviour - Professional Beauty","Pinterest Predicts 2026 reveals 21 trends set to shape beauty, wellness and client behaviour - Professional Beauty",beauty trend
gnews,news.google.com,https://news.google.com/rss/articles/CBMioAFBVV95cUxPMGNyaHBMUE43Qkp4dm5EcGJzWThmQ3NDb1J6bHRfRHVvb3B3blVjQVhZdEF1Um5QTFVmMVFFeFZ6ekNpaTdNbUc2Rl9zY3QtZXRQODdpeGVQSGFXRERjMTc5eEd3RGdZWDJwQXoxSm4tVEJpM1BybnlNemhXdTVPOENJaGM0SlBXVVhyQmpSQmNNWl9LZkdwNUtnUDVEZWJ60gGvAUFVX3lxTE9sRndjR3UzOENfeHJ2ZnR6QU1kWFk0NGFfdTJac2NVdmFaMmprVW5JX3hmQ05scHFXV0poalhVbW1hRTBhaGxkUGhxNzBPRGVFM056QXFEQUZ3TEptMzJaWlE4M2NzWjEzTUlWUXBOc1VaamFweHlYTjVSOW4xWlhWTS1Ja1pHUzYyUU1zbk0zZENEMXFfUzFlbm5qSUhtcEpWMVZUeklkN3JScTZWNTQ?oc=5,1765192910,Hailey Bieber's cheetah-print pedicure is the wild beauty trend you didn’t know you needed - HELLO! Magazine,Hailey Bieber's cheetah-print pedicure is the wild beauty trend you didn’t know you needed - HELLO! Magazine,beauty trend
gnews,news.google.com,https://news.google.com/rss/articles/CBMimgFBVV95cUxNS3ZTMElONFRlRE95bmtiLTZPVGROMG4yaGN3eHBaU2VwOGNSX29lUTdpeHBGLXNJS2ZZU1VWQW1VdnNUQVlhcUMxTHZLMHI2ZkhoYzhlSDZOdVp0Mmtid1NDeDBYdExqNE5jYXFjc0NxeEI5QVdYdmJqeWxvMEQwdjhMR0hldDBnclEyVkZUSU1RWlYwWlVNWTJn0gGfAUFVX3lxTE9KYmJ1NlJ4RnpUdzdHS2VPVm5uVzl5bHVLSzFLWDlEcTNPVzVUQXdsSUI0R0U5SlVrMjNMNjJ4Z2RmN2hIcVVnUlRwUDg4MGRTYWxWWUxCVzNuWk8wMFJ4Yy05VmM1NGJNYzg0dkhneGZESVNGRTF5RGwzd29TZG9WLTlOYXR0dk03Y2p4WjVjS2x4SDdTQVJVZjBIbEJNQQ?oc=5,1765720728,"So, you think our plump lips and blow dries are 'man-repelling'? Sorry chaps, but I've got bad news about those moustaches and sleeve tattoos, says CAROLINE BULLOCK as she reveals 11 male beauty trends hated by women - Daily Mail","So, you think our plump lips and blow dries are 'man-repelling'? Sorry chaps, but I've got bad news about those moustaches and sleeve tattoos, says CAROLINE BULLOCK as she reveals 11 male beauty trends hated by women - Daily Mail",beauty trend
gnews,news.google.com,https://news.google.com/rss/articles/CBMibkFVX3lxTE50eWVRTGRMWDJ2SzNsVFZfVDlDN1VMN1NQU2ZqOTRyYU1CUnMydnJneXFCeUhmeUR5Z2twZnhxMjNtZ0R0NTVPeE1nb20xRC1RbHlOajdzbXB3aUx6Zlc4eXhMbmEzZ0FnWFRZcHdB?oc=5,1762848000,Winter 2025/2026 Beauty Trends You'll Want To Try ASAP - women.com,Winter 2025/2026 Beauty Trends You'll Want To Try ASAP - women.com,beauty trend
gnews,news.google.com,https://news.google.com/rss/articles/CBMivwFBVV95cUxPYWNmakIzSGRPdHNadVNVZzhQazkwZHdHa3cxdkR5QjJqNW0tQTNDR2tBeTVUUU8tYmgzcVRQUG1MSklrTk5yaWo5S2JXSWNwdkxkNlpQN0hCM1hLcVRtYUhYQW9DUUdtSjVVYTh2bmhyOHpBT2NmWlZHOENvMllVc1JPcUNLdjVyZC15eWE2Tm9fb0k1MTRXZ0ZoaDJOdGNlT1lwSGg4akV4VTBBT0ZRQ1lYZ3ZlQnM3QzczVkZOOA?oc=5,1763452800,What is menstrual masking? The potentially risky new beauty trend - The Independent,What is menstrual masking? The potentially risky new beauty trend - The Independent,beauty trend
gnews,news.google.com,https://news.google.com/rss/articles/CBMiZEFVX3lxTE9sQWFiWUxyaGpIYVdHNVFvTzJqSTB4WGRCR0E2YVowRGVpQjBrN0I1eUYwcEVndWpjV0ZKTWprbS05MEZ6azBCWUFOUHRCRzZvQzdPcmZhbE84MVg1MnlHQTZVTWo?oc=5,1763020800,Winter’s Biggest Makeup Trends Are High-Impact With Minimal Effort - Allure,Winter’s Biggest Makeup Trends Are High-Impact With Minimal Effort - Allure,beauty trend
gnews,news.google.com,https://news.google.com/rss/articles/CBMiZEFVX3lxTE5ZdDNRdU1od3daT0lsREpYQ2dBbURIeWdTdEFmMTNRT0tKeFFHaTRhS1lqbDVEcnhHZkh6Y21hRlhIN3k5VlctNHBERlU5SFlUMVFmWkR6RXRjQUpCaW9NV0JNem8?oc=5,1762416000,All About the Viral Scandi Makeup Trend—and How to Get the Look - Real Simple,All About the Viral Scandi Makeup Trend—and How to Get the Look - Real Simple,beauty trend
gnews,news.google.com,https://news.google.com/rss/articles/CBMicEFVX3lxTE96eFRtR1g5NG15VmJxdk9GX3B1V1FJdWRDdkJPb1pHMWk3d2pwMV81WFBURlJxaHRadVZTWUFKR1VSc21KX1lyVTUxa2NSa05nRmxUU1FRb1hFVWNvc2hDZ25YYUQ0Y09jMzNhLTZuWGk?oc=5,1765535400,The Vogue Business Beauty Trend Tracker - Vogue,The Vogue Business Beauty Trend Tracker - Vogue,skincare trend
gnews,news.google.com,https://news.google.com/rss/articles/CBMib0FVX3lxTE0yVnBqbzQzaXRsNnBkT3kxWnFBbGRFam5JdXc4U1BwZE9pM2ZuSngxZ3g2Q3ZTWlZrNTlsZC03Q0pGRy1SQ2hwQl9WNHJJVGx1RWFjMUVqbXMtd21JeG80LTFJQ2NKUDk3YlVtZS0xTQ?oc=5,1765130410,Scientists say this viral rosemary skincare trend actually works - ScienceDaily,Scientists say this viral rosemary skincare trend actually works - ScienceDaily,skincare trend
gnews,news.google.com,https://news.google.com/rss/articles/CBMiaEFVX3lxTE5lU2Vad3cwS3hkdS1vdlZKeFJFdnBNNVJVR3VvYW4zV2tIQ1NnLWp2Yk5XT1EtQy03WVZIUGVMN0JzbXE1V29xZUNaTkNrVW1aZnhYUURlcHJsdzJ6RUtyc092bjhVaDFD?oc=5,1765540800,"PDRN Skincare, Espresso Hair, and Polka-Dot Nails: 9 Trends That Dominated 2025, According to Search Data - Who What Wear","PDRN Skincare, Espresso Hair, and Polka-Dot Nails: 9 Trends That Dominated 2025, According to Search Data - Who What Wear",skincare trend
gnews,news.google.com,https://news.google.com/rss/articles/CBMi2gFBVV95cUxPY3hqUHZWcWhxNVF2T1JwUUhDTmdBdEV5dGN5REVreEgyZ0FsU3I4Z0RpMzlFZHNvWnBWSm5IeVkta0RySzNEMlljcXRGT2hHZ25zbGl6M3BNRTVqQy1ER2VqRUJkUzBfYUdZVUtleWMxZldJTFVmSldPZmhPVnVGSkoxTXR1S2lBamVNR1JGMUtLWFNLbEI2ZkJPVlRBWGkxbHIyTWd2eEdGUHhYUW5HOEhid1NkQkN4a3VsT0VyMXNMOXpRcmlDTGlPbUdQUGtONE5MSmphbFRjQQ?oc=5,1765318327,Inside the toddler skincare trend: Experts say this ‘dystopian’ shift comes with real risks - MDLinx,Inside the toddler skincare trend: Experts say this ‘dystopian’ shift comes with real risks - MDLinx,skincare trend
gnews,news.google.com,https://news.google.com/rss/articles/CBMie0FVX3lxTFBQUGdPY3hPc2hZUWpUQlIxOWVNTDRxMEhhYjhqYkpNUFBLMWdYMXN3WmVMaEliR3VNMk90a1JhTTdKdXNFS2hXZmZnOGdfMXlyVEZuaXAwS3ZJNTQzelhWc1NZUjFsNHZtSXZjYUtDeE1PbUdsR2p5blg2d9IBWEFVX3lxTE16ajN1QV9FMF9YME1jSjNCY0RTN0owbWZNMUFlN3FBejRuUDk2UmdzSXBCWGxZTFpFTlJ4WHBfQmZlQnhGSF9qcnRERGpXRk9nTUx3OHJPYlM?oc=5,1765554693,Is Beef Tallow Good for Your Skin? Benefits vs. Risks - NBC News,Is Beef Tallow Good for Your Skin? Benefits vs. Risks - NBC News,skincare trend
gnews,news.google.com,https://news.google.com/rss/articles/CBMieEFVX3lxTE9VVzN4Y3k3SVhfUXRvaFUzNzdJUG9peEhhWkVvVkRMOWxra242OEhqa0RMOHd2QS1LemstUmlBMVdjMnVDM1hKOE53TGIza0JvbHFZRm5OY2JBUWxOZF83aWVSVXpISzI2TjRSWU9nOVhyd3N2WF9wSw?oc=5,1765559029,"The 8 biggest skincare trends for 2026, according to facialists - Vogue Scandinavia","The 8 biggest skincare trends for 2026, according to facialists - Vogue Scandinavia",skincare trend
gnews,news.google.com,https://news.google.com/rss/articles/CBMikgFBVV95cUxQNjhheUFSRzBJRDlObUw3eThSNmtwQjB4TlAxcWpuOUxESVZHU3FLUDMyc05Md1B3Njk0X1pYbDVjaF9ONUNTSnAzcnBGZVFuX2wtbi1VX1hYSVVYOWI1Sm11ajNvZ0hIUjhHc19wUndha2RYOXZqX2djSFJSU2lPY3ZRMGx4cUFWUW53bVRNNm9BQdIBZEFVX3lxTE9oS01fVnBWdmZQbGhJbzdqOVRyLXgxNTBBeFVsZXZQZzlBQk0tX2tEVGx0TTdweHZwR3N4aXVKZFRtejZuSWtsREk3aVc3OXZmYUxxa3B4TGl3LTNaZElPekxXVmw?oc=5,1765462430,Is the K-Beauty Trend Really Worth All the Hype? - TODAY.com,Is the K-Beauty Trend Really Worth All the Hype? - TODAY.com,skincare trend
gnews,news.google.com,https://news.google.com/rss/articles/CBMiekFVX3lxTE5RNzFTUUxtbUVkWFpOX2xTLW1KOUNjb3NPdlJ3X2t0Qkhhbm5wWndfNEhOcWhNT1lPbEZTVzlLZG1lTVVxWDktWkFmczIyQ1ltaDhQUlNKSEREend5VElCbk9GbVVVTjd1eGozbzdpaHZCdmg1RmRhbXB3?oc=5,1763625600,Dermatologists Say These 2026 Skincare Trends Are Actually Worth Trying. - Women's Health,Dermatologists Say These 2026 Skincare Trends Are Actually Worth Trying. - Women's Health,skincare trend
gnews,news.google.com,https://news.google.com/rss/articles/CBMipwFBVV95cUxObkxoSFdNX0hpZUhWX1M1TXJiYXhOMFZVbkF4M0tmS2dWdHQyRnFFSjFGZ0dSY01sYWRDTUoyUW41Vi14Tm1HYmRFOHk0RC1vYzZfOW00UGZYbGZZWnlaRE1kWUJIVmZjZGk3ZWdDQmVMdklVYS1PU0NwX0gtSzY3ZkI2UlBDczlLNjFrZTVManlTc1IxLXZfMk1Ba0xka1VpM0k5VWgxSQ?oc=5,1765304395,What Is Skin Flooding? How to Try the TikTok Skincare Trend Safely - Life & Style,What Is Skin Flooding? How to Try the TikTok Skincare Trend Safely - Life & Style,skincare trend
