source,query,domain,url,created_utc,title,text
gnews,makeup trend,news.google.com,https://news.google.com/rss/articles/CBMinwFBVV95cUxOYjlDZm12WUJLLW9fT1RlM3RXd0RmOUxTeGJuSUF6X2ZpcFRYVnJhN2FpemhIRko0NGhRN1lWQVh6MVFpTDNINm9kTktHM2ZYaGx1MENfaC1TQVdwN21jUDBfRDY4TmxkMEN6OEs0VTNxa3lSS0kyMkhVX25MLUgwODdmSkE2emtMbWdVUnhhQ3BuTWsxRFpDNjlwWTQ1elU?oc=5,1778129766,"Skincare-meets-makeup trend drives hybrid beauty shift, says GlobalData - Retail Asia","Skincare-meets-makeup trend drives hybrid beauty shift, says GlobalData - Retail Asia"
gnews,makeup trend,news.google.com,https://news.google.com/rss/articles/CBMimgFBVV95cUxQV3ZDUUZfMVpJODVaTXRPWXhHQWZ0ZXZMTzE4eG50UDlsRERwOVF1eldUWHR1YUQyYV9BU2haUlY5Xy1WeXJReEJMeTYzMTNCMVZ3SEt3Tk1sOW5HRGlIOXlXSkFPNXhCR29Ma2EyUjBVZXJjYWdCZXF0UHpGbHQtczd3MnFDcUJHd044c0JTeXlTME55ZFZZbzRn?oc=5,1778006940,"Mascara Is Over, According to the Met Gala Red Carpet - Harper's BAZAAR","Mascara Is Over, According to the Met Gala Red Carpet - Harper's BAZAAR"
gnews,makeup trend,news.google.com,https://news.google.com/rss/articles/CBMickFVX3lxTFAtNnAwOTkzdFpINDJIOTBiSDk3ZWJDSW1uMG1RZnNmOUphU1J6ZlFySmdZbG1iR1c1YUtrdm9JLXJ3TzNHVHFvNkIwQ283dnlOWV85OTdic0VuSGQ4TThzdmdXZ0lwRmI4NDFkLU96a3NJQQ?oc=5,1778176122,Y2K Called and It’s Bringing Back Frosted Lips - Marie Claire,Y2K Called and It’s Bringing Back Frosted Lips - Marie Claire
gnews,makeup trend,news.google.com,https://news.google.com/rss/articles/CBMilgFBVV95cUxOQ0llWk4tOW4yMWg0TDktbGkzSlR6MDMzU2c2c2ZFLVFzUEgydGpPMVZISVNCeEwxcTVjUVZZV254Ry1mOHNnellzeFJRd0lpQnNpeEpLY2RCaURKQ3hjSW1oQTlUNUJzZm8zX1gtZHU0R0lTcFhpcG44anRMZUdZTmw0eVdXQUdwdGlGV29QeUktQkR5dmc?oc=5,1777945320,I Spot Beauty Trends for a Living—This Will Be the Most Popular Makeup Look to Come Out of the 2026 Met Gala - Cosmopolitan,I Spot Beauty Trends for a Living—This Will Be the Most Popular Makeup Look to Come Out of the 2026 Met Gala - Cosmopolitan
gnews,makeup trend,news.google.com,https://news.google.com/rss/articles/CBMidEFVX3lxTE9wWGJqd2VSTmpsWkpXWkJlY2IyaWZ2UU1VMXdQazhQLTdsMFFLSEFtdjdUTlJTNTQydFRTTk1YMF9PeHd5MHRWUzhodElqQnZrdjZXTDRaTVBYSDZPVnUtTzBJRV8xWmNwR090ekU3OTRYWVB0?oc=5,1777878000,10 Simple Makeup Routine Swaps for Women Over 60 - Real Simple,10 Simple Makeup Routine Swaps for Women Over 60 - Real Simple
gnews,makeup trend,news.google.com,https://news.google.com/rss/articles/CBMikwFBVV95cUxNNlB5TlN1OXV3ZWxaOENaNjhXVFBYV1NTQkE3ai0tdUc1SlR5RU4wWlpCSDVoZTBXSF90QlZyUTAzeDgwR1dIWGFBc3dhOVB2VGNPeUN4RzQzbjVqR0ZZVjZQQ2h4NU9CXzJ2aTlwNFpQVmp0NTh0eXFUUUlPajQ3YU5wd2JUZERWa1Z3SklwelZ1OWc?oc=5,1776668400,How to Recreate the Watercolor Makeup Trend Hailey Bieber and Sabrina Carpenter Are Loving for Spring - ELLE,How to Recreate the Watercolor Makeup Trend Hailey Bieber and Sabrina Carpenter Are Loving for Spring - ELLE
gnews,makeup trend,news.google.com,https://news.google.com/rss/articles/CBMibEFVX3lxTE5ES0VzVy0yMG1QYWFDWlFzV05GNllVVHB4LTk4WDhCYkZwekZOdWx0UDhzTm9YLW5hWTlmRzJKVmdwRm5UY1M1TlVNSTR4VjhWZ19hRkVpLUp5cHBMajZ3YXpQWk96QVhITzhpaA?oc=5,1777996500,The Rise Of The One-And-Done Eyeshadow - Refinery29,The Rise Of The One-And-Done Eyeshadow - Refinery29
gnews,makeup trend,news.google.com,https://news.google.com/rss/articles/CBMic0FVX3lxTE9hWU12U000M3lhWHlBYWxfVjJ2VThRVHJLUC1MVFdCT0ZHSDFXcEx0azJIdlRYeGlVaW5UaUJJNHA0cUFLbFgxMUIwNjZQRVNCZTBFcHBlTEZSbHk3VnM3cHRMMXdicDBkeTNxRC15NnZfMjQ?oc=5,1777788000,"Almost 4 Decades Later, And These Iconic '90s Makeup Looks Are Making a Comeback - Who What Wear","Almost 4 Decades Later, And These Iconic '90s Makeup Looks Are Making a Comeback - Who What Wear"
gnews,makeup trend,news.google.com,https://news.google.com/rss/articles/CBMidEFVX3lxTE1jUWhEeGZXb2Y3MHMwbXNhMEppcHg3eHVTNXBHRjBoNVU0WXY4LTAwRlJBRDMxVHBHZGZ6VERtbFFVWjVPTEY4SVVBY1VhZXJEOERQTVBoXzZnNGNjM1pIcFJBYlF5U3VJVHZvUjBqNks2Z2s5?oc=5,1775718000,We Asked Southern Grandmas What Old-School Makeup Trend Should Come Back - Southern Living,We Asked Southern Grandmas What Old-School Makeup Trend Should Come Back - Southern Living
gnews,makeup trend,news.google.com,https://news.google.com/rss/articles/CBMihwFBVV95cUxNdi12NkNpb0JwVVZIRHhQdnhaNmhoSlRlVGZFOVdSRUNDVVJLZTFFR1RDcE11OURORjRZM21COTc4NmRJZGpQMjN3WGJUUnRpMGZnclFMVWZoVWxEdUJFTU05QTBaWkZ0anJfamVZTmR4NVM5SE9MaHlhRVg0UGNCNG9fdTE0M1E?oc=5,1778010010,'Soft blur' makeup is trending — here's how to get the flawless look on a budget - Yahoo,'Soft blur' makeup is trending — here's how to get the flawless look on a budget - Yahoo
gnews,makeup trend,news.google.com,https://news.google.com/rss/articles/CBMiekFVX3lxTE8tUmM3U2ZiWUI3b0NRQXhBellfQTFFb2tQclF5VjVVWkt0azktc19vRlF6bVVmRmtTWGY3SjAxbVV0VlBiWWhKUmJmSmFzc2dEWl9fZTRCVkM3emlFYWh4UU9HUEdWei1LZVQ1YTJfQnVYT3g1OVI2SWZB?oc=5,1778095464,"The Case For ""Fawn Freckles,"" Summer’s Prettiest Makeup Trick - Bustle","The Case For ""Fawn Freckles,"" Summer’s Prettiest Makeup Trick - Bustle"
gnews,makeup trend,news.google.com,https://news.google.com/rss/articles/CBMiX0FVX3lxTE5jTTVfaFhoTUdCbDlKdVZ4NVJQZTlJdG9raTFsbjFLbmRSWFc4Q0c5QVBpUTNNRlZRbzcyaWlFbkZTcFRxQ2ozVlhQX2FKTnhFLW1BNkllTTBHVU10M3Uw?oc=5,1774508400,The Playful Makeup Trend is Beauty’s Rebuttal to “Clean Girl” Minimalism - Vogue,The Playful Makeup Trend is Beauty’s Rebuttal to “Clean Girl” Minimalism - Vogue
gnews,makeup trend,news.google.com,https://news.google.com/rss/articles/CBMimAFBVV95cUxPd1M0SHNCcU1xZlR3V21kYThYT2ZXWl9pMUVHYnJhVTRJM0ZyS21uWF9YdFUzU2dhcWlsSlVGSW9qNi1OZXY5eG9hbHJ4Y0RnWUZNb0VESWJ1UGtDSkNtU1JhR0VIdWNsODBETVFEYUlBNlV2SDNnYlY4Mkt5MHpXcXBuQ1VzdEI3UHlGMmJpajNFNEZkTkstXw?oc=5,1777946400,The Super-Wearable Lip Trend That Took Over the Met Gala - Harper's BAZAAR,The Super-Wearable Lip Trend That Took Over the Met Gala - Harper's BAZAAR
gnews,makeup trend,news.google.com,https://news.google.com/rss/articles/CBMijgFBVV95cUxOeWF0UldvVzZpMWQ1TzNtTnZQb0MzdUlhT2FreFEyZC1CWXFHbVVOV3RZbDJUdHpOUDd4UE9pNWUzcDI3eXpSNjlBS3FHMDNFX1pPTUQtVnZxa0l4N0RHaENEc1loUDZWOXlkM2pVclpCUWZJZzlYT21CaTE4cmNHUzdzU3otUXMyM1JvVXJn?oc=5,1777656128,"Juice Box Lips, Pilates Skin, and Sunburned Cheeks: These Will Be the Biggest Summer Makeup Trends - Cosmopolitan","Juice Box Lips, Pilates Skin, and Sunburned Cheeks: These Will Be the Biggest Summer Makeup Trends - Cosmopolitan"
gnews,makeup trend,news.google.com,https://news.google.com/rss/articles/CBMiogFBVV95cUxQX3ZpS0h4YnA5ZFFfTXhONmhJaXVIcTRGVkdHOUt4a0tjWlNLSkNBTlZpS2JyMC1oeEFheHRmZnprdE5jX0VRWm1MdWlyTGltU3I2VGliMzNZb2pBMFBWNnEzRVB3VjBoX3JLVDE3Y0ZBekVFWW9ONGhkeGpoNHg0dVB6RXE4OXg5ajM0RDFPZnVzYTlQSXVLelNCZUlMZ28wcmc?oc=5,1777947360,The Met Gala’s Boldest Beauty Trend? Invisible Eyebrows - ELLE,The Met Gala’s Boldest Beauty Trend? Invisible Eyebrows - ELLE
gnews,makeup trend,news.google.com,https://news.google.com/rss/articles/CBMiekFVX3lxTFBfSEsyQ21OUzRuTTA4TWUtOTRpcHhsTWFySERUVzMtbXJQWTBPU0NnUGZZM0dzLWdLVENYM0J1TEhBcDB4ZmpLdmZRdFI3Um9ZZHdoQzdRXzQ2RkJKT3VDREU5QzE1dzVBSEpqMjJFUnk1bUNmWVpoRzNR?oc=5,1778092260,The “Instagram Lip” Is Officially Dead — Here’s What Replaced It At The 2026 Met Gala - Refinery29,The “Instagram Lip” Is Officially Dead — Here’s What Replaced It At The 2026 Met Gala - Refinery29
gnews,makeup trend,news.google.com,https://news.google.com/rss/articles/CBMisgFBVV95cUxPZlZrZGZpSUlNeFhkdy1nYzE3a1JRZkZ6LXJDU0swV1ZQZkUxbU5oZDdJT2JrY3pHc1pIUjNyVVNOblJSYWE0S1RBUmFacHRGLWdKaGEtOXd3Ul9lbUJlUWtDajJ1dFVPOGV0OWMxcEpmQVpnQm55YVVNbkJDbHJ6SDVpM2lwcGlaOUxDZE1qVTdKSVJHZENkeklNc1pRZk1SMlhCWmxocXhrZnNvNGVDX2Fn?oc=5,1777932720,"The Best 2026 Met Gala Beauty Looks, From Wet Hair to Smoky Eyes - ELLE","The Best 2026 Met Gala Beauty Looks, From Wet Hair to Smoky Eyes - ELLE"
gnews,makeup trend,news.google.com,https://news.google.com/rss/articles/CBMilwFBVV95cUxQYXhoM2h1YzI1UEdPM1YzMENCRm9YWE0wUzhSSkJPM1ExRC1Rek43YXpKbkI2X0oySlVIckpiVnVteEhBS0kySjdnRkYwSHpUc0FtODhORVJBMXdLem91ZGZxOFZ1dzczcUEtRWhSSHNZZjN4UnkxOFdHeHY3TGVHakFxRy1YV2d3eEFhaEowS1gwTXR5M253?oc=5,1777972111,The Best Beauty Moments You Might Have Missed from the 2026 Met Gala - Harper's BAZAAR,The Best Beauty Moments You Might Have Missed from the 2026 Met Gala - Harper's BAZAAR
gnews,makeup trend,news.google.com,https://news.google.com/rss/articles/CBMidEFVX3lxTE5yWkRLUVJIOWRxSDkwQ0Q5SWhFZS1uSnRCUDVleEZSZV9fRVBZNVQ0Si1XUE1oVEJKVzRUSlRQMkVMYTlvZGZwaDB3N3dfQ1RPMlFQamVQa0VRYnl5LTF5RVl4WWNSMGppVFZTYTNHaE9vOGRm?oc=5,1777947546,The Makeup At The 2026 Met Gala Was Pink & Red All Over - The Zoe Report,The Makeup At The 2026 Met Gala Was Pink & Red All Over - The Zoe Report
gnews,makeup trend,news.google.com,https://news.google.com/rss/articles/CBMicEFVX3lxTE9sTk82QmhRUGFSVE0wRDhLRWNQclJLUmpWSlZJR3NPNWJIa2h5Mld5MERra1hfUGV6cWtwZVNXSEdraldKVmVMa2Y3Nzc5OUc5RmoyV29kOWlJVTY2UzVpalJiclFsX2x3czdUVWxtb1k?oc=5,1777014000,Watercolor Makeup Is Spring’s Softest — & Surprisingly Easy — Beauty Trend - Refinery29,Watercolor Makeup Is Spring’s Softest — & Surprisingly Easy — Beauty Trend - Refinery29
gnews,makeup trend,news.google.com,https://news.google.com/rss/articles/CBMiYkFVX3lxTE52QTBETkJrZHRmQllwRU1KTmxJeEJzZGtoLWxsUGtPN09uX3dvYW1jNVBORkZsVW1QMmhOdGFkSmRMS0dxTy1VVXdwbEk2enJnd3FqVG1fODJvOEFZM3RuZnVR?oc=5,1774854000,"Blue Eyeshadow, Smudged Liner, and More Eye Makeup Trends to Know in 2026 - Vogue","Blue Eyeshadow, Smudged Liner, and More Eye Makeup Trends to Know in 2026 - Vogue"
gnews,makeup trend,news.google.com,https://news.google.com/rss/articles/CBMif0FVX3lxTE1SdkdxVnhHWVhjc3QxVDE2c2lSUW9zYTE5Z19NYXpiQWFXbDczNFBMTnpyblV3bllKRjF3ZDBtQ3IxM2gwLWF5X2hLdW1rWDgwdE9zMXk2MXF6T29VYzJiMGt1ZmxVLXZJd3ZxVzhCUkxYWS1IMDB3ZjNlbHhQS2M?oc=5,1777945320,I Spot Beauty Trends for a Living—This Will Be the Most Popular Makeup Look to Come Out of the 2026 Met Gala - AOL.com,I Spot Beauty Trends for a Living—This Will Be the Most Popular Makeup Look to Come Out of the 2026 Met Gala - AOL.com
gnews,makeup trend,news.google.com,https://news.google.com/rss/articles/CBMidEFVX3lxTE1BSWJkYktiMEpDeHVJTlBfYkFaTFZIajVJLUNMZjQ1Y1RzMnV4UkpROUZabzM1RUdXSmhyc2tmLWRXOGJSdXRpTmY0bUFOalRFSzBmcHhUQmNvQUpqektyU2k3TXRZaV9pb2hOZDdnNS1oaVlR?oc=5,1776841200,"It's Official: This Spring's Most Lovable Blush Trends Are Blurred, Romantic, and Borderline Painterly - Who What Wear","It's Official: This Spring's Most Lovable Blush Trends Are Blurred, Romantic, and Borderline Painterly - Who What Wear"
gnews,makeup trend,news.google.com,https://news.google.com/rss/articles/CBMivwFBVV95cUxNWE1KZzdjekNGMkI4T3U1TnlYaGdNbldDb0x4MDZJNGtSVkFFcWE1X3dIeGc1WHpLbUNCeEJucVVheC1HWFhDZi1Ta2xELWZwcGpObGRwRVhXV1NSaE0wWERBTjVZTm5OU3RQb2ZUZlBIZTNCREdkWW43aUsyZ0RWU2tQOUxZRUFLWERkWGpMRndKRVpNajNhZWZrZTd5a0l2UXVVY1g1cG1MRzJEbWZEbjBoVkNtbC05aGF1b0k1cw?oc=5,1777951140,Marc Jacobs Beauty Is Back and at the Met Gala - ELLE,Marc Jacobs Beauty Is Back and at the Met Gala - ELLE
gnews,makeup trend,news.google.com,https://news.google.com/rss/articles/CBMif0FVX3lxTE5iaFZlYTVJZ1Bpa2RYZnJXYTRsc3NqazhOUHYtRHpqVFp1d0hRMHpBY0RfREs4WnIwdzhleHNUcC05NllhSGdvNGhFWER4WUZOMExPcEtONDktdDk4QnhTLVRHTVFlSlVKRDJBa2dxZEc0SFU0NExKRERkQjVfR2M?oc=5,1777935891,Met Gala 2026: The Invisible Beauty Trend Brands Are Paying Thousands For - AOL.com,Met Gala 2026: The Invisible Beauty Trend Brands Are Paying Thousands For - AOL.com
gnews,makeup trend,news.google.com,https://news.google.com/rss/articles/CBMilgFBVV95cUxOUEhXNHNrb0IwWmxfanBGaEg1aS1leUFEZVBPNzdXUWhqaWg3VlprYnhvY2ZJRXYyRnlBS2JhWmFoa0tEeTBXb3RGeDNuUU4zcldrS0NYRmFnejJyODVNSGFXdm14OUp0T3B4SkR3MXZVQzJ1RlFBRTJjZTNYR2tFN1A5RDhzdnNEd01CMGpGeUJDbXV4cEE?oc=5,1777950900,I Ranked the Best 9 Beauty Looks at the 2026 Met Gala (And a Few Are Kinda Controversial) - Cosmopolitan,I Ranked the Best 9 Beauty Looks at the 2026 Met Gala (And a Few Are Kinda Controversial) - Cosmopolitan
gnews,makeup trend,news.google.com,https://news.google.com/rss/articles/CBMiqwFBVV95cUxOQU9GYUhYeG5vSlFwN1BsX0pnQkRsbHJDSVA4YXRvbkdfay01VU9TcTJTaFM2dzh3NmFfSzN6dWZZNlVrY1FnRmliZFBHNEVMSHJ1UmhCMFU3X1A4V20xNzFLQVVzUlpSWDFMVU9GTjg1TjZDUjZiaFhXbFRyOF9oRFI2V1BybHVLWmtsTDRpUjM5MjBKd01qUmhCOENMMXlaZFJJMlpYckNzd1U?oc=5,1778006460,Kendall Jenner’s Met Gala Lip Stain Is Only $11 on Amazon Right Now - ELLE,Kendall Jenner’s Met Gala Lip Stain Is Only $11 on Amazon Right Now - ELLE
gnews,makeup trend,news.google.com,https://news.google.com/rss/articles/CBMibkFVX3lxTE5LdjFyZVZyVmZNeEotMDZOTlNRaW1KNHNDaDdPLVFnWlozVTI3MUYzS2xMRG55NDRIUm9pbFNkT2duOTlQUkJZbkhBQ0lQT1IzWlE1ckswYWhDdWZBSzdGYk9tRklNa0N0N0hVZFZB?oc=5,1777530540,“Wet” Lashes Are The Romantic Autumn Makeup Trend We Can’t Wait To Try - Refinery29,“Wet” Lashes Are The Romantic Autumn Makeup Trend We Can’t Wait To Try - Refinery29
gnews,makeup trend,news.google.com,https://news.google.com/rss/articles/CBMiigFBVV95cUxQVXhUdW5OdlpETGhHMjRhSEpaT3RBSEo3ckMyY2N4TjZRRGg4UUxiTzcyN0p3RUpSTVJqaXRhUUtRakJ4dDRiWG1JRlhabWN6Rl9GRGhmNzJTcFhFWDJ6cXpyTWdZdkRzYU5BUGJQUjdQYWVBY3pGQ2ViYUxRb29xQjY5cXNiQ2FIRUE?oc=5,1777942140,Doja Cat Debuts ’90s-inspired “Double Liner” at the 2026 Met Gala—and It’s a Master Class in Red Carpet Glam - Cosmopolitan,Doja Cat Debuts ’90s-inspired “Double Liner” at the 2026 Met Gala—and It’s a Master Class in Red Carpet Glam - Cosmopolitan
gnews,makeup trend,news.google.com,https://news.google.com/rss/articles/CBMigAFBVV95cUxPeHgzTjE0RzV0M1hLTnNKM085bGxhOU5wbHA4dlk5WHFXdFJsdnZKc2U4LTN0X3ZqNzE4TDFHdXNJMEtyaWJIbXhlM0lHZUdTN2RKajhWVDlKbVItM19yN0RoUWgxaHBPSTJpNmFHS0ZpLS16cFJNSjhscTVZQzBaRA?oc=5,1778110200,Anne Hathaway's Full Beauty Evolution In Pictures - women.com,Anne Hathaway's Full Beauty Evolution In Pictures - women.com
gnews,makeup trend,news.google.com,https://news.google.com/rss/articles/CBMibkFVX3lxTE1YQS1wdWsyemZVbU4taFMya1JiaDZLVjFPQ0FOcXBNempoY0VrbmNoZ2JXQVJBQnczdGxJRW9VY183Zm5lYVpTcWRYcG1yaXFrUmVwT05nZmtBb0g1S2VWX3ZDZGIzVFdTWWJtQ1ln?oc=5,1775545200,“Wet” Lashes Are The Romantic Spring Makeup Trend We Can’t Wait To Try - Refinery29,“Wet” Lashes Are The Romantic Spring Makeup Trend We Can’t Wait To Try - Refinery29
gnews,makeup trend,news.google.com,https://news.google.com/rss/articles/CBMilgFBVV95cUxPcFRUMHZhdF83TXB3dHdtSnJ0OUwzRTJ3MVBYQ3VmN2w3bTNtUGQ3S3NnOXdXTW8teHBsVlktYUFkR3RVOFpMQUZaTXhPSlBHSElWSjRiTEJGVDN6aXQtT2RqTEhnY3hRUGJ4QkZ3cFYyTDVRRUhiYlRrajd3Zldjc0V6RFVMVnZqb0pxd0U1c3NjWWlYUlE?oc=5,1777945860,"From 1985 to 2026, We Ranked the Best Met Gala Beauty Looks of All Time - Cosmopolitan","From 1985 to 2026, We Ranked the Best Met Gala Beauty Looks of All Time - Cosmopolitan"
gnews,makeup trend,news.google.com,https://news.google.com/rss/articles/CBMiZEFVX3lxTE5ZdDNRdU1od3daT0lsREpYQ2dBbURIeWdTdEFmMTNRT0tKeFFHaTRhS1lqbDVEcnhHZkh6Y21hRlhIN3k5VlctNHBERlU5SFlUMVFmWkR6RXRjQUpCaW9NV0JNem8?oc=5,1775631600,All About the Viral Scandi Makeup Trend—and How to Get the Look - Real Simple,All About the Viral Scandi Makeup Trend—and How to Get the Look - Real Simple
gnews,makeup trend,news.google.com,https://news.google.com/rss/articles/CBMidkFVX3lxTE1CMnVNeEZCT3N2ZDNJamhaV1pSWmdwdnpYdFJaZlI5Nk1HaXlPQzlvQmdPM0VJN3BhSWdUdEQtWkFXUlBaS3luM0tvaFlVQXVGbVktaXZaenN2bFBkempRMDc2RkY3YVhVNE8xZ1VCOXprb1FfaVE?oc=5,1774335600,My FYP Has Been Looking Especially Frosty: The 10 Makeup Must-Haves Leading the Charge in 2026 - Who What Wear,My FYP Has Been Looking Especially Frosty: The 10 Makeup Must-Haves Leading the Charge in 2026 - Who What Wear
gnews,makeup trend,news.google.com,https://news.google.com/rss/articles/CBMihAFBVV95cUxNeEhucERWaWdWWmdWRjg4enRmc1dYckxhUzdTLWNkQ1owNnZTbzZhN3lGYTlfczNtWGFEb2NJTGtBcHhDYU55bzhOcXB6WnhhYVE0aXJPbVEwQVdqZEpmbWxWclZxYTVncGRvazQ3MnlWdm81R0NIU0xfc2ZlbGlFeXR4cDc?oc=5,1774508738,"Not Eyeshadow, Not Bold Lips: The 3 Spring Makeup Looks Everyone's Wearing RN - Marie Claire","Not Eyeshadow, Not Bold Lips: The 3 Spring Makeup Looks Everyone's Wearing RN - Marie Claire"
gnews,makeup trend,news.google.com,https://news.google.com/rss/articles/CBMirwFBVV95cUxNdmtGOEdZLTJab2lpd1pGd2ZRREtKT3RDY2xIbC1ORENhdXJSS3djYUE0ZlFQVUx1ZVhUTUpWVF9kUGVZSDluazNBaFZXWWFyM0Jyd2tua0JvZW9rX2xOUGplaEVCcGZBMnVfTGhNYWxfRHRuYmJEcFB1TmNZeFQ0UVA0ZFkxV0luQmFJNmVUV2t6SzJtTHRPLVRMTXFnSWtfeDBRbWlTRlJzVkxGWkFn?oc=5,1777633385,I’m a beauty writer and I think these will be the biggest spring/summer makeup trends - Irish Country Magazine,I’m a beauty writer and I think these will be the biggest spring/summer makeup trends - Irish Country Magazine
gnews,makeup trend,news.google.com,https://news.google.com/rss/articles/CBMiakFVX3lxTE9aUndDSnJoRU5yRGlMaDRhcWFjVkZJSlIza2xwcGdxVWFTMmd4eXR3Wk44VE1CXzA1d3VZYWNkZURONXZTekVCYXNSSnJ3T2NFMEdlM2lyT1hQbldPbzQyeU1GdWdFQURCVmc?oc=5,1775458800,Fara Homidi Shares 5 Low-Maintenance Makeup Trends For Every Spring Mood - Refinery29,Fara Homidi Shares 5 Low-Maintenance Makeup Trends For Every Spring Mood - Refinery29
gnews,makeup trend,news.google.com,https://news.google.com/rss/articles/CBMiqAFBVV95cUxNbHAxMmpsdjFqNWtzczF1YzdhZXJoTXBPb29LSVhSOE1GV09JajhvbWRoNkFabW92cTNSYnZPUUZBcXlUYnhxYi1EN2JiTFppRDZNakVOMWdXVVF1RGJmZUF3eTR2UmdDUWxFQ0R1UGQxTFNlSmpEd3p5RmEtYVJyVGNQTnhpUG5relRERUkwdk9TM3BrRUlOWjZSYnpZMnJJdDN0Yy1ZZ1k?oc=5,1774508400,Exaggerated Lower Eyeliner Is the Groundbreaking Spring 2026 Makeup Trend - Teen Vogue,Exaggerated Lower Eyeliner Is the Groundbreaking Spring 2026 Makeup Trend - Teen Vogue
gnews,makeup trend,news.google.com,https://news.google.com/rss/articles/CBMilAFBVV95cUxQZUZ0dTFpTFNReURtQUJPd0pxRW5xREx3Tzlpay1jSzFOTnZ0RGItMUNIRUFMbV9DOXJDMGc3ZUI3V0JiMGxtZDlHbDZ6aGNDdWlOWEF4Si0zNm82Sms5clcyWmRqTkpoWFVZRU1fSnVaWlpkVjh4YmR6UFUtS2lReE9INjI3ZXRVdHk1SGxhQ3BLTU1x?oc=5,1776150000,Euphoria Makeup Is Back—These 8 Iconic Looks Are Easier to Recreate Than You Think - Cosmopolitan,Euphoria Makeup Is Back—These 8 Iconic Looks Are Easier to Recreate Than You Think - Cosmopolitan
gnews,makeup trend,news.google.com,https://news.google.com/rss/articles/CBMiX0FVX3lxTE91MGwxekxsWDJtdVFDSjJXbVNpc1pLQlRQYUdUSWxtMnFIbktIdkZ5bFJJdWNUSUs3SWFHTjVmdzgyRVBNN3l4ZlhXalllM2s3b0hMRnFJZ3JvM0pqc2hV?oc=5,1775458800,The Halo Lip Is In & Super Shiny Gloss Is Out For Spring 2026 - The Zoe Report,The Halo Lip Is In & Super Shiny Gloss Is Out For Spring 2026 - The Zoe Report
