source,query,url,created_utc,title,text
youtube,beauty trends,https://www.youtube.com/watch?v=DKDe_ZDzsiE,1778859016,Wishcare tinted lip balm with spf protection🤌🏻 #lipbalm #liptint #beauty #lipcare #makeup #trending,"makeup,beauty, long lasting makeup, for you, trending, explore, for you page, explore page, new launch, must have makeup, ..."
youtube,beauty trends,https://www.youtube.com/watch?v=Hjh1jWJNT9U,1778857214,The beauty industry is getting a huge makeover,Beauty trends and industry shifts you need to know about as a brand owner or marketer.
youtube,beauty trends,https://www.youtube.com/watch?v=V17ibHjIOTI,1778856000,K-beauty trend reshaping views of masculinity,"Fueled by K-pop stars like BTS and viral Korean skincare trends, K-beauty is growing in popularity among men worldwide and ..."
youtube,beauty trends,https://www.youtube.com/watch?v=nzZXQGMRs6M,1778855612,ये Beauty Trend लोगों को पागल बना रहा है 😳 #shorts #viral #trend #trending,Internet पर एक dangerous beauty trend viral हो रहा है जहां लोग sharp jawline पाने के लिए अजीब ...
youtube,beauty trends,https://www.youtube.com/watch?v=PjyARfRFxuE,1778853639,Guess the Makeup from Emoji Challenge💄💋 | #shorts  #youtubeshorts,Guess the Makeup from Emoji Challenge     | #shorts #youtubeshorts #challenge #makeup #youtubevideo ✨ Description : Hello ...
youtube,beauty trends,https://www.youtube.com/watch?v=6vox0An7GKM,1778853609,"Blauer Lidschatten, Nina Park Lips, matte Lippen – Beauty-Trends im Sommer 2026 #beauty #genz",Die Beauty-Trends des Sommers 2026 sind hier und wir müssen reden. Was wirklich alltagstauglich ist und was ihr euch ...
youtube,beauty trends,https://www.youtube.com/watch?v=qFUS4vQygA0,1778853003,Cosmetic Surgery and Economic Inequality #cosmeticsurgery #cosmetics #beauty #ytshorts #ytviral,"cosmetic surgery, beauty standards, plastic surgery debate, social conditioning, kardashian beauty standard, beauty industry, ..."
youtube,beauty trends,https://www.youtube.com/watch?v=2B_xfcXDzjk,1778851805,Protein powder cheap substitute | cheap glutathione tablets | latest beauty trends,Protein powder cheap substitute | cheap glutathione tablets | latest beauty trends.
youtube,beauty trends,https://www.youtube.com/watch?v=ZsdjT5JrYZc,1778851577,Indians Are Ruining Their Skin With These Beauty Trends!!!,Skincare ka problem aaj information ki kami nahi hai… information overload hai. Har din koi naya serum viral ho raha hai.
youtube,beauty trends,https://www.youtube.com/watch?v=WuOUNTNrVT4,1778850631,K-beauty trends are reshaping views of masculinity,"K-beauty is growing in popularity among men worldwide, fueled by K-pop stars like BTS and viral Korean skincare trends, and ..."
youtube,beauty trends,https://www.youtube.com/watch?v=yc7fFFLesOM,1778849862,Sajnaa ho 💚💐 #reels #hatelove #vibes #zalima #beauty #trends #butterfly #love #shreyaghoshal #hamari,
youtube,beauty trends,https://www.youtube.com/watch?v=_DHZ0JLtaMs,1778845659,Rehna do 🌸 #love #reels #hatelove #vibes #zalima #trends #beauty #butterfly #wine #uditnarayan #bad,
youtube,beauty trends,https://www.youtube.com/watch?v=rh88hU7ldjo,1778845207,Tu Mil Jai☘️💚#love #reels #vibes #hatelove #trends #beauty #butterfly #wine #imranhashmi #witch #bad,
youtube,beauty trends,https://www.youtube.com/watch?v=OUicnd7ZwpE,1778838415,Какой спф выбрать?,Какой спф выбрать? Мой спф можно найти на ВБ по запросу «спф Seauty» или по артикулу #WW357489 (копируй с WW) ...
youtube,beauty trends,https://www.youtube.com/watch?v=mxWuanUzvUA,1778830063,Last one of this look besties #MomsofTikTok #grwm #makeup #fyp #Shorts #florandrade.2,Last one of this look besties #MomsofTikTok #grwm #makeup #fyp Last one of this look besties #MomsofTikTok #grwm #makeup ...
youtube,beauty trends,https://www.youtube.com/watch?v=U8zhbcmeSEo,1778828471,my beauty must haves #beauty #products #makeup #essential... #Shorts #youlovemay_,my beauty must haves #beauty #products #makeup #essential... my beauty must haves #beauty #products #makeup #essential...
youtube,beauty trends,https://www.youtube.com/watch?v=ao5Qd5nrTvU,1778826186,How People Actually Use Copper Peptides?  #beautytrends,How are Copper Peptides used? Usually in: Serums Creams Hair products People often apply them: After cleansing Before ...
youtube,beauty trends,https://www.youtube.com/watch?v=ON-aDBpMibU,1778825245,Trends #yt #hairstyle #ytstudioes #youtubeshorts #haircut #youtubevideos #hair #ytshorts #beauty,
youtube,beauty trends,https://www.youtube.com/watch?v=O1QLLZOqHLs,1778823663,Red White Glitter Nail Art Tutorial ❤️✨ | Easy Trendy Nails 2026 | artistry aura,Create this gorgeous Red White Glitter Nail Art look with easy nail art techniques and sparkling glitter details ✨   Perfect for ...
youtube,beauty trends,https://www.youtube.com/watch?v=6FQo235JYPM,1778823034,𝐋𝐮𝐱𝐮𝐫𝐲 𝐇𝐚𝐢𝐫 𝐓𝐫𝐚𝐧𝐬𝐟𝐨𝐫𝐦𝐚𝐭𝐢𝐨𝐧 &amp; 𝐒𝐩𝐚 𝐒𝐞𝐫𝐯𝐢𝐜𝐞𝐬 𝐢𝐧 𝐍𝐚𝐥𝐥𝐚𝐠𝐚𝐧𝐝𝐥𝐚 ✨ | 𝐁𝐞𝐚𝐮𝐭𝐲 𝐁𝐚𝐲 𝐋𝐨𝐮𝐧𝐠𝐞,Redefine your beauty experience at Beauty Bay Lounge ✨ From trend-setting Hair Transformations and flawless Hair Coloring ...
youtube,beauty trends,https://www.youtube.com/watch?v=Atl_Qo1er2s,1778821790,Reasonable Minute of the Day | AI Beauty Trends and the “Looksmaxing” Craze (05-15-26),"Reasonable Minute Of The Day Friday, May 15, 2026 Topic: AI Beauty Trends and the “Looksmaxing” Craze Follow Andy Hooser ..."
youtube,beauty trends,https://www.youtube.com/watch?v=7VlZTZfQIag,1778821409,Dil Mardi🧝‍♀️✨#reels #hatelove #vibes #love #zalima #beauty #trends #butterfly #wine #dilijitdosanjh,
youtube,beauty trends,https://www.youtube.com/watch?v=n954CUeRA9g,1778812194,Top 5 Luxury Makeup Brands Every Girl Wants 🔥,Top 5 Luxury Makeup Brands Every Girl Wants --- ✨ Discover the **Top 5 Luxury Makeup Brands** that beauty lovers are ...
youtube,beauty trends,https://www.youtube.com/watch?v=Kcq6S-DUH9M,1778805932,NEW Cbeauty palette.... or a Copy of THIS Viral brand? (Asian beauty New Releases),"Reacting to NEW K-beauty & C-beauty makeup launches that have been all over TikTok, Xiaohongshu, and Olive Young lately ..."
youtube,beauty trends,https://www.youtube.com/watch?v=qh2o3b3meAQ,1778805200,This was my jam had to use this song for a video! #grwm... #Shorts #florandrade.2,This was my jam had to use this song for a video! #grwm... This was my jam had to use this song for a video! #grwm... This was my ...
youtube,skincare routine trend,https://www.youtube.com/watch?v=9a7SbIyQQE0,1778859898,packing order #skincare #packingorders #fyp #handmade #trend #diy #how #skincareroutine #success #sa,
youtube,skincare routine trend,https://www.youtube.com/watch?v=N4O_j1l5WBI,1778851821,Your skin is trying to tell you something. #glowup #skincare #skincareroutine #trend #viral #shorts,Your skin is trying to tell you something. Redness. Breakouts. Irritation. Sometimes the problem isn't your skin — it's an overloaded ...
youtube,skincare routine trend,https://www.youtube.com/watch?v=OfFv0rnJ8rg,1778850721,🩷#youtubeshorts #skincare #yt #skincareroutine #beauty #ytshorts #ig #viral #trending #trend #insta,True solution for chapped and dry lips.
youtube,skincare routine trend,https://www.youtube.com/watch?v=2reOXHta4VQ,1778848430,best skin care routine for men | The Trend Marketplace,"Guys, your skincare routine shouldn't just be soap and hope. #menskincare #skincareformen #amazonfinds #mensgrooming ..."
youtube,skincare routine trend,https://www.youtube.com/watch?v=LhCGtu8qpN8,1778846335,Skincare Trends You Should Ghost 👻 | Worst Viral Skincare Hacks,"Stop following skincare trends that secretly damage your skin! In this YouTube Short, we're exposing some of the most viral ..."
youtube,skincare routine trend,https://www.youtube.com/watch?v=zyIJ5sGnsl0,1778846005,Trend skincare 2026 = PDRN skincare 🧬🍣 #pdrn #pdrnserum #anua  #viral #skincare #skincareroutine,
youtube,skincare routine trend,https://www.youtube.com/watch?v=LU3KB7J5CmA,1778837136,tan removal remedy ❤️#natural #skincareroutine #skincare#vlog#dailyvlog #youtubevideo #new#trend #yt,
youtube,skincare routine trend,https://www.youtube.com/watch?v=dTPb8HOlvFM,1778820649,#shortvideo #trend #trending #trendingshorts #review #cessa #skincareroutine,
youtube,skincare routine trend,https://www.youtube.com/watch?v=LJf5NMF7f9M,1778818082,Joget tiktok Trend Aisyah#shortvideo#jogettiktok#lipsingshorts#skincareroutine,
youtube,skincare routine trend,https://www.youtube.com/watch?v=lIuxmKf8yw8,1778803256,60-Second Skin Reset: The Science-Backed Quick Glow Trend,The video breaks down a 60-second skin reset trend with step-by-step science-backed tips. It also adds makeup hacks that ...
youtube,skincare routine trend,https://www.youtube.com/watch?v=gQkiTZdo6Tk,1778789700,Best Bodywash in India! #india #skincare #shortvideo #skincareroutine #top #trend #trendingnow#body,
youtube,skincare routine trend,https://www.youtube.com/watch?v=1ANOVtL8mdo,1778779817,Stop Ignoring Skincare #shortvideo #shorts #ytshorts #skincare #bodycare #hygiene #viral #love #feed,"Most people think skincare is only about looking good, but the reality is completely different. Your skin faces pollution, sweat, dirt, ..."
youtube,skincare routine trend,https://www.youtube.com/watch?v=DrzC1imUDC8,1778778940,Ek din skin rhe jayegi aur m clear ho jaugi 🥲 #skincare #skincareroutine #skincareproducts #trend,
youtube,skincare routine trend,https://www.youtube.com/watch?v=L8Gn-cC-BWQ,1778778813,Habitual beauty cream test 👉🏻#yt #beauty #skincare #skincare #skincareroutine #dailyshorts #trend,
youtube,skincare routine trend,https://www.youtube.com/watch?v=DgA6xyNbtQc,1778769151,Cucumber Ice Roller for Glass Skin ❄️🥒 #shorts #skincare #viral #reels #trending #trend #diy #fyp,Giving my skin a refreshing boost with cucumber ice roller ❄️  ✨ #cucumbericeroller #glassskin #glowingskin #iceroller ...
youtube,skincare routine trend,https://www.youtube.com/watch?v=TpHgVkNf-Ck,1778769020,besan aur papaya ke anek jadui fayde 😱 amezing fact 💯#skincareroutine #skincare #trending #facts,Kya aap bhi parlour jaisa glow ghar par chahte hain? Is video mein maine bataye hain 3 aise aasaan aur asardaar homemade ...
youtube,skincare routine trend,https://www.youtube.com/watch?v=jDDTzLFDoiY,1778765724,Skin Acids for Beginners2026: Kaunsa kab use karein?  | Break the marketing trend.,"Kya aap bhi Skin Acids use karne se darte hain? In 60 seconds, jaaniye skin acids use karne ka sahi tareeka aur payein Glowing ..."
youtube,skincare routine trend,https://www.youtube.com/watch?v=eESR36ldxI4,1778765421,Mummy ne di 1 ghante ki dhamki! 😱🤣 #shorts #minivlog#trend #vlog #maa #dailyvlog #food #ytstudioes,Hey guys! Welcome to another mini vlog. ✨ Aaj ke vlog ki shuruat hi ek bade twist se hui! Mummy ne saaf bol diya ki agar 1 ...
youtube,skincare routine trend,https://www.youtube.com/watch?v=JwEmq3HuGjo,1778765429,Most skincare today feels confusing. #glowup  #skincare #skincareroutine #zero3 #trend #viral #new,Most skincare today feels confusing. Too many products. Too many steps. No real system. Your skin doesn't need overload.
youtube,skincare routine trend,https://www.youtube.com/watch?v=bAdf9zW4MwU,1778764223,Skincare routine at 14?! STOP RIGHT NOW!,"Skincare routine at 14?! Think again With social media and trends everywhere, so many young girls feel like they need a ..."
youtube,skincare routine trend,https://www.youtube.com/watch?v=m63FOCzV8IQ,1778760372,#shortvideo #trend #skincare #trending #trendingshorts #review #skincareroutine,
youtube,skincare routine trend,https://www.youtube.com/watch?v=bgKSkIdeXFI,1778758682,trending find #trending #beauty #find #yt #trend #viral #youtube,
youtube,skincare routine trend,https://www.youtube.com/watch?v=UwlT8U1z6YE,1778753046,Trend năm nay gọi tên da Mochi  #kemduongmochi #ugcbeautyhub #reviewlamdep #skincareroutine #beauty,
youtube,skincare routine trend,https://www.youtube.com/watch?v=1hJfkGt1pbQ,1778747742,Affordable skincare products which actually works || Budget Indian Skincare || skincare routine,Best Skincare Products || Products Under Budget Get Clear Glowing Skin #acne #pimpleremoval #pimplemarksremoval ...
youtube,skincare routine trend,https://www.youtube.com/watch?v=aO_Vtg0pES4,1778746500,Sunscreen first🔥🌞,nofilter #hijab #hijabi #hijabigirl #makeuptransition #makeuptransformation #makeuptrends #makeup #makeuptutorial ...
youtube,makeup trend 2025,https://www.youtube.com/watch?v=dgSQZoTezrQ,1778852224,JK Sophia with Cleopatra Trend  #jksophia #cleopatra #makeup #trend #mmissgrandmyanmar2025,
youtube,makeup trend 2025,https://www.youtube.com/watch?v=a6ydjzDbJOM,1778824800,Best Lipstick shades for bridel bridal or non bridal👄2026 #fashiontrends #shorts #lipstick #makeup,Best Lipstick shades for bridel bridal or non bridal look 2026 #fashiontrends #shorts #lipstick #makeup #maybelline #mars ...
youtube,makeup trend 2025,https://www.youtube.com/watch?v=izHPCMHj1eY,1778811018,Bridalmakeup#Makeup#Makeuptutorial#Makeupvideo#,"bridal makeup, makeup bridal, diy bridal makeup, soft bridal makeup, easy bridal makeup, bridal makeup tips, bridal makeup ..."
youtube,makeup trend 2025,https://www.youtube.com/watch?v=_EpL8HJsmtE,1778724034,Power of makeup 💄#shorts,Power of makeup #shorts YOUR QUERIES:- power of makeup the power of makeup power of makeup (poppy playtime) the ...
youtube,makeup trend 2025,https://www.youtube.com/watch?v=L7OGc51RuYk,1778601022,ROSÉ Met Gala 2025 Makeup 🖤✨#rosé #blackpink #makeup #metgala #beauty,"you love BLACKPINK inspired makeup, K-beauty glam, and celebrity recreations, don't forget to like & subscribe #ROSÉ ..."
youtube,makeup trend 2025,https://www.youtube.com/watch?v=2BvROKtzqz0,1778500804,Renee Green Eyeliner  | makeupbymahimapunni 💄💕 #makeup #eyelinertutorial #viral,Hello Green  This Bold & Shimmery Eyeliner would Compliment all your Glam Looks and Outfits✨ Renée Glitterish Eyeliner ...
youtube,makeup trend 2025,https://www.youtube.com/watch?v=XxTNUykOS94,1778315437,🎯 Perfect Eye Makeup Hack for Beginners#shortsmakeup#shortvideo#shorts#trending#viralvideo,"Perfect Eye Makeup Hack for Beginners#shortsmakeup#shortvideo#shorts#trending#viralvideo eye makeup, trending eye ..."
youtube,makeup trend 2025,https://www.youtube.com/watch?v=pLTx0n6NNBQ,1778279424,makeup look recreation /// the makeup look is one i did in 2025,
youtube,makeup trend 2025,https://www.youtube.com/watch?v=NyWvxiCUr9E,1778244194,Ashoka makeup trend 👍 #asokamakeup #asoka  #makeup #dance #trending #viral #duetdance  #viralshorts,Ashoka makeup trend #asokamakeup #asoka #makeup #dance #trending #viral #duet #duetdance #tiktok #viralshorts ...
youtube,makeup trend 2025,https://www.youtube.com/watch?v=BWlSRZl32WM,1778167504,Blue And Silver Eye Makeup Look!,"I did this Blue and Silver eye makeup look in April 2025, the eyeshadow palette I used is BPerfect Cosmetics Carnival Interstellar ..."
youtube,makeup trend 2025,https://www.youtube.com/watch?v=KCzmWSsbZNA,1778159035,Ashoka makeup trend 👍 #asokamakeup #asoka  #makeup #dance #trending #viral #duetdance  #viralshorts,Ashoka makeup trend #asokamakeup #asoka #makeup #dance #trending #viral #duet #duetdance #tiktok #viralshorts ...
youtube,makeup trend 2025,https://www.youtube.com/watch?v=5W_pDAYg_XA,1778100568,Birthday Makeup Transition #makeup #viralshorts #tiktok #trend,My birthday makeup look 2025 was absolutely chefs kiss.
youtube,makeup trend 2025,https://www.youtube.com/watch?v=FGIFRpYsYPQ,1778081101,creative makeup look #viral #trending #shortsfeed #bridalmakeup 🧿 #bridalmakeuplooks #makeup,Indian bridal makeup tutorial pink bridal makeup look #viral #trending #shortsfeed #bridalmakeup #weddingmakeup #makeup ...
youtube,makeup trend 2025,https://www.youtube.com/watch?v=rj4zzawsHvk,1778071854,cool makeup trend with music and different characters #dance #trending #viral #tiktok,cool makeup trend with music and different characters #dance #trending #viral #tiktok #trending #viral #duet #duetdance #tiktok ...
youtube,makeup trend 2025,https://www.youtube.com/watch?v=z11iZSlCZmQ,1778063441,Clean Girl Makeup on Indian Skin (No Foundation) ✨#CleanGirl #nomakeupmakeup #makeuptutorial #viral,"""POV: You finally mastered the 'Clean Girl' look on Indian skin 🕊️  ✨No heavy foundation, no cakey layers—just glowy, fresh ..."
youtube,makeup trend 2025,https://www.youtube.com/watch?v=h4R0utbGVV0,1778052423,How Isha Ambani got ready for the 2026 Met Gala,"When it comes to Met Gala beauty, just like the fashion, there are usually two camps: theatrical experimentation that raises ..."
youtube,makeup trend 2025,https://www.youtube.com/watch?v=WMUMv8wszrs,1778041995,A Kind Of Sunset Eye Makeup Look I Did In August 2025!,I did this kind of sunset eye makeup look in August 2025. Short music: YouTube Studio Music Library #eyemakeup #eyeshadow ...
youtube,makeup trend 2025,https://www.youtube.com/watch?v=gAz3h_-BmJM,1777986008,💕 THIS Bridal Makeup Trend is TAKING OVER! 🔥👰 #BridalTrends #MakeupTrend #BridalBeauty,THIS Bridal Makeup Trend is TAKING OVER! Modern + Traditional = The PERFECT Bridal Look in 2025! Learn to create ...
youtube,makeup trend 2025,https://www.youtube.com/watch?v=z0fpqHS6Wlc,1777958582,Pink Eye Makeup Look!                          #eyemakeup #makeup #shorts ,"I did this Pink eye makeup look in October 2025, the eyeshadow palette I used is BPerfect Cosmetics Carnival Interstellar Stacey ..."
youtube,makeup trend 2025,https://www.youtube.com/watch?v=eqUUEYGtNV8,1777950510,#bridal makeup look# 2025#beauty with Neha style #,bridal makeup look # #beauty with Neha style #
youtube,makeup trend 2025,https://www.youtube.com/watch?v=-KYe4loC2Iw,1777946400,power of makeup 💄#shorts,power of makeup #shorts YOUR QUERIES:- power of makeup the power of makeup power of makeup (poppy playtime) the ...
youtube,makeup trend 2025,https://www.youtube.com/watch?v=pEu7WRPtDpw,1777913990,New viral trend #tiktok #music #duet #transition #makeup #usa #trending #viralshorts #challenge,New viral trend #tiktok #music #duet #transition #makeup #usa #trending #viralshorts #challenge.
youtube,makeup trend 2025,https://www.youtube.com/watch?v=gIuOsdQYYgU,1777905036,power of makeup 💄#shorts,power of makeup #shorts YOUR QUERIES:- power of makeup the power of makeup power of makeup (poppy playtime) the ...
youtube,makeup trend 2025,https://www.youtube.com/watch?v=NxAdW-ZFKAU,1777827711,TikTok makeup trend - Zara Larsson Effect ✨️ Pt. 2 🌈 | 📌 Pinned your comment | #makeup #transition,TikTok makeup trend - Zara Larsson Effect ✨️ Pt. 2 I'm kinda obsessed with those transformations already.
youtube,makeup trend 2025,https://www.youtube.com/watch?v=_48A4OVaEP0,1777765378,recreated 2025 me makeup look,cheek hearts design.
