source,domain,url,created_utc,title,text,query
rss,www.refinery29.com,https://www.refinery29.com/en-us/mango-hailey-beiber-summer-2026-campaign?utm_source=feed&utm_medium=rss,1778600957,Hailey Bieber’s New Mango Campaign Is A Lesson In The “Big Top Rule” — Here Are The Pieces Actually Worth Buying,"Hailey Bieber’s New Mango Campaign Is A Lesson In The “Big Top Rule” — Here Are The Pieces Actually Worth Buying

</div>



<div><figure><img src=""https://www.refinery29.com/images/11980890.jpg?width=768&amp;height=1024&amp;fit=bounds&amp;crop=3%3A4"" /></figure></div>



<p>I spend a lot of time thinking about what actually makes a <a href=""https://www.refinery29.com/en-us/dove-cameron-90s-minimalist-goth-trend-spring-2026"">trend</a> stick. Is it the sheer ubiquity of it on our feeds, or is it the moment a high-street powerhouse manages to bottle up a specific moment and make it feel attainable and wearable?</p>



<p>Looking at <a href=""https://shop.mango.com/us/en/e/women/craft-your-own-story-feat-hailey-bieber/ff9f9804"" rel=""noreferrer noopener"" target=""_blank"">Hailey Bieber’s new Summer 2026 campaign for Mango</a>, it’s clear we’ve hit the latter. While the internet will inevitably spiral over the micro-shorts — and listen, as someone who respects a borderline inappropriate trend, I see the vision — the real value for those of us building a functional, high-low wardrobe isn’t in the controversial hemlines. It’s in the intentionality of the layers.</p>





<p>The campaign is a masterclass in what I call the “Big Top Rule.” It’s a study in contrast: heavy, technical outerwear and structured blazers paired with soft, itsy-bitsy, summer-ready basics. It’s a vibe that feels as at home on a crisp morning in NYC as it does on the coast in California. If you’re opting for micro-tiny shorts this summer, pairing them with an oversized polo, a structured quarter-zip, or a crisp button-down is the polished, sophisticated way to nail the leg-baring trend. Life is about balance, after all. To get the full look just right, you need the volume up top to ground the mini shorts.</p>



<div><figure><img src=""https://www.refinery29.com/images/11980892.jpg?width=768&amp;height=1024&amp;fit=bounds&amp;crop=3%3A4"" /></figure></div>



<p>Thanks to Bieber and Mango, we now have a blueprint for outfits that nail the proportions. Whether you’re going full-Hailey or just grabbing the hero layers, shop the best of the drop here.</p>





<div><figure><img src=""https://www.refinery29.com/images/11980938.jpg?width=768&amp;height=1024&amp;fit=bounds&amp;crop=3%3A4"" /></figure></div>



<figure><a href=""https://www.refinery29.com/en-us/shop/summer-shop-2026-c2240670"" rel=""noreferrer noopener"" target=""_blank""><img src=""https://www.refinery29.com/images/11980947.png?width=1024&amp;height=373&amp;fit=bounds&amp;crop=1024%3A373"" /></a></figure>
<p><strong>Like what you see? How about some more R29 goodness, right here?</strong></p><p><a href=""https://www.refinery29.com/en-us/hailey-bieber-opi-nails-manicure-grammy-awards-2026?utm_source=rss&amp;utm_medium=rss_linkback1"">The OPI Combo Behind Hailey Bieber’s Grammys Nails</a></p><p><a href=""https://www.refinery29.com/en-us/hm-stella-mccartney-collaboration-collection-looks?utm_source=rss&amp;utm_medium=rss_linkback2"">H&amp;M x Stella McCartney Is Back After 20 Years</a></p><p><a href=""https://www.refinery29.com/en-us/zendaya-on-collection-review?utm_source=rss&amp;utm_medium=rss_linkback3"">Zendaya&#039;s On Collection Proves Leggings Are Over</a></p>",
gnews,news.google.com,https://news.google.com/rss/articles/CBMicEFVX3lxTE96eFRtR1g5NG15VmJxdk9GX3B1V1FJdWRDdkJPb1pHMWk3d2pwMV81WFBURlJxaHRadVZTWUFKR1VSc21KX1lyVTUxa2NSa05nRmxUU1FRb1hFVWNvc2hDZ25YYUQ0Y09jMzNhLTZuWGk?oc=5,1778232600,The Vogue Business Beauty Trend Tracker - Vogue,The Vogue Business Beauty Trend Tracker - Vogue,beauty trend
gnews,news.google.com,https://news.google.com/rss/articles/CBMixAFBVV95cUxQVHNBS2JXbzdNbVltblJ5bnVaQ1RDWkJ0WTNrT05PRjZRalBqazRWMDJuUmc3bFd5SEpfTVpZeERXZ3F3OGhkcHpRSXBiS1R3UUZjYmg5R1BUVWpKcVpvUWhBelJ4UGFUMHVWM1p5QUg5aXJDLUs2R2hyVExZZEpldTMyWnpIUlBrMGozVmJpcEVFeXNHSEFwS0ZYVEpheWppUzk5YzYtWmIyZEJiendTc09DZkFIU1l3ajVpS2Y5T1FyOGtl?oc=5,1778708315,The High Skull – China’s Bizarre Beauty Trend Has People Changing the Shape of Their Head - Oddity Central,The High Skull – China’s Bizarre Beauty Trend Has People Changing the Shape of Their Head - Oddity Central,beauty trend
gnews,news.google.com,https://news.google.com/rss/articles/CBMijgFBVV95cUxQbVpYMWFXTi1OTndhRHR0d1lqa0xDYmRPbURzZEV6QzlFeEdTN3VvR0ptWDdDSDZyUmZacFY0UmlhaFBzYUR1UkFSQXNMdlZvZ3lUOHdHU2pOWnpNN3M1cHlFbFNma1ZiUlpZLVhNelA1NWcyTk9TS3lLQ09tNF9DQUJ5S0NOU1JRU3FISG5n?oc=5,1778608116,Bold Eye Shadow Is Spring’s Most Playful Makeup Trend - ELLE,Bold Eye Shadow Is Spring’s Most Playful Makeup Trend - ELLE,beauty trend
gnews,news.google.com,https://news.google.com/rss/articles/CBMicEFVX3lxTE9sTk82QmhRUGFSVE0wRDhLRWNQclJLUmpWSlZJR3NPNWJIa2h5Mld5MERra1hfUGV6cWtwZVNXSEdraldKVmVMa2Y3Nzc5OUc5RmoyV29kOWlJVTY2UzVpalJiclFsX2x3czdUVWxtb1k?oc=5,1777014000,Watercolor Makeup Is Spring’s Softest — & Surprisingly Easy — Beauty Trend - Refinery29,Watercolor Makeup Is Spring’s Softest — & Surprisingly Easy — Beauty Trend - Refinery29,beauty trend
gnews,news.google.com,https://news.google.com/rss/articles/CBMiWEFVX3lxTE9nb0lxTkdrME93QmhtS0htQm1qR3VwNmFUN1pZbXAtaHNMMnVnV3FtU0dzUDZEdlkxZVZBSHd5TW0ybkFNQng3QnJjaUJSSUV3bEJ4ZkNRT3I?oc=5,1778731394,All the incredible beauty trends from AFW 2026 - RUSSH,All the incredible beauty trends from AFW 2026 - RUSSH,beauty trend
gnews,news.google.com,https://news.google.com/rss/articles/CBMifEFVX3lxTE9RaHZWZVYySkhLMXpoVlR6aXI3SG94UmYxUkgzZmxZbXliX2NCczZnSzFHYWZvUlFwTlFmN29raVZwcUNnVDczVHF2aHJRSTI4dWhJRWFBNDA0N1ZvWWVWeDZma19tRlc2MkdMZ2tqaV80RHQwemUwQ1p0SXA?oc=5,1778669221,TikTok says drinking your skincare is the hottest beauty trend to know now - so we tried it - Grazia Daily UK,TikTok says drinking your skincare is the hottest beauty trend to know now - so we tried it - Grazia Daily UK,beauty trend
gnews,news.google.com,https://news.google.com/rss/articles/CBMic0FVX3lxTE5SQS1QNGYxN0tabEZPbmUzOXE5NHJhRXI0Yzg2TXhrNTBTUjJrbXlLMTlwS242Tmw3UXVwRV9uY0NRdVE3SVU3SGdwc0tiOHE4M1loN3BFRFJtaFUzREdncEZHYklnOS1kemNsLUhOX29UVUU?oc=5,1778223600,"""Aussie Girl Glam"" Is Set to Become Summer 2026's #1 Makeup Trend - Who What Wear","""Aussie Girl Glam"" Is Set to Become Summer 2026's #1 Makeup Trend - Who What Wear",beauty trend
gnews,news.google.com,https://news.google.com/rss/articles/CBMibEFVX3lxTE9sTXJWUHVuNGZjdld6Nnk2bEptOHlCcWpKYnFDcHdUNk9aMWIwbkhGM09rME1MS0pLblNJUXRadk1vQU9WMTZrb0UyRHBZOVM5WFNsSXJoLWFoLTBSc1FCci1xUk9ZcG1lREw2UA?oc=5,1778695492,"""Anti-iPhone Face” Makeup Is The Internet’s Response To Same-Face Glam - Bustle","""Anti-iPhone Face” Makeup Is The Internet’s Response To Same-Face Glam - Bustle",beauty trend
gnews,news.google.com,https://news.google.com/rss/articles/CBMimAFBVV95cUxNYUx3d29TVkJDdE5CaGx2LWtRdVBDOU9ucFI5X2J6SUhhSy1TOFdqX2MxalZkdjBlNm5vUktRR2JDMlNhbTYzRTBNdDV4RW9VQU45RXZWbUo0T1NyR01tMFJkMUItUm53NUlPTWFFdGUteWo0NFpJWDBZaUQ3a0ZnbWo5WUlzeVM4bE9HV0R3ZVN6TTcxYm5DdQ?oc=5,1778701680,No-filter culture fuels natural-looking plastic surgery trend - 97.9 The Beat,No-filter culture fuels natural-looking plastic surgery trend - 97.9 The Beat,beauty trend
gnews,news.google.com,https://news.google.com/rss/articles/CBMidEFVX3lxTFA2NmhST3VFc0RmWWEzNkUtb1hSb1JVaFFaWHEwdWh2UWFFQ1J6NGtvZnZIMDdkOUhROWtsaGJSR2pZdlZFS0ZiVnBEMGwyOUtNcVAyVjZtcjUzRWNmN0FTZ0NLb1BhSjdDSWwxZXBrbkxtbUEt?oc=5,1778677200,The Watercolor Makeup Trend Is Peak Ethereal Mermaid Energy - Marie Claire,The Watercolor Makeup Trend Is Peak Ethereal Mermaid Energy - Marie Claire,beauty trend
gnews,news.google.com,https://news.google.com/rss/articles/CBMiggFBVV95cUxQd3M4RFdhc1l5YzhzNHMwa0hmLXBwYjBCWWlCWmxKS0JRcGRxUU12dk55U0JOcW0zV2Q5OGo1TE9Mdjl6LWtSb0c2bkZ0MVRoWk9MckpUQkYtNGZyMWFLbmlVQjdOSG5FeHZzUU1kaTQ5OEdZS3lMR2dKNGJaNU4xemJn?oc=5,1778668105,Beauty’s ‘jelly’ trend is bouncing into packaging too - Cosmetics Business,Beauty’s ‘jelly’ trend is bouncing into packaging too - Cosmetics Business,beauty trend
gnews,news.google.com,https://news.google.com/rss/articles/CBMiUkFVX3lxTE5ncnJqQ3JCVUhqZ3BUelNYelprVHlzcUlmZ0xjVWlqXzUwSHRDVlNLZV9TZkdSSFRCbU9QaXN5TDBRUVFyektsMmhMekZqcEdBVUE?oc=5,1778754000,“Ear”-ie trend. - yourtricounties.ca,“Ear”-ie trend. - yourtricounties.ca,beauty trend
gnews,news.google.com,https://news.google.com/rss/articles/CBMioAFBVV95cUxPUlNoajRRRC1NQ1VuZHBUbVpFQmU4QWV3SkRPb1gyWWZONW5sRURQT0hZS3hfUjFpSnlwdmZhTDZTMnp3SHp5Uk9IV0hsU2lsTXdEQldMM3FwTzZsYVhLWDFLV3BwZlN6UXNhT213QmxKQktHN20wNnZNV1Y3ZzgwclVKQl9Uc1VBaGhNeXlVQ3Y3dHZ4R1MwOXpGUVNPR0hy?oc=5,1778617800,Say Goodbye Bronzing Drops & Hello Bronze Water Tints: Why the Victoria Beckham Item Is Nearly Sold Out - E! News,Say Goodbye Bronzing Drops & Hello Bronze Water Tints: Why the Victoria Beckham Item Is Nearly Sold Out - E! News,beauty trend
gnews,news.google.com,https://news.google.com/rss/articles/CBMikAFBVV95cUxQd3pHN0tHeVlCRGNBN3M4Z3ZaVGlwbGJKQWhEWnVtN0NOcmFuLXlEVzJrOTdWX2d3R0ptWURJY0pfRXZCQTFHcERVUzRBcDlUQ3dxR09jTW9fR2VyV2YySll3VzdGVHhQNXVMQWk4MzE3MWFISjMwLU0tQ05xYWxUMTFJMU9XZkFjdTVOeGtXemc?oc=5,1777878000,I’m Calling It: These Are the Met Gala 2026 Beauty Trends to Watch - Cosmopolitan,I’m Calling It: These Are the Met Gala 2026 Beauty Trends to Watch - Cosmopolitan,beauty trend
gnews,news.google.com,https://news.google.com/rss/articles/CBMiuwFBVV95cUxQZ3Y4cVdZZnBDNUlIYU9EbmQyZU9BYk5zZXFqeHJCWFp6MmsxZnlYa3VOM0ZhU3A0SG1FOUFuWUhLX0tpLUl2aGJ4X0R6dnJZT2toWDJROTdHcm1oMDBsX1BrSDRGc3NfZnpZV1RQSTd0dlN4ZFFBVUxrS3NCNWFsdWVWVUlZdTlFR0tGS2lJY1hCY2h4eGYyQ2dpWU5WLUZpczRnRmo2UmpGTm9pakE1ZkFITktJeWxxSjFR?oc=5,1778754829,China Sees Bizarre 'High Skull' Beauty Trend Involving Acid Injections and Surgery - Ratopati,China Sees Bizarre 'High Skull' Beauty Trend Involving Acid Injections and Surgery - Ratopati,beauty trend
gnews,news.google.com,https://news.google.com/rss/articles/CBMilwFBVV95cUxNNFM5QXdoZURLeTVYaGZZRDhjNmo5OTJrdjg4SFdlWlAxSUxRYklwc2ZJeFl6WENldTVjdHN6X3c5LWRjZGdIN2ZlRGViaFEtTDlzQUo4eVRRbmhXRzlYYkxBWjVIM1hQMXFBS0ZybEpnWGFMdTMwTkZ4OXhoYjlkXzNLM1RaWkliMm5qZnF2ZUZzZUpmd3lr?oc=5,1777532400,Latest spring beauty trend to try | Go-To Girlfriend - CBS News,Latest spring beauty trend to try | Go-To Girlfriend - CBS News,beauty trend
gnews,news.google.com,https://news.google.com/rss/articles/CBMitAFBVV95cUxOQnhaMy0xXzluQ25yQ0xyRklNRmktSjBfMHVudTVOdFJhNWs1a050bzZCNUp2OHo5YXk1TUVZMXd3S2NKOGtYZEFZQXZOLW43Y1habHZjNDdRRUxHbmV3Q2dBMV8zT2hMYTktcGYycXF6YnpIeEtXWTVpWEZIYmpFb2ZfNU9YVUdZaG50cUdUNU1mT0VtZ0k4eUNxN21DbUxWRkdqNFZWM1ljaUJaQUpkTVRSVTc?oc=5,1778706603,"The Rise of Beauty Tourism: 5 Best Countries for Glass Skin, Facials and Hair Transplants - Us Weekly","The Rise of Beauty Tourism: 5 Best Countries for Glass Skin, Facials and Hair Transplants - Us Weekly",beauty trend
gnews,news.google.com,https://news.google.com/rss/articles/CBMiZkFVX3lxTE55YVNKbVVLSGpVeENKazIxYW90cVVvcWJldHkzZ0dJR1JSMTMwNUdGWC0xdUg5WVRsRVJpdTlvUEZBeGNNR2FNTHl4SWhOQlAzdU5QazFiZFlvRndkRDhOOV9MNUxZQQ?oc=5,1777964400,Tired? The Met Gala Served Up Lots of Dark Circles Inspo - Allure,Tired? The Met Gala Served Up Lots of Dark Circles Inspo - Allure,beauty trend
gnews,news.google.com,https://news.google.com/rss/articles/CBMifkFVX3lxTE9QSjEtay14Nms3Y0xKSDVUUnEwZUJ0LXFXNUo5dWpjQXNUX2dPaVkwNG1KN0ZLd0cxYnFkVEh0V3R5Mjh6a1VEb19YTldKZV9lSnBuSlk5STdQMFhrUVRJeDJjZVhPS0Q2NHVyMGtwWU9MMTlOMWFtR3djQzJNZw?oc=5,1778331600,"7 Korean beauty ingredients that will make your skin glow, according to dermatologists - CNN","7 Korean beauty ingredients that will make your skin glow, according to dermatologists - CNN",beauty trend
gnews,news.google.com,https://news.google.com/rss/articles/CBMiX0FVX3lxTE5NeDFDbW9JUzZ2bkxhUXoycUFHVVYzZ0F3T1I1VjR5RkUxU1V5OG9yWU5BQWNPc3QtRHBMTnhWd3RCSUZOSHVFZWJWU1hNekNVN3JJa1lfcFlNdWkyOHln?oc=5,1778535000,The French Highlight Is Summer’s Effortless Color Trend - Vogue,The French Highlight Is Summer’s Effortless Color Trend - Vogue,beauty trend
gnews,news.google.com,https://news.google.com/rss/articles/CBMijgFBVV95cUxOb21CMlBPUlZ0b3NOX0NWWXV1YVVWTVh6dDFJVTRTRjZFbm53bE0wQW1ZMXpNdUM3b0JiVTJyYS1DdTRlUVc1U3ZOdVJwRmZZVXA1Y3UxaHBXRENkZExpN0ZXVnlidTdWVV9UY2FzUjNCR1BwVnNVdV81a1NobUt0a21kNnZ5V1VzUUtmb1ln0gGTAUFVX3lxTE1tU2FURzRvbElISThuZTVDMGw2ZDJFTjRvcl9GWlNfdFFiOHVMSkFjQ0FqYkk5VFA4VHFjbktvaDE2SjVXXzZOLW5YVXdUN3pXOHVDZC1BM3pfaEkwU1FVZklMSUhxRW9lVTNkSnA5SlU5c24wNDh0b3pYS1V6T2Z6N1RtZVdwYmpLOVRUVXBvTkxoVQ?oc=5,1778099629,The 'no makeup makeup' trend is bigger than ever for summer 2026: What to know - Good Morning America,The 'no makeup makeup' trend is bigger than ever for summer 2026: What to know - Good Morning America,beauty trend
gnews,news.google.com,https://news.google.com/rss/articles/CBMi5wFBVV95cUxNYUtqMWZsa0N2OWE0OTBReXdoN3RFNHU3Y094ZDYzcDZ1Z0JHeHdPT3ZpeElFRjFRc1ozWlU4NDJvSXptTW9USWhvcVNqY090V2w0M0w1LTFvamdqLUtYZnlvbkFvVXZBTllTRmlacjdKcVdnNVVKdVdSZmhWV3hKUGNORXVfcW9PVTR6WnBnaGF3RzlIQVNtUkdZcW9vUmhwNm4wb1V2Rmt5VGs4c0NvMWlqV041bmdQbFd2aFFta3ZTeEVtSmNNN252enVnaWFjeHE5OU5Zcnl3eVlHUzlHcmNIZFk4UFU?oc=5,1778742232,India's Ayurvedic Beauty Boom: Global Giants Buy Brands Amid M&A Rush - Whalesbook,India's Ayurvedic Beauty Boom: Global Giants Buy Brands Amid M&A Rush - Whalesbook,beauty trend
gnews,news.google.com,https://news.google.com/rss/articles/CBMijwFBVV95cUxNc3N4cm9LLTU4N3Y5bnNPVi10bjFuU1JXTXZJaTd1dzB0VlJMVTdacXVYME9kZ1NHS3lvSG5ScDhkTjdqVTB6em1Vb3dWN3hWcWtTSWZRbnZ2aTl0SEpMNXhvX283UUN5VDdtc0J0U0Zjb0xOY2FpTjFBNElCeG8wb1hWbGtjS0FaT1JiQVdHaw?oc=5,1777618800,The Beauty Trends Predicted to Make It Big at the 2026 Met Gala - WWD,The Beauty Trends Predicted to Make It Big at the 2026 Met Gala - WWD,beauty trend
gnews,news.google.com,https://news.google.com/rss/articles/CBMiU0FVX3lxTFB0d09mWHFneUlzM3VYOUlKTml1cDhLUnFpbHhGQnRXRTh0QXhxd0Z3aC1rb193MldSMnNvd3RmRXYxdTFfQzFtOUpkeVJrbzJWNWFz?oc=5,1778736641,"The recently released movie 'The Devil Wears Prada'Emily, who appeared as a luxury brand executive i.. - 매일경제","The recently released movie 'The Devil Wears Prada'Emily, who appeared as a luxury brand executive i.. - 매일경제",beauty trend
gnews,news.google.com,https://news.google.com/rss/articles/CBMinAFBVV95cUxQNjhSSDNsaDRrLTVGd1M1VTl5Qkg2c2hvZGtNcER1a3A3a0VybnFDZU5VNS1BWTNicTdrRGZjZ1dpN2l0NjFWS3ZyZGp5eXhKVlc3YkcyRXNzNjY1aVB0d3FBdmNEbUd2ZUhYYTNudEMweFBacmtjZUk4QzNad1Jqd0VOcDA3QWg4MDdkSWFqOVk0SDExLV9uZkdPOWHSAaIBQVVfeXFMTXpkc3ZEMnpXVUh0TEl2Tktwd3ZjbVp0V296bDJqcWwtcEc5b2lHN1MwaGlKd2REbmV0WFQzejdhcExOcGFybno2YmhrWGdnTF9lN1BvTE03MnZNWU93OHZfb05oQ1Y5T2NOckRoZHlQWGp0bF9ZcWlOR2M0Wk9oVi1tdFNNaFRub1d3UjU2alVzc0QxQkJubl9McjZKZ0hzNEdn?oc=5,1778664159,Wearable Maximalism Is Turning Bold Makeup Into Everyday Beauty in 2026 - iDiva,Wearable Maximalism Is Turning Bold Makeup Into Everyday Beauty in 2026 - iDiva,beauty trend
gnews,news.google.com,https://news.google.com/rss/articles/CBMifEFVX3lxTE1Gc3FhRU1oVU1ndC1nLUszcWFFazRVSlItVDVWeUk1VlJkUXdBM2NTajlLTWdwYm1YZUU2OXJiNlcwOFNKREw3RlFtLWRKMWU0QW5WTUVDenhjU19ha2x5WGJaNEl0NUluZWpGeWFHT2puMW1fYjREM2d2VUo?oc=5,1778364000,Anne Hathaway's Full Beauty Evolution In Photos - glam.com,Anne Hathaway's Full Beauty Evolution In Photos - glam.com,beauty trend
gnews,news.google.com,https://news.google.com/rss/articles/CBMikwFBVV95cUxNNlB5TlN1OXV3ZWxaOENaNjhXVFBYV1NTQkE3ai0tdUc1SlR5RU4wWlpCSDVoZTBXSF90QlZyUTAzeDgwR1dIWGFBc3dhOVB2VGNPeUN4RzQzbjVqR0ZZVjZQQ2h4NU9CXzJ2aTlwNFpQVmp0NTh0eXFUUUlPajQ3YU5wd2JUZERWa1Z3SklwelZ1OWc?oc=5,1776668400,How to Recreate the Watercolor Makeup Trend Hailey Bieber and Sabrina Carpenter Are Loving for Spring - ELLE,How to Recreate the Watercolor Makeup Trend Hailey Bieber and Sabrina Carpenter Are Loving for Spring - ELLE,beauty trend
gnews,news.google.com,https://news.google.com/rss/articles/CBMibEFVX3lxTFBxMkpseU5ZTnduYkxPY3VNWURiWHdNeENRNVNjTUZEZ3psU3F0VTFhVEJvemhMdnlZLWd2alZrbUJsME9yRlBmc3F2OVc0UWJCT245UlA0SzFDMmFvc2xFa19YejA4ZHVuR1dyRQ?oc=5,1775113200,"Amal Clooney Tests Out Spring’s Hottest Beauty Trend, the Blurred Lip - Vogue","Amal Clooney Tests Out Spring’s Hottest Beauty Trend, the Blurred Lip - Vogue",beauty trend
gnews,news.google.com,https://news.google.com/rss/articles/CBMidEFVX3lxTE1jUWhEeGZXb2Y3MHMwbXNhMEppcHg3eHVTNXBHRjBoNVU0WXY4LTAwRlJBRDMxVHBHZGZ6VERtbFFVWjVPTEY4SVVBY1VhZXJEOERQTVBoXzZnNGNjM1pIcFJBYlF5U3VJVHZvUjBqNks2Z2s5?oc=5,1775718000,We Asked Southern Grandmas What Old-School Makeup Trend Should Come Back - Southern Living,We Asked Southern Grandmas What Old-School Makeup Trend Should Come Back - Southern Living,beauty trend
gnews,news.google.com,https://news.google.com/rss/articles/CBMiigFBVV95cUxNNGtmUmZKaC0wRDVWRXlxR3Z0QXNNWXhUV3lMVXRVVDNCYk45ZUpDOU0wTWhfeGFXcVpmcmp1bVpoVUFIZHBKWFBLZng4eDJISm9uN3BQTTFPaXdWV21CUjlJbURHQTh4cU1uQ3RlR1VSdHZZLVNsUnZjZVptblVlMFREVlozeDlSVHfSAYoBQVVfeXFMT3YxS0pERVhCVlBKRVhRMUs2YW54OVlnZVlNNEVzLWtRa2owWExPU3d3M0VQR3RLWnpfQjIwN25fczFVT1NyZDN0d0xBb3c3RFRjaHc3ZEdCbWxZS1JSUEV4RHNzY0ZXRnFXODVGc2duUFZKSkVXNnZfOElTMlpkU1JIWFg4MlVIOGVR?oc=5,1775286000,How South Korea's K-beauty trend boosts soft power - dw.com,How South Korea's K-beauty trend boosts soft power - dw.com,beauty trend
gnews,news.google.com,https://news.google.com/rss/articles/CBMibkFVX3lxTE5LdjFyZVZyVmZNeEotMDZOTlNRaW1KNHNDaDdPLVFnWlozVTI3MUYzS2xMRG55NDRIUm9pbFNkT2duOTlQUkJZbkhBQ0lQT1IzWlE1ckswYWhDdWZBSzdGYk9tRklNa0N0N0hVZFZB?oc=5,1777446000,“Wet” Lashes Are The Romantic Autumn Makeup Trend We Can’t Wait To Try - Refinery29,“Wet” Lashes Are The Romantic Autumn Makeup Trend We Can’t Wait To Try - Refinery29,beauty trend
gnews,news.google.com,https://news.google.com/rss/articles/CBMiogFBVV95cUxPUWJBbWZqQWlINm5rbEJ0c2FORVI5bmhfbEp3QkJoSVZfQzZ6TE5JMl9OM2dBTlNNTHJSWUhUMEFMYXBjYkhNMHRJc2VtcmlzSzBHNER2UW1KLVVxeGlaR3Q3YWIzaU5KUlpTb3hVdGJ2ZFV2R3JGRW1tUjk2cXdrci1fYmh5ZzFHNTNjc3pRVWZialFBNkR4Q3BjVVNQSVZaSlE?oc=5,1778572200,CBE 2026: Korean beauty trend captivates Chinese actress - 디지털투데이,CBE 2026: Korean beauty trend captivates Chinese actress - 디지털투데이,beauty trend
gnews,news.google.com,https://news.google.com/rss/articles/CBMidEFVX3lxTE5iVWZhTmZVclk5VWJlOURZMUhsVDN1MEpDVGJOTTBWM1RFZGc3LWR2M2NLdlJ2b01PcG5Wb3BwR2pMeUZiZkVJV3Z3ZjJFUGctVFlGaHA5ZGNwaDYyTEpxa0ltWHlGQWFMUWxRN0NkdlF0aFFB?oc=5,1776063600,Matcha Make-up: the new natural and sophisticated beauty trend - nss G-Club,Matcha Make-up: the new natural and sophisticated beauty trend - nss G-Club,beauty trend
gnews,news.google.com,https://news.google.com/rss/articles/CBMibkFVX3lxTE1YQS1wdWsyemZVbU4taFMya1JiaDZLVjFPQ0FOcXBNempoY0VrbmNoZ2JXQVJBQnczdGxJRW9VY183Zm5lYVpTcWRYcG1yaXFrUmVwT05nZmtBb0g1S2VWX3ZDZGIzVFdTWWJtQ1ln?oc=5,1775545200,“Wet” Lashes Are The Romantic Spring Makeup Trend We Can’t Wait To Try - Refinery29,“Wet” Lashes Are The Romantic Spring Makeup Trend We Can’t Wait To Try - Refinery29,beauty trend
gnews,news.google.com,https://news.google.com/rss/articles/CBMicEFVX3lxTE96eFRtR1g5NG15VmJxdk9GX3B1V1FJdWRDdkJPb1pHMWk3d2pwMV81WFBURlJxaHRadVZTWUFKR1VSc21KX1lyVTUxa2NSa05nRmxUU1FRb1hFVWNvc2hDZ25YYUQ0Y09jMzNhLTZuWGk?oc=5,1778232600,The Vogue Business Beauty Trend Tracker - Vogue,The Vogue Business Beauty Trend Tracker - Vogue,skincare trend
gnews,news.google.com,https://news.google.com/rss/articles/CBMifEFVX3lxTE9RaHZWZVYySkhLMXpoVlR6aXI3SG94UmYxUkgzZmxZbXliX2NCczZnSzFHYWZvUlFwTlFmN29raVZwcUNnVDczVHF2aHJRSTI4dWhJRWFBNDA0N1ZvWWVWeDZma19tRlc2MkdMZ2tqaV80RHQwemUwQ1p0SXA?oc=5,1778669221,TikTok says drinking your skincare is the hottest beauty trend to know now - so we tried it - Grazia Daily UK,TikTok says drinking your skincare is the hottest beauty trend to know now - so we tried it - Grazia Daily UK,skincare trend
gnews,news.google.com,https://news.google.com/rss/articles/CBMinwFBVV95cUxQYXNuV3ZKTHdRWVRoVHFZUTJIN0VFV3gxTWZmLUdidnhzQTFsUjVVSmR2cnFWQ0wtVl8tRlh0UkRhU25yazI1OFdtRy0zeGsyMzY5MFVOSFhHNklYWFV6RHpRNlZPNUFnSXhJLVM5cFhZRFljd3RvUS1xVWpicFVNeDZsUEpBUzhYeS1RRkxlYVlLanBIOFRmN3lvS3BtdVU?oc=5,1777935522,Skin flooding: what it is and how the 2026 skincare trend works - nss G-Club,Skin flooding: what it is and how the 2026 skincare trend works - nss G-Club,skincare trend
gnews,news.google.com,https://news.google.com/rss/articles/CBMigAFBVV95cUxOUS1HbmlULXhMczF2WGMzZzlESUZWeDZ1ZWRnNGtoQ2lLaloxR3FubExGT1ByVkdwdy1DSnlEeG13SklzQlJQWWp6WTBpdFNRTGIyemJ2ZzA2YkxyRTdvQmFhQU5mMzcxYldDeXBDZ2hlWXNYZjRacjlfQ2JBeWpURA?oc=5,1775113200,TikTok Loves These Skin Care Trends — Should You? - UC San Diego Today,TikTok Loves These Skin Care Trends — Should You? - UC San Diego Today,skincare trend
gnews,news.google.com,https://news.google.com/rss/articles/CBMivgFBVV95cUxNRU1XV0RSMy1kV0s1T0tiS3IxeWhQb1lvcjhyNkZyR0Iwa2d6RnVncHN1MFpzbFJZbVllc3ZpRWVkNThGRGdhVDREcGZERDBhSWdqOEozRHFYMUh1V0FtSXp2SktZNFhpR2tIbm14OWZpUTRxRmRJaGhVUFBMRHJ4cDA3NVZYUWc0VnNfVmpKaUhZdmFXakhFSkdvemV5NndCT2dsd3ZYaHE2UE1QRXJwSzNvSFppeWI3TmhTQVd30gHDAUFVX3lxTE8zb1pUczNaVklmWDducXIxWXd4SHM2eGZFTXRLNnlXd3BYclJIWExOVEJLNUp4d1pVNm9wTG81X3N2Sm5vMjVTSHE5eEc1QzNuWHN0ZUJwY01RR3M5OG1zT2Nva2l1bjduUTBWWXhBblZxQ0k2WUp0T0xDbjZjT0NoaVhfakZVNG56MmZpYXB6cEdDbFY5dDNZODNyczRLMVg0R1F5V3pNbnZ3ai1ycngxOTg0a1ZhNmczQm1ObFc5TTFRNA?oc=5,1778478993,Mira Kapoor says she’s on a ‘skin fast’: What dermatologist wants you to know - India TV News,Mira Kapoor says she’s on a ‘skin fast’: What dermatologist wants you to know - India TV News,skincare trend
gnews,news.google.com,https://news.google.com/rss/articles/CBMiowFBVV95cUxPS2xFaXBLT2pNemlidnpiSk5ScDl0SjFkSmtISE44OXJVZ2NQYUpBa3dhUnQtREpJNnN5M1dndlRuazRabHRuSGJFbWd4NWZ4bGE1X2dlbDdyRmpSQ0JyWjkwdVNkN1A3Q2pwU2dtOVJDU2JMQXNtZDB1OEJhUmlCQ19pSzkwRTJEQ3c1bWlsUFB4R2dTNnhZeVlDVmx5eXBwOEFZ?oc=5,1776322800,'Korean skincare trend' going viral on social media - KUSA.com,'Korean skincare trend' going viral on social media - KUSA.com,skincare trend
gnews,news.google.com,https://news.google.com/rss/articles/CBMibkFVX3lxTE9ldWVMLUNOZnMydTBVelZISllvblRBVVp3ZEdadWozS3o5MC1jZWtkTzZIZFJ3VUVjTFlvSTNyWXZ2SHdPMDVlV2VSMXVCSTVmRUpuWXhFSFJLcUFud3pCeXFXakJ3aXBndGZraU9B?oc=5,1775718000,"Peptides Are Everywhere In Skincare, Here’s How To Use Them Correctly - Refinery29","Peptides Are Everywhere In Skincare, Here’s How To Use Them Correctly - Refinery29",skincare trend
gnews,news.google.com,https://news.google.com/rss/articles/CBMizAFBVV95cUxPckpRLTFIYTNWQzhFSVRqSFpEano0N1FteTV1LXJXVENsZ3BvUVE3am9uNzBiRHFSRzFlN0dIVWZBWmpUNDBBLXJTZjd5Z01LaTQxb0RJWjJzVEZZQkZjUS1rTGt0ZFpQS19CYWg0RUhfVXZGRzMwZXU3TTRyWW5GSFBqa3ZsTUwyV0cxdWk0RkxlR0p3ZXQwTzFYcUI0Z19nSWNGQkJWU0VYN1hlaTBXS0kwa2FIbDVYRHdnNVQtTDVpYVc3NTRFWjFIRmc?oc=5,1775113200,Longevity Ingredients in Beauty: Separating Trends from Drivers of Skin Care and Hair Care Growth - Euromonitor,Longevity Ingredients in Beauty: Separating Trends from Drivers of Skin Care and Hair Care Growth - Euromonitor,skincare trend
gnews,news.google.com,https://news.google.com/rss/articles/CBMifEFVX3lxTFBBajdhN1A2RV9SRHpTajlsTWJPbDM2VXZTaXFWLW0zM3dXdExkSldEZzU3eFFFbjE4Z2t5UmdsWU1iVms0OFRTTUIta01TcTk1ckQ4U3pocXBZOGx0WEU3bV9vMDRWWnlDT1dfYkliSDh2bnRRTmRMVjJ3Tl8?oc=5,1777100400,“Eating Your Skincare” Is Taking Over TikTok—Here’s What It Actually Does for Your Skin - Marie Claire UK,“Eating Your Skincare” Is Taking Over TikTok—Here’s What It Actually Does for Your Skin - Marie Claire UK,skincare trend
gnews,news.google.com,https://news.google.com/rss/articles/CBMi8AFBVV95cUxQN2FkRHNPWEZrelZKZkIzNlY0Z29ReVIzYTMzQV85MTZJd0VCTHJ5RjFGbEhNNEJ2NmVMS0lhMkctMDU1LW05TGgzSHlsNWxVY013SDk0RWo4UTQwU1pGci1JdTlVaHR5N2c0X0M3MHo3bXAyb05IWkFWXzAtRUhBRHVObE53dk9idkFlZmtPNmx5aW15TE5zaUN3eEo1cnNRQ085NklkZjNKbnVVYUM3VGhrVkZVa0YxeElZR1FlM2dfNzIwTzR0andUV1NQVHk4azh3TVhVX3hKRG5SMDZxRnA5bXRoMzU0U0dPWjY0MXnSAfYBQVVfeXFMT3dQa3FwcDRfc0E4YTVkQVBmdlJKdUNOUzJnVUJSbUpBTnM4SHpabXUwOEUzdC1iT0xrZ2YxV19jMTlaOGtoUURqVlR0RW16bHF1M1hlekJCTWNZOU9PVUE0SlNvQXNjS0VvVmJBZXRjSXRoTkd0anRpOVlsdWRueXltNm9zU1lEdnBvemMtMFotZHBpQWRKZ252bTJVZnROYnUzdmFyYjdPYXpRR0pQZDVMZmdlWGwySUVPZ2xEc2IwUV9jakk1MWd3VlRVbGY1Vk9JVndJT1NNdF9YWEdxbFFJLVFhQ0JYS3JfcS1raDZhaUJmUW1R?oc=5,1775890800,What is skin flooding? The viral skincare trend dominating your timeline in 2026 - The Times of India,What is skin flooding? The viral skincare trend dominating your timeline in 2026 - The Times of India,skincare trend
gnews,news.google.com,https://news.google.com/rss/articles/CBMif0FVX3lxTFAzeUxhUGhnVElRcE56bDFtYjF0S3I4ODJ0dmFXVEl4Vnd3cEZRY0ptbGtFMUJaeUFab05oWXpWYjJoNl9QN2tjS1Fxc0NmWFZvbFZLOG0yTTF4eWtfV2FkaVhBLVFfaFhxUEdqc0pVWmN3blRQeWVIZWFHWUZpWGc?oc=5,1776256523,This Viral Skincare Trend Can Be Seen At Gyms Across the Country. It May be Doing More Harm Than Good. - AOL.com,This Viral Skincare Trend Can Be Seen At Gyms Across the Country. It May be Doing More Harm Than Good. - AOL.com,skincare trend
gnews,news.google.com,https://news.google.com/rss/articles/CBMifkFVX3lxTE92Y183NHBiN0tLZ25xVEVJdEFRcnBKYlgtMEpVQWhEMXBTSURXYVl3YVBCb28tR2hLakF3SVR4WW5LM3hYeGRLVTRJbkI2ZjBlWXB5NE9mM0VxNjJuT1FBeWdDY2dpWWdqNjc3NUV0MGY0Nl9YMmhvVjJNdzA2UQ?oc=5,1775458800,What are spicules in skincare? The K-beauty trend explained - Stylist,What are spicules in skincare? The K-beauty trend explained - Stylist,skincare trend
