source,domain,url,created_utc,title,text,query
rss,www.refinery29.com,https://www.refinery29.com/en-us/super-new-moon-in-taurus-horoscope-may-2026-meaning-effects?utm_source=feed&utm_medium=rss,1778756452,The Super New Moon In Taurus Is Here — & You’ll Make Decisions Now That’ll Enhance Your Life,"The Super New Moon In Taurus Is Here — & You’ll Make Decisions Now That’ll Enhance Your Life

<div><figure><img src=""https://www.refinery29.com/images/11980317.jpg?width=1024&amp;height=683&amp;fit=bounds&amp;crop=1024%3A683"" /><figcaption>Highly detailed “Supermoon” Pink Moon image with a star field background</figcaption></figure></div>



<p>R29 babes, mark your calendars, because the <a href=""https://www.refinery29.com/en-us/may-monthly-horoscope-2026-meanings-effects"">Super New Moon in Taurus</a> arrives on May 16th. As some of you will know, typically, the New Moon in Taurus brings grounding and peaceful sentiments. However, this time around, it’s going to be a little more chaotic, and tumultuous energies will surface, leading us to make decisions that will enhance our lives. The <a href=""https://www.refinery29.com/en-us/full-flower-moon-in-scorpio-may-2026-horoscope-meaning-effects"">cosmically charged Supermoon</a> (which occurs when the moon is in “perigee,” which means its orbit is in close proximity to earth) amplifies what we wish to create in the weeks ahead. That’s right, the monthly lunar cycle is beginning with a rockin’ core and soulful noise, so feel your feels. </p>



<p>Communicative <a href=""https://www.refinery29.com/en-us/taurus-season-horoscope-2026-meaning-effects"">Mercury in Taurus</a> and expansive Jupiter in Cancer aspect the lunation, suggesting we explore our sentiments. Unfortunately, it’ll be complex, since Mercury in Taurus can make us stubborn and fight for our beliefs — even if they aren’t right. Be watchful of people arguing for the sake of arguing, to stir the pot for a reaction. On the flip side, confronting issues to foster understanding could lead to improvements down the road. Of course, Jupiter is heightening the vibe. Being open and direct about what is plaguing us is the best strategy. </p>



<p>Algol, the “demon star” that represents Medusa’s head full of serpents, brings intense, overwhelming emotions to the forefront of our hearts when it aligns exactly with the New Moon. Understanding patterns is imperative when Algol is in conjunction with the New Moon because we have to confront situations and take back our power to heal and refresh the energy. Unpredictable developments may cause conflict if we do not opt to embrace our shadow selves. Owning the parts of our psyche we hesitate to share (not only with others but also with ourselves) is pivotal and lights the path to metamorphosis. </p>



<p>The good news is that we will not have to go on this journey alone. Support and guidance, from the least expected sources, are on the way! The asteroid Ceres in Taurus, in proximity to the New Moon, offers us a chance to connect with others who share similar experiences. Ceres indicates how we “re-parent” our inner child, bringing our innate nurturing skills to focus. Nurturing might come from those we didn’t know cared — until now. Frenemies might take our side and defend us. Forgiving ourselves is the first step in unconditionally loving ourselves. Having a shoulder to cry on or a friend to listen to our woes is helpful, as they can offer advice and support as we work to mend ourselves. </p>



<p>Echoing this sentiment is the union of the action planet Mars and the comet Chiron, which form a conjunction in Aries on the day of the New Moon. When these two celestial bodies come together, we can turn our shame into confidence. Chiron, which is the internal wound that we must work through in this lifetime, is given a push from Mars to conjure up methods to let go of anger and frustration. Relinquishing these emotions is a soulful and spiritual release that takes time. The catharsis we begin to feel as we take the first steps to rehabilitating the hurt we’ve endured is remarkable. Set the plan in motion and don’t look back under the New Moon. </p>



<p>The caveat is that the upcoming planetary switch of Mercury into Gemini on May 17th, Mars into Taurus, and Venus into Cancer on May 18th will urge us to fast forward without reflecting or contemplating the necessary changes. Slowing down and meditating on the choices we are striving toward. There is beauty in times of growth. Sacrificing comfort to enter a new state and shifting mindsets can sting. As long as we put in the effort and accept the assistance of others, we’ll be turning a corner soon. You got this!</p>
<p><strong>Like what you see? How about some more R29 goodness, right here?</strong></p><p><a href=""https://www.refinery29.com/en-us/may-monthly-horoscope-2026-meanings-effects?utm_source=rss&amp;utm_medium=rss_linkback1"">Your May 2026 Horoscope Is Here</a></p><p><a href=""https://www.refinery29.com/en-us/taurus-season-horoscope-2026-meaning-effects?utm_source=rss&amp;utm_medium=rss_linkback2"">Taurus Season Is Here</a></p><p><a href=""https://www.refinery29.com/en-us/weekly-horoscopes-may-3-to-may-9-meaning-effects?utm_source=rss&amp;utm_medium=rss_linkback3"">Your Horoscope This Week: May 3 To 9</a></p>",
rss,www.refinery29.com,https://www.refinery29.com/en-us/2026/05/11981530/off-campus-season-1-review-cast-interview?utm_source=feed&utm_medium=rss,1778705910,Can A Steamy Hockey Romance Handle Sexual Assault Responsibly? Off Campus Proves It Can,"Can A Steamy Hockey Romance Handle Sexual Assault Responsibly? Off Campus Proves It Can

<div><figure><img src=""https://www.refinery29.com/images/11981546.jpg?width=853&amp;height=1024&amp;fit=bounds&amp;crop=853%3A1024"" /></figure></div>



<p><strong>Content warning: This article contains mentions of <a href=""https://www.refinery29.com/en-us/2022/01/10666176/title-ix-9-college-campus-sexual-assault-cases"">sexual assault</a> and <a href=""https://www.refinery29.com/en-us/domestic-violence-survivor-story-safe-horizon-resources"">domestic violence</a>.  Spoilers ahead for Season 1 of <em><a href=""https://www.refinery29.com/en-us/off-campus-release-date-plot-trailer"">Off Campus</a></em></strong>. </p>



<p>The moment <a href=""https://www.refinery29.com/en-us/off-campus-release-date-plot-trailer""><em>Off Campus</em> </a>fans <em>really</em> get to know Garrett Graham (<a href=""https://www.instagram.com/belmontcameli/"">Belmont Cameli</a>) and Hannah Wells (<a href=""https://www.instagram.com/ellabright__/?hl=en"">Ella Bright</a>) is an intimate one. Extremely intimate. The <a href=""https://www.refinery29.com/en-us/should-you-date-friend"">friends</a>, who have up until this moment <a href=""https://www.refinery29.com/en-us/friends-to-lovers-stories"">shared a limited number of chaste kisses</a>, are sitting across from each other in Garrett’s bedroom. They’re both completely naked, making full eye-contact — and <a href=""https://www.refinery29.com/en-gb/how-to-start-masturbating"">touching themselves </a>while the other watches. They don’t touch <em>each other,</em> but as the camera pans back and forth to their respective faces, they <a href=""https://www.refinery29.com/en-us/masturbation-manifestation-how-to"">masturbate</a> until Hannah, clearly elated, <a href=""https://www.refinery29.com/en-us/orgasm-workshop-self-pleasure"">orgasms</a>. </p>



<p>It’s a super steamy scene that holds significant meaning beyond the panting and hot n’ bothered moaning on-screen; because Hannah, in the wake of a sexual assault in highschool, has until this very moment been <a href=""https://www.refinery29.com/en-us/sex-after-sexual-assault"">unable to have an orgasm or be intimate</a> in a way that made her feel safe — not even with herself. Mission accomplished, the pair fist bump and head down to Garrett’s kitchen to eat leftover pasta. </p>



<p>Adapted from author<a href=""https://www.ellekennedy.com/offcampus""> Elle Kennedy</a>’s <a href=""https://www.ellekennedy.com/offcampus"">book series of the same name</a>, the first season of Prime Video’s <em>Off Campus </em>is many things: it’s steamy, kind of cheesy, has kick-your-feet-and-squeal-with-glee moments of romance, and maybe surprisingly, deals with some pretty heavy subject matter. </p>



<p>Season 1 of the series follows university athlete Garrett Graham, the star of the fictional Briar University hockey team, and music student Hannah Wells as they embark on a <a href=""https://www.refinery29.com/en-us/romantic-comedies-love-life-checklist-essay"">rom-com trope </a>as old — but still as satisfying — as time: The fake dating scenario. In need of academic help to play for the season and be drafted for the NHL, Garrett enlists Hannah to tutor him. In exchange he pretends to be her boyfriend as a ploy to catch the eye of her real crush. Spoiler alert: <a href=""https://www.refinery29.com/en-us/friends-to-lovers-stories"">Garrett and Hannah inevitably fall in love</a>. But while this result may be typical for the genre, <em>Off Campus</em> does something seemingly atypical — or at latest potentially different from what many people are expecting to be a light, fiery smut-filled watch — delving into Hannah’s experience with <a href=""https://www.refinery29.com/en-au/overcoming-survivor-guilt-shame-trauma"">sexual assault</a> and Garrett’s experience with domestic violence at the hands of his famous hockey player father. </p>



<figure><img src=""https://i0.wp.com/www.refinery29.com/images/11981557.png?ssl=1"" /></figure>



<p>For series creator and showrunner<a href=""https://www.instagram.com/louweezy7/?hl=en""> Louisa Levy</a>, tackling Hannah and Garrett’s experiences with sexual assault and domestic violence, respectively, wasn’t taken lightly; with Levy noting it was important for the team behind the series to be responsible with how they were portraying these storylines.  In addition to speaking with experts in both fields, Levy says, they asked experts a somewhat surprising question. “We asked both of them: What do you normally see done wrong or what bothers you about how things are portrayed?,” Levy says, “because we wanted to steer clear of expected pitfalls.” These <a href=""https://thewalrus.ca/almost-every-tv-show-gets-sexual-assault-wrong/"">pitfalls include</a> showing violence in gratuitous detail, failing to centre the survivor, and bypassing their recovery. </p>



<p>Which is why another key decision Levy and the creative team made was to not show any of Hannah and Garrett’s actual trauma on-screen. In a time when often overly gratuitous scenes are pretty much the norm, it was an intentional and impactful decision to not show instances of domestic violence or potentially triggering flashbacks to Hannah’s assault. Instead, these traumas are implied — their meaning still hard to miss — but told through the impact the trauma has had on them both. For Hannah, this means an inability to write songs, something she previously loved, as well as fear around being physically intimate with a partner — the impact of her trauma illustrated in her inability to share these two intimate parts of herself with anyone. For Garrett, growing up in fear of his father, and unable to help his now-deceased mother, has manifested in a fear of turning out just like his dad and hurting those around him. It’s these very real consequences that are the focus of the show. </p>



<figure><blockquote class=""has-text-color has-black-color""><p> I think being able to tell a story of someone who has dealt with sexual assault and can still have a romance and a healthy sex life is so important.</p><cite>‘off campus’ showrunner Louisa Levy</cite></blockquote></figure>



<p>“The story is actually not about the trauma, in the book or in the show,” Levy says, “it’s about the <a href=""https://www.refinery29.com/en-ca/warmth-trauma-survivors"">survival after the trauma</a>. We never actually show either trauma for either of them…we talk about it, but we never show it because we don’t want give power to those moments. We want to show the characters grappling with the after effects.”</p>



<p>Which is what’s happening when viewers meet Hannah and Garrett in that *ahem* climactic scene in his bedroom. While it’s an undoubtedly racy moment, it’s also made infinitely more sexy because it’s a layered and empowering one, for Hannah specifically, as she works towards feeling safe and present in her body in order to enjoy sex. The hottest part? The fact that she — <a href=""https://www.refinery29.com/en-au/best-books-about-female-pleasure"">her pleasure</a>, <a href=""https://www.refinery29.com/en-ca/2019/05/233694/female-pleasure-revolution-sexual-movement"">her desire</a> and, most importantly, <a href=""https://www.refinery29.com/en-us/get-consent-education"">her consent</a>  — is front and centre. </p>



<p>“That scene is so significant in their story,” <a href=""https://www.instagram.com/belmontcameli/"">Belmont Cameli</a>, who plays Garrett, says. “It’s nice because the two characters show up to that scene and the audience has an expectation of what’s going to happen; and there’s a level of caring that Garrett especially has in this circumstance that I think is really admirable and honest. And so the scene ends up completely different than you expected.” </p>



<p>Belmont and co-star Ella Bright had lengthy conversations about the scene — as they did around all their intimate scenes — but especially this one. “It’s really pivotal to their story, around all different types of intimacy that take place in that scene, because there’s sexual intimacy, there’s emotional intimacy, there’s vulnerability just across the board,” Cameli adds.</p>



<p>“For weeks leading up we were always talking about that scene.”</p>



<p>For Bright, that scene, specifically the dancing and the build up around the inevitable moment the friends kiss and become intimate, was one of her favourite moments on set. “What was so special about the intimate scenes of the show is that it is so character-driven and story-driven,” Bright says. “That it is really a turning point for their storyline and it couldn’t have been done in any other way; the sex is such an important factor of the story for these two characters.”  </p>



<p>The idea of <a href=""https://www.thecut.com/2016/12/showrunners-are-fighting-back-against-rape-as-a-plot-point.html"">sexual assault as a plot driver </a>isn’t anything new in media. There have <a href=""https://variety.com/2016/tv/features/rape-tv-television-sweet-vicious-jessica-jones-game-of-thrones-1201934910/"">long been criticisms</a> about the often exploitative ways that various series have introduced sexual assault — most often against the female leads — as a trial they must overcome. It’s the catalyst for personal growth, or worse, a plot device meant to motivate another character’s arc. We saw it in 2015 with <a href=""https://www.vox.com/culture/2019/5/10/18536009/game-of-thrones-season-8-episode-4-recap-sansa-the-hound-last-of-the-starks""><em>Game of Thrones</em>’ Sansa Stark</a>, in 2014 as an act of war against Mary Queen of Scots in <a href=""https://msmagazine.com/2014/10/24/norapeonreign-when-sexual-violence-is-a-plot-device/""><em>Reign</em></a>, and as the only plot point in procedural series like <em>Law &amp; Order: Special Victims Unit.</em> When the first season of <em>Off Campus </em>was first announced, some social media users critiqued the decision to spotlight a rom-com that stems from sexual assault. </p>



<figure><blockquote class=""has-text-color has-black-color""><p>It’s really pivotal to their story, around all different types of intimacy that take place in that scene.. there’s sexual intimacy, there’s emotional intimacy, there’s vulnerability just across the board</p><cite>Belmont Cameli on <em>that</em> ‘off campus’ scene</cite></blockquote></figure>



<p>Criticisms of these narratives have often centred on lazy storytelling that doesn’t extend beyond the actual violence. With this in mind, it’s tough not to wonder if a show like <em>Off Campus</em> should be tackling sexual assault at all. In essence, can the young adult romance genre handle it?</p>



<p>For Levy, the answer is simple: <strong>“</strong>It’s one of the reasons why I got so excited about adapting these books to begin with,” she says. “We have the ability, because it is such a joyful, positive, optimistic show, to couch that with these [deeper], more emotional layers.” </p>



<p>Which is something we’ve seen before with teen and young adult series, which have a history of <a href=""https://www.refinery29.com/en-us/2022/08/11086116/teen-tv-shows-character-deaths"">adeptly handling emotional topics like death</a>. It’s the very fact that Hannah and Garrett — by virtue of the genre and their age — are themselves so positive and optimistic that the show is even able to delve into topics like sexual assault and domestic violence, Levy notes, allowing the series to “go there” without feeling too heavy. </p>



<p>“In romances, there’s these expectations that characters are perfect or unbroken,” Levy says, “and I think being able to tell a story of someone who has dealt with sexual assault and can still have a romance and a <a href=""https://www.refinery29.com/en-us/celibacy-abstinence-effects-on-sex-life"">healthy sex life </a>is so important.”</p>



<p>Of course, that doesn’t mean that <em>Off Campus</em> always gets it right — or whatever “right” is when it comes to a complex and nuanced topic like sexual assault. When Garrett confronts and beats up Hannah’s alleged assailant on the ice (a departure from the book where he confronts a friend of the assailant), it feels like we’re veering into kind of icky territory. In this instance, Hannah is completely removed from her own experience, as her very personal assault is essentially whittled down to a show of brute strength — and even more violence — between two men. </p>



<figure><img src=""https://www.refinery29.com/images/11981572.png?width=1024&amp;height=683&amp;fit=bounds&amp;crop=1024%3A683"" /></figure>



<p>But even this potentially slippery slope is later addressed, when Hannah confronts Garrett for getting involved. As she reinforces time and time again, and once more in that moment, she never asked him to defend her, because she’s worked through her experience in a way she feels comfortable with. As she tells Garrett before the first time they hook-up: “I promise that I have worked so hard through this… I’m not fragile.” While there’s nothing wrong with being fragile, what she’s really saying is that she doesn’t want to be treated differently because of her sexual assault.</p>



<p>Is it perfect? Definitely not. But maybe that’s the point. Because real experiences of healing after violence aren’t perfect, either. </p>



<p>And the hope is, for Bright at least, that people see themselves in this complicated and sometimes messy depiction. ‘I hope people can be seen in some sort of capacity with Hannah’s healing journey,” she says. “Obviously nothing’s ever complete, but it’s definitely a growth and a progress that [Hannah] gets to make throughout the season.” </p>



<p><em>Off Campus is now streaming on Prime Video. </em></p>
<p><strong>Like what you see? How about some more R29 goodness, right here?</strong></p><p><a href=""https://www.refinery29.com/en-us/off-campus-release-date-plot-trailer?utm_source=rss&amp;utm_medium=rss_linkback1"">Everything We Know About Off Campus</a></p><p><a href=""https://www.refinery29.com/en-us/2026/05/11978342/heated-rivalry-season-2-release-date-plot-trailer-cast?utm_source=rss&amp;utm_medium=rss_linkback2"">Everything We Know About Heated Rivalry Season 2</a></p><p><a href=""https://www.refinery29.com/en-us/romance-audiobooks-personal-essay?utm_source=rss&amp;utm_medium=rss_linkback3"">Romance Audiobooks Are Changing My POV On Love</a></p>",
