source,query,url,created_utc,title,text
youtube,beauty trends,https://www.youtube.com/watch?v=0as688lWs4w,1772632050,"Бьюти-тренды 2026, в новом выпуске обсуждаем тренды в макияже губ #золотоеяблоко #бьютитренды",
youtube,beauty trends,https://www.youtube.com/watch?v=FIYVQ1SVg_g,1772625676,🪄 Colour challenge 🎨 ✨ #douyin #makeup #fashionbeauty #trend,Choose which one influencer did trend perfectly Colour challenge ✨ #douyin #makeup #fashionbeauty #trend #trends666 ...
youtube,beauty trends,https://www.youtube.com/watch?v=c-HBmkGif68,1772623827,chaines trends #makeup #trending #viral #beauty #shorts #viral,"chaines trends #makeup #trending #viral #beauty #shorts #viral Originally priced around $1.5 million, the CLR a for its ..."
youtube,beauty trends,https://www.youtube.com/watch?v=gqG-qWfUYkY,1772619881,Meet the Makeup Maestro at the Comic Expo! MakeupArtist Cosplay BeautyTrends ComicCon Cosp,Description: Dive into the world of makeup magic at the Comic Expo! Discover the latest trends and secrets from the makeup ...
youtube,beauty trends,https://www.youtube.com/watch?v=6d71OPhtwxk,1772618400,Ranking The Best/Funniest Boyfriend Makeup Mimic moments 💄😂 #shorts #makeup #viral #couplegoals,Watching partners try to nail these viral makeup trends is the laugh we all needed! From the deer/fawn look to the classic baking ...
youtube,beauty trends,https://www.youtube.com/watch?v=Ab1Ot6iXm6g,1772617166,Master the 8-Step Lip Filler Technique LipAugmentation BeautyTrends,"Description: Discover the secret 8-step lip augmentation technique that's taking the beauty world by storm! Get stunning, full lips in ..."
youtube,beauty trends,https://www.youtube.com/watch?v=s0cyJtgKTPE,1772616628,Viral K-Beauty Skincare | Sensitive Skin or Dry Skin,Title: Viral K-Beauty Skincare | Sensitive Skin or Dry Skin Discover the truth behind viral K-Beauty skincare and find out what ...
youtube,beauty trends,https://www.youtube.com/watch?v=qE6HKEUJtgI,1772616289,Тренды в макияже губ 2026💋 Полный выпуск ищи на нашем канале #золотоеяблоко #бьютитренды,
youtube,beauty trends,https://www.youtube.com/watch?v=WkDLscZavII,1772612186,Chinese style makeup &amp; trend #fy #makeupartist #beauty #chinesemakeup,
youtube,beauty trends,https://www.youtube.com/watch?v=Jf-0SIK6Id4,1772604008,Every day clean girl Makeup👄💄#grwm #asthetic trends #viral #shorts #trending,
youtube,beauty trends,https://www.youtube.com/watch?v=2LKFPrSWHCs,1772600575,Beautiful Chinese Girls P.94 #shorts #viral #trend #beauty  #cute #douyin #tiktok,douyin #style #tiktok #beautiful #viralshort #ailookbook #beautyshorts ASIAN BEAUTY - THE ELEGANCE OF ASIA ✨ Do ...
youtube,beauty trends,https://www.youtube.com/watch?v=Os9D2ZsCqCc,1772587901,VIVAIA These ballerina flats are perfect for back to school... #Shorts #nikki18888,VIVAIA These ballerina flats are perfect for back to school... VIVAIA These ballerina flats are perfect for back to school... VIVAIA ...
youtube,beauty trends,https://www.youtube.com/watch?v=lk-KvxEzKUg,1772587234,Trend നോക്കി ചെയ്യണ്ട ഒരു treatment അല്ല ഇത് /@cibdrellabeautyconcepts,Trend കണ്ടു ചെയേണ്ട ഒരു treatment അല്ല ഇത് . എന്റെ reels കാണു ☑️professional consultation ...
youtube,beauty trends,https://www.youtube.com/watch?v=-h5If5kzmU0,1772565479,Why You Should Never Try Trends Without Checking the Product,certifact1 Real stories. Real lessons. Viral moments with meaning. Welcome to Certifact. Viral trends can be fun — but sometimes ...
youtube,beauty trends,https://www.youtube.com/watch?v=fxCzUQqcRb0,1772559435,Bebot trending challenge #trends #viral#challenge#trending#bestmoments#ranking #girls#beauty#shorts,trends #viral #beauty #bestmoments #challenge #minivlog #music #ranking #ranking #trending#trendingshorts #viralvideo ...
youtube,beauty trends,https://www.youtube.com/watch?v=S4No2Id-k44,1772557410,Ranking The Best Glitter Trends Part 1 #tiktoktrends #glitter,"Ranking the best glitter trends on TikTok ✨   From sparkling makeup looks to eye-catching glitter transitions, this Part 1 ranking ..."
youtube,beauty trends,https://www.youtube.com/watch?v=WsgjNFy-NpM,1772554848,"Артикулы:603827885, 560675673, 560601139, 331148601, 334660874 #wildberries #обзор #8марта #подарок",wildberries #обзор #стиль #шопинг #товары #распаковка #хранение #уют #дом #валдберис Мой Телеграмм канал ...
youtube,beauty trends,https://www.youtube.com/watch?v=9N0lehr-Daw,1772553612,Ranking the Best Glitter Trends! ✨ #shorts #makeup #glitter,We are ranking the most viral and satisfying glitter spray trends! Watch these incredible makeup transitions as they go from a ...
youtube,beauty trends,https://www.youtube.com/watch?v=Jngj4CJcEYc,1772542798,#oc,Can red chili really make your lips look fuller in just 10 minutes? Some people are skipping lip fillers and trying this spicy DIY lip ...
youtube,beauty trends,https://www.youtube.com/watch?v=t6hOmzHO6O8,1772542896,2016 vs 2026 Makeup Glow Up: Beauty Trends Then &amp; Now! #makeuptutorial #makeuptransformation #beauty,2016 vs 2026 makeup glow up! See how beauty trends changed over 10 years — from heavy contouring to the clean girl ...
youtube,beauty trends,https://www.youtube.com/watch?v=g6P5EBXEa1A,1772542593,у меня теперь есть своя куколка Blythe🥺 больше бьюти в тг: rosesvetaa🎀 #blythe #тренды #отношения,
youtube,beauty trends,https://www.youtube.com/watch?v=ZOMfe8G8yN8,1772541475,Easy claw clip hairstyle for girls 🍁#trending #hairstyle @LuxyHair @Beauty.Secret1,"A bun isn't just a hairstyle, it's a whole mood.” Excellent way of stylish hair style #short @Beautyviz #trending #fashionstyle ..."
youtube,beauty trends,https://www.youtube.com/watch?v=emsSjnXKDCw,1772541053,Day in the Life: Working at a Beauty Magazine 💄 #shorts | BeBeautiful,"Fact: This is how your email actually finds us. Working @bebeautiful_india means our daily tasks include trying every gloss, ..."
youtube,beauty trends,https://www.youtube.com/watch?v=h6qIqW6WGk8,1772538599,3 Standar Kecantikan di Jepang yang Unik Banget!,Tahukah kamu? Jepang punya beberapa standar kecantikan yang cukup unik dan berbeda dari banyak negara lain. Pertama ...
youtube,beauty trends,https://www.youtube.com/watch?v=eoqGYldYtWY,1772534759,Plumpy Cheeks 👶💖 + Sleepy Eyes 😴 + Siren Eyes🧿 + Sharp Jawline🔥Ultimate Face Glow Up Transformation✨,Plumpy Cheeks + Sleepy Eyes + Siren Eyes + Sharp Jawline Ultimate Face Glow Up Transformation ✨ .
youtube,skincare routine trend,https://www.youtube.com/watch?v=j6fY2cAdmMI,1772625545,Don’t ignore this #skincareproducts #skincaretips #skincare #skincareroutine #trending #trend,skincareproducts #skincaretips #skincare #skincareroutine #skin #trending #trendingshorts #trend.
youtube,skincare routine trend,https://www.youtube.com/watch?v=JioH5UNR2ho,1772618571,Glowing skin Care #cutebaby #cutie #gf #tranding #trend #trending #skincare #skincareroutine #skills,
youtube,skincare routine trend,https://www.youtube.com/watch?v=3hGO1CIY0A8,1772611226,Trying viral purple face mask #skincare #youtubeshorts #shorts #skincareroutine,youtubeshorts #youtube #shorts #trending #trendingshorts #trend #explore #explorepage #fyp ...
youtube,skincare routine trend,https://www.youtube.com/watch?v=-iKv3i1ad_E,1772605122,My holi🧡 #skincare #youtubeshorts #glowup #rishikataak #viral #skincareroutine #holiskincare #trend,
youtube,skincare routine trend,https://www.youtube.com/watch?v=audCGeLo-8o,1772595297,"Skincare in your 30s is about intention, not trends. Simplifying my routine. #shorts","Skincare in your 30s really is different. Less trends, more intention. #ad #platedskinscience #skincareover30 #skincarein30s ..."
youtube,skincare routine trend,https://www.youtube.com/watch?v=YDSWqXTHPWs,1772584087,قلت ل شات gpt يكتب عني for this trend 😌 #skincareroutine #postivevibes #fyp,
youtube,skincare routine trend,https://www.youtube.com/watch?v=3nTpSZRzTVQ,1772558263,Мист-шиммер ищи на WB: #WW289785 (вводи с WW) #trend #skincare #glow #glowskin #makeup,
youtube,skincare routine trend,https://www.youtube.com/watch?v=_pMGKKZSBPc,1772558153,The Most Hated Skincare Routine Makeup Tutorial Trend Online And TikTok #shorts,Facebook: https://www.facebook.com/profile.php?id=61553602120266&mibextid=ZbWKwL Instagram: ...
youtube,skincare routine trend,https://www.youtube.com/watch?v=gZuJ0tZPanc,1772557257,claiming pads is the new trend #skincare #skincareroutine #viral #viralvideo,
youtube,skincare routine trend,https://www.youtube.com/watch?v=-fJbe8r6X_A,1772555674,Simple skincare routine for teenagers. #skincare #teenagers #trend #popular #aesthetic,
youtube,skincare routine trend,https://www.youtube.com/watch?v=CwNFJOzrYxM,1772555410,Morning skincare routine #viral #love #ytshorts #youtubeblogger #dayinmylife #dailyvlog #vlog #trend,
youtube,skincare routine trend,https://www.youtube.com/watch?v=YdpDuuX01fw,1772545976,My silent review #trend #koreanskincare #medicube #viral,
youtube,skincare routine trend,https://www.youtube.com/watch?v=Jg5rT7WW4q8,1772543009,#skincare #youtubeshorts #shorts #trend #trending #viral #tutorial #tiktok #reels #viralvideo #like,
youtube,skincare routine trend,https://www.youtube.com/watch?v=nIzX-YkvDxs,1772541070,Night routine::LIKE+SUB#fypシ#viral#trend#blowup#aesthetic#asme#skincare#makeup#algorithm#dontflop,Brands used ••••••••••••••• @soldejaneiroofficial @everedenbrand @JB_SKRUB @jbskrub.
youtube,skincare routine trend,https://www.youtube.com/watch?v=WNPW929JY4U,1772537550,SkinCare Routine for Ramadan #RamadanSkinCare #viral #trend #trending #foryou,SkinCare Routine for Ramadan #RamadanSkinCare #viral #trend #trending #foryou.
youtube,skincare routine trend,https://www.youtube.com/watch?v=kk4mH_D5Okg,1772531758,#skincareroutine #morningskincare #shortsvideo #youtubeshorts #shorts #ytshorts #viralvideos #trend,
youtube,skincare routine trend,https://www.youtube.com/watch?v=d1yXwnguakg,1772528993,পায়ের যত্ন। #everyone #skincare #foryou #highlights #beauty #shortsfeed #haircare #newbeauty #trend,
youtube,skincare routine trend,https://www.youtube.com/watch?v=WOWzFfNlSC4,1772520434,What’s one skincare trend you think is overrated? #foryou #grwn #hydratingskincare,
youtube,skincare routine trend,https://www.youtube.com/watch?v=dzn988Qx8rM,1772519285,Daadi Maa Skin Care #skincareproducts #skincare #skincareroutine #skinwhitening #trending #trend,trending #skincareproducts #skincaretips #skincare #skincareroutine #trending #trendingshorts #travel #trend.
youtube,skincare routine trend,https://www.youtube.com/watch?v=PV8cvJDn5SM,1772515332,#FromDullToGlowChallenge #goodalvitaC #fyp #koreanskincareroutine #skincare #trending #explore,
youtube,skincare routine trend,https://www.youtube.com/watch?v=yI0nHRI72o0,1772488864,skincare routine 💛🫧ft @bubbleskincare #bubbleskincare #shortsviral #viral #trend #fypシ,
youtube,skincare routine trend,https://www.youtube.com/watch?v=B0UJtnoOJOg,1772488815,happy march 🌷||#foryou #blowup #4k #aesthetic #algorithm #grwm #preppy #preppyoreo #vlog #cleangirl,skincare #sephora #music #trending #trendingshorts #makeup #viral #viralvideo #shorts #blowup #4k #preppyaesthetic ...
youtube,skincare routine trend,https://www.youtube.com/watch?v=VQY6hJx2Q5Y,1772475822,#trend #preppy #shorts #foryou #viral #fyp #skincare #vlogs #soldejaneiro,
youtube,skincare routine trend,https://www.youtube.com/watch?v=Of3H5YOoERw,1772471583,Неожиданное пополнение: мист-шиммер! Брала на WB: #WW289785 (вводи с WW) #trend #skincare #wb,
youtube,skincare routine trend,https://www.youtube.com/watch?v=M7wy36_LirQ,1772456460,Best skin product unboxing✨️#short #skincare #trend #viral #youtubeshorts,rewives video upload soon #viralvideo #shortvideo #shortsfeed #youtube #ytshorts #skin #best.
youtube,makeup trend 2025,https://www.youtube.com/watch?v=mh-1i0OfnHw,1772596183,🌸✨ Happy Holi 2025 – Engagement Makeup Look ✨🌸 #HappyHoli2025 #EngagementMakeup #HoliSpecial,"Happy Holi Two Thousand Twenty Five This Holi, I am presenting a beautiful Engagement Makeup Look ✨ A soft glam ..."
youtube,makeup trend 2025,https://www.youtube.com/watch?v=uPp111-w2rk,1772589280,TOP Cleópatra TREND  #remix #blackpink #greenscreen #soulmateart #funny,"The Cleopatra Trend (also known as Cleopatra TikTok trend, Cleopatra makeup trend, or #CleopatraTrend) exploded on TikTok in ..."
youtube,makeup trend 2025,https://www.youtube.com/watch?v=CsTyN5cxGto,1772551941,Trend 2025~2026 #like #subscribe #butifyoucloseyoureyes #edit,
youtube,makeup trend 2025,https://www.youtube.com/watch?v=UlBIlw9jnEA,1772551862,2025 vs 2026 Lip Contour Trend 🫦💄  Арт вб #WW301445 арт озон #3302491332 #beautyroutine #makeup,
youtube,makeup trend 2025,https://www.youtube.com/watch?v=j8ftsmGJqdE,1772528400,Makeup on most useless day😭😭 #trending #makeup #memes #funny,mascara meme meme makeup meme blush mascara make up lipstick makeup Tiktok Viral Trend | Tout Donner Trend#tiktok ...
youtube,makeup trend 2025,https://www.youtube.com/watch?v=yxLhlkR5FCA,1772478126,Smooth Makeup Transition #shorts,These makeup transitions are next level ✨ From simple to stunning in seconds Watch till the end for the best ...
youtube,makeup trend 2025,https://www.youtube.com/watch?v=i2wpdFGjr64,1772460905,Eid Trend 2026 | Eid Trends In Hindi | #shorts #eid,Video Title - Eid Trend 2026 | Eid Trends In Hindi | #shorts #eid About this video - Eid Trend 2026 Eid Trends In Hindi Eid trend ...
youtube,makeup trend 2025,https://www.youtube.com/watch?v=LMgpNoWGE90,1772377226,Ronaldo Messi VS Neymar Mbappe ( MAKEUP ) Trend Color mixing 🤭💄#ronaldo #messi #mbappe #trending,arischakyofficial Bugatti new trend   Only one can win   Who's your pick?   #trending #tiktok #music #challenge These trend ...
youtube,makeup trend 2025,https://www.youtube.com/watch?v=bb5WFMBfo5c,1772348493,Anime Makeup Trend ✅ ❤️ #edit #birdtrend #trollface,"AKA KIRO ❌ ANIME TRANSITION TREND ✓ ❤️ 10LIKE FOR MORE Cute, creepy, and strangely beautiful all at once Watch ..."
youtube,makeup trend 2025,https://www.youtube.com/watch?v=vQ6_LWmVgvw,1772287001,Football Stars x MAKEUP Trend 💄🪄 #ronaldo #challenge #trending #viral,Football Stars x MAKEUP Trend #ronaldo @MrBeast @USABoi001 @Ronaldo_Era @Ronaldospeed2025 #USAviral ...
youtube,makeup trend 2025,https://www.youtube.com/watch?v=z0NIZjW2Uwc,1772236520,¡Wow! / Alucinante / karina y marina / tiktok 2025 / shorts  / videos / musica / trend publicidad,
youtube,makeup trend 2025,https://www.youtube.com/watch?v=6jcu8LapedY,1772100017,Ranking The Best Glitter makeup Trend moments ✨ #shorts #makeup #glitter,"Ranking the most stunning and chaotic glitter makeup trend reveals! Watch as these creators transform with a burst of sparkle, ..."
youtube,makeup trend 2025,https://www.youtube.com/watch?v=xI6HSEXvBTM,1772014665,Ranking the best vecna makup  transition ever ✨😭 #trend #viral #strangerthings #tiktok,
youtube,makeup trend 2025,https://www.youtube.com/watch?v=J42pwacWZQc,1771966800,Ranking The BEST Roblox Makeup Trend 💖✨ #shorts #roblox #tiktokviral,Ranking The BEST Roblox Makeup Trend ✨ #shorts #roblox #tiktokviral #trend.
youtube,makeup trend 2025,https://www.youtube.com/watch?v=Wzk-x0V1Kso,1771882218,Soft and  Glam party Makeup look ✨ #partymakeup #youtubeshorts #shorts,makeup eyes eye makeup soft eye makeup makeup tutorial party makeup party makeup look party makeup tutorial how to do a ...
youtube,makeup trend 2025,https://www.youtube.com/watch?v=TIFkK8i2SI4,1771773943,color mixing trend ( full makeup look on YouTube channel #trending #fish #makeup #song,"trend, trends,. dance trend, tiktok trend , dance trends , bad boys trend, no hands trend, tiktok trends , tiktok dance trend , falling ..."
youtube,makeup trend 2025,https://www.youtube.com/watch?v=0jccB0s6K34,1771748405,Power Of Makeup💄☠️ [17] With &quot;QMIIR ~ TIKI TIKI [slowed]&quot; Song,"Power Of Makeup  ☠️ [17] With ""QMIIR ~ TIKI TIKI [slowed]"" Song You won't believe the power of makeup ☠️ This ..."
youtube,makeup trend 2025,https://www.youtube.com/watch?v=0Y2b4Rv-Rj8,1771675201,Ranking The Best Chinese Trend 💅✨ #shorts #chinese,
youtube,makeup trend 2025,https://www.youtube.com/watch?v=YlPTCmnBmrU,1771631752,TikTok Makeup Trend - BEBOT ✨️🔥 2026 Pt. 2 | 📌 Pinned your comment | #makeup #transition,Guys ❄️ don't miss this! Use code WINTER for 30% off at Adidas. BEBOT Makeup Trend Pt. 2 and that's how I sorted them ...
youtube,makeup trend 2025,https://www.youtube.com/watch?v=g7_Qcv8jQ34,1771598244,Best Makeup Trends - Color Mixing | Pt-13,This video is made for entertainment purposes only. Copyright Disclaimer (Fair Use Notice): This video is made for commentary ...
youtube,makeup trend 2025,https://www.youtube.com/watch?v=EYFAgeXbL2E,1771598137,Don&#39;t Laugh Makeup Trend Part 2 💀,This video is for entertainment purpose only.
youtube,makeup trend 2025,https://www.youtube.com/watch?v=YxGih15ZZdU,1771489626,Power Of Makeup💄☠️ [13] With &quot;QMIIR ~ TIKI TIKI [slowed]&quot; Song,"Power Of Makeup  ☠️ [13] With ""QMIIR ~ TIKI TIKI [slowed]"" Song You won't believe the power of makeup ☠️ This ..."
youtube,makeup trend 2025,https://www.youtube.com/watch?v=80hAw38mIEk,1771488010,HASIL TREND MAKEUP,
youtube,makeup trend 2025,https://www.youtube.com/watch?v=ZyuP7SZadJI,1771419666,Rumi MAKEUP Trend 💄💖 Made in Kling 2.6 🎬 #KPopDemon Hunters #klingai #Kling Motion Control #kling26,
youtube,makeup trend 2025,https://www.youtube.com/watch?v=YCT-7k924h4,1771416870,Makeup TREND 2026 color mixing 💛#trending #colormixing #viral l,College: real people +ai generated elements.
