source,domain,url,created_utc,title,text,query
rss,www.refinery29.com,https://www.refinery29.com/en-us/2026/06/11985566/camp-rock-3-release-date-trailer-plot-cast?utm_source=feed&utm_medium=rss,1780443600,Everything We Know About Camp Rock 3,"Everything We Know About Camp Rock 3

<div><figure><img src=""https://www.refinery29.com/images/11985357.png?width=853&amp;height=1024&amp;fit=bounds&amp;crop=853%3A1024"" /></figure></div>



<p>Start marching, because <em><a href=""https://www.refinery29.com/en-au/disney"">Camp Rock 3</a></em> will hit our screens in August 2026. Yes, we’re going to be reunited with Shane Gray (<a href=""https://www.refinery29.com/en-us/2023/02/11280409/joe-jonas-injectables-xeomin"">Joe Jonas</a>), Nate Gray (<a href=""https://www.refinery29.com/en-ca/2019/10/8512185/nick-jonas-says-he-was-close-to-a-coma-before-diabetes-diagnosis"">Nick Jonas</a>) and Jason Gray (<a href=""https://www.refinery29.com/en-us/2019/06/234421/danielle-jonas-brothers-kevin-wife-met-story-chasing-happiness"">Kevin Jonas</a>). As for whether or not Mitchie Torres will make a <a href=""https://www.refinery29.com/en-au/off-campus-g-flip-song-cameo"">surprise cameo</a>, that remains yet to be seen, as Demi Lovato has kept quiet about making an appearance, though she is confirmed to produce the sequel. We can only hope the singer gets to belt out an iconic ballad for <em>Camp Rock 3</em>. </p>



<p>Below, we’ve rounded up all of the information about <em>Camp Rock</em> <em>3</em>, including the cast, trailer and release date.</p>



<h2>When will <em>Camp Rock 3 </em>be released?</h2>



<p><em>Camp Rock 3</em> will be released on Disney+ in August 2026. The streamer has yet to confirm the date.</p>



<h2>What is the plot of <em>Camp Rock 3</em>?</h2>



<p>The Disney+ film focuses on the band Connect 3, who are left scrambling for their reunion tour opener. Instead of finding an already formed artist, they do the only logical thing: head back to Camp Rock to discover the next big pop star or group.</p>



<p>As campers compete for the chance to open for Connect 3, friendships are put to the test, while unexpected romances and revelations occur.</p>



<h2>Who is in the cast of <em>Camp Rock 3</em>?</h2>



<p>The Jonas Brothers are back as guest stars, but there are a whole horde of new Camp Rock campers to bring the iconic franchise back to life. Liamani Seguara plays Sage, Sherry Cola as Lark, Malachi Barton as bad boy Fletch, Lumi Pollack as cellist Rosie, Hudson Stone as Sage’s brother Desi, Casey Trotter as Cliff, Brooklynn Pitts as Callie, a choreographer, and Ava Jean as influencer Madison.</p>



<blockquote class=""instagram-media"" style=""border: 0; margin: 1px; padding: 0; width: 99.375%;""><div style=""padding: 16px;""> <a href=""https://www.instagram.com/p/DOtupPhkhFY/?utm_source=ig_embed&amp;utm_campaign=loading"" rel=""noopener noreferrer"" style=""line-height: 0; padding: 0 0; text-align: center; text-decoration: none; width: 100%;"" target=""_blank""> <div> <div style=""background-color: #F4F4F4; height: 40px; margin-right: 14px; width: 40px;""></div> <div> <div style=""background-color: #F4F4F4; height: 14px; margin-bottom: 6px; width: 100px;""></div> <div style=""background-color: #F4F4F4; height: 14px; width: 60px;""></div></div></div><div style=""padding: 19% 0;""></div> <div style=""height: 50px; margin: 0 auto 12px; width: 50px;""></div><div style=""padding-top: 8px;""> <div style=""color: #3897f0; font-family: Arial,sans-serif; font-size: 14px; font-style: normal; font-weight: 550; line-height: 18px;"">View this post on Instagram</div></div><div style=""padding: 12.5% 0;""></div> <div style=""margin-bottom: 14px;""><div> <div style=""background-color: #F4F4F4; height: 12.5px; width: 12.5px;""></div> <div style=""background-color: #F4F4F4; height: 12.5px; width: 12.5px; margin-right: 14px; margin-left: 2px;""></div> <div style=""background-color: #F4F4F4; height: 12.5px; width: 12.5px;""></div></div><div style=""margin-left: 8px;""> <div style=""background-color: #F4F4F4; height: 20px; width: 20px;""></div> <div style=""width: 0; height: 0; border-top: 2px solid transparent; border-left: 6px solid #f4f4f4; border-bottom: 2px solid transparent;""></div></div><div style=""margin-left: auto;""> <div style=""width: 0px; border-right: 8px solid transparent;""></div> <div style=""background-color: #F4F4F4; height: 12px; width: 16px;""></div> <div style=""width: 0; height: 0; border-left: 8px solid transparent;""></div></div></div> <div style=""margin-bottom: 24px;""> <div style=""background-color: #F4F4F4; height: 14px; margin-bottom: 6px; width: 224px;""></div> <div style=""background-color: #F4F4F4; height: 14px; width: 144px;""></div></div></a><p style=""color: #c9c8cd; font-family: Arial,sans-serif; font-size: 14px; line-height: 17px; margin-bottom: 0; margin-top: 8px; overflow: hidden; padding: 8px 0 7px; text-align: center;""><a href=""https://www.instagram.com/p/DOtupPhkhFY/?utm_source=ig_embed&amp;utm_campaign=loading"" rel=""noopener noreferrer"" style=""color: #c9c8cd; font-family: Arial,sans-serif; font-size: 14px; font-style: normal; font-weight: normal; line-height: 17px; text-decoration: none;"" target=""_blank"">A post shared by Disney+ (@disneyplus)</a></p></div></blockquote>




<p>Maria Canals-Barrera is also back as Connie Torres, which makes us believe Demi Lovato will be back as Mitchie Torres.</p>



<h2>Is Demi Lovato involved with <em>Camp Rock 3</em>? </h2>



<p>Demi Lovato is acting as an Executive Producer for <em>Camp Rock 3</em>, but any cameo has been kept tightly under wraps. During shooting in September, 2025, the singer shared a post on Instagram, saying they were in their “producer era”.</p>



<blockquote class=""instagram-media"" style=""border: 0; margin: 1px; padding: 0; width: 99.375%;""><div style=""padding: 16px;""> <a href=""https://www.instagram.com/p/DPML-XUkS22/?utm_source=ig_embed&amp;utm_campaign=loading"" rel=""noopener noreferrer"" style=""line-height: 0; padding: 0 0; text-align: center; text-decoration: none; width: 100%;"" target=""_blank""> <div> <div style=""background-color: #F4F4F4; height: 40px; margin-right: 14px; width: 40px;""></div> <div> <div style=""background-color: #F4F4F4; height: 14px; margin-bottom: 6px; width: 100px;""></div> <div style=""background-color: #F4F4F4; height: 14px; width: 60px;""></div></div></div><div style=""padding: 19% 0;""></div> <div style=""height: 50px; margin: 0 auto 12px; width: 50px;""></div><div style=""padding-top: 8px;""> <div style=""color: #3897f0; font-family: Arial,sans-serif; font-size: 14px; font-style: normal; font-weight: 550; line-height: 18px;"">View this post on Instagram</div></div><div style=""padding: 12.5% 0;""></div> <div style=""margin-bottom: 14px;""><div> <div style=""background-color: #F4F4F4; height: 12.5px; width: 12.5px;""></div> <div style=""background-color: #F4F4F4; height: 12.5px; width: 12.5px; margin-right: 14px; margin-left: 2px;""></div> <div style=""background-color: #F4F4F4; height: 12.5px; width: 12.5px;""></div></div><div style=""margin-left: 8px;""> <div style=""background-color: #F4F4F4; height: 20px; width: 20px;""></div> <div style=""width: 0; height: 0; border-top: 2px solid transparent; border-left: 6px solid #f4f4f4; border-bottom: 2px solid transparent;""></div></div><div style=""margin-left: auto;""> <div style=""width: 0px; border-right: 8px solid transparent;""></div> <div style=""background-color: #F4F4F4; height: 12px; width: 16px;""></div> <div style=""width: 0; height: 0; border-left: 8px solid transparent;""></div></div></div> <div style=""margin-bottom: 24px;""> <div style=""background-color: #F4F4F4; height: 14px; margin-bottom: 6px; width: 224px;""></div> <div style=""background-color: #F4F4F4; height: 14px; width: 144px;""></div></div></a><p style=""color: #c9c8cd; font-family: Arial,sans-serif; font-size: 14px; line-height: 17px; margin-bottom: 0; margin-top: 8px; overflow: hidden; padding: 8px 0 7px; text-align: center;""><a href=""https://www.instagram.com/p/DPML-XUkS22/?utm_source=ig_embed&amp;utm_campaign=loading"" rel=""noopener noreferrer"" style=""color: #c9c8cd; font-family: Arial,sans-serif; font-size: 14px; font-style: normal; font-weight: normal; line-height: 17px; text-decoration: none;"" target=""_blank"">A post shared by Demi Lovato (@ddlovato)</a></p></div></blockquote>




<h2>Is there a trailer for <em>Camp Rock 3</em>?</h2>



<p>Disney+ released the first teaser trailer for <em>Camp Rock 3</em> in December. You can watch it below.</p>







<p><em><strong>Camp Rock 3 drops in August on Disney+.</strong></em></p>
<p><strong>Like what you see? How about some more R29 goodness, right here?</strong></p><p><a href=""https://www.refinery29.com/en-au/2023/09/11542747/the-other-black-girl-series-magical-realism?utm_source=rss&amp;utm_medium=rss_linkback1"">The Other Black Girl: All Skinfolk Ain’t Kinfolk</a></p><p><a href=""https://www.refinery29.com/en-au/netflix-june-2026-6-new-movies-tv-shows?utm_source=rss&amp;utm_medium=rss_linkback2"">6 Movies &amp; TV Shows Coming To Netflix This June</a></p><p><a href=""https://www.refinery29.com/en-au/2023/05/11386202/love-again-priyanka-chopra?utm_source=rss&amp;utm_medium=rss_linkback3"">Finally, A Brown Woman As The Lead In A Rom-Com</a></p>",
rss,www.refinery29.com,https://www.refinery29.com/en-us/2026/06/11985533/euphoria-season-3-finale-rue-ending?utm_source=feed&utm_medium=rss,1780443148,The Euphoria Finale (Almost) Made Up For The Disaster That Was Season 3,"The Euphoria Finale (Almost) Made Up For The Disaster That Was Season 3

<div><figure><img src=""https://www.refinery29.com/images/11985552.jpg?width=1024&amp;height=992&amp;fit=bounds&amp;crop=32%3A31"" /></figure></div>



<p>Thank God <a href=""https://www.refinery29.com/en-us/euphoria-season-3-makeup-interview-donni-davy""><em>Euphoria</em></a> has come to an end. After watching this very weird and graphic season carelessly shuffle its characters through drug lords, sex work and crime bosses, it finally said something of substance. And though I enjoyed the finale — which creator <a href=""https://www.nytimes.com/2026/06/01/arts/television/popcast-euphoria-sam-levinson-interview.html"">Sam Levinson</a> recently confirmed wraps the series — I find it difficult to clap too hard. (Spoilers ahead, obviously.)</p>



<p>This past season was a circus that used overtly religious themes to clumsily get to the point. Since its 2019 premiere, <a href=""https://www.refinery29.com/en-us/2026/04/11975924/euphoria-season-3-chloe-cherry-cassie-onlyfans-storyline""><em>Euphoria</em>’s alluring storylines</a> and aesthetics gave us a window into the world of a group of high schoolers who could make <em>Degrassi</em><a href=""https://www.refinery29.com/en-us/2017/01/135600/degrassi-gay-characters-lgbtq-moments""> look like PBS programming</a>. Through <a href=""https://www.refinery29.com/en-us/the-drama-movie-review-zendaya-emma-character-explained"">Zendaya’s</a> <a href=""https://www.refinery29.com/en-us/2019/06/236231/zendaya-euphoria-improvised-fight-scene-rue-mom"">Rue</a>, we’ve gotten a front row seat into how addiction takes a tragic toll on not just the individual, but those around them. We’ve witnessed <a href=""https://www.refinery29.com/en-us/2019/09/8476904/euphoria-hunter-schafer-jules-final-scene-meaning"">Jules (Hunter Schafer)</a> search for acceptance through romantic and physical intimacy. We’ve seen the rise, fall, and rise again of friendship through Cassie (<a href=""https://www.refinery29.com/en-us/2025/08/11924722/sydney-sweeney-american-eagle-ad-controversy-republican-trump"">Sydney Sweeney</a>) and Maddy (<a href=""https://www.refinery29.com/en-us/2020/03/9494370/alexa-demie-mac-cosmetics-eye-makeup-collection"">Alexa Demie</a>). And the (deserved) demise of Nate (<a href=""https://www.refinery29.com/en-au/margot-robbie-jacob-elordi-wuthering-heights"">Jacob Elordi</a>), the guy who came between them. </p>



<p>As viewers, we grew an attachment to these characters’ journeys that made Season 2’s crescendo into Lexie’s (<a href=""https://www.instagram.com/maudeapatow/?hl=en"">Maude Apatow</a>) iconic play a peak moment in TV finale history. Which is why despite how devastating it was watching Rue’s death by fentanyl-laced pills and Ali, masterfully played by <a href=""https://www.refinery29.com/en-us/2023/09/11523847/colman-domingo-sing-sing-rustin-review"">Colman Domingo</a>, avenge his surrogate daughter in a Western-inspired showdown with Alamo (<a href=""https://www.instagram.com/therealadewale/?hl=en"">Adewale Akinnuoye-Agbaje</a>), Season 3 was disappointing ragebait at best and a disturbing display of festishization that seems like it spawned from an incel’s 4chan chat history at worst. </p>



<figure><blockquote class=""has-text-color has-black-color""><p>Season 3 was disappointing ragebait at best and a disturbing display of festishization that seems like it spawned from an incel’s 4chan chat history at worst. </p><cite>taryn finley</cite></blockquote></figure>



<p>Masked behind Biblical metaphors, Levinson wants you to believe that he’s saying something deep this season. He’s not. Instead, he’s living out his <a href=""https://www.youtube.com/watch?v=fCPTDQkKe3I"">Quentin Tarantino</a> wet dreams by unnecessarily using the n-word and other slurs each episode. Instead, he’s dragging out stereotypical depictions of sex workers, believing that if these scenes are outrageous enough then maybe we’ll forget that there’s little nuance. (Seriously, what the hell was that <a href=""https://www.imdb.com/es/news/ni65837474/"">50-foot Cassie scene</a>?) Instead, he’s taken these young women characters and tortured them with a series of humiliation rituals, near-death experiences and objectification that feels worlds away from where we were <a href=""https://www.refinery29.com/en-us/2019/06/234382/euphoria-hbo-review-zendaya-tv-series-premiere"">introduced to them</a>.</p>



<p>You’d think that because the stakes are higher for these characters as adults, their stories would be more captivating. Ironically, the fact that this Babylon-esque wild west world exists feels like a sin in and of itself. In fact, <a href=""https://www.tiktok.com/@justlatasha/video/7636486106678054175"">fans dissecting</a> the season’s symbolism on social media found more grounding than the show’s plot.</p>



<figure><img src=""https://www.refinery29.com/images/11985554.png?width=1024&amp;height=674&amp;fit=bounds&amp;crop=512%3A337"" /></figure>



<p>Logistics, schedules, and rumored behind-the-scenes drama were already a good enough reason to wrap up the show and maybe film a two-hour feature focusing on Rue, the most concrete storyline of the season, instead of another eight-episode arc. The overdramatization of <a href=""https://www.refinery29.com/en-us/2026/04/11975924/euphoria-season-3-chloe-cherry-cassie-onlyfans-storyline"">Cassie’s OnlyFans career</a>, Jules’ new life as a sugarbaby, the race war between Lauri (Martha Kelly) and Alamo, and whatever the hell that was with Nate and those flowers felt like Levinson needed to find something to say about these characters but came up short. Frankly, he didn’t have the range. </p>



<p>Levinson reserved his creative discipline and restraint for the finale, which doubled as a touching tribute to late actor <a href=""https://www.refinery29.com/en-us/2019/07/236532/euphoria-fez-drug-dealer-angus-cloud-interview"">Angus Cloud</a> who played Rue’s best friend, Fez.</p>



<figure><blockquote class=""has-text-color has-black-color""><p>The finale was moving because it gave grace to those who suffer from addiction and played out the very real desire to seek vengeance when your loved ones are suddenly taken from you. </p><cite>taryn finley</cite></blockquote></figure>



<p>The finale was moving because it gave grace to those who suffer from addiction and played out the very real desire to seek vengeance when your loved ones are suddenly taken from you. Rue’s death, though tragic, was tender. Though the choice to kill off the show’s lead character (a performance for which <a href=""https://www.refinery29.com/en-us/2020/09/10037100/zendaya-emmys-win-youngest-lead-actress-drama-euphoria"">Zendaya won an Emmy</a>) <a href=""https://www.today.com/popculture/tv/euphoria-finale-what-happens-to-rue-rcna347860"" rel=""noreferrer noopener"" target=""_blank"">has been divisive,</a> I understood it. Witnessing Rue embrace Fez and her parents as she transitioned into the afterlife ran in opposition to her intense brushes with death throughout her seven-episode sobriety. But it felt appropriate. </p>



<p>Even watching Rue’s loved ones move through grief, especially Ali, was the most humanizing thing about this season. I imagine that’s because Levinson’s own <a href=""https://www.nytimes.com/2026/06/01/arts/television/popcast-euphoria-sam-levinson-interview.html"">battle with addiction</a> has informed much of Rue’s storyline. His honesty here is moving. But when the director leans into his misunderstandings about race, gender and sex, we end up watching flattened stereotypical depictions under cinematic lighting and glam.</p>



<p>In the words of Aretha Franklin, “<a href=""https://www.youtube.com/watch?v=fzPpZwSDcRo"" rel=""noreferrer noopener"" target=""_blank"">great gowns, beautiful gowns</a>.” By the end, <em>Euphoria</em> had the headline-grabbing storylines, Pinterest-worthy aesthetics, and a culturally-riveting rawness dressed up in sex.  But that’s it.</p>
<p><strong>Like what you see? How about some more R29 goodness, right here?</strong></p><p><a href=""https://www.refinery29.com/en-us/2026/04/11975924/euphoria-season-3-chloe-cherry-cassie-onlyfans-storyline?utm_source=rss&amp;utm_medium=rss_linkback1"">Euphoria&#039;s Chloe Cherry On Cassie’s OnlyFans Story</a></p><p><a href=""https://www.refinery29.com/en-us/euphoria-season-3-makeup-interview-donni-davy?utm_source=rss&amp;utm_medium=rss_linkback2"">Euphoria Season 3: The Antithesis Of ‘Clean Girl&#039;</a></p><p><a href=""https://www.refinery29.com/en-us/hunter-schafer-mugler-angel-stellar-interview?utm_source=rss&amp;utm_medium=rss_linkback3"">Ever Wondered What Hunter Schafer Smells Like?</a></p>",
