source,domain,url,created_utc,title,text,query
gnews,news.google.com,https://news.google.com/rss/articles/CBMilgFBVV95cUxQSnJDekVuaGhCaWZwNHI0RGxtd2YxNnZPRDhRYVRVNnBaWUFYT1RaUXQzdjF3MnBhNzV6UVpvT0pVSmEzdjYzZG9LM29WSVBCc2I5Y201V2VvR3I4R0FnNXQtS2xzRkV4N2JONXdYbDdnSW9oR2p5aVhxcW41R2R5NkNhZGEyZ0twaU43ME1VcUxQOUFSTXc?oc=5,1780052400,This Cushion Foundation Makes My Skin Look Professionally Airbrushed - Marie Claire,This Cushion Foundation Makes My Skin Look Professionally Airbrushed - Marie Claire,beauty trend
gnews,news.google.com,https://news.google.com/rss/articles/CBMiswFBVV95cUxNM3FxNXN2ZHE4dHFlVF9CdUZSVThCYmhkaUtfWkpfa1NhaTZqb1pieDVHMTQ2aFBhZl9xTFp2NVR2bHZvVUJqb2J5YWQ2NURxbVpGaENERmNqT2xialgxbjZfQ0k4MkJPcHJHM1I3ZXlFaGktNFJRNXU2TUFCNFRCblhlY0F5c3lIUVZ3MGxDOWJNeHh2R0ctbDZzcVZhUXY4bVpuMFJxZ0xfN2J4T2dXZ3JUbw?oc=5,1780028218,Are bare nails the chicest new trend — or a recession indicator? - glossy.co,Are bare nails the chicest new trend — or a recession indicator? - glossy.co,beauty trend
gnews,news.google.com,https://news.google.com/rss/articles/CBMilwFBVV95cUxPcTlJcUJ6SzJxN2c4aFZsQno1THV1NWdpN0s2UVNZdDRvTWZheWk0NGNFS2hvQkMzWnNrNE4zSU1PM2pSbEdQbW4xVTZNc2pYZnlwcTZLd09HY3BTd1c0TFRMd0xKSE91bGxXUWIzOGo3UVROSk5rcjVnM25ZTk51V0I5VHVGT2FYdEhvVE00NW5LR05oSnRn0gGcAUFVX3lxTE9OY0x0bGJyRzVSTi1tY3I5QVRsT1BOTEpET2VGaVVmSEVTLXNHSnVDQUlaVkZvanBXSHZyVlhuaEwteGlzTXBTamF6dWg1REJHX05LWFBJSTNhRk9GTXVSNWNXejdYQ0JiTlRtVjE3aUQ1T3FPTVp4cVVWTVpaa0lUTXZyU0xMOFVNNGJtVDA0SWJDa3loeHVEWU14dg?oc=5,1779715947,The banana beauty trend is having a moment — here’s how to get in on it - Prestige Online - Singapore,The banana beauty trend is having a moment — here’s how to get in on it - Prestige Online - Singapore,beauty trend
gnews,news.google.com,https://news.google.com/rss/articles/CBMiiwFBVV95cUxONUpHd0U5X1VEcTRxRTBhcldYbGNSeEdJX3ZMTVJNVlRVUWdxYU1nT3hzUzhsRzViUTJVT0cxSjI1eWRwY1ZfdW5STUkwb0ZmZ2FsUjd3WmxUY0x1emdPcHRETWdPME9USFVGMmdNNWtKcGJ6M1E0ZkNHaG5mQVY4MFJDR1N0U2l1QzlV?oc=5,1780297200,"Google Says This Summer Nail Color Is More Popular Than Ever, and Manicurists Agree - Harper's BAZAAR","Google Says This Summer Nail Color Is More Popular Than Ever, and Manicurists Agree - Harper's BAZAAR",beauty trend
gnews,news.google.com,https://news.google.com/rss/articles/CBMipAFBVV95cUxPekJneVJKTVpBUEluSHRVdGcwWW9WeVpHejE3MWRUUjNzYXZ0S1htZmVsVjEtN1BVekJPU1ZJcXp5cGZELVYwVHpYYmVybVpRb2JzYlBjOGFxRVJRNTh3ZFRLaGQ0VnhGd0hBRUhZUDZzc2dXUE9RcDNJdFdZN1NrRi15andmTWRxbVB2TUkxbG42aWM5SlR3T28teHEwT3FkangyWQ?oc=5,1780327153,"Rachel Huber Coined ‘Latte Makeup,’ Brands Turned It Into A Campaign Cycle - Net Influencer","Rachel Huber Coined ‘Latte Makeup,’ Brands Turned It Into A Campaign Cycle - Net Influencer",beauty trend
gnews,news.google.com,https://news.google.com/rss/articles/CBMiXkFVX3lxTFBWRGdIMF9ta3VBMjMySU1KbE8yUG5DamhheVFDQUtSZHhaVkp5UlVzQXdNRl8yc0RJTnhmSEtXNXowWXBSVTkzY1FLLWJxajFUeksyREp4c2tQandKbUE?oc=5,1779260400,Blurred Skin: This Soft-Focus Makeup Trend Suits Every Skin Type and Texture - Vogue,Blurred Skin: This Soft-Focus Makeup Trend Suits Every Skin Type and Texture - Vogue,beauty trend
gnews,news.google.com,https://news.google.com/rss/articles/CBMiiwFBVV95cUxNamwtYk9ER2hsR0pOWngwZ3djTnNwNXk3NGJpeXpXcnQ5d241aUZrUGhHRkV2Y0ZlQnpLS3pyZFg4RTJxYjd2STNWa0VXMGI3NlBJM2hXUkpRV0w0TVhFVk1EcHN3VDZjU2YzNFc0Vi15alhFYktGdDBQUmlHT3A4OFlkY3FHQ2tyOFJJ?oc=5,1780038000,Gen Z Is Bringing Tanning Back. Dermatologists Are Alarmed. - ELLE,Gen Z Is Bringing Tanning Back. Dermatologists Are Alarmed. - ELLE,beauty trend
gnews,news.google.com,https://news.google.com/rss/articles/CBMihwFBVV95cUxNcU5DYklkanpWcWg4a244dHdUdE03RlhhNkUxS1I3NElEMXUxaE44MWlVUjhhZmU4VndMTUtIN2Y1WEpxN21WY01nd0FTR01Nb0NwQjRuTDNtellhN19oc05fV1F4QVJDWWlRNmVjdGd0di1QMWdGajFLRTl3bm5Ud3BLMS1CTE0?oc=5,1778742000,Dior Cosigns Summer’s Hottest Makeup Trend: Sparkles - Vogue,Dior Cosigns Summer’s Hottest Makeup Trend: Sparkles - Vogue,beauty trend
gnews,news.google.com,https://news.google.com/rss/articles/CBMizwFBVV95cUxQQjVybGVLUV9NUnRoMk9SNTNJelUxZGU2Sjh0TGNWSWZhQlJLV1FuZGtTdkk0c3RoM0pzMGFGQW9OVU9KTEV1N0t4MGNlMXNMUDFMaUtjWU5oZ3h5QmNqazRqSG1tM3Vpai10NFNBMS1zZlVscW9NRHYtc21xZ0JRcHpiR1c4a1RBX21fSGlzUW15NzNEUGZ1SzdJaTRUeFItTkVBcGktV3ROZXZaT3ZTZUJYTkZJS0pMc01VcTJGSncyUk43WjhlOV93Q2tDTE0?oc=5,1780393496,Jennifer Lopez's near-invisible red-carpet eyebrows launch the Summer 2026 eyebrow trend - Paris Select Book,Jennifer Lopez's near-invisible red-carpet eyebrows launch the Summer 2026 eyebrow trend - Paris Select Book,beauty trend
gnews,news.google.com,https://news.google.com/rss/articles/CBMitAFBVV95cUxPNjQzb25keXFqMUs2NWU1aGZxWWZMa2xtX1JFVEQ3VlhXR1VMRzRMRDJjeVN6VW5CZGxPMUdwVUJ6cEZfbnBhUHE5aGxKV1VQbG11MWJ3Rk1qSXNwN2c0WXhxVmNtcTlzZVJjME83eFVBMXpUbXV1blgzWnFTcmU1LVJJdU8zSkl5eUp2NGh5Q2lCdmFjTkctSU9jeXdOZFlPMUhSanE4VjI3YlRPQ2NRMUZTRXLSAbMBQVVfeXFMT3BGa2ExQUNlUkdUNW9SR1JndjREQUJJUHBZSEJyVGZiV1NoN0J3UTNTM2J4bUtRaUtTUDFkU01peVF1OXM2d2lIQ01OdU5WZnBHQTVTTTdDVktJWjk1b0ZkRkt2ZU5va3l5VVNFQzFkRWJTU1FoeXA0WXJjSEtoMl9UWm8telBUdjNBZHVBNGRfZlJfQ0xmbVpSOXdVNl9JWUozUTRLc1VVdTN4Qk0xdnhuV2M?oc=5,1780382283,8 Beauty Trends Cosmetologists Want People to Stop Following Blindly - femina.in,8 Beauty Trends Cosmetologists Want People to Stop Following Blindly - femina.in,beauty trend
gnews,news.google.com,https://news.google.com/rss/articles/CBMicEFVX3lxTE9sTk82QmhRUGFSVE0wRDhLRWNQclJLUmpWSlZJR3NPNWJIa2h5Mld5MERra1hfUGV6cWtwZVNXSEdraldKVmVMa2Y3Nzc5OUc5RmoyV29kOWlJVTY2UzVpalJiclFsX2x3czdUVWxtb1k?oc=5,1777014000,Watercolor Makeup Is Spring’s Softest — & Surprisingly Easy — Beauty Trend - Refinery29,Watercolor Makeup Is Spring’s Softest — & Surprisingly Easy — Beauty Trend - Refinery29,beauty trend
gnews,news.google.com,https://news.google.com/rss/articles/CBMiuAFBVV95cUxQY01zMUUtcFVqRUp5V1pxOWktMEZMM094NnlOUFZ6dmtIQ2Z0Y1ZPRWJEMGtlck0xWDctWExWMl81Y0NyTzlvYUx3QWNkZnQ5X2ZFSUp5WFA1YXRsd0VNeDZvRUdJT0ZmemxvZ1piSVVNQXB0czU3NmhTNlFyWlJfakIxa3NEWkItN3RJaDJyM3EtS1BnYi1LWUx5Z2hseHlYLXNsTTdXWUlKVXlRbnF5cDI4ZmhJYTAw?oc=5,1777964400,3 Met Gala 2026 Beauty Trends Redefining Luxury on the Red Carpet - Forbes,3 Met Gala 2026 Beauty Trends Redefining Luxury on the Red Carpet - Forbes,beauty trend
gnews,news.google.com,https://news.google.com/rss/articles/CBMic0FVX3lxTE5SQS1QNGYxN0tabEZPbmUzOXE5NHJhRXI0Yzg2TXhrNTBTUjJrbXlLMTlwS242Tmw3UXVwRV9uY0NRdVE3SVU3SGdwc0tiOHE4M1loN3BFRFJtaFUzREdncEZHYklnOS1kemNsLUhOX29UVUU?oc=5,1778223600,"""Aussie Girl Glam"" Is Set to Become Summer 2026's #1 Makeup Trend - Who What Wear","""Aussie Girl Glam"" Is Set to Become Summer 2026's #1 Makeup Trend - Who What Wear",beauty trend
gnews,news.google.com,https://news.google.com/rss/articles/CBMiZkFVX3lxTE55YVNKbVVLSGpVeENKazIxYW90cVVvcWJldHkzZ0dJR1JSMTMwNUdGWC0xdUg5WVRsRVJpdTlvUEZBeGNNR2FNTHl4SWhOQlAzdU5QazFiZFlvRndkRDhOOV9MNUxZQQ?oc=5,1777964400,Tired? The Met Gala Served Up Lots of Dark Circles Inspo - Allure,Tired? The Met Gala Served Up Lots of Dark Circles Inspo - Allure,beauty trend
gnews,news.google.com,https://news.google.com/rss/articles/CBMijgFBVV95cUxOb21CMlBPUlZ0b3NOX0NWWXV1YVVWTVh6dDFJVTRTRjZFbm53bE0wQW1ZMXpNdUM3b0JiVTJyYS1DdTRlUVc1U3ZOdVJwRmZZVXA1Y3UxaHBXRENkZExpN0ZXVnlidTdWVV9UY2FzUjNCR1BwVnNVdV81a1NobUt0a21kNnZ5V1VzUUtmb1ln0gGTAUFVX3lxTE1tU2FURzRvbElISThuZTVDMGw2ZDJFTjRvcl9GWlNfdFFiOHVMSkFjQ0FqYkk5VFA4VHFjbktvaDE2SjVXXzZOLW5YVXdUN3pXOHVDZC1BM3pfaEkwU1FVZklMSUhxRW9lVTNkSnA5SlU5c24wNDh0b3pYS1V6T2Z6N1RtZVdwYmpLOVRUVXBvTkxoVQ?oc=5,1778050800,The 'no makeup makeup' trend is bigger than ever for summer 2026: What to know - Good Morning America,The 'no makeup makeup' trend is bigger than ever for summer 2026: What to know - Good Morning America,beauty trend
gnews,news.google.com,https://news.google.com/rss/articles/CBMikAFBVV95cUxQd3pHN0tHeVlCRGNBN3M4Z3ZaVGlwbGJKQWhEWnVtN0NOcmFuLXlEVzJrOTdWX2d3R0ptWURJY0pfRXZCQTFHcERVUzRBcDlUQ3dxR09jTW9fR2VyV2YySll3VzdGVHhQNXVMQWk4MzE3MWFISjMwLU0tQ05xYWxUMTFJMU9XZkFjdTVOeGtXemc?oc=5,1777878000,I’m Calling It: These Are the Met Gala 2026 Beauty Trends to Watch - Cosmopolitan,I’m Calling It: These Are the Met Gala 2026 Beauty Trends to Watch - Cosmopolitan,beauty trend
gnews,news.google.com,https://news.google.com/rss/articles/CBMilwFBVV95cUxNNFM5QXdoZURLeTVYaGZZRDhjNmo5OTJrdjg4SFdlWlAxSUxRYklwc2ZJeFl6WENldTVjdHN6X3c5LWRjZGdIN2ZlRGViaFEtTDlzQUo4eVRRbmhXRzlYYkxBWjVIM1hQMXFBS0ZybEpnWGFMdTMwTkZ4OXhoYjlkXzNLM1RaWkliMm5qZnF2ZUZzZUpmd3lr?oc=5,1777532400,Latest spring beauty trend to try | Go-To Girlfriend - CBS News,Latest spring beauty trend to try | Go-To Girlfriend - CBS News,beauty trend
gnews,news.google.com,https://news.google.com/rss/articles/CBMijwFBVV95cUxNc3N4cm9LLTU4N3Y5bnNPVi10bjFuU1JXTXZJaTd1dzB0VlJMVTdacXVYME9kZ1NHS3lvSG5ScDhkTjdqVTB6em1Vb3dWN3hWcWtTSWZRbnZ2aTl0SEpMNXhvX283UUN5VDdtc0J0U0Zjb0xOY2FpTjFBNElCeG8wb1hWbGtjS0FaT1JiQVdHaw?oc=5,1777618800,The Beauty Trends Predicted to Make It Big at the 2026 Met Gala - WWD,The Beauty Trends Predicted to Make It Big at the 2026 Met Gala - WWD,beauty trend
gnews,news.google.com,https://news.google.com/rss/articles/CBMiWEFVX3lxTE9nb0lxTkdrME93QmhtS0htQm1qR3VwNmFUN1pZbXAtaHNMMnVnV3FtU0dzUDZEdlkxZVZBSHd5TW0ybkFNQng3QnJjaUJSSUV3bEJ4ZkNRT3I?oc=5,1778742000,All the incredible beauty trends from AFW 2026 - RUSSH,All the incredible beauty trends from AFW 2026 - RUSSH,beauty trend
gnews,news.google.com,https://news.google.com/rss/articles/CBMifkFVX3lxTE93MFg2by1abks3NXF1anZheHBuRV80eHR0U19URi1KLXBBMHFqcVZpZFZFcVJnV21UT081X3hEZzRJS0RkOWtLelVwRmMxd0wwRVI5d3d4cVJXVzBQNEUzeUhvR2lhTTB5SGVpNW04WTE0ZjV6WXpIM1hBTjVJZw?oc=5,1776841200,Rihanna Just Confirmed the Spring Beauty Trend I’ve Been Forecasting for Months - Who What Wear,Rihanna Just Confirmed the Spring Beauty Trend I’ve Been Forecasting for Months - Who What Wear,beauty trend
gnews,news.google.com,https://news.google.com/rss/articles/CBMikwFBVV95cUxNNlB5TlN1OXV3ZWxaOENaNjhXVFBYV1NTQkE3ai0tdUc1SlR5RU4wWlpCSDVoZTBXSF90QlZyUTAzeDgwR1dIWGFBc3dhOVB2VGNPeUN4RzQzbjVqR0ZZVjZQQ2h4NU9CXzJ2aTlwNFpQVmp0NTh0eXFUUUlPajQ3YU5wd2JUZERWa1Z3SklwelZ1OWc?oc=5,1776668400,How to Recreate the Watercolor Makeup Trend Hailey Bieber and Sabrina Carpenter Are Loving for Spring - ELLE,How to Recreate the Watercolor Makeup Trend Hailey Bieber and Sabrina Carpenter Are Loving for Spring - ELLE,beauty trend
gnews,news.google.com,https://news.google.com/rss/articles/CBMiyAFBVV95cUxQUTctdkp5YjJuSnI3RWg5WGFsVzd3TzFFYzdQQWVIWVJHWWJMZHFTdkI2S3hMSGRSd29RMllWTFl3bkN4M2poanNHdG82dDNKZlRlNWhFUW9fZEpRcWRnWDlSUnJCdnY5bXlQZ1hickRyUTJaTm5jakVEOTVhLUg0Q1VFb0pHNXJyb2ZZR1gxWXJObUZjY005RkRqM25UT0J0a1piNEJMX2ZIS0NaWk10Z2wySXB4RV9kMV9pTm9OUjBPVXp5MThHLQ?oc=5,1779879600,"From mori to Douyin makeup, Malaysians are creatively remixing beauty trends - The Star","From mori to Douyin makeup, Malaysians are creatively remixing beauty trends - The Star",beauty trend
gnews,news.google.com,https://news.google.com/rss/articles/CBMicEFVX3lxTE96eFRtR1g5NG15VmJxdk9GX3B1V1FJdWRDdkJPb1pHMWk3d2pwMV81WFBURlJxaHRadVZTWUFKR1VSc21KX1lyVTUxa2NSa05nRmxUU1FRb1hFVWNvc2hDZ25YYUQ0Y09jMzNhLTZuWGk?oc=5,1780047000,The Vogue Business Beauty Trend Tracker - Vogue,The Vogue Business Beauty Trend Tracker - Vogue,skincare trend
gnews,news.google.com,https://news.google.com/rss/articles/CBMiiwFBVV95cUxNaHhqdTV6LWl4dHAwUTJlSGFiNVMtbld2aG1nRlViM1gtSUFROTVLbHhUSVB0WlQxMngtWXpwOXE4WTlhakJpdnlMTFlsbFVJUDZtQl9FV3lxRVlRdl9YenRRX2NfeEVEUTNhUWo0X1ZnUEg4eERwUEdESW1Bcno1Ri1seXpLSThHc0t3?oc=5,1780325719,We've entered the 'Age Blindness Era' – The new beauty trend that's slowed visible ageing - Cosmopolitan,We've entered the 'Age Blindness Era' – The new beauty trend that's slowed visible ageing - Cosmopolitan,skincare trend
gnews,news.google.com,https://news.google.com/rss/articles/CBMijgFBVV95cUxOMXA2U3E3dWd4bG9PRUl6cFdycnhRQldmZDZOb2FQdy1IQkFpbU9qODBqX1lRRUl5ai04c1JfR1hpbkNQTUlsZENBZHdjZ1c4QVUzeWhCSnNhZHhYSmc5QWNqUGY5bHBkT0J6eXN6VVhQZzBVTEJ3QTNqdloxLURNTGw1M19mSVc0OHZkbHdB0gGTAUFVX3lxTE1pLUEyWFV0MU1rZXFXbkFLLXhGT3Z6LTM3M21XNWFYSlRiYTNhYzZYYmFxMzVQWlJySnZmZ1U4US1BbHhxdnp3eG9sR2RRUzR3dkhiZW1ZOUhsbHotc1VDdUxGSGQ5S1ZlWkpobVJsVGh5QkctczJOVDJNNkxELXBNTG5oeTdkN1l5M0pzV2V1SF9xRQ?oc=5,1778828400,Inside the “Eat Your Skincare” Trend - WWLP,Inside the “Eat Your Skincare” Trend - WWLP,skincare trend
gnews,news.google.com,https://news.google.com/rss/articles/CBMiTEFVX3lxTE5DV2dtWkdWM2YtYmdRdmVIMG1tem1COFNYTDZEWFAxLTNwMXdvWGNqdlZaT3hrVjBTc2xMYjR0OGNiQkxWLWxrNEFnenc?oc=5,1778828400,"Video K-beauty trend reshaping views of masculinity - ABC News - Breaking News, Latest News and Videos","Video K-beauty trend reshaping views of masculinity - ABC News - Breaking News, Latest News and Videos",skincare trend
gnews,news.google.com,https://news.google.com/rss/articles/CBMirAFBVV95cUxON3BwRzVCVDBROHFCQ0N2NzdVZUt4VnJYZGdVSTRXM3luTjFXN2dXTUMzT2MzY2NyWVJIX0NfN1M4YjlHcEVnMWRIMmJqWFFCbV93a0U2b3JKV1E2S0psdTl2TFlSd0VfR3JEbDFKQzNfa1ZQY3k2THBtUVE5MGZXYWJNbDBBcEFrZzFNUWNZZ1VHWnZBRmlKb1pkckZsdVFsSGRhSFZOakp6OWtw?oc=5,1780334906,Skin Minimalism Trend: Women Embrace Simple Skincare Routines for Healthy Skin - Deccan Herald,Skin Minimalism Trend: Women Embrace Simple Skincare Routines for Healthy Skin - Deccan Herald,skincare trend
gnews,news.google.com,https://news.google.com/rss/articles/CBMilwFBVV95cUxPcTlJcUJ6SzJxN2c4aFZsQno1THV1NWdpN0s2UVNZdDRvTWZheWk0NGNFS2hvQkMzWnNrNE4zSU1PM2pSbEdQbW4xVTZNc2pYZnlwcTZLd09HY3BTd1c0TFRMd0xKSE91bGxXUWIzOGo3UVROSk5rcjVnM25ZTk51V0I5VHVGT2FYdEhvVE00NW5LR05oSnRn0gGcAUFVX3lxTE9OY0x0bGJyRzVSTi1tY3I5QVRsT1BOTEpET2VGaVVmSEVTLXNHSnVDQUlaVkZvanBXSHZyVlhuaEwteGlzTXBTamF6dWg1REJHX05LWFBJSTNhRk9GTXVSNWNXejdYQ0JiTlRtVjE3aUQ1T3FPTVp4cVVWTVpaa0lUTXZyU0xMOFVNNGJtVDA0SWJDa3loeHVEWU14dg?oc=5,1779715947,The banana beauty trend is having a moment — here’s how to get in on it - Prestige Online - Singapore,The banana beauty trend is having a moment — here’s how to get in on it - Prestige Online - Singapore,skincare trend
gnews,news.google.com,https://news.google.com/rss/articles/CBMikwFBVV95cUxPZ2RTcTEyNlpyVFN5RmF1b1psbnVDaWpDYVVoRDFlLU83R2RDRkFDZmVBYS1pam96TGthVUoyc0ctSlh0QU5uS3RXY3Awd192Zlg3NmNKZEtlSlA5Y2JaQUtZbVZZWjdYS1U4ejJuM3RTa1pncjV0MGNQOHdZbXpRaVNzX19SY0xzRnhZQms3UDlOT3c?oc=5,1779174000,The ’80s Beauty Trend Everyone Is Wearing Again - ELLE,The ’80s Beauty Trend Everyone Is Wearing Again - ELLE,skincare trend
gnews,news.google.com,https://news.google.com/rss/articles/CBMiXkFVX3lxTFBWRGdIMF9ta3VBMjMySU1KbE8yUG5DamhheVFDQUtSZHhaVkp5UlVzQXdNRl8yc0RJTnhmSEtXNXowWXBSVTkzY1FLLWJxajFUeksyREp4c2tQandKbUE?oc=5,1779260400,Blurred Skin: This Soft-Focus Makeup Trend Suits Every Skin Type and Texture - Vogue,Blurred Skin: This Soft-Focus Makeup Trend Suits Every Skin Type and Texture - Vogue,skincare trend
gnews,news.google.com,https://news.google.com/rss/articles/CBMidkFVX3lxTE1KZ21WNGp5YkhtdVJkZmpPRTJkUnFjbkdvUkFJRWtKUGZ5dWFxdUFvbjF4QmxMNXREOW9TNDN3Y3J6bUFhV1BXcDlySk5kOFY4TTlBTnBla2lzSDdkb052b3NhVU1mMXUtMUppUDQxZm1BMXgxakE?oc=5,1780214400,"From sardinemaxxing to skincare, here's why tinned fish is the newest 'it' food - CBC","From sardinemaxxing to skincare, here's why tinned fish is the newest 'it' food - CBC",skincare trend
gnews,news.google.com,https://news.google.com/rss/articles/CBMifEFVX3lxTE9RaHZWZVYySkhLMXpoVlR6aXI3SG94UmYxUkgzZmxZbXliX2NCczZnSzFHYWZvUlFwTlFmN29raVZwcUNnVDczVHF2aHJRSTI4dWhJRWFBNDA0N1ZvWWVWeDZma19tRlc2MkdMZ2tqaV80RHQwemUwQ1p0SXA?oc=5,1778742000,TikTok says drinking your skincare is the hottest beauty trend to know now - so we tried it - Grazia Daily UK,TikTok says drinking your skincare is the hottest beauty trend to know now - so we tried it - Grazia Daily UK,skincare trend
gnews,news.google.com,https://news.google.com/rss/articles/CBMikwJBVV95cUxNNko3RXNKRzJpUFN6LUtwYzc0c3NVdGlBdFlFLWJQMTNLYlN4d0VmTVNZRHR4ODVEb2pJMnROVWR4RWpFaG5zakdWUmtYUzJLRVNKcFpxSy1XZ2RVRmhjUXFaamN0YVFibEpuYWo2LU5mYTB6RjMtallpckd2M2ZfWi03WU9VZUZoR2c4b0lpaHJ2NXRjUEJWLWlvUmhuX0RNMUdUN1ZkeUFKYXBhcjRqYjg5ZXFHQjZzaVNoZEtJVjhlQkhZN293em8wNGhyaHlzVm1WY2F4dUpRVDRDdHBpY0NoQlhlcjlxNzFmeHJCeTR4MTB3VWUzM2tza3VLdEcyc0NfSDJBMENRMlFfVHItaGJpTdIBmAJBVV95cUxQQkJoVTc3NGdWTWJsbDlSZTRxdW9RbWtxR0tFN2NaQTJRSnZGdVcxUnpIc24xV3BCTWdqUjF2NE9maHB6Qmk2YWh2aDFqS0p3S2lEOHR2VURnWmZlUnVuVWYwWVFpTXExZXcxa21USFhLNjVUZ0FzX0FYcnZtOVhkMm9Oc0NsQ2VaNFVvRU5hVlRzZ2FpYjdmbWRReUVDeEhhclZxZi1rRHJqZGdDM25Nc1AwemtiQUNweUozUG5DSWZqN0tEUVA5R1EyMkNUdmh0MHRPVDRBNGlROV9MWS01SGxmWlhYYi0wTnZaeEtDTjFXRzNHMVFxaS10M2xWbExfVFdTM0VwbEpvV3BuWmhDbF9seUpESXZt?oc=5,1778828400,Retinol to peptides and hydration: Anti-ageing overnight skincare trend dermatologists actually approve o - The Times of India,Retinol to peptides and hydration: Anti-ageing overnight skincare trend dermatologists actually approve o - The Times of India,skincare trend
gnews,news.google.com,https://news.google.com/rss/articles/CBMiekFVX3lxTE5pRWtfNmxFQ01KczlrR1JyaTBXNEFXVENmcU1kbnZGXzBNalU3MDd6R1FTMk5td25WaWd4RlBvcjFIcklOWnVoUGhiZ2l0dFg3WFd0blZ2cjJubGxTMWtFYm9rNlF2VXg5RExMeFZEdFpRUmg2LUl5WW9n?oc=5,1778828400,"Your Guide to K-Beauty: Medicube, Dr. Groot and More Picks Worth the Hype - TODAY.com","Your Guide to K-Beauty: Medicube, Dr. Groot and More Picks Worth the Hype - TODAY.com",skincare trend
gnews,news.google.com,https://news.google.com/rss/articles/CBMinAFBVV95cUxOWVUzT2drTXdTVEZwamV5U2x5X1JNeU5SMDRLbVlMZVJNdjJpbHFhQVN0OFRid2VRbFR4UURsZnFFOUNaTktnN0VDX0hwR0tGMVFPekxqRzNndHZpaTNjbFRtX2JfSllSNk1jc081YVl1cGo4TDUtekgxY2hhLWlKSlBhQnJqWXRCV0w4ZGFPY1BGdWdYREJWSHlSX1I?oc=5,1779186912,"What Is Skin Longevity, The Age-Defying, Future-Proofing Skincare Trend? - Cosmo.ph","What Is Skin Longevity, The Age-Defying, Future-Proofing Skincare Trend? - Cosmo.ph",skincare trend
gnews,news.google.com,https://news.google.com/rss/articles/CBMigwJBVV95cUxOV05lTFFBenhWYU84cGc4aWZrVldZT3Y3NDRzRnM3YmthN0RPc2RTQWNNNm9GYTRQaXZGNGE5enBnOHZsSnVGRU41U1VwUFFlZkZaVmYyRmVlOGZRUUZEeG8za0I2Tl9jVGtIZ2tRVGs0b0p2Z0dQTGRvcElHbk5INzRhUnZGV3ZRX2JQS2FibHBIM3pTZFZDVmJsZjY3SnpNYUxkX0pMNkozdkQxbmJUekV5N2RsRHJWR0hXd1BtMF9ENGU0Yjg4aVZQOHZucDZXMVl0TkxiNnhiaUtqdzlBTVVBSjJYajI0d3RtRUIyX2IwRFdzUDlHTmFBbl9EbFZHMzlJ0gGIAkFVX3lxTE1Xa0VBTVBFVDBmTW9XU3hqZmo5LU5XckYxdXlGb00yN3FOMVplbWFIdVFtdjc2NFhhdlFIMzJCRHhJckktVm5JWUVscWZxZTB3MXBTUUMwRVVNQWZXdDkwbmdRaHVJWkl4UTVVdXlaeWlWZnRiTkdsbGx4SW4tZ1h6dC1qcFpiWVZxMDdUQk1RcG5YZHZ0TWdRelZQWFpXbTdMak00U2hNcF9iaGV1VDJ6Z0p1dWkxTW1mNXFqOTRZWm9UakNoQlc0c0F0M01MSEgxTElndVM0VFlweVNMTWdBWXhLTGZZenJWeHY1VzJtYlJham9MSnM4RHZoNHg5NGhaVnQ3enJNMA?oc=5,1779001200,Can rose petals really boost collagen? Here’s what research says about the viral skincare trend - The Times of India,Can rose petals really boost collagen? Here’s what research says about the viral skincare trend - The Times of India,skincare trend
gnews,news.google.com,https://news.google.com/rss/articles/CBMifEFVX3lxTFBBajdhN1A2RV9SRHpTajlsTWJPbDM2VXZTaXFWLW0zM3dXdExkSldEZzU3eFFFbjE4Z2t5UmdsWU1iVms0OFRTTUIta01TcTk1ckQ4U3pocXBZOGx0WEU3bV9vMDRWWnlDT1dfYkliSDh2bnRRTmRMVjJ3Tl8?oc=5,1777014000,“Eating Your Skincare” Is Taking Over TikTok—Here’s What It Actually Does for Your Skin - Marie Claire UK,“Eating Your Skincare” Is Taking Over TikTok—Here’s What It Actually Does for Your Skin - Marie Claire UK,skincare trend
gnews,news.google.com,https://news.google.com/rss/articles/CBMickFVX3lxTE0wY2tkN0xlYk1URmFCcTMtR1ZJMGt2ZDVMZk15TWJxNlRPdVdPdUZoY1JiSXFjM2xRdmcwRnE1M3JjVDJVUlY3aTFoUDcxSmpTajFxYTh3b1VnSFczc0NpbWJxcjhpVGl0V3VWS1d1X1dZZw?oc=5,1779908565,Florence Pugh's Turquoise Eyeliner Is the Summer Makeup Trend to Watch — See Photos - Allure,Florence Pugh's Turquoise Eyeliner Is the Summer Makeup Trend to Watch — See Photos - Allure,makeup trend
gnews,news.google.com,https://news.google.com/rss/articles/CBMihAFBVV95cUxNSmptanlRNGRlOVdvblkteU5oX2txNHh5Q25LXzdCUlZiWElGV2ZGYnJOSm5DOEs0VDg3cl81Q3p6NnlCZjRBRXhvOXRyX01oak01Tmg5dVFqVFFxalAta1phN2pwb3JGX21lWkJIMjI5TnhrVmFhRGpDWWt3TVdRZjZQbmQ?oc=5,1780124400,Summer 2026’s Most Unexpected Lip Trend? Matte Lipstick - ELLE,Summer 2026’s Most Unexpected Lip Trend? Matte Lipstick - ELLE,makeup trend
gnews,news.google.com,https://news.google.com/rss/articles/CBMid0FVX3lxTFAybVVDbllieHZIb2dDMy13azJzZHBtM2U1VmFZSG1RSHRONzdKSzhaQTl1ZjlsanFPZkNyaDllWU4ybVpaV2FQSnhmT3ZCc3lrTGZNMUI0MTlPTkFsOVh0Sms2SzJGWVdHaWtXSndKV2RzdUtER2dV?oc=5,1779433200,The Top Summer 2026 Makeup Trend? Looking Like a Hot and Sweaty Vixen - Marie Claire,The Top Summer 2026 Makeup Trend? Looking Like a Hot and Sweaty Vixen - Marie Claire,makeup trend
gnews,news.google.com,https://news.google.com/rss/articles/CBMijAFBVV95cUxQMFd2ZEl1SUhDVzl6eGpZdHlMeEZUQVpUNzVjZzhLMVhzUHJGa3BJX0YtQ1JCemhueDUtN296QUk2SkQ3aV9DbTg1QjdRdVBNcmxwalV1ZldMNmhpTDlfZHIxc1d3aXRpcmdkUUhfS0t4RXpvTTczS1NIZzZvTmFFUDh1ODZlUFpuOS1DXw?oc=5,1780437002,'Halo Nails' Are Summer's Coolest Manicure Trend - ELLE Canada Magazine,'Halo Nails' Are Summer's Coolest Manicure Trend - ELLE Canada Magazine,makeup trend
gnews,news.google.com,https://news.google.com/rss/articles/CBMic0FVX3lxTE5SQS1QNGYxN0tabEZPbmUzOXE5NHJhRXI0Yzg2TXhrNTBTUjJrbXlLMTlwS242Tmw3UXVwRV9uY0NRdVE3SVU3SGdwc0tiOHE4M1loN3BFRFJtaFUzREdncEZHYklnOS1kemNsLUhOX29UVUU?oc=5,1778223600,"""Aussie Girl Glam"" Is Set to Become Summer 2026's #1 Makeup Trend - Who What Wear","""Aussie Girl Glam"" Is Set to Become Summer 2026's #1 Makeup Trend - Who What Wear",makeup trend
gnews,news.google.com,https://news.google.com/rss/articles/CBMiXkFVX3lxTFBWRGdIMF9ta3VBMjMySU1KbE8yUG5DamhheVFDQUtSZHhaVkp5UlVzQXdNRl8yc0RJTnhmSEtXNXowWXBSVTkzY1FLLWJxajFUeksyREp4c2tQandKbUE?oc=5,1779260400,Blurred Skin: This Soft-Focus Makeup Trend Suits Every Skin Type and Texture - Vogue,Blurred Skin: This Soft-Focus Makeup Trend Suits Every Skin Type and Texture - Vogue,makeup trend
gnews,news.google.com,https://news.google.com/rss/articles/CBMidEFVX3lxTE83UmZMS2Vkc2tBWERsN3UxZFpCQ0U5YkR2RlRuSUNUaHJxdVExY1ZYaVNJRkRXWHhtRWktWHV2Q3ZrVVhzX0huWlFodU9NLUxIbEV5STNQRmY5cU5BRzJ6bnRmRU5PTS1VQlZQcmliSGJlTW9B?oc=5,1779976825,"Finally, A Powder Blush That Doesn't Get Streaky Or Chalky - thezoereport.com","Finally, A Powder Blush That Doesn't Get Streaky Or Chalky - thezoereport.com",makeup trend
gnews,news.google.com,https://news.google.com/rss/articles/CBMicEFVX3lxTE9sTk82QmhRUGFSVE0wRDhLRWNQclJLUmpWSlZJR3NPNWJIa2h5Mld5MERra1hfUGV6cWtwZVNXSEdraldKVmVMa2Y3Nzc5OUc5RmoyV29kOWlJVTY2UzVpalJiclFsX2x3czdUVWxtb1k?oc=5,1777014000,Watercolor Makeup Is Spring’s Softest — & Surprisingly Easy — Beauty Trend - Refinery29,Watercolor Makeup Is Spring’s Softest — & Surprisingly Easy — Beauty Trend - Refinery29,makeup trend
gnews,news.google.com,https://news.google.com/rss/articles/CBMifkFVX3lxTFBQU0dyLXR0ZGNlaDlOZXQ1djdfa3paNUdvLW44UmduVjFuLWYzMG12NjBwZjg2Z1Q4N25BUXpVQ29qRmJ3dXRVSjEyQmdhNnFPSWt1bnNzZVZoZW1OMVB4RFBOX1JZcEllMkFIcmo0UnZSVERITmFPZEJyWDRyUQ?oc=5,1778050800,"The 'no makeup makeup' trend is bigger than ever for summer 2026: What to know - ABC News - Breaking News, Latest News and Videos","The 'no makeup makeup' trend is bigger than ever for summer 2026: What to know - ABC News - Breaking News, Latest News and Videos",makeup trend
gnews,news.google.com,https://news.google.com/rss/articles/CBMimwFBVV95cUxNdTBFd1FWWklMVGM1SFR5OVBZNG5DOTc5NFN2WXo3c3RfS2xxUzJZWElVcU5WQklxV09xS2kwWlFRWHBfNjR1UkR4QWZJYVlRX3UyN0FVSEVfQVFqeXRfbVdmRWczdjJzSkJwWm43N05zamJraVI4TzNacnN6SkQ0LXlRRkpDVVFGcmxlOVRka1IzY0Jzcy1tajB1TQ?oc=5,1779966638,"Smoky, Smudged Eyeliner Is A Big Makeup Trend For Summer 2026 - Stylist","Smoky, Smudged Eyeliner Is A Big Makeup Trend For Summer 2026 - Stylist",makeup trend
gnews,news.google.com,https://news.google.com/rss/articles/CBMiZEFVX3lxTE13Ul9oU25vMm5RNHJrcW8tbWRBckFhWU9sdXBubTVwNllaai1aZ0NCdTU5ZzlUeVBlR2psV1JoUEdVQmp2b1IySk9UZEVTMlRSTG1IQTlWQWFwZ183Y0l0NTlHVnE?oc=5,1779260400,Summer 2026’s Biggest Makeup Trends Are Edgy and Unbothered — See Photos - Allure,Summer 2026’s Biggest Makeup Trends Are Edgy and Unbothered — See Photos - Allure,makeup trend
gnews,news.google.com,https://news.google.com/rss/articles/CBMikwFBVV95cUxPZ2RTcTEyNlpyVFN5RmF1b1psbnVDaWpDYVVoRDFlLU83R2RDRkFDZmVBYS1pam96TGthVUoyc0ctSlh0QU5uS3RXY3Awd192Zlg3NmNKZEtlSlA5Y2JaQUtZbVZZWjdYS1U4ejJuM3RTa1pncjV0MGNQOHdZbXpRaVNzX19SY0xzRnhZQms3UDlOT3c?oc=5,1779174000,The ’80s Beauty Trend Everyone Is Wearing Again - ELLE,The ’80s Beauty Trend Everyone Is Wearing Again - ELLE,makeup trend
gnews,news.google.com,https://news.google.com/rss/articles/CBMid0FVX3lxTE0tLWM3MzNZNG1FNGhncWhIVXZxM1pQRUh0VEJhQk1tWi04N1psVk1rVWNmdXJ1LWpIN0RCbEU0YnpRSW9iV1lRdmZqRDI4RXpCc0ZGVktfRnhCcEZwdmxCa2d5aGoyX1NBNVVIX1ZzeHBRN1YyYTdv?oc=5,1780135830,Beauty Marks: The Best Beauty Looks of the Week - Vogue,Beauty Marks: The Best Beauty Looks of the Week - Vogue,makeup trend
gnews,news.google.com,https://news.google.com/rss/articles/CBMihwFBVV95cUxNcU5DYklkanpWcWg4a244dHdUdE03RlhhNkUxS1I3NElEMXUxaE44MWlVUjhhZmU4VndMTUtIN2Y1WEpxN21WY01nd0FTR01Nb0NwQjRuTDNtellhN19oc05fV1F4QVJDWWlRNmVjdGd0di1QMWdGajFLRTl3bm5Ud3BLMS1CTE0?oc=5,1778742000,Dior Cosigns Summer’s Hottest Makeup Trend: Sparkles - Vogue,Dior Cosigns Summer’s Hottest Makeup Trend: Sparkles - Vogue,makeup trend
gnews,news.google.com,https://news.google.com/rss/articles/CBMiswFBVV95cUxNd29vcWxERWQtRjRWSnN5N01zcEgxZlYyclV1SllENVBiai1YZVozM0JqZ1hEdGFQZ09DM1lpMkFxNXlWN1I4a3h2NDQwVFNjY3k3dENFbXRMLWJaQnkxWFh2OG4xeGNXZmJEU0IwZHpBZzljY2Jab3h1Vk13Z3BjNFVGTmUzamhuM3FXOFNSb1hvYXRkalRkdEJkTktBR282WmZvSFZPMHFXUlNxRE1FVHFvYw?oc=5,1780310863,"The ""No-Makeup"" Look: Why Lip Blush is Dubai’s Top Beauty Trend in 2026 - FTN news","The ""No-Makeup"" Look: Why Lip Blush is Dubai’s Top Beauty Trend in 2026 - FTN news",makeup trend
