source,domain,url,created_utc,title,text,query
rss,www.refinery29.com,https://www.refinery29.com/en-us/best-skincare-tools-devices-gifts?utm_source=feed&utm_medium=rss,1765818036,"10 Of The Best Beauty Tools To Gift Skincare Obsessives, From $18","10 Of The Best Beauty Tools To Gift Skincare Obsessives, From $18

<em>This holiday season, we’ve found the gifts that feel great to get and even better to give. Shop our collection of editor-approved <a href=""https://www.refinery29.com/en-us/the-art-of-giving"">holiday gift guides here</a>.</em><br /><br />We all know someone with <a href=""https://www.refinery29.com/en-us/dermatologist-skincare-advice-2026"">incredible skin</a> — but getting there takes work. <a href=""https://www.refinery29.com/en-us/the-ordinary-uv-filters-spf-45-sunscreen"">From applying sunscreen</a> to <a href=""https://www.refinery29.com/en-us/retinal-skincare-benefits"">being religious with retinol</a>, chances are they’ve already nailed their <a href=""https://www.refinery29.com/en-us/skincare-products-you-dont-need"">skincare lineup</a>. Still, even the best routines can benefit from a little extra help.<br /><br />Skincare tools have come a long way since the days of <a href=""https://www.refinery29.com/en-us/2020/05/9840694/microneedling-at-home-safety-risks"">intimidating dermarollers</a>. Today’s options include <a href=""https://www.refinery29.com/en-us/led-face-mask-red-light-skin-benefits"">LED masks</a> that help heal and rejuvenate skin with red, infrared, and blue light, <a href=""https://www.refinery29.com/en-au/microcurrent-facial"">microcurrent devices</a> that tone and boost radiance, and cryotherapy tools that de-puff in minutes.<br /><br />So help them become their own facialist with these 10 skincare tools, starting at $18, all recommended by our beauty director.<br /><br /><em>All linked products are independently selected by our editors. If you purchase any of these products, we may earn a commission.</em><figure><img height=""1036"" src=""https://www.refinery29.com/images/11949930.png?auto=webp&amp;width=1258&amp;height=1036&amp;quality=85&amp;crop=17:14"" width=""1258"" /><figcaption><h2><a href=""https://go.skimresources.com?id=30283X879131&amp;xs=1&amp;url=https%3A%2F%2Fwww.ulta.com%2Fp%2Ftrinity-smart-microcurrent-facial-toning-starter-kit-pimprod2036661%3F"" rel=""noreferrer noopener"" target=""_blank"">NuFACE Trinity Facial Toning Kit</a><br /></h2><br />They’ll be hard-pressed to find a dermatologist or esthetician who hasn’t tried — and loved — a NuFACE microcurrent facial toning device. Unlike many facial tools that require weeks of consistent use, results are visible immediately. Using low-level electrical currents, it stimulates the facial muscles to create a lifted, tightened effect. The kit also includes two conductive products, allowing the device to glide smoothly over skin without irritation. Snatched jawline, loading.<br /><br /><strong>NuFACE</strong> TRINITY+ Smart Microcurrent Facial Toning Starter Kit, $, available at <a href=""https://go.skimresources.com?id=30283X879131&amp;xs=1&amp;url=https%3A%2F%2Fwww.ulta.com%2Fp%2Ftrinity-smart-microcurrent-facial-toning-starter-kit-pimprod2036661%3F"">Ulta</a></figcaption></figure><figure><img height=""1262"" src=""https://www.refinery29.com/images/11949935.png?auto=webp&amp;width=1242&amp;height=1262&amp;quality=85&amp;crop=621:631"" width=""1242"" /><figcaption><h2><a href=""https://go.skimresources.com?id=30283X879131&amp;xs=1&amp;url=https%3A%2F%2Fwww.ulta.com%2Fp%2Fcryoglow-under-eye-coolingled-anti-aging-skin-clearing-face-mask-pimprod2050546%3Fsku%3D2631334"" rel=""noreferrer noopener"" target=""_blank"">Shark Beauty CryoGlow Under-Eye Cooling+LED Anti-Aging &amp; Skin Clearing Face Mask</a></h2><br /><br />If you really want to impress your giftee, wearing this mask feels akin to a professional facial. It’s packed with red and infrared LED lights that, once absorbed by the skin, activate fibroblasts — the cells responsible for producing collagen and elastin, which keep skin firm, resilient, and hydrated. Red light is also known to <a href=""https://www.refinery29.com/en-us/led-face-mask-red-light-skin-benefits"">help treat breakouts</a> by reducing inflammation and targeting acne-causing bacteria. This mask does all that and more, with the addition of blue light to help calm redness, plus cooling under-eye technology to soothe tired, inflamed skin.<br /><br /><strong>Shark</strong> CryoGlow Under-Eye Cooling+LED Face Mask, $, available at <a href=""https://go.skimresources.com?id=30283X879131&amp;xs=1&amp;url=https%3A%2F%2Fwww.ulta.com%2Fp%2Fcryoglow-under-eye-coolingled-anti-aging-skin-clearing-face-mask-pimprod2050546%3Fsku%3D2631334"">Ulta</a></figcaption></figure><figure><img height=""1026"" src=""https://www.refinery29.com/images/11949938.png?auto=webp&amp;width=1246&amp;height=1026&amp;quality=85&amp;crop=623:513"" width=""1246"" /><figcaption><h2><a href=""https://go.skimresources.com?id=30283X879131&amp;xs=1&amp;url=https%3A%2F%2Fwww.ulta.com%2Fp%2Fcryoroll-ice-roller-pimprod2039864%3Fsku%3D2612549"" rel=""noreferrer noopener"" target=""_blank"">Skin Gym CryoRoll Ice Roller</a></h2><br />The skin-icing trend isn’t going anywhere — just ask Hailey Bieber, who famously dunks her face into a bowl of ice water before red carpet events. While that can get messy, Skin Gym’s CryoRoll Ice Roller streamlines the soothing, skin-awakening ritual. Simply fill it with water and place it in the freezer. Once frozen, remove the lid and glide it over your face to de-puff under-eye bags and refresh tired skin. You can even add a few drops of hyaluronic acid serum to boost hydration.<br /><br /><strong>Skin Gym</strong> CryoRoll Ice Roller, $, available at <a href=""https://go.skimresources.com?id=30283X879131&amp;xs=1&amp;url=https%3A%2F%2Fwww.ulta.com%2Fp%2Fcryoroll-ice-roller-pimprod2039864%3Fsku%3D2612549"">Ulta</a></figcaption></figure><figure><img height=""800"" src=""https://www.refinery29.com/images/11949941.jpg?auto=webp&amp;width=800&amp;height=800&amp;quality=85&amp;crop=1:1"" width=""800"" /><figcaption><h2><a href=""https://go.skimresources.com?id=30283X879131&amp;xs=1&amp;url=https%3A%2F%2Fziipbeauty.com%2Fproducts%2Fziip-halo-microcurrent-device"" rel=""noreferrer noopener"" target=""_blank"">ZIIP Halo Microcurrent Facial Device</a></h2><br /><br />One of the smartest microcurrent facial tools available, this device connects to an app on their phone, allowing them to personalize the current sequence based on their skin's needs — whether it's lifting, firming, or de-puffing. It also comes with a conductor gel for easy gliding, and its ergonomic design makes it super easy to maneuver. We've heard some derms extolling its virtues, and thousands of glowing reviews highlight noticeable improvements in fine lines and sagging skin.<br /><br /><strong>ZIIP</strong> Halo All In One Microcurrent Facial Device, $, available at <a href=""https://go.skimresources.com?id=30283X879131&amp;xs=1&amp;url=https%3A%2F%2Fziipbeauty.com%2Fproducts%2Fziip-halo-microcurrent-device"">Ziip</a></figcaption></figure><figure><img height=""1080"" src=""https://www.refinery29.com/images/11949944.jpg?auto=webp&amp;width=1080&amp;height=1080&amp;quality=85&amp;crop=1:1"" width=""1080"" /><figcaption><h2><a href=""https://go.skimresources.com?id=30283X879131&amp;xs=1&amp;url=https%3A%2F%2Fwww.nordstrom.com%2Fs%2F4-in-1-skin-care-wand%2F7444307%3F"" rel=""noreferrer noopener"" target=""_blank"">Solawave 4-in-1 Radiant Renewal Skincare Wand</a></h2><br /><br />If an LED mask feels a bit out of budget, consider Solawave’s nifty rechargeable wand instead. It combines collagen-boosting red light with microcurrent to energize facial muscles and tighten skin instantly and cumulatively, plus facial massage and a comforting warming sensation. Using it might just be the best three minutes of their day.<br /><br /><strong>Solawave</strong> 4-in-1 Skin Care Wand, $, available at <a href=""https://go.skimresources.com?id=30283X879131&amp;xs=1&amp;url=https%3A%2F%2Fwww.nordstrom.com%2Fs%2F4-in-1-skin-care-wand%2F7444307%3F"">Nordstrom</a></figcaption></figure><figure><img height=""1000"" src=""https://www.refinery29.com/images/11949947.jpg?auto=webp&amp;width=1000&amp;height=1000&amp;quality=85&amp;crop=1:1"" width=""1000"" /><figcaption><h2><a href=""https://go.skimresources.com?id=30283X879131&amp;xs=1&amp;url=https%3A%2F%2Fwww.nordstrom.com%2Fs%2Fsmartappguided-cool-warm-duo-eye-massager-7-in-1%2F8623672"" rel=""noreferrer noopener"" target=""_blank"">GESKE SmartAppGuided Cool &amp; Warm Duo Eye Massager</a></h2><br />If they’re always complaining about feeling — and looking — tired, they’ll love Geske’s cool-and-warm eye massagers. Using them is simple: immerse the tools in warm water for a comforting, under-eye “hug,” or pop them in the fridge for a refreshing cool-down. The liquid inside the tools efficiently conducts heat or cold for maximum effect.<br /><br /><strong>GESKE</strong> SmartAppGuided Cool &amp; Warm Duo Eye Massager | 7 in 1, $, available at <a href=""https://go.skimresources.com?id=30283X879131&amp;xs=1&amp;url=https%3A%2F%2Fwww.nordstrom.com%2Fs%2Fsmartappguided-cool-warm-duo-eye-massager-7-in-1%2F8623672"">Nordstrom</a></figcaption></figure><figure><img height=""1280"" src=""https://www.refinery29.com/images/11949950.jpg?auto=webp&amp;width=1280&amp;height=1280&amp;quality=85&amp;crop=1:1"" width=""1280"" /><figcaption><h2><a href=""https://go.skimresources.com?id=30283X879131&amp;xs=1&amp;url=https%3A%2F%2Fwww.nordstrom.com%2Fs%2Fuplift-neck-sculptsure-set-166-value%2F7433285%3F"" rel=""noreferrer noopener"" target=""_blank"">Nurse Jamie UpLift Neck Sculpt'sure Set<br /></a></h2><br />Nurse Jamie’s UpLift mimics the pummeling magic fingers of any facialist — they’ll wonder how they ever lived without it. Thanks to 24 massaging stones, rolling it over the jawline instantly releases tight muscles, leaving the face feeling lighter and your giftee more relaxed. The set also comes with a firming cream to hydrate and nourish skin as they go.<br /><br /><strong>Nurse Jamie</strong> UpLift Neck Sculpt'sure Set, $, available at <a href=""https://go.skimresources.com?id=30283X879131&amp;xs=1&amp;url=https%3A%2F%2Fwww.nordstrom.com%2Fs%2Fuplift-neck-sculptsure-set-166-value%2F7433285%3F"">Nordstrom</a></figcaption></figure><figure><img height=""950"" src=""https://www.refinery29.com/images/11949953.png?auto=webp&amp;width=1266&amp;height=950&amp;quality=85&amp;crop=633:475"" width=""1266"" /><figcaption><h2><a href=""https://go.skimresources.com?id=30283X879131&amp;xs=1&amp;url=https%3A%2F%2Fwww.nordstrom.com%2Fs%2Ffaq-201-led-face-mask%2F8468660%3F"" rel=""noreferrer noopener"" target=""_blank"">FOREO FAQ™ 201 LED Face Mask<br /></a></h2><br />Foreo’s FAQ LED mask is the talk of every beauty editor group chat — it’s that weightless. Made of soft, comfortable silicone, the mask is studded with 600 red, green, and blue LED lights to boost collagen and elastin, reduce redness, and gradually brighten skin. Even better? It’s completely wireless, so you won’t get tangled up while relaxing, and the generous eye openings let you read or watch TV without emerging bleary-eyed.<br /><br /><strong>Foreo</strong> FAQ™ 201 LED Face Mask, $, available at <a href=""https://go.skimresources.com?id=30283X879131&amp;xs=1&amp;url=https%3A%2F%2Fwww.nordstrom.com%2Fs%2Ffaq-201-led-face-mask%2F8468660%3F"">Nordstrom</a></figcaption></figure><figure><img height=""956"" src=""https://www.refinery29.com/images/11949956.png?auto=webp&amp;width=1266&amp;height=956&amp;quality=85&amp;crop=633:478"" width=""1266"" /><figcaption><h2><a href=""https://go.skimresources.com?id=30283X879131&amp;xs=1&amp;url=https%3A%2F%2Fwww.nordstrom.com%2Fs%2Fcomplete-at-home-facial-spa-bundle-facial-steamer-7-in-1-led-light-therapy-device-hydrocolloid-pimple-patches%2F8662053%3F"" rel=""noreferrer noopener"" target=""_blank"">PURSONIC Complete At-Home Facial Spa Bundle</a></h2><br /><br />Give them the gift of a facial — every day if they like — with Pursonic’s at-home facial spa bundle. It includes a soothing facial steamer that leaves skin dewy, plump, and hydrated, a red light therapy wand to boost skin suppleness over time, and hydrocolloid pimple patches to help breakouts heal quickly.<br /><br /><strong>Pursonic</strong> Complete At-Home Facial Spa Bundle, $, available at <a href=""https://go.skimresources.com?id=30283X879131&amp;xs=1&amp;url=https%3A%2F%2Fwww.nordstrom.com%2Fs%2Fcomplete-at-home-facial-spa-bundle-facial-steamer-7-in-1-led-light-therapy-device-hydrocolloid-pimple-patches%2F8662053%3F"">Nordstrom</a></figcaption></figure><figure><img height=""1400"" src=""https://www.refinery29.com/images/11949959.jpg?auto=webp&amp;width=1400&amp;height=1400&amp;quality=85&amp;crop=1:1"" width=""1400"" /><figcaption><h2><a href=""https://go.skimresources.com?id=30283X879131&amp;xs=1&amp;url=https%3A%2F%2Fwww.sephora.com%2Fproduct%2Ffacial-pro-skin-tool-P519618"" rel=""noreferrer noopener"" target=""_blank"">Shark™ FacialPro™ Glow Glow-Boosting At-Home Facial System</a></h2><br /><br />If you’ve got a bit more to spend, it has to be Shark’s FacialPro. This clever device comes with interchangeable liquid tanks and multiple attachments that deliver results similar to a 90-minute professional facial. That includes a cooling-and-warming depuffing massager, an exfoliating tip, and a Hydro Infuse stage that drenches skin in an exfoliating, hydrating serum. And that’s just the beginning. For anyone serious about achieving glass skin in 2026, this will get them there.<br /><br /><strong>Shark</strong> Shark™ FacialPro™ Glow Glow-Boosting At-Home Facial, $, available at <a href=""https://go.skimresources.com?id=30283X879131&amp;xs=1&amp;url=https%3A%2F%2Fwww.sephora.com%2Fproduct%2Ffacial-pro-skin-tool-P519618"">Sephora</a></figcaption></figure><p><strong>Like what you see? How about some more R29 goodness, right here?</strong></p><p><a href=""https://www.refinery29.com/en-us/best-beauty-makeup-skincare-gifts?utm_source=rss&amp;utm_medium=rss_linkback1"">21 Beauty Gifts For The Friend Who Has Everything</a></p><p><a href=""https://www.refinery29.com/en-us/best-hair-products-tools-gifts?utm_source=rss&amp;utm_medium=rss_linkback2"">21 Gifts For The Person With Amazing Hair</a></p><p><a href=""https://www.refinery29.com/en-us/free-people-under-100-gifts?utm_source=rss&amp;utm_medium=rss_linkback3"">The Best Under-$100 Free People Gifts For Everyone</a></p>",
