source,domain,url,created_utc,title,text
rss,www.yankodesign.com,https://www.yankodesign.com/2025/10/11/everlanes-everpuff-is-the-jacket-that-never-dies/?utm_source=rss&utm_medium=rss&utm_campaign=everlanes-everpuff-is-the-jacket-that-never-dies,1760210124,Everlane’s Everpuff Is The Jacket That Never Dies,"Everlane’s Everpuff Is The Jacket That Never Dies

<p class=""rws-nl-img""><a href=""https://www.yankodesign.com/2025/10/11/everlanes-everpuff-is-the-jacket-that-never-dies/""><img alt="""" class=""attachment-post-thumbnail size-post-thumbnail wp-post-image"" height=""960"" src=""https://www.yankodesign.com/images/design_news/2025/10/everlanes-everpuff-is-the-jacket-that-never-dies/everpuff-00.jpg"" width=""1280"" /></a></p><h2 class=""rws-nl-title"" style=""text-align: center;"">Everlane&#8217;s Everpuff Is The Jacket That Never Dies</h2><div class=""rws-nl-excerpt"">The puffer jacket is a winter staple for a lot of places that experiences really cold weather. But most of the ones in the market...</div>"
rss,www.yankodesign.com,https://www.yankodesign.com/2025/10/11/portalgraph-just-killed-3d-glasses-with-this-award-winning-display/?utm_source=rss&utm_medium=rss&utm_campaign=portalgraph-just-killed-3d-glasses-with-this-award-winning-display,1760203239,Portalgraph Just Killed 3D Glasses With This Award-Winning Display,"Portalgraph Just Killed 3D Glasses With This Award-Winning Display

<p class=""rws-nl-img""><a href=""https://www.yankodesign.com/2025/10/11/portalgraph-just-killed-3d-glasses-with-this-award-winning-display/""><img alt="""" class=""attachment-post-thumbnail size-post-thumbnail wp-post-image"" height=""960"" src=""https://www.yankodesign.com/images/design_news/2025/10/portalgraph-just-killed-3d-glasses-with-this-award-winning-display/portalgraph-02.jpg"" width=""1280"" /></a></p><h2 class=""rws-nl-title"" style=""text-align: center;"">Portalgraph Just Killed 3D Glasses With This Award-Winning Display</h2><div class=""rws-nl-excerpt"">3D visualization has become a necessary evil that most designers secretly hate. Want to preview your architectural model in three dimensions? Better strap on a...</div>"
rss,www.yankodesign.com,https://www.yankodesign.com/2025/10/11/your-ikea-couch-is-dead-5-sculptural-pieces-that-actually-spark-joy/?utm_source=rss&utm_medium=rss&utm_campaign=your-ikea-couch-is-dead-5-sculptural-pieces-that-actually-spark-joy,1760196008,Your IKEA Couch Is Dead: 5 Sculptural Pieces That Actually Spark Joy,"Your IKEA Couch Is Dead: 5 Sculptural Pieces That Actually Spark Joy

<p class=""rws-nl-img""><a href=""https://www.yankodesign.com/2025/10/11/your-ikea-couch-is-dead-5-sculptural-pieces-that-actually-spark-joy/""><img alt="""" class=""attachment-post-thumbnail size-post-thumbnail wp-post-image"" height=""960"" src=""https://www.yankodesign.com/images/design_news/2025/10/your-ikea-couch-is-dead-5-sculptural-pieces-that-actually-spark-joy/Sculptural-Furniture-Design_spark-joy_10.jpg"" width=""1280"" /></a></p><h2 class=""rws-nl-title"" style=""text-align: center;"">Your IKEA Couch Is Dead: 5 Sculptural Pieces That Actually Spark Joy</h2><div class=""rws-nl-excerpt"">When designing a home that genuinely reflects your personality, it is natural to focus on color schemes, furniture layouts, and curated decor. These elements shape...</div>"
rss,www.yankodesign.com,https://www.yankodesign.com/2025/10/11/moma-and-mattel-give-high-art-masterpieces-a-pop-culture-makeover/?utm_source=rss&utm_medium=rss&utm_campaign=moma-and-mattel-give-high-art-masterpieces-a-pop-culture-makeover,1760188816,MoMA and Mattel give high art masterpieces a pop culture makeover,"MoMA and Mattel give high art masterpieces a pop culture makeover

<p class=""rws-nl-img""><a href=""https://www.yankodesign.com/2025/10/11/moma-and-mattel-give-high-art-masterpieces-a-pop-culture-makeover/""><img alt="""" class=""attachment-post-thumbnail size-post-thumbnail wp-post-image"" height=""960"" src=""https://www.yankodesign.com/images/design_news/2025/10/moma-and-mattel-give-high-art-masterpieces-a-pop-culture-makeover/moma-01.jpg"" width=""1280"" /></a></p><h2 class=""rws-nl-title"" style=""text-align: center;"">MoMA and Mattel give high art masterpieces a pop culture makeover</h2><div class=""rws-nl-excerpt"">Whenever I visit museums, I always enjoy looking at the artworks, of course. But sometimes, I wish I could bring home a replica or even...</div>"
rss,www.yankodesign.com,https://www.yankodesign.com/2025/10/11/10-best-smartwatches-to-consider-in-october-2025-find-the-perfect-wearable-for-you/?utm_source=rss&utm_medium=rss&utm_campaign=10-best-smartwatches-to-consider-in-october-2025-find-the-perfect-wearable-for-you,1760182819,10 Best Smartwatches To Consider In October 2025: Find The Perfect Wearable For You,"10 Best Smartwatches To Consider In October 2025: Find The Perfect Wearable For You

<p class=""rws-nl-img""><a href=""https://www.yankodesign.com/2025/10/11/10-best-smartwatches-to-consider-in-october-2025-find-the-perfect-wearable-for-you/""><img alt="""" class=""attachment-post-thumbnail size-post-thumbnail wp-post-image"" height=""960"" src=""https://www.yankodesign.com/images/design_news/2025/10/smartwatches-of-oct/10_best_smartwatches_october_yanko_design_hero.jpg"" width=""1280"" /></a></p><h2 class=""rws-nl-title"" style=""text-align: center;"">10 Best Smartwatches To Consider In October 2025: Find The Perfect Wearable For You</h2><div class=""rws-nl-excerpt"">Smartwatches aren’t just wrist accessories anymore; they’re powerful, purpose-driven extensions of your lifestyle. Whether you’re an athlete, a gamer, a style enthusiast, or simply someone...</div>"
rss,www.yankodesign.com,https://www.yankodesign.com/2025/10/10/this-titanium-edc-knife-has-3-opening-styles-and-costs-just-159/?utm_source=rss&utm_medium=rss&utm_campaign=this-titanium-edc-knife-has-3-opening-styles-and-costs-just-159,1760147152,This Titanium EDC Knife Has 3 Opening Styles and Costs Just $159,"This Titanium EDC Knife Has 3 Opening Styles and Costs Just $159

<p class=""rws-nl-img""><a href=""https://www.yankodesign.com/2025/10/10/this-titanium-edc-knife-has-3-opening-styles-and-costs-just-159/""><img alt="""" class=""attachment-post-thumbnail size-post-thumbnail wp-post-image"" height=""960"" src=""https://www.yankodesign.com/images/design_news/2025/10/this-titanium-edc-knife-has-3-opening-styles-and-costs-just-159/the-scarab-2-0-ti-carbon-edc-knife-04.jpg"" width=""1280"" /></a></p><h2 class=""rws-nl-title"" style=""text-align: center;"">This Titanium EDC Knife Has 3 Opening Styles and Costs Just $159</h2><div class=""rws-nl-excerpt"">The problem with most EDC knives is that they&#8217;re either pretty to look at or actually useful, rarely both. Cheap materials make them look tacky,...</div>"
rss,www.yankodesign.com,https://www.yankodesign.com/2025/10/10/dji-just-launched-a-secret-camera-brand-to-dodge-us-tariffs-heres-where-to-buy-it/?utm_source=rss&utm_medium=rss&utm_campaign=dji-just-launched-a-secret-camera-brand-to-dodge-us-tariffs-heres-where-to-buy-it,1760142640,DJI Just Launched a Secret Camera Brand to Dodge US Tariffs (Here’s Where To Buy It),"DJI Just Launched a Secret Camera Brand to Dodge US Tariffs (Here’s Where To Buy It)

<p class=""rws-nl-img""><a href=""https://www.yankodesign.com/2025/10/10/dji-just-launched-a-secret-camera-brand-to-dodge-us-tariffs-heres-where-to-buy-it/""><img alt="""" class=""attachment-post-thumbnail size-post-thumbnail wp-post-image"" height=""960"" src=""https://www.yankodesign.com/images/design_news/2025/10/dji-is-absolutely-trolling-the-us-tariff-regime-with-its-secret-new-camera-company/dji_xtra_camera_tariffs_1.jpeg"" width=""1280"" /></a></p><h2 class=""rws-nl-title"" style=""text-align: center;"">DJI Just Launched a Secret Camera Brand to Dodge US Tariffs (Here&#8217;s Where To Buy It)</h2><div class=""rws-nl-excerpt"">There&#8217;s a new camera brand in town called Xtra, and it&#8217;s selling cameras that look exactly like DJI&#8217;s most popular models, except without the tariff...</div>"
rss,www.yankodesign.com,https://www.yankodesign.com/2025/10/10/this-tiny-house-looks-impossibly-small-outside-but-hides-a-full-sewing-studio-inside/?utm_source=rss&utm_medium=rss&utm_campaign=this-tiny-house-looks-impossibly-small-outside-but-hides-a-full-sewing-studio-inside,1760139034,This Tiny House Looks Impossibly Small Outside But Hides A Full Sewing Studio Inside,"This Tiny House Looks Impossibly Small Outside But Hides A Full Sewing Studio Inside

<p class=""rws-nl-img""><a href=""https://www.yankodesign.com/2025/10/10/this-tiny-house-looks-impossibly-small-outside-but-hides-a-full-sewing-studio-inside/""><img alt="""" class=""attachment-post-thumbnail size-post-thumbnail wp-post-image"" height=""960"" src=""https://www.yankodesign.com/images/design_news/2025/10/nouvelle-dans/nouvelle_dans_yanko_design_01.jpg"" width=""1280"" /></a></p><h2 class=""rws-nl-title"" style=""text-align: center;"">This Tiny House Looks Impossibly Small Outside But Hides A Full Sewing Studio Inside</h2><div class=""rws-nl-excerpt"">Baluchon has done it again. The French tiny house builder, widely regarded as the most innovative craftsman in the industry, has just revealed their latest...</div>"
rss,www.yankodesign.com,https://www.yankodesign.com/2025/10/10/ikea-transforms-its-most-beloved-chair-into-something-completely-different/?utm_source=rss&utm_medium=rss&utm_campaign=ikea-transforms-its-most-beloved-chair-into-something-completely-different,1760135495,IKEA Transforms Its Most Beloved Chair Into Something Completely Different,"IKEA Transforms Its Most Beloved Chair Into Something Completely Different

<p class=""rws-nl-img""><a href=""https://www.yankodesign.com/2025/10/10/ikea-transforms-its-most-beloved-chair-into-something-completely-different/""><img alt="""" class=""attachment-post-thumbnail size-post-thumbnail wp-post-image"" height=""960"" src=""https://www.yankodesign.com/images/design_news/2025/10/ikea-transforms-its-most-beloved-chair-into-something-completely-different/IKEA-POANG-1.jpg"" width=""1280"" /></a></p><h2 class=""rws-nl-title"" style=""text-align: center;"">IKEA Transforms Its Most Beloved Chair Into Something Completely Different</h2><div class=""rws-nl-excerpt"">IKEA has fundamentally reimagined its most enduring furniture icon, and the result is nothing short of transformative. The POANG armchair, a global bestseller that has...</div>"
rss,www.yankodesign.com,https://www.yankodesign.com/2025/10/10/avg-batmobile-tribute-is-a-mercedes-benz-cl55-amg-turned-into-gothams-ultimate-street-machine/?utm_source=rss&utm_medium=rss&utm_campaign=avg-batmobile-tribute-is-a-mercedes-benz-cl55-amg-turned-into-gothams-ultimate-street-machine,1760131806,AVG Batmobile Tribute is a Mercedes-Benz CL55 AMG turned into Gotham’s Ultimate Street Machine,"AVG Batmobile Tribute is a Mercedes-Benz CL55 AMG turned into Gotham’s Ultimate Street Machine

<p class=""rws-nl-img""><a href=""https://www.yankodesign.com/2025/10/10/avg-batmobile-tribute-is-a-mercedes-benz-cl55-amg-turned-into-gothams-ultimate-street-machine/""><img alt="""" class=""attachment-post-thumbnail size-post-thumbnail wp-post-image"" height=""960"" src=""https://www.yankodesign.com/images/design_news/2025/10/avgs-batmobile-tribute-turns-mercedes-benz-cl55-amg-into-gothams-ultimate-street-machine/AVG-Batmobile-tribute-5.jpg"" width=""1280"" /></a></p><h2 class=""rws-nl-title"" style=""text-align: center;"">AVG Batmobile Tribute is a Mercedes-Benz CL55 AMG turned into Gotham’s Ultimate Street Machine</h2><div class=""rws-nl-excerpt"">In a move that would make Bruce Wayne proud, the AVG Batmobile Tribute roars out of the shadows as a street-legal blend of Gotham grit...</div>"
rss,www.archdaily.com,https://www.archdaily.com/1034561/sister-houses-simon-albina,1760194800,Sister Houses / Simón Albina,"Sister Houses / Simón Albina

<p>The houses are located in the <a href=""https://www.archdaily.com/tag/city-bell"">City Bell</a> neighborhood of La Plata, at the end of a street that intersects with the Ecological Park. They share a pedestrian and vehicular access between the two front lots and were constructed in a mirrored fashion.</p>"
rss,www.archdaily.com,https://www.archdaily.com/1034663/the-court-theatre-haworth-tompkins,1760180400,The Court Theatre / Haworth Tompkins,"The Court Theatre / Haworth Tompkins

<p><em>Sustainability</em> — As a long-term partnership between <a href=""https://www.archdaily.com/tag/christchurch"">Christchurch</a> City Council and The Court Theatre sustainability was from the outset an underlying driver for the project. The following summarises key aspects of sustainability incorporated into the building's design.</p>"
rss,www.archdaily.com,https://www.archdaily.com/1034656/house-ld-sea-arquitectos,1760173200,House LD / SEA Arquitectos,"House LD / SEA Arquitectos

<p>The plot has excellent views towards A Coru&ntilde;a to the north. We created a wind protection area from the dominant northeast winds that opens to the south towards the porch area.</p>"
rss,www.archdaily.com,https://www.archdaily.com/1034774/scroll-and-stroll-how-social-media-is-rewriting-architectural-cultural-tourism,1760167800,Scroll & Stroll: How Social Media Is Rewriting Architectural Cultural Tourism,"Scroll & Stroll: How Social Media Is Rewriting Architectural Cultural Tourism

<p>Historically—like other<a href=""https://www.archdaily.com/998949/12-cultural-spaces-that-owe-their-power-to-adaptive-reuse?ad_source=search&amp;ad_medium=search_result_articles""> cultural forms</a>—architecture has been documented, shared, and promoted primarily through print. Books, journals, and magazines carried the discipline's arguments and images, and because architectural practice relies so heavily on visual communication, printed<a href=""https://www.archdaily.com/1032916/detail-inspiration-the-architects-hub-for-projects-imagery-and-detailed-drawings?ad_source=search&amp;ad_medium=search_result_articles""> journals</a> created a bridge between academic publications and commercial magazines. Through the postwar decades, beautifully produced volumes curated a collective point of view, signaling what the field broadly considered discussion-worthy or exemplary.</p>"
rss,www.archdaily.com,https://www.archdaily.com/1034634/palazzo-mazzini-studio-bressan,1760162400,Palazzo Mazzini / Studio Bressan,"Palazzo Mazzini / Studio Bressan

<p>The renovation project of Palazzo Mazzini in <a href=""https://www.archdaily.com/tag/montebelluna"">Montebelluna</a> was driven by the intention to breathe new life into an existing building located in the city center, transforming it into an elegant and contemporary presence that engages with its urban surroundings. The studio carefully oversaw both interior and exterior design, shaping every detail within a unified project that creates a dialogue between private spaces and architectural image.</p>"
rss,www.archdaily.com,https://www.archdaily.com/1034833/the-chapel-of-st-therese-of-lisieux-bull-osullivan-architecture,1760148000,The Chapel of St. Thérèse of Lisieux / Bull O’Sullivan Architecture,"The Chapel of St. Thérèse of Lisieux / Bull O’Sullivan Architecture

<p>The Chapel of St. Thérèse of Lisieux sits on a hillside overlooking <a href=""https://www.archdaily.com/tag/lyttelton"">Lyttelton</a> Harbour, Whakaraupō. It is a private space open to the public daily, serving as a place of worship, reflection, and architectural engagement. The Chapel was constructed in 2025 by Bull O'Sullivan Architecture as a gift to the people of Christchurch. Bull O'Sullivan is a New Zealand practice that believes in quality and optimism at the most personal level.</p>"
rss,www.archdaily.com,https://www.archdaily.com/1034924/timeless-house-kaa-design-plus-h2,1760122800,Timeless House / KAA DESIGN  + H2,"Timeless House / KAA DESIGN  + H2

<p>The project is located in a small alley of Saigon – a place that embodies the city's distinct climate and culture: sudden rains, scorching sunny days, and the constant hum of traffic day and night. At TIMELESS HOUSE, our approach was to return to nature and rawness, creating a relaxing living space where family members can connect, and where working areas remain open and filled with energy.</p>"
rss,www.archdaily.com,https://www.archdaily.com/1034261/retrofit-of-santa-maria-school-carvalho-terra-arquitetos,1760108400,Retrofit of Santa Maria School / Carvalho Terra Arquitetos,"Retrofit of Santa Maria School / Carvalho Terra Arquitetos

<p>The Early Childhood Education at Santa Maria School operates in buildings constructed at the end of the 1960s, which were expanded and renovated in the 2000s. The proposal was to develop a retrofit project to <strong>modernize and update the spaces</strong> in order to meet new technological demands, uses, and pedagogical practices, while ensuring the preservation of the architectural features that are part of the school's identity.</p>"
rss,www.archdaily.com,https://www.archdaily.com/1034071/edge-hafencity-henn,1760097600,EDGE HafenCity / HENN,"EDGE HafenCity / HENN

<p>A multi-faceted new urban neighborhood for living, working, and leisure is evolving in the western part of Hamburg's HafenCity on former industrial port sites. The recently completed EDGE HafenCity project is another important cornerstone of the Elbbrücken neighborhood. This energy-efficient office building actively fosters interaction and collaboration by bringing its users together while also being open to visitors and locals.</p>"
rss,www.archdaily.com,https://www.archdaily.com/1034404/115ari-single-family-home-between-party-walls-in-sabadell-vallribera-noray-arquitectes,1760090400,115ARI Single-Family Home Between Party Walls in Sabadell / Vallribera Noray Arquitectes,"115ARI Single-Family Home Between Party Walls in Sabadell / Vallribera Noray Arquitectes

<p>When the family showed us the lot for the first time, they did so with some skepticism. <strong>""Are you sure a house can fit here? It's a very narrow lot,""</strong> they said. But beyond those doubts, they also saw that this parcel offered them the opportunity to change their lives, and they entrusted us with the challenge.</p>"
rss,www.archdaily.com,https://www.archdaily.com/1034907/beyond-private-dining-exploring-the-communal-table-as-public-space-infrastructure,1760081400,Beyond Private Dining: Exploring the Communal Table as Public Space Infrastructure,"Beyond Private Dining: Exploring the Communal Table as Public Space Infrastructure

<p>The habit of <a href=""https://www.archdaily.com/973763/dining-rooms-their-importance-and-possibilities-in-plans"" rel=""noopener"" target=""_blank"">sitting at the table and sharing a specific moment</a> with other people has been present for centuries in the most diverse cultures. The Greek Symposium, Roman Convivium, Medieval Feasts and Banquets, and Parisian Salons are just a few examples of how this custom was historically built and has been relevant in social and political negotiations, intellectual discussions, and philosophical debates.</p>"
rss,www.archdaily.com,https://www.archdaily.com/1034568/salinas-del-rey-water-sports-center-deb-plus-el-equipo-mazzanti,1760079600,Salinas del Rey Water Sports Center / DEB + El Equipo Mazzanti,"Salinas del Rey Water Sports Center / DEB + El Equipo Mazzanti

<p>The beaches of Salinas del Rey are considered the second-best location internationally for kitesurfing due to the excellent bioclimatic and atmospheric conditions of the area. This project arises from <strong>the need to install high-quality sports equipment to meet the tourist demand of water sports enthusiasts.</strong></p>"
rss,www.archdaily.com,https://www.archdaily.com/1034592/architecture-at-a-turning-point-working-smarter-with-ai,1760078700,"Architecture at a Turning Point, Working Smarter with AI","Architecture at a Turning Point, Working Smarter with AI

<p>While a book or piece of music can be easily set aside if it doesn't capture our interest, architecture is different. A building endures for decades, and it shapes the landscape and influences the lives of its occupants for years to come. This permanence brings with it a unique set of challenges: architects must design spaces that impact collective life, often under tight deadlines, limited budgets, and significant pressure. In addition to navigating complex regulations and coordinating construction, architects face the misconception that design is simple, or that anyone could do it. The constant balancing act between quality, cost, and speed often leads to sacrifices — whether in time, health, or the integrity of the project itself. This cycle not only wears down the profession but diminishes society's understanding of the true value of design.</p>"
rss,www.archdaily.com,https://www.archdaily.com/1034922/madelon-vriesendorp-co-founder-of-oma-receives-the-2025-soane-medal,1760077800,"Madelon Vriesendorp, Co-Founder of OMA, Receives the 2025 Soane Medal","Madelon Vriesendorp, Co-Founder of OMA, Receives the 2025 Soane Medal

<p>Dutch artist <a href=""https://www.archdaily.com/tag/madelon-vriesendorp"">Madelon Vriesendorp</a> has been named the recipient of the 2025 <a href=""https://www.archdaily.com/tag/soane-medal/page/1"">Soane Medal</a>, becoming the first UK-based female <a href=""https://www.archdaily.com/tag/artist"">artist</a> to receive the award since its launch in 2017. A co-founder of <a href=""https://www.archdaily.com/tag/oma"">Office for Metropolitan Architecture (OMA)</a>, <a href=""https://www.archdaily.com/tag/madelon-vriesendorp"">Vriesendorp</a> is widely recognized for her surrealist and humorous visual language that has shaped how <a href=""https://www.archdaily.com/tag/modern"">modern</a> and <a href=""https://www.archdaily.com/tag/postmodern"">postmodern</a> <a href=""https://www.archdaily.com/tag/architecture"">architecture</a> is represented and understood. Her work, which blends playfulness with critical thought, has provided <a href=""https://www.archdaily.com/tag/architecture"">architecture</a> with vivid, memorable imagery that continues to influence generations of <a href=""https://www.archdaily.com/tag/architects"">architects</a>.</p>"
rss,www.archdaily.com,https://www.archdaily.com/1034686/sagamore-north-cottage-akb-architects,1760076000,Sagamore North Cottage / Akb Architects,"Sagamore North Cottage / Akb Architects

<p>Located on an island near the water's edge, this all-season family cottage was designed as a <strong>private refuge, hidden from view while maintaining a strong connection to the raw beauty of its Muskoka</strong>, Ontario, surroundings. An existing dock and boathouse — designed by the same architecture firm and widely published — continually draws curious boaters uncomfortably close to shore. This unintended attention has made privacy a key consideration for the design of the cottage.</p>"
rss,www.archdaily.com,https://www.archdaily.com/1034908/shop-architects-completes-first-stage-of-hudsons-detroit-mixed-use-development,1760074200,SHoP Architects Completes First Stage of Hudson’s Detroit Mixed-Use Development,"SHoP Architects Completes First Stage of Hudson’s Detroit Mixed-Use Development

<p><a href=""https://www.archdaily.com/city/detroit"" rel=""noopener"" target=""_blank"">Detroit</a>-based Bedrock development group has announced the completion of the first phase of its Hudson's Detroit<a href=""https://www.archdaily.com/category/mixed-use-architecture"" rel=""noopener"" target=""_blank""> mixed-use project </a>in the city center. <a href=""https://www.archdaily.com/806091/shop-unveils-plans-for-detroits-tallest-tower-on-historic-downtown-site"" rel=""noopener"" target=""_blank"">The project was first unveiled in 2017</a>, when the company presented plans for a 1.2-million-square-foot development designed by <a href=""https://www.archdaily.com/office/shop-architects"" rel=""noopener"" target=""_blank"">SHoP Architects</a> to be built on one of downtown Detroit's long-abandoned sites, formerly occupied by the J.L. Hudson's Department Store. Once the tallest department store in the world and a central gathering place for the city throughout much of the 20th century, the site has now been reimagined as a contemporary urban destination. After nearly a decade of planning and construction, Hudson's Detroit aims to bring new activity and <a href=""https://www.archdaily.com/tag/public-space"" rel=""noopener"" target=""_blank"">public space</a> to a location emblematic of the city's commercial and cultural past.</p>"
rss,www.archdaily.com,https://www.archdaily.com/1034921/from-iran-to-argentina-9-unbuilt-contemporary-residences-exploring-form-context-and-identity,1760068800,"From Iran to Argentina: 9 Unbuilt Contemporary Residences Exploring Form, Context, and Identity","From Iran to Argentina: 9 Unbuilt Contemporary Residences Exploring Form, Context, and Identity

<p>Across geographies and generations, architects are rethinking the idea of home, balancing personal expression, contextual sensitivity, and material clarity. These contemporary residential proposals, <a href=""https://www.archdaily.com/contact"">submitted by the ArchDaily community</a>, reveal how the house continues to evolve as both an architectural statement and an intimate landscape for living. From the sculptural and futuristic to the grounded and vernacular, they explore how built form balances between identity, environment, and lifestyle in an increasingly complex world.</p>"
