source,query,url,created_utc,title,text
youtube,interior design trends,https://www.youtube.com/watch?v=murbbMnD2E0,1778156942,home interior design work 🥰#youtubeshorts #viral #viralvideo #foryou #trending #shorts #short,home interior design work #youtubeshorts #viral #viralvideo #foryou #trending #shorts #short3bhk interior design best interior ...
youtube,interior design trends,https://www.youtube.com/watch?v=LoJvxjIl1mI,1778156006,Casa Decor left us with one clear idea,"Casa Decor left us with one clear idea: today's interior design is about emotion. More organic spaces, textured materials, curved ..."
youtube,interior design trends,https://www.youtube.com/watch?v=rFr28YaLMkc,1778155553,TOP 20 Luxury TV Wall Design Trends 2026: Modern TV Unit Design &amp; Stylish TV Wall Decor Ideas,TOP 20 Luxury TV Wall Design Trends 2026: Modern TV Unit Design & Stylish TV Wall Decor Ideas Looking for the ultimate ...
youtube,interior design trends,https://www.youtube.com/watch?v=JfWx9eHmUC4,1778155238,Interior Design Trends to AVOID in 2026 (What&#39;s Already Outdated),"Not every 2026 interior design trend is worth following. In this video, I reveal the trends you should avoid — and what to do instead ..."
youtube,interior design trends,https://www.youtube.com/watch?v=4o61ED9s6EM,1778153410,"Seamless finishes, smart storage, flawless installation — the art of modern kitchen design.","In this video, we're exploring the art of interior design with practical tips and creative ideas to transform your space. With over 10 ..."
youtube,interior design trends,https://www.youtube.com/watch?v=q26Aqd0PRXY,1778152687,Black Ivory Printed Cotton Lumbar Pillow – Mono Sphere #interiordesign #homedecor #homestyling #home,"""   Minimalist Monochrome Elegance | Mono Sphere Lumbar Pillow Cover Upgrade your living space with the sophisticated ..."
youtube,interior design trends,https://www.youtube.com/watch?v=69K9KakoAYM,1778148131,Biophilic design isn’t just a trend. it’s the future of modern living 🌿 #biophilicinteriors,"Biophilic design isn't just a trend. it's the future of modern living As cities grow faster and lives get busier, people are craving ..."
youtube,interior design trends,https://www.youtube.com/watch?v=yaZTcYceDXQ,1778144432,Not Just a Transformation… A Whole New Feeling ✨,"Not just a transformation… a whole new feeling. ✨ Every detail, every texture, and every corner was designed to turn a house into ..."
youtube,interior design trends,https://www.youtube.com/watch?v=pZEVZUKQBUQ,1778143159,#interiordesigntips #designtrends,
youtube,interior design trends,https://www.youtube.com/watch?v=mQjIU8k9xOo,1778141615,Luxury Interior Design Ideas 2026 🏗️ Dream Home Transformation &amp; Modern Decor Trends #interiordesign,"Transforming ordinary spaces into luxurious dream environments that reflect style, comfort & personality! ✨ From elegant living ..."
youtube,interior design trends,https://www.youtube.com/watch?v=x1VIW7UftEk,1778140859,20 Gaudy Living Room Trends That FADED Into 1970s History . ,"The 1970s was the decade that taste forgot—or was it? From conversation pits to shag carpets in the bathroom, we're looking ..."
youtube,interior design trends,https://www.youtube.com/watch?v=aFEJyIiEbjc,1778137200,"как сделать, чтобы интерьер выглядит дорого #дизайнинтерьера",Подписывайся на канал @AlenaaTotskaya чтобы быть в тренде современного дизайна Оставить заявку на дизайн ...
youtube,interior design trends,https://www.youtube.com/watch?v=aVbuMTvo5Bg,1778136583,"Whole-House Customization 2026: Design, Material &amp; Smart Living Trends #cabinet #interiordesign",
youtube,interior design trends,https://www.youtube.com/watch?v=DrA9k-cU2qQ,1778130066,🔥 Wall Panels DIY Installation | Decorative Panels for Stylish Home Design ✨,Wall Panels DIY Installation | Decorative Panels for Stylish Home Design ✨ #3dbudmaterial #wallpanels #decorativepanels ...
youtube,interior design trends,https://www.youtube.com/watch?v=FnYE2GB3okE,1778128643,Imagine the 𝗦𝘁𝗮𝗰𝗸 𝗧𝗿𝗮𝘆 in Red Travertine &amp; Carrara from the 𝗖𝗵𝗮𝗻𝗻𝗲𝗹 𝗖𝗼𝗹𝗹𝗲𝗰𝘁𝗶𝗼𝗻,Imagine the Stack Tray in Red Travertine & Carrara from the Channel Collection styled & situated ...
youtube,interior design trends,https://www.youtube.com/watch?v=JRwjeOIu2Tw,1778119221,dream home design trends | Music Safia #shorts,"dream home design trends | Music Safia #shorts Watch an unbelievable AI home transformation as an old, worn-out house turns ..."
youtube,interior design trends,https://www.youtube.com/watch?v=Kc3te1nOjiY,1778112018,Rotating Unit for Bags in the Wardrobe | Organization Ideas 2026 #interior #shortvideo #viralshorts,Discover the ultimate Beautiful Wardrobe organizing ideas that transforms your Wardrobe into a functional and stylish space.
youtube,interior design trends,https://www.youtube.com/watch?v=OP0qVrzTImI,1778105513,20 Years Later… This Luxury Upgrade Feels Outdated 😳 #shorts,20 years ago this central vacuum system was considered a luxury upgrade Now cordless vacuums make it feel outdated.
youtube,interior design trends,https://www.youtube.com/watch?v=XMAxUuP-nXI,1778101641,200+ Modern Living Room Ideas 2026 | Luxury Furniture &amp; Interior Design Trends,"Looking to transform your living room with modern design ideas for 2026? 🛋️✨ In this video, we explore 200+ living room ..."
youtube,interior design trends,https://www.youtube.com/watch?v=c6TcQsMSxVw,1778096948,Convierte tu Casa con Muros Divisorios Inteligentes TENDENCIAS 2026 #decoration #home #casa,"En el video de hoy se explica qué son los muros divisorios, sus principales características y los diferentes tipos que existen, ..."
youtube,interior design trends,https://www.youtube.com/watch?v=r22fh0_ia_s,1778094046,Top 300+ Creative Landscaping Ideas &amp; Pebblestone Garden Decoration Trends for 2026 🌿✨,"Top 300+ Creative Landscaping Ideas & Pebblestone Garden Decoration Trends for 2026 ✨ In this video, you'll discover the ..."
youtube,interior design trends,https://www.youtube.com/watch?v=0hOAxl89g4g,1778094000,ORGANIC Modern interior DESIGN: Creating a COZY Natural sanctuary (4K),"In this video, we dive deep into the world of Organic Modern Living Room design. Discover how to blend contemporary structure ..."
youtube,interior design trends,https://www.youtube.com/watch?v=aLcC9FRxah0,1778093755,"2026 Home Design Trends, Here&#39;s what&#39;s moving the market","2026 Home Design Trends are Changing After a decade of all-gray interiors and sterile minimalism, buyers are looking for ..."
youtube,interior design trends,https://www.youtube.com/watch?v=mM5k7jrA_Ag,1778093026,What Clients Are Asking For in 2026 | Interior Design Trends We’re Loving,"At Kardinia Interior Design, we're seeing a shift toward homes that feel more personal, layered, and full of character, and we're ..."
youtube,interior design trends,https://www.youtube.com/watch?v=RKc7QZpxwYQ,1778090714,10 Totally Timeless Design Choices,Here are 10 totally timeless design choices. #interiordesigntrends #timelessdesign #homeinspiration.
youtube,home decor ideas,https://www.youtube.com/watch?v=ZL7Co1PLLsM,1778157304,Small space Decor ideas 🪴 #trendingshorts #homedecor,
youtube,home decor ideas,https://www.youtube.com/watch?v=8QKgu78xVmc,1778156288,5 Curtain Styling Tips That Make Your Home Look Expensive | Luxury Interior Design Ideas,Your room may look incomplete because of your curtains ✨ These 5 smart curtain styling tips can instantly make your home look ...
youtube,home decor ideas,https://www.youtube.com/watch?v=cUTp2owNfXc,1778154189,Revolutionary DIY Home Decor Ideas - Transform Your Space,Description: Discover easy and budget-friendly DIY home decor ideas that will transform your living space into a cozy haven!
youtube,home decor ideas,https://www.youtube.com/watch?v=HEIJ_eT9O-8,1778152620,DIY Home Decor || JELLY FISH CRAFT 🪼#shorts #viralshorts #reuse #diy #handmade #crafting #trending,DIY Home Decor || Easy Aesthetic Room Decor Ideas #shorts #viralshorts #homedecor #wallhanging #diy DIY wall hanging idea ...
youtube,home decor ideas,https://www.youtube.com/watch?v=8W70Sq1_9KQ,1778151893,Great Decor Ideas for Your Home P3 #diy #adamrose #construction #design #decor #homedecor #craft,
youtube,home decor ideas,https://www.youtube.com/watch?v=SqrRkOb0dpQ,1778151567,DIY Artificial Bamboo Plant 🌿 | Elegant Home Decor Idea #Shorts #artificialplants #ytshorts #diy #yt,DIY Artificial Bamboo Plant | Elegant Home Decor Idea #Shorts #diy #artificialplants #homedecor #aesthetic #handmade ...
youtube,home decor ideas,https://www.youtube.com/watch?v=gmm6h-mGNT8,1778150641,Luxury Bathroom Design Ideas ✨ | Smart &amp; Organized Bathroom Setup #interiordesign,"اپنے باتھ روم کو دیں ایک لگژری اور ماڈرن لک ✨ Smart storage, premium finishing اور perfect organization کے ساتھ اب آپ کا ..."
youtube,home decor ideas,https://www.youtube.com/watch?v=69jDomgUm6c,1778150670,Kitchen accessories🫶☕️ #homedecorideas #homedecor #kitchentools #glassjars #waterbottle,"Zapai – সাধ্যের মধ্যে স্বপ্ন পূরণ আমরা Zapai থেকে ঘর সাজানো, লাইফস্টাইল, ..."
youtube,home decor ideas,https://www.youtube.com/watch?v=pChzX4n41ao,1778148668,Home Decoration- Interior Design Ideas - #design #home #homedecor #indian #interiordesign #interior,Home Decoration- Interior Design Ideas - #design #home #homedecor #indian #interiordesign #interior For educational ...
youtube,home decor ideas,https://www.youtube.com/watch?v=tbiQ743T5gQ,1778146235,Tiles पर लगाओ ये Tiles Stickers #tiles #tilesstickers #homedecor,Tiles पर लगाओ ये Tiles Stickers #tiles #tilesstickers #homedecor अगर आपकी पुरानी tiles खराब या dull ...
youtube,home decor ideas,https://www.youtube.com/watch?v=Td4yZT5Mt_U,1778145188,Cute Mother&#39;s Day Gift Idea//Best Out Of Waste//Home Decor idea//#diy/#craft/#shorts,
youtube,home decor ideas,https://www.youtube.com/watch?v=7DPXfZk34j8,1778144521,Home decor ✨ #home #decor #ideas #travel #explore #trendingshorts #viralreels #homedecor #beautiful,
youtube,home decor ideas,https://www.youtube.com/watch?v=sPbrR4CMJn0,1778143779,Tem gente que acha isso daqui horrível!!! #DIYHomeDecor#CementCraft#HomeDecorIdeas#RusticDecor #diy,Eu realmente achei que tinha estragado essa toalha… Molhei no cimento sem saber se ia funcionar. No meio do processo ...
youtube,home decor ideas,https://www.youtube.com/watch?v=LupGsegt5j0,1778143420,ice cream stick basket 🧺 ideas #diy #trending #handcraft #homedecor #handmade,ice cream stick basket ideas #diy #trending #handcraft #homedecor #handmade #craftideas #shortreels #shortsfeed ...
youtube,home decor ideas,https://www.youtube.com/watch?v=v7FOwVyFwhg,1778142626,3D Paper Wall Hanging Ideas 💫|#youtubeshorts #viralshort #diy #wallhanging #homedecor #papercraft,
youtube,home decor ideas,https://www.youtube.com/watch?v=PzbHg-PxGTg,1778140414,Revolutionary DIY Home Decor Ideas - Transform Your Space in Days,Description: Discover incredible DIY home decor ideas that will transform your space in just days! From budget-friendly hacks to ...
youtube,home decor ideas,https://www.youtube.com/watch?v=q7AYSMi1VJ0,1778139033,waste material craft ideas/ best out of waste/home decor ideas #shorts #ashortaday #youtubeshorts,waste material craft ideas/ best out of waste/home decor ideas #shorts #ashortaday #youtubeshorts #homedecor #bestoutofwaste ...
youtube,home decor ideas,https://www.youtube.com/watch?v=0CXX_m2vJaM,1778139001,What’s your vibe #interiordesign #homedecor #viral #home #interior #decor #decorideas #homelove,
youtube,home decor ideas,https://www.youtube.com/watch?v=xmoHGWbwBRk,1778138419,Try this diy home decor idea!!🐚✨#diy #subscribe,
youtube,home decor ideas,https://www.youtube.com/watch?v=gYpyKqlFSis,1778137671,Revolutionary DIY Home Decor Ideas - Transform Your Space,Description: Discover incredible DIY home decor ideas that will revolutionize your living space! Learn how to transform your home ...
youtube,home decor ideas,https://www.youtube.com/watch?v=49BSmwfIDjM,1778135401,DIY Home Decor Ideas #diy #shorts #craft #claycraft #youtubeshorts #shortsfeed #airdryclay #decor,DIY Home Decor Ideas #diy #shorts #craft #claycraft #youtubeshorts #shortsfeed #airdryclay #decor #homedecor ...
youtube,home decor ideas,https://www.youtube.com/watch?v=JobndTYpR-c,1778135447,Plants and home #homedecorideas #slowliving #trendingshorts #shortsfeed,Home with plants #homedecorideas #homedecor #easydecor #aestheticroomdecor #indoorplants.
youtube,home decor ideas,https://www.youtube.com/watch?v=VvT8oTvDHls,1778133510,luxury steel door design for home decor ideas 💡 #doormanufacturer #doordesign #gatedesign #steeldoor,
youtube,home decor ideas,https://www.youtube.com/watch?v=2gKWpb4UfLk,1778133213,Moon Table Lamp 🌙 Cozy Aesthetic Room Lighting | Beautiful Bedroom Decor Ideas 2026,Bring the beauty of the moon into your room with this stunning Moon Table Lamp ✨ This aesthetic bedside lamp creates a ...
youtube,home decor ideas,https://www.youtube.com/watch?v=qP6Vqb7KuoE,1778130302,DIY waste cardboard home decor ideas #diy #craft #trendingshorts #youtubeshorts #youtubeshorts,DIY waste cardboard home decor ideas #diy #craft #bestoutofwaste #reuseideas #recyclingideas #reusecrafts #homedecor ...
youtube,small apartment decor,https://www.youtube.com/watch?v=lVcpht7VCqY,1778157478,Ultimate 3D Interior Design Makeover 🔥 | Small Room Transformation | Modern Home Ideas 2026,"Watch the ultimate 3D interior design makeover and see how a small space is transformed into a modern, stylish, and functional ..."
youtube,small apartment decor,https://www.youtube.com/watch?v=dwp2HNpS_DQ,1778155628,Tiny Studio Apartment Makeover | Space-Saving Ideas,"Welcome to Decor Pedia ✨ In this video, we explore amazing Tiny Studio Apartment Makeover | Space-Saving Ideas designed ..."
youtube,small apartment decor,https://www.youtube.com/watch?v=8Xtz3x8Is24,1778155214,Soluções geniais pra quem vive em apê pequeno  #achadinhos #shopee #dicas,Soluções geniais pra quem vive em apê pequeno #achadinhos #dicas #shopee #donadecasa #casapequena ...
youtube,small apartment decor,https://www.youtube.com/watch?v=nL_ncAra2ec,1778153485,Genius Tiny Studio Apartment Makeover Ideas for Small Spaces,Transform your tiny studio apartment into a stylish and functional dream space with these genius makeover ideas for small homes ...
youtube,small apartment decor,https://www.youtube.com/watch?v=bBo2Jl64aKM,1778149832,Quiet Luxury in Paris Inside a Tiny Dream Apartment That Feels Like a Boutique Hotel,"Welcome back to Gelux Home! This video takes you inside a tiny Parisian dream apartment, demonstrating that luxury is about ..."
youtube,small apartment decor,https://www.youtube.com/watch?v=8oTwekhbNDs,1778148024,multi functional space saving furniture for small apartment #shorts,multi functional space saving furniture for small apartment #shorts.
youtube,small apartment decor,https://www.youtube.com/watch?v=kUcL9vxknj0,1778144475,#recreationalvehicle  #travel  #camping #travel trailer camping#automobile,house design plan house design ideas interior design ideas interior design ideas for small house house design planner free ...
youtube,small apartment decor,https://www.youtube.com/watch?v=V2vDXgjRJhE,1778144450,I officially live on this sofa now... ☁️🍕 (My favorite spot!) #sofabed #relax  #homedecor #sofa,"POV: You found the one piece of furniture you'll never want to leave. ✨ ""I like to stay on it"" is an understatement. Whether I'm ..."
youtube,small apartment decor,https://www.youtube.com/watch?v=Dqg78gQMh7Q,1778141319,Grey 3x3m Loft Bed Design Idea for Small Rooms,
youtube,small apartment decor,https://www.youtube.com/watch?v=fcgRkjmnInA,1778127961,Genius Tiny Apartment Decor Ideas to Maximize Every Inch,Discover genius tiny apartment decor ideas that help maximize every inch of your small home without sacrificing comfort or style ...
youtube,small apartment decor,https://www.youtube.com/watch?v=rswdZrNmvP4,1778124168,Genius Tiny Apartment Decor Ideas for a Cozy &amp; Stylish Home,Transform your tiny apartment into a cozy and stylish dream home with these genius decor ideas from HAS Design! In this video ...
youtube,small apartment decor,https://www.youtube.com/watch?v=3fwLTjuF30k,1778118335,Tiny Studio Apartment → Luxury Epoxy Loft Transformation,Watch this unfinished studio apartment transform into a luxury modern loft with a stunning metallic epoxy marble floor. From dusty ...
youtube,small apartment decor,https://www.youtube.com/watch?v=h_I88j2TQE8,1778117671,Cozy Wooden Bookshelf for Bedroom Reading Corners ✨#BedroomDecor #SmallSpaceLiving,"A warm wood bookshelf styled for a cozy bedroom corner, perfect for books, plush toys, and calm everyday storage. This soft ..."
youtube,small apartment decor,https://www.youtube.com/watch?v=KUy1kcMwa3Q,1778112032,Perfect for small spaces or a cozy guest room  Where would you use it? #sofa #furniture #shorts,"From couch mode to bed mode in seconds. Extendable slats make the switch effortless. Perfect for apartments, guest rooms, and ..."
youtube,small apartment decor,https://www.youtube.com/watch?v=JqONo11aGCM,1778112016,Tiny Budgets Big Transformations for Living Spaces,A quick tour of budget-friendly decorating ideas that span minimalist calm to vibrant energy with practical tips and easy DIYs.
youtube,small apartment decor,https://www.youtube.com/watch?v=TANxvcBMzqg,1778108426,COZINHA AMERICANA VALE A PENA ? #design #home #homedecor,COZINHA AMERICANA E COZINHA INTEGRADA COM SALA: VALE A PENA OU É UMA FURADA? A cozinha americana e a ...
youtube,small apartment decor,https://www.youtube.com/watch?v=VXnZ8ya_h_4,1778106260,Small apartment with a big sofa 🤭#sofa #sofabed #home #homedesign #sofacover,
youtube,small apartment decor,https://www.youtube.com/watch?v=QkT1szb9dPA,1778104827,Too many shoes for your NYC apartment? 👠#antbox  #nycshoes  #shoeorganization  #smallspaceliving,Shop ANTBOX 8 Tier Shoe Cabinet: https://www.antboxstorage.com/products/8-tier-shoe-cabinet-small-spaces ✓ Stores up to 32 ...
youtube,small apartment decor,https://www.youtube.com/watch?v=Q217QJYNSAo,1778102539,120 Amazon Furniture &amp; Gadgets That Turn Tiny Cluttered Apartments Into Luxury Spaces,00:00 Introduction 00:34 Lift Top Coffee Table - https://amzn.to/4jqDQEE 01:07 Mini Dryer - https://amzn.to/3GhBlEU 01:42 Fluted ...
youtube,small apartment decor,https://www.youtube.com/watch?v=QfJuOEvpIbU,1778101009,Small Studio Apartment Night Transformation | Cozy Minimalist Interior 🌙 #shorts,Cozy Minimalist Studio Apartment at Night ✨ Experience a beautifully designed small studio apartment at night with warm lighting ...
youtube,small apartment decor,https://www.youtube.com/watch?v=_4oTlhDqQ1Q,1778100060,Small Apartment MUST HAVE! ️ Sofa to Bed Transformation #shorts #interiordesign,Transform your small apartment with this amazing 3-in-1 convertible sofa bed! ✨ Key Features: - Compact 136cm design ...
youtube,small apartment decor,https://www.youtube.com/watch?v=KJREQkl5Ahg,1778087330,Minimalist Bedside Shelf Setup Ideas. #asmr #aestheticroomdecor #minimalisthome #loveyourspace,"Welcome to The Bare Space — your go-to destination for budget home decor inspiration! ✨ We post minimalist bedroom ideas, ..."
youtube,small apartment decor,https://www.youtube.com/watch?v=PdQyS35hcLA,1778085622,TOUR PELO MEU APARTAMENTO | mobiliando nosso apê aos poucos,"Oi gente Esse é um vídeo bem especial. Vem as novidades do nosso apartamento. Ta ficando lindo, do nosso jeitinho, a nossa ..."
youtube,small apartment decor,https://www.youtube.com/watch?v=dJfGBDd8W98,1778079322,Luxury Trader room. #trader #room #newyork  I052,"Welcome to Wibeon – your source for interior design inspiration and home transformation ideas. In this channel, we explore ..."
youtube,small apartment decor,https://www.youtube.com/watch?v=qyZrsiNuXO8,1778075454,Functional Design for a Small Bedroom and Workspace #interiordesign #bedroom #shots,"Struggling with a small, cramped bedroom? Watch how we professionally redesign this tiny space to fit a bed, wardrobe, and a full ..."
