source,domain,url,created_utc,title,text,query
rss,www.yankodesign.com,https://www.yankodesign.com/2026/01/21/this-pocket-titanium-ruler-has-a-level-protractor-and-pen-built-in/?utm_source=rss&utm_medium=rss&utm_campaign=this-pocket-titanium-ruler-has-a-level-protractor-and-pen-built-in,1769049915,"This Pocket Titanium Ruler Has a Level, Protractor, and Pen Built In","This Pocket Titanium Ruler Has a Level, Protractor, and Pen Built In

<p class=""rws-nl-img""><a href=""https://www.yankodesign.com/2026/01/21/this-pocket-titanium-ruler-has-a-level-protractor-and-pen-built-in/""><img alt="""" class=""attachment-post-thumbnail size-post-thumbnail wp-post-image"" height=""960"" src=""https://www.yankodesign.com/images/design_news/2026/01/this-pocket-titanium-ruler-has-a-level-protractor-and-pen-built-in/flintone-megaruler-03.jpg"" width=""1280"" /></a></p><h2 class=""rws-nl-title"" style=""text-align: center;"">This Pocket Titanium Ruler Has a Level, Protractor, and Pen Built In</h2><div class=""rws-nl-excerpt"">Projects pile up on the bench with a ruler that stops at 30 cm, a square for right angles, a separate protractor for odd cuts,...</div>",
rss,www.yankodesign.com,https://www.yankodesign.com/2026/01/21/we-might-get-a-touchscreen-m6-macbook-pro-before-gta-6/?utm_source=rss&utm_medium=rss&utm_campaign=we-might-get-a-touchscreen-m6-macbook-pro-before-gta-6,1769045401,We Might Get A Touchscreen M6 MacBook Pro Before GTA 6,"We Might Get A Touchscreen M6 MacBook Pro Before GTA 6

<p class=""rws-nl-img""><a href=""https://www.yankodesign.com/2026/01/21/we-might-get-a-touchscreen-m6-macbook-pro-before-gta-6/""><img alt="""" class=""attachment-post-thumbnail size-post-thumbnail wp-post-image"" height=""960"" src=""https://www.yankodesign.com/images/design_news/2026/01/draft-m6-pro/m6_macbook_pro_rumors_11.jpeg"" width=""1280"" /></a></p><h2 class=""rws-nl-title"" style=""text-align: center;"">We Might Get A Touchscreen M6 MacBook Pro Before GTA 6</h2><div class=""rws-nl-excerpt"">So here&#8217;s the timeline we&#8217;re apparently living in: Apple will ship a completely redesigned MacBook Pro with OLED displays and touchscreens before Rockstar manages to...</div>",
rss,www.yankodesign.com,https://www.yankodesign.com/2026/01/21/this-sliced-cylinder-lamp-turns-one-cut-into-pure-design-magic/?utm_source=rss&utm_medium=rss&utm_campaign=this-sliced-cylinder-lamp-turns-one-cut-into-pure-design-magic,1769041821,This Sliced Cylinder Lamp Turns One Cut Into Pure Design Magic,"This Sliced Cylinder Lamp Turns One Cut Into Pure Design Magic

<p class=""rws-nl-img""><a href=""https://www.yankodesign.com/2026/01/21/this-sliced-cylinder-lamp-turns-one-cut-into-pure-design-magic/""><img alt="""" class=""attachment-post-thumbnail size-post-thumbnail wp-post-image"" height=""960"" src=""https://www.yankodesign.com/images/design_news/2026/01/this-sliced-cylinder-lamp-turns-one-cut-into-pure-design-magic/corte-01.jpg"" width=""1280"" /></a></p><h2 class=""rws-nl-title"" style=""text-align: center;"">This Sliced Cylinder Lamp Turns One Cut Into Pure Design Magic</h2><div class=""rws-nl-excerpt"">There&#8217;s something deeply satisfying about watching a designer take a basic shape and completely reimagine it. That&#8217;s exactly what Jisu Park has done with the...</div>",
rss,www.yankodesign.com,https://www.yankodesign.com/2026/01/21/this-oreo-shaped-tea-infuser-retains-the-dunking-ritual-with-a-twist/?utm_source=rss&utm_medium=rss&utm_campaign=this-oreo-shaped-tea-infuser-retains-the-dunking-ritual-with-a-twist,1769038204,This Oreo-shaped Tea Infuser Retains The Dunking Ritual With A Twist!,"This Oreo-shaped Tea Infuser Retains The Dunking Ritual With A Twist!

<p class=""rws-nl-img""><a href=""https://www.yankodesign.com/2026/01/21/this-oreo-shaped-tea-infuser-retains-the-dunking-ritual-with-a-twist/""><img alt="""" class=""attachment-post-thumbnail size-post-thumbnail wp-post-image"" height=""960"" src=""https://www.yankodesign.com/images/design_news/2026/01/a-tea-infuser-that-blurs-the-line-between-ritual-and-treat/Cookie_tea_infuser_01.jpg"" width=""1280"" /></a></p><h2 class=""rws-nl-title"" style=""text-align: center;"">This Oreo-shaped Tea Infuser Retains The Dunking Ritual With A Twist!</h2><div class=""rws-nl-excerpt"">There’s something deeply comforting about a cup of tea, especially when it’s paired with an object that makes you smile before you even take the...</div>",
rss,www.yankodesign.com,https://www.yankodesign.com/2026/01/21/if-design-award-makes-sustainability-20-of-your-score-what-designers-need-to-know-in-2026/?utm_source=rss&utm_medium=rss&utm_campaign=if-design-award-makes-sustainability-20-of-your-score-what-designers-need-to-know-in-2026,1769034613,iF Design Award Makes Sustainability 20% of Your Score: What Designers Need to Know in 2026,"iF Design Award Makes Sustainability 20% of Your Score: What Designers Need to Know in 2026

<p class=""rws-nl-img""><a href=""https://www.yankodesign.com/2026/01/21/if-design-award-makes-sustainability-20-of-your-score-what-designers-need-to-know-in-2026/""><img alt="""" class=""attachment-post-thumbnail size-post-thumbnail wp-post-image"" height=""960"" src=""https://www.yankodesign.com/images/design_news/2026/01/draft-mindset/design_mindset_ep_17_1.jpg"" width=""1280"" /></a></p><h2 class=""rws-nl-title"" style=""text-align: center;"">iF Design Award Makes Sustainability 20% of Your Score: What Designers Need to Know in 2026</h2><div class=""rws-nl-excerpt"">Yanko Design&#8217;s podcast, Design Mindset, continues to bring compelling conversations with design leaders who are shaping the future of the industry. Powered by KeyShot, the...</div>",
rss,www.yankodesign.com,https://www.yankodesign.com/2026/01/21/nomad-icy-blue-glow-stratos-band-adds-glow-in-the-dark-twist-to-apple-watch-ultra/?utm_source=rss&utm_medium=rss&utm_campaign=nomad-icy-blue-glow-stratos-band-adds-glow-in-the-dark-twist-to-apple-watch-ultra,1769031010,Nomad Icy Blue Glow Stratos Band adds glow-in-the-dark twist to Apple Watch Ultra,"Nomad Icy Blue Glow Stratos Band adds glow-in-the-dark twist to Apple Watch Ultra

<p class=""rws-nl-img""><a href=""https://www.yankodesign.com/2026/01/21/nomad-icy-blue-glow-stratos-band-adds-glow-in-the-dark-twist-to-apple-watch-ultra/""><img alt="""" class=""attachment-post-thumbnail size-post-thumbnail wp-post-image"" height=""960"" src=""https://www.yankodesign.com/images/design_news/2026/01/nomad-icy-blue-glow-stratos-band-adds-glow-in-the-dark-twist-to-apple-watch-ultra/Icy-Blue-Glow-Stratos-Band-Apple-Watch-8.jpg"" width=""1280"" /></a></p><h2 class=""rws-nl-title"" style=""text-align: center;"">Nomad Icy Blue Glow Stratos Band adds glow-in-the-dark twist to Apple Watch Ultra</h2><div class=""rws-nl-excerpt"">Getting a watch band for your Watch Ultra just got interesting with Nomad’s latest addition to the Stratos Band line-up. After the success with the...</div>",
rss,www.yankodesign.com,https://www.yankodesign.com/2026/01/21/console-wars-are-dead-this-chinese-modder-fused-a-ps5-xbox-series-x-and-switch-2-into-one-console/?utm_source=rss&utm_medium=rss&utm_campaign=console-wars-are-dead-this-chinese-modder-fused-a-ps5-xbox-series-x-and-switch-2-into-one-console,1769026535,"Console Wars Are Dead: This Chinese Modder Fused a PS5, Xbox Series X, and Switch 2 Into One Console","Console Wars Are Dead: This Chinese Modder Fused a PS5, Xbox Series X, and Switch 2 Into One Console

<p class=""rws-nl-img""><a href=""https://www.yankodesign.com/2026/01/21/console-wars-are-dead-this-chinese-modder-fused-a-ps5-xbox-series-x-and-switch-2-into-one-console/""><img alt="""" class=""attachment-post-thumbnail size-post-thumbnail wp-post-image"" height=""960"" src=""https://www.yankodesign.com/images/design_news/2026/01/auto-draft/ningtendo_pxbox5_1.jpg"" width=""1280"" /></a></p><h2 class=""rws-nl-title"" style=""text-align: center;"">Console Wars Are Dead: This Chinese Modder Fused a PS5, Xbox Series X, and Switch 2 Into One Console</h2><div class=""rws-nl-excerpt"">The console wars are dead. And what killed them wasn&#8217;t rising RAM prices, GPU scarcity, tariffs, or any sort of monopolistic practices. It was one...</div>",
rss,www.yankodesign.com,https://www.yankodesign.com/2026/01/21/27-inch-digital-wall-calendar-shows-schedules-then-switches-to-photos/?utm_source=rss&utm_medium=rss&utm_campaign=27-inch-digital-wall-calendar-shows-schedules-then-switches-to-photos,1769019614,"27-Inch Digital Wall Calendar Shows Schedules, Then Switches to Photos","27-Inch Digital Wall Calendar Shows Schedules, Then Switches to Photos

<p class=""rws-nl-img""><a href=""https://www.yankodesign.com/2026/01/21/27-inch-digital-wall-calendar-shows-schedules-then-switches-to-photos/""><img alt="""" class=""attachment-post-thumbnail size-post-thumbnail wp-post-image"" height=""960"" src=""https://www.yankodesign.com/images/design_news/2026/01/27-inch-digital-wall-calendar-shows-schedules-then-switches-to-photos/skylight-cal-max-digital-wall-calendar-14.jpg"" width=""1280"" /></a></p><h2 class=""rws-nl-title"" style=""text-align: center;"">27-Inch Digital Wall Calendar Shows Schedules, Then Switches to Photos</h2><div class=""rws-nl-excerpt"">Shared calendars scatter across phones, sticky notes live on the fridge, and whiteboards never quite get updated. Most attempts to centralize family logistics involve smart...</div>",
rss,www.yankodesign.com,https://www.yankodesign.com/2026/01/21/a-wooden-chapel-that-sings-when-the-wind-blows/?utm_source=rss&utm_medium=rss&utm_campaign=a-wooden-chapel-that-sings-when-the-wind-blows,1769016059,A Wooden Chapel That Sings When The Wind Blows,"A Wooden Chapel That Sings When The Wind Blows

<p class=""rws-nl-img""><a href=""https://www.yankodesign.com/2026/01/21/a-wooden-chapel-that-sings-when-the-wind-blows/""><img alt="""" class=""attachment-post-thumbnail size-post-thumbnail wp-post-image"" height=""960"" src=""https://www.yankodesign.com/images/design_news/2026/01/a-wooden-chapel-that-sings-when-the-wind-blows/cappella-01.jpg"" width=""1280"" /></a></p><h2 class=""rws-nl-title"" style=""text-align: center;"">A Wooden Chapel That Sings When The Wind Blows</h2><div class=""rws-nl-excerpt"">Picture a structure that looks like it&#8217;s floating in a grain field, its wooden slats hanging down like a delicate curtain swaying in the breeze....</div>",
rss,www.yankodesign.com,https://www.yankodesign.com/2026/01/21/worlds-first-hydrogen-powered-surveillance-drone-enters-combat-duty-with-ukrainian-defense-forces/?utm_source=rss&utm_medium=rss&utm_campaign=worlds-first-hydrogen-powered-surveillance-drone-enters-combat-duty-with-ukrainian-defense-forces,1769012408,World’s first hydrogen-powered surveillance drone enters combat duty with Ukrainian Defense Forces,"World’s first hydrogen-powered surveillance drone enters combat duty with Ukrainian Defense Forces

<p class=""rws-nl-img""><a href=""https://www.yankodesign.com/2026/01/21/worlds-first-hydrogen-powered-surveillance-drone-enters-combat-duty-with-ukrainian-defense-forces/""><img alt="""" class=""attachment-post-thumbnail size-post-thumbnail wp-post-image"" height=""960"" src=""https://www.yankodesign.com/images/design_news/2026/01/worlds-first-hydrogen-powered-surveillance-drone-enters-combat-duty-with-ukrainian-defense-forces/Skyeton-Raybird-hydrogen-powered-drone-3.jpg"" width=""1280"" /></a></p><h2 class=""rws-nl-title"" style=""text-align: center;"">World’s first hydrogen-powered surveillance drone enters combat duty with Ukrainian Defense Forces</h2><div class=""rws-nl-excerpt"">Hydrogen-powered unmanned aerial vehicles are not a new concept. Drones running on hydrogen fuel have been in experimental forms for over a decade, but this...</div>",
rss,www.archdaily.com,https://www.archdaily.com/1038041/younghusband-woolstore-woods-bagot,1769047200,Younghusband Woolstore  / Woods Bagot,"Younghusband Woolstore  / Woods Bagot

<p>Younghusband is a cherished example of turn-of-the -century Victorian industrial architecture, employing vast redbrick structures, original ghost signage, and a distinctive saw-tooth roof. The deep floor plates, natural patina, and remnant pastoral parapher nalia make it a unique urban playground for living, working, and socialising.</p>",
rss,www.archdaily.com,https://www.archdaily.com/1037870/heritage-ay-kiln-adaptive-renewal-yfs-plus-wuge-studio,1769040000,Heritage “Ay” Kiln Adaptive Renewal / WUGE Studio + YFS,"Heritage “Ay” Kiln Adaptive Renewal / WUGE Studio + YFS

<p>""Ay"" (硋) is a type of black-glazed ceramic indigenous to the mountainous region of northeastern Fujian, positioned between pottery and porcelain. The site is a century-old traditional Ay kiln built against a hillside, forming an elongated, sloped ""dragon kiln."" Situated at the village entrance and flanked by open fields, the site exhibits characteristics of a rural handicraft compound: the kiln sits at the center, an old rammed-earth house to the west, a modern brick-and-concrete dwelling to the east, and several stone outbuildings scattered around.</p>",
rss,www.archdaily.com,https://www.archdaily.com/1037991/nok-khok-house-yangnar-studio,1769022000,Nork-Kok House / Yangnar Studio,"Nork-Kok House / Yangnar Studio

<p>""Nork-Kok,"" a Thai expression meaning unconventional or outside the norm, does not suggest a lack of order but instead honestly reflects the character of both the place and its owner.</p>",
rss,www.archdaily.com,https://www.archdaily.com/1038018/mashiach-now-square-natureza-urbana,1769007600,Mashiach Now Square / Natureza Urbana,"Mashiach Now Square / Natureza Urbana

<p>The revitalization of Pra&ccedil;a Mashiach Now has transformed a degraded space in the Northern Zone of S&atilde;o Paulo into an urban green infrastructure, coordinating environmental recovery, active mobility, and social activation in a territory historically dominated by automobiles.</p>",
rss,www.archdaily.com,https://www.archdaily.com/1037970/school-in-dunkerque-tank-architectes,1768996800,School in Dunkerque / TANK Architectes,"School in Dunkerque / TANK Architectes

<p>TANK has completed the « L'Alliance », a modular school in Dunkerque, France. The new construction includes an agora, a seven-classroom nursery, an eight-classroom elementary school, a cafeteria, a community center, a multipurpose hall divisible into smaller spaces, a cybercenter, offices, a civic hall, and outdoor areas.</p>",
rss,www.archdaily.com,https://www.archdaily.com/1037971/loggia-house-house-of-em,1768989600,Loggia House / House of Em,"Loggia House / House of Em

<p>London-based architecture and interiors studio House Of EM - the new practice by former Michaelis Boyd directors Emma Bodie and Matthew Sanders - has completed a renovation and extension in Kensal Rise for a young family of four. Designed for clients Anthony and Roberta, Loggia House includes a ground-floor rear extension, internal alterations throughout, and preparatory work for a future dormer extension, all enhancing scale and functionality for the family to enjoy.</p>",
rss,www.archdaily.com,https://www.archdaily.com/1037993/what-informality-and-incrementality-reveal-about-sustainable-urbanism-in-india,1768982400,What Informality and Incrementality Reveal About Sustainable Urbanism in India,"What Informality and Incrementality Reveal About Sustainable Urbanism in India

<p>The magic of Indian architecture lies in an invisible order amidst visceral chaos. When an uncertain future knocks on the doors of local practitioners, one might begin to look within the four walls they occupy to discover an opportunity for reinterpretation.</p>",
rss,www.archdaily.com,https://www.archdaily.com/1037836/riyadh-architecture-city-guide-16-projects-from-heritage-to-urban-expansion,1768980600,Riyadh Architecture City Guide: 16 Projects from Heritage to Urban Expansion,"Riyadh Architecture City Guide: 16 Projects from Heritage to Urban Expansion

<p>Once a <a href=""https://en.wikipedia.org/wiki/Najdi_architecture?utm_medium=website&amp;utm_source=archdaily.com"" target=""_blank"">Najdi settlement</a> defined by mudbrick walls and courtyard houses, <a href=""https://www.archdaily.com/city/riyadh"">Riyadh</a> has undergone one of the most radical urban transformations of the 20th and 21st centuries. The discovery of oil reserves, the consolidation of political power, and the rapid expansion of infrastructure reshaped the city from a regional capital into a sprawling metropolis almost within a single generation. As a result, Riyadh's urban fabric is marked by discontinuities, fragments of <a href=""https://www.archdaily.com/tag/vernacular-architecture"">vernacular architecture</a> coexist with mid-century institutional <a href=""https://www.archdaily.com/tag/modernism"">modernism</a>, and a rapidly evolving contemporary skyline.</p>",
rss,www.archdaily.com,https://www.archdaily.com/1037951/shed-for-the-night-watchman-eduardo-garretti-studio,1768978800,Shed for the Night Watchman / Eduardo Garretti studio,"Shed for the Night Watchman / Eduardo Garretti studio

<p>Strategically placed in the forest is a base made of stone native to the site. Emerging in a stereotomic manner, this solid block also comprises the foundation of the project.</p>",
rss,www.archdaily.com,https://www.archdaily.com/1038040/each-constraint-becomes-more-of-an-opportunity-in-conversation-with-holcim-award-winner-think-tank-architecture,1768977000,"""Each Constraint Becomes More of an Opportunity"": In Conversation With Holcim Award Winner THINK TANK architecture","""Each Constraint Becomes More of an Opportunity"": In Conversation With Holcim Award Winner THINK TANK architecture

<p><a href=""https://www.thinktank-architecture.fr/portfolio/kinshasa-reconstruction-du-marche-central/?utm_medium=website&amp;utm_source=archdaily.com"" target=""_blank"">The Zando Central Market</a> redevelopment in <a href=""https://www.archdaily.com/tag/kinshasa/page/1"">Kinshasa</a>, <a href=""https://www.archdaily.com/tag/congo"">Democratic Republic of the Congo</a>, designed by <a href=""https://www.archdaily.com/tag/think-tank-architecture/page/1"">THINK TANK architecture</a>, <a href=""https://www.archdaily.com/1035453/holcim-foundation-for-sustainable-construction-reveals-20-winning-projects-of-the-2025-holcim-awards?ad_source=search&amp;ad_medium=projects_tab&amp;ad_source=search&amp;ad_medium=search_result_all"">has been selected among the 20 winning projects of the 2025 Holcim Foundation Awards</a> in the <a href=""https://www.archdaily.com/tag/middle-east/page/1"">Middle East</a> and <a href=""https://www.archdaily.com/tag/africa/page/1"">Africa</a> region. Originally designed for 3,500 traders and now accommodating more than 20,000 vendors, the market has long operated under conditions of severe overcrowding and infrastructural strain. The project stands out for its large-scale public ambition, its reliance on <a href=""https://www.archdaily.com/tag/local-materials"">locally available materials</a> and skills, and its capacity to accommodate both formal and informal economies within a rapidly transforming urban context.</p>",
rss,www.archdaily.com,https://www.archdaily.com/1037947/vachnadziani-winery,1768975200,Vachnadziani Winery / Laboratory of Architecture #3,"Vachnadziani Winery / Laboratory of Architecture #3

<p>The building is located in the Alazani Valley, a centuries-old, traditional cradle of the region's winemaking, set against the backdrop of the Caucasus Mountain range and vineyards.</p>",
rss,www.archdaily.com,https://www.archdaily.com/1036650/great-architecture-must-be-poetry-zhu-pei-on-architecture-as-a-form-of-art-in-louisiana-channel-interview,1768973400,“Great Architecture Must Be Poetry:” Zhu Pei on Architecture as a Form of Art in Louisiana Channel Interview,"“Great Architecture Must Be Poetry:” Zhu Pei on Architecture as a Form of Art in Louisiana Channel Interview

<p><a href=""https://www.archdaily.com/tag/zhu-pei"" rel=""noopener"" target=""_blank"">Zhu Pei</a> is a <a href=""https://www.archdaily.com/tag/chinese-architecture"" rel=""noopener"" target=""_blank"">Chinese architect</a> born in 1962 in Beijing. He studied at Tsinghua University and UC Berkeley, and founded <a href=""https://www.archdaily.com/office/studio-zhu-pei"" rel=""noopener"" target=""_blank"">Studio Zhu Pei </a>in 2005. The studio's experimental work and research focus on contemporary architecture, art, and cultural projects. With an artistic and exploratory approach, it investigates the relationship between the roots that anchor architecture in specific natural and cultural contexts and the innovation that drives architecture as a form of artistic revolution. In his interview with <a href=""https://www.archdaily.com/tag/louisiana-channel"" rel=""noopener"" target=""_blank"">Louisiana Channel</a>, Zhu Pei describes architecture as an artistic discipline that, like poetry, relies on openness, imagination, and the creation of new experiences. He argues that great architecture goes beyond functional problem-solving by generating a sense of wonder through its ability to ""invent"" and ""create some new thing, new experience,"" positioning architectural practice as cultural and sensory exploration rather than purely technical production.</p>",
rss,www.archdaily.com,https://www.archdaily.com/1038010/call-for-archdailys-next-product-manager,1768971600,Call for ArchDaily's Next Product Manager,"Call for ArchDaily's Next Product Manager

<p>ArchDaily is expanding its product team and looking for an additional Product Manager to help expand our portfolio. Working at the intersection of content, technology, and the built environment, this role offers the opportunity to contribute directly to the world's most visited architecture platform and to products used daily by millions of professionals.</p>",
rss,www.archdaily.com,https://www.archdaily.com/1037930/urban-transformation-of-san-salvador-contemporary-placemaking-in-central-america,1768968000,Urban Transformation of San Salvador: Contemporary Placemaking in Central America,"Urban Transformation of San Salvador: Contemporary Placemaking in Central America

<p>Historic center renewal has become a recurring strategy in <a href=""https://www.archdaily.com/1026205/tegucigalpas-modernist-revolution-metroplan-and-the-shift-in-the-urban-identity-of-1970s-honduras?ad_source=search&amp;ad_medium=projects_tab&amp;ad_source=search&amp;ad_medium=search_result_all"" rel=""noopener"" target=""_blank"">Central American cities</a> seeking to reassert the symbolic, economic, and functional relevance of their traditional cores. These processes often combine physical rehabilitation, institutional investment, and stricter control over public space. San Salvador offers a recent and instructive case, which allows for understanding of how <a href=""https://www.archdaily.com/1033892/the-architect-as-policymaker-the-case-of-comayaguas-heritage-preservation-in-honduras"" rel=""noopener"" target=""_blank"">interventions in inherited civic spaces</a> balance infrastructure improvement with heritage conservation and social regulation. It also enables the assessment of how these choices resonate within <a href=""https://www.archdaily.com/1034953/the-cayala-paradox-how-are-private-districts-shaping-public-space-design-in-guatemala?ad_source=search&amp;ad_medium=projects_tab&amp;ad_source=search&amp;ad_medium=search_result_all"" rel=""noopener"" target=""_blank"">broader debates</a> on urban transformation in the region.</p>",
rss,www.archdaily.com,https://www.archdaily.com/1037981/house-of-knowledge-christoph-hesse-architects,1768964400,House of Knowledge / Christoph Hesse Architects,"House of Knowledge / Christoph Hesse Architects

<p>The House of Knowledge is part of the <strong>20 Bookhouses Initiative, envisioned to enrich community</strong> life across the rapidly growing metropolis of <a href=""https://www.archdaily.com/tag/xinyang"">Xinyang</a>, a city of 12 million in Henan Province, central China. Located in Yangshan Park, the project consists of <strong>two buildings: a community library with an exhibition hall and a tea house. </strong>Between them stretch <strong>three small lakes</strong>, embedded in a biodiverse landscape and surrounded by the urban fabric.</p>",
rss,www.archdaily.com,https://www.archdaily.com/1037988/round-house-estate-bungalow-at-ahangama-narein-perera,1768960800,Round House Estate Bungalow at Ahangama / Narein Perera,"Round House Estate Bungalow at Ahangama / Narein Perera

<p>The conceptual form of the bungalow is one that was primarily generated by the unique site that was chosen. Located atop the highest point of a cinnamon estate that forms a 12-acre island among the otherwise flat paddy fields of the area. The 3600 views are equally exciting; therefore, needed significant consideration. Envisaged as a circular edge of a ""forest clearing"", the structure needed to merge with the dense plantation. The approach was to define the inner edge only and let the outer edge be randomly broken to organically amalgamate with the landscape.</p>",
