source,domain,url,created_utc,title,text,query
rss,www.archdaily.com,https://www.archdaily.com/1035511/bridge-house-wallmakers,1761807600,Bridge House / Wallmakers,"Bridge House / Wallmakers

<p>The site, situated in <a href=""https://www.archdaily.com/tag/karjat"">Karjat</a> against the backdrop of the hills, had the TATA spillway stream cutting through the land, making a 7m deep gorge in the middle. On the onset itself the project seemed to be burdened by a number of constraints: the two parcels of land had to be connected, but the foundations couldn't rest within the 100ft width of the spillway; we could make a habitable bridge, but there had to be enough clearance for a JCB to clean the 2 streams underneath; we wanted to make the bridge with local materials, but wild grass seemed to be the only material within a five-mile radius.</p>",
rss,www.archdaily.com,https://www.archdaily.com/1035213/how-do-you-make-every-step-count-buildner-announces-stair-competition-winners-and-launches-new-edition,1761806700,How Do You Make Every Step Count? Buildner Announces Stair Competition Winners and Launches New Edition,"How Do You Make Every Step Count? Buildner Announces Stair Competition Winners and Launches New Edition

<p><a href=""https://architecturecompetitions.com/?utm_medium=website&amp;utm_source=archdaily.com"" target=""_blank"">Buildner</a> has announced the results of its international architecture ideas competition,<a href=""https://architecturecompetitions.com/architectsstair/archd?utm_medium=website&amp;utm_source=archdaily.com"" target=""_blank""> Architect's Stair</a>, and the launch of its <a href=""https://architecturecompetitions.com/architectsstair3/archd?utm_medium=website&amp;utm_source=archdaily.com"" target=""_blank"">third edition</a>. </p>",
rss,www.archdaily.com,https://www.archdaily.com/1028964/the-latvian-pavilion-at-the-2025-venice-architecture-biennale-invites-critical-dialogue-on-the-spatial-impact-of-conflict,1761805800,The Latvian Pavilion at the 2025 Venice Architecture Biennale Invites Critical Dialogue on the Spatial Impact of Conflict,"The Latvian Pavilion at the 2025 Venice Architecture Biennale Invites Critical Dialogue on the Spatial Impact of Conflict

<p>The <a href=""https://www.archdaily.com/country/latvia/page/1"" rel=""noopener"" target=""_blank"">Latvian</a> <a href=""https://www.archdaily.com/tag/pavilion"">Pavilion</a> at the <a href=""https://www.archdaily.com/tag/venice-architecture-biennale-2025"" rel=""noopener"" target=""_blank"">19th International Architecture Exhibition – La Biennale di Venezia</a>, commissioned by Jānis Dripe and curated by <a href=""https://www.archdaily.com/tag/liene-jakobsone"">Liene Jākobsone</a> and <a href=""https://www.archdaily.com/tag/ilka-ruby"">Ilka Ruby</a>, explores the impact of <a href=""https://www.archdaily.com/tag/military"" rel=""noopener"" target=""_blank"">military</a> defense on the country's border <a href=""https://www.archdaily.com/tag/landscape"" rel=""noopener"" target=""_blank"">landscape</a>. The <a href=""https://www.archdaily.com/tag/exhibition"" rel=""noopener"" target=""_blank"">exhibition</a> was designed by SAMPLING and Nomad Architects to highlight how geopolitical tensions shape both territory and daily life. In times of escalating international warfare, the curatorial team poses the question of what it means to live on NATO's external border in times of geopolitical <a href=""https://www.archdaily.com/tag/conflict"" rel=""noopener"" target=""_blank"">conflict</a>.</p>",
rss,www.archdaily.com,https://www.archdaily.com/1035526/borna-park-work-and-living-community-malte-kloes-architekten,1761804000,Borna Park - Work and Living Community / Malte Kloes Architekten,"Borna Park - Work and Living Community / Malte Kloes Architekten

<p><strong>Borna-Park: A Community Shaped by Nature</strong> - At Borna-Park, life and work are intimately intertwined with the landscape. The site is surrounded by meadows, open fields, and the tree-lined Pfaffneren River. Nature provides more than a mere backdrop; it becomes the identity of the residential and working community.</p>",
gnews,news.google.com,https://news.google.com/rss/articles/CBMidEFVX3lxTFBocW5QOWY5Mk14QTRMMDVLMHpIX2JDeHZyMTBnVk9ka0NLMmF3T2pIN0g1aG41a0J1aktvZDREMDdMRXJYSWxOY1Qya1hEVWkyd0VWYlpiZDlvaHdxTURTaS1xVVUwMEhSTGFnTGdSMnRqdVo0?oc=5,1758092400,My Mom Made One Tiny Tweak to My Living Room and Made It Feel 10 Times Bigger - The Spruce,My Mom Made One Tiny Tweak to My Living Room and Made It Feel 10 Times Bigger - The Spruce,small apartment decor
gnews,news.google.com,https://news.google.com/rss/articles/CBMibkFVX3lxTE9WeFJpUkhnb2JpNVhkWEFHcE56Smp3UEVvUlk0VnlhWWFrVUY1ZHR5d3d1V3dRYUVwSDlhUktLbFR0b1FwVV92QTVSdjZhTFNqNWpjRlZqa0VUZFllVU5ma0JqWlQ2SndRVkwwRDhR?oc=5,1758956400,"I’m Extremely Small-Space Savvy, and These 5 Slept-On IKEA Finds Work Smarter Not Harder - Apartment Therapy","I’m Extremely Small-Space Savvy, and These 5 Slept-On IKEA Finds Work Smarter Not Harder - Apartment Therapy",small apartment decor
gnews,news.google.com,https://news.google.com/rss/articles/CBMid0FVX3lxTE1ieVd2bTc0YnY5SjVGaVNJMEdqWVRBYXZpaV9Cb2QxZmRJUzNTUWZjOGN4TDBfZmdWU0VpREVoeWphNmtmSFhsNHFMX1RsdG0yS1VZNzFhb2VLdDU4bDB1S3prc1FaQWc3eEh2S2NncWUwM2hRQ2pn?oc=5,1761839045,These 65+ Small Kitchens Expertly Reinvent Cramped Spaces - Apartment Therapy,These 65+ Small Kitchens Expertly Reinvent Cramped Spaces - Apartment Therapy,small apartment decor
gnews,news.google.com,https://news.google.com/rss/articles/CBMic0FVX3lxTE1CR193ZzJiRE9wR1JtTWF0X3QtWWJydDVLZ0xpemxzUmM2enp6Q3JwVnVCODhKUlVWaEFzVndyMWFOUElWTkpySFkxeHFCMkNRMlF4QTVtbzVPZjN0OWFHWDNJNWttcGxPNjhrR05NUEpzOFE?oc=5,1758783600,These 19 Small Space Storage Ideas Are So Smart (and Easy to Copy) - Apartment Therapy,These 19 Small Space Storage Ideas Are So Smart (and Easy to Copy) - Apartment Therapy,small apartment decor
gnews,news.google.com,https://news.google.com/rss/articles/CBMiiAFBVV95cUxQaDBHZkN3WnM0MzJ5YnpTNjdNNnNyckhOMGZoS0d6Qml0NEZwVEVkWWNCWWpvRUhOZVRkZG5JT1JHWm5OUWZDR213TWRTTFZkc1hONkFGNUVwRG15eDRFeVlYajBvR1UtSDlGRGhKa2VJMEIxaFFoQWJqZXJ3U2UxRTJmYUlqcmY1?oc=5,1761030000,13 Small Entryway Ideas You Can DIY - Architectural Digest,13 Small Entryway Ideas You Can DIY - Architectural Digest,small apartment decor
gnews,news.google.com,https://news.google.com/rss/articles/CBMijgFBVV95cUxPS1lNdkNZZFI1elVIQTY5UFhndVNNeUdNNVdlWi1KSmVjSmZTaE43UlFISWFZS0dSOEJyUGhmbGZNN0NRSkFMOEQ5UnlBbTZQN3lUUnNnZFh5QWQxcm5QWjRRTWhpR2VvZDR1enJzblJ5MkVpRUlxdXhmMjhsS3dPbFB3NlhERXBxYXhKVGtR?oc=5,1759302000,7 Things Minimalists Would Never Put in Their Living Room - Real Simple,7 Things Minimalists Would Never Put in Their Living Room - Real Simple,small apartment decor
gnews,news.google.com,https://news.google.com/rss/articles/CBMifkFVX3lxTE8yZXluQkxJbVRxa0hHZDR1WXhoRW1helN0UDhfekg3T1dPNWstZDZvME5hYUE0eGRTSHRsdTRWbTdGNHU2dkJOa1V5MGpSYk8tV3huWHdwTmc4QlFxQlNkakZPUFg0a21ncUpUS1NmYWEwbmltUHBtMjJCNnFEdw?oc=5,1758092400,The Simple Design Hack Every Small Kitchen Needs (It Saves Major Space!) - Apartment Therapy,The Simple Design Hack Every Small Kitchen Needs (It Saves Major Space!) - Apartment Therapy,small apartment decor
gnews,news.google.com,https://news.google.com/rss/articles/CBMiggFBVV95cUxQanF1QUdZNlowSjFlVjZuekRqZXI1a2FfY2NXWWxJZnBmcGJuWjZXXzRDNEN5MzdVLVNkeHZnb295aVpmc3MwMkY3d2JrWjB6S2o3V2FlbkJpUmx4ZDVFUzlPTU9RWkFHM3BnUGlKei1YaWd2U3NJWVloQjVyamFoamVB?oc=5,1759993200,Our Editors Searched Everywhere for Small Space-Friendly Sofas—These 7 Are the Best - House Beautiful,Our Editors Searched Everywhere for Small Space-Friendly Sofas—These 7 Are the Best - House Beautiful,small apartment decor
gnews,news.google.com,https://news.google.com/rss/articles/CBMieEFVX3lxTE54aC1IWEJNOGoyT3gtNmt4ZU5HU1lNc1pQSGNEOWs5dTVfaGpMUUcxY2hhb2x5dTFlUmhkeEsxVFFPanlYcmFDcl9WVXZaOVVocDMyQVA2TldoN1VVcXRuLWlGYWtOa1hZTFhQRWw0aTZBS1JDRFZpSQ?oc=5,1758783600,The 40 best housewarming gifts for anyone who just moved into a new apartment - Business Insider,The 40 best housewarming gifts for anyone who just moved into a new apartment - Business Insider,small apartment decor
gnews,news.google.com,https://news.google.com/rss/articles/CBMiZ0FVX3lxTFBqbTNJc3VFNlhGaFFpNkxKVy0ybUJEajNlTDA0YUZaOVR5R1RiWC0yZnpKa3FEejZ2dEtBbzRnTGxFWlhobnZmWVphSkRBWGtHeHV4dkl4UlBUTmdEVWlMRXh2TWYzeVk?oc=5,1759215600,40 Big Ideas For Small Powder Rooms - Southern Living,40 Big Ideas For Small Powder Rooms - Southern Living,small apartment decor
gnews,news.google.com,https://news.google.com/rss/articles/CBMic0FVX3lxTFBZQWVjVU5rcjRSYnh4Q09zWFJwLTVPZXNWRmV4dmZKUTdKdWpqMWdPYXNoNnJ3bmtMVFJjempJQ1Mxb21DTVhldlhHX3NuT2hoYndyS0R0THVsWnlPSjV2dElnNmJkREUwN0t2REEwS2Y4ekk?oc=5,1759129200,We Tested (and Rated!) All the Desks at Pottery Barn — Here Are the Best to Suit Your Style and Space - Apartment Therapy,We Tested (and Rated!) All the Desks at Pottery Barn — Here Are the Best to Suit Your Style and Space - Apartment Therapy,small apartment decor
youtube,,https://www.youtube.com/watch?v=dV5u79Kbte8,1761916504,luxury home interior design trends 2025 #home #modernliving #bedroom #homedecor #dreaminterior,,interior design trends
youtube,,https://www.youtube.com/watch?v=8Shv-_Tsw3w,1761915626,Luxury Living Room Design Trends 2026 Home Interior Design &amp; Stylish Coffee Table Setup ,Explore the most elegant and inspiring Modern Luxury Coffee Table Styling Ideas for 2026 ✨ This video showcases how to ...,interior design trends
youtube,,https://www.youtube.com/watch?v=gYDK52dOpco,1761913623,Trending home decor #homedecor#interiordesign #trendingnow#trendingshorts #design#shortsfeed #shorts,Transform your space with the latest trending home decor ideas that redefine modern interior design and elevate your lifestyle!,interior design trends
youtube,,https://www.youtube.com/watch?v=LhAv0X90w9Q,1761913023,Next-Gen Room Design Trends 2026 💫 | Aether Interiors,Discover the Top 3 Luxury Room Designs of 2026 — where elegance meets innovation. From futuristic lighting to serene ...,interior design trends
youtube,,https://www.youtube.com/watch?v=1MLDKE-vQvA,1761910202,🎨 Top Interior Design Tips &amp; Tricks You Need to Know in 2026 ✨ | #InteriorDesignTips,"Want to become a professional interior designer or upgrade your home décor game? In this short video, we're sharing expert ...",interior design trends
youtube,,https://www.youtube.com/watch?v=IjBCn_6KcaM,1761908442,Sustainable Luxury Home Design Ideas | Elegant Nature-Inspired Interiors with Modern Eco Touch,Sustainable luxury home design ✨ is redefining modern elegance by merging eco-conscious living with timeless sophistication.,interior design trends
youtube,,https://www.youtube.com/watch?v=wBrDsXi-ps0,1761905591,Beutiful Home “2025 Latest Home Design Trends | Modern Indian Homes” #classyhomes #indianhomes,Beutiful Home “2025 Latest Home Design Trends | Modern Indian Homes” #classyhomes #indianhomes Beutiful Home “2025 ...,interior design trends
youtube,,https://www.youtube.com/watch?v=o0xI5mWJVXk,1761905239,Transform Your Space: Latest Trends in Modern Bedroom Design #shortsfeed #bedroom #interiordesign,"Transform Your Space: Latest Trends in Modern Bedroom Design #shortsfeed #bedroom #interiordesign #Shorts, ...",interior design trends
youtube,,https://www.youtube.com/watch?v=npAKSFm-W8c,1761903029,Trendy Wardrobe interior Designs 2025/double door wardrobe design ideas  👌💫 #modularwardrobe,Trendy Wardrobe interior Designs 2025/double door wardrobe design ideas bedroom Trending Discover the latest double ...,interior design trends
youtube,,https://www.youtube.com/watch?v=U4mDKryN8Zk,1761903039,Modern Modular Kitchen &amp; TV Unit Design Ideas 2025 🌟| #shorts #interiordesign #modularkitchen #ideas,Modern Modular Kitchen & TV Unit Design Ideas 2025 | #shorts #interiordesign #modularkitchen #ideas ✨ Discover the ...,interior design trends
youtube,,https://www.youtube.com/watch?v=no4eCSajZ4U,1761899436,Interior Design Ideaa for Studio Apartments|HH DECORS,InteriorDesign #HomeDecor #InteriorInspo #DreamHome #HomeAesthetic #DesignInspiration #DecorGoals #ModernInteriors ...,interior design trends
youtube,,https://www.youtube.com/watch?v=zZAqnl0D4jE,1761896751,Latest Modular Interior Design 2025/Modern and Luxury Interior Trends,"Experience the art of modern interior design where elegance meets functionality. From concept to creation, we bring your dream ...",interior design trends
youtube,,https://www.youtube.com/watch?v=xjGbc40Q82c,1761892595,Kids Bedroom vs Master Bedroom Makeover | Trending 2025 Interior Design Ideas! #Shorts,Kids Bedroom vs Master Bedroom Makeover | Trending 2025 Interior Design Ideas! #Shorts Transform your home with stylish kids ...,interior design trends
youtube,,https://www.youtube.com/watch?v=snOcWdARLIk,1761888636,Interior Design Ideas for Studio Apartments|HH DECORS,InteriorDesign #HomeDecor #InteriorInspo #DreamHome #HomeAesthetic #DesignInspiration #DecorGoals #ModernInteriors ...,interior design trends
youtube,,https://www.youtube.com/watch?v=K7hAroB8LlE,1761885055,interior design trends 👌 #music #viral #interiordesign #homedecor,interior design trends #music #viral #interiordesign #homedecor.,interior design trends
youtube,,https://www.youtube.com/watch?v=H6xVxC-Waqs,1761874195,“This Is Minimalist Home Design Done Right! 🛋️✨” #HomeDecor #SoftDecor #InteriorDesign #shorts,Discover the beauty of minimalist interior design — where simplicity meets elegance! ✨ From furniture arrangement to soft ...,interior design trends
youtube,,https://www.youtube.com/watch?v=4-Cyz9DcFdw,1761874203,Interior Design Ideas for Studio Apartments|HH DECORS,InteriorDesign #HomeDecor #InteriorInspo #DreamHome #HomeAesthetic #DesignInspiration #DecorGoals #ModernInteriors ...,interior design trends
youtube,,https://www.youtube.com/watch?v=LLP3JfMf-2I,1761862839,How Do Mood Boards Predict Future Interior Design Trends? - Style Your Decor,How Do Mood Boards Predict Future Interior Design Trends? Ever wondered how interior designers stay ahead of the latest ...,interior design trends
youtube,,https://www.youtube.com/watch?v=kfmSXsn4xA4,1761862031,Top Kitchen Trend Design 2025 #kitchendesign #interiordesigntrends  #interiordesign,"Top Kitchen Trend Design 2025 #kitchendesign #interiordesigntrends #interiordesign How to choose design style, which interior ...",interior design trends
youtube,,https://www.youtube.com/watch?v=ELwUdHPzqRs,1761854125,Each stone is sculpted with artistry and precision - Stone Arch by Zahara Finishes,"Each stone is sculpted with artistry and precision — no two alike, yet all bound by Zahara's signature realism and beauty.",interior design trends
youtube,,https://www.youtube.com/watch?v=_UrfsHJYsis,1761853632,Luxury Interior Design Trends | Elegant Home Inspiration,Luxury Interior Design Trends 2025 | Elegant Home Inspiration ✨ Discover the beauty of refined living with the latest interior ...,interior design trends
youtube,,https://www.youtube.com/watch?v=5VDBxOlte-w,1761850989,CHRISTMAS TRENDS TENDENCIAS DE NAVIDAD 2025 COMO DECORAR DECOR Design Trends HOME DECOR #christmas,diseñodeinteriores #casa #estilo #estilodevida #moderno #modern #contemporary #contemporaneo #estilocontemporaneo ...,interior design trends
youtube,,https://www.youtube.com/watch?v=-D6DB7TSDYU,1761850949,CHRISTMAS TRENDS TENDENCIAS DE NAVIDAD 2025 COMO DECORAR DECOR Design Trends HOME DECOR #christmas,diseñodeinteriores #casa #estilo #estilodevida #moderno #modern #contemporary #contemporaneo #estilocontemporaneo ...,interior design trends
youtube,,https://www.youtube.com/watch?v=qHPC9yzXyto,1761850843,CHRISTMAS TRENDS TENDENCIAS DE NAVIDAD 2025 COMO DECORAR DECOR Design Trends HOME DECOR #christmas,diseñodeinteriores #casa #estilo #estilodevida #moderno #modern #contemporary #contemporaneo #estilocontemporaneo ...,interior design trends
youtube,,https://www.youtube.com/watch?v=WpBXg_rTIEU,1761850901,CHRISTMAS TRENDS TENDENCIAS DE NAVIDAD 2025 COMO DECORAR DECOR Design Trends HOME DECOR #christmas,diseñodeinteriores #casa #estilo #estilodevida #moderno #modern #contemporary #contemporaneo #estilocontemporaneo ...,interior design trends
youtube,,https://www.youtube.com/watch?v=uoyKLtjaMps,1761916140,Amazing Craft ideas / Home decoration Walldecor ideas ll#shorts#homedecor#craft #ytshorts #trending,Amazing Craft ideas / Home decoration Walldecor ideas ll#shorts#homedecor#craft #ytshorts #trending #diy #crafts #homedecor ...,home decor ideas
youtube,,https://www.youtube.com/watch?v=3pNfc5u1Nh4,1761915609,DIY Spooky Halloween Room Decor Ideas 🎃👻✨#diy #viral #craft #trending #shortsfeed #shorts #halloween,DIY Spooky Halloween Room Decor Ideas ✨#diy #viral #craft #trending #shortsfeed #shorts #halloween#cardcreations #art ...,home decor ideas
youtube,,https://www.youtube.com/watch?v=3x7JiMhF7L8,1761914807,DIY home decor ideas with ice cream sticks💕#art #shorts,,home decor ideas
youtube,,https://www.youtube.com/watch?v=ffjBM7vZqgg,1761914769,Hope This Gonna Viral 👀 | Home Decor ideas #decor #ideas #creative #art #short,,home decor ideas
youtube,,https://www.youtube.com/watch?v=4yboQVVhM4k,1761913832,Divine Diwali Vibes | Beautiful Home Decor Ideas,"""Divine Diwali Vibes | Ram Aayenge Toh Angana Sajaungi | Beautiful Home Decor Ideas Experience the festive joy with my ...",home decor ideas
youtube,,https://www.youtube.com/watch?v=RmznEWOLmLc,1761912654,Asthetic shoppinig🛍️| #homedecor #dailyshorts #homecentre,"If you love cozy, minimal, and aesthetic home styling, this one's for you! Store: Home Centre India Budget-friendly & aesthetic ...",home decor ideas
youtube,,https://www.youtube.com/watch?v=8HXNHmFt0y8,1761912373,clay home decor ideas🥰💫✨/ colourfull  peacock#shorts #shortvideo #diy #art #decoration #peacock,"clay home decor ideas    ✨/ colourfull peacock#shorts #shortvideo #diy #art #decoration #peacock. . . . . clay art for kids, easy ...",home decor ideas
youtube,,https://www.youtube.com/watch?v=R3RGsPs2z7g,1761912180,#modular kitchen#woodenalmar#homedecorideas #viralshort #home #homedesignideas #homedecor #interior,"L. Looking to refresh your bedroom without breaking the bank? In this video, I'll show you simple and affordable bedroom decor ...",home decor ideas
youtube,,https://www.youtube.com/watch?v=CkOcjwLvtJU,1761911933,Papercraft Ideas At Home I  #papercraft #diy #craft #homedecor #trending #shorts #art #christmas,Papercraft Ideas At Home I #papercraft #diy #craft #homedecor #trending #shorts #art #christmas Your Queries : paper craft ideas ...,home decor ideas
youtube,,https://www.youtube.com/watch?v=uDAnPLiC_vc,1761911978,Diy Home 🏡 decor ideas #shorts #diy #handmade #craft,Diy Home decor ideas #shorts #diy #handmade #craft.,home decor ideas
youtube,,https://www.youtube.com/watch?v=GR831FMmwLg,1761911547,ഒരു cute desk decor idea🌸#diy #shorts #craft #pipecleanercrafts #homedecor #decor,,home decor ideas
youtube,,https://www.youtube.com/watch?v=HNJ3MxkwTKs,1761910227,pintrest inspired home decor ideas | mini planter | #pintrest #homedecor #shorts #diy #crafts,pintrest inspired home decor ideas | mini planter | #pintrest #homedecor #shorts #diy #crafts #wallhanging #walldecor ...,home decor ideas
youtube,,https://www.youtube.com/watch?v=IjBCn_6KcaM,1761908442,Sustainable Luxury Home Design Ideas | Elegant Nature-Inspired Interiors with Modern Eco Touch,Sustainable luxury home design ✨ is redefining modern elegance by merging eco-conscious living with timeless sophistication.,home decor ideas
youtube,,https://www.youtube.com/watch?v=dAoC9wn2YC4,1761907957,✨diy home decor ideas ✨#diy #craft #shorts #ytshorts #artandcraft #shortvideo,diy home decor ideas ✨#diy #craft #shorts #ytshorts #artandcraft #shortvideo.,home decor ideas
youtube,,https://www.youtube.com/watch?v=Bfn4LZSKPsY,1761907723,DIY Mirror Wall Hanging | Beautiful Home Decor Idea | Easy Wall Art Craft | Part 1 Completed#diy,Aaj maine apna DIY Mirror Wall Hanging ka Part 1 complete kar liya ✨ Simple materials se bana ye stylish home decor piece ...,home decor ideas
youtube,,https://www.youtube.com/watch?v=4ejYTPfcrBQ,1761905171,Wall Decor Ideas For Home Decoration 🏠 Easy home decor#wallhanging #trending#shortsvideo#diy #craft,Wall Decor Ideas For Home Decoration Easy home decor#wallhanging #trending#shortsvideo#diy #craft #shortsviral ...,home decor ideas
youtube,,https://www.youtube.com/watch?v=U4mDKryN8Zk,1761903039,Modern Modular Kitchen &amp; TV Unit Design Ideas 2025 🌟| #shorts #interiordesign #modularkitchen #ideas,Modern Modular Kitchen & TV Unit Design Ideas 2025 | #shorts #interiordesign #modularkitchen #ideas ✨ Discover the ...,home decor ideas
youtube,,https://www.youtube.com/watch?v=JrxGuJ_w2IU,1761901404,4 Easy DIY Entrance Door Hanging ideas | Budget-Friendly Home Decor Jugaad 2025,4 Easy DIY Entrance Door Hanging Craft ideas | Budget-Friendly Home Decor Jugaad 2025 Decorate ur Entrance home beautiful ...,home decor ideas
youtube,,https://www.youtube.com/watch?v=U6ggWGR7mjw,1761898838,home decor ideas #craft #buddha #art #clay,clay #clayart home decor ideas #craft #buddha #art #clay.,home decor ideas
youtube,,https://www.youtube.com/watch?v=I1f05pzw2iw,1761897883,Diy cycle planter☘️ || home decor idea✨#shorts#diy #viralshort #shorts #ytshohort #viral #homedecor,Diy cycle planter☘️ || home decor idea✨#shorts#diy #viralshort #shorts #ytshohort #viral #homedecor.,home decor ideas
youtube,,https://www.youtube.com/watch?v=y2ULoIHr3Ik,1761897233,Make Your Sofa Feel Brand New! 😍 #HomeDecorIdeas #SofaStyle #CozyLiving,Make Your Sofa Feel Brand New! #HomeDecorIdeas #SofaStyle #CozyLiving.,home decor ideas
youtube,,https://www.youtube.com/watch?v=09UhOzljOmg,1761896927,DIY-wall hanging planter stand|easy sticks craft idea #wallhanging #homedecor #planter #shorts,DIY-wall hanging planter stand|easy sticks craft idea #wallhanging #homedecor #planter #shorts How to make wall hanging at ...,home decor ideas
youtube,,https://www.youtube.com/watch?v=rGwPPM_qako,1761894619,Bedroom Makeover | Home Decor Ideas | #homedecor  #ytshorts  #youtubeshorts #youtuber #viral,Bedroom Makeover | Home Decor Ideas | #homedecor #ytshorts #youtubeshorts #youtuber #viral.,home decor ideas
youtube,,https://www.youtube.com/watch?v=IMHPHzhe_Cg,1761894300,unique wall decor ideas!! #viralvideo #diy #craftyhome #homedecor #craft #artscraft #walldecor,,home decor ideas
youtube,,https://www.youtube.com/watch?v=s_2xN3sTaOc,1761889590,✨ Modern Home Decor Ideas | Transform Your Space with Stunning Interiors!,"Upgrade your home with these stunning interior decor ideas! From modern living rooms to cozy bedrooms, explore the latest ...",home decor ideas
youtube,,https://www.youtube.com/watch?v=Je7-THvrixI,1761916531,Small room ko bada dikhane ka best tricks #trading #short #shorts #luxury#ytshorts,Small room ko bada dikhane ka best tricks #shorts #luxury # viral #ytshorts.,small apartment decor
youtube,,https://www.youtube.com/watch?v=6ppyr8u-Uu0,1761916201,cozy loft apartment ✨😺 #cozynights,"""Cozy loft apartment tour"" - ""Small apartment design India"" - ""Loft bed apartment ideas"" - ""Compact living space decor"" - ""Studio ...",small apartment decor
youtube,,https://www.youtube.com/watch?v=IMkFDOwu0QQ,1761914238,Parisian Inspired Small Apartment Decor for Living Beautifully in Small Spaces,"Discover how to bring the timeless charm of Parisian decor into your small apartment. In this video, you'll explore 20 beautifully ...",small apartment decor
youtube,,https://www.youtube.com/watch?v=JvQZOOwDB4s,1761912832,🌿 Cozy Balcony Decor Ideas for Small Spaces | Big Style Inspiration ✨#viralshort,"Transform your small balcony into a cozy and stylish retreat! ✨ In this video, discover beautiful balcony decor ideas perfect for ...",small apartment decor
youtube,,https://www.youtube.com/watch?v=f7xYjBGRJ4U,1761912835,Maximize Every Inch! Best Tiny Apartment Decor Tips for Small Space Living,"Welcome to Decor Pedia — your go-to source for creative home decor inspiration! ✨ In this video, we'll show you how to ...",small apartment decor
youtube,,https://www.youtube.com/watch?v=qbYYnWQEzX8,1761912010,Small Room → Luxury Modern Bedroom Make over 30x34 ft Luxury Design,Welcome to ROOM BEYOND ✨ Is video me hum ek small bedroom ko modern luxury look me convert kar rahe hain: ✓ Layout ...,small apartment decor
youtube,,https://www.youtube.com/watch?v=HqEeJ2lzHZg,1761911397,Tiny Apartment Decor Ideas 2025 | Genius Small Space Design &amp; Storage Inspiration,"Welcome to Vhin Project! In this video, we're diving into Tiny Apartment Decor Ideas 2025 | Genius Small Space Design & Storage ...",small apartment decor
youtube,,https://www.youtube.com/watch?v=LcefHmndgqE,1761911286,Modern Apartment Design Ideas | Latest Trends &amp; Inspiration,"Explore the newest modern apartment designs redefining urban living in 2025. From minimalist layouts to luxury finishes, these ...",small apartment decor
youtube,,https://www.youtube.com/watch?v=HrDqW7E9v70,1761908440,Cozy 400 Sq Ft Tiny Apartment Design to Stylish Decor on a Budget,This video from Gazala Home Design explores how to transform a compact 400-square-foot apartment into a cozy and stylish ...,small apartment decor
youtube,,https://www.youtube.com/watch?v=bFb99HX_k_w,1761904870,Smart Layout And Colour Transforms Small Apartment #nevertoosmall #shorts,Smart Layout And Colour Transforms Small Apartment #nevertoosmall #shorts #architecture #tinyhome #tinyhouse ...,small apartment decor
youtube,,https://www.youtube.com/watch?v=78ObuY3e4Ac,1761903008,Interior Design Ideas for Studio Apartments|HH DECORS,InteriorDesign #HomeDecor #InteriorInspo #DreamHome #HomeAesthetic #DesignInspiration #DecorGoals #ModernInteriors ...,small apartment decor
