source,domain,url,created_utc,title,text,query
rss,www.yankodesign.com,https://www.yankodesign.com/2026/05/07/300w-and-7-ports-this-gan-charger-makes-every-other-multi-port-charger-look-embarrassingly-weak/?utm_source=rss&utm_medium=rss&utm_campaign=300w-and-7-ports-this-gan-charger-makes-every-other-multi-port-charger-look-embarrassingly-weak,1778204723,300W and 7 Ports: This GaN Charger Makes Every Other Multi-Port Charger Look Embarrassingly Weak,"300W and 7 Ports: This GaN Charger Makes Every Other Multi-Port Charger Look Embarrassingly Weak

<p class=""rws-nl-img""><a href=""https://www.yankodesign.com/2026/05/07/300w-and-7-ports-this-gan-charger-makes-every-other-multi-port-charger-look-embarrassingly-weak/""><img alt=""Six-port USB-C charging dock with a blue LED status panel showing per-port wattage on a rounded stand."" class=""attachment-post-thumbnail size-post-thumbnail wp-post-image"" height=""960"" src=""https://www.yankodesign.com/images/design_news/2026/05/draft-muitavy/MUITAVY_Gen2_300W_Power_7_in_1_Smart_GaN_Charging_Hub_hero.jpg"" width=""1280"" /></a></p><h2 class=""rws-nl-title"" style=""text-align: center;"">300W and 7 Ports: This GaN Charger Makes Every Other Multi-Port Charger Look Embarrassingly Weak</h2><div class=""rws-nl-excerpt"">Most GaN chargers on the market right now treat 140W like a finish line. Satechi hit it with their ChargeView hub and added a wattage...</div>",
rss,www.yankodesign.com,https://www.yankodesign.com/2026/05/07/tanto-blade-explained-why-the-angled-tip-dominates-2026-edc-knives/?utm_source=rss&utm_medium=rss&utm_campaign=tanto-blade-explained-why-the-angled-tip-dominates-2026-edc-knives,1778200207,Tanto Blade Explained: Why the Angled Tip Dominates 2026 EDC Knives,"Tanto Blade Explained: Why the Angled Tip Dominates 2026 EDC Knives

<p class=""rws-nl-img""><a href=""https://www.yankodesign.com/2026/05/07/tanto-blade-explained-why-the-angled-tip-dominates-2026-edc-knives/""><img alt=""Folding knife with a pale green handle and gray blade lying on dark leather, with a brass CIVIVI brand plate nearby."" class=""attachment-post-thumbnail size-post-thumbnail wp-post-image"" height=""955"" src=""https://www.yankodesign.com/images/design_news/2026/05/auto-draft/tanto_blade_explained_1.jpeg"" width=""1280"" /></a></p><h2 class=""rws-nl-title"" style=""text-align: center;"">Tanto Blade Explained: Why the Angled Tip Dominates 2026 EDC Knives</h2><div class=""rws-nl-excerpt"">Somewhere around the year 900 CE, a Japanese swordsmith solved a very specific problem. Samurai warriors needed a short backup blade that could function in...</div>",
rss,www.yankodesign.com,https://www.yankodesign.com/2026/05/07/casa-pinhal-proves-the-best-brazilian-architecture-barely-touches-the-ground/?utm_source=rss&utm_medium=rss&utm_campaign=casa-pinhal-proves-the-best-brazilian-architecture-barely-touches-the-ground,1778196637,Casa Pinhal Proves the Best Brazilian Architecture Barely Touches the Ground,"Casa Pinhal Proves the Best Brazilian Architecture Barely Touches the Ground

<p class=""rws-nl-img""><a href=""https://www.yankodesign.com/2026/05/07/casa-pinhal-proves-the-best-brazilian-architecture-barely-touches-the-ground/""><img alt=""Modern hillside house with exposed concrete pillars and wooden upper levels among trees."" class=""attachment-post-thumbnail size-post-thumbnail wp-post-image"" height=""960"" src=""https://www.yankodesign.com/images/design_news/2026/05/casa-pinhal/casa_pinhal_yanko_design_03.jpg"" width=""1280"" /></a></p><h2 class=""rws-nl-title"" style=""text-align: center;"">Casa Pinhal Proves the Best Brazilian Architecture Barely Touches the Ground</h2><div class=""rws-nl-excerpt"">Deep in the Serra da Mantiqueira, where the air is thin and the forest floor barely registers sunlight, Cornetta Arquitetura has completed Casa Pinhal —...</div>",
rss,www.yankodesign.com,https://www.yankodesign.com/2026/05/07/this-2550-hour-dress-blew-real-bubbles-at-the-met-gala/?utm_source=rss&utm_medium=rss&utm_campaign=this-2550-hour-dress-blew-real-bubbles-at-the-met-gala,1778193010,"This 2,550-Hour Dress Blew Real Bubbles at the Met Gala","This 2,550-Hour Dress Blew Real Bubbles at the Met Gala

<p class=""rws-nl-img""><a href=""https://www.yankodesign.com/2026/05/07/this-2550-hour-dress-blew-real-bubbles-at-the-met-gala/""><img alt=""Glamorous woman on the red carpet wearing a pearl bubble dress, surrounded by photographers and bubbles in the air."" class=""attachment-post-thumbnail size-post-thumbnail wp-post-image"" height=""960"" src=""https://www.yankodesign.com/images/design_news/2026/05/this-2550-hour-dress-blew-real-bubbles-at-the-met-gala/airo-08.jpg"" width=""1280"" /></a></p><h2 class=""rws-nl-title"" style=""text-align: center;"">This 2,550-Hour Dress Blew Real Bubbles at the Met Gala</h2><div class=""rws-nl-excerpt"">The Met Gala is probably the most popular and glamorous fashion event in the Western world. Whichever way you feel about the organizers and having...</div>",
rss,www.yankodesign.com,https://www.yankodesign.com/2026/05/07/your-samsung-galaxy-watch-will-soon-predict-sudden-fainting-before-it-happens/?utm_source=rss&utm_medium=rss&utm_campaign=your-samsung-galaxy-watch-will-soon-predict-sudden-fainting-before-it-happens,1778189440,Your Samsung Galaxy Watch will soon predict sudden fainting before it happens,"Your Samsung Galaxy Watch will soon predict sudden fainting before it happens

<p class=""rws-nl-img""><a href=""https://www.yankodesign.com/2026/05/07/your-samsung-galaxy-watch-will-soon-predict-sudden-fainting-before-it-happens/""><img alt=""Wrist wearing a round smartwatch showing a colorful wave pattern on a hospital bed, with patient in patterned gown nearby and medical tubing."" class=""attachment-post-thumbnail size-post-thumbnail wp-post-image"" height=""960"" src=""https://www.yankodesign.com/images/design_news/2026/05/your-samsung-galaxy-watch-may-soon-predict-sudden-fainting-before-it-happens/samsung-Fainting-Prediction-With-Galaxy-Watch-2.jpg"" width=""1280"" /></a></p><h2 class=""rws-nl-title"" style=""text-align: center;"">Your Samsung Galaxy Watch will soon predict sudden fainting before it happens</h2><div class=""rws-nl-excerpt"">Fitness trackers and smartwatches are great at monitoring various body parameters, so we can learn from the input and take care of our health and...</div>",
rss,www.yankodesign.com,https://www.yankodesign.com/2026/05/07/this-little-coffee-tool-fixes-a-v60-problem-you-didnt-know-you-had/?utm_source=rss&utm_medium=rss&utm_campaign=this-little-coffee-tool-fixes-a-v60-problem-you-didnt-know-you-had,1778185840,This Little Coffee Tool Fixes a V60 Problem You Didn’t Know You Had,"This Little Coffee Tool Fixes a V60 Problem You Didn’t Know You Had

<p class=""rws-nl-img""><a href=""https://www.yankodesign.com/2026/05/07/this-little-coffee-tool-fixes-a-v60-problem-you-didnt-know-you-had/""><img alt=""Split image: left side shows a gooseneck kettle pouring hot water into a conical coffee filter over a glass carafe; right side shows hands holding and separating a multi-layered, folded metal object."" class=""attachment-post-thumbnail size-post-thumbnail wp-post-image"" height=""960"" src=""https://www.yankodesign.com/images/design_news/2026/05/auto-draft/filter_presso_1.jpg"" width=""1280"" /></a></p><h2 class=""rws-nl-title"" style=""text-align: center;"">This Little Coffee Tool Fixes a V60 Problem You Didn&#8217;t Know You Had</h2><div class=""rws-nl-excerpt"">Somewhere between your gooseneck kettle and your burr grinder sits a problem nobody in the coffee gear industry bothered to productize until now. It is...</div>",
rss,www.yankodesign.com,https://www.yankodesign.com/2026/05/07/honor-is-building-a-12000mah-phone-that-proves-the-battery-vs-thinness-tradeoff-was-always-a-lie/?utm_source=rss&utm_medium=rss&utm_campaign=honor-is-building-a-12000mah-phone-that-proves-the-battery-vs-thinness-tradeoff-was-always-a-lie,1778181300,"Honor Is Building a 12,000mAh Phone That Proves the Battery-vs-Thinness Tradeoff Was Always a Lie","Honor Is Building a 12,000mAh Phone That Proves the Battery-vs-Thinness Tradeoff Was Always a Lie

<p class=""rws-nl-img""><a href=""https://www.yankodesign.com/2026/05/07/honor-is-building-a-12000mah-phone-that-proves-the-battery-vs-thinness-tradeoff-was-always-a-lie/""><img alt=""Three Honor smartphones in black, white, and blue stand upright against a snowy, stormy backdrop in ice and snow."" class=""attachment-post-thumbnail size-post-thumbnail wp-post-image"" height=""961"" src=""https://www.yankodesign.com/images/design_news/2026/05/auto-draft/honor_win2_12000mah_phone_1.jpeg"" width=""1280"" /></a></p><h2 class=""rws-nl-title"" style=""text-align: center;"">Honor Is Building a 12,000mAh Phone That Proves the Battery-vs-Thinness Tradeoff Was Always a Lie</h2><div class=""rws-nl-excerpt"">Seven years ago, Energizer walked into MWC 2019 with a phone that weighed as much as a small paperback novel and measured 18mm thick, all...</div>",
rss,www.yankodesign.com,https://www.yankodesign.com/2026/05/07/huawei-adds-99-diamonds-to-its-toughest-smartwatch/?utm_source=rss&utm_medium=rss&utm_campaign=huawei-adds-99-diamonds-to-its-toughest-smartwatch,1778174432,Huawei Adds 99 Diamonds to Its Toughest Smartwatch,"Huawei Adds 99 Diamonds to Its Toughest Smartwatch

<p class=""rws-nl-img""><a href=""https://www.yankodesign.com/2026/05/07/huawei-adds-99-diamonds-to-its-toughest-smartwatch/""><img alt=""Close-up of a silver wristwatch on a bare wrist with a green geometric rosette dial and braided band."" class=""attachment-post-thumbnail size-post-thumbnail wp-post-image"" height=""960"" src=""https://www.yankodesign.com/images/design_news/2026/05/huawei-adds-99-diamonds-to-its-toughest-smartwatch/Huawei_Watch_Ultimate_Design_Spring_Edition_02.jpg"" width=""1280"" /></a></p><h2 class=""rws-nl-title"" style=""text-align: center;"">Huawei Adds 99 Diamonds to Its Toughest Smartwatch</h2><div class=""rws-nl-excerpt"">Huawei’s latest luxury wearable explores a space the smartwatch industry still hasn’t fully resolved. Instead of presenting technology as something discreet, technical, or performance-first, the...</div>",
rss,www.yankodesign.com,https://www.yankodesign.com/2026/05/07/this-130cm-robot-just-took-buddhist-vows-at-a-seoul-temple/?utm_source=rss&utm_medium=rss&utm_campaign=this-130cm-robot-just-took-buddhist-vows-at-a-seoul-temple,1778170807,This 130cm Robot Just Took Buddhist Vows at a Seoul Temple,"This 130cm Robot Just Took Buddhist Vows at a Seoul Temple

<p class=""rws-nl-img""><a href=""https://www.yankodesign.com/2026/05/07/this-130cm-robot-just-took-buddhist-vows-at-a-seoul-temple/""><img alt=""A monk in white robes with a futuristic visor on the face holds a prayer gesture as orange-robed monks stand in the background under colorful lanterns at a ceremonial event."" class=""attachment-post-thumbnail size-post-thumbnail wp-post-image"" height=""960"" src=""https://www.yankodesign.com/images/design_news/2026/05/this-130cm-robot-just-took-buddhist-vows-at-a-seoul-temple/gabi-01.jpg"" width=""1280"" /></a></p><h2 class=""rws-nl-title"" style=""text-align: center;"">This 130cm Robot Just Took Buddhist Vows at a Seoul Temple</h2><div class=""rws-nl-excerpt"">There has been a lot of discussion lately about how Artificial Intelligence can affect all kinds of religion. From using ChatGPT to create sermons to...</div>",
rss,www.yankodesign.com,https://www.yankodesign.com/2026/05/07/lego-icons-road-bike-is-an-intricate-1015-piece-buildable-set-for-grown-ups/?utm_source=rss&utm_medium=rss&utm_campaign=lego-icons-road-bike-is-an-intricate-1015-piece-buildable-set-for-grown-ups,1778167207,"LEGO Icons Road Bike is an intricate 1,015-piece buildable set for grown-ups","LEGO Icons Road Bike is an intricate 1,015-piece buildable set for grown-ups

<p class=""rws-nl-img""><a href=""https://www.yankodesign.com/2026/05/07/lego-icons-road-bike-is-an-intricate-1015-piece-buildable-set-for-grown-ups/""><img alt=""Red LEGO road bicycle mounted on a trainer stand indoors, with a gray water bottle on the frame and keys on the table nearby."" class=""attachment-post-thumbnail size-post-thumbnail wp-post-image"" height=""960"" src=""https://www.yankodesign.com/images/design_news/2026/05/lego-icons-road-bike-is-an-intricate-1015-piece-buildable-set-for-grown-ups/LEGO-Icons-Road-Bike-Set-14.jpg"" width=""1280"" /></a></p><h2 class=""rws-nl-title"" style=""text-align: center;"">LEGO Icons Road Bike is an intricate 1,015-piece buildable set for grown-ups</h2><div class=""rws-nl-excerpt"">There’s something about the intricately scaled-down models of vehicles that takes me back to the nostalgic times. The memory of the miniature bicycle model that...</div>",
rss,www.archdaily.com,https://www.archdaily.com/1041277/casa-themis-sergio-sampaio-archi-plus-tectonica,1778180400,Casa Themis / Sergio Sampaio Archi + Tectônica,"Casa Themis / Sergio Sampaio Archi + Tectônica

<p>The project stems from a desire for a country home where the family can gather and entertain friends on weekends, fostering togetherness, leisure, and enjoyment of the scenery.</p>",
rss,www.archdaily.com,https://www.archdaily.com/1040544/detached-house-in-the-la-reserva-neighborhood-bahia-blanca-vagon-arquitectura,1778166000,Detached House in the La Reserva Neighborhood Bahía Blanca / Vagón Arquitectura,"Detached House in the La Reserva Neighborhood Bahía Blanca / Vagón Arquitectura

<p>On a corner lot with a north orientation, the project proposes a residence organized as a sequence of intermediate spaces that articulate the collective and the intimate, creating a continuous spatial experience.</p>",
rss,www.archdaily.com,https://www.archdaily.com/1041226/the-albanian-kaleidoscope-reconstruction-and-musealization-of-the-national-historical-museum-of-albania-casanova-plus-hernandez-architects,1778155200,The Albanian Kaleidoscope - Reconstruction and Musealization of the National Historical Museum / Casanova + Hernandez Architects,"The Albanian Kaleidoscope - Reconstruction and Musealization of the National Historical Museum / Casanova + Hernandez Architects

<p><em>THE TRANSFORMATIVE ROLE OF ARCHITECTURE: FROM IDEOLOGICAL INSTRUMENT TO PLATFORM FOR CRITICAL ENGAGEMENT</em> — Tirana is rapidly transforming, reflecting Albania's shift from decades of communist isolation toward a modern Mediterranean destination. The proliferation of towers designed by international architects makes this shift highly visible. However, a more subtle yet equally significant transformation is taking place within the city's cultural infrastructure.</p>",
rss,www.archdaily.com,https://www.archdaily.com/1041059/house-at-towns-edge-elliottarchitects,1778148000,House at Town's Edge / ElliottArchitects,"House at Town's Edge / ElliottArchitects

<p>Built on an existing foundation this house bridges two site conditions. The center of town is a five-minute walk from the front door; stroll out the back door, however, and one is in the Maine woods. A rift of granite blocks helps define the exterior spaces: parking, entry, and a back patio. This stone silhouette continues through the house where the blocks demarcate a wood stove alcove at the end of the living space. The landscaping, as well as details inside, is drawn from the owners' love of Maine granite quarries.</p>",
rss,www.archdaily.com,https://www.archdaily.com/1041153/building-with-the-landscape-non-invasive-design-strategies-for-steep-terrain,1778139000,Building with the Landscape: Non-Invasive Design Strategies for Steep Terrain,"Building with the Landscape: Non-Invasive Design Strategies for Steep Terrain

<p>The relationship between <a href=""https://www.archdaily.com/1039147/light-from-above-measuring-and-designing-daylight-under-sloped-roofs?ad_source=search&amp;ad_medium=search_result_articles"" rel=""noopener"" target=""_blank"">constraint and design excellence is well established in architectural theory, yet often remains underexplored</a> in discussions of site-specific practices. When architects encounter extreme topography, they face a fundamental choice: <a href=""https://www.archdaily.com/1040381/7-unbuilt-houses-shaped-by-site-climate-and-constraints?ad_source=search&amp;ad_medium=search_result_articles"" rel=""noopener"" target=""_blank"">transform the landscape to accommodate the building, or modify the building to fit the landscape</a>. The first approach is straightforward and requires the builder to cut, fill, terrace, and build on level ground. This choice, however, carries cascading consequences as any amount of earth moved may destabilize slopes, disrupt drainage, and fracture ecosystems. A growing body of <a href=""https://www.archdaily.com/1039635/adaptive-cabins-in-costa-rica-designing-for-humidity-and-ventilation-in-the-jungle?ad_source=search&amp;ad_medium=search_result_articles"" rel=""noopener"" target=""_blank"">innovative architectural work demonstrates an alternative to earth-moving and retaining walls.</a></p>",
rss,www.archdaily.com,https://www.archdaily.com/1040982/main-pavilion-of-the-international-horticultural-exhibition-2024-chengdu-cswadi,1778137200,Main Pavilion of the  International Horticultural Exhibition 2024 Chengdu / CSWADI,"Main Pavilion of the  International Horticultural Exhibition 2024 Chengdu / CSWADI

<p>Located in the <a href=""https://www.archdaily.com/tag/chengdu"">Chengdu</a> Eastern New Area, the 23,000-square-meter Main Pavilion is the exposition's core building, programmed to host the closing ceremony, international flower competitions, and forums. Following the event, it will transition into a civic cultural center. The design deeply respects the natural context, seamlessly integrating modern public architecture with Sichuan's natural and humanistic environments.</p>",
rss,www.archdaily.com,https://www.archdaily.com/1040984/buildner-launches-unbuilt-2026-and-reveals-unbuilt-2025-winners,1778136300,Buildner Launches Unbuilt 2026 and Reveals Unbuilt 2025 Winners,"Buildner Launches Unbuilt 2026 and Reveals Unbuilt 2025 Winners

<p><a href=""https://architecturecompetitions.com/?utm_medium=website&amp;utm_source=archdaily.com"" target=""_blank""><strong>Buildner</strong></a><strong> </strong>has launched <a href=""https://architecturecompetitions.com/unbuilt2026/archd?utm_medium=website&amp;utm_source=archdaily.com"" target=""_blank""><strong>Buildner's Unbuilt Award 2026</strong></a>, the third edition of its annual competition, offering a 100,000 EUR prize fund.</p>",
rss,www.archdaily.com,https://www.archdaily.com/1041285/oma-shohei-shigematsu-completes-first-public-project-in-japan-at-newly-renovated-edo-tokyo-museum,1778135400,OMA / Shohei Shigematsu Completes First Public Project in Japan at Newly Renovated Edo-Tokyo Museum,"OMA / Shohei Shigematsu Completes First Public Project in Japan at Newly Renovated Edo-Tokyo Museum

<p>The Edo-Tokyo Museum has reopened to the public following a multi-year <a href=""https://www.archdaily.com/tag/renovation"">renovation</a>, unveiling a series of <a href=""https://www.archdaily.com/tag/scenography"">scenographic</a> interventions and <a href=""https://www.archdaily.com/tag/installations"">installations</a> designed by <a href=""https://www.archdaily.com/tag/oma"">OMA</a> under the direction of <a href=""https://www.archdaily.com/tag/shohei-shigematsu/page/1"">Shohei Shigematsu</a>. Marking the firm's first public project in <a href=""https://www.archdaily.com/country/japan/page/1"">Japan</a>, the commission forms part of the broader renewal of the<a href=""https://www.archdaily.com/tag/museum/page/1""> museum</a>'s iconic building by <a href=""https://www.archdaily.com/tag/metabolism/page/1"">Metabolist architect</a> <a href=""https://www.archdaily.com/tag/kiyonori-kikutake/page/1"">Kiyonori Kikutake</a>. Originally opened in 1993 as the first museum dedicated to the history of <a href=""https://www.archdaily.com/tag/tokyo/page/1"">Tokyo</a>, the institution traces the city's evolution from the Edo period to the present day, and the new interventions aim to strengthen its relationship with contemporary audiences while preserving the identity of <a href=""https://www.archdaily.com/tag/kiyonori-kikutake/page/1"">Kikutake</a>'s architecture.</p>",
rss,www.archdaily.com,https://www.archdaily.com/1041225/casa-continua-studiotamat,1778133600,Casa Continua / STUDIOTAMAT,"Casa Continua / STUDIOTAMAT

<p>In Rome's Flaminio district, STUDIOTAMAT unveils Casa Continua, a 115 sqm apartment entirely reimagined through a project that engages with the home's layered history while opening it to new ways of living.</p>",
rss,www.archdaily.com,https://www.archdaily.com/1041264/a-cultural-center-in-the-arctic-and-a-new-look-at-croatian-modernism-this-weeks-review,1778131800,A Cultural Center in the Arctic and a New Look at Croatian Modernism: This Week’s Review,"A Cultural Center in the Arctic and a New Look at Croatian Modernism: This Week’s Review

<p>This week's selection of architecture news and projects invites a rethinking of the social, cultural, and environmental role of design across diverse scales and geographies. From community-led efforts to preserve modern heritage, such as the campaigns surrounding the <a href=""https://www.archdaily.com/1041096/saint-denis-brutalist-ilot-8-housing-complex-by-renee-gailhoustet-faces-controversial-redevelopment-plan"" rel=""noopener"" target=""_blank"">Îlot 8 housing complex in France</a> and a renewed photographic attention toward <a href=""https://piotr-bednarski.com/Aftermath-Split-3?utm_medium=website&amp;utm_source=archdaily.com"" rel=""noopener"" target=""_blank"">Croatia's Split 3 district</a>, to broader reflections on architecture's agency in the face of climate change and social transformation, many of the featured works question how architecture adapts over time and how it engages with collective life. This week's compilation also highlights architects expanding their practice beyond buildings <a href=""https://www.archdaily.com/1041143/from-lighting-to-modular-systems-archdailys-selection-of-13-architect-designed-objects-at-milan-design-week-2026"" rel=""noopener"" target=""_blank"">through furniture, lighting, and object design</a>, while three projects explore immersive relationships between landscape, climate, and observation in remote or environmentally sensitive contexts, from Arctic Norway to the oasis environments of the United Arab Emirates and the desert landscapes of Saudi Arabia.</p>",
rss,www.archdaily.com,https://www.archdaily.com/1041232/after-corbusier-how-southeast-asia-turned-the-satellite-city-into-a-transit-megaproject,1778126400,After Le Corbusier: How Southeast Asia Turned the Satellite City Into a Transit Megaproject,"After Le Corbusier: How Southeast Asia Turned the Satellite City Into a Transit Megaproject

<p>Southeast Asia is often narrated as a kind of architectural <a href=""https://www.archdaily.com/1032761/playscapes-and-public-imagination-the-ambiguous-play-in-urban-life-of-hong-kong"">playground</a>—an arena where modern and contemporary ideals have been tested at full scale through singular, iconic buildings. One can trace an easy lineage through names that have helped shape the region's <a href=""https://www.archdaily.com/1034779/frankfurt-architecture-city-guide-20-projects-tracing-a-skyline-between-history-and-modernity?ad_source=search&amp;ad_medium=search_result_articles"">skyline imagination</a>: Paul Rudolph's Lippo Centre in Hong Kong and The Concourse in Singapore, I.M. Pei's OCBC Centre and Hong Kong's <a href=""https://www.archdaily.com/153297/ad-classics-bank-of-china-tower-i-m-pei?ad_source=search&amp;ad_medium=projects_tab"">Bank of China Tower</a>, Norman Foster's Supreme Court of Singapore and the <a href=""https://www.archdaily.com/152495/ad-classics-hong-kong-and-shanghai-bank-foster-partners"">HSBC Main Building</a> in Hong Kong, Ron Phillips' Hong Kong City Hall, Moshe Safdie's Marina Bay Sands. Yet this familiar history—told through objects, colonialism, authorship, and signature forms—risks missing a deeper, more consequential layer of influence: the planning logics and infrastructural frameworks that have quietly structured how these cities expand, densify, and distribute everyday life.</p>",
rss,www.archdaily.com,https://www.archdaily.com/1041193/kerr-ssdh,1778122800,Kerr Apartment / SSdH,"Kerr Apartment / SSdH

<p>When the Fitzroy landmark, The MacRobertson's Chocolate Factory (built ~1900's), was converted between 1998 and 2003, it became an early and local example of the industrial apartment building typology. Rather than delivering a series of homogenous, standardised units, the redevelopment divided the amalgamation of warehouse spaces into a series of apartment 'shells' surrounding a voluminous central atrium. The 'shells' were sold to owners with the most minimal amenities, no more than a connection point for plumbing, fire services, and power, with the understanding that occupants would be responsible for their own internal fit-out.</p>",
rss,www.archdaily.com,https://www.archdaily.com/1041180/harudot-khaoyai-idin-architects,1778119200,Harudot Khaoyai Cafe / IDIN Architects,"Harudot Khaoyai Cafe / IDIN Architects

<p>Harudot Khao Yai is located on a sloping site descending from the main road toward a large water basin, opening to a panoramic view of the Khao Yai landscape. The architect recognized the site's potential not only as a café destination, but also as a public viewpoint—one that could be accessed independently by passersby without entering the café itself.</p>",
