source,query,url,created_utc,title,text
youtube,interior design trends,https://www.youtube.com/watch?v=LEaNOMmR2Fg,1764505368,Best Showroom Interior Design Ideas | Interior Design Trends | #shorts,এলিট ইন্টেরিয়র এন্ড ডেকোর আপনাকে দিচ্ছে আধুনিক ইন্টেরিয়র ...
youtube,interior design trends,https://www.youtube.com/watch?v=-FlmTa1JEG8,1764504901,Minimalist Interior. Interior Trends.Simple Modern Interior. ❤️❤️ #shortsfeed #dailyinteriors #yt,Minimalist Interior That Will Change Your Home ✨ | Modern Simple Design Trend Step into the world of minimalist interior design ...
youtube,interior design trends,https://www.youtube.com/watch?v=dyxhBIR0X-A,1764504368,"Modern Nature Home Tour 2025 | Peaceful, Aesthetic &amp; Ultra-Clean Design #elevation #housedesign","Modern Nature Home Tour 2025 | Peaceful, Aesthetic & Ultra-Clean Design #elevation #housedesign Experience a Modern ..."
youtube,interior design trends,https://www.youtube.com/watch?v=EnRUceCViGE,1764504023,"Wall Art Interior Design Trends 2025: Materials, Colors &amp; Styles Redefining Luxury Interiors",Luxury wall design transforms interiors by treating walls as expressive canvases rather than simple boundaries. Through ...
youtube,interior design trends,https://www.youtube.com/watch?v=w6W9ow_hCk0,1764504107,Best Small Apartment Interior Design 2025 | TV Wall Decor Ideas | BD Home Interior,Best Small Apartment Interior Design 2025 | TV Wall Decor Ideas | BD Home Interior Welcome to BD Home Interior! Discover the ...
youtube,interior design trends,https://www.youtube.com/watch?v=GN6_rIW8yzI,1764504006,Interior design | Interior designer | Interior designer near me | Call 9739026654,Interior design | Interior designer | Interior designer near me Instagram: https://www.instagram.com/decfort/?hl=en Website: ...
youtube,interior design trends,https://www.youtube.com/watch?v=3LHHq631STw,1764500414,Boho Bliss Haven: Cozy Home Design Ideas with Free-Spirited Architecture &amp; Natural Materials,"Boho Bliss architecture celebrates a free-spirited and soulful way of living, blending natural materials, warm earthy palettes, and ..."
youtube,interior design trends,https://www.youtube.com/watch?v=x9qvFdpUXUY,1764499074,10 Interior Design Ideas to Elevate Your Home Aesthetics #diyhangingdecoration #creativeideas Video2,Looking to upgrade your home? Here are 10 stunning interior design ideas that will instantly elevate the look and feel of your ...
youtube,interior design trends,https://www.youtube.com/watch?v=H62bG_GsI-A,1764493207,Latest Interior design trends 2025 #interior #ytshorts #yt,https://www.instagram.com/nexa_furniture_?igsh=em9tdzF2cDhjdnl1&utm_source=qr ...
youtube,interior design trends,https://www.youtube.com/watch?v=iVdMkZ3ugDM,1764491564,Trending Bed Designs you need in 2026 ✨🛌  #luxuryhomes #interiordesign #bespokefurniture #shorts,"Explore the latest bed design trends for 2026 — including tufted beds, canopy frames, art deco headboards, jute-textured finishes, ..."
youtube,interior design trends,https://www.youtube.com/watch?v=_zRQmbDHQDc,1764490503,Top Modern House Designs 2026 | Ultra-Modern Home Trends #shorts,Top Modern House Designs 2026 | Ultra-Modern Home Trends #shorts Discreption: Explore the top modern house designs of ...
youtube,interior design trends,https://www.youtube.com/watch?v=L9bwseFy85s,1764489480,POP design for  selling haal Bedroom design.#popceilling #popfalseceilingwork #popdesign  #viral,POP design for selling haal Bedroom design.#popceilling #popfalseceilingwork #popdesign #viral #ytshorts #home ...
youtube,interior design trends,https://www.youtube.com/watch?v=388RQCgkLKA,1764475203,Interior Design with AI #home #decor #interiordesign #ai #trending #shorts #shortsfeed #beforeafter,Witness the power of AI! I redesigned my room using ChatGPT interior design ideas and the results are stunning From a ...
youtube,interior design trends,https://www.youtube.com/watch?v=MIXDG5i5_3k,1764472984,🏡🎨 Design Your Perfect Bedroom | Pick Your Style! 🌟 #DreamHome #BedroomMakeover #ViralChoice,Welcome to the Dream Bedroom Design Challenge! Your bedroom isn't just a room—it's your personal universe. It's where you ...
youtube,interior design trends,https://www.youtube.com/watch?v=1ssbFZdG9p8,1764472974,🛏✨ Choose Your Dream Bedroom | Which One Is YOU? 💭 #DreamBedroom #RoomGoals #AestheticVibes,YouTube Video Description (Approx. 3000 words) Welcome to the ultimate Dream Bedroom Challenge! Have you ever ...
youtube,interior design trends,https://www.youtube.com/watch?v=s_fnoUGMHWs,1764472519,#designinterior #halldesigntvunit #interiordesign #interior #interiordesign #3bhkflatindelhincr,tvunit #interiordesign #interior #interiordesign #3bhkflatindelhincr interior design interior design by interior design 101 interior ...
youtube,interior design trends,https://www.youtube.com/watch?v=IJrukxX71Ts,1764468882,The Most Beautiful Aesthetics &amp; Designs #shorts,Discover the most stunning interior design trends and visual aesthetics that will inspire your next project. From beautiful designs to ...
youtube,interior design trends,https://www.youtube.com/watch?v=nzaQDCxUKBY,1764467571,Retro Revival: 7 Interior Design Trends to Make Your Home Cozy and Unique,"Step into the world of retro design trends! In this video, we explore the comeback of vintage-inspired styles that will transform your ..."
youtube,interior design trends,https://www.youtube.com/watch?v=cC12mtduB2c,1764464462,Modern Interior Design Trends: Igoods Material Showcase   #InteriorDesign  #wallpanel,"Experience how Igoods innovative architectural materials transform different spaces. Lightweight, eco-friendly, and beautifully ..."
youtube,interior design trends,https://www.youtube.com/watch?v=aZ7nTv996rw,1764463844,This Bedroom Looks Like Another Universe 🌌✨ | Unreal Luxury Design! #epoxy #diytransformation,Sky blue epoxy resin floor #diytransformation#epoxy Step inside the most mesmerizing bedroom you've ever seen — where ...
youtube,interior design trends,https://www.youtube.com/watch?v=61jZ4r3MmlA,1764453959,CHRISTMAS TRENDS TENDENCIAS DE NAVIDAD 2025 COMO DECORAR DECOR Design Trends HOME DECOR #christmas,diseñodeinteriores #casa #estilo #estilodevida #moderno #modern #contemporary #contemporaneo #estilocontemporaneo ...
youtube,interior design trends,https://www.youtube.com/watch?v=ifsXV5pnlJA,1764453864,CHRISTMAS TRENDS TENDENCIAS DE NAVIDAD 2025 COMO DECORAR DECOR Design Trends HOME DECOR #christmas,diseñodeinteriores #casa #estilo #estilodevida #moderno #modern #contemporary #contemporaneo #estilocontemporaneo ...
youtube,interior design trends,https://www.youtube.com/watch?v=UxA7onqHnoY,1764453816,CHRISTMAS TRENDS TENDENCIAS DE NAVIDAD 2025 COMO DECORAR DECOR Design Trends HOME DECOR #christmas,diseñodeinteriores #casa #estilo #estilodevida #moderno #modern #contemporary #contemporaneo #estilocontemporaneo ...
youtube,interior design trends,https://www.youtube.com/watch?v=TH0rSZl1x3Q,1764453387,CHRISTMAS TRENDS TENDENCIAS DE NAVIDAD 2025 COMO DECORAR DECOR Design Trends HOME DECOR #christmas,diseñodeinteriores #casa #estilo #estilodevida #moderno #modern #contemporary #contemporaneo #estilocontemporaneo ...
youtube,interior design trends,https://www.youtube.com/watch?v=eHuec1ajc4c,1764453331,CHRISTMAS TRENDS TENDENCIAS DE NAVIDAD 2025 COMO DECORAR DECOR Design Trends HOME DECOR #christmas,diseñodeinteriores #casa #estilo #estilodevida #moderno #modern #contemporary #contemporaneo #estilocontemporaneo ...
youtube,home decor ideas,https://www.youtube.com/watch?v=Qku5ZppeJaM,1764507717,“Dry Art Home Decor | Super Easy DIY Idea | Viral Trending Craft”,"Dry Art Home Decor | Super Easy DIY Idea | Viral Trending Craft” Your queries, Dry art se banaaye apne ghar ko aur bhi beautiful!"
youtube,home decor ideas,https://www.youtube.com/watch?v=L1ovzql5uug,1764507759,Diy Plant Decor Ideas |বাগান  সাজান সবুজ গাছের ছোঁয়ায় | Home Decor #shorts #garden #decor #diy,Diy Plant Decor Ideas |বাগান সাজান সবুজ গাছের ছোঁয়ায় | Home Decor #shorts #garden #decor #diy ...
youtube,home decor ideas,https://www.youtube.com/watch?v=rW-FUdSItEw,1764507703,WINTER HOME DECOR IDEAS #7 | Woodland Centerpiece,"winterhomedecor In this video, we're creating a beautiful woodland moment for the coffee table using simple pieces that bring ..."
youtube,home decor ideas,https://www.youtube.com/watch?v=i7GIJZPSlw4,1764507070,Cute Cat Wall Hook 😺 Fun Home Decor Idea  #short,A playful wall hook shaped like a cat wearing sunglasses. It can hold small items like keys or accessories and adds a fun touch to ...
youtube,home decor ideas,https://www.youtube.com/watch?v=E-knWl6sQFM,1764506434,Diy Paper Wall Hanging Room Decoration ideas#diy #shorts #wallhanging #youtubeshorts #craft,Diy Paper Wall Hanging Room Decoration ideas#diy #shorts #wallhanging #youtubeshorts #craft#papercraft #paperwallhanging ...
youtube,home decor ideas,https://www.youtube.com/watch?v=u4vG-yP4ULM,1764505943,Easy Planter Ideas | planter | Home Decorating Ideas | #diy #homedecor #shorts,"Easy Planter Ideas | planter | Home Decorating Ideas Hey everyone, In this video I have shared Easy beautiful diy planter idea ..."
youtube,home decor ideas,https://www.youtube.com/watch?v=XWReg4R2i3U,1764505826,Easy Wall Hanging Ideas 💡!! Diy cardboard #ytshorts #shorts #homedecor #Diy #walldecor #craft,Easy Wall Hanging Ideas !! Diy cardboard #ytshorts #shorts #homedecor #Diy #walldecor #artist #craft #oldcardboardreuse ...
youtube,home decor ideas,https://www.youtube.com/watch?v=ejdOOFoTmRc,1764505135,DIY Pista Shells Flower 🌿 | Home Decoration Idea | Easy Craft#drawing #art,"DIY Pista Shells Flower Making | Best Out of Waste Craft Welcome back to my channel! In today's video, I am going to show you ..."
youtube,home decor ideas,https://www.youtube.com/watch?v=2QM4BWvfFm0,1764502023,GREAT IDEAS FOR HOME DECOR,GREAT IDEAS FOR HOME DECOR#home#simplyelegant#eleganthomes#shorts.
youtube,home decor ideas,https://www.youtube.com/watch?v=5yiZPcEu2Qc,1764501538,DIY mirror decor ideas🌸#mirror #diy #mirrordecor #decoration #ytshorts #song #shorts #homedecor,DIY mirror decor ideas  #mirror #diy #mirrordecor #decoration #ytshorts #song #shorts #homedecor.
youtube,home decor ideas,https://www.youtube.com/watch?v=2eQ_vt0g5f8,1764500221,Simple DIY Wall Art With ice cream sticks #shorts,Simple DIY Wall Art With ice cream sticks #shorts #homedecorideas #diy #craft #wallhanging #icecreamstickcraftideas ...
youtube,home decor ideas,https://www.youtube.com/watch?v=scZCJxr1tDc,1764498915,new design for home decor ideas #youtubeshorts #homedecorideas #viralvideo,
youtube,home decor ideas,https://www.youtube.com/watch?v=XVjvUS012Oc,1764497763,craftkriti/bird tree/wall art/home decor ideas/showpieces/table decor/tree/unique crafts/trendingart,
youtube,home decor ideas,https://www.youtube.com/watch?v=_jmpDX_FyhM,1764494231,Old house renovation #HomeDecor #Home #InteriorDesign #DecorIdeas #DIY​ #shorts,"Transforming a house into a dream home! ✨ In this video, we take you through an inspiring home renovation journey — from ..."
youtube,home decor ideas,https://www.youtube.com/watch?v=Zjye3o_dUuw,1764493666,paper flower home decor idea l how to make paper flower 🌸 #art #papercraft #funny #flowers #craft,paper flower home decor idea l how to make paper flower #art #papercraft #funny #flowers #craft #subscribe #satisfying ...
youtube,home decor ideas,https://www.youtube.com/watch?v=QSk_q0LJuhY,1764492500,beautiful new style home decor ideas #youtubeshorts #homedecorideas #viralvideo,
youtube,home decor ideas,https://www.youtube.com/watch?v=wipzZNp195c,1764492551,new design home decor ideas for raining view #youtubeshorts #homedecorideas #viralvideo,
youtube,home decor ideas,https://www.youtube.com/watch?v=zrKpZQH3rpc,1764492475,new design home decor ideas #youtubeshorts #homedecorideas #viralvideo,
youtube,home decor ideas,https://www.youtube.com/watch?v=CZYlhJsmqeM,1764492471,Beautiful wallhanging craft ideas withpaper #diy#paperflower #homedecor #papercraft #youtubeshorts,
youtube,home decor ideas,https://www.youtube.com/watch?v=dRi14-FZRy0,1764491101,diy home decoration ideas/diy home decor 😨😱🎀 #youtubeshorts #shortsfeed #art #fypシ #viralshort,diy home decoration ideas/diy home decor #youtubeshorts #shortsfeed #art #fypシ #viralshort Transform your living space ...
youtube,home decor ideas,https://www.youtube.com/watch?v=oXmcvXMmfWU,1764489579,wall tape design ideas | masking tapes design in living room #homedecor #shortsfeed #viral,
youtube,home decor ideas,https://www.youtube.com/watch?v=rXATGXAN3LQ,1764489061,“Luxury Living Room Makeover | Elegant Home Decoration Ideas: #LuxuryHomeDecor #HomeDecor,Luxury Living Room Makeover | Elegant Home Decoration Ideas” #LuxuryHomeDecor #HomeDecor #InteriorDesign ...
youtube,home decor ideas,https://www.youtube.com/watch?v=WIJCaZwu2fY,1764488447,# diy # wall hanging 👌# Home decor ideas 👌#  short video ✨,
youtube,home decor ideas,https://www.youtube.com/watch?v=9w4vPSn76Nc,1764483000,7 Easy Diy Craft idea ✨|| DIY Home Decor 🌸|| #diy #craft #handmade#homedecor,7 Easy Diy Craft idea ✨|| DIY Home Decor || #diy #craft #handmade#homedecor best out of waste ideas for school comp home ...
youtube,home decor ideas,https://www.youtube.com/watch?v=tZB6Rw84VX0,1764481857,Diy Cardboard Home Decor ideas 💡 Handmade crafts #diy #ytshorts #handmade,Diy Cardboard Home Decor ideas Handmade crafts #diy #ytshorts #handmade.
youtube,small apartment decor,https://www.youtube.com/watch?v=w6W9ow_hCk0,1764504107,Best Small Apartment Interior Design 2025 | TV Wall Decor Ideas | BD Home Interior,Best Small Apartment Interior Design 2025 | TV Wall Decor Ideas | BD Home Interior Welcome to BD Home Interior! Discover the ...
youtube,small apartment decor,https://www.youtube.com/watch?v=iiPxPvevMIE,1764504082,Awesome Parisian Christmas Elegance 2025 | Timeless Parisian Holiday Decor for Apartment Living ❄️,christmasdecor2025 #holidaydecorideas #apartmentdecor The concept of Parisian Christmas Elegance 2025 centers around ...
youtube,small apartment decor,https://www.youtube.com/watch?v=9NlogsIrU20,1764503515,Tiny Apartment Genius Decor Ideas: Smart Space Hacks to Maximize Every Inch Instantly,Transform your tiny apartment into a functional and stylish oasis with these genius decor ideas and smart space hacks! ✨ In this ...
youtube,small apartment decor,https://www.youtube.com/watch?v=L1mq-P7LAv8,1764495739,"Genius Tiny Apartment Decor Ideas That Transform Small Spaces Into Beautiful, Cozy Homes","Transform your tiny apartment into a beautiful, cozy home with these genius decorating ideas. In this video, we explore smart, ..."
youtube,small apartment decor,https://www.youtube.com/watch?v=d3tamhjZ0QM,1764478847,From Tiny Space to Cozy Home#shorts,From Tiny Space to Cozy Home#shorts.
youtube,small apartment decor,https://www.youtube.com/watch?v=Q3j8aTpw800,1764476247,RELAXED LIVING UPGRADE ✨ Comfort in Every Corner of a 50m² Apartment Makeover,"Welcome to this Relaxed Living Upgrade — a full transformation of a 50m² apartment into a warm, comfortable, and beautifully ..."
youtube,small apartment decor,https://www.youtube.com/watch?v=rJztcthGqzU,1764457274,Modern Loft Apartment House 🏠,"Discover a modern loft apartment design with clean lines, warm lights, and minimalist luxury. Perfect inspiration for small homes, ..."
youtube,small apartment decor,https://www.youtube.com/watch?v=U6eE69D_7us,1764442635,"NYC Apartment Tour: Small Space, Big NYC Views!",Touring a tiny NYC apartment with huge city views! See how smart design makes the most of every inch in this small space.
youtube,small apartment decor,https://www.youtube.com/watch?v=GfgblBXkbtw,1764432023,Parisian Inspired Small Apartment Makeover  For a Timelessly Elegant Lifestyle,The Parisian-inspired small apartment makeover focuses on transforming limited space into a timeless and elegant sanctuary by ...
youtube,small apartment decor,https://www.youtube.com/watch?v=8vBJ6MPD_hY,1764432017,200 SQ FT *Basement* Studio Apartment Makeover,Shop Beam's exclusive Black Friday offer (11/28–11/30) here: https://shopbeam.com/GATER — get up to 50% off + a free $50 ...
youtube,small apartment decor,https://www.youtube.com/watch?v=sQPNnn5Q5k8,1764428262,Elegant French Inspired Apartment Walls  Parisian Molding &amp; Chic Paneling in Small Spaces,"Transform your apartment into a stunning French-inspired retreat with elegant molding, classic paneling, and Parisian decorative ..."
youtube,small apartment decor,https://www.youtube.com/watch?v=UFpJuCJPJqc,1764427271,Transform Your Tiny Apartment! Genius Decor Ideas to Instantly Make Any Small Space Feel Larger!,Transform your tiny apartment into a spacious-feeling home with these genius decor ideas designed to instantly make any small ...
youtube,small apartment decor,https://www.youtube.com/watch?v=DPYQckarlrg,1764424831,CALIFORNIA HOUSE TOUR | An Chic &amp; Eclectic San Francisco Apartment | Small Space Storage Hacks,"We're touring the San Francisco home of content creator Bergen Flom, who describes her style as ""modern folk."" For more ..."
youtube,small apartment decor,https://www.youtube.com/watch?v=hdAh8Ll81Bo,1764422458,DIY Scented Decor for a Cozy Apartment Christmas,ransform your small Apartment Kitchen with a vibrant and stylish Eclectic design that blends affordable décor with elegant ...
youtube,small apartment decor,https://www.youtube.com/watch?v=erodGTl7u-M,1764422227,Small Size Room Interior design #interior #room #shorts,Small Size Room Interior design #interior #room #shorts Welcome to Achutum Group – Unlocking Dream Homes in Jaipur!
youtube,small apartment decor,https://www.youtube.com/watch?v=Dcq6yzcvOJI,1764421297,Parisian Apartment Decor: Cozy Luxury Secrets For Small Spaces,Dive into the world of Parisian apartment decor where timeless elegance meets cozy luxury! Discover how to transform even the ...
youtube,small apartment decor,https://www.youtube.com/watch?v=arnpp6HpwvQ,1764418953,Genius Tiny Apartment Decor Ideas That Instantly Transform Small Spaces Into Stunning Homes,"Transform your tiny apartment into a stunning, functional haven with these genius decor ideas designed specifically for compact ..."
youtube,small apartment decor,https://www.youtube.com/watch?v=L1OxtotqbZk,1764417650,Parisian Small Apartment  Blending Modern   Classic French Style with Elegance,"Welcome to World Decor Studio! In this video, we explore a stunning Parisian small apartment that beautifully blends modern and ..."
youtube,small apartment decor,https://www.youtube.com/watch?v=YD3KhD2KiUU,1764414065,"Small Space, Big Style : Apartment Tour &amp; Minimalist Decor Tips","This minimalist apartment tour highlights how thoughtful design can transform even the smallest spaces into stylish, functional, ..."
youtube,small apartment decor,https://www.youtube.com/watch?v=-BRyVpwJbYE,1764410171,Small Room Transformation: Ultimate Space-Saving Kids&#39; Room,"SmallRoomSolutions ​#TinyBedroom Watch how this small, empty space is transformed into a highly functional and cozy ..."
youtube,small apartment decor,https://www.youtube.com/watch?v=8LJ2mYhorRk,1764408085,#recreationalvehicle  #travel  #camping #travel trailer camping#automobile,house design plan house design ideas interior design ideas interior design ideas for small house house design planner free ...
youtube,small apartment decor,https://www.youtube.com/watch?v=cvQs2FB4uK4,1764405020,Tiny Apartment Decor Ideas That Make It Look Bigger &amp; Better,"Tiny Apartment Decor Ideas That Make It Look Bigger & Better Make your tiny apartment feel brighter, wider, and more stylish with ..."
youtube,small apartment decor,https://www.youtube.com/watch?v=oNKlZkG2nJU,1764400861,CHEDI Turns Small Mumbai Flat into a DREAM HOME 😍 | 3D Design #shorts,CHEDI Turns Small Mumbai Flat into a DREAM HOME | 3D Design #shorts CHEDI Turns Small Mumbai Flat into a DREAM ...
youtube,small apartment decor,https://www.youtube.com/watch?v=vxpPE-n_peo,1764397166,For Sale Small Duplex villa 133 sqyd 5Bhk Beautiful Interior Design in Vaishali #shortsfeed #home,
youtube,small apartment decor,https://www.youtube.com/watch?v=bPgx1w4zaW4,1764379917,Let&#39;s Decorate for Christmas! Small Apartment Decor,
