source,domain,url,created_utc,title,text,query
youtube,,https://www.youtube.com/watch?v=1e9srfuvs1c,1761900924,#recreationalvehicle  #travel  #camping #travel trailer camping#automobile,house design plan house design ideas interior design ideas interior design ideas for small house house design planner free ...,small apartment decor
youtube,,https://www.youtube.com/watch?v=no4eCSajZ4U,1761899436,Interior Design Ideaa for Studio Apartments|HH DECORS,InteriorDesign #HomeDecor #InteriorInspo #DreamHome #HomeAesthetic #DesignInspiration #DecorGoals #ModernInteriors ...,small apartment decor
youtube,,https://www.youtube.com/watch?v=eI4uUFtVRPI,1761896792,Modern Bedroom Design | Elegant &amp; Space Saving Ideas for Small Rooms ✨🤌🏻 #shorts,Modern Bedroom Design | Elegant & Space Saving Ideas for Small Rooms ✨     #shorts #bedroomdesign #interiordesign ...,small apartment decor
youtube,,https://www.youtube.com/watch?v=snOcWdARLIk,1761888636,Interior Design Ideas for Studio Apartments|HH DECORS,InteriorDesign #HomeDecor #InteriorInspo #DreamHome #HomeAesthetic #DesignInspiration #DecorGoals #ModernInteriors ...,small apartment decor
youtube,,https://www.youtube.com/watch?v=W5ZRUwIutmQ,1761879643,CHEDI BUILT THE WORLD’S SMALLEST LUXURY FLAT 😱🏠✨ | 3D ANIMATION #shorts #cartoon #interiordesign,CHEDI BUILT THE WORLD'S SMALLEST LUXURY FLAT ✨ | 3D ANIMATION #shorts #cartoon #interiordesign.,small apartment decor
youtube,,https://www.youtube.com/watch?v=4-Cyz9DcFdw,1761874203,Interior Design Ideas for Studio Apartments|HH DECORS,InteriorDesign #HomeDecor #InteriorInspo #DreamHome #HomeAesthetic #DesignInspiration #DecorGoals #ModernInteriors ...,small apartment decor
youtube,,https://www.youtube.com/watch?v=qFqCV4O1eI4,1761856390,"100+ Small Living Room Design Ideas: Maximize Tiny Spaces with Smart Layouts, Modern Decor &amp; Storage","Small living room ideas, tiny apartment decor, space-saving layouts, modern minimalist styling, clever storage solutions—get ...",small apartment decor
youtube,,https://www.youtube.com/watch?v=e7oAqOpmBho,1761847316,Dream Living! A Cozy Duplex Apartment #HomeStyle #CozyVibes,"Step inside this cozy duplex apartment that defines dream living! ✨ Experience the perfect blend of warm interiors, modern ...",small apartment decor
youtube,,https://www.youtube.com/watch?v=DugURqvde9w,1761844778,Small Apartment Makeover! Genius Storage &amp; Decor Hacks to Maximize Every Inch,"Transform your small apartment into a stylish, functional haven with these genius storage and decor hacks! ✨ In this video ...",small apartment decor
youtube,,https://www.youtube.com/watch?v=Sgh9TrZrBK4,1761842469,Interior Design Ideas for Studio Apartments|HH DECORS,InteriorDesign #HomeDecor #InteriorInspo #DreamHome #HomeAesthetic #DesignInspiration #DecorGoals #ModernInteriors ...,small apartment decor
youtube,,https://www.youtube.com/watch?v=kdj63lwp-wU,1761841958,Interior Design Ideas for Studio Apartments|HH DECORS,InteriorDesign #HomeDecor #InteriorInspo #DreamHome #HomeAesthetic #DesignInspiration #DecorGoals #ModernInteriors ...,small apartment decor
youtube,,https://www.youtube.com/watch?v=9ZtWXjvuNBU,1761837819,Charming Parisian Small Apartment Décor With Simple 15 Stylish &amp;  Renter-Friendly Small-Space Tricks,"Transform your tiny home with Parisian small apartment ideas that blend renter-friendly mouldings, layered lighting, hidden ...",small apartment decor
youtube,,https://www.youtube.com/watch?v=gAD-19Cq9m4,1761837577,This Tiny 0.68㎡ Room Transformed Into A Luxury Micro-Home #shorts,,small apartment decor
youtube,,https://www.youtube.com/watch?v=8Hsv2gaF6yw,1761836412,Prieto Móveis - DESCONTOS MAIS BRINDES NA COMPRA DOS SEUS MÓVEIS PLANEJADOS DOS SONHOS,"Foi pensando em simplificar sua jornada que criamos o nosso Combo de Móveis Planejados. Uma solução completa, pensada ...",small apartment decor
