source,domain,url,created_utc,title,text,query
youtube,,https://www.youtube.com/watch?v=RdJLrt-EcdI,1777208400,55 New AMAZON FINDS for TINY Apartments | Smart Space Saving Furniture Ideas [With Prices],55 New AMAZON FINDS for TINY Apartments (2026) Tiny Apartments Finds are the ultimate game-changer for anyone living in a ...,small apartment decor
youtube,,https://www.youtube.com/watch?v=pT7X27Jshjk,1777206435,How Creating New York Aesthetics Apartment At Home | Quiet Luxury Small Space Living,How Creating New York Aesthetics Apartment At Home | Quiet Luxury Small Space Living Discover how to transform your small ...,small apartment decor
youtube,,https://www.youtube.com/watch?v=Cxq8N2iPsZY,1777204425,"Tiny Space, Big Style! Genius Apartment Decor Ideas for Small Living","Transform your tiny apartment into a stylish and functional haven ✨ In this video from Decor Pedia, we explore smart and ...",small apartment decor
youtube,,https://www.youtube.com/watch?v=3c1iHHHO9R4,1777204022,Aesthetic loft apartment design ideas 2026 | modern minimalist small apartment inspiration  #shorts,,small apartment decor
youtube,,https://www.youtube.com/watch?v=PS4zb3RDfJs,1777203535,Genius Tiny Apartment Decor Ideas 2026 | Small Space Living Made Stylish,"Transform your tiny apartment into a stylish and functional dream space with these genius decor ideas for 2026. In this video, Vhin ...",small apartment decor
youtube,,https://www.youtube.com/watch?v=MH2_gUAj8J8,1777199435,#recreationalvehicle  #travel  #camping #travel trailer camping#automobile,house design plan house design ideas interior design ideas interior design ideas for small house house design planner free ...,small apartment decor
youtube,,https://www.youtube.com/watch?v=NdfjISn-C6o,1777195917,#recreationalvehicle  #travel  #camping #travel trailer camping#automobile,house design plan house design ideas interior design ideas interior design ideas for small house house design planner free ...,small apartment decor
youtube,,https://www.youtube.com/watch?v=gzjoVHQSOBw,1777194535,AI Studio Apartment Makeover: Dubai Luxury Style,"Watch a studio apartment transform into a chic Dubai-inspired sanctuary with AI. Experience the future of luxury living, designed ...",small apartment decor
youtube,,https://www.youtube.com/watch?v=FwTITlb6T2o,1777194161,#recreationalvehicle  #travel  #camping #travel trailer camping#automobile,house design plan house design ideas interior design ideas interior design ideas for small house house design planner free ...,small apartment decor
youtube,,https://www.youtube.com/watch?v=xurl-3JUlGk,1777194075,좁은 집 2배 넓게 쓰는 스마트 수납 인테리어,"30평 아파트인데도 집이 좁고 답답하게 느껴지시나요? 사실 공간이 부족한 것이 아니라, 수납과 가구 배치가 제대로 정리되지 않았기 ...",small apartment decor
youtube,,https://www.youtube.com/watch?v=AFIjLCK_JOA,1777192353,High Pressure Shower Head Set Stylish Design with Powerful Water Spray Bathroom Upgrade #shortsfeed,"In this video, we showcase the ultimate triple touch sensor LED mirror and explore the latest LED mirror design perfect for modern ...",small apartment decor
youtube,,https://www.youtube.com/watch?v=ZqZN_8Y7tAs,1777191246,"Modern 2 Bedroom Apartment Tour | Terrace, Pool &amp; Beautiful View","This 2 bedroom small luxury apartment blends smart space planning with upscale living. Elegant decor, modern finishes, and a ...",small apartment decor
youtube,,https://www.youtube.com/watch?v=OawhP7_zHn4,1777187978,Small Studio Apartment renovation,,small apartment decor
youtube,,https://www.youtube.com/watch?v=8s2ifwZJagM,1777182335,Small bedroom design ideas 💡 #interiordesign #smallspaceliving #bedroomdecor #interior,,small apartment decor
youtube,,https://www.youtube.com/watch?v=_k7hZt72Mdo,1777179720,🤩 asthetic room decor ideas 💡 #decorationideas #home #trending #interiordesign #newvideo,asthetic room decor ideas #decorationideas #home #trending #interiordesign #newvideo Challenge Accepted ...,small apartment decor
youtube,,https://www.youtube.com/watch?v=uVAtl0ThtRI,1777176025,A must-have for small apartments: a sofa bed that combines two functions. #sofabed #sofa,"Welcome to Sofa! Discover the world of comfortable, stylish, and versatile sofas that bring any space to life. At Sofa, we're ...",small apartment decor
youtube,,https://www.youtube.com/watch?v=IiN8Eku_D9I,1777174325,Mini Luxury Room 🤯#shorts,"Mini Luxury Room #shorts #aispeedrun #luxury #studio luxury room design, aesthetic room setup, modern interior design, small ...",small apartment decor
youtube,,https://www.youtube.com/watch?v=fckoH2ehiG8,1777168830,Tiny Living Room Makeover | Cozy &amp; Minimal Small Apartment Ideas,"Tiny Living Room Makeover (Cozy & Minimal) ✨ In this video, I transform a tiny living room into a cozy and minimal space on a ...",small apartment decor
youtube,,https://www.youtube.com/watch?v=RafcZPAJJnU,1777168651,Genius Tiny Apartment Decor Ideas That Instantly Maximize Every Inch,"Looking to make your tiny apartment feel bigger, smarter, and more functional? ✨ In this video, we're sharing genius decor ...",small apartment decor
youtube,,https://www.youtube.com/watch?v=HJQ5k5peqsM,1777166448,Small Apartment Living Room Makeover | Dopamine decor ideas,Dopamine decor ideas #HomeDecor #InteriorDesign #RoomMakeover #CushionCovers #HomeDecorIdeas #InteriorStyling ...,small apartment decor
youtube,,https://www.youtube.com/watch?v=9pfoH1VnjdU,1777166022,Small Apartment Living Room Makeover in low budget #roommakeover,Small Apartment Living Room Makeover in low budget #HomeDecor #InteriorDesign #RoomMakeover #CushionCovers ...,small apartment decor
