source,query,url,created_utc,title,text
youtube,interior design trends,https://www.youtube.com/watch?v=sg6L_3tgv38,1763560879,A Tour of Interior Designs Inspired by Versailles Palaces (Gold Palace Decor).,"Welcome to the dream tour! Have you ever dreamed of living like royalty? In this video, we take you on a magical journey to ..."
youtube,interior design trends,https://www.youtube.com/watch?v=6eNo88tfpq4,1763560806,Design Trends That Hurt Your Home Sale (What Buyers REALLY Hate),Design Trends That Hurt Your Home Sale (What Buyers REALLY Hate) Are you getting your home ready to sell? Before you make ...
youtube,interior design trends,https://www.youtube.com/watch?v=-_bE9LkWq5A,1763560817,A Tour of Interior Designs Inspired by Versailles Palaces (Gold Palace Decor).,"Welcome to the dream tour! Have you ever dreamed of living like royalty? In this video, we take you on a magical journey to ..."
youtube,interior design trends,https://www.youtube.com/watch?v=dX0--MqFAJ8,1763558898,2026 Interior Design Trends Apartment Therapy | Apartment Therapy best Kids Bedroom Design,"Our Adventure Awaits collection is made for kids who love exploring, imagining, and creating their own world. Create a room that ..."
youtube,interior design trends,https://www.youtube.com/watch?v=PFqOwfOnefw,1763558106,The 2026 Design Trend You’re Not Ready For,"A major design shift is coming in 2026 — warmer, richer, layered, and nothing like the minimalism we've been living with."
youtube,interior design trends,https://www.youtube.com/watch?v=rsqV3tN6qeI,1763557308,Your BDNY Trend Report! #bdny #interiordesigntrends #interiordesign #commercialinteriordesign #trend,
youtube,interior design trends,https://www.youtube.com/watch?v=pWafBTKvQbk,1763554452,Retro Style Revival: 7 Interior Design Trends Making a Comeback | Vintage Home Decor Ideas,"Step into the past and bring retro charm into your home! In this video, we explore 7 vintage design trends that interior experts are ..."
youtube,interior design trends,https://www.youtube.com/watch?v=izlxTeziI8o,1763554173,“Modern Interior Designing &amp; Wall Cladding | Latest Home Decor Trend 2025 |,Interior Designing & Wall Cladding के लेटेस्ट और ट्रेंडिंग आइडियाज़ इस वीडियो में ...
youtube,interior design trends,https://www.youtube.com/watch?v=5ZLloTrFjys,1763553796,Retro Revival: 7 Interior Design Trends to Transform Your Home,"Step into the world of retro chic! Interior designers are bringing back the best of the 60s, 70s, 80s, and 90s to create cozy and ..."
youtube,interior design trends,https://www.youtube.com/watch?v=a6KMke7Jqwk,1763553603,Luxury Living Room Design Trends 2026 | Interior Design &amp; Coffee Table Ideas,"Luxury Living Room Design Trends 2026 | Interior Design & Coffee Table Ideas ✨ Transform your living room into a luxurious, ..."
youtube,interior design trends,https://www.youtube.com/watch?v=qMThz8XRoIE,1763552713,2025 MARBLE TRENDS: The Luxury Marbles Interior Designers ARE OBSESSED With ( Italian &amp; Imported ),"The perfect marble exists for every color palette and design style! ✨ Whether your project calls for the warm elegance of beige, ..."
youtube,interior design trends,https://www.youtube.com/watch?v=tnH6MDWbSug,1763549197,Bedroom interior design walkthrough you must watch #ytshorts #shorts,"Rare Bedroom interior design walkthrough #shortsfeed (Rare Bedroom interior design walkthrough #shortsfeed ) interior design, ..."
youtube,interior design trends,https://www.youtube.com/watch?v=m4ypC8KM_Ag,1763548241,Top 10 False Ceiling Design | gypsum ceiling Ideas#arbaazkhanpop #falseceiling #home #interiordesign,Top 10 False Ceiling Design | gypsum ceiling Ideas#arbaazkhanpop #falseceiling #home #interiordesign Elevate your home ...
youtube,interior design trends,https://www.youtube.com/watch?v=R6-sP7njzyg,1763543041,BIRLA OPUS PAINT WALL TEXTURE NEW DESIGN WALL PAINT TEXTURE,"BIRLA OPUS PAINT WALL TEXTURE NEW DESIGN WALL PAINT TEXTURE how to paint, wall texture, interior design tips, ..."
youtube,interior design trends,https://www.youtube.com/watch?v=a3NvnlUCAZc,1763542766,Interior Design Trends Say Hi #viral#shorts,youtubehsorts #viral#shorts #shortsvideo #interiordesign #livingroomdecor #walnutwood #ambientlighting #homeinspiration ...
youtube,interior design trends,https://www.youtube.com/watch?v=7Y217ug-Nho,1763540818,🔥Premium  Wooden Almira।। 🔥#trendswooden #interiordesign  #trends #shortvideo  vishal furniture..,
youtube,interior design trends,https://www.youtube.com/watch?v=FgpULAsyLss,1763539928,A Kitchen Floor Made of LAVA! #interiordesign #rustic #homeimprovement #shorts,Transform your space with this luxury epoxy lava kitchen design The molten-glow resin floor creates the illusion of walking on ...
youtube,interior design trends,https://www.youtube.com/watch?v=qbHtGLKeL_c,1763539715,Top Luxury Home Decoration &amp; Interior Design Ideas to Transform Your Entire Space in 2025 ✨🏡,Top Luxury Home Decoration & Interior Design Ideas to Transform Your Entire Space in 2025 ✨   Discover the Top Luxury Home ...
youtube,interior design trends,https://www.youtube.com/watch?v=Qv3RtbKNvtE,1763539500,Modern Living Room Dining Kitchen Bedroom Interior Drsign 2025 Ideas#interiordesign#home  #interiors,Modern Living Room Dining Kitchen Bedroom Interior Drsign 2025 Ideas Wall Decotate #interiorstudio_115 #home ...
youtube,interior design trends,https://www.youtube.com/watch?v=0cJCwdPMJE0,1763537604,Reel: Doors (OPK) - Fantoni / ریل: درها - فانتونی #Fantoni #OPK #InteriorDesign #MirazhStudio,Sometimes the smallest details create the biggest impact—and that's exactly what Fantoni accessories and OPK sliding doors ...
youtube,interior design trends,https://www.youtube.com/watch?v=RStTXG7FKeQ,1763533200,Chic &amp; Comfortable Living Room | Styled for Relaxation and Elegance #homedecor#interiordesign#shorts,"Subscribe to @Designhomedecor for daily inspiration, the latest trends, and expert tips to elevate your home. This video features ..."
youtube,interior design trends,https://www.youtube.com/watch?v=k9no8AdqhEo,1763524847,Latest Living Room Design Trends 2025 #10marlahouse,Inside a 6.15 Crore Designer House 10 Marla for Sale Bahria town lahore #designerhouse #10marla #houseforsale ...
youtube,interior design trends,https://www.youtube.com/watch?v=d0mDb7p1k1I,1763516879,Trendy Wardrobe interior Designs 2025/double door wardrobe designideas bedroom Trending ✨🤯,Trendy Wardrobe interior Designs 2025/double door wardrobe design ideas bedroom Trending ✨   Discover the latest double ...
youtube,interior design trends,https://www.youtube.com/watch?v=dOqw4brwR5M,1763497323,CHRISTMAS TRENDS TENDENCIAS DE NAVIDAD 2025 COMO DECORAR DECOR Design Trends HOME DECOR #christmas,diseñodeinteriores #casa #estilo #estilodevida #moderno #modern #contemporary #contemporaneo #estilocontemporaneo ...
youtube,interior design trends,https://www.youtube.com/watch?v=DPdkoq3V5IY,1763497389,CHRISTMAS TRENDS TENDENCIAS DE NAVIDAD 2025 COMO DECORAR DECOR Design Trends HOME DECOR #christmas,diseñodeinteriores #casa #estilo #estilodevida #moderno #modern #contemporary #contemporaneo #estilocontemporaneo ...
youtube,home decor ideas,https://www.youtube.com/watch?v=c4WzUS-jVOE,1763555996,Easy paper craft wall hanging ideas 😍#shorts #shortvideo #wallhanging #homedecor,Easy paper craft wall hanging ideas #shorts #shortvideo #wallhanging #homedecor.
youtube,home decor ideas,https://www.youtube.com/watch?v=RJeZtBnhNkQ,1763555851,DIY Flower Pot Craft 🪴🌷/ Home Decor Ideas #shorts #shortviral #shortsvideo #craft #painting,DIY Flower Pot Craft at Home Decor.
youtube,home decor ideas,https://www.youtube.com/watch?v=lFsnhF5agWo,1763555478,Beautiful Masterpiece Idea 😍💡 #handmade #masterpiece #homedecor,"Beautiful Masterpiece Idea #handmade #masterpiece #homedecor Hello, welcome to my channel madness 24×7."
youtube,home decor ideas,https://www.youtube.com/watch?v=1EFjT6Xgybc,1763555402,Home Decor ideas 2026 | Trendy interior ideas for house Renovation | 7 Tips Normal to Luxury House,Website :- https://civilsitevisit.com Telegarma Group :- https://t.me/civilsitevisit2022 Facebook Page ...
youtube,home decor ideas,https://www.youtube.com/watch?v=wwYiQiLYFZI,1763555428,Top 10 Modern Wall Design Ideas | PVC Wall Panel Design | Home Decor 2025,"Top 10 Wall Design Ideas for your home! Agar aap apne ghar, hall, bedroom, ya living room ko modern look dena chahte ho to ..."
youtube,home decor ideas,https://www.youtube.com/watch?v=MQik4Rfo9yM,1763555435,DIY flower vase | Home decor| #shorts,"DIY flower vase | Home decor Hey everyone, In this video I have shared Easy beautiful diy flower vase ideas which can be made ..."
youtube,home decor ideas,https://www.youtube.com/watch?v=J5rgf4gy-9c,1763555336,Wall decor idea using cake base board ✨ #diy #shorts #wallhanging #handmade #craftideas #homedecor,
youtube,home decor ideas,https://www.youtube.com/watch?v=zJtJ3kiCcUg,1763553798,7 most stylish home decor ideas with plants/home gardening/shorts,7most stylish home decor ideas with plants@nurturenature917 #plants #gardening #homegardening.
youtube,home decor ideas,https://www.youtube.com/watch?v=rOf--vlgHnI,1763553710,Home decoration #shorts#home decorating ideas#home decor#cozy home decor,Home decoration #shorts#home decorating ideas#home decor#cozy home decor.
youtube,home decor ideas,https://www.youtube.com/watch?v=VT52EIEJo6Q,1763551557,New Home Tour | Home Interiors | Home Decor ideas | My inlaws new Home | Kyuki Saas v kavi Bahu thi,
youtube,home decor ideas,https://www.youtube.com/watch?v=dTFxV2nsP9s,1763550302,Diy home decor ideas||cute wall hanging ideas #shortsvideo #artandcraft #ytviral #craftyhome #craft,
youtube,home decor ideas,https://www.youtube.com/watch?v=Om-kyhP9TVU,1763548042,Beautiful Glass Bottle Craft🌸 | Easy Home Decor Idea#homedecor #diy #shortsfeed #ytshorts,Beautiful Glass Bottle Craft   | Easy Home Decor Idea#homedecor #diy #shortsfeed #ytshorts Related tags - glass bottle craft idea ...
youtube,home decor ideas,https://www.youtube.com/watch?v=G4NKNrRgmtw,1763547945,Home decor ideas#diy#music #flute#craft#flowerpot #art#artandcraft #homedecor #home #homemade#,Home decor ideas#diy#music #flute#craft#flowerpot #art#artandcraft #homedecor #home #homemade#
youtube,home decor ideas,https://www.youtube.com/watch?v=-jhUhCCHZNg,1763547434,Diy easy cardboard room decor ✨🌜 #diy #homedecor #ideas,diy #diyideas #ideas #artandcraft #craft #easycraft #homedecor #aestheticroomdecor.
youtube,home decor ideas,https://www.youtube.com/watch?v=MrVB1qAf1Ro,1763544615,A beautiful diy home decor ideas #diy #shots #ytshorts #craft #homedecor,
youtube,home decor ideas,https://www.youtube.com/watch?v=BBUcu0-QbJ8,1763544464,Cardboard Home decor ideas #diy #youtubeshorts #trending #art #craft #handmade #viral #shorts,
youtube,home decor ideas,https://www.youtube.com/watch?v=qCh9BiRujck,1763541593,Paper Cup Home Decor DIY | Easy Best Out of Waste Craft Idea,"Transform simple paper cups into beautiful home decor with this quick and easy DIY idea! ✨ In this YouTube Short, I'll show ..."
youtube,home decor ideas,https://www.youtube.com/watch?v=Kb8tx4ITIq4,1763541110,#fypシ #diyideas #pov #homedecor #humor #fypシ゚viral #fouryou #ideas,
youtube,home decor ideas,https://www.youtube.com/watch?v=LQiM751tXWY,1763540601,birthday decoration ideas ✨#ytshorts #art #decoration #decor #homedecor,birthday decoration ideas ✨#ytshorts #art #decoration #decor #homedecor.
youtube,home decor ideas,https://www.youtube.com/watch?v=wJHMv3TdX2g,1763539661,DIY Home Decor Idea/ Icecream Stick DIY Craft #shortvideo #shortviral #craft #diy #homedecor,DIY Home Decor Idea/ Icecream Stick DIY Craft #shortvideo #shortviral #craft #diy #homedecor #ice cream stick craft #ice cream ...
youtube,home decor ideas,https://www.youtube.com/watch?v=YQjeJX1-X8g,1763537419,Home decorating ideas for Christmas || paper craft ideas #yt #shorts #craft #diy #christmas,Home decorating ideas for Christmas || paper craft ideas #yt #shorts #craft #diy #christmas #homedecor #papercraft #wallhanging ...
youtube,home decor ideas,https://www.youtube.com/watch?v=-xecP2nrRYc,1763536507,Aesthetic Wall Decor🌺| Home decor ideas #shorts #diy #craft #viral #trending #short #youtubeshorts,Aesthetic Wall Decor  | Home decor ideas #shorts #diy #craft #viral #trending #short #youtubeshorts how to make aesthetic wall ...
youtube,home decor ideas,https://www.youtube.com/watch?v=1qOG8rWIHlA,1763536270,crochet home decor ideas for table runners and table mats,crochet home decor ideas for table runners and table mats #tablerunner #tablemat #crochet #newdesignideas #homedecor.
youtube,home decor ideas,https://www.youtube.com/watch?v=eFDx4rF7d40,1763535976,beautiful new style home decor ideas for raining view #housedecorators #viralvideo #youtubeshorts,
youtube,home decor ideas,https://www.youtube.com/watch?v=XBgp0N7Vvlc,1763535956,beautiful new style home decor ideas for raining view #viralvideo #housedecorators #youtubeshorts,
youtube,small apartment decor,https://www.youtube.com/watch?v=U6gmLLMg0GI,1763560986,Small Apartment Makeover with Parisian Elegance | Chic Modern French Home Upgrade,"Welcome back to ATS Studio! In today's video, we take you inside a Small Apartment Makeover with Parisian Elegance, revealing ..."
youtube,small apartment decor,https://www.youtube.com/watch?v=m3_EfZx2Y8E,1763560533,Parisian Inspired Small Apartment Decor for a Cozy Yet Glamorous Ambiance,"Welcome to a warm, comforting, and delightfully inspiring journey into Parisian-inspired small apartment decor—a style that ..."
youtube,small apartment decor,https://www.youtube.com/watch?v=01FMhldFKHo,1763556491,Tiny Apartment Makeover Ideas for 2025 | Transform Your Small Space!,Transform your tiny apartment into a stylish and functional haven with these Tiny Apartment Makeover Ideas for 2025! ✨ Whether ...
youtube,small apartment decor,https://www.youtube.com/watch?v=o1CGf7fAYxs,1763553769,Genius Tiny Apartment Decor Ideas to Maximize Every Inch and Transform Your Small Space,"Transform your small apartment into a highly functional and stylish space with these genius decor ideas! ✨ In this video, we'll ..."
youtube,small apartment decor,https://www.youtube.com/watch?v=XKQM_rwxKoM,1763550066,"Christmas Decor for Small Spaces | Smart, Stylish &amp; Simple Farmhouse Vintage Ideas","Transform your cozy home into a warm and charming holiday retreat with Smart, Stylish & Simple Christmas Decor for Small ..."
youtube,small apartment decor,https://www.youtube.com/watch?v=uwMGXvm8aCM,1763547629,Small Apartment Decor on a Budget: Creative Ideas to Try!,"Transform your small Apartment into a cozy, stylish, and functional space—without spending a lot! In this video, we share a full ..."
youtube,small apartment decor,https://www.youtube.com/watch?v=3VjH9yJLIGs,1763546691,#recreationalvehicle  #travel  #camping #travel trailer camping#automobile,house design plan house design ideas interior design ideas interior design ideas for small house house design planner free ...
youtube,small apartment decor,https://www.youtube.com/watch?v=qbHtGLKeL_c,1763539715,Top Luxury Home Decoration &amp; Interior Design Ideas to Transform Your Entire Space in 2025 ✨🏡,Top Luxury Home Decoration & Interior Design Ideas to Transform Your Entire Space in 2025 ✨   Discover the Top Luxury Home ...
youtube,small apartment decor,https://www.youtube.com/watch?v=TTITSWcc9q4,1763535625,space saving folding multi functional furniture for small apartment #shorts,"space saving folding multi functional furniture for small apartment #shorts A magical tool for small apartments, a multifunctional ..."
youtube,small apartment decor,https://www.youtube.com/watch?v=1rIQHpHiONo,1763532004,"Tiny Room, Big Change | Minimalist Makeover in 20 Seconds #home #aestheticroomdecor #interiordesign","Watch as this tiny room undergoes a stunning minimalist transformation in just 30 seconds! From cluttered and cramped to clean, ..."
youtube,small apartment decor,https://www.youtube.com/watch?v=rQbV9L85d44,1763525288,"Small Apartment, Scandinavian &quot;HYGGE&quot; Style: 80 Design Ideas",Transform Your Small Apartment with Scandinavian Hygge Style ✨ Embrace the Cozy Vibes! Are you looking to transform your ...
youtube,small apartment decor,https://www.youtube.com/watch?v=OFOYp9qOhmw,1763516042,My Airbnb in Lisbon Portugal #realestate #lisbontravel #travelshorts #airbnb,"Tiny apartment, huge memories Exploring Lisbon one narrow street at a time! #travelabroad #europetravel."
youtube,small apartment decor,https://www.youtube.com/watch?v=gcGPAoa0PMQ,1763511307,Apartment Christmas decor| Small spaces,
youtube,small apartment decor,https://www.youtube.com/watch?v=nulDXu5As8s,1763503262,"Small Apartment Refresh | Minimal, Cozy + Budget-Friendly Decor Ideas","Less is more — especially when it comes to creating a calm, stylish home you love. In today's video, I'm taking you through my ..."
youtube,small apartment decor,https://www.youtube.com/watch?v=hHkiFypbsoQ,1763500721,French Elegance in Small Spaces – Parisian Apartment Decor Ideas,Welcome to Abula Decor! Discover the magic of French elegance in small spaces with our comprehensive guide to Parisian ...
youtube,small apartment decor,https://www.youtube.com/watch?v=v7rYGYNg0Os,1763492108,Interior Design Ideas for Studio Apartments|HH DECORS,youtube #youtuber #youtubeshorts #shorts #viral #trending #subscribe #contentcreator #newvideo #youtubevideo #explore ...
youtube,small apartment decor,https://www.youtube.com/watch?v=m66BI0vzMrM,1763481677,Step Inside the Cutest Tiny Home Ever!,Welcome to Dream Homes & Interiors! Step inside this amazing tiny house and get inspired by the beautiful home decor. See how ...
youtube,small apartment decor,https://www.youtube.com/watch?v=8Dk4sN6a4nk,1763476399,Beige aesthetic magic ✨🤍🏚️#HomeDecor#LivingRoomDecor#ModernInteriors#YouTubeShorts#TrendingShorts,"Credits: @Hygee_by_kate More decor inspiration → Follow them on Instagram Transform your home into a cozy, stylish haven ..."
youtube,small apartment decor,https://www.youtube.com/watch?v=SeAD8EfWoaU,1763475673,Elegant Parisian Small Apartment Makeover | Modern French Decor Transformation,Transform your small apartment with the timeless charm of Elegant Parisian style and the refined beauty of Modern French decor ...
youtube,small apartment decor,https://www.youtube.com/watch?v=dKFXnc1wZdM,1763474468,Small Apartment? Try These Luxe Home Décor Tricks for a Bigger Look!,SmallSpaceLiving #ApartmentDecor #USHomeDecor Small Apartment? Try These Luxe Home Décor Tricks for a Bigger Look!
youtube,small apartment decor,https://www.youtube.com/watch?v=-pDuWxG3ddo,1763470325,Genius Tiny Apartment Decor Ideas That Will Transform Your Space Instantly,"Transform your tiny apartment into a stylish, efficient, and cozy living space with these genius decor ideas! In today's video, we ..."
youtube,small apartment decor,https://www.youtube.com/watch?v=8mEKBHYUyBw,1763470096,Parisian Inspired Small Apartment Decor for Effortless Sophistication at Home,"Discover how to infuse your small apartment with Parisian-inspired elegance through gentle decorating ideas that bring beauty, ..."
youtube,small apartment decor,https://www.youtube.com/watch?v=b-XzxlR1omQ,1763468622,Genius Tiny Apartment Decor Ideas to Instantly Make Your Small Space Feel Larger,Transform your tiny apartment with smart and stylish decor ideas that instantly make your small space feel larger! In this video ...
youtube,small apartment decor,https://www.youtube.com/watch?v=D7qg7D6XR7A,1763468392,Minimalist Interior Design: Smart Small Space Solutions | Modern Home Ideas 2025,"Struggling to make your small apartment feel spacious and stylish? In this video, we'll show you how minimalist interior design ..."
youtube,small apartment decor,https://www.youtube.com/watch?v=hQJWgJ6aQKs,1763467301,Cozy Parisian Apartment  Stylish Retreat Decor Ideas for French Small Spaces,Discover how to transform a tiny space into a cozy Parisian retreat with World Decor Studio. This video is packed with stylish decor ...
