source,domain,url,created_utc,title,text,query
gnews,news.google.com,https://news.google.com/rss/articles/CBMiiwFBVV95cUxNMHdKdHUyOGlTWm5KT2hZUmhOc2I3TDNRZDBIV3NRV0JtNFRTTGZTZlBkUVlWM2JTNmlYdUdRejdvZmt2eXR3T051YWl1a1VTb0JFT3o1T0Vzb2dHT0pDN2JUQUNaRUxLOWdpcjBkcWVLM0VLSERXOGlNM2liU0dqdm96THhjTi1RTGdR?oc=5,1768658400,"We Asked 6 Interior Designers Which Trends Will Lead the Charge in 2026—Plus, What to Shop for Each One - Real Simple","We Asked 6 Interior Designers Which Trends Will Lead the Charge in 2026—Plus, What to Shop for Each One - Real Simple",interior design trends
gnews,news.google.com,https://news.google.com/rss/articles/CBMidkFVX3lxTFBxVk04Y0VaODhPUHhTMWh2NTBwaHVJN3A2YVpfeDlHYjFCdzFlMElUcmtDdWRWc2phRXFueEtsSVdZVFVMaGlBUDBtV3ByTFE5TTZuMjZFcHBjWFZzcjdEdmRjeFI3NkU5eWhNY0owRkVmbU1NWFE?oc=5,1767081600,The Vintage Interior Trends Designers Predict Will Define Homes in 2026 - Homes and Gardens,The Vintage Interior Trends Designers Predict Will Define Homes in 2026 - Homes and Gardens,interior design trends
gnews,news.google.com,https://news.google.com/rss/articles/CBMif0FVX3lxTE1nNktQd3BnR3pLemRNZGVJRW4ycVJWdnlSd0RVUTE0UkVnQzhncTNQN0ZiWlRkM0JlclNobFI1eWVaa3FtQjN5YzdvRjR2dW8yYmxha0haR1RMN1RwaTdGUExsSzB2ZlFtN29FU2IxMTk3Zm5qTVRxVVRJZnBuOXM?oc=5,1766908800,Designers Say These 5 Furniture Trends Are Out for 2026 - Real Simple,Designers Say These 5 Furniture Trends Are Out for 2026 - Real Simple,interior design trends
gnews,news.google.com,https://news.google.com/rss/articles/CBMihwFBVV95cUxQVGZYTU1yblhCcXNpenV3N2Y3MGh1WFVIWnFCWUMyWXlpU0RmMHdkbGhBQkQtWDU4R0xvUE9Cb0EwNEtDVXZSYjBWb0hzRHdsU0VOZ2tOLVI4Zkk1VjVvMEpmX1JfdXdzVkVEMzJSa2cwaFJCcjBrcGc2YjBfNWFETlF1UDYzeWM?oc=5,1768983523,Are 2016 Interiors Cool Again? - House Beautiful,Are 2016 Interiors Cool Again? - House Beautiful,interior design trends
gnews,news.google.com,https://news.google.com/rss/articles/CBMibEFVX3lxTE5QcmpCVE16enJwbVc2RUlSMnJGSUZNblctTjh4ZjdzY0pSeFNtUzc4QlNkYWx1YUVBbEpvaXM2Y3I2UEYyTjA5c3F1cVhBVXBMV1JWUjk4Tmh0MlFFUFpsbzJoelE4MXhHbEdhUg?oc=5,1765699200,"People Are Calling Out Home Design Trends That Scream ""I'm A Republican,"" And I Need To Know If You Agree - BuzzFeed","People Are Calling Out Home Design Trends That Scream ""I'm A Republican,"" And I Need To Know If You Agree - BuzzFeed",interior design trends
gnews,news.google.com,https://news.google.com/rss/articles/CBMirwFBVV95cUxPLUpRMWFlR2FVTWZYZTZhSE9wR0ZVVEJBcWRMV2NmWVVFMHBfTUg5MjBFMVFyNTVuWFhBUVlLRnFzdFRtcEEzS2xfc1VabUNWaWZFeFFFQVBNVzkwWk1FbnJuYy1mSXBpVU9ORm12Z3pUM2J6UGRCaHpNWG4zRE5JVV9ackprQmFXLTJPTnBuR3k1TnRSMnJuckVGcUZxZnJtRVB5NUxKTEVHRjMyNGdF?oc=5,1766908800,7 New Year's Decorating Resolutions Interior Designers Are Making for 2026 – Plus What to Buy Before They Sell Out - Homes and Gardens,7 New Year's Decorating Resolutions Interior Designers Are Making for 2026 – Plus What to Buy Before They Sell Out - Homes and Gardens,interior design trends
gnews,news.google.com,https://news.google.com/rss/articles/CBMipAFBVV95cUxNSkNuNGZxQWtTOVJSTnYtc3FOSjZEUWlJMU1hckhGdDVsZzdIQ2U2OE5CZUZCLW5kSGx0M1dnMmxEUVVqRkVjekxVV2dveUc0MWN4QzJMR2NDcXdFWjlmdndoeU9ldVFsdnVvaXNmMUdzc255aFo5QUtCWDlZQnFLaHJxdVUyZnZtMzdURS1YNUFnb3NXT1ZCRWg4Q3J2U3ZLazM3OQ?oc=5,1767081600,The interior design trends we’re definitely trying in 2026 - dallasnews.com,The interior design trends we’re definitely trying in 2026 - dallasnews.com,interior design trends
gnews,news.google.com,https://news.google.com/rss/articles/CBMipgFBVV95cUxPVVVlZEVieElhVThVRVFnSzlJSl8xLXlhWTU5UktWNm1ELXRfdXpROHpjeWVIS2RWT21TaWFVcEJhdkpEWkJnc3JlY2VWZ0tKaVlVX3ZYYTZ3b05pZDJBTkYtZ0J0RjRhRlA0MVg2NWZDdklNZzFLOUd4ZWV6aFNIaFJkRXBkeUlwcHJnS0swaGlzaEFqTVR4VDQweHM2d2xKY1RObjFR?oc=5,1767254400,"Moody, rich and cozy: Interior design predictions for 2026 - northjersey.com","Moody, rich and cozy: Interior design predictions for 2026 - northjersey.com",interior design trends
gnews,news.google.com,https://news.google.com/rss/articles/CBMifEFVX3lxTE9US04yWEVVUkhqSmJPX3RwSE9ybk5qRWJBbjR2QURIT24xaWxiS1RpT2c1S1VsTDZ4ZnBOTnpXQVVucXFiTVZwbHlxallaMVNyckEtQUlST2ZScGtDZG1SUkxNU0U5bmk3bXJZY1lhRERMajdEendqUndjNW8?oc=5,1768764600,The Kitchen Feature Designers Are Using to “Fake” a $1M Renovation - Apartment Therapy,The Kitchen Feature Designers Are Using to “Fake” a $1M Renovation - Apartment Therapy,interior design trends
gnews,news.google.com,https://news.google.com/rss/articles/CBMickFVX3lxTE5JaGJWYl9RaWtEMUtpNFhBMVJ6Yy1LeTBGV3lpOGVKS0RsV0lxaEdsMmJFSVQ3UUVMc0p1ME9PRzh5Vm1ZSG4xU3FFOHBCZkg5OFhVNFlTbWtSWGJ4aGVTN0Z5eVJuMFZZRzFnVFd6b3hCdw?oc=5,1768952280,We Asked Designers What Trendy Home Items People Regretted in 2025—They Named These 6 - The Spruce,We Asked Designers What Trendy Home Items People Regretted in 2025—They Named These 6 - The Spruce,interior design trends
gnews,news.google.com,https://news.google.com/rss/articles/CBMikAFBVV95cUxOM25qbFZhc1VvMW01VDkwRXhHeDdMaU43WW5rR1FiNDVyTkhVcUQ1UGFVZHFSN2dobmhIbjJHeklKTERWYXVDSzZYUzhCOWtscTFGN0ZtYWh1a3hXSXVwWTRJNHZFT1RsbE1kaV9IVHBBOExLNEotclFBWVpfVXB1UXZyRGtVSEFmMGNLcjhDY3o?oc=5,1768984200,"I’m Not the Biggest Fan of a Patterned Couch – But These 5 Sofa Color Trends Are Sure to Deliver the Chic, Subtle Statement I Want in 2026 - Homes and Gardens","I’m Not the Biggest Fan of a Patterned Couch – But These 5 Sofa Color Trends Are Sure to Deliver the Chic, Subtle Statement I Want in 2026 - Homes and Gardens",interior design trends
gnews,news.google.com,https://news.google.com/rss/articles/CBMiZkFVX3lxTE93RDk4RTNaM0Jza3hkcVA3UmZTQzhiQk4yaks3b1FnbXNEX3ZHR1dOV05SZTFvWmF6RENJcDJRTndxTXFSYzZUejdzdEdMV29ZYWVkOVg0T1dUTlYxQjYyZFpXWVg4dw?oc=5,1765526400,The home-design trends that will be everywhere in 2026 — and what's going out of style - Business Insider,The home-design trends that will be everywhere in 2026 — and what's going out of style - Business Insider,interior design trends
gnews,news.google.com,https://news.google.com/rss/articles/CBMickFVX3lxTE5RQVBZcFc4NDRYcmxxN2hXX09MaEppYmt5N2dBVkdJUXpuMWNvZUw1aDltbEZMenItOThQMDRtU013RG0tUFdPTEdMOFQ2QnNDMW9pVVlHaXpBaldxSXRmM2VMQ2k1TG04RXNidDdBY0VVQQ?oc=5,1765267200,Interior Design Trends of 2025 - ArchDaily,Interior Design Trends of 2025 - ArchDaily,interior design trends
gnews,news.google.com,https://news.google.com/rss/articles/CBMigwFBVV95cUxNVEloQTE1MUxPOTdDZ3k5bWVwam1abHpqM2ZXOGNqbG5JVnRBbWxIeVhDb2I0TG1yX3ROTXp6T1hIakRYRUF1MC00UV9hWnczWjlybnk4dl8weDEwV2lzZnM5SUFRaS15YTVTQmF4b2FXRnA5YUdqZHFueTFTWmNyZzZZUQ?oc=5,1767081600,Interior designers on their New Year decorating resolutions for 2026 - House & Garden,Interior designers on their New Year decorating resolutions for 2026 - House & Garden,interior design trends
gnews,news.google.com,https://news.google.com/rss/articles/CBMidEFVX3lxTE91TGJrY1FuQUhKQ3dqTGtNUWRPLTVlRURmS2UtaDlhS1VkNW56cXhNZWVwUDM2WTd4WFFza3QwZ2FrbjRfZ0lrZGEyWVZBa2tvTWpXX1FyRVQyVzJCZXR3ZFFiYXZIV21RRHNNcVgyT0JOZG8x?oc=5,1768975200,I Added This Tiny Backplate Upgrade Before My Kitchen Was Finished – Here’s Why It's Made A Huge Impact - Homes and Gardens,I Added This Tiny Backplate Upgrade Before My Kitchen Was Finished – Here’s Why It's Made A Huge Impact - Homes and Gardens,interior design trends
gnews,news.google.com,https://news.google.com/rss/articles/CBMingFBVV95cUxOMnc3NGV2WlFKWm1mNXVtdFhOV1FzVjVneW5mbjM5bmFlbTNDWDdoYklSeVhrOGxPWnBKdW96eW5WaTYxU2tTSWVBc2w1bXpwbFNCdy1qSFFuUTYycXJRYzVNM1k3QU05eFBPQTZXa2VlRFdpY0NnZ3dxbldZaXNheWtrYTJMM05scDljYVJHSXFiZGN6dkdSWXpiWGx1Zw?oc=5,1768680350,5 Bathroom Design Trends Already Taking Over in 2026 - Country Living Magazine,5 Bathroom Design Trends Already Taking Over in 2026 - Country Living Magazine,interior design trends
gnews,news.google.com,https://news.google.com/rss/articles/CBMifEFVX3lxTE5nQlpzYkJBYlFxME5VODl1NXlHRTc5MHdCejFlYmRVWXlsbU1JMEdwMmtUbjQyZU56cWpUUTVSVXFxSzc0b3cydWc4MWpvRlhKRm9TUlphS2lKbzZfRG50b05QNlQ3TUpndDBaTnBGZ2xKbzdnbE1ubWVFOTA?oc=5,1769014800,"Goodbye Gray—This Soothing Paint Color Will Be Everywhere This Year, Designers Say - Real Simple","Goodbye Gray—This Soothing Paint Color Will Be Everywhere This Year, Designers Say - Real Simple",interior design trends
gnews,news.google.com,https://news.google.com/rss/articles/CBMiaEFVX3lxTE1HRXZlOEEwSlNxUGpLY0kwVXUxOG4xUnRaTVVkR1pNa0ZpX2pLeS1wenBtTV9aZmZid0ZGLUlhemRMcXc2NUtMLVVqUnNJdTdIZGt3MTVnWm9sOVl4ZG5YN2M2ckVVM0Zq?oc=5,1768849440,Quiet Luxury Interior Design: 7 Ways to Nail the Look on a Budget - Better Homes & Gardens,Quiet Luxury Interior Design: 7 Ways to Nail the Look on a Budget - Better Homes & Gardens,interior design trends
gnews,news.google.com,https://news.google.com/rss/articles/CBMiggFBVV95cUxONGU4OTY3UzBiUjg2YmpZOGt6bEpaaU1GU3EzUkc3dGRKOWV1SHBSczFMWkRDV0pYMDFhNlJLYldxXy1tSnJEaVlQMFFqUk9aMWxTdl9xR1VpcG5Xc3ExNTBDUG16ejFFTTI4SUZHbXdzZkswWGZXMnBXWFFWTjBYcG5B?oc=5,1767945600,"Shea McGee Says This Once-Loved Color Has Truly Had Its Day – These are the Trends She's Leaving in 2025, and What She Chooses Instead for 2026 - Homes and Gardens","Shea McGee Says This Once-Loved Color Has Truly Had Its Day – These are the Trends She's Leaving in 2025, and What She Chooses Instead for 2026 - Homes and Gardens",interior design trends
gnews,news.google.com,https://news.google.com/rss/articles/CBMif0FVX3lxTE9KdkstMUs4M3AtdWRGVDNmRWJwYnF5bTRBMU5YbDJEaUQteU91R1d5UVJXY3NseVFuQUxjcktGbloycl95clgxclh6NWh6XzRtQnJqSy1odWZUWi1SUmxIaUNldVU1RV9lM3R2UjU2Y0xVYk9EcXUwUGxWRDVmUzA?oc=5,1765958400,The Decorating Trends Designers Are Leaving Behind in 2026 - domino.com,The Decorating Trends Designers Are Leaving Behind in 2026 - domino.com,interior design trends
gnews,news.google.com,https://news.google.com/rss/articles/CBMimAFBVV95cUxNY0RhM1NEVTMtNHZsUzVZQWFVZ2JaRE50UEUxR2l4NkdIcFAtV3NVMnpmZld0UEZsSmJFOWxrLVNpVlNzLWE0OVdmQ1BjdXNmN0Roc3ZYTkJKU1dZdGZqeHRoNWhaY2VlOFhmOXhlNFl6T2NOWjFaZVVJZkV2c0FPQVFUcUF0MWFHU1BzN1V6WDRydUMxcDdZTg?oc=5,1765958400,"I'm an interior designer. Here are 4 trends that are in this season, and 4 that are out. - Business Insider","I'm an interior designer. Here are 4 trends that are in this season, and 4 that are out. - Business Insider",interior design trends
gnews,news.google.com,https://news.google.com/rss/articles/CBMibkFVX3lxTE1BbExwNlpSaTllSWMxY1ZMa1ZGbHZHenVONzluTWFxVTlOR1Y0d0JtUlFBWXlWZTd6bUNWV3BRazlMQTFwZ3QyOHo2czJydTdZa3FBa3U3Q3pIa2oxd1l5WHRPSlJ3b05pWXU5ZnNB?oc=5,1767081600,"6 Decor Trends That Are Always Timeless, Designers Say - The Spruce","6 Decor Trends That Are Always Timeless, Designers Say - The Spruce",interior design trends
gnews,news.google.com,https://news.google.com/rss/articles/CBMitAFBVV95cUxPOXM4bGNxLUpoV1Z4d2taUzlBVm9OMGNVSTNwbWZjNE1EcUIzT3ZtRmdjYnp4OEUxaVhHMmxGU213YjVOQmRDNzd5cjQ0bVRWYXFxQzRFaEV0eThmT2k3eThBSFMwTXhvSXlSNlpPbUxtM0cwNEJlVG0tdnB4ZmdFcXhaZzNhcTNPZlNvdlgwQVBvd1ZRUHlQbUpUdjJHZjcxTXNqQmxVWmdVV0Nra3NETG5CTkE?oc=5,1767168000,Home design experts reveal their top interiors trends for 2026 - The Independent,Home design experts reveal their top interiors trends for 2026 - The Independent,interior design trends
gnews,news.google.com,https://news.google.com/rss/articles/CBMihgFBVV95cUxPYlR3QWlJMjFVY2VQdUlFcTE1U1pKSnQ1cks2WlJBN3NaM09oVzJobENVLWdPenhTdjBHNUk0bjJEY1JEOThIaGF2NlU4bVktVkFJYlpoMGZzbzdNalJsWGgzc0hVRjNQQXNKNGMtZGtKTnFlbjVtZU1QZG5QaE9XaHdHRWRJZw?oc=5,1767340800,"The Most Elevated Interior Trends to Add to Your Space in 2026 Start at $23, According to a Wayfair Shopping Expert - Real Simple","The Most Elevated Interior Trends to Add to Your Space in 2026 Start at $23, According to a Wayfair Shopping Expert - Real Simple",interior design trends
gnews,news.google.com,https://news.google.com/rss/articles/CBMiYkFVX3lxTFBVQnFST2NXTThrR3ZhOG5oR1lYQnFzcV9ETGNLZmpVNks0Vzc5SHR2LUtCMGwwcDItV19tWHY5dVV0R1o4MVd4c0p5eEpwV1lwQlJhTGl4bjY5d2Q5NHJ4Wmp3?oc=5,1767254400,Designers Predict These 6 Living Room Trends Will Define 2026 - Better Homes & Gardens,Designers Predict These 6 Living Room Trends Will Define 2026 - Better Homes & Gardens,interior design trends
gnews,news.google.com,https://news.google.com/rss/articles/CBMiiAFBVV95cUxNXzhBbWFYbGxBRGdyYW5FUEYxeFhyeV9SNGxBa0x5ank0U3FOQVRQdGNJdDZ6UXhMbm5mMUpCTkk3ZG93Ri0zR0o0dW1UWDBFMzZkazVvV3N1UVA2RnZHTnByYlNhZ1NUejZuRDZnbXUzbnp5c1NNQlN2MEk4dU9icmVXbWJMQnlJ?oc=5,1765267200,Pinterest's 2026 Interior Design Trends Are Here—And They're Bold - ELLE Decor,Pinterest's 2026 Interior Design Trends Are Here—And They're Bold - ELLE Decor,interior design trends
gnews,news.google.com,https://news.google.com/rss/articles/CBMihANBVV95cUxQU2xRUXRhdWQwYV82dktBYmZvVXhJODJkWmRENDdfQWt1aGVndEhkdjZ0Q2IyUGNhbEpEcGo4NFQ5Mmt1ZlZnZVpHaGloN2VWVDFqOWNRZ0FBa080dGVCekxPOU9RNGVCNE9nZGRNUjJ4MkZURWlQZF83Qk5mai1vdWg2SDhhMlVpdlVpcUdza0pWdkh1TS1HNXE3S2thamdYVEhXT2tiYmExaXBvV0dsd3Vaal9CbVo0THJaUTB1cHF2Si1pRjd2S3BncXRsQVdWRlh6U1NRdVJoWXJMSmZyaUhXM05hTUVMSkF5d3Z1UTY1VF80OC1aaWY1R2xYRTJkSWZMNFMzMy1FWk0wUC12THRBcEhwYWkxNEk2MUlCaEJrUU5meGdLNWlqeGc1cUd4aFI4V0paWU0yNml2N0JPaTdGazd0ZjlMR0lFOGF0SzA0QTJVRjNsa2tMMzRMbU00RnhETk5lTE9ubFZDYUx0V2Z2eE80R1BoYkdicVdqLWRTTkh1?oc=5,1765526400,"Interior Design: What’s In and Out for 2026, According to Hundreds of Pros - The Wall Street Journal","Interior Design: What’s In and Out for 2026, According to Hundreds of Pros - The Wall Street Journal",interior design trends
gnews,news.google.com,https://news.google.com/rss/articles/CBMitgFBVV95cUxNNUxRdjlEaTMwaGtvRFp2YWRWMHRSX3NJdTdPRVNOSFNuNnR1THlVYS04d29LclpwTnlIODJrYnc0cGxTNE9zZ0c4S0tVUEZHdklxU2dtVjZETTJwbXRVWklkMUVMaVpNQTE5Q09aTFhJdjJxbS1NczBmemFVZWtwZWtzUTNZcDZXYThxaEFVNEo3cUZXZUVNalNnQzFYU0ZOcmljT1c1MFh2Y01xSHkyQnpncnJIZw?oc=5,1768636800,The Best Old-School Decor Ideas Designers Still Love - Good Housekeeping,The Best Old-School Decor Ideas Designers Still Love - Good Housekeeping,interior design trends
gnews,news.google.com,https://news.google.com/rss/articles/CBMingFBVV95cUxNRzRKY2djcTBiQms1WjZmWnZLdFc1aUVUN1dDdGtaTUZNd25yaWhScngzTnVuNlF5TjgteXJ6LTc3SmhGbks1N3hvZWxEdk5sMFFYYzdJNzJiSUU3dXRtRVVHVWo0cEtvbzdzTTdaUDlpTFRtUmZTUEZZUTB1MnVlZDNoc3E0eHNLQnJRWWdYeFJub1ZYbVBwd1hWLVpPUQ?oc=5,1766131200,10 Interior Design Trends set to Define 2026 and Beyond - Country Living Magazine,10 Interior Design Trends set to Define 2026 and Beyond - Country Living Magazine,interior design trends
gnews,news.google.com,https://news.google.com/rss/articles/CBMiX0FVX3lxTE9OUkEwOHZMdjJpQ2Y4OFcwN3BOZUJxQ05zbVoxdXQyakxzSFdudUlDN05CaDRKazl5OXZOZEtkd3oyRjEzclB5aXNqcmIzbGw1VmRmNUdRVS13TlJ1WlBJ?oc=5,1766995200,The DIY Trends Designers Can't Wait to Try in 2026—and We Can’t Either - The Spruce,The DIY Trends Designers Can't Wait to Try in 2026—and We Can’t Either - The Spruce,interior design trends
gnews,news.google.com,https://news.google.com/rss/articles/CBMicEFVX3lxTE1nZVpLS2x2aWtVRnlBRnpvWUZHRHZKdUlIOFRtLTRWWHdkM2JFZERiWHhxU19ONWRIaTF6eDl3V3BJRXRvMzZyRGtUMmdSWDdFVXl1RnNoVGc5djMxakZweEZrTFRHTzJPeTdBeW84VmU?oc=5,1768998600,The Home Exterior Trends to Watch in 2026 - Dengarden,The Home Exterior Trends to Watch in 2026 - Dengarden,interior design trends
gnews,news.google.com,https://news.google.com/rss/articles/CBMieEFVX3lxTE1iamlTYkRtYmc0YW1CcHo5UzNoUGppRTBkdjJ1UVd6RlB0aDNmcm9KaGJkeEwyMWVzbUkxN2JnWTNhZllSU1c0TVZ3S3R4eGkyTlRhZ1lMN1k4VGVMbEM1cGVSWEN3VmZZUm5CdEt4WW1fZm1SZXRyYw?oc=5,1766131200,The 8 standout interior design trends set to shape 2026 - voguescandinavia.com,The 8 standout interior design trends set to shape 2026 - voguescandinavia.com,interior design trends
gnews,news.google.com,https://news.google.com/rss/articles/CBMijAFBVV95cUxPUVBneGY3eXZ6c3ZXXzBwc0Q5dzdvU2hSNFc3M1YwRngxendMU0RCMTFGVU1QVlduQ2RlRTBpUVVEVWZvak1KaVQyVXp6LUV4SzVUV2FxWWhjRFZSclBKd3E4aFVQODljX1QxbmVuSmZBWXAzaHpRZkdmQlN0RnhhTjV1bUo0blVUdUoxbw?oc=5,1766044800,Redecorating Your Living Room in 2026? These Are the Trends Designers Want to See You Use in the New Year - Homes and Gardens,Redecorating Your Living Room in 2026? These Are the Trends Designers Want to See You Use in the New Year - Homes and Gardens,interior design trends
gnews,news.google.com,https://news.google.com/rss/articles/CBMijwFBVV95cUxPdTY1b1JWRmdndzBabm9haUhFNXNfTDAzT0F4NWlzOEdzT0llUzhzWm53ZEl3Mm1rbEZxMEhUSlJQaHZodDJNWjVaNHl1N1NLNnAxdEJneElPT2tLRklPYUV5UDd6bmRLLU1nR2tHQVRrdTFrYmZEVGxJMjFCUHZGZTZoRjJ0VFlRaG5wdldvaw?oc=5,1768730876,'Going Analog' Is One Of The Year’s Biggest Wellness Trends – Here’s How To Do It At Home - House Beautiful,'Going Analog' Is One Of The Year’s Biggest Wellness Trends – Here’s How To Do It At Home - House Beautiful,interior design trends
gnews,news.google.com,https://news.google.com/rss/articles/CBMiogFBVV95cUxPbXktWlpDYzZ5dmY3TlAxVHF2NjlranpETUc3a0g3Uy1kQXluQnc0RFF4cmx0V2lyZlRfdEdfU0RKc2h5LVY5UEhvVFNaejZKdGMyU0RiMUJISFU1M3daU3B4YnY1SnBlTTdGNW5fMWVZRldkMERnWXJHLUtmWS1WNTE0X01UMzFqbk9LdHlla3llNEtabFJBaXdITS0tdWhZQ1E?oc=5,1765785600,10 'Old' Decor Trends Designers Never Thought Would Make a Comeback—But They Did - veranda.com,10 'Old' Decor Trends Designers Never Thought Would Make a Comeback—But They Did - veranda.com,interior design trends
gnews,news.google.com,https://news.google.com/rss/articles/CBMijgFBVV95cUxOZ2dIQ1BEXzBWM3NKTll1Ui0zXzlseGdUa1NhYTlYVDFMNHJGTXNFeTBkQVNuOHBRbDV3YXJWdl9wejg0dlZWUFQ5M2hScXBnWlk0eGpGZDRBZWFMY2ZuTnI2NmsySWZfd3c3RHFRV1RSOERKZUVmMmpfc0Y0VFZQOUJ1OWhvXzM1LXluZmxR?oc=5,1765267200,"10 Design Trends From 2025 You’ll Still See Everywhere in 2026, According to Experts - House Beautiful","10 Design Trends From 2025 You’ll Still See Everywhere in 2026, According to Experts - House Beautiful",interior design trends
gnews,news.google.com,https://news.google.com/rss/articles/CBMihwFBVV95cUxPNU5haDRpX3IzMjJHU0NDZ04xRFJOY0trdmZMaUh4bTMyeTV1b0lRRHhNc1Z2M09URHk5LXB6TWN3U05aTF9oNjVTQ2NkVUpiZzZaY2VyVDlRdzdKZmxNZDBDZWZmRjhDQ0x6OURqSHl1UlM5MlRkNjJneTVQdklJbUtBeUpaekU?oc=5,1768784544,3 Nostalgic Decorating Trends Making a Comeback in 2026 - Homes and Gardens,3 Nostalgic Decorating Trends Making a Comeback in 2026 - Homes and Gardens,home decor trend
gnews,news.google.com,https://news.google.com/rss/articles/CBMigwFBVV95cUxNYXBQelJaNXRoQ3dFWmZ2UUVvdDhTMmxZQ2FNZUxwRFl3aU9RZFRxZ01hQl9DVTF3X250VTk2M3FESDlSNWhyd3g3QUxfRFFPMC1MRUp3ajJfU00ta0pEbEFHR3Fsb1BqcFFHbW83SkJ2Szk1c0RyVnF2S2FFNGo0ZWhKbw?oc=5,1767427200,"5 Home Decor Trends Fading Out in 2026, According to Top Designers - ELLE Decor","5 Home Decor Trends Fading Out in 2026, According to Top Designers - ELLE Decor",home decor trend
gnews,news.google.com,https://news.google.com/rss/articles/CBMizAFBVV95cUxOX2phc1R6TkpqaHlJaDhTMmhiN3BJbHpKNWtPMzM5eEljZzVObi1oU0JZdU5CdWNwUG5zaG16dEd2V0JnaXpiWlVkNk5zRi1FUy1kWUJvelVMclZ1STJqd2RkWjRNY1dmQ1ppQWg2VS1mQndWb2p6VnZvUlBIZWg2WXlsZ3lWWjBDUERILUpNaV90azk3SmZLSXZhamtsQkkyREFDYk4yTkJuQnZRTGo5emRWa3dJQkFWR0w1ckI5c21DaXJrcmdtMk1mUU8?oc=5,1768570348,10 Home Trends Designers Say Will Look Dated by the End of 2026 - Good Housekeeping,10 Home Trends Designers Say Will Look Dated by the End of 2026 - Good Housekeeping,home decor trend
gnews,news.google.com,https://news.google.com/rss/articles/CBMijAFBVV95cUxOT3pVMk1pVWVlWFFld25aNjh6U2J3TWNwZFhQalZNdUdQaUZMcHNPNFdPMnRYT1NVOG41a1Zha0E5ZDlZS196aWljTzAxTGpDVE96a0Y1TzVfeUdCbmJSejI3RnhuUzRVVl8tSjExRTh3REZMVFRuVkVUQjVoQnhXS1R1bXoyRTNxNXR6eg?oc=5,1767772800,What Will Our Homes Look Like in 2026? - The New York Times,What Will Our Homes Look Like in 2026? - The New York Times,home decor trend
gnews,news.google.com,https://news.google.com/rss/articles/CBMiZkFVX3lxTE9vVThtWTdkU2hOekpVYnN5UnRsaEZneHFUZ3hrWVozN1ZwRmpDRGx6NWtKR1VwMWFfLWFXMTVPVnRqY0RqVXJ4NC1faFJ3elNWOV9KSG16Z3R1T2wtb0o2MDRBYmRYUQ?oc=5,1768709520,Designers Agree: These 9 Decor Trends Are Officially Outdated in 2026 - Better Homes & Gardens,Designers Agree: These 9 Decor Trends Are Officially Outdated in 2026 - Better Homes & Gardens,home decor trend
gnews,news.google.com,https://news.google.com/rss/articles/CBMikgFBVV95cUxOQnhsRVRwdmgxR3B3d3psSDlJOFMwczB6ZG9pVV9HWC1KU3B0akFOSTdHdGxBbjVaODdEQnhHcFdmTmdGZDh5Y1lXelkwODNGQ04yM3k2aDZpbmFuWC1FYWtUMjM4Tm5GN0s1d2RxeDducGpGY0tDemltWHJOMndlaVdFMXpBakh0TVppWGN2bUtkZ9IBZEFVX3lxTE9iazBkM1dHUW5IMjNFeEJTZU1kQThhMmpxWmpabVhONGdBVG14Z25DYkZlRl9wSW5MY3RNc0prN2tyd1ZaOExNbHAyYnU1azd2TXRRUlZxQ1JTdFVCYm5idldTVC0?oc=5,1768919077,See the New and Unexpected Trends in Home Décor - TODAY.com,See the New and Unexpected Trends in Home Décor - TODAY.com,home decor trend
gnews,news.google.com,https://news.google.com/rss/articles/CBMickFVX3lxTFBsakhFcDNROS05N3hIMURHdE9oazlxRmhkaHFUTFFBOW5fSkpvMFppd2xDanhRcHcwZC0zTDRDbGduLTlyN1lDSG5xMEZfZmpXVFNGNWJScmtfRnJpTURGSVNhM3lGU01DSWxQbjdOeEJlQQ?oc=5,1769013960,Designers Agree: These 4 Trends Were Short-Lived and Won't Be Back in 2026 - The Spruce,Designers Agree: These 4 Trends Were Short-Lived and Won't Be Back in 2026 - The Spruce,home decor trend
gnews,news.google.com,https://news.google.com/rss/articles/CBMinwFBVV95cUxPTC13a3RKTlhZeTZvTzFxcjExY3d5SndxNmZIdzNWcVJQSTRZbVNsVmVEZV9XcGNCc1JkR1JKUnU4c24wb1dsc0V3ZHZOOGU3RUJEZ2prWXJjNllNcVlDcWZBUU9ENnVZcmlzRnRLUnhkQjZaTEZRUElJaUU0VFJoVlQ5cGp2elQ5cUpvQVJheG5nNTNJRlFaeE4tQWxVa3c?oc=5,1766995200,"8 ""Tacky"" Home Trends That Are Tragically Dead to Designers in 2026 - House Beautiful","8 ""Tacky"" Home Trends That Are Tragically Dead to Designers in 2026 - House Beautiful",home decor trend
gnews,news.google.com,https://news.google.com/rss/articles/CBMiaEFVX3lxTE9DTS1haUExMWlZcEJ1blFzT0pCYXpObGowQXhsd3RGTmdSQ1JmN1dVdDRTRFdsWDhORGhIdS1USFNRLTg5b1JpOGgwV1JORDZabW42YXNGQ3EwdnlQb2g3MGRuUERhY2d6?oc=5,1765267200,The 11 Key Interior Design Trends Set to Define 2026 - Vogue,The 11 Key Interior Design Trends Set to Define 2026 - Vogue,home decor trend
gnews,news.google.com,https://news.google.com/rss/articles/CBMi1gFBVV95cUxOSXh5bnFic3hKazBHNTY5R3ZBLTN1Zy1uZlFvZU8zZmQycVlWNGdmek9ZRlFIM3RoZU8yUXIwLUxNWEh4eVg1TGE2T2Y5TXVlcS05N3d2T0pMT3N6eG9OTXI3SjdWdmZTX3ZCWlpDTGgyTjBDZEJkVGEtbHRCZUY5YzFEaWx6S2hVamttc3hWd3ZRLWFRQjQ4akNkY2dkS0ozUGRJWmt2dEpEWG04SllDR3huTTVaU1hNNDZTTEFwc2FXd2owbXVNRjVHR3ZGdVVWRkdiYVpn?oc=5,1768644180,Decorating? HGTV says this is the top home design trend in Mississippi - clarionledger.com,Decorating? HGTV says this is the top home design trend in Mississippi - clarionledger.com,home decor trend
gnews,news.google.com,https://news.google.com/rss/articles/CBMihwFBVV95cUxQbk9MN3ZGdnNla1d0Q2JyM3lnTmVxelE0cWtWREdJNEtmT0U3WVdSQzRPd0pEVWFWN3RSNkhjWUN0TnVzb1hWZGhkY3ZnaFAxQW80dnhXQ3RzTDhDekI1ZENLNWFnbWxRd1NYdkJTbW1pLWcwU0RYUk11YmlQc2tCV25FVkxqLW8?oc=5,1768809600,8 Outdated Home Features Designers Say Are Making A Comeback - Southern Living,8 Outdated Home Features Designers Say Are Making A Comeback - Southern Living,home decor trend
gnews,news.google.com,https://news.google.com/rss/articles/CBMipAFBVV95cUxQcjQ5Zl9lT3IzaFJLLTA2MUQ4LXpzcm04SGl1MldIeG51U1pELXduVmQtaTlnQzlDdldFemNrcHhwQVV1X1FrYThfMTZ4TGE3c3VzeHZHelp1ZGtZdzd0bU52TW42YnZnWlBHY1hmcGgyLXJ4Mk9yZzdsTVhfRFR5T0xTWWREQ1hzeDM4Q1REV1JwSF9KTkJ2TUVtUnQyRmttaGR1cA?oc=5,1766908800,Interior Designers Forecast Home Decor Trends for 2026 - Mansion Global,Interior Designers Forecast Home Decor Trends for 2026 - Mansion Global,home decor trend
gnews,news.google.com,https://news.google.com/rss/articles/CBMihwJBVV95cUxNU0w5RkxLcGxkUF9SOVN3MHBCbEtySHd1S2l3SFM2cGdvZVplU01sSGtnSVdUb2Y3eHhFdjh3dHl3THZGZ01PcnMyQVJsRk5ma3ozank2TWt3ZjZlWjVmbUZyc1VMbm9IdFc1b2tFdE9zbktrMjBxRzhvVHVOZWJQY2ZuUkFSYlJGRDB6Y3J6NmpHR2VxZ0JVWG9ZMWpCcDZic3V2cGIycFlTajBEOXBETWl0aFIxY0xEOEtPdG81Q2pHdjAxVmstMFBwZnQ2amtaNjgzRlZvV2ZsMjY3YU1rZXBiRWZoTTlOTDhodHhlWUxodXlwV0RrcmRNU28zR1ZNd3kwM1NwMNIBjAJBVV95cUxPcXN2NnRYR3hVRlYwWWtEZTJQWmR2all2bGU4UVpqUVNrV3lVY2NUakFWQUlxai1CdVNKVTdWNzNGMHI3Qnk0Tkd0LTJVWVF1M2JBRktUWXZFNGQ2SkJDb2I3dS1uOFdodVFlaGZUOGM5Um5DMkJjSWFzRUxBQmE0b1ZhU3hlQWcxaGZISDh4eDl1YzZqZ1Y2R3ZYSTJBbGdrZEFvLTMwZWtLZzZ4Nk9zUkk3cFd0aTRQb0xuLWNFMU1XZTlKMkJoUkVtR2Z3ZlVUUXB1NFBZQUJSMlJFenVveC1lOWtpZlJzTTRMMDNVZlRudXFwYTNlbVZHNDRMZjFDQVROR051Q1ltUnY2?oc=5,1768719000,Millennial grey is officially dead: Google searches reveal hottest home decor trends of 2026 - Times of India,Millennial grey is officially dead: Google searches reveal hottest home decor trends of 2026 - Times of India,home decor trend
gnews,news.google.com,https://news.google.com/rss/articles/CBMiswFBVV95cUxQS3hlX1dtaS1xYTg4YkN4b3lIekRIM2FYM3pHUk5VWEZwY3RDbk1UajZpdjV3LXBNSGhIbVJ0NjhoTWV5UU5YZ0Vzd0RoUG9tRXA0Q1gtU0NyRDFubXB3a1V0bTFmQzUwTmFrRDNqSC1XeUhVY0s5QWtUZWZYckNjTUxHQm9VOGZBRHVic3luYUpaWU1FQ294MlgzUTVSZ1ZuQU5qTTM3dERrdk9oTjBkczlkSQ?oc=5,1768669920,The Best Home Trends of 2026 - Good Housekeeping,The Best Home Trends of 2026 - Good Housekeeping,home decor trend
gnews,news.google.com,https://news.google.com/rss/articles/CBMifEFVX3lxTE50V01CS3dOTUdDR2haRFMzZTFMVFA5RUtBREdkM3pkNkVwWmhYNk9qWXVEVF9GT3lQTXFqbkRDQ1JuVVBraWw5ZVhfQkYwV245QWlldlZHS0NZVmt6XzFLcUhmd1Q4ZW5ndl9rclBXeGIxSkFvSjIteWZPM0I?oc=5,1767513600,HomeGoods Just Dropped Its 2026 Decor Forecast—These Trends Stand Out - The Spruce,HomeGoods Just Dropped Its 2026 Decor Forecast—These Trends Stand Out - The Spruce,home decor trend
gnews,news.google.com,https://news.google.com/rss/articles/CBMimAFBVV95cUxNLUNZaElncGRUY25qblRiQW13QTB5U0ptd3NhZEtNWTN3WUk4cjk3TEJoM250amZMRmRaNFoxbHJQT1ZaTkJ3bnM4eW1sMEpneWx4SVFOMjY0MVRubWxCSXc5SUdBaWxLejhnZ2o5eUVuaXhrcGI2bWxFaUJFVEtYZHhIRF9VOWltTUxmQklKQUpndGRHSHlPNQ?oc=5,1768705508,Is Your Home 'Cringey' in 2026? 3 Design Trends It’s Time to Say Goodbye to Immediately - Homes and Gardens,Is Your Home 'Cringey' in 2026? 3 Design Trends It’s Time to Say Goodbye to Immediately - Homes and Gardens,home decor trend
gnews,news.google.com,https://news.google.com/rss/articles/CBMinwFBVV95cUxQMmV2aVJYM2plNndGS0dVZVUtZG9IN1A3Mmh4OGVBQ2ktVW9TUzczVGpQYmlWc2g3cVhFVkZwc3hlVzM3Uk1DYWdTb0t3WWgtaDNVQnZuWUQ0MEQ1d3R6UGJHNzRvcXNTcUFaVnlQYW05V3R2RnkzaTVoLVpuOEZqNFh1cTlkVlFzUHdYX09WUkg3c0Z1bzlDb2FqU2o0dlE?oc=5,1767081600,The 4 Most Viral Interior Trends of 2025 - ELLE Decor,The 4 Most Viral Interior Trends of 2025 - ELLE Decor,home decor trend
