source,domain,url,created_utc,title,text,query
rss,www.yankodesign.com,https://www.yankodesign.com/2026/04/23/a-rolling-home-robot-that-recognizes-faces-and-detects-falls-for-549/?utm_source=rss&utm_medium=rss&utm_campaign=a-rolling-home-robot-that-recognizes-faces-and-detects-falls-for-549,1776938871,A Rolling Home Robot That Recognizes Faces and Detects Falls for $549,"A Rolling Home Robot That Recognizes Faces and Detects Falls for $549

<p class=""rws-nl-img""><a href=""https://www.yankodesign.com/2026/04/23/a-rolling-home-robot-that-recognizes-faces-and-detects-falls-for-549/""><img alt=""White, spherical robot with big blue eyes sits on a beige pedestal next to a white charging dock/dock station, in a neutral setup."" class=""attachment-post-thumbnail size-post-thumbnail wp-post-image"" height=""960"" src=""https://www.yankodesign.com/images/design_news/2026/04/a-rolling-home-robot-that-recognizes-faces-and-detects-falls-for-549/enabot-ebo-max-family-bot-04.jpg"" width=""1280"" /></a></p><h2 class=""rws-nl-title"" style=""text-align: center;"">A Rolling Home Robot That Recognizes Faces and Detects Falls for $549</h2><div class=""rws-nl-excerpt"">Smart home devices have gotten remarkably good at answering questions and playing music, but they&#8217;ve always had one big limitation: they stay put. A speaker...</div>",
rss,www.yankodesign.com,https://www.yankodesign.com/2026/04/23/the-oneplus-ace-6-ultra-finally-fixes-the-thumbs-on-screen-problem/?utm_source=rss&utm_medium=rss&utm_campaign=the-oneplus-ace-6-ultra-finally-fixes-the-thumbs-on-screen-problem,1776933922,The OnePlus Ace 6 Ultra Finally Fixes the Thumbs-on-Screen Problem,"The OnePlus Ace 6 Ultra Finally Fixes the Thumbs-on-Screen Problem

<p class=""rws-nl-img""><a href=""https://www.yankodesign.com/2026/04/23/the-oneplus-ace-6-ultra-finally-fixes-the-thumbs-on-screen-problem/""><img alt=""Handheld setup: a white game controller with red analog sticks is held below a black smartphone with purple neon design, ready for mobile gaming."" class=""attachment-post-thumbnail size-post-thumbnail wp-post-image"" height=""950"" src=""https://www.yankodesign.com/images/design_news/2026/04/the-oneplus-ace-6-ultra-finally-fixes-the-thumbs-on-screen-problem/oneplus-ace-6-ultra-05.jpg"" width=""1280"" /></a></p><h2 class=""rws-nl-title"" style=""text-align: center;"">The OnePlus Ace 6 Ultra Finally Fixes the Thumbs-on-Screen Problem</h2><div class=""rws-nl-excerpt"">Mobile gaming has come a long way from simple puzzle games and endless runners. Today&#8217;s smartphones can run graphically demanding titles at high frame rates,...</div>",
rss,www.yankodesign.com,https://www.yankodesign.com/2026/04/22/the-brightest-edc-flashlight-of-2026-packs-12300-lumens-active-cooling-and-still-fits-in-your-pocket/?utm_source=rss&utm_medium=rss&utm_campaign=the-brightest-edc-flashlight-of-2026-packs-12300-lumens-active-cooling-and-still-fits-in-your-pocket,1776908721,"The Brightest EDC Flashlight of 2026 packs 12,300 Lumens, Active Cooling, and Still Fits in Your Pocket","The Brightest EDC Flashlight of 2026 packs 12,300 Lumens, Active Cooling, and Still Fits in Your Pocket

<p class=""rws-nl-img""><a href=""https://www.yankodesign.com/2026/04/22/the-brightest-edc-flashlight-of-2026-packs-12300-lumens-active-cooling-and-still-fits-in-your-pocket/""><img alt="""" class=""attachment-post-thumbnail size-post-thumbnail wp-post-image"" height=""960"" src=""https://www.yankodesign.com/images/design_news/2026/04/draft-wuben/Wuben_X1Pro_flashlight_hero.jpg"" width=""1280"" /></a></p><h2 class=""rws-nl-title"" style=""text-align: center;"">The Brightest EDC Flashlight of 2026 packs 12,300 Lumens, Active Cooling, and Still Fits in Your Pocket</h2><div class=""rws-nl-excerpt"">EDC gear is converging. The knife becomes a multitool, the multitool becomes a bit driver, the bit driver becomes a pry bar, and somewhere in...</div>",
rss,www.yankodesign.com,https://www.yankodesign.com/2026/04/22/mooois-25th-anniversary-monster-chairs-have-hand-embroidered-creatures-on-every-backrest/?utm_source=rss&utm_medium=rss&utm_campaign=mooois-25th-anniversary-monster-chairs-have-hand-embroidered-creatures-on-every-backrest,1776904203,Moooi’s 25th Anniversary Monster Chairs Have Hand-Embroidered Creatures on Every Backrest,"Moooi’s 25th Anniversary Monster Chairs Have Hand-Embroidered Creatures on Every Backrest

<p class=""rws-nl-img""><a href=""https://www.yankodesign.com/2026/04/22/mooois-25th-anniversary-monster-chairs-have-hand-embroidered-creatures-on-every-backrest/""><img alt=""Row of black quilted chairs with colorful embroidered backs on a raised stage at a design event, with a large poster behind.—YD Yanko Design logo visible in the corner"" class=""attachment-post-thumbnail size-post-thumbnail wp-post-image"" height=""960"" src=""https://www.yankodesign.com/images/design_news/2026/04/auto-draft/moooi_monster_chair_1.jpg"" width=""1280"" /></a></p><h2 class=""rws-nl-title"" style=""text-align: center;"">Moooi&#8217;s 25th Anniversary Monster Chairs Have Hand-Embroidered Creatures on Every Backrest</h2><div class=""rws-nl-excerpt"">When Marcel Wanders designed the Monster Chair in 2014, the &#8220;monster&#8221; part was mostly conceptual. The piece had presence, sure, with its quilted leather upholstery...</div>",
rss,www.yankodesign.com,https://www.yankodesign.com/2026/04/22/this-60-japanese-tool-might-ruin-canned-beer-forever-and-thats-actually-the-point/?utm_source=rss&utm_medium=rss&utm_campaign=this-60-japanese-tool-might-ruin-canned-beer-forever-and-thats-actually-the-point,1776900600,"This $60 Japanese tool might ruin canned beer forever, and that’s actually the point","This $60 Japanese tool might ruin canned beer forever, and that’s actually the point

<p class=""rws-nl-img""><a href=""https://www.yankodesign.com/2026/04/22/this-60-japanese-tool-might-ruin-canned-beer-forever-and-thats-actually-the-point/""><img alt=""Hands lift and pull back the tab on a green beer can, revealing the opening. The can sits among other cans on a surface."" class=""attachment-post-thumbnail size-post-thumbnail wp-post-image"" height=""960"" src=""https://www.yankodesign.com/images/design_news/2026/04/this-60-japanese-tool-might-ruin-canned-beer-forever-and-thats-actually-the-point/Japanese_tool_might_ruin_canned_beer_forever_15.jpg"" width=""1280"" /></a></p><h2 class=""rws-nl-title"" style=""text-align: center;"">This $60 Japanese tool might ruin canned beer forever, and that&#8217;s actually the point</h2><div class=""rws-nl-excerpt"">There was a time when opening a can was just that, opening a can. A quick crack, a cold sip, and on with your day....</div>",
rss,www.yankodesign.com,https://www.yankodesign.com/2026/04/22/ikea-waited-12-years-to-show-this-inflatable-chair-at-milan-design-week/?utm_source=rss&utm_medium=rss&utm_campaign=ikea-waited-12-years-to-show-this-inflatable-chair-at-milan-design-week,1776897045,IKEA Waited 12 Years to Show This Inflatable Chair at Milan Design Week,"IKEA Waited 12 Years to Show This Inflatable Chair at Milan Design Week

<p class=""rws-nl-img""><a href=""https://www.yankodesign.com/2026/04/22/ikea-waited-12-years-to-show-this-inflatable-chair-at-milan-design-week/""><img alt=""Designer green upholstered chair with a tubular chrome frame on a mirrored pedestal in an industrial studio setting.  The YD Yanko Design logo is visible in the corner."" class=""attachment-post-thumbnail size-post-thumbnail wp-post-image"" height=""960"" src=""https://www.yankodesign.com/images/design_news/2026/04/auto-draft/ikea_inflatable_chair_mdw_1.jpg"" width=""1280"" /></a></p><h2 class=""rws-nl-title"" style=""text-align: center;"">IKEA Waited 12 Years to Show This Inflatable Chair at Milan Design Week</h2><div class=""rws-nl-excerpt"">Air has always been free. IKEA designer Mikael Axelsson has been thinking about that fact for over a decade, sitting on an idea he first...</div>",
rss,www.yankodesign.com,https://www.yankodesign.com/2026/04/22/10-best-gadgets-tools-that-make-going-off-grid-feel-like-an-upgrade/?utm_source=rss&utm_medium=rss&utm_campaign=10-best-gadgets-tools-that-make-going-off-grid-feel-like-an-upgrade,1776890726,10 Best Gadgets & Tools That Make Going Off-Grid Feel Like an Upgrade,"10 Best Gadgets & Tools That Make Going Off-Grid Feel Like an Upgrade

<p class=""rws-nl-img""><a href=""https://www.yankodesign.com/2026/04/22/10-best-gadgets-tools-that-make-going-off-grid-feel-like-an-upgrade/""><img alt="""" class=""attachment-post-thumbnail size-post-thumbnail wp-post-image"" height=""960"" src=""https://www.yankodesign.com/images/design_news/2026/04/best-gadgets-tools-that-make-going-off-grid-feel-like-an-upgrade/10_best_gadgets_off_grid_yanko_design_hero.webp"" width=""1280"" /></a></p><h2 class=""rws-nl-title"" style=""text-align: center;"">10 Best Gadgets &#038; Tools That Make Going Off-Grid Feel Like an Upgrade</h2><div class=""rws-nl-excerpt"">There&#8217;s a version of going off-grid that means giving things up — signal, comfort, hot coffee, reliable light. Then there&#8217;s the version a new wave...</div>",
rss,www.yankodesign.com,https://www.yankodesign.com/2026/04/22/brabus-urban-e-first-edition-bring-cyberpunk-flair-to-premium-electric-motorcycles/?utm_source=rss&utm_medium=rss&utm_campaign=brabus-urban-e-first-edition-bring-cyberpunk-flair-to-premium-electric-motorcycles,1776885338,BRABUS Urban E First Edition bring cyberpunk flair to premium electric motorcycles,"BRABUS Urban E First Edition bring cyberpunk flair to premium electric motorcycles

<p class=""rws-nl-img""><a href=""https://www.yankodesign.com/2026/04/22/brabus-urban-e-first-edition-bring-cyberpunk-flair-to-premium-electric-motorcycles/""><img alt=""Bright red Brabus sport motorcycle parked on pavement with green shrubbery behind it."" class=""attachment-post-thumbnail size-post-thumbnail wp-post-image"" height=""960"" src=""https://www.yankodesign.com/images/design_news/2026/04/brabus-urban-e-and-first-edition-bring-cyberpunk-flair-to-premium-electric-motorcycles/BRABUS-Urban-E-First-Edition-5.jpg"" width=""1280"" /></a></p><h2 class=""rws-nl-title"" style=""text-align: center;"">BRABUS Urban E First Edition bring cyberpunk flair to premium electric motorcycles</h2><div class=""rws-nl-excerpt"">German tuning specialist, BRABUS, has shown to what extremes four-wheeler modding can go when you’ve already got a powerful machine at hand. They’ve now partnered...</div>",
rss,www.yankodesign.com,https://www.yankodesign.com/2026/04/22/a-copper-wax-lamp-revives-a-slovak-forge-and-glows-like-stained-glass/?utm_source=rss&utm_medium=rss&utm_campaign=a-copper-wax-lamp-revives-a-slovak-forge-and-glows-like-stained-glass,1776878458,A Copper-Wax Lamp Revives a Slovak Forge and Glows Like Stained Glass,"A Copper-Wax Lamp Revives a Slovak Forge and Glows Like Stained Glass

<p class=""rws-nl-img""><a href=""https://www.yankodesign.com/2026/04/22/a-copper-wax-lamp-revives-a-slovak-forge-and-glows-like-stained-glass/""><img alt=""Copper-toned sculpture with four hammered circular disks mounted on copper posts on a black multi-level pedestal."" class=""attachment-post-thumbnail size-post-thumbnail wp-post-image"" height=""960"" src=""https://www.yankodesign.com/images/design_news/2026/04/a-copper-wax-lamp-revives-a-slovak-forge-and-glows-like-stained-glass/mdw-echoes-of-copper-slovak-university-of-technology-09.jpg"" width=""1280"" /></a></p><h2 class=""rws-nl-title"" style=""text-align: center;"">A Copper-Wax Lamp Revives a Slovak Forge and Glows Like Stained Glass</h2><div class=""rws-nl-excerpt"">Industrial heritage sites have a way of disappearing quietly. The machinery goes silent, the workers move on, and the buildings either get repurposed or left...</div>",
rss,www.yankodesign.com,https://www.yankodesign.com/2026/04/22/this-chair-looks-normal-until-it-needs-to-keep-you-afloat-in-a-flood/?utm_source=rss&utm_medium=rss&utm_campaign=this-chair-looks-normal-until-it-needs-to-keep-you-afloat-in-a-flood,1776874811,This Chair Looks Normal Until It Needs to Keep You Afloat in a Flood,"This Chair Looks Normal Until It Needs to Keep You Afloat in a Flood

<p class=""rws-nl-img""><a href=""https://www.yankodesign.com/2026/04/22/this-chair-looks-normal-until-it-needs-to-keep-you-afloat-in-a-flood/""><img alt=""Folded maroon and white upholstered chair resting on a white display table, showroom lighting in the background, Yanko Design logo in the lower right."" class=""attachment-post-thumbnail size-post-thumbnail wp-post-image"" height=""960"" src=""https://www.yankodesign.com/images/design_news/2026/04/this-chair-looks-normal-until-it-needs-to-keep-you-afloat-in-a-flood/mdw-aquaforma-domus-academy-04.jpg"" width=""1280"" /></a></p><h2 class=""rws-nl-title"" style=""text-align: center;"">This Chair Looks Normal Until It Needs to Keep You Afloat in a Flood</h2><div class=""rws-nl-excerpt"">Flooding has gone from a rare calamity to a recurring reality for millions of households. As climate patterns grow more unpredictable, the spaces people call...</div>",
rss,www.archdaily.com,https://www.archdaily.com/1040886/a-new-centre-pompidou-in-seoul-and-the-un-house-of-no-waste-how-competition-winners-this-weeks-review,1776922200,A New Centre Pompidou in Seoul and the UN House of No Waste (HØW) Competition Winners: This Week’s Review,"A New Centre Pompidou in Seoul and the UN House of No Waste (HØW) Competition Winners: This Week’s Review

<p>Observed annually on April 22, <a href=""https://www.archdaily.com/1040850/on-international-mother-earth-day-urban-rewilding-aquatic-ecosystems-and-ancestral-practices-for-biodiversity"" rel=""noopener"" target=""_blank"">International Mother Earth Day frames this week's architectural discourse</a> through an urgent call to rethink the relationship between the built environment and natural systems, foregrounding themes such as urban rewilding, the restoration of aquatic ecosystems, and the integration of ancestral knowledge into contemporary design practices. On another note, <a href=""https://www.archdaily.com/1040861/salone-del-mobililano-and-milan-design-week-2026-open-across-the-city-and-fairgrounds"" rel=""noopener"" target=""_blank"">the opening of Salone del Mobile.Milano 2026 and Milan Design Week 2026</a> seek to reinforce the global relevance of design as a platform for exchange and experimentation, activating the city of Milan through a network of exhibitions and installations that engage both industry and public audiences. Among the announcements of award-winning architectural projects this week, the United Nations' House of No Waste (HØW) Competition highlights emerging architectural responses to climate and resource challenges. The awarded projects demonstrate scalable strategies for reducing material waste and embodied carbon while promoting adaptable, socially responsive, and resource-conscious public infrastructure.</p>",
rss,www.archdaily.com,https://www.archdaily.com/1040825/podium-tower-urbanism-in-southeast-asia-density-management-and-the-disappearing-street,1776916800,"Podium–Tower Urbanism in Southeast Asia: Density, Management, and the Disappearing Street","Podium–Tower Urbanism in Southeast Asia: Density, Management, and the Disappearing Street

<p>If <a href=""https://www.archdaily.com/1040682/beyond-the-street-climate-commerce-and-the-evolution-of-hong-kongs-elevated-networks?ad_source=search&amp;ad_medium=search_result_articles"">elevated networks</a> reveal a city that increasingly walks above the street, the podium–tower is the typology that often makes that condition feel inevitable. Across <a href=""https://www.archdaily.com/tag/southeast-asia"">Southeast Asia</a>, podium–tower projects have become one of the dominant languages of <a href=""https://www.archdaily.com/1036590/urban-regeneration-in-greece-the-ellinikon-master-plan-and-beyond?ad_source=search&amp;ad_medium=search_result_articles"">metropolitan growth</a>: a system that concentrates housing, jobs, retail, and transit connections into highly legible and managed parcels. From an urban planning perspective, the model can be remarkably effective—absorbing <a href=""https://www.archdaily.com/1012235/navigating-2024-european-cities-make-strides-in-urban-cooling-congestion-and-connection?ad_source=search&amp;ad_medium=search_result_articles"">congestion</a>, formalizing circulation, and delivering density quickly. Yet as it spreads, the typology also raises a quieter question: what does it optimize for, and what does it erode—especially at the level of the street, where <a href=""https://www.archdaily.com/1040709/public-space-in-use-region-austral-and-the-architecture-of-everyday-life?ad_source=search&amp;ad_medium=search_result_articles"">urban life</a> is meant to be negotiated rather than curated?</p>",
rss,www.archdaily.com,https://www.archdaily.com/1040846/frenzy-stair-sepide-elmi,1776913200,Frenzy Stair / Sepide Elmi,"Frenzy Stair / Sepide Elmi

<p>The wall can be a compressed memory, a condensed memory of the process through which a mental wall is materialized. Through its very presence, it operates as a mechanism of visibility and invisibility. Walls are sometimes mental and sometimes physical, but in all cases, they are powerful. They possess the power to conceal and to reveal bodies, objects, and cities. The distinction between public and private life profoundly shapes behavior, clothing, and even the movements of the bodies.</p>",
rss,www.archdaily.com,https://www.archdaily.com/1040838/nth-neutral-tactile-habitat-ply-architecture,1776909600,NTH/ Neutral Tactile Habitat / Ply Architecture,"NTH/ Neutral Tactile Habitat / Ply Architecture

<p>Located within the tree-lined streets of <a href=""https://www.archdaily.com/tag/colonel-light-gardens"">Colonel Light Gardens</a>, NTH by Ply Architecture is a carefully resolved addition that responds to both context and family life. Set among a fabric of heritage bungalows, the project adopts a measured architectural language—balancing continuity with distinction—to ensure a respectful integration within its established streetscape.</p>",
rss,www.archdaily.com,https://www.archdaily.com/1040851/shell-book-pavilion-luo-studio,1776902400,Shell Book Pavilion / LUO studio,"Shell Book Pavilion / LUO studio

<p><em>Origin: A Response to a Familiar Place</em> — Xiangyun Town is not an unfamiliar place. Since it is close by, there were many occasions in the past to come here with my child. The earliest impressions of the place were, on the one hand, the many art installations in its public plaza areas, and on the other hand, its friendliness toward children and the community, with spaces for play and pause. Therefore, being invited this time to design and build a community book pavilion in the plaza felt more like returning to a place once encountered in everyday life and responding once again to the question of what kind of public space is truly needed here.</p>",
rss,www.archdaily.com,https://www.archdaily.com/1040849/louvered-house-i2a-architects-studio,1776884400,Louvered House / i2a Architects Studio,"Louvered House / i2a Architects Studio

<p>Set within a 40-cent north-facing plot in Edamuttom, <a href=""https://www.archdaily.com/tag/thrissur"">Thrissur</a>, Louvered House stands as an exploration of how contemporary living can harmoniously coexist with the sensitivities of Kerala's tropical climate and cultural memory. Once a flourishing nutmeg plantation, the site still retains its original trees and lush greenery, weaving ecological continuity into the architectural design. To the east, the client's ancestral tharavad remains, adding another layer of heritage and familial rootedness to the project. This delicate balance of the old and the new forms the philosophical core of the residence.</p>",
rss,www.archdaily.com,https://www.archdaily.com/1040423/house-of-ashes-taco-taller-de-arquitectura-contextual,1776870000,House of Ashes / TACO taller de arquitectura contextual,"House of Ashes / TACO taller de arquitectura contextual

<p>Casa Ceniza is a single-family home conceived as a massive geometric volume that protects itself from the street while creating an internal landscape of patios, water, and vegetation. Closed off from the outside and open to gardens and interior patios, the house proposes an introspective architecture where spaces are gradually revealed along the journey.</p>",
rss,www.archdaily.com,https://www.archdaily.com/1040545/renovation-of-the-jesuit-school-dunar-arquitectos-plus-trax,1776859200,Renovation of the Jesuit School / DUNAR arquitectos + TRAX,"Renovation of the Jesuit School / DUNAR arquitectos + TRAX

<p>When the building was first accessed, it was in an advanced state of ruin: it had completely lost its roof, the flooring of the upper level of the first bay &mdash;corresponding to the old school&mdash; and was undergoing a significant process of vegetation colonization, the result of decades of continuous abandonment. The lack of protection against the elements had accelerated the deterioration of the walls and vaults, seriously compromising the stability of the entire structure. Although the competition documents limited the intervention to a part of the property, the project understood from the outset that it was essential to execute the entire roof as a preliminary structural and heritage operation, aimed at stopping the degradation process and ensuring the future conservation of the building.</p>",
rss,www.archdaily.com,https://www.archdaily.com/1040469/mmmm-apartment-depaolidefranceschibaldan-architetti,1776852000,MMMM Apartment / depaolidefranceschibaldan architetti,"MMMM Apartment / depaolidefranceschibaldan architetti

<p>Box in a Box. A refurbishing project with a dual stylistic code, conceived for an early 20th-century apartment in <a href=""https://www.archdaily.com/tag/milan"">Milan</a>. An apartment located on the third floor of a post-WWI bâtiment on Viale Beatrice d'Este in Milan has undergone a meticulous and unusual refurbishment by DDBA. The residence, featuring a typically bourgeois character, is distinguished by large French windows overlooking rows of poplars and the vibrantly colored façades of the residential buildings directly opposite, designed by Giordano Forti and Camillo Magni.</p>",
rss,www.archdaily.com,https://www.archdaily.com/1039699/reclaiming-the-street-alejandra-ferrera-on-architecture-and-urban-life-in-honduras,1776843000,Reclaiming the Street: Alejandra Ferrera on Architecture and Urban Life in Honduras,"Reclaiming the Street: Alejandra Ferrera on Architecture and Urban Life in Honduras

<p><a href=""https://www.archdaily.com/country/honduras/page/1"" rel=""noopener"" target=""_blank"">Honduras</a> is the second-largest country in <a href=""https://www.archdaily.com/tag/central-america"" rel=""noopener"" target=""_blank"">Central America</a>, both in territory and population. Today, its urban fabric remains heavily influenced by <a href=""https://www.archdaily.com/1026205/tegucigalpas-modernist-revolution-metroplan-and-the-shift-in-the-urban-identity-of-1970s-honduras?ad_source=search&amp;ad_medium=search_result_articles"" rel=""noopener"" target=""_blank"">modernist principles</a> from the 1970s that prioritised high-speed arterial corridors and automobile-dependent ""point-to-point"" mobility. In addition, the country faced many challenges regarding <a href=""https://www.archdaily.com/1022307/architecture-for-peace-fostering-growth-and-learning-through-educational-spaces-in-honduras?ad_source=search&amp;ad_medium=search_result_articles"" rel=""noopener"" target=""_blank"">public safety</a> during the 2010s, which contributed to creating an urban space characterised by blind facades, high perimeter walls, and gated enclosures designed to isolate the interior from the public realm. </p>",
rss,www.archdaily.com,https://www.archdaily.com/1040505/houses-of-stealth-tonglu-senbo-resort-spactrum,1776841200,Houses of Stealth (Tonglu Senbo Resort) / SpActrum,"Houses of Stealth (Tonglu Senbo Resort) / SpActrum

<p><strong>The Way of Stealth: A Renewal Strategy Respecting Coexistence<br /></strong>Since 2022, this landscape in <a href=""https://www.archdaily.com/tag/hangzhou"">Hangzhou</a> Tonglu has undergone its largest transformation. After careful investigation, SpActrum concluded that while the original site strategy had failed in form and material, the trees that grew alongside the buildings over twenty years stood out as an effective natural strategy. The first task was to persuade the client to abandon a ""radically refreshed"" look, instead rebuilding cabins and walkways with contemporary techniques – a return to a ""non-referential"" state.</p>",
rss,www.archdaily.com,https://www.archdaily.com/1040861/salone-del-mobililano-and-milan-design-week-2026-open-across-the-city-and-fairgrounds,1776839400,Salone del Mobile.Milano and Milan Design Week 2026 Open Across the City and Fairgrounds,"Salone del Mobile.Milano and Milan Design Week 2026 Open Across the City and Fairgrounds

<p><a href=""https://www.archdaily.com/tag/milan"">Milan</a> reactivates its role as a global design capital this week as <a href=""https://www.archdaily.com/tag/milan-design-week-2026"">Milan Design Week 2026</a> has began on April 20, followed by the opening of <a href=""https://www.archdaily.com/tag/salone-del-mobile-2026"">the 64th edition of Salone del Mobile.Milano</a> on April 21 at Fiera Milano, Rho. Rather than a single event, the week unfolds as a layered system in which the fair and the city operate through different temporalities and spatial conditions. From early openings across urban districts to the formal start of the fairgrounds program, the staggered calendar reinforces a continuous flow of activity that extends across institutions, infrastructures, and public space.</p>",
