source,query,url,created_utc,title,text
youtube,interior design trends,https://www.youtube.com/watch?v=fL31VsFyNVI,1778781626,4 Interior Design Trends for 2026 | WB DESIGNSTUDIO,"Experience the future of living. In this atmospheric visual journey, WB DESIGNSTUDIO unveils four key interior trends for 2026."
youtube,interior design trends,https://www.youtube.com/watch?v=W-Wufxti_NQ,1778778002,Beginner’s Guide to Japandi Interior Design | Modern Minimalist Home Ideas,"Discover the ultimate Beginner's Guide to Japandi Interior Design and learn how to create a calm, cozy, and modern minimalist ..."
youtube,interior design trends,https://www.youtube.com/watch?v=OUhB7Bxh3eQ,1778777775,2026 Interior Design Trends: SF Decorator Showcase Tour #shorts  #interiordesign,Step inside the most prestigious design event on the West Coast! The 2026 San Francisco Decorator Showcase is officially ...
youtube,interior design trends,https://www.youtube.com/watch?v=IrAhqQddOTU,1778777630,Interior Design Trends 2026 😍 Must Watch! #interiordesign #explorepage #foryou #home #viralvideo,"Interior Design Trends 2026 ✨ Discover the latest luxury interior trends including warm & expressive color palettes, modern ..."
youtube,interior design trends,https://www.youtube.com/watch?v=VfgMUS9Y_KU,1778776491,Best Modern House Design Ideas for Elegant Living in 2026,"Discover the most breathtaking modern house design ideas for elegant living in 2026. In this video, we explore stunning luxury ..."
youtube,interior design trends,https://www.youtube.com/watch?v=cRzYDkOBzCY,1778774783,"2026 Home Design Trends: What&#39;s In, What&#39;s Out &amp; What Buyers Want Now",Are you thinking about selling your home — or just want to know what's actually trending in 2026? In this video I'm breaking down ...
youtube,interior design trends,https://www.youtube.com/watch?v=7UAXNkTpQxM,1778774524,2026 Interior Design Trends.  #home #rumah #arsitektur #shortvideo #design #viralvideo #viral,
youtube,interior design trends,https://www.youtube.com/watch?v=_ugh-LAMBSA,1778774456,LIVING LUXE 2026 TORONTO: The Most Expensive &amp; Elite Home Design Trends,"Take an exclusive tour of the Living Luxe Design Show 2026 at the Toronto Congress Centre on April 18. In this video, we review ..."
youtube,interior design trends,https://www.youtube.com/watch?v=GoeCPwMXPkM,1778774427,Color Capping: The 2026 Interior Painting Trend,"Is color drenching too much of a commitment for your home? While painting every wall, ceiling, and trim the same color is a ..."
youtube,interior design trends,https://www.youtube.com/watch?v=LmaEZwrkwCk,1778773330,#BuildingMaterials #InnovativeDesign #Innovation #InteriorDesign #Architecture #ModernInteriors,Future of Interiors Innovative Building Materials #Shorts #Architecture #InteriorDesign Discover the next generation of building ...
youtube,interior design trends,https://www.youtube.com/watch?v=o5J_5ljtnmw,1778773174,interior #interiordesign #design #homedecor #home #architecture #decor #furniture #homedesign #home,interior #interiordesign #design #homedecor #home #architecture #decor #furniture #homedesign #home For interior ...
youtube,interior design trends,https://www.youtube.com/watch?v=k_NdKp85jdY,1778772787,2026 Kitchen Design Trends That Will Transform Your Home | Luxury Remodeling Ideas,"Discover the hottest 2026 kitchen design trends and remodeling ideas that are transforming modern homes! In this video, we ..."
youtube,interior design trends,https://www.youtube.com/watch?v=ep69VQH8-Vs,1778772348,НЕ используйте ТРЕНДЫ в ИНТЕРЬЕРЕ,Заказать дизайн проект можно по ссылке в описании профиля или по телефону +79320219090 #интерьер ...
youtube,interior design trends,https://www.youtube.com/watch?v=Ah8fzSdH_3A,1778770817,Why Is Everyone Hiding Their Sliding Doors Now? 🤔 #interiordesign #homedecor #doors #slide,A Sliding Door that completely disappears after opening… is this what modern homes will look like in 2026? No bulky panels.
youtube,interior design trends,https://www.youtube.com/watch?v=-rGd8LJeDaM,1778767200,2026 mein yeh 5 kitchen colours har modern home mein trend karne wale hain!,2026 mein kitchen design trends completely change hone wale hain ✨ Agar aap modular kitchen renovate kar rahe ho ya new ...
youtube,interior design trends,https://www.youtube.com/watch?v=BRNS3YMFsyM,1778767215,The Newest Home Design Trends: Creating Serene Open Plan Living Space Interior,"Welcome back to Dream Homes TV! In today's episode, we are diving deep into the most sought-after interior movement of the ..."
youtube,interior design trends,https://www.youtube.com/watch?v=NfSozFbTNfk,1778765419,DECORATING RULES YOU SHOULD NEVER BREAK | INTERIOR DESIGN HACKS,10 DECORATING RULES YOU SHOULD NEVER BREAK | INTERIOR DESIGN HACKS10 DECORATING RULES YOU SHOULD ...
youtube,interior design trends,https://www.youtube.com/watch?v=4S6dQGcZVKI,1778761808,Kitchen Interior Designs #youtube #trending #shorts #interiordesign #kitchen #trends #home #diy,Why settle for Kitchens that weaken over time? Tusker Steel Kitchens are designed for modern homes with the strength of 304 ...
youtube,interior design trends,https://www.youtube.com/watch?v=FxXmaTqPiKE,1778758222,luxury hall interior design luxury hall ke video#luxuryhall#viralvideo,luxury hall interior design luxury hall ke video#luxuryhall#viralvideo Luxury Hall Interior Design 2026 | Modern Living Room ...
youtube,interior design trends,https://www.youtube.com/watch?v=eAe0utokSXg,1778758140,contact us for best quality awning and service. #awning #patio #design #trends,"New India Awning is a company that provides awnings, designer wallpaper, and vertical blinds, primarily operating in a presence ..."
youtube,interior design trends,https://www.youtube.com/watch?v=P9pjxd2WkRU,1778757492,The Smart Kitchen Detail Most Homeowners Overlook #interiordesign,Small design details can make a big difference in everyday living. Reaching across the kitchen sink to open or close a window ...
youtube,interior design trends,https://www.youtube.com/watch?v=thhh32VpJ9Q,1778757045,Restaurant Design Ideas | Latest Restaurant Design Trends #viral #short #design #interiordesign,"Where Minimal Luxury Meets Timeless Design ✨ A perfect blend of warm earthy tones, elegant wall panels, soft ambient lighting, ..."
youtube,interior design trends,https://www.youtube.com/watch?v=SuJbSbP70qg,1778756442,Low Budget Small Modern Minimalist Homes | Simple Yet Elegant House Design Trends,"Hello Everyone! In today's episode, we are diving deep into the world of Low-Budget Small Modern Minimalist Homes. We're ..."
youtube,interior design trends,https://www.youtube.com/watch?v=2IJ1aKopTFE,1778754921,Designer Shekha Explains Every Interior Detail Before Execution | #meeting #interiordesign #interior,"In this video, we're exploring the art of interior design with practical tips and creative ideas to transform your space. With over 10 ..."
youtube,interior design trends,https://www.youtube.com/watch?v=h7CmhC88K9w,1778754620,L Shaped Design Trends 2026 #modularkitchendesign #modernkitchen,L Shaped Design Trends 2026 #modularkitchendesign #modernkitchen #modularkitchencabinetdesign Discover the best L ...
youtube,home decor ideas,https://www.youtube.com/watch?v=zi7cn_p-9N4,1778780021,Diy Home decor ideas#shorts #viral #trending #art #diy,
youtube,home decor ideas,https://www.youtube.com/watch?v=RKlcUQEEfFk,1778777861,Easy Rope Basket DIY for Home Decor 💙,"Easy Rope Basket DIY for Home Decor In this video, I made a beautiful rope basket organizer using simple materials at home ..."
youtube,home decor ideas,https://www.youtube.com/watch?v=S2S4ZbYI-L4,1778776971,one day#home #homeinterior #homedecorideas#hometour #ytshorts#treandingshort #shortvideos#homedecor,
youtube,home decor ideas,https://www.youtube.com/watch?v=nia24RpPCTM,1778775354,DIY Terracotta Plate Art 🌿 | Easy Hand Painted Home Decor Idea | Best Out of Waste #diy #shorts,DIY Terracotta Plate Art | Easy Hand Painted Home Decor Idea | Best Out of Waste #diy #shorts Simple waste plastic container ...
youtube,home decor ideas,https://www.youtube.com/watch?v=Ni2hH7N9PPk,1778774438,Wow! Amazing Craft Ideas! #diy #craft #youtubeshorts #easycraftideas #art #artoftheday tutacuteart,DIY cute home decor ideas #diy I'm back with a fun DIY from ordinary materials for your home. Welcome to the magical world of ...
youtube,home decor ideas,https://www.youtube.com/watch?v=QRwfcozcvNk,1778772615,Wall hanging idea - Home Decor Ideas #diy #craft #homedecor #wallhanging #viral,
youtube,home decor ideas,https://www.youtube.com/watch?v=eiymyWOtroU,1778772660,DIY FOR KAKTASTREE#MINIATURE TREE IDEAS#HAND MADE#HOME DECOR IDEAS#SHORT#USE FOR MODULATE CLAY,HAND MADE CRAFT IDEAS. #USE FOR MODULATE CLAY. #HOME DECOR IDEAS. #WEAST PLASTIC BOTTLE USE.
youtube,home decor ideas,https://www.youtube.com/watch?v=sZlj90Um9Tw,1778772628,Amazing Mini Waterfall Craft 🌊🏡 | Easy DIY Home Decor Idea#vairalshorts #youtubeshorts,Amazing Mini Waterfall Craft | Easy DIY Home Decor Idea Beautiful handmade mini waterfall craft with cute house and nature ...
youtube,home decor ideas,https://www.youtube.com/watch?v=_OgGzcdt2Ro,1778771881,Cozy Minimal Home Decor Ideas,
youtube,home decor ideas,https://www.youtube.com/watch?v=D-3Nwun-EnI,1778771163,Styling a Dough Bowl Tray | Easy May Home Decor Idea,Shop this video on my Amazon Storefront under the Videos tab https://urlgeni.us/amazon/lavenderbrook or here ...
youtube,home decor ideas,https://www.youtube.com/watch?v=tE5qxdLOVjU,1778770671,Home Decor 🏠 #homedecor #decorideas #decor #roommakeoverideas #trending #shorts #home #makeover,
youtube,home decor ideas,https://www.youtube.com/watch?v=gAjHyGk_rVo,1778770338,Kid&#39;s Room Design Ideas 💡 #kidsroommakeover #decor #decorideas #homedecor #roommakeoverideas #shorts,
youtube,home decor ideas,https://www.youtube.com/watch?v=4UdEltbOBUc,1778770077,Home Decor 🏠 #home #homedecor #roommakeoverideas #trending #decorideas #decor #shorts,
youtube,home decor ideas,https://www.youtube.com/watch?v=2kv8cuOqdeI,1778769856,Crochet Home Decor Items So Cute They Sell Fast,"Discover fast-selling crochet home decor ideas perfect for beginners. These easy crochet projects are quick to make, proving that ..."
youtube,home decor ideas,https://www.youtube.com/watch?v=wVD1r_D0OXs,1778769621,THRIFTED STYLE 💡 #decorinspo #thrifting #homedecor #vintage #diy #decor #education,I see these vintage treasures at the thrift store often! Did you know that they can be stacked? #homedecor #thrifted ...
youtube,home decor ideas,https://www.youtube.com/watch?v=NoptOQeR5_A,1778769344,💜💜💜   #nokshiwala #ArtificialFlowers #homedecorideas,
youtube,home decor ideas,https://www.youtube.com/watch?v=LUewKZShsPg,1778769300,Easy and Simple Wall Hanging - Home Decoration Ideas #shorts​ #wallhanging​ #homedecor​ #craftyhome​,wallhanging​ #homemadepapercraft​ #papercraft​ #handmade​ #homemadepapercraft​ #homedecoration​ #handmade​ ...
youtube,home decor ideas,https://www.youtube.com/watch?v=sqwnwV6KNtI,1778768259,"Positive home, peaceful mind ✨#home #homedecor #positivevibes #homedecorideas #indianhome #shorts",CrystalPyramid #PositiveVibes #HomeEnergy #Prosperity #PeacefulHome #HealingCrystals #HomeDecor #PositiveEnergy ...
youtube,home decor ideas,https://www.youtube.com/watch?v=P1mSC1aT1h4,1778766987,Diy wall craft ideas💡#shorts #shortvideo #paperwallcraft #viral #creative #homedecor,Diy wall craft ideas  #shorts #shortvideo #paperwallcraft #viral #creative #homedecor #diy #craft #homemadepapercraft #art ...
youtube,home decor ideas,https://www.youtube.com/watch?v=XBY8vI3Utqs,1778765710,wedding room decor ideas #furniture #interior444 #home #shorts,
youtube,home decor ideas,https://www.youtube.com/watch?v=TpepQ4U8aEo,1778765424,Beautiful Home Entrance Decor Ideas for 2026 🌟,"Transform your home with beautiful entrance decor ideas for 2026. Discover modern foyer designs, stylish main door concepts, ..."
youtube,home decor ideas,https://www.youtube.com/watch?v=AI81rGzUoiQ,1778765419,Money plant decor ideas #plants #homedecor #homeplants #snakeplant #plantsdecor #plantslover #plant,
youtube,home decor ideas,https://www.youtube.com/watch?v=ErAA4J4avo0,1778765417,Easy Room Decor Idea with Paper Flowers ✨ #diycrafts,Easy Room Decor Idea with Paper Flowers ✨ #diycrafts Learn how to make this beautiful and colorful paper flower wall hanging ...
youtube,home decor ideas,https://www.youtube.com/watch?v=L8NDjdDT0dw,1778764836,55 Must-Have Amazon Home Decor Ideas That Make Small Spaces Feel Bigger,55 Must-Have Amazon Home Decor Ideas You'll Wish You Knew Sooner [2026] Transform your living space instantly with these ...
youtube,home decor ideas,https://www.youtube.com/watch?v=dABgSe0fwsQ,1778762866,DIY Home Decor Ideas for a Stylish Space,Description: Unleash your inner chef with these 5 simple cooking techniques! From mastering the perfect steak to making ...
youtube,small apartment decor,https://www.youtube.com/watch?v=ReeXA7aZI74,1778781632,Tiny Apartment Room Glow Up ✨,
youtube,small apartment decor,https://www.youtube.com/watch?v=CA17G_I3H54,1778773503,Small Apartment Hack! 3-in-1 Sleeper Sofa with USB &amp; Cup Holders 🛋️✨ #Shorts,Need smart furniture for a small space? This 56” 3-in-1 sleeper sofa loveseat easily converts into a pull-out bed and includes ...
youtube,small apartment decor,https://www.youtube.com/watch?v=DKigDcXnRgI,1778773042,5 Interior Design Secrets to Make Any Small Space Feel Huge,"Unlock the potential of your tiny home with these expert interior design secrets. Learn how to use light, furniture, and vertical ..."
youtube,small apartment decor,https://www.youtube.com/watch?v=TgBUXqdytZ4,1778771170,Small Corner Shelf Ideas That Make Your Home Look Expensive,"Turn any empty corner into a cozy luxury space with floating shelves, indoor plants, warm lighting, and minimalist decor ideas."
youtube,small apartment decor,https://www.youtube.com/watch?v=qEEPmFxeQBk,1778770880,El invento perfecto para pisos pequeños 😮,Este mueble multifuncional transforma un comedor completo para varias personas en una pequeña consola en cuestión de ...
youtube,small apartment decor,https://www.youtube.com/watch?v=200-v9J15wM,1778767943,Small apartment with a big sofa 🤭#sofa #homedesign #home #HomeDecor #sofabed,
youtube,small apartment decor,https://www.youtube.com/watch?v=k6aVhgABEzY,1778763082,From Construction to Luxury Studio Apartment | Cinematic Epoxy Floor Design (4K),Watch this stunning studio apartment transformation from bare construction to a fully furnished luxury interior featuring a cinematic ...
youtube,small apartment decor,https://www.youtube.com/watch?v=gzS9H78lrFs,1778761848,"Room small ho ya big, space ki problem har ghar mein hoti hai.",Smart space-saving storage ✔️ Clutter-free organization ✔️ Stylish modern designs ✔️ Customized as per your room size ...
youtube,small apartment decor,https://www.youtube.com/watch?v=05ig1EaQhtQ,1778761801,create a mini luxury bedrooms #shorts #minibedroom #bedroom,create a mini luxury bedrooms #shorts #minibedroom #bedroom luxury bedroom design low budget turning a small space into a ...
youtube,small apartment decor,https://www.youtube.com/watch?v=vVFwjlchAqE,1778760348,How to Style Your Living Room Like an Interior Designer | Elegant Step-by-Step Secrets,"How to style your living room like an interior designer, elegant step by step secrets for small spaces in 2026. In this MIZZU ..."
youtube,small apartment decor,https://www.youtube.com/watch?v=kx8mkpLx-eg,1778759516,Tiny Apartment Makeover Ideas for Stylish and Functional Living,"Transform your small apartment into a stylish, organized, and comfortable home with these easy makeover ideas! In this video ..."
youtube,small apartment decor,https://www.youtube.com/watch?v=xiXg0fN67w4,1778758605,Top IKEA Products for Small Spaces | Hidden Gems for Small Apartments,Discover the best IKEA products and furniture for small spaces in this IKEA showroom tour. If you live in a small apartment or ...
youtube,small apartment decor,https://www.youtube.com/watch?v=V-V6H6HQQH0,1778758125,Genius Tiny Apartment Makeover Ideas That Transform Small Spaces,"Discover genius tiny apartment makeover ideas that transform small spaces into stylish, cozy, and highly functional homes ✨ In ..."
youtube,small apartment decor,https://www.youtube.com/watch?v=6d4qFnKMG_I,1778756403,Summer Cottagecore Decor Trends 2026 | Elegant Vintage Boho Styling for Tiny Spaces,"Welcome to the ultimate guide for Summer Cottagecore 2026! If you're living in a tiny apartment, studio, or small home, this video ..."
youtube,small apartment decor,https://www.youtube.com/watch?v=u5Nc21DMwI8,1778748387,The &quot;Small Space&quot; Nightstand I’m Obsessed With,Finally found a nightstand that doesn't sacrifice style for square footage. If you're living in a tiny apartment or just love a clean ...
youtube,small apartment decor,https://www.youtube.com/watch?v=IpwhlviRFvg,1778744610,Small Bedroom Color Ideas That Make Rooms Feel Bigger #interiordesign #homedecor #smallapartment,The full article is available at this link: https://smartsmallspace.com/small-bedroom-color-ideas/
youtube,small apartment decor,https://www.youtube.com/watch?v=I6k1bdxJVGc,1778743806,"Small Room, Big Style 😍 #interiordesign #eleganthomes #home #homedecor #business #shorts",Small room with a smart & modern makeover ✨ ✔️ Space-saving design ✔️ Clean modern look ✔️ Budget friendly interior ...
youtube,small apartment decor,https://www.youtube.com/watch?v=cZESnNbIvpM,1778740634,✨ Tiny Balcony Makeover Ideas for Apartments 🪴,Small Balcony Makeover Ideas ✨ Cozy Swing & Plant Decor for Tiny Spaces Turn your tiny balcony into a peaceful cozy corner ...
youtube,small apartment decor,https://www.youtube.com/watch?v=lehvxSEG9jQ,1778738436,"Rooftop Laundry Transformed into Compact Apartment, Malta 28sqm/301sqft","Issue 7 of NTS Magazine has arrived — featuring compact homes, clever small-space ideas, textile furniture and joyful interiors."
youtube,small apartment decor,https://www.youtube.com/watch?v=KRw9U9Sp_Ik,1778729944,Genius Tiny Apartment Decor Ideas to Maximize Every Inch of Space,"Transform your tiny apartment into a stylish and functional dream home with these genius decor ideas ✨ In this video, Vinza ..."
youtube,small apartment decor,https://www.youtube.com/watch?v=5WlYV0rHJCo,1778727866,Small Apartment Makeover Ideas That Maximize Every Inch of Space,Transform your compact home with these amazing small apartment makeover ideas that maximize every inch of space ✨ In this ...
youtube,small apartment decor,https://www.youtube.com/watch?v=10d1nDZS6Uc,1778726416,"Small Space, Big Style! Genius Tiny Apartment Decor Ideas","Transform your tiny apartment into a stylish and functional dream space with Small Space, Big Style! In this video, Astri Home ..."
youtube,small apartment decor,https://www.youtube.com/watch?v=0k1uf_LLPdk,1778724000,Tiny Room Makeover That Feels Like Heaven ✨🏡,"Living alone feels better with a cozy room ✨ Small room, big cozy vibes ✨ Watch this tiny space transform into the perfect ..."
youtube,small apartment decor,https://www.youtube.com/watch?v=qor6HO2zXTA,1778716846,Video 6 Living Room Upgrade Fix rental safe #6 - Tiny Space Transformation,"Feeling cramped and stressed in your living room? Watch this quick upgrade that turns a cluttered rental space into a cozy, happy ..."
youtube,small apartment decor,https://www.youtube.com/watch?v=LoxE8LigvQ4,1778709828,33 Genius Amazon Tiny Apartment Gadgets &amp; Furniture for Effortless Luxury Living!,"33 mind-blowing Amazon gadgets and smart furniture that transform tiny apartments and small spaces into organized, ..."
