source,domain,url,created_utc,title,text,query
rss,www.yankodesign.com,https://www.yankodesign.com/2026/01/31/this-5-inch-video-business-card-wants-to-replace-your-stack-of-paper-cards/?utm_source=rss&utm_medium=rss&utm_campaign=this-5-inch-video-business-card-wants-to-replace-your-stack-of-paper-cards,1769913933,This 5-Inch “Video Business Card” Wants To Replace Your Stack Of Paper Cards,"This 5-Inch “Video Business Card” Wants To Replace Your Stack Of Paper Cards

<p class=""rws-nl-img""><a href=""https://www.yankodesign.com/2026/01/31/this-5-inch-video-business-card-wants-to-replace-your-stack-of-paper-cards/""><img alt="""" class=""attachment-post-thumbnail size-post-thumbnail wp-post-image"" height=""960"" src=""https://www.yankodesign.com/images/design_news/2026/01/this-5-inch-video-business-card-wants-to-replace-your-stack-of-paper-cards/Vidcard_Video_Business_Card_That_Makes_You_Unforgettable_hero.jpg"" width=""1280"" /></a></p><h2 class=""rws-nl-title"" style=""text-align: center;"">This 5-Inch &#8220;Video Business Card&#8221; Wants To Replace Your Stack Of Paper Cards</h2><div class=""rws-nl-excerpt"">Televisions used to be heavy boxes that dominated a room. Now, the latest LG and Samsung prototypes at CES 2026 look more like posters than...</div>",
rss,www.yankodesign.com,https://www.yankodesign.com/2026/01/31/10-best-japanese-stationery-items-under-100-planners-obsess-over/?utm_source=rss&utm_medium=rss&utm_campaign=10-best-japanese-stationery-items-under-100-planners-obsess-over,1769905815,10 Best Japanese Stationery Items Under $100 Planners Obsess Over,"10 Best Japanese Stationery Items Under $100 Planners Obsess Over

<p class=""rws-nl-img""><a href=""https://www.yankodesign.com/2026/01/31/10-best-japanese-stationery-items-under-100-planners-obsess-over/""><img alt="""" class=""attachment-post-thumbnail size-post-thumbnail wp-post-image"" height=""960"" src=""https://www.yankodesign.com/images/design_news/2026/01/japanese-stationery-items-under-100-planners-obsess-over/10_best_japanese_desig_stationery_yanko_design_hero.jpg"" width=""1280"" /></a></p><h2 class=""rws-nl-title"" style=""text-align: center;"">10 Best Japanese Stationery Items Under $100 Planners Obsess Over</h2><div class=""rws-nl-excerpt"">The stationery world has long looked to Japan for innovation, and planning enthusiasts know this better than anyone. Japanese design philosophy brings together minimalism, functionality,...</div>",
rss,www.yankodesign.com,https://www.yankodesign.com/2026/01/31/this-concept-makes-reading-a-physical-ritual-not-an-app-reminder/?utm_source=rss&utm_medium=rss&utm_campaign=this-concept-makes-reading-a-physical-ritual-not-an-app-reminder,1769902243,"This Concept Makes Reading a Physical Ritual, Not an App Reminder","This Concept Makes Reading a Physical Ritual, Not an App Reminder

<p class=""rws-nl-img""><a href=""https://www.yankodesign.com/2026/01/31/this-concept-makes-reading-a-physical-ritual-not-an-app-reminder/""><img alt="""" class=""attachment-post-thumbnail size-post-thumbnail wp-post-image"" height=""960"" src=""https://www.yankodesign.com/images/design_news/2026/01/his-concept-makes-reading-a-physical-ritual-not-an-app-reminder/lead-reading-motivation-concepts-01.jpg"" width=""1280"" /></a></p><h2 class=""rws-nl-title"" style=""text-align: center;"">This Concept Makes Reading a Physical Ritual, Not an App Reminder</h2><div class=""rws-nl-excerpt"">The intention to read a physical book more often usually gets buried under phones, streaming, and vague guilt about never finishing that stack on the...</div>",
rss,www.yankodesign.com,https://www.yankodesign.com/2026/01/31/hovstep-helps-adhd-focus-with-helicopter-missions-that-actually-end/?utm_source=rss&utm_medium=rss&utm_campaign=hovstep-helps-adhd-focus-with-helicopter-missions-that-actually-end,1769895927,HOVSTEP Helps ADHD Focus with Helicopter Missions That Actually End,"HOVSTEP Helps ADHD Focus with Helicopter Missions That Actually End

<p class=""rws-nl-img""><a href=""https://www.yankodesign.com/2026/01/31/hovstep-helps-adhd-focus-with-helicopter-missions-that-actually-end/""><img alt="""" class=""attachment-post-thumbnail size-post-thumbnail wp-post-image"" height=""960"" src=""https://www.yankodesign.com/images/design_news/2026/01/hovstep-helps-adhd-focus-with-helicopter-missions-that-actually-end/hovstep-helicopter-clock-concept-12.jpg"" width=""1280"" /></a></p><h2 class=""rws-nl-title"" style=""text-align: center;"">HOVSTEP Helps ADHD Focus with Helicopter Missions That Actually End</h2><div class=""rws-nl-excerpt"">Modern work and study days are chopped into tiny fragments, with multiple tabs, apps, and timers all competing for attention. Even well-intentioned plans fall apart...</div>",
rss,www.yankodesign.com,https://www.yankodesign.com/2026/01/31/your-dog-can-now-turn-on-the-lights-no-really/?utm_source=rss&utm_medium=rss&utm_campaign=your-dog-can-now-turn-on-the-lights-no-really,1769890541,"Your Dog Can Now Turn On the Lights (No, Really)","Your Dog Can Now Turn On the Lights (No, Really)

<p class=""rws-nl-img""><a href=""https://www.yankodesign.com/2026/01/31/your-dog-can-now-turn-on-the-lights-no-really/""><img alt="""" class=""attachment-post-thumbnail size-post-thumbnail wp-post-image"" height=""960"" src=""https://www.yankodesign.com/images/design_news/2026/01/your-dog-can-now-turn-on-the-lights-no-really/dogosophy-010.jpg"" width=""1280"" /></a></p><h2 class=""rws-nl-title"" style=""text-align: center;"">Your Dog Can Now Turn On the Lights (No, Really)</h2><div class=""rws-nl-excerpt"">We&#8217;re living through a strange moment where our refrigerators are smarter than ever, our thermostats learn our habits, and now, apparently, dogs can control household...</div>",
rss,www.yankodesign.com,https://www.yankodesign.com/2026/01/31/redmagic-11-air-review-fan-cooled-gaming-flagship-at-just-207g-499/?utm_source=rss&utm_medium=rss&utm_campaign=redmagic-11-air-review-fan-cooled-gaming-flagship-at-just-207g-499,1769876404,"REDMAGIC 11 Air Review: Fan-cooled Gaming Flagship at Just 207g, $499","REDMAGIC 11 Air Review: Fan-cooled Gaming Flagship at Just 207g, $499

<p class=""rws-nl-img""><a href=""https://www.yankodesign.com/2026/01/31/redmagic-11-air-review-fan-cooled-gaming-flagship-at-just-207g-499/""><img alt="""" class=""attachment-post-thumbnail size-post-thumbnail wp-post-image"" height=""960"" src=""https://www.yankodesign.com/images/design_news/2026/01/redmagic-11-air-review-fan-cooled-gaming-flagship-at-just-207g-499/redmagic-11-air-review-01.jpg"" width=""1280"" /></a></p><h2 class=""rws-nl-title"" style=""text-align: center;"">REDMAGIC 11 Air Review: Fan-cooled Gaming Flagship at Just 207g, $499</h2><div class=""rws-nl-excerpt"">Gaming phones have split off into their own design species, leaning into transparent backs, RGB lighting, and visible cooling that looks more like sci‑fi props...</div>",
rss,www.yankodesign.com,https://www.yankodesign.com/2026/01/31/this-award-winning-bookstore-looks-like-a-portal-to-outer-space/?utm_source=rss&utm_medium=rss&utm_campaign=this-award-winning-bookstore-looks-like-a-portal-to-outer-space,1769869238,This Award-Winning Bookstore Looks Like a Portal to Outer Space,"This Award-Winning Bookstore Looks Like a Portal to Outer Space

<p class=""rws-nl-img""><a href=""https://www.yankodesign.com/2026/01/31/this-award-winning-bookstore-looks-like-a-portal-to-outer-space/""><img alt="""" class=""attachment-post-thumbnail size-post-thumbnail wp-post-image"" height=""960"" src=""https://www.yankodesign.com/images/design_news/2026/01/this-award-winning-bookstore-looks-like-a-portal-to-outer-space/huaian-01.jpg"" width=""1280"" /></a></p><h2 class=""rws-nl-title"" style=""text-align: center;"">This Award-Winning Bookstore Looks Like a Portal to Outer Space</h2><div class=""rws-nl-excerpt"">Picture walking through a bustling marketplace in China and suddenly stumbling upon what looks like a giant celestial machine that&#8217;s crashed through the ceiling. That&#8217;s...</div>",
rss,www.yankodesign.com,https://www.yankodesign.com/2026/01/31/5-best-gaming-concepts-to-revolutionize-gaming-in-2026/?utm_source=rss&utm_medium=rss&utm_campaign=5-best-gaming-concepts-to-revolutionize-gaming-in-2026,1769863226,5 Best Gaming Concepts To Revolutionize Gaming In 2026,"5 Best Gaming Concepts To Revolutionize Gaming In 2026

<p class=""rws-nl-img""><a href=""https://www.yankodesign.com/2026/01/31/5-best-gaming-concepts-to-revolutionize-gaming-in-2026/""><img alt="""" class=""attachment-post-thumbnail size-post-thumbnail wp-post-image"" height=""962"" src=""https://www.yankodesign.com/images/design_news/2026/01/gaming-concepts-to-revolutionize-gaming-in-2026/5_best_gaming_concepts_yanko_design_hero.jpeg"" width=""1280"" /></a></p><h2 class=""rws-nl-title"" style=""text-align: center;"">5 Best Gaming Concepts To Revolutionize Gaming In 2026</h2><div class=""rws-nl-excerpt"">Gaming hardware has reached an inflection point where pure performance no longer separates the exceptional from the ordinary. Today&#8217;s players demand experiences that merge technical...</div>",
rss,www.yankodesign.com,https://www.yankodesign.com/2026/01/30/meta-misread-the-future-twice-now-theyre-sitting-on-a-golden-egg-but-dont-know-it/?utm_source=rss&utm_medium=rss&utm_campaign=meta-misread-the-future-twice-now-theyre-sitting-on-a-golden-egg-but-dont-know-it,1769827540,"Meta Misread the Future Twice. Now They’re Sitting on a Golden Egg, But Don’t Know It","Meta Misread the Future Twice. Now They’re Sitting on a Golden Egg, But Don’t Know It

<p class=""rws-nl-img""><a href=""https://www.yankodesign.com/2026/01/30/meta-misread-the-future-twice-now-theyre-sitting-on-a-golden-egg-but-dont-know-it/""><img alt="""" class=""attachment-post-thumbnail size-post-thumbnail wp-post-image"" height=""955"" src=""https://www.yankodesign.com/images/design_news/2026/01/meta-misread-the-future-twice-now-theyre-sitting-on-a-golden-egg-but-dont-know-it/meta_missed_the_future_twice_1.jpeg"" width=""1280"" /></a></p><h2 class=""rws-nl-title"" style=""text-align: center;"">Meta Misread the Future Twice. Now They&#8217;re Sitting on a Golden Egg, But Don&#8217;t Know It</h2><div class=""rws-nl-excerpt"">Mark Zuckerberg changed his company&#8217;s name to Meta in October 2021 because he believed the future was virtual. Not just sort-of virtual, like Instagram filters...</div>",
rss,www.yankodesign.com,https://www.yankodesign.com/2026/01/30/this-palm-sized-desktop-vacuum-combo-keeps-your-setup-squeaky-clean/?utm_source=rss&utm_medium=rss&utm_campaign=this-palm-sized-desktop-vacuum-combo-keeps-your-setup-squeaky-clean,1769823047,This palm-sized desktop vacuum combo keeps your setup squeaky clean,"This palm-sized desktop vacuum combo keeps your setup squeaky clean

<p class=""rws-nl-img""><a href=""https://www.yankodesign.com/2026/01/30/this-palm-sized-desktop-vacuum-combo-keeps-your-setup-squeaky-clean/""><img alt="""" class=""attachment-post-thumbnail size-post-thumbnail wp-post-image"" height=""960"" src=""https://www.yankodesign.com/images/design_news/2026/01/this-palm-sized-desktop-vacuum-combo-keeps-your-setup-squeaky-clean/The-Guys-Desktop-vacuum-cleaning-robot-3.jpg"" width=""1280"" /></a></p><h2 class=""rws-nl-title"" style=""text-align: center;"">This palm-sized desktop vacuum combo keeps your setup squeaky clean</h2><div class=""rws-nl-excerpt"">Believe you me, desk setups look amazing when you have all the gadgets and accessories in place. Some days down the line, that squeaky clean...</div>",
rss,www.archdaily.com,https://www.archdaily.com/1038301/isabu-dokdo-museum-simplex-architecture,1769911200,Isabu Dokdo Museum / Simplex Architecture,"Isabu Dokdo Museum / Simplex Architecture

<p>The site lies in Jeongna-dong, Samcheok-si, Gangwon-do. <a href=""https://www.archdaily.com/tag/samcheok"">Samcheok</a> Port is located to the east, with an industrial zone to the east and the south, a commercial zone to the north, and a residential zone to the north west. In A.D. 512 (the 13th year of King Jijeung's reign), Silla general Isabu set off from this spot in Samcheok with his marine troops to conquer Usanguk, today known as Ulleungdo Island, and Dokdo Island, which was part of the Silla territory. Yukhyangsan Mountain, located at the centre of the site, was once an oceanic island at the time of Isabu's departure, but has now become a mountainous region. Underneath this reclaimed land are the lower reaches of Yukhyangsan Mountain, which was once an island. The lower part of the Yukhyangsan Mountain was excavated, the site was lowered to its former altitude, and water was introduced. The water introduced to this area adopts the form of a pond with the name Yukhyang-ji, relating it to Yukhyangsan Mountain and alluding to the image of an island on the sea. An exhibition space tracing the historic features throughout the newly revealed site will come to play a role as na ew cultural site in Samcheok, and recover what in the landscape had been lost to the past.</p>",
rss,www.archdaily.com,https://www.archdaily.com/1038203/lumen-residential-building-next-office-alireza-taghaboni,1769893200,Lumen Residential Building / Next Office–Alireza Taghaboni,"Lumen Residential Building / Next Office–Alireza Taghaboni

<p>We call the Lumen Residential Building the Corners Project because by manipulating and distorting the form in the corner of a building block and by using strategies such as filament, semi-transparency, and multi-layering, we could tame the intense light that exists in the main aspects of the building.</p>",
rss,www.archdaily.com,https://www.archdaily.com/1038202/stream-eyewear-starfield-village-unjeong-rvmn,1769878800,Stream Eyewear Starfield Village Unjeong / RVMN,"Stream Eyewear Starfield Village Unjeong / RVMN

<p>If eyewear in the past was consumed primarily for vision correction, today it has come to be recognized as a small fashion item that expresses one's identity, shifting the direction of the eyewear market as a whole. Following Suwon, the second location—STREAM EYEWEAR Unjeong—breaks away from the conventional image of an ""optical shop,"" redefines STREAM's brand presence, and unfolds with a narrative unique to Unjeong.</p>",
rss,www.archdaily.com,https://www.archdaily.com/1038263/house-co-estudio-base-arquitectos,1769871600,House CO / Estudio Base Arquitectos,"House CO / Estudio Base Arquitectos

<p>The CO House, located in <a href=""https://www.archdaily.com/tag/santo-domingo"">Santo Domingo</a>, Chile, was born out of the necessity of a couple looking to settle on the coast with a versatile and flexible home. The design aimed to balance the comfort for the daily use of two people with the ability to comfortably accommodate ten occupants during certain periods of the year, prioritizing functional flexibility.</p>",
rss,www.archdaily.com,https://www.archdaily.com/1038053/anthony-timberland-center-grafton-architects,1769857200,Anthony Timberland Center / Grafton Architects,"Anthony Timberland Center / Grafton Architects

<p>A totemic presence in the landscape, the new Anthony Timberlands Center has opened in <a href=""https://www.archdaily.com/tag/fayetteville"">Fayetteville</a>, Arkansas. Part of the Fay Jones School of Architecture and Design, the center is conceived as a model for mass timber and wood product construction. It was designed by Pritzker Prize-winning Grafton Architects, executed by local studio Modus, and illuminated by New York-based TM Light.</p>",
rss,www.archdaily.com,https://www.archdaily.com/1037477/the-long-table-as-a-spatial-protocol-designing-conditions-for-gathering-and-pause,1769844600,The Long Table as a Spatial Protocol: Designing Conditions for Gathering and Pause,"The Long Table as a Spatial Protocol: Designing Conditions for Gathering and Pause

<p>A long <a href=""https://www.archdaily.com/search/products/categories/furniture_tables"">table</a> can sit almost anywhere and still do the same work. It can stretch beneath a market canopy, run along a school dining hall, or occupy the center of a shared living room, and it immediately changes the room's temperature.</p>",
rss,www.archdaily.com,https://www.archdaily.com/1034677/athletics-arena-archas,1769839200,Athletics Arena / Archas,"Athletics Arena / Archas

<p>This addition to the historic Dariaus and Girėno Stadium is conceived as a highly functional indoor athletics facility, extending the existing infrastructure to accommodate both competitive and training uses. The design approach prioritizes contextual integration, material authenticity, and spatial fluidity, aiming to reinforce the site's cultural significance within the urban fabric of Kaunas.</p>",
rss,www.archdaily.com,https://www.archdaily.com/1038259/cafe-on-site-aptdotapt,1769824800,Café On-Site / aptdotapt,"Café On-Site / aptdotapt

<p>Located in a small town in Zhejiang, China, Café On-Site(开场Kai-Chang) is conceived as a field of energy for neighborhoods. Beyond serving locally inspired signature coffee and food, the café focuses on human gathering and interaction — on how energy flows, accumulates, and connects within a spatial setting. We developed the project holistically, including brand strategy, naming, visual identity, and interior design.</p>",
rss,www.archdaily.com,https://www.archdaily.com/1038272/0-office-igarchitects,1769799600,〇 Office / IGArchitects,"〇 Office / IGArchitects

<p>This project involves the renovation of a single-floor office in Shibuya. Rather than an office organized around a specific, fixed function, the brief called for a place capable of accommodating multiple, unfixed modes of use, including employee welfare, receptions, and other forms of gathering.</p>",
rss,www.archdaily.com,https://www.archdaily.com/1038264/forest-apartment-tropico-arquitectura,1769785200,Forest Apartment / Trópico Arquitectura,"Forest Apartment / Trópico Arquitectura

<p>This project was commissioned by a young anthropologist. The desire was to create a living space that met his intimate needs, a space that would allow him to reconstruct himself.</p>",
rss,www.archdaily.com,https://www.archdaily.com/1038150/tiffany-and-co-mvrdv,1769774400,Tiffany & Co / MVRDV,"Tiffany & Co / MVRDV

<p><em>MVRDV design adds glass fins with fluid curves to the façade of Tiffany &amp; Co.'s flagship store in Beijing</em> — A new Tiffany &amp; Co. flagship store has opened in the Taikoo-Li Sanlitun commercial neighbourhood in <a href=""https://www.archdaily.com/tag/beijing"">Beijing</a>, with a façade of curving, translucent glass fins that add an ethereal presence to the building. With its flowing shapes inspired by the masterpieces of jewellery designer Elsa Peretti, the Beijing store is the fifth in a series of façade designs created by MVRDV for Tiffany, introducing a new design motif that reflects the pursuit of innovative materials and expressive three-dimensional form that characterises each design in the series.</p>",
rss,www.archdaily.com,https://www.archdaily.com/1038026/parede-townhouses-extrastudio,1769767200,Parede Townhouses / extrastudio,"Parede Townhouses / extrastudio

<p>The word house functions as both a verb and a noun. To house is a transitive verb, which requires a direct object to complete its meaning. The purpose of a dwelling is to house an individual or a family, and we cannot separate the act of housing from its object.</p>",
rss,www.archdaily.com,https://www.archdaily.com/1038159/inside-contemporary-kazakhstani-architecture-exploring-the-work-of-naaw,1769758200,Inside Contemporary Kazakhstani Architecture: Exploring the Work of NAAW,"Inside Contemporary Kazakhstani Architecture: Exploring the Work of NAAW

<p>Selected as one of the winners of <a href=""https://www.archdaily.com/1033983/20-practices-shaping-the-future-of-architecture-winners-of-the-archdaily-2025-next-practices-awards"" rel=""noopener"" target=""_blank"">ArchDaily 2025 Next Practices Awards</a>, <a href=""https://www.archdaily.com/office/naaw?ad_name=project-specs&amp;ad_medium=single"" rel=""noopener"" target=""_blank"">NAAW</a> represents a new generation of architectural studios reshaping contemporary practice in Central Asia. Founded in 2019 by Elvira Bakubayeva and Aisulu Uali, the studio operates at the intersection of research, interdisciplinary collaboration, and spatial experimentation, positioning architecture as a tool for reflection and an active agent in shaping contemporary <a href=""https://www.archdaily.com/country/kazakhstan"" rel=""noopener"" target=""_blank"">Kazakhstani</a> identity.</p>",
rss,www.archdaily.com,https://www.archdaily.com/1038207/folded-rooms-garden-rad-plus-ar-research-artistic-design-plus-architecture,1769756400,Folded Rooms Garden / RAD+ar (Research Artistic Design + architecture),"Folded Rooms Garden / RAD+ar (Research Artistic Design + architecture)

<p>Folded Rooms Garden is an experimental residential intervention located within a compact urban pocket in <a href=""https://www.archdaily.com/tag/bandung"">Bandung</a>, Indonesia. The project challenges the conventional reliance on vertical partition walls, proposing instead a fluid sequence of living environments seamlessly integrated with the landscape.</p>",
rss,www.archdaily.com,https://www.archdaily.com/1038279/salone-del-mobile-announces-2026-framework-appointing-oma-to-design-the-salone-contract-master-plan,1769754600,"Salone del Mobile Announces 2026 Framework, Appointing OMA to Design the ""Salone Contract"" Master Plan","Salone del Mobile Announces 2026 Framework, Appointing OMA to Design the ""Salone Contract"" Master Plan

<p><a href=""https://www.archdaily.com/tag/salone-del-mobile"">Salone del Mobile.Milano</a> has announced the framework for its 64th edition, scheduled to take place from April 21 to 26, 2026, at Fiera Milano, Rho. The upcoming edition will bring together more than 1,900 exhibitors from 32 countries across over 169,000 square meters of exhibition space, highlighting the fair's continued scale and international reach. Beyond its quantitative dimension, the 2026 Salone positions itself as an evolving cultural and economic infrastructure, increasingly structured around long-term strategies rather than isolated events. The program reflects a growing emphasis on <a href=""https://www.archdaily.com/tag/accessibility"">accessibility</a>, curatorial depth, and cross-sector dialogue, pointing at the Salone's role not only as a marketplace for the industry but also as a platform where architectural thinking, industrial production, and global dynamics intersect within a single, coordinated framework.</p>",
rss,www.archdaily.com,https://www.archdaily.com/1038180/semi-detached-house-in-friedrichsruhe-larob-studio-fur-architektur-plus-florian-nagler-architekten,1769752800,Semi-Detached House in Friedrichsruhe / larob. studio für architektur + Florian Nagler Architekten,"Semi-Detached House in Friedrichsruhe / larob. studio für architektur + Florian Nagler Architekten

<p>In <a href=""https://www.archdaily.com/tag/friedrichsruhe"">Friedrichsruhe</a>, where open farmland meets gently wooded hills, a country house has been built as a pair of connected homes. The layout and overall appearance of the buildings — including the main houses, garages, and boundary walls — take inspiration from a nearby historic farmstead. With very simple means, a strong sense of space and atmosphere was created. The main idea was to design a house that works on its own terms, without complex technical systems, without constant regulation, and without the need for ongoing adjustments.</p>",
rss,www.archdaily.com,https://www.archdaily.com/1038280/one-week-to-milano-cortina-2026-the-cultural-olympiad-expands-the-games-through-a-distributed-arts-and-public-programme,1769751000,One Week to Milano Cortina 2026: The Cultural Olympiad Expands the Games Through a Distributed Arts and Public Programme,"One Week to Milano Cortina 2026: The Cultural Olympiad Expands the Games Through a Distributed Arts and Public Programme

<p>Nearly one week before the start of the <a href=""https://www.archdaily.com/tag/milano-cortina-2026"" rel=""noopener"" target=""_blank"">Milano Cortina 2026 Winter Olympics</a>, the organizing committee has released <a href=""https://www.olympics.com/en/milano-cortina-2026/our-projects/cultural-olympiad?utm_medium=website&amp;utm_source=archdaily.com"" rel=""noopener"" target=""_blank"">official information on the event's Cultural Olympiad</a>: an arts and culture programme accompanying the Olympic and Paralympic Games. The programme is recognized by the IOC as one of the three pillars of the Olympic Movement, alongside sport and education. Conceived as a widespread platform involving territories, institutions, and communities across <a href=""https://www.archdaily.com/tag/italy"">Italy</a>, the Cultural Olympiad aims to highlight the <a href=""https://www.archdaily.com/tag/italian-alps"">Italian Alps</a> and <a href=""https://www.archdaily.com/979356/milan-city-guide-20-projects-to-see-in-italys-fashion-capital"" rel=""noopener"" target=""_blank"">Milan's cultural heritage</a> while promoting Olympic values through art, history, and participation beyond<a href=""https://www.archdaily.com/1028018/italy-prepares-13-sports-venues-for-the-milano-cortina-2026-winter-olympics"" rel=""noopener"" target=""_blank""> the official sports venues.</a></p>",
