source,query,url,created_utc,title,text
youtube,interior design trends,https://www.youtube.com/watch?v=EmrRMzSq93o,1771413999,Minimalism looks clean… but feels cold #interiordesign #designs #trends,
youtube,interior design trends,https://www.youtube.com/watch?v=niAawV32cb0,1771413005,Interior Design Trends &amp; Concepts in 2026 | Impiria Interior Design #interiordesign #impiriainterior,2026 is redefining the way we experience our spaces ✨ From sustainable living spaces and the power of maximalism to ...
youtube,interior design trends,https://www.youtube.com/watch?v=w38lu78kVoo,1771407845,bedroom wardrobe design ✨#slidingdoor #glassdivider #homedecor #interiordesign,bedroom wardrobe design ✨#slidingdoor #glassdivider #homedecor #interiordesign ...
youtube,interior design trends,https://www.youtube.com/watch?v=wZU_61bcbtk,1771407028,Cafe Core aesthetic that looks EXPENSIVE but isn&#39;t #interior444 #interiordesigntrends #homedesign,Create a cafe core aesthetic in your home without breaking the bank by using simple DIY home decor hacks. The cafe core ...
youtube,interior design trends,https://www.youtube.com/watch?v=qVPxAOGoRn4,1771403262,Latest Floor Design Trends 🏡 | Luxury &amp; Stylish Look#TrendingFloorDesign#youtubeshorts#viralvideo,"Trending Floor Design 2026 | Modern & Stylish Flooring Ideas ✨ In this video, you will see the latest and trending floor design ..."
youtube,interior design trends,https://www.youtube.com/watch?v=F0V8tSHCMLg,1771401620,2026 Interior Design Trends #interiordesign #furniture #interior #homedecor #100k #woodenbed,2026 Interior Design Trends @rehmanfurniture12 #interiordesigntrends #interiordesigninspiration #interiordesignideas Interior ...
youtube,interior design trends,https://www.youtube.com/watch?v=BJZ2L4v02Kg,1771399805,"Turning a SCARY Basement into a $100,000 Futuristic Cinema! 🤯","Is this the future of home entertainment? We took a dark, creepy concrete basement and transformed it into the Ultimate ..."
youtube,interior design trends,https://www.youtube.com/watch?v=K3CFM0QRxFU,1771398485,2026 Sofa &amp; Home Design Trends | Comfort Meets Luxury,"In this video, we explore the rise of flexible sectional layouts, low-profile luxury seating, curved and sculptural couch designs, and ..."
youtube,interior design trends,https://www.youtube.com/watch?v=i1gIxrvDlyc,1771397869,2026 Interior Design Trends for Small Space Luxury Living With Elegant and Timeless Style,"Discover the top 2026 interior design trends for small space luxury living and learn how to create a home that feels spacious, ..."
youtube,interior design trends,https://www.youtube.com/watch?v=Hb2uaIK6YzM,1771395479,How to style a SMALL living room to look bigger (and better!) ✨#shorts #epoxy #interiordesign,How to style a SMALL living room to look bigger (and better!) ✨ Struggling with a cramped space? Watch how we use small living ...
youtube,interior design trends,https://www.youtube.com/watch?v=JWxYMvsZJgA,1771390936,modular kitchen design ideas #kitchen #interior #homedecor #shorts #viral #classykitchen,modular kitchen design ideas #kitchen #interior #homedecor #shorts #viral #classykitchen YOUR QUERY ultimate modular ...
youtube,interior design trends,https://www.youtube.com/watch?v=1J4XIjwghDM,1771388468,bedroom wardrobe design ✨#slidingdoor #glassdivider #homedecor #interiordesign,bedroom wardrobe design ✨#slidingdoor #glassdivider #homedecor #interiordesign ...
youtube,interior design trends,https://www.youtube.com/watch?v=s6VbG0oBct0,1771385366,"home design YouTube title ideas, descriptions, hashtags, and keywords you can use for","Discover the latest modern home design trends featuring clean lines, open spaces, and stylish interiors. In this video, we explore ..."
youtube,interior design trends,https://www.youtube.com/watch?v=cwNXdKgEUoo,1771382652,🏡 &quot;Apne Sapno Ka Bedroom 🌙💖 | Aesthetic Room Tour 🔥 #HomeInspiration #DreamBedroom&quot;,Full SEO Description (with emojis + hashtags) ✨ Welcome to Apne Sapno Ka Bedroom Tour — the ultimate journey into ...
youtube,interior design trends,https://www.youtube.com/watch?v=sGUtsV1YJ8g,1771380660,bedroom bed design ✨#slidingdoor #glassdivider #homedecor #interiordesign,bedroom bed design ✨#slidingdoor #glassdivider #homedecor #interiordesign ...
youtube,interior design trends,https://www.youtube.com/watch?v=cy2U71TG018,1771351339,Design Trends and Home Improvement Ideas!,"Thinking about remodeling your home in Seattle? We headed to the Northwest Remodeling Expo to walk the floor, talk with ..."
youtube,interior design trends,https://www.youtube.com/watch?v=6HT5vjJzXPM,1771351105,10 Unique False Ceiling Trends for Modern Homes #interiordesign #shortvideo #viralvideo #video,10 Unique False Ceiling Trends for Modern Homes #interiordesign #shortvideo #viralvideo #video.
youtube,interior design trends,https://www.youtube.com/watch?v=fU4MK63K1lw,1771348858,HOMEGOODS SHOP WITH ME | HomeGoods SPRING 2026 | HOME DECOR IDEAS | Designer Look For Less,What's new at HomeGoods Spring 2026! Follow me on Instagram: https://www.instagram.com/brandyjjackson/ Shop my Amazon ...
youtube,interior design trends,https://www.youtube.com/watch?v=1xp__GVH650,1771347603,Luxury Small Apartment Interior Design Trends 2026 for Elegant Modern Living,"Small home interior design in 2026 focuses on luxury compact living, where elegance meets smart functionality. Modern small ..."
youtube,interior design trends,https://www.youtube.com/watch?v=Q438rMrRb6U,1771347600,Interior Design Trends Nigerians Are Choosing in 2026 | #interiorstuesdays #shorts,"Not every interior trend works in Nigerian homes Heat, dust, kids, NEPA, these are the real life matters. In this clip, I break down ..."
youtube,interior design trends,https://www.youtube.com/watch?v=XUbEOncVrbI,1771346609,Luxury Interior Design Trends 2026 | Hyper Realistic 4K,Step inside the world of ultra realistic luxury architecture. This cinematic 4K HDR showcase explores breathtaking high-end lobby ...
youtube,interior design trends,https://www.youtube.com/watch?v=Aa63bguOoB8,1771345800,bedroom mirror design ✨#slidingdoor #glassdivider #homedecor #interiordesign #kitchendesign,bedroom mirror design ✨#slidingdoor​ #glassdivider​ #homedecor​ #interiordesign​ ...
youtube,interior design trends,https://www.youtube.com/watch?v=EBY564BeZwA,1771345425,Luxury Interior Tour”#shorts #youtube #youtubeshorts #shortvideo #shortsviral #subscribe #shortsfeed,"Luxury Interior Tour”#shorts #youtube #youtubeshorts #shortvideo #shortsviral #subscribe #shortsfeed interior design, interior car ..."
youtube,interior design trends,https://www.youtube.com/watch?v=6H5K9On-N7I,1771344445,Breathtaking Modern Contemporary Minimalist House | Architectural Design Trends 2026,"Is this the perfect home? In today's tour, we are stepping into a breathtaking Modern Contemporary Minimalist House that ..."
youtube,interior design trends,https://www.youtube.com/watch?v=_DfgTVA97XI,1771344000,Dark &amp; Dramatic Modern Home Tour | Black Luxury Design Trends 2026,This dark and dramatic modern home tour explores the rising influence of black luxury design trends in 2026. The exterior makes ...
youtube,home decor ideas,https://www.youtube.com/watch?v=ZeYtrcFrO-o,1771416833,DIY👩‍🎨| Plants decor ideas| Bottle Art| Warli #shortsfeed#ytshorts#subscribe#like#share#diy#warliart,DIY | Plants decor ideas| Bottle Art| Warli Art | Bottle Painting   | home decor ideas| #subscribe #like #share #youtube ...
youtube,home decor ideas,https://www.youtube.com/watch?v=gxXnb-UGWfg,1771416594,Swan Love Wall Decor 🦢 | DIY Home Decor,"Swan Love Wall Decor | DIY Home Decor Learn how to make this beautiful swan couple wall art using clay, tissue paper and ..."
youtube,home decor ideas,https://www.youtube.com/watch?v=9K9uwsT4WoU,1771416331,Home decor #ytshorts #diy #artandcraft #homedecorideas #craftyhome #craftideas #youtubeshorts #craft,Home decor #ytshorts #diy #artandcraft #homedecorideas #craftyhome #craftideas #youtubeshorts #craft#shortsfeed #shortvideo ...
youtube,home decor ideas,https://www.youtube.com/watch?v=if87c-IWc5g,1771415984,DIY Cute Planter Makeover 🌿✨ | Waste to Home Decor#diydecor#homedecorideas #upcycleddecor #diy,Turning simple waste into something cute & aesthetic Who knew a little bow could change everything? ✨ Would you keep ...
youtube,home decor ideas,https://www.youtube.com/watch?v=VzJ6ihDMH0Y,1771414826,DIY Ramadan craft ideas #homedecor #ramadan #diy #shorts #viral #ramadan2026 #deskdecor #craft,DIY Ramadan craft ideas #homedecor #ramadan #diy #shorts #viral #ramadan2026 #deskdecor #craft.
youtube,home decor ideas,https://www.youtube.com/watch?v=m8dKVQbEHZE,1771414100,DIY Mirror Wall Hanging ✨ | Easy Home Decor Idea 🪞 #shorts! DIY Mirror Wall Decor 🪞 | #ytshorts #diy,DIY Mirror Wall Hanging ✨ | Easy Home Decor Idea #shorts! DIY Mirror Wall Decor | #ytshorts #diy @SunitaMourya-c2s ...
youtube,home decor ideas,https://www.youtube.com/watch?v=qzMCPulyTxc,1771413318,Ganpati Cutouts for Festive Decoration | DIY Ganesh Ji Craft Ideas | Mandir &amp; Ganesh Chaturthi Decor,Celebrate the divine presence of Ganpati Bappa with our beautifully crafted Ganpati Cutouts – perfect for Ganesh Chaturthi ...
youtube,home decor ideas,https://www.youtube.com/watch?v=5aBwBpFt_hs,1771413260,Amazing Flower Decor For Home Garden 🌼🌱🌺 #homedecor #garden #decor #trend #shortviral #flower #diy,Amazing Flower Decor For Home Garden #homedecor #garden #decor #trend #shortviral #flower #diy Create A Mini ...
youtube,home decor ideas,https://www.youtube.com/watch?v=ASzldo0xy84,1771412654,DIY Ramadan Kareem 🌙⭐ decor Idea craft 🫶💖#diy #craft #art #ramadan #shorts ✨,DIY Ramadan Kareem ⭐ Beautiful Decor Idea | Easy Paper Craft ✨ Ramadan Kareem Special ⭐ DIY Decor Craft Idea ...
youtube,home decor ideas,https://www.youtube.com/watch?v=mpAF5yr83H4,1771412487,ramadan special home decor idea (day 30-1) #craft #paper #diy #papercrafts,"Welcome to our Ramadan special home decor idea video, where we will be sharing a unique and creative DIY paper craft to ..."
youtube,home decor ideas,https://www.youtube.com/watch?v=oQvGbKuNSiM,1771411649,DIY Wool Home Decor Idea 🧶 | Easy Handmade Room Decoration #shorts,DIY Wool Home Decor Idea | Is easy handmade room decoration se apne ghar ko stylish aur beautiful banaye. Is simple wool ...
youtube,home decor ideas,https://www.youtube.com/watch?v=aj-25eu8XqY,1771410780,Amazing wall hanging ideas |wall hanging crafts ideas #trending #diy #shorts viralshorts #crafts,Amazing wall hanging ideas |wall hanging crafts ideas #trending #diy #shorts viralshorts #craftsDiy paper crafts ideas |amazing ...
youtube,home decor ideas,https://www.youtube.com/watch?v=fcjrd7cemnw,1771409915,Unique wall hanging design/Plastic spoon wall hanging design/Home decor ideas/Wall decor ideas,
youtube,home decor ideas,https://www.youtube.com/watch?v=krLLKkPYIfA,1771409705,🌙✨Ramadan Decoration Ideas 2026 | Stunning DIY Home Decor for Ramadan,Ramadan Decoration Ideas 2026 | Stunning DIY Home Decor for Ramadan ✨ Ramadan Decoration Ideas 2026 | Easy DIY Home ...
youtube,home decor ideas,https://www.youtube.com/watch?v=Mqp7LEaZoBM,1771408693,home decoration ideas 🌝 #shorts #homedecoration #homedecor #decoration,home decoration ideas #shorts #homedecoration #homedecor #decoration.
youtube,home decor ideas,https://www.youtube.com/watch?v=I9bVv9in4Ik,1771408364,Beautiful Wall Hanging Craft idea #shorts #youtubeshorts #viralvideo #colourpapercraft #homedecor,wallhangingcraftdecor #roomdecor #homedecor #beautifulcraft #diy #colourpapercraft #homedecorideas #orangecolor ...
youtube,home decor ideas,https://www.youtube.com/watch?v=NDA2hFZdRpk,1771408321,💐#home #kitchenorganization #kitchen #decor#kitchenitems #homedecor #ytshorts #amazonmusthaves,
youtube,home decor ideas,https://www.youtube.com/watch?v=2jhdxizjkAs,1771408204,bottle paper flowers craft ideas #diy #trending #handcraft #craftyhome #homedecor,bottle paper flowers craft #diy #trending #handcraft #craftideas #homedecor #shortreels #shortvideo #shortsfeed #handmade ...
youtube,home decor ideas,https://www.youtube.com/watch?v=OBdQsvLQ7WI,1771407988,🌸✨Ramadan decor🌙#shorts #diy #craft #ramadan #how #decor #home #easy #art #ideas #wallhanging,"Ramadan Kareem to all. It's a precious month and people ready to welcome this month like decorate their homes , purify their soul ..."
youtube,home decor ideas,https://www.youtube.com/watch?v=w38lu78kVoo,1771407845,bedroom wardrobe design ✨#slidingdoor #glassdivider #homedecor #interiordesign,bedroom wardrobe design ✨#slidingdoor #glassdivider #homedecor #interiordesign ...
youtube,home decor ideas,https://www.youtube.com/watch?v=edb3QGloG0c,1771406199,Best Out of Waste Ideas #diy #recycledart #trashart #shorts #homedecor,Best Out of Waste Ideas #diy #recycledart #trashart #shorts #homedecor #purnimascraftsvilla #craft #reuse #wastematerialcraft ...
youtube,home decor ideas,https://www.youtube.com/watch?v=KWmKdfU0Pb0,1771405968,Indian Kitchen💐#home #kitchenorganization #kitchen #decor#kitchenessentials #homedecor #kitchentour,KitchenTour   #kitchen #home #kitchenfinds #kitchenorganization #decor #kitchenessentials #homedecor #decorideas ...
youtube,home decor ideas,https://www.youtube.com/watch?v=Jq0Gd7kAppw,1771405234,ramazan Mubarak🥰🤲ramazan home decor idea #ramadan #home #viralvideo #viralvideo #viral,ramazan Mubarak    ramazan home decor idea #ramadan #home #viralvideo #viralvideo #viral.
youtube,home decor ideas,https://www.youtube.com/watch?v=M3MK_QRvgFM,1771404529,&quot;From Flower Mandi To 7-Star Hotel! 🔥🌹 #Shorts #art,What happens when you mix thousands of real roses with epoxy resin? ✨ My Nani decided to give our old house a magical ...
youtube,home decor ideas,https://www.youtube.com/watch?v=Jeb-E6H5vhQ,1771404382,Diy Cute Wall Hanging For Bride &amp; Groom #diy #wallhanging #homedecor #craft #shorts #resinart,Diy Cute Wall Hanging For Bride & Groom #diy #wallhanging #homedecor #craft #shorts #resinart DIY Wall Hanging Craft Home ...
youtube,small apartment decor,https://www.youtube.com/watch?v=ZBBin_rOUUI,1771417716,Tiny Apartment Makeover Ideas That Instantly Upgrade Small Living Spaces,"Looking to transform your tiny apartment into a stylish and functional space? In this video, Decor Pedia shares simple yet powerful ..."
youtube,small apartment decor,https://www.youtube.com/watch?v=SUBhRtK34Xk,1771416048,Parisian Inspired Small Apartment Decor Blending Refined Aesthetics with Urban Comfort,"Step into the enchanting world of a Parisian-inspired small luxury apartment, where refined aesthetics blend seamlessly with ..."
youtube,small apartment decor,https://www.youtube.com/watch?v=wZPF5v_Q_so,1771416058,6㎡ Cozy Study Setup – Smart Folding Sofa Bed for Small Apartment Living” #shortsfeed,"Upgrade your living space with the ultimate multifunctional sofa bed! In this video, we explore sofas, convertible sofa, sofa beds, ..."
youtube,small apartment decor,https://www.youtube.com/watch?v=Ptfbg1Oll6M,1771415823,Luxury Dressing Table for Small Bedrooms – Elegant Bedside Makeup Setup” #shortsfeed,"In this video, we showcase the ultimate triple touch sensor LED mirror and explore the latest LED mirror design perfect for modern ..."
youtube,small apartment decor,https://www.youtube.com/watch?v=0E-KgT2zQP8,1771415153,A small room with the best interior design 🏗️,interiordesign #interior #studioapartments.
youtube,small apartment decor,https://www.youtube.com/watch?v=PMzKCNGK38w,1771413896,Christmas Decorations 2026 | Stunning Home Decor Ideas🎅 🎄,Christmas Decorations 2026 | Stunning Home Decor Ideas Get ready to transform your home with the most inspiring Christmas ...
youtube,small apartment decor,https://www.youtube.com/watch?v=r23g4tKw46Y,1771412480,Small Luxury Paris Apartment Tour | Art Deco Interior Design with Timeless Parisian Style,"In this video, we explore a Small Space Luxury Paris Apartment inspired by the glamour of Art Deco and the effortless elegance of ..."
youtube,small apartment decor,https://www.youtube.com/watch?v=Fw15zIhC9w4,1771412421,Small Parisian Apartment Vibes 🌿 Understated Glamour Rooted in Elegance and French Tradition,Small Parisian Apartment Vibes are all about understated glamour rooted in elegance and French tradition. By combining soft ...
youtube,small apartment decor,https://www.youtube.com/watch?v=7PUA9YO9r_g,1771412413,"Parisian Decor Secrets for Tiny Apartments | Elegant, Romantic &amp; Timeless","Parisian decor for tiny apartments is rooted in celebrating architectural charm, embracing soft neutral palettes, and maximizing ..."
youtube,small apartment decor,https://www.youtube.com/watch?v=c-H_2m7esL8,1771410867,Small Balcony Design|Apartment Balcony Decor Balcony Deck Patio Seats Lights Wall Decor#vkshomedecor,VKS home decor sharing Modern balcony interior design. Cozy Small balcony makeover tips ideas. How to use balcony space ...
youtube,small apartment decor,https://www.youtube.com/watch?v=WSY4GLWerWs,1771401600,14 Clever Storage Ideas for small Spaces #kidsroom #aestheticroomdecor #homedecor #home,Discover smart and stylish ways to maximize every inch of your home! From floating shelves and under-bed drawers to ...
youtube,small apartment decor,https://www.youtube.com/watch?v=Q7J_9Ot218E,1771397818,Why This Small Apartment Bedroom Feels Luxury Hotel Level Without Adding A Single Extra Inch,"Why does this small apartment bedroom feel like a luxury hotel suite without adding a single extra inch? In this transformation, we ..."
youtube,small apartment decor,https://www.youtube.com/watch?v=S34IeP_C_s0,1771396778,Affordable Tiny Apartment Makeover Ideas That Look Totally Custom,"Transform your small space without draining your budget! In this video, I'm sharing affordable tiny apartment makeover ideas that ..."
youtube,small apartment decor,https://www.youtube.com/watch?v=Hb2uaIK6YzM,1771395479,How to style a SMALL living room to look bigger (and better!) ✨#shorts #epoxy #interiordesign,How to style a SMALL living room to look bigger (and better!) ✨ Struggling with a cramped space? Watch how we use small living ...
youtube,small apartment decor,https://www.youtube.com/watch?v=tahmOhu0NJw,1771387874,МЕБЛИРОВКА МАЛЕНЬКОЙ СПАЛЬНИ #дизайнинтерьера #ремонт #интерьер #спальня #дизайнспальни #лайфхак,
youtube,small apartment decor,https://www.youtube.com/watch?v=64wWvs0vUe0,1771383700,✨ Modern House Tour: Small Beautiful Home Design Tour with Simple Interior In Kathmandu ✨🏠,Modern House Tour: Small Beautiful Home Design Tour with Simple Interior In Kathmandu ✨   This video takes you on a tour of ...
youtube,small apartment decor,https://www.youtube.com/watch?v=NUQpXw1IcU8,1771380116,"Concealed Safe Bedside Table – Practical, Stylish, and Perfect for Small Apartments” #shortsfeed","In this video, we showcase the ultimate triple touch sensor LED mirror and explore the latest LED mirror design perfect for modern ..."
youtube,small apartment decor,https://www.youtube.com/watch?v=3VIMF-hswtw,1771355781,SMALL CLOSET TRANSFORMATION | NYC Housing Lottery Apartment,"Transform your small closet into a luxury organized space! ✨ In this video, I'm taking you through my complete closet makeover ..."
youtube,small apartment decor,https://www.youtube.com/watch?v=Qxh86WIpuZQ,1771353082,"this year we downsized from our 2,000 sq ft house to this 765 sq ft and we’re loving it so far 🥹","this year we downsized from our 2000 sq ft house to this 765 sq ft aaaaaand we're loving it so far it's easier to clean, ..."
youtube,small apartment decor,https://www.youtube.com/watch?v=xaNgjntXwyw,1771352708,​#interiordesign #spacesaving #londonapartments #murphybed #smallhomehacks #ukinteriors,interiordesign #spacesaving #londonapartments #murphybed #smallhomehacks #ukinteriors #tinyhomeliving #modernhome ...
youtube,small apartment decor,https://www.youtube.com/watch?v=1xp__GVH650,1771347603,Luxury Small Apartment Interior Design Trends 2026 for Elegant Modern Living,"Small home interior design in 2026 focuses on luxury compact living, where elegance meets smart functionality. Modern small ..."
youtube,small apartment decor,https://www.youtube.com/watch?v=MJA7arsH2nI,1771344036,How to Achieve Parisian Chic in a Small Living Room | Timeless &amp; Elegant Tips,"Achieving Parisian chic in a small living room begins with embracing timeless foundations: soft neutral palettes, elegant ..."
youtube,small apartment decor,https://www.youtube.com/watch?v=_RTGcWPLnF4,1771343716,tiny nyc apartment wardrobe organization,"when i moved into this tiny brooklyn studio (it's a rental btw), i prioritized the feeling of calm + spaciousness over having stuff. this ..."
youtube,small apartment decor,https://www.youtube.com/watch?v=KCHU0HVZ1MI,1771339785,Elegant Small Apartment Design Inspired by Classic Parisian Aesthetics,"From delicate wall moldings and herringbone parquet floors to vintage-inspired Louis-style seating and marble accents, every ..."
youtube,small apartment decor,https://www.youtube.com/watch?v=fy1QBDjbXSU,1771338626,Best Study Table Design for Work From Home &amp; Students 😍 | Smart Desk with Storage for Small Rooms,"Looking for a smart, compact study table design for your home? ✨ In this video, we showcase a highly functional study table that ..."
