source,domain,url,created_utc,title,text,query
gnews,news.google.com,https://news.google.com/rss/articles/CBMikwFBVV95cUxObHRSWDFUWWVPMDlWS1JVNlBMUHhlTUNGU2R6S1VwR3YtZHVZNmVFLVF3WnowUno0OHVnRGxvdFpEQlhfYmt4YWZWelVjUHc5RXBHbWRoTDFoWUZvTXpUVmplS3d6cGhEODZVdFk4NUNqRTJ2dUlUTE9OMzJYVVZCZFZhNTRXTlN1ekdId2JYUzFnVzg?oc=5,1777791600,"Psychologists Explain Why Everyone’s Suddenly Obsessed With ""Grandma Things"" - House Beautiful","Psychologists Explain Why Everyone’s Suddenly Obsessed With ""Grandma Things"" - House Beautiful",home decor trend
gnews,news.google.com,https://news.google.com/rss/articles/CBMiowFBVV95cUxQd2FzMzlaNC1DdTJRWWJqQ0pPSmotalUzdC1SQkxCVE04RDhtUmNTYk96MUlqR3VxWm1wc1p2a0VRR01KelRRazNlVkxqV3lOeXRuZkVsdGRLX01XQUkwS1UzV1Z3cE5IcjhUV1ZCMVNTdWZMOEcwcVdNemJyRDYxRXNJVmhuNVJ4UlpHVDhKbFVOR0J0N25vd2NlUmZnNGFHaVp3?oc=5,1776927600,Equestrian Home Decor Is Galloping Into 2026–Here’s How to Get the Look - The Pioneer Woman,Equestrian Home Decor Is Galloping Into 2026–Here’s How to Get the Look - The Pioneer Woman,home decor trend
gnews,news.google.com,https://news.google.com/rss/articles/CBMikAFBVV95cUxNdXZVOFllejlNUk9BanRtemJXdkIwZVR3Sk1qTkJDMl81YmE2V25mRzEyQTY0Rm1DWXNDaGpOVzluZFJ0NVBUdUdKOFUtMzk0UDhpUDFadzl0blVjSkR6VDRDTVJKY1ZYbVRnOEZUQi1sX2JhU2J1SDFzMXUwOTQ5RkdLT0JDVlpnTkRJa19ONDU?oc=5,1774335600,"Designers Agree: ""Whimsical"" Decor Is the Secret to a More Joyful Home in 2026 - House Beautiful","Designers Agree: ""Whimsical"" Decor Is the Secret to a More Joyful Home in 2026 - House Beautiful",home decor trend
gnews,news.google.com,https://news.google.com/rss/articles/CBMifkFVX3lxTE1sYXJVak5NWGJoSnJiczBUOUdjd19oR2RPOHRRMTByUk9ESkd5LVBpcWwzM3ZOaTlGa2J4TjIxWXhiYWJqZlAzRWdaQk9rbU95eDcwcU4zVEZtUmQzeUQ2Y21tVTF6UnZBT3c4eUZWUEVyNFI2UlJYNXFVY3E3QQ?oc=5,1774422000,This Grandma-Approved Goose Decor Trend Is Taking Over This Spring - Apartment Therapy,This Grandma-Approved Goose Decor Trend Is Taking Over This Spring - Apartment Therapy,home decor trend
gnews,news.google.com,https://news.google.com/rss/articles/CBMickFVX3lxTE4tLXJyYVVObzRjUXY3N1R3cHlqNnl5S2s3SjFsRU0wQzhwRTVMMURvVDllZ1oybW5LU0pTekpkWExZbF9FLVJvTHRYYVV1Q3J6VkU5U1JJSTBBYTRNZFU2VkVTSGZxLWVsUllxWlFwYm5Fdw?oc=5,1776409200,57 small living room ideas for characterful compact spaces - House & Garden,57 small living room ideas for characterful compact spaces - House & Garden,small apartment decor
gnews,news.google.com,https://news.google.com/rss/articles/CBMiugFBVV95cUxNMUY0NG9wT2huenhYeGRRVzE1MWNReHd2cTdZNENuN0lXQ3dwS2dmREt1RGVJYTFsdVUyQ3BYSGZ1LXpvbWI2cXZESkZJallROGR1Mm9QY20tSS1NVmlmSjVoM1BTZUtRU1p1UWVKZmswZGpIRURnVGc5QTFtX25VY0VnM2NxeGlGMzR6ZFFQOEx5LVpUMkpqMWRqMFNJTnRUM2hrLWt0VGRtR1pkeUdmancxNy1XdEhza3c?oc=5,1776236400,A Design Editor Applies Color and Restraint in His Madrid Apartment - The New York Times,A Design Editor Applies Color and Restraint in His Madrid Apartment - The New York Times,small apartment decor
gnews,news.google.com,https://news.google.com/rss/articles/CBMie0FVX3lxTE9FOHFoOXF6a2wwSHIwTGZjcmdTYzVZQ19GUUFZc2djcFMwMVZhYVRNQ2ZxSy1NVzNELTk1SWw0ZzFmZHNnR09uUkRLWVNuNlljUmwxZXB1dzZBN2tjUXNvTGl6aHNfOXhnVUYzaG5MWWNzWEhyX3BoLUJBbw?oc=5,1777014000,7 Holiday Design Ideas From a Designer Who Went All In on Christmas — In 700 Square Feet - Apartment Therapy,7 Holiday Design Ideas From a Designer Who Went All In on Christmas — In 700 Square Feet - Apartment Therapy,small apartment decor
gnews,news.google.com,https://news.google.com/rss/articles/CBMihAFBVV95cUxQSzlSUEh3UUxGOE5uNkxLS3Y0c1FRNEdyelZqaDBoODIzRjZOMF9jUDF4cUY5Z19wOTVJdFN0UHYyV2diNTZobFZtSC12dDl0NUNoUFVrTG15SXF3VzAxcDBfckUtNGFlaVpSajEybHRKWkZuZDE2MmFMZ1NXMGN4aUN3UWk?oc=5,1775631600,This 315-Square-Foot NYC Studio Uses Strategic White Decor (and a No-Drill Canopy Bed!) to Feel Huge - Apartment Therapy,This 315-Square-Foot NYC Studio Uses Strategic White Decor (and a No-Drill Canopy Bed!) to Feel Huge - Apartment Therapy,small apartment decor
gnews,news.google.com,https://news.google.com/rss/articles/CBMib0FVX3lxTE9jOGJhVTVKZDZrbXRGMVhJeDlEN3lTdEFIRXBJRDVfRWxMN0lyYzY2TG5JOWlUMzFBYVhvSHo2QzdKUlpfb1F1T2IxcllEdDIyLU5EVS1NNjlteHMyeTRPOG9wV25iejJqWjNQcmZ2Yw?oc=5,1776495600,Give Your Small Entryway a Welcoming Boost With These 31 Ideas - The Spruce,Give Your Small Entryway a Welcoming Boost With These 31 Ideas - The Spruce,small apartment decor
gnews,news.google.com,https://news.google.com/rss/articles/CBMid0FVX3lxTE05UTJTcTZlWGVvbTJjNG5yMTBrU2RzLWFWbWRmSzRHLTBZNEZ0MUZLUHRzT0lNMGdQSHE3dWRCbGh3cEFxTFN4Skt2Zi1FcE9RQldwT3lPenNMTkszb3Fvck9kbE02Y2E3aFhJUWZ0OGtSOGFYLUlj?oc=5,1774508400,101 of Our Favorite Plant Displaying Ideas of All Time - Apartment Therapy,101 of Our Favorite Plant Displaying Ideas of All Time - Apartment Therapy,small apartment decor
gnews,news.google.com,https://news.google.com/rss/articles/CBMidEFVX3lxTE0tX3hmcmROaWY1eUZ1bURnQTR4R2ktbktpNVpYNnhZR1V1Z3BfaWxVZ0VZWjRNMTl1eTl4M3Q2MXJYNXFITHFaSFFKTU5OVDNSR2hrV093WnRkY2l2SGQ1cFlmN2ZuZXE3eTZfU1ZOeFluWjNP?oc=5,1775545200,33 Small Laundry Room Ideas for the Tiniest of Spaces - Architectural Digest,33 Small Laundry Room Ideas for the Tiniest of Spaces - Architectural Digest,small apartment decor
youtube,,https://www.youtube.com/watch?v=8gbRQXhiEow,1778167527,Small Modern Kitchen Design Trends 2026 || @gninteriorbd,"Our company name is GN INTERIOR Our service about interior design, interior decoration, home interior design, bedroom interior ...",interior design trends
youtube,,https://www.youtube.com/watch?v=QZb8dYsJuXg,1778167098,2026 Interior Design Trends: High-Gloss Laminates &amp; Custom Wood Paneling,"Step inside our latest project as we bring a modern vision to life! In this video, we're showcasing the intricate details of a home ...",interior design trends
youtube,,https://www.youtube.com/watch?v=7d8Tf77aeEU,1778166023,8 MUST SEE Kitchen Design Trends &amp; Remodeling Ideas from a Home Builder!,8 MUST SEE Kitchen Design Trends & Remodeling Ideas from a Home Builder! Kitchen trends in 2026 are changing fast—and ...,interior design trends
youtube,,https://www.youtube.com/watch?v=1WRp6WN2VEQ,1778164762,tv cabinet design for living room ideas #interiordesign,tv cabinet design for living room ideas #interiordesign 25 Modern TV Cabinet Designs for Stylish Living Rooms ✨ Latest TV Unit ...,interior design trends
youtube,,https://www.youtube.com/watch?v=VCQ6n6W9Osw,1778164221,Modular Kitchen Designs India #yt #youtube #trending #shorts #interiordesign #kitchen #trends #home,Still compromising on hygiene? What looks clean outside isn't always truly hygienic. Tusker Steel Kitchens in 304 stainless steel ...,interior design trends
youtube,,https://www.youtube.com/watch?v=JqKml633PdM,1778159541,Interior Designers Are Using THIS Art Trend in 2026 | Luxury Wall Art Project #interiordesign,Interior Designers Are Using THIS Art Trend in 2026 | Luxury Wall Art Project #interiordesign Discover how modern interior ...,interior design trends
youtube,,https://www.youtube.com/watch?v=murbbMnD2E0,1778156942,home interior design work 🥰#youtubeshorts #viral #viralvideo #foryou #trending #shorts #short,home interior design work #youtubeshorts #viral #viralvideo #foryou #trending #shorts #short3bhk interior design best interior ...,interior design trends
youtube,,https://www.youtube.com/watch?v=LoJvxjIl1mI,1778156006,Casa Decor left us with one clear idea,"Casa Decor left us with one clear idea: today's interior design is about emotion. More organic spaces, textured materials, curved ...",interior design trends
youtube,,https://www.youtube.com/watch?v=rFr28YaLMkc,1778155553,TOP 20 Luxury TV Wall Design Trends 2026: Modern TV Unit Design &amp; Stylish TV Wall Decor Ideas,TOP 20 Luxury TV Wall Design Trends 2026: Modern TV Unit Design & Stylish TV Wall Decor Ideas Looking for the ultimate ...,interior design trends
youtube,,https://www.youtube.com/watch?v=JfWx9eHmUC4,1778155238,Interior Design Trends to AVOID in 2026 (What&#39;s Already Outdated),"Not every 2026 interior design trend is worth following. In this video, I reveal the trends you should avoid — and what to do instead ...",interior design trends
youtube,,https://www.youtube.com/watch?v=4o61ED9s6EM,1778153410,"Seamless finishes, smart storage, flawless installation — the art of modern kitchen design.","In this video, we're exploring the art of interior design with practical tips and creative ideas to transform your space. With over 10 ...",interior design trends
youtube,,https://www.youtube.com/watch?v=q26Aqd0PRXY,1778152687,Black Ivory Printed Cotton Lumbar Pillow – Mono Sphere #interiordesign #homedecor #homestyling #home,"""   Minimalist Monochrome Elegance | Mono Sphere Lumbar Pillow Cover Upgrade your living space with the sophisticated ...",interior design trends
youtube,,https://www.youtube.com/watch?v=69K9KakoAYM,1778148131,Biophilic design isn’t just a trend. it’s the future of modern living 🌿 #biophilicinteriors,"Biophilic design isn't just a trend. it's the future of modern living As cities grow faster and lives get busier, people are craving ...",interior design trends
youtube,,https://www.youtube.com/watch?v=yaZTcYceDXQ,1778144432,Not Just a Transformation… A Whole New Feeling ✨,"Not just a transformation… a whole new feeling. ✨ Every detail, every texture, and every corner was designed to turn a house into ...",interior design trends
youtube,,https://www.youtube.com/watch?v=mQjIU8k9xOo,1778141615,Luxury Interior Design Ideas 2026 🏗️ Dream Home Transformation &amp; Modern Decor Trends #interiordesign,"Transforming ordinary spaces into luxurious dream environments that reflect style, comfort & personality! ✨ From elegant living ...",interior design trends
youtube,,https://www.youtube.com/watch?v=x1VIW7UftEk,1778140859,20 Gaudy Living Room Trends That FADED Into 1970s History . ,"The 1970s was the decade that taste forgot—or was it? From conversation pits to shag carpets in the bathroom, we're looking ...",interior design trends
youtube,,https://www.youtube.com/watch?v=wRAa-9vBO7s,1778139907,​Would You Sleep on a Floating Bed  #Satisfying #home #shorts,Would You Sleep on a Floating Bed? 🛏️ Experience the most satisfying bedroom transformation ever! From raw river stones to a ...,interior design trends
youtube,,https://www.youtube.com/watch?v=aFEJyIiEbjc,1778137200,"как сделать, чтобы интерьер выглядит дорого #дизайнинтерьера",Подписывайся на канал @AlenaaTotskaya чтобы быть в тренде современного дизайна Оставить заявку на дизайн ...,interior design trends
youtube,,https://www.youtube.com/watch?v=DrA9k-cU2qQ,1778130066,🔥 Wall Panels DIY Installation | Decorative Panels for Stylish Home Design ✨,Wall Panels DIY Installation | Decorative Panels for Stylish Home Design ✨ #3dbudmaterial #wallpanels #decorativepanels ...,interior design trends
youtube,,https://www.youtube.com/watch?v=FnYE2GB3okE,1778128643,Imagine the 𝗦𝘁𝗮𝗰𝗸 𝗧𝗿𝗮𝘆 in Red Travertine &amp; Carrara from the 𝗖𝗵𝗮𝗻𝗻𝗲𝗹 𝗖𝗼𝗹𝗹𝗲𝗰𝘁𝗶𝗼𝗻,Imagine the Stack Tray in Red Travertine & Carrara from the Channel Collection styled & situated ...,interior design trends
youtube,,https://www.youtube.com/watch?v=ryhRzxilAME,1778122737,Esthetic Living Room Makeover | Minimalist Interior Design #updeshmistrirehli #home,Esthetic Living Room Makeover | Minimalist Interior Design Is video mein dekhiye ek behad khoobsurat aur cozy living room ka ...,interior design trends
youtube,,https://www.youtube.com/watch?v=JRwjeOIu2Tw,1778119221,dream home design trends | Music Safia #shorts,"dream home design trends | Music Safia #shorts Watch an unbelievable AI home transformation as an old, worn-out house turns ...",interior design trends
youtube,,https://www.youtube.com/watch?v=Kc3te1nOjiY,1778112018,Rotating Unit for Bags in the Wardrobe | Organization Ideas 2026 #interior #shortvideo #viralshorts,Discover the ultimate Beautiful Wardrobe organizing ideas that transforms your Wardrobe into a functional and stylish space.,interior design trends
youtube,,https://www.youtube.com/watch?v=OP0qVrzTImI,1778105513,20 Years Later… This Luxury Upgrade Feels Outdated 😳 #shorts,20 years ago this central vacuum system was considered a luxury upgrade Now cordless vacuums make it feel outdated.,interior design trends
youtube,,https://www.youtube.com/watch?v=XMAxUuP-nXI,1778101641,200+ Modern Living Room Ideas 2026 | Luxury Furniture &amp; Interior Design Trends,"Looking to transform your living room with modern design ideas for 2026? 🛋️✨ In this video, we explore 200+ living room ...",interior design trends
youtube,,https://www.youtube.com/watch?v=PIDFx1dPKMw,1778165453,Living Room Makeover | Low Cost  Home Decor Ideas | How I keep Home Clean &amp; Organized | WomeniaATF,Living Room Makeover | Low Cost Home Decor Ideas | How I keep Home Clean & Organized | WomeniaATF WomeniaATF HUB ...,home decor ideas
youtube,,https://www.youtube.com/watch?v=uAgce5zZSfc,1778164955,Diy with home decor ideas 😱#shorts,Diy with home decor ideas #shorts.,home decor ideas
youtube,,https://www.youtube.com/watch?v=TSJSdbyV5Pc,1778164341,DIY Realistic Lucky Bamboo Plant 🌿✨#shreyacrafter #shorts #bamboo #homedecor #diy,DIY Realistic Lucky Bamboo Plant ✨ Hey cuties! Today I'm making this super realistic Lucky Bamboo Plant using just paper!,home decor ideas
youtube,,https://www.youtube.com/watch?v=LojgsDqKTww,1778157383,easy home decor diy idea (beautiful home decor),easy home decor diy idea (beautiful home decor) home decor diy with simple things home decoration ideas easy and beautiful ...,home decor ideas
youtube,,https://www.youtube.com/watch?v=ZL7Co1PLLsM,1778157304,Small space Decor ideas 🪴 #trendingshorts #homedecor,,home decor ideas
youtube,,https://www.youtube.com/watch?v=Zq1VBmalCMU,1778155500,Modular Kitchen Design ✨ Modern Storage &amp; Premium Finish Ideas #interiordesign #home,"ت Modular Kitchen Design کے ساتھ Smart Storage, Stylish Finish اور Space Saving Ideas آپ کے کچن کو بنائیں مزید Luxury ...",home decor ideas
youtube,,https://www.youtube.com/watch?v=hg8a0hcHmvY,1778154747,Homedecor diy plant stand #garden decoration ideas #Shorts #shortsviral #shortsfeed #viral,Homedecor diy plant stand #garden decoration ideas #Shorts #shortsviral #shortsfeed #viral.,home decor ideas
youtube,,https://www.youtube.com/watch?v=cUTp2owNfXc,1778154189,Revolutionary DIY Home Decor Ideas - Transform Your Space,Description: Discover easy and budget-friendly DIY home decor ideas that will transform your living space into a cozy haven!,home decor ideas
youtube,,https://www.youtube.com/watch?v=HEIJ_eT9O-8,1778152620,DIY Home Decor || JELLY FISH CRAFT 🪼#shorts #viralshorts #reuse #diy #handmade #crafting #trending,DIY Home Decor || Easy Aesthetic Room Decor Ideas #shorts #viralshorts #homedecor #wallhanging #diy DIY wall hanging idea ...,home decor ideas
youtube,,https://www.youtube.com/watch?v=8W70Sq1_9KQ,1778151893,Great Decor Ideas for Your Home P3 #diy #adamrose #construction #design #decor #homedecor #craft,,home decor ideas
youtube,,https://www.youtube.com/watch?v=SqrRkOb0dpQ,1778151567,DIY Artificial Bamboo Plant 🌿 | Elegant Home Decor Idea #Shorts #artificialplants #ytshorts #diy #yt,DIY Artificial Bamboo Plant | Elegant Home Decor Idea #Shorts #diy #artificialplants #homedecor #aesthetic #handmade ...,home decor ideas
youtube,,https://www.youtube.com/watch?v=gmm6h-mGNT8,1778150641,Luxury Bathroom Design Ideas ✨ | Smart &amp; Organized Bathroom Setup #interiordesign,"اپنے باتھ روم کو دیں ایک لگژری اور ماڈرن لک ✨ Smart storage, premium finishing اور perfect organization کے ساتھ اب آپ کا ...",home decor ideas
youtube,,https://www.youtube.com/watch?v=69jDomgUm6c,1778150670,Kitchen accessories🫶☕️ #homedecorideas #homedecor #kitchentools #glassjars #waterbottle,"Zapai – সাধ্যের মধ্যে স্বপ্ন পূরণ আমরা Zapai থেকে ঘর সাজানো, লাইফস্টাইল, ...",home decor ideas
youtube,,https://www.youtube.com/watch?v=KUb5AEy1d4g,1778150540,Crochet Home Decor Items So Cute They Sell Fast,Discover fast-selling crochet home decor ideas that will make your space feel cozier and more inviting. These easy crochet ...,home decor ideas
youtube,,https://www.youtube.com/watch?v=pChzX4n41ao,1778148668,Home Decoration- Interior Design Ideas - #design #home #homedecor #indian #interiordesign #interior,Home Decoration- Interior Design Ideas - #design #home #homedecor #indian #interiordesign #interior For educational ...,home decor ideas
youtube,,https://www.youtube.com/watch?v=tbiQ743T5gQ,1778146235,Tiles पर लगाओ ये Tiles Stickers #tiles #tilesstickers #homedecor,Tiles पर लगाओ ये Tiles Stickers #tiles #tilesstickers #homedecor अगर आपकी पुरानी tiles खराब या dull ...,home decor ideas
youtube,,https://www.youtube.com/watch?v=Td4yZT5Mt_U,1778145188,Cute Mother&#39;s Day Gift Idea//Best Out Of Waste//Home Decor idea//#diy/#craft/#shorts,,home decor ideas
youtube,,https://www.youtube.com/watch?v=7DPXfZk34j8,1778144521,Home decor ✨ #home #decor #ideas #travel #explore #trendingshorts #viralreels #homedecor #beautiful,,home decor ideas
youtube,,https://www.youtube.com/watch?v=sPbrR4CMJn0,1778143779,Tem gente que acha isso daqui horrível!!! #DIYHomeDecor#CementCraft#HomeDecorIdeas#RusticDecor #diy,Eu realmente achei que tinha estragado essa toalha… Molhei no cimento sem saber se ia funcionar. No meio do processo ...,home decor ideas
youtube,,https://www.youtube.com/watch?v=LupGsegt5j0,1778143420,ice cream stick basket 🧺 ideas #diy #trending #handcraft #homedecor #handmade,ice cream stick basket ideas #diy #trending #handcraft #homedecor #handmade #craftideas #shortreels #shortsfeed ...,home decor ideas
youtube,,https://www.youtube.com/watch?v=PzbHg-PxGTg,1778140414,Revolutionary DIY Home Decor Ideas - Transform Your Space in Days,Description: Discover incredible DIY home decor ideas that will transform your space in just days! From budget-friendly hacks to ...,home decor ideas
youtube,,https://www.youtube.com/watch?v=q7AYSMi1VJ0,1778139033,waste material craft ideas/ best out of waste/home decor ideas #shorts #ashortaday #youtubeshorts,waste material craft ideas/ best out of waste/home decor ideas #shorts #ashortaday #youtubeshorts #homedecor #bestoutofwaste ...,home decor ideas
youtube,,https://www.youtube.com/watch?v=0CXX_m2vJaM,1778139001,What’s your vibe #interiordesign #homedecor #viral #home #interior #decor #decorideas #homelove,,home decor ideas
youtube,,https://www.youtube.com/watch?v=xmoHGWbwBRk,1778138419,Try this diy home decor idea!!🐚✨#diy #subscribe,,home decor ideas
youtube,,https://www.youtube.com/watch?v=ip7Cr-xk5ic,1778137688,Tiny House Goals 🏡✨ Modern 2-Story Tiny Home Design You’ll Want to Live In,This stunning modern tiny house proves that small spaces can feel luxurious From the curved staircase to the cozy balcony and ...,home decor ideas
youtube,,https://www.youtube.com/watch?v=QySHUDHv1Hs,1778166050,SMALL SPACES DECORATING IDEAS #smallspacedecoratingideas #interiordesign,"In today's video I share an alternative for decorating a den or small apartment. Instead of buying a large sofa or loveseat, try using ...",small apartment decor
youtube,,https://www.youtube.com/watch?v=8cD8KOp5aVo,1778163943,small living room transformation video of an apartment in modern style,,small apartment decor
youtube,,https://www.youtube.com/watch?v=0S3pY4NqYPw,1778162404,Hidden Murphy Bed for Small Apartments | Space Saving Bed #murphybed #shorts,Hidden Murphy Bed for Small Apartments | Space Saving Bed Smart Space Saving Murphy Bed DesignModern Murphy Bed ...,small apartment decor
youtube,,https://www.youtube.com/watch?v=-vS76NBrLKM,1778160601,"Small Apartment Ideas | Modern Living Room, Kitchen And Dining Design","Small spaces don't have to feel limited. In this video, modern apartment living is explored through layouts that bring the living ...",small apartment decor
youtube,,https://www.youtube.com/watch?v=lVcpht7VCqY,1778157478,Ultimate 3D Interior Design Makeover 🔥 | Small Room Transformation | Modern Home Ideas 2026,"Watch the ultimate 3D interior design makeover and see how a small space is transformed into a modern, stylish, and functional ...",small apartment decor
youtube,,https://www.youtube.com/watch?v=8Xtz3x8Is24,1778155214,Soluções geniais pra quem vive em apê pequeno  #achadinhos #shopee #dicas,Soluções geniais pra quem vive em apê pequeno #achadinhos #dicas #shopee #donadecasa #casapequena ...,small apartment decor
youtube,,https://www.youtube.com/watch?v=nL_ncAra2ec,1778153485,Genius Tiny Studio Apartment Makeover Ideas for Small Spaces,Transform your tiny studio apartment into a stylish and functional dream space with these genius makeover ideas for small homes ...,small apartment decor
youtube,,https://www.youtube.com/watch?v=bBo2Jl64aKM,1778149832,Quiet Luxury in Paris Inside a Tiny Dream Apartment That Feels Like a Boutique Hotel,"Welcome back to Gelux Home! This video takes you inside a tiny Parisian dream apartment, demonstrating that luxury is about ...",small apartment decor
youtube,,https://www.youtube.com/watch?v=8oTwekhbNDs,1778148024,multi functional space saving furniture for small apartment #shorts,multi functional space saving furniture for small apartment #shorts.,small apartment decor
youtube,,https://www.youtube.com/watch?v=kUcL9vxknj0,1778144475,#recreationalvehicle  #travel  #camping #travel trailer camping#automobile,house design plan house design ideas interior design ideas interior design ideas for small house house design planner free ...,small apartment decor
youtube,,https://www.youtube.com/watch?v=V2vDXgjRJhE,1778144450,I officially live on this sofa now... ☁️🍕 (My favorite spot!) #sofabed #relax  #homedecor #sofa,"POV: You found the one piece of furniture you'll never want to leave. ✨ ""I like to stay on it"" is an understatement. Whether I'm ...",small apartment decor
youtube,,https://www.youtube.com/watch?v=GRwAbEbS8Yk,1778144432,💥ИЗ 25м² В ШЕДЕВР! Яркая квартира с гениальным зонированием и эксклюзивной спальней| Обзор интерьера,"Добро пожаловать в самую функциональную студию, которую вы видели. Всего 25 квадратных метров, но здесь есть все: ...",small apartment decor
youtube,,https://www.youtube.com/watch?v=Dqg78gQMh7Q,1778141319,Grey 3x3m Loft Bed Design Idea for Small Rooms,,small apartment decor
youtube,,https://www.youtube.com/watch?v=fcgRkjmnInA,1778127961,Genius Tiny Apartment Decor Ideas to Maximize Every Inch,Discover genius tiny apartment decor ideas that help maximize every inch of your small home without sacrificing comfort or style ...,small apartment decor
youtube,,https://www.youtube.com/watch?v=rswdZrNmvP4,1778124168,Genius Tiny Apartment Decor Ideas for a Cozy &amp; Stylish Home,Transform your tiny apartment into a cozy and stylish dream home with these genius decor ideas from HAS Design! In this video ...,small apartment decor
youtube,,https://www.youtube.com/watch?v=3fwLTjuF30k,1778118335,Tiny Studio Apartment → Luxury Epoxy Loft Transformation,Watch this unfinished studio apartment transform into a luxury modern loft with a stunning metallic epoxy marble floor. From dusty ...,small apartment decor
youtube,,https://www.youtube.com/watch?v=h_I88j2TQE8,1778117671,Cozy Wooden Bookshelf for Bedroom Reading Corners ✨#BedroomDecor #SmallSpaceLiving,"A warm wood bookshelf styled for a cozy bedroom corner, perfect for books, plush toys, and calm everyday storage. This soft ...",small apartment decor
youtube,,https://www.youtube.com/watch?v=KUy1kcMwa3Q,1778112032,Perfect for small spaces or a cozy guest room  Where would you use it? #sofa #furniture #shorts,"From couch mode to bed mode in seconds. Extendable slats make the switch effortless. Perfect for apartments, guest rooms, and ...",small apartment decor
youtube,,https://www.youtube.com/watch?v=JqONo11aGCM,1778112016,Tiny Budgets Big Transformations for Living Spaces,A quick tour of budget-friendly decorating ideas that span minimalist calm to vibrant energy with practical tips and easy DIYs.,small apartment decor
youtube,,https://www.youtube.com/watch?v=VXnZ8ya_h_4,1778106260,Small apartment with a big sofa 🤭#sofa #sofabed #home #homedesign #sofacover,,small apartment decor
youtube,,https://www.youtube.com/watch?v=QkT1szb9dPA,1778104827,Too many shoes for your NYC apartment? 👠#antbox  #nycshoes  #shoeorganization  #smallspaceliving,Shop ANTBOX 8 Tier Shoe Cabinet: https://www.antboxstorage.com/products/8-tier-shoe-cabinet-small-spaces ✓ Stores up to 32 ...,small apartment decor
youtube,,https://www.youtube.com/watch?v=Q217QJYNSAo,1778102539,120 Amazon Furniture &amp; Gadgets That Turn Tiny Cluttered Apartments Into Luxury Spaces,00:00 Introduction 00:34 Lift Top Coffee Table - https://amzn.to/4jqDQEE 01:07 Mini Dryer - https://amzn.to/3GhBlEU 01:42 Fluted ...,small apartment decor
youtube,,https://www.youtube.com/watch?v=QfJuOEvpIbU,1778101009,Small Studio Apartment Night Transformation | Cozy Minimalist Interior 🌙 #shorts,Cozy Minimalist Studio Apartment at Night ✨ Experience a beautifully designed small studio apartment at night with warm lighting ...,small apartment decor
youtube,,https://www.youtube.com/watch?v=_4oTlhDqQ1Q,1778100060,Small Apartment MUST HAVE! ️ Sofa to Bed Transformation #shorts #interiordesign,Transform your small apartment with this amazing 3-in-1 convertible sofa bed! ✨ Key Features: - Compact 136cm design ...,small apartment decor
