source,domain,url,created_utc,title,text,query
youtube,,https://www.youtube.com/watch?v=RsStLnhaTBc,1781011497,✨🎀 Pinteresty Room Decor Ideas For you 💡🫵🏻,RoomDecor #PinterestIdeas #AestheticRoom #HomeDecor #DecorationIdeas #RoomInspiration #DIYDecor #Shorts ...,home decor ideas
youtube,,https://www.youtube.com/watch?v=Yg4exYdeG_g,1781058000,Tiny Apartment Styling Ideas for a Spacious Feel,"Looking for creative ways to make your tiny apartment feel bigger, brighter, and more comfortable? In this video, HAS Design ...",small apartment decor
youtube,,https://www.youtube.com/watch?v=iN7Ihy5p_48,1781056589,Chic and Smart Decor Ideas for Tiny Apartments,"Looking for stylish ways to transform your tiny apartment into a functional and beautiful home? In this video, Vinza Studio shares ...",small apartment decor
youtube,,https://www.youtube.com/watch?v=KUvZasS3D1U,1781055299,Clever Tiny Apartment Decor for a Modern Lifestyle | Small Space Decorating Ideas,"Looking for clever tiny apartment decor ideas that combine style, comfort, and functionality? In this video from Astri Home Decor, ...",small apartment decor
youtube,,https://www.youtube.com/watch?v=h1gDKR47hTM,1781049615,Luxurious Frugality in a Tiny City Flat,A practical guide to budget living featuring a nurse and a student who prove that smart choices beat costly habits. Watch their ...,small apartment decor
youtube,,https://www.youtube.com/watch?v=wA6FQQFcQY4,1781036900,POV: You Turn a Tiny Space Into a Zen Sanctuary 🌿,"From empty corner to cozy zen retreat. Watch this Japanese-inspired small-space makeover come together with a tatami mat, ...",small apartment decor
youtube,,https://www.youtube.com/watch?v=lTNjJkEx2Hg,1781027555,Small Living Room Transformation That Looks Expensive#short,"Watch this incredible living room renovation transformation! From an ordinary space to a modern, elegant, and cozy living room.",small apartment decor
youtube,,https://www.youtube.com/watch?v=AaaWYiSibHI,1781023062,#smartfurniture #furniture #upgradeyourhome #interiordesign #smallapartment #interior,,small apartment decor
youtube,,https://www.youtube.com/watch?v=7YDBjvE5UOM,1781022492,#furniture #smartfurniture #kitchen #transformers #smallapartmentideas #home,,small apartment decor
youtube,,https://www.youtube.com/watch?v=hmJnNpOzGRA,1781022163,#furniture #opulentinteriors #smartfurniture #kitchen #smallapartmentideas #home #upgradeyourhome,,small apartment decor
youtube,,https://www.youtube.com/watch?v=dmF5iHpZZuw,1781021210,Inside a Cozy Parisian Tiny Apartment Full of Timeless Charm,This cozy Parisian tiny apartment beautifully demonstrates how timeless design can transform a small space into an elegant and ...,small apartment decor
youtube,,https://www.youtube.com/watch?v=-9T8wAov0Js,1781020824,#smartfurniture #home #furniture #ikea #interiordesign #smallapartment #interior #homedecor,,small apartment decor
youtube,,https://www.youtube.com/watch?v=-5OWxr-Qjw8,1781020221,"25 Amazon Furniture Picks for Small Apartments - Stylish, Space-Saving &amp; Under $500(With Prices)","Products Featured In This Video: space saving furniture, tiny apartment furniture, multifunctional furniture, sleeper sofas, sectional ...",small apartment decor
youtube,,https://www.youtube.com/watch?v=1v_CvjWKwBE,1781015404,Studio Apartment Transformation | Metallic Epoxy Floor Before &amp; After #construction  #viral #shorts,Watch this incredible studio apartment transformation from an unfinished construction site into a stunning luxury living space ...,small apartment decor
youtube,,https://www.youtube.com/watch?v=1J_yYXsPWUQ,1781015187,Small Apartment | Stylish Living Room Sofa Bed#sofa #home #homedesign #sofabed #sofacover,,small apartment decor
youtube,,https://www.youtube.com/watch?v=KdOqRMbK7lg,1781013624,"Tiny Apartment, Luxury Look | Parisian Decor Secrets That Never Go Out of Style",ParisianDecor #TinyApartmentDesign #LuxuryInteriors Discover how to transform a tiny apartment into a luxurious and timeless ...,small apartment decor
youtube,,https://www.youtube.com/watch?v=FsMqEXyTcM8,1781012303,tiny apartment interior design  #interiordesign #colors #tinyhome #tinyapartment #livingsmall,the first painting shown is done by Dorothy White.,small apartment decor
youtube,,https://www.youtube.com/watch?v=pIaQP7MEP5s,1781012109,Small Balcony Makeover Ideas | HiLiving Interiors Bangalore🏡✨ #hilivinginteriors #trending,Turn Your Balcony Into a Luxury Relaxing Space ✨ Your balcony is not just an outdoor area… It can become your favorite corner ...,small apartment decor
youtube,,https://www.youtube.com/watch?v=9xUQNiEkQiY,1781011802,Wake Up Sid Was Never Just About Mumba It Was About Home! #wakeupsid  #home #urbanspace #shorts #yt,"Why do some homes stay in our memory long after we've left them? In this video, we revisit one of Bollywood's most loved homes ...",small apartment decor
youtube,,https://www.youtube.com/watch?v=ZySzPgRIzoU,1781010580,small space kitchen idea 👌🔨🪚 #furniture #woodworking #interiordesign,Watch till the end for budget-friendly organizing hacks that make your kitchen look modern and efficient. Perfect for: Small ...,small apartment decor
youtube,,https://www.youtube.com/watch?v=qzsY0TWIviw,1781010024,Small Modern Luxury Apartment Decor 2026 | Make Tiny Homes Look Expensive,"Small modern luxury apartment ideas 2026 to make your tiny home look expensive! Discover the best small space interior decor, ...",small apartment decor
youtube,,https://www.youtube.com/watch?v=R2On3zwbXdM,1781006129,Minimalist Japandi Decor Ideas for Tiny Apartments,"Looking for stylish ways to transform your small apartment into a peaceful and functional home? In this video, Decor Pedia ...",small apartment decor
youtube,,https://www.youtube.com/watch?v=_k4kr_VyB4Q,1781004907,Scandinavian Decor Ideas for Modern Tiny Apartments,Transform your small apartment into a stylish and comfortable retreat with these inspiring Scandinavian decor ideas! ✨ In this ...,small apartment decor
youtube,,https://www.youtube.com/watch?v=aAEHZ0RRVxo,1781004276,The Most Unbelievable Tiny Room Transformation #shorts,,small apartment decor
youtube,,https://www.youtube.com/watch?v=EXt5zYPGiG4,1781003140,Встроенная мебель в маленькой квартире это не роскошь,Это способ выиграть метры которых формально нет.,small apartment decor
youtube,,https://www.youtube.com/watch?v=eG2tgc3iw0U,1781002824,20 Artículos de Amazon para Organizar tu Apartamento Pequeño,1 ➡️ Organizador de Cables - https://geni.us/GDlDet (amazon) 2 ➡️ Tabla de Planchar para pared - https://geni.us/rCHcjW7 ...,small apartment decor
