source,domain,url,created_utc,title,text,query
gnews,news.google.com,https://news.google.com/rss/articles/CBMikAFBVV95cUxPWGkzX2lfYjRnSXZZa0F5MWVzdjZfRHZXaUhCaUwzZkd6dlcwelVYUXFXQWVXcnN5WkV5UVpDaXFHUWctS3VXOU1rZTd4bXMzZmo4SDZmYmJhNHAtV1Y3Y3dfOGNyaUhrcnUtUTN0aTVKbGJtNnc0QTVOR2VEVVd6U2RVd0ZvRmRwMEFMSUpIdlA?oc=5,1777964400,8 “Tacky” Home Trends Designers Say Are Officially Dead in 2026 - House Beautiful,8 “Tacky” Home Trends Designers Say Are Officially Dead in 2026 - House Beautiful,home decor trend
gnews,news.google.com,https://news.google.com/rss/articles/CBMirAFBVV95cUxPWWg5WWJKSVJXVEZrTTI5MV8xZk1oVHRkSUtfZDR0TF9YS2lZaUgybjNuSm5EZ29oSGlBYmlOdlpSZjZlODNiYUd4ZnpNazdmNlRsS1RyeDRHLUV5X1oxNE40eTZQZzJ1Z3ltR0ZjUzhuY0pfT1hkX2hMdjExN1FOTnBYTnBKM2FhcjlTV3ZMbDlSbWZjcjhoOGJwU1E0ZUd5ZVJzTTBQaGEwR1U1?oc=5,1779260400,These Are the Home and Design Trends You’ll See Everywhere in Fall 2026 - ELLE Decor,These Are the Home and Design Trends You’ll See Everywhere in Fall 2026 - ELLE Decor,home decor trend
gnews,news.google.com,https://news.google.com/rss/articles/CBMilAFBVV95cUxQNTc1WTAxMF8xUjhMTFlrUGZOR05PcVV0a1VjdGE3QWlGRmNYaDRfTFpuVFMtZmdGMmFwLXN1ZG5MaEZCT0tVQ05XMFJZT0Roall3eER0dXlpbE1keXRsV1FoaXJjUDFmbFNJWVdwdkItYkhoZnh0Ulc4cDZra1V1cVZYYlBNUnpuV01yejd5ZkdhZjJO?oc=5,1779606000,11 Summer Decor Trends Pros Say Will Be Huge in 2026 - Good Housekeeping,11 Summer Decor Trends Pros Say Will Be Huge in 2026 - Good Housekeeping,home decor trend
gnews,news.google.com,https://news.google.com/rss/articles/CBMiwwFBVV95cUxQUzRvb2hjeTZ0b3o1SzE5Q2t3WUotQlRRNldfY3JSTEw3MGE0R1lhQnN1VVd0dl80YzlvUmxuOGU1QTZROG1rQ0paS2g2eUNsQTdjbE15MzV6dElTcjc0SG1UdVZIWW0wZ3JodzZraXV6Rl9OWVdCU0xHVGkxbWlWdkltZ0pIQ1RsTTNXSkhkMTNNMEVkVEpLdHd4Q0N4MDNMMG1SMF91M3I4R1JqU1BTU2lONXViWWNIRWxQRE4yZ3ctcVk?oc=5,1778050800,2026 Summer Design And Decor Trends: From Midimalism To Grandmillennial - Forbes,2026 Summer Design And Decor Trends: From Midimalism To Grandmillennial - Forbes,home decor trend
gnews,news.google.com,https://news.google.com/rss/articles/CBMivwFBVV95cUxPcjQydnRUOEF3WVJNdGFPRDk1YmFGVkc2TlhWdVZLYTUzNUF4RENQTVdWQWFSRVp0NnI1Z2pINDlCV2t4bV9BNElVRExYbGhUcG01RkFpVkc0X0FjdlRxbVpJNDJ5bEJfd3Vvc0hCY0RBZGkzTHhITmVYRXYwbVpHUFV1RmsxUEpDYUZOTHlBbTRFS0R6WG9sOTlPVFhZajFfMUNrQ0cxdV9yU2ZYaENNd21pYUlSWWFGUmstcS1VQQ?oc=5,1779346800,Welcome Mat: Summer events and home decor trends to refresh your home - The Detroit News,Welcome Mat: Summer events and home decor trends to refresh your home - The Detroit News,home decor trend
gnews,news.google.com,https://news.google.com/rss/articles/CBMiiwFBVV95cUxQWFI1NnVYXzVZZlR1dndvcG9mZE9YdklhSVhTdDQyWF9TVko2VU9DTnlTQ2FNUHZrVG5DaldVRjFzXzc1M0doWnhZb0tUaThRdWo2am9scXB1LTNNVmYzVzlyNEJjN0hXOGhLRkJUZ3lJY3Z4Y3dkTHhfenZFdUlSYkN2YllXaUFaZDV3?oc=5,1779087600,"Designers Say This Trend Is Actually Making Your Home Feel ""Sad"" - House Beautiful","Designers Say This Trend Is Actually Making Your Home Feel ""Sad"" - House Beautiful",home decor trend
gnews,news.google.com,https://news.google.com/rss/articles/CBMifEFVX3lxTE1JaVcxRlY2ZU1VMTduQ2dyQ25JV2FBdmZKV3RXbEFPcGVEYWM5QUZRU084a0VVelBud2ZQdnFtbEdsQm9QR2RYeG9aRjBNbUhJMXdNTkdvWEloMkFmeXduQzFmRkkzUFd1M001cGhEM3luM01NTVh3TW9VdWk?oc=5,1779951600,7 Items That Are Making Your Home Look Dated—and the Fresh Updates Designers Recommend Instead - Real Simple,7 Items That Are Making Your Home Look Dated—and the Fresh Updates Designers Recommend Instead - Real Simple,home decor trend
gnews,news.google.com,https://news.google.com/rss/articles/CBMilgFBVV95cUxOQ3pWNktPbWF3eFVBT2hDZFlxOFpQWDM2N0ZQNUx5emxleGtnTHFITmFJV0NVWGRIU0hFTEpYTHY5SUdkd1RxSDZQTzIybmN1OE5BS0MxdnJnZ19JTVAyWTBJN3RtMUwyV3hma3VOVTZfOVhtRzJieDV0SVhrbWxGWnJ1bUJWVzMxLVpoaUtKVGhhcGZnYXc?oc=5,1777791600,Designers Say These 10 Vintage Decor Trends Will Be Everywhere in 2026 - Good Housekeeping,Designers Say These 10 Vintage Decor Trends Will Be Everywhere in 2026 - Good Housekeeping,home decor trend
gnews,news.google.com,https://news.google.com/rss/articles/CBMilwFBVV95cUxOOTdmWFBPRERMUDgzVnFQdDFSdE5qTkkteWNQSWRDeHBmMU1GMjJDQy1WWnI3clBMRkpOZkVrelF1MFd0ZUJpSk91b3Rjel9td3ZfQnlXc1lzRXhBTjJVNFdCajdOb2p3eU1DRnRXS1hXVnRMNEdKN1N1akI4Ni1TeVpmSmtDYTF5LVVNaUdLb25Gc2FuWUdn?oc=5,1780210800,Designers Reveal the “Tackiest” Decorating Trends From Every Generation - House Beautiful,Designers Reveal the “Tackiest” Decorating Trends From Every Generation - House Beautiful,home decor trend
gnews,news.google.com,https://news.google.com/rss/articles/CBMiggFBVV95cUxNQUlITmJmQlZ1ZkdDOC1Ka3ViMWxjcEdMOUxlQUplNHBLQTh4cEFkZFVnSF9Va0pISUk4ajZKaEJsQ3ZQaHBqLXdPaUgyeWxwUmJQUGgxU0hmOE5fMkk1eEpwSGZkY1NBY29ENjFoMWY1LTlxbnFRdXBta1RzTXNyLTR3?oc=5,1777186800,Designers Are Already Retiring These 6 Home Trends (Are They in Your House?) - Apartment Therapy,Designers Are Already Retiring These 6 Home Trends (Are They in Your House?) - Apartment Therapy,home decor trend
gnews,news.google.com,https://news.google.com/rss/articles/CBMijAFBVV95cUxQR0JobGVoNDRsZUxPTzF0emp3STJtNTFUZWRjUUdESzhYZ3RoYk8tbDV4VlZsNm85VFNzcVdETGxTMDFGZUdlbHlWM1N1ZFMxaUo2TWh5QXU0UXh3UU5SeWE5TS1EbE5fQWI0WkphSERzdHIwZGJwcUpMOWU1Y0FDNVlyOUxxMTJ0aWZIXw?oc=5,1780768800,Neil Young's Bohemian Living Room Sofa Trailblazed a Storyful '60s Design Trend That Will Be Everywhere in 2026 - Homes and Gardens,Neil Young's Bohemian Living Room Sofa Trailblazed a Storyful '60s Design Trend That Will Be Everywhere in 2026 - Homes and Gardens,home decor trend
gnews,news.google.com,https://news.google.com/rss/articles/CBMirwFBVV95cUxPa3pvcVVFaE5kQXlwY1VaVkVpalY2YkNqdVNVUGlFaDgxSkMzblozNW9TV1VUVXRFSG0xOS12RGcwa1Q3Vy10TVJSemdJMUZZY3JQT0dhQ0tnd2x4VjNRTUxqakNWaThDdnJsd1JZbDE2S29fR3A0WTNXZnBuX3hZSkhBaE1LZGNWa1RLUXV2dHhId1VYcllGQ01RUXZ3LXhuVTBuWTJWMUhwTFZ0eVZV?oc=5,1779778800,Jeremiah Brent Sounds Off on the Worst Design Trends From Social Media - House Beautiful,Jeremiah Brent Sounds Off on the Worst Design Trends From Social Media - House Beautiful,home decor trend
gnews,news.google.com,https://news.google.com/rss/articles/CBMilAFBVV95cUxNazZmSmhKV0s5eEtCYWZMWS03MzBMd09hYW8wa3FnUkJLN0dWNzNFYXFVTzlMSEdBbEl0c2VYRHhXZ2lSTkpkcVp3R1BJZWk4XzBDOVFwSExvRXlTdjViUnJXOWt1RDhUazA3OFBKVWpQTU1fS0czX0h0eUlsdkVwLXpuVzJ5VHEzSzFjVVFIWkk3SWd6?oc=5,1778655600,"How to Pull Off the “Nonnamaxxing” Trend at Home, According to Designers - House Beautiful","How to Pull Off the “Nonnamaxxing” Trend at Home, According to Designers - House Beautiful",home decor trend
gnews,news.google.com,https://news.google.com/rss/articles/CBMiY0FVX3lxTE5jQmZpUXF3SVRJX2d4cVBwOUlfTWYtYWppcVBXVHJtQXZtM1JzQ25RcmZxZF9KWjZPYWJTRkJ4d2Q1cTFJOUs4RWV1QWhfOENuZXNaVGx1YnZrS0gzeVgwNUllQQ?oc=5,1777446000,"The Top Summer Decor Trends of 2026, According to Design Experts - Better Homes & Gardens","The Top Summer Decor Trends of 2026, According to Design Experts - Better Homes & Gardens",home decor trend
gnews,news.google.com,https://news.google.com/rss/articles/CBMid0FVX3lxTE1EeUxaRmEycnRCR1BTZUI4MmlVQ2lMdjFKbmk2TkphNDN0MkpqRlRGTDVNWXYxRTNVNlpqaV9LaHRLS3VCMkk5eDh1UmxuMTBlZVZwV3pFSjE5Y2d5YjA3ZlVkUU5fOFoyeU1ZcURuNlo3blE5SFFF?oc=5,1777791600,We Asked Designers to Name the Most Overrated Decor Trends of the Year—and They Did Not Hold Back - Real Simple,We Asked Designers to Name the Most Overrated Decor Trends of the Year—and They Did Not Hold Back - Real Simple,home decor trend
gnews,news.google.com,https://news.google.com/rss/articles/CBMigAFBVV95cUxQcmpxWmJhNndyN2VzZzFaR0V4Y1ZLWEU0OFJ3UGlUeGNxeHRxOUN4MEtfQm9sOEg4VUJGX2ZNekktX0JyNU5VMm5FS2Q3dV9kZHB4bGYtWENQV2xTQk5xLUZaM1c3VDVZLTBkSkpWWmtWamllc2VwbldJWW82eDRvYw?oc=5,1779260400,The Chicest Designers in New York All Seemed to Agree on These 4 Trends at NYCxDESIGN 2026 - Homes and Gardens,The Chicest Designers in New York All Seemed to Agree on These 4 Trends at NYCxDESIGN 2026 - Homes and Gardens,home decor trend
gnews,news.google.com,https://news.google.com/rss/articles/CBMijgFBVV95cUxQVWE1TS1YQjBCeWEwTTVETDhrVEZtR0xzNjY1UlhrQUU0Q3UxbnRFbDFqQmcxSWEwNV9qdWJta19HRTlGUmpJSVMxaS0tV2YtdEhGNnZkaC1KT0paNjhmLW9JNG5STmZfMkRmUUItOUxUTnZkZ0N5QzBoTGx4azQ4eTBOdG82dWFLS2dSRS13?oc=5,1777532400,6 Living Room Trends Designers Say Are Out In 2026 - Southern Living,6 Living Room Trends Designers Say Are Out In 2026 - Southern Living,home decor trend
gnews,news.google.com,https://news.google.com/rss/articles/CBMiY0FVX3lxTE5UWUk3UG1OaThWZFNNWlRkaFRxTWtTeEZ2UTExQkJOYXhhbXM3cFltdlBZb0xLNHZySVp1UWpXeHJ4TlpGRENzcmdHX0ZGUEx3VzliQUl0LXR5QmIwbmlSbHZmZw?oc=5,1777359600,Pattern Drenching Is the Design Trend We're Seeing Everywhere—Here’s How to Get It Right - Real Simple,Pattern Drenching Is the Design Trend We're Seeing Everywhere—Here’s How to Get It Right - Real Simple,home decor trend
gnews,news.google.com,https://news.google.com/rss/articles/CBMif0FVX3lxTE9wSTY1UGgxMExBWGF6STN0SXNrTlpwQkZOUkF4U2Y1dmZ6N0kyaS1vdlBEY3FWOF9qTWRBTG03Rk5pX05sVE00bWsyTzZIRm8ydTFFX1ctcWRzZkljb3ctTjJaYlMzaTkxZXBPQTB6NExCWU1jTk82ZGNUdEhWOWc?oc=5,1779174000,Designers Are Ditching These 5 Furniture Trends in 2026 - Real Simple,Designers Are Ditching These 5 Furniture Trends in 2026 - Real Simple,home decor trend
gnews,news.google.com,https://news.google.com/rss/articles/CBMiYEFVX3lxTE5oVmlmM3RHMjg2SFRSSDFZVVQxaW8wT3YteWJoU3Bual80SHR4QUpQb29sMXZBWTh0SXZRVFEzbVNEejIyUzhsRnlvaC0xdTJpanFlQjVHZ0RKNXpFeC1PSA?oc=5,1778482800,Home Décor Trends 2026: How To Sell Trending Décor - Shopify,Home Décor Trends 2026: How To Sell Trending Décor - Shopify,home decor trend
gnews,news.google.com,https://news.google.com/rss/articles/CBMiiwFBVV95cUxPdWtXZWRhcGpVcGVJdUdPeHFWX0VfTWZDVjhiaGVxREIySmcwZ1Y0ZGdoM295OTR1X2l2a1Q2bVhDcXRLbnVkZUpTc04wYldVVEpYdTRwMWhhMy1ic0ZkcXQ0YnpUYXM5dU9iX1dtbkVMSGdEV0syNF9ualZBbFVzbGxycGtwMWpFUlZB?oc=5,1777964400,"Move Over, Minimalism—“Midmalism” Is the Feel-Good Decorating Trend Everyone’s Trying This Summer - Real Simple","Move Over, Minimalism—“Midmalism” Is the Feel-Good Decorating Trend Everyone’s Trying This Summer - Real Simple",home decor trend
gnews,news.google.com,https://news.google.com/rss/articles/CBMipgFBVV95cUxNVGo1MkRLSlYzQ19UQTBWV2hyQWdOVHRPaE1jZ3ZiamR6QTc2b1dNZ2d0Ujc5ejNhYzA1eDZ2Q2xTdjJ3MXhveGdlQ2RMU1FzV2ZsX2VhcjRnSnBlNjRQUU94WGROZ3pZTzlqWGpZWnpRemxocDZfX2pNdnMwdmtGNi1MSndjS3pRUjNWb2RMNVg4NmoyQng1STN4aU50ajVjanRNT1Nn?oc=5,1778742000,This Petite Chelsea Apartment Is Packed With Personality - ELLE Decor,This Petite Chelsea Apartment Is Packed With Personality - ELLE Decor,small apartment decor
gnews,news.google.com,https://news.google.com/rss/articles/CBMiuAFBVV95cUxOQTVaU05sZzI0bV9WdTZ3dklKdFo4eVI5UW5ETW15UmlKOWVJc3lVM05jYmZJRFpQRkZrTWRhb1RaelJYRGlmd2hxQ1czNmNWR1RTaGxfRklrUkhXaktISVQzeEFaNS1IbFBob25tYjF4aVYwUk5XbGJKRXpzeTI4eW1TQjhIcWVNeDAyOGExUGlFT2V0MWlkM2NvSHBRMnJ1dEtSUUdTRXJyNUw2UkJncXBDY0hHZlln?oc=5,1779346800,Open plan is not the answer: design professionals on the dos and don’ts of small space living - The Guardian,Open plan is not the answer: design professionals on the dos and don’ts of small space living - The Guardian,small apartment decor
gnews,news.google.com,https://news.google.com/rss/articles/CBMijgFBVV95cUxOMUh4T2dxcXRTMFdOMFZIOXhYQVRiZVFjckFSVHZSbjdOSDIyV2stS3dCSXpQV29JXy1sOVVVMGJXbWI2c0drOUx2RGZHSldmZGVkaGpxWjJEOHBCTFZqWnFLUXdMNVoyWmtSSUtuZFF1ZDhEWFZwV2NYMkxwd2sySmpLZXhPTVE2RzdJdk5R?oc=5,1779433200,"This Small-Space Trend Is Subtle, But It's Taking Over Apartments Right Now, Designers Say - The Spruce","This Small-Space Trend Is Subtle, But It's Taking Over Apartments Right Now, Designers Say - The Spruce",small apartment decor
gnews,news.google.com,https://news.google.com/rss/articles/CBMidkFVX3lxTE9BbDBqMTd0NkZKQlMta1BwNkxNX0VlZW1ob0hGNDRTZmdCLU9tS0FIUkFtdjJXdzNxWG1JdW5BOTFVWnd4dFMtS2c1dUtmYk8xbmx5eFZYM2VqNjNLOGxfSXNZMktKMEZEY1RKOUNxSGxCRklqakE?oc=5,1778828400,10 Tiny Balconies That Feel Supersized Thanks to Genius Decor Hacks - Apartment Therapy,10 Tiny Balconies That Feel Supersized Thanks to Genius Decor Hacks - Apartment Therapy,small apartment decor
gnews,news.google.com,https://news.google.com/rss/articles/CBMihAFBVV95cUxOeXFHNXEtR2xLejVzLTdNamJmdm9uRUdRdFFwc2hPcFdRVldRdWlBaE1LVmFzenJBTGRubDY5X250clpyN3NRbGoyWUUwRzN5YlduZjNGN2FVSjNrZG5DbW11cHAtYnlXLURpUkNLSEpaci1UZHBtR2hjX0ZJUGhVWTJTYlM?oc=5,1780603450,"7 Design Choices That Could Be Making Your Living Room Feel Cramped, According to Pros - The Spruce","7 Design Choices That Could Be Making Your Living Room Feel Cramped, According to Pros - The Spruce",small apartment decor
gnews,news.google.com,https://news.google.com/rss/articles/CBMic0FVX3lxTFB4U2dwU3pnclZPcUYzdHdqVFg4RGtCRUxsYVI1RnhtNHhad0ZHYUJicnBvRG0yNGZ2ejhTMkFhLWlDeTJ3R1JIZEdEamc1YS1LVUZkYnBmRTJ1SjRFLVRQazRSVmt4Z3JVMGFndlZvalY1ZFE?oc=5,1778310000,21 Small Living Rooms With TVs That Actually Look Good - The Spruce,21 Small Living Rooms With TVs That Actually Look Good - The Spruce,small apartment decor
youtube,,https://www.youtube.com/watch?v=pUU63-F3Y78,1781046484,The Best DIY Backyard Upgrade Everyone&#39;s Missing #construction... #Shorts #carlovers.1100,The Best DIY Backyard Upgrade Everyone's Missing #construction... The Best DIY Backyard Upgrade Everyone's Missing ...,interior design trends
youtube,,https://www.youtube.com/watch?v=9p667IzUuSc,1781045430,Cold Minimalism: Luxury Design Trends That Are Dying,"For years, luxury design was defined by sharp contrasts, clean lines, and highly minimalist interiors, but buyer preferences are ...",interior design trends
youtube,,https://www.youtube.com/watch?v=zN2ETd1y7aw,1781042433,Three Interior Design That Need to Die,There are a few home trends I think we can finally let go of. All gray everything. Signs labeling rooms we are actively standing in.,interior design trends
youtube,,https://www.youtube.com/watch?v=sRHMm_ly4H0,1781029475,2026 Interior Design Trends You Can&#39;t Ignore |  #cubixinteriors #interiordesign #shorts,"What will interior design look like in 2026? In this video, we explore the biggest design trends and styles that are set to dominate ...",interior design trends
youtube,,https://www.youtube.com/watch?v=Jv6eNbV3oTs,1781022627,"The Secret to a Richer, More Luxurious Home","Dark wood tones have a way of transforming a space instantly. Rich, dramatic, and timeless, deeper wood finishes bring a sense ...",interior design trends
youtube,,https://www.youtube.com/watch?v=TI6P0wulXU0,1781021886,Interior Freelancer 🔥👍🔥👍🔥#interior #interiordesign #viral #video #shorts #short #reels #youtube,"interior design,home decor,modern home design,interior trends 2025,luxury interiors,small space ideas,living room design ...",interior design trends
youtube,,https://www.youtube.com/watch?v=LBrIw-tpPDU,1781021580,ADMISSION OPEN | BSc FASHION DESIGN | BSC INTERIOR DESIGN | VID COLLEGE #fashiondesign #interior,Admission open! Explore Your Design Journey with VID College of Design Join us at VID College of Design and unlock your ...,interior design trends
youtube,,https://www.youtube.com/watch?v=gFhfz98iFXA,1781021482,Invisible Tv Stand 🔥😱🔥😱🔥#interior #interiordesign #viral #video #shorts #short #reels #youtube,"interior design,home decor,modern home design,interior trends 2025,luxury interiors,small space ideas,living room design ...",interior design trends
youtube,,https://www.youtube.com/watch?v=cAWOBNk4IiI,1781020012,Top Luxury Interior Design Trends for Small Homes 2026 | Elegant Space-Saving Decor Ideas,Welcome to Fresh Home Ideas! Discover the future of luxury living in compact spaces with the latest interior design trends ...,interior design trends
youtube,,https://www.youtube.com/watch?v=lfotM9SdMhY,1781017980,Color Trend Alert 2024: Discover the Hottest New Shade Taking Over! #ColorTrends #Design,"Get ready to see this color take the world by storm! This bold, vibrant shade is set to dominate fashion, interior design, and even ...",interior design trends
youtube,,https://www.youtube.com/watch?v=Zd3O1sr9TIk,1781017551,Luxury Wardrobe Interior Design | Space Saving Ideas #Shorts,"Welcome to HouzzMood – your ultimate destination for Home Decor, Interior Design, Modern Architecture, Luxury Living, and ...",interior design trends
youtube,,https://www.youtube.com/watch?v=lTtngTvTtg8,1781015869,Viral Cactus Stairs 😍 | Amazing Home Design Ideas 2026#shorts,Viral Cactus Stairs Design 2026! Aaj ke is video mein dekhiye ek unique aur trending home decor idea – Cactus Stairs Design ...,interior design trends
youtube,,https://www.youtube.com/watch?v=OgdLEZEr24U,1781013912,Top 150+ Ceiling Design Trends 2025 | Living Room &amp; Bedroom with Fan Ideas,Upgrade your home interiors with the **Top 150+ Modern False Ceiling Bedroom Design Ideas 2025 | Living Room & Bedroom ...,interior design trends
youtube,,https://www.youtube.com/watch?v=ITZDX0MuBfM,1781013868,Transform Your Home: Top 5 Must-Try Interior Design Trends #HomeDécor #InteriorDesign,"Of course! Please provide the social media post you'd like to have rewritten, and I'll create a YouTube-optimized version for you, ...",interior design trends
youtube,,https://www.youtube.com/watch?v=mgeE_KnPXFo,1781013605,10 Home Ideas That Will Change Everything: 2026 Design Trends Overview,Looking for renovation inspiration or looking to transform your home? This video features a large compilation of the best design ...,interior design trends
youtube,,https://www.youtube.com/watch?v=AcNFzxfR3-Q,1781013616,Beautiful Vintage Crochet Decor Trends Taking Over Homes in 2026,"Are you tired of cold, sterile minimalism? Welcome back to the channel, design family! In today's video, we are diving deep into the ...",interior design trends
youtube,,https://www.youtube.com/watch?v=muhnGheMdPk,1781013139,LED panel PVC wall panel bedroom design #pvc #trending #shorts #interiordesign,LED panel PVC wall panel bedroom design #pvc #trending #shorts #interiordesign Give your bedroom a luxurious makeover with ...,interior design trends
youtube,,https://www.youtube.com/watch?v=XEelUqGK-To,1781011822,Staircase Trends 2026: Renovate in Style #texture #interiordesign #stairs,"If you're renovating your stairs in 2026, this is for you! ✨ From classic wooden spirals with checkered runners to modern marble ...",interior design trends
youtube,,https://www.youtube.com/watch?v=e0v_X03pVjU,1781011820,A Home That Feels Right ✨ #HomeSweetHome #interiordesign  #luxuryliving,"Because no matter where life takes you, nothing feels quite like coming back home. A place of comfort, warmth, and the people ...",interior design trends
youtube,,https://www.youtube.com/watch?v=jpQCHAfoR54,1781008225,grenight কিচেন silap ফিটিং #new #home #ytshorts #wall #construction #interiordesign #homedecor,grenight কিচেন silap ফিটিং #new #home #ytshorts #wall #construction #interiordesign #homedecor kitchen sink fitting ...,interior design trends
youtube,,https://www.youtube.com/watch?v=3QMY3u4kMsw,1781006409,One Interior Design Trend That Should Stay in 2016 😬,"Not every design trend deserves a comeback. One style that was everywhere in 2016 still feels dated in 2026, and interior ...",interior design trends
youtube,,https://www.youtube.com/watch?v=uHQOawLWrkw,1781001852,Luxury Living Room Makeover &amp; Wall Panel Design#shortsfeed #explore #viral #ytshorts,"Take a tour of this beautifully designed modern home featuring elegant wall paneling, premium finishes, stylish ceiling details, and ...",interior design trends
youtube,,https://www.youtube.com/watch?v=qdkaeCfSZ60,1781001895,2024 Interior Design Trends: Window Treatments &amp; Colour Inspiration,Elevate your space with custom window coverings that reflect your unique personal style. ✨ #ronaldsblinds.,interior design trends
youtube,,https://www.youtube.com/watch?v=Jz6h4az2baY,1781001026,Luxury Wallpaper Ideas for Wall Moulding ✨ | Modern Interior Design #Shorts,"Transform your walls with stunning wallpaper and moulding combinations! ✨ Discover elegant wall panel designs, luxury ...",interior design trends
youtube,,https://www.youtube.com/watch?v=dHK3wyecO44,1781001004,Island kitchen design #kitchen #interiordesign #interior #design,Island kitchen design #kitchen #interiordesign #interior #design Transform your home with these stunning Island Kitchen Design ...,interior design trends
youtube,,https://www.youtube.com/watch?v=DKePHKYuCeg,1781056453,Furniture polish design ideas #woodworking #homedecor #interiordesign #viral #youtube,,home decor ideas
youtube,,https://www.youtube.com/watch?v=EVILMcgh-RY,1781055461,Decoration 1/Home decor/idea&#39;s/Creative home design#creative #ideas,,home decor ideas
youtube,,https://www.youtube.com/watch?v=2Rekb2G_Yrc,1781055323,#arkandahouse #homedecorideas #dapurminimalis #panciantilengket #youtubeshorts #shortvideo,,home decor ideas
youtube,,https://www.youtube.com/watch?v=W9Qsk9GvH8g,1781049607,Living room decor idea #homedecor #glamdecor #interiordesign #aestheticroomdecor #decor #home,,home decor ideas
youtube,,https://www.youtube.com/watch?v=2clVFyQMxbw,1781046641,#home #girlroom #girl #girls #baby #babyroom#roomreveal #potterybarn #homedecor  #homedecorideas,,home decor ideas
youtube,,https://www.youtube.com/watch?v=VAq-n9fIseo,1781043360,LIMPIEZA EN SEGUNDOS #ideas #limpieza #hogar #home #homedecor #shorts #inspiration #trucosdelimpieza,,home decor ideas
youtube,,https://www.youtube.com/watch?v=BjzxCv-YdJQ,1781033662,#blogger #happy4thofjuly #homedecor #youtubeshorts #hobbylobby #diyhomedecor #homedecorideas,,home decor ideas
youtube,,https://www.youtube.com/watch?v=BY3gLiq3r4g,1781032892,#blogger #happy4thofjuly #hobbylobby #diyhomedecor #shortvideo #homedecorideas #shaping,,home decor ideas
youtube,,https://www.youtube.com/watch?v=gEqRRy8MyLA,1781029141,Smart Home Decor Ideas for Small Spaces 🤎🏡#HomeDecoration#HomeDecorIdeas#SimpleHome#CozyHome,,home decor ideas
youtube,,https://www.youtube.com/watch?v=w9bE0r-xSxk,1781023544,Tiny Room Makeover That Looks Absolutely Stunning 😍🏡 #HomeDecor #DecorIdeas #InteriorDesign #shorts,Tiny Room Makeover That Looks Absolutely Stunning #HomeDecor #DecorIdeas #HomeInspo #InteriorDesign #shorts.,home decor ideas
youtube,,https://www.youtube.com/watch?v=0RTsCXBGB30,1781022617,The design my landlord never expected 😳#AmeliaInteriors #interiordesign #homedecor.,My landlord said NO... so I asked AI The result completely transformed the space. What started as an ordinary room became ...,home decor ideas
youtube,,https://www.youtube.com/watch?v=Sj--p9zKTMs,1781021450,Revolutionary DIY Home Decor Ideas for 2023,Description: Discover the latest and greatest DIY home decor ideas that are taking the internet by storm in 2023!,home decor ideas
youtube,,https://www.youtube.com/watch?v=xRp79OSzdak,1781020203,Amazing Smart Home Gadgets &amp; Luxury Interior Decor Ideas 2026 | VivixTV#shortvideo,"Welcome to VivixTV! ​In this video, we bring you the ultimate collection of modern home decor ideas, luxury aesthetic living room ...",home decor ideas
youtube,,https://www.youtube.com/watch?v=1UVpn7OROZg,1781018234,DIY Giant Wall Fan🪭 | Budget Room Decor Idea ✨,diy #diycrafts #walldecor #homedecor #youtubeshorts #viralshorts.,home decor ideas
youtube,,https://www.youtube.com/watch?v=H6oZm36yWnQ,1781017206,Blue Living Room Decor Ideas 2026 | How To Style The Perfect Blue Living Room Like A Designer,Blue Living Room Decor Ideas 2026 | How To Style The Perfect Blue Living Room Like A Designer Looking for beautiful blue ...,home decor ideas
youtube,,https://www.youtube.com/watch?v=2UdwapQ7j2U,1781015405,Budget Modular Kitchen for 2BHK Flat 🏡 | Interior Design Ideas #Shorts,Most Affordable Modular Kitchen Design for a 2BHK Flat! Looking for a modern modular kitchen that fits your budget? Check out ...,home decor ideas
youtube,,https://www.youtube.com/watch?v=tt0Yg5OtvQs,1781014942,DIY Wall Hanging Using Ear Buds | Easy Wall Decor Idea at Home | TP Vista,Made this beautiful wall hanging using ear buds — completely zero cost and so easy to make! ✨ A perfect room decor idea ...,home decor ideas
youtube,,https://www.youtube.com/watch?v=zjDO7Lt6aU4,1781013455,💖 Affordable Home Decor Shopping For Meesho | #HomeDecor #HomeDecorIdeas #MeeshoFinds,Affordable Home Decor Shopping For Meesho | #HomeDecor #HomeDecorIdeas #MeeshoFinds #ytshorts #youtubeshorts ...,home decor ideas
youtube,,https://www.youtube.com/watch?v=WoqajrjlTY0,1781013416,Home decor Diy #cardboard diy#beautiful and easy decoration ideas from waste material #craft,Home decor Diy #cardboard diy#beautiful and easy decoration ideas from waste material #craft cardboard craft home decor ...,home decor ideas
youtube,,https://www.youtube.com/watch?v=FQ69QGy3Org,1781013091,When decor meets nature and light ✨🌿 #homedecor #flowers #decorideas #homeinspiration #vase #garden,,home decor ideas
youtube,,https://www.youtube.com/watch?v=MKN8jOlnvSw,1781012687,mast flower pot home decor idea shorts ytshorts #viral  video 🥰🥰👍,,home decor ideas
youtube,,https://www.youtube.com/watch?v=lqmtJkLjrKM,1781012346,Handmade Crochet Flowers 🌸 | Aesthetic Home Decor Idea,"Handmade with love! I created these beautiful crochet daisy flowers using yarn. They make a perfect gift, room decor, ...",home decor ideas
youtube,,https://www.youtube.com/watch?v=rANHo5oCb1M,1781011817,DIY Colorful Wall Hanging Craft | Easy Handmade Home Decor Idea ✨ #WallHangingCraft #DIYCraft,CraftIdeas #DIYHomeDecor #WallDecor #HandmadeCraft #CreativeCraft #ArtAndCraft #EasyCraft #RoomDecor #CraftLovers ...,home decor ideas
youtube,,https://www.youtube.com/watch?v=CQVAmndMUe8,1781011872,DIY Photo Holder ❤️ Easy Home Decor Idea | Handmade Craft #shorts,Transform your favorite memories into beautiful home decor with this easy DIY Photo Holder! ❤️ A simple handmade craft idea ...,home decor ideas
