source,query,url,created_utc,title,text
youtube,interior design trends,https://www.youtube.com/watch?v=LwTDfzIXE-g,1772614826,욕실 인테리어? 이렇게만 해보세요!! #욕실인테리어,2026년 뜨는 욕실 인테리어 트렌드! 영상에서 확인해주세요:) 인테리어상담 :: forms.gle/y2ViubMQUq9iQcbT8 인스타그램 ...
youtube,interior design trends,https://www.youtube.com/watch?v=jPDkdT14zjI,1772610602,2026 Luxury Interior Design Trends You Need to See ✨,"2026 Luxury Interior Design Trends are all about deep wood finishes, matte black accents, and warm ambient lighting. This year's ..."
youtube,interior design trends,https://www.youtube.com/watch?v=GfTf0rB8YVI,1772604013,Luxury Crystal Epoxy Floor Living Room | Stunning Modern Interior Design 2026 ✨ #shorts #asmr #viral,"Welcome to the ultimate Crystal Vibe Room Transformation ✨ In this video, we showcase a stunning luxury living room featuring a ..."
youtube,interior design trends,https://www.youtube.com/watch?v=y5vJPd_ji2M,1772603409,Latest Lamp Design Trends 2026 | Stylish &amp; Elegant Lighting ideas,Brighten up your interiors with the latest lamp design trends 2026 showcasing stylish and elegant lighting ideas for modern homes ...
youtube,interior design trends,https://www.youtube.com/watch?v=W7O9zcEtMpI,1772600226,stone floor luxury room #shortvideo,stone floor luxury room #shortvideo #StoneFloor #LuxuryRoom #InteriorDesign #HomeDecor #LuxuryLiving #FlooringIdeas ...
youtube,interior design trends,https://www.youtube.com/watch?v=mQg7FRnqn8s,1772598680,Most Viral Pinterest-Inspired Tile Designs for 2026! 🏠✨ | Tilesmart Vijayawada,"In this video, we explore the latest collection at Tilesmart Vijayawada, where we've decoded international Pinterest trends for the ..."
youtube,interior design trends,https://www.youtube.com/watch?v=WPqxgSbsMag,1772597173,AI Renovation Magic 😱 Before &amp; After Shock!#shorts #aitransformation #airenovation,AI Renovation Magic Before & After Shock!#shorts #aitransformation #airenovation Welcome to Renovixs ✨ Yahan aap ...
youtube,interior design trends,https://www.youtube.com/watch?v=kV8RbOm5yMY,1772586050,Part-1 💯Customer Review  @sakthipvcinteriors2256  #trending #viral #upvcmodularkitchen #tvunit,"Thanks for watching. If you like this video please ☞ ""SUBSCRIBE"" - ""LIKE"" - ""SHARE"" -""COMMENT"" ..."
youtube,interior design trends,https://www.youtube.com/watch?v=JgcPVqKyigY,1772584200,Outdated Home Decor Trends - Stop Doing These,FREE Modern Paint Palette: https://allisajacobs.kit.com/685fc48731 1:1 DESIGN CALLS: design consult: ...
youtube,interior design trends,https://www.youtube.com/watch?v=_EsP9Kcn_dI,1772580600,Luxury modern modular kitchen😍#shorts #viralshorts #interiordesign #modularkitchen #kitchen #youtube,Luxury modern modular kitchen  #shorts #viralshorts #interiordesign #modularkitchen #kitchen #youtube Kitchen design ideas ...
youtube,interior design trends,https://www.youtube.com/watch?v=ZyPFw_v-zFI,1772571063,Recron sofa #furniture #sofa #interiordesign #fyp,Recron sofa #furniture #sofa #interiordesign #fyp [choice furniture & cushion] | ALL types of furniture and cushion| • Premium ...
youtube,interior design trends,https://www.youtube.com/watch?v=q-XkjeYr49k,1772569815,Top Modern Home Design Trends You’ll Love in 2026🏘🏡🏰#bestdesign #living #livingroom #homedecor #home,"Looking for modern home design ideas? ✨ In this video, I'm sharing a beautifully designed home featuring elegant interiors, ..."
youtube,interior design trends,https://www.youtube.com/watch?v=_VLuFMXVNWk,1772559126,#trendyoutube  Wardrobe Interior Designs 2026 | Double Door Bedroom Wardrobe Ideas #shotrs,Trendy Wardrobe Interior Designs 2026 | Double Door Bedroom Wardrobe Ideas Your Queries :- trendy wardrobe interior ...
youtube,interior design trends,https://www.youtube.com/watch?v=0ca56oZ-ekc,1772557520,Why Some Interior Design Trends Never Go Out of Style #shorts,Aspiring Interior Designer Blueprint: Link in Bio Full video on YouTube: @For_The_Designers Not all interior design trends are ...
youtube,interior design trends,https://www.youtube.com/watch?v=vkALwoRRDlE,1772557289,100+ Covered Patio Ideas 2026 | Best Roof Designs and Shade Solutions for Your Backyard Patio,"Covered patio ideas, patio cover ideas, patio roof designs, backyard patio ideas, outdoor shade solutions, pergola ideas, covered ..."
youtube,interior design trends,https://www.youtube.com/watch?v=PaZ0XAeeNZ0,1772556185,100+ Modern Bathroom  Interior Design Ideas | What Kind of Bathroom Make Your Day,"Welcome to Blockchain Interior Studio – Your Ultimate Destination for Interior Design, Home Decor, and Styling Inspiration!"
youtube,interior design trends,https://www.youtube.com/watch?v=F-qgafEX2yc,1772555144,Coffee Table🔥😱🔥😱🔥#interior #interiordesign #viral #video #shorts #short #viralvideo #reels #yt,"interior design,home decor,modern home design,interior trends 2025,luxury interiors,small space ideas,living room design ..."
youtube,interior design trends,https://www.youtube.com/watch?v=_onhxKTb8j0,1772555055,Luxury Chair 🔥🤩🔥🤩🔥#interior #interiordesign #viral #video #shorts #short #reels #youtube #feed,"interior design,home decor,modern home design,interior trends 2025,luxury interiors,small space ideas,living room design ..."
youtube,interior design trends,https://www.youtube.com/watch?v=8dUw8M_WZXU,1772554567,"2026 Luxury Interior Design Trends: Deep Wood Finishes, Matte Black Details &amp; Cozy Ambient Glow","Step inside the world of 2026 luxury interior design trends where deep wood finishes, matte black details, and cozy ambient glow ..."
youtube,interior design trends,https://www.youtube.com/watch?v=R0ELMfy3ryk,1772554140,The Future of Living Room Design? 🌿✨ #InteriorDesign,Transform your space with this stunning organic moss-inspired rug and modular sofa setup. This isn't just a living room; it's a ...
youtube,interior design trends,https://www.youtube.com/watch?v=Y9o5rR8bbnI,1772553643,Luxurious Chinoiserie Entryway Styling 2026 | Martha Stewart Inspired Black &amp; Cherry Blossom Decor,"Luxurious Chinoiserie Entryway Styling 2026 blends timeless elegance with modern sophistication, inspired by Martha Stewart's ..."
youtube,interior design trends,https://www.youtube.com/watch?v=q3d9KPKXq20,1772552899,"Glam Spring 2026 Home Makeover | Luxe Decor Ideas for Entryways, Living Rooms &amp; More","Glam Spring 2026 Home Makeover is your ultimate guide to transforming your space with luxe decor ideas for entryways, living ..."
youtube,interior design trends,https://www.youtube.com/watch?v=1UQBnjDFsr8,1772552554,Quiet Luxury Trends for 2026 Minimalist Small Luxury Homes Interior Inspiration,"Discover the beauty of quiet luxury trends for 2026, where minimalist design meets refined sophistication in small luxury homes."
youtube,interior design trends,https://www.youtube.com/watch?v=qSTA4_jigas,1772550960,Luxury Modular Kitchen#shorts #interiordesign #modularkitchen #homedecor #home #youtubeshorts #viral,Luxury Modular Kitchen#shorts #interiordesign #modularkitchen #homedecor #home #youtubeshorts #viral Latest kitchen design ...
youtube,interior design trends,https://www.youtube.com/watch?v=45HVN0I_S2c,1772550697,Spring 2026 Entryway Decor Ideas | Top Modern and Elegant Design Trends,Refresh your home with the hottest Spring 2026 entryway decor ideas that blend modern elegance with effortless functionality.
youtube,home decor ideas,https://www.youtube.com/watch?v=1CgY3J0eebs,1772613089,DIY Broken Cup Reuse Ideas 💡। Home Decor Idea #homedecor #holi #holicraft #shorts #shortvideo #rekha,
youtube,home decor ideas,https://www.youtube.com/watch?v=S_T_Z1Hjc4U,1772613120,Easy Home Decor Craft with Ice Cream stick #shortsfeed #trendingshorts #viral #painting,Easy Home Decor Craft with Ice Cream Sticks #StressFreeZone #DIYWallHanging #PopsicleStickCraft #EasyDIY ...
youtube,home decor ideas,https://www.youtube.com/watch?v=0Pd_jdYkIPo,1772599501,Cute Room Decor Ideas | Cozy Aesthetic Home Upgrades #Shorts,roomtransformation #tinyapartment #homedecorideas #cozyaesthetic #interiorstyling #Japanesedecor #calmingspace ...
youtube,home decor ideas,https://www.youtube.com/watch?v=Q90W8CCdLqs,1772593253,Birthday decoration ideas at home | balloon decoration ideas #balloon #decor #homedecor #feed #love,
youtube,home decor ideas,https://www.youtube.com/watch?v=jSQmEQYoEj4,1772591622,#arkandahouse #dapurminimalis #ricebox #momlife #homedecorideas,
youtube,home decor ideas,https://www.youtube.com/watch?v=XLKt-pAmv8M,1772591498,Holi table set up decor ideas with nestasia. #holispecial  #holi #homedecor #festival #festiveseason,
youtube,home decor ideas,https://www.youtube.com/watch?v=ntFpQ_vQlsQ,1772589461,Diy Home Decor Idea 🩷🌷 ll ... #diy #homedecor #craft #shorts #diycraft,Diy Home Decor Idea ll ... #diy #homedecor #craft #shorts #diycraft.
youtube,home decor ideas,https://www.youtube.com/watch?v=7p-IL21lvZA,1772588787,Revolutionary DIY Home Decor Ideas,Description: Discover incredible DIY home decor ideas that will transform your space! From budget-friendly hacks to stunning craft ...
youtube,home decor ideas,https://www.youtube.com/watch?v=4fCUKnTdRdo,1772584145,Stunning Home Decoration Ideas | New House Renovation &amp; Modern Minimalist Makeover #Shorts,
youtube,home decor ideas,https://www.youtube.com/watch?v=kFjNi5spRfg,1772584008,"HomeGoods NEW FINDS 🌸 Cute Spring Glassware, Home Decor &amp; Home Refresh Ideas! ✨","Come shop with me at HomeGoods as we browse cute glassware, dinnerware ideas, spring home decor, garden decor, planters, ..."
youtube,home decor ideas,https://www.youtube.com/watch?v=8Tc2QT5miUM,1772583201,Thrift JACKPOT 🤩🛒💨 #thrifting #decor #homedecor #collectibles #vintage #decorideas #thriftshopping,My name is Art I'm a professional shopper and decorator looking for deals of the thrift store! Make sure to check out my full length ...
youtube,home decor ideas,https://www.youtube.com/watch?v=AIYUHccrLT8,1772582565,Flower Vase | Easy &amp; Beautiful Home Decor Ideas #asthetic room decor for American teenager #genz,"Learn how to make this beautiful DIY flower vase at home Easy, budget-friendly and perfect for room decor! Don't forget to like, ..."
youtube,home decor ideas,https://www.youtube.com/watch?v=GEas6Zi3JgU,1772577402,Spring Home Decor Refresh + Pop Shelf Haul • Front Porch Decorating Ideas • Spring Porch Decorating,springdecoratewithme #frontporchdecor #homerefresh Come decorate with me as I finally take down Christmas and refresh my ...
youtube,home decor ideas,https://www.youtube.com/watch?v=8LfNrQACAIw,1772577004,Spring Cottage Refresh 2026 🌷 Thrifted Spring Decor Haul &amp; Decorating Ideas |  Goodwill Thrifting,"Spring Cottage Refresh 2026 Affordable Spring Decor Haul & Decorating Ideas | Thrifting, Home Decor Join me today as I get ..."
youtube,home decor ideas,https://www.youtube.com/watch?v=atucfHbiwc0,1772571604,Home Decorating Ideas|Decorate with Me|Home Reset,DREAME Aero Pro Wet Dry Vacuum Cleaner Buy on Amazon: https://dreame.shopping/3ZRiGq8 EXclusive ...
youtube,home decor ideas,https://www.youtube.com/watch?v=x9E2AXDBIAw,1772569088,Para la entrada de tu casa - Recibidor que NO ocupa espacio #minimalhome #homeideas #homedecor,"Minimalismo, ideas de decoración, DIY, estilo rústico. Instagram: practicamente_bren."
youtube,home decor ideas,https://www.youtube.com/watch?v=DXiF3NXJsjo,1772568421,HOMEGOODS SHOP WITH ME | HomeGoods SPRING 2026 | HOME DECOR IDEAS |,What's new at HomeGoods Spring 2026! Tapestry Pillow: https://rstyle.me/+PJpYNwOxIelgdZRxKl5g1w Tapestry Pillow Insert: ...
youtube,home decor ideas,https://www.youtube.com/watch?v=xNUa-3TtPhI,1772564872,Revolutionary DIY Home Decor Ideas - Transform Your Space,Description Discover stunning DIY home decor ideas that will transform your space! From budget-friendly hacks to creative project ...
youtube,home decor ideas,https://www.youtube.com/watch?v=qFe6sx0hI0U,1772563008,DECORACIÓN MODERNA 2026: Ideas Modernas y ELEGANTES para Decorar con Dorado / Ideas de Decoración ✨️,DECORACIÓN MODERNA 2026: Ideas Modernas y Elegantes para Decorar con Dorado | Ideas de Decoración ✨️ ¿Quieres ...
youtube,home decor ideas,https://www.youtube.com/watch?v=78eNmsgbpMU,1772559536,🏡 Minimalist TV Unit Design Ideas for Living Room ✨ #shorts #shortsfeed #home #interiordesign,Minimalist TV Unit Design Ideas for Living Room ✨ #shorts #shortsfeed #home #interiordesign Upgrade your living room with this ...
youtube,home decor ideas,https://www.youtube.com/watch?v=7ZxflyVeaUQ,1772557835,Easter decor idea #glamdecor #interiordesign #easterdecor #easter2026 #homedecor #home #decor,
youtube,home decor ideas,https://www.youtube.com/watch?v=-tlVt7_HuYU,1772557203,Vintage inspired Interior decoration ideas. Vintage style Cottage Home Decor#vintagestyle #homedecor,"In this video............... Welcome to your dream escape! In this enchanting video, we unveil exquisite vintage-inspired cottage home ..."
youtube,home decor ideas,https://www.youtube.com/watch?v=6uALWOv_Vas,1772553095,"Thrift smarter, not harder! #thrifthome #budgethomedecorhacks #homedecorideas",
youtube,home decor ideas,https://www.youtube.com/watch?v=_eT51g21TGE,1772548200,Country Cottage inspired Home Decoration Ideas. Cozy Cottage Style Makeover Ideas on a Budget.#decor,Country Cottage inspired Home Decoration Ideas. Cozy Cottage Style Makeover Ideas on a Budget. ✨ Transform your living ...
youtube,home decor ideas,https://www.youtube.com/watch?v=TQ-CMOHsIpg,1772547709,#woodworking #wood #home #carpentry #interiordesign #woodenalmari #homedecor #construction #interior,woodworking #wood #home #carpentry #interiordesign #woodenalmari #homedecor #construction #interior444. . window design ...
youtube,small apartment decor,https://www.youtube.com/watch?v=PYToNt8zXhY,1772614825,Small Apartment Plant Decor Ideas | Cozy &amp; Modern Styling,Attiaplantsandbirdsinfo.
youtube,small apartment decor,https://www.youtube.com/watch?v=qc0zeL4DfJw,1772597459,"Multifunctional tatami bed, smart furniture bed #tatami #double bed #furniture #bedroom","Welcome to Sofa! Discover the world of comfortable, stylish, and versatile sofas that bring any space to life. At Sofa, we're ..."
youtube,small apartment decor,https://www.youtube.com/watch?v=GD2uAZayrL4,1772593290,USA’s #1 Tiny Home Builer,
youtube,small apartment decor,https://www.youtube.com/watch?v=Fwa-5lRF0Sk,1772590140,Tiny Yard Homes 635 Sq Ft Home Tour,
youtube,small apartment decor,https://www.youtube.com/watch?v=FY-i0lB-oJM,1772587813,This Genius Balcony Table Hooks Onto Any Railing! 🪵,Transform your balcony into a cosy outdoor nook — no floor space needed! This railing-mounted balcony stand is one of the ...
youtube,small apartment decor,https://www.youtube.com/watch?v=HaEKXbe6PuQ,1772581224,This Is a Girl’s Apartment | Cozy &amp; Realistic Home #apartmenttour #apartmentdecor #smallapartment,"Step inside my cozy apartment, soft lighting, clean counters, and little details that make it feel like home. Sharing simple apartment ..."
youtube,small apartment decor,https://www.youtube.com/watch?v=13_XIifL3Ms,1772578868,Creamy Style multifunctional Foldable Bean Bag Sofabed – Cozy small apartment &quot; #shortsfeed,"Upgrade your living space with the ultimate multifunctional sofa bed! In this video, we explore sofas, convertible sofa, sofa beds, ..."
youtube,small apartment decor,https://www.youtube.com/watch?v=8BT_t_broFI,1772577003,Tiny Apartment? This Wall Garden Is a Game Changer! 🏡,Living in a rental and short on space? This no-floor-space wall planter is the renter-friendly home décor hack everyone is ...
youtube,small apartment decor,https://www.youtube.com/watch?v=hyeejsCiQcA,1772575249,2026 Apartment Trends That Make Small Spaces Look Shockingly Grand,2026 apartment trends are redefining compact living—and these ideas make small spaces look shockingly grand.
youtube,small apartment decor,https://www.youtube.com/watch?v=NTTw3tQtTnA,1772573409,Small Living Room Glow-Up with ONE Wall Planter! 🌱✨,Living in a small apartment but love plants? Stop filling your floor with bulky plant stands and go vertical instead! This 47” ...
youtube,small apartment decor,https://www.youtube.com/watch?v=_6fY3P51BXE,1772569813,This 2-Pack Wall Planter Made My Living Room Look EXPENSIVE 😍,I had a boring blank wall… so I turned it into a luxury vertical garden This 2-pack wooden wall planter instantly upgraded my ...
youtube,small apartment decor,https://www.youtube.com/watch?v=lI0sC8RW-9Q,1772568038,Small Room Turned Into Genius Bunk Bed Setup! 🛏️✨,Watch a simple empty bedroom transform into a modern built-in bunk bed setup in just 60 seconds. This smart space-saving ...
youtube,small apartment decor,https://www.youtube.com/watch?v=AjjMes5a5MI,1772565706,This is the optimal solution for small bedroom design. #SmallBedroomDesign #InteriorDesign,
youtube,small apartment decor,https://www.youtube.com/watch?v=R9yIOR-Ism0,1772564422,Luxury Secrets for a Parisian Style Small Apartment | How to Make a Tiny Apartment Look Expensive,"This video explores the sophisticated world of ""Quiet Luxury"" specifically tailored for small-space living in 2026. Moving away from ..."
youtube,small apartment decor,https://www.youtube.com/watch?v=e3Ch3Tqx344,1772562662,Small Room? This Vertical Plant Wall Hack Changes EVERYTHING 🌱✨,Tired of bulky plant stands taking up your floor space? This vertical wall planter hack transforms any blank wall into a stunning ...
youtube,small apartment decor,https://www.youtube.com/watch?v=gR7B_Ew9ms0,1772560844,Prieto Móveis - O Segredo da Cozinha: Onde Guardar Sua AirFryer!,Está pensando em transformar seu lar com móveis que duram e encantam? Você sabia que a maioria das empresas de MÓVEIS ...
youtube,small apartment decor,https://www.youtube.com/watch?v=VDq2PWrJp8M,1772558418,Smart Kitchen Design 2026 😍 | Modern Modular Kitchen Ideas 🔥 | Small Space Smart Setup ✨,"Aaj dekhiye latest Smart Kitchen Design jo banaye aapki kitchen ko modern aur stylish Modular cabinets, smart storage, LED ..."
youtube,small apartment decor,https://www.youtube.com/watch?v=UitWrv5v5zc,1772557243,Prieto Móveis - Dicas da Pri Prieto,Está pensando em transformar seu lar com móveis que duram e encantam? Você sabia que a maioria das empresas de MÓVEIS ...
youtube,small apartment decor,https://www.youtube.com/watch?v=r8iWIzAB9iA,1772556044,You Won’t Believe This Tiny Loft Layout 😍 Smart Small Apartment Design,"Step inside this beautifully designed cozy loft apartment featuring warm wood tones, soft neutral textures, and smart space-saving ..."
youtube,small apartment decor,https://www.youtube.com/watch?v=KzzHYXiTUew,1772553634,Dream Small Parisian Apartment Decor  How to Decorate an Elegant Parisian Small Space with Big Perso,Creating a dreamy small Parisian apartment begins with understanding the essence of Parisian style—classic architectural ...
youtube,small apartment decor,https://www.youtube.com/watch?v=sEVPlLCDa3o,1772551620,Hidden Expandable Desk Cabinet – Smart Space Saving Furniture,Title: Hidden Expandable Desk Cabinet – Smart Space Saving Furniture Full Description: Upgrade your home with this innovative ...
youtube,small apartment decor,https://www.youtube.com/watch?v=k0m4Ub7slMQ,1772550038,"Small Space Luxury Interiors 2026 Using Modern Trends, Timeless Materials, and Elegant Layouts","Discover how to transform compact living into pure sophistication in Small Space Luxury Interiors 2026 Using Modern Trends, ..."
youtube,small apartment decor,https://www.youtube.com/watch?v=j-ndLojkD_w,1772550075,Elegant Small Apartment Styling | Parisian Inspired Home Ideas,"Transforming a small apartment into a timeless, elegant home is absolutely possible with the right design approach. In this video ..."
youtube,small apartment decor,https://www.youtube.com/watch?v=JL-uea5YWBg,1772549837,Small Home Styling Parisian Decor For Cozy Spaces,Small Home Styling Parisian Decor For Cozy Spaces Discover how Light-Filled Rooms Parisian Elegance Creates Pure Harmony ...
youtube,small apartment decor,https://www.youtube.com/watch?v=G2WfJMtqXUw,1772549363,Small Apartment Living in 2026 Is Getting a Major Luxury Upgrade,Small apartment living in 2026 is getting a major luxury upgrade—and this transformation proves it. Discover how compact urban ...
