source,domain,url,created_utc,title,text,query
rss,www.yankodesign.com,https://www.yankodesign.com/2026/05/28/la-la-lands-iconic-poster-gets-its-own-lego-recreation-with-minifigure-ryan-gosling-and-emma-stone/?utm_source=rss&utm_medium=rss&utm_campaign=la-la-lands-iconic-poster-gets-its-own-lego-recreation-with-minifigure-ryan-gosling-and-emma-stone,1780003846,La La Land’s Iconic Poster Gets Its Own LEGO Recreation With Minifigure Ryan Gosling and Emma Stone,"La La Land’s Iconic Poster Gets Its Own LEGO Recreation With Minifigure Ryan Gosling and Emma Stone

<p class=""rws-nl-img""><a href=""https://www.yankodesign.com/2026/05/28/la-la-lands-iconic-poster-gets-its-own-lego-recreation-with-minifigure-ryan-gosling-and-emma-stone/""><img alt=""LEGO scene of a man in a white shirt and tie dancing with a woman in a yellow dress on a brick platform beside a tall street lamp, against a purple circular backdrop."" class=""attachment-post-thumbnail size-post-thumbnail wp-post-image"" height=""960"" src=""https://www.yankodesign.com/images/design_news/2026/05/auto-draft/lego_lala_land_poster_1.jpeg"" width=""1280"" /></a></p><h2 class=""rws-nl-title"" style=""text-align: center;"">La La Land&#8217;s Iconic Poster Gets Its Own LEGO Recreation With Minifigure Ryan Gosling and Emma Stone</h2><div class=""rws-nl-excerpt"">Damien Chazelle made La La Land as a love letter to a Los Angeles that barely exists anymore, and to a style of filmmaking that...</div>",
rss,www.yankodesign.com,https://www.yankodesign.com/2026/05/28/love-hulten-built-a-pink-floyd-prism-guitar-you-can-actually-play/?utm_source=rss&utm_medium=rss&utm_campaign=love-hulten-built-a-pink-floyd-prism-guitar-you-can-actually-play,1780000221,Love Hultén Built a Pink Floyd Prism Guitar You Can Actually Play,"Love Hultén Built a Pink Floyd Prism Guitar You Can Actually Play

<p class=""rws-nl-img""><a href=""https://www.yankodesign.com/2026/05/28/love-hulten-built-a-pink-floyd-prism-guitar-you-can-actually-play/""><img alt=""Scientist in a lab coat holds a white triangular electronic instrument with two long grid-like necks and a row of orange buttons, in a studio setting."" class=""attachment-post-thumbnail size-post-thumbnail wp-post-image"" height=""959"" src=""https://www.yankodesign.com/images/design_news/2026/05/627868/magicos-2_1.jpg"" width=""1280"" /></a></p><h2 class=""rws-nl-title"" style=""text-align: center;"">Love Hultén Built a Pink Floyd Prism Guitar You Can Actually Play</h2><div class=""rws-nl-excerpt"">The equilateral triangle is one of the most psychologically loaded forms in Western visual culture. It appears on currency, on occult diagrams, on the cover...</div>",
rss,www.yankodesign.com,https://www.yankodesign.com/2026/05/28/37-inch-tires-body-on-frame-no-touchscreen-hyundais-boulder-concept-should-make-jeep-nervous/?utm_source=rss&utm_medium=rss&utm_campaign=37-inch-tires-body-on-frame-no-touchscreen-hyundais-boulder-concept-should-make-jeep-nervous,1779995712,"37-Inch Tires, Body-On-Frame, No Touchscreen: Hyundai’s Boulder Concept Should Make Jeep Nervous","37-Inch Tires, Body-On-Frame, No Touchscreen: Hyundai’s Boulder Concept Should Make Jeep Nervous

<p class=""rws-nl-img""><a href=""https://www.yankodesign.com/2026/05/28/37-inch-tires-body-on-frame-no-touchscreen-hyundais-boulder-concept-should-make-jeep-nervous/""><img alt=""Silver rugged SUV with a roof rack and oversized tires navigating rocky desert terrain under a clear blue sky, front-right angle view."" class=""attachment-post-thumbnail size-post-thumbnail wp-post-image"" height=""960"" src=""https://www.yankodesign.com/images/design_news/2026/05/628030/hyundai_boulder_concept_1.jpg"" width=""1280"" /></a></p><h2 class=""rws-nl-title"" style=""text-align: center;"">37-Inch Tires, Body-On-Frame, No Touchscreen: Hyundai&#8217;s Boulder Concept Should Make Jeep Nervous</h2><div class=""rws-nl-excerpt"">The midsize truck and off-road SUV segment is the most brand-loyal territory in the American automotive market. Bronco buyers bleed blue oval. Wrangler owners have...</div>",
rss,www.yankodesign.com,https://www.yankodesign.com/2026/05/28/acers-predator-atlas-8-is-the-first-gaming-handheld-with-a-metal-fan/?utm_source=rss&utm_medium=rss&utm_campaign=acers-predator-atlas-8-is-the-first-gaming-handheld-with-a-metal-fan,1779987654,Acer’s Predator Atlas 8 Is the First Gaming Handheld With a Metal Fan,"Acer’s Predator Atlas 8 Is the First Gaming Handheld With a Metal Fan

<p class=""rws-nl-img""><a href=""https://www.yankodesign.com/2026/05/28/acers-predator-atlas-8-is-the-first-gaming-handheld-with-a-metal-fan/""><img alt=""Handheld gaming console with dual joysticks, glowing blue controls, playing a futuristic shooter on its screen in a neon city backdrop."" class=""attachment-post-thumbnail size-post-thumbnail wp-post-image"" height=""960"" src=""https://www.yankodesign.com/images/design_news/2026/05/acers-predator-atlas-8-is-the-first-gaming-handheld-with-a-metal-fan/acer-predator-atlas-8-gaming-handheld-06.jpeg"" width=""1280"" /></a></p><h2 class=""rws-nl-title"" style=""text-align: center;"">Acer&#8217;s Predator Atlas 8 Is the First Gaming Handheld With a Metal Fan</h2><div class=""rws-nl-excerpt"">Handheld gaming PCs have come a long way in a short time, but two problems follow every device in the category. Performance peaks early in...</div>",
rss,www.yankodesign.com,https://www.yankodesign.com/2026/05/28/acers-aspire-go-15-is-the-first-budget-laptop-built-on-snapdragon-c/?utm_source=rss&utm_medium=rss&utm_campaign=acers-aspire-go-15-is-the-first-budget-laptop-built-on-snapdragon-c,1779987614,Acer’s Aspire Go 15 Is the First Budget Laptop Built on Snapdragon C,"Acer’s Aspire Go 15 Is the First Budget Laptop Built on Snapdragon C

<p class=""rws-nl-img""><a href=""https://www.yankodesign.com/2026/05/28/acers-aspire-go-15-is-the-first-budget-laptop-built-on-snapdragon-c/""><img alt=""Two Acer laptops float in the air: an open silver notebook with a vibrant, abstract screen beside a closed lid model."" class=""attachment-post-thumbnail size-post-thumbnail wp-post-image"" height=""960"" src=""https://www.yankodesign.com/images/design_news/2026/05/acers-aspire-go-15-is-the-first-budget-laptop-built-on-snapdragon-c/acer-aspire-go-15-qualcomm-01.jpg"" width=""1280"" /></a></p><h2 class=""rws-nl-title"" style=""text-align: center;"">Acer&#8217;s Aspire Go 15 Is the First Budget Laptop Built on Snapdragon C</h2><div class=""rws-nl-excerpt"">Qualcomm&#8217;s Snapdragon processors have spent the past couple of years proving themselves in premium laptops, winning over skeptics with extended battery life and capable on-device...</div>",
rss,www.yankodesign.com,https://www.yankodesign.com/2026/05/28/ferrari-inspired-testazero-is-a-flamboyant-speedster-for-open-air-adventures-all-electric-luce-better-watch-out/?utm_source=rss&utm_medium=rss&utm_campaign=ferrari-inspired-testazero-is-a-flamboyant-speedster-for-open-air-adventures-all-electric-luce-better-watch-out,1779984032,"Ferrari-inspired TESTaZERO is a flamboyant speedster for open air adventures, all-electric Luce better watch out","Ferrari-inspired TESTaZERO is a flamboyant speedster for open air adventures, all-electric Luce better watch out

<p class=""rws-nl-img""><a href=""https://www.yankodesign.com/2026/05/28/ferrari-inspired-testazero-is-a-flamboyant-speedster-for-open-air-adventures-all-electric-luce-better-watch-out/""><img alt=""Upside-down yellow Ferrari-style sports car on a city street, with pedestrians and a photographer in the background."" class=""attachment-post-thumbnail size-post-thumbnail wp-post-image"" height=""960"" src=""https://www.yankodesign.com/images/design_news/2026/05/ferrari-testazero-concept-has-unconventional-label-stamped-all-over-still-its-impressive/Ferrari-TESTaZERO-by-Antonio-Pavento-1.jpg"" width=""1280"" /></a></p><h2 class=""rws-nl-title"" style=""text-align: center;"">Ferrari-inspired TESTaZERO is a flamboyant speedster for open air adventures, all-electric Luce better watch out</h2><div class=""rws-nl-excerpt"">Ferrari has finally entered the electric-powertrain domain with its Luce sports car, which some adore while others absolutely hate. The controversial performance car is the Italian marque’s...</div>",
rss,www.yankodesign.com,https://www.yankodesign.com/2026/05/28/louis-vuitton-just-made-a-one-of-a-kind-clock-for-unicef/?utm_source=rss&utm_medium=rss&utm_campaign=louis-vuitton-just-made-a-one-of-a-kind-clock-for-unicef,1779980411,Louis Vuitton Just Made a One-of-a-Kind Clock for UNICEF,"Louis Vuitton Just Made a One-of-a-Kind Clock for UNICEF

<p class=""rws-nl-img""><a href=""https://www.yankodesign.com/2026/05/28/louis-vuitton-just-made-a-one-of-a-kind-clock-for-unicef/""><img alt=""Gold, faceted spherical timepiece displayed inside an open Louis Vuitton trunk, surrounded by LV monogram luggage cases."" class=""attachment-post-thumbnail size-post-thumbnail wp-post-image"" height=""960"" src=""https://www.yankodesign.com/images/design_news/2026/05/louis-vuitton-just-made-a-one-of-a-kind-clock-for-unicef/unity-01.jpg"" width=""1280"" /></a></p><h2 class=""rws-nl-title"" style=""text-align: center;"">Louis Vuitton Just Made a One-of-a-Kind Clock for UNICEF</h2><div class=""rws-nl-excerpt"">Not every luxury piece earns the word &#8220;meaningful.&#8221; Beautiful, yes. Covetable, absolutely. But meaningful is a harder category to land in, and the Louis Vuitton...</div>",
rss,www.yankodesign.com,https://www.yankodesign.com/2026/05/28/xiaomi-17-pro-review-refined-in-all-the-right-places/?utm_source=rss&utm_medium=rss&utm_campaign=xiaomi-17-pro-review-refined-in-all-the-right-places,1779973273,Xiaomi 17 Pro Review: Refined in All the Right Places,"Xiaomi 17 Pro Review: Refined in All the Right Places

<p class=""rws-nl-img""><a href=""https://www.yankodesign.com/2026/05/28/xiaomi-17-pro-review-refined-in-all-the-right-places/""><img alt=""Blue Xiaomi smartphone with a four‑camera square module standing upright on a stone ledge in a park."" class=""attachment-post-thumbnail size-post-thumbnail wp-post-image"" height=""960"" src=""https://www.yankodesign.com/images/design_news/2026/05/xiaomi-17-pro-review-refined-in-all-the-right-places/xiaomi-17t-pro-review-01.jpg"" width=""1280"" /></a></p><h2 class=""rws-nl-title"" style=""text-align: center;"">Xiaomi 17 Pro Review: Refined in All the Right Places</h2><div class=""rws-nl-excerpt"">Xiaomi is bringing back its T series with the Xiaomi 17T and Xiaomi 17T Pro, but this time the schedule feels unusually aggressive. Instead of...</div>",
rss,www.yankodesign.com,https://www.yankodesign.com/2026/05/28/8-fathers-day-edc-gifts-so-good-we-bought-them-for-ourselves-first/?utm_source=rss&utm_medium=rss&utm_campaign=8-fathers-day-edc-gifts-so-good-we-bought-them-for-ourselves-first,1779968435,8 Father’s Day EDC Gifts So Good We Bought Them for Ourselves First,"8 Father’s Day EDC Gifts So Good We Bought Them for Ourselves First

<p class=""rws-nl-img""><a href=""https://www.yankodesign.com/2026/05/28/8-fathers-day-edc-gifts-so-good-we-bought-them-for-ourselves-first/""><img alt=""Black vintage-style portable radio with an orange tuning dial and carrying handle on a desk."" class=""attachment-post-thumbnail size-post-thumbnail wp-post-image"" height=""960"" src=""https://www.yankodesign.com/images/design_news/2026/05/fathers-day-edc-gifts-so-good-we-bought-them-for-ourselves-first/8_best_fathers_day_edc_yanko_design_hero.webp"" width=""1280"" /></a></p><h2 class=""rws-nl-title"" style=""text-align: center;"">8 Father&#8217;s Day EDC Gifts So Good We Bought Them for Ourselves First</h2><div class=""rws-nl-excerpt"">The best Father&#8217;s Day gifts aren&#8217;t found in department store gift sets or tucked inside branded packaging. They live somewhere more specific, in the overlap...</div>",
rss,www.yankodesign.com,https://www.yankodesign.com/2026/05/28/zara-and-playstation-just-made-gaming-fashion-actually-cool/?utm_source=rss&utm_medium=rss&utm_campaign=zara-and-playstation-just-made-gaming-fashion-actually-cool,1779962830,Zara and PlayStation Just Made Gaming Fashion Actually Cool,"Zara and PlayStation Just Made Gaming Fashion Actually Cool

<p class=""rws-nl-img""><a href=""https://www.yankodesign.com/2026/05/28/zara-and-playstation-just-made-gaming-fashion-actually-cool/""><img alt=""Grey PlayStation controller-shaped bag with buttons, hand straps, and adjustable crossbody strap."" class=""attachment-post-thumbnail size-post-thumbnail wp-post-image"" height=""960"" src=""https://www.yankodesign.com/images/design_news/2026/05/zara-and-playstation-just-made-gaming-fashion-actually-cool/zara-00.jpg"" width=""1280"" /></a></p><h2 class=""rws-nl-title"" style=""text-align: center;"">Zara and PlayStation Just Made Gaming Fashion Actually Cool</h2><div class=""rws-nl-excerpt"">Gaming and fashion have been flirting with each other for years, and most of the time, the results are predictable. Graphic tees with pixelated prints,...</div>",
rss,www.archdaily.com,https://www.archdaily.com/1041479/londres-187-building-cca-bernardo-quinzanos-plus-olga-romano,1779980400,Londres 187 Building / CCA | Bernardo Quinzaños  + Olga Romano,"Londres 187 Building / CCA | Bernardo Quinzaños  + Olga Romano

<p>Located on London Street in the Ju&aacute;rez neighborhood, the building integrates collective housing with ground-floor retail. The proposal maximizes the use of the lot through an organization of two volumes articulated by a central courtyard and a rear patio, ensuring natural light and ventilation.</p>",
rss,www.archdaily.com,https://www.archdaily.com/1041803/black-thought-pavilion-meds-meetings-of-design-students-plus-cisem-nur-yldirim-plus-alberto-collet,1779969600,Black Thought Pavilion / Alberto Collet + Çisem Nur Yldirim + MEDS (Meetings of Design Students),"Black Thought Pavilion / Alberto Collet + Çisem Nur Yldirim + MEDS (Meetings of Design Students)

<p>The concept for the construction of a pavilion, Black Thought in <a href=""https://www.archdaily.com/tag/rijeka"">Rijeka</a>, Croatia, utilizing the traditional Japanese technique of Yakisugi, offers a powerful opportunity to create a distinctive, sustainable, and culturally resonant structure.</p>",
rss,www.archdaily.com,https://www.archdaily.com/1041786/diagonal-apartment-de-la-villa-studio,1779962400,Diagonal Apartment / De la Villa Studio,"Diagonal Apartment / De la Villa Studio

<p>The flat is situated on the iconic Avinguda Diagonal, one of Barcelona's main arteries that crosses the city obliquely, connecting different neighborhoods and offering a vivid panorama of its urban evolution. This location not only guarantees accessibility, but also lends a representative character to the project, framed by a dynamic and cosmopolitan environment, with shopping centers, design shops, and offices of key companies in the life of the city.</p>",
rss,www.archdaily.com,https://www.archdaily.com/1041623/the-spirit-of-space-10-distillery-projects-where-production-shapes-architecture,1779953400,The Spirit of Space: 10 Distillery Projects Where Production Shapes Architecture,"The Spirit of Space: 10 Distillery Projects Where Production Shapes Architecture

<p>Unlike many <a href=""https://www.archdaily.com/category/industrial-architecture"" rel=""noopener"" target=""_blank"">industrial programs</a> traditionally concealed behind <a href=""https://www.archdaily.com/search/projects/categories/factory"" rel=""noopener"" target=""_blank"">neutral façades</a> and hermetic spaces, contemporary <a href=""https://www.archdaily.com/tag/distillery"" rel=""noopener"" target=""_blank"">distilleries</a> often expose their <a href=""https://www.archdaily.com.br/br/926578/arquitetura-des-industrial-8-projetos-que-ressignificam-o-espaco-da-maquina"" rel=""noopener"" target=""_blank"">production processes</a> as an essential part of the <a href=""https://www.archdaily.com/962662/modular-components-in-industrial-architecture"" rel=""noopener"" target=""_blank"">architectural experience</a>. The heat of the stills, the vapors of distillation, and the paths traced by raw materials cease to function merely as technical operations and instead assume spatial prominence.</p>",
rss,www.archdaily.com,https://www.archdaily.com/1041735/classrooms-for-new-day-school-school-simple-architecture,1779951600,Classrooms for New Day School School / Simple Architecture,"Classrooms for New Day School School / Simple Architecture

<p>New Day School is a migrant learning centre serving Burmese migrant and refugee communities in the Thai border town of Mae Sot. Since the last military coup on 1st of February 2021, the number of Burmese refugees and migrants crossing into Thailand has dramatically increased. Help without Frontiers Thailand is a community-based organisation that supports learning centres by providing essential funding for teacher salaries, lunches, and school uniforms. Due to the limited funding, the support for new classroom buildings, sanitation facilities, and overall infrastructure is often lacking.</p>",
rss,www.archdaily.com,https://www.archdaily.com/1041534/ceramics-forged-in-light-a-spatial-translation-of-circular-material-processes,1779950700,Ceramics Forged in Light: A Spatial Translation of Circular Material Processes,"Ceramics Forged in Light: A Spatial Translation of Circular Material Processes

<p>Can one of architecture's oldest materials still inform how <a href=""https://www.archdaily.com/tag/sustainability"">sustainability</a> and <a href=""https://www.archdaily.com/tag/manufacturing"">manufacturing</a> are approached today? What shifts when <a href=""https://www.archdaily.com/tag/ceramics"">ceramic</a> is viewed beyond its surface, as a process shaped by <a href=""https://www.archdaily.com/tag/light"">light</a>, <a href=""https://www.archdaily.com/tag/water"">water</a>, and <a href=""https://www.archdaily.com/tag/clay"">clay</a>? At <a href=""https://www.archdaily.com/tag/milan-design-week"" rel=""noopener"" target=""_blank"">Milan Design Week 2026</a>, VitrA, a brand producing <a href=""https://www.vitraglobal.com/?utm_medium=website&amp;utm_source=archdaily.com"" rel=""noopener"" target=""_blank"">bathroom and ceramic surfaces and working across sanitaryware and tiles</a>, and international design practice <a href=""https://www.archdaily.com/office/snohetta"" rel=""noopener"" target=""_blank"">Snøhetta</a> explore these questions through <a href=""https://www.vitraglobal.com/fairs/milan-design-week-2026-interni-materiae/?utm_medium=website&amp;utm_source=archdaily.com"" rel=""noopener"" target=""_blank""><em>Ceramics Forged in Light</em></a>, an immersive installation created for the INTERNI MATERIAE exhibition. Positioned within a broader discourse on <a href=""https://www.archdaily.com/tag/material"">material experimentation</a> and <a href=""https://www.archdaily.com/tag/circular-design"">circular production</a>, the project treats ceramic as an architectural material defined by continuous transformation, shaped through light, water, heat, reflection, and reuse.</p>",
rss,www.archdaily.com,https://www.archdaily.com/1041933/pan-african-biennale-unveils-participants-for-its-inaugural-edition-in-nairobi,1779949800,Pan-African Biennale Unveils Participants for Its Inaugural Edition in Nairobi,"Pan-African Biennale Unveils Participants for Its Inaugural Edition in Nairobi

<p><a href=""https://www.archdaily.com/tag/pan-african-architecture-biennale"">The Pan-African Biennale (PAB)</a> has announced <a href=""https://www.panafricanbiennale.org/participants?utm_medium=website&amp;utm_source=archdaily.com"" rel=""noopener"" target=""_blank"">the official selection of participants</a> for <a href=""https://www.archdaily.com/1039935/the-first-pan-african-biennale-establishes-a-platform-for-a-decolonized-african-led-architectural-future?ad_campaign=special-tag"">its inaugural 2026 edition, set to take place from September 7 to 11, 2026</a>, at the Kenyatta International Convention Centre in <a href=""https://www.archdaily.com/tag/nairobi/page/1"">Nairobi</a>. Conceived as the first continental architecture biennale dedicated to spatial practices from and within <a href=""https://www.archdaily.com/tag/africa/page/1"">Africa</a>, the event will bring together architects, studios, research collectives, and material practitioners from across the continent. Additional participants, keynote speakers, and contributors are expected to be announced in the coming weeks.</p>",
rss,www.archdaily.com,https://www.archdaily.com/1041798/cornebarrieu-social-housing-atelier-regis-roudil-architectes,1779948000,Cornebarrieu Social Housing  / Atelier Régis Roudil Architectes,"Cornebarrieu Social Housing  / Atelier Régis Roudil Architectes

<p>Located at the southern end of the ZAC Monges-Croix du Sud in <a href=""https://www.archdaily.com/tag/cornebarrieu"">Cornebarrieu</a>, this housing completed by atelier Régis Roudil links the preserved countryside with the new urban fabric of the ZAC. They constitute a point of entry to the district. The transition from a natural landscape to organic geometry and a gentle form of urbanisation integrated with nature is at the heart of the project, whose essence is defined by the surrounding landscape whilst also articulating the entrance to the southern end of the Zac.</p>",
rss,www.archdaily.com,https://www.archdaily.com/1041936/herzog-and-de-meurons-nearly-completed-triangle-tower-and-omas-urban-vision-for-rome-this-weeks-review,1779946200,Herzog & de Meuron's Nearly Completed Triangle Tower and OMA's Urban Vision for Rome: This Week's Review,"Herzog & de Meuron's Nearly Completed Triangle Tower and OMA's Urban Vision for Rome: This Week's Review

<p>This week, we revisited the ideas currently shaping the design of 21st-century cities, with a view toward a longer timeframe than that which characterised modern design. These examples of today's urban design point toward the cities of tomorrow, seeking to reflect collective memory and social identity while addressing the climate challenges we face today. From <a href=""https://www.archdaily.com/1041838/mac-panama-selects-palma-plus-taller-to-to-design-its-new-museum-building"" rel=""noopener"" target=""_blank"">a new museum in Panama</a> drawing on Latin American architectural tradition to <a href=""https://www.archdaily.com/1041756/street-artist-jr-installs-an-inflatable-cave-on-paris-pont-neuf-in-tribute-to-christo-and-jeanne-claude"" rel=""noopener"" target=""_blank"">an inflatable installation on Paris's oldest bridge over the Seine</a>, built and not-yet-built projects rescue architecture as a repository of collective memory, while others explore its transformative potential through the lens of contemporary well-being. In this weekly news compilation, we present ongoing projects from Panama, numerous African countries, France, Canada, Italy, Australia, and the United States.</p>",
rss,www.archdaily.com,https://www.archdaily.com/1041822/curatorial-work-as-city-making-design-trusts-marisa-yiu-on-exhibitions-and-spatial-agency,1779940800,Curatorial Work as City-Making: Design Trust’s Marisa Yiu on Exhibitions and Spatial Agency,"Curatorial Work as City-Making: Design Trust’s Marisa Yiu on Exhibitions and Spatial Agency

<p>In <a href=""https://www.archdaily.com/tag/hong-kong"">Hong Kong</a>, where architecture is often driven by real estate logic, <a href=""https://www.archdaily.com/1039154/making-infrastructure-visible-when-systems-become-architecture?ad_source=search&amp;ad_medium=search_result_articles"">infrastructure</a>, and accelerated <a href=""https://www.archdaily.com/1039650/form-function-and-funding-the-high-tech-urbanism-of-san-francisco?ad_source=search&amp;ad_medium=search_result_articles"">development</a>, the space for <a href=""https://www.archdaily.com/949316/the-evolution-in-understanding-of-human-scales-in-architecture"">bodily-scaled</a> civic experimentation can be surprisingly narrow. This is where <a href=""https://designtrust.hk?utm_medium=website&amp;utm_source=archdaily.com"" rel=""noopener"" target=""_blank"">Design Trust </a>has become distinctive. As a grant-making and project-enabling platform, it supports <a href=""https://www.archdaily.com/1038245/when-art-came-first-spatial-experiments-that-shaped-architecture-in-latin-america?ad_source=search&amp;ad_medium=search_result_articles"">spatial interventions</a> that sit between architecture, research, and public programming—work that is often too modest, collective, or uncertain to fit conventional client–architect pipelines.</p>",
rss,www.archdaily.com,https://www.archdaily.com/1041799/i8-icampus-in-werksviertel-cf-moller,1779937200,i8 - iCampus in Werksviertel / C.F. Møller,"i8 - iCampus in Werksviertel / C.F. Møller

<p>i8 is a versatile new office building in Werksviertel, <a href=""https://www.archdaily.com/tag/munich"">Munich</a>, Germany, built in a hybrid timber construction, which contributes positively to the LCA of the building and helps to secure a good indoor climate.</p>",
rss,www.archdaily.com,https://www.archdaily.com/1041894/son-restaurant-pinto,1779933600,SON Restaurant / pinto,"SON Restaurant / pinto

<p>Sitting beneath casuarina trees on Rayong's main road from the city to the beach, SON Restaurant occupies a small garden surrounded by restaurants with ocean views, mangrove edges, and riverside terraces. Without a dramatic site to compete with, the project would fail as a business; instead, the restaurant creates its own environment. It's own spatial experience.</p>",
