source,domain,url,created_utc,title,text,query
youtube,,https://www.youtube.com/watch?v=QGVvov990Fw,1776926134,Artificial lily flower🪷! #onlineshopping #homedecorideas #onlineshopping #artificialflowers #lily,"Zapai – সাধ্যের মধ্যে স্বপ্ন পূরণ আমরা Zapai থেকে ঘর সাজানো, লাইফস্টাইল, ...",home decor ideas
youtube,,https://www.youtube.com/watch?v=n-0rQaddO-o,1776926060,Artificial pear😍🍐 #onlineshopping #homedecorideas #pearl #artificial,"Zapai – সাধ্যের মধ্যে স্বপ্ন পূরণ আমরা Zapai থেকে ঘর সাজানো, লাইফস্টাইল, ...",home decor ideas
youtube,,https://www.youtube.com/watch?v=7D8_BYHgzyw,1776925890,Diy snail decor #craft #clay #clayart #diy #decor #homedecor #handmade #shorts,"Diy snail decor #craft #clay #clayart #diy #decor #homedecor #handmade #shorts diy snail, diy decor, diy home decor, diy room ...",home decor ideas
youtube,,https://www.youtube.com/watch?v=1hZfR7t0Uhk,1776925767,"Easy And Beautiful Home Decor Craft Idea, Paper Craft Idea #wallhanging #shortsfeed #ytshorts","Easy And Beautiful Home Decor Craft Idea, Paper Craft Idea #wallhanging #shortsfeed #ytshorts#PaperFlowers ...",home decor ideas
youtube,,https://www.youtube.com/watch?v=sdYPEC9eJv0,1776922500,5 Creative DIY Hacks You Can Make at Home 🤯✨ | #shorts,Try these 5 creative DIY hacks and turn everyday items into something amazing! 🛠️✨ ✔️ Make your own play button replica ...,home decor ideas
youtube,,https://www.youtube.com/watch?v=JDA1oAl4dTw,1776920651,Modern Hall Interior Design Ideas 2026 | Living Room Design | Small Hall Decoration #interiordesign,Discover beautiful and modern hall interior design ideas to transform your living room into a stylish and comfortable space.,home decor ideas
youtube,,https://www.youtube.com/watch?v=F3MzAazOgTo,1776919498,Plant Decor ideas 🪴 #homedecor #indoorplants #happiness #showpiece #gardening #diy #fyp,,home decor ideas
youtube,,https://www.youtube.com/watch?v=DzX6zt2_mjs,1776916770,French home decor | home decor ideas | vintage treasures,French home decor | home decor ideas | vintage treasures.,home decor ideas
youtube,,https://www.youtube.com/watch?v=7CNYNJGATU4,1776916340,Wallpaper sheet water proof home decoration ideas latest design #wall #homedecor #shortsfeed,,home decor ideas
youtube,,https://www.youtube.com/watch?v=SFrMOy2iIqU,1776916261,Evening tea #trendingshorts #amazonfinds #kitchenstorage #homedecorideas #organizedhome,Kitchen essential home finds Proud link Glasslock Korea Tempered Glass Storage Containers with Lid - Classic 715ml Rectangle ...,home decor ideas
youtube,,https://www.youtube.com/watch?v=GcgPvdzMjZs,1776915665,DIY Cute Girl Flower Pot 🌸 || Best Home Decor || #diy #short #viral #trending #art #craft #handmade,DIY Cute Girl Flower Pot | Best Home Decor Idea Waste se Beautiful Planter | Easy Craft Mini Girl Pot Banaya Full ...,home decor ideas
youtube,,https://www.youtube.com/watch?v=icnzRdwFuzk,1776911563,💞 DIY Amazing Beautiful 3D Paper Flower / Home Decor ideas #shorts #youtubeshorts #trendingshorts,DIY Amazing Beautiful 3D Paper Flower / Home Decor ideas #shorts #youtubeshorts #trendingshorts #art #shortvideo #shortsviral ...,home decor ideas
youtube,,https://www.youtube.com/watch?v=sCOtpI9nkzg,1776907842,DIY easy wall decor Aesthetic Home Decor Idea craft idea,,home decor ideas
youtube,,https://www.youtube.com/watch?v=4-IWnWeyMfA,1776907805,Home decor ideas 💡 #trendingshorts #homedecor #diy #artshorts #craftideas #shortsindia #viralvideo,Home decor ideas #trendingshorts #homedecor #diy #artshorts #craftideas #shortsindia #viralvideo Transforml your space with ...,home decor ideas
youtube,,https://www.youtube.com/watch?v=i_QtEH00I44,1776907800,2026 ke Most Viral Gift Ideas 🎁 | Unique Home Decor Hacks #shorts #viralshorts #viral #shortvideol,2026 ke latest trending gift ideas | Unique home decor items jo aapke ghar ko beautiful banaye Agar aap budget me best gift ...,home decor ideas
youtube,,https://www.youtube.com/watch?v=otC1QiaqB6k,1776907541,Living room decor idea #glamdecor #homedecor #home #aestheticroomdecor #interiordesign #interior,,home decor ideas
youtube,,https://www.youtube.com/watch?v=ojkM53u2BGQ,1776943973,Maximalist Small Apartment Ideas That Feel Opulent and Bold 🌿 Color-Drenched Rooms You&#39;ll Adore,"Transform your space with these maximalist small apartment ideas that feel bold, luxurious, and completely unforgettable.",small apartment decor
youtube,,https://www.youtube.com/watch?v=25m6J5-g7so,1776943569,#recreationalvehicle  #travel  #camping #travel trailer camping#automobile,house design plan house design ideas interior design ideas interior design ideas for small house house design planner free ...,small apartment decor
youtube,,https://www.youtube.com/watch?v=WHudRJD9x1A,1776939412,#recreationalvehicle  #travel  #camping #travel trailer camping#automobile,house design plan house design ideas interior design ideas interior design ideas for small house house design planner free ...,small apartment decor
youtube,,https://www.youtube.com/watch?v=Y2U4a-nYLUM,1776934912,#recreationalvehicle  #travel  #camping #travel trailer camping#automobile,house design plan house design ideas interior design ideas interior design ideas for small house house design planner free ...,small apartment decor
youtube,,https://www.youtube.com/watch?v=BzktnCDDBgY,1776933472,#recreationalvehicle  #travel  #camping #travel trailer camping#automobile,house design plan house design ideas interior design ideas interior design ideas for small house house design planner free ...,small apartment decor
youtube,,https://www.youtube.com/watch?v=z-V6aFQV89U,1776913029,From dust to luxury ✨Watch this studio apartment transform,A compact studio apartment undergoes a stunning transformation from raw construction to a luxurious modern living space.,small apartment decor
youtube,,https://www.youtube.com/watch?v=sZ0B-2_C7dA,1776910547,Genius Tiny Apartment Makeover Ideas | Maximize Every Inch with Smart Decor,"Transform your tiny apartment into a stylish and functional space with these genius makeover ideas! ✨ In this video, HAS ...",small apartment decor
youtube,,https://www.youtube.com/watch?v=0mDET6y_QWk,1776908258,part 46.Minimalist Glass Partition ✨ Smart Storage Solution #Shorts,Transform your space with this stunning modern glass partition design ✨ Featuring textured frosted glass and a sleek storage ...,small apartment decor
youtube,,https://www.youtube.com/watch?v=cVa1OkW3eDo,1776888974,Amazing space saving furniture | Best for small apartment #furnitureideas #shorts #youtube,,small apartment decor
youtube,,https://www.youtube.com/watch?v=X7r1ZuKYlPY,1776873930,Space Saving Bathtub 👍🏼 #businessideas #spacesaving #bathtub #homeinnovation #usashorts,"In United States, this hammock-style bathtub is becoming a viral space-saving solution. Designed for small apartments with only a ...",small apartment decor
youtube,,https://www.youtube.com/watch?v=6o4gdfNVpKE,1776873752,Unglaublich: 3 Quadratmeter = Ganze Wohnung?! 🤯 #viral #style #design #modern #keşfet ##home,"Bu Video zeigt, wie ich aus nur 3 Quadratmetern eine komplette Wohnung gemacht habe! Mit Schlafzimmer, Wohnzimmer ...",small apartment decor
youtube,,https://www.youtube.com/watch?v=8seq5rmFbdw,1776872394,"My USA apartment tour 🇺🇸✨ small, cozy &amp; full of love ❤️ come see our little dream home 🏡","Everyone kept asking for my apartment tour in the USA ✨ So here it is! From cozy corners to my favorite decor spots, this ...",small apartment decor
youtube,,https://www.youtube.com/watch?v=oesL_G6PUig,1776872360,TOUR APÊ MEZANINO #apepequeno #apefuncional #reforma #quartonomezanino  #dicasdecoracao,Um apê 26m² com direito ao quarto no mezanino!,small apartment decor
youtube,,https://www.youtube.com/watch?v=k_Np7QsGDAw,1776866476,Precisa de um cantinho para guardar seus sapatos?,"Se quiser ver o tour completo, conhecer mais projetos da arquiteta e ainda ganhar 5% de desconto, entra no nosso site e escreve ...",small apartment decor
youtube,,https://www.youtube.com/watch?v=C5ABvkcHZbQ,1776866271,"Tiny Studio Apartment Makeover Ideas for Maximum Comfort, Space &amp; Style","Transform your tiny studio apartment into a cozy, stylish, and highly functional space with these easy makeover ideas from Decor ...",small apartment decor
youtube,,https://www.youtube.com/watch?v=k1dYu6E39ug,1776866034,Small Apartment Folding Sofa Bed – So Good Even the Neighbors Keep Asking! #shortsfeed,"Upgrade your living space with the ultimate multifunctional sofa bed! In this video, we explore sofas, convertible sofa, sofa beds, ...",small apartment decor
youtube,,https://www.youtube.com/watch?v=E185YbIFvaQ,1776865380,👉 From Ruins to Luxury 😱 Studio Apartment Transformation #shorts #transformation #bunker #luxury,From Ruins to Luxury Studio Apartment Transformation #shorts #transformation #bunker #luxury Watch this insane studio ...,small apartment decor
youtube,,https://www.youtube.com/watch?v=nkXPXzBGqqA,1776864056,part 43.Beautiful Room Divider with Leaf Art 😍 Modern Home Decor,"Upgrade your home entrance with this stunning modern partition design ✨ Featuring elegant textured glass artistic leaf décor, ...",small apartment decor
youtube,,https://www.youtube.com/watch?v=fkD00zCktBc,1776862885,SMALL SPACE DESIGN | A Romantic &amp; Paris-Inspired Apartment in NYC,"For more extraordinary home tours, visit our website: homeworthy.com Content creator Brigette Muller takes us inside her 560 sq ft ...",small apartment decor
youtube,,https://www.youtube.com/watch?v=O3AMrMMHUTU,1776862847,Luxury in Simplicity : Designing a Breathable Layout in a Small Apartment,"This video, ""Luxury in Simplicity: Designing a Breathable Layout in a Small Apartment,"" redefines the concept of small-space living ...",small apartment decor
youtube,,https://www.youtube.com/watch?v=JvRC0WkRyNs,1776862645,"“Small Space, Big Style 😍 | Studio Apartment Tour”“1 Room Mein#shorts",,small apartment decor
youtube,,https://www.youtube.com/watch?v=YzcgASFKjI0,1776861787,Ultimate Small Room Transformation #3dhousedesign#shorts,Smart Storage And Stylish Design Inside Innovative Bedroom || 3D Animation #shortsfunny smart storage and stylish design ...,small apartment decor
youtube,,https://www.youtube.com/watch?v=zxlqLZ87J1g,1776861689,Tiny Studio Apartment Decor Ideas That Maximize Space Without Renovation,"Transform your tiny studio apartment into a smart, stylish, and highly functional space—without any renovation! ✨ In this video ...",small apartment decor
youtube,,https://www.youtube.com/watch?v=fNd28SjKSjA,1776859273,Small Apartment Makeover Ideas with Modern Luxury Interior Design 2026,Discover how a small apartment becomes a masterpiece of modern luxury through thoughtful 2026 design ideas that maximize ...,small apartment decor
youtube,,https://www.youtube.com/watch?v=dJfeWV0Im_g,1776859281,small home updates that elevated my space 🌟,homedecor #homedesign #homeinterior #home #apartment #apartmentdecor #apartmentliving #interiordesign #interiordecor ...,small apartment decor
