source,domain,url,created_utc,title,text,query
rss,www.yankodesign.com,https://www.yankodesign.com/2026/04/26/smegs-air-fryer-comes-with-a-steam-function-for-food-thats-crispy-outside-and-juicy-inside/?utm_source=rss&utm_medium=rss&utm_campaign=smegs-air-fryer-comes-with-a-steam-function-for-food-thats-crispy-outside-and-juicy-inside,1777224057,Smeg’s Air Fryer Comes With A Steam Function For Food That’s Crispy Outside and Juicy Inside,"Smeg’s Air Fryer Comes With A Steam Function For Food That’s Crispy Outside and Juicy Inside

<p class=""rws-nl-img""><a href=""https://www.yankodesign.com/2026/04/26/smegs-air-fryer-comes-with-a-steam-function-for-food-thats-crispy-outside-and-juicy-inside/""><img alt=""Retro teal SMEG toaster with chrome trim on a wooden counter, greenery in the background."" class=""attachment-post-thumbnail size-post-thumbnail wp-post-image"" height=""960"" src=""https://www.yankodesign.com/images/design_news/2026/04/auto-draft/smeg_air_fryer_concept_1.jpg"" width=""1280"" /></a></p><h2 class=""rws-nl-title"" style=""text-align: center;"">Smeg&#8217;s Air Fryer Comes With A Steam Function For Food That&#8217;s Crispy Outside and Juicy Inside</h2><div class=""rws-nl-excerpt"">I was today years old when I learnt that Smeg&#8217;s origins were in enamel technology, not the gorgeously colorful kitchen appliances we&#8217;ve known them for...</div>",
rss,www.yankodesign.com,https://www.yankodesign.com/2026/04/26/the-restaurant-made-of-mud-and-marine-waste-is-drop-dead-gorgeous/?utm_source=rss&utm_medium=rss&utm_campaign=the-restaurant-made-of-mud-and-marine-waste-is-drop-dead-gorgeous,1777216837,The Restaurant Made of Mud and Marine Waste Is Drop-Dead Gorgeous,"The Restaurant Made of Mud and Marine Waste Is Drop-Dead Gorgeous

<p class=""rws-nl-img""><a href=""https://www.yankodesign.com/2026/04/26/the-restaurant-made-of-mud-and-marine-waste-is-drop-dead-gorgeous/""><img alt=""Brick building with perforated towers and glass entrances; a group of people in colorful saris walking on a grassy foreground."" class=""attachment-post-thumbnail size-post-thumbnail wp-post-image"" height=""960"" src=""https://www.yankodesign.com/images/design_news/2026/04/the-restaurant-made-of-mud-and-marine-waste-is-drop-dead-gorgeous/petti-01.jpg"" width=""1280"" /></a></p><h2 class=""rws-nl-title"" style=""text-align: center;"">The Restaurant Made of Mud and Marine Waste Is Drop-Dead Gorgeous</h2><div class=""rws-nl-excerpt"">When you hear &#8220;shipping container restaurant,&#8221; you probably picture a food truck-adjacent setup with exposed steel walls and Edison bulb string lights. Petti, a restaurant...</div>",
rss,www.yankodesign.com,https://www.yankodesign.com/2026/04/26/recycled-paper-turned-into-a-japanese-zen-garden-for-your-walls/?utm_source=rss&utm_medium=rss&utm_campaign=recycled-paper-turned-into-a-japanese-zen-garden-for-your-walls,1777209608,Recycled Paper Turned Into a Japanese Zen Garden for Your Walls,"Recycled Paper Turned Into a Japanese Zen Garden for Your Walls

<p class=""rws-nl-img""><a href=""https://www.yankodesign.com/2026/04/26/recycled-paper-turned-into-a-japanese-zen-garden-for-your-walls/""><img alt=""Minimalist dining area with a light wood table and two chairs, teal vertical-slatted wall art, and a small plant centerpiece."" class=""attachment-post-thumbnail size-post-thumbnail wp-post-image"" height=""960"" src=""https://www.yankodesign.com/images/design_news/2026/04/recycled-paper-turned-into-a-japanese-zen-garden-for-your-walls/reborn-01.jpg"" width=""1280"" /></a></p><h2 class=""rws-nl-title"" style=""text-align: center;"">Recycled Paper Turned Into a Japanese Zen Garden for Your Walls</h2><div class=""rws-nl-excerpt"">Most acoustic panels exist as a necessary evil. You know the type: thick foam squares in aggressive wedge shapes, usually in black or grey, installed...</div>",
rss,www.yankodesign.com,https://www.yankodesign.com/2026/04/26/5-libraries-that-look-nothing-like-libraries-and-are-better-for-it/?utm_source=rss&utm_medium=rss&utm_campaign=5-libraries-that-look-nothing-like-libraries-and-are-better-for-it,1777203648,5 Libraries That Look Nothing Like Libraries (And Are Better For It),"5 Libraries That Look Nothing Like Libraries (And Are Better For It)

<p class=""rws-nl-img""><a href=""https://www.yankodesign.com/2026/04/26/5-libraries-that-look-nothing-like-libraries-and-are-better-for-it/""><img alt=""Evening view of a modern building with a wavy blue roof and warm exterior lighting, surrounded by trees and a parking lot."" class=""attachment-post-thumbnail size-post-thumbnail wp-post-image"" height=""960"" src=""https://www.yankodesign.com/images/design_news/2026/04/5-libraries-that-look-nothing-like-libraries-and-are-better-for-it/Library-Designs_Architecture_7.jpg"" width=""1280"" /></a></p><h2 class=""rws-nl-title"" style=""text-align: center;"">5 Libraries That Look Nothing Like Libraries (And Are Better For It)</h2><div class=""rws-nl-excerpt"">In a world shaped by AI, constant notifications, and shrinking attention spans, focused reading has become harder to protect. Distractions are no longer just external;...</div>",
rss,www.yankodesign.com,https://www.yankodesign.com/2026/04/25/loopgears-dual-beam-5000-lumen-edc-flashlight-also-doubles-as-a-12v-laptop-power-bank/?utm_source=rss&utm_medium=rss&utm_campaign=loopgears-dual-beam-5000-lumen-edc-flashlight-also-doubles-as-a-12v-laptop-power-bank,1777167940,LOOPGEAR’s Dual-Beam 5000 Lumen EDC Flashlight Also Doubles As A 12V Laptop Power Bank,"LOOPGEAR’s Dual-Beam 5000 Lumen EDC Flashlight Also Doubles As A 12V Laptop Power Bank

<p class=""rws-nl-img""><a href=""https://www.yankodesign.com/2026/04/25/loopgears-dual-beam-5000-lumen-edc-flashlight-also-doubles-as-a-12v-laptop-power-bank/""><img alt=""Smartphone connected to a rugged electronic device via a charging cable on a dark surface, blue glow from the device visible."" class=""attachment-post-thumbnail size-post-thumbnail wp-post-image"" height=""960"" src=""https://www.yankodesign.com/images/design_news/2026/04/loopgears-dual-beam-5000-lumen-edc-flashlight-also-doubles-as-a-12v-laptop-power-bank/LOOPGEAR_SK05_Pro_2_08.jpg"" width=""1280"" /></a></p><h2 class=""rws-nl-title"" style=""text-align: center;"">LOOPGEAR&#8217;s Dual-Beam 5000 Lumen EDC Flashlight Also Doubles As A 12V Laptop Power Bank</h2><div class=""rws-nl-excerpt"">Flashlight manufacturers love to brag about lumen counts, but raw output means very little when the beam profile can&#8217;t match the task at hand. A...</div>",
rss,www.yankodesign.com,https://www.yankodesign.com/2026/04/25/this-nova-scotia-home-floats-above-the-land-on-steel-legs-and-changes-nothing-beneath-it/?utm_source=rss&utm_medium=rss&utm_campaign=this-nova-scotia-home-floats-above-the-land-on-steel-legs-and-changes-nothing-beneath-it,1777159849,This Nova Scotia Home Floats Above the Land on Steel Legs and Changes Nothing Beneath It,"This Nova Scotia Home Floats Above the Land on Steel Legs and Changes Nothing Beneath It

<p class=""rws-nl-img""><a href=""https://www.yankodesign.com/2026/04/25/this-nova-scotia-home-floats-above-the-land-on-steel-legs-and-changes-nothing-beneath-it/""><img alt=""Modern house on a rocky hillside with glass walls and a metal roof, surrounded by boulders and trees."" class=""attachment-post-thumbnail size-post-thumbnail wp-post-image"" height=""960"" src=""https://www.yankodesign.com/images/design_news/2026/04/east-river-residence/east_river_residence_yanko_design_01.jpg"" width=""1280"" /></a></p><h2 class=""rws-nl-title"" style=""text-align: center;"">This Nova Scotia Home Floats Above the Land on Steel Legs and Changes Nothing Beneath It</h2><div class=""rws-nl-excerpt"">There&#8217;s a certain restraint in the decision to let a building hover. Not every architect earns that move. Along the rugged Atlantic coastline of Nova...</div>",
rss,www.yankodesign.com,https://www.yankodesign.com/2026/04/25/smart-concept-2-reimagines-the-iconic-city-car-as-a-fashion-forward-electric-micro-mobility-commuter/?utm_source=rss&utm_medium=rss&utm_campaign=smart-concept-2-reimagines-the-iconic-city-car-as-a-fashion-forward-electric-micro-mobility-commuter,1777156212,Smart Concept #2 reimagines the iconic city car as a fashion-forward electric micro-mobility commuter,"Smart Concept #2 reimagines the iconic city car as a fashion-forward electric micro-mobility commuter

<p class=""rws-nl-img""><a href=""https://www.yankodesign.com/2026/04/25/smart-concept-2-reimagines-the-iconic-city-car-as-a-fashion-forward-electric-micro-mobility-commuter/""><img alt=""Man in a tan blazer and white pants stands beside a small futuristic white Smart car in a dark studio backdrop."" class=""attachment-post-thumbnail size-post-thumbnail wp-post-image"" height=""960"" src=""https://www.yankodesign.com/images/design_news/2026/04/smart-concept-2-reimagines-the-iconic-city-car-as-a-fashion-forward-electric-micro-mobility-commuter/Smart-Concept-2-Micro-Mobility-Vehicle-1.jpg"" width=""1280"" /></a></p><h2 class=""rws-nl-title"" style=""text-align: center;"">Smart Concept #2 reimagines the iconic city car as a fashion-forward electric micro-mobility commuter</h2><div class=""rws-nl-excerpt"">Smart has always had a knack for making the smallest cars feel like big ideas. The original two-seater wasn’t just about transportation; it was a...</div>",
rss,www.yankodesign.com,https://www.yankodesign.com/2026/04/25/oberhausers-balloon-is-the-most-beautiful-lamp-made-of-concrete/?utm_source=rss&utm_medium=rss&utm_campaign=oberhausers-balloon-is-the-most-beautiful-lamp-made-of-concrete,1777149911,Oberhauser’s Balloon Is the Most Beautiful Lamp Made of Concrete,"Oberhauser’s Balloon Is the Most Beautiful Lamp Made of Concrete

<p class=""rws-nl-img""><a href=""https://www.yankodesign.com/2026/04/25/oberhausers-balloon-is-the-most-beautiful-lamp-made-of-concrete/""><img alt=""Night garden with illuminated perforated sphere sculptures along a stone path at night."" class=""attachment-post-thumbnail size-post-thumbnail wp-post-image"" height=""960"" src=""https://www.yankodesign.com/images/design_news/2026/04/oberhausers-balloon-is-the-most-beautiful-lamp-made-of-concrete/oberhauser-06.jpg"" width=""1280"" /></a></p><h2 class=""rws-nl-title"" style=""text-align: center;"">Oberhauser&#8217;s Balloon Is the Most Beautiful Lamp Made of Concrete</h2><div class=""rws-nl-excerpt"">The first time I came across the Oberhauser Balloon, I genuinely thought I was looking at a sea creature. That rough, porous sphere covered in...</div>",
rss,www.yankodesign.com,https://www.yankodesign.com/2026/04/25/the-dog-bowl-designed-to-keep-your-pet-guessing/?utm_source=rss&utm_medium=rss&utm_campaign=the-dog-bowl-designed-to-keep-your-pet-guessing,1777144510,The Dog Bowl Designed to Keep Your Pet Guessing,"The Dog Bowl Designed to Keep Your Pet Guessing

<p class=""rws-nl-img""><a href=""https://www.yankodesign.com/2026/04/25/the-dog-bowl-designed-to-keep-your-pet-guessing/""><img alt=""Brown dog standing at a bright orange–green interactive puzzle feeder, eating kibble indoors."" class=""attachment-post-thumbnail size-post-thumbnail wp-post-image"" height=""960"" src=""https://www.yankodesign.com/images/design_news/2026/04/the-dog-bowl-designed-to-keep-your-pet-guessing/sloddy-01.jpg"" width=""1280"" /></a></p><h2 class=""rws-nl-title"" style=""text-align: center;"">The Dog Bowl Designed to Keep Your Pet Guessing</h2><div class=""rws-nl-excerpt"">Most slow feeders work exactly once. You put one down, your dog spends a week figuring it out, and then mealtime goes back to being...</div>",
rss,www.yankodesign.com,https://www.yankodesign.com/2026/04/25/the-whistler-home-that-looks-like-it-fell-from-the-mountain/?utm_source=rss&utm_medium=rss&utm_campaign=the-whistler-home-that-looks-like-it-fell-from-the-mountain,1777137634,The Whistler Home That Looks Like It Fell From the Mountain,"The Whistler Home That Looks Like It Fell From the Mountain

<p class=""rws-nl-img""><a href=""https://www.yankodesign.com/2026/04/25/the-whistler-home-that-looks-like-it-fell-from-the-mountain/""><img alt="""" class=""attachment-post-thumbnail size-post-thumbnail wp-post-image"" height=""960"" src=""https://www.yankodesign.com/images/design_news/2026/04/whistler-ski-retreat/whistler_ski_retreat_yanko_design_01.jpg"" width=""1280"" /></a></p><h2 class=""rws-nl-title"" style=""text-align: center;"">The Whistler Home That Looks Like It Fell From the Mountain</h2><div class=""rws-nl-excerpt"">There are mountain homes, and then there is the Hadaway House. Perched on a northwest-facing slope in Whistler&#8217;s exclusive Sunridge neighbourhood, this 4,497-square-foot residence by...</div>",
rss,www.archdaily.com,https://www.archdaily.com/1039270/unwhite-office-brenzo,1777201200,Unwhite Office / brenzo,"Unwhite Office / brenzo

<p>A 70 m² office within a new mixed-use building in <a href=""https://www.archdaily.com/tag/barcelona"">Barcelona</a> — a workspace conceived to be neutral, serene, and versatile.</p>",
rss,www.archdaily.com,https://www.archdaily.com/1040297/the-green-courtyard-house,1777194000,The Green Courtyard House,"The Green Courtyard House

<p>The house functions as a landscape formation that incorporates architectural forms to create a new experience in which landscape and architecture become a coherent whole. In other words, the site's natural topography is continued by the house.</p>",
rss,www.archdaily.com,https://www.archdaily.com/1040709/public-space-in-use-region-austral-and-the-architecture-of-everyday-life,1777188600,Public Space in Use: Región Austral and the Architecture of Everyday Life,"Public Space in Use: Región Austral and the Architecture of Everyday Life

<p>Architecture is often evaluated through what gets built. But in many cases, what matters happens after: how spaces are used, adapted, and made part of everyday life. For <a href=""https://www.archdaily.com/office/region-austral"" rel=""noopener"" target=""_blank"">Región Austral</a>, winner of ArchDaily's <a href=""https://www.archdaily.com/1033983/20-practices-shaping-the-future-of-architecture-winners-of-the-archdaily-2025-next-practices-awards"">2025 Next Practices Awards</a>, this is where design really begins. Working across many contexts, the practice approaches public space not as a single object, but as something that needs to be activated, negotiated, and sustained over time. Their projects focus less on defining form and more on creating the conditions for use, with design serving as the starting point.</p>",
rss,www.archdaily.com,https://www.archdaily.com/1040436/partizani-high-school-loft-architects,1777183200,Partizani High School / Loft Architects,"Partizani High School / Loft Architects

<p>The new project for the reconstruction of the ""Partizani"" school provides us with the opportunity to create an identity space in which, through the proposed architectural intervention, we not only aim to restore a variety of educational environments in collaboration with the surrounding environment, but we also hope that this intervention will create a dialogue with both the architectural context and its experience. Located in a dense urban location, where the facility is surrounded by large buildings of up to 13 stories, our proposal entails collaborating with the surrounding neighborhood and integrating the school into the local community. It is critical that the spaces we build, both inside and outdoors, are the most dynamic locations where creativity and healthy relationships are constantly evolving. Given the lack of vegetation in the surrounding region, we believe that the connection with nature is a crucial aspect that not only ties the building to the environment but also influences the increase of greenery in the surrounding area.</p>",
rss,www.archdaily.com,https://www.archdaily.com/1040871/samsung-library-no-3-supported-by-the-shaanxi-hope-project-wall-architects-of-xauat,1777168800,"Samsung Library No. 3, supported by the Shaanxi Hope Project / Wall Architects of XAUAT","Samsung Library No. 3, supported by the Shaanxi Hope Project / Wall Architects of XAUAT

<p>As part of the Samsung (China) Semiconductor Corporate Social Responsibility program, Yuan Architecture Studio has completed a series of three rural school libraries since 2020 at the foothills of the Qinling Mountains. The first, ""Zhongnan Book Pavilion"" (2021), revitalized its campus environment; the second, ""Qin Feng Book Pavilion"" (2023), created a shared space bridging school and village life. Through these projects, we recognized that rural construction requires a clear distinction between architect-controlled elements and open-ended components—inviting teachers and students to co-shape their environment. This approach aligns closely with N. John Habraken's concept of ""Open Building.""</p>",
rss,www.archdaily.com,https://www.archdaily.com/1040952/around-the-bend-nigel-grigg-architects,1777150800,Around the Bend / Nigel Grigg Architects,"Around the Bend / Nigel Grigg Architects

<p>Around the Bend is both an extension to a timber Edwardian house built in the early 1900's and a separate but attached newly built Studio Garage Apartment building at the rear of the property on an unusual triangular piece of land.</p>",
rss,www.archdaily.com,https://www.archdaily.com/1040550/joren-ji-ossuary-oooarchitecture,1777136400,Joren-ji Ossuary / OOOarchitecture,"Joren-ji Ossuary / OOOarchitecture

<p>As Japan's regional communities face population decline and changing burial customs, temples are increasingly required to rethink how spaces for remembrance are built and used. Joren-ji Ossuary replaces an aging reinforced-concrete structure with a new timber building made from locally sourced cedar, proposing a contemporary model for sacred architecture rooted in continuity rather than nostalgia.</p>",
rss,www.archdaily.com,https://www.archdaily.com/1040149/vlp-house-pascali-semerdjian-arquitetos,1777129200,VLP House / Pascali Semerdjian Arquitetos,"VLP House / Pascali Semerdjian Arquitetos

<p>The trapezoidal shape of the land, located in a vacation condominium near S&atilde;o Paulo, guided the formal decision of the Casa VLP floor plan. The residence features a traditional division between the social block and the intimate block, separated by a central circulation axis that begins at the entrance of the house. This entrance is marked by a wooden pergola, which indicates the path and invites the individual to enter.</p>",
rss,www.archdaily.com,https://www.archdaily.com/1040586/ecosysteme-d-snohetta-plus-santer-vanhoof,1777114800,Ecosystème D / Snøhetta + Santer Vanhoof,"Ecosystème D / Snøhetta + Santer Vanhoof

<p>Rooted in the port landscape of Dunkirk, Écosystème D is an energy-positive building designed to serve as a catalyst for energy transition. Dedicated to innovation in renewable energy, it brings together an incubator, a technology hall, a training center, and a showroom under one roof. The entire structure is part of a low-impact, bioclimatic architecture that embodies innovation. In constant interaction with its environment, the building represents a new urban and industrial dynamic for the Hauts-de-France region.</p>",
rss,www.archdaily.com,https://www.archdaily.com/1040384/casa-l5-pasqual-giner-arquitectura,1777107600,Casa L5 / Pasqual Giner Arquitectura,"Casa L5 / Pasqual Giner Arquitectura

<p>Pasqual Giner and Auñón Cabrera unveil Casa L5, a contemporary viewpoint overlooking the Mediterranean</p>",
rss,www.archdaily.com,https://www.archdaily.com/1040611/why-do-we-want-to-float-the-psychology-of-lightness-in-architecture,1777102200,Why Do We Want to Float? The Psychology of Lightness in Architecture,"Why Do We Want to Float? The Psychology of Lightness in Architecture

<p>In 1962, the architect <a href=""https://www.archdaily.com/office/buckminster-fuller"" rel=""noopener"" target=""_blank"">Buckminster Fuller</a> envisioned a floating city that would free humanity from its dependence on the Earth. The speculative project consisted of enormous <a href=""https://www.archdaily.com.br/br/904613/como-funcionam-as-estruturas-geodesicas"" rel=""noopener"" target=""_blank"">geodesic spheres</a> that would naturally <a href=""https://www.archdaily.com/893555/tensegrity-structures-what-they-are-and-what-they-can-be"" rel=""noopener"" target=""_blank"">levitate</a> in air warmed by the sun and be anchored to mountaintops. Designed to house thousands of people, <a href=""https://www.archdaily.com/792330/buckminster-fullers-daughter-shares-her-fathers-best-lessons"" rel=""noopener"" target=""_blank"">Fuller</a>’s <a href=""https://www.researchgate.net/figure/Buckminster-Fuller-Floating-Cloud-Structures-Cloud-Nine-1960_fig1_316624911?utm_medium=website&amp;utm_source=archdaily.com"" rel=""noopener"" target=""_blank""><em>Cloud Nine</em></a> aimed to ease land ownership pressures, address housing shortages, and contribute to environmental preservation.</p>",
rss,www.archdaily.com,https://www.archdaily.com/1040555/jonslunds-skola-d-office-arkitekter,1777096800,Jonslunds Skola / D Office arkitekter,"Jonslunds Skola / D Office arkitekter

<p>A rural school rooted in a thousand years of history - Set within a landscape inhabited for thousands of years, Jonslund skola transforms local history into a contemporary architectural identity.</p>",
rss,www.archdaily.com,https://www.archdaily.com/1040639/floating-kiosk-bufen-atelier,1777082400,floating kiosk / bufen atelier,"floating kiosk / bufen atelier

<p>Conceived as a temporary intervention within a context devoid of strong spatial references, the project presents itself as an enigmatic, almost extraterrestrial presence—an object whose origin appears indeterminate, as if it had descended abruptly into the urban fabric.</p>",
rss,www.archdaily.com,https://www.archdaily.com/1040896/o16-house,1777057200,O16 House / studiokian,"O16 House / studiokian

<p>Starting from a desire to blend a unique, tropical, and private sanctuary for a house, comes a dwelling that welcomes the user to indulge in natural elements, both man-made and contextual. O16 is located in a gateless complex with a corner site that overlooks a basketball park and the complex perimeter boundary. The house has a secluded feeling with views and a row of eternal greenery that is provided by the surroundings, thus making the 2nd floor of the house basically undisturbed in terms of views.</p>",
rss,www.archdaily.com,https://www.archdaily.com/1040424/mp-house-7nze-arquitetura,1777042800,MP House / 73.Onze Arquitetura,"MP House / 73.Onze Arquitetura

<p>Implanted in a residential condominium, this residence was designed as a vacation home for a family, with the possibility of seasonal rentals. The choice of materials enhances the natural and cultural characteristics of the region, using wood, a tile roof, rustic plaster, burnt cement, and eucalyptus pergolas, providing identity and integration with the surroundings.</p>",
rss,www.archdaily.com,https://www.archdaily.com/1039396/juan-francisco-casas-studio-positive-livings,1777032000,Juan Francisco Casas Studio  / Positive Livings,"Juan Francisco Casas Studio  / Positive Livings

<p>""Taking the chairs out to the street"" How many Dmes have our grandmothers reminded us that back in the village, every evening they would take their chairs out to the street and gather with the neighbors ""to catch the evening breeze""</p>",
rss,www.archdaily.com,https://www.archdaily.com/1040449/house-in-the-meadow-team-tonbo,1777024800,House in the Meadow / Team Tonbo,"House in the Meadow / Team Tonbo

<p>The starting point for the design was the site: a plot where farm sheds and stables once stood, with uninterrupted views over meadows and woodland. The clients are a couple without children and did not want a house larger than necessary. Their program consisted of three parts: living, sleeping, and eating.</p>",
