source,query,url,created_utc,title,text
youtube,interior design trends,https://www.youtube.com/watch?v=UQJXRNgvSHg,1779964525,Dieser INTERIOR-TRICK kennst du bestimmt nicht 😱❤ #interiordesign #homedecor #trends,Warum wirken manche Räume sofort harmonisch… und andere wie ein unangenehmes Familientreffen? Die Antwort ist oft ...
youtube,interior design trends,https://www.youtube.com/watch?v=31Gh6Q8AhKg,1779964209,The only Color aesthetics you need in 2026,"2026 interior color palette ideas featuring warm peach, soft ivory, earthy clay, muted sage & modern neutral tones for cozy luxury ..."
youtube,interior design trends,https://www.youtube.com/watch?v=VkiwV5dIbRo,1779964215,How to do Modular kitchen design !! #modularkitchen #kitchen #shorts #viral #kitchendreams,Ultimate modular kitchen design ideas Best modular kitchen design ideas Modular kitchen modular kitchen renovation ideas how ...
youtube,interior design trends,https://www.youtube.com/watch?v=lHwj4Ma4xWA,1779962867,2026 Interior Design &amp; Kitchen Trends | Blum Trend Report 2026  #blumindia #blumhardware,"Want a closer look at the future of global furniture design? In this video, we share an exclusive look at the biggest design shifts, ..."
youtube,interior design trends,https://www.youtube.com/watch?v=C4cmnUy_utE,1779960630,Elegant Kitchen Interior Ideas: 9 Ways to Update Your Kitchen #brajeshwariinteriors,9 Ways to Update Your Kitchen | Modern Kitchen Design Inspiration Are you planning to remodel or refresh your kitchen?
youtube,interior design trends,https://www.youtube.com/watch?v=W-r87sNrjws,1779958816,This Wall Panel Will Elevate Your Entire Room! ✨#InteriorDesign #LuxuryHome #WallPanels,Looking for a way to add instant luxury to your space? Watch how this textured charcoal wall panel transforms a plain wall into a ...
youtube,interior design trends,https://www.youtube.com/watch?v=TR8T4lWlp3c,1779957031,InteriorDesignTrends#LuxuryHomeDecor#FihanQurise#AdhunikPVC#HomeRenovationIdeas,assalamualaikum main fihan qurise from prayagraj short video PVC panal kaam karte hai kya aap logo ko kaam karwana chahte ...
youtube,interior design trends,https://www.youtube.com/watch?v=YLN9ZH1hAmM,1779954979,Luxury Interior Design Ideas For Your Home | Interior Design Trends You Need To Know #interiordesign,Design. Comfort. Elegance. ✨ By Luxurious Interior Firm in Mumbai. . . +91 9930415936 https://esquareinteriors.in/ . . (interior ...
youtube,interior design trends,https://www.youtube.com/watch?v=ywmVog_wqkc,1779938421,घर के लिए सबसे सुंदर मंदिर 😍 #shorts #45profile #homedecor #love #interior444 #interiormaster #home,itchen sliding door #interiormaster​ #glasspartition​ #interior444​ #homedecor​ Whether you're building a new kitchen or ...
youtube,interior design trends,https://www.youtube.com/watch?v=dYd0Owc49Ds,1779938148,3D-Printed PETG Side Table: The Future of Minimalist Home Design,Discover the perfect blend of cutting-edge 3D printing technology and minimalist design with the PETG Side Table from ...
youtube,interior design trends,https://www.youtube.com/watch?v=INDfrsYuqc8,1779935390,modern muslim home design#viral #viralvideo #foryou #trending #shorts #short #shortvideo #home,modern muslim home design#viral #viralvideo #foryou #trending #shorts #short #shortvideo #homemuslim home interior home ...
youtube,interior design trends,https://www.youtube.com/watch?v=mqjWktOY9yU,1779926421,Four Styles One Cohesive Micro Loft,"A quick deep-dive into blending minimalist, modern, classic, and industrial room design. Practical layout moves unlock both ..."
youtube,interior design trends,https://www.youtube.com/watch?v=YjZRCgJV9vA,1779925159,BEST Luxury Interior Design Trends Taking Over 2026 | Kips Bay Show House Tour,
youtube,interior design trends,https://www.youtube.com/watch?v=aAJMmFO_c6w,1779922822,Home Interior Design for Your Peaceful Mind | Interior Design Ideas,"Welcome to Blockchain Interior Studio – Your Ultimate Destination for Interior Design, Home Decor, and Styling Inspiration!"
youtube,interior design trends,https://www.youtube.com/watch?v=3paNN4oeegA,1779915602,Lighting &amp; Design Trends: Smart or Risky?,"Thinking about updating your home with the latest interior design and lighting trends? Before you start renovating, there's one ..."
youtube,interior design trends,https://www.youtube.com/watch?v=8xqcqGiLoqY,1779902533,Apartamento pequeno dicas de decoração e bem-estar em 2026,Decorar um apartamento pequeno para um verdadeiro santuário emocional não depende apenas de metragem — depende de ...
youtube,interior design trends,https://www.youtube.com/watch?v=XqbsUo8Flx0,1779902270,Balcony Mistake 🔥😱🔥😱🔥#interior #interiordesign #viral #video #shorts #short #reels #youtube #yt,"interior design,home decor,modern home design,interior trends 2025,luxury interiors,small space ideas,living room design ..."
youtube,interior design trends,https://www.youtube.com/watch?v=O4uCkD07vCc,1779901564,Would you rather..? 🤔 Interior design edition #interiordesign #transformyourhome #homedesign #home,"When it comes to your forever home, every decision matters   Natural stone or man-made? Cool tones or warm tones? Hiring a ..."
youtube,interior design trends,https://www.youtube.com/watch?v=Y7Z7MDNKxSc,1779901223,Earthy Luxury Living Room Ideas 2026 🤎 Modern Elegant Interior Design Trends,"Discover breathtaking earthy luxury living room ideas blending modern elegance, warm textures, natural materials, and timeless ..."
youtube,interior design trends,https://www.youtube.com/watch?v=UaHgrysxF7U,1779898453,Luxury House || #interiordesign #home,Luxury House || #interiordesign #home Your Queries :- Home Design New Home Home Decor Interior Design Home Makeover ...
youtube,interior design trends,https://www.youtube.com/watch?v=r_sDBjUc2sw,1779898014,Modular kitchen Interior Design |  Beautiful Kitchen #shortsfeed #kitchen #modularkitchen #home,Modular kitchen Interior Design | Beautiful Kitchen #shortsfeed #kitchen #modularkitchen #home #ModularKitchen ...
youtube,interior design trends,https://www.youtube.com/watch?v=e4XJrAowszg,1779897609,What are the home design trends in 2026?,What are the home design trends we're seeing in 2026? Some home features that felt fresh just a few years ago are now sending ...
youtube,interior design trends,https://www.youtube.com/watch?v=lHEiQvkTjyI,1779897636,Milan 2026: Main Bathroom Design Trends at Salone del Mobile,"In this video, we explore the latest innovations and key design trends for bathrooms presented at the major design industry events ..."
youtube,interior design trends,https://www.youtube.com/watch?v=WqUSt45Kwh8,1779895834,Luxury Interior Tour”#shorts #youtube #youtubeshorts #shortvideo #shortsviral #shortsfeed #subscribe,Luxury Interior Tour”#shorts #youtube #youtubeshorts #shortvideo #shortsviral #shortsfeed #subscribe ✨ Interior Design Ideas for ...
youtube,interior design trends,https://www.youtube.com/watch?v=FQLgp8-9Dis,1779894918,Home Decor 2026 TRENDS #homedecor #interiordesign #shorts #viral #trending #fyp,
youtube,home decor ideas,https://www.youtube.com/watch?v=xuWromgTZck,1779957564,Stylish⚜️Home Decor Ideas Under Budget 💯Life-Changing Amazon Finds &amp; Hacks For Cozy &amp; Aesthetic Home,Product Buying links ✓Master Buying links https://amzn.urlgeni.us/https://amzn.to/4wUJjcU #amazonfinds #amazonhomefinds ...
youtube,home decor ideas,https://www.youtube.com/watch?v=EMjeYJQCJyg,1779951943,Home Decoration Wholesale Market | Home Decor Gift Items Metal Art Water Fountain Home Decor Market,Home Decoration Wholesale Market | Home Decor Gift Items Metal Art Water Fountain Home Decor Market Dosto aaj aye hai ...
youtube,home decor ideas,https://www.youtube.com/watch?v=yakKBgGVEik,1779922815,New Furniture | Cozy styling | decor ideas #collabtribesigns #homedecor ,"https://tribesigns.com/ Today's video ~ collab is sponsored by Tribesigns. I will be presenting a new, beautiful furniture item."
youtube,small apartment decor,https://www.youtube.com/watch?v=N7Hyam4nd5w,1779961532,Small Apartment Animation  Modern Interior  #3d #architecture #lumion #interiordesign   Nuno Silva 1,"Watch this space go from empty to stunning ✨ Every detail was carefully designed to bring out a modern, luxury feel. Would you ..."
youtube,small apartment decor,https://www.youtube.com/watch?v=ugTKIYy0DwA,1779958951,Amazing small apartment kitchen designs – the details are all here! #kitchendesign #renovation,
youtube,small apartment decor,https://www.youtube.com/watch?v=lxLpBjVnXHo,1779952957,Από “παλιό διαμέρισμα” σε μικρό διαμαντάκι ✨🏡,"Από “παλιό διαμέρισμα” σε μικρό διαμαντάκι ✨   Ολική μεταμόρφωση με νέες ηλεκτρολογικές εγκαταστάσεις, φρεσκαρισμένους ..."
youtube,small apartment decor,https://www.youtube.com/watch?v=f39dM5pBE1Q,1779952321,Luxury gamer room. #gemers #room #gamerroom  I057,"Welcome to Wibeon – your source for interior design inspiration and home transformation ideas. In this channel, we explore ..."
youtube,small apartment decor,https://www.youtube.com/watch?v=IYdU9Fd-TSs,1779950894,7 Vertical Storage Hacks That Transform Tiny Apartments 🏠 #homeorganization #home #storagesolutions,Small space? Big storage needs? Discover 7 vertical storage solutions that maximize every wall in your tiny apartment.
youtube,small apartment decor,https://www.youtube.com/watch?v=JztR_60-UIU,1779948665,5 Game Changing Furniture Ideas for Small Apartments 🏠 #homeorganization #home #storagesolutions,Small space? Big dreams? Discover 5 multifunctional furniture pieces that save space and look amazing in your apartment.
youtube,small apartment decor,https://www.youtube.com/watch?v=wjqeaElD4Sg,1779948034,8 Clever Melbourne Small Apartments Under 60sqm/646sqft,"Issue 7 of NTS Magazine has landed — discover small-space-friendly textile furniture, joy-sparking colourscapes, beautifully ..."
youtube,small apartment decor,https://www.youtube.com/watch?v=6APChtkzhRQ,1779944448,Small Room Project na may Tamang Furniture and Placement!,
youtube,small apartment decor,https://www.youtube.com/watch?v=8hOQAKT--Ao,1779942194,Small Apartment | Stylish Living Room Sofa Bed#home #sofacover #homedesign #sofa #sofabed,
youtube,small apartment decor,https://www.youtube.com/watch?v=8I9EvsRy0lo,1779938455,Best Tiny Apartment Decor Ideas for a Clean Minimal Home,Transform your tiny apartment into a clean and beautiful minimal home with these inspiring decor ideas from Vinza Studio ✨ In ...
youtube,small apartment decor,https://www.youtube.com/watch?v=2e2XcTho2Es,1779935185,POV: I finally found a bookshelf that fits all my books 📚✨,No more book piles on the floor This vertical bookshelf turned one tiny corner into my dream reading nook while saving so ...
youtube,small apartment decor,https://www.youtube.com/watch?v=GUS3GYREyS8,1779934683,#smartfurniture #home #sofa #ikea #homedecor #furniture #interiordesign #smallapartment,
youtube,small apartment decor,https://www.youtube.com/watch?v=2COES8AI_8M,1779934365,#furniture #smallapartmentdesign #design #interiordesign #homedecor #smartfurniture #office,
youtube,small apartment decor,https://www.youtube.com/watch?v=yGQ2RYfN6gI,1779930786,Perfect for small spaces — a stylish sofa and bed in one! #tiaro #home   #homedecor #furniture #sofa,"A must-have for small apartments｜This multifunctional elm wood Luohan bed is simply irresistible! ☀️ By day, it works as a ..."
youtube,small apartment decor,https://www.youtube.com/watch?v=peMY2AhLngI,1779926407,The Suburban Studio Sprint A Quiet Arena of Home Mastery,"A fresh take on turning everyday chores into a grand, Olympic style showcase. It follows a tiny team as they elevate domestic tasks ..."
youtube,small apartment decor,https://www.youtube.com/watch?v=R2x7LJEbu7c,1779926412,Solar-Smart Living Secrets for Small Apartments,"Five practical life hacks tailored for tiny urban spaces, focusing on lighting, airflow, heat control, and mood-boosting greenery."
youtube,small apartment decor,https://www.youtube.com/watch?v=fm65B882B9c,1779926428,Corner to Catalyst: A Compact Nook Organization Tale,"Watch a tiny apartment corner transform into a functional micro-hub. Practical steps, visuals, and a story of decluttering in action."
youtube,small apartment decor,https://www.youtube.com/watch?v=7fPleORESgU,1779923269,The perfect tree for small apartments 🥹,The perfect tree for small apartments.
youtube,small apartment decor,https://www.youtube.com/watch?v=m4cj3FRqM6Y,1779919919,Watch This Side Table Become 4 STOOLS! 🤯 USA Apartment Thing You NEED,Hosting unexpected guests just got easier with this magical 4-in-1 side table that hides 4 individual stools inside!
youtube,small apartment decor,https://www.youtube.com/watch?v=5z0BlkOWhsg,1779919775,POV: Your Studio Apartment Has a Couch AND Bed Now ✨🛋️ USA Renters Love This,Transform your living space with this dual-purpose sofa bed designed to function as a stylish couch AND a comfortable bed — all ...
youtube,small apartment decor,https://www.youtube.com/watch?v=W_8qwLmklO0,1779916964,Tiny Studio Apartment Turned Into Luxury Space,This tiny studio apartment turned into a luxury smart living space. Watch this satisfying AI renovation transformation as a small ...
youtube,small apartment decor,https://www.youtube.com/watch?v=MbiLuSARqBU,1779901106,"Вариант планировки узкой, маленькой комнаты. #дизайнинтерьера #планировка #ремонт","Продолжаем разбирать планировки маленьких комнат Сегодня — узкая комната, которую многие называют «вагоном»."
youtube,small apartment decor,https://www.youtube.com/watch?v=BzpKyem_4oc,1779899802,have you ever see the smart furniture for your small apartment #smartfurniture #smarthome #interior,
youtube,small apartment decor,https://www.youtube.com/watch?v=nYZlggt4rJY,1779897999,#interiordesign #smallapartmentideas #furniture #smartfurniture #chair #home,
youtube,small apartment decor,https://www.youtube.com/watch?v=aoIpBsfzES8,1779897633,Small Apartment Studio Renovation  #SmallSpace #Renovation #TimeLapse,"Watch a small apartment studio transform into a smart, stylish living space in this satisfying time-lapse. From compact and empty to ..."
