source,domain,url,created_utc,title,text,query
gnews,news.google.com,https://news.google.com/rss/articles/CBMiqAFBVV95cUxQZTVCaXdMY2prOEM4c18yakcyYkRhRGF0Y1FpVmRpUWdJeGVoVXY2ZHZHZEpWX3FIbFY2cHEyOS0yV0p6OGg2SzRHV1NSRUxBNTFJTVRKelM3NHI5RUZVN3dFWnhveExLdjdTVlhyQ0JJV0RWTWRjSmdGejNBUkZmc2h2SVAyeHhEMXZPc2xtR0dOYlRJM1ZvcXNPdGo3NzBLM3BXMWxNckI?oc=5,1776808800,Interior Designer Nate Berkus Says Stop Buying Trends—These Are the 5 Home Pieces Worth Investing In - E! Online,Interior Designer Nate Berkus Says Stop Buying Trends—These Are the 5 Home Pieces Worth Investing In - E! Online,home decor trend
gnews,news.google.com,https://news.google.com/rss/articles/CBMipgFBVV95cUxNUGc5NlBVQjdOMGsxWDBzTDcyTlpobzAweHc5RVNna0IySmFtdzJydzZMTHdfS3R5clZaMlRWWUFHeW42Y21FYnlQRkd4OW5TV1VBMUU4bFJKSmlxa2ZkU3hpY3FXc1drNmJSVGdDcktURWFJSGJ6RWhGeVpqMmtXWmhpbnRyVno0OVRPZnRtN2FUdGRhWENuWVEtNXB2Yk1DMnRSVjVn?oc=5,1776697439,"This Handmade, Collected Decorating Trend Is Everywhere in 2026—Meet “Folklectic” - Country Living Magazine","This Handmade, Collected Decorating Trend Is Everywhere in 2026—Meet “Folklectic” - Country Living Magazine",home decor trend
gnews,news.google.com,https://news.google.com/rss/articles/CBMickFVX3lxTFBCU3dCTXJCYVBodHFGMTJVd2VuT19LTHFOaWJzZ01ONGxhMkpOOUZaU0ltbjd6UDdjcXdjMzNId1lHX1Y0emFtVnlsVnNaN0VJc1ZuVDVRYWI2aHZianNhdXQxYTZrTDZYMkhjVExYczJ5UQ?oc=5,1775843080,8 Home Decor Trends Designers Secretly Hate—And Some Might Surprise You - AOL.com,8 Home Decor Trends Designers Secretly Hate—And Some Might Surprise You - AOL.com,home decor trend
gnews,news.google.com,https://news.google.com/rss/articles/CBMid0FVX3lxTE5uWmthZFA3T0xYNHhubXkwTngtRnM0WGJlSGJhT25xc0tJa0xQMkdyM0JJbjItVlU2MGpzME1kcVFYdWRFM0YtS1huZndmZHZNRmNjc0xSN0RiYmpGNTNWbjJfSk04TDRoeVJqZ1Bva3VwdjNFRWFz?oc=5,1775977200,Designers Regretted Following These 3 Design Trends—What They Wish They'd Done Instead - The Spruce,Designers Regretted Following These 3 Design Trends—What They Wish They'd Done Instead - The Spruce,home decor trend
gnews,news.google.com,https://news.google.com/rss/articles/CBMihAFBVV95cUxOTzNHVVkwa0ctZGNZWHZSS0tVeHlnZ1dDcXNkZlFRTjBPSk85VUl3eUZZWG5oUmlSbHNNSVQ1a3lCSno1eHZieUpJYXo2S3dtWEUwS2E0R0p6cDVLZWN6LTRfM1NEcnVjYWVHcjA2bGJiellOVXd6WnpOSnhrS2dVZC00bzY?oc=5,1773558000,9 Decorating Trends We’re Glad Are Gone - Southern Living,9 Decorating Trends We’re Glad Are Gone - Southern Living,home decor trend
gnews,news.google.com,https://news.google.com/rss/articles/CBMiiwFBVV95cUxPZnhRemxodXZBSmpiSDEwTE5weWlVMDVNN0tLVWFHV2tHWUJlbW1OeHZRZlNsODhYUVp5TjN1TVF1SkFaaVA3bUd0Q0g3ZGVDTUVHQkN5eXI2NnVXQUxRLW9samtMQ1ZwUkgzazJLbDFDUXJHTUtnZDJaUXR2XzZpZFUxazR1TWxwb09J?oc=5,1774594800,6 Outdated Interior Design Trends—And 6 That Are Making A Comeback - Southern Living,6 Outdated Interior Design Trends—And 6 That Are Making A Comeback - Southern Living,home decor trend
gnews,news.google.com,https://news.google.com/rss/articles/CBMihgFBVV95cUxOdjZtWlo1U19OWWlMZVZ0ekJMR2kway05R0hCV2FBRjFIMy1zWlc0ZmNiWGN0TzJQQ2U0by11akhxWmJaM05rUlZjc3JoLUcyQ0VXcmdiYks0TlBqOV9MZnRTdVI2d0d3Z0dsLWQ0OHpCUDB0OHZCc2VhV2ZwSUVGd2doM3hTdw?oc=5,1774249200,6 Outdated Decor Items Designers Are Begging You to Replace in 2026 - The Spruce,6 Outdated Decor Items Designers Are Begging You to Replace in 2026 - The Spruce,home decor trend
gnews,news.google.com,https://news.google.com/rss/articles/CBMidkFVX3lxTE4wdEFwU0FRbEJpdkxXNFR3eF9xWlNacWlSQkMxdGltS0pFbTl1aEJndXpKWVcxdExIZnJaMjltT3QyRkRvaDVucXlsNUNsQ2tuRVNhZnA2VGtZOFpMWXZRZG54NXZmbjZmTi1VcVN4YmoxSXM2Umc?oc=5,1773558000,10 Decorating Choices That Instantly Make A Home Look Dated - Southern Living,10 Decorating Choices That Instantly Make A Home Look Dated - Southern Living,home decor trend
gnews,news.google.com,https://news.google.com/rss/articles/CBMipAFBVV95cUxNVHZqa2FLZURQbjlUazRfaTZMaWdTNHpfczFoMkM5UHhra0JqVWo1UFRvVG5PSmMwTGp1T3JmRnFDbFh1TkFTS1hKdVhfUThmRFBkWDZDSkFtNngtOHRSZ2JfcDRmZERLUW00UFpQUXV6clNhV0JhbGt1T1NmTjQ5V2tvcVAzSHBVeVU3ZUlaMjZCa0dSZWZWQ05haTc1dmFIZnY0ag?oc=5,1773471600,"14 Home Decor Trends You'll See This Year, According To An Interior Designer - Southern Living","14 Home Decor Trends You'll See This Year, According To An Interior Designer - Southern Living",home decor trend
gnews,news.google.com,https://news.google.com/rss/articles/CBMijwFBVV95cUxQbURSMXljeXl1d0huSldYYjBVbnJMR0pVZF9EbVh0dVVZVU1vMzFtcV9SWjJpQmRFQmNTYXpvVGFYdUpIN1Z3T3hvdlN6dmhsR1JWcEprTEU4d3lCaEVVeXBHcEpuV2doRmVObjlNRzlUdTBCbXlUZFJZSGJMRnhYVW4yTDFQM2std1FJMnNnQQ?oc=5,1776754800,Experts Say These Are the Most Valuable Antiques to Look for in 2026 - House Beautiful,Experts Say These Are the Most Valuable Antiques to Look for in 2026 - House Beautiful,home decor trend
gnews,news.google.com,https://news.google.com/rss/articles/CBMiigFBVV95cUxPbkJsa0FGb0V0blczMVNBaFFMZjlPX25FWk1IMVpLTF9vdjZPTWNMMXZaNkpKenA3aGxTcWFyRDZYemo0aUphZzNob1dPSkc2UnZiYl9OOEtWNm1hRmRaNXJ1a3BIZmluMmVEN1d0S1FGZzI4bF8xeENtQm9yZGdIOHczMjB2R3RRdWc?oc=5,1773903600,Designers Say These ’80s Decor Trends Are Making a Stylish Comeback - Good Housekeeping,Designers Say These ’80s Decor Trends Are Making a Stylish Comeback - Good Housekeeping,home decor trend
gnews,news.google.com,https://news.google.com/rss/articles/CBMidEFVX3lxTE1ZZXhYYVNyN05Bc3R3dGpnTlhSWHREZUs2cUI0SEJock92bXd6eEstMFRscDNmQWRRbmRpTFg2MDZBSWg3dFVIWkdLLVpRNHVGRnVCVm9vSFEwZzBOb2FDa0VCazg5UWtlV09ybEVlNGdONUJt?oc=5,1775026800,The 'Found Luxury' Trend Is Replacing Quiet Luxury - Homes and Gardens,The 'Found Luxury' Trend Is Replacing Quiet Luxury - Homes and Gardens,home decor trend
gnews,news.google.com,https://news.google.com/rss/articles/CBMia0FVX3lxTFBhNEwtTzVyTUpicmYtMlBfV3dlQWJyUV9aMlhHcVROOVpISE9heFM1bVpiRGlKZnJTcjY2NWNWQ29qaldoQVM4NzR3d3BmX3NQSXFwc2RSRGRodUQ4NnF2UGtQeGw1TWR5LU1r?oc=5,1776236400,"The Y2K Teen Bedroom Is Back, Baby - Popsugar","The Y2K Teen Bedroom Is Back, Baby - Popsugar",home decor trend
gnews,news.google.com,https://news.google.com/rss/articles/CBMifEFVX3lxTFBERG5TN05TbUtsZXhrYWJDckI1RkpyV3MyZV9mWnhTX2poV3NKOTJURUR2VThMYXlVam56M2xNeTZfbW5fUHBkZXB0ZEJ3T1UtM3IzYjlOOHo0ZDlCYW5KQUtnUnZiN3U3RFhzN2FZbW9SbVZSNG9YUnVVdjg?oc=5,1773730800,"5 Home Design Trends That Will Be Everywhere This Spring, Pinterest Predicts - marthastewart.com","5 Home Design Trends That Will Be Everywhere This Spring, Pinterest Predicts - marthastewart.com",home decor trend
gnews,news.google.com,https://news.google.com/rss/articles/CBMitwFBVV95cUxNYzdfMlNoYlZBR2tRdVdBdDN3LW5sNlM0WTdac1B5cnFPNjRoZERyaVNfLVNBQ2RtYTNKWVdXSlBOVVJ4ZjdVWUd6Y05qXzlEeGpIMC0wQkFpeUdVMzY3cFBFYnRzaFNWX1hNejhBSTNjRk9nWGNuX0Q3c2FBWnQyZDAzVnJGZXdHSWJqYVFLdTUwWHFkNHUxUms5TzZ6VXJXTjRQUTZZejFNSk96RlVWSzRBUTVubFE?oc=5,1777072202,"Our House Manual Launches Free Practical Guides for Budget-Friendly Home Decor, DIY Tips, and Eco-Living Hacks for U.S. Consumers - Carroll County Mirror-Democrat","Our House Manual Launches Free Practical Guides for Budget-Friendly Home Decor, DIY Tips, and Eco-Living Hacks for U.S. Consumers - Carroll County Mirror-Democrat",small apartment decor
gnews,news.google.com,https://news.google.com/rss/articles/CBMiugFBVV95cUxNMUY0NG9wT2huenhYeGRRVzE1MWNReHd2cTdZNENuN0lXQ3dwS2dmREt1RGVJYTFsdVUyQ3BYSGZ1LXpvbWI2cXZESkZJallROGR1Mm9QY20tSS1NVmlmSjVoM1BTZUtRU1p1UWVKZmswZGpIRURnVGc5QTFtX25VY0VnM2NxeGlGMzR6ZFFQOEx5LVpUMkpqMWRqMFNJTnRUM2hrLWt0VGRtR1pkeUdmancxNy1XdEhza3c?oc=5,1776236400,A Design Editor Applies Color and Restraint in His Madrid Apartment - The New York Times,A Design Editor Applies Color and Restraint in His Madrid Apartment - The New York Times,small apartment decor
gnews,news.google.com,https://news.google.com/rss/articles/CBMic0FVX3lxTE5obXpWb2hydm1tdVp0Q1lZUzNWMGQ3SWhTbDhEbGFKUUxNWm5PdkRPMktyYnk1cmIyektLRTgxb1ZPQ05nbHlvb3FJamFFREoteEw2OXItOFhmVEdBNUItNVFJci1EUHhjT1FhbnJQYUt3Qk0?oc=5,1776668400,"8 Calming Paint Colors Designers Use to Create a Warm, Welcoming Living Room - Real Simple","8 Calming Paint Colors Designers Use to Create a Warm, Welcoming Living Room - Real Simple",small apartment decor
gnews,news.google.com,https://news.google.com/rss/articles/CBMidEFVX3lxTE0tX3hmcmROaWY1eUZ1bURnQTR4R2ktbktpNVpYNnhZR1V1Z3BfaWxVZ0VZWjRNMTl1eTl4M3Q2MXJYNXFITHFaSFFKTU5OVDNSR2hrV093WnRkY2l2SGQ1cFlmN2ZuZXE3eTZfU1ZOeFluWjNP?oc=5,1775545200,33 Small Laundry Room Ideas for the Tiniest of Spaces - Architectural Digest,33 Small Laundry Room Ideas for the Tiniest of Spaces - Architectural Digest,small apartment decor
gnews,news.google.com,https://news.google.com/rss/articles/CBMif0FVX3lxTE91b1NXSi04LXdJaVdOYnJUWEFnZ3pMNTZ5OUR2d2ctYXlvZkM4V2RyeUQ2aV9FQlV2UF9oaEVIbFBvSnZOUHlRVlBkWmxzdEl5c0owZmlqZ0pOZldpOUdnR1JYaTZyTDV1dHJ1YTNkb3FvWnh5OTR1VUpLekRGNWc?oc=5,1773990000,Designers Say These Under $30 Upgrades Make Any Small Apartment Feel Instantly Welcoming - The Spruce,Designers Say These Under $30 Upgrades Make Any Small Apartment Feel Instantly Welcoming - The Spruce,small apartment decor
gnews,news.google.com,https://news.google.com/rss/articles/CBMid0FVX3lxTE1ieVd2bTc0YnY5SjVGaVNJMEdqWVRBYXZpaV9Cb2QxZmRJUzNTUWZjOGN4TDBfZmdWU0VpREVoeWphNmtmSFhsNHFMX1RsdG0yS1VZNzFhb2VLdDU4bDB1S3prc1FaQWc3eEh2S2NncWUwM2hRQ2pn?oc=5,1773644400,These 72 Small Kitchens Expertly Reinvent Cramped Spaces - Apartment Therapy,These 72 Small Kitchens Expertly Reinvent Cramped Spaces - Apartment Therapy,small apartment decor
gnews,news.google.com,https://news.google.com/rss/articles/CBMiZkFVX3lxTE5Fa2ZDa3FhcWhRMUFUVTFjWUFRbkRsWFZpN2txY1NubXowLUlWMkI5U094TzlHXzRZeHR3OEEySVNvVWh4UXdZMmxyeGd6Ymdlcm5hQUVtWHZxdkxzaDJGb2VjWmZYZw?oc=5,1776719374,7 Genius Patio Ideas That Do So Much More Than Just Seating (All in Time for Summer!) - Apartment Therapy,7 Genius Patio Ideas That Do So Much More Than Just Seating (All in Time for Summer!) - Apartment Therapy,small apartment decor
gnews,news.google.com,https://news.google.com/rss/articles/CBMigwFBVV95cUxOR0x2dzlBV0Uxa0xzcHBjSkRzaFlvaUIxTTVzS1VhSjFZbXBhY3dhaUJzemFnT1dxa0dMZGlVWHFoXzBCYzMzZHFvQ2hYRmlsQ3VqQTZkZXdfZnk4cHhGVDZ6aC1TMHppX3h4a0dCSGZMbjBJQlF3TmgyTnhFSDE5b05IWQ?oc=5,1774335600,This “Gorgeous” Velvet Loveseat Looks 3x the Price — but It’s More Than 25% Today! - Apartment Therapy,This “Gorgeous” Velvet Loveseat Looks 3x the Price — but It’s More Than 25% Today! - Apartment Therapy,small apartment decor
gnews,news.google.com,https://news.google.com/rss/articles/CBMia0FVX3lxTE5XQVpSRHNudWR3cXpMUzJLamc0RnlSNzI1QWRDY2JrRzJVdllLWmM5MHIzTkx6dkhRbDE3UlN3d1Q4Y2pBb0h1a244V0VaVm9TZTZ2MzdnWGoydlI1Q0E5SUNBWEV5MV84MFNJ?oc=5,1774162800,27 Tiny Living Room Ideas for 2026 The Smart Styling Moves Tight Spaces Depend On - TheCoolist,27 Tiny Living Room Ideas for 2026 The Smart Styling Moves Tight Spaces Depend On - TheCoolist,small apartment decor
gnews,news.google.com,https://news.google.com/rss/articles/CBMikwFBVV95cUxQZEtlS2k4b0pDMlhScXFqX0h2aGZMX3dVa3QzZUc4SGJReVJZd0h6bjJPR3M1a2RBVjlEbHNWSzVGa3BjcURhZmtHTUU5TFA0NjZLcVczRUlFNXdnd2MtTFRKQWRjTVRQUG50OWREYTlKMU8zbUFBYkVXZDBJWno5ZnpVdk5WNnZJNnFNLU1hcEFhSlk?oc=5,1773558000,"28 Guest Bedroom Ideas for a Cozy, Inviting Space - Real Simple","28 Guest Bedroom Ideas for a Cozy, Inviting Space - Real Simple",small apartment decor
youtube,,https://www.youtube.com/watch?v=_iHexdHrlPs,1777219800,Room Wallpaper Design 2026 😍 | Bedroom Makeover Ideas | Latest Wall Decoration Trends #shorts,Room Wallpaper Design 2026 | Bedroom Makeover Ideas | Latest Wall Decoration Trends #shortsvideo #wallpaperinterior ...,interior design trends
youtube,,https://www.youtube.com/watch?v=ma3-l-FQGKc,1777219272,Why Your Bedroom Feels Tiring AI Found the Reason  #SleepHacks #AIInsights #InteriorDesignTrends,s your bedroom actually draining your energy? We used AI to analyze the hidden factors that make your space feel exhausting ...,interior design trends
youtube,,https://www.youtube.com/watch?v=axuxe5W4j84,1777217582,2026 Design Trends Are Bringing Back Dark Drama #interiordesign #opulentinteriors #luxuryinteriors,Hallways and corridors in our projects are never just passageways. They are the first scenes where a house introduces itself.,interior design trends
youtube,,https://www.youtube.com/watch?v=AtW4hRX_gU0,1777216148,"cozy dining room design ideas 🍽️✨Simple, modern &amp; aesthetic home transformation! #home","Welcome to the future of interior design — where creativity meets technology, and everyday spaces transform into cinematic ...",interior design trends
youtube,,https://www.youtube.com/watch?v=UJLaqib7iF8,1777212051,Top Kitchen Design Trends | Modern Elegant Interiors,Top Kitchen Design Trends | Modern Elegant Interiors Discover the latest modular kitchen designs 2026 featuring modern color ...,interior design trends
youtube,,https://www.youtube.com/watch?v=FDphccBAhL8,1777208420,Interior Design Trends to AVOID in 2026,Not every trend deserves a place in your home. Some of the biggest interior design trends of recent years are already feeling ...,interior design trends
youtube,,https://www.youtube.com/watch?v=LsLb4KE-ryw,1777208383,This Floor Looks Like Liquid Marble 😳 (Insane Transformation) #epoxyfloor #viral #shots #satisfying,"What if a floor could look deeper than marble… and more alive? In this cinematic transformation, we take a rough concrete base ...",interior design trends
youtube,,https://www.youtube.com/watch?v=u4e0ZKy50O0,1777206744,Wooden Flooring 🔥👌🔥👌🔥#interior #interiordesign #viral #video #shorts #short #reels #youtube #yt,"interior design,home decor,modern home design,interior trends 2025,luxury interiors,small space ideas,living room design ...",interior design trends
youtube,,https://www.youtube.com/watch?v=N0A1wekSP9E,1777204002,Latest Bedroom Interior Design Trends 2026 | Affordable Design Packages | Call Nuvio: 9836666625,Experience Modern Luxury in Kolkata! 🏙️✨ Join us for a complete walkthrough of our latest 3BHK interior project in Kolkata.,interior design trends
youtube,,https://www.youtube.com/watch?v=ZGVXXmYBPMs,1777203023,Luxury Epoxy Floor Design in USA Homes | Modern Interior Trends 2026#viraldesign #epoxy #epoxyresin,Epoxy resin art is a modern and highly creative form of artwork that uses a special clear liquid material called epoxy resin to create ...,interior design trends
youtube,,https://www.youtube.com/watch?v=WFLGPO7oDs0,1777195355,Stop Using Boring Colors! 🚫 Luxury Home Paint Trends 2026 ✨ #colorconcept #dramaticinteriors,"Are you still using the same old ""builder beige""? It's time for an upgrade! ✨ In this video, we're showcasing the top luxury paint ...",interior design trends
youtube,,https://www.youtube.com/watch?v=qdh91zuMM8g,1777191695,&quot;decoration ideas for home&quot; &quot;living room interior design&quot;,decoration ideas for home #homedecor #InteriorDesign #RoomMakeover #CushionCovers #HomeDecorIdeas #InteriorStyling ...,interior design trends
youtube,,https://www.youtube.com/watch?v=Geu5gDuO8Xw,1777187903,#HomeDecor2026 #InteriorDesignTrends #LuxuryLiving #WallDecor #ModernHome #DecorInspiration #home,,interior design trends
youtube,,https://www.youtube.com/watch?v=S6N6PJzVQjA,1777187401,Luxury Living Area #design #designtrends #luxury #architecture #interiordesign,moderndecor #architecturedesign #modernhome #diy #room #home #decor #homeinterior #homerenovationideas #designtrends ...,interior design trends
youtube,,https://www.youtube.com/watch?v=a9ZvsIQ3b10,1777177800,Home @designmaster96 #HomeInterior #InteriorDesign #HomeDecor #DecorIdeas #ModernHome #DesignTrends,,interior design trends
youtube,,https://www.youtube.com/watch?v=Vj4T5Grgp8A,1777166140,Small space living room decor ideas | Interior design ideas | Living room makeover,Small space living room decor ideas #homedecor #InteriorDesign #RoomMakeover #CushionCovers #HomeDecorIdeas ...,interior design trends
youtube,,https://www.youtube.com/watch?v=5KwnaFcwUP0,1777166100,Bedroom Color Ideas for Girls 2026 | Modern &amp; Aesthetic Combinations  #interiordesign,"Designing a girls' bedroom in 2026? Forget loud and childish colors — go for soft, balanced, and aesthetic combinations.",interior design trends
youtube,,https://www.youtube.com/watch?v=NSpKEKphOUs,1777165220,Luxury Living Area #design #designtrends #luxury #luxuryhomes #interiordesign #architecture #design,moderndecor #architecturedesign #modernhome #diy #room #home #decor #homeinterior #homerenovationideas #designtrends ...,interior design trends
youtube,,https://www.youtube.com/watch?v=wnttautfAfg,1777147242,🔥 LVT Flooring DIY Installation | Luxury Vinyl Tile Waterproof Modern Floor,"Upgrade your home with modern LVT flooring! Luxury vinyl tiles offer a realistic wood or stone look while being waterproof, ...",interior design trends
youtube,,https://www.youtube.com/watch?v=ZUbT6qUAzVY,1777143614,100 Budget-Friendly Vintage Rustic Farmhouse Decor Ideas 🪵 Cozy Home Trends 2026!#farmhousestyle ,"Transform your home into a warm, cozy dream space with these 100 Budget-Friendly Vintage Rustic Farmhouse Decor Ideas !",interior design trends
youtube,,https://www.youtube.com/watch?v=05hHtEoz-lc,1777143601,Beware! 6 Interior Design Choices You Will Quickly Regret!,"When it comes to interior design, making the right choices can be overwhelming, especially with the constant emergence of new ...",interior design trends
youtube,,https://www.youtube.com/watch?v=eAMQzl7G7YI,1777142624,Trends 2026 – was gerade die Möbelwelt prägt. #moderneswohnen #interiordesign,Auf der Ausstellung und in den Showrooms 2026 sieht man klare Richtungen: Glasvitrinen bringen Leichtigkeit und setzen ...,interior design trends
youtube,,https://www.youtube.com/watch?v=7ggjasNhOsE,1777142130,Modern Wall Designs 2026 | Transform Your Home Instantly 🏠✨,Modern Wall Designs 2026 | Transform Your Home Instantly ✨ This channel is all about giving information about interior work ...,interior design trends
youtube,,https://www.youtube.com/watch?v=3cd4cyBW-xc,1777140900,Top Minimalist Home and Kitchen Design Trends to Watch in 2026,MinimalistKitchen #HomeDesign #AestheticHome Top Minimalist Home and Kitchen Design Trends to Watch in 2026 tags: ...,interior design trends
youtube,,https://www.youtube.com/watch?v=4G6Kcxejj1Q,1777140101,🔥 Decorative Wall Panels DIY | 3D Wall Paneling Interior Wall Decor,"Transform your walls with modern decorative wall panels! Perfect for creating stylish interiors, these panels are easy to install and ...",interior design trends
youtube,,https://www.youtube.com/watch?v=yxOAdWvLqRg,1777220378,. A gorgeous home decor idea🌷✨Dollar tree💕🌳,,home decor ideas
youtube,,https://www.youtube.com/watch?v=tCozPXfE20o,1777215683,Ralph Lauren Inspired Home Decor Ideas That Make Your Entire Home Feel Luxurious,"Step into a world of timeless elegance where classic American luxury meets everyday comfort. In this video, we explore beautifully ...",home decor ideas
youtube,,https://www.youtube.com/watch?v=3UH6SKxObn0,1777212750,🦢Luxury Home Decor Ideas: The Perfect Swan Pair #shorts #swan,Luxury Home Decor Ideas: The Perfect Swan Pair Elegant Swan Couple Decor for Your Home! #HomeDecor Give your home a ...,home decor ideas
youtube,,https://www.youtube.com/watch?v=smAc0ZQcNBo,1777211557,10 Minutes DIY Console Table 😍 | Easy Home Decor Idea#shorts #reel,10 Minutes DIY Console Table | Easy Home Decor Idea सिर्फ 10 मिनट में बनाएं एक stylish DIY console ...,home decor ideas
youtube,,https://www.youtube.com/watch?v=hbzeIOL3sbw,1777211080,Purani Bottle Se Banaye Professional Planter! 🎍 | DIY Home Decor Ideas #shorts,Kya aapne kabhi socha tha ki ek purani plastic bottle se itna sundar aur professional planter ban sakta hai? Is video mein ...,home decor ideas
youtube,,https://www.youtube.com/watch?v=4jt5p1gbVk4,1777210399,Diy bottle art 🩷🧿 #craft #craftideas #artscraft #youtubeshorts #bottleart #homedecor #diycrafts,art art and craft art and craft wall hangings art shorts art short artist Egg tray craft Best out of waste Pista shells craft Pista shells ...,home decor ideas
youtube,,https://www.youtube.com/watch?v=TzitQ90KaMc,1777210200,2026 ke Most Viral Gift Ideas 🎁 | Unique Home Decor Hacks #shorts #viralshorts #viral #shortvideo,2026 ke latest trending gift ideas | Unique home decor items jo aapke ghar ko beautiful banaye Agar aap budget me best gift ...,home decor ideas
youtube,,https://www.youtube.com/watch?v=1XeG7gXFRbc,1777208405,Stunning Oriental Rug 2026 | Luxury Home Decor &amp; Design Ideas #shorts #rug #design #carpet #home,Stunning Oriental Rug 2026 – Luxury Home Decor & Design Ideas! Upgrade your home with this **beautifully crafted oriental ...,home decor ideas
youtube,,https://www.youtube.com/watch?v=ENwT93FiuLQ,1777208248,HELP!! Any ideas to upgrade this space? 😭#interiordesign #homedecor #homedecorideas,,home decor ideas
youtube,,https://www.youtube.com/watch?v=oTEkGlb8N6Q,1777206654,Home decor 🥰🥰🥰🥰,,home decor ideas
youtube,,https://www.youtube.com/watch?v=Bbuj_V4ZTYk,1777206600,This Aluminium Wardrobe Looks Amazing!😳#bedroomdesign #wardrobe #cupboard #homedecor #interiordesign,"Aluminium cupboards are rust-free, low maintenance, and ideal for long-lasting use. If you're planning a bedroom makeover or ...",home decor ideas
youtube,,https://www.youtube.com/watch?v=8QDxRsVgubY,1777205950,🤩 room decor ideas #decorationideas #home #trending #interiordesign #homedecor #newvideo,room decor ideas #decorationideas #home #trending #interiordesign #homedecor #newvideo Top 5 Most Popular Songs OF ...,home decor ideas
youtube,,https://www.youtube.com/watch?v=otBITFzwdzE,1777205812,quick Aesthetic wall decor 💕 easy room decor idea🌷#shorts #diy #decor #roomdecor #youtubeshorts,"aesthetic room decor, pinterest wall decor ideas, diy aesthetic room decor, pinterest room decor diy, aesthetic wall decor ideas, ...",home decor ideas
youtube,,https://www.youtube.com/watch?v=tQC-DZ3I8Q4,1777204841,Home Decor Ideas #youtubeshorts #shortviral #diy #craft #decor,Home Decor Ideas #youtubeshorts #shortviral #diy #craft #decor.,home decor ideas
youtube,,https://www.youtube.com/watch?v=orhfE1tZBD0,1777204739,Turn Waste into Amazing DIY Crafts 😳 | Easy Home Ideas,Turn Waste into Amazing DIY Crafts | Easy Home Ideas Description Don't throw waste items! Turn them into creative DIY crafts ...,home decor ideas
youtube,,https://www.youtube.com/watch?v=LllqD7W5cOE,1777203027,cute artificial pollen flowers #meeshoapp #homedecor #decorative #flowers,beautiful cute artificial pollen flowers for home decor. they can be put in mini head plantar and looks great in TV unit for decor ...,home decor ideas
youtube,,https://www.youtube.com/watch?v=4NcofnjdL6c,1777203003,DIY Ice Cream Stick Wall Hanging | Room Decor Ideas 😍💐#shorts,DIYCrafts #WallHanging #BestOutOfWaste #HomeDecor #CraftIdeas #ClayArt #Shorts #youtubevideo Don't Forget to Subscribe ...,home decor ideas
youtube,,https://www.youtube.com/watch?v=QmkXxbvvXD0,1777202102,Home decor ideas under budget #home #homedecor #meeshohaul #meeshofinds #youtubeshorts,,home decor ideas
youtube,,https://www.youtube.com/watch?v=jn7MkmyW03o,1777198548,diy easy Home decor ideas #craft #ytshorts #shortsfeed #youtubeshorts,diy easy Home decor ideas #craft #ytshorts #shortsfeed #youtubeshorts.,home decor ideas
youtube,,https://www.youtube.com/watch?v=gbnRt4rRVss,1777197663,Cheap Sofa Covers That Look Luxury | Home Decor Ideas” #shorts,Cheap Sofa Covers That Look Luxury | Home Decor Ideas” #shorts sofa seat covers couch seat covers sofa cover for living room ...,home decor ideas
youtube,,https://www.youtube.com/watch?v=QhHz3tVtxIE,1777197640,Beautiful Wall Shelf Ideas for Stylish &amp; Modern Home Decor 🏡,,home decor ideas
youtube,,https://www.youtube.com/watch?v=TsIw49DYZnI,1777195826,Best Artificial Plant Under ₹150😍 Home Decor Idea India  #homedecor #artificialplant #shorts@Meesho,Best Artificial Plant Under ₹150   Home Decor Idea India #homedecor #artificialplant #shorts #budgetdecor #roomdecor #shorts ...,home decor ideas
youtube,,https://www.youtube.com/watch?v=wJNQ4krNuWc,1777195040,exposed cement bench using roof 😨 #shorts #craft #cementcrafts #homedecor #ideas,exposed cement bench using roof #shorts #craft #cementcrafts #homedecor #ideas.,home decor ideas
youtube,,https://www.youtube.com/watch?v=xhvxR5ercaQ,1777194951,Diy mini umbrella 🌂//Best out of waste//Home Decor idea//#diy/#craft/#shorts,,home decor ideas
youtube,,https://www.youtube.com/watch?v=uuRqixt8e94,1777193777,Home decoration ideas 😍 (Craft ideas) #craft #diy #shorts #homedecor #shortsvideo #ytshorts #viral,,home decor ideas
youtube,,https://www.youtube.com/watch?v=atM3zo3ySGY,1777220313,How to Use a Black Palette in a Small Apartment Without Making It Feel Cramped,This video thoroughly explores how to apply a luxurious dark interior aesthetic to a small apartment without making it feel cramped ...,small apartment decor
youtube,,https://www.youtube.com/watch?v=eKil8Iz-9w4,1777219082,Transforming This Small New York Apartment with Paint and Decor!,"I prove you don't need a full renovation to fall in love with your home again. In this video, I transform a tired, outdated living room ...",small apartment decor
youtube,,https://www.youtube.com/watch?v=71QntgjqgpE,1777218524,A cozy small apartment balcony seating area | Seasonal Home Decor Ideas  #homedecor,"A cozy small apartment balcony seating area with a wooden chair and soft neutral cushions, a small round table with a cup of ...",small apartment decor
youtube,,https://www.youtube.com/watch?v=CGbleIv8GtU,1777214556,MaximizingTiny Apartment Spaces with Functional Modern Parisian Style Decor,Transform your compact living space into a sophisticated retreat with this inspiring guide to maximizing tiny apartment spaces ...,small apartment decor
