source,domain,url,created_utc,title,text,query
rss,www.yankodesign.com,https://www.yankodesign.com/2026/06/09/libernovo-maxis-gives-bigger-builds-the-chair-they-actually-deserve/?utm_source=rss&utm_medium=rss&utm_campaign=libernovo-maxis-gives-bigger-builds-the-chair-they-actually-deserve,1781055917,LiberNovo Maxis Gives Bigger Builds the Chair They Actually Deserve,"LiberNovo Maxis Gives Bigger Builds the Chair They Actually Deserve

<p class=""rws-nl-img""><a href=""https://www.yankodesign.com/2026/06/09/libernovo-maxis-gives-bigger-builds-the-chair-they-actually-deserve/""><img alt=""Man reclining in a black ergonomic lounge chair with a padded headrest and wheeled base, resting on a wooden floor."" class=""attachment-post-thumbnail size-post-thumbnail wp-post-image"" height=""960"" src=""https://www.yankodesign.com/images/design_news/2026/05/libernovo-maxis-gives-bigger-builds-the-chair-they-actually-deserve/LiberNovo_-Maxis_Chair_01.jpg"" width=""1280"" /></a></p><h2 class=""rws-nl-title"" style=""text-align: center;"">LiberNovo Maxis Gives Bigger Builds the Chair They Actually Deserve</h2><div class=""rws-nl-excerpt"">The ergonomic chair market has grown considerably over the past decade, with brands competing on lumbar support, adjustability, and build quality. For most people, the...</div>",
rss,www.yankodesign.com,https://www.yankodesign.com/2026/06/09/adidas-just-squared-the-stan-smith-it-actually-works/?utm_source=rss&utm_medium=rss&utm_campaign=adidas-just-squared-the-stan-smith-it-actually-works,1781051404,Adidas Just Squared the Stan Smith. It Actually Works.,"Adidas Just Squared the Stan Smith. It Actually Works.

<p class=""rws-nl-img""><a href=""https://www.yankodesign.com/2026/06/09/adidas-just-squared-the-stan-smith-it-actually-works/""><img alt="""" class=""attachment-post-thumbnail size-post-thumbnail wp-post-image"" height=""960"" src=""https://www.yankodesign.com/images/design_news/2026/06/adidas-just-squared-the-stan-smith-it-actually-works/stan-smith-sq-00.jpg"" width=""1280"" /></a></p><h2 class=""rws-nl-title"" style=""text-align: center;"">Adidas Just Squared the Stan Smith. It Actually Works.</h2><div class=""rws-nl-excerpt"">The Stan Smith is one of those shoes you either already own or have owned at some point. Originally developed as a tennis shoe in...</div>",
rss,www.yankodesign.com,https://www.yankodesign.com/2026/06/09/this-129-floating-pen-doesnt-just-write-it-spins-for-30-seconds/?utm_source=rss&utm_medium=rss&utm_campaign=this-129-floating-pen-doesnt-just-write-it-spins-for-30-seconds,1781047803,This $129 Floating Pen Doesn’t Just Write. It Spins for 30 Seconds,"This $129 Floating Pen Doesn’t Just Write. It Spins for 30 Seconds

<p class=""rws-nl-img""><a href=""https://www.yankodesign.com/2026/06/09/this-129-floating-pen-doesnt-just-write-it-spins-for-30-seconds/""><img alt="""" class=""attachment-post-thumbnail size-post-thumbnail wp-post-image"" height=""960"" src=""https://www.yankodesign.com/images/design_news/2026/06/this-129-floating-pen-doesnt-just-write-it-spins-for-30-seconds/Levitating-Pen_3_Desk-Object_Hovers_12.jpg"" width=""1280"" /></a></p><h2 class=""rws-nl-title"" style=""text-align: center;"">This $129 Floating Pen Doesn&#8217;t Just Write. It Spins for 30 Seconds</h2><div class=""rws-nl-excerpt"">Most pens are designed to disappear into the background of your workday. You toss them in a drawer, lose them in a bag, borrow one...</div>",
rss,www.yankodesign.com,https://www.yankodesign.com/2026/06/09/the-hangzhou-prism-by-oma-is-the-mixed-use-landmark-chinas-tech-capital-deserves/?utm_source=rss&utm_medium=rss&utm_campaign=the-hangzhou-prism-by-oma-is-the-mixed-use-landmark-chinas-tech-capital-deserves,1781044201,The Hangzhou Prism by OMA Is the Mixed-Use Landmark China’s Tech Capital Deserves,"The Hangzhou Prism by OMA Is the Mixed-Use Landmark China’s Tech Capital Deserves

<p class=""rws-nl-img""><a href=""https://www.yankodesign.com/2026/06/09/the-hangzhou-prism-by-oma-is-the-mixed-use-landmark-chinas-tech-capital-deserves/""><img alt="""" class=""attachment-post-thumbnail size-post-thumbnail wp-post-image"" height=""960"" src=""https://www.yankodesign.com/images/design_news/2026/06/draft-hangzhou-prism/hangzhou_prism_yanko_design_01.jpg"" width=""1280"" /></a></p><h2 class=""rws-nl-title"" style=""text-align: center;"">The Hangzhou Prism by OMA Is the Mixed-Use Landmark China&#8217;s Tech Capital Deserves</h2><div class=""rws-nl-excerpt"">There&#8217;s a centuries-old Chinese proverb that goes: &#8216;above, there is heaven; below, there is Suzhou and Hangzhou.&#8217; OMA&#8217;s newly completed Hangzhou Prism doesn&#8217;t just reference...</div>",
rss,www.yankodesign.com,https://www.yankodesign.com/2026/06/09/this-kung-fu-panda-lego-build-lets-you-recreate-the-po-vs-tai-lung-fight-yourself/?utm_source=rss&utm_medium=rss&utm_campaign=this-kung-fu-panda-lego-build-lets-you-recreate-the-po-vs-tai-lung-fight-yourself,1781037002,This Kung Fu Panda LEGO Build Lets You Recreate the Po vs Tai Lung Fight Yourself,"This Kung Fu Panda LEGO Build Lets You Recreate the Po vs Tai Lung Fight Yourself

<p class=""rws-nl-img""><a href=""https://www.yankodesign.com/2026/06/09/this-kung-fu-panda-lego-build-lets-you-recreate-the-po-vs-tai-lung-fight-yourself/""><img alt="""" class=""attachment-post-thumbnail size-post-thumbnail wp-post-image"" height=""960"" src=""https://www.yankodesign.com/images/design_news/2026/06/auto-draft/lego_kung_fu_panda_tai_lung_1.jpeg"" width=""1280"" /></a></p><h2 class=""rws-nl-title"" style=""text-align: center;"">This Kung Fu Panda LEGO Build Lets You Recreate the Po vs Tai Lung Fight Yourself</h2><div class=""rws-nl-excerpt"">Tai Lung might be the best villain DreamWorks Animation ever put on screen. Not because he&#8217;s the most powerful, or the most menacing, but because...</div>",
rss,www.yankodesign.com,https://www.yankodesign.com/2026/06/09/sonys-original-playstation-returns-as-a-utilitarian-cushion-case-for-laptops-and-tablets/?utm_source=rss&utm_medium=rss&utm_campaign=sonys-original-playstation-returns-as-a-utilitarian-cushion-case-for-laptops-and-tablets,1781032540,Sony’s Original PlayStation returns as a utilitarian cushion case for laptops and tablets,"Sony’s Original PlayStation returns as a utilitarian cushion case for laptops and tablets

<p class=""rws-nl-img""><a href=""https://www.yankodesign.com/2026/06/09/sonys-original-playstation-returns-as-a-utilitarian-cushion-case-for-laptops-and-tablets/""><img alt="""" class=""attachment-post-thumbnail size-post-thumbnail wp-post-image"" height=""960"" src=""https://www.yankodesign.com/images/design_news/2026/06/sonys-original-playstation-returns-as-a-utilitarian-cushion-case-for-laptops-and-tablets/PlayStation-Multi-Cushion-Case-BOOK-2.jpg"" width=""1280"" /></a></p><h2 class=""rws-nl-title"" style=""text-align: center;"">Sony’s Original PlayStation returns as a utilitarian cushion case for laptops and tablets</h2><div class=""rws-nl-excerpt"">For many gamers, the original PlayStation was more than just a gaming console, as it was an introduction to an entirely new era of entertainment....</div>",
rss,www.yankodesign.com,https://www.yankodesign.com/2026/06/09/from-foldable-pilates-to-shoe-robots-innox-gcs-2026s-best-startups/?utm_source=rss&utm_medium=rss&utm_campaign=from-foldable-pilates-to-shoe-robots-innox-gcs-2026s-best-startups,1781025644,From Foldable Pilates to Shoe Robots: InnoX GCS 2026’s Best Startups,"From Foldable Pilates to Shoe Robots: InnoX GCS 2026’s Best Startups

<p class=""rws-nl-img""><a href=""https://www.yankodesign.com/2026/06/09/from-foldable-pilates-to-shoe-robots-innox-gcs-2026s-best-startups/""><img alt="""" class=""attachment-post-thumbnail size-post-thumbnail wp-post-image"" height=""960"" src=""https://www.yankodesign.com/images/design_news/2026/06/from-foldable-pilates-to-shoe-robots-innox-gcs-2026s-best-startups/innox-gcs-2026-01.jpg"" width=""1280"" /></a></p><h2 class=""rws-nl-title"" style=""text-align: center;"">From Foldable Pilates to Shoe Robots: InnoX GCS 2026&#8217;s Best Startups</h2><div class=""rws-nl-excerpt"">The consumer tech market has a crowding problem, mostly driven by products that try to do too much for too many people. The most interesting...</div>",
rss,www.yankodesign.com,https://www.yankodesign.com/2026/06/09/what-if-the-internet-had-a-building-you-could-actually-walk-inside/?utm_source=rss&utm_medium=rss&utm_campaign=what-if-the-internet-had-a-building-you-could-actually-walk-inside,1781022053,What If the Internet Had a Building You Could Actually Walk Inside?,"What If the Internet Had a Building You Could Actually Walk Inside?

<p class=""rws-nl-img""><a href=""https://www.yankodesign.com/2026/06/09/what-if-the-internet-had-a-building-you-could-actually-walk-inside/""><img alt="""" class=""attachment-post-thumbnail size-post-thumbnail wp-post-image"" height=""960"" src=""https://www.yankodesign.com/images/design_news/2026/06/what-if-the-internet-had-a-building-you-could-actually-walk-inside/the-internet-observatory-04.jpg"" width=""1280"" /></a></p><h2 class=""rws-nl-title"" style=""text-align: center;"">What If the Internet Had a Building You Could Actually Walk Inside?</h2><div class=""rws-nl-excerpt"">The internet has always been invisible. It moves information at a scale and speed the human mind can&#8217;t fully grasp, yet we access it through...</div>",
rss,www.yankodesign.com,https://www.yankodesign.com/2026/06/09/prada-designs-a-hidden-onesie-that-could-keep-nasas-artemis-astronauts-alive-on-the-moon/?utm_source=rss&utm_medium=rss&utm_campaign=prada-designs-a-hidden-onesie-that-could-keep-nasas-artemis-astronauts-alive-on-the-moon,1781018436,Prada designs a hidden Onesie that could keep NASA’s Artemis astronauts alive on the Moon,"Prada designs a hidden Onesie that could keep NASA’s Artemis astronauts alive on the Moon

<p class=""rws-nl-img""><a href=""https://www.yankodesign.com/2026/06/09/prada-designs-a-hidden-onesie-that-could-keep-nasas-artemis-astronauts-alive-on-the-moon/""><img alt="""" class=""attachment-post-thumbnail size-post-thumbnail wp-post-image"" height=""960"" src=""https://www.yankodesign.com/images/design_news/2026/06/prada-designs-a-hidden-onesie-that-could-keep-nasas-artemis-astronauts-alive-on-the-moon/LCVG-Prada-x-Axiom-Space-Liquid-Cooling-Ventilation-Garment-for-NASA-8.jpg"" width=""1280"" /></a></p><h2 class=""rws-nl-title"" style=""text-align: center;"">Prada designs a hidden Onesie that could keep NASA’s Artemis astronauts alive on the Moon</h2><div class=""rws-nl-excerpt"">The fashion and home décor industry has, for years, looked toward space for inspiration. Prada is a brand that’s pushing through to be the first...</div>",
rss,www.yankodesign.com,https://www.yankodesign.com/2026/06/09/cash-app-just-made-a-25-magic-wand-you-pay-with/?utm_source=rss&utm_medium=rss&utm_campaign=cash-app-just-made-a-25-magic-wand-you-pay-with,1781014817,Cash App Just Made a $25 Magic Wand You Pay With,"Cash App Just Made a $25 Magic Wand You Pay With

<p class=""rws-nl-img""><a href=""https://www.yankodesign.com/2026/06/09/cash-app-just-made-a-25-magic-wand-you-pay-with/""><img alt="""" class=""attachment-post-thumbnail size-post-thumbnail wp-post-image"" height=""960"" src=""https://www.yankodesign.com/images/design_news/2026/06/cash-app-just-made-a-25-magic-wand-you-pay-with/cash-app-wand-01.jpg"" width=""1280"" /></a></p><h2 class=""rws-nl-title"" style=""text-align: center;"">Cash App Just Made a $25 Magic Wand You Pay With</h2><div class=""rws-nl-excerpt"">Payment technology has largely been invisible work. Tap your phone, swipe your card, wave your watch, done. The entire industry spent years making transactions faster...</div>",
rss,www.archdaily.com,https://www.archdaily.com/1042260/555-sunshine-farmshop-so,1781031600,555 Sunshine Farmshop  / SO,"555 Sunshine Farmshop  / SO

<p>The farm shop and café nestle within a tunnel of tamarind trees, letting the natural canopy remain the true architecture. A gable roof is split into two gestures: one curving softly, sheltering the café with crafted intimacy; the other stretched long and straight, clad in free-form black slate, filtering light like overlapping leaves.</p>",
rss,www.archdaily.com,https://www.archdaily.com/1041950/abadim-house-paulo-moreira-architectures,1781017200,Abadim House / Paulo Moreira Architectures,"Abadim House / Paulo Moreira Architectures

<p>The project consists of the rehabilitation of an 18th-century rural house, located in the village of Abadim, in the Minho region of northern Portugal. The property is made up of a set of buildings arranged in a lush landscape, with views of the Serra da Cabreira.</p>",
rss,www.archdaily.com,https://www.archdaily.com/1041889/casa-tlaloc-lopez-gonzalez-studio,1781006400,Casa Tlaloc / Lopez Gonzalez Studio,"Casa Tlaloc / Lopez Gonzalez Studio

<p>Architecture, in its purest sense, represents an act of dominion over gravity. Casa Tlaloc sits upon the site with the naturalness of the inevitable. It grounds itself firmly and ascends like a stack of old books, where each story supports the next. Within this state of superposition, a verticality emerges, organized by the specificity of daily rituals and their varying degrees of privacy.</p>",
rss,www.archdaily.com,https://www.archdaily.com/1042278/cherry-orchard-shared-living-spaces-actual-office,1780999200,Cherry Orchard  Shared Living Spaces / Actual Office,"Cherry Orchard  Shared Living Spaces / Actual Office

<p>Actual Office has completed the fit-out of a series of shared living spaces in South <a href=""http://feeds.feedburner.com/tag/london"">London</a>, defined by a simple but strong design idea and curated material palette that balances warmth, durability, and spatial clarity. Collaborating with a dynamic client, Actual Office established a unified design vision and applied it to a series of interconnected shell spaces, transforming them into a refined residential environment.</p>",
rss,www.archdaily.com,https://www.archdaily.com/1042148/previ-lima-and-the-politics-of-resident-authorship-in-social-housing,1780990200,PREVI Lima and the Politics of Resident Authorship in Social Housing,"PREVI Lima and the Politics of Resident Authorship in Social Housing

<p>Architects are accustomed to being credited for buildings long after construction ends. Names remain attached to projects through photographs, publications, and histories, often decades after the original drawings were produced. Buildings, on the other hand, rarely remain faithful to that narrative for long. Families grow, technologies change, businesses emerge, and daily life introduces demands that no plan can fully anticipate. Over time, architecture accumulates modifications, repairs, additions, and improvisations that gradually distance it from its original form.</p>",
rss,www.archdaily.com,https://www.archdaily.com/1042210/cp-rancho-weber-arquitectos,1780988400,CP Rancho / Weber Arquitectos,"CP Rancho / Weber Arquitectos

<p>Located in a village near Valle de Bravo, Rancho CP is set on a forested site with views of the surrounding mountains. The project was conceived as an equestrian ranch designed as a retreat in direct contact with nature, integrating spaces for horseback riding and interaction with the horses as an essential part of everyday life.</p>",
rss,www.archdaily.com,https://www.archdaily.com/1042070/the-lasting-impact-of-architectural-education-training-professionals-to-question-convention,1780987500,The Lasting Impact of Architectural Education: Training Professionals to Question Convention,"The Lasting Impact of Architectural Education: Training Professionals to Question Convention

<p>Architectural schools usually leave lasting marks on their students, shaping their style and critical inquiry long after formal education has ended. For example, <a href=""https://www.sciarc.edu/?utm_medium=website&amp;utm_source=archdaily.com"" target=""_blank"">SCI-Arc</a>, founded in 1972 and based in downtown Los Angeles, is an institution recognized for its culture of experimentation, critical investigation, and creative independence, building a reputation based on the idea that architecture should be understood as a field open to dialogue with art, technology, design, and contemporary culture. The diversity of trajectories of its alumni demonstrates how this environment can generate distinct professional approaches, but united by the same willingness to explore new possibilities.</p>",
rss,www.archdaily.com,https://www.archdaily.com/1042293/oma-completes-hangzhou-prism-mixed-use-development-in-chinas-future-tech-city,1780986600,OMA Completes Hangzhou Prism Mixed-Use Development in China's Future Tech City,"OMA Completes Hangzhou Prism Mixed-Use Development in China's Future Tech City

<p><a href=""https://www.archdaily.com/office/oma?ad_source=search&amp;ad_medium=search_result_professionals"">OMA</a> has completed the <a href=""https://www.archdaily.com/912962/omas-xinhu-hangzhou-prism-breaks-ground-in-the-citys-future-cbd"">Hangzhou Prism</a>, a large-scale <a href=""http://feeds.feedburner.com/tag/mixed-use-development"">mixed-use development</a> in <a href=""https://www.archdaily.com/tag/hangzhou/page/1"">Hangzhou</a>'s Future Tech City district, <a href=""https://www.archdaily.com/country/china/page/1"">China</a>, following a design and development process that began in 2016. Commissioned by Xinhu Real Estate Group and led by <a href=""https://www.archdaily.com/tag/oma"">OMA</a> Partner Chris van Duijn, with Michael Hadjistyllis serving as project architect, the project combines residential units, a hotel, offices, commercial spaces, and public amenities within a single building volume. Marking <a href=""https://www.archdaily.com/tag/oma"">OMA</a>'s first completed project in <a href=""https://www.archdaily.com/tag/hangzhou/page/1"">Hangzhou</a>, the development occupies a central site within one of the city's emerging innovation and business districts.</p>",
rss,www.archdaily.com,https://www.archdaily.com/1042273/the-century-of-gehry-frank-gehry-retrospective-opens-at-the-serralves-museum-in-porto,1780983000,"""The Century of Gehry"": Frank Gehry Retrospective Opens at the Serralves Museum in Porto","""The Century of Gehry"": Frank Gehry Retrospective Opens at the Serralves Museum in Porto

<p>From June 12 to December 20, 2026, the <a href=""http://feeds.feedburner.com/tag/serralves-museum-of-contemporary-art"">Serralves Museum of Contemporary Art</a> in <a href=""http://feeds.feedburner.com/tag/porto"">Porto</a>, <a href=""http://feeds.feedburner.com/tag/portugal"">Portugal</a>, will be hosting a retrospective exhibition dedicated to the career of <a href=""https://www.archdaily.com/1036716/frank-gehry-visionary-architect-of-the-bilbao-guggenheim-dies-at-96"" rel=""noopener"" target=""_blank"">Frank Gehry (1929-2025)</a>. Titled <em>The Century of Gehry</em>, the exhibition presents to the public original large-scale models, sculptures, drawings, furniture, and other works documenting the architect's notable, and at times controversial, <a href=""https://www.archdaily.com/964625/what-is-postmodernism"" rel=""noopener"" target=""_blank"">postmodern architecture</a>. The exhibit covers from early experiments to iconic buildings such as t<a href=""https://www.archdaily.com/67321/gehry-residence-frank-gehry"" rel=""noopener"" target=""_blank"">he architect's house in Santa Mónica</a>, the <a href=""https://www.archdaily.com/422470/ad-classics-the-guggenheim-museum-bilbao-frank-gehry"" rel=""noopener"" target=""_blank"">Guggenheim Museum in Bilbao</a>, the <a href=""https://www.archdaily.com/555694/fondation-louis-vuitton-gehry-partners"" rel=""noopener"" target=""_blank"">Fondation Louis Vuitton in Paris</a>, and the <a href=""https://www.archdaily.com/441358/ad-classics-walt-disney-concert-hall-frank-gehry"" rel=""noopener"" target=""_blank"">Walt Disney Concert Hall in Los Angeles</a>. The<a href=""https://www.archdaily.com/tag/serralves-museum-of-contemporary-art"" rel=""noopener"" target=""_blank""> Serralves Museum</a> occupies a building designed by the Portuguese architect Álvaro Siza Vieira in 1991. The exhibition is housed in <a href=""https://www.archdaily.com/1015907/serralves-museum-alvaro-siza-wing-alvaro-siza-vieira"" rel=""noopener"" target=""_blank"">the new wing that bears his name</a>.</p>",
rss,www.archdaily.com,https://www.archdaily.com/1042229/contemplative-drama-how-gaudi-shaped-light-and-color-at-sagrada-familia,1780977600,Contemplative Drama: How Gaudí Shaped Light and Color at Sagrada Família,"Contemplative Drama: How Gaudí Shaped Light and Color at Sagrada Família

<p>It is afternoon in the summer, and the nave of the<a href=""https://www.archdaily.com/tag/la-sagrada-familia""> Sagrada Família</a> is saturated with warm colors. Shafts of amber and crimson sweep across the stone floor, shift as a cloud passes over<a href=""https://www.archdaily.com/tag/barcelona""> Barcelona</a>, then deepen again. Around you, visitors slow without quite realizing it. Some raise their phones — not to capture the architecture, but to step into the light itself, positioning themselves in a pool of orange or gold as if the colours were something you could wear.</p>",
rss,www.archdaily.com,https://www.archdaily.com/1042246/ara-manor-reincarnation,1780974000,Ara Manor  / Reincarnation,"Ara Manor  / Reincarnation

<p>Emerging from the green landscape of Narsingdi, Ara Manor is conceived as a retreat where architecture dissolves into climate, vegetation, water, and light. Designed as a three-storied vacation residence for the owner of Crony Group, the project explores how contemporary domestic architecture in Bangladesh can remain deeply connected to landscape and environmental context while offering a sense of withdrawal from urban intensity.</p>",
rss,www.archdaily.com,https://www.archdaily.com/1042247/house-yolk-touch-architect,1780970400,House Yolk / TOUCH Architect,"House Yolk / TOUCH Architect

<p>'House Yolk' is a metaphor as an analogy for the yolk, which is a yellow internal part of an egg, that is surrounded by the white, and is rich in protein and fat. It is a small house, which is located on a large land plot, and is rich in functionality and privacy within a compact space. This 340-square-meter house is located on a very large land plot, owned by the family who plans to leave the land for inheritors and relatives in the future. The owners only need a small house since it must be only for three family members.</p>",
rss,www.archdaily.com,https://www.archdaily.com/1042198/yanqian-trail-vcd-lab,1780963200,Yanqian Trail / VCD Lab,"Yanqian Trail / VCD Lab

<p>Yanqian Trail is situated on Xianggang Mountain in Yanqian Village, opposite the Qixingyan Scenic Area—a National 5A-rated tourist attraction in <a href=""http://feeds.feedburner.com/tag/zhaoqing"">Zhaoqing</a>, China. Spanning a total length of 1,310 metres, the project is an ecological footpath built on stilts encircling the mountain. The Cloud Walk meanders like a flowing ribbon along the slopes of Xianggang Mountain. Designed with a pure steel framework that gently touches the forest, it maximises the protection of native vegetation and animal habitats whilst subtly elevating the walker's perspective, imbuing the journey with poetry and height, and fully showcasing the harmonious coexistence of human life and natural tranquillity.</p>",
rss,www.archdaily.com,https://www.archdaily.com/1042228/parnasambhar-n-b-architects,1780945200,Parnasambhar / N. B. Architects,"Parnasambhar / N. B. Architects

<p>Located in the northernmost region of Maharashtra, with a faint aural backdrop of the Arabian Sea and wrapped in a dense canopy of chikoo trees, this abode isolates itself in playful spatial experiences. Abutting the coastal road, the farmhouse secures its privacy through a thick green cover and thoughtful orientation.</p>",
rss,www.archdaily.com,https://www.archdaily.com/1041948/710-house-bloco-arquitetos,1780930800,710 House / BLOCO Arquitetos,"710 House / BLOCO Arquitetos

<p>The house is located in the residential section of W3 South Avenue in Bras&iacute;lia. It is a project for a semi-detached house built on a lot measuring 8.50 meters in front by 20 meters in depth, defined by three ""typical cuts"" that delineate the different areas of the house.</p>",
rss,www.archdaily.com,https://www.archdaily.com/1041890/rosa-jamaica-beach-club-gris-estudio-de-diseno-plus-arquitectura,1780920000,Rosa Jamaica Beach Club / Gris | Estudio de Diseño + Arquitectura,"Rosa Jamaica Beach Club / Gris | Estudio de Diseño + Arquitectura

<p><em>Context and Challenge - </em>El Paredón Buena Vista sits on one of Guatemala's most sensitive stretches of coastline. The client wanted a functional beach club—restaurant, kitchen, bar, event spaces—but not at the expense of what made the location worth developing in the first place. That's a tension most hospitality projects never resolve.</p>",
rss,www.archdaily.com,https://www.archdaily.com/1042236/kopa-ivy-studio,1780912800,KOPA / Ivy Studio,"KOPA / Ivy Studio

<p>Located in the heart of Pointe-Saint-Charles, a historic industrial neighborhood in <a href=""http://feeds.feedburner.com/tag/montreal"">Montreal</a>, Kopa establishes itself as a premier destination for community and indoor racket sports. Occupying a freestanding, single-story industrial building of roughly 20,000 square feet, the project required a significant structural intervention to adapt the existing envelope to the precise dimensions of modern athletic courts. The design response directly embraces the raw scale of the original architecture, orchestrating a sharp, intentional contrast between an immersive, high-volume sports arena and a sequence of intimate, deeply saturated hospitality zones.</p>",
