source,domain,url,created_utc,title,text,query
rss,www.archdaily.com,https://www.archdaily.com/1037264/wood-house-jak-architecture,1773036000,Wood House / JAK Architecture,"Wood House / JAK Architecture

<p>What began as a modest brief for a young and growing family soon evolved into a considered renovation that reimagines an existing <a href=""https://www.archdaily.com/tag/barwon-heads"">Barwon Heads</a> home. The original house had endured several unsympathetic alterations over the years, leaving it disjointed and built to a poor standard.</p>",
rss,www.archdaily.com,https://www.archdaily.com/1039439/oma-shohei-shigematsu-designs-ellipsoidal-pavilion-for-mushroom-cultivation-at-casa-wabi-in-oaxaca-mexico,1773034200,"OMA / Shohei Shigematsu Designs Ellipsoidal Pavilion for Mushroom Cultivation at Casa Wabi in Oaxaca, Mexico","OMA / Shohei Shigematsu Designs Ellipsoidal Pavilion for Mushroom Cultivation at Casa Wabi in Oaxaca, Mexico

<p>A domed, ellipsoidal pavilion for mushroom production designed by <a href=""https://www.archdaily.com/office/oma"" rel=""noopener"" target=""_blank"">OMA </a>for <a href=""https://www.archdaily.com/885736/fundacion-casa-wabi-headquarters-alberto-kalach"" rel=""noopener"" target=""_blank"">Fundación Casa Wabi</a> opened on March 4, 2026. The building is located within Casa Wabi's 25-hectare site in <a href=""https://www.archdaily.com/city/oaxaca"" rel=""noopener"" target=""_blank"">Oaxaca</a>, <a href=""https://www.archdaily.com/country/mexico"" rel=""noopener"" target=""_blank"">Mexico</a>, on the Pacific coast, about 30 minutes from the city of <a href=""https://www.archdaily.com/city/puerto-escondido"" rel=""noopener"" target=""_blank"">Puerto Escondido</a>. Casa Wabi is a foundation created by artist Bosco Sodi that promotes the exchange of ideas between artists of various disciplines and local communities. <a href=""https://www.archdaily.com/788480/wabi-house-tadao-ando-architect-and-associates"" rel=""noopener"" target=""_blank"">The foundation's flagship building was designed by Japanese architect Tadao Ando</a> and completed in 2014. The OMA-designed pavilion adds a new space for cultivating mushrooms and fostering exchange between food, art, nature, and local communities to the foundation's facilities, which include a multipurpose palapa, six bedrooms, two enclosed studios, six open studios, a screening room and auditorium, a 450-m² exhibition hall, and various workspaces.</p>",
rss,www.archdaily.com,https://www.archdaily.com/1039154/making-infrastructure-visible-when-systems-become-architecture,1773028800,Making Infrastructure Visible: When Systems Become Architecture,"Making Infrastructure Visible: When Systems Become Architecture

<p>For centuries, <a href=""https://www.archdaily.com/1035657/from-albania-to-iran-7-unbuilt-infrastructure-projects-reimagining-mobility-ecology-and-connection"">large-scale infrastructure</a> operated in the background. <a href=""https://www.archdaily.com/tag/port"">Ports</a>, power plants, and <a href=""https://www.archdaily.com/tag/energy"">energy</a> facilities were positioned at the edges of cities, designed primarily for efficiency, and rarely considered part of <a href=""https://www.archdaily.com/1035354/dispatched-architecture-of-the-american-post-office-and-the-privatization-of-civic-space"">civic life</a>. Their function was indispensable, yet their architectural presence remained secondary. These structures supported <a href=""https://www.archdaily.com/1003034/the-transformative-power-of-urbanization-how-indian-cities-like-delhi-plan-for-urban-growth"">urban growth</a> and global exchange while maintaining a spatial distance from everyday urban experience.</p>",
rss,www.archdaily.com,https://www.archdaily.com/1039095/under-the-pink-roof-caret-studio-associato,1773025200,Under The Pink Roof  / Caret Studio,"Under The Pink Roof  / Caret Studio

<p>The new Foro Boario in <a href=""https://www.archdaily.com/tag/borgo-san-lorenzo"">Borgo San Lorenzo</a> restores identity and a sense of belonging through collective architecture. The project for the Foro Boario in Borgo San Lorenzo revitalizes a marginal area, restoring to it a shared identity. A large rose–terracotta canopy becomes a symbol of gathering and an urban landmark, expressing an architecture that speaks the community's language.</p>",
rss,www.archdaily.com,https://www.archdaily.com/1037010/when-architects-design-time-tadao-ando-and-the-meaning-of-youth,1773019800,When Architects Design Time: Tadao Ando and the Meaning of Youth,"When Architects Design Time: Tadao Ando and the Meaning of Youth

<p>Tadao Ando has joined forces with <a href=""https://www.cauny.com/pages/cauny-x-ando?utm_medium=website&amp;utm_source=archdaily.com"" rel=""noopener"" target=""_blank"">Cauny</a> to design the newest watch in <em>The Architects of Time</em> <em>Series</em>. This is a collection of watches designed by some of the greatest architects of our time—an initiative that the nearly century-old brand launched in 2019 with none other than Álvaro Siza. From then until today, the collection has proven to be a Pritzker Prize–based tour de force: Siza, Rafael Moneo, Eduardo Souto Moura, and, this year, Tadao Ando.</p>",
youtube,,https://www.youtube.com/watch?v=iMQ3Ysp0Hxk,1773140472,Moody Regencycore Easter Decor 🕯️ Dark Elegant Spring Home Styling Ideas,"Step into a world where Easter elegance meets dramatic interior design. In this video, we explore Moody Regencycore Easter ...",interior design trends
youtube,,https://www.youtube.com/watch?v=HVBH3H0UlgU,1773138707,Modern Bathroom Design Trends | Sculptural Washbasins Taking Over Interiors,"Wait till you see these bathroom designs. Today's bathrooms are no longer just functional, they're immersive design experiences ...",interior design trends
youtube,,https://www.youtube.com/watch?v=XNdiWJWSbTI,1773138376,OBEGI Home - 2026 Design Trends,"As we look ahead to 2026, OBEGI Home's experts share their outlook on the design trends that will shape refined homes in the ...",interior design trends
youtube,,https://www.youtube.com/watch?v=XwFOKvs4bcQ,1773136837,Stunning Modern Home Design Ideas Created by AI | 2026 Trends#shortvideo #aihomedesign #shortvideo,"Welcome to [noyonvisionai]! ​In today's video, we explore the incredible world of AI-driven architecture. We are showcasing some ...",interior design trends
youtube,,https://www.youtube.com/watch?v=uX61W9nYQfo,1773134908,Which room style would you choose? #interiordesign #roomdesign #designtrends,"Explore how a single room adapts to various aesthetics in this captivating video. We showcase a range of styles, offering fresh ...",interior design trends
youtube,,https://www.youtube.com/watch?v=w1BAi2djFeU,1773129877,Interior Design Trends 2026 | Wall Painting Design Ideas | Top 5 Interior Design Trends,"If you want to decorate your home walls with simple paint, this Mountain Wall Painting Design is a beautiful and easy idea.",interior design trends
youtube,,https://www.youtube.com/watch?v=ULxcjoF7224,1773128903,Small Bathroom Tiles Design Ideas | Stylish &amp; Space-Saving Tile Designs|Modern Small Bathroom Tiles,"Looking for small bathroom tiles design ideas to make your bathroom look stylish and spacious? In this video, we share the latest ...",interior design trends
youtube,,https://www.youtube.com/watch?v=cGJru7TJPpo,1773124547,Dopamine Decor Homes 🌈 Colourful Interior Design Trend #homestyling  #dopamine #colourininteriors,"Dopamine decor is one of the most exciting interior design trends right now. Instead of neutral palettes and minimal spaces, this ...",interior design trends
youtube,,https://www.youtube.com/watch?v=Wv3Z0cL2Er0,1773120389,Latest Kitchen Interior Trends 2026 🚀 #shorts,Latest Kitchen Interior Trends 2026 #shorts #kitchen #furniture #home #hometour #house #housedesign #interior ...,interior design trends
youtube,,https://www.youtube.com/watch?v=gwSfkXayw34,1773110631,25 Modern Kitchen Designs 2026 | Latest Trends &amp; Budget Options | Small kitchen design,25 Modern Kitchen Designs 2026 | Latest Trends & Budget Options | Small kitchen design Top 25 Modern Kitchen Trending ...,interior design trends
youtube,,https://www.youtube.com/watch?v=NIr7uj_Rah0,1773104432,Modern Home Interior Inspiration💫💫 #home #interiordesign #luxury #beautiful #usa,"Modern interior design ideas for beautiful and luxury homes. In this shorts video, you will see amazing living room, bedroom, ...",interior design trends
youtube,,https://www.youtube.com/watch?v=8K89pkbsiHM,1773103500,ROSE GARDEN EPOXY BEDROOM 🤗😂😇 | #usa #viral #trending #youtubeshorts #shorts #shortvideo,ROSE GARDEN EPOXY BEDROOM | #usa #viral #trending #youtubeshorts #shorts #shortvideo AMERIBOOM is the ...,interior design trends
youtube,,https://www.youtube.com/watch?v=QxHkdNREjig,1773101129,Model Home Décor Trends: Warm Tones Arrive! #realestate #home #design #kristinburnsrealtor,"Model home tour day this past Saturday with some great young buyers! While walking through some new homes in Winchester, ...",interior design trends
youtube,,https://www.youtube.com/watch?v=SGl5OtmYO3g,1773100835,Luxury Interior Design Ideas💫💥 #interiordesign #luxury #homedecor #beautiful #usa,"Modern interior design ideas for beautiful and luxury homes. In this shorts video, you will see amazing living room, bedroom, ...",interior design trends
youtube,,https://www.youtube.com/watch?v=JHy7wSJePOQ,1773099011,Wardrobe Storage Organization Ideas | Wardrobe Storage Solution    #interiordesign #home #shorts,"Wardrobe Storage: - ◾ Accessories: Handbags, belts, scarves, and other personal items. ◾ Clothing: Shirts, pants, dresses, and ...",interior design trends
youtube,,https://www.youtube.com/watch?v=jDQsIEBsm0E,1773093283,Custom wood paneling.#InteriorDesign #HomeMakeover #RoomTransformation #CustomWoodPaneling #Luxury,From Trash to Treasure: Ultimate Dining Room Makeover! ✨ ​The Secret to Luxury Walls: Custom Wood Paneling Reveal ...,interior design trends
youtube,,https://www.youtube.com/watch?v=7jO91dhM-Vs,1773092700,STOP Doing This! 10 Home Design Trends You Will Regret in 2026,"Design trends don't age gracefully. What felt modern five years ago might turn into a massive, expensive regret that actually ...",interior design trends
youtube,,https://www.youtube.com/watch?v=4XesSnUum0w,1773090901,Colour Capping! Interior Design Trends,Interior Design Trends for 2026! #InteriorDesign #DesignTrends #Shorts.,interior design trends
youtube,,https://www.youtube.com/watch?v=0NJXCcMxisY,1773086638,A Miami Realtor Ranks Home Design Trends 📉 #shorts,Are barn doors and all-white kitchens still in? I'm ranking the most popular home design trends from S-tier to F-tier based on what ...,interior design trends
youtube,,https://www.youtube.com/watch?v=YEbJiO0lVaM,1773082829,The Biggest Interior Design Trends No One Is Talking About!,Discover the most exciting and underrated interior design trends that are about to take the world of decor by storm. In this video ...,interior design trends
youtube,,https://www.youtube.com/watch?v=rBXtMqDn0Zs,1773080484,Is Green the New Millennial Grey?,Wanna know the most overrated color? It's green. #interiordesigntrends #paintcolors #millennialgrey #green.,interior design trends
youtube,,https://www.youtube.com/watch?v=bTesivt4CA8,1773077193,✨1941 House Beautiful Magazine✨ #1940s #40s #nostalgia #vintage #fashion #home #oldstyle #trends,,interior design trends
youtube,,https://www.youtube.com/watch?v=yK20JE3c_uk,1773074988,Top 100 Modern Modular Kitchen Designs 2026 | Luxury Kitchen Interior Design Ideas &amp; Layouts,TITLE:** Top 100 Modern Modular Kitchen Designs 2026 | Luxury Kitchen Interior Design Ideas & Layouts Discover the **latest ...,interior design trends
youtube,,https://www.youtube.com/watch?v=uNd8Zg-UaoU,1773074863,Waterfall Sink🔥🤔🔥🤔🔥#interior #interiordesign #viral #video #shorts #short #reels #youtube #feed,"interior design,home decor,modern home design,interior trends 2025,luxury interiors,small space ideas,living room design ...",interior design trends
youtube,,https://www.youtube.com/watch?v=aeLYaXC2swI,1773073736,7 Interior Design Trends For 2026,"Interior design is changing fast, and 2026 is bringing some surprising trends into homes everywhere. From textured walls and ...",interior design trends
youtube,,https://www.youtube.com/watch?v=YEcGAU7cfz8,1773138854,DIY Wool Home Decor Idea | Easy Room Decoration with Wool 🧶✨,Learn how to make a beautiful DIY wool home decor idea for your room in this easy YouTube Shorts tutorial. This easy room ...,home decor ideas
youtube,,https://www.youtube.com/watch?v=3frkY-uU0uo,1773137576,Wall decor ideas/Wall hanging craft ideas/Cardboard home decor,,home decor ideas
youtube,,https://www.youtube.com/watch?v=4mINpVgRZ4U,1773133618,Pista Shell Flowers I Home Decor Ideas #diy #craft #shorts,,home decor ideas
youtube,,https://www.youtube.com/watch?v=3BZulkUPXN8,1773132593,Creative Switch Cover Decoration 😍 | Beautiful Home Decor Idea ✨#switchcover #switchplate #switch,switchsticker #switchdecor #homedecor #homedecoration #walldecor #decorideas #creativeideas #diydecor #roomdecor ...,home decor ideas
youtube,,https://www.youtube.com/watch?v=8AGPYGegySg,1773132493,DIY Napkin holder #diy #decor #homedecor #handmadecraft #shorts #shortsfeed,craft #decorideas #diydecor #diyhomedecor #simplecraft #craftshorts #ytshorts #youtubeshorts.,home decor ideas
youtube,,https://www.youtube.com/watch?v=anOGJk63wg4,1773132511,DIY home decor ideas with icecream stick 🌼#shorts,,home decor ideas
youtube,,https://www.youtube.com/watch?v=e3LZ4aSEDlE,1773130606,Kids room makeover ideas #homedecor#kidsroomdecor #kidsroomorganization #roommakeover #homedecor,,home decor ideas
youtube,,https://www.youtube.com/watch?v=HHwU5vLr-xk,1773127813,waste Led bulb reuse ideas/ home decor ideas/ best out of waste #shorts #ashortaday #youtubeshorts,waste Led bulb reuse ideas/ home decor ideas/ best out of waste #shorts #ashortaday #youtubeshorts #homedecor #handmade ...,home decor ideas
youtube,,https://www.youtube.com/watch?v=97uDTs9aMJo,1773126490,Amazing paper flower wall hanging #shorts #youtubeshorts #viralshort #wallhanging #homedecor #craft,diycrafts #wallhanging #homedecor Amazing paper wall hanging /paper craft for home decoration / heart shaped wall decor ideas ...,home decor ideas
youtube,,https://www.youtube.com/watch?v=yz3ne9fyH5k,1773124414,luxury steel door design for home decor ideas for home 🏡 #steeldoor #maindoor #doors #entrydoor,,home decor ideas
youtube,,https://www.youtube.com/watch?v=Ggycvek7Bu4,1773123705,They Turn A Simple Bedroom Into Luxury With One Accent Wall #homedecor #interiordesign #beforeafter,"Welcome to Interiors by Ashwiinii Dongare ✨ We specialize in Luxury Residential Interior Design in Pune, creating personalized, ...",home decor ideas
youtube,,https://www.youtube.com/watch?v=79oUlmj4SGk,1773123415,Colorful Wooden Nesting Dolls | Perfect Gift &amp; Home Decor,woodennestingdolls #matryoshkadolls #handmadedolls #homedecorideas #giftideas #woodencrafts #traditionaltoys #shorts ...,home decor ideas
youtube,,https://www.youtube.com/watch?v=pYU4pjktpAE,1773121502,Floating Cup Home Decor Find You Can’t Miss! Floating Cup Show Piece #mbr #homedecorideas #homedecor,,home decor ideas
youtube,,https://www.youtube.com/watch?v=n5TniFg1Lo4,1773121516,₹99 me Amazing Home Decor 😍 | Anokha Shilpkar Store Tour | Budget Home Decoration Ideas #shorts,,home decor ideas
youtube,,https://www.youtube.com/watch?v=GvqvwUaHIvc,1773118280,home decor ideas &amp; birthday decoration ideas🎀💡💙 #youtubeshorts #viral #shorts #shortsfeed #diycandle,,home decor ideas
youtube,,https://www.youtube.com/watch?v=SgbSjPHvFaE,1773116544,Anniversary flower decoration | flower decoration ideas Noida #homedecor #babyshower #balloon,,home decor ideas
youtube,,https://www.youtube.com/watch?v=QVmVOfjbs10,1773108365,Let’s style and decorate my bedroom dresser #homedecorideas  #tvwallmount  #bedroomdecorideas,"One of my favorite places to style, decorate and redecorate in our bedroom is the dresser right under the TV wall.",home decor ideas
youtube,,https://www.youtube.com/watch?v=nGB1F76MgJw,1773108259,Perfect Wall Frame Setting Trick | Smart Home Decoration Ideas#shorts,,home decor ideas
youtube,,https://www.youtube.com/watch?v=3i2y50zx1lE,1773106292,Diy Home Decor Idea ☘️🌷ll #diy #craft #shorts #shortsvideo #ytshorts,Diy Home Decor Idea ☘️  ll #diy #craft #shorts #shortsvideo #ytshorts.,home decor ideas
youtube,,https://www.youtube.com/watch?v=iYiaf6nTvSQ,1773106299,Ubah suasana di rumah type 36 #arkandahouse #homedecorideas #momlife #wallboard,,home decor ideas
youtube,,https://www.youtube.com/watch?v=24xSxMIl9MA,1773102220,Electrical Meter Box Decoration Ideas Hide Your Meter Box Beautifully#home#shortvideo#viral#fyp#shor,Electrical meter box decorations can give your home a stylish and creative touch while hiding an unattractive meter box.,home decor ideas
youtube,,https://www.youtube.com/watch?v=9jyvwThn1A4,1773099603,Dollar tree home Decor Ideas #homedecor #homedecorideas #dollartree #diy,,home decor ideas
youtube,,https://www.youtube.com/watch?v=EemnYU5jnFc,1773098160,Mashallah very beautiful room wardrobe 💯✅ #homedecorideas #interiordesign #wood #workout,,home decor ideas
youtube,,https://www.youtube.com/watch?v=c685brlId1Q,1773096405,Revolutionary DIY Home Decor Ideas for 2023,Description: Discover the latest and greatest DIY home decor ideas for 2023! From budget-friendly hacks to stunning ...,home decor ideas
youtube,,https://www.youtube.com/watch?v=PXY_oeLB-mk,1773093216,Nuevos zapateros #interiordesign #ideas #home #decoration #homedecor #interior #pasillo #tips #decor,,home decor ideas
youtube,,https://www.youtube.com/watch?v=mO8HYCfB6c4,1773140480,Small Space Luxury: Elegant Parisian Apartment Design | Art Deco Inspired Interiors,"In this video, we explore the refined elegance of a Small Space Luxury Parisian Apartment inspired by the timeless design ...",small apartment decor
youtube,,https://www.youtube.com/watch?v=9Nm4SJ0y7lM,1773140431,Small Space Dark Aesthetic 2026 | Elegant Moody Apartment Design That Feels Rich &amp; Sophisticated,"Discover how small space dark aesthetic design in 2026 can transform compact apartments into luxurious, moody retreats that ...",small apartment decor
youtube,,https://www.youtube.com/watch?v=WJIBMMm9xA4,1773132695,From Ruins to Luxury: The Ultimate Studio Transformation 🏚️✨#HomeRenovation #InteriorDesign !!,Title: From Ruins to Luxury: The Ultimate Studio Transformation 🏚️✨ ​Description: Watch this derelict space turn into a dream ...,small apartment decor
youtube,,https://www.youtube.com/watch?v=1bVueJZDTVA,1773131320,А вы выбрали бы хранение в шкафу или гардеробной❓ #дизайнинтерьера #маленькаяквартира,,small apartment decor
youtube,,https://www.youtube.com/watch?v=YsIOpBCNZFI,1773128517,10 Modern Interior Design Ideas That Look Luxury 😍 | Small Home Decor Ideas 2026 #shorts,Transform your home with these modern interior design ideas that make small spaces look luxurious and stylish. In this short ...,small apartment decor
youtube,,https://www.youtube.com/watch?v=N2tT_9Dap9o,1773127761,This Slim Shoe Cabinet From Amazon Is Perfect for Small Entryways 🤯 #shorts,This narrow shoe cabinet organizer from Amazon is perfect for keeping your entryway clean and clutter-free. It features flip ...,small apartment decor
youtube,,https://www.youtube.com/watch?v=AT7frgGab6k,1773122462,Lazy Sofa Bed – Perfect Comfort for Small Apartments&quot; #shortsfeed,"Upgrade your living space with the ultimate multifunctional sofa bed! In this video, we explore sofas, convertible sofa, sofa beds, ...",small apartment decor
youtube,,https://www.youtube.com/watch?v=egrsOWwe5hk,1773113696,“Adjustable Shower Head Holder – Easy Bathroom Upgrade! 🚿” #shortsfeed,"In this video, we showcase the ultimate triple touch sensor LED mirror and explore the latest LED mirror design perfect for modern ...",small apartment decor
youtube,,https://www.youtube.com/watch?v=t5__5uBwCqc,1773107568,Small bedroom makeover that changes everything,"What if a small bedroom could become the most organized and beautiful space in the house? In this video, we transform a ...",small apartment decor
youtube,,https://www.youtube.com/watch?v=PTjyLpoyxWc,1773103692,Small bedroom but huge storage. Custom furniture makes every corner useful. #interiordesign,"Small bedroom but huge storage. Custom furniture turns every corner into useful space, making even a compact bedroom feel ...",small apartment decor
youtube,,https://www.youtube.com/watch?v=QcOdQdBW7zk,1773102361,The Most Satisfying Mini House Build You’ll See Today,"Welcome to House Tiny! The Most Satisfying Mini House Build You'll See Today Hello and welcome to House Tiny, the ultimate ...",small apartment decor
youtube,,https://www.youtube.com/watch?v=buVq5YG2R58,1773075060,Space-Saving Folding Desk with Bookshelf for Apartment Living #apartment #SpaceSaving,Small apartments often struggle to fit a proper workspace. This space-saving folding desk with integrated bookshelf transforms ...,small apartment decor
youtube,,https://www.youtube.com/watch?v=hJss-LzEE-o,1773072066,Tiny Studio Apartment Makeover | Beautiful Small Space Transformation,This tiny studio apartment makeover demonstrates how thoughtful interior design can completely transform a small and limited ...,small apartment decor
youtube,,https://www.youtube.com/watch?v=TaFIgrJENKA,1773072000,Small Apartment Design Ideas in Paris | Magical Night Lighting That Transforms Tiny Spaces,This small Parisian apartment beautifully demonstrates how thoughtful design can transform limited space into an elegant and ...,small apartment decor
youtube,,https://www.youtube.com/watch?v=DPzjblw0fcw,1773070749,Small Space Luxury Design 2026 Ideas That Elevate Apartments Into Elegant Designer Homes,the best small space luxury design ideas for 2026 that transform ordinary apartments into elegant designer homes. In this video ...,small apartment decor
youtube,,https://www.youtube.com/watch?v=uFERY1It0G0,1773069754,How Parisian Decor Philosophy Transforms Small Apartments into Artful Homes,"In this relaxing home tour, we explore how Parisian decor principles — simplicity, balance, vintage craftsmanship, and soft neutral ...",small apartment decor
youtube,,https://www.youtube.com/watch?v=-wgTHrqjVBA,1773068859,"Small Space Styling Ideas That Make Your Home Feel Luxurious, Calm and Beautiful","Discover small space styling ideas that make your home feel luxurious, calm, and beautifully designed. In this video, we share ...",small apartment decor
youtube,,https://www.youtube.com/watch?v=nuGvxV4Lztk,1773068487,Prieto Móveis - Superou as expectativas! O projeto completo que transformou o apê do Hélio.,Cansado de promessas vazias em marcenaria? Descubra como o Hélio superou experiências ruins do passado e transformou ...,small apartment decor
youtube,,https://www.youtube.com/watch?v=O1fmuji-j7o,1773068441,Achados que vão facilitar a vida para quem mora em apartamento pequeno #shorts #achadinhos,Link abaixo Prateleira: https://s.shopee.com.br/8pgucQgnBB Bancada ripada: https://s.shopee.com.br/900Kojg9qE Organizador ...,small apartment decor
youtube,,https://www.youtube.com/watch?v=L_-zyhfAocY,1773068400,Turning My One Bedroom Apartment Into A Cozy Home (Part 6),"this bedroom makeover was long overdue but loving the progress so far! If you're new here, welcome to my apartment ...",small apartment decor
youtube,,https://www.youtube.com/watch?v=SISEfI-AhbQ,1773067663,Elegant Small Apartment Interiors for 2026 That Feel Straight Out of a Designer Magazine,Discover elegant small apartment interiors for 2026 that feel straight out of a designer magazine. This inspiring home design ...,small apartment decor
youtube,,https://www.youtube.com/watch?v=WzlMK532jKQ,1773066633,✨ Modern Luxury Washroom 🚿 | Interior Design Goals 🏡#washroom #luxury #shorts #trending #viral,Modern Luxury Washroom | Interior Design Goals #washroom #luxury #shorts #trending #viral washroom interior design ...,small apartment decor
youtube,,https://www.youtube.com/watch?v=tjxty4g5qqI,1773064773,2026 Small Apartment Entryway - Elegance And Luxury in A Every Detail. #shorts,"A small apartment entryway can still make a big and luxurious first impression. In this video, we explore 2026 small apartment ...",small apartment decor
youtube,,https://www.youtube.com/watch?v=hiYcMyhaZqA,1773062956,Small Apartment Sofa Bed – Stylish and Practical Comfort &quot; #shortsfeed,"Upgrade your living space with the ultimate multifunctional sofa bed! In this video, we explore sofas, convertible sofa, sofa beds, ...",small apartment decor
youtube,,https://www.youtube.com/watch?v=aL96vnFRSW8,1773058801,Tiny Apartment Decorating Ideas That Instantly Maximize Your Space,"Living in a tiny apartment doesn't mean sacrificing comfort or style. In this video from Decor Pedia, we explore smart decorating ...",small apartment decor
