source,domain,url,created_utc,title,text,query
gnews,news.google.com,https://news.google.com/rss/articles/CBMikwFBVV95cUxOUWpHQzBETTlubzVhenMxZ05RNjNrdXdfUU5rZWg3Vnd0aFpXb0RRYlZFRWx4UU5YUFJVdWRXZzRta1Q2TUtNbEtibTVISE1oY3MxbC1yb045U3BTalltSzF4cWJkZnI0aEhYeGtTeVNSQ3FUc041SVBIZVN3bDNMQjZjMFRmREkyUnhrV0dXNmF1U1k?oc=5,1777899902,New & Noteworthy: April Trend Advisor edition - Home Accents Today,New & Noteworthy: April Trend Advisor edition - Home Accents Today,home decor trend
gnews,news.google.com,https://news.google.com/rss/articles/CBMikwFBVV95cUxObHRSWDFUWWVPMDlWS1JVNlBMUHhlTUNGU2R6S1VwR3YtZHVZNmVFLVF3WnowUno0OHVnRGxvdFpEQlhfYmt4YWZWelVjUHc5RXBHbWRoTDFoWUZvTXpUVmplS3d6cGhEODZVdFk4NUNqRTJ2dUlUTE9OMzJYVVZCZFZhNTRXTlN1ekdId2JYUzFnVzg?oc=5,1777791600,"Psychologists Explain Why Everyone’s Suddenly Obsessed With ""Grandma Things"" - House Beautiful","Psychologists Explain Why Everyone’s Suddenly Obsessed With ""Grandma Things"" - House Beautiful",home decor trend
gnews,news.google.com,https://news.google.com/rss/articles/CBMigwFBVV95cUxOTWZMM3VubFR4OUtWQmJXblUxbDN5ZG8xQWR0WmMzQ1c5T3RGOHkwZExtLXhOMUxueEFGRmx3akNJNkhCV2lRU0N4SjA4alhNWHhKcXdwalo1aHhjbTM4YngtSjlpZU40aTBLS1Q3ZWZlY25FdjZiSzJsb1dnbFVPZko2MA?oc=5,1778115970,NCAA Marquette Golden Eagles Low Top Shoes - DESIGN-TREND - portalcantagalo.com.br,NCAA Marquette Golden Eagles Low Top Shoes - DESIGN-TREND - portalcantagalo.com.br,home decor trend
gnews,news.google.com,https://news.google.com/rss/articles/CBMia0FVX3lxTFBhNEwtTzVyTUpicmYtMlBfV3dlQWJyUV9aMlhHcVROOVpISE9heFM1bVpiRGlKZnJTcjY2NWNWQ29qaldoQVM4NzR3d3BmX3NQSXFwc2RSRGRodUQ4NnF2UGtQeGw1TWR5LU1r?oc=5,1776236400,"The Y2K Teen Bedroom Is Back, Baby - Popsugar","The Y2K Teen Bedroom Is Back, Baby - Popsugar",home decor trend
gnews,news.google.com,https://news.google.com/rss/articles/CBMiowFBVV95cUxQd2FzMzlaNC1DdTJRWWJqQ0pPSmotalUzdC1SQkxCVE04RDhtUmNTYk96MUlqR3VxWm1wc1p2a0VRR01KelRRazNlVkxqV3lOeXRuZkVsdGRLX01XQUkwS1UzV1Z3cE5IcjhUV1ZCMVNTdWZMOEcwcVdNemJyRDYxRXNJVmhuNVJ4UlpHVDhKbFVOR0J0N25vd2NlUmZnNGFHaVp3?oc=5,1776927600,Equestrian Home Decor Is Galloping Into 2026–Here’s How to Get the Look - The Pioneer Woman,Equestrian Home Decor Is Galloping Into 2026–Here’s How to Get the Look - The Pioneer Woman,home decor trend
gnews,news.google.com,https://news.google.com/rss/articles/CBMiugFBVV95cUxNMUY0NG9wT2huenhYeGRRVzE1MWNReHd2cTdZNENuN0lXQ3dwS2dmREt1RGVJYTFsdVUyQ3BYSGZ1LXpvbWI2cXZESkZJallROGR1Mm9QY20tSS1NVmlmSjVoM1BTZUtRU1p1UWVKZmswZGpIRURnVGc5QTFtX25VY0VnM2NxeGlGMzR6ZFFQOEx5LVpUMkpqMWRqMFNJTnRUM2hrLWt0VGRtR1pkeUdmancxNy1XdEhza3c?oc=5,1776236400,A Design Editor Applies Color and Restraint in His Madrid Apartment - nytimes.com,A Design Editor Applies Color and Restraint in His Madrid Apartment - nytimes.com,small apartment decor
gnews,news.google.com,https://news.google.com/rss/articles/CBMie0FVX3lxTE9FOHFoOXF6a2wwSHIwTGZjcmdTYzVZQ19GUUFZc2djcFMwMVZhYVRNQ2ZxSy1NVzNELTk1SWw0ZzFmZHNnR09uUkRLWVNuNlljUmwxZXB1dzZBN2tjUXNvTGl6aHNfOXhnVUYzaG5MWWNzWEhyX3BoLUJBbw?oc=5,1777014000,7 Holiday Design Ideas From a Designer Who Went All In on Christmas — In 700 Square Feet - Apartment Therapy,7 Holiday Design Ideas From a Designer Who Went All In on Christmas — In 700 Square Feet - Apartment Therapy,small apartment decor
gnews,news.google.com,https://news.google.com/rss/articles/CBMiZkFVX3lxTE5Fa2ZDa3FhcWhRMUFUVTFjWUFRbkRsWFZpN2txY1NubXowLUlWMkI5U094TzlHXzRZeHR3OEEySVNvVWh4UXdZMmxyeGd6Ymdlcm5hQUVtWHZxdkxzaDJGb2VjWmZYZw?oc=5,1776719374,7 Genius Patio Ideas That Do So Much More Than Just Seating (All in Time for Summer!) - Apartment Therapy,7 Genius Patio Ideas That Do So Much More Than Just Seating (All in Time for Summer!) - Apartment Therapy,small apartment decor
gnews,news.google.com,https://news.google.com/rss/articles/CBMihAFBVV95cUxQSzlSUEh3UUxGOE5uNkxLS3Y0c1FRNEdyelZqaDBoODIzRjZOMF9jUDF4cUY5Z19wOTVJdFN0UHYyV2diNTZobFZtSC12dDl0NUNoUFVrTG15SXF3VzAxcDBfckUtNGFlaVpSajEybHRKWkZuZDE2MmFMZ1NXMGN4aUN3UWk?oc=5,1775631600,This 315-Square-Foot NYC Studio Uses Strategic White Decor (and a No-Drill Canopy Bed!) to Feel Huge - Apartment Therapy,This 315-Square-Foot NYC Studio Uses Strategic White Decor (and a No-Drill Canopy Bed!) to Feel Huge - Apartment Therapy,small apartment decor
gnews,news.google.com,https://news.google.com/rss/articles/CBMib0FVX3lxTE9jOGJhVTVKZDZrbXRGMVhJeDlEN3lTdEFIRXBJRDVfRWxMN0lyYzY2TG5JOWlUMzFBYVhvSHo2QzdKUlpfb1F1T2IxcllEdDIyLU5EVS1NNjlteHMyeTRPOG9wV25iejJqWjNQcmZ2Yw?oc=5,1776495600,Give Your Small Entryway a Welcoming Boost With These 31 Ideas - The Spruce,Give Your Small Entryway a Welcoming Boost With These 31 Ideas - The Spruce,small apartment decor
gnews,news.google.com,https://news.google.com/rss/articles/CBMidEFVX3lxTE0tX3hmcmROaWY1eUZ1bURnQTR4R2ktbktpNVpYNnhZR1V1Z3BfaWxVZ0VZWjRNMTl1eTl4M3Q2MXJYNXFITHFaSFFKTU5OVDNSR2hrV093WnRkY2l2SGQ1cFlmN2ZuZXE3eTZfU1ZOeFluWjNP?oc=5,1775545200,33 Small Laundry Room Ideas for the Tiniest of Spaces - Architectural Digest,33 Small Laundry Room Ideas for the Tiniest of Spaces - Architectural Digest,small apartment decor
youtube,,https://www.youtube.com/watch?v=hSCd62SbpN8,1778193903,Warm Minimalist Living Room 2026 ✨ Cozy Luxury Interior Design Trends,Discover the future of elegant interiors with Warm Minimalist Living Room 2026 by TRK Studio. This video showcases luxurious ...,interior design trends
youtube,,https://www.youtube.com/watch?v=sjMNTwBhsc0,1778192544,Making a Glass Sky Floor Step by Step #homedesign... #Shorts #carlovers.1100,Making a Glass Sky Floor Step by Step #homedesign... Making a Glass Sky Floor Step by Step #homedesign... Making a Glass ...,interior design trends
youtube,,https://www.youtube.com/watch?v=-t2E2loZJr0,1778184000,"Elegant! 🏛️ Italian Interior Design Ideas 2026 with Luxury Marble, Gold Accents &amp; European Style","Italian interior design ideas are not about excess — they are about the precise, considered use of the very best materials, ...",interior design trends
youtube,,https://www.youtube.com/watch?v=Pn697ZiepXs,1778179836,More Shelving Ideas!,Some more ideas for shelving! #interiordesign #homeremodeling #homedesign #luxuryhomes #designer #homes #construction ...,interior design trends
youtube,,https://www.youtube.com/watch?v=Hdl3GVeGBRM,1778171420,Wait Until You See the Inside of This Closet 😍 #walkinwardrobe #designtrends #homedecor,Dream Walk-In Closet Designs 2026 | Luxury Wardrobe Goals #reels #shortfeed #closecall Description: This channel is all ...,interior design trends
youtube,,https://www.youtube.com/watch?v=8gbRQXhiEow,1778167527,Small Modern Kitchen Design Trends 2026 || @gninteriorbd,"Our company name is GN INTERIOR Our service about interior design, interior decoration, home interior design, bedroom interior ...",interior design trends
youtube,,https://www.youtube.com/watch?v=QZb8dYsJuXg,1778167098,2026 Interior Design Trends: High-Gloss Laminates &amp; Custom Wood Paneling,"Step inside our latest project as we bring a modern vision to life! In this video, we're showcasing the intricate details of a home ...",interior design trends
youtube,,https://www.youtube.com/watch?v=7d8Tf77aeEU,1778166023,8 MUST SEE Kitchen Design Trends &amp; Remodeling Ideas from a Home Builder!,8 MUST SEE Kitchen Design Trends & Remodeling Ideas from a Home Builder! Kitchen trends in 2026 are changing fast—and ...,interior design trends
youtube,,https://www.youtube.com/watch?v=1WRp6WN2VEQ,1778164762,tv cabinet design for living room ideas #interiordesign,tv cabinet design for living room ideas #interiordesign 25 Modern TV Cabinet Designs for Stylish Living Rooms ✨ Latest TV Unit ...,interior design trends
youtube,,https://www.youtube.com/watch?v=VCQ6n6W9Osw,1778164221,Modular Kitchen Designs India #yt #youtube #trending #shorts #interiordesign #kitchen #trends #home,Still compromising on hygiene? What looks clean outside isn't always truly hygienic. Tusker Steel Kitchens in 304 stainless steel ...,interior design trends
youtube,,https://www.youtube.com/watch?v=JqKml633PdM,1778159541,Interior Designers Are Using THIS Art Trend in 2026 | Luxury Wall Art Project #interiordesign,Interior Designers Are Using THIS Art Trend in 2026 | Luxury Wall Art Project #interiordesign Discover how modern interior ...,interior design trends
youtube,,https://www.youtube.com/watch?v=murbbMnD2E0,1778156942,home interior design work 🥰#youtubeshorts #viral #viralvideo #foryou #trending #shorts #short,home interior design work #youtubeshorts #viral #viralvideo #foryou #trending #shorts #short3bhk interior design best interior ...,interior design trends
youtube,,https://www.youtube.com/watch?v=hNyUzVovowM,1778156317,Plinth Bases and Monoliths: High End Furniture Forms for Boutique Homes,"Furniture is no longer just functional, it is becoming a defining architectural element within modern interiors. In this video, we dive ...",interior design trends
youtube,,https://www.youtube.com/watch?v=rFr28YaLMkc,1778155553,TOP 20 Luxury TV Wall Design Trends 2026: Modern TV Unit Design &amp; Stylish TV Wall Decor Ideas,TOP 20 Luxury TV Wall Design Trends 2026: Modern TV Unit Design & Stylish TV Wall Decor Ideas Looking for the ultimate ...,interior design trends
youtube,,https://www.youtube.com/watch?v=JfWx9eHmUC4,1778155238,Interior Design Trends to AVOID in 2026 (What&#39;s Already Outdated),"Not every 2026 interior design trend is worth following. In this video, I reveal the trends you should avoid — and what to do instead ...",interior design trends
youtube,,https://www.youtube.com/watch?v=4o61ED9s6EM,1778153410,"Seamless finishes, smart storage, flawless installation — the art of modern kitchen design.","In this video, we're exploring the art of interior design with practical tips and creative ideas to transform your space. With over 10 ...",interior design trends
youtube,,https://www.youtube.com/watch?v=q26Aqd0PRXY,1778152687,Black Ivory Printed Cotton Lumbar Pillow – Mono Sphere #interiordesign #homedecor #homestyling #home,"""   Minimalist Monochrome Elegance | Mono Sphere Lumbar Pillow Cover Upgrade your living space with the sophisticated ...",interior design trends
youtube,,https://www.youtube.com/watch?v=qB8w1GwHak8,1778151600,Tiny Home Glow-Up! Cozy Rustic Boho Cottage Decor Ideas for Small Spaces,Tiny Home Glow-Up! We're moving away from the cold minimalism of the past and embracing the warmth of 2026 interior design ...,interior design trends
youtube,,https://www.youtube.com/watch?v=69K9KakoAYM,1778148131,Biophilic design isn’t just a trend. it’s the future of modern living 🌿 #biophilicinteriors,"Biophilic design isn't just a trend. it's the future of modern living As cities grow faster and lives get busier, people are craving ...",interior design trends
youtube,,https://www.youtube.com/watch?v=yaZTcYceDXQ,1778144432,Not Just a Transformation… A Whole New Feeling ✨,"Not just a transformation… a whole new feeling. ✨ Every detail, every texture, and every corner was designed to turn a house into ...",interior design trends
youtube,,https://www.youtube.com/watch?v=6F6g7SCQI20,1778144408,Aesthetic Modern Apartment Tour  Pure Elegance 🌿✨,Explore the sleek lines and stunning textures of this high-end modern apartment. We tour the open-plan living room with massive ...,interior design trends
youtube,,https://www.youtube.com/watch?v=pZEVZUKQBUQ,1778143159,#interiordesigntips #designtrends,,interior design trends
youtube,,https://www.youtube.com/watch?v=mQjIU8k9xOo,1778141615,Luxury Interior Design Ideas 2026 🏗️ Dream Home Transformation &amp; Modern Decor Trends #interiordesign,"Transforming ordinary spaces into luxurious dream environments that reflect style, comfort & personality! ✨ From elegant living ...",interior design trends
youtube,,https://www.youtube.com/watch?v=wRAa-9vBO7s,1778139907,​Would You Sleep on a Floating Bed  #Satisfying #home #shorts,Would You Sleep on a Floating Bed? 🛏️ Experience the most satisfying bedroom transformation ever! From raw river stones to a ...,interior design trends
youtube,,https://www.youtube.com/watch?v=aFEJyIiEbjc,1778137200,"как сделать, чтобы интерьер выглядит дорого #дизайнинтерьера",Подписывайся на канал @AlenaaTotskaya чтобы быть в тренде современного дизайна Оставить заявку на дизайн ...,interior design trends
youtube,,https://www.youtube.com/watch?v=wqMwKBTiRvI,1778187665,Styling My Bookcase with Neutral &amp; Gold Decor ✨ | Elegant Home Decor Ideas,"Bestfriends welcome back to another jam back motivatal video. As always, I'm allowing God to order every step — even in the ...",home decor ideas
youtube,,https://www.youtube.com/watch?v=Vlz7IfnaZRk,1778186828,Ideia compacta para banheiro #interiordesign #interiordesign #dicasdecoracao #homedecor,,home decor ideas
youtube,,https://www.youtube.com/watch?v=YXxBsDMXGdU,1778183251,DIY Elegant Candle Holder Decoration 🌸✨ | Easy Home Decor Idea #shorts#youtubeshorts,DIY Elegant Candle Holder Decoration ✨ | Easy Home Decor Idea #shorts#youtubeshorts Turn simple materials into a beautiful ...,home decor ideas
youtube,,https://www.youtube.com/watch?v=kBEtPJ3nDaI,1778181902,Ideas para decorar  PRIMAVERA VERANO 🍋 #cocina,Lo encontré en persona es realmente hermoso Las florecitas son de @hobbylobby y sólo utilicé siete ramitas. Justo ahora ...,home decor ideas
youtube,,https://www.youtube.com/watch?v=j9fBf4yd2Eo,1778181581,Comprando cosas para hacer cambios en mi hogar #compras #home #homedecorideas #homedecoration #vlog,,home decor ideas
youtube,,https://www.youtube.com/watch?v=d7DYOAnYdg4,1778180439,$20 vs $240… ¿notas la diferencia? 👀 #homedecor #diy #interiordesign,"Hola y bienvenidas a un nuevo video, chicas! Hoy les comparto cómo di nueva vida a una base de mimbre con un poco de ...",home decor ideas
youtube,,https://www.youtube.com/watch?v=0zN8GjUKNk4,1778178617,Decoración Verano 🌞 2026 Hobby Lobby #homedecor #summer #colección #ideas #homedecor,Te Invito A Seguir Me En Mi Pagina de Instagram: https://www.instagram.com/marisolgregoriomar/,home decor ideas
youtube,,https://www.youtube.com/watch?v=WZhZJZI2GjY,1778178206,Elimina moho y humedad #tips #truco #viral #caseros #hogar #caseros #homedecorideas #homemade,,home decor ideas
youtube,,https://www.youtube.com/watch?v=Dk8ww0BvNPg,1778172398,DIY Aesthetic Key Holder Polymer Clay Home Decor Ideas #clayart #handmadedecor,,home decor ideas
youtube,,https://www.youtube.com/watch?v=Bl7fJzYde5Y,1778171230,M.M #brilliant #look #fashionable kitchens #home decor ideas 💡,,home decor ideas
youtube,,https://www.youtube.com/watch?v=Mi7yELN7lH0,1778171009,Revolutionary DIY Home Decor Ideas for 2023,Description: Discover the latest and greatest DIY home decor ideas for 2023! From budget-friendly hacks to stunning ...,home decor ideas
youtube,,https://www.youtube.com/watch?v=Ngop0iGzeck,1778170917,THRIFTED REPURPOSE IDEAS #thrifting #homedecorideas #decor #vintage #shopping #repurposed #diy,Multiple ways to repurpose a vanity tray!,home decor ideas
youtube,,https://www.youtube.com/watch?v=E_e2-_81HhY,1778170441,covers for Sofa seat! living room decor ideas #shorts,covers for Sofa seat! living room decor ideas #shorts Sectional sofa cover Aesthetic home decor Living room makeover Jacquard ...,home decor ideas
youtube,,https://www.youtube.com/watch?v=hITCgK9FRTM,1778170470,Shop at the link 🔗 in my bio! An easy decor idea for an empty corner 😍🙌 #homedecor,,home decor ideas
youtube,,https://www.youtube.com/watch?v=TpXbxuCSowU,1778168689,#homedecorideas #kitchen #kitchendesign #kitchendesignideas #homedecor #elegantkitchen,,home decor ideas
youtube,,https://www.youtube.com/watch?v=_9cLi-4ktf0,1778168476,Cozy Candle Decor Ideas for a Peaceful Home ✨🕯️,A simple cozy candle arrangement with soft light and flowers ✨ I love creating peaceful little corners at home. #shorts ...,home decor ideas
youtube,,https://www.youtube.com/watch?v=yJ328Q36e_0,1778168054,Butterfly Craft Idea for Home Decor 🦋 Budget Friendly DIY #shorts #diy #neetusdiyandart #craft,"Welcome to my DIY craft channel In this video, I made a beautiful Butterfly Tree Craft using simple and waste materials.",home decor ideas
youtube,,https://www.youtube.com/watch?v=jr4oPsdMpoM,1778167209,Aesthetic home decor ideas#diy #craft #shorts #homedecor #shortsfeed #youtubeshorts #viral,Diy plastic spoons craft idea#diy #craft #shorts #homedecor #shortsfeed #youtubeshorts #viral.,home decor ideas
youtube,,https://www.youtube.com/watch?v=iyXNt6Edql8,1778166905,Easy Asthetic Room Decor Ideas ✨| DIY Home Decor 🦋 #shorts #viralshorts #homedecor  #diy #asthetic,Easy Asthetic Room Decor Ideas ✨| DIY Home Decor #shorts #viralshorts #homedecor #diy #asthetic DIY Home Decor✨|| ...,home decor ideas
youtube,,https://www.youtube.com/watch?v=7lxEDR_Oeng,1778165712,Cozy Living Room Home Decor Ideas,,home decor ideas
youtube,,https://www.youtube.com/watch?v=PIDFx1dPKMw,1778165453,Living Room Makeover | Low Cost  Home Decor Ideas | How I keep Home Clean &amp; Organized | WomeniaATF,Living Room Makeover | Low Cost Home Decor Ideas | How I keep Home Clean & Organized | WomeniaATF WomeniaATF HUB ...,home decor ideas
youtube,,https://www.youtube.com/watch?v=uAgce5zZSfc,1778164955,Diy with home decor ideas 😱#shorts,Diy with home decor ideas #shorts.,home decor ideas
youtube,,https://www.youtube.com/watch?v=TSJSdbyV5Pc,1778164341,DIY Realistic Lucky Bamboo Plant 🌿✨#shreyacrafter #shorts #bamboo #homedecor #diy,DIY Realistic Lucky Bamboo Plant ✨ Hey cuties! Today I'm making this super realistic Lucky Bamboo Plant using just paper!,home decor ideas
youtube,,https://www.youtube.com/watch?v=s0h4HSXPRdI,1778162507,Aesthetic Home Decor #diy #viralshort #trendingshorts #handmade,DIY Colorful Paper Plate Wall Decor Easy Handmade Home Decor Idea ✨ Creative Plate Painting Design for Room ...,home decor ideas
youtube,,https://www.youtube.com/watch?v=8kkQgQ3l_Ho,1778162412,Turn Glass Jars into Elegant Vintage Flower Vases | Home Decor Ideas,Home decor ideas meet a beautiful vintage flower vase in this creative upcycling hack. Turn ordinary glass jars into elegant ...,home decor ideas
youtube,,https://www.youtube.com/watch?v=sSOinjAereY,1778191259,NYC closets are overflowing… time for a fix! 😤#ANTBOX #NYCCloset #WardrobeUpgrade #smallspaceliving,Need more storage? Try our modular wardrobe: https://www.antboxstorage.com/products/foldable-wardrobe-with-hangers ...,small apartment decor
youtube,,https://www.youtube.com/watch?v=gd5eeqekSDg,1778191250,I Found the Cheapest Apartment in Manhattan… And People Can’t Believe It 😳🏙️,"Everyone thinks living in Manhattan means spending millions… but that's not always true This apartment proves that creativity, ...",small apartment decor
youtube,,https://www.youtube.com/watch?v=v5btblaPtOo,1778190061,Small Apartment Hack! 🛋️ Turns Into a Bed Instantly 😴 #Shorts,Transform your empty corner into a functional space! This video showcases a versatile convertible sofa bed perfect for small ...,small apartment decor
youtube,,https://www.youtube.com/watch?v=MEqiUmLsFd4,1778186460,THIS Small Sofa Just Changed My Apartment Forever! (132cm Sofa Bed Transformation),Discover the ULTIMATE small apartment game-changer! This 132cm 多功能 sofa bed transforms from cozy seating to full-size bed ...,small apartment decor
youtube,,https://www.youtube.com/watch?v=JAZGdQV-xJQ,1778186461,🛋️ Sofa to Bed in SECONDS! Perfect for Small Apartments  #Shorts,"Transform your small space with this amazing 3-in-1 sofa bed! Initially looks like a stylish cream loveseat, but pull out the ...",small apartment decor
youtube,,https://www.youtube.com/watch?v=QySHUDHv1Hs,1778166050,SMALL SPACES DECORATING IDEAS #smallspacedecoratingideas #interiordesign,"In today's video I share an alternative for decorating a den or small apartment. Instead of buying a large sofa or loveseat, try using ...",small apartment decor
youtube,,https://www.youtube.com/watch?v=8cD8KOp5aVo,1778163943,small living room transformation video of an apartment in modern style,,small apartment decor
youtube,,https://www.youtube.com/watch?v=0S3pY4NqYPw,1778162404,Hidden Murphy Bed for Small Apartments | Space Saving Bed #murphybed #shorts,Hidden Murphy Bed for Small Apartments | Space Saving Bed Smart Space Saving Murphy Bed DesignModern Murphy Bed ...,small apartment decor
youtube,,https://www.youtube.com/watch?v=-vS76NBrLKM,1778160601,"Small Apartment Ideas | Modern Living Room, Kitchen And Dining Design","Small spaces don't have to feel limited. In this video, modern apartment living is explored through layouts that bring the living ...",small apartment decor
youtube,,https://www.youtube.com/watch?v=FUZpKuVex_A,1778158802,54 New AMAZON FINDS for TINY Apartments | Smart Space Saving Furniture Ideas [With Prices],54 New AMAZON FINDS for TINY Apartments Struggling with a tiny apartment and cluttered kitchen space? These Kitchen ...,small apartment decor
youtube,,https://www.youtube.com/watch?v=lVcpht7VCqY,1778157478,Ultimate 3D Interior Design Makeover 🔥 | Small Room Transformation | Modern Home Ideas 2026,"Watch the ultimate 3D interior design makeover and see how a small space is transformed into a modern, stylish, and functional ...",small apartment decor
youtube,,https://www.youtube.com/watch?v=8Xtz3x8Is24,1778155214,Soluções geniais pra quem vive em apê pequeno  #achadinhos #shopee #dicas,Soluções geniais pra quem vive em apê pequeno #achadinhos #dicas #shopee #donadecasa #casapequena ...,small apartment decor
youtube,,https://www.youtube.com/watch?v=nL_ncAra2ec,1778153485,Genius Tiny Studio Apartment Makeover Ideas for Small Spaces,Transform your tiny studio apartment into a stylish and functional dream space with these genius makeover ideas for small homes ...,small apartment decor
youtube,,https://www.youtube.com/watch?v=bBo2Jl64aKM,1778149832,Quiet Luxury in Paris Inside a Tiny Dream Apartment That Feels Like a Boutique Hotel,"Welcome back to Gelux Home! This video takes you inside a tiny Parisian dream apartment, demonstrating that luxury is about ...",small apartment decor
youtube,,https://www.youtube.com/watch?v=8oTwekhbNDs,1778148024,multi functional space saving furniture for small apartment #shorts,multi functional space saving furniture for small apartment #shorts.,small apartment decor
youtube,,https://www.youtube.com/watch?v=kUcL9vxknj0,1778144475,#recreationalvehicle  #travel  #camping #travel trailer camping#automobile,house design plan house design ideas interior design ideas interior design ideas for small house house design planner free ...,small apartment decor
youtube,,https://www.youtube.com/watch?v=GRwAbEbS8Yk,1778144432,💥ИЗ 25м² В ШЕДЕВР! Яркая квартира с гениальным зонированием и эксклюзивной спальней| Обзор интерьера,"Добро пожаловать в самую функциональную студию, которую вы видели. Всего 25 квадратных метров, но здесь есть все: ...",small apartment decor
youtube,,https://www.youtube.com/watch?v=Dqg78gQMh7Q,1778141319,Grey 3x3m Loft Bed Design Idea for Small Rooms,,small apartment decor
youtube,,https://www.youtube.com/watch?v=fcgRkjmnInA,1778127961,Genius Tiny Apartment Decor Ideas to Maximize Every Inch,Discover genius tiny apartment decor ideas that help maximize every inch of your small home without sacrificing comfort or style ...,small apartment decor
youtube,,https://www.youtube.com/watch?v=rswdZrNmvP4,1778124168,Genius Tiny Apartment Decor Ideas for a Cozy &amp; Stylish Home,Transform your tiny apartment into a cozy and stylish dream home with these genius decor ideas from HAS Design! In this video ...,small apartment decor
youtube,,https://www.youtube.com/watch?v=3fwLTjuF30k,1778118335,Tiny Studio Apartment → Luxury Epoxy Loft Transformation,Watch this unfinished studio apartment transform into a luxury modern loft with a stunning metallic epoxy marble floor. From dusty ...,small apartment decor
youtube,,https://www.youtube.com/watch?v=h_I88j2TQE8,1778117671,Cozy Wooden Bookshelf for Bedroom Reading Corners ✨#BedroomDecor #SmallSpaceLiving,"A warm wood bookshelf styled for a cozy bedroom corner, perfect for books, plush toys, and calm everyday storage. This soft ...",small apartment decor
youtube,,https://www.youtube.com/watch?v=KUy1kcMwa3Q,1778112032,Perfect for small spaces or a cozy guest room  Where would you use it? #sofa #furniture #shorts,"From couch mode to bed mode in seconds. Extendable slats make the switch effortless. Perfect for apartments, guest rooms, and ...",small apartment decor
youtube,,https://www.youtube.com/watch?v=JqONo11aGCM,1778112016,Tiny Budgets Big Transformations for Living Spaces,A quick tour of budget-friendly decorating ideas that span minimalist calm to vibrant energy with practical tips and easy DIYs.,small apartment decor
youtube,,https://www.youtube.com/watch?v=VXnZ8ya_h_4,1778106260,Small apartment with a big sofa 🤭#sofa #sofabed #home #homedesign #sofacover,,small apartment decor
