source,domain,url,created_utc,title,text,query
rss,www.archdaily.com,https://www.archdaily.com/1040556/house-snb,1776837600,House SNB / Constanze Ladner,"House SNB / Constanze Ladner

<p>On the outskirts of <a href=""https://www.archdaily.com/tag/wiesbaden"">Wiesbaden</a>, directly adjacent to the city forest, this historic apartment unfolds as a sequence of clearly articulated rooms shaped by a remarkably intact original fabric. The spatial character is defined by finely detailed stucco ceilings, ranging from restrained to floral, paired with herringbone parquet in the connecting rooms and wooden floorboards in more private areas. Dark door and window frames, original built-in elements, and subtle traces of former uses lend the interiors a layered depth and establish a strong narrative foundation for the project.</p>",
rss,www.archdaily.com,https://www.archdaily.com/1040850/on-international-mother-earth-day-urban-rewilding-aquatic-ecosystems-and-ancestral-practices-for-biodiversity,1776835800,"On International Mother Earth Day: Urban Rewilding, Aquatic Ecosystems, and Ancestral Practices for Biodiversity","On International Mother Earth Day: Urban Rewilding, Aquatic Ecosystems, and Ancestral Practices for Biodiversity

<p>The United Nations' International Mother Earth Day, observed annually on April 22, <a href=""https://unhabitat.org/events/international-mother-earth-day-2?utm_medium=website&amp;utm_source=archdaily.com"" rel=""noopener"" target=""_blank"">aims to ""promote harmony with nature and the Earth.</a>"" In light of the urgency posed by climate change, it seeks to raise awareness of the challenges of preserving all forms of life supported by the planet. It is a call to the global community to safeguard biodiversity while striving to balance economic, social, and ecological systems. Crimes against biodiversity include large-scale practices such as deforestation, land-use change, intensified agriculture, livestock production, and illegal wildlife trade, <a href=""https://www.un.org/en/observances/earth-day?utm_medium=website&amp;utm_source=archdaily.com"" rel=""noopener"" target=""_blank"">all considered by the UN to be accelerating factors in the destruction of the planet</a>.</p>",
rss,www.archdaily.com,https://www.archdaily.com/1040737/open-call-for-projects-team-lead-at-archdaily,1776832200,Open Call for Projects Team Lead at ArchDaily,"Open Call for Projects Team Lead at ArchDaily

<p>ArchDaily is looking for a Projects Team Lead to guide the curation and strategic development of one of the platform's core content pillars: built projects. This role sits at the intersection of editorial and architectural judgment, data-driven strategy, and team leadership, shaping how architecture is selected, presented, and amplified to a global audience.</p>",
rss,www.archdaily.com,https://www.archdaily.com/1040209/van-wassenhove-residence-living-the-radical-continuity-of-juliaan-lampens,1776830400,Van Wassenhove Residence: Living the Radical Continuity of Juliaan Lampens,"Van Wassenhove Residence: Living the Radical Continuity of Juliaan Lampens

<p>Architectural history often advances through iconic gestures or technological breakthroughs, yet some works remain influential precisely because they resist spectacle. Built between 1972 and 1974 in <a href=""https://www.archdaily.com/city/sint-martens-latem"">Sint-Martens-Latem</a>, <a href=""https://www.archdaily.com/search/projects/country/belgium"">Belgium</a>, the <a href=""https://museumdd.be/en/locations/woning-van-wassenhove?utm_medium=website&amp;utm_source=archdaily.com"" target=""_blank"">Van Wassenhove Residence </a>stands as one of those quiet but decisive projects. Conceived as a single, continuous concrete volume set within a wooded landscape, the house challenges conventional ideas of domestic comfort, privacy, and spatial hierarchy. Its presence is direct and uncompromising, yet it avoids monumentality, positioning itself instead as a lived structure shaped by everyday rituals and long-term inhabitation.</p>",
rss,www.archdaily.com,https://www.archdaily.com/1040650/lumen-coffee-1936-snkh-studio,1776826800,Lumen Coffee 1936 / snkh studio,"Lumen Coffee 1936 / snkh studio

<p>A reversible stainless-steel intervention within Yerevan's oldest preserved interior from the 1930s. Lumen Coffee 1936 revives a former bookstore, revealing the ""Oriental Art Nouveau"" wooden setting and creating a refined dialogue between heritage and contemporary design.</p>",
rss,www.archdaily.com,https://www.archdaily.com/1040839/champawat-market-plaza-compartment-s4,1776823200,Champawat Market Plaza / Compartment S4,"Champawat Market Plaza / Compartment S4

<p>Can local crafts move beyond being exhibited within architecture to instead shape architecture itself so that the building becomes a living craft, setting a visible and replicable model for cultural and economic revival within the rural ecosystem?</p>",
gnews,news.google.com,https://news.google.com/rss/articles/CBMieEFVX3lxTFBMaUdtUVpYNXh2UldFZkJtSWNxdHV2VlZOZUZxd3FQQ040ZFVTN0FoQWFNTDNMUUxsOHpNa3F6N2R6RktpaUROZ09MazJlZ0JSX2hTYmQtNHZlOGNlS2ZtMGJobEFkekxRUHc3MVIxNG1MTEVKZkhXaQ?oc=5,1776495600,We Can All Agree This Decorating Trend Doesn’t Need A Comeback - Southern Living,We Can All Agree This Decorating Trend Doesn’t Need A Comeback - Southern Living,interior design trends
gnews,news.google.com,https://news.google.com/rss/articles/CBMioAFBVV95cUxOTmVzZTlEV01EejRJcmhVU3daQWtOdjBFcnRBSUU0ZlFzZDk1eFhjd0RMektUOEhXaHU3c3AwdThVeTc5RmUxNXQxQWdGdEdpUkc2MGdVRmhpZ0ZYVzdrNG9XVTlVQ3lHNGxDUTNqUU1SbFhkTVZyd2NtbUlybDFrQ0R1SWJCU2llSFJLWEdkXzZIa0x0UWVrclVVMHVyNXdn?oc=5,1776893948,Kitchen Trends 2026: What Designers Are Obsessing Over Now - Architectural Digest,Kitchen Trends 2026: What Designers Are Obsessing Over Now - Architectural Digest,interior design trends
gnews,news.google.com,https://news.google.com/rss/articles/CBMikgFBVV95cUxQVGFRMGljdmxSU3BqWXR4MFBPNVhUZkxRT29OY0FPbzhCRHJ4RVlEXzEwdFQ5dGp6SzdFWTRjZS1JR3ppbGpxWWNUd0tfa1U5VktpYllsWlZqczVjNFZrV1NWcmdkRmd1RnJuQ1JwazhaRFVCU1B6cGZoMndMaHo4Wm05YWFnc3piYmExc1ZnalJkZw?oc=5,1776630662,“It Looks Dated To Me Already”: 16 Popular Home Design Trends People Reallllllllly Can’t Stand - BuzzFeed,“It Looks Dated To Me Already”: 16 Popular Home Design Trends People Reallllllllly Can’t Stand - BuzzFeed,interior design trends
gnews,news.google.com,https://news.google.com/rss/articles/CBMigAFBVV95cUxQTmg0eGV0dFI2WFZ1MTBiMDFrQ1NIY09KRWJoM040Q0dqZ250M0F0Y2NkWFc5Q3JYY2QzbGFuVFdzZEo4SFJQVmdDS1h2WElxdGVkUWZfTFNXQnBaMHc2TmhjUGpjNXRLUFd1em54OTlVckZVbzU2REJ0UUpCLWZDNg?oc=5,1775026800,"These 5 Home Design Trends Are Set to Take Over This Spring, According to Designers Who Track What’s Next - The Spruce","These 5 Home Design Trends Are Set to Take Over This Spring, According to Designers Who Track What’s Next - The Spruce",interior design trends
gnews,news.google.com,https://news.google.com/rss/articles/CBMiqgFBVV95cUxOTHBBSE5QRzZuNzZkWF9xLTJ2ZTRvc1MwQld3Mk9BVExLMTNOZEFBVmFRWXdnUmJ4Q3pBWjN6N1ZLVVpuajFHRHg3bVFjelVMSkRnaVpOajNUZHp5SjgtakdTUUh4V3c2YVJseXAxdndnSTRQdUVCNE1hZE0tc3NnRTVXSkczVXNkX0QwNmhhMlFTMmZnaXhoQ1czUE1kMmVqaGdWLVh4Zm85UQ?oc=5,1776857450,Luxus Magazine: A new issue to learn all about the latest interior design trends - Luxus Plus,Luxus Magazine: A new issue to learn all about the latest interior design trends - Luxus Plus,interior design trends
gnews,news.google.com,https://news.google.com/rss/articles/CBMitwFBVV95cUxPMXlkdEJXQTVxbWRWR3oxWUtOd1JvNkRtb1F2THE2Mkhnc2RwTHk0UjROSGJudFg1aVNyRHpKemxVMk1rZ1k3QXJNZkxzY3pubm9mdTB3Y1UzQUd4YmZ4V19YSXFqb2ZYMFFHdklQakJJSlluQ245bTdBeTZpSi1TbkdXUmJKUDZSWXJYRElRdVJSVWNXWnVqS0RKd2MzOHNaM2ZNV0QwbVZia1J6UmhSMm1TUVZTYzg?oc=5,1773644400,Why Patterns And Bold Stonework Will Define Interior Design This Spring - Forbes,Why Patterns And Bold Stonework Will Define Interior Design This Spring - Forbes,interior design trends
gnews,news.google.com,https://news.google.com/rss/articles/CBMieEFVX3lxTE9NUVMtNnJ0TzRiOUVPczlubUhYa2l1emJEeVU4WlBnXzE2RGxXZHZHTUdzSnc4d2EwekFsRTRPNnNaVXJhNTQxem1zN2xIWExHaHVoYV9DN0h4b3lnZmg1aTFMb01hckt4eERXMHd2NGVyRzlnWUZrSw?oc=5,1776612600,6 “Tacky” Home Trends Interior Designers Secretly Love - Apartment Therapy,6 “Tacky” Home Trends Interior Designers Secretly Love - Apartment Therapy,interior design trends
gnews,news.google.com,https://news.google.com/rss/articles/CBMidEFVX3lxTE1ZZXhYYVNyN05Bc3R3dGpnTlhSWHREZUs2cUI0SEJock92bXd6eEstMFRscDNmQWRRbmRpTFg2MDZBSWg3dFVIWkdLLVpRNHVGRnVCVm9vSFEwZzBOb2FDa0VCazg5UWtlV09ybEVlNGdONUJt?oc=5,1775026800,The 'Found Luxury' Trend Is Replacing Quiet Luxury - Homes and Gardens,The 'Found Luxury' Trend Is Replacing Quiet Luxury - Homes and Gardens,interior design trends
gnews,news.google.com,https://news.google.com/rss/articles/CBMijwFBVV95cUxPeU9oSGZiVXV5RmxfSEk0bHIxdkx6WW81Mlg3SHBQTy1ob1ZGbUZNcTRPRklaZ3Fwak1LajVWY1ZzbkstbUJVRzEzMk9reUZmYktzU19jc0w2aGJhSGFNMHJlVXc0blhYWUwxTWpPZ2ltdThZeTRHcGdJTXBvMUN4YkY4ak43bXNPNlpTSXRGaw?oc=5,1775372400,These Coastal Design Trends Will Get You Ready for Summer 2026 - ELLE Decor,These Coastal Design Trends Will Get You Ready for Summer 2026 - ELLE Decor,interior design trends
gnews,news.google.com,https://news.google.com/rss/articles/CBMipgFBVV95cUxNUGc5NlBVQjdOMGsxWDBzTDcyTlpobzAweHc5RVNna0IySmFtdzJydzZMTHdfS3R5clZaMlRWWUFHeW42Y21FYnlQRkd4OW5TV1VBMUU4bFJKSmlxa2ZkU3hpY3FXc1drNmJSVGdDcktURWFJSGJ6RWhGeVpqMmtXWmhpbnRyVno0OVRPZnRtN2FUdGRhWENuWVEtNXB2Yk1DMnRSVjVn?oc=5,1776697439,"This Handmade, Collected Decorating Trend Is Everywhere in 2026—Meet “Folklectic” - Country Living","This Handmade, Collected Decorating Trend Is Everywhere in 2026—Meet “Folklectic” - Country Living",interior design trends
gnews,news.google.com,https://news.google.com/rss/articles/CBMikwFBVV95cUxQbks0eVFfeFh5WWJwb1lTLUZVY205WXUtaWRIVGNkMmN1anFDOHg3UHdWTUgyUUNHdXkwaGl3TnhubHN3bGc1R2p5MmdUSTR5V0E4NEUwUnJ3UE9ISVFiel8yRDhwTVF6TWZtNHlfV3VoeUtYSWxZMmpiNFBBMFNpOEJtNF9YVGp5QW16RGZNLWlmSUE?oc=5,1776771000,"6 Bedroom Design Trends That Make Your Space Look Outdated, According to Designers - Real Simple","6 Bedroom Design Trends That Make Your Space Look Outdated, According to Designers - Real Simple",interior design trends
gnews,news.google.com,https://news.google.com/rss/articles/CBMid0FVX3lxTE5uWmthZFA3T0xYNHhubXkwTngtRnM0WGJlSGJhT25xc0tJa0xQMkdyM0JJbjItVlU2MGpzME1kcVFYdWRFM0YtS1huZndmZHZNRmNjc0xSN0RiYmpGNTNWbjJfSk04TDRoeVJqZ1Bva3VwdjNFRWFz?oc=5,1775977200,Designers Regretted Following These 3 Design Trends—What They Wish They'd Done Instead - The Spruce,Designers Regretted Following These 3 Design Trends—What They Wish They'd Done Instead - The Spruce,interior design trends
gnews,news.google.com,https://news.google.com/rss/articles/CBMigwFBVV95cUxNbWZmaUV6U05BM09rSW5CWVRtM0NOeDVPQ3hPNnhETVU0T3ctQkI0RjlJNXFNdkg4bXVEekJWdDBPcXNzeGg0T0s4SjQ3WnlQNldjUElBS2hIMFBWSG90MzJiMTJSMnpHb2cwdGprMGh6VDI0ZEp6QUhYcjBPa1VyOFNCaw?oc=5,1776607200,Goodbye Plain Patios – These 2026 Outdoor Furniture Trends Are All About Personality - Homes and Gardens,Goodbye Plain Patios – These 2026 Outdoor Furniture Trends Are All About Personality - Homes and Gardens,interior design trends
gnews,news.google.com,https://news.google.com/rss/articles/CBMib0FVX3lxTFAzQ2otcDFpT0VrRnJjRkU4QXRwRWpBUVpMOUpsMHhPM2hibjEwQksxaGJQZGZLOVdQa2EtVjJja0dQODA4THRUM0loUG42U3NXWjJyMGFUTzM4LXFrZG0wUmtqc1J1VEs4QnBDQkp6WQ?oc=5,1775804400,8 Design Trends Designers Think Are Finally Back in 2026 - The Spruce,8 Design Trends Designers Think Are Finally Back in 2026 - The Spruce,interior design trends
gnews,news.google.com,https://news.google.com/rss/articles/CBMihgFBVV95cUxNeU1uNG56MlpQMGFZbHpxa1RjcGw2aGZkV19LNHZveUltaEI1ZnlEU2Q0b1cyVC03dTVXVnlLU1VsSGU5TGc5eEZzclE0RXVCRWd3UVhhYS1MWTdPakgwOWRUMDJYX1dDQUZmWXFfbEd6RlpGX3pXYmJ3YzZiZzdrWnNveHRjZw?oc=5,1776495600,The Best Decorating Tip I Ever Got Was From an Interior Designer and I Think About It All the Time - The Spruce,The Best Decorating Tip I Ever Got Was From an Interior Designer and I Think About It All the Time - The Spruce,interior design trends
gnews,news.google.com,https://news.google.com/rss/articles/CBMiiAFBVV95cUxQWkJOMVFHNFJxS0w5eG5pVFNHYTlJMy1RV2lyUng1RDlCXzRiTUExYkdpZ1R0NF9EdFNDa0pOTVpla09RS0VZUkNwcU9EN3VlRWp1WEhhRS1XbzBYRHA2NnR0b3lPc0NDTnJIdHRwMmkwVEV0b09FZGo4WTlCVmVDSHFtX09KSEJl?oc=5,1776880800,Meet Our Next in Design Winners: Janaye - Homes and Gardens,Meet Our Next in Design Winners: Janaye - Homes and Gardens,interior design trends
gnews,news.google.com,https://news.google.com/rss/articles/CBMiuAFBVV95cUxOcGpSUlBCckE0NEFCemNSXzE3Q2lzUnVfVUxLTTJJUXhqYU5URDNXYmJuWE54ZEczeGtRcE13RkxpTkRiUEVVTGFsSDBRWGJUUFZfSW9LYjlzeUxuZWhKTTdsVlkxRUx1TWlJMHEzMllrVzdXWEkyZnZabFVuY3BvZXFXM01PWFlUUFVfVkZobWtmbGMzUkVZWExDd05DUDRyVUZlQ3FRV3pnOHdkN0hjQ2VZc3c2bHdj?oc=5,1776765266,'Minimalism is over': Interior Design Masters judge Michelle Ogundehin on trends and decorating mistakes - House Beautiful,'Minimalism is over': Interior Design Masters judge Michelle Ogundehin on trends and decorating mistakes - House Beautiful,interior design trends
gnews,news.google.com,https://news.google.com/rss/articles/CBMif0FVX3lxTE1TdHZsM2wxVEJzbnYycWVKUzJoTExVcEZfUERSTGhyZ195UFJFdTdDZ2pKWDBldDRWbm04S0dzel9QYnhBanJrR3FRZ2x2ajRSM3lrdFBmLTM1djZObGp0eXlTeHU0SE03blZ4RDZUclBpNS01d3lLRjRDVURNZjQ?oc=5,1776924248,"Why Choosing Antiques Is Good for You, and Your Home - Livingetc","Why Choosing Antiques Is Good for You, and Your Home - Livingetc",interior design trends
gnews,news.google.com,https://news.google.com/rss/articles/CBMigwFBVV95cUxOWjF0OHMzNVczOWxsVDZzZFI4T1d5bDg3UVZrOFZ0eWE5cU5NSEktWG8wV0YwRzJyanY0LTZFeno2ME9Od1pZY0laWFM4SzJyQVJPSWZBaVY2RmFXS3prMWpxZDVxN2Q0VzJKaF9SZDdnbW9rMDRxMjlCeF93aHphU09Jdw?oc=5,1776780000,"Sorry, Beige Really Is Boring – 5 Colors Designers Are Replacing It With for More Exciting Warm Interiors in 2026 - Homes and Gardens","Sorry, Beige Really Is Boring – 5 Colors Designers Are Replacing It With for More Exciting Warm Interiors in 2026 - Homes and Gardens",interior design trends
gnews,news.google.com,https://news.google.com/rss/articles/CBMikAFBVV95cUxPZjdWaEZNZlBhY0ExNDRaZGhiVVExSHlPUVBha3J3eGlodklBcTZoWW9sWmotaXhrMXIwSG44Wm5heDltc29UR0phWExtYXhwX0k2MENHbzZDV2l3QjVyaUZZb0liZDJITlZEdlliRno1VzVjQVhmd2hPOEg4MTd5OHpzTmgwY1NlbG1iVk5RTGU?oc=5,1773385200,What's Making a Home Look Dated in 2026? Interior Designers Reveal What to Leave Out This Year – and What to Do Instead - Homes and Gardens,What's Making a Home Look Dated in 2026? Interior Designers Reveal What to Leave Out This Year – and What to Do Instead - Homes and Gardens,interior design trends
gnews,news.google.com,https://news.google.com/rss/articles/CBMifEFVX3lxTFBERG5TN05TbUtsZXhrYWJDckI1RkpyV3MyZV9mWnhTX2poV3NKOTJURUR2VThMYXlVam56M2xNeTZfbW5fUHBkZXB0ZEJ3T1UtM3IzYjlOOHo0ZDlCYW5KQUtnUnZiN3U3RFhzN2FZbW9SbVZSNG9YUnVVdjg?oc=5,1773730800,"5 Home Design Trends That Will Be Everywhere This Spring, Pinterest Predicts - marthastewart.com","5 Home Design Trends That Will Be Everywhere This Spring, Pinterest Predicts - marthastewart.com",interior design trends
gnews,news.google.com,https://news.google.com/rss/articles/CBMihAFBVV95cUxOTzNHVVkwa0ctZGNZWHZSS0tVeHlnZ1dDcXNkZlFRTjBPSk85VUl3eUZZWG5oUmlSbHNNSVQ1a3lCSno1eHZieUpJYXo2S3dtWEUwS2E0R0p6cDVLZWN6LTRfM1NEcnVjYWVHcjA2bGJiellOVXd6WnpOSnhrS2dVZC00bzY?oc=5,1773558000,9 Decorating Trends We’re Glad Are Gone - Southern Living,9 Decorating Trends We’re Glad Are Gone - Southern Living,interior design trends
gnews,news.google.com,https://news.google.com/rss/articles/CBMikAFBVV95cUxNdXZVOFllejlNUk9BanRtemJXdkIwZVR3Sk1qTkJDMl81YmE2V25mRzEyQTY0Rm1DWXNDaGpOVzluZFJ0NVBUdUdKOFUtMzk0UDhpUDFadzl0blVjSkR6VDRDTVJKY1ZYbVRnOEZUQi1sX2JhU2J1SDFzMXUwOTQ5RkdLT0JDVlpnTkRJa19ONDU?oc=5,1774335600,"Designers Agree: ""Whimsical"" Decor Is the Secret to a More Joyful Home in 2026 - House Beautiful","Designers Agree: ""Whimsical"" Decor Is the Secret to a More Joyful Home in 2026 - House Beautiful",interior design trends
gnews,news.google.com,https://news.google.com/rss/articles/CBMijwFBVV95cUxQbURSMXljeXl1d0huSldYYjBVbnJMR0pVZF9EbVh0dVVZVU1vMzFtcV9SWjJpQmRFQmNTYXpvVGFYdUpIN1Z3T3hvdlN6dmhsR1JWcEprTEU4d3lCaEVVeXBHcEpuV2doRmVObjlNRzlUdTBCbXlUZFJZSGJMRnhYVW4yTDFQM2std1FJMnNnQQ?oc=5,1776754800,Experts Say These Are the Most Valuable Antiques to Look for in 2026 - House Beautiful,Experts Say These Are the Most Valuable Antiques to Look for in 2026 - House Beautiful,interior design trends
gnews,news.google.com,https://news.google.com/rss/articles/CBMic0FVX3lxTE93bzdkUkN5VnQ2eEZLaVZZb2ZPaE1yTV9iT2pxNWM3YWRkVXJuSXgteEJuenlNQllHdG52eFZvN2w2OFJidzQyWVViV2htczItUmZtcWhFaFRSc2gxYWstQmJVZFFKYTJReTRZSF9KazI5ejQ?oc=5,1776772860,The One Decor Rule Nate Berkus Follows: Don’t Chase Trends - Better Homes & Gardens,The One Decor Rule Nate Berkus Follows: Don’t Chase Trends - Better Homes & Gardens,interior design trends
gnews,news.google.com,https://news.google.com/rss/articles/CBMiqAFBVV95cUxQZTVCaXdMY2prOEM4c18yakcyYkRhRGF0Y1FpVmRpUWdJeGVoVXY2ZHZHZEpWX3FIbFY2cHEyOS0yV0p6OGg2SzRHV1NSRUxBNTFJTVRKelM3NHI5RUZVN3dFWnhveExLdjdTVlhyQ0JJV0RWTWRjSmdGejNBUkZmc2h2SVAyeHhEMXZPc2xtR0dOYlRJM1ZvcXNPdGo3NzBLM3BXMWxNckI?oc=5,1776808800,Interior Designer Nate Berkus Says Stop Buying Trends—These Are the 5 Home Pieces Worth Investing In - E! News,Interior Designer Nate Berkus Says Stop Buying Trends—These Are the 5 Home Pieces Worth Investing In - E! News,interior design trends
gnews,news.google.com,https://news.google.com/rss/articles/CBMilAFBVV95cUxORUxLS1lSU1ZPRDRVNjhSdEsyeklveUhRa0tseTBYbFBreUo0M2hBQmdnQmxUVnM5T0pfNU1DTkdoTnRURGtfY3pWblJkSG5mbkcxZDRscXJFUkYxNWUwR1JHQTl6SFk5QWxfOEJDUDJ4eVB3REY2WjhqcXZORWlKWnFaWmtyX3c3TGZaNGJRZ2JxajY2?oc=5,1776605745,Designers Say This Bold 80s Trend Is Making a Major Comeback - Good Housekeeping,Designers Say This Bold 80s Trend Is Making a Major Comeback - Good Housekeeping,interior design trends
gnews,news.google.com,https://news.google.com/rss/articles/CBMiqgFBVV95cUxOdkE0em03WWRZMUpFQWx4SVR3VTFzd2FEbWVkS3pQNEhScm9vNFBnSVVJbUdHdHM4Q3dkdEV6QnM1ZjM0SkZhV1JTNGgwSWdMbzBidkhCbEpvNl9MQjBCWVFBd08wQkVoSVJ6VXpIZ3psaHFWUFlJVUVVVlczNHRiOEt1Z19YNjNMOGowaGRlaTF4QndKLTcwMGNnUVpsSG03NUZDWGZlN1ViUQ?oc=5,1774940400,The 4 Living Room Colors Going Out of Style in 2026 – And What Designers Are Using Instead - Homes and Gardens,The 4 Living Room Colors Going Out of Style in 2026 – And What Designers Are Using Instead - Homes and Gardens,interior design trends
gnews,news.google.com,https://news.google.com/rss/articles/CBMiZ0FVX3lxTE10dlpfVzVMdWJ0TUw3aFprYktoLXcxRTBYbkpQRGUwcVhlY2FJYkt5c2pFUVE4M2E2SGVXckl4MG1PRGp4VTdKTHUxeVl2bFYzREh2NW13aGJDS0JqMGNmR2VKUG91akE?oc=5,1776747600,5 Home Storage Trends for 2026 That Add Style and Sense - Livingetc,5 Home Storage Trends for 2026 That Add Style and Sense - Livingetc,interior design trends
gnews,news.google.com,https://news.google.com/rss/articles/CBMigAFBVV95cUxNckpHYk0zR3hJM1dlOWhwdTRPRnMyOXNsN1hDVmJ4RHlRMnh5Uk9Qcm1rOTgtbG56Tk8zc1k1WXNZT3hDZ3BTVVdsUW1tYWpiRjFDN0pBRlN2U2I2Q0drVUoxS1VRMlJGcDNoSjNDNF9BaU9DZ1pjRTYtb0dfcTVwdg?oc=5,1776630662,"People Are Calling Out Popular Home Design Trends That Are Actually Terrible, And It's Brutally Honest - Yahoo News Canada","People Are Calling Out Popular Home Design Trends That Are Actually Terrible, And It's Brutally Honest - Yahoo News Canada",interior design trends
gnews,news.google.com,https://news.google.com/rss/articles/CBMiowFBVV95cUxOYmZTcGpNUUFHdFhOVzRRRGtRdDlhTnNGOW83UEs1eE1oNVlZNGVraUR3Sk9ETDJicXVBd0thaGhsUnpnN2EwaHA3LWJ3bHMxRHk4MkhRejlya0ZYUFZRZ2NUTDFHN3NhSzctRzVqTnNxRGROdVdIR1JseldxcGdZNEdfZzBNVnJVOThRMF81UzdVMlFha0RNZXBhMTZmRm5Wenpj?oc=5,1775545200,Why British Living Rooms Feel Better Than Yours (And How to Fix It) - Country Living,Why British Living Rooms Feel Better Than Yours (And How to Fix It) - Country Living,interior design trends
gnews,news.google.com,https://news.google.com/rss/articles/CBMikwFBVV95cUxORmpaN01BUVludjAxcWpDZE5acW5fQjdoVWFPbV9GN1lsQnZSZDJ6ZnNka2F0VjJNUEJuRGhBSUxUakRPVU9Ba2pkdVRIckNKZG5yQTZVYk5LSWJQOE9VODJ1X3VjRUc4dkVkWGREZGFrX3Y0UnBDVTdhVS1qRTRNQnFXUHRyZHlkM0N5NlRJT0ZPWEk?oc=5,1776708000,Meet Our Next in Design Winners: Jessica Summer - Homes and Gardens,Meet Our Next in Design Winners: Jessica Summer - Homes and Gardens,interior design trends
gnews,news.google.com,https://news.google.com/rss/articles/CBMinwFBVV95cUxOR0Y3eW12dU5KSjRlM1BkM1ljY2ZZMmoxWDFrcFdMb0F1bTh0ZWtmdW1mbWZqdm54U1NPZFRrb2JEQXgyVUZtX1dPZGpyU19TcmRncTNmMEVrVlBYZFJvMXNuTkVYSGpmQjRoYkVqb0VXMnc4b245bDdMbEt4V0NqV0JkTkNMRmYzQUt3b0N4TjlJemRZWHE5VVpRVlFyZm8?oc=5,1774508400,The 'Quiet' Color Every Designer Is Using Right Now to Add Instant Calm to Any Room - Homes and Gardens,The 'Quiet' Color Every Designer Is Using Right Now to Add Instant Calm to Any Room - Homes and Gardens,interior design trends
gnews,news.google.com,https://news.google.com/rss/articles/CBMigwFBVV95cUxPQmppV1VTZ1lIZzc5MHVwdFlzZnd6aHBOaDlyUU1MOGphSWU0MkU4cjdFUlN3dVk1SFVhbDNwd1dQc0ZFTWtycjllRTZERjZiMEFFelk3QktTWVhfVHltOWkyOUhNS3hyNmVwQy1lOXlLWjdZYVk4dUttZkc1RDFWcXJJUQ?oc=5,1775372400,13 Outdated Design Trends That Are Scaring Buyers Away From Your Home - House Digest,13 Outdated Design Trends That Are Scaring Buyers Away From Your Home - House Digest,interior design trends
gnews,news.google.com,https://news.google.com/rss/articles/CBMikgFBVV95cUxPMm9UWnQta1RzWGtWRzdQOG1HMnkzYUVJb3JjeWxWdjZvbWo3Q1d4M1laRDJjNGhLQzlTUEFTWWg1SGxGNlpfN1ExNWxvc3FtTmJqcU5YSTJUQW9PN2lQRjIzQTd6d2xaVDl2TjFZREtvZTdOYWpHc3lBZW1Dc3dEQWxCRFBmVUF0cG1vWk03QXB6UQ?oc=5,1776702739,11 Designer-Approved Details That Instantly Make Your Kitchen Look So Expensive - House Beautiful,11 Designer-Approved Details That Instantly Make Your Kitchen Look So Expensive - House Beautiful,interior design trends
gnews,news.google.com,https://news.google.com/rss/articles/CBMisgFBVV95cUxQOTdrc29CSk5wV1F5LXBnSk54cmR5VTlXM0lYazR5WElIQ1Bab1U0TzdKSmdTM1FFYm9CY0p5U3JrV1VkeXNKbzBsQkpaQmhxVWFvQTRJN1FRYUtrN3g3Q09DbTZXSjhycXFzWnUwcnY4d0Rsb2JDZVY0OTQ1SkFmdF91OWttXzQxMVRtNWpRQzc4Skd3ZTk5VEpqRVdyZ3c0VVpsLWhpSnBEM3RPX2VGMjJR?oc=5,1776693600,Nine interiors trends from Milan Design Week - The Times,Nine interiors trends from Milan Design Week - The Times,interior design trends
gnews,news.google.com,https://news.google.com/rss/articles/CBMieEFVX3lxTFBMaUdtUVpYNXh2UldFZkJtSWNxdHV2VlZOZUZxd3FQQ040ZFVTN0FoQWFNTDNMUUxsOHpNa3F6N2R6RktpaUROZ09MazJlZ0JSX2hTYmQtNHZlOGNlS2ZtMGJobEFkekxRUHc3MVIxNG1MTEVKZkhXaQ?oc=5,1776495600,We Can All Agree This Decorating Trend Doesn’t Need A Comeback - Southern Living,We Can All Agree This Decorating Trend Doesn’t Need A Comeback - Southern Living,home decor trend
gnews,news.google.com,https://news.google.com/rss/articles/CBMixgFBVV95cUxOZmhfNmxNcld5OURpM1poNGVXV2xGX3FveEhfOVZzTUZUdlpUTlF5RlBYMWNfT0VvM3d4d1MwbGhRa2NFdF9qZEs4X0x1c2htamRSR1NfRHNteHotRWpXTFN0azA1UVNOdEJuYXhqSy1KdlM1UnNZV1ZUejhqWGhzR21qbndRclhyNExabUIyX1JCSndhWDdwTVBFWXNtSTNKQkRLUk9DZkdjUWNmQVZPbW9BQ1I0OEZnZU5IeF9IVkJ0dTRlNkE?oc=5,1776941733,Experts say this TikTok decor trend is a disaster waiting to happen - AOL.com,Experts say this TikTok decor trend is a disaster waiting to happen - AOL.com,home decor trend
gnews,news.google.com,https://news.google.com/rss/articles/CBMipgFBVV95cUxNUGc5NlBVQjdOMGsxWDBzTDcyTlpobzAweHc5RVNna0IySmFtdzJydzZMTHdfS3R5clZaMlRWWUFHeW42Y21FYnlQRkd4OW5TV1VBMUU4bFJKSmlxa2ZkU3hpY3FXc1drNmJSVGdDcktURWFJSGJ6RWhGeVpqMmtXWmhpbnRyVno0OVRPZnRtN2FUdGRhWENuWVEtNXB2Yk1DMnRSVjVn?oc=5,1776697439,"This Handmade, Collected Decorating Trend Is Everywhere in 2026—Meet “Folklectic” - Country Living","This Handmade, Collected Decorating Trend Is Everywhere in 2026—Meet “Folklectic” - Country Living",home decor trend
gnews,news.google.com,https://news.google.com/rss/articles/CBMinAFBVV95cUxNRDdSZEFzSXEtaWF6YkxvWjVEdXJjN3I4YWNma2dMTi04WC1hNlUtOGFCUlhRRk5rQmIxMVVnQTRxM05XcFJ0RHg5VEFrYjRTRTc0a2RFZjE1SF8zZm5jTVhxZXNrLVhaWWpTXzdJb0dEcWlXUWlJX0Uta1Rfem9wbG1VZkNubkd2NS1KRWlvVEpSMm1RUzljbEVIWTg?oc=5,1775372400,"People Are Revealing The ""Outdated"" Home Design Trends That Need To Replace Modern Trends ASAP - BuzzFeed","People Are Revealing The ""Outdated"" Home Design Trends That Need To Replace Modern Trends ASAP - BuzzFeed",home decor trend
gnews,news.google.com,https://news.google.com/rss/articles/CBMiqAFBVV95cUxQZTVCaXdMY2prOEM4c18yakcyYkRhRGF0Y1FpVmRpUWdJeGVoVXY2ZHZHZEpWX3FIbFY2cHEyOS0yV0p6OGg2SzRHV1NSRUxBNTFJTVRKelM3NHI5RUZVN3dFWnhveExLdjdTVlhyQ0JJV0RWTWRjSmdGejNBUkZmc2h2SVAyeHhEMXZPc2xtR0dOYlRJM1ZvcXNPdGo3NzBLM3BXMWxNckI?oc=5,1776808800,Interior Designer Nate Berkus Says Stop Buying Trends—These Are the 5 Home Pieces Worth Investing In - E! News,Interior Designer Nate Berkus Says Stop Buying Trends—These Are the 5 Home Pieces Worth Investing In - E! News,home decor trend
gnews,news.google.com,https://news.google.com/rss/articles/CBMid0FVX3lxTE5uWmthZFA3T0xYNHhubXkwTngtRnM0WGJlSGJhT25xc0tJa0xQMkdyM0JJbjItVlU2MGpzME1kcVFYdWRFM0YtS1huZndmZHZNRmNjc0xSN0RiYmpGNTNWbjJfSk04TDRoeVJqZ1Bva3VwdjNFRWFz?oc=5,1775977200,Designers Regretted Following These 3 Design Trends—What They Wish They'd Done Instead - The Spruce,Designers Regretted Following These 3 Design Trends—What They Wish They'd Done Instead - The Spruce,home decor trend
gnews,news.google.com,https://news.google.com/rss/articles/CBMitwFBVV95cUxPMXlkdEJXQTVxbWRWR3oxWUtOd1JvNkRtb1F2THE2Mkhnc2RwTHk0UjROSGJudFg1aVNyRHpKemxVMk1rZ1k3QXJNZkxzY3pubm9mdTB3Y1UzQUd4YmZ4V19YSXFqb2ZYMFFHdklQakJJSlluQ245bTdBeTZpSi1TbkdXUmJKUDZSWXJYRElRdVJSVWNXWnVqS0RKd2MzOHNaM2ZNV0QwbVZia1J6UmhSMm1TUVZTYzg?oc=5,1773644400,Why Patterns And Bold Stonework Will Define Interior Design This Spring - Forbes,Why Patterns And Bold Stonework Will Define Interior Design This Spring - Forbes,home decor trend
