source,domain,url,created_utc,title,text,query
rss,www.yankodesign.com,https://www.yankodesign.com/2025/12/29/the-solar-touch-light-that-hides-its-tech-in-plain-sight/?utm_source=rss&utm_medium=rss&utm_campaign=the-solar-touch-light-that-hides-its-tech-in-plain-sight,1767025222,The Solar Touch Light That Hides Its Tech in Plain Sight,"The Solar Touch Light That Hides Its Tech in Plain Sight

<p class=""rws-nl-img""><a href=""https://www.yankodesign.com/2025/12/29/the-solar-touch-light-that-hides-its-tech-in-plain-sight/""><img alt="""" class=""attachment-post-thumbnail size-post-thumbnail wp-post-image"" height=""960"" src=""https://www.yankodesign.com/images/design_news/2025/12/the-solar-touch-light-that-hides-its-tech-in-plain-sight/sulu-01.jpg"" width=""1280"" /></a></p><h2 class=""rws-nl-title"" style=""text-align: center;"">The Solar Touch Light That Hides Its Tech in Plain Sight</h2><div class=""rws-nl-excerpt"">There&#8217;s something quietly revolutionary happening in the world of ambient lighting, and it looks like a smooth wooden pebble you&#8217;d want to hold in your...</div>",
rss,www.yankodesign.com,https://www.yankodesign.com/2025/12/29/retro-modern-n200-desktop-speaker-has-serious-teenage-engineering-vibes/?utm_source=rss&utm_medium=rss&utm_campaign=retro-modern-n200-desktop-speaker-has-serious-teenage-engineering-vibes,1767018051,Retro-modern N200 desktop speaker has serious Teenage Engineering vibes,"Retro-modern N200 desktop speaker has serious Teenage Engineering vibes

<p class=""rws-nl-img""><a href=""https://www.yankodesign.com/2025/12/29/retro-modern-n200-desktop-speaker-has-serious-teenage-engineering-vibes/""><img alt="""" class=""attachment-post-thumbnail size-post-thumbnail wp-post-image"" height=""960"" src=""https://www.yankodesign.com/images/design_news/2025/12/retro-modern-n200-bluetooth-desktop-speaker-has-serious-te-vibes/Orgdot-N200-Bluetooth-Desktop-Speaker-9.jpg"" width=""1280"" /></a></p><h2 class=""rws-nl-title"" style=""text-align: center;"">Retro-modern N200 desktop speaker has serious Teenage Engineering vibes</h2><div class=""rws-nl-excerpt"">Desktop Bluetooth speakers are plentiful, and the one you choose for your desk setup purely depends on the desired audio signature and your design affinity....</div>",
rss,www.yankodesign.com,https://www.yankodesign.com/2025/12/29/best-lego-designs-of-2025-10-sets-that-redefined-building-blocks/?utm_source=rss&utm_medium=rss&utm_campaign=best-lego-designs-of-2025-10-sets-that-redefined-building-blocks,1767012044,Best LEGO Designs of 2025: 10 Sets That Redefined Building Blocks,"Best LEGO Designs of 2025: 10 Sets That Redefined Building Blocks

<p class=""rws-nl-img""><a href=""https://www.yankodesign.com/2025/12/29/best-lego-designs-of-2025-10-sets-that-redefined-building-blocks/""><img alt="""" class=""attachment-post-thumbnail size-post-thumbnail wp-post-image"" height=""960"" src=""https://www.yankodesign.com/images/design_news/2025/12/best-lego-designs-of-2025/10_best_lego_designs_2025_yanko_design_hero.jpg"" width=""1280"" /></a></p><h2 class=""rws-nl-title"" style=""text-align: center;"">Best LEGO Designs of 2025: 10 Sets That Redefined Building Blocks</h2><div class=""rws-nl-excerpt"">LEGO transformed from a childhood toy to a design phenomenon this year, releasing sets that blur the line between construction kit and sculptural art. The...</div>",
rss,www.yankodesign.com,https://www.yankodesign.com/2025/12/29/acemagic-m1a-pro-is-a-tank-styled-ryzen-ai-cube-with-128gb-ram/?utm_source=rss&utm_medium=rss&utm_campaign=acemagic-m1a-pro-is-a-tank-styled-ryzen-ai-cube-with-128gb-ram,1767006428,ACEMAGIC M1A PRO+ Is a Tank-Styled Ryzen AI Cube With 128GB RAM,"ACEMAGIC M1A PRO+ Is a Tank-Styled Ryzen AI Cube With 128GB RAM

<p class=""rws-nl-img""><a href=""https://www.yankodesign.com/2025/12/29/acemagic-m1a-pro-is-a-tank-styled-ryzen-ai-cube-with-128gb-ram/""><img alt="""" class=""attachment-post-thumbnail size-post-thumbnail wp-post-image"" height=""960"" src=""https://www.yankodesign.com/images/design_news/2025/12/acemagic-m1a-pro-is-a-tank-styled-ryzen-ai-cube-with-128gb-ram/acemagic-m1a-pro-plus-06.jpg"" width=""1280"" /></a></p><h2 class=""rws-nl-title"" style=""text-align: center;"">ACEMAGIC M1A PRO+ Is a Tank-Styled Ryzen AI Cube With 128GB RAM</h2><div class=""rws-nl-excerpt"">Most mini PCs still look like shrunken office desktops, anonymous rectangles that hide under monitors or behind screens. That makes sense for some setups, but...</div>",
rss,www.yankodesign.com,https://www.yankodesign.com/2025/12/28/this-89-planter-grows-plants-in-mid-air-without-soil-or-water/?utm_source=rss&utm_medium=rss&utm_campaign=this-89-planter-grows-plants-in-mid-air-without-soil-or-water,1766976324,This $89 Planter Grows Plants in Mid-Air Without Soil or Water,"This $89 Planter Grows Plants in Mid-Air Without Soil or Water

<p class=""rws-nl-img""><a href=""https://www.yankodesign.com/2025/12/28/this-89-planter-grows-plants-in-mid-air-without-soil-or-water/""><img alt="""" class=""attachment-post-thumbnail size-post-thumbnail wp-post-image"" height=""960"" src=""https://www.yankodesign.com/images/design_news/2025/12/this-no-mess-desktop-planter-that-grows-plants-with-mist-in-mid-air-is-available-for-pre-order/izestee-Desktop-Aeroponic-Plant-Ecosystem-2.jpg"" width=""1280"" /></a></p><h2 class=""rws-nl-title"" style=""text-align: center;"">This $89 Planter Grows Plants in Mid-Air Without Soil or Water</h2><div class=""rws-nl-excerpt"">Biophilic interiors, where people are more connected to nature, are becoming really popular. Just everyone wants plants on the work desk and leafy green sprouting...</div>",
rss,www.yankodesign.com,https://www.yankodesign.com/2025/12/28/hand-built-through-nine-storms-remote-scottish-home-wins-riba-house-of-the-year-2025/?utm_source=rss&utm_medium=rss&utm_campaign=hand-built-through-nine-storms-remote-scottish-home-wins-riba-house-of-the-year-2025,1766968255,Hand-Built Through Nine Storms: Remote Scottish Home Wins RIBA House of the Year 2025,"Hand-Built Through Nine Storms: Remote Scottish Home Wins RIBA House of the Year 2025

<p class=""rws-nl-img""><a href=""https://www.yankodesign.com/2025/12/28/hand-built-through-nine-storms-remote-scottish-home-wins-riba-house-of-the-year-2025/""><img alt="""" class=""attachment-post-thumbnail size-post-thumbnail wp-post-image"" height=""960"" src=""https://www.yankodesign.com/images/design_news/2025/12/caochan-na-creige/riba_house_2025_yanko_design_01.jpg"" width=""1280"" /></a></p><h2 class=""rws-nl-title"" style=""text-align: center;"">Hand-Built Through Nine Storms: Remote Scottish Home Wins RIBA House of the Year 2025</h2><div class=""rws-nl-excerpt"">On a rocky outcrop in Scotland&#8217;s Outer Hebrides, where Atlantic winds batter the coastline and ancient Lewisian Gneiss stone shapes the landscape, sits Caochan na...</div>",
rss,www.yankodesign.com,https://www.yankodesign.com/2025/12/28/this-intelligent-pet-exoskeleton-helps-injured-dogs-relearn-movement-on-their-own-terms/?utm_source=rss&utm_medium=rss&utm_campaign=this-intelligent-pet-exoskeleton-helps-injured-dogs-relearn-movement-on-their-own-terms,1766964644,This Intelligent Pet Exoskeleton Helps Injured Dogs Relearn Movement on Their Own Terms,"This Intelligent Pet Exoskeleton Helps Injured Dogs Relearn Movement on Their Own Terms

<p class=""rws-nl-img""><a href=""https://www.yankodesign.com/2025/12/28/this-intelligent-pet-exoskeleton-helps-injured-dogs-relearn-movement-on-their-own-terms/""><img alt="""" class=""attachment-post-thumbnail size-post-thumbnail wp-post-image"" height=""960"" src=""https://www.yankodesign.com/images/design_news/2025/12/this-intelligent-exoskeleton-helps-injured-dogs-relearn-movement-on-their-own-terms/repawse_pet_exoskeleton_1.jpg"" width=""1280"" /></a></p><h2 class=""rws-nl-title"" style=""text-align: center;"">This Intelligent Pet Exoskeleton Helps Injured Dogs Relearn Movement on Their Own Terms</h2><div class=""rws-nl-excerpt"">Watching a dog struggle to walk is quietly heartbreaking. Movement, for animals, is not just mobility. It is freedom, confidence, and joy. The Pet Power...</div>",
rss,www.yankodesign.com,https://www.yankodesign.com/2025/12/28/this-yacht-is-actually-powered-by-a-detachable-jet-ski/?utm_source=rss&utm_medium=rss&utm_campaign=this-yacht-is-actually-powered-by-a-detachable-jet-ski,1766958325,This Yacht is actually powered by a Detachable Jet-ski,"This Yacht is actually powered by a Detachable Jet-ski

<p class=""rws-nl-img""><a href=""https://www.yankodesign.com/2025/12/28/this-yacht-is-actually-powered-by-a-detachable-jet-ski/""><img alt="""" class=""attachment-post-thumbnail size-post-thumbnail wp-post-image"" height=""960"" src=""https://www.yankodesign.com/images/design_news/2025/12/this-yacht-is-actually-powered-by-a-detachable-jet-ski/one_16_hybrid_jetski_1.jpg"" width=""1280"" /></a></p><h2 class=""rws-nl-title"" style=""text-align: center;"">This Yacht is actually powered by a Detachable Jet-ski</h2><div class=""rws-nl-excerpt"">Jet skis rip through water with ridiculous speed and agility. They&#8217;re also terrible at everything else. Try bringing friends along for the ride, or packing...</div>",
rss,www.yankodesign.com,https://www.yankodesign.com/2025/12/28/this-cmf-phone-mini-concept-is-the-compact-android-fans-have-been-begging-for/?utm_source=rss&utm_medium=rss&utm_campaign=this-cmf-phone-mini-concept-is-the-compact-android-fans-have-been-begging-for,1766952917,This CMF Phone Mini Concept Is The Compact Android Fans Have Been Begging For,"This CMF Phone Mini Concept Is The Compact Android Fans Have Been Begging For

<p class=""rws-nl-img""><a href=""https://www.yankodesign.com/2025/12/28/this-cmf-phone-mini-concept-is-the-compact-android-fans-have-been-begging-for/""><img alt="""" class=""attachment-post-thumbnail size-post-thumbnail wp-post-image"" height=""960"" src=""https://www.yankodesign.com/images/design_news/2025/12/auto-draft/cmf_phone_mini_1.jpg"" width=""1280"" /></a></p><h2 class=""rws-nl-title"" style=""text-align: center;"">This CMF Phone Mini Concept Is The Compact Android Fans Have Been Begging For</h2><div class=""rws-nl-excerpt"">The market for compact smartphones didn&#8217;t disappear because people stopped wanting them; manufacturers simply decided the economics didn&#8217;t justify the engineering. The iPhone 13 mini...</div>",
rss,www.yankodesign.com,https://www.yankodesign.com/2025/12/28/this-award-winning-swing-feeds-birds-when-kids-arent-playing/?utm_source=rss&utm_medium=rss&utm_campaign=this-award-winning-swing-feeds-birds-when-kids-arent-playing,1766946004,This Award-Winning Swing Feeds Birds When Kids Aren’t Playing,"This Award-Winning Swing Feeds Birds When Kids Aren’t Playing

<p class=""rws-nl-img""><a href=""https://www.yankodesign.com/2025/12/28/this-award-winning-swing-feeds-birds-when-kids-arent-playing/""><img alt="""" class=""attachment-post-thumbnail size-post-thumbnail wp-post-image"" height=""960"" src=""https://www.yankodesign.com/images/design_news/2025/12/this-award-winning-swing-feeds-birds-when-kids-arent-playing/birddy-01.jpg"" width=""1280"" /></a></p><h2 class=""rws-nl-title"" style=""text-align: center;"">This Award-Winning Swing Feeds Birds When Kids Aren&#8217;t Playing</h2><div class=""rws-nl-excerpt"">There&#8217;s something delightfully clever about design that refuses to pick just one job. You know what I&#8217;m talking about: those rare pieces that make you...</div>",
rss,www.archdaily.com,https://www.archdaily.com/1037175/manitouwaba-lake-house-daymark,1767002400,Manitouwaba Lake House / Daymark,"Manitouwaba Lake House / Daymark

<p>For a young couple with three children, building a cottage on Manitouwaba Lake was about more than a getaway—it was about continuing a family story. The new retreat would sit beside the parents' legacy cottage in <a href=""https://www.archdaily.com/tag/seguin"">Seguin</a>, and by merging two properties into one, the family created a site large enough to hold both heritage and future.</p>",
rss,www.archdaily.com,https://www.archdaily.com/1026214/material-strategies-for-updating-and-repurposing-modernist-classics,1766993400,Rewriting Modernism Through Materials,"Rewriting Modernism Through Materials

<p><a href=""https://www.archdaily.com/791939/ad-classics-park-hill-estate-sheffield-jack-lynn-ivor-smith?ad_medium=gallery"" rel=""noopener"" target=""_blank"">Park Hill</a>, a large social housing complex in Sheffield, stands out as one of the most ambitious examples of modernist architecture in post-war Britain. Designed in 1961 by Jack Lynn and Ivor Smith, its innovative concept of ""streets in the sky"" aimed to combine high-density housing with the community spirit of traditional neighborhoods. By the late 20th century, the complex had fallen into severe neglect, marked by social problems and structural degradation that undermined both its functionality and reputation. Gradually, Park Hill became synonymous with the failure of modernism, carrying a heavy social stigma and marginalizing its residents. </p>",
rss,www.archdaily.com,https://www.archdaily.com/1037142/restructuring-and-extension-of-the-academie-fratellini-in-saint-denis-atelier-du-pont,1766991600,Restructuring and Extension of the Académie Fratellini in Saint-Denis  / Atelier du Pont,"Restructuring and Extension of the Académie Fratellini in Saint-Denis  / Atelier du Pont

<p>Located in Saint Denis, in the Greater Paris Region, the Académie Fratellini is an internationally renowned circus school, a leisure centre, and a venue for the creation and performance of shows. Following major renovation and extension work, the Académie Fratellini reopened its doors to the public in October 2025. Founded by Annie Fratellini and Pierre Étaix in 1974 and based in Saint Denis since 2003, the Académie Fratellini has undergone an ambitious restructuring and extension project led by the architecture and interior design agency Atelier du Pont. The new project is in keeping with the architectural style of the original designers, Patrick Bouchain and Loïc Julienne, preserving the atmosphere and strong identity of this lively and extraordinary place.</p>",
rss,www.archdaily.com,https://www.archdaily.com/1037024/howard-waterfall-retreat-competition-buildners-winners-explore-multigenerational-living-and-topography,1766990700,Howard Waterfall Retreat Competition: Buildner’s Winners Explore Multigenerational Living and Topography,"Howard Waterfall Retreat Competition: Buildner’s Winners Explore Multigenerational Living and Topography

<p><a href=""https://architecturecompetitions.com/?utm_medium=website&amp;utm_source=archdaily.com"" target=""_blank"">Buildner</a> has announced the results of the <a href=""https://architecturecompetitions.com/howardretreat/archd?utm_medium=website&amp;utm_source=archdaily.com"" target=""_blank"">Howard Waterfall Retreat</a> architecture competition, an international design challenge developed in close collaboration with the Howard Family Trust. The competition invited architects and designers to propose a multi-generational family retreat set within a privately owned, forested landscape in Northwestern <a href=""https://www.archdaily.com/tag/pennsylvania"">Pennsylvania</a>, centered on the dramatic presence of Howard Falls and the surrounding gorge.</p>",
rss,www.archdaily.com,https://www.archdaily.com/1037428/snob-architects-designs-contemporary-office-building-in-barcelonas-el-raval-district,1766989800,SNOB Architects Designs Contemporary Office Building in Barcelona’s El Raval District,"SNOB Architects Designs Contemporary Office Building in Barcelona’s El Raval District

<p>Located in <a href=""https://www.archdaily.com/tag/barcelona/page/1"">Barcelona</a>'s El Raval district, the Futuristic <a href=""https://www.archdaily.com/tag/office"">Office</a> Building by <a href=""https://www.archdaily.com/tag/snob-architects/page/1"">SNOB Architects </a>introduces a <a href=""https://www.archdaily.com/tag/contemporary"">contemporary</a> <a href=""https://www.archdaily.com/tag/office"">office</a> program within a consolidated and historically layered <a href=""https://www.archdaily.com/tag/urban"">urban</a> environment. Designed by the <a href=""https://www.archdaily.com/tag/lisbon"">Lisbon</a>-based practice and scheduled for completion around 2026, the project comprises approximately 12,000 square meters of gross built area. The <a href=""https://www.archdaily.com/tag/buildings"">building</a>'s height, massing, and proportions are calibrated in response to the surrounding fabric, reflecting the scale of adjacent <a href=""https://www.archdaily.com/tag/structures"">structures</a> while establishing a <a href=""https://www.archdaily.com/tag/contemporary"">contemporary</a> architectural language. Rather than presenting itself as an isolated object, the project is conceived as part of the existing <a href=""https://www.archdaily.com/tag/city"">city</a>, contributing to the gradual transformation of El Raval through a controlled and context-aware architectural approach.</p>",
rss,www.archdaily.com,https://www.archdaily.com/1037087/villa-t-la-obra,1766988000,Villa T  / la obra,"Villa T  / la obra

<p>The old Villa Terraza, named by its first inhabitant with a small sign at the entrance, already contained the essence of the project: a house defined by light and the desire to transform an apartment into a bright refuge. This original intuition guided the project from the beginning. <strong>The home opens to all orientations, allowing the sun to organize the rhythms of daily life.</strong></p>",
rss,www.archdaily.com,https://www.archdaily.com/1037421/a-smart-city-prototype-in-japan-plp-architecture-breaks-ground-on-the-first-tower-of-tokyo-cross-park,1766986200,A Smart City Prototype in Japan: PLP Architecture Breaks Ground on the First Tower of Tokyo Cross Park,"A Smart City Prototype in Japan: PLP Architecture Breaks Ground on the First Tower of Tokyo Cross Park

<p>Construction has officially broken ground on <a href=""https://www.archdaily.com/city/tokyo"" rel=""noopener"" target=""_blank"">Tokyo</a>'s new global headquarters for NTT, a major Japanese technology company. The project is a key component of <a href=""https://www.archdaily.com/979532/plp-architecture-unveils-masterplan-of-tokyo-cross-park-vision"" rel=""noopener"" target=""_blank"">PLP Architecture's Tokyo Cross Park masterplan, a large-scale regeneration development in the Tokyo metropolitan area</a>, first announced in 2022. On December 5, 2025, construction began on the first stage of the scheme, one of four towers planned within the masterplan. The NTT Hibiya Tower, designed by <a href=""https://www.archdaily.com/office/plp-architecture"" rel=""noopener"" target=""_blank"">PLP Architecture</a> and developed by NTT Urban Development in collaboration with Tokyo Electric Power Company, is a 230-metre-tall, 361,000-square-metre mixed-use building and forms the central element of the 1.1-million-square-metre Tokyo Cross Park Vision. PLP Architecture serves as Design Architect for the tower, as well as Masterplanner and Placemaking Strategist for the wider development.</p>",
rss,www.archdaily.com,https://www.archdaily.com/1029725/historic-materials-in-the-digital-age-how-digitally-assisted-stone-carving-adds-a-new-dimension-to-heritage-restoration,1766980800,Historic Materials in the Digital Age: How Digitally Assisted Stone Carving Adds a New Dimension to Heritage Restoration,"Historic Materials in the Digital Age: How Digitally Assisted Stone Carving Adds a New Dimension to Heritage Restoration

<p>Heritage restoration has always been an intricate process that requires delicate balancing between preserving the integrity of historic materials while integrating contemporary techniques that can enhance accuracy, efficiency, and resilience. With <a href=""https://www.canada.ca/en/public-services-procurement/services/infrastructure-buildings/parliamentary-precinct/multimedia/renovating-centre-block.html?utm_medium=website&amp;utm_source=archdaily.com"" target=""_blank"">the restoration process of Parliament Hill</a> in <a href=""https://www.archdaily.com/tag/ottawa"">Ottawa</a>, Canada's capital city, this intersection of tradition and technology is now on full display. <a href=""https://www.canada.ca/en/public-services-procurement/services/infrastructure-buildings/parliamentary-precinct/discover/east-block.html?utm_medium=website&amp;utm_source=archdaily.com"" target=""_blank"">The East Block</a>, built in 1865, offers a compelling example of how digital tools can support the efforts of heritage restoration and contribute to a centuries-old craft such as stone carving.</p>",
rss,www.archdaily.com,https://www.archdaily.com/1037069/the-shrine-office-sobokuya-inc-plus-private-architect-studio,1766977200,The Shrine Office / Sobokuya Inc. +  PRIVATE Architect Studio,"The Shrine Office / Sobokuya Inc. +  PRIVATE Architect Studio

<p>Nature takes the lead, and architecture follows in harmony. A dialogue between light and material— a timeless structure designed to live with this land for generations to come.</p>",
rss,www.archdaily.com,https://www.archdaily.com/1037252/house-in-koganei-sa-house-ofa-officeforarchitects-architectural-design-office,1766973600,"House in Koganei, SA House / OFA (OfficeForArchitects) Architectural Design Office","House in Koganei, SA House / OFA (OfficeForArchitects) Architectural Design Office

<p>This project is a two-story timber house situated in a quiet suburban neighborhood adjacent to an urban park on the outskirts of <a href=""https://www.archdaily.com/tag/tokyo"">Tokyo</a>. The project began with a shared vision between the client and the architect: to place a ""tunnel of greenery"" at the center of the home. The design process, therefore, started with the careful selection of a site capable of realizing this idea. Benefiting from the lush trees of the park extending to the north, the internal space incorporates a generous opening that frames the landscape and draws views deep into the house, establishing the integration of greenery as the principal architectural theme.</p>",
rss,www.archdaily.com,https://www.archdaily.com/1037241/choreography-of-a-cloud-dancing-shadows-art-pavilion-at-the-louvre-abu-dhabi-yokomae-et-bouayad,1766966400,"Choreography of a Cloud, Dancing Shadows Art Pavilion at the Louvre Abu Dhabi / YOKOMAE et BOUAYAD","Choreography of a Cloud, Dancing Shadows Art Pavilion at the Louvre Abu Dhabi / YOKOMAE et BOUAYAD

<p>YOKOMAE et BOUAYAD announce their selected entry, among five others, inside the Louvre <a href=""https://www.archdaily.com/tag/abu-dhabi"">Abu Dhabi</a> for the Richard Mille Art Prize. Inaugurated under the Louvre Abu Dhabi's iconic dome on October 10th and running until December 28th for the Art Here 2025, Richard Mille Art Prize launched an international competition that attracted more than 400 projects to design and build five art installations and/or architectural pavilions reflecting on this year's theme of ""shadows.""</p>",
rss,www.archdaily.com,https://www.archdaily.com/957619/the-kensington-learning-space-plan-architect,1766955600,The Kensington Learning Space / Plan Architect,"The Kensington Learning Space / Plan Architect

<p>The Kensington Learning space is a new concept of kids learning space which consist of learning space, playing space and nature space. The site location is sitting in the Bangkok suburban area with the not-so-interesting surrounding.  So the layout design is set to create its own atmosphere.</p>",
rss,www.archdaily.com,https://www.archdaily.com/1037292/nice-rice-xinle-road-concept-store-say-architects,1766941200,nice rice Xinle Road Concept Store / say architects,"nice rice Xinle Road Concept Store / say architects

<p>Nice rice Xinle Road marks the origin of the brand, and this year it has been thoughtfully renewed. Today, the brand has expanded to dozens of cities nationwide, yet each new opening looks back to Xinle Road as its point of departure. With this vision at the core, say reimagined the store as a place of convergence, depicting a warm, welcoming""rice house"".</p>",
rss,www.archdaily.com,https://www.archdaily.com/1037181/vicente-house-masa-arquitectos,1766934000,Vicente House / MASA Arquitectos,"Vicente House / MASA Arquitectos

<p><em>Uncertainty as an Opportunity for Change.</em> The pandemic affected&mdash;among other things&mdash;the way we relate to and inhabit spaces. The concepts of balance and stability were called into question. As a working hypothesis, we understood that instability would become a new form of balance.&nbsp;</p>",
rss,www.archdaily.com,https://www.archdaily.com/1036823/dot-ateliers-adjaye-associates,1766919600,Dot Ateliers / Adjaye Associates,"Dot Ateliers / Adjaye Associates

<p>""Artists bring so much value to the world and don't ask for much in return except for support in the form of spaces and materials to create and freedom to experiment with their creativity and maybe recognition to crown it all. …Hopefully a little assistance from us all can help grow their talents, add value to themselves and their works, thus allowing them to continue adding value to the world."" Amoako Boafo, Artist and Founder of dot.ateliers</p>",
