source,query,url,created_utc,title,text
youtube,interior design trends,https://www.youtube.com/watch?v=rhs4beuv03c,1776004285,Modern Living Room Design Ideas Home Interior Design| Living Room Wall Decorating Ideas #shorts,Modern Living Room Design Ideas Home Interior Design| Living Room Wall Decorating Ideas #shorts Luxurious Neutrality: ...
youtube,interior design trends,https://www.youtube.com/watch?v=nhxgNhs2Hy4,1776003204,Best dressing table| #interiordesign #homedecor #home #livingroomdecor #decor #sofaset #furniture,"Transform your bedroom or vanity space with modern dressing table designs that blend style and functionality. In this video, we ..."
youtube,interior design trends,https://www.youtube.com/watch?v=l15BAVzvEQ8,1775999710,Dragon style luxury pool  #beforeafterrenovation #diy #transformyourhome,"Welcome to [Your Channel Name], your go-to destination for luxury home transformations and cinematic interior renovations."
youtube,interior design trends,https://www.youtube.com/watch?v=lOr03DL9qfU,1775995666,Home Interior design 🤯 #shorts #trending #viral,"interior design, interior design 101, interior design 2026, interior design tips, interior design tour, home interior design, 2bhk ..."
youtube,interior design trends,https://www.youtube.com/watch?v=vOzODv2rScM,1775995706,"Bathroom Interior Design Trends#DreamTrackAI Empty highway, midnight drive","Bathroom Interior Design Trends 2026 #DreamTrackAI Empty highway, midnight drive image By veecteez imagesearchman ..."
youtube,interior design trends,https://www.youtube.com/watch?v=_tsxegZ06kE,1775995266,👉 🚨 5 MORE DECOR TRENDS THAT WILL MAKE YOUR HOME LOOK OUTDATED IN 2026,"Your home might be following trends that are already going out of style In this video, you'll discover 5 more decor mistakes ..."
youtube,interior design trends,https://www.youtube.com/watch?v=IJqiUOGdQcE,1775993412,Toiletten Ideen Deutsch Die besten WC Design Trends,"Suchst du nach modernen Toiletten Ideen, um dein WC stilvoll und funktional zu gestalten? In diesem Video zeigen wir dir die ..."
youtube,interior design trends,https://www.youtube.com/watch?v=zY4VPEJHJss,1775991600,Modern Boho Meets Vintage Cottage | Cozy Decor Trends You’ll See Everywhere in 2026,Welcome back to Decorancy. modern boho decor and vintage cottage style—the coziest home decor trend taking over 2026!
youtube,interior design trends,https://www.youtube.com/watch?v=QyCBLW5YWv8,1775988985,Space-Saving Door Design 2026 | Home Organization Ideas #shorts  #youtubeshorts #Architecture,Folding glass partitions are versatile architectural solutions designed to transform spaces with elegance and functionality.
youtube,interior design trends,https://www.youtube.com/watch?v=wAsAdSvhE8g,1775978477,Luxury living room trends 2026 Design By Mulev Associates,
youtube,interior design trends,https://www.youtube.com/watch?v=024IV4gX17A,1775970000,Hidden Staircase Design That Doubles as Furniture – Genius Space-Saving Idea!,Hidden Staircase Design That Doubles as Furniture – Genius Space-Saving Idea! This incredible build transforms a floating ...
youtube,interior design trends,https://www.youtube.com/watch?v=X0vvpjhA30A,1775970028,стильная детская #дизайнпроект #дизайнинтерьера,Подписывайся на канал @AlenaaTotskaya чтобы быть в тренде современного дизайна Оставить заявку на дизайн ...
youtube,interior design trends,https://www.youtube.com/watch?v=TVW1Rs2y4-g,1775966539,Interior By The design studio #interiordesign  #decorideas #inspiration,"Welcome to Interior By The design studio, where our team of experts share their top interior design ideas to help you create your ..."
youtube,interior design trends,https://www.youtube.com/watch?v=SWrLDWQzZtI,1775959227,Interior Home Decor🔥💫 #shorts,Interior Home Decor     #shorts YOUR QUERIES:- exterior design minecraft exterior design of modern houses exterior design ...
youtube,interior design trends,https://www.youtube.com/watch?v=SXUZrz2STGM,1775947501,Classic European Interior Trends 2026 ✨ Timeless Luxury Meets Modern Elegance,Discover how classic European interiors are making a stunning comeback with a modern twist. From elegant moldings to ...
youtube,interior design trends,https://www.youtube.com/watch?v=mP9qa_fky7k,1775928613,Kleine Räume Wohnzimmer modern gemütlich Ideen,"In diesem Video zeigen wir dir die besten Wohnzimmer Ideen modern gemütlich, um dein Zuhause in einen stilvollen, warmen ..."
youtube,interior design trends,https://www.youtube.com/watch?v=urSwRKC6RRQ,1775925908,The Finishing Touch Most People Miss,"Sometimes it's the smallest details that make the biggest impact. Instead of the typical bulky vent cover, we used a low-profile ..."
youtube,interior design trends,https://www.youtube.com/watch?v=k1nrNlSCFAk,1775924535,2026 Modern Bedroom &amp; Living Room Transformation Ideas ✨ #smarthomedecor #home,"Welcome to Modern Home Lifestyle! ✨ ​In today's video, we are sharing some of the most beautiful and trending home decor ..."
youtube,interior design trends,https://www.youtube.com/watch?v=SDO6cDRoB0g,1775922222,How to make pillar deigein -send coment deigein বালি সিমেন্ট দিয়ে ফোর্সের পিলার এর ডিজাইন এর কাজ,FalseCeilingDesign #InteriorDesign #InteriorDecoration Welcome to our channel dedicated to Gypsum interior design inspiration!
youtube,interior design trends,https://www.youtube.com/watch?v=gzFkc8ldbLU,1775920468,ТОП тренды дизайна 2026 ✨ #дизайн2026 #интерьер2026 #shorts,"Ваш интерьер застряла в прошлом? В 2026 году мы уходим от визуального шума к концепции ""тихой роскоши"" и ..."
youtube,interior design trends,https://www.youtube.com/watch?v=71uUNJq3KG4,1775920248,Modern Entry Door Design 2026 🚪 | Latest Main Door Ideas for Home  घर के Main Door के Latest Design,Modern Entry Door Design 2026 | Latest Main Door Ideas for Home घर के Main Door के Latest Design Stylish Entry Door ...
youtube,interior design trends,https://www.youtube.com/watch?v=XKfKQo_iafk,1775919652,Luxury Villa Tour | Premium Interior Design Dubai #dubai #interiorfitoutcompanydubai,"Set in Palm Jumeirah, this villa is designed to match its location open spaces that breathe materials that speak for themselves ..."
youtube,interior design trends,https://www.youtube.com/watch?v=IHHg7OzFTwQ,1775919635,2026 Cabinet Trends: Is Painted Finally Out? 🎨➡️🪵,We're looking ahead at the trends hitting the industry in 2026. The biggest shift we're seeing? All-painted kitchens are on the way ...
youtube,interior design trends,https://www.youtube.com/watch?v=ydSGakqnEuY,1775916055,Vinylboden Trends 2026 – Diese Designs kommen jetzt!,In diesem Video zeigen wir dir die Vinylboden Trends für 2026 und welche Dekore jetzt besonders gefragt sind. Von natürlichen ...
youtube,interior design trends,https://www.youtube.com/watch?v=EaB036YEwnw,1775914230,From Yarn to Wow! Wonderful Crochet Home Decor Ideas | Timeless Handmade Inspiration,"Beautiful crochet home decor ideas that are taking over 2026 interior design trends! ✨ In this video, we explore how DIY ..."
youtube,home decor ideas,https://www.youtube.com/watch?v=rhs4beuv03c,1776004285,Modern Living Room Design Ideas Home Interior Design| Living Room Wall Decorating Ideas #shorts,Modern Living Room Design Ideas Home Interior Design| Living Room Wall Decorating Ideas #shorts Luxurious Neutrality: ...
youtube,home decor ideas,https://www.youtube.com/watch?v=pv6n7uCCMRg,1776001744,💫Diy Pen Stand Making Ideas with Bottle #diy #homedecor #handmade #penstand #trending #ytshorts,
youtube,home decor ideas,https://www.youtube.com/watch?v=u8J1eNzlfV4,1776000704,Easy dream catcher ideas #diy #craft #shorts #viral #viralshorts #ytshorts #homedecor #handmade,Easy dream catcher ideas #diy #craft #shorts #viral #viralshorts #ytshorts #homedecor #handmade.
youtube,home decor ideas,https://www.youtube.com/watch?v=d9oPPbOGg6I,1776000649,DIY Wall Decor Ideas 😍 | Easy &amp; Budget Friendly Home Decor #diy #homedecor #yt  #walldecor #shorts,DIY Wall Decor Ideas | Easy & Budget Friendly Home Decor   Perfect for beginners and anyone who loves creative crafts ...
youtube,home decor ideas,https://www.youtube.com/watch?v=Fi7gQk8Wm38,1775999160,home decor ideas,
youtube,home decor ideas,https://www.youtube.com/watch?v=dFJoF9hFmZM,1775998806,KITCHEN Decorating Ideas | Spring Decor,"Transform your kitchen for spring with simple, elegant decorating ideas using natural textures, soft greens, pops of colour and ..."
youtube,home decor ideas,https://www.youtube.com/watch?v=qGQXCVOlCUU,1775997890,Home decor ideas from waste material ✨ Tutorial. #anshika #homedecor #walldecor #diycrafts,
youtube,home decor ideas,https://www.youtube.com/watch?v=TUpbcYP33_I,1775997300,Diy Woolen Wall Hanging | Wall Decor Ideas ✨#ytshorts #wallhanging #walldecor #craft,Diy Woolen Wall Hanging | Wall Decor Ideas ✨#ytshorts #wallhanging #walldecor #craft How To Make woolen wall hanging wall ...
youtube,home decor ideas,https://www.youtube.com/watch?v=9-V8Hpr-18k,1775992757,DIY Artificial Plant 🌿 | Easy Handmade Home Decor Idea#shorts#viral#shortvideo#homedecor#viralshorts,DIY Artificial Plant | Easy Handmade Home Decor Idea#shorts#viral#shortvideo#homedecor#viralshorts#diy#planter ...
youtube,home decor ideas,https://www.youtube.com/watch?v=aAdTpZgo20E,1775992596,DIY Bow Grid Wall Decor 🎀 | Easy Aesthetic Room Decor #shorts,"Create this super cute and aesthetic DIY Bow Grid Wall Decor at home ✨ Perfect for room decoration, Pinterest-inspired setup, ..."
youtube,home decor ideas,https://www.youtube.com/watch?v=Uzo_6ae0H_8,1775988840,#hobbylobby #shopping #shopwithme #shoppingtime #homedecor #homedecorinspo #homedecorideas,
youtube,home decor ideas,https://www.youtube.com/watch?v=HET86Lng_Qc,1775985955,Amazing Kids Room Design &amp; Organization Ideas #KidsRoomDesign #RoomDecor #InteriorDesign #ytshorts,Amazing Kids Room Design & Organization Ideas 2026 Transform your child's world with these creative and functional kids' room ...
youtube,home decor ideas,https://www.youtube.com/watch?v=Ez76KVPYYwo,1775983571,Diy Aesthetic Home Decor🩷✨||DIY cute mini planter # Easy Room Decor Ideas#viralshorts #planter#diy,Diy Aesthetic Home Decor  ✨||Diy cute mini planter # Easy Room Decor Ideas#shorts #viralshorts #homedecor #planter #diy ...
youtube,home decor ideas,https://www.youtube.com/watch?v=XnXAw6NDpa0,1775982972,Flipkart Home Decor Haul #homedecor #decor #fyp  #under500 #decorideas #shorts #viral #flipkarthaul,
youtube,home decor ideas,https://www.youtube.com/watch?v=jBKjiGsKhU8,1775982618,Modern Pine Wood Wall Shelf Installation | Easy Drill Setup | Home Decor Ideas #ytshorts #viral,
youtube,home decor ideas,https://www.youtube.com/watch?v=i-C8dljyhRo,1775981626,DIY Home Decor Ideas 💡 | Doodh Pilae Glass Decoration | Wedding Accessories 2026 | #diy,DIY Home Decor Ideas | Doodh Pilae Glass Decoration | Wedding Accessories 2026 | #diy.
youtube,home decor ideas,https://www.youtube.com/watch?v=nZxdzmJVf28,1775980820,Indha oru 🥾👠shoe rack irundha podhum nga… 🥳 #shoeden #homedecorideas,"Tired of messy shoes all over your home? ✨ Upgrade your space with a strong, stylish, and super practical shoe rack! I recently ..."
youtube,home decor ideas,https://www.youtube.com/watch?v=zn2hU4cxj78,1775976310,My Dream Bedroom Setup #homedecor #bedroomdecor #diyideas #diydecor #home #cozyhome #ideas#furniture,
youtube,home decor ideas,https://www.youtube.com/watch?v=pRYg8OGWoJE,1775975858,DIY hanging lantern using waste materials | कबाड़ से जुगाड़ | Home decor ideas | Gardening tips,
youtube,home decor ideas,https://www.youtube.com/watch?v=CmJ2L6qUDMw,1775975303,Diy home decor ideas 💡#artandcraft #shorts,Diy home decor ideas #artandcraft #shorts #homedecor #artandcraft #art #artwork #homedecorideas #decor.
youtube,home decor ideas,https://www.youtube.com/watch?v=IMIPaUC8eWE,1775974947,Beautiful Home Decoration ideas #homedecor #homedesign,
youtube,home decor ideas,https://www.youtube.com/watch?v=N1MOYmNYCuM,1775974163,Mini vase fridge magnet #magnet #plants #shorts #ytshorts #home #decorideas #aesthetic #pinterest,DIY #DIYCrafts #FridgeMagnet #MiniVase #Handmade #CraftIdeas #EasyDIY #HomeDecor #AestheticDecor #CreativeIdeas ...
youtube,home decor ideas,https://www.youtube.com/watch?v=YOFG7wbCXts,1775968686,Wallpaper sheet water proof home decoration ideas latest design #wall #homedecor #shortsfeed,"Wellcome to Wall Sheet Youtube Channel– your ultimate destination for creative wall sheet Designs, DIY decor ideas, and ..."
youtube,home decor ideas,https://www.youtube.com/watch?v=dKYHj1niLQg,1775966210,wall hanging pepar craft || Home Decor ideas 💡#youtubeshorts #handmade #craft #viral #short #shorts,Diy || wall hanging pepar craft || Home Decor ideas like comment ❤️ share #support me     #youtubeshorts ...
youtube,home decor ideas,https://www.youtube.com/watch?v=1tuOo2Zbzw8,1775960477,#shopping #shopwithme #homedecor #hobbylobby #hobbylobbyfinds #homedecorideas #homedecorinspo,
youtube,small apartment decor,https://www.youtube.com/watch?v=gqGMRuDDR5g,1776003408,Elegant Parisian Small Apartment Makeover | Chic French Decor Ideas for Tiny Space Living,Step into the world of timeless elegance with this *Elegant Parisian Small Apartment Makeover* by ATS Studio ✨    .
youtube,small apartment decor,https://www.youtube.com/watch?v=EWPt8h7K7O8,1776002430,Small Apartment TRANSFORMATION 🏡 Before to Luxury Modern Makeover 😳✨ #viral #shorts #smallapartment,Small Apartment TRANSFORMATION Before to Luxury Modern Makeover ✨ Watch this stunning small apartment ...
youtube,small apartment decor,https://www.youtube.com/watch?v=YSxNNwNKSME,1776002427,“This Studio Apartment Transformation Will Blow Your Mind 🤯 | Epoxy Floor Magic” #shorts,"This is one of the most satisfying studio apartment transformations you'll ever watch Starting from a dusty, unfinished space with ..."
youtube,small apartment decor,https://www.youtube.com/watch?v=bmJrsaQrDfo,1776000232,Sofa in small apartments can be cool too.#sofa #sofabed #home #bed #homedesign,
youtube,small apartment decor,https://www.youtube.com/watch?v=-jI6_0oFmdg,1775997001,“गरीब से लग्ज़री तक 😍 Studio Apartment Makeover with Epoxy Floor”,गरीब से लग्ज़री तक Studio Apartment Makeover with Epoxy Floor” Watch this insane transformation of a simple ...
youtube,small apartment decor,https://www.youtube.com/watch?v=r29Lz9Aa6SY,1775993702,Worst Mistakes in Small Houses #short #shorts #viralshort,Worst Mistakes in Small Houses #short #shorts #viralshort Related Queries:- #smallbedroom #bedroomstorage #storagesolutions ...
youtube,small apartment decor,https://www.youtube.com/watch?v=gk3gqBOjPgA,1775993772,"Tiny Apartment Makeover Ideas for Small Spaces That Feel Cozy, Modern, and Spacious","Looking to transform your tiny apartment into a cozy, modern, and spacious retreat? ✨ In this video from Decor Pedia, we share ..."
youtube,small apartment decor,https://www.youtube.com/watch?v=dgNXTBUX6vE,1775991921,Tiny Studio Apartment Makeover Ideas That Transform Your Small Home,Transform your tiny studio apartment into a stylish and functional home with these smart makeover ideas. In this video from Vhin ...
youtube,small apartment decor,https://www.youtube.com/watch?v=lJzSR_BDGzM,1775991673,Miami Art Deco in a Small Paris Apartment | A Vibrant Twist on Timeless Style,"This video explores how a small Parisian apartment can be transformed using the bold, vibrant energy of Miami Art Deco—without ..."
youtube,small apartment decor,https://www.youtube.com/watch?v=qN0NaeiHTjs,1775990147,#recreationalvehicle  #travel  #camping #travel trailer camping#automobile,house design plan house design ideas interior design ideas interior design ideas for small house house design planner free ...
youtube,small apartment decor,https://www.youtube.com/watch?v=IdpD93ZhIBA,1775988025,Prieto Móveis - Projeto de Cozinha: aéreos inteligentes para airfryer e batedeira.,"Você já sentiu a frustração de ter uma cozinha linda, mas que não cabe nada? No vídeo de hoje, a Pri Prieto revela como o ..."
youtube,small apartment decor,https://www.youtube.com/watch?v=mJfb1X0kfsk,1775985335,Space Saving Furniture Small Flats Complete Home Interior Under Budget #home #decoration #interior,Welcome To The Fixitindia Decor Complete Home & Office Interior decor under on Roof Our services Complete Home & office ...
youtube,small apartment decor,https://www.youtube.com/watch?v=8GXNnrHpcPo,1775984881,#recreationalvehicle  #travel  #camping #travel trailer camping#automobile,house design plan house design ideas interior design ideas interior design ideas for small house house design planner free ...
youtube,small apartment decor,https://www.youtube.com/watch?v=ii4Lo2KV3ls,1775979553,Small Apartment Decor ❤️🔥💯👍🏻 #home #interiordesign,
youtube,small apartment decor,https://www.youtube.com/watch?v=u0DWLpGjMJo,1775973645,Luxury Studio Apartment Floor Transformation 😍 Unreal Epoxy Makeover,Watch this incredible studio apartment transformation from raw empty space to a fully furnished luxury interior with a stunning ...
youtube,small apartment decor,https://www.youtube.com/watch?v=cGGNKcH5EGw,1775967583,Shower Head Holder Set – High Pressure Shower Head Upgrade for Bathroom #shortsfeed,"In this video, we showcase the ultimate triple touch sensor LED mirror and explore the latest LED mirror design perfect for modern ..."
youtube,small apartment decor,https://www.youtube.com/watch?v=U8DR-Es1fMA,1775956441,1 bedroom that doesn&#39;t feel cramped (courtyard reveal) #tinyhome #design #shorts,
youtube,small apartment decor,https://www.youtube.com/watch?v=M2HV-y5wJDQ,1775955620,Extendable Cream Style Dining Table#extendabletable #diningtable #smallapartment #shorts,Creamy Style Extendable Dining Table Perfect for Small Apartments.
youtube,small apartment decor,https://www.youtube.com/watch?v=zwicdF-dyZ4,1775952066,Tiny 6x8 Weekend Makeover Rewrite,"A rapid, unique tiny space transformation that fits a full set of functions into a cramped 6x8 apartment. Watch a bold redesign ..."
youtube,small apartment decor,https://www.youtube.com/watch?v=cMhkqOj6u9M,1775950144,apartment decor updates! #crochet #smallapartment,
youtube,small apartment decor,https://www.youtube.com/watch?v=RDOkVWejMx0,1775941380,обустройство маленькой квартиры | все арты в тгк rizhick 🤍✨,
youtube,small apartment decor,https://www.youtube.com/watch?v=QTW7yiYB-7s,1775935894,This Tiny Manhattan Apartment Is For Sale… And You Can OWN It 😳,"We're checking out a tiny apartment in Manhattan — and believe it or not, you can actually OWN it Buying property in NYC is ..."
youtube,small apartment decor,https://www.youtube.com/watch?v=QvwwKG6UWAM,1775931478,You Won’t Believe This Studio Apartment Transformation 😳,Step inside this modern studio apartment transformation ✨ A smart and stylish small space design that proves you don't need a ...
youtube,small apartment decor,https://www.youtube.com/watch?v=29SO-W8LK1w,1775931060,it took years for me to make this apartment a home. #Shorts #anisainside,it took years for me to make this apartment a home. it took years for me to make this apartment a home. it took years for me to ...
youtube,small apartment decor,https://www.youtube.com/watch?v=Z3Xr-cbkT9A,1775927776,Small Apartment Decoration Ideas | Chhote Ghar Ko Bada Kaise Dikhaye | Smart Home Hacks.,Small Apartment Decoration Ideas | Chhote Ghar Ko Bada Kaise Dikhaye | Smart Home Hacks. Is video me aapko milenge 9 easy ...
