source,query,url,created_utc,title,text
youtube,interior design trends,https://www.youtube.com/watch?v=nvfHliekco8,1773821709,One Tile Fits All!  Interior Design Trends,Interior Design Trends for 2026! #InteriorDesign #DesignTrends #Shorts.
youtube,interior design trends,https://www.youtube.com/watch?v=U5WUmGwGxqU,1773819476,"2026 Home Decor: DITCH TRENDS, FIND YOUR SOUL STYLE",इस वीडियो में देखिए कैसे एक पुराने और टूटे-फूटे घर को कड़ी मेहनत और ...
youtube,interior design trends,https://www.youtube.com/watch?v=HeXhT5wa1eY,1773809067,Room Flooring Ideas 2026 | Modern Floor Design for Home #shorts #viral,Agar aap apne ghar ya room ke liye best flooring ideas dhoond rahe hain to yeh video aap ke liye hai. Is video mein hum latest ...
youtube,interior design trends,https://www.youtube.com/watch?v=PxNYvS39jOs,1773808216,DIY @designmaster96#BedroomStyle #HomeDecor #InteriorDesign #DecorIdeas #RoomMakeover #DesignTrends,
youtube,interior design trends,https://www.youtube.com/watch?v=vqUNDxaVK6c,1773802984,trending tv unit design ideas,"Transform your living space with stunning TV cabinet design ideas! 🛋️✨ In this video, we dive into the latest trends and creative ..."
youtube,interior design trends,https://www.youtube.com/watch?v=x0cVZHvGwm4,1773798806,"Revolutionary Home Decor Hacks: Save Big, Go Viral",Description: Dive into the world of revolutionary home decor hacks! Discover how to save big on stylish home improvements.
youtube,interior design trends,https://www.youtube.com/watch?v=kB9hK5uZmLA,1773797444,“3D Sunflower Floor Design 🌻 | Luxury Epoxy Bedroom Makeover” #viral #shortsfeed #shorts #video #new,Transform your bedroom into a breathtaking sunflower paradise with this stunning 3D epoxy floor design. This ultra-realistic ...
youtube,interior design trends,https://www.youtube.com/watch?v=BJ0AaGrUwJ8,1773797409,Modern Open Concept Interior Designs That Look Luxurious &amp; Expensive | 2026 Trends,"Welcome to Haven and Green, where we explore the most stunning home designs and layouts. This video showcases various ..."
youtube,interior design trends,https://www.youtube.com/watch?v=oXFeBQjRhmw,1773795005,I Turned My Bedroom into a Tropical Jungle Floor! 🌿✨ #InteriorDesign #epoxyart,Ever dreamed of walking on water through a lush forest? Watch this incredible transformation as we embed live greenery into a ...
youtube,interior design trends,https://www.youtube.com/watch?v=_CtNUG6G5Z8,1773793435,Luxury Wood Epoxy Floor Transformation | Satisfying Interior Design #woodfloor #epoxyfloor,About Video: Watch this incredible epoxy flooring design made with real wood slices! This unique interior transformation blends ...
youtube,interior design trends,https://www.youtube.com/watch?v=mZb5KKhFeKo,1773792055,#ModernFlooring #3DEpoxyFloor #LuxuryHomeDesign #InteriorDesignTrends#shortsfeed,"Transform your space with cutting-edge flooring solutions Explore bold 3D epoxy designs, luxurious marble, sleek tiles, and ..."
youtube,interior design trends,https://www.youtube.com/watch?v=TYTL2fDwDZw,1773774558,Home Decor Ideas #trinterior #interiordesign,"""Welcome to T.R Interior. ""Check out our latest video featuring amazing furniture designs, trends, and DIY tutorials! In this video ..."
youtube,interior design trends,https://www.youtube.com/watch?v=fnZCYlxPUVA,1773774040,Beverly Hills Glam Interior in Small Apartments | Valentino Red Design Trend 2026,Valentino Red 2026: Replicating Beverly Hills Glamour in Compact Seoul Apartments explores how bold luxury interior design ...
youtube,interior design trends,https://www.youtube.com/watch?v=KsETnNFEuqI,1773774025,"The Secret to a Cozy Home ☁️✨Small change, HUGE vibe shift. ✨&quot;luxury home decor ideas, minimal",Transform your space instantly with this simple lace curtain hack. Discover how soft textures and natural light can completely ...
youtube,interior design trends,https://www.youtube.com/watch?v=FHlXBo9fBhg,1773771300,What&#39;s Coming IN 2026: Home Decor Trends You&#39;ll Love,"Discover the home decor trends actually WORTH embracing in 2026! After my last video on what's going OUT, you asked what's ..."
youtube,interior design trends,https://www.youtube.com/watch?v=Hsa--sZPGzU,1773770517,Тренды текстиля 2026: что показали в Париже,Paris Deco Off задаёт направление для всего интерьерного рынка. В 2026 текстиль становится более декоративным: ...
youtube,interior design trends,https://www.youtube.com/watch?v=RhoSvILPiIc,1773770427,Ralph Lauren Interior Design Trends 2026: Elegant Homes You’ll Love,homedecor #housedecor #homedecorideas #housedecorideas Step into the world of timeless sophistication with Ralph Lauren's ...
youtube,interior design trends,https://www.youtube.com/watch?v=VcfX9QM0aAs,1773767286,Mistake 🔥😱🔥😱🔥#interior #interiordesign #viral #video #shorts #short #reels #youtube #viralshort,"interior design,home decor,modern home design,interior trends 2025,luxury interiors,small space ideas,living room design ..."
youtube,interior design trends,https://www.youtube.com/watch?v=mEQwpic3sLc,1773767144,Backyard Makeover 🔥🤩🔥🤩🔥#interior #interiordesign #viral #video #shorts #short #reels #youtube,"interior design,home decor,modern home design,interior trends 2025,luxury interiors,small space ideas,living room design ..."
youtube,interior design trends,https://www.youtube.com/watch?v=lgOkKwy5Ssg,1773766406,"Amazing Top Modern Home Design Trends 2026 | Smart Living Ideas design, Innovative home design ideas","Welcome to our channel! In this video, we explore Innovative Home Design Ideas for 2026 that are transforming the way we live."
youtube,interior design trends,https://www.youtube.com/watch?v=oAqN4tuTNjY,1773765845,Design Trends 2026!,"Achtung, Interior-Alarm 2026! Wer dachte, runde Ecken sind nur was für Kinderzimmer, falsch gedacht! Von Riffelglas bis ..."
youtube,interior design trends,https://www.youtube.com/watch?v=TkrVuHIJYFo,1773765099,10 Cozy &amp; Elegant Small Apartment Decorating Ideas: Luxury Living Inspiration,Transform your home with cozy and elegant small apartment decorating ideas for luxury living inspiration in 2026. This Mizzu ...
youtube,interior design trends,https://www.youtube.com/watch?v=VlaaktkuCj0,1773765000,Stunning 3D Epoxy Floor Installation: DIY Home Renovation Goals #epoxyfloor #renovation,Stunning 3D Epoxy Floor Installation: DIY Home Renovation Goals #epoxyfloor #renovation This is the MOST satisfying home ...
youtube,interior design trends,https://www.youtube.com/watch?v=qzhAqLf7lwE,1773763997,This Floor Looks Like Water 😳 Luxury Bedroom Transformation (Unbelievable!)#LuxuryBedroom #I #usa🇺🇸,This stunning luxury bedroom features a mind-blowing marble floor design that looks like real water . The deep green reflective ...
youtube,interior design trends,https://www.youtube.com/watch?v=nkkCbBr9qTY,1773763733,Restaurant Idea | small cafe | Restaurant Design | # cafe #restourant,Restaurant Idea | small cafe | Restaurant Design | # cafe #restourant Small Fast Food Restaurant Idea | #interiordesign #fastfood ...
youtube,home decor ideas,https://www.youtube.com/watch?v=A6_SpGjCEpw,1773821700,Wallpainting Perfail#wallputtykaisekare​ #ceilingdesign​ #homedesign​ #homedecor​ #trendingsho,Wallpainting Perfail#wallputtykaisekare​ #ceilingdesign​ #homedesign​ #homedecor​ #trendingsho 1st coat wall putty kaise ...
youtube,home decor ideas,https://www.youtube.com/watch?v=x2TTjzEbLok,1773821625,#Home decor four-piece Bedding universal soft velvet sofa cover &quot; #shortsfeed,"Upgrade your home furniture with stylish and protective solutions like chair cover, black chair cover, and modern chair covers ..."
youtube,home decor ideas,https://www.youtube.com/watch?v=fv7LPgaxrDg,1773821597,Chaitra Navaratri/Guddi Padwa special Mango Leaves Toran/Decoration |Traditional Decor #viral#shorts,Chaitra Navaratri/Guddi Padwa special Mango Leaves Toran/Decoration |Traditional Decor #viral#shorts Diy mango leaves ...
youtube,home decor ideas,https://www.youtube.com/watch?v=8tW5bmJsxfc,1773820957,beautiful wall hanging ideas 💫 #youtubeshorts #viralshorts #diy #wallhanging #homedecor #craft,
youtube,home decor ideas,https://www.youtube.com/watch?v=neL_7vQJJlc,1773820349,Snake Plant வாங்கிட்டேன் 🌿 | Home Decor Idea Coming Soon!,நான் recently இந்த Snake Plant வாங்கியிருக்கேன் இது என் வீட்டுக்கு ஒரு ...
youtube,home decor ideas,https://www.youtube.com/watch?v=U5WUmGwGxqU,1773819476,"2026 Home Decor: DITCH TRENDS, FIND YOUR SOUL STYLE",इस वीडियो में देखिए कैसे एक पुराने और टूटे-फूटे घर को कड़ी मेहनत और ...
youtube,home decor ideas,https://www.youtube.com/watch?v=A3tZwu6ArT4,1773819427,Navratri decoration ideas 🥁🥳#tiktok #diy#navratri #decoration#ytshorts #viral#shorts #trending#reels,Navratri decoration ideas #tiktok #diy#navratri #decoration#ytshorts #viral#shorts #trending#reels navratri decoration ideas ...
youtube,home decor ideas,https://www.youtube.com/watch?v=0tCzOBi1eaw,1773819003,empty matchbox reuse ideas/ home decor ideas/ best out of waste #shorts #youtubeshorts #diy #craft,empty matchbox reuse ideas/ home decor ideas/ best out of waste #shorts #youtubeshorts #diy #craft #homedecor #crafts ...
youtube,home decor ideas,https://www.youtube.com/watch?v=pnR00euyCy4,1773819000,Diy home decor ideas#music#shorts#youtube#home decor craft,"Diy home decor ideas #music #shorts #youtube #home decor craft diy home decor ideas, home decor ideas, diy home decor, diy ..."
youtube,home decor ideas,https://www.youtube.com/watch?v=-AROErwd2HU,1773818517,🌸🌈5 Home decor finds ഇതിൽ ഏതാണ് നിങ്ങൾക്ക് ഇഷ്ടപ്പെട്ടത് #trending #flipkart,
youtube,home decor ideas,https://www.youtube.com/watch?v=Cyxf8N018ck,1773818100,wall decoration ideas with paper#shorts #trending #viral #diy #fun #craft#papercraft #youtubeshorts,wall decoration ideas with paper#shorts #trending #viral #diy #fun #craft#papercraft #youtubeshorts #wallhanging #homedecor ...
youtube,home decor ideas,https://www.youtube.com/watch?v=EjTvtW4MZPY,1773816431,Table Decor Ideas #decoration #decor,Welcome to my channel Daily Upload Decoration ideas Aap sabhi ko mera video pasand aaye to please channel ko ...
youtube,home decor ideas,https://www.youtube.com/watch?v=5POy9o6Bzms,1773815402,DIY Texture Wall Art 🖼️ under budget ft. KOLAM #homedecor #interiorstyling #ytshortsindia,"DIY Texture Wall Art 🖼️ under budget ft. KOLAM #homedecor #interiorstyling #ytshortsindia Acha ek baat batao aap log, ..."
youtube,home decor ideas,https://www.youtube.com/watch?v=sM6JXO9nP1Q,1773814225,Home decor ideas | craft ideas | cardboard craft | #craft #creativity #diy #homedecor,
youtube,home decor ideas,https://www.youtube.com/watch?v=6m1qKdmM__c,1773813781,DIY Paper Craft for Eid ✂️ | Eid Mubarak Home Decor Ideas ✨ #shorts #diy #ytshorts #eid #ramadan #yt,DIY Paper Craft for Eid ✂️ | Eid Mubarak Home Decor Ideas ✨ #shorts #diy #ytshorts #eid #ramadan #yt FunSketchWorld ...
youtube,home decor ideas,https://www.youtube.com/watch?v=24x1WhTE8FI,1773813643,Amazing paper flower wall hanging #shorts #youtubeshorts #viralshort #wallhanging #homedecor #craft,diycrafts #wallhanging #homedecor Amazing paper wall hanging /paper craft for home decoration / heart shaped wall decor ideas ...
youtube,home decor ideas,https://www.youtube.com/watch?v=HYx4KwcHL6U,1773811032,DIY Home Decor Craft Ideas #diy #artandcraft #youtubeshorts #craft #homedecor #papercraft #ideas,DIY Home Decor Craft Ideas / Easy Paper Home Decor Craft Ideas #diy #artandcraft #youtubeshorts #craft #share #shorts ...
youtube,home decor ideas,https://www.youtube.com/watch?v=5iVnWNyHBrI,1773810300,DIY Easy Cardboard Home Decor Idea #diy #craft #trendingshorts #youtubeshorts #viralshorts #shorts,DIY Easy Cardboard Home Decor Idea #diy #artandcraft #craft #craftideas #art #homedecor #bestoutofwaste #reuseidea ...
youtube,home decor ideas,https://www.youtube.com/watch?v=p_3XXOoUAHo,1773807675,DIY Paper Sunflower 🌻 | Easy Wall Decor Idea #osmcraft,Learn how to make a beautiful DIY Paper Sunflower step by step! This easy and creative craft idea is perfect for home ...
youtube,home decor ideas,https://www.youtube.com/watch?v=Uzh9Ieb6_OA,1773806671,Cozy Foyer Makeover | Entryway Decor Ideas | Indian Home Aesthetic,Turning my foyer into a cozy welcome corner ✨ In this short video I decorated my foyer area and created a warm and aesthetic ...
youtube,home decor ideas,https://www.youtube.com/watch?v=Hk29McbDk_c,1773805812,Tablescape Tuesday🌸Easter &amp; Spring Table Decor Ideas | Elegant &amp; Cozy Dining Room Setup 2026 ,"Today is Tablescape Tuesday, and I'm decorating my dining room table for Easter and Spring I wanted a cozy, elegant, and ..."
youtube,home decor ideas,https://www.youtube.com/watch?v=6E5v_t74f1A,1773805827,Outdoor Solar Wind Chime Light 😍 Luxury Garden Decor #shorts #homedecor #solar,Outdoor Solar Wind Chime Light Luxury Garden Decor #shorts #homedecor #solar Upgrade your outdoor space with this ...
youtube,home decor ideas,https://www.youtube.com/watch?v=ctUGXLqI3RA,1773804448,बच्चा चोर #maithilidhamalcomedy #decorationideas #funny #comedymove #homedecorideas #sorts,
youtube,home decor ideas,https://www.youtube.com/watch?v=Y4cAEg7_Es4,1773804030,Cute Mini Pot Painting🎨 Easy DIY Aesthetic Home Decor💛✨#minipotpainting #diy#easycraft #aestheticart,"In this video, I created a cute and aesthetic mini pot painting using simple colors and easy design ideas. This DIY craft is ..."
youtube,home decor ideas,https://www.youtube.com/watch?v=pYogAndkJ4U,1773590470,Cozy Vintage Cottage Decor Ideas 2026 🌿💜 Purple Spring Home Styling,"Welcome to our cozy vintage cottage world! ✨ In this video, you'll find the most beautiful purple spring home decor ideas ..."
youtube,small apartment decor,https://www.youtube.com/watch?v=XPDzXb_Kn-Q,1773814364,Dreamy Small Parisian Apartments Decor with Irresistible French Aesthetics,"Step into the enchanting world of dreamy small Parisian apartments, where elegance meets simplicity in the most charming way."
youtube,small apartment decor,https://www.youtube.com/watch?v=vqUNDxaVK6c,1773802984,trending tv unit design ideas,"Transform your living space with stunning TV cabinet design ideas! 🛋️✨ In this video, we dive into the latest trends and creative ..."
youtube,small apartment decor,https://www.youtube.com/watch?v=9s80quX4mnM,1773790204,"✨ Small Apartment, Huge Personality! 🌿 Glamorous Spring 2026 Décor Trends You Need to See",00:00 Welcome to Le Mahurip 02:26 Scent and Atmosphere: The sixth Sense of a Beautiful Home 04:26 Lived-in Luxury: ...
youtube,small apartment decor,https://www.youtube.com/watch?v=lD728lJejSA,1773783009,"Chic Feminine Small Bedroom Ideas for Women Decor, Smart Storage Solutions &amp; Cozy Modern","Chic Feminine Small Bedroom Ideas for Women Decor, Smart Storage Solutions & Cozy Modern Looking for small bedroom ideas ..."
youtube,small apartment decor,https://www.youtube.com/watch?v=fnZCYlxPUVA,1773774040,Beverly Hills Glam Interior in Small Apartments | Valentino Red Design Trend 2026,Valentino Red 2026: Replicating Beverly Hills Glamour in Compact Seoul Apartments explores how bold luxury interior design ...
youtube,small apartment decor,https://www.youtube.com/watch?v=Gd6QSdhM7wc,1773773721,10 SEGREDOS PARA FAZER ESPAÇOS PEQUENOS PARECEREM DE LUXO | SMALL APARTMENT DESIGN,10 SEGREDOS PARA FAZER ESPAÇOS PEQUENOS PARECEREM DE LUXO | SMALL APARTMENT DESIGN Designer de ...
youtube,small apartment decor,https://www.youtube.com/watch?v=7GtdsHzpn2Y,1773770415,Prieto Móveis - Dicas incríveis para Apê pequeno.,Está pensando em transformar seu lar com móveis que duram e encantam? Você sabia que a maioria das empresas de MÓVEIS ...
youtube,small apartment decor,https://www.youtube.com/watch?v=-E-LImCu4Gc,1773766323,"🔥 Tiny Industrial Loft – Small Space, Big Style! 🏡✨","Discover this cozy industrial-style loft featuring warm wooden ceilings, vintage Edison lighting, and a smart mezzanine layout."
youtube,small apartment decor,https://www.youtube.com/watch?v=TkrVuHIJYFo,1773765099,10 Cozy &amp; Elegant Small Apartment Decorating Ideas: Luxury Living Inspiration,Transform your home with cozy and elegant small apartment decorating ideas for luxury living inspiration in 2026. This Mizzu ...
youtube,small apartment decor,https://www.youtube.com/watch?v=L3cgDbvYEaw,1773765085,15+ Renter-Friendly Hacks to Make a Tiny Apartment Feel Bigger in 1 Day,Transform your small space fast with these 15+ renter-friendly hacks to make a tiny apartment feel bigger in just 1 day. If you live in ...
youtube,small apartment decor,https://www.youtube.com/watch?v=CiT44TYXpwg,1773764520,Tiny Studio → Luxury Apartment Transformation 🤯,Tiny Studio → Luxury Apartment Transformation Watch this amazing transformation from a small empty studio into a stunning ...
youtube,small apartment decor,https://www.youtube.com/watch?v=_I8RWYYLOlM,1773764154,Let&#39;s Make This Room&#39;s Floor Into A Blue Ocean! #shorts #transformation #modified #design #roomdecor,Watch this studio apartment transformation from empty concrete floors to a luxurious metallic epoxy masterpiece! See the full ...
youtube,small apartment decor,https://www.youtube.com/watch?v=9QQBe3r-zQM,1773763350,Styling a Small Luxury Home Neutral Decor with Bold Accent Statements,Discover how to style a small luxury home using neutral decor with bold accent statements that instantly elevate your space.
youtube,small apartment decor,https://www.youtube.com/watch?v=3nlT-TAUpYs,1773763162,“cool girl” apartment before and afters🥰 | this small space makeover was EVERYTHING,
youtube,small apartment decor,https://www.youtube.com/watch?v=YFOR98_6JV8,1773763257,Affordable French Chateau Style: Elevating Small Apartment with Paris Vintage Charm,"In this video, we step inside the romantic world of a 215-square-foot Parisian studio to prove that luxury isn't defined by square ..."
youtube,small apartment decor,https://www.youtube.com/watch?v=7Y8LliZKKWE,1773763210,Cozy Parisian Studio Apartment Tour | Elegant Small Apartment Ideas &amp; French Vintage Interior Design,"This video takes viewers on a tour of a cozy Parisian studio apartment that beautifully combines elegance, functionality, and ..."
youtube,small apartment decor,https://www.youtube.com/watch?v=C5p6vm5cRHc,1773763217,9Luxury Loft Transformation in a Small Space | Therenolab #satisfying #interiordesign #shorts,"Watch how a compact space turns into a stunning modern luxury loft with smart design, sleek lighting, and multi-level living."
youtube,small apartment decor,https://www.youtube.com/watch?v=oHHtHWOlOrY,1773761203,"Small Space, Rich Vibes: The Luxury Decor Tricks Designers Don’t Tell You",Transform your small space into a stunning luxury sanctuary with smart interior design tricks the pros rarely share. In “Small Space ...
youtube,small apartment decor,https://www.youtube.com/watch?v=E5g86OQtDjs,1773759624,Какую мебель НЕЛЬЗЯ ставить в маленькой комнате? ОШИБКА 99% ЛЮДЕЙ,Заказать дизайн интерьера: Тел: +79250005565 Почта: info@tbdesign.pro Сайты студий: https://tbdesign.pro ...
youtube,small apartment decor,https://www.youtube.com/watch?v=Fyo2IpP7a9w,1773757809,A Perfect Tiny Parisian Studio | Small Apartment Inspiration,"This video explores the beauty and functionality of a perfect tiny Parisian studio, demonstrating how a small apartment can still ..."
youtube,small apartment decor,https://www.youtube.com/watch?v=OQL3ryGywgU,1773757002,Small Apartment Living in 2026 Just Got Seriously More Luxurious,"Small apartment living in 2026 just got seriously more luxurious, and this video reveals the design secrets behind it. Discover how ..."
youtube,small apartment decor,https://www.youtube.com/watch?v=1bwcALWIx34,1773752400,40 Amazon Space-Saving Furniture for Small Homes &amp; Apartments,40 Space-Saving Furniture on Amazon for Small Homes & Apartments (2026) Looking to maximize your small living space without ...
youtube,small apartment decor,https://www.youtube.com/watch?v=R_CnMsitpr4,1773752400,Parisian Small Apartment Styling Creating Elegant Gallery Walls with Vintage Brass,"In this video, we explore how small Parisian apartments achieve timeless elegance using one simple yet powerful design feature: ..."
youtube,small apartment decor,https://www.youtube.com/watch?v=skDG_GAJTn8,1773750528,Modern Small Bedroom Makeover | AI Room Transformation #homedecor #shorts #interiordesign #roomtour,
youtube,small apartment decor,https://www.youtube.com/watch?v=EM92Hw641ug,1773749917,15&#39;x40&#39; House Plan for Small Family||600Sq.ft||2BHK|| #shorts #shortsfeed #shortvideo #short #2bhk,This is a 2D architectural floor plan designed for a compact residential plot measuring 15' x 40'. The layout is organized linearly to ...
