source,domain,url,created_utc,title,text,query
youtube,,https://www.youtube.com/watch?v=bqvPP7FDupU,1780005605,Furniture Ideas for Small Spaces,"Small spaces can still feel stylish, functional, and comfortable! Smart furniture choices and creative layouts can maximize every ...",small apartment decor
youtube,,https://www.youtube.com/watch?v=uBf_AV88uaU,1780000553,Tiny Triangle Room to Small Apartment #viral #shorts #short #interiordesign #design #aparments #diy,DeepDesignLab #InteriorDesign #HomeMakeover #RoomTransformation #BeforeAndAfter #RenovationJourney #DIYDecor ...,small apartment decor
youtube,,https://www.youtube.com/watch?v=f78jeeS76ZE,1779990624,"Tiny space, luxury vibes ✨🏡 Stunning studio apartment transformation with modern aesthetic #ai#viral",Watch this incredible studio apartment transformation where a compact space turns into a modern luxury setup. ✨ Perfect ...,small apartment decor
youtube,,https://www.youtube.com/watch?v=HUzAtZ7gUDk,1779988819,Smart Bulbs Changed How My Small Room Feels#SmartLighting #SmartBulbs #PhilipsHue,Smart Bulbs Changed How My Small Room Feels #SmartLighting #SmartBulbs #PhilipsHue #GoveeLights #ApartmentLighting ...,small apartment decor
youtube,,https://www.youtube.com/watch?v=Y1eOEWkebNI,1779988515,#smartliving #home #smallspaceliving #amazonfinds #homedecor #cozycorner #diy #cozyhome #modernhome,Small spaces deserve thoughtful design Apartment living doesn't mean compromising on comfort or style. The right furniture ...,small apartment decor
youtube,,https://www.youtube.com/watch?v=x6NmsfTeKo8,1779985907,Small Apartment Interior Design Ideas | Modern Modular Kitchen &amp; Wardrobe Tour,"Looking for smart ways to design a small apartment or flat? ✨ In this video, we take a quick walkthrough of a beautifully finished, ...",small apartment decor
youtube,,https://www.youtube.com/watch?v=tehAmfv4oxU,1779985074,#interiordesign #opulentinteriors #smallapartmentideas #home,,small apartment decor
youtube,,https://www.youtube.com/watch?v=n54lYWp_50I,1779984597,#interiordesign #smallapartmentideas #diningtabledesign #smartfurniture #furniture #home,,small apartment decor
youtube,,https://www.youtube.com/watch?v=dTIbAmN_mWA,1779984397,#smartfurniture #home #furniture #ikea #amazonfinds #homedecor #smallapartment,,small apartment decor
youtube,,https://www.youtube.com/watch?v=egpGaQ2QYCE,1779983317,"TOUR CASA NOVA ,KITNET PEQUENA 20m2 |  DECORAÇÃO ",,small apartment decor
youtube,,https://www.youtube.com/watch?v=N3Cz1h7rBSE,1779983128,I Turned My Tiny Apartment Into a Luxury NYC Penthouse 😳,"I transformed my tiny boring apartment into a luxury NYC penthouse-style space using rental-friendly DIY hacks, IKEA furniture, ...",small apartment decor
youtube,,https://www.youtube.com/watch?v=Rg9EnY_Fw_0,1779982886,Советы для маленькой квартиры #дизайн #интерьер #дизайнинтерьера #ремонт #ремонтквартир #ремонтдома,,small apartment decor
youtube,,https://www.youtube.com/watch?v=GGDZSO6ss2w,1779980058,Дизайн в небольшой квартире | #дизайнинтерьера,"У нас маленькая квартира, тут уже ничего не сделать» — один из самых популярных мифов. На практике всё наоборот.",small apartment decor
youtube,,https://www.youtube.com/watch?v=n42skXJ3p2I,1779979238,Small Apartment Decor Ideas That Actually Work #home #organization #bedroomdecor #cleaning,,small apartment decor
youtube,,https://www.youtube.com/watch?v=lMw2MA4e2po,1779976806,DIY Vintage Crochet Decor | Cozy Cottagecore Farmhouse Vibes for Small Spaces &amp; Tiny Homes,"Ready to turn your small space into a cozy, storybook sanctuary? ✨ In this ultimate DIY home decor guide, we are diving deep ...",small apartment decor
youtube,,https://www.youtube.com/watch?v=PRHq3NneUBU,1779972603,AI Transformed This Tiny Studio Into A Dream Home! ✨#ai design #homeMakeover #ai interior #ai shorts,AI just transformed this tiny studio apartment into something UNBELIEVABLE! This is the future of interior design and nobody is ...,small apartment decor
youtube,,https://www.youtube.com/watch?v=IU2uJdgWre0,1779970820,Tiny Apartment Decorating Ideas for a Cozy &amp; Luxury Look,Transform your tiny apartment into a cozy and luxurious retreat with these inspiring decorating ideas from Decor Pedia!,small apartment decor
youtube,,https://www.youtube.com/watch?v=fNpw4wJZudc,1779970162,Modern House 3D Floor Plan Design Idea 🏠 #smallapartment,,small apartment decor
youtube,,https://www.youtube.com/watch?v=CYW__FDvFtg,1779968084,This Furniture Trick Makes Small Rooms Look Bigger 😮,Bulky furniture can make a small room feel cramped and uncomfortable. Compact multifunction furniture helps create more floor ...,small apartment decor
youtube,,https://www.youtube.com/watch?v=nUiFtaj5GbE,1779965330,We are OBSESSED with this tiny home 👀🏡 #Shorts #TinyHome,,small apartment decor
youtube,,https://www.youtube.com/watch?v=ZoAHlW5EMMs,1779965122,Studio McGee Inspired Summer Decor with Vintage Finds | Cozy Farmhouse Home Styling Ideas,"Step inside a warm and peaceful summer farmhouse inspired by timeless Studio McGee interiors, vintage flea market treasures, ...",small apartment decor
youtube,,https://www.youtube.com/watch?v=N7Hyam4nd5w,1779961532,Small Apartment Animation  Modern Interior  #3d #architecture #lumion #interiordesign   Nuno Silva 1,"Watch this space go from empty to stunning ✨ Every detail was carefully designed to bring out a modern, luxury feel. Would you ...",small apartment decor
youtube,,https://www.youtube.com/watch?v=tQYFhFGy3Ww,1779960100,Tiny Bedroom Makeover Ideas That Save HUGE Space! 🤯,Discover smart small bedroom design ideas that maximize storage and make compact spaces look bigger and more luxurious.,small apartment decor
youtube,,https://www.youtube.com/watch?v=ugTKIYy0DwA,1779958951,Amazing small apartment kitchen designs – the details are all here! #kitchendesign #renovation,,small apartment decor
youtube,,https://www.youtube.com/watch?v=lxLpBjVnXHo,1779952957,Από “παλιό διαμέρισμα” σε μικρό διαμαντάκι ✨🏡,"Από “παλιό διαμέρισμα” σε μικρό διαμαντάκι ✨   Ολική μεταμόρφωση με νέες ηλεκτρολογικές εγκαταστάσεις, φρεσκαρισμένους ...",small apartment decor
