source,domain,url,created_utc,title,text,query
rss,www.yankodesign.com,https://www.yankodesign.com/2025/10/31/this-330-lego-goonies-set-is-pure-halloween-treasure/?utm_source=rss&utm_medium=rss&utm_campaign=this-330-lego-goonies-set-is-pure-halloween-treasure,1761916832,This $330 LEGO Goonies Set Is Pure Halloween Treasure,"This $330 LEGO Goonies Set Is Pure Halloween Treasure

<p class=""rws-nl-img""><a href=""https://www.yankodesign.com/2025/10/31/this-330-lego-goonies-set-is-pure-halloween-treasure/""><img alt="""" class=""attachment-post-thumbnail size-post-thumbnail wp-post-image"" height=""960"" src=""https://www.yankodesign.com/images/design_news/2025/10/this-330-lego-goonies-set-is-pure-halloween-treasure/goonies-01.jpg"" width=""1280"" /></a></p><h2 class=""rws-nl-title"" style=""text-align: center;"">This $330 LEGO Goonies Set Is Pure Halloween Treasure</h2><div class=""rws-nl-excerpt"">If you&#8217;ve ever dreamed about finding pirate treasure in underground caves or sliding down secret passages to escape the bad guys, you&#8217;re about to lose...</div>",
rss,www.yankodesign.com,https://www.yankodesign.com/2025/10/31/7-best-adventure-rigs-of-october-2025-conquering-falls-toughest-trails/?utm_source=rss&utm_medium=rss&utm_campaign=7-best-adventure-rigs-of-october-2025-conquering-falls-toughest-trails,1761910839,7 Best Adventure Rigs Of October 2025 Conquering Fall’s Toughest Trails,"7 Best Adventure Rigs Of October 2025 Conquering Fall’s Toughest Trails

<p class=""rws-nl-img""><a href=""https://www.yankodesign.com/2025/10/31/7-best-adventure-rigs-of-october-2025-conquering-falls-toughest-trails/""><img alt="""" class=""attachment-post-thumbnail size-post-thumbnail wp-post-image"" height=""960"" src=""https://www.yankodesign.com/images/design_news/2025/10/adventure-ready-automotives-for-outdoor-enthusiasts-this-fall/7_best_adventure_automotives_yanko_design_hero.jpg"" width=""1280"" /></a></p><h2 class=""rws-nl-title"" style=""text-align: center;"">7 Best Adventure Rigs Of October 2025 Conquering Fall&#8217;s Toughest Trails</h2><div class=""rws-nl-excerpt"">The call of the wild grows stronger as autumn paints landscapes in brilliant hues, beckoning outdoor enthusiasts to venture beyond familiar territories. This fall presents...</div>",
rss,www.yankodesign.com,https://www.yankodesign.com/2025/10/31/new-film-camera-with-lidar-autofocus-brings-modern-tech-to-35mm/?utm_source=rss&utm_medium=rss&utm_campaign=new-film-camera-with-lidar-autofocus-brings-modern-tech-to-35mm,1761905247,New Film Camera With LiDAR Autofocus Brings Modern Tech to 35mm,"New Film Camera With LiDAR Autofocus Brings Modern Tech to 35mm

<p class=""rws-nl-img""><a href=""https://www.yankodesign.com/2025/10/31/new-film-camera-with-lidar-autofocus-brings-modern-tech-to-35mm/""><img alt="""" class=""attachment-post-thumbnail size-post-thumbnail wp-post-image"" height=""960"" src=""https://www.yankodesign.com/images/design_news/2025/10/new-film-camera-with-lidar-autofocus-brings-modern-tech-to-35mm/analogue-af-1-camera-08.jpg"" width=""1280"" /></a></p><h2 class=""rws-nl-title"" style=""text-align: center;"">New Film Camera With LiDAR Autofocus Brings Modern Tech to 35mm</h2><div class=""rws-nl-excerpt"">Film photography is having a renaissance, but most point-and-shoots on the market are either vintage relics with unpredictable quirks or new models that miss the...</div>",
rss,www.yankodesign.com,https://www.yankodesign.com/2025/10/31/3d-printed-bricks-that-help-baby-trees-survive-climate-change/?utm_source=rss&utm_medium=rss&utm_campaign=3d-printed-bricks-that-help-baby-trees-survive-climate-change,1761900314,3D Printed Bricks That Help Baby Trees Survive Climate Change,"3D Printed Bricks That Help Baby Trees Survive Climate Change

<p class=""rws-nl-img""><a href=""https://www.yankodesign.com/2025/10/31/3d-printed-bricks-that-help-baby-trees-survive-climate-change/""><img alt="""" class=""attachment-post-thumbnail size-post-thumbnail wp-post-image"" height=""960"" src=""https://www.yankodesign.com/images/design_news/2025/10/3d-printed-bricks-that-help-baby-trees-survive-climate-change/treesoil-01.jpg"" width=""1280"" /></a></p><h2 class=""rws-nl-title"" style=""text-align: center;"">3D Printed Bricks That Help Baby Trees Survive Climate Change</h2><div class=""rws-nl-excerpt"">Sometimes the best innovations look backward before they move forward. That&#8217;s exactly what&#8217;s happening with TreeSoil, a project that takes ancient farming wisdom and reimagines...</div>",
rss,www.yankodesign.com,https://www.yankodesign.com/2025/10/30/this-genius-modular-power-strip-lets-you-swap-outlets-usb-ports-and-wireless-pads-like-lego-bricks/?utm_source=rss&utm_medium=rss&utm_campaign=this-genius-modular-power-strip-lets-you-swap-outlets-usb-ports-and-wireless-pads-like-lego-bricks,1761875151,"This Genius Modular Power Strip Lets You Swap Outlets, USB Ports, and Wireless Pads Like LEGO Bricks","This Genius Modular Power Strip Lets You Swap Outlets, USB Ports, and Wireless Pads Like LEGO Bricks

<p class=""rws-nl-img""><a href=""https://www.yankodesign.com/2025/10/30/this-genius-modular-power-strip-lets-you-swap-outlets-usb-ports-and-wireless-pads-like-lego-bricks/""><img alt="""" class=""attachment-post-thumbnail size-post-thumbnail wp-post-image"" height=""960"" src=""https://www.yankodesign.com/images/design_news/2025/10/draft-tobenone/TobenOne_DIY_Modular_Magnetic_Hub_hero.jpg"" width=""1280"" /></a></p><h2 class=""rws-nl-title"" style=""text-align: center;"">This Genius Modular Power Strip Lets You Swap Outlets, USB Ports, and Wireless Pads Like LEGO Bricks</h2><div class=""rws-nl-excerpt"">Every power strip you&#8217;ve ever bought was designed for someone else. Too many USB-A ports when you need USB-C. No wireless charging. Or it has...</div>",
rss,www.yankodesign.com,https://www.yankodesign.com/2025/10/30/12-recalls-in-2-years-the-tesla-cybertruck-is-breaking-records-for-all-the-wrong-reasons/?utm_source=rss&utm_medium=rss&utm_campaign=12-recalls-in-2-years-the-tesla-cybertruck-is-breaking-records-for-all-the-wrong-reasons,1761870643,12 Recalls in 2 Years: The Tesla Cybertruck Is Breaking Records For All The Wrong Reasons,"12 Recalls in 2 Years: The Tesla Cybertruck Is Breaking Records For All The Wrong Reasons

<p class=""rws-nl-img""><a href=""https://www.yankodesign.com/2025/10/30/12-recalls-in-2-years-the-tesla-cybertruck-is-breaking-records-for-all-the-wrong-reasons/""><img alt="""" class=""attachment-post-thumbnail size-post-thumbnail wp-post-image"" height=""960"" src=""https://www.yankodesign.com/images/design_news/2025/10/12-recalls-in-2-years-the-tesla-cybertruck-is-breaking-records-for-all-the-wrong-reasons/cybertruck_recall_2025_1.jpg"" width=""1280"" /></a></p><h2 class=""rws-nl-title"" style=""text-align: center;"">12 Recalls in 2 Years: The Tesla Cybertruck Is Breaking Records For All The Wrong Reasons</h2><div class=""rws-nl-excerpt"">The most I&#8217;ve ever heard of a car being recalled is probably 2014 Jeep Cherokee, or the 2021 Chevy Silverado. Both cars (if I&#8217;m not...</div>",
rss,www.yankodesign.com,https://www.yankodesign.com/2025/10/30/this-1388-foot-tower-is-nycs-first-net-zero-supertall-skyscraper/?utm_source=rss&utm_medium=rss&utm_campaign=this-1388-foot-tower-is-nycs-first-net-zero-supertall-skyscraper,1761867001,"This 1,388-Foot Tower Is NYC’s First Net-Zero Supertall Skyscraper","This 1,388-Foot Tower Is NYC’s First Net-Zero Supertall Skyscraper

<p class=""rws-nl-img""><a href=""https://www.yankodesign.com/2025/10/30/this-1388-foot-tower-is-nycs-first-net-zero-supertall-skyscraper/""><img alt="""" class=""attachment-post-thumbnail size-post-thumbnail wp-post-image"" height=""960"" src=""https://www.yankodesign.com/images/design_news/2025/10/270-park-avenue/270_park_avenue_yanko_design_03.jpg"" width=""1280"" /></a></p><h2 class=""rws-nl-title"" style=""text-align: center;"">This 1,388-Foot Tower Is NYC&#8217;s First Net-Zero Supertall Skyscraper</h2><div class=""rws-nl-excerpt"">As Midtown Manhattan continues to evolve, 270 Park Avenue rises as a new titan of the New York skyline—a 1,388-foot, 60-story headquarters for JPMorgan Chase...</div>",
rss,www.yankodesign.com,https://www.yankodesign.com/2025/10/30/dreamfarms-genius-measuring-cup-squeegees-itself-clean-every-time/?utm_source=rss&utm_medium=rss&utm_campaign=dreamfarms-genius-measuring-cup-squeegees-itself-clean-every-time,1761863456,Dreamfarm’s Genius Measuring Cup Squeegees Itself Clean Every Time,"Dreamfarm’s Genius Measuring Cup Squeegees Itself Clean Every Time

<p class=""rws-nl-img""><a href=""https://www.yankodesign.com/2025/10/30/dreamfarms-genius-measuring-cup-squeegees-itself-clean-every-time/""><img alt="""" class=""attachment-post-thumbnail size-post-thumbnail wp-post-image"" height=""960"" src=""https://www.yankodesign.com/images/design_news/2025/10/this-genius-measuring-cup-squeegees-itself-clean-every-time/upcup-02.jpg"" width=""1280"" /></a></p><h2 class=""rws-nl-title"" style=""text-align: center;"">Dreamfarm&#8217;s Genius Measuring Cup Squeegees Itself Clean Every Time</h2><div class=""rws-nl-excerpt"">You know that moment when you&#8217;re trying to measure out peanut butter and half of it stays stubbornly stuck to the measuring cup? Or when...</div>",
rss,www.yankodesign.com,https://www.yankodesign.com/2025/10/30/toyota-announces-worlds-first-self-driving-ev-for-children/?utm_source=rss&utm_medium=rss&utm_campaign=toyota-announces-worlds-first-self-driving-ev-for-children,1761857101,Toyota Announces World’s First Self-Driving EV For Children,"Toyota Announces World’s First Self-Driving EV For Children

<p class=""rws-nl-img""><a href=""https://www.yankodesign.com/2025/10/30/toyota-announces-worlds-first-self-driving-ev-for-children/""><img alt="""" class=""attachment-post-thumbnail size-post-thumbnail wp-post-image"" height=""960"" src=""https://www.yankodesign.com/images/design_news/2025/10/auto-draft/toyota_mobi_0.jpg"" width=""1280"" /></a></p><h2 class=""rws-nl-title"" style=""text-align: center;"">Toyota Announces World&#8217;s First Self-Driving EV For Children</h2><div class=""rws-nl-excerpt"">Would you trust AI to drive your child across town without you? Toyota is betting some parents will. At the Japan Mobility Show 2025, the...</div>",
rss,www.yankodesign.com,https://www.yankodesign.com/2025/10/30/s4-honcho-is-a-power-packed-electric-bike-for-city-commutes-and-off-road-excursions/?utm_source=rss&utm_medium=rss&utm_campaign=s4-honcho-is-a-power-packed-electric-bike-for-city-commutes-and-off-road-excursions,1761851730,S4 Honcho is a power-packed electric bike for city commutes and off-road excursions,"S4 Honcho is a power-packed electric bike for city commutes and off-road excursions

<p class=""rws-nl-img""><a href=""https://www.yankodesign.com/2025/10/30/s4-honcho-is-a-power-packed-electric-bike-for-city-commutes-and-off-road-excursions/""><img alt="""" class=""attachment-post-thumbnail size-post-thumbnail wp-post-image"" height=""960"" src=""https://www.yankodesign.com/images/design_news/2025/10/s4-honcho-is-a-power-packed-electric-bike-for-city-commutes-and-off-road-excursions/Livewire-S4-Honcho-Electric-Bike-2.jpg"" width=""1280"" /></a></p><h2 class=""rws-nl-title"" style=""text-align: center;"">S4 Honcho is a power-packed electric bike for city commutes and off-road excursions</h2><div class=""rws-nl-excerpt"">LiveWire, the electric-motorcycle arm of Harley‑Davidson, has unveiled its upcoming S4 Honcho mini moto as a striking departure from the usual large-format electric bikes. Designed...</div>",
rss,www.archdaily.com,https://www.archdaily.com/1035525/grand-canal-gateway-bridge-hangzhou-zaha-hadid-architects,1761894000,Grand Canal Gateway Bridge - Hangzhou / Zaha Hadid Architects,"Grand Canal Gateway Bridge - Hangzhou / Zaha Hadid Architects

<p>Construction of the Grand Canal Gateway Bridge in <a href=""https://www.archdaily.com/tag/hangzhou"">Hangzhou</a> is now complete. When opened for public use later this year, <strong>the footbridge will unite the 800,000 square metre Seamless City masterplan under construction on the east and west banks of the Grand Canal.</strong> The centre piece of the city's new 14.7-hectare River Middle public park and river promenade, the bridge and surrounding master plan by Zaha Hadid Architects (ZHA) reconnects the city with its historic Grand Canal and Qiantang River by integrating homes, workplaces and amenities for its community with vital civic spaces for recreation, leisure and tourism.</p>",
rss,www.archdaily.com,https://www.archdaily.com/1035402/material-memory-what-we-lose-when-we-demolish-buildings,1761893100,Material Memory: What We Lose When We Demolish Buildings,"Material Memory: What We Lose When We Demolish Buildings

<p>Concrete, steel, wood, glass. Every year, millions of tons of construction materials are discarded, piled up in landfills, and silenced beneath the weight of the next building. Entire structures disappear to make way for others, restarting a voracious cycle of resource extraction, material production, and replacement. Along with the debris that accumulates, something deeper is also lost: time, human labor, stories, and the collective memory embedded in matter. At a time when climate goals demand reducing emissions and extending the lifespan of what already exists, demolition is increasingly recognized as a form of urban amnesia, one that erases not only cultural continuity but also the embodied energy of buildings. And even though it is often said that the most sustainable building is the one that already exists, that principle rarely survives when other interests come into play.</p>",
rss,www.archdaily.com,https://www.archdaily.com/1035595/the-grand-egyptian-museum-fully-opens-completing-gizas-new-cultural-landmark,1761892200,"The Grand Egyptian Museum Fully Opens, Completing Giza’s New Cultural Landmark","The Grand Egyptian Museum Fully Opens, Completing Giza’s New Cultural Landmark

<p>The Grand <a href=""https://www.archdaily.com/country/egypt/page/1"">Egyptian</a> Museum (GEM) in <a href=""https://www.archdaily.com/tag/cairo/page/1"">Cairo</a> <a href=""https://sis.gov.eg/en/media-center/events/the-opening-ceremony-of-the-grand-egyptian-museum/?utm_medium=website&amp;utm_source=archdaily.com"" target=""_blank"">will open to the public on November 1</a>, 2025, completing a project that has been in development for more than two decades. Designed by <a href=""https://www.archdaily.com/office/heneghan-peng-architects"">Heneghan Peng Architects</a>, the museum is located on the <a href=""https://www.archdaily.com/tag/giza"">Giza Plateau</a>, approximately two kilometers from the <a href=""https://www.archdaily.com/tag/pyramids"">Pyramids of Giza</a>, and occupies a 500,000-square-meter site positioned between the edge of <a href=""https://www.archdaily.com/tag/cairo/page/1"">Cairo</a> and the <a href=""https://www.archdaily.com/tag/desert"">desert</a>. Conceived as a new cultural and <a href=""https://www.archdaily.com/tag/research-center"">research center</a>, the <a href=""https://www.archdaily.com/tag/museum/page/1"">museum</a> aims to present the legacy of ancient Egyptian civilization within a <a href=""https://www.archdaily.com/tag/contemporary-architecture"">contemporary architectural</a> framework.</p>",
rss,www.archdaily.com,https://www.archdaily.com/1035438/house-koritno-arhitekti-pocivasek-petranovic,1761890400,House Koritno / Arhitekti Počivašek Petranovič,"House Koritno / Arhitekti Počivašek Petranovič

<p>The settlement of <strong>Koritno</strong> lies on the edge of the fluvial–glacial terrace of the Sava Dolinka riverbed, southeast of Bled. To the north, the site offers a striking backdrop of the Alps / Karavanke, while to the south there are views into greenery and good sunlight exposure.</p>",
rss,www.archdaily.com,https://www.archdaily.com/1035581/mvrdv-advances-urban-densification-with-the-sax-residential-towers-in-rotterdam,1761888600,MVRDV Advances Urban Densification with The Sax Residential Towers in Rotterdam,"MVRDV Advances Urban Densification with The Sax Residential Towers in Rotterdam

<p><a href=""https://www.archdaily.com/city/rotterdam"" rel=""noopener"" target=""_blank"">The City of Rotterdam</a>, developers BPD and Synchroon, and architecture firm <a href=""https://www.archdaily.com/office/mvrdv"" rel=""noopener"" target=""_blank"">MVRDV </a>have officially begun construction on The Sax, a major <a href=""https://www.archdaily.com/search/projects/categories/residential-architecture"" rel=""noopener"" target=""_blank"">residential project</a> located on Rotterdam's Wilhelminapier. Designed to contribute to the city's ongoing <a href=""https://www.archdaily.com/tag/densification"" rel=""noopener"" target=""_blank"">densification </a>efforts, the development will deliver 916 apartments within two interconnected towers. Once completed, The Sax will make Wilhelminapier the most densely populated area in <a href=""https://www.archdaily.com/country/the-netherlands"" rel=""noopener"" target=""_blank"">the Netherlands</a>, making the project an example of compact urban growth. The design comprises two towers, combining a wide mix of housing types and shared amenities with strong connections to public transport and sustainable <a href=""https://www.archdaily.com/tag/urban-mobility"" rel=""noopener"" target=""_blank"">mobility solutions</a>, including parking for 1,800 bicycles and a fully automated car garage. With its silver façade and undulating balconies, the building's form echoes the shape of a saxophone, reflecting the character of <a href=""https://www.archdaily.com/city/rotterdam"" rel=""noopener"" target=""_blank"">Rotterdam</a>. </p>",
rss,www.archdaily.com,https://www.archdaily.com/1035416/piracaia-eco-village-arquipelago-arquitetos,1761879600,Piracaia Eco-Village / Arquipélago Arquitetos,"Piracaia Eco-Village / Arquipélago Arquitetos

<p>Proposal for a modular construction system of residences made of rammed earth and wood, with premises to be reproducible and accommodating three different sizes: 50, 100, and 125m2.</p>",
rss,www.archdaily.com,https://www.archdaily.com/1035454/da-osaka-branch-tokyo-reiichi-ikeda-design,1761876000,DA OSAKA Branch Tokyo / Reiichi Ikeda Design,"DA OSAKA Branch Tokyo / Reiichi Ikeda Design

<p>DA-OSAKA, headquartered in Osaka, is a company specializing in interior construction for commercial premises. This project is for their <a href=""https://www.archdaily.com/tag/tokyo"">Tokyo</a> branch office. Located in Jinbou-cho, Chiyoda, Tokyo, where well known as ""Town of Books"" because of densely packed bookstores and vintage bookshops, and maDA-OSAKA, headquartered in Osaka, is a company specializing in interior construction for commercial premises. This project is for their Tokyo branch office.</p>",
rss,www.archdaily.com,https://www.archdaily.com/1035556/barn-inside-unknown-design,1761868800,Barn Inside / Unknown design,"Barn Inside / Unknown design

<p>This space no longer pursues the neatness and newness of the surface, but accepts the traces of time. The bareness, coarseness, and even a slight ""dilapidation"" are no longer regarded as defects, but become the most powerful expression of texture. It presents a kind of ""unfinished"" state, which is not repairing or decorating, but restoring the materials to their original form and letting them tell their own stories quietly.</p>",
rss,www.archdaily.com,https://www.archdaily.com/1035567/lib-earth-house-model-b-lib-work-c-ltd-plus-arup-plus-ogawaa-design-studio-plus-studio-qtn,1761850800,"Lib Earth House model B / Lib Work Co., Ltd.  + Arup + ogawaa design studio + Studio QTN","Lib Earth House model B / Lib Work Co., Ltd.  + Arup + ogawaa design studio + Studio QTN

<p>The Lib Earth House Project aims to develop future housing models that embody principles of environmental sustainability and habitability. By utilizing construction-scale 3D printing technology, the project explores how buildings can be built exclusively from locally sourced, biodegradable materials, fostering long-term, harmonious habitation on Earth. The recently completed ""Lib Earth House model b"" is the second prototype realized under this initiative. This single-story experimental residence spans approximately 100 sqm and is constructed using 3D-printed earthen walls.</p>",
rss,www.archdaily.com,https://www.archdaily.com/1035485/retreat-in-nocaima-obreval,1761836400,Retreat in Nocaima / Obreval,"Retreat in Nocaima / Obreval

<p>Located among the lush, rolling hills of <a href=""https://www.archdaily.com/tag/nocaima"">Nocaima</a>, Colombia, this small dwelling offers <strong>a contemporary, thoughtful, and sensitive reinterpretation of traditional rural architecture</strong>. The project revisits vernacular elements such as bamboo, sloping roofs, and open corridors, transforming them into intentional architectural resources that, while honoring their cultural, material, and environmental origins, also question them and establish new relationships with the landscape and climate.</p>",
rss,www.archdaily.com,https://www.archdaily.com/1035159/day-job-office-22re,1761825600,Day Job Office / 22RE,"Day Job Office / 22RE

<p>In their latest office conversion, Los Angeles-based design and architecture studio 22RE introduces a vibrant, residentially inspired workplace for LA creative agency Day Job. The 1,800-square-foot building in Glassell Park - formerly the studio of artist Ed Ruscha - sets the tone with an austere monolithic exterior clad in locally sourced Douglas fir and stucco.</p>",
rss,www.archdaily.com,https://www.archdaily.com/1035524/hofbode-ii-semi-detached-house-marge-architecten,1761818400,Hofbode II Semi-Detached House / Marge architecten,"Hofbode II Semi-Detached House / Marge architecten

<p>The renovation and extension of a semi-detached house that aligns daily life with the rhythm of the sun. The historical postcard reads Villa Les Roses. Almost a novel by Willem Elsschot. </p>",
rss,www.archdaily.com,https://www.archdaily.com/1035558/seven-finalist-designs-revealed-for-the-museum-of-jesus-baptism-in-jordan,1761811200,Seven Finalist Designs Revealed for the Museum of Jesus’ Baptism in Jordan,"Seven Finalist Designs Revealed for the Museum of Jesus’ Baptism in Jordan

<p>The Foundation for the Development of the Lands Adjacent to the Baptism Site has unveiled seven shortlisted <a href=""https://www.archdaily.com/tag/concept"">concept</a> designs for <a href=""https://www.archdaily.com/1033120/seven-international-design-teams-shortlisted-for-museum-of-jesus-baptism-in-jordan?ad_source=search&amp;ad_medium=projects_tab&amp;ad_source=search&amp;ad_medium=search_result_all"">the new Museum of Jesus' Baptism</a> at Bethany, <a href=""https://www.archdaily.com/country/jordan/page/1"">Jordan</a>. The proposals, now available in an <a href=""https://competitions.malcolmreading.com/bethany/gallery?utm_medium=website&amp;utm_source=archdaily.com"" target=""_blank"">online gallery</a>, were developed by internationally recognized <a href=""https://www.archdaily.com/tag/multidisciplinary"">multidisciplinary</a> teams led by <a href=""https://www.archdaily.com/office/aau-anastas?ad_source=search&amp;ad_medium=search_result_professionals"">AAU Anastas</a>, <a href=""https://www.archdaily.com/office/heneghan-peng-architects?ad_name=project-specs&amp;ad_medium=single"">heneghan peng architects</a>, <a href=""https://www.archdaily.com/office/niall-mclaughlin-architects?ad_source=search&amp;ad_medium=search_result_professionals"">Níall McLaughlin Architects</a>,<a href=""https://www.archdaily.com/office/studio-anne-holtrop?ad_source=search&amp;ad_medium=search_result_professionals""> Studio Anne Holtrop</a>, <a href=""https://www.archdaily.com/office/tatiana-bilbao-estudio?ad_source=search&amp;ad_medium=search_result_professionals"">Tatiana Bilbao ESTUDIO</a>, <a href=""https://www.archdaily.com/office/toshiko-mori?ad_source=search&amp;ad_medium=search_result_professionals"">Toshiko Mori Architect</a>, and <a href=""https://www.archdaily.com/office/trahan-architects?ad_source=search&amp;ad_medium=search_result_professionals"">Trahan Architects</a>. Managed by <a href=""https://www.archdaily.com/tag/malcolm-reading-consultants/page/1"">Malcolm Reading Consultants</a>, the invited competition seeks an architect-led multidisciplinary team to design a <a href=""https://www.archdaily.com/tag/museum/page/1"">museum</a> and <a href=""https://www.archdaily.com/tag/garden"">garden</a> that responds to the sacred character of the site. The project is planned to open in 2030, marking the bimillennial of Christ's baptism, and aims to create a space of reflection, learning, and cultural exchange.</p>",
rss,www.archdaily.com,https://www.archdaily.com/1035029/architecture-of-wine-15-contemporary-wineries-around-the-world,1761809400,Architecture of Wine: 15 Contemporary Wineries Around the World,"Architecture of Wine: 15 Contemporary Wineries Around the World

<p>Wine production has long been tied to place, climate, and culture, and in recent decades, architecture has become a central part of this relationship. <a href=""https://www.archdaily.com/category/winery"">Wineries</a> are no longer understood only as functional facilities for fermentation, storage, and distribution, but also as spaces where landscape, materiality, and visitor experience intersect. From subterranean cellars hidden beneath fields to sculptural landmarks rising in rural territories, these buildings shape the identity of winemaking regions while offering visitors a carefully choreographed encounter with the process of production.</p>",
