source,domain,url,created_utc,title,text,query
rss,www.yankodesign.com,https://www.yankodesign.com/2026/03/10/asus-rogs-first-open-ear-earbuds-hear-the-game-and-the-room/?utm_source=rss&utm_medium=rss&utm_campaign=asus-rogs-first-open-ear-earbuds-hear-the-game-and-the-room,1773137274,ASUS ROG’s First Open-Ear Earbuds: Hear the Game and the Room,"ASUS ROG’s First Open-Ear Earbuds: Hear the Game and the Room

<p class=""rws-nl-img""><a href=""https://www.yankodesign.com/2026/03/10/asus-rogs-first-open-ear-earbuds-hear-the-game-and-the-room/""><img alt="""" class=""attachment-post-thumbnail size-post-thumbnail wp-post-image"" height=""960"" src=""https://www.yankodesign.com/images/design_news/2026/03/asus-rogs-first-open-ear-earbuds-hear-the-game-and-the-room/O701_Photo_00002.jpg"" width=""1280"" /></a></p><h2 class=""rws-nl-title"" style=""text-align: center;"">ASUS ROG&#8217;s First Open-Ear Earbuds: Hear the Game and the Room</h2><div class=""rws-nl-excerpt"">Gaming earbuds have long operated on an unspoken assumption: that total audio immersion requires cutting yourself off from the world around you. Sealed tips, passive...</div>",
rss,www.yankodesign.com,https://www.yankodesign.com/2026/03/10/carriers-want-this-blackberry-style-phone-i-tried-it-at-mwc/?utm_source=rss&utm_medium=rss&utm_campaign=carriers-want-this-blackberry-style-phone-i-tried-it-at-mwc,1773132320,Carriers Want This BlackBerry-Style Phone – I Tried It at MWC,"Carriers Want This BlackBerry-Style Phone – I Tried It at MWC

<p class=""rws-nl-img""><a href=""https://www.yankodesign.com/2026/03/10/carriers-want-this-blackberry-style-phone-i-tried-it-at-mwc/""><img alt="""" class=""attachment-post-thumbnail size-post-thumbnail wp-post-image"" height=""960"" src=""https://www.yankodesign.com/images/design_news/2026/03/carriers-want-this-blackberry-style-phone-i-tried-it-at-mwc/clicks-communicator-02.jpg"" width=""1280"" /></a></p><h2 class=""rws-nl-title"" style=""text-align: center;"">Carriers Want This BlackBerry-Style Phone &#8211; I Tried It at MWC</h2><div class=""rws-nl-excerpt"">When Clicks unveiled the Clicks Communicator at CES 2026, the device immediately stood out in a sea of look-alike smartphones. It pairs a physical QWERTY...</div>",
rss,www.yankodesign.com,https://www.yankodesign.com/2026/03/09/this-37-5-clip-on-edc-flashlight-does-something-a-200-olight-still-cannot-measure-distances/?utm_source=rss&utm_medium=rss&utm_campaign=this-37-5-clip-on-edc-flashlight-does-something-a-200-olight-still-cannot-measure-distances,1773107159,This $37.5 Clip-On EDC Flashlight Does Something a $200 Olight Still Cannot… Measure Distances,"This $37.5 Clip-On EDC Flashlight Does Something a $200 Olight Still Cannot… Measure Distances

<p class=""rws-nl-img""><a href=""https://www.yankodesign.com/2026/03/09/this-37-5-clip-on-edc-flashlight-does-something-a-200-olight-still-cannot-measure-distances/""><img alt="""" class=""attachment-post-thumbnail size-post-thumbnail wp-post-image"" height=""960"" src=""https://www.yankodesign.com/images/design_news/2026/02/this-35-clip-on-edc-flashlight-does-something-a-200-olight-still-cannot-measure-distances/TorchEye_X1_o7.jpg"" width=""1280"" /></a></p><h2 class=""rws-nl-title"" style=""text-align: center;"">This $37.5 Clip-On EDC Flashlight Does Something a $200 Olight Still Cannot&#8230; Measure Distances</h2><div class=""rws-nl-excerpt"">The humble flashlight is older than you probably think. The first handheld electric torch was patented in 1899, and for the better part of 127...</div>",
rss,www.yankodesign.com,https://www.yankodesign.com/2026/03/09/google-pixel-11-pro-fold-leaks-early-with-a-familiar-design-and-one-noticeable-change/?utm_source=rss&utm_medium=rss&utm_campaign=google-pixel-11-pro-fold-leaks-early-with-a-familiar-design-and-one-noticeable-change,1773102606,Google Pixel 11 Pro Fold Leaks Early With a Familiar Design and One Noticeable Change,"Google Pixel 11 Pro Fold Leaks Early With a Familiar Design and One Noticeable Change

<p class=""rws-nl-img""><a href=""https://www.yankodesign.com/2026/03/09/google-pixel-11-pro-fold-leaks-early-with-a-familiar-design-and-one-noticeable-change/""><img alt="""" class=""attachment-post-thumbnail size-post-thumbnail wp-post-image"" height=""959"" src=""https://www.yankodesign.com/images/design_news/2026/03/draft-pixel-fold/pixel_11_pro_fold_1.jpeg"" width=""1280"" /></a></p><h2 class=""rws-nl-title"" style=""text-align: center;"">Google Pixel 11 Pro Fold Leaks Early With a Familiar Design and One Noticeable Change</h2><div class=""rws-nl-excerpt"">The Google Pixel 11 Pro Fold is shaping up to be exactly the phone you already know, made marginally better in the ways that are...</div>",
rss,www.yankodesign.com,https://www.yankodesign.com/2026/03/09/a-cluster-of-volcanic-cabins-rises-from-inner-mongolias-fragile-steppe/?utm_source=rss&utm_medium=rss&utm_campaign=a-cluster-of-volcanic-cabins-rises-from-inner-mongolias-fragile-steppe,1773099002,A Cluster of Volcanic Cabins Rises From Inner Mongolia’s Fragile Steppe,"A Cluster of Volcanic Cabins Rises From Inner Mongolia’s Fragile Steppe

<p class=""rws-nl-img""><a href=""https://www.yankodesign.com/2026/03/09/a-cluster-of-volcanic-cabins-rises-from-inner-mongolias-fragile-steppe/""><img alt="""" class=""attachment-post-thumbnail size-post-thumbnail wp-post-image"" height=""960"" src=""https://www.yankodesign.com/images/design_news/2026/03/volcano-in-hotel-of-arrivals/volcano_hotel_yanko_design_01.jpg"" width=""1280"" /></a></p><h2 class=""rws-nl-title"" style=""text-align: center;"">A Cluster of Volcanic Cabins Rises From Inner Mongolia&#8217;s Fragile Steppe</h2><div class=""rws-nl-excerpt"">Somewhere in the vast Baiyinkulun Steppe of Inner Mongolia, where dormant volcanoes have shaped the earth for millennia, a new hotel settles quietly into the...</div>",
rss,www.yankodesign.com,https://www.yankodesign.com/2026/03/09/the-knit-chair-that-rewrites-comfort-by-subtracting-instead-of-adding/?utm_source=rss&utm_medium=rss&utm_campaign=the-knit-chair-that-rewrites-comfort-by-subtracting-instead-of-adding,1773095430,The Knit Chair That Rewrites Comfort by Subtracting Instead of Adding,"The Knit Chair That Rewrites Comfort by Subtracting Instead of Adding

<p class=""rws-nl-img""><a href=""https://www.yankodesign.com/2026/03/09/the-knit-chair-that-rewrites-comfort-by-subtracting-instead-of-adding/""><img alt="""" class=""attachment-post-thumbnail size-post-thumbnail wp-post-image"" height=""960"" src=""https://www.yankodesign.com/images/design_news/2026/02/the-knit-chair-that-rewrites-comfort-by-subtracting-instead-of-adding/KnitOne_chair_furniture_01.jpg"" width=""1280"" /></a></p><h2 class=""rws-nl-title"" style=""text-align: center;"">The Knit Chair That Rewrites Comfort by Subtracting Instead of Adding</h2><div class=""rws-nl-excerpt"">For decades, furniture design has followed an unspoken rule. Comfort equals more. More foam, more padding, more layers, more material. The Knit One Chair by...</div>",
rss,www.yankodesign.com,https://www.yankodesign.com/2026/03/09/this-ergonomic-mouse-tracks-your-heart-rate-telling-you-to-take-a-break-before-you-experience-burnout/?utm_source=rss&utm_medium=rss&utm_campaign=this-ergonomic-mouse-tracks-your-heart-rate-telling-you-to-take-a-break-before-you-experience-burnout,1773089120,"This Ergonomic Mouse Tracks Your Heart Rate, Telling You To Take A Break Before You Experience Burnout","This Ergonomic Mouse Tracks Your Heart Rate, Telling You To Take A Break Before You Experience Burnout

<p class=""rws-nl-img""><a href=""https://www.yankodesign.com/2026/03/09/this-ergonomic-mouse-tracks-your-heart-rate-telling-you-to-take-a-break-before-you-experience-burnout/""><img alt="""" class=""attachment-post-thumbnail size-post-thumbnail wp-post-image"" height=""959"" src=""https://www.yankodesign.com/images/design_news/2026/03/auto-draft/calmix_mouse_1.jpeg"" width=""1280"" /></a></p><h2 class=""rws-nl-title"" style=""text-align: center;"">This Ergonomic Mouse Tracks Your Heart Rate, Telling You To Take A Break Before You Experience Burnout</h2><div class=""rws-nl-excerpt"">Imagine if your mouse was also your stress ball. Okay, not exactly, but while a stress ball helps you calm your nerves after a rather...</div>",
rss,www.yankodesign.com,https://www.yankodesign.com/2026/03/09/this-ring-like-wearable-speaker-has-integrated-magnetic-earbuds-for-on-demand-personal-audio/?utm_source=rss&utm_medium=rss&utm_campaign=this-ring-like-wearable-speaker-has-integrated-magnetic-earbuds-for-on-demand-personal-audio,1773083737,This ring-like wearable speaker has integrated magnetic earbuds for on-demand personal audio,"This ring-like wearable speaker has integrated magnetic earbuds for on-demand personal audio

<p class=""rws-nl-img""><a href=""https://www.yankodesign.com/2026/03/09/this-ring-like-wearable-speaker-has-integrated-magnetic-earbuds-for-on-demand-personal-audio/""><img alt="""" class=""attachment-post-thumbnail size-post-thumbnail wp-post-image"" height=""960"" src=""https://www.yankodesign.com/images/design_news/2026/03/this-ring-like-wearable-speaker-packs-magnetic-earbuds-for-on-demand-personal-audio/Wearable-Speaker-Earbuds-2.jpg"" width=""1280"" /></a></p><h2 class=""rws-nl-title"" style=""text-align: center;"">This ring-like wearable speaker has integrated magnetic earbuds for on-demand personal audio</h2><div class=""rws-nl-excerpt"">Audio is a primordial requisite for experiencing the world, and even since the invention of speakers and consequently headphones and earbuds, the magical experience has...</div>",
rss,www.yankodesign.com,https://www.yankodesign.com/2026/03/09/your-1200-phone-looks-boring-next-to-these-5-concepts/?utm_source=rss&utm_medium=rss&utm_campaign=your-1200-phone-looks-boring-next-to-these-5-concepts,1773076839,"Your $1,200 Phone Looks Boring Next to These 5 Concepts","Your $1,200 Phone Looks Boring Next to These 5 Concepts

<p class=""rws-nl-img""><a href=""https://www.yankodesign.com/2026/03/09/your-1200-phone-looks-boring-next-to-these-5-concepts/""><img alt="""" class=""attachment-post-thumbnail size-post-thumbnail wp-post-image"" height=""960"" src=""https://www.yankodesign.com/images/design_news/2026/03/your-1200-phone-looks-boring-next-to-these-5-concepts/honor-robot-phone-11.jpg"" width=""1280"" /></a></p><h2 class=""rws-nl-title"" style=""text-align: center;"">Your $1,200 Phone Looks Boring Next to These 5 Concepts</h2><div class=""rws-nl-excerpt"">Look at the phones announced this year, like those revealed at MWC 2026 last week, and you will notice something. They are all faster, thinner,...</div>",
rss,www.yankodesign.com,https://www.yankodesign.com/2026/03/09/first-look-of-new-oneplus-15t-revealed-hints-two-new-colors-and-high-end-features/?utm_source=rss&utm_medium=rss&utm_campaign=first-look-of-new-oneplus-15t-revealed-hints-two-new-colors-and-high-end-features,1773069650,"First look of new OnePlus 15T revealed, hints two new colors and high-end features","First look of new OnePlus 15T revealed, hints two new colors and high-end features

<p class=""rws-nl-img""><a href=""https://www.yankodesign.com/2026/03/09/first-look-of-new-oneplus-15t-revealed-hints-two-new-colors-and-high-end-features/""><img alt="""" class=""attachment-post-thumbnail size-post-thumbnail wp-post-image"" height=""960"" src=""https://www.yankodesign.com/images/design_news/2026/03/first-look-of-new-oneplus-15t-revealed-hints-two-new-colors-and-high-end-features/OnePlus-15T-phone-1.jpg"" width=""1280"" /></a></p><h2 class=""rws-nl-title"" style=""text-align: center;"">First look of new OnePlus 15T revealed, hints two new colors and high-end features</h2><div class=""rws-nl-excerpt"">OnePlus has recently redefined what it means to “never settle” with its OnePlus 13 and 13T smartphones. Now, the company is back in the spotlight...</div>",
rss,www.archdaily.com,https://www.archdaily.com/1039470/cultural-heritage-sites-in-the-middle-east-damaged-as-war-reaches-historic-urban-areas,1773120600,Cultural Heritage Sites in the Middle East Damaged as War Strikes Historic Urban Areas,"Cultural Heritage Sites in the Middle East Damaged as War Strikes Historic Urban Areas

<p>On February 28th, 2026,<a href=""https://www.en-hrana.org/the-first-day-of-the-u-s-israel-and-iran-war-initial-report-on-the-scope-of-attacks-and-their-human-consequences/?utm_medium=website&amp;utm_source=archdaily.com"" rel=""noopener"" target=""_blank""> the news of the loss of human lives</a>, the operational pattern of military strikes, damage to infrastructure, communication disruptions, and international responses following US-Israeli military attacks on <a href=""https://www.archdaily.com/tag/iran"">Iran</a> <a href=""https://www.theguardian.com/world/us-israel-war-on-iran?utm_medium=website&amp;utm_source=archdaily.com"" rel=""noopener"" target=""_blank"">confirmed to the world that there was a new focus of war in the Middle East</a>. This military conflict has also had a human and infrastructural impact on <a href=""https://www.archdaily.com/tag/lebanon"">Lebanon</a>, Syria, Iraq, and Jordan, with active combat zones in their territories, and the Gulf States, where damage particularly affected US military bases and energy infrastructure. This adds a new site of armed conflict globally, joining the fifth year of the Russia-Ukraine war, the civil wars in Sudan and Myanmar, persistent conflict in Mali, Burkina Faso, and the Democratic Republic of the Congo, violent armed conflict in Haiti, and the forced overthrow of the former Venezuelan president. All these territories are currently involved in the deliberate destruction of their normality, including essential, everyday, <a href=""https://www.lemonde.fr/en/culture/article/2026/03/07/cultural-heritage-under-threat-from-middle-east-war_6751201_30.html?M_BT=193539955101321&amp;lmd_campaign=trf_newsletters_lmie&amp;lmd_creation=lemonde_in_english_NY&amp;lmd_link=editorspicks-title&amp;lmd_medium=email&amp;lmd_send_date=20260309130000&amp;utm_medium=website&amp;utm_source=archdaily.com"" rel=""noopener"" target=""_blank"">and cultural infrastructure of global value</a>. Although information is currently scattered and partial, it is possible to assess some of the damage to cultural heritage caused by this new outbreak of armed conflict.</p>",
rss,www.archdaily.com,https://www.archdaily.com/1038979/open-call-for-projects-collaborator-program-participant-at-archdaily,1773117000,Open Call for Projects Collaborator Program Participant at ArchDaily,"Open Call for Projects Collaborator Program Participant at ArchDaily

<p>ArchDaily is looking for a proactive and curious architect to be part of our Projects Collaborator Program. As a part-time program participant, you will be working with the team in charge of curating and coordinating all <a href=""https://www.archdaily.com/search/projects?ad_source=jv-header&amp;ad_name=main-menu"">built project </a>publications on ArchDaily. </p>",
rss,www.archdaily.com,https://www.archdaily.com/1039434/6-unbuilt-retreats-exploring-hospitality-through-landscape-and-refuge,1773115200,6 Unbuilt Retreats Exploring Hospitality Through Landscape and Refuge,"6 Unbuilt Retreats Exploring Hospitality Through Landscape and Refuge

<p>Spaces of retreat continue to offer fertile ground for unbuilt exploration, revealing how architecture can support rest, reflection, and immersion in nature amid shifting environmental and cultural conditions. In this <a href=""https://www.archdaily.com/tag/unbuilt-architecture"">Unbuilt</a> edition, <a href=""https://www.archdaily.com/contact"">submitted by the ArchDaily community, </a>the selected projects assemble a diverse range of proposals that reconsider hospitality through the lens of refuge. These works position accommodation not as spectacle or excess, but as spatial frameworks shaped by landscape, climate, material restraint, and shared experience.</p>",
rss,www.archdaily.com,https://www.archdaily.com/1039370/clairiere-school-tracks,1773111600,Clairière School / TRACKS,"Clairière School / TRACKS

<p>A preserved space near a residential neighborhood, its contours shaped over the years by the passage of water that gradually carved out these sunken lanes. To access the site, one crosses the wooded edge and discovers the meadow: a protected landscape with trees as its horizon. All the classrooms benefit from an unobstructed view of the generous playgrounds, with this wooded edge as a backdrop. It is this clearing, this inner landscape, conducive to the establishment of a school, that we wanted to capture: a world apart, both a protected space and a place of learning, experimentation, and discovery.</p>",
rss,www.archdaily.com,https://www.archdaily.com/1039416/aurva-illam-house-iki-builds,1773108000,Aurva Illam House / Iki Builds,"Aurva Illam House / Iki Builds

<p>Set against the expanding urban edge of Hyderabad, Aurva Illam, a name bridging the Sanskrit Aurva (of the earth) and the Tamil Illam (home), is a residential prototype conceived as a ""cascading earth"" that unapologetically redefines modern luxury for the Anthropocene. Rejecting the ubiquitous glass-and-marble paradigm, the home proposes a new status symbol: bespoke materiality, thermal autonomy, and zero-air-conditioning living.</p>",
rss,www.archdaily.com,https://www.archdaily.com/1039383/floating-pavilion-studio-re-plus-n,1773100800,Floating Pavilion / Studio RE+N,"Floating Pavilion / Studio RE+N

<p>Tea terraces cascade toward the horizon, threaded with drifting mist  —  the Floating Pavilion sits at the summit of a terraced tea mountain in Songyang County, Zhejiang Province, China, some five hundred meters above sea level. A slender white form hovers above the fields on minimal supports, as if a thin wing had just been lifted by the wind. ""Floating"" describes both a structural condition  —  a thin roof suspended above the ground  —  and a quality of time in this place, where mist drifts, light shifts, and one pauses briefly on the mountain, as in a fleeting moment of respite.</p>",
rss,www.archdaily.com,https://www.archdaily.com/1039424/self-sustaining-farmhouse-manoj-patel-design-studio,1773082800,Self-Sustaining Farmhouse / Manoj Patel Design Studio,"Self-Sustaining Farmhouse / Manoj Patel Design Studio

<p>Between the city's chaos and rural calm, this sustainable retreat invites one to relax from the hectic schedules of daily routine into the natural habitat. The site is situated on the outskirts of Vadodara city, having a site area of 30,000 sqft with 1,500 sqft area built up. Surrounded by lush green open plots, the site context is an opportunity where architecture responds sensitively to nature through a material palette and spatial openness. Sustainability forms the core philosophy for the design, where the material palette plays an important role. Evolving from ecological sensibilities, the ground beams were formed within the cavities of brick walls and RCC slurry poured to bind and strengthen—transforming construction logic into an expressive architectural language of efficiency and craft.</p>",
rss,www.archdaily.com,https://www.archdaily.com/1039325/tamanas-house-atelie-amanha,1773068400,Tamanás House / Ateliê Amanhã,"Tamanás House / Ateliê Amanhã

<p>The relationship with the existing landscape and the uneven topography were the main determinants in the design of Casa Taman&aacute;s. Situated on a sloped lot with several existing fruit trees, the fundamental strategy of the project consisted of operating through precise cuts in the built volume. More than simple openings, these interventions function as frames that enhance the view of the landscape, framing scenes that vary between the tree canopies and the gardens at ground level, establishing a visual continuity that integrates the architecture with its immediate surroundings.</p>",
rss,www.archdaily.com,https://www.archdaily.com/1039010/la-manufacture-cultural-center-mars-architectes,1773057600,La Manufacture Cultural Center / MARS Architectes,"La Manufacture Cultural Center / MARS Architectes

<p>The creation of this cultural center stems from the need for a functional facility capable of bringing together services currently scattered throughout the town in order to better serve local residents. Located in a historic bastide now identified as an area facing social and economic challenges, the project represents a first step in the renewal of Villefranche-de-Rouergue's town center. It is conceived as an inclusive place, particularly attentive to disadvantaged populations, dedicated to sharing, education, and cultural life.</p>",
rss,www.archdaily.com,https://www.archdaily.com/1039365/nancy-social-housing-abc-studio,1773050400,Nancy Social Housing / ABC Studio,"Nancy Social Housing / ABC Studio

<p>In <a href=""https://www.archdaily.com/tag/maxeville"">Maxéville</a>, next door to the eastern French city of Nancy, ABC delivers <strong>20 social housing units for seniors</strong> on the Haut-du-Lièvre plateau, known for Zehrfuss's once-longest-in-Europe housing block and its panoramic tower, now entering its final winter as Lorraine's tallest.</p>",
rss,www.archdaily.com,https://www.archdaily.com/1039197/architectural-ingredient-15-brazilian-restaurants-where-design-meets-gastronomy,1773041400,Architectural Ingredient: 15 Brazilian Restaurants Where Design Meets Gastronomy,"Architectural Ingredient: 15 Brazilian Restaurants Where Design Meets Gastronomy

<p>The relationship between <a href=""https://www.archdaily.com/985887/celebrating-culinary-arts-architecture-and-the-experience-of-restaurants-and-cafes"" rel=""noopener"" target=""_blank"">architecture and gastronomy</a> goes beyond the simple function of providing a place to eat. It is a <a href=""https://www.archdaily.com/976101/culinary-architecture-16-projects-that-explore-different-kitchen-layouts"" rel=""noopener"" target=""_blank"">sensory symbiosis</a> in which <a href=""https://www.archdaily.com/1004878/color-in-hospitality-design-20-restaurant-interiors-that-set-the-right-tone"" rel=""noopener"" target=""_blank"">the environment prepares the palate</a> as much as seasoning does. The visual composition of a dish can be understood through principles such as volume, balance, contrast, and rhythm — concepts that are equally fundamental to architectural design. In the same way, a <a href=""https://www.archdaily.com/tag/gastronomy"" rel=""noopener"" target=""_blank"">restaurant’s architecture</a> — its colors, lighting, and material choices — acts as <a href=""https://www.archdaily.com/902412/bars-and-restaurants-50-examples-in-plan-and-section"" rel=""noopener"" target=""_blank"">an invisible ingredient</a>, capable of elevating the <a href=""https://www.archdaily.com/875529/beyond-food-10-exquisite-restaurant-interiors"" rel=""noopener"" target=""_blank"">dining experience</a> and shaping the perception of flavor even before the first bite. Both disciplines are dynamic, <a href=""https://www.archdaily.com.br/br/1012075/neurogastronomia-aplicada-a-arquitetura-em-prol-do-envelhecimento-humano"" rel=""noopener"" target=""_blank"">directly reflecting social behaviors and cultural trends</a> that influence how we occupy space and how we nourish ourselves.</p>",
rss,www.archdaily.com,https://www.archdaily.com/1039306/xichang-jianchuan-film-museum-complex-documentary-film-museum-tanghua-architects-and-associates,1773039600,Xichang Jianchuan Film Museum Complex - Documentary Film Museum / Tanghua Architects & Associates,"Xichang Jianchuan Film Museum Complex - Documentary Film Museum / Tanghua Architects & Associates

<p>Xichang Jianchuan Film Museum is located in the center of Xichang High-speed Railway New Town Area in the Anning River Valley of Xichang City, with the overall layout of ""17 Museum + 5 areas"", divided into ""Public Welfare Museum Project"" and ""Xichang Jianchuan Film Museum Project"" are two major parts. The total planning site of the project is about 1200 mu, with a total construction area of 265,000 square meters and a total investment of about 7 billion. The project is planned and designed by the expert team led by Fan Jianchuan, the director of Jianchuan Museum.</p>",
rss,www.archdaily.com,https://www.archdaily.com/1039447/women-in-architecture-progress-gaps-and-the-work-still-ahead,1773037800,"Women in Architecture: Progress, Gaps, and the Work Still Ahead","Women in Architecture: Progress, Gaps, and the Work Still Ahead

<p>Each year, <a href=""https://www.archdaily.com/tag/archdaily-international-days"" rel=""noopener"" target=""_blank"">International Women's Day</a> brings renewed attention to questions of <a href=""https://www.archdaily.com/tag/gender"" rel=""noopener"" target=""_blank"">gender</a> within many professional fields, <a href=""https://www.archdaily.com/tag/women-in-architecture"" rel=""noopener"" target=""_blank"">architecture among them</a>. Public conversations often center on celebrating prominent figures or highlighting notable projects, moments that briefly illuminate the contributions of women within the discipline. Yet the visibility produced by these occasions sits within a longer and more complex trajectory. Over the past several decades, the architectural profession has undergone gradual shifts that have expanded opportunities and broadened participation, even as longstanding structures continue to shape how careers develop and how architectural work becomes visible.</p>",
