source,domain,url,created_utc,title,text,query
rss,www.yankodesign.com,https://www.yankodesign.com/2026/05/07/lego-icons-road-bike-is-an-intricate-1015-piece-buildable-set-for-grown-ups/?utm_source=rss&utm_medium=rss&utm_campaign=lego-icons-road-bike-is-an-intricate-1015-piece-buildable-set-for-grown-ups,1778167207,"LEGO Icons Road Bike is an intricate 1,015-piece buildable set for grown-ups","LEGO Icons Road Bike is an intricate 1,015-piece buildable set for grown-ups

<p class=""rws-nl-img""><a href=""https://www.yankodesign.com/2026/05/07/lego-icons-road-bike-is-an-intricate-1015-piece-buildable-set-for-grown-ups/""><img alt=""Red LEGO road bicycle mounted on a trainer stand indoors, with a gray water bottle on the frame and keys on the table nearby."" class=""attachment-post-thumbnail size-post-thumbnail wp-post-image"" height=""960"" src=""https://www.yankodesign.com/images/design_news/2026/05/lego-icons-road-bike-is-an-intricate-1015-piece-buildable-set-for-grown-ups/LEGO-Icons-Road-Bike-Set-14.jpg"" width=""1280"" /></a></p><h2 class=""rws-nl-title"" style=""text-align: center;"">LEGO Icons Road Bike is an intricate 1,015-piece buildable set for grown-ups</h2><div class=""rws-nl-excerpt"">There’s something about the intricately scaled-down models of vehicles that takes me back to the nostalgic times. The memory of the miniature bicycle model that...</div>",
rss,www.yankodesign.com,https://www.yankodesign.com/2026/05/07/googles-99-gemini-speaker-is-about-to-land/?utm_source=rss&utm_medium=rss&utm_campaign=googles-99-gemini-speaker-is-about-to-land,1778163615,Google’s $99 Gemini Speaker Is About to Land,"Google’s $99 Gemini Speaker Is About to Land

<p class=""rws-nl-img""><a href=""https://www.yankodesign.com/2026/05/07/googles-99-gemini-speaker-is-about-to-land/""><img alt=""Four round, fabric-covered smart speakers in white, red, mint green, and gray on a white surface."" class=""attachment-post-thumbnail size-post-thumbnail wp-post-image"" height=""960"" src=""https://www.yankodesign.com/images/design_news/2026/05/googles-99-speaker-is-the-smart-homes-long-overdue-restart/google-home-01.jpg"" width=""1280"" /></a></p><h2 class=""rws-nl-title"" style=""text-align: center;"">Google&#8217;s $99 Gemini Speaker Is About to Land</h2><div class=""rws-nl-excerpt"">The smart speaker category has been quietly stagnating. Go ahead and look around your house. Chances are there&#8217;s a Nest Audio or an Amazon Echo...</div>",
rss,www.yankodesign.com,https://www.yankodesign.com/2026/05/07/remarkable-just-made-a-399-writing-tablet-that-wont-distract-you/?utm_source=rss&utm_medium=rss&utm_campaign=remarkable-just-made-a-399-writing-tablet-that-wont-distract-you,1778160050,reMarkable Just Made a $399 Writing Tablet That Won’t Distract You,"reMarkable Just Made a $399 Writing Tablet That Won’t Distract You

<p class=""rws-nl-img""><a href=""https://www.yankodesign.com/2026/05/07/remarkable-just-made-a-399-writing-tablet-that-wont-distract-you/""><img alt=""Green reMarkable notebook with open white page and a black stylus, floating against a blue sky."" class=""attachment-post-thumbnail size-post-thumbnail wp-post-image"" height=""960"" src=""https://www.yankodesign.com/images/design_news/2026/05/remarkable-just-made-a-399-writing-tablet-that-wont-distract-you/remarkable-paper-pure-01.jpg"" width=""1280"" /></a></p><h2 class=""rws-nl-title"" style=""text-align: center;"">reMarkable Just Made a $399 Writing Tablet That Won&#8217;t Distract You</h2><div class=""rws-nl-excerpt"">There&#8217;s a particular kind of frustration that comes with trying to take notes on a device that also wants to tell you about emails, calendar...</div>",
rss,www.yankodesign.com,https://www.yankodesign.com/2026/05/07/8-memorial-day-weekend-gadgets-for-the-man-whod-rather-be-outside/?utm_source=rss&utm_medium=rss&utm_campaign=8-memorial-day-weekend-gadgets-for-the-man-whod-rather-be-outside,1778154049,8 Memorial Day Weekend Gadgets for the Man Who’d Rather Be Outside,"8 Memorial Day Weekend Gadgets for the Man Who’d Rather Be Outside

<p class=""rws-nl-img""><a href=""https://www.yankodesign.com/2026/05/07/8-memorial-day-weekend-gadgets-for-the-man-whod-rather-be-outside/""><img alt=""Hand gripping a metallic pendant necklace with a glowing green vertical light inside a small rectangular case against a dark background and chain visible above."" class=""attachment-post-thumbnail size-post-thumbnail wp-post-image"" height=""960"" src=""https://www.yankodesign.com/images/design_news/2026/04/memorial-day-weekend-gadgets-for-the-man-whod-rather-be-outside/8_best_memorial_weekend_men_yanko_design_hero.jpg"" width=""1280"" /></a></p><h2 class=""rws-nl-title"" style=""text-align: center;"">8 Memorial Day Weekend Gadgets for the Man Who&#8217;d Rather Be Outside</h2><div class=""rws-nl-excerpt"">The campsite is not a compromise. For a certain kind of person, the space between the trees gets the same deliberate attention as a living...</div>",
rss,www.yankodesign.com,https://www.yankodesign.com/2026/05/07/huawei-watch-fit-5-pro-review-more-than-its-slim-design-suggests/?utm_source=rss&utm_medium=rss&utm_campaign=huawei-watch-fit-5-pro-review-more-than-its-slim-design-suggests,1778142624,Huawei Watch Fit 5 Pro Review: More Than Its Slim Design Suggests,"Huawei Watch Fit 5 Pro Review: More Than Its Slim Design Suggests

<p class=""rws-nl-img""><a href=""https://www.yankodesign.com/2026/05/07/huawei-watch-fit-5-pro-review-more-than-its-slim-design-suggests/""><img alt=""Smartwatch with orange band on the wrist, showing a Starry Night–inspired face and the time 13:46."" class=""attachment-post-thumbnail size-post-thumbnail wp-post-image"" height=""961"" src=""https://www.yankodesign.com/images/design_news/2026/05/huawei-watch-fit-5-pro-review-more-than-its-slim-design-suggests/huawei-watch-fit-5-pro-review-12.jpg"" width=""1280"" /></a></p><h2 class=""rws-nl-title"" style=""text-align: center;"">Huawei Watch Fit 5 Pro Review: More Than Its Slim Design Suggests</h2><div class=""rws-nl-excerpt"">Huawei has launched the Watch Fit 5 series, continuing the evolution of a product line that now feels far more ambitious than its name might...</div>",
rss,www.yankodesign.com,https://www.yankodesign.com/2026/05/06/dead-battery-by-noon-this-45w-pocket-charger-fixes-that-for-good/?utm_source=rss&utm_medium=rss&utm_campaign=dead-battery-by-noon-this-45w-pocket-charger-fixes-that-for-good,1778118329,Dead Battery by Noon? This 45W Pocket Charger Fixes That for Good,"Dead Battery by Noon? This 45W Pocket Charger Fixes That for Good

<p class=""rws-nl-img""><a href=""https://www.yankodesign.com/2026/05/06/dead-battery-by-noon-this-45w-pocket-charger-fixes-that-for-good/""><img alt=""White portable charger with a metallic top showing 100% on its display, placed on a magazine with a white strap nearby."" class=""attachment-post-thumbnail size-post-thumbnail wp-post-image"" height=""960"" src=""https://www.yankodesign.com/images/design_news/2026/04/dead-battery-by-noon-this-45w-pocket-charger-fixes-that-for-good/INIU_Pocket_Rocket_P50_charger_hero.jpg"" width=""1280"" /></a></p><h2 class=""rws-nl-title"" style=""text-align: center;"">Dead Battery by Noon? This 45W Pocket Charger Fixes That for Good</h2><div class=""rws-nl-excerpt"">Battery anxiety has become a familiar part of modern daily life. Smartphones, wireless earbuds, tablets, and handheld gaming devices all run down faster than most...</div>",
rss,www.yankodesign.com,https://www.yankodesign.com/2026/05/06/this-is-the-tiny-house-the-short-term-rental-market-has-been-waiting-for/?utm_source=rss&utm_medium=rss&utm_campaign=this-is-the-tiny-house-the-short-term-rental-market-has-been-waiting-for,1778113807,This Is the Tiny House the Short-Term Rental Market Has Been Waiting For,"This Is the Tiny House the Short-Term Rental Market Has Been Waiting For

<p class=""rws-nl-img""><a href=""https://www.yankodesign.com/2026/05/06/this-is-the-tiny-house-the-short-term-rental-market-has-been-waiting-for/""><img alt=""Tiny house on wheels with white siding and a wooden upper level, behind a black metal fence."" class=""attachment-post-thumbnail size-post-thumbnail wp-post-image"" height=""960"" src=""https://www.yankodesign.com/images/design_news/2026/05/rasa-tiny-house/rasa_yanko_design_01.jpg"" width=""1280"" /></a></p><h2 class=""rws-nl-title"" style=""text-align: center;"">This Is the Tiny House the Short-Term Rental Market Has Been Waiting For</h2><div class=""rws-nl-excerpt"">I truly love a well-designed tiny home — one that doesn&#8217;t just compress living into a smaller footprint but genuinely rethinks how space can work...</div>",
rss,www.yankodesign.com,https://www.yankodesign.com/2026/05/06/5-indoor-garden-designs-that-make-small-apartments-feel-like-jungles/?utm_source=rss&utm_medium=rss&utm_campaign=5-indoor-garden-designs-that-make-small-apartments-feel-like-jungles,1778110227,5 Indoor Garden Designs That Make Small Apartments Feel Like Jungles,"5 Indoor Garden Designs That Make Small Apartments Feel Like Jungles

<p class=""rws-nl-img""><a href=""https://www.yankodesign.com/2026/05/06/5-indoor-garden-designs-that-make-small-apartments-feel-like-jungles/""><img alt=""Glass fishbowl in a wooden cutout tray, containing aquatic plants and small fish, with leafy greens and a pointing hand nearby."" class=""attachment-post-thumbnail size-post-thumbnail wp-post-image"" height=""960"" src=""https://www.yankodesign.com/images/design_news/2026/05/623694/Indoor-Gardens_Hydrophonics_7-1.jpg"" width=""1280"" /></a></p><h2 class=""rws-nl-title"" style=""text-align: center;"">5 Indoor Garden Designs That Make Small Apartments Feel Like Jungles</h2><div class=""rws-nl-excerpt"">Living in a compact home does not mean giving up on greenery. The “plant parent” mindset has evolved beyond simple pots on a sill, growing...</div>",
rss,www.yankodesign.com,https://www.yankodesign.com/2026/05/06/the-artemis-ii-earthset-photo-is-now-a-lego-set-and-it-looks-incredible/?utm_source=rss&utm_medium=rss&utm_campaign=the-artemis-ii-earthset-photo-is-now-a-lego-set-and-it-looks-incredible,1778106606,The Artemis II ‘Earthset’ Photo Is Now a LEGO Set and It Looks Incredible,"The Artemis II ‘Earthset’ Photo Is Now a LEGO Set and It Looks Incredible

<p class=""rws-nl-img""><a href=""https://www.yankodesign.com/2026/05/06/the-artemis-ii-earthset-photo-is-now-a-lego-set-and-it-looks-incredible/""><img alt=""LEGO mosaic of a spacecraft over a rocky desert, titled Earthset Artemis II, with four astronauts minifigures at bottom left and a satellite on the left edge"" class=""attachment-post-thumbnail size-post-thumbnail wp-post-image"" height=""960"" src=""https://www.yankodesign.com/images/design_news/2026/05/auto-draft/lego_ideas_earthset_1.jpeg"" width=""1280"" /></a></p><h2 class=""rws-nl-title"" style=""text-align: center;"">The Artemis II &#8216;Earthset&#8217; Photo Is Now a LEGO Set and It Looks Incredible</h2><div class=""rws-nl-excerpt"">On Christmas Eve 1968, astronaut Bill Anders looked out of Apollo 8&#8217;s window and saw something no human had ever seen before: Earth, whole and...</div>",
rss,www.yankodesign.com,https://www.yankodesign.com/2026/05/06/this-30000-tiny-home-puts-the-bed-on-the-ground-floor-and-the-price-below-every-competitor/?utm_source=rss&utm_medium=rss&utm_campaign=this-30000-tiny-home-puts-the-bed-on-the-ground-floor-and-the-price-below-every-competitor,1778103016,"This $30,000 Tiny Home Puts the Bed on the Ground Floor and the Price Below Every Competitor","This $30,000 Tiny Home Puts the Bed on the Ground Floor and the Price Below Every Competitor

<p class=""rws-nl-img""><a href=""https://www.yankodesign.com/2026/05/06/this-30000-tiny-home-puts-the-bed-on-the-ground-floor-and-the-price-below-every-competitor/""><img alt=""Blue-gray tiny house on a dual-axle trailer with a wooden upper facade, white-framed window, and a wooden staircase leading to a glass-panel front door."" class=""attachment-post-thumbnail size-post-thumbnail wp-post-image"" height=""960"" src=""https://www.yankodesign.com/images/design_news/2026/05/shanti/shanti_yanko_design_01.jpg"" width=""1280"" /></a></p><h2 class=""rws-nl-title"" style=""text-align: center;"">This $30,000 Tiny Home Puts the Bed on the Ground Floor and the Price Below Every Competitor</h2><div class=""rws-nl-excerpt"">At just $30,000, the Shanti by Simplify Further Tiny Homes might be the most honest tiny home on the market right now. No gimmicks, no...</div>",
rss,www.archdaily.com,https://www.archdaily.com/1041153/building-with-the-landscape-non-invasive-design-strategies-for-steep-terrain,1778139000,Building with the Landscape: Non-Invasive Design Strategies for Steep Terrain,"Building with the Landscape: Non-Invasive Design Strategies for Steep Terrain

<p>The relationship between <a href=""https://www.archdaily.com/1039147/light-from-above-measuring-and-designing-daylight-under-sloped-roofs?ad_source=search&amp;ad_medium=search_result_articles"" rel=""noopener"" target=""_blank"">constraint and design excellence is well established in architectural theory, yet often remains underexplored</a> in discussions of site-specific practices. When architects encounter extreme topography, they face a fundamental choice: <a href=""https://www.archdaily.com/1040381/7-unbuilt-houses-shaped-by-site-climate-and-constraints?ad_source=search&amp;ad_medium=search_result_articles"" rel=""noopener"" target=""_blank"">transform the landscape to accommodate the building, or modify the building to fit the landscape</a>. The first approach is straightforward and requires the builder to cut, fill, terrace, and build on level ground. This choice, however, carries cascading consequences as any amount of earth moved may destabilize slopes, disrupt drainage, and fracture ecosystems. A growing body of <a href=""https://www.archdaily.com/1039635/adaptive-cabins-in-costa-rica-designing-for-humidity-and-ventilation-in-the-jungle?ad_source=search&amp;ad_medium=search_result_articles"" rel=""noopener"" target=""_blank"">innovative architectural work demonstrates an alternative to earth-moving and retaining walls.</a></p>",
rss,www.archdaily.com,https://www.archdaily.com/1040982/main-pavilion-of-the-international-horticultural-exhibition-2024-chengdu-cswadi,1778137200,Main Pavilion of the  International Horticultural Exhibition 2024 Chengdu / CSWADI,"Main Pavilion of the  International Horticultural Exhibition 2024 Chengdu / CSWADI

<p>Located in the <a href=""https://www.archdaily.com/tag/chengdu"">Chengdu</a> Eastern New Area, the 23,000-square-meter Main Pavilion is the exposition's core building, programmed to host the closing ceremony, international flower competitions, and forums. Following the event, it will transition into a civic cultural center. The design deeply respects the natural context, seamlessly integrating modern public architecture with Sichuan's natural and humanistic environments.</p>",
rss,www.archdaily.com,https://www.archdaily.com/1040984/buildner-launches-unbuilt-2026-and-reveals-unbuilt-2025-winners,1778136300,Buildner Launches Unbuilt 2026 and Reveals Unbuilt 2025 Winners,"Buildner Launches Unbuilt 2026 and Reveals Unbuilt 2025 Winners

<p><a href=""https://architecturecompetitions.com/?utm_medium=website&amp;utm_source=archdaily.com"" target=""_blank""><strong>Buildner</strong></a><strong> </strong>has launched <a href=""https://architecturecompetitions.com/unbuilt2026/archd?utm_medium=website&amp;utm_source=archdaily.com"" target=""_blank""><strong>Buildner's Unbuilt Award 2026</strong></a>, the third edition of its annual competition, offering a 100,000 EUR prize fund.</p>",
rss,www.archdaily.com,https://www.archdaily.com/1041285/oma-shohei-shigematsu-completes-first-public-project-in-japan-at-newly-renovated-edo-tokyo-museum,1778135400,OMA / Shohei Shigematsu Completes First Public Project in Japan at Newly Renovated Edo-Tokyo Museum,"OMA / Shohei Shigematsu Completes First Public Project in Japan at Newly Renovated Edo-Tokyo Museum

<p>The Edo-Tokyo Museum has reopened to the public following a multi-year <a href=""https://www.archdaily.com/tag/renovation"">renovation</a>, unveiling a series of <a href=""https://www.archdaily.com/tag/scenography"">scenographic</a> interventions and <a href=""https://www.archdaily.com/tag/installations"">installations</a> designed by <a href=""https://www.archdaily.com/tag/oma"">OMA</a> under the direction of <a href=""https://www.archdaily.com/tag/shohei-shigematsu/page/1"">Shohei Shigematsu</a>. Marking the firm's first public project in <a href=""https://www.archdaily.com/country/japan/page/1"">Japan</a>, the commission forms part of the broader renewal of the<a href=""https://www.archdaily.com/tag/museum/page/1""> museum</a>'s iconic building by <a href=""https://www.archdaily.com/tag/metabolism/page/1"">Metabolist architect</a> <a href=""https://www.archdaily.com/tag/kiyonori-kikutake/page/1"">Kiyonori Kikutake</a>. Originally opened in 1993 as the first museum dedicated to the history of <a href=""https://www.archdaily.com/tag/tokyo/page/1"">Tokyo</a>, the institution traces the city's evolution from the Edo period to the present day, and the new interventions aim to strengthen its relationship with contemporary audiences while preserving the identity of <a href=""https://www.archdaily.com/tag/kiyonori-kikutake/page/1"">Kikutake</a>'s architecture.</p>",
rss,www.archdaily.com,https://www.archdaily.com/1041225/casa-continua-studiotamat,1778133600,Casa Continua / STUDIOTAMAT,"Casa Continua / STUDIOTAMAT

<p>In Rome's Flaminio district, STUDIOTAMAT unveils Casa Continua, a 115 sqm apartment entirely reimagined through a project that engages with the home's layered history while opening it to new ways of living.</p>",
rss,www.archdaily.com,https://www.archdaily.com/1041264/a-cultural-center-in-the-arctic-and-a-new-look-at-croatian-modernism-this-weeks-review,1778131800,A Cultural Center in the Arctic and a New Look at Croatian Modernism: This Week’s Review,"A Cultural Center in the Arctic and a New Look at Croatian Modernism: This Week’s Review

<p>This week's selection of architecture news and projects invites a rethinking of the social, cultural, and environmental role of design across diverse scales and geographies. From community-led efforts to preserve modern heritage, such as the campaigns surrounding the <a href=""https://www.archdaily.com/1041096/saint-denis-brutalist-ilot-8-housing-complex-by-renee-gailhoustet-faces-controversial-redevelopment-plan"" rel=""noopener"" target=""_blank"">Îlot 8 housing complex in France</a> and a renewed photographic attention toward <a href=""https://piotr-bednarski.com/Aftermath-Split-3?utm_medium=website&amp;utm_source=archdaily.com"" rel=""noopener"" target=""_blank"">Croatia's Split 3 district</a>, to broader reflections on architecture's agency in the face of climate change and social transformation, many of the featured works question how architecture adapts over time and how it engages with collective life. This week's compilation also highlights architects expanding their practice beyond buildings <a href=""https://www.archdaily.com/1041143/from-lighting-to-modular-systems-archdailys-selection-of-13-architect-designed-objects-at-milan-design-week-2026"" rel=""noopener"" target=""_blank"">through furniture, lighting, and object design</a>, while three projects explore immersive relationships between landscape, climate, and observation in remote or environmentally sensitive contexts, from Arctic Norway to the oasis environments of the United Arab Emirates and the desert landscapes of Saudi Arabia.</p>",
rss,www.archdaily.com,https://www.archdaily.com/1041232/after-corbusier-how-southeast-asia-turned-the-satellite-city-into-a-transit-megaproject,1778126400,After Corbusier: How Southeast Asia Turned the Satellite City Into a Transit Megaproject,"After Corbusier: How Southeast Asia Turned the Satellite City Into a Transit Megaproject

<p>Southeast Asia is often narrated as a kind of architectural <a href=""https://www.archdaily.com/1032761/playscapes-and-public-imagination-the-ambiguous-play-in-urban-life-of-hong-kong"">playground</a>—an arena where modern and contemporary ideals have been tested at full scale through singular, iconic buildings. One can trace an easy lineage through names that have helped shape the region's <a href=""https://www.archdaily.com/1034779/frankfurt-architecture-city-guide-20-projects-tracing-a-skyline-between-history-and-modernity?ad_source=search&amp;ad_medium=search_result_articles"">skyline imagination</a>: Paul Rudolph's Lippo Centre in Hong Kong and The Concourse in Singapore, I.M. Pei's OCBC Centre and Hong Kong's <a href=""https://www.archdaily.com/153297/ad-classics-bank-of-china-tower-i-m-pei?ad_source=search&amp;ad_medium=projects_tab"">Bank of China Tower</a>, Norman Foster's Supreme Court of Singapore and the <a href=""https://www.archdaily.com/152495/ad-classics-hong-kong-and-shanghai-bank-foster-partners"">HSBC Main Building</a> in Hong Kong, Ron Phillips' Hong Kong City Hall, Moshe Safdie's Marina Bay Sands. Yet this familiar history—told through objects, colonialism, authorship, and signature forms—risks missing a deeper, more consequential layer of influence: the planning logics and infrastructural frameworks that have quietly structured how these cities expand, densify, and distribute everyday life.</p>",
rss,www.archdaily.com,https://www.archdaily.com/1041193/kerr-ssdh,1778122800,Kerr Apartment / SSdH,"Kerr Apartment / SSdH

<p>When the Fitzroy landmark, The MacRobertson's Chocolate Factory (built ~1900's), was converted between 1998 and 2003, it became an early and local example of the industrial apartment building typology. Rather than delivering a series of homogenous, standardised units, the redevelopment divided the amalgamation of warehouse spaces into a series of apartment 'shells' surrounding a voluminous central atrium. The 'shells' were sold to owners with the most minimal amenities, no more than a connection point for plumbing, fire services, and power, with the understanding that occupants would be responsible for their own internal fit-out.</p>",
rss,www.archdaily.com,https://www.archdaily.com/1041180/harudot-khaoyai-idin-architects,1778119200,Harudot Khaoyai Cafe / IDIN Architects,"Harudot Khaoyai Cafe / IDIN Architects

<p>Harudot Khao Yai is located on a sloping site descending from the main road toward a large water basin, opening to a panoramic view of the Khao Yai landscape. The architect recognized the site's potential not only as a café destination, but also as a public viewpoint—one that could be accessed independently by passersby without entering the café itself.</p>",
rss,www.archdaily.com,https://www.archdaily.com/1041077/designing-for-time-material-aging-as-a-design-strategy,1778117400,Designing for Time: Material Aging as a Design Strategy,"Designing for Time: Material Aging as a Design Strategy

<p>The figure of Tithonus in Greek mythology offers a reflection on the paradox of permanence. In pleading with Zeus for immortality, he forgot to request eternal youth, resulting in a life of endless aging. Over time, his body deteriorates, turning immortality itself into a burden. The narrative suggests a fundamental contradiction: permanence, when detached from the capacity for change, ceases to be a desirable quality. Instead of stability, it produces accumulated decay without adaptation.</p>",
rss,www.archdaily.com,https://www.archdaily.com/1041224/qingdao-science-technology-museum-von-gerkan-marg-and-partners-architects,1778112000,Qingdao Science Technology Museum / gmp Architects,"Qingdao Science Technology Museum / gmp Architects

<p>With the <a href=""https://www.archdaily.com/tag/qingdao"">Qingdao</a> Science &amp; Technology Museum on Hong Island, the architects von Gerkan, Marg and Partners (gmp) have created a cultural facility that provides important momentum for the urban development of Qingdao. As one of China's leading centers for marine research, the city is home to a large share of the country's national research institutions, which form the thematic context of the museum.</p>",
rss,www.archdaily.com,https://www.archdaily.com/1041156/srila-house-wright-inspires,1778094000,Srila House / Wright Inspires,"Srila House / Wright Inspires

<p>Srila was envisioned as a seamless extension of a deep appreciation for art, tradition, and cultural living. Rooted in nostalgia yet shaped by curiosity, the brief emerged from the clients' emotional connection to traditional homes of Tamil Nadu—spaces remembered for their warmth, breathability, and effortless relationship with light, shade, and everyday rituals. At the same time, they sought to move away from the rigidity of typical concrete houses, aspiring instead for a home that feels softer, calmer, and deeply connected to nature.</p>",
rss,www.archdaily.com,https://www.archdaily.com/1032018/muyunafest-2025-main-floating-stage-espacio-comun,1778079600,Muyunafest 2025 Main Floating Stage  / Espacio Común,"Muyunafest 2025 Main Floating Stage  / Espacio Común

<p>During the rising of the Itaya River in May 2025, Espacio Común, in collaboration with residents of Belén in <a href=""https://www.archdaily.com/tag/iquitos"">Iquitos</a>, built a floating stage for Muyuna Fest, a film festival that defends the world’s forests by giving voice—through cinema—to Amazonian communities. Located in front of Estrellita de Jesús school, the intervention responded to the amphibious logic of the territory and to local cultural practices, offering a temporary yet powerful infrastructure for public life.</p>",
