source,query,domain,url,created_utc,title,text
gnews,runway trend,news.google.com,https://news.google.com/rss/articles/CBMifEFVX3lxTE51TGNCN1E1TW92VThxVm81Z1RkbllVZVkwdHgyRXBtY2R5UmNIcF8wOHh3UGl2SUh3RGdNVkdSdGVmRE1uZEJOYTlXa0dVZVFBWVdteHpFbXk0TzM2c2laWWZaVmpyWC03bXgweDJMQjlKdVNaaGVLUTZFYnI?oc=5,1760079600,These Are the 6 Biggest Trends to Know From Paris Fashion Week - Who What Wear,These Are the 6 Biggest Trends to Know From Paris Fashion Week - Who What Wear
gnews,runway trend,news.google.com,https://news.google.com/rss/articles/CBMifkFVX3lxTE01a0lMNUxtUXJnX1NKRk9UNE5uWERoZHFkVmlvS2R5d0dBb0VlM25takFCaXpiVFVHWk15enZqbGgtQlRnaXUzcUZrYjJQTEVTX0pWNHMzSkpqdEp6allDU0hLcnZaQWlTelNOZ3BsUEstajJDTjRoZDJOaW83UQ?oc=5,1759215600,How to Wear 5 Trends From the Most Recent Fashion Shows - The Cut,How to Wear 5 Trends From the Most Recent Fashion Shows - The Cut
gnews,runway trend,news.google.com,https://news.google.com/rss/articles/CBMiX0FVX3lxTE5NdTNacTFZOXNvZmJmbGhLQVRUampoYVJsVmVQamQ2Zk5nTnVtZE96WmdBVlhPeW05QXQxanJLV0VsWlVZdGQ0eUY0RlE5aFR2VEcxZk1nODNBbEJnMDg4?oc=5,1760338800,"Horse Girls, Rejoice: Equestrian Fashion is This Fall’s Defining Aesthetic - The Everygirl","Horse Girls, Rejoice: Equestrian Fashion is This Fall’s Defining Aesthetic - The Everygirl"
gnews,runway trend,news.google.com,https://news.google.com/rss/articles/CBMifkFVX3lxTE52dTVmdHJ6Nzc4QXpnY2RDUUVWQ2Z2ZGtYYm9sVmV3ZktCOVFUbFphZWZNc2phNC1CeEtDcDd2Qi1XZjU2a0ZxQ0JVNFNjMWJEcWEzMzdZeXVuTDhhNGxKb0dPZEw2ZkNkNE1VUXZpVG03a24tZklxcjM3bE03UQ?oc=5,1759820400,The Best Fall Fashion Trends to Shop Right Now - Harper's BAZAAR,The Best Fall Fashion Trends to Shop Right Now - Harper's BAZAAR
gnews,runway trend,news.google.com,https://news.google.com/rss/articles/CBMi3AFBVV95cUxOMUxwZ2oyREpBcGtFcWNydTQ1d0UtZE5rMnRQZjh6ODY1MHV6NG1kbFhVVmx4aV9TcURVMklIdmh6VUxkeWExdmJDVWlGN1V5eWVpR0xZbnRCOUZRR1JUUDVYYUhSblozbHFYMHRZcVJpUVlOR0pjWlNOWGU4ZDk2bkJ2V2Q1MmoweVJpNGxtdFQ5WG5wZUpFN3lpcm80WjlxNnJackdWemxzNUhKOGdwa1ZpMlRqM005WGhmRlFTTFk1VU5nMnBBQ2xNX0syal9JUHRyRG02N21hS3dj?oc=5,1760511600,"The Spring 2026 Accessory Trend Report: 175 Bags, Statement Belts, and Nouveau Flip-Flops That You’ll Want Next Season - Vogue","The Spring 2026 Accessory Trend Report: 175 Bags, Statement Belts, and Nouveau Flip-Flops That You’ll Want Next Season - Vogue"
gnews,runway trend,news.google.com,https://news.google.com/rss/articles/CBMimgFBVV95cUxQVXBtSHN6VGp5eEF5QUFwZzlLSEZzbGRuZ1ZlbHNRaThtRUZhanFfc252WXpnZTU1UkdISjNOaGhWQ0E5ZXhaUU5pcEhsX1JQUWU1Z2x0eW9hRzVtaWVqMm1POUJSUnFUYUxuQlpEcl9MbGtoSEtlTzc3SVVPeUlTVnpOV2VORDR4OU5Xd1pBQjI5ZnJKT1BiMUZR?oc=5,1759906800,Parisian It Girls Have Spoken: These Are the Street-Style Trends to Know for Fall - Marie Claire,Parisian It Girls Have Spoken: These Are the Street-Style Trends to Know for Fall - Marie Claire
gnews,runway trend,news.google.com,https://news.google.com/rss/articles/CBMihAFBVV95cUxQdGtLczgzN1NNZFlkNzEydDJWcWllMWZoS0ltQ2x5LVFhSlJHZ2ZYU1ZLUzIwRG5HUURJblJCRWNPUmFlMzV1emZtMjYxZmRBcjQzTmxkZWp5ZGltdlQ1c0lPbzlWN2d0M04xTnlreWM3VkUyYm1YaUI2U0lnOUd1WmM2a28?oc=5,1759820400,The Unexpected Handbag Trend Taking Over Fall Fashion - ELLE,The Unexpected Handbag Trend Taking Over Fall Fashion - ELLE
gnews,runway trend,news.google.com,https://news.google.com/rss/articles/CBMirAFBVV95cUxPcXI3WmdENm9iOF9rckNQWmZRYllKblF0S3ZmanVuZ2pQYmwySmtjMlpTMmxFcERKTlNXTDRpNmlScWRvYktLbWRoMFJxUzYyN0REdnljTHNNbWI4NUxwbkhibE5nVUh6ZFo1SGthTWJFSGxwRXhPTFB4bzJsekRURlF5Ykg2ZVVHTjRIRW1Rb2gtUTBwUUhkV3JwR09zdGR1YTRSSV9iZFVBblNG?oc=5,1760598000,"Opulent, Humble, High-and-Low: 10 Jewelry Trends From the Spring 2026 Collections - Vogue","Opulent, Humble, High-and-Low: 10 Jewelry Trends From the Spring 2026 Collections - Vogue"
gnews,runway trend,news.google.com,https://news.google.com/rss/articles/CBMiowFBVV95cUxQdWVTbkpzSEh2Y24tbjlwbEwwTE9fQ2ozREtpeEpvTE5icTYxejMxSzRLSEtRU01McU1RZ29RaThBcEdpdmtWeklnTW14eDJKX2Z5VmhWdUJ5ZFc1bWY1R3dDNl9sMDZfeTRLVnBfZTVMYUJ4QWxlZ21zazJRTkNoZzhLRE1palJ4dWVrbHBqbmNnUEpscUg2ZUlIYi1tQ1puVTI4?oc=5,1760079600,The 2025 Fall Fashion Trend Inspo You Need For This Weird Weather - Girls' Life,The 2025 Fall Fashion Trend Inspo You Need For This Weird Weather - Girls' Life
gnews,runway trend,news.google.com,https://news.google.com/rss/articles/CBMiZkFVX3lxTE1jOURfZmdoRnB6VFFRWjdjdWJSLVpob1ROU3VvWm9iVU9fRHBzOGpVelNYN0lFR1VBYldVZDFLamhKbnlpY0UwdTJNSzZkdE8tbWNqUVJIRW5OTG1wd2s3aGtLSmhfZw?oc=5,1760511600,How to Nail the Western Boots Trend Without Going Full Cowgirl - Vogue,How to Nail the Western Boots Trend Without Going Full Cowgirl - Vogue
gnews,runway trend,news.google.com,https://news.google.com/rss/articles/CBMipgFBVV95cUxQRF9ua0VUcm1sM0h1VDRtVGUwNnVCWUpVR2R4eVVtLVlVYTJuT3VFV0RuX1BuQ3FpZUl6Q2x0WGtxeHAzMzJ0emNDWF9RQzVFaXBMeWFCSlJTMFNUU0dabElPYk0tUjZsVUdScWFKSzZxb3VxM1pNcmowVW4xQjVkQi1yTW9MTUVjNFdQTk9SM0VaY1Rfb1UyUHBXcEc4OE83cllFN0hn?oc=5,1760338800,What Are You Wearing? The 11 Street Style Trends of the Spring 2026 Season - Vogue,What Are You Wearing? The 11 Street Style Trends of the Spring 2026 Season - Vogue
gnews,runway trend,news.google.com,https://news.google.com/rss/articles/CBMiogFBVV95cUxNSUZMTVBIY0JxMjVEMVFQajhxREhtOGRYb0l2S0kwenpYV2Vfb1paZmJZTGQ0RkluQUt3Y0J3TWt2OFNoR3JRNl82Zm0zdWhOMXlsNEdpZlhVMmNYdXkwVGYzTnk5bEFFd0Q0TWo3ZlFneS1lSllBUEluakp6WUEwOEdseWRxV0daaWNmcjlValQxWFlsSjJmdVp3Tzd5LWVpbkE?oc=5,1760079600,A New Fall Color Has Entered the Chat: Burgundy—Here’s How To Style the Wine Red Trend - E! News,A New Fall Color Has Entered the Chat: Burgundy—Here’s How To Style the Wine Red Trend - E! News
gnews,runway trend,news.google.com,https://news.google.com/rss/articles/CBMiW0FVX3lxTE9iRFhtcVNlc0MxcElEVjRlRjBWMkE2QmVJWWg0YkQ5Y19YZkVLZ0hDZnE2ekFkZXZ2LWNFV3phdzFKa1NKQUhzeHVMVTNySWtyTFZhbDNMNlhtUGc?oc=5,1760598000,Western-Inspired Fashion is Back Again This Fall—40+ Pieces to Nail the Trend - The Everygirl,Western-Inspired Fashion is Back Again This Fall—40+ Pieces to Nail the Trend - The Everygirl
gnews,runway trend,news.google.com,https://news.google.com/rss/articles/CBMijAFBVV95cUxObG5LRFdJaXhvMUhiUVlBeFlNU18xbmY1WkgtRkg1SHFPUUpZS25LMU0zWTk5bGhOME9XQUxBR2s3bzZUS1JPdndlWGRTam43SWp5UnAtcEMyajVhQXFORENuU3ZHdEZYb2lvSktGdWgzR01RZXluSTdqNVUySm5fMW1yTm1ld24yUkpPdg?oc=5,1761647520,AI Revolutionizes Fashion Trend Prediction: Study - Mirage News,AI Revolutionizes Fashion Trend Prediction: Study - Mirage News
