source,query,domain,url,created_utc,title,text
gnews,fashion trend,news.google.com,https://news.google.com/rss/articles/CBMiakFVX3lxTFBOdTZEMlM5UnRfMlVNbkRxYmVzYldhdFp3cGsxMnF3c2E2QW9Lc3hFT1FoeURvZXlJeEpCYnpTQzVKaU5sRzYxaVFqNW9aOWdHdzFYQjlmSWRMUWx3bFdjTEQtc2tfcHg5a2c?oc=5,1775246327,The 14 Biggest Fall 2026 Fashion Trends We Saw on the Runways - W Magazine,The 14 Biggest Fall 2026 Fashion Trends We Saw on the Runways - W Magazine
gnews,fashion trend,news.google.com,https://news.google.com/rss/articles/CBMiuwJBVV95cUxQaHpJc3pHZmdVb1dfWk8xQVhVNWxJc1hndEkxZ0d0Mnk2bDI5eXlGTm9WVVJ3Y083d1U3bUV5V3RGTGFQOVkyeGZuYl83ZlNrVF9vZGZ0UkZZYlJkbHRlWUxJSlRmTUtSRjFiLVZUR2tmRlptMVgtcXp4cERVQWVPQkNXWWlDbC11cE9LaXdGbWVIdFJSSHJQUEh2VGhnYnJFOVBkMG53S0JsTFl1bE95T1poUXJUamhQaWdnX0pLRW9oS2xrRkZFQ3JDM2lvY2J4OXE1MkxpTHhPUS1ndUJMS041MjhvZ3VGMmpsSWpOb0JuMkhra2Rva0l1d3daR2k0VGNmY1JUTXFTaWhZT3pIdC1wZjVjT3VrbTdIVWhpc2N4Q0R1emQ5WGdQX2RTRjVGYi1mZ1pSaVllQ2_SAcACQVVfeXFMUDc5TUxSTk5NNWVuWS1RRmk0SDktSi12NHN5MFM2UWV4NVlMUzdIZVVvYUVvQzNLVUh6REdfNUpUaS03SktqcnBfaFA0X3pLLXNtSUVrVGZiSHZGclNUWk9hcDRkeGo4dVFQZ0Flb2RYcDJkWlB1RzJVNVJsR3RFeGVPQlZKbVhoUXp2Q3B2ejBzcnBuOU9CRWhRNFJOWFlrS2QyN3Y1bE1vMmE2azN6UGozMVdCRkl2c1hRZkZKV3F6c1hraEwtY0VUbGs3Y1V5TU5vSVpnOEowR19fR2h0bE01bUpnRWJVaXRsTW4yMU45UHUwUTNXZm5yaVRITGV5cGJRN3BaT2FteUxydkh6Y3VqNTY2SHppOXpkdUd3QVB3NGsxVk10MDhSWGlsYWFodGY2dmpQeEdCdjJfSXJCQU0?oc=5,1775379240,"Move over rings, 2026 is all about wrist fashion trend: 5 rules for perfect bracelet stacking, according - The Times of India","Move over rings, 2026 is all about wrist fashion trend: 5 rules for perfect bracelet stacking, according - The Times of India"
gnews,fashion trend,news.google.com,https://news.google.com/rss/articles/CBMiggFBVV95cUxNeVRuYklMUVNJaDVIM2M1QTZscjVsMHduQUN4MUdDWndZTDFUeWZ3eWxLbnd0cmRIcG1tWFJmd3Utbko2NHBNbFNMVXlPeDlkUU82SWNMT00yNU1EanV5UzduR1hMR3VrRnI3T3p5WElDaWdIbHN0T05kZjRtZ1hIYml3?oc=5,1775051250,The Fall 2026 Trends I’m Shopping and Styling Ahead of Time - Marie Claire,The Fall 2026 Trends I’m Shopping and Styling Ahead of Time - Marie Claire
gnews,fashion trend,news.google.com,https://news.google.com/rss/articles/CBMifkFVX3lxTE01c253bnd0b1NWOVhWdGlzQk81clE2TnpYakJLUl9XYWNGekRwdTkzRlJRU2RLRmxCcXg0WDFldVFVODB3Z29KSnBYbW9wNE1HOGhwQnRWbi01UG1uc2x1N05oQlA0X3EtQnhMeVRLUU1yZmlfTHNPMkp6R0xsZw?oc=5,1775379600,"Leopard Print, You're Done—the 2026 Alt Everyone's Shopping for Their Closets and Homes - Who What Wear","Leopard Print, You're Done—the 2026 Alt Everyone's Shopping for Their Closets and Homes - Who What Wear"
gnews,fashion trend,news.google.com,https://news.google.com/rss/articles/CBMiakFVX3lxTE9jcmpqeURLS29reVZGejVvbng0MjdKdnhsMXpVcE1LVVNzcWoyZ3VuZjhZY0FhZUtKRmxHZ3VGeTR4ODVqWXN5RFlCYkhGUFZqN2txQU0tSEZ1SVlBR2tXSllxb21KZ2ZmWlE?oc=5,1775431125,Women today all dress beautifully. But there's one boring problem. - Mamamia,Women today all dress beautifully. But there's one boring problem. - Mamamia
gnews,fashion trend,news.google.com,https://news.google.com/rss/articles/CBMib0FVX3lxTE5ROXJldXB2NzJvd3NvZTg1ZFBNTU5Jc2VZQUNYSHY4WnFfa3NZei0wYVRDWTVZQW5mZWthNFN3MXdjOGg5RWotODQ4cGI2YWpQOFFfa2RjLU1XMDJtWEZnREdFVHlTQjhWc0VsSzN5TdIBdEFVX3lxTE9FZXFVTGx0eEpqLS11UVVhYzRrd0hoSjhHYVNDQWZMUEwtd3Q0ZEhlZDY2ZWpMZVpHWGs0emtYbXFlczkzc0NNZDdYNHZiY3VNR0FWTG5DTVZaT2dPMVFsSThMSzhST0hDTnMwNklabFBzek54?oc=5,1775414900,Equestrian-Inspired Runway Shows - Trend Hunter,Equestrian-Inspired Runway Shows - Trend Hunter
gnews,fashion trend,news.google.com,https://news.google.com/rss/articles/CBMisgFBVV95cUxNYm5ReS1DZ2p6bFgzUjIzYkhzYWE4YW9BQW5GVmRpc3plekRFRmV5NXNDdzFhWHFhNWQ3ODZueExLWmRJX1V0QWRoOTJVZXEzU3Z4TmdicTZsNXlTQTRKVmJIempid0M4Ympzb3lzS09DQjBKMlJ4MVhvaGtBcXo0SkFDaDk1WlktTThRdUc1WnRtRWVFNEtndkRfclNzZTEtSjBnNGlCaEN4d3I3b1d0N3RR?oc=5,1775228813,How Gen Z Nostalgia and Music Are Driving Festival Fashion Trends in 2026 - WWD,How Gen Z Nostalgia and Music Are Driving Festival Fashion Trends in 2026 - WWD
gnews,fashion trend,news.google.com,https://news.google.com/rss/articles/CBMioAFBVV95cUxOTjJQX2tFbEkwR01GaUhGUklQOUw3ckFEYWRGMW43WXVJak15elVLRlY4MXR3T0d6SFE5YkdMMEZobktMS1Fkc21vQjY1SVBkX1JoazZIM3MzSmg5dWdXUnliQ1FYczRMU3RHbUZ4bTJPdjNZNFV1VlVBdUFpMUFEaThoekNuWk10X1NLZEVMXy16dFpMbHkxRTdrODBMWnZO?oc=5,1774906675,The Los Angeles fashion trend of the year is politics - Annenberg Media,The Los Angeles fashion trend of the year is politics - Annenberg Media
gnews,fashion trend,news.google.com,https://news.google.com/rss/articles/CBMilwFBVV95cUxPMUw0UnVaUkRnZWpaaF9DNGw1c1VjMThDNXYwbGlDMFZ5bmZpNXdTY0dWNWhiZjY3THg5UFE2eTJEVHhOYzk3Uk1SVFVyaFhZdVBERGoyUlMyRG5qaGY5WG9KMjhmZ29FeFlTb2dNdWtTS2FvUlJSaUJWNVdYRWZJanBHVk1XMU9aRTdZVWgySmpaYkh4VDR3?oc=5,1775248196,These Are the 6 Key Fashion Trends to Pay Attention to This Season - Town & Country Magazine,These Are the 6 Key Fashion Trends to Pay Attention to This Season - Town & Country Magazine
gnews,fashion trend,news.google.com,https://news.google.com/rss/articles/CBMioAFBVV95cUxNdGpROFY4OFRXQ3hrbU9WZXdmbDBKanA5NkNSSDhlSVU3WEZyZDg5X2dNNzJoTDIwUlZOUmlJQ0gxWG1yNHQtRW5abGI2aFRDcUtsX3lIdU1DNmNscnROSnV1d0FnSTZhRlN3bGJkU2JZQ2hZLTNyR1NaU3psanBCelBlZXlrOVhfeFJMcWRPRWY1WUxsdE1Vb0lPVWFrd2sy?oc=5,1774953000,"15 Fashion Trends That Are ‘Out’ for Spring—and What a Stylist Says to Wear Instead, From $14 - Travel + Leisure","15 Fashion Trends That Are ‘Out’ for Spring—and What a Stylist Says to Wear Instead, From $14 - Travel + Leisure"
gnews,fashion trend,news.google.com,https://news.google.com/rss/articles/CBMioAFBVV95cUxNTlVuVE9KMmN2WEFMX3hZZ0lLb1RBTnlTS0VidzNrOTRjQ19ZV1NwOXRRZzFla0pMa1RNdER5YjVPUmVvc3lXX3Nib0hCczFhUXIteFB4dmZYb2FiZHZNRWwtWGEtZlpfa2IwM1pmVTA1THNMNk1BcjRIanh3LWhCX3BwS2FqS25XS2hqMnZrVTh0bUR5cmRLeUtUc2V1Q3dV?oc=5,1774989073,Emma Chamberlain Shares the One Fashion Trend from Her Early YouTube Days She Wants to Come Back (Exclusive) - People.com,Emma Chamberlain Shares the One Fashion Trend from Her Early YouTube Days She Wants to Come Back (Exclusive) - People.com
gnews,fashion trend,news.google.com,https://news.google.com/rss/articles/CBMigwFBVV95cUxOUnZRQl83dXdWYXJOOTNaaHVvRjVaYVBDaTFmUmpvaXI5aDFfTFhmWjd0eDBKTG91S3l2blMxek02YnlVRkRwZERESE5JbVpGajU0cElQSXloaGFHTkx3OV9veEpxd2UxRTRpWDVwRmRLMUlKVnctVGVuTEJnRjMzOTllQQ?oc=5,1774863600,I Got the Tucker Carlson Merch. I Don’t Think He’d Like My Friends’ Reactions. - Slate,I Got the Tucker Carlson Merch. I Don’t Think He’d Like My Friends’ Reactions. - Slate
gnews,fashion trend,news.google.com,https://news.google.com/rss/articles/CBMigAFBVV95cUxQR1FuRFkyMU1tbnY2ZzVZbXRtRnJwdU9ZVFZwb2JlN2ZNR2hxcWliMWMzRmdlOWpXVkttRXAwT1V0RGV4VDhFU3BfWWJ6TFZXX0lQUC1ONzhlMmotU09lTG5MdkpITGtpTHpyak9rT0lhQ2JGZkYwRV9rbm5MQmhiUQ?oc=5,1775044271,8 Looks for Wearing Spring Fashion Trends (Well) - Vogue Arabia,8 Looks for Wearing Spring Fashion Trends (Well) - Vogue Arabia
gnews,fashion trend,news.google.com,https://news.google.com/rss/articles/CBMixAFBVV95cUxOc2RyNmJFeEdXZGUzWjUzS1VyM04yZGJiQ1prOEpvTTFzZ0lCWHZLMEhmTk9seW11SkdCa1drNzI0V3BMX293SFQtQmdpdEt2NmxYXzdQQ0MxQ3VhY2VWUVVUX2Zza2c2bGVXc2FwNlM0ejUxSzdrT0tUYlZsWHZCZnlwbDdrMThvSnJfNXJ1aUh3UzhHZjZWWmI2Wndrczk1WWI0WTh5X2lBNktkYnpKS3hScDMzT09nRjRpUUl6ajhGUXVU?oc=5,1775316360,Zendaya Introduces the Fur-Trim Trend to Bridal Fashion - Harper's BAZAAR,Zendaya Introduces the Fur-Trim Trend to Bridal Fashion - Harper's BAZAAR
gnews,fashion trend,news.google.com,https://news.google.com/rss/articles/CBMilAFBVV95cUxNbzI2RlRjS2VTSG1YM3VQN0g5VGZNOU1PcjVPWTF1U1pnMzk0dHRvMlhHUkFnbTJXazRMUkU4OE1CSzlvVU9EODhrQThkeUZ6UXc4T3EzbVo0LWJxd2swOXBXSlNqN0J1ZGxlRGRrUXhfTGpKcVRheXZUVVVoM1lNbzJjaG4zUE9yLUxHVDdhM05KaVg2?oc=5,1775235600,It’s hip to be baggy — fashion’s gone oversized in 2026 - The Times,It’s hip to be baggy — fashion’s gone oversized in 2026 - The Times
gnews,fashion trend,news.google.com,https://news.google.com/rss/articles/CBMisgFBVV95cUxPeHdGY3VfWml3aDkyUW1ueWZvVG1EaDlZbU5hRmY3SUpyYkJxbXo0Q1hjajBPeUtjeG9ySlZVaWlqaUpCNlJ6c0drX05wM1FkWGRLWUdfUWxsRVcwRDFlQkxhbUE2YVRqenZnVVJvS2lkZDRnZ2xYLVAzel9JSU80SXZ2d3Vidm9hUTYwbFhkYi1QOGJpbV8ycmczcmlyX0d3UWM3QnBwSzZpLVc2T2htZlBn?oc=5,1775199600,"Students fight ‘fast’ trend with hand-me-downs, thrifting in fashion show - Denver Gazette","Students fight ‘fast’ trend with hand-me-downs, thrifting in fashion show - Denver Gazette"
gnews,fashion trend,news.google.com,https://news.google.com/rss/articles/CBMimAFBVV95cUxPa3QwUkdtMTduZkY1SHVJN0ZqaWpDTUVvYmdtZ0F2azFhM0hEM180T1RLRWlIMlpMNjRER1p3TVA3UXllSFJFYmhuYTVaSjZubFVUcXItV1E2NllpMmRXZGowREd5UGhoZ3hOdUhyXzdGcGgyY3NjaXh3M0poNkJPUUNTQ0FEWW9Kb0lzVXZfQlFTWnV2MmdPeg?oc=5,1773817200,The math that explains why Y2K is back in fashion - Scientific American,The math that explains why Y2K is back in fashion - Scientific American
gnews,fashion trend,news.google.com,https://news.google.com/rss/articles/CBMijgFBVV95cUxNbFR4THAwYTFFU2FtR3hWQnJ4TzJobzVrc0lqUkM0ZWwzVlZNbjdjWFBaU1dka2ZTRWhYb3J5QTF5OFJ6alQ5anlnTmF3MUVRTVVRUUx4amJaTnpBMHRRWHJJSk5MN0JKQVFoZDVtZUZHNkNFYm1fWGllV3JqSm1KWFdNTk5wQ2ZlX08yM3pn?oc=5,1775264400,Every Major Trend to Know From Paris Fashion Week - Who What Wear,Every Major Trend to Know From Paris Fashion Week - Who What Wear
gnews,fashion trend,news.google.com,https://news.google.com/rss/articles/CBMilAFBVV95cUxPVW8yUEFyRGRCWnlCWnhHb0ZwZEtPdklOZzFjQlhrNm9ZUGNPTEhQSG55cmhjdGozMG1yODdZa0FlNXgwNFJvVU92X28wS2o1cU80NDVvWG5pWUtlVXZ6UXRCbV9hdEV3MXUwdU9tTXNlaHZQLV9YMUZ4R0pCQWptU2Zuc2s3X1hvc2ZUcFVkSFVNTnNF?oc=5,1775229795,How to Wear the Tricky Trend We Saw Everywhere at Fashion Week - Harper's BAZAAR,How to Wear the Tricky Trend We Saw Everywhere at Fashion Week - Harper's BAZAAR
gnews,fashion trend,news.google.com,https://news.google.com/rss/articles/CBMijgFBVV95cUxPaWtGSTI2amVQUXgyV1g1SXViZkJ4Smg4SzQwMnZZZUpxdU1LUDBZTTRXX1VIQnV5TU91Q2gxSV9MYmd6VUlndkd4S2hVVF8zQnp2Mm5LSWlmRUFFLUo4ZGZUaDJ1bzZMQmVMTVRqTF8zYmZIUDRIWlQwSGphVkJONFE4RjBpTERwVGxUbVJn?oc=5,1775140546,3 Outfits That Made Me Believe in the Silly Little Pouch - Marie Claire,3 Outfits That Made Me Believe in the Silly Little Pouch - Marie Claire
gnews,fashion trend,news.google.com,https://news.google.com/rss/articles/CBMilgFBVV95cUxPbVZHTlNMNFVRMUFSZ0dnZEJTU3hGM2ctZXBDVnlWcHdTM1pJWUJtdnMtRUNhb1UyN1hBeXNxV2ZiVDlnbWotNm5MMng2SzdoSFRMeGFMN1BEQzl6SVhhOHpLSEpvSUhWZHpkbHdnNkMtbFF1ZGVaM1pzUHllUGNKM0NlaFZFVDd2Y2loazdmYUJSV2VoMmc?oc=5,1775379788,Mary Jane trainers are the unexpected but comfortable spring shoe trend – and Next has a pair for £38 - Good Housekeeping,Mary Jane trainers are the unexpected but comfortable spring shoe trend – and Next has a pair for £38 - Good Housekeeping
gnews,fashion trend,news.google.com,https://news.google.com/rss/articles/CBMiZEFVX3lxTE8yTGRnRUhLMFRSUDVyQ2E4WE9wQm1wb1pKbmpWYzFWck1vMEFJR24xclBTOEF3QW1KS1NSWkc3dDJsRGxVSGdYOTJ3S0IzaEN0cDhNdHZYdkZZWFVXa3J6QjNLcDc?oc=5,1775228235,Selena Gomez Tries Her Own Twist on the Pop of Pink Trend - vogue.com,Selena Gomez Tries Her Own Twist on the Pop of Pink Trend - vogue.com
gnews,fashion trend,news.google.com,https://news.google.com/rss/articles/CBMicEFVX3lxTE1oYURQejZaQ3VOUkg2WEZTWC12dGI2RDQyVHEtSVIzOVlWU2FEVjhRRHIwR25nX0hHTFhQb2lwWXFieGNRalo3TGhfTzFnZzN2VXBKc2doSVZPTnVJbHFOd0xoTkNrMU5KTk4ybnZNX3HSAXZBVV95cUxQTnRlbmdFTVpOWWhSVVpWRzdYUGMyb0RwNnpfT1BrdEN4VVVsR2RYeTRlTjYxR2pBRlBTUGstV0Vpd3lNcEMybnJmNEtYMDN3S01zNFZzY082TTBSZHQyemNZNUR4OVhZOWFaazB6WDFiVkFCX0NR?oc=5,1775228594,Top 25 Luxury Fashion Trends in April - Trend Hunter,Top 25 Luxury Fashion Trends in April - Trend Hunter
gnews,fashion trend,news.google.com,https://news.google.com/rss/articles/CBMidEFVX3lxTE01Y3VHS240bHNPcUthM0ZvODBXZ0xEV3lobTNaNlRudFB0M0dxUGNKbUx0cXc3SnRncWlra0I5NU53RWFxZ3ZfU04tYlZfUlBOdWR2eFhVaDJTVGJFNUpiX21tRUVIOW9EOC1mdkFJdGRZaEky?oc=5,1774985716,5 spring fashion trends you’ll be seeing everywhere soon - CBC,5 spring fashion trends you’ll be seeing everywhere soon - CBC
gnews,fashion trend,news.google.com,https://news.google.com/rss/articles/CBMie0FVX3lxTE85bVN4R0JLeWpfUkdoTURvQzJFWWpIbHc5cWR0MWRVNk82ZW5wMXp5eC1VaGktX0JQTUV1RXNEYWJiZ2dITE9NbVUzZ2t0X2Z3bmlIOFBSX0pGSmotbGlVSTh6aWNPYXdoRlBpM0Q0Q1JUMVU5M3QxWVMxUQ?oc=5,1775192400,Fashion Editors Agree: These Dated Trends Won’t Make It to Spring 2026 - Who What Wear,Fashion Editors Agree: These Dated Trends Won’t Make It to Spring 2026 - Who What Wear
gnews,fashion trend,news.google.com,https://news.google.com/rss/articles/CBMivgFBVV95cUxORldONHBlQXRNVThtYXJYTm9vU1hodjFxekRKbmUyYm1QdHMyNEYwT1NxWGZCZ3l6b2tsOEhsd2dPTU1FZUwxMXVuMEljQ3dkV0Q5cFIwV0VEdXlJd3ZyMTdiMGtDR1NfMXltQk55WGJreGpfYWliV0N4aFliaVZ6cDZadVJJSGZIaFV5ekRQZ0hwc2ZSc0Jjc0ZldU1LTHFrcHpnY1hzZTQtTmpNSWc0V0R0Qm5pdDBZN0hLal9B?oc=5,1775234496,Spring 2026 Fashion Trends That Actually Work for Women Over 50 - Yahoo Creators,Spring 2026 Fashion Trends That Actually Work for Women Over 50 - Yahoo Creators
gnews,fashion trend,news.google.com,https://news.google.com/rss/articles/CBMilgFBVV95cUxOa2wzNXYtbUlrR2VIcXQ5ekZuVTRHZ2ZfV2hLUG5DbU8zcFBRekI1VEpqa295S2JjbVNLVVhjUHdNVUVqaU9uOGh0d0tJNEE1WHN6ZFNYX3o2QXRnZWY4TTlKWG83VVE0NGM4ZHZHRm5pNmhJQnJjR2J2aVBWN0xQQWRPMGF6dWZGWGlZMmMtTGZxSTl0N1E?oc=5,1775141865,I'm Building My Dream Minimalist Spring Wardrobe—4 Trends I'm Shopping First - Marie Claire,I'm Building My Dream Minimalist Spring Wardrobe—4 Trends I'm Shopping First - Marie Claire
gnews,fashion trend,news.google.com,https://news.google.com/rss/articles/CBMioAFBVV95cUxPQmZFVTc5TWh2c1JNTEM3UkJ3YU9MbVJYcG5HWGRFdUhqUHMtQ1pRQ191Uk5zRzhNZEpKTzczd1NnQ0FaWXk4SEVIVWJINi1CUVZ1RlhlVEVlbzZ1Yk9Tb2ZmX3dMdWJma29HRmg5X3VQUFNRWDhwMm0wVWljSmw3bGtpUFJ2bTRJM3ZtX1ZZRlkzMFV5dDNBd0hoTTc5OFhm?oc=5,1775192682,Fall 2026 Ready-to-Wear Trend: Coats [PHOTOS] - WWD,Fall 2026 Ready-to-Wear Trend: Coats [PHOTOS] - WWD
gnews,fashion trend,news.google.com,https://news.google.com/rss/articles/CBMijwFBVV95cUxNTEZIVU96bGRKYnRmY2tHeHA0a2NxYjIycDh0VjUwWTlWME0xaG1SOTlQYmlrNUdmQUtmbnhzQ19lU2ZZQUI3VjJpSGJqa1JjTnBmNW1uUzZtdkg1MEFnY0NSZmdpLWdic2p0d195VlYxMXQxWUdieXJEVFotdDJOY21HSlZqM2JGeWc3TXZWaw?oc=5,1775155811,Forget Basic White Sneakers—These 6 Styles Are Blowing Up in 2026 - ELLE,Forget Basic White Sneakers—These 6 Styles Are Blowing Up in 2026 - ELLE
gnews,fashion trend,news.google.com,https://news.google.com/rss/articles/CBMimwFBVV95cUxOSm12OFktMFpySGhUdzZMNThQdHRUQVZPb3BCM1ZHQnhTNHB2TmtDTnJiTnBMbFM2UjVrenJSWGdtTnFIY1dWTW5ma2tZRTdsdEZtQ3BDamR1ZElfVDlTZVNnUlRyeFpxVWpiYXVLQnd1WGpEdTZBVlJCWk5pSGVaZmhZR3hZa3JnbHI4ZjFmNEFpV1Ztc3VGYmtJYw?oc=5,1775230500,Wraps Pants Are the Polished Trend That’s Replacing Your Go-to Jeans This Spring 2026 - E! News,Wraps Pants Are the Polished Trend That’s Replacing Your Go-to Jeans This Spring 2026 - E! News
gnews,fashion trend,news.google.com,https://news.google.com/rss/articles/CBMiiAFBVV95cUxQU2NCWW5NYUxiOXBtZUhDdHVTVUxoNm9XME5TMy1wdEtOTHZZTEY4NU1nUEx4c1hRcnBGczJXYWI3RTB0VVNQY25jRFdBMTZQNkpDOFpsd3NSblo4NzZXcENyaDhsQ1RLNHNVNHR4eTk1MGJtVEEtWnRYU3M2d0Z6RDNPV2RnazlT?oc=5,1775134836,Spring Fashion Trends That Aren't Just Florals (But Still Perfect For Easter) - Girls' Life,Spring Fashion Trends That Aren't Just Florals (But Still Perfect For Easter) - Girls' Life
gnews,fashion trend,news.google.com,https://news.google.com/rss/articles/CBMigwFBVV95cUxOUVRfekRsREpsTkFyd3NHcWV5RmtNajM3ODdrdEpBdXZteW5SOXJCX3BXTXZPOWxGQnVWQWo3aHJYRWVnalhtOUl6a3lEclBCR3o1YVhOSTcxQmVVd0wwekRZdThrZ0NOLUdHckMwUmd0T29ybGJEZ0tqMm9Kc1VwNV9LSQ?oc=5,1775243310,These Lightweight Spring Sweaters Go With Literally Everything - Harper's BAZAAR,These Lightweight Spring Sweaters Go With Literally Everything - Harper's BAZAAR
gnews,fashion trend,news.google.com,https://news.google.com/rss/articles/CBMi3gFBVV95cUxPNktZQ0R4ZVp1OGZGTnJJUmtwWjRYZWVYaXQ2eG5iNl9KckxZWVh2ZjZjNVpZQTNkRkc2b0lkekVZRkpULU1lSFlZSFR2RlNMcWstTTNlUk9mX2dTMGhOaEVab1R4WVdkSXQ0aUVVNThGcy1vSnk3V19SM19ZaHY1VGFDS0pMaWpubHVRZUNFNTFPa21DY0txb3hYVE5LOFA3QkRUSEYzeXRVbS12cE9WMzJHc1hBNFVrcm9Tc0xqY3hxVHZSWmd0bXhHMENTQUk2d3VfNTlkZUhLdTZEZWc?oc=5,1774789447,‘Leverage the local’: The fashion trend that explains why everyone around you is channeling their inner tourist - Fast Company,‘Leverage the local’: The fashion trend that explains why everyone around you is channeling their inner tourist - Fast Company
gnews,fashion trend,news.google.com,https://news.google.com/rss/articles/CBMivwFBVV95cUxNZlNLd1dTUnNhUjMzMDJjWTZYMTdSUDRWQzZNOTdZZkNxWFlra1UwaGN0ZlhEa3NVV21qRGZFVm9aNDZjazdaTTM4YlRvbmRLNXV5VmZjUTd1NnBXSG1EYkR4S3F6Y0lvakpJQlBsVDJxRVpQVVFFNERhamRzU08tOWplcVdhR01yMFBzTlZoNkdpbTJfQkFEN2x2eXhKVVBqYzFDUzhHcTl5bUstMVJLWGRmSDVHVUdTU3M2dzlFYw?oc=5,1774681200,When the gloves come off: spring 2026 fashion trends - The State News,When the gloves come off: spring 2026 fashion trends - The State News
gnews,fashion trend,news.google.com,https://news.google.com/rss/articles/CBMilwFBVV95cUxQSW5YV0EzYzhmRXJsVEhkXzVNZzd1T2xvVVFEclNzM0ZzYldDOEtNM0xUMk5PNDU1T21rVzRob1ZsX1kxMVFqcXcwTHQzWkJsZlFYaXNGeVV4aTZRdFBfNVd3Y2ktRUwyVHlETDVrRjlLY0VpcVJmZFJKdGZHTEJiZDhtR09VTlpNUVltSmphaS1lSlRnX1hr?oc=5,1774508400,Vintage to Vibrant: Spring 2026 fashion trend predictions - thelantern.com,Vintage to Vibrant: Spring 2026 fashion trend predictions - thelantern.com
gnews,fashion trend,news.google.com,https://news.google.com/rss/articles/CBMilAFBVV95cUxNTy00QXVXOXFDU1VHR1UxaUxWd213N3NkdWJoSGFuMVFFdm9VUkl0WmVYYmhZTU9WSWE3SWZVd1oxM0ZGdkNHRXFmTkVpcHA5Q0hhTFlPakNQX1cxeXhwSE9RYlhVX3Y5aWNodktZdXFOM0VUSXFsOEg4MHU1a2kzUWdsNG9JdE5sMFg3VlFtb2h6YTBV?oc=5,1775249282,Jeans Look More Chic Than Ever When Celebs Wear These 6 Spring Shoe Trends - Marie Claire,Jeans Look More Chic Than Ever When Celebs Wear These 6 Spring Shoe Trends - Marie Claire
gnews,fashion trend,news.google.com,https://news.google.com/rss/articles/CBMidkFVX3lxTFB3RmhlbF8xSzhneVB4NGI3aG1ndGRtUklHRzdqTWhxODZvZGZmTkk5RGlnblNMYjZNYU1Rc3pqZkUtYl9iLVFyWkJEc0hFR3p4aVk3WVJCZ0poRWtsemNHQ2hSaUhkaWdjWUVHRWxzZURfdUVEMEE?oc=5,1775073303,"I'm Not Saying That Polka Dots Are Done, But This Summery Trend Is Getting a Lot More Attention - Who What Wear","I'm Not Saying That Polka Dots Are Done, But This Summery Trend Is Getting a Lot More Attention - Who What Wear"
gnews,fashion trend,news.google.com,https://news.google.com/rss/articles/CBMinwFBVV95cUxNejBFdEhUR3ozdlVJS2lsNmR1cmtpYlNHYzJNLXFudkNSVjZhNkNMYU5ZaWJtQ3JvWkh6bEp3Smw2NWZpODhDWXVwaGVfZ3NadHNzckpsdWxPZXptbXd3dk5qd3RUYXhUMnNzOFhpMGQzaXBWX0R0NzZVSnhvNWVSQnVGMjhoaVBkSGIwMFBidGoxVndkbWVSb1p1TUVuN1E?oc=5,1775077161,From the Archive: When Space Exploration Met Style - WWD,From the Archive: When Space Exploration Met Style - WWD
gnews,fashion trend,news.google.com,https://news.google.com/rss/articles/CBMinwFBVV95cUxOZzFzeWw2cUlEaXFqS0hydzNNTVVsT2VfNzRJc1V4VVF6cm1PYTFqZ2ItSjRQeUw0YlBYWkNUVXJfZU56MFlUNnhLVEltbVJTdlc5aElmYnlfdTlvVEd2MWV0M1dCbVdvNkp2OVZjci0zSXBMN29NVVllMFd5VGJyWlVBYUxsQVdxTjZKY2J2bEhLMGtDX2JMUUx1cUd1YzA?oc=5,1775126321,"I’m Normally Anti-Leggings, But This Divisive Spring Colour Trend Has Just Made Me Rethink - Who What Wear","I’m Normally Anti-Leggings, But This Divisive Spring Colour Trend Has Just Made Me Rethink - Who What Wear"
gnews,fashion trend,news.google.com,https://news.google.com/rss/articles/CBMia0FVX3lxTFBnOHV3aWI3MXphWGVnQ0NZbTVCUlVTYUtKWklFTVZDWWJ5V2JVRXJ5U2Zxb1FmMmhybGhPVWV5VEwyV0djX3FoWWRtUzNKbUlGVWdQNjYwb0lkSTRqLV81YXhNNDBYUWUzdFlr?oc=5,1775152800,The Handbag Trends Everyone Will Be Carrying This Spring 2026 - Refinery29,The Handbag Trends Everyone Will Be Carrying This Spring 2026 - Refinery29
gnews,fashion trend,news.google.com,https://news.google.com/rss/articles/CBMiZEFVX3lxTE9fNkVJcWRyaFNZQnJUSm1DOGk1TFNGclNuM0xkSzg2ZHJHZ2g1Nl9RdVJYZWtJYTVoY1Jxc1haYUpGV1dLOXM0eXVFR2paVXQ5ZFk0YlBGUVFvQjMwRVpRSkFwNW0?oc=5,1775217624,The Maximalist Hat Trend Taking Over This Spring - The Zoe Report,The Maximalist Hat Trend Taking Over This Spring - The Zoe Report
gnews,fashion trend,news.google.com,https://news.google.com/rss/articles/CBMieEFVX3lxTE9jd0hIdjAwVnhPN1dJWVBVODhsUGN3dU5Nbm9yYU5vYVNRR25fdW8tZ2hhenZiR2NmZ1JiQmFJcVpnVS05QlNCQUx2YTZpdHhPTHUxOVRLSkdoQXVYVzdmX3RXTGd1XzU2eTZvLVBkd3JYejI0Q1lwWA?oc=5,1774076400,Here's Why the Riviera Fashion Trend Should be On Your Moodboard in 2026 - Who What Wear,Here's Why the Riviera Fashion Trend Should be On Your Moodboard in 2026 - Who What Wear
gnews,fashion trend,news.google.com,https://news.google.com/rss/articles/CBMifEFVX3lxTE1jZEJ3WXpTVHFWTGFCdXVoLXpNZktCUk1MWXY0Wnk2NFlOUTJXcnRVOTZjbGY4YWtnVU1UQWlKOUVoQU9pNlVXLU5MWW1NOHI3YmNkbG96VkxQanZJMDJXUzdTZFhyakprUDNfN3FiSVhieGlWZ0tBVnZGcHg?oc=5,1775285033,The Next Big Nostalgic Trends Are Inspired By Eras You'd Never Expect - Who What Wear,The Next Big Nostalgic Trends Are Inspired By Eras You'd Never Expect - Who What Wear
gnews,fashion trend,news.google.com,https://news.google.com/rss/articles/CBMif0FVX3lxTE1CVjhwY1FsOWVRVy1PVGEwbXltaERDU1JpVG9EbHhyVTBtcDdWMVF6elA5cjRocVVrYmM5MWlrM0p4SzNOenBRZHRCdDMybFdqRmt2VXVsVk4wY2JLc2hieU5iMHVrOWJzXzNrQlRqSk1Teld1SUVHQnpLSElsVjQ?oc=5,1775128679,This Divisive Shoe Trend Is Replacing Ballet Flats For Spring 2026 - ELLE,This Divisive Shoe Trend Is Replacing Ballet Flats For Spring 2026 - ELLE
gnews,fashion trend,news.google.com,https://news.google.com/rss/articles/CBMiZ0FVX3lxTFBfMUwtMEE4aVM3YmI5VGtkZ2dleVFxTWxzV2tzbHpySDdJQ1dSUnFuRmFpdGo5VVRVbHAzOWc3TlRyQ0ZReW1DSTlSYkljczRDdXBTVTVBc2c1UmdfbnNvX2ZwOHpwVVU?oc=5,1773903600,The Key Spring 2026 Trends to Add to Your Wardrobe Now - vogue.com,The Key Spring 2026 Trends to Add to Your Wardrobe Now - vogue.com
gnews,fashion trend,news.google.com,https://news.google.com/rss/articles/CBMiuAFBVV95cUxORklMLVI5Qy11d2Jzcllpb25Ub3FOWGRNOFczZWxILUdnNkhNZFBGQ3V2V2N2MHNIUkpFMmtaUnZXRG0xQS1FX1BEZVZmNXZjdTBPUUxhdUk2N2szR1dpQmNpZF9pN1JibWNhU3lZVC11cHVCU3dNaWFGZkk2WXA0MHZUUjRaajEtcmNPQXB1bkllc2NwOERvUUFPQk1TYktrNUJmS3BVQ2hLUm1pUG9KNGJUd3JjQndZ?oc=5,1775312446,Zendaya's Airport Style Cleverly Pairs Two of Spring 2026's Biggest It-Girl Trends - Marie Claire,Zendaya's Airport Style Cleverly Pairs Two of Spring 2026's Biggest It-Girl Trends - Marie Claire
gnews,fashion trend,news.google.com,https://news.google.com/rss/articles/CBMigAFBVV95cUxOM1RSalN1eWIwcmlDUnFiYmQ4WTBOdVVaWVZqRW5ndFB4aWNORldxMTByOEN2LV9BMVp4NkhwU0FFMUZ0MDlqbURNRHhqYWFfQTI1VG5YTWYzYVZyZ1JzWElUdm5kVzhnaXcyVFBMRUhnU29wZkFrc0t5UkV0ZHB2ZA?oc=5,1775203200,Sharon Stone and Meryl Streep Are Making a Case for Blue This Spring—I’m Shopping the Trend at Quince From $40 - instyle.com,Sharon Stone and Meryl Streep Are Making a Case for Blue This Spring—I’m Shopping the Trend at Quince From $40 - instyle.com
gnews,fashion trend,news.google.com,https://news.google.com/rss/articles/CBMilgFBVV95cUxPS0tvRTFTcWdSdldBZzdSUnhkMzE0akRwcklVOHYzOHNFRnNSVmJEb1Fja1NUOWczSFk0eWFuQllWLXFtemUxUTBKaWg3TkdHS21pU000Z05kU0U4YU50bFh3OUduZ0RYa1hHYmlSNDEwZU1CVlFtdE43Y3hzblVJWmdHbUs4dF9NcEQzLXFTX21fV3RVekE?oc=5,1775264400,"Oprah Has the Best Taste in Travel Clothes—and the Comfy Jeans Trend She Loves Is Perfect for Spring, From $29 - Travel + Leisure","Oprah Has the Best Taste in Travel Clothes—and the Comfy Jeans Trend She Loves Is Perfect for Spring, From $29 - Travel + Leisure"
gnews,fashion trend,news.google.com,https://news.google.com/rss/articles/CBMipwFBVV95cUxPcVptTVh6eEV0NDExVGV3TFdQT29xMlJFMnF1bU00emtKNnhCQWlwN055M0ZNaGFRV0hsRHJ3YW5paGQ4WGJoMlpIa3JabU9RcGlIRVdvcE5rZjJGVVJnc3FPcC1hNmU1eU9ZVklQNEhLMU1xOFg0czJ5WDJrbXFJcC1iMURxVUVXRURpcjhXOWU5bEJKZW5VNzFXVVBMc2c1bUVVZlNydw?oc=5,1775304254,"Your Spring Reset: New Season, New Me - L'OFFICIEL USA","Your Spring Reset: New Season, New Me - L'OFFICIEL USA"
gnews,fashion trend,news.google.com,https://news.google.com/rss/articles/CBMihwFBVV95cUxQTERmVXlUR2VsVFdfZW8zSXlyRWJLTkNIN0NhUGVTS2h3eDN5aEdtbGdIZm0tNzFNU0pIVE5NaEp1bjBzSE5jUVNBYTZzMFVXaFlxUE5OcUUxcVlHWXRodndRVnNXRUc3VGlwTnJCTDczNnJNMDE1aGg1R3d5ZWNxemVFRnV2dUk?oc=5,1775304000,"These Are the Sneaker Trends Cool Moms in NYC Wear to Drop-Off, Butterfield Market, and Tracy Anderson - Who What Wear","These Are the Sneaker Trends Cool Moms in NYC Wear to Drop-Off, Butterfield Market, and Tracy Anderson - Who What Wear"
gnews,fashion trend,news.google.com,https://news.google.com/rss/articles/CBMiZkFVX3lxTE1mMmdfaXZYT2tyeUx5RFZxTUJvSWYxbWVsUkhVRzdWenZnY2ZGUzVwR3NURG9va1dHQU5VNU42ZTdzWTA1dFBzMXRxQzlTWVcwN08tVjFHOHFVTi1vRUNvb3R4TDRodw?oc=5,1775251500,11 Coachella Outfit Ideas Fashion Girls Swear By for This Festival Season - instyle.com,11 Coachella Outfit Ideas Fashion Girls Swear By for This Festival Season - instyle.com
gnews,fashion trend,news.google.com,https://news.google.com/rss/articles/CBMiekFVX3lxTE0wZUNOOEx0Rnk4UlJVRHJhSHRlbjFrT2JxX3RLdTdDdXpCTWUxSl9FRTRILXNQT29lVkNzWnJqd2F3cEhlUmoyV05kdEV6V2Uwa3ZuU24zVm00cjA4Z05wOC1FQlhjQUlZR19XWlFkamlLVDJENTVSYWRn?oc=5,1775113200,"If You Want to Dress Like a Fashion Person, These Are the 10 Things to Buy This April - Who What Wear","If You Want to Dress Like a Fashion Person, These Are the 10 Things to Buy This April - Who What Wear"
gnews,fashion trend,news.google.com,https://news.google.com/rss/articles/CBMiakFVX3lxTE9DenZITE91UVV1d1Q2SjhxX3NzeEZFbWc1RXRnckVGWnVHbFJNMjZSb0RyX2p6VkpMRkJvTnZMRnVWWUN6NVgzcmF0ZmFGbFZ4Q2JVMG9NNnBOUDRWRDhzTjdkRXRkRTRMVHc?oc=5,1773298800,7 Spring Fashion Trends — Thoughts? - Cup of Jo,7 Spring Fashion Trends — Thoughts? - Cup of Jo
gnews,fashion trend,news.google.com,https://news.google.com/rss/articles/CBMifkFVX3lxTE53a29XblltOGthU3FpbjJ2bVV5VmllNHFUNnEtS0hNQndqcUVCa1paRmNIMGs5ZzV5anVvVE5NVm9UZUU2NENkS2o2R1drSmVDZFVqc3Fzdks5NjhyTzdiTDdINHVWNG4xMGRFT1dJdDh4VUtKT0s2c2tQU05KUQ?oc=5,1775286000,The Spring 2026 It-Girl Wardrobe: 9 Highly Specific Things They're All Wearing - Who What Wear,The Spring 2026 It-Girl Wardrobe: 9 Highly Specific Things They're All Wearing - Who What Wear
