source,query,domain,url,created_utc,title,text
gnews,fashion trend,news.google.com,https://news.google.com/rss/articles/CBMifEFVX3lxTE9ndVBlLTlsYy1uTjJ3eWhmWXRPcHYyckpRM0hHMnJieUR0UnF5UGNjczZOTDNuTVI2Z3lIUEZpektKamtkdXEyY204dVlJQ09wVGpkTG5kM1ZibVpzNXU4MXNZSmxRZkpFYjUxQlJsdjVhNTFoTV9QREZodWU?oc=5,1763337600,The State of Fashion 2026: When the rules change - McKinsey & Company,The State of Fashion 2026: When the rules change - McKinsey & Company
gnews,fashion trend,news.google.com,https://news.google.com/rss/articles/CBMivwFBVV95cUxPYjhRVWo4Ykp4ZVZJT28xUll0ZUp2ZUVDaFV3Z3ZmYWxDMklzWEkwSXlVNW1RWHNFdnZ5Mnk2bzdvOWRlWkZBN0dPaDU5aVByTzNwbXBhRUduMS1MVjFsbkVORzEtVW5RTWhQZnE3eEpUTjVvc0hlam94RFpwV0htSDNoU1pEYWF6d0VjNEtNdXRCNHRucmgwY3psdWNGNF9zcDdtVkZIMHJaTXV0U1ZsUEp4ekZCSHdobnBBUUc5NA?oc=5,1763439769,"If you're over 50 and still wearing these 8 trends, it's time for a style refresh - VegOut","If you're over 50 and still wearing these 8 trends, it's time for a style refresh - VegOut"
gnews,fashion trend,news.google.com,https://news.google.com/rss/articles/CBMiiwFBVV95cUxNeW1DSElmcEViLWgzUUZ1LWlkUGtteV9UOXdFVGxXN20wSGN5cmxVYmpQTUNvVHVDQjBTZXo5YVB0cGswM0JqMUNHSzhhS2lNWFBoTkhCTFJvLTFEUG1xWGpHaDlWbHZHaXNaWURnWjZDd0lmc2xWZDBHRm5zbXc4OGhsbmc4UGNMdk80?oc=5,1763429700,A Stylist Told Me the No. 1 Problem She Hears from Clients Aged 30 to 60 — Her Simple Solutions Start at $19 - People.com,A Stylist Told Me the No. 1 Problem She Hears from Clients Aged 30 to 60 — Her Simple Solutions Start at $19 - People.com
gnews,fashion trend,news.google.com,https://news.google.com/rss/articles/CBMiXkFVX3lxTFBQODBtNm9OM1dtS251QkRINWVhLWdvWU1rQ0FJU1BycG1PY3VLaHF6dFZEeXB6YmZzNUZFRmJkUzVIODJzcTRDb2tpOW45blF4UklSM3Byd2xYT3NfdlE?oc=5,1763396530,The Boho Jacket Is Back – And Just In Time For Party Season - Vogue,The Boho Jacket Is Back – And Just In Time For Party Season - Vogue
gnews,fashion trend,news.google.com,https://news.google.com/rss/articles/CBMipAFBVV95cUxPSFhpeTlKMTRJUFpLaFFfWUF0NXB4YU0tYVhidkRfMU10blFnNW5uSnVMaENDWnpNaWY1M2lMemVxc3BkZ1NXYXFjWkJVcDBuWWtKMi0wVlFFVndJWUVndHRDdUNXbHBfcmNTVmVGSjBOMEhxbGtRYzVrdm44bmRHY3phbHlzSWVFUDhSb0ZCNzF0UEFoNUlvVDg2d0V1YkgwLVVxRA?oc=5,1763401551,"""Main Character"" Coats Are My Favorite Winter Trend—These 24 Are Currently On Sale at Nordstrom - Marie Claire","""Main Character"" Coats Are My Favorite Winter Trend—These 24 Are Currently On Sale at Nordstrom - Marie Claire"
gnews,fashion trend,news.google.com,https://news.google.com/rss/articles/CBMikgFBVV95cUxPZExYRndXa3BoNzIyeTFpeFduM1p6NmFsTFpySkx2TzVLMUIwTnpuelJWUUczaXo0bDlydHdDMC1QY2lCTVloTW82MVpaZFhrUDVOMWlUUFhoVHQydDZsaXVjdlhqTlVkd0dDcmxtYXdCV2JXLXBmUEx0bzFqYWZCaWZUeklESUM3eEV5WTNOaWhPQQ?oc=5,1763390070,I Just Got Back From Paris—the Chicest French Girls Are Wearing This Winter Jeans Trend With Heels and Boots - Who What Wear,I Just Got Back From Paris—the Chicest French Girls Are Wearing This Winter Jeans Trend With Heels and Boots - Who What Wear
gnews,fashion trend,news.google.com,https://news.google.com/rss/articles/CBMifEFVX3lxTE9mTmQ5a09BeGxUQXNuVExTVkZHVGRiVkhFMHhmQ0tWWm5vMUliT3EyRTZXZHFCNnlYaGhGXzNBLWY2REV5a2ZhdzEtV0tXOWdxSFdmd2hqSmMyZ0t2Zl84ZWlyVXhkeVVvZG5vXzQ2ajBQbjQ3ZWFDa0M2c2c?oc=5,1763446358,6 Fashion Lessons That the World Can Take From the Middle East - Vogue Arabia,6 Fashion Lessons That the World Can Take From the Middle East - Vogue Arabia
gnews,fashion trend,news.google.com,https://news.google.com/rss/articles/CBMiXkFVX3lxTE16MG5ZMG1CeElkbmlHT3k5ZWJ0UG42QlVocHpsUjQ2cVI0WWtqTXRpMHJDOFZjRGIwVVVTdEZmT0h0SWYwSnlxSEg3b3lYTE5EU3JHVVR1TmFtVXQ0RXc?oc=5,1763155012,2026’s Trendiest Sneakers Are Already Here - glamour.com,2026’s Trendiest Sneakers Are Already Here - glamour.com
gnews,fashion trend,news.google.com,https://news.google.com/rss/articles/CBMikAFBVV95cUxPeDZjSWFUNlBjOU5PZVJxYWhtdWhrcWx5ZGJDaG9LcVFmM1VzWlk2XzZOVUdQRlFZSm5HMk04b1M0VTAtOFJWWU94YkxfdmlOdGtYSEd2VUp0RmNOWDRyOGZuYTJGOVdIUENoWDVlcFdmS0lrWkVUZ0kwRElfcUdOaE9VdjNVY2RIZTRIdFI0Zlk?oc=5,1763383778,Gloves Fashion Trend 2026: Layering & Opera Gloves from Runways - nssmag.com,Gloves Fashion Trend 2026: Layering & Opera Gloves from Runways - nssmag.com
gnews,fashion trend,news.google.com,https://news.google.com/rss/articles/CBMingFBVV95cUxPM3FYM1lZMUVKdTNYaXFXa3RXQWNiLThHbzVMTDZ0eTRxZjZhQ2JHbHd3WUdpNmx0RC1wZllhQ2tYVm1xeWpkanpYbjVBNEU1Q0hmdDB1Q1lGdDFZeHdDSjh5c0YxX25sRzZOc3NULVg0VEdZWW9rSGhrQlU5aFNFMFdmWWpSM1E2UFdNNHcxTWd5b3RXdmZlWEJZSTBSZw?oc=5,1763122925,Winter fashion 2025: 7 trends dominating the street - Paris Select,Winter fashion 2025: 7 trends dominating the street - Paris Select
gnews,fashion trend,news.google.com,https://news.google.com/rss/articles/CBMiiwFBVV95cUxQVk9teUw5M0s1Z3dRcGp0cG5HZHBqcFViVkU4bVVidEl3dUUzZ2Fwall0YTRHZ293VEk0Y1hUbERNajZqZjh5XzZHaTZySXBndzFleXBMSl9rUzJWTlNSQi1OMGZXX2dsd1ZjR3NsWUpueWE0eVJCWXh4TXpZSlJLcC1OYm0tT2p0a0dZ?oc=5,1763413200,Gwyneth Paltrow cements the long black dress as autumn/winter’s most sophisticated occasion wear trend - Woman & Home,Gwyneth Paltrow cements the long black dress as autumn/winter’s most sophisticated occasion wear trend - Woman & Home
gnews,fashion trend,news.google.com,https://news.google.com/rss/articles/CBMioAFBVV95cUxQQ0dXMmJoR1JXVUJjb2Z6VDgyMTJFSjVMR1VtVEhjVk8wYTRzSGpIT01RYmRDbi0zcjZsN1I2WGlFMUFVVmZpR3N2NTFzYXJZMkdNQW1iTUpjY0NrUTJBQmZCdGhqSVJKc3VIZk5GcjhnY0d4ZWpZM1ZPYnRuaVlzWUc4Nm9IX3QwS1R6bzVycVdHZXBxcEk3UGFlUTl6TWxY?oc=5,1763384075,5 easy ways to style winter's biggest trends - Cosmopolitan,5 easy ways to style winter's biggest trends - Cosmopolitan
gnews,fashion trend,news.google.com,https://news.google.com/rss/articles/CBMiiAFBVV95cUxOVWpWVVVPY0JYWW5fcm5qRlpSRVRja1VFS2VNRXp3aGVud3QxUVdzTElqWHN4YUpKUEl1WkMyLU80TFlwQmpNQzNZcVFGWjFwOGFPM045M002cTVFcGdrVFctWENpSUo3Uk9WQXdibmNjQ05MNU50ME9wSkt3RFVva3dzNVFobUxJ?oc=5,1763160876,Korean Beauty Trends Are Going to Look Different in 2026 - ELLE,Korean Beauty Trends Are Going to Look Different in 2026 - ELLE
gnews,fashion trend,news.google.com,https://news.google.com/rss/articles/CBMimAFBVV95cUxNcV9vQlI1Slp6TDk3RlA5TkZMQ0VxRUw3LXItTmtoMk5YYUhRcW9aQklVRWtQSW05aDE1MHN2VThWR2ZhYlI4aEhSQnRmSzJ1bjdMdDRNWjZKRDVGMnRjd0xzQVluLTRqRmlTbWh4aklEZHI5akNPbC1PRk5hX2lZV2lBcy0tVWVYYW85T2g0QTE1elJ1ZG1kOA?oc=5,1763314371,4 Fashion Mistakes You Need to Avoid At All Costs - New Wave Magazine,4 Fashion Mistakes You Need to Avoid At All Costs - New Wave Magazine
gnews,fashion trend,news.google.com,https://news.google.com/rss/articles/CBMiowFBVV95cUxNVUlacHppODZTVWhwS1hKSE10bEZaeXJUTndFclg1N3Z3N1JOS2pkYVdza083YU1SRU5IYVhvc2FjUnY1bGtBdU0xTmF1V0dHdGF1a280YWNzV2VXcGpoeDNRM0ZYSjNLUmI2aHVSZkVvcS01RDd5bDdQQ3hrU2RKME9BTWdzM2doV2hFLXdKXzdJeWhNRlVDaG1tRG9pMWlOQWVr?oc=5,1763378403,Daring bustier dresses was the Governors Awards 2025 trend nobody expected - HELLO! Magazine,Daring bustier dresses was the Governors Awards 2025 trend nobody expected - HELLO! Magazine
gnews,fashion trend,news.google.com,https://news.google.com/rss/articles/CBMihwFBVV95cUxOQ0REcGhoX2pQZmpsaTVxd0x4ajI0TmpJNFdPdGJyakNWZjJBaS03M1lUd0UwZXV0cXVMYVc0ME9UeFJPbThPU3ZBT1dyRzBjS2pid3JGclBmMUMwVWFlVktZQU9TamlTeGZKbVlBN1NoUEJ2V29OZi04eUlGSDh3WGVlQVFpbjA?oc=5,1763277385,Is a Reform council setting a new fashion trend? - NewsBiscuit,Is a Reform council setting a new fashion trend? - NewsBiscuit
gnews,fashion trend,news.google.com,https://news.google.com/rss/articles/CBMiiAFBVV95cUxQU01kcDFBWk1PeVJRVEcwM2dqVGlaR1JiQmhIaG9NMTM5SktFcWdLR1o0SVBOVXlGQlV0ci1xWGYxMjlsUUIyemM2Nzg4WnVZT1JqTkJQUXZGU1dMczI5MVFJZzNUb01GT2JpVFNNV01Edjd1X1d3czAwQkwyYjFUS09jUXZWaERy?oc=5,1763103780,Redefining the rules of ‘mom style’ - The Guardian,Redefining the rules of ‘mom style’ - The Guardian
gnews,fashion trend,news.google.com,https://news.google.com/rss/articles/CBMikgFBVV95cUxOcV81R0doMHV5ci0yUDhUNU9wVFFhODJxcm9SeHZaNkJEbmdxSTB1QWxoMldWYmhIQTVxNVl2OEVmdHYyTkx5UXVUMTkzVWt1cjdzV1ZjQkdnUG5oODJ3QWFVUDNRb041UUNScGxwS2xwXzhuMFowVzZfRDQ0bTBVVkhwXzYxNlBHLTdxbDAxaEV4UQ?oc=5,1763234329,Lily-Rose Depp Styles Ugg Boots With a Chanel Bag for the Perfect High-Low Moment - Marie Claire,Lily-Rose Depp Styles Ugg Boots With a Chanel Bag for the Perfect High-Low Moment - Marie Claire
gnews,fashion trend,news.google.com,https://news.google.com/rss/articles/CBMiggFBVV95cUxQejBIaVlmWXIxMl81RGJlNjVJalhTcGpMYXdvOWxvalBlV0dFY0hiZXdSamJtR3B3Vkw4ODFDSEZfQXE5RUMyQ1UwZ01mcWkxdURoWVhCcFNPd2JfdENyXzdmVEw4WDdHYXVGR0E3TjVXLWR5bW9XXzYxYzc5aUJqaFB3?oc=5,1762156800,12 Autumn/Winter 2025 Fashion Trends That Will Dominate This Season - Who What Wear,12 Autumn/Winter 2025 Fashion Trends That Will Dominate This Season - Who What Wear
gnews,fashion trend,news.google.com,https://news.google.com/rss/articles/CBMirgFBVV95cUxOSnhCNVZWSFpoQWREQ0JSVXg4Y01Gd0JGVm9xLWlqck1hT1hLSGU0eERrZWZrWjZGeW5HZUtVcnlKeEVTSWtNdnQwWVdUZzRiZzBHUWVKaHBIaUZ0OEExQ0tObmROZzhzY1UzRWxMQTdpMjIzSkczcksxOFhGUmNJS3JMY1dRTXhMSXc3U1FVQUNKX0FTSnA1S0VCcW01RkJhNjJNWGlfN2Y5WlNIM2c?oc=5,1763313094,Jennifer Aniston Styles Her Classic White Sneakers With One of Fall 2025's Denim Trends - Marie Claire,Jennifer Aniston Styles Her Classic White Sneakers With One of Fall 2025's Denim Trends - Marie Claire
gnews,fashion trend,news.google.com,https://news.google.com/rss/articles/CBMihwFBVV95cUxQMXRRX2NkYmtiamVJUUxyc19jUG1ZejY1RkJXU053WkF6blNFbmlzbWtiS0ZJVXBFRTN3WXJZMXI1VE0tNEU3TEhRQkJXRURIQlRYZ2RaOVo2Mk9JRDZCWGk0WTB6Z2VDU25oR2hKb2JMaFQ0M2hvTlJCdHZUNGJFb09LYmJBWFU?oc=5,1763377867,"5 shoe trends you'll see everywhere this winter, and the best brands to shop them from now - Cosmopolitan","5 shoe trends you'll see everywhere this winter, and the best brands to shop them from now - Cosmopolitan"
gnews,fashion trend,news.google.com,https://news.google.com/rss/articles/CBMiXEFVX3lxTE94UExZZTdrSE1TWUx4cDc5aXV1cUxIb3FpZzhrN2Zwb2hIakV1aE03X0ZiVXU0SS1pZDRma2RheWd5b3NaZHdDWXJTTFg2NmxacFRKUjA2TUU0aVNN?oc=5,1762066800,Granny Print Is the Next Grandma-Inspired Fashion Trend Emerging in 2025 - glamour.com,Granny Print Is the Next Grandma-Inspired Fashion Trend Emerging in 2025 - glamour.com
gnews,fashion trend,news.google.com,https://news.google.com/rss/articles/CBMikwFBVV95cUxQZTU5eGVDMEZ4QVBiVHdWZ0E2YV9fVXRnZl9JeVpLR1NPYTJkVnJpU3VrZmNIcFE2VnhyaHRJWEZTelpXS0lBQzU5NDdwU3kxOGFZTzlOM0RZZG5LbHN5ekJqZzB6YWs4QUw0Tm8zemFCNWExRWdUdm1hTjBpX2xrTTQ0QnI2NndBWWFqVVdDZWVoQlU?oc=5,1763302895,"In New Trend, Black Men Are Ditching Tracksuits for Quarter Zips and Calling Themselves ‘Young Gentleman’ - The Root","In New Trend, Black Men Are Ditching Tracksuits for Quarter Zips and Calling Themselves ‘Young Gentleman’ - The Root"
gnews,fashion trend,news.google.com,https://news.google.com/rss/articles/CBMiakFVX3lxTE50dGFsZm1wZ3RiNkdjYV9scTdZOGZjNlQ2dmtfTEtxQUo4MGRWLXJ6RGdWcjJkckZCSVBkamhqTHVEV1Y1ZlROMmVzSkpxeUNuam5pemhTSDVTNXBiY2lzaHRiRzFTNHR1YkE?oc=5,1763149731,"Jessica Simpson Wows in Black Cut-Out Dress (Plus, a Polarizing Y2K Trend) - PureWow","Jessica Simpson Wows in Black Cut-Out Dress (Plus, a Polarizing Y2K Trend) - PureWow"
gnews,fashion trend,news.google.com,https://news.google.com/rss/articles/CBMisAFBVV95cUxNVWhHY2R4czhLOFE1QjVySU0yZktsUVBNU3d0aW1NUjlBd2ttNEtjOHd1TjU5Q1RiRzVuS05EeUlDN1VZQTZmaDRNLWV6Zmt6ZV85RVV0NHNLNjNCYjh5LUdqSjZuQzNNcjlhZG9SMWppdkY1SWVZOHlhT3hheGYxazBDcFV0bzJFeld2THpNeXlyam9Vby13RUVWZWx0NWxaajdsdTlWZWN5WVdsWi1TNg?oc=5,1763136058,From the Archive: Tracing Tartan – a Festive Fall Favorite - WWD,From the Archive: Tracing Tartan – a Festive Fall Favorite - WWD
gnews,fashion trend,news.google.com,https://news.google.com/rss/articles/CBMihwFBVV95cUxQQk14UDBhb3pyWXJzLTZxQU5ZdDJmVjdLc21BcWRqRVpUdkoyRVBLUHN2LVc1LW43Rl9WZWRBTnRGQ01MYWJqUmhlTTBaUkxJaHZiNTRjaG9SM2NwT0YyVnphdzI2YkNHZHc1V3ZteE44WURzQ1VJNDdrbEdERTdSUF9fQkg5YkE?oc=5,1762329600,Fashion’s It Girls Are Already Wearing These Spring 2026 Fashion Trends - ELLE,Fashion’s It Girls Are Already Wearing These Spring 2026 Fashion Trends - ELLE
gnews,fashion trend,news.google.com,https://news.google.com/rss/articles/CBMiiwFBVV95cUxOU3lPSVJ1TVRfR1ZRVEpiVUpNNkNNQkpzTk5RNS1wZldzVkRnVGg3cmMzZ1o5NkpPTnlLVnlLWUZobEs4RGJRVFNiWWZNbndWeDU3WmFQOGprcGpTcmxCbnRoUkRhS0EtbE1yanE0REI2cGZaX3J6WVBHUmU2RENsVWJ5a1ZLU29fUHRj?oc=5,1763075025,What Gifts Do Tween Girls Want This Year? We've Got the List. - Cosmopolitan,What Gifts Do Tween Girls Want This Year? We've Got the List. - Cosmopolitan
gnews,fashion trend,news.google.com,https://news.google.com/rss/articles/CBMikwFBVV95cUxNNHNfbmpvSUpTeFMyTkFJci1GUG1icXZDMkxDbzB6OFN6Z2YxcVRiTXFYMTdmeHNQbThpM3dEaGE3MFM1bjV5T205UVY4bEFlYWprTC0xc05pb2tKQkxVbzlsU3BTcnV6Sl9uYTdzWm9iQTJNbmtKbHJLbXBjS3FINEU0ZWswSGNjelZmOU9uMzdfMXc?oc=5,1763352405,Retail Trend: Area 51 Merchandise Surge Leads to 400% Increase - Meyka,Retail Trend: Area 51 Merchandise Surge Leads to 400% Increase - Meyka
gnews,fashion trend,news.google.com,https://news.google.com/rss/articles/CBMihAFBVV95cUxOUUVBUEVDdTBUdmxjWWtFNzI2TFAyX2NTNEI0M2pya2dfOURnb19MRTBONHpLalNNb2pHcG13T0FhVGR3bTRRbDhoUEtpX2RZclFWQXp3U3dFbl9DTVRFTFJVMkwtemFnYi1FeHhVUTJpOGo2a1BPZkIyOVdKaEZHYnE0UWs?oc=5,1762156800,The Winter Trends to Start Wearing Now—Before the Mainstream Catches On - Marie Claire,The Winter Trends to Start Wearing Now—Before the Mainstream Catches On - Marie Claire
gnews,fashion trend,news.google.com,https://news.google.com/rss/articles/CBMiggFBVV95cUxNZlVCdGhCbkZGWnVrT21YaFdmOHlMbGpOLUtlWHBlbTRFbDd5a1RlQk5YckJtNC1Jc3lOTjVlYVdCbDNRYVdFVE44eFlUM3dzNkVtUDVTUlZGM3MxMmJWUE9qVHFPamcxdWlURlhyV3JRVW9sMHNwejRWdXNTZVJ3S3RR?oc=5,1762329600,6 Fall Fashion Trends That Are *Actually* Wearable - Katie Couric Media,6 Fall Fashion Trends That Are *Actually* Wearable - Katie Couric Media
gnews,fashion trend,news.google.com,https://news.google.com/rss/articles/CBMiZkFVX3lxTFB0ekVfb2tsSUlvYVpYTXVhanMxUE5yc1g2bWdBdVZhd2NreHR2cURZbzZWVVFySXI1TUs1MVBpajFnanVOUUJ3eDNjX19INEZFM0hneTNvVjFOWDN5cEx3ejE2cFprUdIBa0FVX3lxTE45clVuYVplcUZvY19zTzBIOU9kdTRsYlVFY2hILVJPYjJJRFJOZEFhSlRENE5iNld5cDBtS2ltZ083SkNEX0xIVWVpWi1oU2NpaXY2OS1OdXJUMkhZTVdEdkt5dmJRTGdfMGkw?oc=5,1763151063,Daily Style Accessible Fashion - Trend Hunter,Daily Style Accessible Fashion - Trend Hunter
gnews,fashion trend,news.google.com,https://news.google.com/rss/articles/CBMiggFBVV95cUxORjgtLWdCbHJLU01xZ0ZQSjlFTFB4b0pCcldoMkdqZDZFeldRWEpmcXFORzFtRURRYUxtZVM4ajEzd3JpY2tTZ0pOczBzQ2hCZDc5Z2dXcnlUYTZHMGE2T3VKSGVhanlueHFmLW1mMnIyVFB0dTc2LU5OZ2l4TE9NU25n?oc=5,1763197200,"Suddenly, Cigarette Jeans are Popular Again—These are the Shoes That Make Them Look Cool - Who What Wear","Suddenly, Cigarette Jeans are Popular Again—These are the Shoes That Make Them Look Cool - Who What Wear"
gnews,fashion trend,news.google.com,https://news.google.com/rss/articles/CBMibkFVX3lxTE9YMmhvMHJrUjVESFhCaE5DeUtlbVF2bkl0MTAyeTlSd2V4bEEtTFN3MFdHcU5hQURBamx2UkpJNDdpUU5ycFA4V1ZNWlo0aVl0OXJ0X0lRbU9jcUZocVZqMEdIM0kyaFFseWVXMTVB?oc=5,1762329600,10 Fall Trends GQ Staffers Are Shopping Right Now - GQ,10 Fall Trends GQ Staffers Are Shopping Right Now - GQ
gnews,fashion trend,news.google.com,https://news.google.com/rss/articles/CBMihgFBVV95cUxPVElyYnB5eVR5OHg3ZEtxMkQ1dE14N2ZIQ1p5b3FQbnRWY0tpc19wVC1kZlJnLS1iRmxROWpIZjloX0RtV0tCLThVQkpLZkk0X0tMSF9Tc2Q0SzQzMlBRR28yeEczSjVlR2lTeGNmYi1US2Y4N3NSWHp6NmhRajFpbUZVSlBPQQ?oc=5,1761548400,I Can't Stop Thinking About These Runway Trends—So I'm Making Them My Own This Fall - Marie Claire,I Can't Stop Thinking About These Runway Trends—So I'm Making Them My Own This Fall - Marie Claire
gnews,fashion trend,news.google.com,https://news.google.com/rss/articles/CBMiekFVX3lxTFAyeTV1elphQ19BUTBHOGdJTWpoeW1idmZDdkx3QjJ6NEFqbzN1V3JmTG1VbTNRcHJlOVlsN25ad0c5b1BLZ0phQXV0S19PNGtFa2xCck9tWWtvNzU1bk80NVhKNmZDWmJEbzE3OTQzRnJ5aHZoczVENWJn?oc=5,1763413559,The Best Latex Fashion Brands for Newbies - High On Films,The Best Latex Fashion Brands for Newbies - High On Films
gnews,fashion trend,news.google.com,https://news.google.com/rss/articles/CBMihgFBVV95cUxNaVBySmRXRTczOG9WNkpiZWZmOVNhVlhRZS15Sl85Uk9hSmhsUmVSam9FakpXNVZ4Y2xiU1lvS2ZtZmR4OENMQTVSU29HaHRzMkw0aklNN0xrOGJPZVBKdjJ2STQydEJsTkQxWG5ENkpaZ2dyNXpSWFBTaUNqZXNCSXhWSE1TQQ?oc=5,1763444617,Bella Hadid Sheer Dress Ignites New Wave of Transparent Fashion Trend - Zoom Bangla News,Bella Hadid Sheer Dress Ignites New Wave of Transparent Fashion Trend - Zoom Bangla News
gnews,fashion trend,news.google.com,https://news.google.com/rss/articles/CBMigAFBVV95cUxPaldEalFEU3k2cFNOOHRLVGhadjFjN3hjOFdPTFh1LVl5aEJoQ1ZlRHp1RHU1LVpVanBOdGFQSWJ3NC1QMmJkb1JsR2oyYVJzaFc5VnN4V2R1cVl5Y0p6UnYtV21HZDRaWGxnYkhkY2dyem4yQkI3MjNXdnZJSGZabQ?oc=5,1763199000,"All the Coolest Women I Follow Are Wearing This ""Dated"" Shoe Trend With Jeans, Dresses and Skirts - Who What Wear","All the Coolest Women I Follow Are Wearing This ""Dated"" Shoe Trend With Jeans, Dresses and Skirts - Who What Wear"
gnews,fashion trend,news.google.com,https://news.google.com/rss/articles/CBMibkFVX3lxTFB2akVOU01WUXRzRUk4MGc4ci1wb2JhOTk2T2hQdk9JN2xwMjN1cjZyLXRKdDBMbGFpMWNTVXFBalpMcGY0SXN3TW9mNU85WHRfNnFxWlJLTkota3lmYy1CbjZWc1ZiekVmTmZSeDFn?oc=5,1761721200,15 Spring 2026 Trends You Can Already Translate Into Your Fall Wardrobe - Vogue,15 Spring 2026 Trends You Can Already Translate Into Your Fall Wardrobe - Vogue
gnews,fashion trend,news.google.com,https://news.google.com/rss/articles/CBMimAFBVV95cUxPc0x2VXpkX2luMExyd2tvTWdhQ0FDUjJSYWlxMVp0Zks5bUtmbG9aVFZWc2xVR1QtcERkOGpJRVZHRF9nLWlPZVhGV1VuLWU1aTJoSHR3RmFOOXNWdmphVTR4R3M0M0F0VFJ3bjByWUV3OGdXblBIdDhKUEtla3V3V015U0x4YzdmRUtTZmVjWHh2Z3NiYTA3SA?oc=5,1761289200,"12 Fashion Trends That Are ‘Out’ for Fall—and the Stylish Pieces You Should Wear Instead, From $18 at Amazon - Travel + Leisure","12 Fashion Trends That Are ‘Out’ for Fall—and the Stylish Pieces You Should Wear Instead, From $18 at Amazon - Travel + Leisure"
gnews,fashion trend,news.google.com,https://news.google.com/rss/articles/CBMi3gFBVV95cUxPQkZhOXo0cUZZWnpQUXhLWnB4cHhydTNGaDJTU2c5TE8xSGdVRlJSbXNENzRieUMxUkItY3ZjbUdaVlRoWGkzUDI3cElKbjF5cEhWdzBqeWVtdVFMZURWel9YU19yaS1NNC13dHdBdm5iODVVdVN2LVg5UmRzSVRxMGhWc2F2UWwzSTd6R3o3OHQ0MVZONUNJendIZGNJaUJ1Vkc2a19OSU1WYzFIWURxRVlhVzhocy0yZk52dE01QkxlVGpUTnFvZjJDUmNYcmxkSjBWZ0swNk8waFFRakE?oc=5,1763359660,British fashion retailer AllSaints seeks retail technology enthusiast as Sean Trend takes on CFO role - Retail Technology Innovation Hub,British fashion retailer AllSaints seeks retail technology enthusiast as Sean Trend takes on CFO role - Retail Technology Innovation Hub
gnews,fashion trend,news.google.com,https://news.google.com/rss/articles/CBMikAFBVV95cUxNN1BxOVZSTDNYTDJuVU1iYU1md0QyY0ZfZGNBOS1VTzA3U2V3bElzNzhfWlA3dmZacWVVcGtjV2JYRm54djB0ZTIySjBpQnU5eFg5Z3BOSUw2Sk5nUjFUR3JfUjRneGtTMlRTSDRkNDFHajNrR0lhWHhGOFU0bVZ6U0FBcHpIS0FhRmJKSGNVZ04?oc=5,1762502400,TikTok Turns Bull Nose Rings into 2025 Fashion Trend - AGDAILY,TikTok Turns Bull Nose Rings into 2025 Fashion Trend - AGDAILY
gnews,fashion trend,news.google.com,https://news.google.com/rss/articles/CBMigAFBVV95cUxOcThXX2FoMGh2cTVFWmRyWU5hekhCMlB3bEwzMjFIM2xXeU9GVU12NzM3X2o2VlR0WEtqUnRKRUpZUkFXSE9McWhYeXJrZV9tQnJrUkVabEFoOTdLSVkybGwzUUt5VHVsQkk5Y1RYYzQ1RWNVdG9Yc3BvMHlIV0xuZw?oc=5,1759906800,Spring 2026 Fashion Is Running It Back to the '80s - Marie Claire,Spring 2026 Fashion Is Running It Back to the '80s - Marie Claire
gnews,fashion trend,news.google.com,https://news.google.com/rss/articles/CBMiZkFVX3lxTE5LaUlMc1VCNXJ1QUlBX0JXOFNJWkxFVVRHRGQtVGZJSGdUM19za24yWWhsaUx5dllfRjd2cDNqdE5zRHd1ZXdHSXhfZG83WUxGa3RCWHpUZGdHWkN0VnF4MXNYZzRudw?oc=5,1760943600,Fashion’s New Obsession? Clothes That Swallow You Whole - glamour.com,Fashion’s New Obsession? Clothes That Swallow You Whole - glamour.com
gnews,fashion trend,news.google.com,https://news.google.com/rss/articles/CBMikwFBVV95cUxQNWJGS3ZBNTB6NjJmMHE0dTRoRDlLTEIyRzQ0ZzV1cVF6Z0tiTVJyWWJSc0FiU2pGT0RnbEV6TkQ0U2RhR0VvemZMZGhmUjc2NklHSzRFR1I0czkzWE1OR21iMmVFYV9Kd1Rjb1JWWWIyM0RoZ3ZoaEpqR293SDJ0aXhZbGcwa05aQ1IxSjFGRzlTa0E?oc=5,1763222400,"Lily Allen shows just how easy it is to style autumn/winter’s biggest colour trend, she looks so cosy and chic - Woman & Home","Lily Allen shows just how easy it is to style autumn/winter’s biggest colour trend, she looks so cosy and chic - Woman & Home"
gnews,fashion trend,news.google.com,https://news.google.com/rss/articles/CBMibkFVX3lxTFByR2cxRHZOVHNNcFZBcXVhRlNZV0loRzJXdklLRElqNXF0WFlvYTRpR0RrUHkxVjBFRnNscUx2ZnA1X1hEYTVBc1dIZ2RuSDJ6V0o2cjlIb1lHVkJXQjJnNW4tTlpWVUJoa1pJUE9R?oc=5,1759906800,The 11 Key Fall/Winter 2025 Fashion Trends You Can Start Wearing Now - Vogue,The 11 Key Fall/Winter 2025 Fashion Trends You Can Start Wearing Now - Vogue
gnews,fashion trend,news.google.com,https://news.google.com/rss/articles/CBMieEFVX3lxTE9nc2ktNnQxVzlMTjl1MjR5MFYwSkMtVjI1Z0VhZlBLU0JqVlBjdHUyejJCVDV3OE9xYmF3ckhxR2VXLTk1Y3ZScXZfN0VPSU1ManFXYmFUWWxKTDN6cjFXTzk2OGxSVWxDOHIyeXZmRG9jUktfd2FIMg?oc=5,1761202800,The Vogue Business TikTok Trend Tracker - Vogue,The Vogue Business TikTok Trend Tracker - Vogue
gnews,fashion trend,news.google.com,https://news.google.com/rss/articles/CBMifkFVX3lxTE52dTVmdHJ6Nzc4QXpnY2RDUUVWQ2Z2ZGtYYm9sVmV3ZktCOVFUbFphZWZNc2phNC1CeEtDcDd2Qi1XZjU2a0ZxQ0JVNFNjMWJEcWEzMzdZeXVuTDhhNGxKb0dPZEw2ZkNkNE1VUXZpVG03a24tZklxcjM3bE03UQ?oc=5,1759820400,The Best Fall Fashion Trends to Shop Right Now - Harper's BAZAAR,The Best Fall Fashion Trends to Shop Right Now - Harper's BAZAAR
gnews,fashion trend,news.google.com,https://news.google.com/rss/articles/CBMicEFVX3lxTE5OUHFIc094WDR1c3IzY1RMMFJQcFZWVjBiVU83NnMtd2JITTZ5THJoOHBONlZrTW5FYlNpUk1TQWE4OEtHSEZOQm1GVVExSk45d1U0M1hNbnBiTjN5eVkzUnVXM2d2ZUJVNnRVUXkxWU8?oc=5,1760684400,The Biggest Spring 2026 Fashion Trends Allow You to Choose Your Own Style Adventure - Marie Claire,The Biggest Spring 2026 Fashion Trends Allow You to Choose Your Own Style Adventure - Marie Claire
gnews,fashion trend,news.google.com,https://news.google.com/rss/articles/CBMiYEFVX3lxTE9IeXVaWGVDWTdZbkYtOFgtMlNFbTh3bWFsS1VxRTBGcURQWnhENDBEOXZSbW00YXhMSUE5RV9LVVdBci1IcHpIMXpPZHRyNzk4Y0RnRUp3N21TbzRxMUNVaw?oc=5,1761807600,The Top Fall Shoe Trends to Know - Vogue,The Top Fall Shoe Trends to Know - Vogue
gnews,fashion trend,news.google.com,https://news.google.com/rss/articles/CBMiZEFVX3lxTE9KZjRhRnlHZVJ6REd3MjkxSXQxRnMtRXRHd1dFWUxwdWlJZWdfQUh3LVhIZXRpMjFnQ2NhVFlfSDQtMkJyaTFWQ3QxQmxqd2g0LXE2OHVSV2lWa1dKUFNDdGlHNzU?oc=5,1759820400,15 Fashion Trends To Try Out in 2025 - Teen Vogue,15 Fashion Trends To Try Out in 2025 - Teen Vogue
gnews,fashion trend,news.google.com,https://news.google.com/rss/articles/CBMiogFBVV95cUxNSUZMTVBIY0JxMjVEMVFQajhxREhtOGRYb0l2S0kwenpYV2Vfb1paZmJZTGQ0RkluQUt3Y0J3TWt2OFNoR3JRNl82Zm0zdWhOMXlsNEdpZlhVMmNYdXkwVGYzTnk5bEFFd0Q0TWo3ZlFneS1lSllBUEluakp6WUEwOEdseWRxV0daaWNmcjlValQxWFlsSjJmdVp3Tzd5LWVpbkE?oc=5,1760079600,A New Fall Color Has Entered the Chat: Burgundy—Here’s How To Style the Wine Red Trend - E! News,A New Fall Color Has Entered the Chat: Burgundy—Here’s How To Style the Wine Red Trend - E! News
gnews,fashion trend,news.google.com,https://news.google.com/rss/articles/CBMilwFBVV95cUxPQVpUS2M4Z3hOcGZFMkxaU2w5eFRvSzV0dnFGbmxzZ0Q1TlFoVWxlMmhWUVBfeDR5ZUJmUEI3dVBZVlEtek5FUncxakV3cEVVc3hzQmx1VkFtanRMR0c1X205b2ZRVHFZMzVLOE9Ra1QzbzJNc2pTVUpwNFVGOFVXZzhzbkRCRVpNbEpIQkIxVEVkNHBFbTdR?oc=5,1760684400,"I'm a Fashion Writer in NYC, and Here Are 10 Fall Trends I’m Seeing on Every Block—From $22 at Amazon - Travel + Leisure","I'm a Fashion Writer in NYC, and Here Are 10 Fall Trends I’m Seeing on Every Block—From $22 at Amazon - Travel + Leisure"
gnews,fashion trend,news.google.com,https://news.google.com/rss/articles/CBMipAFBVV95cUxQbTVXdmktV0NQOUE5azRoY0ptb2xOVU0xeDNxUzMzT0dxclpzMDhtSWoyYlJzN2VFOXlxWmQ4QlhlUkhKeGJSR202ejd5ZWtMNDF4TFJKamFCLUtsX3FKV0phSGVuVVo4RW9sbE1FQmJsY2ZuYzZ4bDMwb19xdENENkVJR2U5VkpOeFZnQTFmZVQzTFF0bzZjQnMzbS1FWGYtTEhGYw?oc=5,1762959513,This very old-school fashion trend is back — and even Kate Middleton is wearing it - AOL.com,This very old-school fashion trend is back — and even Kate Middleton is wearing it - AOL.com
gnews,fashion trend,news.google.com,https://news.google.com/rss/articles/CBMixgFBVV95cUxNRXVwMkFWT3J1b29tR2U0R1l2U3U2N1Z1THd2QlhZV2FKWXJZQ3VZYUVJSXJKaE9YMGRGcTFBdFpKNXhESGhuTXhNaVRIbUtYZmdmTDlMckxtenRjT3Q2LXFzTl9OUklvVWNuRUU2cFBSVzdMWnVmWTh6V2Y2M2JUcmVqcFA4Ym1XZXI2SkpJWjhkZXZEdTRoVHo3SHVOR1hCcktJZEM0clJJNnRrNHphd3gzeE5sOFhpcUNJY3pBaEVOUEhzeVE?oc=5,1759734000,ARE SKATEBOARDERS STILL SETTING FASHION TRENDS? A CONVERSATION WITH STREET NIGHT LIVE - Jenkem Magazine,ARE SKATEBOARDERS STILL SETTING FASHION TRENDS? A CONVERSATION WITH STREET NIGHT LIVE - Jenkem Magazine
gnews,fashion trend,news.google.com,https://news.google.com/rss/articles/CBMiakFVX3lxTFAzazl2Zy14clhRbzhYRzY5aFEtdnJkMURla3djYTFuWFRnaWdsLXhTUHI4Y0NZWEYzVUkxRHF6XzlQYWFTMmxPMEV3eUNfajFDZjZrUG5CaUhUdlpxOFJsaHJxMnBUUXVsV3c?oc=5,1761289200,Dark Romance Is Taking Over Pop Culture—and Our Closets - PureWow,Dark Romance Is Taking Over Pop Culture—and Our Closets - PureWow
gnews,fashion trend,news.google.com,https://news.google.com/rss/articles/CBMimwFBVV95cUxObzA3T1laRTZqSTZmZnFuY3hXQjg3dWtkeUJVb1hPTFE4WEpnMjRDSTJKM0gwbkJROEJpamJhS2pHemkxSnpwN0ZJWjZmT1RXNnZCdFNndFBlVjhZdjItVDdjUHNjSDZIUk9JZGs2REhCWmRSMGJ3YTA0alRUSnZneWFadEhlZzQ2ekFxUDJVMlBiYmJ2RV9XTFlMRQ?oc=5,1760450784,Layers with texture are this fall’s fashion trend - Golf Digest,Layers with texture are this fall’s fashion trend - Golf Digest
gnews,fashion trend,news.google.com,https://news.google.com/rss/articles/CBMimAFBVV95cUxNZzZJLUczUWJvakJiRVU2YVhGQzRRRTVPeFZvcDBqb3ZpNF92bEw4b1hxQ3NWMm92WTBsQms5S3gybzJRVXNvMnlPZE9DelczLVlXOENTalMwX1pXYTlBTndhVFVhRWRNY3hrOEJlYkFfVkhMS1EwWHJUMTYxSzlPV213UmNZYjh4enk1cmxmQTVZX1RELTBrWg?oc=5,1763402009,Ditch the Christmas jumper - the new trend shoppers love & prices start from £8 - The Irish Sun,Ditch the Christmas jumper - the new trend shoppers love & prices start from £8 - The Irish Sun
