source,query,domain,url,created_utc,title,text
gnews,fashion trend,news.google.com,https://news.google.com/rss/articles/CBMibkFVX3lxTE5CM3piS2ozQUR0MmJwbzA2T3ZINGJLLUNocUVJNkR4emlQTkJBcXE5T0J2QTFFcUM5UGZVVHdoelU2RlBRaXVNaldGWTI5T0c3ejdzdHdObnZHQzdNUzZiSjRCaUxuX2w3YllCWFpn?oc=5,1772092800,"'90s Grunge Is Back, Plus 8 Other Fall 2026 Fashion Trends to Know - Popsugar","'90s Grunge Is Back, Plus 8 Other Fall 2026 Fashion Trends to Know - Popsugar"
gnews,fashion trend,news.google.com,https://news.google.com/rss/articles/CBMioAFBVV95cUxNUUROSmR0MFFMUUg4NFNuYXJmNHd1cEs3N3QyektXRHNDRTVlU3l3Q1FXd2ZoMDRidzRYam5hZzdpd0pnc1A1UkhHRXp0RTZGOUxxNTJlSjBGbFRaNlk1ZTNxelpKSkRTdWFkb2ltNWRjSUNVZE1YZExCQ2F3Rlc3czBGR0w5VE4yZl9BbGdDLVBFalJtU2swWXAyTHJOZHRQ?oc=5,1771401600,Let Fall 2026 Model-Off-Duty Style Be Your Winter Fashion Inspiration - Vogue,Let Fall 2026 Model-Off-Duty Style Be Your Winter Fashion Inspiration - Vogue
gnews,fashion trend,news.google.com,https://news.google.com/rss/articles/CBMi6AFBVV95cUxQNnRlRTFPWFJ4Y28yYVRJYlZQOHFDSk1GdjlOY0N0ZHpROE16MzJaQTd4QXBwZ2VUVEphdzhJc0Fsb3VXWXdzeVhNZ29sazN2YS1QVEJCZld1M3U0cS1rcWtiX3BkZF9jY094NVd0UTk4LXdrbmFlYVB4am1QUV8tWUE1UXlscnJWUF9NQXZHbFVNSzBlYWFLTlhuM2k4dTVXbElVWXQwRVBBRTlwVHFiWU95azVYb2p1c2gyZ2Q1U2kwRUlKMkg0b09aQ0tEZnhZc3hKZ1JVWEJZcjI0RE16dzAyNmFJUm5o?oc=5,1774292906,The 'rich mom' style trend isn't going away anytime soon. Here's how to get the look for less. - Yahoo,The 'rich mom' style trend isn't going away anytime soon. Here's how to get the look for less. - Yahoo
gnews,fashion trend,news.google.com,https://news.google.com/rss/articles/CBMifEFVX3lxTE81SE0zajljR1UtaTZrSFFlUktvREVlM3BPc3lNYm9VTUl1dmJKcjItR1JJOFJZYnZ5ckxxZkZxUklTUGtvcWhSY0Frb3ZBOU9Bc1NCdE1qZXh2X2lnNjUxWExsNWtHQjdvRHlGaFExbjVnZVV0b0FNUFhscS0?oc=5,1772524800,8 Spring Trends I'm Glad to Part With and the 8 I'll Be Wearing in 2026 Instead - Who What Wear,8 Spring Trends I'm Glad to Part With and the 8 I'll Be Wearing in 2026 Instead - Who What Wear
gnews,streetwear trend,news.google.com,https://news.google.com/rss/articles/CBMiowFBVV95cUxOdGttVEFyMEx1SGJuOVV3eUxpSGhDWDhPRXZucDFQRGhIYnlNWXFCS0JEY1drdXgwejNlVHNNcVY2LVVkWkxwVm4tdWgxSHM4b3U0eXpCTWdhOGh0X2ZrcTQteC1ZTDB0anV3M3B4dkVQMThxZmxRRTlnZl9neGN0clZTY2JtVzVjUnBwa1lfWlg2djlmXy1qbi1QVWl6azRTQ0lN?oc=5,1773872603,Y2K Beanies: The Retro Streetwear Trend Making a Huge Comeback - OCNJ Daily,Y2K Beanies: The Retro Streetwear Trend Making a Huge Comeback - OCNJ Daily
gnews,runway trend,news.google.com,https://news.google.com/rss/articles/CBMiYEFVX3lxTE1MaHZlVFBNaEZTcExQSW51TUhsU1N5S2t4TzQ2em5faTAzTm9aejA2cGJKYkJiYkFqNUFiSUxOY1c3MDA5M1NUcXo3aXkzTjk4bG5YLXI5bTdJbFl4UzB3Vw?oc=5,1774042167,The Fall/Winter 2026 Runway Trend Report - Coveteur,The Fall/Winter 2026 Runway Trend Report - Coveteur
gnews,runway trend,news.google.com,https://news.google.com/rss/articles/CBMiZ0FVX3lxTFBfMUwtMEE4aVM3YmI5VGtkZ2dleVFxTWxzV2tzbHpySDdJQ1dSUnFuRmFpdGo5VVRVbHAzOWc3TlRyQ0ZReW1DSTlSYkljczRDdXBTVTVBc2c1UmdfbnNvX2ZwOHpwVVU?oc=5,1773948810,The Key Spring 2026 Trends to Add to Your Wardrobe Now - Vogue,The Key Spring 2026 Trends to Add to Your Wardrobe Now - Vogue
gnews,runway trend,news.google.com,https://news.google.com/rss/articles/CBMieEFVX3lxTE9jd0hIdjAwVnhPN1dJWVBVODhsUGN3dU5Nbm9yYU5vYVNRR25fdW8tZ2hhenZiR2NmZ1JiQmFJcVpnVS05QlNCQUx2YTZpdHhPTHUxOVRLSkdoQXVYVzdmX3RXTGd1XzU2eTZvLVBkd3JYejI0Q1lwWA?oc=5,1774080300,Here's Why the Riviera Fashion Trend Should be On Your Moodboard in 2026 - Who What Wear,Here's Why the Riviera Fashion Trend Should be On Your Moodboard in 2026 - Who What Wear
gnews,runway trend,news.google.com,https://news.google.com/rss/articles/CBMif0FVX3lxTE1rV1BQTHFRNjctMVp6MjMyLUk4WUJsRzU5S2dKa1J2NmdfWjlDcDVKMi1pcVNvN1ltTE9FVVJaYmR6aHVVMXhsX3pjel9rSEtrdkdOM1ZrME10eGtqTGdfNjBlR3dwMDVaMkJjcDNfM2UxemtUa0hYTndDYTRuTjg?oc=5,1774015184,RIP Quiet Luxury: FW26 Wants to Be Seen - hypebeast.com,RIP Quiet Luxury: FW26 Wants to Be Seen - hypebeast.com
gnews,runway trend,news.google.com,https://news.google.com/rss/articles/CBMia0FVX3lxTE5ia3VCRGlDOVVJU1QyX3BMQXAxeVlENjJVVC0wdWxncXlLZzdoajFpTk5XWTFzLVR5eUVSRXZqTy11Y2RaWU1ZUWIyWlI1b002YlRMaDFuRmpQUldaRFdNd2I3cmlSUGJxVDU4?oc=5,1773917612,5 Spring Fashion Trends Everyone’s About to Be Wearing—And How to Style Them Now - Camille Styles,5 Spring Fashion Trends Everyone’s About to Be Wearing—And How to Style Them Now - Camille Styles
gnews,runway trend,news.google.com,https://news.google.com/rss/articles/CBMijgFBVV95cUxPU183ZVNLUWVPRXZyclVwcFZCcmN0LUZPUVhBVUhmN1JLUUlWdnZ2VWR1b3BOMENUT1hPUnpBc2k0cThxbTVqUkFRV0MtdzIwM1Y1UzJJandaN2ZVR29vbDhDNGZ4Vl9mUHlYaDVZYlphd0U3N1pKMlRBYkFMZjIzUm1wTzdoWjM1cVRXOTZ3?oc=5,1774080000,Six defining trends and takeaways from the A/W 2026 shows - wallpaper.com,Six defining trends and takeaways from the A/W 2026 shows - wallpaper.com
gnews,runway trend,news.google.com,https://news.google.com/rss/articles/CBMiigFBVV95cUxPZ3N4SjdZbUZpWm93bUN5MFlIZWRsYlcyWkNEN3FLc3F5YmM3cTl4SDBoYmR5Yjh1TXI3ZHkydUVTVEU2b09ZSlpZWmw0eHMxQVNJT0dwbHFGaFhTdHRlRmtzVnY0YlUwTDAxdTN4TnNEZ095UmlWZ1F2eFVKdi12WDBUdm5Tekp1Umc?oc=5,1773903600,The Best Spring Trends of 2026 - Harper's BAZAAR,The Best Spring Trends of 2026 - Harper's BAZAAR
gnews,runway trend,news.google.com,https://news.google.com/rss/articles/CBMihgFBVV95cUxPZ2EwbmNjRWlBbW9lbDVVWkxoSWZQTUNhNV9oMDMtRHozSFVmNUFTcU8xLTVXMXU1YlI5UVF4QTRpVUR0M1ZvaHZfZnd5amQyODA0YW55ZUh0TE5Zdk1XZzc2YTVydVhsei04SVo1UGM3VnJWS1hySFpPSkR2TkNyMzYwanZlZw?oc=5,1771315200,The Hottest Runway Trend at New York Fashion Week Is Just Holding Everyday Objects - Fashionista,The Hottest Runway Trend at New York Fashion Week Is Just Holding Everyday Objects - Fashionista
gnews,runway trend,news.google.com,https://news.google.com/rss/articles/CBMie0FVX3lxTE1KYUJnN0VRUzdLRXp3bXF0OTBNZmNLNnFCdS1Rek9EX0g4TmdQQl94MENjNUxmMEJvekY0ZGdBRnVhQ3daZkxWQWV2NExmUUlOY3Q0RE1XaGpzc0I1STIzQzZTZkJXRHltekpzd1NuMm5wWkh3dEhWVi1iQQ?oc=5,1773644400,It’s Nice to See (Some) Actresses Wearing Dresses They Can Breathe In - The New York Times,It’s Nice to See (Some) Actresses Wearing Dresses They Can Breathe In - The New York Times
gnews,runway trend,news.google.com,https://news.google.com/rss/articles/CBMi7gFBVV95cUxPSnZObXVKVkVKNkhhU3ZRdlNqSWE1bnd2UWwwaXdOLUdXbDFQRnhUSzA4N3V2SzFlSTB2WWx6YXdWOE4tbWhrQXNKeDI4ZElRTWtvM1c0ZDZQT3o1MzNtSE9oUWh3VDQtaTVVWVlOcU5KLUJZdkZkcUd3UEozSG8zOEpwc1NRVEdNVmluUV9oZDQ4WW9RcFJ3QjB1c0d6OGdqSWw3RG1wRUxaRXBKZnhiQnNqQWlJdGhLUHI2S1MySk9IdVRvNHN5T0x5TXZQbHYzczBIalRwV1JhaGxlYjFtQjJnY0NSRE0xZ3lmaXln0gHuAUFVX3lxTE5PSmwwNGNMMU9td1pJYmthTS1IcGJrQm9XRDNDN2dYZkRDV1ZQYnJSZjM1N0E0Mm5BcGVGZVYwRmdCbWpxR25pa2k2S2gxemJtUzY2Zld3QkxyUUg4Zi1zeExoSjNNY0dPem1TVnRJOWF4ZW4zdy1LREVQb19lYnNLNVZIMjRXVG14djNrRDZHSFJRLWZXdHh0dVBuRXJSdmtNVmU2VkhXcjIzYUZWNGYzcV9uUHRnM0hpTmljR3NSVW9zVmU2d0g0d1htRld2dUVNdnREM2ZaUkJsZkhxOE9LYUs4LXBibEJiV1BJV2c?oc=5,1774054814,How ‘painful bag’ became a popular subculture among Chinese youth - South China Morning Post,How ‘painful bag’ became a popular subculture among Chinese youth - South China Morning Post
gnews,runway trend,news.google.com,https://news.google.com/rss/articles/CBMijAFBVV95cUxOdWl5dWNNMC1oc0FxSmZCeVhMTTFfVjVabEVSVWl5TGFac3VXQmtIQVFvSGJ0UW9uQUN2bTMtVzJod2tEMW40RDRsS013R3ZYTEJOT0FiWHRWa2dJTk5jTDBySnpBdWt6czBHZUdnU0JpWXRqNnlmNF9KRWMwM3hqSjBNZ1A0S1BQMzFzUg?oc=5,1774014700,Klein Blue Is Poised to Be 2026’s Biggest Fashion Color Trend - Marie Claire,Klein Blue Is Poised to Be 2026’s Biggest Fashion Color Trend - Marie Claire
gnews,runway trend,news.google.com,https://news.google.com/rss/articles/CBMiZEFVX3lxTE9KZjRhRnlHZVJ6REd3MjkxSXQxRnMtRXRHd1dFWUxwdWlJZWdfQUh3LVhIZXRpMjFnQ2NhVFlfSDQtMkJyaTFWQ3QxQmxqd2g0LXE2OHVSV2lWa1dKUFNDdGlHNzU?oc=5,1772870400,"17 Spring Fashion Trends to Try, From CBK-Inspired Minimalism to Texturemaxxing - Teen Vogue","17 Spring Fashion Trends to Try, From CBK-Inspired Minimalism to Texturemaxxing - Teen Vogue"
gnews,runway trend,news.google.com,https://news.google.com/rss/articles/CBMilAFBVV95cUxPYUo2RjdqVnFPU2dLa0JkZnRzR3M0dVFhNXFSQ1BqdzVpTzNPTU5zMUZQWGNuaGUyMUdEc1Y5d1VUcTBNeDBQN00ydnJPalVHX1o2Z0RzbU85N1JRb2ZzZUtNblVncUoyaTNzYmFybWxENXA5Q3lwTF9pRC1ZRWhjSjdQcmJwU01JUUtUdU1ZMzIxR1hz?oc=5,1772438400,Breaking away from the fast fashion trend cycle - The DePaulia,Breaking away from the fast fashion trend cycle - The DePaulia
gnews,runway trend,news.google.com,https://news.google.com/rss/articles/CBMifkFVX3lxTFB3NHR0Nk9fckhCYndwd3FQSnBsdzZhTWU5ZTJiY2d5Wnl3bkstaTQ0dlJuT1FEdHZaSTVmQ0R2dS1SR2w4VWNzSkpFRXRJNDRPN21ORTNIQXpxNFVOczVSRC1Sc04yZ1hiZWhzcElrS2FzMUktckRrbmZXaUNJQQ?oc=5,1774260969,Best Footwear Trends at Tokyo Fashion Week FW26 - hypebeast.com,Best Footwear Trends at Tokyo Fashion Week FW26 - hypebeast.com
gnews,runway trend,news.google.com,https://news.google.com/rss/articles/CBMiXkFVX3lxTE9yd2tNemNmVnNxMkV6OGp1RFo5NkpwSW9MQkNmTVhKV2xkZm9FQi1ueURzY2NXNlg3WkJ6RmtiakQzdXhUaFV5c29HaEN4S2d4YmZXd0hWS1VJM1IxREE?oc=5,1770883200,The NYFW Fall/Winter 2026 Runway Trend Report - Coveteur,The NYFW Fall/Winter 2026 Runway Trend Report - Coveteur
gnews,runway trend,news.google.com,https://news.google.com/rss/articles/CBMibEFVX3lxTFBTUWlTZTJ2MU1iSlFIWGJidGE1VHBXZ2FCMW5fN3NPUlprQ0dLTE03VkF6WWRoODFzdkduWHhaX1N3ZVRtaW1HN1RMcWhJcmwteWV0OGVpMWVoVjVaeDNBaUpYZTh0eFRaX0dGNw?oc=5,1774162800,Not Skinny But Not Barrel—6 Newer (and Cooler) Spring Jeans Trends People Are Wearing Instead - Who What Wear,Not Skinny But Not Barrel—6 Newer (and Cooler) Spring Jeans Trends People Are Wearing Instead - Who What Wear
gnews,runway trend,news.google.com,https://news.google.com/rss/articles/CBMieEFVX3lxTE9nc2ktNnQxVzlMTjl1MjR5MFYwSkMtVjI1Z0VhZlBLU0JqVlBjdHUyejJCVDV3OE9xYmF3ckhxR2VXLTk1Y3ZScXZfN0VPSU1ManFXYmFUWWxKTDN6cjFXTzk2OGxSVWxDOHIyeXZmRG9jUktfd2FIMg?oc=5,1773898200,The Vogue Business TikTok Trend Tracker - Vogue,The Vogue Business TikTok Trend Tracker - Vogue
gnews,runway trend,news.google.com,https://news.google.com/rss/articles/CBMiekFVX3lxTE84NjEyWkJMRHJia195MWwxNEVjdjJmbjhlOVlhdzh0d21SQWRZaERBaHoxamRIVlg1cHJEeDdhc2QtOWZvclJjb3VGQW1Wcmhta0lFMzdVd0tUeFloazUtclBNenJnamYwckJCWkY5bXpvVkloN21ZMDRB?oc=5,1774076400,The Major Handbag Trends of Fall 2026 Have Arrived: 7 It Styles to Know - Who What Wear,The Major Handbag Trends of Fall 2026 Have Arrived: 7 It Styles to Know - Who What Wear
gnews,runway trend,news.google.com,https://news.google.com/rss/articles/CBMimwFBVV95cUxOT09wUHR5Y2tMMUVFS1QzbnpUYnhDb3NCX2tLa3hudjkyd25BUEtsQS1OaGgxUF9Gbm92Y3BWclBjWmR0NmRoOEhmd2RoeVdYR2dKdlpmVkFmU3YtTUFHd1VXVlBwckFQc1lZTlNzdUlOOE5HT0hQMl9zZmtpZ3hQZzF0WjhqTWpsY0VkYTBSbGJNZ0hJMGZBWTBUcw?oc=5,1774085400,"By Summer 2026, Every Fashion Person Will Be Wearing This Skirt Trend With T-Shirts - Who What Wear","By Summer 2026, Every Fashion Person Will Be Wearing This Skirt Trend With T-Shirts - Who What Wear"
gnews,runway trend,news.google.com,https://news.google.com/rss/articles/CBMi8wFBVV95cUxPZzJBVTFyenMwVTVYWWxPYV92V3dLelNFV0lPRTJtaWZUSWFsYWF0RkZxcGYyaXhRbEZmRUVlWTA4UnBEUE56SW5kVFdEeVcwWmpaOXREbVA3U2RMY0ZxdTFOLVhkNUFNYXphQ1hVTFhsbEJrMzAwXzVZQ0FvRzVUMTltaHNnZ0p0S3ZmdnE2RGduY1VZdkJIaG5CUl9iNHAwcDBBMnhrYWNmeFFKVE0wWkZra1RSeFMyaklUaE51SnJRTVZXNnJVOXBhMG8wOHlzcHJQYVVqQnhxa1VLd19IQi1yT0RWejRkTTVmWG82dHlhUGPSAfgBQVVfeXFMTi03aXRScUFtVG9xdzNqVlpEVVdISTFxR3JiOGpHT2Z6R011UmhJU0pXQkx4TF9UNkpRekI4ZHN3RjdIdTRHNHpZRDhvUDJTMFI0b0tfTUVoMHd2T0tTeHQ5SHpyX1FBNjJsTWVhclRQNFhBMkNCTmgzYVBiVzEzcTdlcVdEcnZMU01nazJxczRCZUVFVVRZQjFvaW5Bd3ZVRHdkWF9EbFhxaG9ZcEFYaldidWQzTzRRRUZQYXpYekRhdUhtcko0MHB4LUw3QzA3TW95b0huQmFDRnBRQzlqWndpQ0VJVHB6d0JNOHd4MFJINWpoYmVVcXg?oc=5,1774335814,All-white fashion trend 2026: How celebrities styled ‘cloud dancer’ at Lakmē Fashion Week x FDCI - Moneycontrol.com,All-white fashion trend 2026: How celebrities styled ‘cloud dancer’ at Lakmē Fashion Week x FDCI - Moneycontrol.com
gnews,runway trend,news.google.com,https://news.google.com/rss/articles/CBMinAFBVV95cUxNdmVmdU1HcTdQcGVXZDN4TzNaYW4xZkViMEdLLWc2Mmg0d3VZQ1AwUVhEa3AyNTk0ODM2S2hsYjRld3UyaU9WLXdJTFJkZGNsanpYRWF0NEY2VkZVd0tRcV8wRFplYlVIOHlxZnRnZ0w1U2g1NWxhZzF3aXZkVFA5X05vdm0xcS1XWWE0TWRhSnVoTFUyOXhsM2JFdEw?oc=5,1773021191,A Fashion Trend Defining the 2020s? Tech Billionaires Crowding the Culture - Good On You,A Fashion Trend Defining the 2020s? Tech Billionaires Crowding the Culture - Good On You
gnews,runway trend,news.google.com,https://news.google.com/rss/articles/CBMijgFBVV95cUxOUVpCcXczNVo0bE1ITmZkUG9jNURhdHNZNTdZSmhkd280V3htNlVEWnlFNWJUaE55cmFqdnY2dGdQQ3FKemxqQV9QemhGbHE4ZWl1aW5ha0xnbElNdFlJTU1FWUNEYWNEdlFKQnJiZlJQOTlpaF9WbWVmQ3lQYnNHMldCT3pRcnFnWEVGQ0tR?oc=5,1773126000,Why Models Over 40 Became Fashion Month’s Standout Runway Trend - Yahoo,Why Models Over 40 Became Fashion Month’s Standout Runway Trend - Yahoo
gnews,runway trend,news.google.com,https://news.google.com/rss/articles/CBMikAFBVV95cUxOdlJ4MkZOaDZXTkZRZVFWM3pFamd4aE5od3dBZ212SGR5VTZHLVhhRVlhS0tPRXJiVTl3RXVRcnh5TlNrM2h4ZzZ3aGZpVFRBLTNnSGQyMFptMTh5bzg0MHY1RTZBZWZCWnVIN0J4OVRPbXhhamxXSkViTGVaZEVKSGlWSXFGcFVzUVdwNFY0ZWU?oc=5,1772524800,5 Runway Trends From Milan Fashion Week You Need Know About Now - Who What Wear,5 Runway Trends From Milan Fashion Week You Need Know About Now - Who What Wear
gnews,runway trend,news.google.com,https://news.google.com/rss/articles/CBMid0FVX3lxTE9XMmtZbmF5alV6b3cwVmFQbU51M1FFbk1VVUY0aGJTWmlHcnNGV3gwX08ybnA5QTRkZUtrTF91X0Vocm9pRi03RS03cFlrV0JETWVhcWM0VFVTMXdLX2dyNDVNMkR3OEhwai1rRmw0NGVISE9GMWlF?oc=5,1772524800,Autumn 2026 Ready-to-Wear: The Runway Beauty Trends Taking Shape - Vogue Arabia,Autumn 2026 Ready-to-Wear: The Runway Beauty Trends Taking Shape - Vogue Arabia
gnews,runway trend,news.google.com,https://news.google.com/rss/articles/CBMiiwFBVV95cUxPc04tc2FlamlzTWRyUDRVUTJnUmR0dFhfUGNJLW5COHk0RGl0eWdEZzE0RE5TQTdyeUI1X3F1ZFk1WDR0a2hjaDNtSnA4VVVFQTJRaVdfUmFfa0NzWGxpVzVScVdQcjJ4NklMTzVSLXRMTWU2eFdOR3hnWWVtMm1wdG5odXJYb3Zycmo4?oc=5,1772092800,Cobalt blue: the fashion trend taking over runways and red carpets - hyphenonline.com,Cobalt blue: the fashion trend taking over runways and red carpets - hyphenonline.com
gnews,runway trend,news.google.com,https://news.google.com/rss/articles/CBMilAFBVV95cUxNMVFiRVdrRUdlSTRWSHNtOTRaVzdEWVpJYWhOWF92SGlOM3A3VkpNSmRDSklKRlRlUFFaVTRZT3Ffc1JwZENmcHZYRk9EZU45Z2NFdG92UzcwQ01nSGhtQUM2RmhVbWtFcHdXWTBCU0NwVXhzcUhoR243WlVsb2xCaEhiSHlUYktPd18yZ3NEX0Z6bnVl?oc=5,1772006400,Minimalism Is Out. London’s Fall 2026 Runways Are All About Bold Classics. - ELLE,Minimalism Is Out. London’s Fall 2026 Runways Are All About Bold Classics. - ELLE
gnews,runway trend,news.google.com,https://news.google.com/rss/articles/CBMihwFBVV95cUxNb2tTZVpUSGREa2N2WFZfTVJheU9ISjNmRGFpdWdrMlNFSnlRUnVzRkQ4eks1ZU5acFpxTWlIa1hrSUxlMjU4ZlNZanZoN25zLWh4LWY5TWlRRlVKaEdoRGFTVlJhaDlHT2pqMDVJd3VlMnlPWllSS1U3RVlZWkNaMGNmVnI1NkU?oc=5,1772179200,I Just Got Off the Plane from London Fashion Week—Here Are My Favorite Trends - Harper's BAZAAR,I Just Got Off the Plane from London Fashion Week—Here Are My Favorite Trends - Harper's BAZAAR
gnews,runway trend,news.google.com,https://news.google.com/rss/articles/CBMiiAFBVV95cUxPWHM5bVNlRHF1MnhQQmZ4c216LWRyb28xRUJtWk5YLXRPWTVnQnNYblNoeVlIcThfcHZMcjJuYVlRVmFOUnRpV1JIRkhvc0RtQ2FNb0VnTDQ4ZW5CT1RZbm5GNGxFQjB0YTJkYktmQVloaEFndW5HcGQ5VkJJREtHaHpwRU9SNk14?oc=5,1771401600,The 6 New York Fashion Week Fall/Winter 2026 Trends We Want - Who What Wear,The 6 New York Fashion Week Fall/Winter 2026 Trends We Want - Who What Wear
gnews,runway trend,news.google.com,https://news.google.com/rss/articles/CBMic0FVX3lxTE1DS3JyTktQOE43XzgzZmdKcHBhQ3VWZWs3bi1yMFZINURsVlREVVVOdDNYTUhaVjYzcjdXcmg5MHNUSTZvMW1NS3NpdFN0VTYweEhwQ0c0Rzc1bERzcXNIMi00RnJqQjFwX2IxVF9rRlFGYXM?oc=5,1773126000,The Key Spring/Summer 2026 Trends To Know (And Shop) Now - British Vogue,The Key Spring/Summer 2026 Trends To Know (And Shop) Now - British Vogue
gnews,runway trend,news.google.com,https://news.google.com/rss/articles/CBMirwFBVV95cUxPZTB1dmdoTzZ1ZUdpVnhVT2o1cG00ek9uLVdYZkI1V3g3ZDNoMjljVU5DVWhzNzNqTzZ2YjVwUFFWcDVLNktrYi1DWTRwTWcwR0U5dGc0dDE2ZlBQMndEb1JxaFlqczBFYjNIQkFpRy1RLWJmVjlCZmNQT0NtNG1DY0M0UVl2YlAzYnpRdERDZ0RCcWNJa2duTUpraS04aTN5ZUEwNXZOUjJuSDRaOTFJ?oc=5,1771920000,London Fashion Week’s Street Style Featured These Key Trends - ELLE,London Fashion Week’s Street Style Featured These Key Trends - ELLE
gnews,runway trend,news.google.com,https://news.google.com/rss/articles/CBMifEFVX3lxTE9jVWZSTkdCWjZlU3c4cy1zQjdrd2dsbnY1Q3A0WWpaZEc0aEFvMG1CQXBTRHhrNk9iSkdaRGxtSHNOWllxTzdobmFTNjRzUTN3enhjZGl3Q1lIMzY1RS1acWVCbnQtLUM4R1huY0pZbkFLVGdJRS1yc0g3WHc?oc=5,1773558000,Nicole Kidman Wows at Oscars 2026 in a Sequin Feather Dress Featuring a Controversial Fashion Trend - instyle.com,Nicole Kidman Wows at Oscars 2026 in a Sequin Feather Dress Featuring a Controversial Fashion Trend - instyle.com
gnews,runway trend,news.google.com,https://news.google.com/rss/articles/CBMiekFVX3lxTFBnbHk1NF9IT3ZEODNBOEVvSWlTSlVVS1B4aWNRX2Y1cTlaVzI3ekwxZDhDUVNJOTdOQ1VBTUdrdjhUdGNpalhQWXYxYzFWbzNXT2tIMkRpOFF5S2dRRWZyaWRFZTQ0M043cmt1VVhUN1BLbldVR0VjLUxR?oc=5,1772092800,"9 Spring 2026 Fashion Trends to Shop Now, From Headscarves to Hot Pants - Popsugar","9 Spring 2026 Fashion Trends to Shop Now, From Headscarves to Hot Pants - Popsugar"
gnews,runway trend,news.google.com,https://news.google.com/rss/articles/CBMi0AFBVV95cUxNNmR5YVpmRlJVN3RaQmRTT3BucWFLMENMZ2k2ZlVyMnB2QzJVOElVSkhzUG5aR1N3NFNWNzhGY0xNZV9KZFVUOURqZTNhVkR0Ri16NExYWjNYVjY2NDkyZ0xFVW9TLWRHZHhWV0txQndDelI1RTZCWDFoU0xsN2NLc0JSYjVwNU12R3kxNWE3VlZRTWRGcDZqYS00ZVk5dzRWX2RIcndTUGN3V0stZzhHZmlwXy1yN2Ntb253SFdBVERycUhtNnU2TjJEa2VjRjRh?oc=5,1771833600,Stay Updated: These Are the Key Fall/Winter 2026 Trends Dominating the Runways - L'OFFICIEL USA,Stay Updated: These Are the Key Fall/Winter 2026 Trends Dominating the Runways - L'OFFICIEL USA
gnews,runway trend,news.google.com,https://news.google.com/rss/articles/CBMiXkFVX3lxTE1ZYmRZbkM1UUJxV2lMVXFuaDlmV2puVnZZZE9jUS1IVkNVYXQ0cnBRaGhBU2dqeE9mMmVfMDRHU3pfaEJzeFUyUFRnNDdUZVdpMk1lalk3ZmROT3dVMVE?oc=5,1771488000,I’m a Fashion Editor—These Are the Spring Trends I’m Seeing Everywhere - glamour.com,I’m a Fashion Editor—These Are the Spring Trends I’m Seeing Everywhere - glamour.com
