source,query,url,created_utc,title,text
youtube,men's fashion trends,https://www.youtube.com/watch?v=iVahZU4pbWU,1782370185,which one is your fav. ?#explorepage #fashion #fashiontrends #viral #boy,which one is your fav. ?#explorepage #fashion #fashiontrends #viral #boy.
youtube,men's fashion trends,https://www.youtube.com/watch?v=uXESj1Wa3VA,1782368003,&quot;Luxury Men&#39;s Style 🌙 Grey-Blue Suit with Moonlit Shine&quot;,"This grey-blue suit paired with a white shirt and silver textured tie creates a cool and eye-catching look, just like moonlight ..."
youtube,men's fashion trends,https://www.youtube.com/watch?v=UcWucSCxYt4,1782367823,❄️ Men&#39;s Winter Style | The Silver Suit Secret Everyone&#39;s Talking About,"Winter is the perfect season to showcase a stylish and professional look. In this video, you'll discover a unique and eye-catching ..."
youtube,men's fashion trends,https://www.youtube.com/watch?v=Ec2Vjc4nuQs,1782358468,"👉 Boys, Wear This &amp; Get Instant Attention 🔥","Welcome to Dapper Society ✨ Elevate your style with the latest men's fashion trends, outfit ideas, and grooming tips. From school ..."
youtube,men's fashion trends,https://www.youtube.com/watch?v=wWhvALMJ4mw,1782357238,Men in  T-shirt and Jeans|Casual Wear for Men| #menfashion #gents #gentsfashion,"Keep it simple, stylish, and timeless with the classic men's T-shirt and jeans combination. Perfect for casual outings, weekend ..."
youtube,men's fashion trends,https://www.youtube.com/watch?v=5broUPoCqyQ,1782356413,The Rise of Gent Z: Why Young Men Are Changing Their Style,"Something fascinating is happening in men's fashion right now! In a viral post shared by the online community askablkman, ..."
youtube,men's fashion trends,https://www.youtube.com/watch?v=ajxi_neHudI,1782354607,Purple Shirt Men’s Fashion Look 😎🔥 #Shorts,Looking for the perfect men's fashion look? Check out this stylish purple shirt outfit paired with white trousers and sneakers.
youtube,men's fashion trends,https://www.youtube.com/watch?v=ynhvIaY3sqk,1782351398,New Insta story ideas | Aesthetic insta story ideas for men | Men&#39;s Fashion 2026 🔥  #ai,"Men's Fashion 2026 How To Look Attractive, Stylish & Confident | Sunglasses Style Guide ⭐ prompt (copy and paste) ..."
youtube,men's fashion trends,https://www.youtube.com/watch?v=gchRnk53oiQ,1782351235,👗 Trending USA Fashion Look 2026 #fashiontrends #luxuryfashion #usafashion #designerfashion,"Welcome to Fashion Aura USA! Discover the latest fashion trends, stylish outfits, elegant dresses, luxury fashion, women's wear, ..."
youtube,men's fashion trends,https://www.youtube.com/watch?v=NdT9rI2gCgM,1782349260,one color made your whole outfit look 10x cleaner #monochromatic #outfit #fashiontrends,
youtube,men's fashion trends,https://www.youtube.com/watch?v=fhAtK7FhKjs,1782342099,"Inside Pitti Uomo 110,  The Men&#39;s Fashion SS27 Trends","Inside Pitti Uomo 110 — Italian menswear trends SS27, standout brands from the floor, and what it tells us about how ..."
youtube,men's fashion trends,https://www.youtube.com/watch?v=ayJZqeBm6V0,1782337008,men fashion #fashion #fashiontrends,
youtube,men's fashion trends,https://www.youtube.com/watch?v=WKAj12bnI4c,1782333017,X-Men Goblin Queen Costume🔥#Cosplay Model #Fashion Style #Shorts Trend Makeup Hair Outfit Movie Fan!,Jessica Felice in costume as X-Men Goblin Queen from Marvel Comics. Cosplay Model Fashion Style Shorts #Trending #Video ...
youtube,men's fashion trends,https://www.youtube.com/watch?v=L-sxoJWhmfg,1782327625,More choices. More style. More #TOMATO 🍅✨,tomatofashion #thebestversionofyou #fashion #fashiontrends #fashiontrends #summerfashion #summer #summercollection.
youtube,men's fashion trends,https://www.youtube.com/watch?v=qaX8H5TIC4M,1782321194,Dior Men’s Spring Summer 2027 #dior #diorbag #fashiontrends,
youtube,men's fashion trends,https://www.youtube.com/watch?v=IrRV0XGPoe0,1782315897,Men Who Dress Like This... ⚜️ #mensfashion #oldmoney #quietluxury #shortstrend,Men Who Dress Like This... ⚜️ #mensfashion #oldmoney #quietluxury #shortstrend The secret is in the simplicity. ⚜️ Men who ...
youtube,men's fashion trends,https://www.youtube.com/watch?v=hdUrSVUbRag,1782314362,Luxury Fashion Styles That Look Expensive#FashionAuraUSA #USAFashion #FashionTrends #LuxuryFashion,"Welcome to Fashion Aura USA! Discover the latest fashion trends, stylish outfits, elegant dresses, luxury fashion, women's wear, ..."
youtube,men's fashion trends,https://www.youtube.com/watch?v=et7VOLPU0QE,1782311403,2026 Men&#39;s Fashion Trend 🔥 Premium Brown Shirt Styling | Luxury Look #shorts,"Brown Is The New Black! Upgrade your style with this premium brown overshirt. Minimal design, powerful presence, and the ..."
youtube,men's fashion trends,https://www.youtube.com/watch?v=s3wcvE_0OSA,1782308673,Trendy Boys Outfit Ideas 2026 | Stylish &amp; Casual Men&#39;s Fashion Inspiration,"Looking for the latest boys outfit ideas for 2026? In this video, discover trendy casual outfits, smart streetwear looks, stylish ..."
youtube,men's fashion trends,https://www.youtube.com/watch?v=8AfVWALutl8,1782308730,🔥😱Latest Stylish Denim Jeans Collection  Best Men&#39;s Wear at Jinu Collection👖#shorts #trending #viral,Latest Stylish Denim Jeans Collection Best Men's Wear at Jinu Collection    #shorts #trending #viral Welcome to Jinu Collection!
youtube,men's fashion trends,https://www.youtube.com/watch?v=ax1Rg4XKI9s,1782307831,🔥 White Shirt Review 😎 | Best White Shirt Try On &amp; Honest Review | Stylish Look 2026 #MensFashion,White Shirt Review | Best White Shirt Try On & Honest Review | Stylish Look 2026 White Shirt Review | Classic White Shirt ...
youtube,men's fashion trends,https://www.youtube.com/watch?v=cpd2BY1kBSg,1782307830,2026 FASHION TRENDS YOU MUST TRY,"Instagram: https://www.instagram.com/pehenawah Fashion trends come and go, but not every trend deserves a place in your ..."
youtube,men's fashion trends,https://www.youtube.com/watch?v=FgO89XNur9w,1782307807,Upgrade your style with our latest Oversized T-Shirt Collection!#OversizedTshirt #YouTubeShorts,"welcome to our latest fashion collection! ✨ Mens, Womens & Kids Wear ke stylish aur trending outfits dekhne ke liye video ko end ..."
youtube,men's fashion trends,https://www.youtube.com/watch?v=rU-VBzSenvk,1782307824,Indian men&#39;s don&#39;t know how to dress... really.#fashiontrends #fashionking #indianfashion,
youtube,men's fashion trends,https://www.youtube.com/watch?v=00l-WLyJrXc,1782306023,Dior Men&#39;s Spring Summer 2027 Show | Paris Fashion Week 4K | Becka Dripper TV,Dior Men's Spring Summer 2027 Show | Paris Fashion Week 4K | Becka Dripper TV Experience the elegance and creativity of ...
youtube,women's fashion trends,https://www.youtube.com/watch?v=FhYnf_Bj2VI,1782370680,super hit disign 👌👍😊👍 #fashiontrends #minivlog #newsuitdesignforkarwachauth #fashion,
youtube,women's fashion trends,https://www.youtube.com/watch?v=ac8FRKduuTU,1782369903,Birth Month Top &amp; Skirt Outfit Ideas 💖 | Fashion by Month #bodycondress#birthmonth#asmr#girlsfashion,Discover stylish top and skirt outfit ideas inspired by every birth month! ✨ Which month's outfit matches your vibe the best?
youtube,women's fashion trends,https://www.youtube.com/watch?v=gKX99NLxVhQ,1782369155,Trendy Summer Outfit Ideas | Summer dress design | Frocks women design #fashion #design #trending,Trendy Summer Outfit Ideas | Summer dress design | Frocks women design #fashion #design #trending frock designs 2024 frock ...
youtube,women's fashion trends,https://www.youtube.com/watch?v=tGOrS0GBu3o,1782368390,Latest Summer Special Cotton Frocks Design Ideas | Trendy Summer Outfit Ideas | #shorts #fashion,Latest Summer Special Cotton Frocks Design Ideas | Trendy Summer Outfit Ideas | Summer dress design frock designs 2024 frock ...
youtube,women's fashion trends,https://www.youtube.com/watch?v=bEyZj3vDC5M,1782368132,Red carpet look 🤯||dinner date look🔥#ootd #fyp #datelook #shorts,Red carpet look ||dinner date look   Search terms / Any queries party wear outfit ideas top skirt color combination women ...
youtube,women's fashion trends,https://www.youtube.com/watch?v=uu2yHgbAxD0,1782365346,हौले-हौले चलो💃❤️#fashiontrends #fashion #trending #viralvideo #ytshorts #rajasthaniclture #reels,fypシ゚viral #fypシ #rajasthani #lehenga #lenghacholi #culture #dress #look #song #trendingshorts #trend #trendingsongs.
youtube,women's fashion trends,https://www.youtube.com/watch?v=ovi3AeomXEc,1782364017,meesho footwear for women 🎀 #womenheels #heels #meesho #fashiontrends #trend #fashionheels #viral,viral #heels #shortsfeed #trendingshort #youtubeshorts #meeshoapp #meesho #meeshohaul #meeshofinds #heelsandals ...
youtube,women's fashion trends,https://www.youtube.com/watch?v=G8iPr0ynfBU,1782360329,💖🧶Women Knitted Fashion 2026 👗🔥 Elegant Winter Style Trends You’ll Absolutely Love,"Step Into 2026 Women's Knitted Fashion Discover the perfect blend of comfort, elegance, and modern winter vibes with these ..."
youtube,women's fashion trends,https://www.youtube.com/watch?v=Rs_Az-8b7cg,1782359608,"Women Knitted Sweater, Autumn and Winter Color Block Long Sleeve Tassel#viral",Welcome to our latest Women's Fashion Collection! ✨ Discover this beautiful Women's Knitted Sweater featuring a stylish Color ...
youtube,women's fashion trends,https://www.youtube.com/watch?v=moWs7laB3L8,1782358209,party wearing outfits 👠#fashion#fashionstyle#trending#viral#girlsfashion#shorts#halo#youtube,"Welcome to Fashion by Anshu ❤️ Discover beautiful outfit ideas, trendy fashion inspiration, elegant dresses, ethnic wear, party ..."
youtube,women's fashion trends,https://www.youtube.com/watch?v=N81oxlKbW5w,1782356641,Soft &amp; Stylish Lace Panty for Women #shorts #fashion #vairalshort,Soft & Stylish Lace Panty for Women #shorts #fashion #vairalshort Discover this beautiful and comfortable lace panty design for ...
youtube,women's fashion trends,https://www.youtube.com/watch?v=Nv2FoZmAQl8,1782356608,DM 👉 7082883611 ✅ #fashion #dressess #fashionstyles #dress #indianfashion #fashiontrends #wedding,
youtube,women's fashion trends,https://www.youtube.com/watch?v=mDy2kF6Qrxo,1782355528,&quot;The Outfit 🤍|| Kurti Look|| #ootdguide #styleinspo #fashiontrends #song #fyp #meeshohaul #ytshorts,"""The Outfit || Kurti Look|| #ootdguide #styleinspo #fashiontrends #song #fyp #meeshohaul #ytshorts Elegant soft pink outfit set ..."
youtube,women's fashion trends,https://www.youtube.com/watch?v=wdrYaz1Rhog,1782352416,rakib &amp; ritu #rakibhossain #rituhossain #rakib_hossain #lifeisbutadream #love #fashiontrends,
youtube,women's fashion trends,https://www.youtube.com/watch?v=gchRnk53oiQ,1782351235,👗 Trending USA Fashion Look 2026 #fashiontrends #luxuryfashion #usafashion #designerfashion,"Welcome to Fashion Aura USA! Discover the latest fashion trends, stylish outfits, elegant dresses, luxury fashion, women's wear, ..."
youtube,women's fashion trends,https://www.youtube.com/watch?v=8HvDjOJh2m4,1782349999,🧶 Women Knitted Fashion | Trendy Knitwear &amp; Stylish Outfit Ideas,"Welcome to Women Knitted Fashion! ✨ Your destination for beautiful knitted fashion, trendy knitwear designs, stylish sweaters, ..."
youtube,women's fashion trends,https://www.youtube.com/watch?v=F829venOFbQ,1782349220,old money outfit ideas ##summeroutfit #outfitinspiration #fashiontrends #fashion #trending #shorts,
youtube,women's fashion trends,https://www.youtube.com/watch?v=QBHXcHBGgCs,1782342911,Wedge Heels vs Chunky Heels 👠✨ | The Ultimate Footwear Trend of 2026 #shoes #aesthetic #fashion #fyp,"Which heel style is stealing the spotlight in 2026—wedge heels or chunky heels? ✨ In this video, we explore two of the most ..."
youtube,women's fashion trends,https://www.youtube.com/watch?v=abJNLCmDG58,1782338406,"Transparent Dress, Lingerie &amp; Bikini | 4K Try-On Haul See Everything | Glamora USA","Welcome back to Glamora Studio! ✨ Fashion Glow-Up in Seconds! In today's video, we're showcasing a stylish fashion look and ..."
youtube,women's fashion trends,https://www.youtube.com/watch?v=FuinCdtX1J0,1782337564,It Got Chaotic But I’m So Grateful for My Family 🥹🤍 #realmotherhood #momlife,"It got a little out of control, but I'm so grateful for my beautiful family. Wishing you all happy holidays filled with love and special ..."
youtube,women's fashion trends,https://www.youtube.com/watch?v=piPePffQOS4,1782329436,#humor #usa #foryou #fyp #love #crazyfashion #shorts #viral #youtubeshorts #fashiontrends,
youtube,women's fashion trends,https://www.youtube.com/watch?v=qrlA07isdgE,1782327613,#humor #usa #foryou #fyp #love #crazyfashion #shorts #viral #youtubeshorts #fashiontrends,
youtube,women's fashion trends,https://www.youtube.com/watch?v=3TNUh8AIiiY,1782325829,#humor #usa #foryou #fyp #love #crazyfashion #shorts #viral #youtubeshorts #fashiontrends,
youtube,women's fashion trends,https://www.youtube.com/watch?v=GdOuNIJeSFw,1782324720,Trending Footwear &amp; Style Searches 2026 | Ladies Shoes &amp; Sandals Fashion Trends,"Discover the Top Footwear & Style Searches of 2026! In this video, we explore the most popular and highly searched ladies shoes ..."
youtube,women's fashion trends,https://www.youtube.com/watch?v=0l_4VjgCbDc,1782322231,#humor #usa #foryou #fyp #love #crazyfashion #shorts #viral #youtubeshorts #fashiontrends,
youtube,streetwear 2025,https://www.youtube.com/watch?v=D5YjpY4yl0I,1782345631,AW 2025-26: The Shape of Cozy Glam,"A precise briefing on autumn winter 2025 26 fashion, makeup, and styling trends, focusing on textures, colors, and accessory ..."
youtube,streetwear 2025,https://www.youtube.com/watch?v=M9B8qHZtaME,1782153028,Pre Fall 2025 LIVE NOW ‼️#outofroutine #onlineshopping,
youtube,streetwear 2025,https://www.youtube.com/watch?v=p__jNgE49bA,1782121645,🌞Summer Outfit For Girls ☔#summer​ #streetwear​ #2025​ #youtubeshorts​ #girlswear​..your question,baby girl dress design #fashion #viral #trending #newoutfit #cotton.
youtube,streetwear 2025,https://www.youtube.com/watch?v=9IUoiRbuugk,1781961869,Gen Z Fashion Trends 2025 | Oversized Tees &amp; Baggy Jeans Lookbook,"Elevate your everyday style with trendy oversized tees, baggy denim, and effortless accessories. From casual streetwear to clean ..."
youtube,streetwear 2025,https://www.youtube.com/watch?v=0H1N-DxexFE,1781945643,Fashion Casual Solid Gray Cropped T-shirt 2025 Woman Clothes O-neck Corset Tops Streetwear Girls,https://s.click.aliexpress.com/e/_c36RClsp#streetwearfashion #y2kfashion #cleangirlaesthetic #baddieoutfits #modeloffduty.
youtube,streetwear 2025,https://www.youtube.com/watch?v=Ocx2uCYkpho,1781926779,Grey Fall 2025 Thermal #Explore #Cozy #Streetwear #Designer #Galaxy,Follow at 1avish1ove on Instagram for more updates on inventory!
youtube,streetwear 2025,https://www.youtube.com/watch?v=0O_a2eOktiI,1781892799,Men&#39;s 2025 Japanese streetwear shirt #ytshorts #million #trending #cloth #outfit #ytshort,"Men's 2025 Japanese Streetwear Shirt Refresh your summer wardrobe with this Men's 2025 Japanese Streetwear Shirt, a perfect ..."
youtube,streetwear 2025,https://www.youtube.com/watch?v=gBBoT1ZX1UU,1781845372,Bottines Plateforme Punk Goth Lacets – Femme 2025,"Step out in style with our Bottines Plateforme Punk Goth Lacets! At just $62.12, embrace your edgy side without breaking the bank!"
youtube,streetwear 2025,https://www.youtube.com/watch?v=eBNIIsTj4yM,1781646055,PUUR -  Paris Fashion Week 2025-2026,
youtube,streetwear 2025,https://www.youtube.com/watch?v=wH32s0Ua1lc,1781484030,2025 pakai sistem pre-order ❌-#alinsideproduction 📠0895410501555#Screenprinting #streetwear #dtf,
youtube,streetwear 2025,https://www.youtube.com/watch?v=JVnmN3y6RAM,1781415753,Er supreme dødt i 2025? #fyp #viral #xyzbca #supreme #fashion  @WHITE COFFEE,Er supreme dødt i 2025? #fyp #viral #xyzbca #supreme #fashion @WHITE COFFEE.
youtube,streetwear 2025,https://www.youtube.com/watch?v=s7oHmltSWQI,1781385826,Teaser#1 magazine2025/2026 2e édition #fashion #wondacoutures #business #mode,
youtube,streetwear 2025,https://www.youtube.com/watch?v=IAhcpreya2U,1781361071,Jordan 4 black cat 2025💫💫#viral #jordans #FYP #blackcat #streetwear,"short #sneakerhead #unboxing Leave me size!!! Hello! My friend, if want this goods add our whatsapp:+86 152 6026 8083."
youtube,streetwear 2025,https://www.youtube.com/watch?v=pl8iapqEUsw,1781263765,People think oversized is a 2025 trend. The 90s would disagree.,fashion #streetwear #oversized People think oversized clothing is a new trend. The 90s would disagree. Fashion doesn't move ...
youtube,streetwear 2025,https://www.youtube.com/watch?v=oPHuQHVhEF8,1781257518,2025🎞️,
youtube,streetwear 2025,https://www.youtube.com/watch?v=huDGV5Hfa4M,1781121920,Inside the Bold Golf Show at Ireland Fashion Week 2025 ⛳️,"Kicking off Ireland Fashion Week 2025, and taking over Teeling Whiskey Distillery in the process, Bold Gold redefine classic Golf ..."
youtube,streetwear 2025,https://www.youtube.com/watch?v=QTDDc204Rf8,1781121778,Inside the Bold Golf Show at Ireland Fashion Week 2025 ⛳️,"Kicking off Ireland Fashion Week 2025, and taking over Teeling Whiskey Distillery in the process, Bold Gold redefine classic Golf ..."
youtube,streetwear 2025,https://www.youtube.com/watch?v=GbM0NA3mCnY,1781121625,Inside the Bolf Golf Show at Ireland Fashion Week 2025 ⛳️,"Kicking off Ireland Fashion Week 2025, and taking over Teeling Whiskey Distillery in the process, Bold Gold redefine classic Golf ..."
youtube,streetwear 2025,https://www.youtube.com/watch?v=INDdxvvfM2g,1781121448,Behind-the-scenes at the Ireland Fashion Week 2025 Bold Golf Sportswear Show ⛳️,"Kicking off Ireland Fashion Week 2025, and taking over Teeling Whiskey Distillery in the process, Bold Gold redefine classic Golf ..."
youtube,streetwear 2025,https://www.youtube.com/watch?v=ttzwemi4E8s,1781097730,🔥 New Trending Black Denim Shorts 2025 | Stylish Streetwear Fashion You Need to See! 😍🖤#shorts,Discover the latest black denim shorts making waves in street fashion! ✨ Featuring a bold graphic design and modern ...
youtube,streetwear 2025,https://www.youtube.com/watch?v=AN_OTgtlVWY,1781039173,How to dress like Jacob Elordi 🎱 #mensfashion #menstyle #fashion #jacobelordi #fashion2025,How to dress like Jacob Elordi #mensfashion #menstyle #fashion #jacobelordi #fashion2025.
youtube,streetwear 2025,https://www.youtube.com/watch?v=pov9SUIAc2o,1780928559,Stylish Black &amp; Yellow Track Pant 🔥 New Trending Jogger 2025,Latest Black Track Pant with Yellow Side Stripes Looking for a stylish and comfortable track pant? This premium black jogger ...
youtube,streetwear 2025,https://www.youtube.com/watch?v=a1vLkzJMInY,1780833600,2025 Streetwear Trends,"Streetwear fashion in 2025 evolves into a dynamic and futuristic style driven by urban culture, comfort, and sustainability. Discover ..."
youtube,streetwear 2025,https://www.youtube.com/watch?v=TXqZGGorAMI,1780762521,Recreating the worst outfit from 2025.     #fashiontrends #fashion #streetwear,
youtube,streetwear 2025,https://www.youtube.com/watch?v=yUbjCBjijeA,1780755670,Vintage Washed Shacket for Men 🔥 | Best Men&#39;s Shacket 2025 | Indian Streetwear Brand  #shacket,Vintage Washed Shacket for Men | Incroy & Merv SS25 Collection Looking for the perfect shacket outfit for men? This vintage ...
