source,query,domain,url,created_utc,title,text
gnews,fashion trend,news.google.com,https://news.google.com/rss/articles/CBMisgFBVV95cUxNYm5ReS1DZ2p6bFgzUjIzYkhzYWE4YW9BQW5GVmRpc3plekRFRmV5NXNDdzFhWHFhNWQ3ODZueExLWmRJX1V0QWRoOTJVZXEzU3Z4TmdicTZsNXlTQTRKVmJIempid0M4Ympzb3lzS09DQjBKMlJ4MVhvaGtBcXo0SkFDaDk1WlktTThRdUc1WnRtRWVFNEtndkRfclNzZTEtSjBnNGlCaEN4d3I3b1d0N3RR?oc=5,1775228813,How Gen Z Nostalgia and Music Are Driving Festival Fashion Trends in 2026 - WWD,How Gen Z Nostalgia and Music Are Driving Festival Fashion Trends in 2026 - WWD
gnews,fashion trend,news.google.com,https://news.google.com/rss/articles/CBMivgFBVV95cUxORldONHBlQXRNVThtYXJYTm9vU1hodjFxekRKbmUyYm1QdHMyNEYwT1NxWGZCZ3l6b2tsOEhsd2dPTU1FZUwxMXVuMEljQ3dkV0Q5cFIwV0VEdXlJd3ZyMTdiMGtDR1NfMXltQk55WGJreGpfYWliV0N4aFliaVZ6cDZadVJJSGZIaFV5ekRQZ0hwc2ZSc0Jjc0ZldU1LTHFrcHpnY1hzZTQtTmpNSWc0V0R0Qm5pdDBZN0hLal9B?oc=5,1775234496,Spring 2026 Fashion Trends That Actually Work for Women Over 50 - Yahoo Creators,Spring 2026 Fashion Trends That Actually Work for Women Over 50 - Yahoo Creators
gnews,fashion trend,news.google.com,https://news.google.com/rss/articles/CBMigwFBVV95cUxOUVRfekRsREpsTkFyd3NHcWV5RmtNajM3ODdrdEpBdXZteW5SOXJCX3BXTXZPOWxGQnVWQWo3aHJYRWVnalhtOUl6a3lEclBCR3o1YVhOSTcxQmVVd0wwekRZdThrZ0NOLUdHckMwUmd0T29ybGJEZ0tqMm9Kc1VwNV9LSQ?oc=5,1775243310,These Lightweight Spring Sweaters Go With Literally Everything - Harper's BAZAAR,These Lightweight Spring Sweaters Go With Literally Everything - Harper's BAZAAR
gnews,fashion trend,news.google.com,https://news.google.com/rss/articles/CBMicEFVX3lxTE1oYURQejZaQ3VOUkg2WEZTWC12dGI2RDQyVHEtSVIzOVlWU2FEVjhRRHIwR25nX0hHTFhQb2lwWXFieGNRalo3TGhfTzFnZzN2VXBKc2doSVZPTnVJbHFOd0xoTkNrMU5KTk4ybnZNX3HSAXZBVV95cUxQTnRlbmdFTVpOWWhSVVpWRzdYUGMyb0RwNnpfT1BrdEN4VVVsR2RYeTRlTjYxR2pBRlBTUGstV0Vpd3lNcEMybnJmNEtYMDN3S01zNFZzY082TTBSZHQyemNZNUR4OVhZOWFaazB6WDFiVkFCX0NR?oc=5,1775228594,Top 25 Luxury Fashion Trends in April - Trend Hunter,Top 25 Luxury Fashion Trends in April - Trend Hunter
gnews,fashion trend,news.google.com,https://news.google.com/rss/articles/CBMioAFBVV95cUxOTjJQX2tFbEkwR01GaUhGUklQOUw3ckFEYWRGMW43WXVJak15elVLRlY4MXR3T0d6SFE5YkdMMEZobktMS1Fkc21vQjY1SVBkX1JoazZIM3MzSmg5dWdXUnliQ1FYczRMU3RHbUZ4bTJPdjNZNFV1VlVBdUFpMUFEaThoekNuWk10X1NLZEVMXy16dFpMbHkxRTdrODBMWnZO?oc=5,1774906675,The Los Angeles fashion trend of the year is politics - Annenberg Media,The Los Angeles fashion trend of the year is politics - Annenberg Media
gnews,fashion trend,news.google.com,https://news.google.com/rss/articles/CBMigwFBVV95cUxOUnZRQl83dXdWYXJOOTNaaHVvRjVaYVBDaTFmUmpvaXI5aDFfTFhmWjd0eDBKTG91S3l2blMxek02YnlVRkRwZERESE5JbVpGajU0cElQSXloaGFHTkx3OV9veEpxd2UxRTRpWDVwRmRLMUlKVnctVGVuTEJnRjMzOTllQQ?oc=5,1774863600,Tucker Carlson's merch has become a major fashion trend for ... liberals. - Slate,Tucker Carlson's merch has become a major fashion trend for ... liberals. - Slate
gnews,fashion trend,news.google.com,https://news.google.com/rss/articles/CBMioAFBVV95cUxNdGpROFY4OFRXQ3hrbU9WZXdmbDBKanA5NkNSSDhlSVU3WEZyZDg5X2dNNzJoTDIwUlZOUmlJQ0gxWG1yNHQtRW5abGI2aFRDcUtsX3lIdU1DNmNscnROSnV1d0FnSTZhRlN3bGJkU2JZQ2hZLTNyR1NaU3psanBCelBlZXlrOVhfeFJMcWRPRWY1WUxsdE1Vb0lPVWFrd2sy?oc=5,1774953000,"15 Fashion Trends That Are ‘Out’ for Spring—and What a Stylist Says to Wear Instead, From $14 - Travel + Leisure","15 Fashion Trends That Are ‘Out’ for Spring—and What a Stylist Says to Wear Instead, From $14 - Travel + Leisure"
gnews,fashion trend,news.google.com,https://news.google.com/rss/articles/CBMioAFBVV95cUxNTlVuVE9KMmN2WEFMX3hZZ0lLb1RBTnlTS0VidzNrOTRjQ19ZV1NwOXRRZzFla0pMa1RNdER5YjVPUmVvc3lXX3Nib0hCczFhUXIteFB4dmZYb2FiZHZNRWwtWGEtZlpfa2IwM1pmVTA1THNMNk1BcjRIanh3LWhCX3BwS2FqS25XS2hqMnZrVTh0bUR5cmRLeUtUc2V1Q3dV?oc=5,1774989073,Emma Chamberlain Shares the One Fashion Trend from Her Early YouTube Days She Wants to Come Back (Exclusive) - People.com,Emma Chamberlain Shares the One Fashion Trend from Her Early YouTube Days She Wants to Come Back (Exclusive) - People.com
gnews,fashion trend,news.google.com,https://news.google.com/rss/articles/CBMigAFBVV95cUxOM1RSalN1eWIwcmlDUnFiYmQ4WTBOdVVaWVZqRW5ndFB4aWNORldxMTByOEN2LV9BMVp4NkhwU0FFMUZ0MDlqbURNRHhqYWFfQTI1VG5YTWYzYVZyZ1JzWElUdm5kVzhnaXcyVFBMRUhnU29wZkFrc0t5UkV0ZHB2ZA?oc=5,1775203200,Sharon Stone and Meryl Streep Are Making a Case for Blue This Spring—I’m Shopping the Trend at Quince From $40 - instyle.com,Sharon Stone and Meryl Streep Are Making a Case for Blue This Spring—I’m Shopping the Trend at Quince From $40 - instyle.com
gnews,fashion trend,news.google.com,https://news.google.com/rss/articles/CBMidkFVX3lxTE9LN2t1d1FVNG9jN2RxWHJZZDJnQmxfVXlMVF8xeXVpQVpsQ1BIMmJvZlV4RE81ZExkYVVYOEc2MGhrZGpSRkdpS3FvaFZRRU1JNXRrSVIwYUdkVHdEckI5bng0Z2FSMXFHMjN0TGRPQnllMG9TWFE?oc=5,1775026800,No Neutrals Here: 8 Print Trends Fashion People Are Wearing This Spring - Who What Wear,No Neutrals Here: 8 Print Trends Fashion People Are Wearing This Spring - Who What Wear
gnews,fashion trend,news.google.com,https://news.google.com/rss/articles/CBMi3gFBVV95cUxPNktZQ0R4ZVp1OGZGTnJJUmtwWjRYZWVYaXQ2eG5iNl9KckxZWVh2ZjZjNVpZQTNkRkc2b0lkekVZRkpULU1lSFlZSFR2RlNMcWstTTNlUk9mX2dTMGhOaEVab1R4WVdkSXQ0aUVVNThGcy1vSnk3V19SM19ZaHY1VGFDS0pMaWpubHVRZUNFNTFPa21DY0txb3hYVE5LOFA3QkRUSEYzeXRVbS12cE9WMzJHc1hBNFVrcm9Tc0xqY3hxVHZSWmd0bXhHMENTQUk2d3VfNTlkZUhLdTZEZWc?oc=5,1774789811,‘Leverage the local’: The fashion trend that explains why everyone around you is channeling their inner tourist - Fast Company,‘Leverage the local’: The fashion trend that explains why everyone around you is channeling their inner tourist - Fast Company
gnews,fashion trend,news.google.com,https://news.google.com/rss/articles/CBMidEFVX3lxTE01Y3VHS240bHNPcUthM0ZvODBXZ0xEV3lobTNaNlRudFB0M0dxUGNKbUx0cXc3SnRncWlra0I5NU53RWFxZ3ZfU04tYlZfUlBOdWR2eFhVaDJTVGJFNUpiX21tRUVIOW9EOC1mdkFJdGRZaEky?oc=5,1774985716,5 spring fashion trends you’ll be seeing everywhere soon - CBC,5 spring fashion trends you’ll be seeing everywhere soon - CBC
gnews,fashion trend,news.google.com,https://news.google.com/rss/articles/CBMijgFBVV95cUxPaWtGSTI2amVQUXgyV1g1SXViZkJ4Smg4SzQwMnZZZUpxdU1LUDBZTTRXX1VIQnV5TU91Q2gxSV9MYmd6VUlndkd4S2hVVF8zQnp2Mm5LSWlmRUFFLUo4ZGZUaDJ1bzZMQmVMTVRqTF8zYmZIUDRIWlQwSGphVkJONFE4RjBpTERwVGxUbVJn?oc=5,1775140546,3 Outfits That Made Me Believe in the Silly Little Pouch - Marie Claire,3 Outfits That Made Me Believe in the Silly Little Pouch - Marie Claire
gnews,fashion trend,news.google.com,https://news.google.com/rss/articles/CBMilwFBVV95cUxNR19IbjBfdVZpRjEyb1FVU0otdWptUUhhcjB0dlViNU5NMGdpRnlJaVVrUDJEZjdubE83X09HbDN4NDFkVUZuRWNyZGRpeGpKN0JJaFh6NXllV2hjUHRkVDQ2b3FDSlhWOXhSY2xYZGtyek55bkRPcXBmODd3TnhibWpTY1NkTWw5SGJjc1RncXF3MF9mbnAw?oc=5,1774865400,On Trend: 2026 fashion trends - Winston-Salem Journal,On Trend: 2026 fashion trends - Winston-Salem Journal
gnews,fashion trend,news.google.com,https://news.google.com/rss/articles/CBMipgFBVV95cUxPSnpON0NZdjZ0bFl6VW1lTTljT3pGWV8xZUs3eDI2TnpsOE9wQ3JjRC0wWDNMVU1VN0s2eno4Q1ROWXUxdTFDVldBS3luRzBfTUJ2dE0wWFdqZHUyX05Gd1YzNHM4TGt1OHlybm1UTjdEcnFmcXhqUkJSVHRnYUtHeFZyb2FYajlwTElhT0VCXzd0REpkZmRpZnlQc3RKN3J4Q3FmZTlR?oc=5,1775160130,Modest Fashion Is Booming — Here’s What It Borrows From The Bavarians - Harlem World Magazine,Modest Fashion Is Booming — Here’s What It Borrows From The Bavarians - Harlem World Magazine
gnews,fashion trend,news.google.com,https://news.google.com/rss/articles/CBMivwFBVV95cUxNZlNLd1dTUnNhUjMzMDJjWTZYMTdSUDRWQzZNOTdZZkNxWFlra1UwaGN0ZlhEa3NVV21qRGZFVm9aNDZjazdaTTM4YlRvbmRLNXV5VmZjUTd1NnBXSG1EYkR4S3F6Y0lvakpJQlBsVDJxRVpQVVFFNERhamRzU08tOWplcVdhR01yMFBzTlZoNkdpbTJfQkFEN2x2eXhKVVBqYzFDUzhHcTl5bUstMVJLWGRmSDVHVUdTU3M2dzlFYw?oc=5,1774699361,When the gloves come off: spring 2026 fashion trends - The State News,When the gloves come off: spring 2026 fashion trends - The State News
gnews,fashion trend,news.google.com,https://news.google.com/rss/articles/CBMijwFBVV95cUxNTEZIVU96bGRKYnRmY2tHeHA0a2NxYjIycDh0VjUwWTlWME0xaG1SOTlQYmlrNUdmQUtmbnhzQ19lU2ZZQUI3VjJpSGJqa1JjTnBmNW1uUzZtdkg1MEFnY0NSZmdpLWdic2p0d195VlYxMXQxWUdieXJEVFotdDJOY21HSlZqM2JGeWc3TXZWaw?oc=5,1775155811,Forget Basic White Sneakers—These 6 Styles Are Blowing Up in 2026 - elle.com,Forget Basic White Sneakers—These 6 Styles Are Blowing Up in 2026 - elle.com
gnews,fashion trend,news.google.com,https://news.google.com/rss/articles/CBMilAFBVV95cUxPVW8yUEFyRGRCWnlCWnhHb0ZwZEtPdklOZzFjQlhrNm9ZUGNPTEhQSG55cmhjdGozMG1yODdZa0FlNXgwNFJvVU92X28wS2o1cU80NDVvWG5pWUtlVXZ6UXRCbV9hdEV3MXUwdU9tTXNlaHZQLV9YMUZ4R0pCQWptU2Zuc2s3X1hvc2ZUcFVkSFVNTnNF?oc=5,1775229795,How to Wear the Tricky Trend We Saw Everywhere at Fashion Week - Harper's BAZAAR,How to Wear the Tricky Trend We Saw Everywhere at Fashion Week - Harper's BAZAAR
gnews,fashion trend,news.google.com,https://news.google.com/rss/articles/CBMioAFBVV95cUxPQmZFVTc5TWh2c1JNTEM3UkJ3YU9MbVJYcG5HWGRFdUhqUHMtQ1pRQ191Uk5zRzhNZEpKTzczd1NnQ0FaWXk4SEVIVWJINi1CUVZ1RlhlVEVlbzZ1Yk9Tb2ZmX3dMdWJma29HRmg5X3VQUFNRWDhwMm0wVWljSmw3bGtpUFJ2bTRJM3ZtX1ZZRlkzMFV5dDNBd0hoTTc5OFhm?oc=5,1775192682,Fall 2026 Ready-to-Wear Trend: Coats [PHOTOS] - WWD,Fall 2026 Ready-to-Wear Trend: Coats [PHOTOS] - WWD
gnews,fashion trend,news.google.com,https://news.google.com/rss/articles/CBMif0FVX3lxTE1CVjhwY1FsOWVRVy1PVGEwbXltaERDU1JpVG9EbHhyVTBtcDdWMVF6elA5cjRocVVrYmM5MWlrM0p4SzNOenBRZHRCdDMybFdqRmt2VXVsVk4wY2JLc2hieU5iMHVrOWJzXzNrQlRqSk1Teld1SUVHQnpLSElsVjQ?oc=5,1775128679,This Divisive Shoe Trend Is Replacing Ballet Flats For Spring 2026 - elle.com,This Divisive Shoe Trend Is Replacing Ballet Flats For Spring 2026 - elle.com
gnews,fashion trend,news.google.com,https://news.google.com/rss/articles/CBMigAFBVV95cUxQR1FuRFkyMU1tbnY2ZzVZbXRtRnJwdU9ZVFZwb2JlN2ZNR2hxcWliMWMzRmdlOWpXVkttRXAwT1V0RGV4VDhFU3BfWWJ6TFZXX0lQUC1ONzhlMmotU09lTG5MdkpITGtpTHpyak9rT0lhQ2JGZkYwRV9rbm5MQmhiUQ?oc=5,1775044271,8 Looks for Wearing Spring Fashion Trends (Well) - Vogue Arabia,8 Looks for Wearing Spring Fashion Trends (Well) - Vogue Arabia
gnews,fashion trend,news.google.com,https://news.google.com/rss/articles/CBMimAFBVV95cUxPa3QwUkdtMTduZkY1SHVJN0ZqaWpDTUVvYmdtZ0F2azFhM0hEM180T1RLRWlIMlpMNjRER1p3TVA3UXllSFJFYmhuYTVaSjZubFVUcXItV1E2NllpMmRXZGowREd5UGhoZ3hOdUhyXzdGcGgyY3NjaXh3M0poNkJPUUNTQ0FEWW9Kb0lzVXZfQlFTWnV2MmdPeg?oc=5,1773817200,The math that explains why Y2K is back in fashion - Scientific American,The math that explains why Y2K is back in fashion - Scientific American
gnews,fashion trend,news.google.com,https://news.google.com/rss/articles/CBMihgFBVV95cUxPSnhSQXpBZU5MNlVKaEhvYS16djBMSXY0YlRDdlJ2LXNFUHF3Z2FOVUhfYkxJLTJNdXJnNGY0RnB3bHZ4YVM2WlVvNy1ZY0t5YzlIRFBwcERsd1F6aXYya3NGVHdfNlNZcE1yWl9uSnpSUkxnMjdaZlJMcXZWTXdOcjFvN0lPdw?oc=5,1774987894,Plaid Is Spring’s Surprise Trend Taking Over—Here’s Why - elle.com,Plaid Is Spring’s Surprise Trend Taking Over—Here’s Why - elle.com
gnews,fashion trend,news.google.com,https://news.google.com/rss/articles/CBMiWkFVX3lxTFAxT1lBOTlXQVNNZ2VhU3NHdFdLbFN1QnNCaUVQdk1KMmgwYjZ2WjM1ZW9VdzJFTHBMYWpQVXZSTzBxZEd2dW0yM1Q1NUdsbzgweGltdDEybElodw?oc=5,1774695381,"Goodbye Ballet Flats, Hello Derby Shoes: The French Style To Step Into This Spring - Vogue","Goodbye Ballet Flats, Hello Derby Shoes: The French Style To Step Into This Spring - Vogue"
gnews,fashion trend,news.google.com,https://news.google.com/rss/articles/CBMigwFBVV95cUxQSlViV25ISnVCbUU4VVRUX3YtRGFMZERFcjhVLWhBTHUxNXAxX2dYVVJGT3NJcVdyLXJIMmg0WHpsNVVFT3dtR3VaMUhSb0RtQ2JuSVRSck5QU3dOU0V6WGQzRE5wUnJQLU9HN1FadFVwbGRUQ05SS0lzYlNoeXdoYVhORQ?oc=5,1775203200,"Not denim, not leather, Anita Rani gives a masterclass in how to wear spring's biggest jacket trend - Woman & Home","Not denim, not leather, Anita Rani gives a masterclass in how to wear spring's biggest jacket trend - Woman & Home"
gnews,fashion trend,news.google.com,https://news.google.com/rss/articles/CBMinAFBVV95cUxPbk94Y0dkVHBRZmlhNkJvQndKU3V2UERLd1drUWozT2VWUmI1OUZuNVh4QnFSb3Z0UDdWZVNHRlloUTQxU184UFJYS2toSHloc2FyanZPTGpNTE0yaE5OdDVXYmNHQzNna2dUMG9TTTVYZU9ZWjFfYXhqdmxZOFNCQUswY1VZQmpEaGZhcDJiT2tfeXhGRUtXVy1XWjM?oc=5,1774868400,"I’m an NYC Fashion Writer—These Are the 7 Spring Trends I’m Seeing Everywhere Right Now, From $16 - Travel + Leisure","I’m an NYC Fashion Writer—These Are the 7 Spring Trends I’m Seeing Everywhere Right Now, From $16 - Travel + Leisure"
gnews,fashion trend,news.google.com,https://news.google.com/rss/articles/CBMic0FVX3lxTE1pZDhmTm4yZzY2MzZrWnRCWlVQVGl2Z2cyYjh6Z2E2aGhzU1BIZFJEWDJMYkJ6UHJfTVNXbllJLWJ1THZhNXRaV3R6WUdWNi1mUGtJX1ZMNWlWa2c0YmdvSWx5bm1ZVnVGUndWNnMzWXNFVm8?oc=5,1775160000,"Princess Diana's 38 Most Iconic Style Moments, From Her Wedding Gown to That Revenge Dress - instyle.com","Princess Diana's 38 Most Iconic Style Moments, From Her Wedding Gown to That Revenge Dress - instyle.com"
gnews,fashion trend,news.google.com,https://news.google.com/rss/articles/CBMiYEFVX3lxTFBCaGJVUHFjVkNZMVZEaklNV1RNdHlXcXdnbDFxbG8zY2tadnBOYVhndVFIOUNUWUJVMU84Q0tPQkNWWU1udEpCQmxmSXF5QzdBSS1uazBQbTZwanVHNnRHNw?oc=5,1775088000,The Fresh Bag Trend Fashion Insiders Will Wear in 2026 - Who What Wear,The Fresh Bag Trend Fashion Insiders Will Wear in 2026 - Who What Wear
gnews,fashion trend,news.google.com,https://news.google.com/rss/articles/CBMilwFBVV95cUxPd01QU05aazFqc0ZFdXVVcjd6S1dQc1NNZnV2c0c1eGduNzdEeFZuU2dZRG1pYUE5VzFQS1NFMG5iRWVja3I4YTZ5VzZZcXhEY1AxYWZIcDRoSTlodzNGYUQ1eWNmaEZ5aThhVU1iUVhkZnlxaXVBcmszcnY0LUpkUmRsa0JkNDdkRHl1Q2lTM3N3X0g1VWgw?oc=5,1773730800,Why Fashion Is Suddenly Obsessed With the 18th Century - elle.com,Why Fashion Is Suddenly Obsessed With the 18th Century - elle.com
gnews,fashion trend,news.google.com,https://news.google.com/rss/articles/CBMia0FVX3lxTFBnOHV3aWI3MXphWGVnQ0NZbTVCUlVTYUtKWklFTVZDWWJ5V2JVRXJ5U2Zxb1FmMmhybGhPVWV5VEwyV0djX3FoWWRtUzNKbUlGVWdQNjYwb0lkSTRqLV81YXhNNDBYUWUzdFlr?oc=5,1775152800,The Handbag Trends Everyone Will Be Carrying This Spring 2026 - refinery29.com,The Handbag Trends Everyone Will Be Carrying This Spring 2026 - refinery29.com
gnews,fashion trend,news.google.com,https://news.google.com/rss/articles/CBMia0FVX3lxTE9KWndoSVVrU0tJeFNyWlFNUkVCRjZSM05VNXRBRU9udEg1U1ZSSWVMRnJ1b01kVmd2cm1CV1htUUhfaFhBLTNuaWw0WTVHVDJjQ3dnQ0hvTnZ6LVBLRmdTb3NSQzVnM1dZVjln?oc=5,1775060220,"My Attention Span Is Zero, But These Spring Sneaker Trends Have Me Locked In - refinery29.com","My Attention Span Is Zero, But These Spring Sneaker Trends Have Me Locked In - refinery29.com"
gnews,fashion trend,news.google.com,https://news.google.com/rss/articles/CBMihgFBVV95cUxNeEpGV3dOTld5Z1Ixamx1WTlGOTZIckFmMVkzSmZBLU9TNlByNm0zTVNhNWJnYS1nUkI3Q2dDdTlualhLejI5TUtzMklEcVphMmRSS3JtR3I0TUxXQV9wX3ZleE40cHpkVWtmMlZvUW1QMFBlU1g0TWx1M3JnaEVKdWpwTVhQZw?oc=5,1774989705,Emma Chamberlain Shares the One Fashion Trend from Her Early YouTube Days She Wants to Come Back (Exclusive) - AOL.com,Emma Chamberlain Shares the One Fashion Trend from Her Early YouTube Days She Wants to Come Back (Exclusive) - AOL.com
gnews,fashion trend,news.google.com,https://news.google.com/rss/articles/CBMicEFVX3lxTE4ySXI2QzBxY3gyNER1dkl0V1p5eVBfYUFXcVBUcFowTm9tU1hvNGZrV0JVR3RrR1BaOHZMOHhPUm9OUHcyR01OTldrSGJ0TEFFb1k5Q3phQnc2VC00R08xVTdVSkl4cTVHUXNqOTRWUno?oc=5,1775139020,Granny trainers are the normcore shoe trend we're obsessing over for spring 2026 - Glamour UK,Granny trainers are the normcore shoe trend we're obsessing over for spring 2026 - Glamour UK
gnews,fashion trend,news.google.com,https://news.google.com/rss/articles/CBMi2gFBVV95cUxQSm1rWmlPa2dGM25oZnNIa250VWFyVGctUEc0WlZPbkhWVmpxeVdENF8xWl9NLThSZkt6S2oxaFBwZ0tSbmtBYVpTamJBZ1hfUWM5a1U2QVhENXVIT0xJUmtsNGNOQVc0N2lURVJNUzlIWW1oRXd5XzlBbHp6eW8tQVVSSjRtTUp6RktaMXYxYks0U1k2QkFYNzMxb05LbjZSWWdGdDdiUHM3S0ltdnpZRFZvR3kxR1ZBSGl2ZWxMUjMwbFQxOEp4MGw4S2RyZ09sYmFrdlE2QU1rQQ?oc=5,1775159820,Shop the bedazzled Dolly Parton x Good American denim collab today - USA Today,Shop the bedazzled Dolly Parton x Good American denim collab today - USA Today
gnews,fashion trend,news.google.com,https://news.google.com/rss/articles/CBMinwFBVV95cUxOZzFzeWw2cUlEaXFqS0hydzNNTVVsT2VfNzRJc1V4VVF6cm1PYTFqZ2ItSjRQeUw0YlBYWkNUVXJfZU56MFlUNnhLVEltbVJTdlc5aElmYnlfdTlvVEd2MWV0M1dCbVdvNkp2OVZjci0zSXBMN29NVVllMFd5VGJyWlVBYUxsQVdxTjZKY2J2bEhLMGtDX2JMUUx1cUd1YzA?oc=5,1775126321,"I’m Normally Anti-Leggings, But This Divisive Spring Colour Trend Has Just Made Me Rethink - Who What Wear","I’m Normally Anti-Leggings, But This Divisive Spring Colour Trend Has Just Made Me Rethink - Who What Wear"
gnews,fashion trend,news.google.com,https://news.google.com/rss/articles/CBMiowFBVV95cUxPWk1VOTJtbzhSY2FuQXQ5ckdNS2RwYi16dmpYSmpZSnZkVzcxZlpzSXJSS1VMR3lSbHN6RXpWSjlpRTlrMktxM01jWXB1Uk5XWkx2NXFTb0ZXaWRyWllrTGQxNHF1a196NDU5VlVOMDFlUkk4dDI0c1MyUkdPNjBSN20yeUppcHBGSkdzY1M5RFdza0FZWHRpQXU1VG5PNmVDZ1Br0gGyAUFVX3lxTE5NSVI2c3A3elhpVW5rSmxtRjlpM09kSUtBT2ZTLVFFVHFhVWRFZkE2R25MM3pNdjh5MlJkYVl6TWpFMmU3UFNPa29aRUUtZnQtMXh2TURrakZRUzBDZDFCS0NvdUtJbm1aWDlMQlo1X2ZPZGVERVVvUm5vWE9LYlo1a09mRHpCRFNYNzUxMzZqazE4U1lJRnlaR1ByWjlTOEVvWkhZeEFhejZzakhENTdMYWc?oc=5,1775070480,Melania Trump joins Amal Clooney in fringe revival trend by rewearing white tiered fringe dress paired with white Louboutins - HOLA,Melania Trump joins Amal Clooney in fringe revival trend by rewearing white tiered fringe dress paired with white Louboutins - HOLA
gnews,fashion trend,news.google.com,https://news.google.com/rss/articles/CBMiqwFBVV95cUxQdmxkSzFlMk0xbHRSYXMxNTFpMnkxZldxcWFNRHdOX1ZpTUgxcUFQY3hNeDc0Z2xqMFVYb2hLUWZoYlBOZU9vdWd4UFo5SnZMU1F2TXdZdTZLMjhJYU8xMTJzSzlIR3I4bVZlcmpWWi1vbzhaV19Ram92TENvc1RIWmZxVFdvMzVEYUpyX1Z2aGRJTGRpa0wzRXNhdGRhemZPb1Fkc1h4U0IycEU?oc=5,1775011080,Sadie Sink Revives Claire Danes’s ‘Romeo + Juliet’ Style in Prada - elle.com,Sadie Sink Revives Claire Danes’s ‘Romeo + Juliet’ Style in Prada - elle.com
gnews,fashion trend,news.google.com,https://news.google.com/rss/articles/CBMilwFBVV95cUxQSW5YV0EzYzhmRXJsVEhkXzVNZzd1T2xvVVFEclNzM0ZzYldDOEtNM0xUMk5PNDU1T21rVzRob1ZsX1kxMVFqcXcwTHQzWkJsZlFYaXNGeVV4aTZRdFBfNVd3Y2ktRUwyVHlETDVrRjlLY0VpcVJmZFJKdGZHTEJiZDhtR09VTlpNUVltSmphaS1lSlRnX1hr?oc=5,1774508400,Vintage to Vibrant: Spring 2026 fashion trend predictions - The Lantern,Vintage to Vibrant: Spring 2026 fashion trend predictions - The Lantern
gnews,fashion trend,news.google.com,https://news.google.com/rss/articles/CBMie0FVX3lxTE1hejZSSDJYVEV0d202OUJjSHNKM1g1VW51QVhQcXhvOVZnQ3ZnZjMzZ0c5ZnlrcUUzTUhDVktuUWFqZW02YV9iWVZkcDhEZmtlbmhSOV9lSWxEVk53bGhJYTVMSVR0dzJVeVhIeUNiWkZpRElpNUFTLXBzbw?oc=5,1774973108,Everyone in the Group Chat Wants a Piece of Laura Harrier’s Closet - instyle.com,Everyone in the Group Chat Wants a Piece of Laura Harrier’s Closet - instyle.com
gnews,fashion trend,news.google.com,https://news.google.com/rss/articles/CBMid0FVX3lxTE9wVUcwU25VOHRFaEFtRmEwamUzNTRjYjBXcGxDVnVIVnRsOVZTV3NKR2hZLU02VHZsdTRicWUwSzViLVJMY0dsUHVwNXRwRlhua041NHBWUlFNa2FIaXNIRW90Z3cxdmpMQTN4VjQ3X1JiTE1aVWxj?oc=5,1775003173,These Slip-On Sneakers Nail the Eyelet Trend—and They're Under $60 - PureWow,These Slip-On Sneakers Nail the Eyelet Trend—and They're Under $60 - PureWow
gnews,fashion trend,news.google.com,https://news.google.com/rss/articles/CBMijgFBVV95cUxOM2ctcHdIa2stUWs0NklZVTJHenphVVV6VjlURFJiMFVUVDdKc0dXQ1FfTFh5Z0NRcmdLN241QTdFN1hoSnJkbXdXOGtvc2RBSTd5Q3pOVUpSRHVKZ04yay1EU3hzN28waW5pOVowTktLQ1E5UW5EZDBqOENEOVc1OXowZ0VMc29MWlBjU1Fn?oc=5,1775163263,The Party Heel Trend for Anyone Who Misses Playing Dress-Up - Marie Claire,The Party Heel Trend for Anyone Who Misses Playing Dress-Up - Marie Claire
gnews,fashion trend,news.google.com,https://news.google.com/rss/articles/CBMihgFBVV95cUxObW13Y00wMThsVThaVXRBTEV1SXRQQTZsQ21wYU1XMmkyZWRTSWUtTlVjNkFadFNNOEg5cVpoSkZYZmMtTVJVNlc1XzlvNEE2MGxvak85bE94Y3JOZ2VHNzdhbjJmOFl3TzREVUtYSy1ud1pzR3RXWDNFMGdMakZwRXNVQ0ZKZw?oc=5,1775069700,7 Amazon Spring Outfits Starting at $13 That Look So Polished - goodhousekeeping.com,7 Amazon Spring Outfits Starting at $13 That Look So Polished - goodhousekeeping.com
gnews,fashion trend,news.google.com,https://news.google.com/rss/articles/CBMilwFBVV95cUxNR2I3cVhVbWpTWlByZTJQbVcwekZQNXRkdHBhZ1NoS3lQbWpvNjFraGVFUUJ4TDRRb29TamxhZzl4S0NQVVg3ZEotUFQ3dUUwY285aGNDRmxsWks1dnNJdHdtS1VFcHJveGJfcEJoczVQTFVYNTgzRE9OUHk5ekd5WWVXTFozbTJsX2FsSFE0cFJYS3YtUVFn?oc=5,1775115229,9 Street Style Trends To Try For Spring/Summer 2026 - Harper's Bazaar Singapore,9 Street Style Trends To Try For Spring/Summer 2026 - Harper's Bazaar Singapore
gnews,fashion trend,news.google.com,https://news.google.com/rss/articles/CBMiYkFVX3lxTFBQS1ZESVpuMHZWcmozazBjdVl5dUhuOWlOSUpQR3g3dW1WZDhxcTIzWDEtR0xWa3B5THRKenlnUmZaS0d0V3hzZlFyRGtIWnYtLVR4bXo4NTBNWDhOZGFYREpn?oc=5,1774888800,15 Refreshing Floral Dress Trends for Spring That Are Actually Groundbreaking - instyle.com,15 Refreshing Floral Dress Trends for Spring That Are Actually Groundbreaking - instyle.com
gnews,fashion trend,news.google.com,https://news.google.com/rss/articles/CBMiiwFBVV95cUxOeHAtdVlreTBmei02MHpTQlVYODhvVGJfTnFHNTVzR0ZTc28tOFFPdTVQemJITnZDdzNhSzdiZzhiVjVDUzRnQ1dHZG8xWllhR0tjcUhrcGZ0aS10X19ERkVLRGRsQUQ2WGxaV2NlMHR2M2dGeUVVS2thRGV6NVZsV1A1WmlUaVpTVHpZ?oc=5,1775026800,This Is How Fashion People Are Wearing Spring's Sporty Jacket Trend - Who What Wear,This Is How Fashion People Are Wearing Spring's Sporty Jacket Trend - Who What Wear
gnews,fashion trend,news.google.com,https://news.google.com/rss/articles/CBMitAFBVV95cUxOeEVQWmhuZk5kNzVidTFadkFnczFyRS02bGY5WGNaZkN0ZXBhYWxKYXIyeVJBXzZ2WE5pRHdPSE1vcThMRDhvRTVqM180THBTZ05fUlhqSUV3VnFCNE1vZE5BZmlEdkM3YjRzNlJLWncxeVhaRDBiUHRlTTJwZEFvMGRxM24yVEJnY3hwMEtyVEZxeHRmUm1aRC1PZkpPNjZYOFZ4Rjl4ZEFnS0tyY0FjVkM1RnE?oc=5,1774980094,Celebrities Embrace Flare Jeans and Distressed Denim Trends - Sourcing Journal,Celebrities Embrace Flare Jeans and Distressed Denim Trends - Sourcing Journal
gnews,fashion trend,news.google.com,https://news.google.com/rss/articles/CBMiZ0FVX3lxTFBfMUwtMEE4aVM3YmI5VGtkZ2dleVFxTWxzV2tzbHpySDdJQ1dSUnFuRmFpdGo5VVRVbHAzOWc3TlRyQ0ZReW1DSTlSYkljczRDdXBTVTVBc2c1UmdfbnNvX2ZwOHpwVVU?oc=5,1773903600,The Key Spring 2026 Trends to Add to Your Wardrobe Now - Vogue,The Key Spring 2026 Trends to Add to Your Wardrobe Now - Vogue
gnews,fashion trend,news.google.com,https://news.google.com/rss/articles/CBMidkFVX3lxTFBpOEx6NkZ3d0VkMHdIYnJ3X3IzQW84eENTR3JzQVNqOHpyX2F6SDVzREd3XzZXU2tJenpMNk5UczlidnR2MFd1S0ZJMFN5eUUtODl1M1FoZ05MZlpoSWNubm1rQzhMVW5fSEhQUWhZdHJQVlE2SUE?oc=5,1775113200,6 Spring 2026 Skirt Trends Chic People Are Skipping Jeans For - Who What Wear,6 Spring 2026 Skirt Trends Chic People Are Skipping Jeans For - Who What Wear
gnews,fashion trend,news.google.com,https://news.google.com/rss/articles/CBMiakFVX3lxTE1lRnBmS25VeVNvWEI4VjVjcmtaQnJSVUJoWGhDUWtqT3lYYkZ6ZUJmc0xLMHJBQ1dnWDVESW1ybUJobldqYmt2dXduRlhNYjJVQmJSMS1KYkJWMkluVXlaUjhzcDNtLWxBVFE?oc=5,1773817200,"Fashion trends cycle every 20 years, mathematical model confirms - Popular Science","Fashion trends cycle every 20 years, mathematical model confirms - Popular Science"
gnews,fashion trend,news.google.com,https://news.google.com/rss/articles/CBMihAFBVV95cUxPLThCbHg4VU9uT2wzXy1BNkM3bW1RZWVSMkdRY1YtZnNFcjV0TXJEWEpRMGsxazNncl96eFc4NnNqTUNVZHBYR1FNRzJic2l5bVdtTjlaUy1mQWN3N0dZVnVqWTlKNTJrSzVBdGU4WW5iYkN3aUROcmg1NVllVlpiSncteHg?oc=5,1775063100,5 Ways Fashion Girls Are Wearing Asymmetric Slip Dresses This Spring - elle.com,5 Ways Fashion Girls Are Wearing Asymmetric Slip Dresses This Spring - elle.com
gnews,fashion trend,news.google.com,https://news.google.com/rss/articles/CBMikwFBVV95cUxOUVA0UXNCQjRZNjMxRDdINmN1a2tMTzV4WHdHYWpKU1hOenlUVzVvamQtSzl4eG1nY21YaEVtcG16YTdqaVVsci04QVV6SzF1a1VINm8xWUtSSm5URGV4YVhCdkRxSDI4cWFBbHhjWnZNQ0xyZTBqRmU5aXdLcHNLSHBmUi0yZzdzVjdXNGRKUkZmajQ?oc=5,1775092648,The Unlikely Utilitarian Staple the Fall 2026 Collections Have Me Coveting - Harper's BAZAAR,The Unlikely Utilitarian Staple the Fall 2026 Collections Have Me Coveting - Harper's BAZAAR
gnews,fashion trend,news.google.com,https://news.google.com/rss/articles/CBMifkFVX3lxTFBQZ2VnRTBXUGtTTzVDUjJlUzVOUU14UmR3bkJfTEh0QXgtcGhiSXo0blJKR1I5c2tIM0l5bGY3bzhlUFZjMU1IOS1wbm52emJrOFhIOTVKTmc2ZTR4ZWhOWkwwWkE4VFc2aTV0Umd4NXJKTGxXZG56UHdDVUhvZw?oc=5,1775007695,"Move Over, Suede—Every It Girl Is Wearing This Luxe Bag Trend - elle.com","Move Over, Suede—Every It Girl Is Wearing This Luxe Bag Trend - elle.com"
gnews,fashion trend,news.google.com,https://news.google.com/rss/articles/CBMidkFVX3lxTFB3RmhlbF8xSzhneVB4NGI3aG1ndGRtUklHRzdqTWhxODZvZGZmTkk5RGlnblNMYjZNYU1Rc3pqZkUtYl9iLVFyWkJEc0hFR3p4aVk3WVJCZ0poRWtsemNHQ2hSaUhkaWdjWUVHRWxzZURfdUVEMEE?oc=5,1775073303,"I'm Not Saying That Polka Dots Are Done, But This Summery Trend Is Getting a Lot More Attention - Who What Wear","I'm Not Saying That Polka Dots Are Done, But This Summery Trend Is Getting a Lot More Attention - Who What Wear"
gnews,fashion trend,news.google.com,https://news.google.com/rss/articles/CBMif0FVX3lxTFBZa2NXYnZtWkIxdkNjeHJmNWpFS2hFYk5VYlRXQ1JmUUxVMTFrbUJUb0MzSXJONGNXR3NoRWtOS1RsSGI3a3VKWFM0NlA0VnRCdmFyakk4di1XbW5RaDU4T1phZHpTZnhTWXhYMlNtZHhVUVpacjRpaVVGUFFsOUU?oc=5,1775051099,"Not Barn, Not Suede—The Elegant Jacket Trend Fashion People Are Pairing With Leggings and Capris - Who What Wear","Not Barn, Not Suede—The Elegant Jacket Trend Fashion People Are Pairing With Leggings and Capris - Who What Wear"
gnews,fashion trend,news.google.com,https://news.google.com/rss/articles/CBMilwFBVV95cUxQZ1BQLXFZLUlOU2FOWW00el9oVDV5R0JxdGV4eXhuMnVRaUdfN21CcE16Y0pBZjZrSUdlQ0o2ZGhrYmo1cFNKODVLOUx3cGVMeHQzUGFzYm9JRnd3dklJd3lTczNGWUxKclpZVE9ZMzNqS0VnTDJSeTc3QV9VMUJ2c3MtQlhhUFhtUDh4cmduNWxOQjFkYmlB?oc=5,1774974213,Bandana Scarves Are the Western-Inspired Spring Trend I Can’t Stop Thinking About - Marie Claire,Bandana Scarves Are the Western-Inspired Spring Trend I Can’t Stop Thinking About - Marie Claire
