source,query,url,created_utc,title,text
youtube,men's fashion trends,https://www.youtube.com/watch?v=NXMZTE-bx8I,1782239763,Flipflops under 500 | Budget fashion #tamilfashion #mensfashion #fashion #fashiontrends,
youtube,men's fashion trends,https://www.youtube.com/watch?v=VBQkgF0njWE,1782239557,👑 Top Men&#39;s Indo-Western &amp; Western Fashion Trends 2026,
youtube,men's fashion trends,https://www.youtube.com/watch?v=JH-3TaeJAEg,1782239435,Men White Kurta Design 2026 | Latest Stylish White Kurta Collection for Men,"Welcome to our latest collection of Men White Kurta Design 2026! Discover elegant, stylish, and trending white kurta designs for ..."
youtube,men's fashion trends,https://www.youtube.com/watch?v=-RLmzQL7lxQ,1782238190,I Found the Best Bootcut Jeans for Men 👖🔥 Perfect Fit &amp; Timeless Style in 2026,"Looking for the best bootcut jeans for men? I finally found a pair that delivers the perfect fit, timeless style, and effortless ..."
youtube,men's fashion trends,https://www.youtube.com/watch?v=mJ_nXjc7Q58,1782237403,Make that man’s jaw drop with these sis 🥰 #fashion #fashiontrends #dresstoimpress #maxidress,
youtube,men's fashion trends,https://www.youtube.com/watch?v=V6wmX6yQu70,1782237079,#bollywood #fashion #dress #embrodering #love #fashiontrends #style 👍👍👍👌👌👍👍👍👍,fashion dj.
youtube,men's fashion trends,https://www.youtube.com/watch?v=w06izp0rEzs,1782237027,Mens Fashion | Oversize Polo with Baggy Jeans #fashion #fashiontrends #fashionshorts #ootdguide,
youtube,men's fashion trends,https://www.youtube.com/watch?v=TMJeEUOVnOw,1782233553,🔥 Men&#39;s Summer Fashion 2026 | Black Polo Shirt &amp; White Shorts Outfit Ideas #shorts,Upgrade your summer wardrobe with this stylish men's fashion combination featuring a classic black polo shirt paired with elegant ...
youtube,men's fashion trends,https://www.youtube.com/watch?v=vqz2jN1UZ-M,1782232700,Top Trending Summer Color Trends for Men 2026 | Must-Have Menswear Colors This Season 3 #shorts,MensFashion2026 #MensStyle #SummerFashion2026 #MenswearTrends #SummerStyle #MensOutfits Summer 2026 is bringing ...
youtube,men's fashion trends,https://www.youtube.com/watch?v=oGiLNGTLLDU,1782231031,👔 ¿Los hombres no se saben vestir,"Junto a Melina Rapimán, docente de Diseño de Vestuario y Textil de la Universidad Andrés Bello (UNAB), conversamos sobre ..."
youtube,men's fashion trends,https://www.youtube.com/watch?v=RLU5TAj71Gg,1782226823,COOL MEN’S STYLE: PURPLE &amp; BLACK 💜🖤,COOL MEN'S STYLE: PURPLE & BLACK Step into standout menswear with the Cool Men's Style collection featuring bold ...
youtube,men's fashion trends,https://www.youtube.com/watch?v=0wwncgYddt0,1782225760,#fashion #latestafricaprint #mensfashion #abayakaftan #fashionstyle #luxuryfashion #fashiontrends,Luxury looks good on you. Step out in confidence. #DeesClothingGlobal #AfricanMenswear #LuxuryFashion ...
youtube,men's fashion trends,https://www.youtube.com/watch?v=kXBRWIjwDfg,1782218626,🔥 Men&#39;s Fashion Transformation | Stylish Outfit Ideas | Men  Printed Spread Collar Casual Shirt,Men's Fashion Transformation | Stylish Outfit Ideas | Men Printed Spread Collar Casual Shirt Upgrade your style with this clean ...
youtube,men's fashion trends,https://www.youtube.com/watch?v=DiuxOkrOUVE,1782218512,U NEED only this shirt! #deepchic #glowuptips #manfashion #fashionstyle #fashiontrends,U NEED only this shirt! #deepchic #glowuptips #manfashion #fashionstyle #fashiontrends.
youtube,men's fashion trends,https://www.youtube.com/watch?v=yOZ5TGcKRO8,1782217802,3 modern hairstyles for men #mensfashion #fashiontrends,3 modern hairstyles for men #mensfashion #fashiontrends MY FASHION INSTAGRAM ...
youtube,men's fashion trends,https://www.youtube.com/watch?v=1wymQF1OVoA,1782217326,Must Buy These Black &amp; Beige Jeans😮|Jeans| #mensfashion #shorts,Must Buy These Black & Beige Jeans  |Jeans| #mensfashion #shorts Here is your product link (press long on the link to open) ...
youtube,men's fashion trends,https://www.youtube.com/watch?v=MYV5nyDm8lM,1782214226,The Only Jeans You Need in 2026… (Most Men Will Style Them Wrong) 👖,"Skinny jeans are officially back in 2026! But before you start wearing them like it's 2016, Masterji is here with a lesson you don't ..."
youtube,men's fashion trends,https://www.youtube.com/watch?v=rTzUL0W4LE0,1782213435,Dress Code Doesn&#39;t Matter - if you are billionaire Fashion #FashionTips #FashionTrends #MensFashion,"korean fashion style, street fashion, korean fashion try on, korean street fashion, gender-neutral fashion ideas, fashion tips for ..."
youtube,men's fashion trends,https://www.youtube.com/watch?v=urPqeIXKt3Y,1782211730,পোশাক আইটেম ( আপনার প্রতিষ্ঠানের জন্য এ আই ভিডিও বিজ্ঞাপন বানাতে চাইলে আমাদের সাথে যোগাযোগ করুন ),Contact Us ━━━━━━━━━━━━━━ WhatsApp Only 01789814390 শুধুমাত্র WhatsApp-এর ...
youtube,men's fashion trends,https://www.youtube.com/watch?v=71Wf5Ta56pw,1782210635,Trending formal shirts for men / formal dress for men colour combinations | plain shirts #shorts,Trending Formal Shirts for Men | Best Formal Dress Colour Combinations | Plain Shirts for Office & Wedding Look Looking for the ...
youtube,men's fashion trends,https://www.youtube.com/watch?v=7ty9ztqd7L0,1782209286,2nd one is the best ⭐️ #ootdguide #ootd #fashion #fashioninspo #grwm #fashiontrends #mensfashion,
youtube,men's fashion trends,https://www.youtube.com/watch?v=-Jtgc7JoYrg,1782206614,rich outfits #fashion #ootd #youtubeshorts #fashiontrends,
youtube,men's fashion trends,https://www.youtube.com/watch?v=TZrOPGP6z40,1782205203,🚨 I Bet 99% of Men Would Instantly Look Better If They Dressed Like This 😳🔥#fashion #aestheic,Looking stylish isn't about owning more clothes—it's about knowing what works. This fashion edit showcases the kind of outfits ...
youtube,men's fashion trends,https://www.youtube.com/watch?v=t4INElmtNNw,1782197122,"Pack of 2 Men Self Design Polo Neck Cotton Blend Black, Grey T-Shirt",Watch this stylish fashion showcase featuring a modern black-and-white outfit combination on a walking pad. Perfect inspiration ...
youtube,men's fashion trends,https://www.youtube.com/watch?v=33FytyTHJKA,1781922621,MILAN MEN’S FASHION WEEK 2026: Top 10 Fashion Trends from Ralph Lauren SS27 Menswear collection ,Milan menswear fashion week show is here and Ralph Lauren Spring/Summer 2027 collection has arrived with top details that we ...
youtube,women's fashion trends,https://www.youtube.com/watch?v=IY9dEgjJboY,1782235824,#humor #usa #foryou #fyp #love #crazyfashion #shorts #viral #youtubeshorts #fashiontrends,
youtube,women's fashion trends,https://www.youtube.com/watch?v=ltJKsg3H__U,1782234009,Top Summer Dresses 2026 #fashiontrends #fashion #dress,"Welcome to Studio Hype – your destination for the latest fashion trends, elegant outfit ideas, and luxury-inspired style. Discover ..."
youtube,women's fashion trends,https://www.youtube.com/watch?v=K4P4y58DHcA,1782226831,Royal Silk Saree Look by Anitha Mohan 💜 #silk #saree #fashion,Discover timeless elegance with this stunning silk saree look featuring Anitha Mohan. Dressed in a beautiful purple and silver ...
youtube,women's fashion trends,https://www.youtube.com/watch?v=gTxJZAKKl1g,1782226808,Gamis Twill Premium Busui Friendly Kancing #gamis #fashiontrends #fashion #gamissyari #gamisterbaru,Gamis Twill Premium Busui Friendly Kancing #gamis #fashiontrends #fashion #gamissyari #gamisterbaru.
youtube,women's fashion trends,https://www.youtube.com/watch?v=HRnqd2dVNtY,1782225271,&quot;Beautiful women&#39;s Fashion Trends 2026&quot;,
youtube,women's fashion trends,https://www.youtube.com/watch?v=-CmvmLRvtNU,1782224576,Every Girl Needs This Outfit ❤️✅ #shorts #trendingreels #feedshorts,"Every Girl Needs This Outfit ❤️ #shortsfeed ✨ Simple, classy, and stylish! This white shirt and blue jeans outfit is the perfect ..."
youtube,women's fashion trends,https://www.youtube.com/watch?v=pd3snNxNqe8,1782223894,Backless kurti ideas 🎀 #youtubeshorts #fashion #trending #indianfashion #ootd #girl #kurti #shorts,"Looking for the latest backless kurti designs? In this video, explore beautiful and trendy backless kurti ideas that will upgrade your ..."
youtube,women's fashion trends,https://www.youtube.com/watch?v=P3lTTDmthMQ,1782223203,#humor #usa #foryou #fyp #love #crazyfashion #shorts #viral #youtubeshorts #fashiontrends,
youtube,women's fashion trends,https://www.youtube.com/watch?v=6al6Nxnjc-Y,1782221934,🌸 Beautiful Mini Dress Looks for Women &amp; Girls.   #shorts  #treanding    #fashionshorts   #viral,Beautiful Mini Dress Looks for Women & Girls   Discover the most beautiful and trendy mini dresses for women and girls! From ...
youtube,women's fashion trends,https://www.youtube.com/watch?v=7r9GI5Yp6xM,1782221428,😍 Must-Have Shirts for Every Gen Z Girlie #ytshorts #fashion #shortsfeed #ootd #style #shirtoutfits,5 Shirts Every Gen Z Girl Needs in Her Wardrobe! Looking for trendy shirt styles that are perfect for Gen Z girls? In this video ...
youtube,women's fashion trends,https://www.youtube.com/watch?v=flKZCFjPjwE,1782221427,#magyar#ootd#outfitideas#fashion#fashiontrends#dailyfashion#longdress#summerfashion#streetstyle,
youtube,women's fashion trends,https://www.youtube.com/watch?v=9ggOIcrq0lI,1782220812,पटियाला सूट सिल्वा दुन 😱😱 #fashiontrends #fashion #newsuitdesignforkarwachauth,
youtube,women's fashion trends,https://www.youtube.com/watch?v=vndLSd896kc,1782219633,#afrohouse #amapiano #fashion #latestafricaprint #fashiontrends #plussize #viralvideo #ootd,
youtube,women's fashion trends,https://www.youtube.com/watch?v=Ie6kDx9awvU,1782219609,Stunning Women&#39;s Fashion Ideas 2026 | Elegant &amp; Trendy Outfit Collection,"Discover beautiful women's fashion styles and outfit inspirations for every occasion. From elegant dresses to trendy modern looks, ..."
youtube,women's fashion trends,https://www.youtube.com/watch?v=qUBcOVsctrM,1782219628,Atasan KaosTunik Polos Jumbo Bahan Premium Original #fashiontrends #fashion #kaoswanita,
youtube,women's fashion trends,https://www.youtube.com/watch?v=aRxAQ7qIqgg,1782218711,Ankita Dave Instagram 🔥 Casual Summer Outfits for Girls | Fashion Trends 2026 #shorts,Ankita Dave Instagram Casual Summer Outfits for Girls | Fashion Trends 2026 Check out Ankita Dave-inspired casual summer ...
youtube,women's fashion trends,https://www.youtube.com/watch?v=i_GPBpQYQ1o,1782218162,Ready to play the role of own🪞🌹#fashiontrends #women #explore,
youtube,women's fashion trends,https://www.youtube.com/watch?v=FEtr_Z1s-Bs,1782217808,Beautiful Street Fashion Outfits Style Street 👗🥰 Fashion Style #fashion #styleblogger #shorts,"Beautiful Street Fashion Outfits & Trendy Street Style Looks! ✨ Discover amazing fashion inspiration, stylish outfit ideas, and the ..."
youtube,women's fashion trends,https://www.youtube.com/watch?v=ebJ3oWVJ21E,1782216015,1500 me liya hai #fypシ #cute #fashiontrends #duet #funny,
youtube,women's fashion trends,https://www.youtube.com/watch?v=4Ty5HaZRZ54,1782214207,The best colour combination outfit 🌸💗 ll #fashiontrends #fashionstyle #shorts  #casualwear #short,outfitideas #outfitinspo #fashionstyle #fashiontrends #ootd #styleinspo #womensfashion #ethnicwear #indianwear #kurtilove ...
youtube,women's fashion trends,https://www.youtube.com/watch?v=uJUrYWUY1aw,1782214208,Ritu mam😍🌺#talentedrituinsan#viralvideo#viralchannel#haryanvisong#newdesign#fashiontrends#style#yt,viralchannel​​#viralvideo​​​​​​​​​​​​​​​​​​​​​​​​#talentedrituinsan​​​​​​​​​​​​​​​​​​​​​​​​# ...
youtube,women's fashion trends,https://www.youtube.com/watch?v=wKAp413-KaM,1782214116,Lavender Embroidered Kurta Set 💜 | Elegant Ethnic Wear for Women | Vaishavi Fashion,Step into timeless elegance with this beautiful lavender embroidered kurta set from Vaishavi Fashion. ✨ Designed for women ...
youtube,women's fashion trends,https://www.youtube.com/watch?v=DMMIvERZf9U,1782211592,&quot;The Outfit ❤️🤍|| Shirt Look✨ ||#ootdguide#fashiontrends #styleinspo #fyp#ytshorts,"Heart Print Shirt with Wide Leg Jeans Simple, Trendy & Super Stylish Casual Look ✨    Perfect outfit inspiration for everyday ..."
youtube,women's fashion trends,https://www.youtube.com/watch?v=odQKzDEgvqE,1782211556,booking now+919644185675 #summerwearcollection #fashiontrends #wedingcollection #newcollection #suit,
youtube,women's fashion trends,https://www.youtube.com/watch?v=sArO7DrG8Vk,1782162611,The 3 Top Summer 2026 Fashion Trends | What to Wear This Summer,GTWJ DIGITAL MAGAZINE ISSUE 007: https://gtwju.com/products/issue-007?variant=53990161350989 GTWJ BOOK: ...
youtube,streetwear 2025,https://www.youtube.com/watch?v=M9B8qHZtaME,1782153028,Pre Fall 2025 LIVE NOW ‼️#outofroutine #onlineshopping,
youtube,streetwear 2025,https://www.youtube.com/watch?v=p__jNgE49bA,1782121645,🌞Summer Outfit For Girls ☔#summer​ #streetwear​ #2025​ #youtubeshorts​ #girlswear​..your question,baby girl dress design #fashion #viral #trending #newoutfit #cotton.
youtube,streetwear 2025,https://www.youtube.com/watch?v=9IUoiRbuugk,1781961869,Gen Z Fashion Trends 2025 | Oversized Tees &amp; Baggy Jeans Lookbook,"Elevate your everyday style with trendy oversized tees, baggy denim, and effortless accessories. From casual streetwear to clean ..."
youtube,streetwear 2025,https://www.youtube.com/watch?v=0H1N-DxexFE,1781945643,Fashion Casual Solid Gray Cropped T-shirt 2025 Woman Clothes O-neck Corset Tops Streetwear Girls,https://s.click.aliexpress.com/e/_c36RClsp#streetwearfashion #y2kfashion #cleangirlaesthetic #baddieoutfits #modeloffduty.
youtube,streetwear 2025,https://www.youtube.com/watch?v=Ocx2uCYkpho,1781926779,Grey Fall 2025 Thermal #Explore #Cozy #Streetwear #Designer #Galaxy,Follow at 1avish1ove on Instagram for more updates on inventory!
youtube,streetwear 2025,https://www.youtube.com/watch?v=0O_a2eOktiI,1781892799,Men&#39;s 2025 Japanese streetwear shirt #ytshorts #million #trending #cloth #outfit #ytshort,"Men's 2025 Japanese Streetwear Shirt Refresh your summer wardrobe with this Men's 2025 Japanese Streetwear Shirt, a perfect ..."
youtube,streetwear 2025,https://www.youtube.com/watch?v=gBBoT1ZX1UU,1781845372,Bottines Plateforme Punk Goth Lacets – Femme 2025,"Step out in style with our Bottines Plateforme Punk Goth Lacets! At just $62.12, embrace your edgy side without breaking the bank!"
youtube,streetwear 2025,https://www.youtube.com/watch?v=wH32s0Ua1lc,1781484030,2025 pakai sistem pre-order ❌-#alinsideproduction 📠0895410501555#Screenprinting #streetwear #dtf,
youtube,streetwear 2025,https://www.youtube.com/watch?v=s7oHmltSWQI,1781385826,Teaser#1 magazine2025/2026 2e édition #fashion #wondacoutures #business #mode,
youtube,streetwear 2025,https://www.youtube.com/watch?v=IAhcpreya2U,1781361071,Jordan 4 black cat 2025💫💫#viral #jordans #FYP #blackcat #streetwear,"short #sneakerhead #unboxing Leave me size!!! Hello! My friend, if want this goods add our whatsapp:+86 152 6026 8083."
youtube,streetwear 2025,https://www.youtube.com/watch?v=pl8iapqEUsw,1781263765,People think oversized is a 2025 trend. The 90s would disagree.,fashion #streetwear #oversized People think oversized clothing is a new trend. The 90s would disagree. Fashion doesn't move ...
youtube,streetwear 2025,https://www.youtube.com/watch?v=oPHuQHVhEF8,1781257518,2025🎞️,
youtube,streetwear 2025,https://www.youtube.com/watch?v=huDGV5Hfa4M,1781121920,Inside the Bold Golf Show at Ireland Fashion Week 2025 ⛳️,"Kicking off Ireland Fashion Week 2025, and taking over Teeling Whiskey Distillery in the process, Bold Gold redefine classic Golf ..."
youtube,streetwear 2025,https://www.youtube.com/watch?v=QTDDc204Rf8,1781121778,Inside the Bold Golf Show at Ireland Fashion Week 2025 ⛳️,"Kicking off Ireland Fashion Week 2025, and taking over Teeling Whiskey Distillery in the process, Bold Gold redefine classic Golf ..."
youtube,streetwear 2025,https://www.youtube.com/watch?v=GbM0NA3mCnY,1781121625,Inside the Bolf Golf Show at Ireland Fashion Week 2025 ⛳️,"Kicking off Ireland Fashion Week 2025, and taking over Teeling Whiskey Distillery in the process, Bold Gold redefine classic Golf ..."
youtube,streetwear 2025,https://www.youtube.com/watch?v=INDdxvvfM2g,1781121448,Behind-the-scenes at the Ireland Fashion Week 2025 Bold Golf Sportswear Show ⛳️,"Kicking off Ireland Fashion Week 2025, and taking over Teeling Whiskey Distillery in the process, Bold Gold redefine classic Golf ..."
youtube,streetwear 2025,https://www.youtube.com/watch?v=ttzwemi4E8s,1781097730,🔥 New Trending Black Denim Shorts 2025 | Stylish Streetwear Fashion You Need to See! 😍🖤#shorts,Discover the latest black denim shorts making waves in street fashion! ✨ Featuring a bold graphic design and modern ...
youtube,streetwear 2025,https://www.youtube.com/watch?v=pov9SUIAc2o,1780928559,Stylish Black &amp; Yellow Track Pant 🔥 New Trending Jogger 2025,Latest Black Track Pant with Yellow Side Stripes Looking for a stylish and comfortable track pant? This premium black jogger ...
youtube,streetwear 2025,https://www.youtube.com/watch?v=HZ9p7GsT58U,1780908547,The Aura Jacket | ETHCC Cannes 2025,
youtube,streetwear 2025,https://www.youtube.com/watch?v=a1vLkzJMInY,1780833600,2025 Streetwear Trends,"Streetwear fashion in 2025 evolves into a dynamic and futuristic style driven by urban culture, comfort, and sustainability. Discover ..."
youtube,streetwear 2025,https://www.youtube.com/watch?v=TXqZGGorAMI,1780762521,Recreating the worst outfit from 2025.     #fashiontrends #fashion #streetwear,
youtube,streetwear 2025,https://www.youtube.com/watch?v=yUbjCBjijeA,1780755670,Vintage Washed Shacket for Men 🔥 | Best Men&#39;s Shacket 2025 | Indian Streetwear Brand  #shacket,Vintage Washed Shacket for Men | Incroy & Merv SS25 Collection Looking for the perfect shacket outfit for men? This vintage ...
youtube,streetwear 2025,https://www.youtube.com/watch?v=r3QcBa7o32k,1780695360,Sneaker Con 2025 Legit Check | MIH DINO Mesh Hat,"At Sneaker Con 2025, one of the most recognized legit check personalities took a closer look at our MIH ART IS A CRIME DINO™ ..."
youtube,streetwear 2025,https://www.youtube.com/watch?v=pS8JObNfhcc,1780645071,2025,"Don't forget to follow us on Instagram @lifted.limited for more content, and subscribe to our channel for the latest updates. DM TO ..."
youtube,streetwear 2025,https://www.youtube.com/watch?v=MY46sKbeMDI,1780623479,POV: 2026 NFL Draft Rookies Pull Up To Showroom LA 🏈🔥,POV: The 2026 NFL Draft's hottest rookie class just pulled up to Showroom LA for a PRIVATE Rookie Premiere — and the energy ...
