source,query,domain,url,created_utc,title,text
gnews,fashion trend,news.google.com,https://news.google.com/rss/articles/CBMimAFBVV95cUxNWTR1aHhrdFZkR2g2VFRRcmNmek9MR3h0akFDdzJJU2dkTTlBUWJ4WERJYUpoX294aXpYdHZCTFVlNTZHWnZFNzQ1Q0hmSFd6Rzl4RHhvLXk3TVZ3UnMzSUIzWHYwNGFQR2JGMEk2NTZsNmd6Q1B0dzdRT2gzMTE0OGhxSGJrMlNER2VweTZIRVRuUFBDbU5HWA?oc=5,1774350396,Fall 2026 Ready-to-Wear Trend: Ruffles [PHOTOS] - WWD,Fall 2026 Ready-to-Wear Trend: Ruffles [PHOTOS] - WWD
gnews,fashion trend,news.google.com,https://news.google.com/rss/articles/CBMioAFBVV95cUxPNGFYQUk5THJkOGFOUUVGSWtMNlJOQ3VUdW1TdmwzU1UtRXJXV3E5bmlodjQ4UUpoWnczMG5KbEZ1d045bEJMZWtUVzlVNFpldjl5UWxpc1l5UWhtSlNlc25YcG12aUY5N2ZwVzFKejV5Z0E4ZFlxRVVPekVvQ0F0WFRpdlVDQmU4X3FlUmVJeWljdUNUSE9TSXAzVUxfWERV?oc=5,1774343385,Why China’s Gen Z Stopped Following Trends and Started Following Themselves - RADII,Why China’s Gen Z Stopped Following Trends and Started Following Themselves - RADII
gnews,fashion trend,news.google.com,https://news.google.com/rss/articles/CBMijAFBVV95cUxPdEF3TGJXZ29SaWZMeFdjME1PQUEwOHVTU3FLZ0Rzd3VyMVpTcWZrWTdPMFBRSVdXS1RZb09WQlFFaXlsTm94Vm5TM1lnSVRuZTNoUGlQRk0xem9xVGk2RkdzWlIzbFFRdDYzcmpmWmpSS0huVVRaZ2ZvMWJHckVTZjQzdlVHQ0V6cm5HOA?oc=5,1774308321,I Hated This Shoe Trend for Over a Decade—Now I Own Three Pairs - Cosmopolitan,I Hated This Shoe Trend for Over a Decade—Now I Own Three Pairs - Cosmopolitan
gnews,fashion trend,news.google.com,https://news.google.com/rss/articles/CBMieEFVX3lxTE9jd0hIdjAwVnhPN1dJWVBVODhsUGN3dU5Nbm9yYU5vYVNRR25fdW8tZ2hhenZiR2NmZ1JiQmFJcVpnVS05QlNCQUx2YTZpdHhPTHUxOVRLSkdoQXVYVzdmX3RXTGd1XzU2eTZvLVBkd3JYejI0Q1lwWA?oc=5,1774080300,Here's Why the Riviera Fashion Trend Should be On Your Moodboard in 2026 - Who What Wear,Here's Why the Riviera Fashion Trend Should be On Your Moodboard in 2026 - Who What Wear
gnews,fashion trend,news.google.com,https://news.google.com/rss/articles/CBMijgFBVV95cUxNazJYNVNINU9MUmtQNkVkM3dlNDIzSE5pXzJhMFVRSHdsRkg1cXVneVEwM1BUYnBHMlNPZjlsUUNsZ1RsNjQ3Q1JIZ3RMUjc4WjcxOWwtZHFRbHFHQXQyUTlmdlFsY092LWlPR0NZYlhUNnFmb3FsWnpUQ0JYVGFxdERkbWF0YVBOZ1RmNDFR?oc=5,1773849706,The 11 Fashion Trends That Define the Fall 2026 Season - Vogue,The 11 Fashion Trends That Define the Fall 2026 Season - Vogue
gnews,fashion trend,news.google.com,https://news.google.com/rss/articles/CBMijwFBVV95cUxNRXVmdEVLSkhzR1JyQUdqU3o4Q1VORUtOOFZIQ21LYllSd2h0V3FscVNCTzcwblluUmMySVlvd1hLLVh2UUtmRXN1ZGQ0Smg3SzJETTZUamxDaEVNYmVDRXNvVWRSR2ttcjVuYlVNM1RVTTk4NHJEbGFlaXFZSXB5TmlZU0dWcklnRVZqTjYxYw?oc=5,1774290720,"Best Hair at Fall 2026 Fashion Week in New York, London, Milan & Paris - The New York Times","Best Hair at Fall 2026 Fashion Week in New York, London, Milan & Paris - The New York Times"
gnews,fashion trend,news.google.com,https://news.google.com/rss/articles/CBMiggFBVV95cUxNYlVuUm0xbW5wSmtnQVRfLVBSWmM0SENvNUFUV29JRFZCNTYzR2JDeFJxV01yX3A4S2VOb1ZXTzBpajRVR1lYQmxYX3lkNzRmakJzYlhINk1uTE01X2FMUWxVNWhnQTUwUkFGVFVISVZPUUU3RHByUGxaSnI0T04tMU9n?oc=5,1774336441,Side-hip trend 2026: cut-out dresses that redefine silhouette - nss G-Club,Side-hip trend 2026: cut-out dresses that redefine silhouette - nss G-Club
gnews,fashion trend,news.google.com,https://news.google.com/rss/articles/CBMijwFBVV95cUxNNFp3Z0U4dFd2Sm1Vd3MzUVhhd0lSZjZwQk8yV2gwRjNvNTBpdktfM1RhMS1ZTDZaeUE4SEgwRE1BUXR3YzVZNTlNOFdCVXZvMUZETllUVFFDdkllUEROUkFCSW81YmNwZmtXOC1HVWFYWUZXaURkZXVZMEhITFdwQ1lKVVBIUC05SWoxOVJkWQ?oc=5,1774297940,A Moment For Joy Fall 2026 RTW Fashion Trend - The Impression,A Moment For Joy Fall 2026 RTW Fashion Trend - The Impression
gnews,fashion trend,news.google.com,https://news.google.com/rss/articles/CBMisAFBVV95cUxQaVpVWGVTT3o2SWRsMXRYVVo1WjVJejE2aTd1WXNKaUNOVnpITXlrZ1dKVVJJZUFrYTZaTXJZVlhnUUJ5ZHJfcFJLckRZamtWRU95bGVmUHpSQmJiWVpSSGlUYjZtWVlPSl9wWnJfT2RaQ0FWc2xyenAtUkxmNlQtd3RDZl92SGNzbnhlRHlCcnMwRHhGTmo2TndUQWVzOU9fU2Q2Y0lmM3Z5NHlyUTRzZ9IBxAFBVV95cUxQUUpuNnk1SUx2OWozZVRsSjcyWlV4SXdDbFRVRFZ0NE5zbENwdERhS1RKbWYwd3BINjhBNDg4VmxuTlJIUXR0d2hhMFMzaEhCVE1aQmo5LVkzbVBFd3VOVDZNN01FbmhoMDE1YS1RMmdJRkZrQWhaaGRLTl9zOVJtODBHT0wyVDUzWEZfczFraFRVdl9vdUp6SEFPQTFCRW81Y3lSeFhja1VXeE82TUliOC1wZ1BfWGVpUVhJek1pLUZScnlY?oc=5,1774204800,"Color is in: Image consultant says spring style is all about bold, expressive style - WBRC","Color is in: Image consultant says spring style is all about bold, expressive style - WBRC"
gnews,fashion trend,news.google.com,https://news.google.com/rss/articles/CBMi7gFBVV95cUxPSnZObXVKVkVKNkhhU3ZRdlNqSWE1bnd2UWwwaXdOLUdXbDFQRnhUSzA4N3V2SzFlSTB2WWx6YXdWOE4tbWhrQXNKeDI4ZElRTWtvM1c0ZDZQT3o1MzNtSE9oUWh3VDQtaTVVWVlOcU5KLUJZdkZkcUd3UEozSG8zOEpwc1NRVEdNVmluUV9oZDQ4WW9RcFJ3QjB1c0d6OGdqSWw3RG1wRUxaRXBKZnhiQnNqQWlJdGhLUHI2S1MySk9IdVRvNHN5T0x5TXZQbHYzczBIalRwV1JhaGxlYjFtQjJnY0NSRE0xZ3lmaXln0gHuAUFVX3lxTE5PSmwwNGNMMU9td1pJYmthTS1IcGJrQm9XRDNDN2dYZkRDV1ZQYnJSZjM1N0E0Mm5BcGVGZVYwRmdCbWpxR25pa2k2S2gxemJtUzY2Zld3QkxyUUg4Zi1zeExoSjNNY0dPem1TVnRJOWF4ZW4zdy1LREVQb19lYnNLNVZIMjRXVG14djNrRDZHSFJRLWZXdHh0dVBuRXJSdmtNVmU2VkhXcjIzYUZWNGYzcV9uUHRnM0hpTmljR3NSVW9zVmU2d0g0d1htRld2dUVNdnREM2ZaUkJsZkhxOE9LYUs4LXBibEJiV1BJV2c?oc=5,1774054814,How ‘painful bag’ became a popular subculture among Chinese youth - South China Morning Post,How ‘painful bag’ became a popular subculture among Chinese youth - South China Morning Post
gnews,fashion trend,news.google.com,https://news.google.com/rss/articles/CBMid0FVX3lxTFBRSm9ibUZyX2RkSl9ob2VKNmhOMkxoTHRVNVM0LWFDWHQwX0t2aWgwNU1lOFlqcnRnRExPX180dVpqemRINWc1SDVKZmtnTlZfTk84N0xHWklCNXZEUnFES2VZRlowRTBrcUdYWlVQZ3dQT1AzeW13?oc=5,1774342800,Lace: How To Style Them With A Modern Touch - Harper's Bazaar Singapore,Lace: How To Style Them With A Modern Touch - Harper's Bazaar Singapore
gnews,fashion trend,news.google.com,https://news.google.com/rss/articles/CBMiZEFVX3lxTE9KZjRhRnlHZVJ6REd3MjkxSXQxRnMtRXRHd1dFWUxwdWlJZWdfQUh3LVhIZXRpMjFnQ2NhVFlfSDQtMkJyaTFWQ3QxQmxqd2g0LXE2OHVSV2lWa1dKUFNDdGlHNzU?oc=5,1772870400,"17 Spring Fashion Trends to Try, From CBK-Inspired Minimalism to Texturemaxxing - Teen Vogue","17 Spring Fashion Trends to Try, From CBK-Inspired Minimalism to Texturemaxxing - Teen Vogue"
gnews,fashion trend,news.google.com,https://news.google.com/rss/articles/CBMia0FVX3lxTFBLMEs5Q3ViZENJYW0xSG9OdGlSd1dZeHROTmdvMVg4TFRNVEVrTzd2SnI2QW1XMWV3OWtRWXgwc3pNSzh6RnZjZjdxenpZVGtmWjFDUHMzZDN1Y1dLSjBtNnh0dzBUZFRWNHhz?oc=5,1774292400,Gracie Abrams' Transformation Has Been A Sight To See - women.com,Gracie Abrams' Transformation Has Been A Sight To See - women.com
gnews,fashion trend,news.google.com,https://news.google.com/rss/articles/CBMic0FVX3lxTFBuQVFBSW9Ra2VtTTZ5MlV6MjV0WkFoZUw3NVVLX253LWs0YmREMEwydGRfWnR1UWlWNjlQSjZ6bGZkdFdQeEZpX3doNXp6VTRBVkstanVaZTlWdTBHLU5QYXpCaG5YMEVadE1qdGxOSFpiNWc?oc=5,1774231200,4 Dated Sneaker Trends You Should Retire in Spring 2026—and the Cool-Girl Alternatives to Replace Them With - instyle.com,4 Dated Sneaker Trends You Should Retire in Spring 2026—and the Cool-Girl Alternatives to Replace Them With - instyle.com
gnews,fashion trend,news.google.com,https://news.google.com/rss/articles/CBMiiAFBVV95cUxObjdwQVFBOGw1VERMaFF6Nmw5NGEzR3RDWG1xUzN6MXpKTExJVUpsX2N1SXZqZ2NGa0lVRVM4cGlJc0M1TXA5X2R5bm1Xb3MwcEpGb1NVdWc1TndGNzd0TnBaVFMyM1d5WldzeDF5dGVnUWNfc01QWjBWTUJiNWtjTmR4VEE2Y3lO?oc=5,1774298380,"Are My Eyes Deceiving Me, Or Is Peplum Actually Back? - Cosmopolitan","Are My Eyes Deceiving Me, Or Is Peplum Actually Back? - Cosmopolitan"
gnews,fashion trend,news.google.com,https://news.google.com/rss/articles/CBMiZ0FVX3lxTFBfMUwtMEE4aVM3YmI5VGtkZ2dleVFxTWxzV2tzbHpySDdJQ1dSUnFuRmFpdGo5VVRVbHAzOWc3TlRyQ0ZReW1DSTlSYkljczRDdXBTVTVBc2c1UmdfbnNvX2ZwOHpwVVU?oc=5,1773948810,The Key Spring 2026 Trends to Add to Your Wardrobe Now - Vogue,The Key Spring 2026 Trends to Add to Your Wardrobe Now - Vogue
gnews,fashion trend,news.google.com,https://news.google.com/rss/articles/CBMie0FVX3lxTE1KYUJnN0VRUzdLRXp3bXF0OTBNZmNLNnFCdS1Rek9EX0g4TmdQQl94MENjNUxmMEJvekY0ZGdBRnVhQ3daZkxWQWV2NExmUUlOY3Q0RE1XaGpzc0I1STIzQzZTZkJXRHltekpzd1NuMm5wWkh3dEhWVi1iQQ?oc=5,1773644400,It’s Nice to See (Some) Actresses Wearing Dresses They Can Breathe In - The New York Times,It’s Nice to See (Some) Actresses Wearing Dresses They Can Breathe In - The New York Times
gnews,fashion trend,news.google.com,https://news.google.com/rss/articles/CBMidEFVX3lxTE9aMXlOVy1Qc2pXMGZwajFvYVdtbTVHYTZGWEMtVHZTekdIcEg1NGx5OU9lc1dvOFlrWFlGNERDYjBvQU9jX2FNNGl5R1FfdUphNURQQ2xLVFM1NmNyR0g1TmdlNmwtX2hqYVc4aW4yV1NKUUhN?oc=5,1774202858,Toothpaste Dressing Is the Minty Fresh Trend We’re All-in On - Vogue,Toothpaste Dressing Is the Minty Fresh Trend We’re All-in On - Vogue
gnews,fashion trend,news.google.com,https://news.google.com/rss/articles/CBMieEFVX3lxTE1wSjh5T094UkhXSjNTbk8xZWp5d2pOcDZ1c2d4SGFKNWRRR0RlZTFZSXlJRFRkTFo4SkdKMDY0eUZGQVlnVG5FcFhYMGJqMmY0TnZKMFhkbUVlSDVvV1NKNVktUDQ5SEpOdTloaGtIWENJcEFuU055Qg?oc=5,1774173600,The Best Bags in Fall 2026 Street Style - Vogue,The Best Bags in Fall 2026 Street Style - Vogue
gnews,fashion trend,news.google.com,https://news.google.com/rss/articles/CBMigwFBVV95cUxOSEJBc0FoYTlpdVc2c19Cd2VON3U4bHVjTUxXSUdnQjVrMFJ3Q0c0VHpjV1d1QW40RUlaeDJuWDNySV9ucVQ2OTJzZE9NZ1BGckVDdEZpd21iUVRFcHJBdnZaS3hHN2Z3NVJ0WmZUblJPZkpJVVFWSzhJbWc2OE9qUE9tSQ?oc=5,1774167893,Bella Hadid Is Locked Into This Y2K Denim Trend - Vogue,Bella Hadid Is Locked Into This Y2K Denim Trend - Vogue
gnews,fashion trend,news.google.com,https://news.google.com/rss/articles/CBMiekFVX3lxTE84NjEyWkJMRHJia195MWwxNEVjdjJmbjhlOVlhdzh0d21SQWRZaERBaHoxamRIVlg1cHJEeDdhc2QtOWZvclJjb3VGQW1Wcmhta0lFMzdVd0tUeFloazUtclBNenJnamYwckJCWkY5bXpvVkloN21ZMDRB?oc=5,1774076400,The Major Handbag Trends of Fall 2026 Have Arrived: 7 It Styles to Know - Who What Wear,The Major Handbag Trends of Fall 2026 Have Arrived: 7 It Styles to Know - Who What Wear
gnews,fashion trend,news.google.com,https://news.google.com/rss/articles/CBMijAFBVV95cUxOdWl5dWNNMC1oc0FxSmZCeVhMTTFfVjVabEVSVWl5TGFac3VXQmtIQVFvSGJ0UW9uQUN2bTMtVzJod2tEMW40RDRsS013R3ZYTEJOT0FiWHRWa2dJTk5jTDBySnpBdWt6czBHZUdnU0JpWXRqNnlmNF9KRWMwM3hqSjBNZ1A0S1BQMzFzUg?oc=5,1774014700,Klein Blue Is Poised to Be 2026’s Biggest Fashion Color Trend - Marie Claire,Klein Blue Is Poised to Be 2026’s Biggest Fashion Color Trend - Marie Claire
gnews,fashion trend,news.google.com,https://news.google.com/rss/articles/CBMibkFVX3lxTE9iRnJXTlJmaW9wN2lZNGRrbXR5Zi1WcDlqN3BzbkRSRDctVlczNkI1anN1em9wckZ3Q1RKVnRXRmJCc1JjdW9ya3Azd09mVzVCajB6R2xZZnYzRXZnXzUxOXBLQjNZXzBueTJzLVZn?oc=5,1774162800,Sportif Chic Is the It Aesthetic in NYC and L.A.—5 Cool Trends to Look the Part - Who What Wear,Sportif Chic Is the It Aesthetic in NYC and L.A.—5 Cool Trends to Look the Part - Who What Wear
gnews,fashion trend,news.google.com,https://news.google.com/rss/articles/CBMif0FVX3lxTE9WT2VqdHhaQ2Z5LW5PQjVsQXNlZl9VNVpZeVAtNFBrOUhRZzBEQVhUV283dGFkZExNVU84WTl0dGN4TGpBbldIcmJpR2pBRU1NYUpuTk9QaS1kY2hLOWwzUnRYZDdjM3ViMFZYbnpZVk5mcXZfWmpiRkkwTnppa2M?oc=5,1774134000,I Might be the Last Person in My L.A. Pilates Class to Add These Cool-Girl Sneakers to My Spring Wardrobe - instyle.com,I Might be the Last Person in My L.A. Pilates Class to Add These Cool-Girl Sneakers to My Spring Wardrobe - instyle.com
gnews,fashion trend,news.google.com,https://news.google.com/rss/articles/CBMiV0FVX3lxTE5ic2JaUUtCdWYxZWJSbnNaYkdaNUduOWJldGhRU2hQTkxrd1h5dmJablJzeXJhYnJ4MlZXTnJGeUgxQXM4WVU3QXFlZWNtOTBkVU9fd2NYMA?oc=5,1774242021,"Dress like a poet, express inner identity and stay on trend - The Korea Herald","Dress like a poet, express inner identity and stay on trend - The Korea Herald"
gnews,fashion trend,news.google.com,https://news.google.com/rss/articles/CBMilAFBVV95cUxPYUo2RjdqVnFPU2dLa0JkZnRzR3M0dVFhNXFSQ1BqdzVpTzNPTU5zMUZQWGNuaGUyMUdEc1Y5d1VUcTBNeDBQN00ydnJPalVHX1o2Z0RzbU85N1JRb2ZzZUtNblVncUoyaTNzYmFybWxENXA5Q3lwTF9pRC1ZRWhjSjdQcmJwU01JUUtUdU1ZMzIxR1hz?oc=5,1772438400,Breaking away from the fast fashion trend cycle - The DePaulia,Breaking away from the fast fashion trend cycle - The DePaulia
gnews,fashion trend,news.google.com,https://news.google.com/rss/articles/CBMib0FVX3lxTFBOMjRWU0NJclB6a041Y2pNa3ZUWXpVUGFQY2hpdXBjOVFJbF82emtUS1E1YjlMQV9QNGc1LWdjcWJkalJaOHlfTXpnVFd0aHAyT0doTVJnY3NXa1lSekh0Q2Fic1Bjd2pFZTRybmh5VdIBxwFBVV95cUxNNC14X2g1ZlZkNEZuLTk5b2ZET3ByWmUzWFlhWjVFVmIwcEUzTTdibFdsVlQ0VkZNdVRKVUNNeWx4RERma0hpemlaQ005d1otWEdhVFVaMjJPY1MxZ3RBemxEM09xcWJlZzMxUC1xbUhYZFhkejczWUMyLThIdEZzMjdsdUJpd3QwUVY5aUdTWkt6SXhzVjAweGk1c1Y3d3NfbUUtUk1wbElvalRUX1B1bEJYY3Z5bXkxOE5fVUJUZHQ3RHB4dnA4?oc=5,1774279714,Why Nonna Core Is the Most Influential Style Trend of 2026 - thekit.ca,Why Nonna Core Is the Most Influential Style Trend of 2026 - thekit.ca
gnews,fashion trend,news.google.com,https://news.google.com/rss/articles/CBMimwFBVV95cUxPWnBZaUl6ZUJoNE5FTUVZX2NzTzUxRERKbldrNWtXTHRxTHFhbjBoY3BWZzJmenM0UlFZamg2QXlfZWJNTGJFM0VUZGRONHV0T21lSjVuV1pSLW1YX09uZUxBcEI5SHFpbzFmdTM2TDl2RnEyUTNrR3JLaUkwOGJoemVhRWpxOXNTdG45UEVHMHFOQ2tCNjk0c3pXYw?oc=5,1774320855,Cargo pants are replacing jeans as your spring style go-to – Zara's £36 tailored pair nail the polished look - Cosmopolitan,Cargo pants are replacing jeans as your spring style go-to – Zara's £36 tailored pair nail the polished look - Cosmopolitan
gnews,fashion trend,news.google.com,https://news.google.com/rss/articles/CBMie0FVX3lxTE8wRWViaVJGM3lOakZSN3YwX0UxeGotYXhoTnNPX3lpWl9ubUFIQkFpSzBTS0xUR2lkNlphQzEwRk5ldDVZcm8zMVZvZ3IyZVV2dXRkNW10LVRPNTFqMUxjbWVtcjAzNHYwdXJMUVpwS2xRWVJzMGlaSU5lWQ?oc=5,1772611200,Boho Chic Has Grown Up—7 Trends Defining the Aesthetic in 2026 - Who What Wear,Boho Chic Has Grown Up—7 Trends Defining the Aesthetic in 2026 - Who What Wear
gnews,fashion trend,news.google.com,https://news.google.com/rss/articles/CBMifEFVX3lxTFA5VVFiaW1TTXBCU2VMd1EwMFJXSHE5ZXFvU3h2em9DM1h4Vzk3YlJNQlhRcGxkTGtUQnozUFZhUURxR1dpdHJLeWh6N19ITmk3c0E1ZHdEVDVKRjRrUTdlMDNHMWFGTmxIa1hnU3YtSy1QMXl0RHpNcHI0Tlk?oc=5,1773844993,H&M's New Drop Reads Like an A-Z of Spring Trends—These Pieces Will Fly Out of Stock First - Who What Wear,H&M's New Drop Reads Like an A-Z of Spring Trends—These Pieces Will Fly Out of Stock First - Who What Wear
gnews,fashion trend,news.google.com,https://news.google.com/rss/articles/CBMiggFBVV95cUxOcVlmNFJoT01mOWJmOFNBanVROUcwcVk1cnh2WjJxNFhaVi1lRTJzWlZ1WDlSV2VEMGZlUmNqNndKYTNSY1hwMXYwT0k1aVdraVlMZnNKb0VHbXJpRWliYjhHX3A4WmlSbXUwTTl3UmVGN2o4OXY1c2dNdmFhMzJWT2J3?oc=5,1772956800,16 Spring/Summer 2026 Trends Everyone's Talking About - Who What Wear,16 Spring/Summer 2026 Trends Everyone's Talking About - Who What Wear
gnews,fashion trend,news.google.com,https://news.google.com/rss/articles/CBMid0FVX3lxTE53eDByOG5lVlpieWRpZWphVFgyVjlrOXJiRFNNMFI2THdsZHR2Q2N2N29uSDhlb0FUVVU2eTdOdnltQnpPWldWeWVKTWstOXdPV1NZS2d0VkluSEtxNHlHa2RMc1hpbzJOTFR5US0wX3UxMnNudHkw?oc=5,1774162800,Sorry to My Denim Jacket—Fashion People Everywhere Are Choosing This Trending Spring Style Instead - Who What Wear,Sorry to My Denim Jacket—Fashion People Everywhere Are Choosing This Trending Spring Style Instead - Who What Wear
gnews,fashion trend,news.google.com,https://news.google.com/rss/articles/CBMiowNBVV95cUxOQmRRMElzVjJZb0R4YjRWTE9tX1YyNURZZUNHeWM4VWhqbk5EUVdla1FLWlBmbkNuQTN5dTJKZVFfSnNRMy11LTdJcUREWXpsVngzRUVKazZCSURyRWV2NWpPZ1QwRGNoU3N5TWxPREMxb3BubVY2OWtneXFKblhtN3MtY0FtN09DWUJKaHlPZEhvQlNvVXl2bDlUNGFwR0cwcFFuUWdPV254T0xCT1lXM0hkeURMcGdJT3ZISk5namtJY1B5N25FUzRMMmZqZFRVTmx1M3lyYmVIekw2R0tqZ0g4V0doY3FxS0E5VWIxZUVxZWhBQnBqUVRva0ZXWXpmWnl6NlFrYi1YbERFV3FWQks3WjBNWDFKSmtqYXFJVHBuVll0X1g2Q0djZGxqQjVPc0JudnNFNmpoODlEYUNfVzhxWFJqZzRQcGdIU3hUMWRPQ1RYcUJIVDh5czl3aFNiVHdyRDV3V2trTHlZWlFLUjZ2bGNQTFRsRVd6ZFUtMGRQU2l4VXJ6N3J3MW02WFF3SXE4MkRQVHc0NVYxeFJGNGlpZw?oc=5,1774130400,The style set’s new coat? The leopard — plus more trends to know now - The Times,The style set’s new coat? The leopard — plus more trends to know now - The Times
gnews,fashion trend,news.google.com,https://news.google.com/rss/articles/CBMieEFVX3lxTE9SQ2dfaU94M1dRYzA4aFp2dWIwX2t1QlA2b0F3TlQ5cE5hU09BbWI3WFV0NkRkTE84S05TV1RKTU9LSlFVRDNTaks1TzV4NktRMGNVZ21tMVg5eVJ5aEt6TWoyTndvR3E0aEZ5a0dzWDlJWUoyVk1waw?oc=5,1774198355,Spring Clean Your Closet With The Top 6 Fashion Trends You’ll See Everywhere This Season - AOL.com,Spring Clean Your Closet With The Top 6 Fashion Trends You’ll See Everywhere This Season - AOL.com
gnews,fashion trend,news.google.com,https://news.google.com/rss/articles/CBMi8wFBVV95cUxPZzJBVTFyenMwVTVYWWxPYV92V3dLelNFV0lPRTJtaWZUSWFsYWF0RkZxcGYyaXhRbEZmRUVlWTA4UnBEUE56SW5kVFdEeVcwWmpaOXREbVA3U2RMY0ZxdTFOLVhkNUFNYXphQ1hVTFhsbEJrMzAwXzVZQ0FvRzVUMTltaHNnZ0p0S3ZmdnE2RGduY1VZdkJIaG5CUl9iNHAwcDBBMnhrYWNmeFFKVE0wWkZra1RSeFMyaklUaE51SnJRTVZXNnJVOXBhMG8wOHlzcHJQYVVqQnhxa1VLd19IQi1yT0RWejRkTTVmWG82dHlhUGPSAfgBQVVfeXFMTi03aXRScUFtVG9xdzNqVlpEVVdISTFxR3JiOGpHT2Z6R011UmhJU0pXQkx4TF9UNkpRekI4ZHN3RjdIdTRHNHpZRDhvUDJTMFI0b0tfTUVoMHd2T0tTeHQ5SHpyX1FBNjJsTWVhclRQNFhBMkNCTmgzYVBiVzEzcTdlcVdEcnZMU01nazJxczRCZUVFVVRZQjFvaW5Bd3ZVRHdkWF9EbFhxaG9ZcEFYaldidWQzTzRRRUZQYXpYekRhdUhtcko0MHB4LUw3QzA3TW95b0huQmFDRnBRQzlqWndpQ0VJVHB6d0JNOHd4MFJINWpoYmVVcXg?oc=5,1774335814,All-white fashion trend 2026: How celebrities styled ‘cloud dancer’ at Lakmē Fashion Week x FDCI - Moneycontrol.com,All-white fashion trend 2026: How celebrities styled ‘cloud dancer’ at Lakmē Fashion Week x FDCI - Moneycontrol.com
gnews,fashion trend,news.google.com,https://news.google.com/rss/articles/CBMinAFBVV95cUxNdmVmdU1HcTdQcGVXZDN4TzNaYW4xZkViMEdLLWc2Mmg0d3VZQ1AwUVhEa3AyNTk0ODM2S2hsYjRld3UyaU9WLXdJTFJkZGNsanpYRWF0NEY2VkZVd0tRcV8wRFplYlVIOHlxZnRnZ0w1U2g1NWxhZzF3aXZkVFA5X05vdm0xcS1XWWE0TWRhSnVoTFUyOXhsM2JFdEw?oc=5,1773021191,A Fashion Trend Defining the 2020s? Tech Billionaires Crowding the Culture - Good On You,A Fashion Trend Defining the 2020s? Tech Billionaires Crowding the Culture - Good On You
gnews,fashion trend,news.google.com,https://news.google.com/rss/articles/CBMihAFBVV95cUxPUkc0RHZtX05DRzRBRk52OHZsd3JOOEtBQmVjcXRNM29aWXhfTXF4dEU3Mm5oUElkeWtMTmIzcDVOUEg3OHhsVGpjcldTV2RkMVU2ZTJtNlpnSXRtbDlhVnAweWY1QUFUbVRURW5qUk5ScnFIVi1TY2MwMEYwNUFCNVpfek4?oc=5,1774141200,Sydney Sweeney's Stunning Legs Couldn't Redeem Some Of Her Tackiest Outfits - glam.com,Sydney Sweeney's Stunning Legs Couldn't Redeem Some Of Her Tackiest Outfits - glam.com
gnews,fashion trend,news.google.com,https://news.google.com/rss/articles/CBMiekFVX3lxTFAtdEhOVm1qdjNGNERmUjRzQXktTUJrelNVWUluY2swWUpVcHNaWWNFaWNkVmV5cVNXWWJkZy13aExZN2gwMVFQdkZzVEVqQ2RGd2J6RFhKeDlMUGstaUREdkNOeldEb1loY0RlYkJ5WXNwdEptYldhV3JR?oc=5,1774281600,"M&S just gave this nostalgic shoe the ultimate grown-up, spring makeover. Here's how to style it - Woman & Home","M&S just gave this nostalgic shoe the ultimate grown-up, spring makeover. Here's how to style it - Woman & Home"
gnews,fashion trend,news.google.com,https://news.google.com/rss/articles/CBMihgFBVV95cUxORlhCWTEyX0stSDVzdVU2Z1JaQUZJUjFjQ3E0dy1vUDhLMjdETkE3ZloxQmllVS01VEl1QXpod25idlBfb0hMOTFOd2RaNGZJU1hMOE5yUTR1SE1fa3dJZG1KT2o1eHNCYTFmZ1hoMzh5cWdCV1hjR1R6SXhUSFBKcTl0OXpoUQ?oc=5,1774058400,The Devil Wears Prada 2 Is Already Bringing Throwback Trends to the Spotlight—5 Predictions I Have - Who What Wear,The Devil Wears Prada 2 Is Already Bringing Throwback Trends to the Spotlight—5 Predictions I Have - Who What Wear
gnews,fashion trend,news.google.com,https://news.google.com/rss/articles/CBMiggFBVV95cUxPaGM4SDN6eGZTRDRTN1FuaVg4ZVhid1RUVk85MFdGNUpQTjZVdld3TnVJRVQ5T1YtVXpPeXVLZ3Q4NlhKbWhvcDNMRnBnMWE0MUdEWDB6Smtubl9ZS2VIdk05NHFJbE9GdEZTVVBvbGVOVThFdkhXQTI2cTlzb0IyTlZ3?oc=5,1774094400,"I write about shoes for a living, and the ballet pump-sneaker hybrid is the trainer trend that truly works with everything - Woman & Home","I write about shoes for a living, and the ballet pump-sneaker hybrid is the trainer trend that truly works with everything - Woman & Home"
gnews,fashion trend,news.google.com,https://news.google.com/rss/articles/CBMiiwFBVV95cUxOSjVaU0dyMUJvX0hrZm83LVdWcWxOUFVIczVTc2F0ek9XMWthY2lrTXZnQUpCY18zS3RmU2ZjWmtlQ3BrdzNnN0lqV2ZkRkJzUzVBS1c0UEwxaFhRVVFZR0FzaTVZeTA1cVZaUnVMbGhRSFVnOXp5azJnZERUd2laemlYZFVpcGFha01n?oc=5,1774318556,"The Peplum Is Back, But Not As You Remember It - ELLE Singapore","The Peplum Is Back, But Not As You Remember It - ELLE Singapore"
gnews,fashion trend,news.google.com,https://news.google.com/rss/articles/CBMibkFVX3lxTE41SDQySk9YYXRhMEpTSC1VTUg3T1BFQ1BFMk5jbG5YVGNrVGxGcUFRMVRkS2hXZTIwbVktdkU4SGdwYnZnVlQwd3ZrcElIbkR6RUVzVG1kUUJMR1c2empLZzZ1Z3ZnLTVsVFltYjRB0gFzQVVfeXFMUFQ1Rl9QS241bGxxaUs1d2JtTzgwVWNzczE3TUtBZ19aU1FNRFBfRWdxbC0tZ3lzNGE3eXBKdFoyaWdGUkRLVnMwWVNXVXpYUmN4Q0JieUl4TnhjUDRMT0R4WExVNVZNbFdRYUhTdk9CUEc5WQ?oc=5,1773558000,I tried this under-$30 slouchy bag on Amazon that looks like Coach. Here’s why I love it - CNN,I tried this under-$30 slouchy bag on Amazon that looks like Coach. Here’s why I love it - CNN
gnews,fashion trend,news.google.com,https://news.google.com/rss/articles/CBMiVkFVX3lxTE9Tdk5RNHZWTks3UzhlUU9rSGl1c3czZ3BBUzV4cDN3WXdCckVqZ3djZFJLX0JMMi1NQmxsTndHMFJCM1M0RFZWNHBFRTk3MGt3bEU0N2V3?oc=5,1774278365,The key spring 2026 trends to add to your wardrobe now - vogue.sg,The key spring 2026 trends to add to your wardrobe now - vogue.sg
gnews,fashion trend,news.google.com,https://news.google.com/rss/articles/CBMi9gFBVV95cUxOR0xOYzdEUlhrUjZCOFZ1eDlmM0dpRjJYRUtTSjRGb2VxTHNvRzVhcVlXOXRzci02N1JOV3FTaEFqazdaaWRfZ2ZhcjdxenhOWnBNcUJnMVFUYWs4Z2U4VjlVSjlZdXJhQmszYmpIVE1taFloZjBvQXo1SHlJWG5zRnJyd0psTUotX3BCalBoMkZBMkIyVmxQcWpGTXBQRjhkZ2VhYnAtNXBrTUlCanVTM0V0X3l1bEhscExqajdLdDduQ0pSM3FPajF6V3N6VmY4ZFA1NkhFLWxOX0ZrNjBwdF9mLVhBd0plRmFRSlBqQlVVc2tES2fSAfsBQVVfeXFMTk1PNEl0WFRkZmQtX2s3T1NoaDh2Q3Y1M3l6RTdQdEd5aVFEdUxBd3RJbDVPeGdCMW1oRkJDOGhCMkxyaHJDSmRTOEJWRWZaMW42U3RfNG9DRFlqMEk5VFFWZ2pWSkl2RkdtN2VHem12azM1Zzk4TGY1WFdaNlFTd2NFdXBrZjlwd25pa0Vrc0JlbHdFTEFhbk1NaW5sMTN3SWRZOGREVjhoM2F5Y3Z1QTVnU18xVUthQ3FpLWFNMS02N1lpQ1MtelhtS0dGeklidlRITFZYRmt4bjBSNllyY1lnMGl0MXA3SlJaSVpaVFhGYV9la3lZTXkyMHM?oc=5,1773990000,Huge problem with ‘It’ girl trend - News.com.au,Huge problem with ‘It’ girl trend - News.com.au
gnews,fashion trend,news.google.com,https://news.google.com/rss/articles/CBMilgFBVV95cUxOMTUxa241N2VNeEVyakVxaGZQS3BaN2t4TEYtTURBUnl4QWdTUm4tVkY2aU5QNERhejcyZ3AzeTV2NElncnJOWFNPU1hvRmdmWEZBaEcyejZ5Q2d3SUNxQmhUaVVzcW9jSUlSWlh1cXUwVGdiRktiY3NmZ2hMYkFTUWRYSENiZTdHdDZXWi1aY0piRnJHUWc?oc=5,1774014460,"Layered t-shirts are the easy way to elevate basic tops, and Next's £16 2-in-1 design nails the spring trend - Cosmopolitan","Layered t-shirts are the easy way to elevate basic tops, and Next's £16 2-in-1 design nails the spring trend - Cosmopolitan"
gnews,fashion trend,news.google.com,https://news.google.com/rss/articles/CBMid0FVX3lxTE1FS2RuU1JPRFllcmRQU1lOS1I5aDNhZ1RXOHFXeUFiY2dmaWpid1I5dUtKa3RLd0UtRkdpZW1UMHpUZF9qaXlYTWpmMUIwdFdVY2JqMXJTZXRGZGFLU0xGTkdNN0VJbkp5YmNXeWlXSUdPY3AyR2ln?oc=5,1772352000,Fashion Editors Agree: These Dated Trends Won’t Make It to Spring 2026 - Who What Wear,Fashion Editors Agree: These Dated Trends Won’t Make It to Spring 2026 - Who What Wear
gnews,fashion trend,news.google.com,https://news.google.com/rss/articles/CBMiigFBVV95cUxQY2NfQThaYnpKRWNXQ3VuZW9iQlNTcjR5WFZjU0ZFYkV1UU9IU0xnN3Q3QmJNU2JSRzF3b2sydFhFMmlHbUlCV1lpck1fNWF4RFBLeHlmanVNejhMU1JoYkdId3U5S2RsaGRQdldhdGNnTGtGWU9ZUGVXNXEwbncyNlp6RGEtb0ptZEHSAZIBQVVfeXFMTW5sUG1UUVVLb1pGUkFxMkNxbmlLbjNIWEFUblFsT2FlNHIwN09HZWxrazIzdWNXUkdxV2dKSXNQN2tQY0xRR256N3RnMlp1NmE5bGtrU2swUmNZV3ZKdWRZOTVFRHNMVWd0QzF4SHpPOU82d0h6M0wzVW0wODJuUFpBYmRKdkdQNXJUZHpiMnM2OEE?oc=5,1774217625,Metallic clutches dominate Eid fashion trends - The Express Tribune,Metallic clutches dominate Eid fashion trends - The Express Tribune
gnews,fashion trend,news.google.com,https://news.google.com/rss/articles/CBMiWEFVX3lxTE5JZzhPZ1hheU9KNjdoNVhYVFdVRlFUbXJSUHI0dFdHTzNNUC1UelMxQkJFSkxpRXhiS3dweDNrVExaMDRSak02bEl3ZVdtbzM2S2F1RXNpUFo?oc=5,1774069683,Viral ‘Kashmiri choorian’ bangles dominate Eid fashion trends in Pakistan - Arab News PK,Viral ‘Kashmiri choorian’ bangles dominate Eid fashion trends in Pakistan - Arab News PK
gnews,fashion trend,news.google.com,https://news.google.com/rss/articles/CBMic0FVX3lxTE1DS3JyTktQOE43XzgzZmdKcHBhQ3VWZWs3bi1yMFZINURsVlREVVVOdDNYTUhaVjYzcjdXcmg5MHNUSTZvMW1NS3NpdFN0VTYweEhwQ0c0Rzc1bERzcXNIMi00RnJqQjFwX2IxVF9rRlFGYXM?oc=5,1773126000,The Key Spring/Summer 2026 Trends To Know (And Shop) Now - British Vogue,The Key Spring/Summer 2026 Trends To Know (And Shop) Now - British Vogue
gnews,fashion trend,news.google.com,https://news.google.com/rss/articles/CBMicEFVX3lxTFBFYkJTaUNPUU5OLURrcHNURWxDZlB0S3V1cS1aaXVkMWtaNjlha21nVVVxdUYzMTZkaDRGZmcyOFNwdkFXd0NmZ1l2RHFNeFozN2JZdVg0MS1iZ2p1dXN4bGhUX1dhOUZzUndLRjI2cWw?oc=5,1771833600,6 Spring 2026 Fashion Trends + How to Wear Them - StyleBlueprint,6 Spring 2026 Fashion Trends + How to Wear Them - StyleBlueprint
gnews,fashion trend,news.google.com,https://news.google.com/rss/articles/CBMikwFBVV95cUxQZC16R1JyZ29ZNGtUemRIOFVnc3pnOEEydEJsU3BVQlFnc2Z2amVRX2Z0M3EtQk9vdV9EVmRoR0FXdWJ5RjNlTkowLURORXdBSTl6RXpMZjd3d0llTi1wOXp3bXloQXdyQWo1RnRFZW9QODNRMlpCZHJ6N1lXNGxhazN2WHRnU0ZlS2V4WmRZb0hsZDA?oc=5,1771833600,'80s-Era Graphic T-Shirts Are Winning Me Over Again in 2026—Here's Why - Marie Claire,'80s-Era Graphic T-Shirts Are Winning Me Over Again in 2026—Here's Why - Marie Claire
gnews,fashion trend,news.google.com,https://news.google.com/rss/articles/CBMiWkFVX3lxTE9uTDc3OTNCSF95Tmx2WEJDbWtmY0FFV2V3T2hCMDRqOHJDTzJrR1FtRjJfRUMxd1NCc1VFQk5nclpvUVlLZHhLN2ZRZEhQRDR1bjlMNi1ZY0dhUQ?oc=5,1774208728,Just 18 pairs of cool sneakers for autumn and winter that aren't... Adidas Sambas. - Mamamia,Just 18 pairs of cool sneakers for autumn and winter that aren't... Adidas Sambas. - Mamamia
gnews,fashion trend,news.google.com,https://news.google.com/rss/articles/CBMiekFVX3lxTE5HWTBhc242TE8xdUl4QTM2c0x4WFd3UjJ2b1lheDRBeE9hRG1DeG9NcmkyV3ozY3RQQ2JxRm1UempWVmwwbWplS0dEelprcm0xYzJ6eDAyazE5NTZ0X2pVRDc0UktEdWxGd0V0blFuUUVZdW1XUER1SW1R?oc=5,1773871200,The Curator: Spring 2026 fashion trends you need to know - National - Global News,The Curator: Spring 2026 fashion trends you need to know - National - Global News
