source,query,url,created_utc,title,text
youtube,men's fashion trends,https://www.youtube.com/watch?v=h_M8v7p8pro,1762398262,Why Do Today&#39;s Men&#39;s Fashion Trends Feel So Historic? - The Sharp Dressed Gent,Why Do Today's Men's Fashion Trends Feel So Historic? Have you ever wondered why men's fashion today feels so connected to ...
youtube,men's fashion trends,https://www.youtube.com/watch?v=j7fnVwHPFnY,1762396357,How Did Oversized Fits Become A Modern Men&#39;s Fashion Trend? - The Sharp Dressed Gent,How Did Oversized Fits Become A Modern Men's Fashion Trend? Have you ever wondered how oversized fits became a staple in ...
youtube,men's fashion trends,https://www.youtube.com/watch?v=Pk3kTqMzluA,1762358935,🔥 Men ₹10 | Ladies ₹25 | Jackets ₹65 | Winter Wholesaler Suppliers 😱,Men ₹10 | Ladies ₹25 | Jackets ₹65 | Winter Wholesaler Suppliers Sakshi Garments Contact : +917003934056 ...
youtube,men's fashion trends,https://www.youtube.com/watch?v=n6lZHl39nr8,1762345869,Masse Ka PERMANENT Solution #shorts #fashiontrends #grooming,Masse Ka PERMANENT Solution #shorts #fashiontrends #grooming MY FASHION INSTAGRAM ...
youtube,men's fashion trends,https://www.youtube.com/watch?v=wrcPZxXwsqw,1762345882,10 Winter Jackets YOU NEED for Fashion Trend 2025 | Jackets Haul 2025 | BeYourBest by San Kalra,10 Winter Jackets YOU NEED for Fashion Trend 2025 | Myntra Jackets Haul | BeYourBest by San Kalra Join Discord ...
youtube,men's fashion trends,https://www.youtube.com/watch?v=oh5xMhfbpuw,1762345872,"Autumn/Winter Mens&#39;s Style Inspiration: Canali, Boss, Boggi...",fallmenswear #wintermensfashion #wintermenswear #fallmensfashion #luxurymenswatches #mensfashion2025 ...
youtube,women's fashion trends,https://www.youtube.com/watch?v=mgq44Efgwck,1762434191,Tendenze moda inverno 2025/26 ❄️,
youtube,women's fashion trends,https://www.youtube.com/watch?v=Q7znj8JlXlg,1762434059,✨ Stylish Ladies Fashion Trends 2025 | New Outfit Ideas for Girls 👗 YouTube Shorts #Fashion #Shorts,Stylish Ladies Fashion Trends 2025 | New Outfit Ideas for Girls YouTube Shorts #Fashion #Shorts “Trendy Ladies Fashion ...
youtube,women's fashion trends,https://www.youtube.com/watch?v=JQ9M5BFloZI,1762428627,Maine kuch bola 🤪|#trending #funny #youtubeshorts #fashiontrends #shorts #viral #shortvideo #funny,Maine kuch bola |#trending #funny #youtubeshorts #fashiontrends #shorts #viral #shortvideo #funny #trending ...
youtube,women's fashion trends,https://www.youtube.com/watch?v=KspBZRjtkmE,1762425014,latest lehenga wholesale market surat #shorts #short #ytshorts #shortsfeed #shortsfeature,"NAVDURGA DESIGNER Call / Whatsapp:- 8487046348 9904753407 Address:- 503515-16,Upper Ground,New Ratan ..."
youtube,women's fashion trends,https://www.youtube.com/watch?v=oCo6W3pmYxI,1762422124,#shorts #fashion #fashionstyle #fashiontrends #viral #viralshorts,shorts #fashion #fashionstyle #fashiontrends #viral #viralshorts.
youtube,women's fashion trends,https://www.youtube.com/watch?v=zOEUb-_N3Kc,1762414131,Women love❤🙈#This outfits#fashiontrends#Desi flex#subcribemychannel#like,
youtube,women's fashion trends,https://www.youtube.com/watch?v=N_DFANyuZeU,1762411773,Beautiful Sandal very Amazing Designs #shortfeed #shoes #viral #fashion,"Ultimate Ladies Shoes Collection – Step Out in Style & Comfort! Welcome to the world of fashion-forward, comfortable, and ..."
youtube,women's fashion trends,https://www.youtube.com/watch?v=kDmygptXwHg,1762410621,"Price, 149 sale New sale market new suj  #fashionstyle #shortskapda#fashionsale#fashiontrends","Price, 149 sale New sale market new suj #fashionstyle #shortskapda#fashionsale#fashiontrends 🛍️ New Market Fashion 2025 ..."
youtube,women's fashion trends,https://www.youtube.com/watch?v=7mBqD2iusa8,1762409992,#trending #onlineshopping #womensnewcollection #womensfashion #fashionstyle #fashiontrends,
youtube,women's fashion trends,https://www.youtube.com/watch?v=qyfWUkXuyfo,1762408231,Blink and u will miss it 😉 eve sweet #explorepage #fashiontrends #tiktok #bikini #trendingshorts,Join this channel to get access to perks: https://www.youtube.com/channel/UCWazz2HX9cdIzZ6bmPt4bBw/join.
youtube,women's fashion trends,https://www.youtube.com/watch?v=0x1ESEEjBeA,1762407570,Astronomia(ExtendedMix)#viralvideos#shortvideos#tending#love#fashiontrends#🌹,
youtube,women's fashion trends,https://www.youtube.com/watch?v=EqX2SbdJr4M,1762406428,Must-Have Women&#39;s Fashion Trends You Can&#39;t Afford to Miss in 2025 #ytshorts #style,
youtube,women's fashion trends,https://www.youtube.com/watch?v=-iMkyFcCBXo,1762404771,গায়িকা জোজো মুখার্জীর আসল পরিবার #motivation #respecta #respecta #fashiontrends #respectation #love,গায়িকা জোজো মুখার্জীর আসল পরিবার #motivation #respecta #respecta #fashiontrends #respectation ...
youtube,women's fashion trends,https://www.youtube.com/watch?v=Pgd6Y8CQx0I,1762399826,#fashiontrends #subscriber #views,
youtube,women's fashion trends,https://www.youtube.com/watch?v=2ygkj2glmcg,1762399802,“The smile that broke the internet 😘✨” #shorts #fashion #fashiontrends #trend,The smile that broke the internet ✨” #shorts #fashion #fashiontrends #trend.
youtube,women's fashion trends,https://www.youtube.com/watch?v=aPrVa1fd42Y,1762392601,“The smile that broke the internet 😘✨” #shorts #fashion #fashiontrends #trend,The smile that broke the internet ✨” #shorts #fashion #fashiontrends #trend.
youtube,women's fashion trends,https://www.youtube.com/watch?v=AEnzfCFG8Ws,1762367220,#shortsvideo #danceshorts #fashiontrends #trendingshorts #viralshort,shortsvideo #danceshorts #fashiontrends #trendingshorts #viralshort.
youtube,women's fashion trends,https://www.youtube.com/watch?v=yqxyYBucy44,1762363201,Latest Dress Trends ✨ | Model Style for Ladies 💕  |#shorts #stitchature #diy,Latest Dress Trends ✨ | Model Style for Ladies |#shorts #stitchature #diy Discover the latest dress trends and model-style ...
youtube,women's fashion trends,https://www.youtube.com/watch?v=Qmod_hBLjB4,1762360217,Natural Older Women OVER  50 60 &amp; 70| Best Elegant Fashion Trends Older Women part 07,Natural Older Women OVER 50 60 & 70| Best Elegant Fashion Trends Older Women part 07 Attractive Older Women Over 40 50 ...
youtube,women's fashion trends,https://www.youtube.com/watch?v=g6a8JxWfYUA,1762359820,Saal ja bola na ja #fashiontrends #mekup #enjoy #shorts,
youtube,women's fashion trends,https://www.youtube.com/watch?v=SLrjNCoWrzM,1762359508,Zudio Haul.. #fashiontrends #makeup #beauty #lipstick #trendingshorts,Zudio Store Shopping #zudioshoppingvlog #zudiohaul #zudiowomencollection.
youtube,women's fashion trends,https://www.youtube.com/watch?v=iPTEGbblteI,1762358738,Мы в тренде)) #shorts #тренды #юмор,"Бутик женской одежды SHOPLADY05 Махачкала, ул. Шеболдаева 4. +79898860333."
youtube,women's fashion trends,https://www.youtube.com/watch?v=i_Nnf-7hoH0,1762358474,Formal Fashion Trends 🌟 #dress #formalwear #fashion #unfrezzmyaccount #shorts #viralshorts,Formal Fashion Trends #dress #formalwear #fashion #unfrezzmyaccount #shorts #viralshorts #party wear dresses #dress ...
youtube,women's fashion trends,https://www.youtube.com/watch?v=9MbUYvhubgA,1762357399,"Fashion Trends, Fashion Tips, Women&#39;s Fashion, Saree Draping, Casual Fashion, Modern Saree, Fashion",
youtube,women's fashion trends,https://www.youtube.com/watch?v=F8ujD9UtMSo,1762355767,"Fashion Trends, Fashion Tips, Women&#39;s Fashion, Saree Draping, Casual Fashion, Modern Saree, Fashion",
youtube,streetwear 2025,https://www.youtube.com/watch?v=uZVwrUjE1po,1762434808,Suzushii Clothing Streetwear Store Honest Review | suzushiiclothing.com Legit or Scam? (2025),"In this video, I show you Suzushii Clothing Streetwear T-Shirts & Hoodies Honest Review | suzushiiclothing.com Legit or Scam? in ..."
youtube,streetwear 2025,https://www.youtube.com/watch?v=aQYJRKZdJ14,1762434003,Mens Casual Winter Jacket | Functional &amp; Fashionable 2025,"Get the best of both worlds with this functional and fashionable Mens Casual Winter Jacket, perfect for 2025 and beyond!"
youtube,streetwear 2025,https://www.youtube.com/watch?v=nrzNxrTAqxQ,1762428660,🔥 Urban Chic Fashion 2025 | Stunning Streetwear Looks That Turn Heads 💃 #shorts #fashion #trending,Urban Chic Fashion 2025 | Stunning Streetwear Looks That Turn Heads #shorts #fashion #trending --- Description: Get ...
youtube,streetwear 2025,https://www.youtube.com/watch?v=DEqOuNDD2Zs,1762425531,Chinese Streetwear 2025 | Global Style Inspiration part: 26 #fashiontrends #chinesefashion,"Experience the rise of Chinese Streetwear 2025, where bold designs from Shanghai and Beijing spark global street style trends."
youtube,streetwear 2025,https://www.youtube.com/watch?v=eeJZl3HpUSA,1762423272,Stunning Streetwear Looks of 2025 😍🔥 #FashionShorts,"Step into the world of Street Fashion 2025 — where every look turns heads! ✨ From bold urban vibes to classy chic fits, these ..."
youtube,streetwear 2025,https://www.youtube.com/watch?v=9q5PVeS7Kdo,1762423221,addict(s)　2025A/Wコレクション　Vol.40 #fashion #clothing #mensfashion #streetwear #ootd #jeans #menswear,メンズセレクトショップaddict(s)で取り扱っている2025AWコレクションのアイテム紹介になります。
youtube,streetwear 2025,https://www.youtube.com/watch?v=oFKwGBlDIq0,1762418340,Chinese Streetwear 2025 | Global Style Inspiration part: 25 #fashiontrends #chinesefashion,"Experience the rise of Chinese Streetwear 2025, where bold designs from Shanghai and Beijing spark global street style trends."
youtube,streetwear 2025,https://www.youtube.com/watch?v=8oGdFQpqUmY,1762410339,"BEST Men&#39;s Fall/Winter HAUL 2025: Affordable Streetwear &amp; Style Fall/Winter HAUL, 2025, Style Guide.","Agar aap BEST Men's Fall/Winter HAUL 2025 search kar rahe the, toh aap sahi jagah aaye hain! Is video mein main saare ..."
youtube,streetwear 2025,https://www.youtube.com/watch?v=2fOcj5DjUl8,1762408809,Спортивный костюм Nike x Supreme,
youtube,streetwear 2025,https://www.youtube.com/watch?v=WJgr3Aimli0,1762407017,🔥 Ladies Fashionistas Rule the Streets | 2025 Street Style Trends 💃 #shorts #fashion #trending,Ladies Fashionistas Rule the Streets | 2025 Street Style Trends #shorts #fashion #trending --- Description (SEO Optimized): ...
youtube,streetwear 2025,https://www.youtube.com/watch?v=aSHJ5rh3Qwc,1762403632,SUPREME SS 2025 #supremenyc #supremecollector #streetwear,
youtube,streetwear 2025,https://www.youtube.com/watch?v=6fvqjYCeG5Y,1762398752,Got sole Boston 2025 #viral #streetwear #sneakerhead#bostonceltics #jaylenbrown #fashion,
youtube,streetwear 2025,https://www.youtube.com/watch?v=VlonG_F6M7Q,1762397920,Flick Kick 👟 Boys Joggers 2025 | Step Up Your Style 🔥,"Flick Kick Joggers | Own the Street Bold Colors, Bold Moves New day, new drip — Flick Kick Joggers redefine comfort and ..."
youtube,streetwear 2025,https://www.youtube.com/watch?v=GkbnaPTWMpc,1762379461,Would you wear these?🤔🧷Free Fashionguid in Bio🧷 #streetwear #sneakers,"Streetwear inspo 2025 From hoodies, jorts, caps to the latest sneaker drops – this Short brings you the best streetwear ..."
youtube,streetwear 2025,https://www.youtube.com/watch?v=UUc-wxXycKE,1762379005,🔥 Os 5 Animes que Mais Bombam nas Estampas em 2025 👕✨,Os animes estão dominando o streetwear brasileiro em 2025 Nesse vídeo eu te mostro quais são os 5 que mais fazem ...
youtube,streetwear 2025,https://www.youtube.com/watch?v=ACxLt5SCAwE,1762378299,Would you wear these?🤔🧷Link in Bio🧷#streetwear #customsneakers,"Streetwear inspo 2025 From hoodies, jorts, caps to the latest sneaker drops – this Short brings you the best streetwear ..."
youtube,streetwear 2025,https://www.youtube.com/watch?v=3BnOPgl84IM,1762374301,How to Start a Sneaker &amp; Streetwear Business in 2025,"What does it really take to turn your love for sneakers into a six figure business? In this episode of Prosperity In Education, we sit ..."
youtube,streetwear 2025,https://www.youtube.com/watch?v=CxWH6bVSJXQ,1762372810,Must-Try Outfit Ideas for a Stunning Everyday Look! #shorts #outfitideas #fashion,Welcome to Obsessed with Skinny Jeans! Must-Try Outfit Ideas for a Stunning Office Look! Which style is your favorite?
youtube,streetwear 2025,https://www.youtube.com/watch?v=z9PTXKFZpdU,1762369267,EVISU X ICE CREAM 2025 COLLECTION,
youtube,streetwear 2025,https://www.youtube.com/watch?v=f81OxYL52jU,1762362075,Top Street Styles 2025 🌍  Viral Fashion Inspiration 👠,Discover the latest **viral street styles** and **OOTD ideas** from around the world! From casual **streetwear** to chic outfits ...
youtube,streetwear 2025,https://www.youtube.com/watch?v=eAP2iqg9yQk,1762359079,🖤 Urbanstyle.Berlin – Herren Hoodie Kollektion 2025Entdecke unsere neuen Herren Hoodies,"Der Hoodie, der Style & Komfort neu definiert! Urban. Bequem. Unverwechselbar – genau dein Look. Jetzt entdecken auf ..."
youtube,streetwear 2025,https://www.youtube.com/watch?v=shy-9OIcvX0,1762358086,Hoodie &amp; Trouser Combo For Men | Stylish Winter Outfit 2025,"Looking for the perfect winter combo? ❄️ Get our Hoodie & Trouser Combo for Men — stylish, warm, and super comfortable!"
youtube,streetwear 2025,https://www.youtube.com/watch?v=JUS6-OEGSbI,1762357502,Fall Ready 🍂 Nike Sweatsuit Season | Cozy Streetwear Outfit Inspo 2025 #nike #outfit #outfitideas,Fall calls for cozy fits and classic Nike energy This Nike sweatsuit is the perfect blend of comfort and streetwear style — made ...
youtube,streetwear 2025,https://www.youtube.com/watch?v=tFKFfaWwhRk,1762356498,Zudio Winter Collection 2025 #zudiofashion #wintercollection #fashionideas #sale #trending,zudio #zudioindia #zudiostyle #zudiowintercollection #zudiowinter2025 #zudiolookbook #zudioOOTD #zudiofinds ...
youtube,streetwear 2025,https://www.youtube.com/watch?v=U-lRaod6omM,1762355706,Actually Obsessed 😍 JD Sports x Nike Autumn #outfit Inspo 2025 | Cozy Streetwear Vibes #nike,"fall fits never looked this good Serving cozy streetwear vibes with the latest JD Sports x Nike looks for Autumn 2025 — sporty, ..."
