source,query,url,created_utc,title,text
youtube,men's fashion trends,https://www.youtube.com/watch?v=fCByUrS5uAA,1768806821,Navy blue&#39; #fashion #fashionstyle #fashiontrends #selfimprovement #selfgrowth #selfcare #selflove,fashion #fashionstyle #fashiontrends #mensfashion #fashionshorts #style #styleinspo #menswear #selfimprovement #selfcare ...
youtube,men's fashion trends,https://www.youtube.com/watch?v=A1VMsxVSdTI,1768803312,🗣️ Men&#39;s Fashion Ideas 🌟 #ytshorts #mensfashion #exploreshorts #outfitideas,Men's Fashion Ideas #ytshorts #mensfashion #exploreshorts #outfitideas keyword - #MensFashion #CapsuleWardrobe ...
youtube,men's fashion trends,https://www.youtube.com/watch?v=lSZL0kx3q_E,1768801082,😱💪🏋️#motivation #fitness #bodybuilder #trendingshorts #shortsviral #youtubeshorts #fashiontrends,
youtube,men's fashion trends,https://www.youtube.com/watch?v=Zy3FbKuxXRI,1768797104,Men&#39;s fashion world          #fashion #fashiontrends #mensfashion #menswear #viral #trendingclothes,Please subscribe and like.
youtube,men's fashion trends,https://www.youtube.com/watch?v=uXil24GY5vA,1768791344,Top Korean Men Fashion 2026 | Stylish Outfit Ideas #hangul #koreantalkzm #koreastyle #koreanmale,"Korean man outfit 2026 mein modern, minimal aur classy fashion trends dekhne ko milte hain. Is video mein aap dekhenge latest ..."
youtube,men's fashion trends,https://www.youtube.com/watch?v=3Z7tW3pBqXM,1768787988,Men&#39;s Fashion Week Paris: Trends Making Waves! #Shorts #VidNarrate,"""Men's Fashion Week: Bold Styles Unleashed! #ParisFashion #TrendAlert"""
youtube,men's fashion trends,https://www.youtube.com/watch?v=rAgQ-Pns6pM,1768752910,🔥 Men Fashion Trends 2026 👟 | Sneakers &amp; Canvas You Can Actually Wear 😎,"WELCOME TO FUNACHY FASHION–MEN'S FASHION SPOT   Your go-to channel for everything MEN'S Fashion, Style Tips, ..."
youtube,men's fashion trends,https://www.youtube.com/watch?v=iiAUg6IyVd8,1768752070,🔥 Men Fashion Trends 2026 ⌚ | Watches You Can Actually Wear 😎,"WELCOME TO FUNACHY FASHION–MEN'S FASHION SPOT   Your go-to channel for everything MEN'S Fashion, Style Tips, ..."
youtube,men's fashion trends,https://www.youtube.com/watch?v=ckYvOg8ik8s,1768751772,The Perfect Minimal Sneakers for Men 👟✨ #shorts #fashion,HERE is your product links press the link for long https://www.wishlink.com/fashioncollection3415/post/4062948 Your ...
youtube,men's fashion trends,https://www.youtube.com/watch?v=duaQh5oVCR4,1768750536,✨College outfit inspo#shorts  #fashion#trend #collegeoutfits#mensfashion,"Hi guys, I hope you will like this video. If you want to watch more content like this.❤ Please, Don't Forget to Like, Comment, Share ..."
youtube,men's fashion trends,https://www.youtube.com/watch?v=5e-K191cH9Q,1768750500,Men with Class Dress Like This in 2026 🔥 #style #fashion #explore #trending #viral,"Men with class don't chase trends — they build timeless style ✨ This outfit is all about clean fits, premium details, and quiet ..."
youtube,men's fashion trends,https://www.youtube.com/watch?v=N0vEB4Dw67w,1768748902,Man in Blue 💙 Powerful Men’s Fashion Look Nexahub Trends,"Blue outfit styling that defines confidence, class, and modern masculinity #MenFashion #blueoutfit #MensStyle #GentlemanLook ..."
youtube,men's fashion trends,https://www.youtube.com/watch?v=VmHr4CP9KIU,1768747655,Flex&#39; #fashion #fashionstyle #fashiontrends #fashionshorts #shortsfeed #shorts #viral,fashion #fashionstyle #fashiontrends #selfimprovement #mindset #viral #youtubeshorts #youtube #viralshort #views #fypシ #fypシ ...
youtube,men's fashion trends,https://www.youtube.com/watch?v=oqF_hAVHmmk,1768746813,Best slippers for men under 300 😱 | Foot Wear | Sandals | #footwear #sandals #comfortfootwear #mens,Best slippers for men under 300 | Foot Wear | Sandals | #footwear #sandals #comfortfootwear #mens best slides for men best ...
youtube,men's fashion trends,https://www.youtube.com/watch?v=eDqDu6LD0VI,1768739459,Extra Premium Cotton Shirting Fabrics for Men | Formal Office Wear Shirt Fabrics in India 2026,"Agar aap premium shirts for men, luxury cotton shirting fabrics, aur best shirt fabric in India search kar rahe ho, to yeh video aapke ..."
youtube,men's fashion trends,https://www.youtube.com/watch?v=yPXsvElYn8w,1768735275,🔥 Men Fashion Trends 2026 👕 | T-Shirts &amp; Polo Styles You Can Actually Wear 😎,"WELCOME TO FUNACHY FASHION–MEN'S FASHION SPOT   Your go-to channel for everything MEN'S Fashion, Style Tips, ..."
youtube,men's fashion trends,https://www.youtube.com/watch?v=Rqt9cls43LA,1768733245,Day 23 of FIT OR FAAT SERIES.  #mensfashion #fashiontrends #subscribe,
youtube,men's fashion trends,https://www.youtube.com/watch?v=oeB8zUdBEOI,1768732454,Latest Coat Pant Design 😍 | Men Fashion Shorts,"New style coat pant design ✂️   Latest fitting, perfect cutting aur premium finishing Main ek professional fashion designer ..."
youtube,men's fashion trends,https://www.youtube.com/watch?v=fSmd0rxJBtc,1768730465,Most Handsome Man in the World Part 129 #handsome #model #fashion #handsomemen #shorts,"Discover who is the most handsome man in the world In this video, we showcase the world's most handsome men, featuring ..."
youtube,men's fashion trends,https://www.youtube.com/watch?v=RL2Zoei-GpQ,1768726028,Top Men’s Outfits 2026🔥New Fashion Trends You Must Try#shorts #fashion #outfit #outfitideas #explore,Top Men's Outfits 2026  New Fashion Trends You Must Try #youtubeshorts #youtube #reels #viral #viralvideo Queries Discussed ...
youtube,men's fashion trends,https://www.youtube.com/watch?v=st5h683lTyg,1768726019,Top Men’s Outfits 2026🔥New Fashion Trends You Must Try#shorts #fashion #outfit #outfitideas #explore,Top Men's Outfits 2026  New Fashion Trends You Must Try #youtubeshorts #youtube #reels #viral #viralvideo Queries Discussed ...
youtube,men's fashion trends,https://www.youtube.com/watch?v=fFf7Z4Lr0Tg,1768725041,power of YouTube channel 💪💸!! #fashiontrends #viral #youtubeshorts #myfirstvlog #ytshorts #short,power of YouTube channel !! #fashiontrends #viral #youtubeshorts #myfirstvlog #ytshorts #short #bailalrdx04 #bhiar ...
youtube,men's fashion trends,https://www.youtube.com/watch?v=SZ3SPuCXvw4,1768723202,Trending Shirt For Men 😍😍 #shirt #mensfashion #fashion #clothing #shorts,5 Trending Shirt For Men top shirt for men shirts for men dress shirt for men linen shirt for men budget shirt for men flannel ...
youtube,men's fashion trends,https://www.youtube.com/watch?v=-acC8k4yOwk,1768714283,Men&#39;s fashion trends #youtube #outfit #shortsfeed #viral #fyp #fashionstyle#shorts @YouTube,Men's fashion trends #youtube #outfit #shortsfeed #viral #fyp #fashionstyle #shorts @YouTube #shortsvideo #shorts ...
youtube,men's fashion trends,https://www.youtube.com/watch?v=g2Np-1l86N0,1768661511,Men’s Fashion Trends You’ll Actually Wear in 2026,Clothing Links V Neck Sweaters - EOT ...
youtube,women's fashion trends,https://www.youtube.com/watch?v=cYmbG4mip1o,1768806417,Trending Winter Fashion Clothes Unboxing For Girls #trending #fashiontrends #fashion,
youtube,women's fashion trends,https://www.youtube.com/watch?v=3_bn53dUQzY,1768804733,CHINA GIRL STREET FASHION | #shortsfeed #fashiontrends #china #streetfashion #shortvideo,CHINA GIRL STREET FASHION | #shortsfeed #fashiontrends #china #streetfashion #shortvideo #chinastreetstyle #chinesegirl ...
youtube,women's fashion trends,https://www.youtube.com/watch?v=0u1678MvK70,1768799706,2026 Plus Size Fashion Trends — Slay with Confidence,Explore Into the world Of Timeless African Fashion In 2025 And Elegant African Prints Dress Styles.. This Video Showcases the ...
youtube,women's fashion trends,https://www.youtube.com/watch?v=OMDUjDHl6cc,1768798523,#speedsong #fashion #music #fashiontrends #dj #newmusic #fashionhub #remix #fashionhubcollection,
youtube,women's fashion trends,https://www.youtube.com/watch?v=9nbERIKWWLo,1768795009,🤗Tag your bhabhi 🥰#shorts #viralvideo #bhojpuristatua #fashiontrends #love @snehaajit7478,
youtube,women's fashion trends,https://www.youtube.com/watch?v=8IEQMESWz8M,1768793864,गरीब लोग बहुत क्या बोली महिला #trending #videos #shorts #fashiontrends,गरीब लोग बहुत क्या बोली महिला #trending #videos #shorts #fashiontrends गरीब लोग बहुत ...
youtube,women's fashion trends,https://www.youtube.com/watch?v=pKe70uYtDJA,1768793370,#viral  women deewana khub hai♥️♥️ #viral #fashiontrends #love #tereliyehumhaijiye,viral #love #trendingshorts.
youtube,women's fashion trends,https://www.youtube.com/watch?v=asYtfFi3KO0,1768792985,#trending #saree #fashiontrends #viral #fashion #fashionstyles #indiandesignerwear #sareecollection,
youtube,women's fashion trends,https://www.youtube.com/watch?v=cqur_pAeIMs,1768789938,Hamre ghar wale itne. aameer h ki#love #aestheic #shortvideos #viralvideos #fashiontrends #fashion,Hamre ghar wale itne. aameer h ki#love #aestheic #shortvideos #viralvideos #fashiontrends #fashion.
youtube,women's fashion trends,https://www.youtube.com/watch?v=VTk1BFVZw0A,1768779181,#Rang_Rashiya_Channel #dance #fashiontrends #video #summerfashion #bhojpuri #eshramcardregistration,Rang_Rashiya_Channel #dance #fashiontrends #video #summerfashion #bhojpuri #eshramcardregistration.
youtube,women's fashion trends,https://www.youtube.com/watch?v=Xffo_J1PLfg,1768762469,Women&#39;s Fashion Dress Trending #fashion #youtubeshorts #fashiontrends,
youtube,women's fashion trends,https://www.youtube.com/watch?v=8PkxU1CWm5k,1768760946,WHICH 2026 Fashion Trends Are ACTUALLY Worth Wearing NOW,"In this video, I talk about the upcoming fashion trends for 2026, focusing on what's truly""wearable fashion trends for real women."
youtube,women's fashion trends,https://www.youtube.com/watch?v=Zwbc_yEYrlA,1768756515,street fashion girl | street style | #shorts #fashiontrends #fashionstyle #beautiful #beauty #model,street fashion girl | street style | #shorts #fashiontrends #fashionstyle #beautiful #beauty #model.
youtube,women's fashion trends,https://www.youtube.com/watch?v=zkZ5xDSEnKU,1768754728,how men can wear women&#39;s fashion,woman discusses men wearing women's clothes Get an Exclusive NordVPN deal + 4 months extra here ...
youtube,women's fashion trends,https://www.youtube.com/watch?v=3U_oQaOF8Y4,1768752900,#song #lovesong #trendingshorts #shortsvideo #oldisgoldsongs #love #shortfeed#dance#fashiontrends,
youtube,women's fashion trends,https://www.youtube.com/watch?v=k3P-RHEat5Q,1768751247,Winter Outfit For Girls 😎#shorts #fashion#trend#viral#kurti #stylewithanupam#outfit#woolencollection,Women's clothes for daily wear winter special woolen outfits for girls womens. Embroidered Kashmiri Work woolen kurti ...
youtube,women's fashion trends,https://www.youtube.com/watch?v=i7TU8DWdaNs,1768749513,CHINA GIRL STREET FASHION | #shortsfeed #fashiontrends #china #streetfashion #shortvideo,CHINA GIRL STREET FASHION | #shortsfeed #fashiontrends #china #streetfashion #shortvideo #chinastreetstyle #chinesegirl ...
youtube,women's fashion trends,https://www.youtube.com/watch?v=IYfi21jRLFA,1768748418,Mini vlog🎀#minivlog #ytshorts #shortvideo #viral #viralvideo #shorts #trending #fashiontrends #like,Mini vlog  #minivlog #ytshorts #shortvideo #viral #viralvideo #shorts #trending #fashiontrends #like . . . . .
youtube,women's fashion trends,https://www.youtube.com/watch?v=DUAChfkxN4o,1768747546,Outfits For Women&#39;s😎🔥#shorts #fashion #trend #viral  #stylewithanupam#shawls #fashiontrends #winter,Cozy Super Soft Werm Shawl Collection For Girls Women's. Trendy outfits for women's clothes.Must have Trend Fashion Style ...
youtube,women's fashion trends,https://www.youtube.com/watch?v=A5B_elB4P1c,1768746608,NEW ARRIVALS TOP ELEGANT HANDBAG FOR WOMEN&#39;S//NEW MODEL PURSE FASHION IDEAS 2026,NEW ARRIVALS TOP ELEGANT HANDBAG FOR WOMEN'S//NEW MODEL PURSE FASHION IDEAS 2026 BAG & SHOES ...
youtube,women's fashion trends,https://www.youtube.com/watch?v=1vh3G5Tiuh8,1768739405,💞desi vibes: desi fashion trends #shortsvideo,desi vibes: desi fashion trends #shortsvideo #traditionalwear #desilook #desifashion #indianfashion ...
youtube,women's fashion trends,https://www.youtube.com/watch?v=vBCfEl7GtEI,1768735855,মায়ের জন্মদিনে পুরনো দিনের ছবি পোস্ট করে মাকে জন্মদিনেরশুভেচ্ছা #motivation #trending #fashiontrends,মায়ের জন্মদিনে পুরনো দিনের ছবি পোস্ট করে মাকে জন্মদিনেরশুভেচ্ছা ...
youtube,women's fashion trends,https://www.youtube.com/watch?v=drKXyzkUqFI,1768735500,beautiful mirror work  girls dress 👗#shortvideo #fashion #trending,beautiful mirror work girls dress #shortvideo #fashion #trending #viralshorts #fashioninspiration #fashiontrends #dress ...
youtube,women's fashion trends,https://www.youtube.com/watch?v=zLFQ8EUxcgc,1768735088,Naeema Butt Ramp walk #ytshorts #shortsfeed #shorts #youtubeshorts #fashiontrends #shortsviraltips,Naeema Butt Ramp walk #ytshorts #shortsfeed #shorts #youtubeshorts #fashiontrends #shortsviraltips.
youtube,women's fashion trends,https://www.youtube.com/watch?v=QMqpLy0UAoA,1768733100,India got talent women fashion secret idea 💡👌 shorts video #womensfashion #diyfashion #fashionstyle,India got talent women fashion secret idea shorts video #womensfashion #diyfashion #fashionstyle #fashion #diyfashion ...
youtube,streetwear 2025,https://www.youtube.com/watch?v=80lm8Gh74fE,1768809861,KONDALA 2025 Fall Winter Casual Faux Fur Brown Women Warm Jackets Streetwear,KONDALA 2025 Fall Winter Casual Faux Fur Brown Women Warm Jackets Streetwear ✓ Sponsored Aliexpress link ...
youtube,streetwear 2025,https://www.youtube.com/watch?v=EILGUR8juHs,1768787245,#nerdsclothing x @dannycortesnyc @siriusxm 2025 #art #streetwear #thesuperppodcast #dannycortes,hiphop50 #hiphop #polopirata #polopirate #viral #satisfyingvideo #moda #estilo #siriusxm #radio #radioshow.
youtube,streetwear 2025,https://www.youtube.com/watch?v=otpnGX3-jzU,1768784462,Vibe Surge 2025 Styles,A fast-paced YouTube Shorts montage that showcases seven hot 2025 trends in rapid 1–2 second clips with bold text overlays ...
youtube,streetwear 2025,https://www.youtube.com/watch?v=J3uZYopai-A,1768770332,Where to buy Vintage Clothing🔥#streetwear #vintageclothing #fashion,"Streetwear inspo 2025 From hoodies, jorts, caps to the latest sneaker drops – this Short brings you the best streetwear ..."
youtube,streetwear 2025,https://www.youtube.com/watch?v=yUxcfcgveEE,1768757196,"SP5DER, DENIM TEARS AND HELLSTAR DONE?!! WORST/BEST BRANDS OF 2025!",MAKE SURE TO FOLLOW OUR PAGES www.instagram.com/shopstatus www.tiktok.com/shopstatus_ www.Shopstatus.store ...
youtube,streetwear 2025,https://www.youtube.com/watch?v=0qAcYBe3uF8,1768755603,weirdest chinese items that i have pt 20 🤑 #whydna #fashion #streetwear #pickups,
youtube,streetwear 2025,https://www.youtube.com/watch?v=92puES2GDH4,1768720185,POV: You just found the trend of 2025 😎 #ClothingBrand #FashionBrand #streetwear,
youtube,streetwear 2025,https://www.youtube.com/watch?v=VQW10qyhqI8,1768718590,MUJER 2025 Suede Bomber Jackets for Women Outerwears Oversized Jacket Woman Streetwear,MUJER 2025 Suede Bomber Jackets for Women Outerwears Oversized Jacket Woman Streetwear ✓ Sponsored Aliexpress link ...
youtube,streetwear 2025,https://www.youtube.com/watch?v=Sn8lSJ9cTWU,1768687676,Y2k demon slayer wide leg jeans streetwear jeans men women 2025 harajuku japanese style sky blue jea,Y2k demon slayer wide leg jeans streetwear jeans men women 2025 harajuku japanese style sky blue jeans wide trouser denim ...
youtube,streetwear 2025,https://www.youtube.com/watch?v=UiS4lWc5ajo,1768685956,2025 Men Irregular Pants Solid Color Button Joggers Loose Trousers Men Streetwear INCERUN Fashion Ca,2025 Men Irregular Pants Solid Color Button Joggers Loose Trousers Men Streetwear INCERUN Fashion Casual Male Long ...
youtube,streetwear 2025,https://www.youtube.com/watch?v=QyhzSbO3RA0,1768685168,2025 High Street American Retro Streetwear Men Gothic Harajuku Letter Printed Zipper Hoodie Trendy P,2025 High Street American Retro Streetwear Men Gothic Harajuku Letter Printed Zipper Hoodie Trendy Punk Y2K Overside ...
youtube,streetwear 2025,https://www.youtube.com/watch?v=-oADXGpbueI,1768683889,Men Tank Tops Transparent Sexy Hollow Out Sleeveless Male Vests Streetwear 2025 Fashion Party Nightc,Men Tank Tops Transparent Sexy Hollow Out Sleeveless Male Vests Streetwear 2025 Fashion Party Nightclub Men Clothing ...
youtube,streetwear 2025,https://www.youtube.com/watch?v=DrFW6DvGc6s,1768682135,2025 Hip-hop Trendy Streetwear Graphic Tops Men Goth Harajuku Retro Oversized T-shirt Women Y2K Pure,2025 Hip-hop Trendy Streetwear Graphic Tops Men Goth Harajuku Retro Oversized T-shirt Women Y2K Pure Cotton Loose Short ...
youtube,streetwear 2025,https://www.youtube.com/watch?v=xOkMDjJHQns,1768681944,INCERUN Men Tank Tops Mesh Sleeveless Hollow Out Casual Male Vests Streetwear 2025 Solid See Through,INCERUN Men Tank Tops Mesh Sleeveless Hollow Out Casual Male Vests Streetwear 2025 Solid See Through Summer Sexy ...
youtube,streetwear 2025,https://www.youtube.com/watch?v=OW2he1NkMHc,1768680260,Men Tank Tops Patchwork V Neck Sleeveless Knitted Male Vests Summer 2025 Skinny Streetwear INCERUN F,Men Tank Tops Patchwork V Neck Sleeveless Knitted Male Vests Summer 2025 Skinny Streetwear INCERUN Fashion Men ...
youtube,streetwear 2025,https://www.youtube.com/watch?v=ByuxRuzo7hM,1768680009,INCERUN Summer Men Vests Patchwork Lapel Sleeveless Button Casual Male Waistcoats Streetwear 2025 Fa,INCERUN Summer Men Vests Patchwork Lapel Sleeveless Button Casual Male Waistcoats Streetwear 2025 Fashion Vests ...
youtube,streetwear 2025,https://www.youtube.com/watch?v=LDlVXF7gy8U,1768677745,FSLE 2025 New Women Retro Color Block Striped T-Shirt Classic Round Neck Long Sleeve Basic Vintage O,FSLE 2025 New Women Retro Color Block Striped T-Shirt Classic Round Neck Long Sleeve Basic Vintage Oversized Chic ...
youtube,streetwear 2025,https://www.youtube.com/watch?v=9yMvwQqBdHo,1768676399,INCERUN Men Tank Tops Patchwork Sleeveless Summer Workout Casual Male Vests Streetwear 2025 Loose Fa,INCERUN Men Tank Tops Patchwork Sleeveless Summer Workout Casual Male Vests Streetwear 2025 Loose Fashion Men ...
youtube,streetwear 2025,https://www.youtube.com/watch?v=kKvJuLMWqFQ,1768670839,Zudio Sale #zudiofashion #zudioindia #winterstyle #trends2025 #trendingshorts,Zudio #ZudioIndia #ZudioStyle #ZudioWinterCollection #ZudioWinter2025 #ZudioLookbook #ZudioOOTD #ZudioFinds ...
youtube,streetwear 2025,https://www.youtube.com/watch?v=g4RempXRpJc,1768669270,TFMLN 2025 Winter Women Loose Faux Leather Jacket Fashion Removed Big Fur Collar Causal Coat High,Buy Now:https://s.click.aliexpress.com/e/_c4pGQNDl TFMLN 2025 Winter Women's Loose Faux Leather Jacket Step into winter in ...
youtube,streetwear 2025,https://www.youtube.com/watch?v=tF8QRF7kKHo,1768669076,2025 Summer New Retro Pink Los Angeles 86 Printed Blouse Women Streetwear Baseball Shirt Hip Hop Sho,2025 Summer New Retro Pink Los Angeles 86 Printed Blouse Women Streetwear Baseball Shirt Hip Hop Short Sleeve Button Up ...
youtube,streetwear 2025,https://www.youtube.com/watch?v=a7lysZ1kQh8,1768666076,2025 Men Shorts Solid Color Elastic Waist Split Side Button Men Bottoms Streetwear Fashion Sexy Casu,2025 Men Shorts Solid Color Elastic Waist Split Side Button Men Bottoms Streetwear Fashion Sexy Casual Male Shorts S-5XL ...
youtube,streetwear 2025,https://www.youtube.com/watch?v=sF71-1HWUBA,1768664756,2025 Summer New Boston Printed Oversize Blouse Women Streetwear Baseball Shirt Cool Hip Hop America,2025 Summer New Boston Printed Oversize Blouse Women Streetwear Baseball Shirt Cool Hip Hop America Half Sleeve Button ...
youtube,streetwear 2025,https://www.youtube.com/watch?v=E12FwudQyqU,1768663236,2025 Recap of BK LEO Clothing.‎Lifestyle Streetwear #2025Recap #YearOfGrowth #TransformationWear,2025 Recap of BK LEO Clothing. ‎Lifestyle Streetwear. ‎Wear your mindset. Enjoy the journey. ‎Explore for more ‎Free Shipping for ...
youtube,streetwear 2025,https://www.youtube.com/watch?v=wcH_mc7ZcnE,1768658168,2025 New Boxy Fit Short Sleeve T-shirt Men&#39;s Heavyweight Cotton Drop Shoulder Tee American Streetwea,2025 New Boxy Fit Short Sleeve T-shirt Men's Heavyweight Cotton Drop Shoulder Tee American Streetwear Basic Crew Neck ...
