source,query,domain,url,created_utc,title,text
gnews,fashion trend,news.google.com,https://news.google.com/rss/articles/CBMitAFBVV95cUxNNTNtYnJSZ29VVnVfQUtRS2VHdFZyWndOal92TWhKRENzNTVRMVdOLUhpai1IMUlkdUQ2MUVxd2JGNWdhRmpUMGdyOHBVY1FIVDJVdXB4UDJTVk44a3ZLaV9zUVFldW4yNzNCZi1tQkdoOGlkVjhya1VjVzZXYUF2S21zbXZGQUhkTEthbzFWc1BRN29kRFdQUmlEbXVqZTYxeUh4OGVQSnA5VFR4czBQWFRvV0g?oc=5,1776927600,Vintage fashion trend offers sustainable alternative to fast fashion in Las Vegas - WBRC,Vintage fashion trend offers sustainable alternative to fast fashion in Las Vegas - WBRC
gnews,fashion trend,news.google.com,https://news.google.com/rss/articles/CBMiugFBVV95cUxQOG9ScFdXRmgxRHJRUE1lemwySENvdkhucDhqRXgwRU9ub0gyaEVrMTVlTVJzWkVkVkI2MWdpZFdDOUJCV3YwUzlKdl9IY2dfWTNxaE1lN01qV2ZtMzMzWE9TQXFDUllFdGJaY2ZfQW0zdHdGMEFOVDRaaUlwNnJYRXZnbmVvUVVlOUZSaTlDOEoweFMtQ1FLVHpNc3h0R1QwWDE4VDg2dHgyT1lKUmRUb3ZBYnlkU2x2OXc?oc=5,1776927600,Vintage fashion trend offers sustainable alternative to fast fashion in Las Vegas - AZ Family,Vintage fashion trend offers sustainable alternative to fast fashion in Las Vegas - AZ Family
gnews,fashion trend,news.google.com,https://news.google.com/rss/articles/CBMijwFBVV95cUxOSU45RFZCYVA2YWtIZlVOUzNxQkdZYWROSlFWdVFTQkhHNGhqQlRNN0syWVV4Sm9qYm1WRXpfRHhtS1RqeENoMGZNdlZ1d0xOQTBNZVEwbzctazBDOWRiS1JwaTdhWG8wdE50bU9lV1g1bkUwRG53NjR2dDc2VngtVnI1djNPWXFiQTV4T1lNOA?oc=5,1777679100,The Met Gala Naked Dresses Everyone *Still* Talks About - Who What Wear,The Met Gala Naked Dresses Everyone *Still* Talks About - Who What Wear
gnews,fashion trend,news.google.com,https://news.google.com/rss/articles/CBMiggFBVV95cUxOdWxKR0NTQ01iYUZpZ0lmOEVHZ1JIY2FqdnJYMlVvQ0dnQVRuZDJSbjVoYWQxMGVtZkNudE5BQjBfVWhHRDVLS3dZVkJRMk5UZGZ3RldIUGNKcTFLakROZGpRaU1yTllibzNxWVlpeFdGS0hOSWVoaTd0Y0dsaHBQTE1R?oc=5,1777579231,Everyone Wants to Get Their Hands on a Flap Bag Right Now - Harper's BAZAAR,Everyone Wants to Get Their Hands on a Flap Bag Right Now - Harper's BAZAAR
gnews,fashion trend,news.google.com,https://news.google.com/rss/articles/CBMitAFBVV95cUxOVzBnQnh6bUdKT1BXclltb0VITmlCM2M3a1NMT19QM29DOHZWMW8tN1h3T0o5VVJ0THpERHdjVUE5d2QxNHBsVkkySHp0SlRqZnBLcmlpdUhnZEV4aWdSRHh5NkxDdldQR1Z0Q0tUTVYzbGRZOVRBTVh0aDRwdzQ5RlVReVlBLXlCaDlBN1A4SVppSV9Mc2JaREVJT3JBbVpVdWNvalVlNXVPeVVxOGhIRDVhVkQ?oc=5,1776927600,Vintage fashion trend offers sustainable alternative to fast fashion in Las Vegas - WAFB,Vintage fashion trend offers sustainable alternative to fast fashion in Las Vegas - WAFB
gnews,fashion trend,news.google.com,https://news.google.com/rss/articles/CBMitAFBVV95cUxOZ0V4Vzc2dzl1cWp0bFJXTzV2aVdpYUxfbXlqRm5xMUhPSHctNGN5Wm9YMzdULUIyZ0ZQQUVrUENTeU45ODNGV3pPWnE2akt1cVZHZzNmdkMxRzl4QkRDWm94c2k2TWNpSmh1WG5peFhORHBlbzFmWEQzbFhxWHhubkp2NUNUTlh2R1BmNFhra0xZUC0zcUNZQzRaZ0QzdVpvX0hfVnpwN1pCcmM1ZXBJbFdqSmQ?oc=5,1777005420,Vintage fashion trend offers sustainable alternative to fast fashion in Las Vegas - KSLA,Vintage fashion trend offers sustainable alternative to fast fashion in Las Vegas - KSLA
gnews,fashion trend,news.google.com,https://news.google.com/rss/articles/CBMiswFBVV95cUxPOFZEblAwN09JV3BjSTkzNFlRRVBtMXhsY2V3LWFNRnkzUmN1bklQMEh1R1NBNFc3N3laSGFBcVp0WUZKdDlUOTh4YzBYV0tkY0pBMzdIWlM0eGhmT1czOU0xVnZady05MUdzR0lWZDdSd1RZT3Q0WE5feF9hTy1YT3ZwZWNTWVF3Yk52cHhUakVWLU1OY0kyWlJubjVSZUNkaGtaOElaLTd5Wm5GLTU5b2pSMA?oc=5,1776927600,Vintage fashion trend offers sustainable alternative to fast fashion in Las Vegas - WCTV,Vintage fashion trend offers sustainable alternative to fast fashion in Las Vegas - WCTV
gnews,fashion trend,news.google.com,https://news.google.com/rss/articles/CBMioAFBVV95cUxOTjJQX2tFbEkwR01GaUhGUklQOUw3ckFEYWRGMW43WXVJak15elVLRlY4MXR3T0d6SFE5YkdMMEZobktMS1Fkc21vQjY1SVBkX1JoazZIM3MzSmg5dWdXUnliQ1FYczRMU3RHbUZ4bTJPdjNZNFV1VlVBdUFpMUFEaThoekNuWk10X1NLZEVMXy16dFpMbHkxRTdrODBMWnZO?oc=5,1774854000,The Los Angeles fashion trend of the year is politics - Annenberg Media,The Los Angeles fashion trend of the year is politics - Annenberg Media
gnews,fashion trend,news.google.com,https://news.google.com/rss/articles/CBMie0FVX3lxTFB1ekVNQ1dLbk1GR0lyOWYyT1FNZmtpZkNidTZlRG9JNDlnWDA5dGlpQV9kUU05RnlkN1BtYXlXUU9FT2hVYVN3Vm44clV3dG9DLUxtamstRFZZeGtpbFl4UGtLRFdaNGJ4azdaQnpZd1FSR1JrOXlCbUp4UQ?oc=5,1777672069,7 Spring Bag Trends That Are Surprisingly Practical - Good Housekeeping,7 Spring Bag Trends That Are Surprisingly Practical - Good Housekeeping
gnews,fashion trend,news.google.com,https://news.google.com/rss/articles/CBMitwFBVV95cUxQSWZQSFJoOU5lQ1lBR2pvVWdKaXRZUnk5bk9Qb2NvWTVwSjRWbkoydlRyY1VDT203MFNFX3gyZmtRQWJBTVdaZnFTWk9XeVlUb1dnMHZEQXdoNTdpMm5MM0s4eThENmJzemExTm5XR1J5cTlubi1pb25FMmZFQk1sZWpjdEs3QXAtZm84STdoNzRMTWVndTBwV0JlbDdwTGFENzZ6NGdnVndTRHZ4UVg2M0VhWFppdG8?oc=5,1776927600,Vintage fashion trend offers sustainable alternative to fast fashion in Las Vegas - KFYR-TV,Vintage fashion trend offers sustainable alternative to fast fashion in Las Vegas - KFYR-TV
gnews,fashion trend,news.google.com,https://news.google.com/rss/articles/CBMitAFBVV95cUxNTmJaWkVVQXdhdWhzR3ZSWXREYml5ZG1kanZTdGlzbzlremhVZWl0Vkp5dFIySXB0aE95YjJPamtHTVN0eTJaSXZLRmFZaWJKZ2hNWEY4ejVPY0FLeWR1N3YzdTJTU2ViRVJqeGhoM3dNY0V5ZVBONERyVl9nSEE4MklPTnNzV2ctaUNMa0ZXeEhmTVRCS3BXUzBmcV9JdU1TQ1o4ZWNGeTMwaWVnUlZmM0xiQmk?oc=5,1776927600,Vintage fashion trend offers sustainable alternative to fast fashion in Las Vegas - KNOE,Vintage fashion trend offers sustainable alternative to fast fashion in Las Vegas - KNOE
gnews,fashion trend,news.google.com,https://news.google.com/rss/articles/CBMiswFBVV95cUxQdkNUaWtNdFplbEFQLVBuQlFHTnk5YkVNdEQyUGxvcTRCVldqTnNwNG5aSTJsSnF6a2Z6UFVUUXFwNDB5ZnM3dTgySTJETklFOU1DMDhTcm9iejRTaF9QVVpoOHZYMUlXZWlPY2c3bFk5aDgxZmozb1BQRWN4Mkt3QmpxM3doZmlsR1ZUZGtfd3F0bFg5NThJOFRveTVqckhzeTJDRTNsVVRYRFMxdWRVOVF5aw?oc=5,1776927600,Vintage fashion trend offers sustainable alternative to fast fashion in Las Vegas - WVLT,Vintage fashion trend offers sustainable alternative to fast fashion in Las Vegas - WVLT
gnews,fashion trend,news.google.com,https://news.google.com/rss/articles/CBMitAFBVV95cUxQdWdDaGg3S2hmXzRNd3l6dC1DSWk3ZGt2VEdxaG05Q3AyTjZlQXQ0RjJEZUdld0FEMFFRQ0FxX3E2UTlLc1JQVXdpOGNSNkIzMkJ2Wk1HT2lRYl8yX3RsVU1xY3AweUw1aWg3dU1oWVQ4dXVCSWY4Vm85NG5LUTZPYzg3NXlfWndSZ3UtSHdtdm5NU1lHTUNId3RJdXYtenVVN2xaR2ktR2RhTkxENl9kaHlWM2g?oc=5,1777005420,Vintage fashion trend offers sustainable alternative to fast fashion in Las Vegas - KMVT,Vintage fashion trend offers sustainable alternative to fast fashion in Las Vegas - KMVT
gnews,fashion trend,news.google.com,https://news.google.com/rss/articles/CBMiigFBVV95cUxObWpHaU9NMzlxODVGWUhDQ0RVeVk1ZEx0aHpmM015U244dFhoWXZ2Y0hKZTlqelktTjVXREtWallROWVxcHZHYVJpNk5QTzdoQ0wtY2RCOGpsb3VWUVNQT2pvLUI2cnZlZWhxRWVxbTFRUnBIc3hKbWxFM196WUJ6T0ZmdzJkNldaLXc?oc=5,1776495600,The Most Stylish Women Over 50 Are Wearing These 5 Spring Fashion Trends in 2026 - Who What Wear,The Most Stylish Women Over 50 Are Wearing These 5 Spring Fashion Trends in 2026 - Who What Wear
gnews,fashion trend,news.google.com,https://news.google.com/rss/articles/CBMidEFVX3lxTE12ZDdENm5abDMzY2owd0NPOUpvVGlnMmNYN0xkLTZsMnBGYkN3Sm5wUERYendfVDRvTFAxd2huMTcxVG1NNGs4Vy1oaDYwcEM5UWc0d2lTY1Z6TkRneF9fYThhSGc0LTR2Skh3bUM3RWtMNnNk?oc=5,1777706497,Coastal Grandmother vs Beach Luxe: The Seaside Fashion Trend That Owns Summer 2026 - Elle India,Coastal Grandmother vs Beach Luxe: The Seaside Fashion Trend That Owns Summer 2026 - Elle India
gnews,fashion trend,news.google.com,https://news.google.com/rss/articles/CBMijgFBVV95cUxNeF95ckp6WjM0NURFaHpFb2xTZmlFOUgyaFh4Y0gyZjdQejJBNnBQQ0p2anlhR2F5alF0MVgwQWZieWQwMi1VcXF0OXdjSFdKS1VRVklFMDU4ZU5UUVRHOGV6MU01QVJCdmg2OEhjU0lWSzdlemxsRWF6WHVLcmd4MHp6bXFMZkhQLVhiZ0tn?oc=5,1777837438,"9 summer dresses from M&S that are chic, stylish, and under £50 - cosmopolitan.com","9 summer dresses from M&S that are chic, stylish, and under £50 - cosmopolitan.com"
gnews,fashion trend,news.google.com,https://news.google.com/rss/articles/CBMijAFBVV95cUxPR3c0Zlc5RE9nSW9EczZEZEVucEVnXy1SY0t1Mk0tanZLaXpLbGJGb2wwb18yNEE2SkgyeExsdl9yUXlFSzg2dWJmeGFlaUV6Uk5IZFQzZEtwZjlHc3dZTFJ1bXZNa1NRMkNXM3FYZk5ncy1mQ0cxM0VVTGxMY1NlbF9QdzJQWjE5WTFtbg?oc=5,1777644069,"This new shoe trend is an elevated, polished take on ballet flats – and M&S has a chic suede pair for just £40 - cosmopolitan.com","This new shoe trend is an elevated, polished take on ballet flats – and M&S has a chic suede pair for just £40 - cosmopolitan.com"
gnews,fashion trend,news.google.com,https://news.google.com/rss/articles/CBMie0FVX3lxTFBKakxMZFpxdXFEZFR1ZVN0WEpLZ2pwNExIYkdwOUVGSnpuLXNFUWpqT1pLS2lQdS1zdEpFSHhJcjRnd2R4RkdMb04wamVQdjVJalY5dTZfeEU0VDcyMDJNRzVBOTdCdkI4UWdVTDVZUk5Zd0tPb05lMGprYw?oc=5,1777683600,Paris Hilton explains why she's 'proud' of Y2K fashion trends - Yahoo News UK,Paris Hilton explains why she's 'proud' of Y2K fashion trends - Yahoo News UK
gnews,fashion trend,news.google.com,https://news.google.com/rss/articles/CBMikAFBVV95cUxPUkZQMjYyU1U4aWtONDlzcDFDaElqYnI1aE44bk5vZmtUZl9qaXVNeHpobnBqa01xbkthcGt6QzJnbVl5a25GVjF4Nm9zWmZxRW81dkNQeDVwdFVOVXdzNW13SXhRQkFBamdPOHgwVjdVTmNyb2RER3FuQUN2TERadjVKQWZqaXpEcVZGQUllNHk?oc=5,1777717348,Directional striped dresses are spring’s most flattering print and Zara's £30 throw-on design nails the trend - cosmopolitan.com,Directional striped dresses are spring’s most flattering print and Zara's £30 throw-on design nails the trend - cosmopolitan.com
gnews,fashion trend,news.google.com,https://news.google.com/rss/articles/CBMilwFBVV95cUxNQ0I1UGpIWUlZQ0Z0T0Rxb2x0dVgza19YV1VndXZ1RnJ1ck5xS1h4eGc1YkJoMkR4R0x0dUhIRGdhcC1LbjM2SWI2UHA2N0ozc3hadWdKa1RWaThFZUx2R2RwSlk1RjJVNXJnQW5Uc2tsRDBNNklQclFyLTlvTl93QjI4OEVrYUFCQ0Q1QmRGR0V1NmRqZXJ3?oc=5,1775718000,"Coachella 2026 Trends To Watch For: Western, Boho and More - WWD","Coachella 2026 Trends To Watch For: Western, Boho and More - WWD"
gnews,fashion trend,news.google.com,https://news.google.com/rss/articles/CBMinAFBVV95cUxPYUpuWEhBSndjS3RndEdPeS1aMHdER1J4dWNvYjJLQy1uMlF3bjFkUmFDYVVNOEFSbDV6eXFHZ05BUXkzQWRnVmFKWEpZMWJXS0dRQTBxNkJ1dktqNUFmVHNCbm45OXpsTE5kaTZ2Ri1pWU5QU3NfNl8xbTM3QlpheU1wNUlNQXdwNzBMdU8xZDNYOUtfV2otSHlkbHPSAbABQVVfeXFMUGVjMUFMSXVOZXNvdHVXcnlOSFkwUTdEaTZLblh6b09RUEg2SzNmbnNGcFBIWHV4WG1ZV0VLQXd1V0JXLXZUdk1HUGxMUm53SEdISVczenRIZEJRb2NjdlNscno3TTBnaHhuaEFJTEdtTmVhU2FGLWxWRlozZF9Tdml3VmRmd2xuUF9HeUhMTmJVODZodDd0dTNyTC1nOUR5VVJzeHhBZWRNRnhiMmwzMWI?oc=5,1776150000,Trend Expert at Von Maur chats about current spring fashion trends - KWCH,Trend Expert at Von Maur chats about current spring fashion trends - KWCH
gnews,fashion trend,news.google.com,https://news.google.com/rss/articles/CBMiekFVX3lxTE5zdUxTWURrUkstZDRZc0xWWlhKMTRzX1p0eHB6TEMzbUk3WkM4UGxJdGUtbVN6STJObmZpNTFoZ3g2aEVsT0xtOUhSQlN5dUVRZlN3SVdfMHIxakMzV2F5X3Y1N2Q1YWlXSTJFenJpWWVsVUFIM2hXODlB?oc=5,1776409200,‘Printmaxxing’ is the new fashion trend replacing quiet luxury: 9 ways to make it work for you - Harper's BAZAAR,‘Printmaxxing’ is the new fashion trend replacing quiet luxury: 9 ways to make it work for you - Harper's BAZAAR
gnews,fashion trend,news.google.com,https://news.google.com/rss/articles/CBMiV0FVX3lxTE5taHhfRThfOWx2aDdIRTdjQkJVU2tHWV9NWlExbThGQ0trSVdtclhMcWY4MTN5dmpORFgtaThWT0VDNWN3TERHLWxTNm9pclBYUXlxOF8yOA?oc=5,1777763364,"Sorry, but we need to have a serious discussion about fashion's next 'it' shoe. - Mamamia","Sorry, but we need to have a serious discussion about fashion's next 'it' shoe. - Mamamia"
gnews,fashion trend,news.google.com,https://news.google.com/rss/articles/CBMigAFBVV95cUxOTTlsNTJ4Z05FZnhFSXRIcnRpUzJaNFc0bkx2cGZUZDNBaXhiVDNIVE15Z1hvLTRZdFdLQVhaRTdZd29sWVZHaWRGT1hQcURJYVMzVE1aM1BFajVtY1NzN3M0UjJxaFU0enJrUWtzc21OYlB2VjVGTkN0OE1fWGY3WQ?oc=5,1776495600,Fashion's Best Dressed are Already Wearing These 7 Summer Trends Now - Who What Wear,Fashion's Best Dressed are Already Wearing These 7 Summer Trends Now - Who What Wear
gnews,fashion trend,news.google.com,https://news.google.com/rss/articles/CBMitAFBVV95cUxNNElLZjJVbnpIX3NwY1NHWnlXVHhRZ3ZCTXVCYzVTdDdPWTE4Ujh1VkFXTS14b1B5VVZLdGE2ZzVkanJHSjMyOE0zbXRYb01wUFJDakhLc3NPNF9Wa180dHZXdjJHU0FHOFNvTjRNZlpMQkFXZmwwWXhfTnlKUkxsZWhFcjZPZDEwRmdwNi1KZV9LNWFYN0hRbE1hcTUxa0w2VTZjcXpXZkFuVnltSC04MXJfRkY?oc=5,1777005420,Vintage fashion trend offers sustainable alternative to fast fashion in Las Vegas - WAFF,Vintage fashion trend offers sustainable alternative to fast fashion in Las Vegas - WAFF
gnews,fashion trend,news.google.com,https://news.google.com/rss/articles/CBMifEFVX3lxTE04OWhwVUhhQWhKZHBLVExjVGFhTWc5TUQ3Y0RZenZwVnZ4T1ZsMTc1SVMtVG04NURacEljVkJDQXpGdHNJLVRTWkdoOGYtdmUzQzBBOVRnR1RGTVYtemVKRmpvaGp5VGZ6bUNTT3hEVGM4QlFuWF96LXpadVI?oc=5,1776322800,Ponchos! Skullcaps! Fringe Boots! Here Are the Biggest Trends I Spotted at Coachella 2026 - Who What Wear,Ponchos! Skullcaps! Fringe Boots! Here Are the Biggest Trends I Spotted at Coachella 2026 - Who What Wear
gnews,fashion trend,news.google.com,https://news.google.com/rss/articles/CBMiggFBVV95cUxQZENNSEkyMGVCVk1LNklReF8wUHJrclBlMlBFVHdZZDhEQkVtc2pMRDNZTXVCWS1BQ0VrTUJibWdzSXVkNFd6S1l6WjVvbm9Ga2txa2ZRWGNZdXVDUHRHQ1ZMZExYUlhfb01QX1lNX2JjZnNhX053N253OHJ4dnlLcXpB?oc=5,1777795460,The pretty top trend fashion editors are swapping summer blouses for – shop from £20 at Zara - Red magazine,The pretty top trend fashion editors are swapping summer blouses for – shop from £20 at Zara - Red magazine
gnews,fashion trend,news.google.com,https://news.google.com/rss/articles/CBMitgFBVV95cUxNX3cybk10NTI1MDZzR1BMY0xjQWFVUUVMcXhVcUF1cWdHLTRXelpwMjV3YTVxQVBIdzF2UDNiSWJaR04zV1JmbEVhV2ZsRTBOa1gtUm5LdkZ4bDRYYmUzSUdvZXU1WnpaRjFDSnVDVS0zNkFRVmx0aWNCU3VxQnlNcWFIX0RGbUJUZERpR1JhMXdXUzdCV01HRDVDb0Q4N1ExOTduYW16UlhjTmJfNXg2T1dtVDRFZw?oc=5,1775977200,"Coachella 2026 Fashion Is All About Miniskirts, Micro Shorts, Sheer Layers and Desert Boho Energy - WWD","Coachella 2026 Fashion Is All About Miniskirts, Micro Shorts, Sheer Layers and Desert Boho Energy - WWD"
gnews,fashion trend,news.google.com,https://news.google.com/rss/articles/CBMia0FVX3lxTFBxdGR4SHN5aGEtczhhdWlYdjR6MlJZeFpkTmV4TThHbHE0MGVMVFVLNU4zMDVWNkJROGxFR2JncklXT3lfMktjSnNNa0tQM2NjU0xlLURFM3NGQkVHczZnUUtrcHI5aW9MbnVJ?oc=5,1775631600,I’m Convinced These Spring 2026 Trends Will Be Everywhere - Refinery29,I’m Convinced These Spring 2026 Trends Will Be Everywhere - Refinery29
gnews,fashion trend,news.google.com,https://news.google.com/rss/articles/CBMickFVX3lxTFBTQlpEVGdibXR6Zk5na1R3RDd0ZFFremZoa192TjljRGgxLVpyd2JYRTVZTVpvdlF1cWowVzJzZ2U3dTBpcGNPM2tONWg4OF9TSks0a0FaWjIzb2RGeU5ILTR5UHBHQW12MXp6aUZIeHNNdw?oc=5,1777701600,Sandal Season Has Arrived—Here's Exactly How to Wear Your Pedicure This Spring - Marie Claire UK,Sandal Season Has Arrived—Here's Exactly How to Wear Your Pedicure This Spring - Marie Claire UK
gnews,fashion trend,news.google.com,https://news.google.com/rss/articles/CBMiWkFVX3lxTFAxT1lBOTlXQVNNZ2VhU3NHdFdLbFN1QnNCaUVQdk1KMmgwYjZ2WjM1ZW9VdzJFTHBMYWpQVXZSTzBxZEd2dW0yM1Q1NUdsbzgweGltdDEybElodw?oc=5,1774681200,"Goodbye Ballet Flats, Hello Derby Shoes: The French Style To Step Into This Spring - Vogue","Goodbye Ballet Flats, Hello Derby Shoes: The French Style To Step Into This Spring - Vogue"
gnews,fashion trend,news.google.com,https://news.google.com/rss/articles/CBMic0FVX3lxTE1DS3JyTktQOE43XzgzZmdKcHBhQ3VWZWs3bi1yMFZINURsVlREVVVOdDNYTUhaVjYzcjdXcmg5MHNUSTZvMW1NS3NpdFN0VTYweEhwQ0c0Rzc1bERzcXNIMi00RnJqQjFwX2IxVF9rRlFGYXM?oc=5,1777100400,The Key Spring/Summer 2026 Trends To Know (And Shop) Now - British Vogue,The Key Spring/Summer 2026 Trends To Know (And Shop) Now - British Vogue
gnews,fashion trend,news.google.com,https://news.google.com/rss/articles/CBMi3gFBVV95cUxPNktZQ0R4ZVp1OGZGTnJJUmtwWjRYZWVYaXQ2eG5iNl9KckxZWVh2ZjZjNVpZQTNkRkc2b0lkekVZRkpULU1lSFlZSFR2RlNMcWstTTNlUk9mX2dTMGhOaEVab1R4WVdkSXQ0aUVVNThGcy1vSnk3V19SM19ZaHY1VGFDS0pMaWpubHVRZUNFNTFPa21DY0txb3hYVE5LOFA3QkRUSEYzeXRVbS12cE9WMzJHc1hBNFVrcm9Tc0xqY3hxVHZSWmd0bXhHMENTQUk2d3VfNTlkZUhLdTZEZWc?oc=5,1774767600,‘Leverage the local’: The fashion trend that explains why everyone around you is channeling their inner tourist - Fast Company,‘Leverage the local’: The fashion trend that explains why everyone around you is channeling their inner tourist - Fast Company
gnews,fashion trend,news.google.com,https://news.google.com/rss/articles/CBMivwFBVV95cUxNZlNLd1dTUnNhUjMzMDJjWTZYMTdSUDRWQzZNOTdZZkNxWFlra1UwaGN0ZlhEa3NVV21qRGZFVm9aNDZjazdaTTM4YlRvbmRLNXV5VmZjUTd1NnBXSG1EYkR4S3F6Y0lvakpJQlBsVDJxRVpQVVFFNERhamRzU08tOWplcVdhR01yMFBzTlZoNkdpbTJfQkFEN2x2eXhKVVBqYzFDUzhHcTl5bUstMVJLWGRmSDVHVUdTU3M2dzlFYw?oc=5,1774681200,When the gloves come off: spring 2026 fashion trends - The State News,When the gloves come off: spring 2026 fashion trends - The State News
gnews,streetwear trend,news.google.com,https://news.google.com/rss/articles/CBMioAFBVV95cUxQVG1WakxaazlfeHVaOUtiY1NaUmpDTjVtbzRLWDVOY2thWThHMmhWTENvV1BwcmdzLWZLSkZrcVpDZHZ5YXBJbEk1NmtCS19LeGJYMV9vczJTWXNHVWZnRXpvMEhqZUtJcXZMOG40ZmppT0NpMXZFblNuWk5RVWJERWVTU05VdjBJcFBhZjh0RUR1WWFRWl9oU3NLMEFteXZ0?oc=5,1777874231,Top Summer Spring 2026 Trends: From Runway to Streetwear - Social Life Magazine,Top Summer Spring 2026 Trends: From Runway to Streetwear - Social Life Magazine
gnews,streetwear trend,news.google.com,https://news.google.com/rss/articles/CBMihgFBVV95cUxQTENfazlhbmpaaEppT1h3QXlfVERROGpPaGNMN0VkR0ZvdUJpOENHVFN6dDY3U1doS290MGNEdG4xcmpGM0hwV21VUE00YVMtWGgzUER1UFNrbmQzT1dUTk9UN1VoUDdMMlRiQ1IydE83XzduaVVabXFGQnVwQVl4LXFVVlAzdw?oc=5,1777781598,The Intersection of High Fashion & Streetwear: 2026 Trends & Future - Ballerstatus,The Intersection of High Fashion & Streetwear: 2026 Trends & Future - Ballerstatus
gnews,streetwear trend,news.google.com,https://news.google.com/rss/articles/CBMiqwFBVV95cUxPYkExWUNfMTlZRUFISUdkb3NiOWtzcHItbDN0eEMzdE1EOUFoblBTTnNqSGFkSU05VUhZcmRHd250VG1LMVNMeVZxeXlKWGZrYm9hSUZFemNHMTlNSWhrM1NOb0Vsb0lxSzhjeFBkZnFJMnpKaHFaMzFoV2R0US00SUJKUXpnREM2bmJUanBDcmNPYXpxWnY2TTdoUlhleElvSnIxU2hrV1NNVlU?oc=5,1776668400,Denim Without Borders: 4 Denim Trends Breaking Fashion Tiers from Luxury to Streetwear - WWD,Denim Without Borders: 4 Denim Trends Breaking Fashion Tiers from Luxury to Streetwear - WWD
gnews,streetwear trend,news.google.com,https://news.google.com/rss/articles/CBMibkFVX3lxTE1DUkpzMnNJVmtCbU1sY1pubFBPeEtFZXJJd1I3S0Y3cUpzWTFSX29GSFZPRUdzSVFKWUVPcUVBRFI3WHQ0NzFEa0s2bWhVTVlJOHpVUzZiWVdVR0wwLWxPeTBiUG1VdnFQbGgwcVZn?oc=5,1775458800,9 Spring Trends GQ Staffers Are Shopping Right Now - GQ,9 Spring Trends GQ Staffers Are Shopping Right Now - GQ
gnews,runway trend,news.google.com,https://news.google.com/rss/articles/CBMioAFBVV95cUxQVG1WakxaazlfeHVaOUtiY1NaUmpDTjVtbzRLWDVOY2thWThHMmhWTENvV1BwcmdzLWZLSkZrcVpDZHZ5YXBJbEk1NmtCS19LeGJYMV9vczJTWXNHVWZnRXpvMEhqZUtJcXZMOG40ZmppT0NpMXZFblNuWk5RVWJERWVTU05VdjBJcFBhZjh0RUR1WWFRWl9oU3NLMEFteXZ0?oc=5,1777874231,Top Summer Spring 2026 Trends: From Runway to Streetwear - Social Life Magazine,Top Summer Spring 2026 Trends: From Runway to Streetwear - Social Life Magazine
gnews,runway trend,news.google.com,https://news.google.com/rss/articles/CBMiYEFVX3lxTE5UQVg5bmNOM2Z4VThRRjJwZzNTU3BmdDBYVURiUlZwdWVZV0FxdFQwQXN2cGpvb3JpME0teV9NWWltWF8wZW9lNnB4Zm9vb0FPSG16YU4yRlNzNWE1eXFoTQ?oc=5,1777771412,10 Statement Trends to Try This Spring - Vogue,10 Statement Trends to Try This Spring - Vogue
gnews,runway trend,news.google.com,https://news.google.com/rss/articles/CBMiekFVX3lxTE5CZGFRWFdPUmRDZk9PUl85Y3dBQno5VVpzTE5MWXh5bEtRaVBPdTZsRUVtb254YWtlcjNoQVMzMllOclNOcXJ6NDgwVURMTjREVTA0QVk5emZrY05rZmFscEVib0tNLW9sOXdVSXdzMVlSVXoxVkhfcnJ3?oc=5,1777791600,"According to the Runways, This Is *the* Color Combo of 2026 - Who What Wear","According to the Runways, This Is *the* Color Combo of 2026 - Who What Wear"
gnews,runway trend,news.google.com,https://news.google.com/rss/articles/CBMipgFBVV95cUxQeHkxQ1pjd0dPLXgyWkpvbzFmeC05WDhRMl8wOE5rUDhfYjBadTU4b05lRFV4T3AxY1FfbmhUOHpyelFVUzg2cHlFX0pvOFJEOFNGcnU3dTFmeDQ0YnBDV3lXT1FUcFpVVlh1OTI3bk9jdktaTUstWlhVMVVtbnhBVGhQQWVWMmdReElXaUZPZzlrMXZUTTN5bC1ORTZsSVJHWnJhQ2pB?oc=5,1777478413,"In “The Devil Wears Prada 2”, fashion magazines are off-trend - The Economist","In “The Devil Wears Prada 2”, fashion magazines are off-trend - The Economist"
gnews,runway trend,news.google.com,https://news.google.com/rss/articles/CBMilAFBVV95cUxOZFhJYjM4TkZwaExSWm4yd0hQdDd4aWF4aXFleEpuUHV0TDFjU0ZXSS1fQ2JkWS1xX3BRNkNCQ1p1NlhnX184NEhCVW8yQWRXQlpsTGFUN2luNE1vamtFM0l5eDZGVlNpRXlXMlBaZmJvWmtfay0xYlJBcWJEMk1xMHJPM1otSkRaOE5yTl9pWnJkWjJH?oc=5,1777571620,How Big Is Too Big When It Comes to Sunglasses? - WWD,How Big Is Too Big When It Comes to Sunglasses? - WWD
gnews,runway trend,news.google.com,https://news.google.com/rss/articles/CBMitwFBVV95cUxPVUxVWE9MUEt1SXlqYXBEREx5SVRuOHh5Mk44d2FDM2hoOGd4VVBPSzVNUHRjWWVUdUd1OW5HTnhlcjVVUWZxWEpaZ25KdmhwZkZjVlN6WFdqOWdRY1Nwd3lqY2hndHBCNXRUZW9wYlN2MWdEdnkwd09wZmM4Zm1GRkZHalhTc0k4V2toRlQtdTdKM3lvaThJZng0ZC1Na0RCYVBPZnc2WUlvVlp0emRJdlBSalVPdGM?oc=5,1777460820,Which Derby fashion trend needs to get the boot? - WDRB,Which Derby fashion trend needs to get the boot? - WDRB
gnews,runway trend,news.google.com,https://news.google.com/rss/articles/CBMimgFBVV95cUxPaXA0akNVUm1yaXVEaFkta29KeS1MWnRBa001b2xJak9QZUdzdkxrb29SZUtveFpVemh1R3pZbTQzYkdSNERHdnNuR2JlUTlackVKTWppWnVHOHdITDR3UGJUS0I4RUFjQlFBb2Z5TW1Ja3BZR2NPQm1WRklGUXBMd0lKc19Nei1yZ29XLVBEaDg1Rm9NVmVmMWJ3?oc=5,1777412993,National fashion-trend store opens new location in State College - WJAC,National fashion-trend store opens new location in State College - WJAC
gnews,runway trend,news.google.com,https://news.google.com/rss/articles/CBMi1wFBVV95cUxOSEIxV3hwaHpLa25uc0hfMFRISHk3WktLSWFPNlkwTkRhMENmYW9VMDBwY3hSZC04cFFiSmdlZk9peWdTR21TOGt2cmNVSVg0a3c3R1hDdko5ZEZmb185bjVzNXVPbkdQVXliektpUTd4dzdjckppUGxOXzJMZTlxQ29CSk5RdzEwVlI4N25HTnhVc1lHMUFCUnp1M3k1b0VsX2ZWZkVzWlF5ZXZsRWV5V25GQ2s1UTlSWWs5OVItMk8xbXVyVG80UTJuVUVjZ2xsMERRSm1vQdIB3AFBVV95cUxPeUdUcGZHU0FRNFpBak5SUWZ5VzZZbi0wRXRqMHZrWmJWbFE3aFVrYzFzbWNMZG96ZURxT3FCS1EwYWlRWkd3UXhtN21iN09oRjVEOFRqLTBkUEFDYzY3NF84VUR5TER6R1NsZXQ1UFJIS08zTTNDX1pKZnJjdGxVWHJPQlpiSVZodDZUOTRObERVc1lYYU5yUnVxSGMtVmJJRUwzOV9DeEstWWJXTXI0RmRSdFl4RTJ1aC1kWVZ5OWs0dTlJbkp0V2E0WERtLUpRazJwME5SR0piWkRN?oc=5,1777391520,Celebs From Travis Scott to Rihanna Are Fueling This Luxury Fashion Trend - Mansion Global,Celebs From Travis Scott to Rihanna Are Fueling This Luxury Fashion Trend - Mansion Global
gnews,runway trend,news.google.com,https://news.google.com/rss/articles/CBMigAFBVV95cUxNNXFHV3dhT0xfNzJCQzEyWHdBVTFxZUtUTENOcjRpQlB5NmpvYzhXTFdQZklxWUtaNGQ5d3JZcDE3QlYtdU5hTVJleGM5MTBRa0VDTjhKY2lpSE5nQnZKYlVadktLSnZMdzlPQWVMdmZEMVhJa1NJLTBLejZxUFJUQg?oc=5,1777661488,"This Summer’s Shoe Trends Have Something for Everyone, From CBK Stans to Maximalists - Marie Claire","This Summer’s Shoe Trends Have Something for Everyone, From CBK Stans to Maximalists - Marie Claire"
gnews,runway trend,news.google.com,https://news.google.com/rss/articles/CBMifEFVX3lxTE10NHJUbUtvNVkxYmVLN3lVb0pMYXktRVNva0ZMendleml5ZG1iNkEwUmJGNEZlTjh1c19Rcmd0bEtQUnlORHAxWU9YRmdRLVktWlAxd3NXY0Y5dWI1RzR1Wk1hTmxnU0oxVHBDajJmelRwTndoSnYyTXIxM1M?oc=5,1777562014,"I'm No Psychic, But I *Know* These 7 Dress Trends Will Dominate in 6 Months - Who What Wear","I'm No Psychic, But I *Know* These 7 Dress Trends Will Dominate in 6 Months - Who What Wear"
gnews,runway trend,news.google.com,https://news.google.com/rss/articles/CBMieEFVX3lxTE9nc2ktNnQxVzlMTjl1MjR5MFYwSkMtVjI1Z0VhZlBLU0JqVlBjdHUyejJCVDV3OE9xYmF3ckhxR2VXLTk1Y3ZScXZfN0VPSU1ManFXYmFUWWxKTDN6cjFXTzk2OGxSVWxDOHIyeXZmRG9jUktfd2FIMg?oc=5,1777634402,The Vogue Business TikTok Trend Tracker - Vogue,The Vogue Business TikTok Trend Tracker - Vogue
gnews,runway trend,news.google.com,https://news.google.com/rss/articles/CBMipgFBVV95cUxQYXl2cUdIUGdVcnZ3TXN5Q05uYUhYSlQ2YWhWZzRwczh1Rk8xRXlKWFVKOWJuNkJJd2tybDBTMnpJQ0hfVUNScGtnUDMxUTRpdGVoSlVBS2l1YnZycm5DZmkwQlZVRUFDZW45NWVlMzJtWC03SGNyRmUtSUJLcEN1S19KOTRwelJYTVRvbnZhZTFGeXh0Ny12UUxiMUFkTzZzQWktOFVB?oc=5,1777708800,Not Ballet Flats—Jennifer Lawrence Just Styled Her LBD With an Even More Elegant Shoe - Who What Wear,Not Ballet Flats—Jennifer Lawrence Just Styled Her LBD With an Even More Elegant Shoe - Who What Wear
gnews,runway trend,news.google.com,https://news.google.com/rss/articles/CBMinwFBVV95cUxQT3ZaQ0xDUmNjRnlIRVZmblIxd1VnaVZ1ZUxscVZKWXVid3hPV0lnUkFSRmJhbllMT1hxSXlteTQxMDEtN2xENjNoczFPRTdTc0RRUlNKYUk0Qlg1aVI3cERUX09EeDB0TGJQNE91dDZBTkVoXzc0WHEtU21sLTJDTF9hRkxhNXFjdXotZXhhZ1IwcEpfMXhyZHVlZndaZzQ?oc=5,1777489600,"Harry Styles, Jennifer Lawrence, and Sarah Pidgeon—Suddenly Everyone Has a Leopard-Print Bag - Vogue","Harry Styles, Jennifer Lawrence, and Sarah Pidgeon—Suddenly Everyone Has a Leopard-Print Bag - Vogue"
gnews,runway trend,news.google.com,https://news.google.com/rss/articles/CBMiZEFVX3lxTE41T1QydDhpSjZ6RXpDaHdmVV9hS2l2TUF4NkdCY3VUNHhxalpER1ZTbWdXMlNIX056cmNrNmxvcGZTWUtnZnVqbU9XY0haTTNNNncxZ3NPWlpsVGY1YWJNR1VIdnM?oc=5,1777604400,This Cool Girl Trend Will Set Fashion People Apart From Everyone Else In 2026 - Who What Wear,This Cool Girl Trend Will Set Fashion People Apart From Everyone Else In 2026 - Who What Wear
gnews,runway trend,news.google.com,https://news.google.com/rss/articles/CBMikAFBVV95cUxQT0ItZFprX21GaUhPU3BSU3h2Q2hfSG9BRFI0OTJRUFlRSmxUM1VhWTR6LTl1OXU2ODBWYlYzb2h2ZGZ0Y3NkVzlLaW8xR3N4cFRVa2tESXBfS0ZBSmZGZ2FRd05vU1FhWlQ4VkMwQVF3czFiSGstS1JubkVaMXBTc1QyQmtCUVROYnpDTkpsOFY?oc=5,1775458800,Jennifer Lawrence Incorporates a Major 2026 Runway Trend Into Her Spring Style - Vogue,Jennifer Lawrence Incorporates a Major 2026 Runway Trend Into Her Spring Style - Vogue
gnews,runway trend,news.google.com,https://news.google.com/rss/articles/CBMifkFVX3lxTE9XSk83ZWhEUFR3cFdpSk1Mc0N4MHpiVUE5UUtvSEVDR3lfUUcxWE5XbnJoVkp4dDZqaERoWG1NN3VJQ0d0cWtyVlRlU1dybm16d2hLUTdFY0VpcTk2NERTV0tmb2UzWUw5VjRlb1hvelRoV29ZbXFPQjFtZEdudw?oc=5,1777604400,6 Spring 2026 Outfit Trends That Are Already Huge In Paris - Who What Wear,6 Spring 2026 Outfit Trends That Are Already Huge In Paris - Who What Wear
