source,query,domain,url,created_utc,title,text
gnews,fashion trend,news.google.com,https://news.google.com/rss/articles/CBMia0FVX3lxTFBNQVV3OGlkVHRoLTVSaG9nNmpWMVQ2X2tFNl9aaGpYRkFXclZCd3M3cWtyMTl4RTJVTGh0WDlaT3Q0cnptNmVuZklSOFo4OFFYdDRfOENsNXR2LU81SmY2bmcxTjBzRWpzbGhn?oc=5,1762156800,10 Challenges The Fashion Industry Will Face in 2026 - Heuritech,10 Challenges The Fashion Industry Will Face in 2026 - Heuritech
gnews,fashion trend,news.google.com,https://news.google.com/rss/articles/CBMigAFBVV95cUxOcThXX2FoMGh2cTVFWmRyWU5hekhCMlB3bEwzMjFIM2xXeU9GVU12NzM3X2o2VlR0WEtqUnRKRUpZUkFXSE9McWhYeXJrZV9tQnJrUkVabEFoOTdLSVkybGwzUUt5VHVsQkk5Y1RYYzQ1RWNVdG9Yc3BvMHlIV0xuZw?oc=5,1759906800,Spring 2026 Fashion Is Running It Back to the '80s - Marie Claire,Spring 2026 Fashion Is Running It Back to the '80s - Marie Claire
gnews,fashion trend,news.google.com,https://news.google.com/rss/articles/CBMieEFVX3lxTE9nc2ktNnQxVzlMTjl1MjR5MFYwSkMtVjI1Z0VhZlBLU0JqVlBjdHUyejJCVDV3OE9xYmF3ckhxR2VXLTk1Y3ZScXZfN0VPSU1ManFXYmFUWWxKTDN6cjFXTzk2OGxSVWxDOHIyeXZmRG9jUktfd2FIMg?oc=5,1761202800,The Vogue Business TikTok Trend Tracker - Vogue,The Vogue Business TikTok Trend Tracker - Vogue
gnews,fashion trend,news.google.com,https://news.google.com/rss/articles/CBMilwFBVV95cUxPQVpUS2M4Z3hOcGZFMkxaU2w5eFRvSzV0dnFGbmxzZ0Q1TlFoVWxlMmhWUVBfeDR5ZUJmUEI3dVBZVlEtek5FUncxakV3cEVVc3hzQmx1VkFtanRMR0c1X205b2ZRVHFZMzVLOE9Ra1QzbzJNc2pTVUpwNFVGOFVXZzhzbkRCRVpNbEpIQkIxVEVkNHBFbTdR?oc=5,1760684400,"I'm a Fashion Writer in NYC, and Here Are 10 Fall Trends I’m Seeing on Every Block—From $22 at Amazon - Travel + Leisure","I'm a Fashion Writer in NYC, and Here Are 10 Fall Trends I’m Seeing on Every Block—From $22 at Amazon - Travel + Leisure"
gnews,fashion trend,news.google.com,https://news.google.com/rss/articles/CBMilAFBVV95cUxOZGZUdGhfdUs2YUpOVUVuRDVwV3BiZU9XZ3VHMHNRc0NjWVFaallhV29UMHc2Sm9ibkxmWlh3SUFiUW5nZ3FlOEp6V3pKM2h5MXlEdFVxNlU4RFplMXdIdFlaYjFjUVVyamF3LXBqMXBGRHJfUzRZcDVqczJwZHVvVW5UT2VZQjJJamxfZGtrd0VxcFUy?oc=5,1762954204,Designer Andre Tan reveals which shoes are out of style this fall - RBC-Ukraine,Designer Andre Tan reveals which shoes are out of style this fall - RBC-Ukraine
gnews,fashion trend,news.google.com,https://news.google.com/rss/articles/CBMiYEFVX3lxTE9IeXVaWGVDWTdZbkYtOFgtMlNFbTh3bWFsS1VxRTBGcURQWnhENDBEOXZSbW00YXhMSUE5RV9LVVdBci1IcHpIMXpPZHRyNzk4Y0RnRUp3N21TbzRxMUNVaw?oc=5,1761807600,The Top Fall Shoe Trends to Know - Vogue,The Top Fall Shoe Trends to Know - Vogue
gnews,fashion trend,news.google.com,https://news.google.com/rss/articles/CBMibkFVX3lxTFByR2cxRHZOVHNNcFZBcXVhRlNZV0loRzJXdklLRElqNXF0WFlvYTRpR0RrUHkxVjBFRnNscUx2ZnA1X1hEYTVBc1dIZ2RuSDJ6V0o2cjlIb1lHVkJXQjJnNW4tTlpWVUJoa1pJUE9R?oc=5,1759906800,The 11 Key Fall/Winter 2025 Fashion Trends You Can Start Wearing Now - Vogue,The 11 Key Fall/Winter 2025 Fashion Trends You Can Start Wearing Now - Vogue
gnews,fashion trend,news.google.com,https://news.google.com/rss/articles/CBMimwFBVV95cUxObzA3T1laRTZqSTZmZnFuY3hXQjg3dWtkeUJVb1hPTFE4WEpnMjRDSTJKM0gwbkJROEJpamJhS2pHemkxSnpwN0ZJWjZmT1RXNnZCdFNndFBlVjhZdjItVDdjUHNjSDZIUk9JZGs2REhCWmRSMGJ3YTA0alRUSnZneWFadEhlZzQ2ekFxUDJVMlBiYmJ2RV9XTFlMRQ?oc=5,1760450784,Layers with texture are this fall’s fashion trend - Golf Digest,Layers with texture are this fall’s fashion trend - Golf Digest
gnews,fashion trend,news.google.com,https://news.google.com/rss/articles/CBMifkFVX3lxTE52dTVmdHJ6Nzc4QXpnY2RDUUVWQ2Z2ZGtYYm9sVmV3ZktCOVFUbFphZWZNc2phNC1CeEtDcDd2Qi1XZjU2a0ZxQ0JVNFNjMWJEcWEzMzdZeXVuTDhhNGxKb0dPZEw2ZkNkNE1VUXZpVG03a24tZklxcjM3bE03UQ?oc=5,1759820400,The Best Fall Fashion Trends to Shop Right Now - Harper's BAZAAR,The Best Fall Fashion Trends to Shop Right Now - Harper's BAZAAR
gnews,fashion trend,news.google.com,https://news.google.com/rss/articles/CBMi2wFBVV95cUxPajFQZmRTQmVLVHItRFNBYzdZekxWSWRJcDlHNnNIRlc0cTdoZGM3a0ZtdDFrb0hNbXJCVEdkajYzWVN6UmxiZlZ4WFYwUW5LZk01eVo4amsyTzNYaW9ic2l2R1RScWdPd1NJTUFOMDZuWTlPMU15WFV6aWZTY3ozZWNmTWw2THRrWHhULVc1SThBRng4RDRZQ1U1X05wR0dkTldWVnBMNDU2cnFyZzNaU1pEaWFkeU9hYkp0R0laR0JMYldDQWttNVdyTHp3TmFsR3ZUTkhGRXRSVjTSAeoBQVVfeXFMTTRDSkZDeTdPR1YyV0xVcE1DQm5JVlBMU3RBOGhHUVZJNThNbzZWc1hWeUtpOEFzdmVqaE0tRXR4SnFrTzk1bGJQQ3RPYnVmbUJISDJmM0hVZHgtMEswdERTZmkxM0QyRTE2N1J6cVVMNjBpWENjQ0xFTEZWLXBnY093QzQyaDhUTTBHWU1Nam5TWFlpY2UzWjVPLVZGYTQ4VzdwdG5JZkplYVUtVDdCRHZocVo4WEFkVUdPWlkwdVZvN1l4bUIxS2REN3c4QUg4QXpmOUtHUHZuZlNQY01wdHZWcURfYVhlUVpB?oc=5,1762814253,Taylor Momsen goes full rock and roll with 'naked dress' trend in entirely sheer black lace gown - HELLO! Magazine,Taylor Momsen goes full rock and roll with 'naked dress' trend in entirely sheer black lace gown - HELLO! Magazine
gnews,fashion trend,news.google.com,https://news.google.com/rss/articles/CBMigAFBVV95cUxQdzJCa2dWME5mZVhvRmN5RW1LMVZmWU8wVmNSOHM3ajBEUE5qYXYtM1YyTEk0aXVCLU1DM08xb3Z2US1wTkdOazZOVm1COXBwNVNWS0xZVlVKZDEwdWRxbUJZb183VVFLdFVKYWhBZE1DMk9SdHhDV1NFcS1PbjF4ag?oc=5,1760857200,5 Expensive-Looking Trends I'm Shopping at M&S For Autumn - Who What Wear,5 Expensive-Looking Trends I'm Shopping at M&S For Autumn - Who What Wear
gnews,fashion trend,news.google.com,https://news.google.com/rss/articles/CBMifkFVX3lxTE9VRXA0Y0l3VkRhM0c2T1lEWEVlN0xLUXhMZ25STjUtT0tYdVZYM29IN3JzZ3B6WDNWcW9UQXYxejRzeWpQN29MM0JrcFVwV2tvX3JfSXMtMzZxX1NlWFpkYjJtTGVIWnFCcVhyNGItbUx6VXlQYTVSM3E4RGMzZw?oc=5,1762394400,"I Live in NYC, and Every It Girl Is Wearing These 7 Fall Trends: Trench Coats, Barn Jackets, and More From $24 - instyle.com","I Live in NYC, and Every It Girl Is Wearing These 7 Fall Trends: Trench Coats, Barn Jackets, and More From $24 - instyle.com"
gnews,fashion trend,news.google.com,https://news.google.com/rss/articles/CBMiZEFVX3lxTE9KZjRhRnlHZVJ6REd3MjkxSXQxRnMtRXRHd1dFWUxwdWlJZWdfQUh3LVhIZXRpMjFnQ2NhVFlfSDQtMkJyaTFWQ3QxQmxqd2g0LXE2OHVSV2lWa1dKUFNDdGlHNzU?oc=5,1759820400,15 Fashion Trends To Try Out in 2025 - Teen Vogue,15 Fashion Trends To Try Out in 2025 - Teen Vogue
gnews,fashion trend,news.google.com,https://news.google.com/rss/articles/CBMijwFBVV95cUxQRW9YU2ZKRGFyVlBHdzI4OXVOLTlxSUp2b1dmZFBxZlVSUDlCUnRfN295eGJOTjRHODdjNEpKcmJqeFJvdllUY1dfbXdIZnRhaDRmZFFPNkVua0VOTEF5d29GVVo5Zm5tRk1ueG9JQWpOUW5QTUx6RmozOHoyT3YwdVc0VmtfRnQyM05FY1gzWQ?oc=5,1759215600,Horse Girl Fashion Is Back in the Saddle! How To Wear It for Fall 2025 - The Pioneer Woman,Horse Girl Fashion Is Back in the Saddle! How To Wear It for Fall 2025 - The Pioneer Woman
gnews,fashion trend,news.google.com,https://news.google.com/rss/articles/CBMiggFBVV95cUxPVlB3TTlGZDBOV0hydi1PRTZzc2JMem15eU1hZ1hTeHItZ25meGJ4eXFRU1pqdzI0NHdKUkxZTG5FOUJZbWhUZ0JTR1Y0NTRWTmlNSjI0V3JJUHgwUkkxYWJIUDRDSzB0Zm9yWU93NFJ5VGhWblFweHNWbE9kSzI1Q0x3?oc=5,1761116400,News Just In: These Are the Winter 2025 Fashion Trends I've Already Spotted French Women Wearing - Who What Wear,News Just In: These Are the Winter 2025 Fashion Trends I've Already Spotted French Women Wearing - Who What Wear
gnews,fashion trend,news.google.com,https://news.google.com/rss/articles/CBMidEFVX3lxTE8tWEluYkhtRVM2WkNNSUlLSElfeTRXWkwwc3FSeTB6N1h0VUI2NVNTMVhoZHJOVTVYc2ZIXzFWUWlDNUR4RFFGOGJWbnJVZE4xSVNRc2RxYzVFT18tMkoxWGM1OWFackt2cE9TczYxSS1ZaEhB0gF6QVVfeXFMTUU2cEpuWDJuUDVINkRTNHBBOTZPc20zYlhpVGhoanlMa0xMQl9fbDdnMWVJVDc2VXI2SnRFQ1c4RkU3bTN4WkY2N1J1V05MRWNoSWp4YkJUUURkc1FIY1kyRjduU1ZsRHZIVl95V1pDYVh0Qm05NzVJMGc?oc=5,1759129200,"How to wear the perfect-for-fall burgundy trend, according to stylists - CNN","How to wear the perfect-for-fall burgundy trend, according to stylists - CNN"
gnews,fashion trend,news.google.com,https://news.google.com/rss/articles/CBMiogFBVV95cUxNSUZMTVBIY0JxMjVEMVFQajhxREhtOGRYb0l2S0kwenpYV2Vfb1paZmJZTGQ0RkluQUt3Y0J3TWt2OFNoR3JRNl82Zm0zdWhOMXlsNEdpZlhVMmNYdXkwVGYzTnk5bEFFd0Q0TWo3ZlFneS1lSllBUEluakp6WUEwOEdseWRxV0daaWNmcjlValQxWFlsSjJmdVp3Tzd5LWVpbkE?oc=5,1760079600,A New Fall Color Has Entered the Chat: Burgundy—Here’s How To Style the Wine Red Trend - E! News,A New Fall Color Has Entered the Chat: Burgundy—Here’s How To Style the Wine Red Trend - E! News
gnews,fashion trend,news.google.com,https://news.google.com/rss/articles/CBMirwFBVV95cUxPTlRKMjlqQ3BsaTRYX19rWUg0U2t0SWJwWXE2VG1PTlJuOWJLeDVOd2lOcVB0WmV1OUV4b1g1SWxIMlVxMC1wQ3F0N09HWFVTbXhWc0VLWUs0RTVObXhMaW9DZ3VpOXhYSEdrZU5hTm9IQ3FjUUxBMEQzSHNmNm80cGo3RWtwRUJXdTZKY0hNbUkwZWhnMzFjM1hmWGhobVBRRzlqQ1NBRTlpbVJtNnBj?oc=5,1759474800,What the Cowboy Boot Boom Says About America - Bloomberg.com,What the Cowboy Boot Boom Says About America - Bloomberg.com
gnews,fashion trend,news.google.com,https://news.google.com/rss/articles/CBMidkFVX3lxTE5FcGl3QzNQWDN5TXdDdTY0eFJreFdpbmtHc0F1WTlNdlAtb2RyeTFjMDJtOHNQYW8xbnFCMW9BNHg3STVXQndiUjVvMndES2plVVBZZHVpRkRDMlp4WExUcjhoU2JaRE5PeG5COGhuTGZzY01vY2c?oc=5,1760598000,"I Suddenly Need a Cozy Flannel, Thanks to These Street Style Stars - Vogue","I Suddenly Need a Cozy Flannel, Thanks to These Street Style Stars - Vogue"
gnews,streetwear trend,news.google.com,https://news.google.com/rss/articles/CBMibkFVX3lxTE9YMmhvMHJrUjVESFhCaE5DeUtlbVF2bkl0MTAyeTlSd2V4bEEtTFN3MFdHcU5hQURBamx2UkpJNDdpUU5ycFA4V1ZNWlo0aVl0OXJ0X0lRbU9jcUZocVZqMEdIM0kyaFFseWVXMTVB?oc=5,1762363685,10 Fall Trends GQ Staffers Are Shopping Right Now - GQ,10 Fall Trends GQ Staffers Are Shopping Right Now - GQ
gnews,streetwear trend,news.google.com,https://news.google.com/rss/articles/CBMiXkFVX3lxTE5KcVVBMC1HR1JVSVhjZjlwX09sZTJOczdsYUVNQ21hZmtKemgxYUd1WUREMDJ1WnkyeXpldkxHVFhCQWUtSVd5a001T0lJckFjcVI1NFdROHBkLUwwV1E?oc=5,1759474800,Coucou Cherie! 8+ Paris Fashion Week Street Style Trends to Recreate - Vogue,Coucou Cherie! 8+ Paris Fashion Week Street Style Trends to Recreate - Vogue
gnews,streetwear trend,news.google.com,https://news.google.com/rss/articles/CBMilwFBVV95cUxPYjFfbENZSTNsMWhHWGR4eGQzbXp4QVRMVk8wOG9xb2llV2cxX1hfN0YtUEo3VDZjRmR5MjBwTW9kdGtIeDZwaXlsOHE0NXRSQ3lETHgxVEI1THQ4RlhwVmhZOVdlRWlrWWd3VUZFRElsWVlfWnJSSWwxS29ibUlESEhrb2NDdjJvbFdjVjNXMzgzRmtkQ0tJ?oc=5,1760831049,How Female Skateboarding Is Shaping Streetwear and Fashion Trends - vocal.media,How Female Skateboarding Is Shaping Streetwear and Fashion Trends - vocal.media
gnews,streetwear trend,news.google.com,https://news.google.com/rss/articles/CBMiygFBVV95cUxNQUVQWDdSVDFlZlQ3MTJOXzVJTC1GbHFfd0tlRHl4NUVkZ3NyZDMzdnVQTm1LWW9WWTFTU2g3VFl6Z0NOUm9NVWE3MVE3RG1ZMG14eHhUTmk5VXRVNWdFRFFVNG9oSktMTTdHT0IxeS02cDlMSTdPUTJhMkJfcERfMVg2UWpaaXhacWNGNnU4SWhHWTZxYmtPS2Fic05naWxrZ25vZVdmalJLWEZkZXBsb3hGZ1owX0hhaS0tYll2ZVhKNmRCendWQklB?oc=5,1760511600,TICAL Athletics Sets New Trend with Streetwear Fitness Apparel Collection Launch - Lohud,TICAL Athletics Sets New Trend with Streetwear Fitness Apparel Collection Launch - Lohud
gnews,streetwear trend,news.google.com,https://news.google.com/rss/articles/CBMijwFBVV95cUxNMk5qZVNqelBNdEpZQ3JubFlTYjdOeFlKZTRKS3l0SFVRNUlNdlhiSHdXOWtFcmtDVkVwV2VRdGNHT0tEVTlMMXJPZWFqamk1S3NVYUF5NVUyQ0ZJSXhEN1FiaVViUXdLV0lQTXM2MjR0TlZva1Q2R1dzLU9BazhTYkNHdXBKNmpoMVZxOFFuUQ?oc=5,1759824033,How to Style Streetwear: Trends & Tips for 2025 - vocal.media,How to Style Streetwear: Trends & Tips for 2025 - vocal.media
gnews,streetwear trend,news.google.com,https://news.google.com/rss/articles/CBMib0FVX3lxTE9JeWVaZXA1N3FRdEdrNHV0WGNabGRhZWJ4MWF2S2ozN1BwOFA2Z1IwY0JVTi1QM3BGNmJ5YmlZeDZIdXhJMlczUGVTcHpHNXpEcDNDaFQ3NXNRajdTNlExTFphdVVkYkxieVZhZDFkY9IBdEFVX3lxTE5GOEtOVEdaWUtSODN3WVNlNkR4WGFBcHF0SzNVajZQZWVkNWNzOWlQRFJBMXhzTEl4aUlzLUJkQ0M2N01MclpITTVsRk9xNDd6bDVSU1B1NTlKVnZiemhib2dQeTlWWkJvTHhJbTRHMm1ITno4?oc=5,1760511600,Basketball-Player Streetwear Campaigns - Trend Hunter,Basketball-Player Streetwear Campaigns - Trend Hunter
gnews,runway trend,news.google.com,https://news.google.com/rss/articles/CBMigwFBVV95cUxQOWlkSVVSTE5BNDF3VkVHMzlTYV83S3N3bmlQREloZnVoT1pIY25nSXRNYVNiMkk4VFNSNGlXbVR5SUZvZnVQT0FSTW9lQktUa0MzMFpZcGlaNUcxNU1fNy1CNk43VV9SeTZ2b2FxZWpQTFJpdXhsMnlKd1VCOWhjVHpRdw?oc=5,1762979895,The Burgundy Bag Trend Taking Over Every Fashion Girl’s Wardrobe This Season - ELLE,The Burgundy Bag Trend Taking Over Every Fashion Girl’s Wardrobe This Season - ELLE
gnews,runway trend,news.google.com,https://news.google.com/rss/articles/CBMipAFBVV95cUxQbTVXdmktV0NQOUE5azRoY0ptb2xOVU0xeDNxUzMzT0dxclpzMDhtSWoyYlJzN2VFOXlxWmQ4QlhlUkhKeGJSR202ejd5ZWtMNDF4TFJKamFCLUtsX3FKV0phSGVuVVo4RW9sbE1FQmJsY2ZuYzZ4bDMwb19xdENENkVJR2U5VkpOeFZnQTFmZVQzTFF0bzZjQnMzbS1FWGYtTEhGYw?oc=5,1762959348,This very old-school fashion trend is back — and even Kate Middleton is wearing it - AOL.com,This very old-school fashion trend is back — and even Kate Middleton is wearing it - AOL.com
gnews,runway trend,news.google.com,https://news.google.com/rss/articles/CBMihAFBVV95cUxPVWRGZ01BV0JaRjJkOXljQUtJcnd6VkU4Si1jb3Nha20yd2g1OTBBaVpFOFpnRVR0dnhMekZDaXVoSy1Rc1ZSSUp5Q2J0cTJlejNfOUVqMnlKSnZkdkVhejNmcWR5RkIzSUZQdmRDOFA1TUE3Y2hIMTZkMEM0OWhKZWVvM0o?oc=5,1762804257,"Alexa Chung Loves Fake Merch That Means ""Absolutely Nothing"" and Dresses Over Jeans - instyle.com","Alexa Chung Loves Fake Merch That Means ""Absolutely Nothing"" and Dresses Over Jeans - instyle.com"
gnews,runway trend,news.google.com,https://news.google.com/rss/articles/CBMilwFBVV95cUxQTEVBV0hxQzl0ZG5rWDNmbmgteEwwYWhOY0ZBQjZCRl90N0FXTXJhU1d6OUhjcmFaU2dwQkNyWS1VdlkzTE4tUXdJeTRlemYwQ212VDA1NmdTRzZsM215dHVrYWJ3dE5HRnpFVHktLTlZeEZlWUZSYXFwLVdDVzVnb1FPT0pTYnZpT01hc1l5OWh1TTBBeVRZ?oc=5,1762808562,The Top 12 Spring 2026 Accessory Trends From the Runways - W Magazine,The Top 12 Spring 2026 Accessory Trends From the Runways - W Magazine
gnews,runway trend,news.google.com,https://news.google.com/rss/articles/CBMiqwFBVV95cUxQMGJmMWtITmNpMS1zdEhMeDYyV0g4RmI0cXhxYUNnZDdtbmthem5LRXRjdXF1MEl0MHdONzNJWl9YNHBwX0g2UFhpUXlkQmFRNHRCSm9wSVdGdzdHZEx6bFR1TFNaWEg2bzJYVE04OXQ5eUtTQ0xZbUtIY0p5dXh1Wnc5N1QxZWRQZ0w0aW44SDlIV0laVHZOblE3MFU0YTVNeXVIWHF2UVJDd3c?oc=5,1762548307,The Gen Z Fashion Trend That's Baffling Apparel Retailers - Forbes,The Gen Z Fashion Trend That's Baffling Apparel Retailers - Forbes
gnews,runway trend,news.google.com,https://news.google.com/rss/articles/CBMiekFVX3lxTE1HUlJka0NpTVNrM1IzRHdKakF2a295dWtiWjk5dnE4UDV6Q0JqallGTVh6d3VON1kwWE5pVmVyR0ZieWxtTDFEdFNoNHRYNUN3LTlyeWthSXlTZFpSZUw4RG91aUhKMDYyaDZVQmhBaHU5TmxDM3pNdUxn?oc=5,1762842600,It's Not Brown—This Unexpected Suede Colour Is Winning Over the Fashion Crowd - Who What Wear,It's Not Brown—This Unexpected Suede Colour Is Winning Over the Fashion Crowd - Who What Wear
gnews,runway trend,news.google.com,https://news.google.com/rss/articles/CBMiekFVX3lxTE9QUXNwN0NpbmpkODl6Y2V4QVU0dGVubjdTdDduQ2ZFM3duRkNPZ0N1MFdocVpBYThDVldZcHRXTUx2VTZ4SmdDWENWUUxaSEtTcnNGTlRZak1XUVNHQkZNOGlMcFZZcDNwSGpFQVRZM3lLVm51UnJpUGJn?oc=5,1762805546,Can Sarah Jessica Parker Make the Wide-Open Bag Trend Happen? - Vogue,Can Sarah Jessica Parker Make the Wide-Open Bag Trend Happen? - Vogue
gnews,runway trend,news.google.com,https://news.google.com/rss/articles/CBMihgFBVV95cUxPVElyYnB5eVR5OHg3ZEtxMkQ1dE14N2ZIQ1p5b3FQbnRWY0tpc19wVC1kZlJnLS1iRmxROWpIZjloX0RtV0tCLThVQkpLZkk0X0tMSF9Tc2Q0SzQzMlBRR28yeEczSjVlR2lTeGNmYi1US2Y4N3NSWHp6NmhRajFpbUZVSlBPQQ?oc=5,1761548400,I Can't Stop Thinking About These Runway Trends—So I'm Making Them My Own This Fall - Marie Claire,I Can't Stop Thinking About These Runway Trends—So I'm Making Them My Own This Fall - Marie Claire
gnews,runway trend,news.google.com,https://news.google.com/rss/articles/CBMiggFBVV95cUxNZlVCdGhCbkZGWnVrT21YaFdmOHlMbGpOLUtlWHBlbTRFbDd5a1RlQk5YckJtNC1Jc3lOTjVlYVdCbDNRYVdFVE44eFlUM3dzNkVtUDVTUlZGM3MxMmJWUE9qVHFPamcxdWlURlhyV3JRVW9sMHNwejRWdXNTZVJ3S3RR?oc=5,1762329600,6 Fall Fashion Trends That Are *Actually* Wearable - Katie Couric Media,6 Fall Fashion Trends That Are *Actually* Wearable - Katie Couric Media
gnews,runway trend,news.google.com,https://news.google.com/rss/articles/CBMikAFBVV95cUxNN1BxOVZSTDNYTDJuVU1iYU1md0QyY0ZfZGNBOS1VTzA3U2V3bElzNzhfWlA3dmZacWVVcGtjV2JYRm54djB0ZTIySjBpQnU5eFg5Z3BOSUw2Sk5nUjFUR3JfUjRneGtTMlRTSDRkNDFHajNrR0lhWHhGOFU0bVZ6U0FBcHpIS0FhRmJKSGNVZ04?oc=5,1762546566,TikTok Turns Bull Nose Rings into 2025 Fashion Trend - AGDAILY,TikTok Turns Bull Nose Rings into 2025 Fashion Trend - AGDAILY
gnews,runway trend,news.google.com,https://news.google.com/rss/articles/CBMiXEFVX3lxTE94UExZZTdrSE1TWUx4cDc5aXV1cUxIb3FpZzhrN2Zwb2hIakV1aE03X0ZiVXU0SS1pZDRma2RheWd5b3NaZHdDWXJTTFg2NmxacFRKUjA2TUU0aVNN?oc=5,1762066800,Granny Print Is the Next Grandma-Inspired Fashion Trend Emerging in 2025 - glamour.com,Granny Print Is the Next Grandma-Inspired Fashion Trend Emerging in 2025 - glamour.com
gnews,runway trend,news.google.com,https://news.google.com/rss/articles/CBMilAFBVV95cUxPcUtTZGV5M1laM0h4bVBVS3E5R3Ffd0ctcDRCSmc2NTQxNFVtc00xaFdrS0sxel9XdmlqUTA5a3ItdkxIZkJZLVpCcmJmMHcwMjFDU0V4RTB0UGx3dlZwbUV3VTlNZU1IVzFtc0llSGFzVVdKVGhhNi1SODdfa2JFVjdiT2pVdmlNN0pQbXRoa1JIS2xv?oc=5,1762977701,Thomas Tuchel issues verdict on 'crazy' new England fashion trend ahead of latest World Cup qualifier - London Evening Standard,Thomas Tuchel issues verdict on 'crazy' new England fashion trend ahead of latest World Cup qualifier - London Evening Standard
gnews,runway trend,news.google.com,https://news.google.com/rss/articles/CBMiggFBVV95cUxOZ3k1a053U1ZQdEsxbFFMcWQtdkpDX1RIMkR0WkdJbElQWWtPaEc2Vm43bHkxcUpSLXRSekJZeHlfUE55Sm5DMWhXd2NJVXdzbGx5QXJzVno2ZkhydHhEclRZam1ENDlIX1JLOFh6Sk1remcxMEJhNGFMNHNwdXhTVXNB?oc=5,1762495200,How to Nail the Coffeecore Fashion Trend - Vogue Arabia,How to Nail the Coffeecore Fashion Trend - Vogue Arabia
gnews,runway trend,news.google.com,https://news.google.com/rss/articles/CBMiY0FVX3lxTE9BR3ZGSm0tTUNUUHhGSkVzU2hzUnF5eVlDSjNUUVRTa212QkhfbjlhRG9WX255YS16amhpbE9sbkJCRVd2Uzg0VG9zZ3h6akRwUE01Z3dncTBPczJDcXhUYnhYMA?oc=5,1759906800,The Spring/Summer 2026 Runway Trend Report - Coveteur,The Spring/Summer 2026 Runway Trend Report - Coveteur
gnews,runway trend,news.google.com,https://news.google.com/rss/articles/CBMibkFVX3lxTE9YMmhvMHJrUjVESFhCaE5DeUtlbVF2bkl0MTAyeTlSd2V4bEEtTFN3MFdHcU5hQURBamx2UkpJNDdpUU5ycFA4V1ZNWlo0aVl0OXJ0X0lRbU9jcUZocVZqMEdIM0kyaFFseWVXMTVB?oc=5,1762363685,10 Fall Trends GQ Staffers Are Shopping Right Now - GQ,10 Fall Trends GQ Staffers Are Shopping Right Now - GQ
gnews,runway trend,news.google.com,https://news.google.com/rss/articles/CBMifEFVX3lxTE9LWXZlSnVVaVlFNVQtOE1udC1xTkdqWUh2RUdxSmJDRngySGdNV0hzS08wMDNqOVlFSllXVksyNnktZFBncjJPYnIwTFhDamx1QXZvdjVraloyblR1QzZfTGNaa0JNOUpZUDFNeFlEcDBQdzU5ZEl0N051c1g?oc=5,1762880716,"Square Toes, Dance Flats, and More Spring 2026 Shoe Trends to Know - ELLE","Square Toes, Dance Flats, and More Spring 2026 Shoe Trends to Know - ELLE"
gnews,runway trend,news.google.com,https://news.google.com/rss/articles/CBMiggFBVV95cUxQejBIaVlmWXIxMl81RGJlNjVJalhTcGpMYXdvOWxvalBlV0dFY0hiZXdSamJtR3B3Vkw4ODFDSEZfQXE5RUMyQ1UwZ01mcWkxdURoWVhCcFNPd2JfdENyXzdmVEw4WDdHYXVGR0E3TjVXLWR5bW9XXzYxYzc5aUJqaFB3?oc=5,1762156800,12 Autumn/Winter 2025 Fashion Trends That Will Dominate This Season - Who What Wear,12 Autumn/Winter 2025 Fashion Trends That Will Dominate This Season - Who What Wear
gnews,runway trend,news.google.com,https://news.google.com/rss/articles/CBMihAFBVV95cUxOUUVBUEVDdTBUdmxjWWtFNzI2TFAyX2NTNEI0M2pya2dfOURnb19MRTBONHpLalNNb2pHcG13T0FhVGR3bTRRbDhoUEtpX2RZclFWQXp3U3dFbl9DTVRFTFJVMkwtemFnYi1FeHhVUTJpOGo2a1BPZkIyOVdKaEZHYnE0UWs?oc=5,1762156800,The Winter Trends to Start Wearing Now—Before the Mainstream Catches On - Marie Claire,The Winter Trends to Start Wearing Now—Before the Mainstream Catches On - Marie Claire
gnews,runway trend,news.google.com,https://news.google.com/rss/articles/CBMiZkFVX3lxTE5LaUlMc1VCNXJ1QUlBX0JXOFNJWkxFVVRHRGQtVGZJSGdUM19za24yWWhsaUx5dllfRjd2cDNqdE5zRHd1ZXdHSXhfZG83WUxGa3RCWHpUZGdHWkN0VnF4MXNYZzRudw?oc=5,1760943600,Fashion’s New Obsession? Clothes That Swallow You Whole - glamour.com,Fashion’s New Obsession? Clothes That Swallow You Whole - glamour.com
gnews,runway trend,news.google.com,https://news.google.com/rss/articles/CBMicEFVX3lxTE5OUHFIc094WDR1c3IzY1RMMFJQcFZWVjBiVU83NnMtd2JITTZ5THJoOHBONlZrTW5FYlNpUk1TQWE4OEtHSEZOQm1GVVExSk45d1U0M1hNbnBiTjN5eVkzUnVXM2d2ZUJVNnRVUXkxWU8?oc=5,1760684400,The Biggest Spring 2026 Fashion Trends Allow You to Choose Your Own Style Adventure - Marie Claire,The Biggest Spring 2026 Fashion Trends Allow You to Choose Your Own Style Adventure - Marie Claire
gnews,runway trend,news.google.com,https://news.google.com/rss/articles/CBMikAFBVV95cUxQaEJiWm83SmZaQkFkTDIwa2c1RGtHNXlzcDdLek1QRnlySjRLakxYZjgtV2I3ZHh0R0FQcVFFM2hFdDExeW9FZzZMbU9zMlpyRzdveFBfWHNOcEVtOS14WndXQ2xVc1NvektTR1gxUFF0U0dVZkZsUjNOaGlETEpDZG1RcEdGWTZpNWtTWGVhaTI?oc=5,1759993200,I Just Got Back From Paris Fashion Week—These Are 6 Key Trends I Know Will Matter Next Season - Who What Wear,I Just Got Back From Paris Fashion Week—These Are 6 Key Trends I Know Will Matter Next Season - Who What Wear
gnews,runway trend,news.google.com,https://news.google.com/rss/articles/CBMifkFVX3lxTE9CdUY5enkwOHV4aU54aHo1alg5RGRDSkt6SjNJM2UtLVNCbExGM3BOMDdsOHh2YjJjcVhabkxuZnZtYkF0Vi1lNTN3djAzX25KSnM3SjVhZUoxanluaUpkYlZXSTFKNEdXOFNVQ0VkVGJfS1hQYXlCSER3SkUwQQ?oc=5,1760857200,7 Minimalist Trends To Steal From The Most Recent Runways - Who What Wear,7 Minimalist Trends To Steal From The Most Recent Runways - Who What Wear
gnews,runway trend,news.google.com,https://news.google.com/rss/articles/CBMioAFBVV95cUxQcFpUZHZMWXdJd0FWRmthQjVhckdYcnhZSDE0TmNBX1pDdWt1dFJGbVNwMkZHOGxjalJZb3QyVUtUZHZCTjZLdTZDOHR1QXFLcGxZSjNqUHlDNUtUN21NNXd2ckdHT0dFbnByMk1aMWlJY1o0clBLM3lYZGJqc0c5SFllMXoxQVdlaF9WdjJFdi1HdTFiOXVUNFhMLWdELXdl?oc=5,1760338800,Our Favorite Trends from Paris Fashion Week - Harper's BAZAAR,Our Favorite Trends from Paris Fashion Week - Harper's BAZAAR
gnews,runway trend,news.google.com,https://news.google.com/rss/articles/CBMiZEFVX3lxTE9KZjRhRnlHZVJ6REd3MjkxSXQxRnMtRXRHd1dFWUxwdWlJZWdfQUh3LVhIZXRpMjFnQ2NhVFlfSDQtMkJyaTFWQ3QxQmxqd2g0LXE2OHVSV2lWa1dKUFNDdGlHNzU?oc=5,1759820400,15 Fashion Trends To Try Out in 2025 - Teen Vogue,15 Fashion Trends To Try Out in 2025 - Teen Vogue
gnews,runway trend,news.google.com,https://news.google.com/rss/articles/CBMikgFBVV95cUxQamFqR1VyTzdlcGluVFZlY2JFMVJSSFpoTnBxNE9yQmJMdXg1UlgweXY1dkktQUdwSTdTOEFibDRUZzRtOU5OV2UtMWdkMkJkRXh0N1oyOHBBcXdtWHl0N1phNzlwNF9uQU01RlpEbEZVeXJCY25NY0JPbXZBeGNyLS1YTlUzLWNCUjEzTG9SZWxwUQ?oc=5,1760684400,Fashion Insiders Say Chocolate Brown Is the Color of Fall 2025 - ELLE,Fashion Insiders Say Chocolate Brown Is the Color of Fall 2025 - ELLE
gnews,runway trend,news.google.com,https://news.google.com/rss/articles/CBMiXkFVX3lxTE5KcVVBMC1HR1JVSVhjZjlwX09sZTJOczdsYUVNQ21hZmtKemgxYUd1WUREMDJ1WnkyeXpldkxHVFhCQWUtSVd5a001T0lJckFjcVI1NFdROHBkLUwwV1E?oc=5,1759474800,Coucou Cherie! 8+ Paris Fashion Week Street Style Trends to Recreate - Vogue,Coucou Cherie! 8+ Paris Fashion Week Street Style Trends to Recreate - Vogue
gnews,runway trend,news.google.com,https://news.google.com/rss/articles/CBMijgFBVV95cUxQR1lySllzeF9QbVdGUXhkRExQQ3VORWJNYzdlN2NGTWoxamplUDV3WXhLLW5lV21jYmUyWmd4WFJCOUNxSnNUZXl2MTBWVl9yWGU1NUhHM1ZvVVlyT1hwOEl2V0U4SW8yYzc5Tk1xU0dweFVneTlVMFhXWFNlMENSYjBnRE5aZGVHMlpkUENn?oc=5,1762312247,QUIZ! Which Fall Fashion Trend Matches Your Vibe? - Girls' Life,QUIZ! Which Fall Fashion Trend Matches Your Vibe? - Girls' Life
gnews,runway trend,news.google.com,https://news.google.com/rss/articles/CBMikAFBVV95cUxQWHpGcy1zYzA3RjJRWW5sUGRCMHcyUEw0cl81bmc3TG81V3pDOElwVlQ2VUhFbXJPQWt1SFJldE9lc1NCTERRT0o0S2xZeDQ1YTRWZHdYa3VPcDMzdFlWQm11UU9zc05xUzFBWmZtVndFWnNvenZtZ2k4ajhoNGVWYUlwR0UwS0piZHdad3N5TDA?oc=5,1759215600,I’m Calling It—These are the 5 Most Stylish Trends From Milan Fashion Week - Who What Wear,I’m Calling It—These are the 5 Most Stylish Trends From Milan Fashion Week - Who What Wear
gnews,runway trend,news.google.com,https://news.google.com/rss/articles/CBMivAFBVV95cUxNaVZ6bFEwaDZETHgtSmI5QXYzU19XOGVnNmpiekRVNmc0UTBSZGVFbHlobHk0VFhldnV2WkFsSFFpYXFPMDJpa1NoLXBTQ05PNENMaHZ4akV0YmxMdHhsTThMS0dUZzJwZE5tTzlDbl81OHc5LUd5VENlR1Zfbk5rSnJXVUFCYjdnTW9CTy1BZ3VXTFo4ZjBzLXJJTGZCUVZaMGZ3blVYTXZlcGlXZDFnS3I3eVZ6TUw3akFRag?oc=5,1762840277,Spring/Summer‘25: The coolest trends from the runway - Glamour South Africa,Spring/Summer‘25: The coolest trends from the runway - Glamour South Africa
gnews,runway trend,news.google.com,https://news.google.com/rss/articles/CBMigAFBVV95cUxOcThXX2FoMGh2cTVFWmRyWU5hekhCMlB3bEwzMjFIM2xXeU9GVU12NzM3X2o2VlR0WEtqUnRKRUpZUkFXSE9McWhYeXJrZV9tQnJrUkVabEFoOTdLSVkybGwzUUt5VHVsQkk5Y1RYYzQ1RWNVdG9Yc3BvMHlIV0xuZw?oc=5,1759906800,Spring 2026 Fashion Is Running It Back to the '80s - Marie Claire,Spring 2026 Fashion Is Running It Back to the '80s - Marie Claire
gnews,runway trend,news.google.com,https://news.google.com/rss/articles/CBMihwFBVV95cUxOODNUWUFSdW81a1Y3Q2dNTFdhVHZDUG5vRlVJRnZoNHVnUGxJWllweVRkRkEzajFYWEsySnNuYWZoZVEwWk9qYTZmSUlQakpBelJHQVBVbEgtSUFRNDFPUGxyM2E3Xy1JUmxBWF9lSDJqOXdmM0Z4SlZubHc3YzRBNWdsVTRpelE?oc=5,1759302000,"A Monumental MFW: Designer Debuts, Farewells, and Every Major Trend to Know - Who What Wear","A Monumental MFW: Designer Debuts, Farewells, and Every Major Trend to Know - Who What Wear"
gnews,runway trend,news.google.com,https://news.google.com/rss/articles/CBMimwFBVV95cUxObzA3T1laRTZqSTZmZnFuY3hXQjg3dWtkeUJVb1hPTFE4WEpnMjRDSTJKM0gwbkJROEJpamJhS2pHemkxSnpwN0ZJWjZmT1RXNnZCdFNndFBlVjhZdjItVDdjUHNjSDZIUk9JZGs2REhCWmRSMGJ3YTA0alRUSnZneWFadEhlZzQ2ekFxUDJVMlBiYmJ2RV9XTFlMRQ?oc=5,1760450784,Layers with texture are this fall’s fashion trend - Golf Digest,Layers with texture are this fall’s fashion trend - Golf Digest
gnews,runway trend,news.google.com,https://news.google.com/rss/articles/CBMijwFBVV95cUxQRW9YU2ZKRGFyVlBHdzI4OXVOLTlxSUp2b1dmZFBxZlVSUDlCUnRfN295eGJOTjRHODdjNEpKcmJqeFJvdllUY1dfbXdIZnRhaDRmZFFPNkVua0VOTEF5d29GVVo5Zm5tRk1ueG9JQWpOUW5QTUx6RmozOHoyT3YwdVc0VmtfRnQyM05FY1gzWQ?oc=5,1759215600,Horse Girl Fashion Is Back in the Saddle! How To Wear It for Fall 2025 - The Pioneer Woman,Horse Girl Fashion Is Back in the Saddle! How To Wear It for Fall 2025 - The Pioneer Woman
