source,query,url,created_utc,title,text
youtube,men's fashion trends,https://www.youtube.com/watch?v=E2ELwKgB0hQ,1775380491,Minimal outfit but maximum style 😎 #casualvibes #outfitdaily #mensclothing #styleguide #urbanstyle,"Clean, minimal and stylish This neutral casual outfit is perfect for everyday wear—simple t-shirt, relaxed pants, and fresh ..."
youtube,men's fashion trends,https://www.youtube.com/watch?v=qUvjKqrchTQ,1775378660,New drop 🔥🔥➡️ baggy outfit #casualclothing #fashiontrends #viralvideo #mensfashion #casualwear,
youtube,men's fashion trends,https://www.youtube.com/watch?v=vu3o3jyCza8,1775378014,best colour combination #oldmoney #plussizemenswear #mensstyle #mensfashion #hoodieq #outfit #best,"Welcome to Fashion Xpress — your fast and stylish destination for the latest fashion trends! Yahan aapko milte hain outfit ideas, ..."
youtube,men's fashion trends,https://www.youtube.com/watch?v=ccWJErjutZA,1775376720,just 200/- shirts 🤗🔥 #MensFashion#MensStyle#MensClothing#ShirtStyle#FashionTrends#StyleInspo#viral,"Upgrade your style with the latest trending men's shirts From casual everyday looks to stylish party wear, discover premium ..."
youtube,men's fashion trends,https://www.youtube.com/watch?v=2DcYnm3wGTY,1775376402,Terrain Tribe| Men’s Fashion Wear #fashiontrends #fyp #viralvideo #spykar #ytshorts #virlshorts,
youtube,men's fashion trends,https://www.youtube.com/watch?v=PJjhy0AzYEo,1775374045,New stock update order now☎️9992180912 #fashionindia #clothing #genshinimpact #fashiontrendz #viral,"Upgrade your wardrobe with the latest arrivals at Men's Villa We bring you premium quality outfits designed for style, comfort, ..."
youtube,men's fashion trends,https://www.youtube.com/watch?v=H3J-UgvvH9w,1775374046,Kaos singlet pria premium murah #kaos #singlet #fashion #fashiontrends #fashionstyle,
youtube,men's fashion trends,https://www.youtube.com/watch?v=hNFpMiKZfE0,1775372010,Kaos singlet pria sablon premium #singlet #kaos #fashion #fashiontrends #fashionstyle,
youtube,men's fashion trends,https://www.youtube.com/watch?v=o7qldy4sIEM,1775369162,GOATED FREINDSHIP #fashiontrends #petshub #travel #summerfashion #trendingshorts #brothers #viral,
youtube,men's fashion trends,https://www.youtube.com/watch?v=oIQmf9VlTU0,1775368021,99% Guys Dress Wrong😒 #outfit  #outfitideas #mensfashion #ootdguide #viral #viral,Want to upgrade your style without trying too hard? This clean & minimal outfit proves that simple powerful Most guys ...
youtube,men's fashion trends,https://www.youtube.com/watch?v=CoqtmFL2q4Y,1775367912,Premium Henley Tshirt for men#fashion #fashiontrends #mensfashion #shorts,Premium Henley Tshirt for men#fashion #fashiontrends #mensfashion #shorts.
youtube,men's fashion trends,https://www.youtube.com/watch?v=MlNJVufsUjA,1775367785,Tha art of dressing classy✨❤️#fashion #shorts#outfit,Your Enquiry outfit ideas from meesh outfit ideas men outfit ideas for women outfit ideas for chubby girl outfit ideas for boys ...
youtube,men's fashion trends,https://www.youtube.com/watch?v=OrKOewUvgaw,1775364724,tu sasuro me...... #viral #hindiganabhojpuriganakaiselikhe #fashiontrends #trending #summerf#viralre,tu sasuro me...... #viral #hindiganabhojpuriganakaiselikhe #fashiontrends #trending #summerf#viralretu sasuro me...... #viral ...
youtube,men's fashion trends,https://www.youtube.com/watch?v=5IU5td-9qsE,1775363835,Baggy Vs Straight Jeans: Which Is Better? 👖 #Shorts,Stop wearing the wrong fit! Here is the ultimate battle between Beige Baggy and Beige Straight jeans to see which gives you that ...
youtube,men's fashion trends,https://www.youtube.com/watch?v=qgjAhwkRnUw,1775361705,🔥2026 Men’s Superb Outfit Combination Every Man Must Try -06🔥 #mensfashion #reels  #shorts #short,Welcome to our channel! Discover this amazing men's outfit combination that every man should watch and try for a stylish and ...
youtube,men's fashion trends,https://www.youtube.com/watch?v=WXJNAiQs1qE,1775357784,🗣️&quot;Aura +99999 Of White Shirts&quot;💯 #shorts #outfitideas,"""Aura +99999 Of White Shirts""   #shorts #outfitideas Keywords- #FashionShorts #StyleTips #MensOOTD ..."
youtube,men's fashion trends,https://www.youtube.com/watch?v=5_i7L4QGFPY,1775357645,New Japanese Fashion Brand #menswear #mensfashion #style #shorts #fashion #streetwear #fashiontrends,"This new Japanese fashion brand Shiden is one of my latest obsessions, because it is one of the more unique brands to come ..."
youtube,men's fashion trends,https://www.youtube.com/watch?v=THQOKxt54K4,1775356228,Orry affordable attractive suit/kot-pant price #orry #crackah #fashion #fashiontrends #price #shorts,
youtube,men's fashion trends,https://www.youtube.com/watch?v=0JZd9ZkJEFY,1775355847,"Boys, Wear This &amp; Look Instantly Attractive😱🤙","Welcome to Dapper Society ✨ Elevate your style with the latest men's fashion trends, outfit ideas, and grooming tips. From school ..."
youtube,men's fashion trends,https://www.youtube.com/watch?v=XiGfBtNak2g,1775345409,​Flannel Shirt Styling Guide 2026 | Men’s Fashion Trends,"Flannel Shirt Styling Guide 2026 | Men's Fashion Trends Agar aap apne fashion game ko upar le jana chahte hain, toh flannel ..."
youtube,men's fashion trends,https://www.youtube.com/watch?v=z4LOcFkdf-k,1775340065,20 Men&#39;s Fashion Trends for Lovers of Classic Style #mensstyle #mensfashion #styleover30  -- 👉 ...,20 Men's Fashion Trends for Lovers of Classic Style #mensstyle #mensfashion #styleover30 -- https://amzn.to/4c4rM8N Vital ...
youtube,men's fashion trends,https://www.youtube.com/watch?v=nTYi--ryuy8,1775329208,Men’s Fashion Trends You’ll Actually Wear in 2026 | Fredjo Clothing Store,Welcome to my YouTube channel Fredjo Clothing Store new video Men's Fashion Trends You'll Actually Wear in 2026 | Fredjo ...
youtube,men's fashion trends,https://www.youtube.com/watch?v=daMng0sOAis,1775324041,👉 2026 Men’s Fashion Trends You NEED to Know 🔥,mensfashion #menstyle #menswear Τα trends της αντρικής μόδας για το 2026 είναι ήδη εδώ Από clean nerdy looks μέχρι ...
youtube,men's fashion trends,https://www.youtube.com/watch?v=sw_pUc3s1go,1775322113,3 Best Summer Shirts for Men 2026 | Trending Summer Fashion,"3 Best Summer Shirts for Men 2026 | Trending Summer Fashion ""Hello dosto! Swagat hai aapka mere naye video mein. Aaj ke is ..."
youtube,men's fashion trends,https://www.youtube.com/watch?v=u_vsefOPvas,1775318513,V Neck Sweaters Style Tips Brands &amp; Versatility | Fredjo Clothing Store,Welcome to my YouTube channel Fredjo Clothing Store new video V Neck Sweaters Style Tips Brands & Versatility | Fredjo ...
youtube,women's fashion trends,https://www.youtube.com/watch?v=jsv6tsHZxAo,1775391656,Recreate Fashion Hack Pashmina. #hijabstyle #fashiontrends #fashionstyle,
youtube,women's fashion trends,https://www.youtube.com/watch?v=Bj6lwlS4zJo,1775385957,चालाक पति है 😠😡🤨 #comedy #viral #fashiontrends #funny #yt #summerfashion #trending #sarita_rawat1605,चालाक पति है #comedy #viral #fashiontrends #funny #yt #summerfashion #trending #sarita_rawat1605 #shorts ...
youtube,women's fashion trends,https://www.youtube.com/watch?v=b7k-s3bTs6Q,1775383220,Comment link to get this Saree link🩷🌸 #saree #shortsvideo #fashiontrends #love,Comment link to get this Saree link     #saree #shortsvideo #fashiontrends #love.
youtube,women's fashion trends,https://www.youtube.com/watch?v=zfmF0BaeMFk,1775382127,Latest Design Women&#39;s Shoes Unique Modern Style Unboxing #ytshorts #fashiontrends #shortsfeed,"Explore the best shoes,sneakers,boots,sandals,slippers,flipflops for every occasion. Discover casualshoes,fashionshoes ..."
youtube,women's fashion trends,https://www.youtube.com/watch?v=C91u_6s39lU,1775381937,Trending Footwear &amp; Style Searches 2026 | Ladies Shoes &amp; Sandals Fashion Trends,"Discover the Top Footwear & Style Searches of 2026! In this video, we explore the most popular and highly searched ladies shoes ..."
youtube,women's fashion trends,https://www.youtube.com/watch?v=TYws4CEmKfo,1775379976,Links will be revealed sooonn!!! #outfitideas #outfitinspo #aesthetic #summerfashion #fashiontrends,
youtube,women's fashion trends,https://www.youtube.com/watch?v=tnblAqcXdwU,1775379671,balam aawara nikal Gaye 🤗 #song #fashiontrends #youtubeshorts #musicmamtacreator,balam aawara nikal Gaye #song #fashiontrends #youtubeshorts #musicmamtacreator.
youtube,women's fashion trends,https://www.youtube.com/watch?v=l6k11tvlpLw,1775377376,Dress Collection 2026💫🎉 New Party Dress #shorts #dress #fashion #trending #eid2026 #viral,Dress Collection 2026     New Party Dress #shorts #dress #fashion #trending #eid2026 #viral Latest Eid Dress Designs 2026 ...
youtube,women's fashion trends,https://www.youtube.com/watch?v=Q0Dr3G3EcvE,1775376033,Outfit Inspiration Daily 👗#style #fashiontrends #fashion #shorts #short,"Discover the latest fashion trends 2026 with stylish outfit ideas, runway looks, and viral fashion reels. From elegant black outfits to ..."
youtube,women's fashion trends,https://www.youtube.com/watch?v=5cBltoSs1QE,1775376000,Billionaire outfits for women of class and glamour ❤️❤️2026,Billionaire outfits for women of class and glamour ❤️❤️ Our Ankara agbada dresses bring effortless elegance with every flow ...
youtube,women's fashion trends,https://www.youtube.com/watch?v=uPanGXA5jt4,1775374226,"Elegant Women Summer Outfit Collection  Premium Daily Wear, Party Fashion and Stylish Bottom Looks","Elegant Women Summer Outfit Collection Premium Daily Wear, Party Fashion and Stylish Bottom Looks Explore an elegant ..."
youtube,women's fashion trends,https://www.youtube.com/watch?v=ZeDFf8Qhfc8,1775373758,#kurticollection #kurtiset #viralshort #viralreels #fashiontrends,
youtube,women's fashion trends,https://www.youtube.com/watch?v=1vhL2dtLODo,1775373324,#wedding #love #dulhandulhan #song #dulheraja #braidal #dance #trending #fashiontrends #youtubeshort,wedding #love #dulhandulhan #song #dulheraja #braidal #dance #trending #fashiontrends #youtubeshort.
youtube,women's fashion trends,https://www.youtube.com/watch?v=OEylcTEYAxE,1775372400,short kurtis 🩷🪷#fashion#fashionstyle#fashiontrends#ytshorts#viral#yt#fyp,Links 1. https://bitli.in/9mm52NB 2. https://myntr.it/FDPc66r 3. https://bitli.in/I3IxSqv 4. https://bitli.in/AfYvwoW 5.
youtube,women's fashion trends,https://www.youtube.com/watch?v=8Xhv1cGszVk,1775372239,"women,s Amazing Colorful Floral Wall Art 😍 | Unique Home Decor Idea 2026 #shorts #shortsfeed",Stay warm and stylish this winter with this trendy Women Knitted Sweater ❄️ This beautiful Color Block Long Sleeve Tassel ...
youtube,women's fashion trends,https://www.youtube.com/watch?v=HSM4AI49HM4,1775371769,Top look || casual college outfit || #fashiontrends #outfitideas #ootdguide #ootd #shorts,Top look || casual college outfit || #fashiontrends #outfitideas #ootdguide #ootd #shorts brown top outfit ideas beige cargo pants ...
youtube,women's fashion trends,https://www.youtube.com/watch?v=YcX5QMP2nuw,1775367031,"Women Premium Summer Wear Ideas  Smart Daily Fashion, Elegant Party Looks and Chic Bottom Styles","Women Premium Summer Wear Ideas Smart Daily Fashion, Elegant Party Looks and Chic Bottom Styles Discover women's ..."
youtube,women's fashion trends,https://www.youtube.com/watch?v=c4WhVvjMt0c,1775366785,@riyabhattacharyya0924 #trending #meesho #same #fashion #viral #shorts #fashiontrends #bengali,
youtube,women's fashion trends,https://www.youtube.com/watch?v=hQenqMdGbdc,1775366758,A moment for Red Dress🥂🍒 #womenstyle #outfitinspo #fashiontrends #viralvideo #shorts #explore,"Ultimate Day Out at Bahu Plaza Jammu! 🛍️   | Lunch & Vibes We visited Bahu Plaza for some fun, shopping, and, of course, ..."
youtube,women's fashion trends,https://www.youtube.com/watch?v=MST-swUdWEk,1775365376,Women’s Knitted Sweater 2026 – Autumn/Winter Color Block Tassel Sleeves,Looking for the perfect Fall & Winter outfit idea? ❄️This trendy women's color block knitted sweater is a must-have for 2026 ...
youtube,women's fashion trends,https://www.youtube.com/watch?v=ZnLYLzMzwMA,1775364532,Aesthetic Poses for girls 🎀. | #outfitideas #fashiontrends  #fashion #aesthetic,Aesthetic Poses for girls . | #outfitideas #fashiontrends #fashion #aesthetic Comment for next video .. #aesthetic #girls #poses ...
youtube,women's fashion trends,https://www.youtube.com/watch?v=cPFz9gFWZgw,1775364114,Women’s Knitted Sweater 2026 – Autumn/Winter Color Block Tassel Sleeves,Looking for the perfect Fall & Winter outfit idea? ❄️This trendy women's color block knitted sweater is a must-have for 2026 ...
youtube,women's fashion trends,https://www.youtube.com/watch?v=pPA7TvRwGt4,1775363429,"Stylish Summer Wear for Women with Premium Casual Fashion, Party Wear, and Everyday Elegant Outfits","Stylish Summer Wear for Women with Premium Casual Fashion, Party Wear, and Everyday Elegant Outfits Discover stylish ..."
youtube,women's fashion trends,https://www.youtube.com/watch?v=ks4LCVSGZ80,1775361659,Minimal Elegant Outfit Ideas 🖤 #style #fashiontrends #fashion #shorts #short,"Discover the latest fashion trends 2026 with stylish outfit ideas, runway looks, and viral fashion reels. From elegant black outfits to ..."
youtube,women's fashion trends,https://www.youtube.com/watch?v=iEktN13R2ZY,1775360890,Women’s Knitted Sweater 2026 – Autumn/Winter Color Block Tassel Sleeves,Looking for the perfect Fall & Winter outfit idea? ❄️ This trendy women's color block knitted sweater is a must-have for 2026 ...
youtube,streetwear 2025,https://www.youtube.com/watch?v=HfLwDPIUDnk,1775162618,OOTD | Streetwear on a Budget | June 4 2025,"I believe you don't need to spend a fortune to look elevated, confident, and timeless at any age Grab my FREE Thrift Store ..."
youtube,streetwear 2025,https://www.youtube.com/watch?v=q2nF9KvtmYo,1775161422,OOTD | Streetwear on a Budget | May 28 2025,"I believe you don't need to spend a fortune to look elevated, confident, and timeless at any age Grab my FREE Thrift Store ..."
youtube,streetwear 2025,https://www.youtube.com/watch?v=lqjXlwX4EkM,1775079127,2025 fashion regrets #hourscollection #fashiontips #howtodress #streetwear,
youtube,streetwear 2025,https://www.youtube.com/watch?v=KpnkyTbP5ys,1775069672,Y2K Streetwear Outfit | Starboy Tee + Stacked Jeans Fit Check 2025,"The ""Starboy"" tee + stacked denim combo is LIVE ⭐ Full fit breakdown: • Starboy Longsleeve Tee (Heather Gray) • Stacked Cargo ..."
youtube,streetwear 2025,https://www.youtube.com/watch?v=AUAeTvlIVa8,1775053804,MXDVS pop-up in Amsterdam 2025. #streetwear #fashion #clothingbrand #pop-up,At our last MXDVS pop-up in Amsterdam we got to meet some amazing people in line. It was inspiring to hear your stories and see ...
youtube,streetwear 2025,https://www.youtube.com/watch?v=ZMrIsc14j6E,1775037456,ADIDAS performance real madrid jersey 2025/26 away #edit,
youtube,streetwear 2025,https://www.youtube.com/watch?v=uZZL63kKxuI,1774994449,The massive secret in Kendrick&#39;s Super Bowl outfit... 🤫🏈,You won't believe the hidden details in Kendrick Lamar's Super Bowl outfit... Kendrick completely shut down the 2025 Super ...
youtube,streetwear 2025,https://www.youtube.com/watch?v=GbzxeCvtksg,1774985666,Ai in 2025 vs Ai in 2026 😂🔥 #ai #tech #blackbox,ai #tech #blackbox.
youtube,streetwear 2025,https://www.youtube.com/watch?v=5hGNsWQBMmA,1774967926,2025 Summer Men Black White Streetwear Hip Hop Shirt Men Tassels Party Night Club Men Shirts Male...,Stand out with street style that speaks volumes! Elevate your look with our 2025 Summer Men Black White Streetwear Hip Hop ...
youtube,streetwear 2025,https://www.youtube.com/watch?v=aDv8zBxsR_A,1774905909,Jordan 4 Undefeated 2025 Review #jordan4 #sneakers #undefeated #trending #fashion #sneakerhead #nike,Jordan 4 Undefeated 2025 Review #jordan4 #sneakers #undefeated #trending #fashion #sneakerhead #nike #whitesville ...
youtube,streetwear 2025,https://www.youtube.com/watch?v=rOJq97nLToE,1774867503,The Future of Streetwear: 2026 Market Intelligence #streetwearcommunity #fashionbusiness ,"The Future of Streetwear: 2025-2026 Market Intelligence The global streetwear market is shifting from ""Marketing-led Hype"" to ..."
youtube,streetwear 2025,https://www.youtube.com/watch?v=4R7yRN7I14c,1774865526,best outfit for 2025 #fashion #shorts #oldmoney,best outfit for 2025 #fashion #shorts #oldmoney.
youtube,streetwear 2025,https://www.youtube.com/watch?v=juoKj_DSL3A,1774794752,Westside collection #zudioindia #trends2025,Zudio #ZudioIndia #ZudioStyle #ZudioWinterCollection #ZudioWinter2025 #ZudioLookbook #ZudioOOTD #ZudioFinds ...
youtube,streetwear 2025,https://www.youtube.com/watch?v=a5PGoY3zxLA,1774792393,The Best Hats for 2025: Top Picks for Style &amp; Fit! #Hats #NewEra #Streetwear #Fashion #Snapback,"Looking for the perfect hat to complete your fit? Whether you're into classic New Era 59FIFTY fitteds, vintage Dad Hats, or the ..."
youtube,streetwear 2025,https://www.youtube.com/watch?v=TNwUS1bNi5Q,1774742440,Lesser Care performs &quot;Streetwear&quot; live @ Genghis Cohen&#39;s 3/7/2025 Los Angeles ,"Lesser Care ""STREETWEAR"" March 7th 2025 Los Angeles @ Genghis Cohen's."
youtube,streetwear 2025,https://www.youtube.com/watch?v=1i_brhSWlFc,1774707731,NiZED Alien Drip – Von einer anderen Welt | Streetwear Berlin 2025 #nized #streetwear #BerlinFashion,"NiZED trifft nicht – NiZED landet. Dieses Piece kommt von einem anderen Stern. Kein Mensch trägt das so. Zu weird für die Norm, ..."
youtube,streetwear 2025,https://www.youtube.com/watch?v=oeLrB-tkvLU,1774705723,Where to buy good graphic Shirts 🔥#streetwear #graphicshirts,"Streetwear inspo 2025 From hoodies, jorts, caps to the latest sneaker drops – this Short brings you the best streetwear ..."
youtube,streetwear 2025,https://www.youtube.com/watch?v=eWnDkBDSv2I,1774667902,2025 Vintage Big Face Graphic Print Cotton T-Shirt Men Y2K Summer Short Sleeves Vintage Oversize,2025 Vintage Big Face Graphic Print Cotton T-Shirt Men Y2K Summer Short Sleeves Vintage Oversize Tshirt Streetwear Women ...
youtube,streetwear 2025,https://www.youtube.com/watch?v=gJhN3tJnaiE,1774621526,Jersey reviews:🔥 Juventus 2025/26 Pre-Match Training Jersey #vintage #jersey #juventus,
youtube,streetwear 2025,https://www.youtube.com/watch?v=9S8sZz100Ls,1774531230,💥Live 2025💥#konzertvibes #heavyriffs#heavymusic  #musikliebe#livemusik#rockband#punkrock#streetwear,
youtube,streetwear 2025,https://www.youtube.com/watch?v=EzWOIwTGTyw,1774512122,Sophie showcasing our new 2025 spring summer berghaus collection,"Sophie showcasing our new 2025 spring summer berghaus collection. Come by and see us in-store, or take a look over on our ..."
youtube,streetwear 2025,https://www.youtube.com/watch?v=aM_evO71jTw,1774507381,Transform Your Home with These Must-HaveGadgets &amp; Tools of 2025!#shorts #gadget,Transform Your Home with These Must-Have Gadgets & Tools of 2025! #shorts #gadget Transform Your Home with These ...
youtube,streetwear 2025,https://www.youtube.com/watch?v=7USc9--zXXE,1774501212,"December 5, 2025",
youtube,streetwear 2025,https://www.youtube.com/watch?v=smSY2xd3goM,1774498926,Green Islands Apparel @ CaboVerdean Fashion Week Boston 2025,Green Islands Apparel x Cabo Verdean Fashion Week ✨ From the heart of the diaspora to the runway! We are incredibly ...
youtube,streetwear 2025,https://www.youtube.com/watch?v=12XuyWCpALQ,1774399334,22 Desember 2025,
