source,query,url,created_utc,title,text
youtube,men's fashion trends,https://www.youtube.com/watch?v=Tyyw4PHSKdY,1773405043,mens pants correct names #fashiontrends #fashion #fashionstyle,MY FASHION INSTAGRAM = https://www.instagram.com/stylesaiyan01?utm_source=qr&igsh=MTdhdDBwdzM1OXFyYQ== MY ...
youtube,men's fashion trends,https://www.youtube.com/watch?v=uPSLrfbD_Jg,1773404316,Title: Unboxing: Men&#39;s Fragrance-Free Attire - The Ultimate Men&#39;s Fashion Roundup for Wome,"Tags: men's fashion, fragrance-free clothing, women's style, unboxing, fashion review, men's attire, men's wear, style tips ..."
youtube,men's fashion trends,https://www.youtube.com/watch?v=O-Ytcxm_5Os,1773403252,TENDENCIAS 2026 MODA MASCULINA-GUIA DEFINITIVA-TODO LO QUE SE VA A USAR ESTE AÑO,En este video te muestro todas las tendencias en moda masculina 2026 que van a dominar el año. Repasamos las prendas ...
youtube,men's fashion trends,https://www.youtube.com/watch?v=6wgpx4XopqM,1773382800,The Best Men Round Neck Cotton T-shirt You&#39;ll Ever Need | Dev Creation,The Best Men Round Neck Cotton T-shirt You'll Ever Need | Dev Creation Upgrade your look with a Men Round Neck Cotton ...
youtube,men's fashion trends,https://www.youtube.com/watch?v=8ZE6uI6DTgA,1773381349,#fashion #zaracasual #mensfashion #sale #onlineshopping #newfashionbrand #mensstyle #fashiontrends,
youtube,men's fashion trends,https://www.youtube.com/watch?v=ZEn1ns1ZK-8,1773379521,Sepatu pantofel pria model docmart Servodio #sepatu #pantofel #docmart #fashion #fashiontrends,
youtube,men's fashion trends,https://www.youtube.com/watch?v=PIVw9VY_qBo,1773373500,Bell Bottom Jeans For Men Best Quality  Denim Look 2026 #gwalior  #fashion #jeans #menswear   #pants,"Bellbottom Jeans – retro style with a modern twist ✨. Perfect for parties, casual outings, and a bold fashion statement. Pair it with ..."
youtube,men's fashion trends,https://www.youtube.com/watch?v=jIX4LkQcda4,1773370184,fashion week #hoodieq #plussizemenswear #fashion #outfit #mensstyle #fashiontrends #youtube #best,"Welcome to Fashion Xpress — your fast and stylish destination for the latest fashion trends! Yahan aapko milte hain outfit ideas, ..."
youtube,men's fashion trends,https://www.youtube.com/watch?v=C9w7DzTP2b8,1773365408,👕 3 best shirt for men 🔥 #shirts #fashion #outfit,"3 best shirt for men #shirts #fashion #outfit best t-shirts for men, best shirt for indian men in hindi, 3 best polo t-shirts for men's ..."
youtube,men's fashion trends,https://www.youtube.com/watch?v=wdhWMJ6Cp4I,1773364934,Men’s Fashion Trends 2026 #menswear #mensfashion #fashiontrends #fashion #style #shorts #streetwear,"Looking into the men's fashion trends for 2026, there is no doubt that the motorsport fashion trend is gaining more and more ..."
youtube,men's fashion trends,https://www.youtube.com/watch?v=6TXnjE8wEic,1773357916,FW2026 | Men&#39;s fashion | VELORIN,"Confidence, elegance, and bold fashion come together in this stunning runway moment. The flowing long coat, relaxed tailored ..."
youtube,men's fashion trends,https://www.youtube.com/watch?v=1uh3OIk8o4M,1773343269,"Latest men’s shirt collection at FABRECIA 👕 Perfect fit, premium style, limited pieces. #fabrecia","Discover the latest shirt arrivals at FABRECIA Our new collection features premium men's shirts designed for modern style, ..."
youtube,men's fashion trends,https://www.youtube.com/watch?v=-s-6PqKZVHo,1773341460,Men&#39;s fashion Comment for link#fashion #fashionstyle #fashiontrends #fashionista,
youtube,men's fashion trends,https://www.youtube.com/watch?v=eTGqyapTD9k,1773339553,2026 fashion hot takes,"Today we're breaking down the most controversial fashion hot takes of 2026. From overrated trends to unpopular opinions, ..."
youtube,men's fashion trends,https://www.youtube.com/watch?v=brhIbn-DjFA,1773330660,Best Men&#39;s Haircuts 🔥 Choose Your Hairstyles #viral #fashion #shorts,Looking for the perfect men's haircut? Discover these stylish and trending hairstyles for men that can instantly upgrade your look.
youtube,men's fashion trends,https://www.youtube.com/watch?v=LBrRYK80uWo,1773328504,viral Song❤️🔥#shortsviral #shortvideo #reelitfeelit #reelsindia #fashiontrends #trendingshorts,
youtube,men's fashion trends,https://www.youtube.com/watch?v=HEnqDzlygHQ,1773327582,Order now☎️-9992180912 #tshirts #premiumquality #worldwideshipping #fashion #fashiontrends #shirts,Premium quality men's T-shirts available at Men's Villa Jhansa. Eh T-shirts comfortable fabric te stylish design naal bani hoyi hai ...
youtube,men's fashion trends,https://www.youtube.com/watch?v=XgZgixOzLVQ,1773327543,💫🤩New Trendy Outfit😎#shorts#viral #fashion #trend #style #stylewithanupam #trending #attitude,stylish ethnic outfit For Men's Boy's upgrade style and attitude. #unboxing #onlineshopping #mensfashion #ootd #fashion ...
youtube,men's fashion trends,https://www.youtube.com/watch?v=W_MzlZXt3MM,1773326336,Men&#39;s Accessories That Boost Your Looks😎|Men Wear| #watch #shorts,Men's Accessories That Boost Your Looks  |Men Wear| #watch #shorts Here is your product link (press long on the link to ...
youtube,men's fashion trends,https://www.youtube.com/watch?v=FP1fmyT3E6w,1773325841,"₹ 200 lo OUTFIT, fashion EXPENSIVE kadhu 👔","JOIN THE PROTEAN COLLECTIVE Best apparel offers, exclusive links, and na nunchi style updates. Join our Instagram ..."
youtube,men's fashion trends,https://www.youtube.com/watch?v=ke5KFDXZy00,1773325076,ТОП 5 МУЖСКИХ ТРЕНДОВ 2026 | Мужская Мода 2026 | Мужской Стиль 2026,Стилист подберёт образ из модной одежды за 30 минут - https://clck.ru/3SVPsf Запишись на бесплатную консультацию ...
youtube,men's fashion trends,https://www.youtube.com/watch?v=mKRNMf6xFZU,1773325106,Menswear Runway 2026 | LV Designer Fashion Show | VELORIN,"From powerful dark suits to high-end accessories, every look represents the evolution of luxury men's fashion in 2026. Welcome to ..."
youtube,men's fashion trends,https://www.youtube.com/watch?v=gVcHzzDXAag,1773323740,Upcoming Fashion Trends &amp; Styles You Can’t Ignore | Podcast With AAshi,"Upcoming Fashion Trends & Styles You Can't Ignore Fashion is constantly evolving, and staying updated with the latest trends ..."
youtube,men's fashion trends,https://www.youtube.com/watch?v=-Fa-X9tQoIY,1773322885,“Top 10 Stylish Men’s Shirts 2026 | Latest Fashion Shirts for Boys”,Top 10 Stylish Men's Shirts 2026 | Latest Fashion Shirts for Boys” Welcome to our channel! In this video you will see the latest ...
youtube,men's fashion trends,https://www.youtube.com/watch?v=P41uOhmLceQ,1773232237,Westside Summer Haul 2026 | Best Summer Outfits for Men | BeYourBest Fashion by San Kalra,Westside Summer Haul 2026 | Best Summer Outfits for Men | BeYourBest Fashion by San Kalra Join Discord ...
youtube,women's fashion trends,https://www.youtube.com/watch?v=F6mNnSRwJ9c,1773402225,Women&#39;s Pleated Kali Skirt Easy ✂️ #viralshorts #fashion #diy #sewing #fashiontrends,Women's Pleated Kali Skirt Easy ✂️ #viralshorts #fashion #diy #sewing #fashiontrends.
youtube,women's fashion trends,https://www.youtube.com/watch?v=O_CpuiAWiZ8,1773401865,Bairi 😎🤠😇 #kavya #comedy #funny #love #video #kavyalifestyle #fashiontrends #youtube #song #cutelook,New song.
youtube,women's fashion trends,https://www.youtube.com/watch?v=43BnXEJvXRw,1773400466,kahin ghoom Aaye Jahan bhi kaho Tum #fashiontrends #song #song #titlesong #shorts #dance #😍👌😍👌😍👌😍,
youtube,women's fashion trends,https://www.youtube.com/watch?v=1biaoxj1Gpg,1773386976,Trending winter coat design stylish women fashion look#shorts#new#video#viral,Stylish women winter coat fashion. Beautiful short coat design perfect for winter outfits. Trendy ladies coat style that looks elegant ...
youtube,women's fashion trends,https://www.youtube.com/watch?v=YCtJcPxYb1c,1773386924,Trending winter coat design stylish women fashion look#shorts#new#video#viral,Stylish women winter coat fashion. Beautiful short coat design perfect for winter outfits. Trendy ladies coat style that looks elegant ...
youtube,women's fashion trends,https://www.youtube.com/watch?v=9h2aM_lHsB0,1773386374,wedding Guest outfit 😍 #viral #wedding #meesho #outfit #affordable #affordable #trend #fashion,"Welcome to **Style on Budget** Here you'll find **trendy outfits, affordable fashion finds, and stylish outfit inspiration** for girls ..."
youtube,women's fashion trends,https://www.youtube.com/watch?v=8K100zeIJjc,1773386084,"2026,Women,s Fashion Stylish Winter Scarves &amp; Caps ❄️ | Trending Fashion Worldwide #shorts","Women,s Fashion Stylish Winter Scarves & Caps ❄️ | Trending Fashion Worldwide #shorts Stay warm and look stylish this ..."
youtube,women's fashion trends,https://www.youtube.com/watch?v=uq1qPdQTU04,1773384922,"Women,s Fashion Stylish Winter Scarves &amp; Caps ❄️ | Trending Fashion Worldwide 🌍#shorts","Women,s Fashion Stylish Winter Scarves & Caps ❄️ | Trending Fashion Worldwide #shorts Stay warm and look stylish this ..."
youtube,women's fashion trends,https://www.youtube.com/watch?v=EbAhRl2fohE,1773384722,Оранжеві окуляри — тренд весни 2026. Але чи готові всі їх носити? #тренди2026 #fashiontrends #fw26,
youtube,women's fashion trends,https://www.youtube.com/watch?v=mjfYST3Myrk,1773379367,colours available💥💫🥳💃✨️#shivshahipaithani #fashiontrends#viralreel#saree #love#onlineshopping#shorts,
youtube,women's fashion trends,https://www.youtube.com/watch?v=i0cRh4LkgrY,1773379237,new trending shorts video 😊🌹#shortvideos #funny #fashiontrends #youtube #comedy,
youtube,women's fashion trends,https://www.youtube.com/watch?v=AgD_sLT8G9E,1773378008,Spring 2025 Fashion Trends What to Wear &amp; What to Skip !,"Discover the Spring 2025 fashion trends that instantly make your outfits look elegant and modern. In this video, we explore what to ..."
youtube,women's fashion trends,https://www.youtube.com/watch?v=GZPNZxTM_pQ,1773376346,trending cord set... 🥰 #trending #kurtisbusiness #fashion #kurtisstyle #fashionstyle #fashiontrends,
youtube,women's fashion trends,https://www.youtube.com/watch?v=pGetxIuWbcQ,1773376237,#fashion #model #beauty #beautiful #stitch #woodenbuilding #fashiontrends #ootd #outfit #fashionsty,Get ready to turn heads with the latest fashion trend! This stunning jumpsuit is perfect for stylish girls who want to make a ...
youtube,women's fashion trends,https://www.youtube.com/watch?v=0Z0Mg-42_GU,1773373216,Zendaya Chić Glowy Slay @ Essence Black Women In Hollywood Awards #zendaya #fashionpolice #essence,Zendaya Chić Glowy Slay @ Essence Black Women In Hollywood Awards #bwih #blackwomeninhollywood #blackhollywood ...
youtube,women's fashion trends,https://www.youtube.com/watch?v=TwvMBzDi2Xw,1773371362,Tendencias de Moda SS26 SHEIN,"Busca ""Trends"" en SHEIN para las tendencias de Moda SS26 Links Store Name:Jasmine Jewelry 148161641 ..."
youtube,women's fashion trends,https://www.youtube.com/watch?v=zozR_5UQsFw,1773371027,Sangeethasilk#saree #trendingshorts #reels #trending #shorts #shortvideo #short#kurti#fashiontrends,
youtube,women's fashion trends,https://www.youtube.com/watch?v=RX8qPhtkmS8,1773370209,Last transition! #relatable #transition #ootdguide #fashiontrends #grwm #fashion,
youtube,women's fashion trends,https://www.youtube.com/watch?v=-6GN8ZAZkY4,1773369548,Ik this isn’t a good representation 💔 #relatable #ootd #fashiontrends #grwm #granolastyle,
youtube,women's fashion trends,https://www.youtube.com/watch?v=0KDsNIHumnE,1773369420,Jabse bole koilariya🥰😊#shorts #ytshorts #bhojpuri #fashiontrends #dance #trending #youtubeshorts,Jabse bole koilariya    #shorts #ytshorts #bhojpuri #fashiontrends #dance #trending #youtubeshorts . . . Please support me   ...
youtube,women's fashion trends,https://www.youtube.com/watch?v=EVv4U9pvSnI,1773369179,My life #xuhuongyoutube #fashiontrends #travel #bestplayer,
youtube,women's fashion trends,https://www.youtube.com/watch?v=2oWXiZIRs-A,1773367186,Black Dresses #shorts #reels #ootd #outfit #style #fashion #fashiontrends #foryou #foryoupage,
youtube,women's fashion trends,https://www.youtube.com/watch?v=IqXOTWu6bM4,1773367224,Style Sakhi | Ladies Fashion &amp; Footwear Trends🧡💛💚 #shoes,"Welcome to Style Sakhi Your go-to destination for latest ladies fashion, trendy footwear, and daily styling ideas. Here you'll find ..."
youtube,women's fashion trends,https://www.youtube.com/watch?v=E7e61ZXZnao,1773366853,Choose one your favourite #shorts #reels #ootd #outfit #style #fashion #fashiontrends #foryou,
youtube,women's fashion trends,https://www.youtube.com/watch?v=Vko40egMOtw,1773365808,Get ready with me #shorts #reels #ootd #outfit #style #fashion #fashiontrends #foryou #foryoupage,
youtube,streetwear 2025,https://www.youtube.com/watch?v=SdlQVkB_y2U,1773349610,Best Streetwearbrands in 2026🔥 #streetwear #streetwearbrands,"Streetwear inspo 2025 From hoodies, jorts, caps to the latest sneaker drops – this Short brings you the best streetwear ..."
youtube,streetwear 2025,https://www.youtube.com/watch?v=k4TOkYVTx-4,1773314100,Isis Fashion Awards 2025 – Luxury Collection Unveiled ✨,Step into the world of street fashion and style inspiration ✨. Today's video showcases stunning outfit looks that turn everyday ...
youtube,streetwear 2025,https://www.youtube.com/watch?v=V_TiKiFrYQI,1773252385,Where to buy the best Denims in 2026💯#streetwear #denims,"Streetwear inspo 2025 From hoodies, jorts, caps to the latest sneaker drops – this Short brings you the best streetwear ..."
youtube,streetwear 2025,https://www.youtube.com/watch?v=5yv0119pe18,1773209728,#football #soccer #worldcup #footballshirt Juventus 2025-26 del Piero Special Jersey S-4XL,
youtube,streetwear 2025,https://www.youtube.com/watch?v=rZZw6zQbPQI,1773087119,Best Streetwearhoodie you mus buy for 2026🔥#streetwear #hoodies,"Streetwear inspo 2025 From hoodies, jorts, caps to the latest sneaker drops – this Short brings you the best streetwear ..."
youtube,streetwear 2025,https://www.youtube.com/watch?v=j1t-ie8czHU,1773086428,"Fashion Trips at the end of 2025 w/ Represent Clo, Sevenstore &amp; Adidas and Duke + Dexter",Closing out 2025 with a Manchester fashion vlog. In this video I head to the Represent Manchester store to check out the ...
youtube,streetwear 2025,https://www.youtube.com/watch?v=opsb6Tcq0dw,1772945509,2025 Djessi windbreaker #djessi #parisstyle #streetwear #clothingbrand #clothing #fashion #music,
youtube,streetwear 2025,https://www.youtube.com/watch?v=j12yUNOFn-o,1772896324,MRMRDurban Est.2025 – Streetwear drops you can’t miss! 🔥👕🧥 coming soon,"Level up your streetwear game with MRMRDurban Est.2025! Shop our hoodies, T-shirts, caps, and more. Limited drops."
youtube,streetwear 2025,https://www.youtube.com/watch?v=ybRe-Xpm2-Q,1772892943,2025 Camel Car Cigarette TShirt Vintage Cotton Tshirts Short Sleeve Streetwear Womens Men Motorspor,2025 Camel Car Cigarette TShirt Vintage Cotton Tshirts Short Sleeve Streetwear Womens Men Motorspor Buy here ...
youtube,streetwear 2025,https://www.youtube.com/watch?v=9_qZe14T_UM,1772842832,@fonkicheff  en Aguascalientes 2025  #dj #nestorsalazar #concertphotography #streetwear,Tuve la oportunidad de tomar fotos en la presentación de Fonki Cheff en Aguascalientes.
youtube,streetwear 2025,https://www.youtube.com/watch?v=akZSW1wfaCU,1772802916,2025 Hot Anime Arcane Jinx T Shirt Hip Hop Washed Cotton TShirt Men Women Tops Oversized Streetwear,2025 Hot Anime Arcane Jinx T Shirt Hip Hop Washed Cotton TShirt Men Women Tops Oversized Streetwear Buy here ...
youtube,streetwear 2025,https://www.youtube.com/watch?v=Gx4drux2-Lk,1772794359,Womens Y2K Cropped Tank Top Sexy Graphic TShirt Fashion Printed Sweatshirt Streetwear Summer 2025 T,Womens Y2K Cropped Tank Top Sexy Graphic TShirt Fashion Printed Sweatshirt Streetwear Summer 2025 T Buy here ...
youtube,streetwear 2025,https://www.youtube.com/watch?v=uf7Oy3pZ8LQ,1772784149,😤 Men&#39;s streetwear in 2025 has completely changed — and most guys haven&#39;t caught up yet.,The oversized-everything era isn't dead. But it has evolved. The fits winning right now are mixing relaxed volume with unexpected ...
youtube,streetwear 2025,https://www.youtube.com/watch?v=oJe38aJ2Vig,1772753790,Best of TikTok dances if 2025 #streetwear #fashion,
youtube,streetwear 2025,https://www.youtube.com/watch?v=jBfFSp6lPMw,1772749793,ALL GONE: The Finest of Street Culture 2025  &quot;unwrapped&quot;,"https://kingsdavis.medium.com/ Love from Brooklyn ""ALL GONE "" by Futura 2000 'Atomic Rings' edition just delivered ..."
youtube,streetwear 2025,https://www.youtube.com/watch?v=7LSPTxBUqeE,1772749565,Good Graphic Shirts you must buy for 2026🔥#streetwear #graphictee,"Streetwear inspo 2025 From hoodies, jorts, caps to the latest sneaker drops – this Short brings you the best streetwear ..."
youtube,streetwear 2025,https://www.youtube.com/watch?v=diXPLIuY6Tg,1772746957,Men&#39;s Straight Cargo Pants 2025 Spring / Summer: Elastic Waist Streetwear,"Exclusive deal alert! Men's Straight Cargo Pants 2025 Spring / Summer: Elastic Waist Streetwear, available for a limited time at the ..."
youtube,streetwear 2025,https://www.youtube.com/watch?v=Ve5FIwhcmC8,1772722558,"&quot;2025 Streetwear Vibes: Edgy Graphics, Bold Cargoes, and Celebrity Style Icons",
youtube,streetwear 2025,https://www.youtube.com/watch?v=79I4roMWnFk,1772720151,2025 Vintage High Waist Flare Jeans Women Autumn Streetwear Y2K Denim Trousers Female Sexy Slim Fit,2025 Vintage High Waist Flare Jeans Women Autumn Streetwear Y2K Denim Trousers Female Sexy Slim Fit Buy here ...
youtube,streetwear 2025,https://www.youtube.com/watch?v=BK4VkBlWLoU,1772719612,Fujii Kaze Europe and North America Tour 2025 Hoodies Long Sleeve Streetwear Cosplay Women Men Hood,Fujii Kaze Europe and North America Tour 2025 Hoodies Long Sleeve Streetwear Cosplay Women Men Hood Buy here ...
youtube,streetwear 2025,https://www.youtube.com/watch?v=PwYk_jcrVtY,1772718958,2025Fashion lapel denim jacket asymmetrical design womens denim coat loose casual streetwear outerw,2025Fashion lapel denim jacket asymmetrical design womens denim coat loose casual streetwear outerw Buy here ...
youtube,streetwear 2025,https://www.youtube.com/watch?v=G--CrdmZndA,1772716896,Fashion Jackets for Women Streetwear Winter 2025 New Puffer Long Sleeve Zip Up Stand Collar Crop Bu,Fashion Jackets for Women Streetwear Winter 2025 New Puffer Long Sleeve Zip Up Stand Collar Crop Bu Buy here ...
youtube,streetwear 2025,https://www.youtube.com/watch?v=4WSgLgw2w4c,1772715568,Women Streetwear Letter Embroidery Brown Y2k Baggy Jeans 2025 Harajuku Vintage Denim Trousers Japan,Women Streetwear Letter Embroidery Brown Y2k Baggy Jeans 2025 Harajuku Vintage Denim Trousers Japan Buy here ...
youtube,streetwear 2025,https://www.youtube.com/watch?v=6_U-cqsnKTE,1772711943,Fall 2025 Fashion Tracksuit 3 Piece Sets Womens Streetwear Stripe Patchwork Long Sleeve Jacket Tops,Fall 2025 Fashion Tracksuit 3 Piece Sets Womens Streetwear Stripe Patchwork Long Sleeve Jacket Tops Buy here ...
youtube,streetwear 2025,https://www.youtube.com/watch?v=UUWih3a1Tos,1772705827,Punk Fashion 1980s - 2025 #punk #fashion #streetwear #subculture #history,
