source,domain,url,created_utc,title,text,query
youtube,,https://www.youtube.com/watch?v=d1gM1sPaGss,1781329174,#pantoutfit#trendingshorts #fashion #viralvideo #ytshorts #like,Your Style Request     outfit ideas     outfit ideas for girls   outfit ideas from meesho outfit ideas men outfit ideas for women     ...,men's fashion trends
youtube,,https://www.youtube.com/watch?v=Ii04oVoQhiU,1781327494,Blockecore trend🔥 is here! 🇧🇷⚡️ #grwm #shortsindia,Styling this viral Brazil football jersey with oversized baggy jeans. Rate this blockecore streetwear look from 1 to 10!,men's fashion trends
youtube,,https://www.youtube.com/watch?v=D-Fr93Geih8,1781324033,subscribe krlo guys🧿💗#outfit #outfitideas #outfitstyle #meesho #fashionstyle #fashion #fashiontrends,,men's fashion trends
youtube,,https://www.youtube.com/watch?v=y03AJ4oYD-Y,1781375437,#humor #usa #foryou #fyp #love #crazyfashion #shorts #viral #youtubeshorts #fashiontrends,,women's fashion trends
youtube,,https://www.youtube.com/watch?v=oj9_CedsQK0,1781370023,Could it get better 🤩 #fashiontrends #dressootd #womensfashion,,women's fashion trends
youtube,,https://www.youtube.com/watch?v=Cme6liTgvco,1781370033,#humor #usa #foryou #fyp #love #crazyfashion #shorts #viral #youtubeshorts #fashiontrends,,women's fashion trends
youtube,,https://www.youtube.com/watch?v=8Nz6ZcKnusY,1781369580,follow + comment link on Instagram to get this look,Elegant Black Office Wear Outfit | Classy Women Fashion | Meesho Fashion Trends 2026 Elegant black and white office wear ...,women's fashion trends
youtube,,https://www.youtube.com/watch?v=a6DRorM8WJ4,1781368803,Modern Talking..🌸🧿 #trend #trending #viral #fashion #grwm #style #styleinspo #fashiontrends,Modern Talking..     #trend #trending #viral #fashion #grwm #style #styleinspo #fashiontrends #everydayfashion ...,women's fashion trends
youtube,,https://www.youtube.com/watch?v=wdyr9_YMkOk,1781366422,#humor #usa #foryou #fyp #love #crazyfashion #shorts #viral #youtubeshorts #fashiontrends,,women's fashion trends
youtube,,https://www.youtube.com/watch?v=IGxzwGZRdzY,1781366087,💞 H&amp;M NEW SUMMER 2026 COLLECTION ARRIVALS 🩵 FEMININE WOMEN&#39;S FASHION,H&M NEW SUMMER 2026 COLLECTION ARRIVALS FEMININE WOMEN'S FASHION H&M is a popular fashion brand offering ...,women's fashion trends
youtube,,https://www.youtube.com/watch?v=4RQo4ZcZMtw,1781365573,🔥 Stylish Printed Kurti Palazzo Set Design | Latest Fashion Look ✨#fashion #trend #short,"Beautiful printed Kurti Palazzo Set design for women. Simple, elegant and comfortable outfit for daily wear, office wear and ...",women's fashion trends
youtube,,https://www.youtube.com/watch?v=t2lEAM5IyPA,1781365106,The outfit 🤍|| @Meesho #shorts #styleinspo #ootdguide #fyp #fashion #indianfashion #ootd,"Casual Fusion Outfit Lookbook | Peach Kurti + Wide Leg Jeans Styling In today's fashion lookbook, I'm styling a beautiful peach ...",women's fashion trends
youtube,,https://www.youtube.com/watch?v=jJK18NonWW0,1781364601,How strange were women’s fashion trends in the 1930s?—2 #foryou #historia #knowledge #1930s #trend,,women's fashion trends
youtube,,https://www.youtube.com/watch?v=6QMvarnhXbo,1781364601,Affordable Party Wear Sarees Under ₹199 #fyp #saree #women #fashion #ytshorts,Shorts #YouTubeShorts #ViralShorts #TrendingShorts #ShortsViral DigitalMarketing #MarketingTips #BusinessGrowth ...,women's fashion trends
youtube,,https://www.youtube.com/watch?v=W6AeJziAIbQ,1781364641,Fashion Trends &amp; Style Inspiration,"Welcome to Trend Era! Discover the latest fashion trends, outfit inspiration, style tips, and accessories for women and men.",women's fashion trends
youtube,,https://www.youtube.com/watch?v=N-NVNLt4EkI,1781362807,How strange were women’s fashion trends in the 1930s? #foryou #historia #knowledge #1930s #trend,,women's fashion trends
youtube,,https://www.youtube.com/watch?v=s5QlCfCpAlw,1781362833,Celana Daleman Gamis Haji Umroh Wanita #fashiontrends #fashion #celanaumroh #celanawanita,,women's fashion trends
youtube,,https://www.youtube.com/watch?v=dU-qz8ilYvU,1781362806,Trending Footwear &amp; Style Searches 2026 | Ladies Shoes &amp; Sandals Fashion Trends,"Discover the Top Footwear & Style Searches of 2026! In this video, we explore the most popular and highly searched ladies shoes ...",women's fashion trends
youtube,,https://www.youtube.com/watch?v=VCCCESgBrpw,1781362810,#humor #usa #foryou #fyp #love #crazyfashion #shorts #viral #youtubeshorts #fashiontrends,,women's fashion trends
youtube,,https://www.youtube.com/watch?v=hlewWUpm27U,1781361078,Royal Blue Ethnic Look 💙✨ Wedding Ready Outfit #shorts #fashion #ethnicwear #viral #shorts #trend,"POV: You finally found the perfect wedding guest outfit ✨ This royal blue ethnic ensemble is all about elegance, grace, and ...",women's fashion trends
youtube,,https://www.youtube.com/watch?v=myYz8ILuys4,1781361020,Latest Women&#39;s Fashion 2026 😍 | Kurti Jeans Styling Ideas ✨ #shorts #youtubeshorts #viral #fashion,"Looking for the perfect outfit inspiration? This stunning fashion look combines a stylish kurti, trendy jeans, elegant earrings, and ...",women's fashion trends
youtube,,https://www.youtube.com/watch?v=sWp9c1Pc88k,1781360662,#minimalism #outfit  #moda  #explore  #fashion  #fashiontrends,,women's fashion trends
youtube,,https://www.youtube.com/watch?v=Oay__mNnVJE,1781360663,🔥 TRENDING WOMEN&#39;S A-LINE DRESSES COLLECTION 2026 🔥#Meesho #meeshofinds #meeshofashion #meesho,TRENDING WOMEN'S TOPS COLLECTION 2026 ✨ New Arrivals You Can't Miss! ✨ Stylish • Comfortable • Trendy ...,women's fashion trends
youtube,,https://www.youtube.com/watch?v=sxfCCbtP8ww,1781359743,Sexy Butterfly Lace Transparent Panties 💖 Elegant Mesh Lingerie Fashion #Shorts,"Sexy butterfly lace transparent panties pink mesh lingerie, women fashion trend, aesthetic underwear, stylish lace panty, ...",women's fashion trends
youtube,,https://www.youtube.com/watch?v=BdLM7QmBqk0,1781359715,Sexy Butterfly Lace Transparent Panties 💖 Elegant Mesh Lingerie Fashion #Shorts,"Sexy butterfly lace transparent panties pink mesh lingerie, women fashion trend, aesthetic underwear, stylish lace panty, ...",women's fashion trends
youtube,,https://www.youtube.com/watch?v=9YDTuvtjuaM,1781359770,Sexy Butterfly Lace Transparent Panties 💖 Elegant Mesh Lingerie Fashion #Shorts,"Sexy butterfly lace transparent panties pink mesh lingerie, women fashion trend, aesthetic underwear, stylish lace panty, ...",women's fashion trends
youtube,,https://www.youtube.com/watch?v=dWHpCfR7W3g,1781359675,Sexy Butterfly Lace Transparent Panties 💖 Elegant Mesh Lingerie Fashion #Shorts,"Sexy butterfly lace transparent panties pink mesh lingerie, women fashion trend, aesthetic underwear, stylish lace panty, ...",women's fashion trends
youtube,,https://www.youtube.com/watch?v=7yndwMT5g88,1781359590,Sexy Butterfly Lace Transparent Panties 💖 Elegant Mesh Lingerie Fashion #Shorts,"Sexy butterfly lace transparent panties pink mesh lingerie, women fashion trend, aesthetic underwear, stylish lace panty, ...",women's fashion trends
youtube,,https://www.youtube.com/watch?v=IAhcpreya2U,1781361071,Jordan 4 black cat 2025💫💫#viral #jordans #FYP #blackcat #streetwear,"short #sneakerhead #unboxing Leave me size!!! Hello! My friend, if want this goods add our whatsapp:+86 152 6026 8083.",streetwear 2025
youtube,,https://www.youtube.com/watch?v=Xsi9YC8glqM,1781185884,OnSize - A költözés - 2025.December,Webshop: https://onsize.eu/ Megnyílt az OnSize első boltja Budapesten az Andrássy út 43. szám alatt. Várunk titeket sok ...,streetwear 2025
youtube,,https://www.youtube.com/watch?v=QTDDc204Rf8,1781121778,Inside the Bold Golf Show at Ireland Fashion Week 2025 ⛳️,"Kicking off Ireland Fashion Week 2025, and taking over Teeling Whiskey Distillery in the process, Bold Gold redefine classic Golf ...",streetwear 2025
youtube,,https://www.youtube.com/watch?v=GbM0NA3mCnY,1781121625,Inside the Bolf Golf Show at Ireland Fashion Week 2025 ⛳️,"Kicking off Ireland Fashion Week 2025, and taking over Teeling Whiskey Distillery in the process, Bold Gold redefine classic Golf ...",streetwear 2025
youtube,,https://www.youtube.com/watch?v=INDdxvvfM2g,1781121448,Behind-the-scenes at the Ireland Fashion Week 2025 Bold Golf Sportswear Show ⛳️,"Kicking off Ireland Fashion Week 2025, and taking over Teeling Whiskey Distillery in the process, Bold Gold redefine classic Golf ...",streetwear 2025
youtube,,https://www.youtube.com/watch?v=ttzwemi4E8s,1781097730,🔥 New Trending Black Denim Shorts 2025 | Stylish Streetwear Fashion You Need to See! 😍🖤#shorts,Discover the latest black denim shorts making waves in street fashion! ✨ Featuring a bold graphic design and modern ...,streetwear 2025
youtube,,https://www.youtube.com/watch?v=Y63TLdYMw3c,1781001988,Jordan 4 black cat 2025.      #sneakers #fashion #nike #nikeaj1  #fyp #streetwear #style #shoes,,streetwear 2025
youtube,,https://www.youtube.com/watch?v=pov9SUIAc2o,1780928559,Stylish Black &amp; Yellow Track Pant 🔥 New Trending Jogger 2025,Latest Black Track Pant with Yellow Side Stripes Looking for a stylish and comfortable track pant? This premium black jogger ...,streetwear 2025
youtube,,https://www.youtube.com/watch?v=a1vLkzJMInY,1780833600,2025 Streetwear Trends,"Streetwear fashion in 2025 evolves into a dynamic and futuristic style driven by urban culture, comfort, and sustainability. Discover ...",streetwear 2025
youtube,,https://www.youtube.com/watch?v=TXqZGGorAMI,1780762521,Recreating the worst outfit from 2025.     #fashiontrends #fashion #streetwear,,streetwear 2025
youtube,,https://www.youtube.com/watch?v=yUbjCBjijeA,1780755670,Vintage Washed Shacket for Men 🔥 | Best Men&#39;s Shacket 2025 | Indian Streetwear Brand  #shacket,Vintage Washed Shacket for Men | Incroy & Merv SS25 Collection Looking for the perfect shacket outfit for men? This vintage ...,streetwear 2025
youtube,,https://www.youtube.com/watch?v=r3QcBa7o32k,1780695360,Sneaker Con 2025 Legit Check | MIH DINO Mesh Hat,"At Sneaker Con 2025, one of the most recognized legit check personalities took a closer look at our MIH ART IS A CRIME DINO™ ...",streetwear 2025
youtube,,https://www.youtube.com/watch?v=pS8JObNfhcc,1780645071,2025,"Don't forget to follow us on Instagram @lifted.limited for more content, and subscribe to our channel for the latest updates. DM TO ...",streetwear 2025
youtube,,https://www.youtube.com/watch?v=MY46sKbeMDI,1780623479,POV: 2026 NFL Draft Rookies Pull Up To Showroom LA 🏈🔥,POV: The 2026 NFL Draft's hottest rookie class just pulled up to Showroom LA for a PRIVATE Rookie Premiere — and the energy ...,streetwear 2025
youtube,,https://www.youtube.com/watch?v=tS9jeYnObOY,1780565144,Best shorts summer 2025#shorts # summer2025#шорты #baggy#bestshorts,,streetwear 2025
youtube,,https://www.youtube.com/watch?v=MXc7iRYfgF4,1780563621,Established in 2025. Made for eternity. | DELVASTRO,Rate the fit from 1 to 10. Secure early access via Link in Bio.,streetwear 2025
youtube,,https://www.youtube.com/watch?v=OUugQobmnXs,1780557993,"AmaxluluE Streetwear 2025, warme Luxus-koreanische Damen-Wi... — Top Pick 2026 | Unbeatable Price!","AmaxluluE Streetwear 2025, warme Luxus-koreanische Damen-Winterjacke, Damen-Kapuze, langer, übergroßer, gepolsterter ...",streetwear 2025
youtube,,https://www.youtube.com/watch?v=HEjTE631KdQ,1780557191,Men’s White Graphic Chunky Sneakers | Ultra Cushion Streetwear Platform Shoes 2025 #shoes #撈底 #nike,Looking for versatile streetwear sneakers that match every outfit? Our new graphic platform chunky shoes are crafted for modern ...,streetwear 2025
youtube,,https://www.youtube.com/watch?v=oTF-1GwKqF0,1780506432,Eigenen Style finden | Part 2 (Hose) | 26.05.2025,Song: sakuracloud - miffy cafe Music provided by NoCopyrightSounds Free Download/Stream: Watch:,streetwear 2025
youtube,,https://www.youtube.com/watch?v=6I2CgIIiftI,1780502671,Jerseys Under ₹999 in India 2025🔥|Link in bio.#shorts #shoes #drip #fashion #amazonfinds #streetwear,,streetwear 2025
youtube,,https://www.youtube.com/watch?v=Kacb2mavPx8,1780497928,AJ 12 Flu Game 2025 On-Hand &amp; In-Depth Review! #sneakerslovers #sneakers,THE HOLY GRAIL IS IN THE BUILDING! AJ 12 Flu Game 2025 On-Hand & In-Depth Review! The wait is officially over! Today ...,streetwear 2025
youtube,,https://www.youtube.com/watch?v=x3bkU3qbIZk,1780495231,British Fashion Evolution (1900–2025) 👗🇬🇧 | 125 Years of Style in 60 Seconds!#shorts,British Fashion Evolution (1900–2025) | 125 Years of Style in 60 Seconds!#shorts Watch the incredible transformation of ...,streetwear 2025
youtube,,https://www.youtube.com/watch?v=jPiraR9InWw,1780481994,✅ Hoodies for streetwear - Ripped Beast Hoodie ( # 3129 ) ‪@MaviGadgets‬,You can also find the product links in our bio @MaviGadgets Product Number: # 3129 Product Name: Ripped Beast Hoodie ...,streetwear 2025
youtube,,https://www.youtube.com/watch?v=lMLltKz5-L0,1780469533,Den havde ALDRIG gået i 2025 og det gjorde den altså heller ikke i 2018 #fyp #foryoupag #foryou #...,Den havde ALDRIG gået i 2025 og det gjorde den altså heller ikke i 2018 #fyp #foryoupag #foryou #fashiontiktok #streetwear.,streetwear 2025
youtube,,https://www.youtube.com/watch?v=XQg9pMxdu5I,1780413073,STREETWEAR @ Inferninho Deluxe Kiki Ball (07/12/2025),Inferninho Deluxe Kiki Ball - Casa de Candaces (07/12/2025) - Recife-PE JÚRI Star Thalligeira 007 (PE) Star Imperatriz Mavi ...,streetwear 2025
