source,query,domain,url,created_utc,title,text
gnews,runway trend,news.google.com,https://news.google.com/rss/articles/CBMijgFBVV95cUxNRXRfeWVCWkdvTF9oaVR3a3Vibm5nb0lyT3pVdnB6NklpTGhTS0EycXUxekMxZnQ0OGdpVnJTYXJrMHRDc0xZQnJhdXRzOWh4Q0hEdDRnek1pRDRBdDd0ZXN2M1c5QW9KMmExeVFMbFk0SkJhUjNWaFNRMEgwakx4TC1uWUtDSkRYOWNOSmNn?oc=5,1774895025,I'm Over Ballet Flats—I'm Styling This Celeb-Approved Sneaker Trend Instead - Marie Claire,I'm Over Ballet Flats—I'm Styling This Celeb-Approved Sneaker Trend Instead - Marie Claire
gnews,runway trend,news.google.com,https://news.google.com/rss/articles/CBMijgFBVV95cUxNazJYNVNINU9MUmtQNkVkM3dlNDIzSE5pXzJhMFVRSHdsRkg1cXVneVEwM1BUYnBHMlNPZjlsUUNsZ1RsNjQ3Q1JIZ3RMUjc4WjcxOWwtZHFRbHFHQXQyUTlmdlFsY092LWlPR0NZYlhUNnFmb3FsWnpUQ0JYVGFxdERkbWF0YVBOZ1RmNDFR?oc=5,1773817200,The 11 Fashion Trends That Define the Fall 2026 Season - Vogue,The 11 Fashion Trends That Define the Fall 2026 Season - Vogue
gnews,runway trend,news.google.com,https://news.google.com/rss/articles/CBMijgFBVV95cUxOM2ctcHdIa2stUWs0NklZVTJHenphVVV6VjlURFJiMFVUVDdKc0dXQ1FfTFh5Z0NRcmdLN241QTdFN1hoSnJkbXdXOGtvc2RBSTd5Q3pOVUpSRHVKZ04yay1EU3hzN28waW5pOVowTktLQ1E5UW5EZDBqOENEOVc1OXowZ0VMc29MWlBjU1Fn?oc=5,1775163263,The Party Heel Trend for Anyone Who Misses Playing Dress-Up - Marie Claire,The Party Heel Trend for Anyone Who Misses Playing Dress-Up - Marie Claire
gnews,runway trend,news.google.com,https://news.google.com/rss/articles/CBMilwFBVV95cUxQSW5YV0EzYzhmRXJsVEhkXzVNZzd1T2xvVVFEclNzM0ZzYldDOEtNM0xUMk5PNDU1T21rVzRob1ZsX1kxMVFqcXcwTHQzWkJsZlFYaXNGeVV4aTZRdFBfNVd3Y2ktRUwyVHlETDVrRjlLY0VpcVJmZFJKdGZHTEJiZDhtR09VTlpNUVltSmphaS1lSlRnX1hr?oc=5,1774508400,Vintage to Vibrant: Spring 2026 fashion trend predictions - The Lantern,Vintage to Vibrant: Spring 2026 fashion trend predictions - The Lantern
gnews,runway trend,news.google.com,https://news.google.com/rss/articles/CBMiggFBVV95cUxOcVlmNFJoT01mOWJmOFNBanVROUcwcVk1cnh2WjJxNFhaVi1lRTJzWlZ1WDlSV2VEMGZlUmNqNndKYTNSY1hwMXYwT0k1aVdraVlMZnNKb0VHbXJpRWliYjhHX3A4WmlSbXUwTTl3UmVGN2o4OXY1c2dNdmFhMzJWT2J3?oc=5,1772956800,16 Spring/Summer 2026 Trends Everyone's Talking About - Who What Wear,16 Spring/Summer 2026 Trends Everyone's Talking About - Who What Wear
gnews,runway trend,news.google.com,https://news.google.com/rss/articles/CBMibEFVX3lxTFBYc2JUNHY5RnU1bGxuVUpENlBpWkZKVkdQZlU3VDBpT21FUl8xeEVXblZ0aUdwTFp3UEZWdHZvc3pNd1pBbVRRc2h0NGlGRXhMQnREc21Hdi1wcVZTSHktLXRZUmRsWEZoYW9JSw?oc=5,1774933200,These Will Be *the* Sandal Styles Every Fashion Person Will Wear in Summer - Who What Wear,These Will Be *the* Sandal Styles Every Fashion Person Will Wear in Summer - Who What Wear
gnews,runway trend,news.google.com,https://news.google.com/rss/articles/CBMiWkFVX3lxTFAxT1lBOTlXQVNNZ2VhU3NHdFdLbFN1QnNCaUVQdk1KMmgwYjZ2WjM1ZW9VdzJFTHBMYWpQVXZSTzBxZEd2dW0yM1Q1NUdsbzgweGltdDEybElodw?oc=5,1774695381,"Goodbye Ballet Flats, Hello Derby Shoes: The French Style To Step Into This Spring - Vogue","Goodbye Ballet Flats, Hello Derby Shoes: The French Style To Step Into This Spring - Vogue"
gnews,runway trend,news.google.com,https://news.google.com/rss/articles/CBMiiAFBVV95cUxQVjF0VjhyQnREakxYZU9ETnFtNWoyM1YwcV9xbGxZYlRVaTZqSWlhc3NKZHhoeExNV29TaldJaG04c1VOVzJQcEdPbGhXV2RTUHU2a1hsS2J1OG1OZ1pWempSNW9fcElIQ2FJNFZ0RW0teDczdk4tallZVnVMd2p3cWtnTGZvM3FW?oc=5,1774335600,Prep! It Coats! Sex Appeal! 10 Trends Set to Define Spring 2026 Fashion - Who What Wear,Prep! It Coats! Sex Appeal! 10 Trends Set to Define Spring 2026 Fashion - Who What Wear
gnews,runway trend,news.google.com,https://news.google.com/rss/articles/CBMidkFVX3lxTFA5WWhxN1JpVVpzTlJCQ2VwZDloNkF0NHU5VmUxaTE4c3NwZ1lISEZBbDdjWGVMZ1VOX0RUUlUwbHdXRUp0R3B5MWNhZ01fTFU5Q2FrMllFYVpXNVF3M0k2TG1Pd1pQb3FpWXdmWkNKWUlYa1Jfc1E?oc=5,1775005449,The ’90s Are Back—These 5 Handbag Trends Prove It - elle.com,The ’90s Are Back—These 5 Handbag Trends Prove It - elle.com
gnews,runway trend,news.google.com,https://news.google.com/rss/articles/CBMif0FVX3lxTE1rV1BQTHFRNjctMVp6MjMyLUk4WUJsRzU5S2dKa1J2NmdfWjlDcDVKMi1pcVNvN1ltTE9FVVJaYmR6aHVVMXhsX3pjel9rSEtrdkdOM1ZrME10eGtqTGdfNjBlR3dwMDVaMkJjcDNfM2UxemtUa0hYTndDYTRuTjg?oc=5,1773990000,RIP Quiet Luxury: FW26 Wants to Be Seen - hypebeast.com,RIP Quiet Luxury: FW26 Wants to Be Seen - hypebeast.com
gnews,runway trend,news.google.com,https://news.google.com/rss/articles/CBMiYkFVX3lxTFBQS1ZESVpuMHZWcmozazBjdVl5dUhuOWlOSUpQR3g3dW1WZDhxcTIzWDEtR0xWa3B5THRKenlnUmZaS0d0V3hzZlFyRGtIWnYtLVR4bXo4NTBNWDhOZGFYREpn?oc=5,1774888800,15 Refreshing Floral Dress Trends for Spring That Are Actually Groundbreaking - instyle.com,15 Refreshing Floral Dress Trends for Spring That Are Actually Groundbreaking - instyle.com
gnews,runway trend,news.google.com,https://news.google.com/rss/articles/CBMimgFBVV95cUxNeDQ4LV9WY1d4VmJGOVlnRExuSVdQM3dYNHBJSTJWZnB1QllkdEdjNnNZaVhfaWZaRWRBdzRsekFrWFlIZlFpOWxURTNrZ3BjVDdLS0lTdkEzZWJqaUppRExNRHB2NzM1ck1mOXJQeHBSOHhpQWY0OFJ5SHJQSG0xSWlDU0pwd1d0WktMVmpHbUFGRE44MC1sYkRR?oc=5,1775134557,Why Bubble Dress Fashion Trends Are Suddenly Everywhere Again - Elle India,Why Bubble Dress Fashion Trends Are Suddenly Everywhere Again - Elle India
gnews,runway trend,news.google.com,https://news.google.com/rss/articles/CBMijgFBVV95cUxPU183ZVNLUWVPRXZyclVwcFZCcmN0LUZPUVhBVUhmN1JLUUlWdnZ2VWR1b3BOMENUT1hPUnpBc2k0cThxbTVqUkFRV0MtdzIwM1Y1UzJJandaN2ZVR29vbDhDNGZ4Vl9mUHlYaDVZYlphd0U3N1pKMlRBYkFMZjIzUm1wTzdoWjM1cVRXOTZ3?oc=5,1774076400,Six defining trends and takeaways from the A/W 2026 shows - wallpaper.com,Six defining trends and takeaways from the A/W 2026 shows - wallpaper.com
gnews,runway trend,news.google.com,https://news.google.com/rss/articles/CBMieEFVX3lxTE42TktlXy1lRzF2UmMwSEpEdjJYNFVXbDhIai1UTFFLUkFKUFZpUXlPeGJ1cW8wbXhwTUp1NDhhck9FOE5HczhMbDBNTUlXcUh4VUhaRktoQ0NBVmZtaW13QUw4ek05M1RjRjlYTXZTX05BVThxQXJzag?oc=5,1773126000,Why Models Over 40 Became Fashion Month’s Standout Runway Trend - elle.com,Why Models Over 40 Became Fashion Month’s Standout Runway Trend - elle.com
gnews,runway trend,news.google.com,https://news.google.com/rss/articles/CBMiZEFVX3lxTE9KZjRhRnlHZVJ6REd3MjkxSXQxRnMtRXRHd1dFWUxwdWlJZWdfQUh3LVhIZXRpMjFnQ2NhVFlfSDQtMkJyaTFWQ3QxQmxqd2g0LXE2OHVSV2lWa1dKUFNDdGlHNzU?oc=5,1772870400,"17 Spring Fashion Trends to Try, From CBK-Inspired Minimalism to Texturemaxxing - Teen Vogue","17 Spring Fashion Trends to Try, From CBK-Inspired Minimalism to Texturemaxxing - Teen Vogue"
gnews,runway trend,news.google.com,https://news.google.com/rss/articles/CBMie0FVX3lxTE1KYUJnN0VRUzdLRXp3bXF0OTBNZmNLNnFCdS1Rek9EX0g4TmdQQl94MENjNUxmMEJvekY0ZGdBRnVhQ3daZkxWQWV2NExmUUlOY3Q0RE1XaGpzc0I1STIzQzZTZkJXRHltekpzd1NuMm5wWkh3dEhWVi1iQQ?oc=5,1773644400,It’s Nice to See (Some) Actresses Wearing Dresses They Can Breathe In - The New York Times,It’s Nice to See (Some) Actresses Wearing Dresses They Can Breathe In - The New York Times
gnews,runway trend,news.google.com,https://news.google.com/rss/articles/CBMijgFBVV95cUxQRXBqR1dOaURJaFFxZF8xME1XRmxpNmhILXpQUjZtbnNkTlF5UFdWd0hhYlBfMHB5eVh6c3ZaSlpNM2ZudW9tY0xPR0dCNDc2Yk9iejBpMFIyQ0xJSmtBNXQ0SDZVLUw4Q1pEUXVSSUFONzRvVm1YTzR5ek9uU1psaW5ib3dNamNxdllpSXNB?oc=5,1774875387,3-31-26 is smoking returning as a fashion trend? - radioplusinfo.com,3-31-26 is smoking returning as a fashion trend? - radioplusinfo.com
gnews,runway trend,news.google.com,https://news.google.com/rss/articles/CBMiswFBVV95cUxNcURGWDFibEwta3R0WEZadUZTclo4VXVmYnQ1NDlQalBQcEtXbk9SS3FfcTFQblJ1d1ZtWDhac1JTNjF3dW9GR3Zrc3NZMnphcU02S0xKMDJuTDY4V3JUX1ZyNEJYdkQ3N1hBUVRfZEhGVTNfMjJETjV0bmFueThfc2M2bmVMSEw4MVJaRWY5d241b0lLYW9DQkFtVUREdlFteXl6aEtBWlRuQW9TaktZMm1qZw?oc=5,1774648658,"LSU women's basketball fans turn game day into fashion trend, boosting local businesses - WBRZ","LSU women's basketball fans turn game day into fashion trend, boosting local businesses - WBRZ"
gnews,runway trend,news.google.com,https://news.google.com/rss/articles/CBMilAFBVV95cUxPYUo2RjdqVnFPU2dLa0JkZnRzR3M0dVFhNXFSQ1BqdzVpTzNPTU5zMUZQWGNuaGUyMUdEc1Y5d1VUcTBNeDBQN00ydnJPalVHX1o2Z0RzbU85N1JRb2ZzZUtNblVncUoyaTNzYmFybWxENXA5Q3lwTF9pRC1ZRWhjSjdQcmJwU01JUUtUdU1ZMzIxR1hz?oc=5,1772438400,Breaking away from the fast fashion trend cycle - The DePaulia,Breaking away from the fast fashion trend cycle - The DePaulia
gnews,runway trend,news.google.com,https://news.google.com/rss/articles/CBMiwwFBVV95cUxNMUlZSGRKWEcxaUNGellYYVRUMkNSUWRZZU83SC1rNkVhczE3eHl5dkstZHFvRXBydjdSTnZhQmFtclNKRVYyMHIzNlczNHo2NE13SVYzWVRDNlBzVU5ySDMyNE1yRHNVQWMtdGZDa05yY2tuczlwMnNfMkpaRmM3a2duaW1BQlc4RFZRcU9sN2ZUcWtoQnM3UHhaU2JQNzJySXRUWnNUVEQzQmZEMUhQOXMxQUZic3gtbldDVDhENWQ2c2M?oc=5,1775113080,"Move over, It Girl. It’s the era of the Lit Girl: Have books become the new fashion trend? - The Straits Times","Move over, It Girl. It’s the era of the Lit Girl: Have books become the new fashion trend? - The Straits Times"
gnews,runway trend,news.google.com,https://news.google.com/rss/articles/CBMinAFBVV95cUxNdmVmdU1HcTdQcGVXZDN4TzNaYW4xZkViMEdLLWc2Mmg0d3VZQ1AwUVhEa3AyNTk0ODM2S2hsYjRld3UyaU9WLXdJTFJkZGNsanpYRWF0NEY2VkZVd0tRcV8wRFplYlVIOHlxZnRnZ0w1U2g1NWxhZzF3aXZkVFA5X05vdm0xcS1XWWE0TWRhSnVoTFUyOXhsM2JFdEw?oc=5,1773039600,A Fashion Trend Defining the 2020s? Tech Billionaires Crowding the Culture - goodonyou.eco,A Fashion Trend Defining the 2020s? Tech Billionaires Crowding the Culture - goodonyou.eco
gnews,runway trend,news.google.com,https://news.google.com/rss/articles/CBMikAFBVV95cUxOdlJ4MkZOaDZXTkZRZVFWM3pFamd4aE5od3dBZ212SGR5VTZHLVhhRVlhS0tPRXJiVTl3RXVRcnh5TlNrM2h4ZzZ3aGZpVFRBLTNnSGQyMFptMTh5bzg0MHY1RTZBZWZCWnVIN0J4OVRPbXhhamxXSkViTGVaZEVKSGlWSXFGcFVzUVdwNFY0ZWU?oc=5,1772524800,5 Runway Trends From Milan Fashion Week to Know About Now - Who What Wear,5 Runway Trends From Milan Fashion Week to Know About Now - Who What Wear
gnews,runway trend,news.google.com,https://news.google.com/rss/articles/CBMiigFBVV95cUxPZ3N4SjdZbUZpWm93bUN5MFlIZWRsYlcyWkNEN3FLc3F5YmM3cTl4SDBoYmR5Yjh1TXI3ZHkydUVTVEU2b09ZSlpZWmw0eHMxQVNJT0dwbHFGaFhTdHRlRmtzVnY0YlUwTDAxdTN4TnNEZ095UmlWZ1F2eFVKdi12WDBUdm5Tekp1Umc?oc=5,1773903600,The Best Spring Trends of 2026 - Harper's BAZAAR,The Best Spring Trends of 2026 - Harper's BAZAAR
gnews,runway trend,news.google.com,https://news.google.com/rss/articles/CBMikAFBVV95cUxNZVZIUERLNHF3RUhrQldGVVU3T1JnRzFaZVNCQjRkOXcySVJDNmpNbkM0ZDNqelprdkt0WkpJWlRrRml6UmhabVBIN3NOUS00a2U1TjY2MTRIZXozTHgxQXJKb0NCMHhMcnNrQThFYk9BMW1xejJ0U3l6SDh1WjRNaWgzZS10YVJJNTYxVTVjSEU?oc=5,1772006400,Spring 2026 Fashion Trend: Poppy Red Takes Over the Runway - Modern Luxury,Spring 2026 Fashion Trend: Poppy Red Takes Over the Runway - Modern Luxury
gnews,runway trend,news.google.com,https://news.google.com/rss/articles/CBMiiwFBVV95cUxPc04tc2FlamlzTWRyUDRVUTJnUmR0dFhfUGNJLW5COHk0RGl0eWdEZzE0RE5TQTdyeUI1X3F1ZFk1WDR0a2hjaDNtSnA4VVVFQTJRaVdfUmFfa0NzWGxpVzVScVdQcjJ4NklMTzVSLXRMTWU2eFdOR3hnWWVtMm1wdG5odXJYb3Zycmo4?oc=5,1772092800,Cobalt blue: the fashion trend taking over runways and red carpets - hyphenonline.com,Cobalt blue: the fashion trend taking over runways and red carpets - hyphenonline.com
gnews,runway trend,news.google.com,https://news.google.com/rss/articles/CBMimgFBVV95cUxNaDh6ckpfNzFaVGNGTnFzMEM3eFJ5RFh1eUdzeHRKZjNqRTRDVGV2N2lLb0s1WHQ3czdaNjNKWXlwdUtiYll3NUE0c0ktN1pGMURUekw3QTd3OVpqNXNyQkZldVN1ZG9Tcjd4dUhfMlJQM21GQjkwcUt5bmtHcUU2RnQtZkFBczF0dnpnNjQ2ejRCTTF1NG5JSVh3?oc=5,1772697600,The Biggest Runway Trends from Fashion Week FW26 - hypebae.com,The Biggest Runway Trends from Fashion Week FW26 - hypebae.com
gnews,runway trend,news.google.com,https://news.google.com/rss/articles/CBMiiAFBVV95cUxPWHM5bVNlRHF1MnhQQmZ4c216LWRyb28xRUJtWk5YLXRPWTVnQnNYblNoeVlIcThfcHZMcjJuYVlRVmFOUnRpV1JIRkhvc0RtQ2FNb0VnTDQ4ZW5CT1RZbm5GNGxFQjB0YTJkYktmQVloaEFndW5HcGQ5VkJJREtHaHpwRU9SNk14?oc=5,1771401600,The 6 New York Fashion Week Fall/Winter 2026 Trends We Want - Who What Wear,The 6 New York Fashion Week Fall/Winter 2026 Trends We Want - Who What Wear
gnews,runway trend,news.google.com,https://news.google.com/rss/articles/CBMinAFBVV95cUxQZXI5aDhUUmtqUzRkbDRKMThrYzVwcnNWZ0JXWjV5UzJMMW8xVHRwSU1oYk9pbmhOTDZ1d2J2STBybUhLSHh5elNqUzFmYWd1LUFWcmd3NzNFQWJ6NUJpQWhVa1EzSkN2MERPRjM0Ui1BQjkwTi0zdGpyeGZMZm9sVTFZa25uamo5YlB1UkZlZUVqY2NCTzdXMnpXWVk?oc=5,1774422000,"8 Dated Fashion Trends to Abandon This Spring, and What You Should Be Buying Instead - Real Simple","8 Dated Fashion Trends to Abandon This Spring, and What You Should Be Buying Instead - Real Simple"
gnews,runway trend,news.google.com,https://news.google.com/rss/articles/CBMimAFBVV95cUxQREVINnExaXd1N1NvemFCZ28wY1lwYXRTUFM3WWc2YlRSb0szU1lBN0pVVWE3ZC0wZFJIS0JFR0JYUzRrWnJqejI2cnNzT0ZmTl9MNkV0dDRJRE1zdnpVMWx0VVBZVXdpeXB5blRuVUY0Y3FNUm0wVWhucVBtLUxDZTFlM1dPSEZiaHViM3U1TnlBNEVOZ2JNMA?oc=5,1772697600,"These Are the Fashion Trends That Will Dominate Spring 2026, According to the Runways - Cosmopolitan","These Are the Fashion Trends That Will Dominate Spring 2026, According to the Runways - Cosmopolitan"
gnews,runway trend,news.google.com,https://news.google.com/rss/articles/CBMikgFBVV95cUxQNzJKLWJuQlZrR0oydDRNOGtwNWtJMGJ2Njh3ZGIyV0pEQ1dlNkpaT2V2S1pZUTdPYmtoTE50cl80ck81RWpXeTVRNmlrSE5PQmo1aVZjZDNYT0NVbGIzWV82MTl1TXBoNWVhX2kzQ0JyNmZEZmNxbmxKbjR0NWd1RWVQV2czUFJzSERGejc0aHRRdw?oc=5,1772092800,8 Chic Trends From London Fashion Week Worth Knowing About - Who What Wear,8 Chic Trends From London Fashion Week Worth Knowing About - Who What Wear
gnews,runway trend,news.google.com,https://news.google.com/rss/articles/CBMilAFBVV95cUxNMVFiRVdrRUdlSTRWSHNtOTRaVzdEWVpJYWhOWF92SGlOM3A3VkpNSmRDSklKRlRlUFFaVTRZT3Ffc1JwZENmcHZYRk9EZU45Z2NFdG92UzcwQ01nSGhtQUM2RmhVbWtFcHdXWTBCU0NwVXhzcUhoR243WlVsb2xCaEhiSHlUYktPd18yZ3NEX0Z6bnVl?oc=5,1772006400,Minimalism Is Out. London’s Fall 2026 Runways Are All About Bold Classics. - elle.com,Minimalism Is Out. London’s Fall 2026 Runways Are All About Bold Classics. - elle.com
gnews,runway trend,news.google.com,https://news.google.com/rss/articles/CBMipgFBVV95cUxOcXI2alJSdDNCLTdBeDhzckdhZGZuN3J0dmI4ak9LSzU3b2h3bUhoY1pwdGVOYjFWS2ZEbUdCNjN5ejV2dHF4MHlTaXpGZDhiS2xCbDBBVzRnQk52QUp6dm9fMkJON2FFZ254ZTAxUVhEQ2V0aHdXZU5LS3plUzZId2NVbFB0YkxpNU1ETkgxenEwOE1OTjRMNUFydGxmZXFaeWJTOF9R?oc=5,1772524800,"Top Fall 2026 Trends From Milan Fashion Week: Black, Power Suiting, and Lace [PHOTOS] - WWD","Top Fall 2026 Trends From Milan Fashion Week: Black, Power Suiting, and Lace [PHOTOS] - WWD"
gnews,runway trend,news.google.com,https://news.google.com/rss/articles/CBMijgFBVV95cUxPQ0RSekhweU5IOXRpeVctak5WU3djR2ltVXFEaUFHeEJ3ZEpjWGJ4MmFMZjFwSnBCS1IzR21Cb1p1T1V5Tlhwam5Uek45QlBFUGwtYmhRbnpnY0UzMzhDUk9pbEs1dEI5RWJnU21sNmhUT3FWTVdpbUpqT1k1d3NLUFFNTXFLNXR0OWtGX3pR?oc=5,1771488000,Fashion’s It Girls Are Already Wearing These Spring 2026 Fashion Trends - elle.com,Fashion’s It Girls Are Already Wearing These Spring 2026 Fashion Trends - elle.com
gnews,runway trend,news.google.com,https://news.google.com/rss/articles/CBMiV0FVX3lxTE1BVlduVWt5WGJxY1NVcFkyd0JWTGVXdzE2MGg2VE5qTkE4VHBpSDJXTDdsbFliWF9GSU1tcXB3enJxUS1uUVB4YXg5UTVYYWFtWU9XN3AyUQ?oc=5,1775151926,runway coat 2026 Best Sale - pregonerobaja.com.mx,runway coat 2026 Best Sale - pregonerobaja.com.mx
gnews,runway trend,news.google.com,https://news.google.com/rss/articles/CBMic0FVX3lxTE1DS3JyTktQOE43XzgzZmdKcHBhQ3VWZWs3bi1yMFZINURsVlREVVVOdDNYTUhaVjYzcjdXcmg5MHNUSTZvMW1NS3NpdFN0VTYweEhwQ0c0Rzc1bERzcXNIMi00RnJqQjFwX2IxVF9rRlFGYXM?oc=5,1773126000,The Key Spring/Summer 2026 Trends To Know (And Shop) Now - British Vogue,The Key Spring/Summer 2026 Trends To Know (And Shop) Now - British Vogue
