source,query,domain,url,created_utc,title,text
gnews,fashion trend,news.google.com,https://news.google.com/rss/articles/CBMie0FVX3lxTE1KYUJnN0VRUzdLRXp3bXF0OTBNZmNLNnFCdS1Rek9EX0g4TmdQQl94MENjNUxmMEJvekY0ZGdBRnVhQ3daZkxWQWV2NExmUUlOY3Q0RE1XaGpzc0I1STIzQzZTZkJXRHltekpzd1NuMm5wWkh3dEhWVi1iQQ?oc=5,1773677372,The Best Oscars Fashion Trend Was Dresses You Can Breathe In - The New York Times,The Best Oscars Fashion Trend Was Dresses You Can Breathe In - The New York Times
gnews,fashion trend,news.google.com,https://news.google.com/rss/articles/CBMiywFBVV95cUxPNTZ4cXZud3E4RXJhWkRtY01aM3ZUY1BHWE5oYVhrcjZsRU04bGpOQjBjeXl4ZFpWWTBHZGZjVjdBdmFuX0pieDdjd05Wb0tXRThwSy1vbHplUzVBWUtHaGExTF9iTWZKUE1kaUUzZjIwRUtuZHd1QXRZTzA5bmdqbjZFYmE0MDNKU0VnUkxaSC1RWHdxM1l1X1liVTJfWHpqVGw2dFI3dHRibTlvR3paQ21DRVUtWmEtamd6bWNISFJvNjh3RWQyc2FoMA?oc=5,1773677351,"Fleetwood, Thomas highlight new golf fashion trend as apparel free agents - Sports Business Journal","Fleetwood, Thomas highlight new golf fashion trend as apparel free agents - Sports Business Journal"
gnews,fashion trend,news.google.com,https://news.google.com/rss/articles/CBMitwFBVV95cUxNTlhOMk5uWGRDcm5kNHltLTVtcmMzbjRDNTdSdUtwaVpNSElEY0oyakNabm9qT0VvQTVGSmF4WFRIU09tX1RCWkFkOUFDdldOYmJHVGZCSHZybGNZMHJYanV3ekl6VWlGZE9ZZ014RzR1bmZ2MS1Xd0ZZX0tkVjJqbVhVYm05RFY5MFlJWmdua0lTaXgyQU1KenVOM1hjMTRVQ0dzbGo1a1B6UmczSXUxNUh0MUVvOUU?oc=5,1773658861,Oscars 2026 Style Watch: The Trends That Dominated the Red Carpet - Forbes,Oscars 2026 Style Watch: The Trends That Dominated the Red Carpet - Forbes
gnews,fashion trend,news.google.com,https://news.google.com/rss/articles/CBMimAFBVV95cUxOem5GVTY3aWYwTDhYaWJLdFducDktT2VIS2g2ellKUTZ6YXlqQmdYUTJVcU83d0ZEVkd2aXNsaDR5QThWWnNhdjYweE1ES1BVUDN2dnNsT1lqamlLSVRBVkhvbkl6RFVUXzNYLW54LVc1VHZoemsxTjBUQXZ2NFRneTh2SjhxdUQ0QlVhWVRVZUR1bkoyYUY2TA?oc=5,1773649104,"Not Sequins, Not Silk—This Unexpected Oscars Red Carpet Trend Came Straight from the Runway - Who What Wear","Not Sequins, Not Silk—This Unexpected Oscars Red Carpet Trend Came Straight from the Runway - Who What Wear"
gnews,fashion trend,news.google.com,https://news.google.com/rss/articles/CBMijwFBVV95cUxPYnNiVTk5dDRkZjRIdk1NaXo5YzdDWVBzX040eWFiMWVncUs0UVpkZnBlSjJNeUdSN0lISGY3MEtNSW1lcmJqRVlMVVJBeWxPY2VGWlFGQ2lBejJnVnJKQ1BwZjF2eWtCTFN3eTNVMDBEU1dERDNxVGFYMG9xX1VKOXFMNVNkYUw3NW1waUcxRQ?oc=5,1773667340,"The ‘Kicktail Bob’ Is Spring’s Most Elegant Haircut—It’s Versatile, Low-Maintenance and Adds Volume - Cosmopolitan","The ‘Kicktail Bob’ Is Spring’s Most Elegant Haircut—It’s Versatile, Low-Maintenance and Adds Volume - Cosmopolitan"
gnews,fashion trend,news.google.com,https://news.google.com/rss/articles/CBMigwFBVV95cUxNZzVSZklTNjJDN1YtTDFlQjlFWEFJb3FJQklPNlE3Zk9vT3NKYnJsZlNhbjZMVWdpU1JqdlI0MzQ4M1NUSS15cTJoeGpucnYyanBXV1J1NmVIM3ZhN3NicFJJN2xXWWF3RGZCUFlUcVdMYlJMYmczOUVyOHhwdDNsbDlXTQ?oc=5,1773656683,This Divisive 2010s Fashion Trend Just Ruled The Oscars 2026 Red Carpet - Glamour UK,This Divisive 2010s Fashion Trend Just Ruled The Oscars 2026 Red Carpet - Glamour UK
gnews,fashion trend,news.google.com,https://news.google.com/rss/articles/CBMiakFVX3lxTE1tT3lGTF9WR2FiMjNydV8yRHNFUGw3dkdCZTM2ME5QUHNqYzRNZ2cxbTEwQ0I5Tk0tdmVpVzAtbGNMUnBRR0F1bFU3eWp3MmI4S0JVQ0hGQXdUSW1qWDRQY3Nma1JDcWZXcXc?oc=5,1773602332,The Trend Cyclone - Strike Magazines,The Trend Cyclone - Strike Magazines
gnews,fashion trend,news.google.com,https://news.google.com/rss/articles/CBMickFVX3lxTE9yV2dQZExYSU1OVVVfTWxTaTZqaGRyc0VRR2FWbzN0MkJzM0xOWnlHTjBDWXRvbDBjbVphbFY5cE9qVUJSNV9lVWZjdWIyTXNtR25UTlhwUHluM3pCQ2ZLenl3UU0xZF9HUGdXWEhxVDl3dw?oc=5,1773620698,The Biggest Trends From the 2026 Oscars Red Carpet - FASHION Magazine,The Biggest Trends From the 2026 Oscars Red Carpet - FASHION Magazine
gnews,fashion trend,news.google.com,https://news.google.com/rss/articles/CBMic0FVX3lxTE5vU3RsNW01MVY0NlFOeTBBcWxVMTBITG1EYTAzUEZZeGZ5YVBTNG1GeXNMbnBfbzFrdkw1Ym9UcFJsNUNnNUdMOGVta0dsbElOTDJmdDFZMHRRV0RFRmpDWklOUDFCUlJTSkEyeE4wam5ETnc?oc=5,1773626949,The Oscars 2026 Red Carpet Is Filled With This Millennial-Coded Hair Trend - instyle.com,The Oscars 2026 Red Carpet Is Filled With This Millennial-Coded Hair Trend - instyle.com
gnews,fashion trend,news.google.com,https://news.google.com/rss/articles/CBMivAFBVV95cUxNbmRMX2tPempTQTZKWHRDcU9YcnNBS2VEbnlkS0Z4UEtQdktxYTdnYkdoNmtjanMtMHR4MkRvY2ZQT3FSc2xVWXVjSzhZUWlyc0ZtQ1drWGJlU3JEMERfWE54Wm9jVHdBeERnbVlyeUtwZThaU3NNN1BWbnY5bE42cXdXQ0NiWTR0WWZvMDZFREQyaWpWRHM1amllMHFLZ1hvUlQwTkFNOERKc1Y5c3B1UmxMQ0daUW44empwRw?oc=5,1773436875,These Fall Runway Trends Look Straight Out of Carolyn Bessette Kennedy’s Closet - ELLE,These Fall Runway Trends Look Straight Out of Carolyn Bessette Kennedy’s Closet - ELLE
gnews,fashion trend,news.google.com,https://news.google.com/rss/articles/CBMibEFVX3lxTFBWaUJnWG83TDZqc0FBMGZOVzUxeW1xOTF6d3d1ekJKU0F4RFU1ZUNYZjFmb2d5UFZLczNhYkQ4dXVZSmlRaGdKd3J1TU1hN081OUUwSDZmdTRDRGFwbGZ3NXhJNmRlTEF1S3liRQ?oc=5,1773615696,The Oscars Red Carpet Trend That Surprised Us All - PureWow,The Oscars Red Carpet Trend That Surprised Us All - PureWow
gnews,fashion trend,news.google.com,https://news.google.com/rss/articles/CBMibkFVX3lxTE41SDQySk9YYXRhMEpTSC1VTUg3T1BFQ1BFMk5jbG5YVGNrVGxGcUFRMVRkS2hXZTIwbVktdkU4SGdwYnZnVlQwd3ZrcElIbkR6RUVzVG1kUUJMR1c2empLZzZ1Z3ZnLTVsVFltYjRB0gFzQVVfeXFMUFQ1Rl9QS241bGxxaUs1d2JtTzgwVWNzczE3TUtBZ19aU1FNRFBfRWdxbC0tZ3lzNGE3eXBKdFoyaWdGUkRLVnMwWVNXVXpYUmN4Q0JieUl4TnhjUDRMT0R4WExVNVZNbFdRYUhTdk9CUEc5WQ?oc=5,1773586980,I tried this under-$30 slouchy Amazon bag that looks like Coach. Here’s why I love it - CNN,I tried this under-$30 slouchy Amazon bag that looks like Coach. Here’s why I love it - CNN
gnews,fashion trend,news.google.com,https://news.google.com/rss/articles/CBMidkFVX3lxTE1ZU1c0Q242VGVLSmdJNTIydk9IMnJPcFV3RlJBckI1YUJHSDhRX0puMGVhWGJLUmVtdUhaVjNCNHhXdkJ3ZEVxQXdqdE9nTnZGSVM1cDk0dVlxMlM3QXAybEZvQ2d3TzJBVkFIRlBrc3JfYjN2UWc?oc=5,1773669501,From Runway to Wardrobe: The Latest Dress Drops to Match Every Style - dscene magazine,From Runway to Wardrobe: The Latest Dress Drops to Match Every Style - dscene magazine
gnews,fashion trend,news.google.com,https://news.google.com/rss/articles/CBMiaEFVX3lxTFBpVlpMWHU2Uk1lTnRhR094OFpsNFlvMzdqRHZkeG1pbXRReXA4d2tvUXlfT1UzaGlkVUxOc2RUMEJLUmNwMG4yOUd1RnZWdVdrcWVUM3Jpc2hmc0VfOHpCR0xWcWpkZDdt?oc=5,1773613221,"At the 2026 Oscars, Spring-Ready Pastels Lit up the Red Carpet - Vogue","At the 2026 Oscars, Spring-Ready Pastels Lit up the Red Carpet - Vogue"
gnews,fashion trend,news.google.com,https://news.google.com/rss/articles/CBMilwFBVV95cUxNT2xNX2dFcEpCVHFGampZeklHNjRXTFMzRVNjOTg2blRtWXhHRnBwMWJ0MS03MjdmRDlNUFRTd1kyb0JWdU5EdVQxQXN1Vkg1cmNJci00V2pzWDFuMTRJTzRJMmd5LWVkTlF2N1BZNkxHVXRIblpNaHA1N0VVazdOOUhYd3RNTEFvaG8yT096dXE0bjJjNFln?oc=5,1773632216,"Oscars 2026: Rose Byrne, Zoe Saldaña and Damson Idris Top the Best-Dressed List - The Hollywood Reporter","Oscars 2026: Rose Byrne, Zoe Saldaña and Damson Idris Top the Best-Dressed List - The Hollywood Reporter"
gnews,fashion trend,news.google.com,https://news.google.com/rss/articles/CBMimgFBVV95cUxOS2FYU0t4STRxMGthRDJBT0JlMnRnbUdEcS1NWncyTVVLbm16aWU5NFlleF9xZ2JsNXFwRzE3aWJLOHQ4cFNocDl1QUs3TDVOaGx0OXI5TEo0SjEzT1RoMkpEaTQxOEtHNmlRTUxCUlFIZUVzR0dHbGFHN2F3S1RuLWNzZGxhdFRrXzFBbDNyQmllS0VncWZXN2lR?oc=5,1773660962,This Microtrend From the Oscars Red Carpet That Will Be Huge This Spring - Who What Wear,This Microtrend From the Oscars Red Carpet That Will Be Huge This Spring - Who What Wear
gnews,fashion trend,news.google.com,https://news.google.com/rss/articles/CBMiggFBVV95cUxNNXJxQjZZYVFuWHY4VmdkVS1faUNTQnhaZ29NQnEzRUlQcFhRYTE0MWNzTFZUenVNTDBBaThfSGtLUjJ4YWxfekhhQl9UMjJILTIzeWxsaUFPc25wQnA1dUNSYW5xUEFVRTctblRtRjg5QW5uZ0M4c1U4azFZUDJjUlF3?oc=5,1773471600,Florals for Spring Are Genuinely Groundbreaking This Season—5 Fresh Trends To Know in 2026 - Who What Wear,Florals for Spring Are Genuinely Groundbreaking This Season—5 Fresh Trends To Know in 2026 - Who What Wear
gnews,fashion trend,news.google.com,https://news.google.com/rss/articles/CBMifEFVX3lxTE43Yk5EdlVzbFdISGM4WWJ6bVlMbWo4SmdRSk5URVNQOWdaNHM1S3EtUUFXZkRXRlQ1TS01S2FfLUlweXVCa0E4WGduaGJiVHlpZXRHT1cyQU5SbVdLRkIwQnVBcHFrN1pUSzBheVU1aGJNZHJUY0VsVHpKLXo?oc=5,1773644400,"In Paris, Stylish Women Wear These Pants If They're Not Wearing Jeans - Who What Wear","In Paris, Stylish Women Wear These Pants If They're Not Wearing Jeans - Who What Wear"
gnews,fashion trend,news.google.com,https://news.google.com/rss/articles/CBMipwFBVV95cUxPeEVLNHlHLWRaRVJDRDlrYmRFLTViUV9md2c4NVRmWUFOZDhwUzRucUlNcmlocHhzaGJFcUQtamNMckZpaGk5V2JRQWRSamV6RnlxS2hRbkhwMm5wQThiRHVJdUNhNHJ2dGItQzR1S09Jcm4yaWFodlRlV2t2aGN6MTIyZVNxdnB3dklKYk5mVS04d1Q0UmUzLWV6cG5KNlZ1N3EzWEduWQ?oc=5,1773667773,Depop Appoints Trends Spokesperson to Spot Trends - TheIndustry.fashion,Depop Appoints Trends Spokesperson to Spot Trends - TheIndustry.fashion
gnews,fashion trend,news.google.com,https://news.google.com/rss/articles/CBMifEFVX3lxTE9jVWZSTkdCWjZlU3c4cy1zQjdrd2dsbnY1Q3A0WWpaZEc0aEFvMG1CQXBTRHhrNk9iSkdaRGxtSHNOWllxTzdobmFTNjRzUTN3enhjZGl3Q1lIMzY1RS1acWVCbnQtLUM4R1huY0pZbkFLVGdJRS1yc0g3WHc?oc=5,1773614992,Nicole Kidman Wows at Oscars 2026 in a Sequin Feather Dress Featuring a Controversial Fashion Trend - instyle.com,Nicole Kidman Wows at Oscars 2026 in a Sequin Feather Dress Featuring a Controversial Fashion Trend - instyle.com
gnews,fashion trend,news.google.com,https://news.google.com/rss/articles/CBMiggFBVV95cUxOTnRfTUcwVDNoRnVHYlJwWk5CQzIwbnNvR3RuU0NVVVpNYnJBSG9jVUtSZ1Zkbi04OGNWdlpsSTdlWDY0RkkzNkpqcHR6YVJTS2Rfc21EemNaRVJVWVNMdVNPLXZiRG5jUmpTZ1JyeWwxTV9lZWFQRkM1ZTFCOUQ2Y1FR?oc=5,1773561600,6 New Trending Jeans in 2026: How to Find Your Perfect Pair - Who What Wear,6 New Trending Jeans in 2026: How to Find Your Perfect Pair - Who What Wear
gnews,fashion trend,news.google.com,https://news.google.com/rss/articles/CBMilwFBVV95cUxNU3F0Tm5qeWhubnFlWWd5M2NUQlo1MDd0NFlWYUZQcWpaWU5fTk1acFAtbXptQ0ZOVTAwVlZ3aXE4UWdkM3lXT3Z1ekk2MzJDbFhZZ0xuRXlrMldPYWlpZm1jeVJFd2NJTkVWeDBVQnZtekFvYzZKNVlFUGJCQzA5UlpPY0xlenRfTHhaUVJLd3M3dTRGeTdV?oc=5,1773617271,"The Oscars’ Feathered Moment: Nicole Kidman, Demi Moore and More Float Down the Red Carpet in Plumed Style - WWD","The Oscars’ Feathered Moment: Nicole Kidman, Demi Moore and More Float Down the Red Carpet in Plumed Style - WWD"
gnews,fashion trend,news.google.com,https://news.google.com/rss/articles/CBMioAFBVV95cUxQMjhDbDA0YnNHZGV1OWdncXd1ZTdQZmhDd1JmNGxsLUZoeWxVUmNtd0FkWDVsd2FBNWxHNUFYNzZVRk5RanRwTExUb1hpSy1odmtPdGdPUHFHNENmcWtybVMxbE5venRoT3MtazVuRFFuMGZDa1dJZlJWNDRPejNQYmh3YnF2NHMxN1pRdXNJRTduRS1xNURQdDRkRkhjbFdS?oc=5,1773486000,"Paige Lorenze on This Year’s Top Festival Season Fashion Trends, Plus How To Wear Them - E! News","Paige Lorenze on This Year’s Top Festival Season Fashion Trends, Plus How To Wear Them - E! News"
gnews,fashion trend,news.google.com,https://news.google.com/rss/articles/CBMidkFVX3lxTFB4NUw5VjVTMjJ0emFSUHp5eVhYN3Y2dlAyV0VRQWNPdl9vaHF5TVpicXBlV1lVMWJXYXNDcmdhVGdVTGxyVzVKaHJEb3Jla1ZoallWOFRxR3JFUkVEUEY1NjZUaTl5ZU1tZmZXLXRseXQwZmVUZmc?oc=5,1773426964,Downtown Girls Are in Their Kurt Cobain Era - Marie Claire,Downtown Girls Are in Their Kurt Cobain Era - Marie Claire
gnews,fashion trend,news.google.com,https://news.google.com/rss/articles/CBMi4gFBVV95cUxOdmtpM3hHUWJnNkg5ckZ1LS1DNFYySXFXZ1o0bkNReFVkUk5zRmF2YUdEN09Xd3NCNTdTMm9iTE9WTVFIbDM4a3J4ckZtQW9ITFJfSnlTUThNcEpuaUloS0FIVXA1OTJfS1VXY2NZeXh3WFVoemFxelQ5OEw1Y0Zmc3YtZ1BaUUZrcDZ1dWZlaC0tUU1FcENKRGFGcTlkbFdXOThSenRTT3puellIOER0YWJ5YmtYY1gyNGt6SktlUDhmQk53eVBZc0c1UWRzaFhrUnpDQmNrWHM2MHhwajJreHhR?oc=5,1773675000,The surprising history of dupatta in Indian fashion and culture - The Times of India,The surprising history of dupatta in Indian fashion and culture - The Times of India
gnews,fashion trend,news.google.com,https://news.google.com/rss/articles/CBMilwFBVV95cUxNN2dvRWM4clRwMjAwRFliSmxuVjR4bjFlOWhyUVJBR2JMOTFDSTU4YW9YOE11RGlWd2xBbm9NVE5KLS1wQWtHbmU5SVp2T1gyeG9FdU90di1WNWFmTFZyTVc5ZzlzNVZ1bk9ON2REaTE3QTJhcHFYbzM3MGt5dkVoZVI5RUYweThHUnZiOERIOVptSXN2dkc0?oc=5,1773606180,See All the Celebrity Red Carpet Looks at the 2026 Oscars - ELLE,See All the Celebrity Red Carpet Looks at the 2026 Oscars - ELLE
gnews,fashion trend,news.google.com,https://news.google.com/rss/articles/CBMiogFBVV95cUxNZ3I0eF92cHEzbTBzWXFvM29kdklHZG1TWUdnMUF6dmk3M3lLLUlOZ1dkU2JITXpLRDllMjhQVFN3cnVwcWdiM2dIMFQyY3llQzlpckNmVFFQOXR3LUU2M3BILVVnVld3WUtKb2ZWU2VoaEtiaXlSOHQyR05XNTdqZ0l3T01iaHotbU9rX2lDelVQU2tLTGVBTnJQQlRxWXJFY1E?oc=5,1773423713,"I’m a Minimalist Who Lives for New Shoes—4 Trendy Spring Styles I'm Scooping Up at Zara, H&M, and Mango - Marie Claire","I’m a Minimalist Who Lives for New Shoes—4 Trendy Spring Styles I'm Scooping Up at Zara, H&M, and Mango - Marie Claire"
gnews,fashion trend,news.google.com,https://news.google.com/rss/articles/CBMie0FVX3lxTE9MUUhqWmlkelZUMWR5NUNjc0liNm02NVRtNVVXXy1xeklyZTFOcDFpdGdoMERHWTczdkpjLVQ0QlF4ZjVDd2s0ZkJweXZBTXZ6VkJzendEb0RPN1JIR2F4elhaZG5BbGk2a2hvOXBDQWtsb0czbjBCbktIdw?oc=5,1773558000,Every Fall/Winter 26 Shoe Trend That Dominated the Runways This Season - Who What Wear,Every Fall/Winter 26 Shoe Trend That Dominated the Runways This Season - Who What Wear
gnews,fashion trend,news.google.com,https://news.google.com/rss/articles/CBMiogFBVV95cUxPdnlCOTJjVFV2Yld1bE9yZVJGbkRUYTllY2lOZGJseTI4SzJ4VHhUaFVBdTc0MlN3U3JiWnEzXzl4akJGR0ZyREllZ2dBbjhrd0FIU3pQb01nWFVjZWdDRERfYmZBbHJaaU4ya0xhZzlabkcteGV2UHZhQk9wTWNOcDA2MGIybzlxd0EySmdQcThRTk51WFlPdXZMUl9naVdSVnc?oc=5,1773389584,"Not Ballet Flats, Not Loafers—The 4 Trainer Trends That Dominated Paris Fashion Week - Who What Wear","Not Ballet Flats, Not Loafers—The 4 Trainer Trends That Dominated Paris Fashion Week - Who What Wear"
gnews,fashion trend,news.google.com,https://news.google.com/rss/articles/CBMihwFBVV95cUxPN01kRWxlX0ZRdVdvb1MtUkliWkVxQXNGZXpJZ2ZCa25CNk84LUQydzk1ZTNVS1VrZk5kT1pzTVVHd3o4MGNnOGF0d2dFUm9WTXZZczdZSU9nRklYdVNEY1cxeE5ja3YzU1lnS0xfRXRNTnpxNzl6QXZHaDZEdGc5c3BUaWJJRDg?oc=5,1773547200,"According to Experts, These 5 Trends Will Dominate Wedding-Guest Dressing in 2026 - Who What Wear","According to Experts, These 5 Trends Will Dominate Wedding-Guest Dressing in 2026 - Who What Wear"
gnews,fashion trend,news.google.com,https://news.google.com/rss/articles/CBMilAFBVV95cUxPYUo2RjdqVnFPU2dLa0JkZnRzR3M0dVFhNXFSQ1BqdzVpTzNPTU5zMUZQWGNuaGUyMUdEc1Y5d1VUcTBNeDBQN00ydnJPalVHX1o2Z0RzbU85N1JRb2ZzZUtNblVncUoyaTNzYmFybWxENXA5Q3lwTF9pRC1ZRWhjSjdQcmJwU01JUUtUdU1ZMzIxR1hz?oc=5,1772438400,Breaking away from the fast fashion trend cycle - The DePaulia,Breaking away from the fast fashion trend cycle - The DePaulia
gnews,fashion trend,news.google.com,https://news.google.com/rss/articles/CBMirAFBVV95cUxQempzZ2JQa1Fpc3FyN2o2RXBETHEwTDNYVkpRWlk3SW1fdTZtNTZUaXZidFZmQklKVmo2VFYySU1pNHVyMS1KRURBV3BmZ3NTOWdDNk5OSGRBQlJ1ejcwQURDRVpYNTg4amU3UnlCaUdNeUZoWHU0a1JwZG1jT25WU1dabDAySzgzMjFZMl9pNGxySkxJaUprZnBmUUhvLW5fYlBrSmRZd0VvSVRI?oc=5,1773349782,Marc Jacobs and Sofia Coppola Have a Love/Hate Relationship with a ‘Kind of Trashy’ ‘90s Fashion Trend (Exclusive) - People.com,Marc Jacobs and Sofia Coppola Have a Love/Hate Relationship with a ‘Kind of Trashy’ ‘90s Fashion Trend (Exclusive) - People.com
gnews,fashion trend,news.google.com,https://news.google.com/rss/articles/CBMiakFVX3lxTE5VMHk0c3pDcFZXclk0QWg2UjYxUEJHS3ZjUVZjNG0yLWpQZ3RoS1ctUHgzSXVfSVY4MTVNaXdLMDVnUWVWY0NDNkxsZ3RHVFB3UW9TcnhVTE4xYk5JeUhTQ3lqMXZVZWU0NXc?oc=5,1773468000,It Girls Will Be Wearing These 5 Shoe Colour Trends This Spring - Who What Wear,It Girls Will Be Wearing These 5 Shoe Colour Trends This Spring - Who What Wear
gnews,fashion trend,news.google.com,https://news.google.com/rss/articles/CBMiggFBVV95cUxNeU0zOERGX2RpVDA0RVRoU2xqcUF2U25rZWd3bDJNTUo2SVhiYlJPUU5VcTE0U3Q4Uy1ZTWc2XzVfX1RkLVRSQnVPQUh1aktRdjFkMGRUMWRPbXdWandnQVJzWHNEV3dDQUlJUW02YVBMejMwNW01bjVWUU16RHloVzJR?oc=5,1773392605,"Alas, You Will Never Look Like J.F.K. Jr. in Your Chinos - The New York Times","Alas, You Will Never Look Like J.F.K. Jr. in Your Chinos - The New York Times"
gnews,fashion trend,news.google.com,https://news.google.com/rss/articles/CBMiggFBVV95cUxOcVlmNFJoT01mOWJmOFNBanVROUcwcVk1cnh2WjJxNFhaVi1lRTJzWlZ1WDlSV2VEMGZlUmNqNndKYTNSY1hwMXYwT0k1aVdraVlMZnNKb0VHbXJpRWliYjhHX3A4WmlSbXUwTTl3UmVGN2o4OXY1c2dNdmFhMzJWT2J3?oc=5,1772956800,16 Spring/Summer 2026 Trends Everyone's Talking About - Who What Wear,16 Spring/Summer 2026 Trends Everyone's Talking About - Who What Wear
gnews,fashion trend,news.google.com,https://news.google.com/rss/articles/CBMid0FVX3lxTE1PNzFLVlU0Ym9HS3MtUkRrTG1SUFJ1U1lEdFZ6Z2UzY3ZLb1IxS2FRUlBHVGcyT1NFNU1MMW1Yb1VlZVBGZ2dRQWZsQVlXSkZfU1VTa1Q3T3lxWEdsRExiRVhSTU5qUVQ1Z2VocG9VUFVCYlVlQUhJ?oc=5,1773337209,Parisian Girls Won’t Stop Wearing These 5 Street Style Trends - glamour.com,Parisian Girls Won’t Stop Wearing These 5 Street Style Trends - glamour.com
gnews,fashion trend,news.google.com,https://news.google.com/rss/articles/CBMif0FVX3lxTE5tTEYtT2NnbFBVbjNlVzJoVVRZR1l6S2dEYVNjY1dPVURrbk9YVERsdVFkSUNOXzF0V3ZVN1hNV205SGdlT2RZMTIzbTE3UERUdmRNU0x1NnRRZFdIN2oxMENMUDEtQm5oYVNzY21oUEZkdDF3eU1BS05Pekk5UGM?oc=5,1773664200,Is Fashion Finally Over the Long-Reigning Exposed Nipple Trend? - Fashionista,Is Fashion Finally Over the Long-Reigning Exposed Nipple Trend? - Fashionista
gnews,fashion trend,news.google.com,https://news.google.com/rss/articles/CBMiZkFVX3lxTE0tZFl4aVZsb1ZuZ3ZoYlBjaHlGT2RVVFUxbEtMcWZnbUlocjNTODExcUJiOUVfSTRocmdWZHgzZnc3bDc5dFRRUW9SbVVibHBxUEZLekVudXZJZE1EWW8zbUxvNF9rUQ?oc=5,1773374400,Not Babydoll and Not Prairie: 4 Spring 2026 Dress Trends That Actually Feel Cool and Fresh - Who What Wear,Not Babydoll and Not Prairie: 4 Spring 2026 Dress Trends That Actually Feel Cool and Fresh - Who What Wear
gnews,fashion trend,news.google.com,https://news.google.com/rss/articles/CBMiqAFBVV95cUxNUHpFQlh4M3lLVEVrdks1MldLSmcwMk51LVdSVzFTejVJR1JqcVRvX01NSnRMNWxuS2xORXFrZE1pY3FFN1NEa3ZtZXkzekhkSXdzd2sxMkd0OEVnTlpHbHZ4Y1FTNVJ5N21nb0pNajY0YS1Ubk1IUjRocGVnZjdEYXVhYzlHeUxKTkpEV0hUX3V2VUNNOTJwMnl5a045UUpMeGxrdHlQTmE?oc=5,1773426720,Tyla and Kendall Jenner Are Turning the Lingerie-Top Trend Into a Night-Out Look—Here’s How to Wear It - ELLE,Tyla and Kendall Jenner Are Turning the Lingerie-Top Trend Into a Night-Out Look—Here’s How to Wear It - ELLE
gnews,fashion trend,news.google.com,https://news.google.com/rss/articles/CBMibkFVX3lxTE5VZnc0MjB4U1dnSHFORE5lMDk5dVN3VjZVMmRseGlrVVB1RUUtTTMwTnFOZmxSVEVuWWE3b1hWQmhjNEFvajJ6RWt1QXNzNk5MbHJtVjRhaml4U1BtaEppcjltSm85MnpOcWwzRG5n?oc=5,1773558000,"Not Barn Jackets, Not Leather Bombers—Spring 2026 Is All About This Sporty Outerwear Style - Who What Wear","Not Barn Jackets, Not Leather Bombers—Spring 2026 Is All About This Sporty Outerwear Style - Who What Wear"
gnews,fashion trend,news.google.com,https://news.google.com/rss/articles/CBMifEFVX3lxTE9Kc0o3SVRfcFBQS192MVRLX2V4OGpPc0hVV3gxQktQRmdIWDhKelQzZmVqWTdPZE9jN2hnVGR5NFRZYktOM3NVX2JwUTJ2anpXRGJlWWJVMVlNWjQ4NkU1V2Ewd2NUY1pZSnNVMlNiWndzN3NwX0diTkxpeUc?oc=5,1773437700,15 Trends from Fashion Month That We Can't Stop Thinking About - AOL.com,15 Trends from Fashion Month That We Can't Stop Thinking About - AOL.com
gnews,fashion trend,news.google.com,https://news.google.com/rss/articles/CBMihwFBVV95cUxPdGJ6M0JYYm5tdWdtNDVESS1xdkl5Zk41Q0ViQ3F1RnNMM2tMY19JMVRmVDFXcEhld0JWOGtKdDhZd3JtM1ZYeDNjelhyMERjOTlTeEUzLWFjTElQaHVkMzRvU0JwSzVnQmJqY2dNRVRiSEVxdFpyZ0RicDhQb2FzSjQ5aWhmMkk?oc=5,1773330333,Fashion People Can't Stop Wearing This Elevated Take on a Spring Classic (It's So Chic) - Who What Wear,Fashion People Can't Stop Wearing This Elevated Take on a Spring Classic (It's So Chic) - Who What Wear
gnews,fashion trend,news.google.com,https://news.google.com/rss/articles/CBMie0FVX3lxTE9qOE9xR294WlRTN0dUSFNHSEh1Y1F5dVBhMWEzNmROcHo2TGVuXzJRamEwdVd3ZHRUUlJOaHdDSmYxUHVTVVl4T21aSEVhODE3dXZSNnZNenpVVWl5d29UTGFIRDR2b0I5MHgyR0pzVkdMcUY3WUlzVU1Dcw?oc=5,1773385200,The Spring 2026 Accessory Trends That'll Bring Even the Most Boring Outfits to Life - Who What Wear,The Spring 2026 Accessory Trends That'll Bring Even the Most Boring Outfits to Life - Who What Wear
gnews,fashion trend,news.google.com,https://news.google.com/rss/articles/CBMitAFBVV95cUxPRFFEcV80X1d5SWZpT3ZrUkNHTER6MVdSdGpVS09ILXVYQTJ5X0UzeVkxQVZJTWI1WDhZd0N6Wi04QkF6emNPOVFoX25EcnhYd0VXb0FROEZmckRndVpCMkFKWi1VOEpRRVZRbW9zWVNER01zcGc0VmlCYnNhX21sbzdBMVd4RTJPLU9lZ2RsdHcyaC15M3AxdVRnVm9rTHFYeE9GdjMzU1pVTXJzeS1jN0VnXzk?oc=5,1773519720,Kendall Jenner’s Bandana Streak Continues on a Dinner Date With Hailey Bieber - Harper's BAZAAR,Kendall Jenner’s Bandana Streak Continues on a Dinner Date With Hailey Bieber - Harper's BAZAAR
gnews,fashion trend,news.google.com,https://news.google.com/rss/articles/CBMigAFBVV95cUxQOVBTZ2llSjQ1cDdTTE5CVlFrMkppLTdHeGlIQzg0emFFc1ZxMFVEc2JyU29mMXNKV2dubi14TmNZckJNVHhNSWdDQmpiMV9QLXZkY19iZmhGZVJZbTNDaThObDgyNWxQbVRsT0hkWHh4T3FURjdIaUNBV3N4X2xldg?oc=5,1773478800,"Oprah, 72, Took This Ageless Spring Denim Trend to Paris Fashion Week—Here's How I'm Wearing It in NYC, From $8 - instyle.com","Oprah, 72, Took This Ageless Spring Denim Trend to Paris Fashion Week—Here's How I'm Wearing It in NYC, From $8 - instyle.com"
gnews,fashion trend,news.google.com,https://news.google.com/rss/articles/CBMilgFBVV95cUxPZUtqTW1Mbi1uQjBkTWtYbkl5YkFtZGxHQWNnaVQzN1JFRGp0cXpkX1ZZVHAtUm5QNHNaaWtJTHJMR3B5T0h4enBKV1k1OG8xSTJNV0lRQ0o5THJGUE1mY3lqczhQMVhfUTdqa0p6bEg3S1VTZjEyTmtPV200U0lBbHpxaUxuVHNVNWVxel9Dcy0xTGgyNlE?oc=5,1773295500,7 Pretty Trends That Will Make Your Jeans Look *Very* 2026 - Who What Wear,7 Pretty Trends That Will Make Your Jeans Look *Very* 2026 - Who What Wear
gnews,fashion trend,news.google.com,https://news.google.com/rss/articles/CBMigAFBVV95cUxNdU1fR2V3TnZjVHpJUmxsLThvYkN0VElHUDc5c19odjdYa1hVSC1ibVE1RnJCbFUwRm9GSGtKVUJOQVU4S2ZJb0kwaGNpekZkTzFNSVZ3UDU5cEZyazFZa2drcnJ5OHBsaXJBaURZZ0dDWTltamFEWEJ5ek9BSWNuVw?oc=5,1773558000,"You Might Not Agree, But I Think These 5 Trainer Colours Are Dated Now - Who What Wear","You Might Not Agree, But I Think These 5 Trainer Colours Are Dated Now - Who What Wear"
gnews,fashion trend,news.google.com,https://news.google.com/rss/articles/CBMinAFBVV95cUxNdmVmdU1HcTdQcGVXZDN4TzNaYW4xZkViMEdLLWc2Mmg0d3VZQ1AwUVhEa3AyNTk0ODM2S2hsYjRld3UyaU9WLXdJTFJkZGNsanpYRWF0NEY2VkZVd0tRcV8wRFplYlVIOHlxZnRnZ0w1U2g1NWxhZzF3aXZkVFA5X05vdm0xcS1XWWE0TWRhSnVoTFUyOXhsM2JFdEw?oc=5,1773021191,A Fashion Trend Defining the 2020s? Tech Billionaires Crowding the Culture - Good On You,A Fashion Trend Defining the 2020s? Tech Billionaires Crowding the Culture - Good On You
gnews,fashion trend,news.google.com,https://news.google.com/rss/articles/CBMif0FVX3lxTE94bk95bURrZWtBVnFUdUIyQlFtZ3VyTUdyc0wtdkt4OWk0YVBKb1dGVGVnMmJvQXgzSF95UEw5b3QxRHU1RW5odmx1QjZEYkpfWDVzTW5uQ2NRbzZkMlFLUzFFWGJ5aDh3SG9idkUxbHFnOEE5VFJjY29Gd0p0cjA?oc=5,1773499645,Sex Was Back on the Runway at Paris Fashion Week—Just Not the Way You Think - Vanity Fair,Sex Was Back on the Runway at Paris Fashion Week—Just Not the Way You Think - Vanity Fair
gnews,fashion trend,news.google.com,https://news.google.com/rss/articles/CBMid0FVX3lxTE5ESU9YTU5KWVRkVklTMi1QOHJaQnBwS1RndGZJQ3ZNdkVmUjNrYy16cnBtRUczREE0c3Y2R0Yta2M4WGZ2bGVOdDB2UFJMTU9MTzFqbFowVGVWUmxVMXM5U19XRXdLZ016bE5hdnJMZmM2Q2VsU21N?oc=5,1773558900,"Take It From Me, You're About to See These 7 Designer Bag Everywhere - Who What Wear","Take It From Me, You're About to See These 7 Designer Bag Everywhere - Who What Wear"
gnews,fashion trend,news.google.com,https://news.google.com/rss/articles/CBMigwFBVV95cUxPdFVIX1NoOGcySENVZGFlblJiMjJRamFnekVXQUZMY2thVE5XOVVfV1lWZldjcG01TjFVWUJJTDM1VGFQa1pHVUdUWl9IOEczX2VvTkM0X3JvN1lRU0t1ZzN2akNlZXVwQzY0OENreGZNaEZuYXQ0cm1sQ1Mtbnl1YmVZMA?oc=5,1773558000,6 Spring Jacket Color Trends People Are Wearing Instead of Black RN - Who What Wear,6 Spring Jacket Color Trends People Are Wearing Instead of Black RN - Who What Wear
gnews,fashion trend,news.google.com,https://news.google.com/rss/articles/CBMi2wFBVV95cUxOM1p1bU9xeVBKLVQyVlhveHMwejNYMWVYRDh5YWdxZDBISWgta3o0MU5qcnNqQzZycWpta3NzYVl6WTd4R2oyNUFUc0dKRnlGM2ZWM01aQVFVZS1uSTRyRzRqZUVLLVgwYXlITVQtYzNXZHpqSGI0WllXWE05NF9fWXRUb2prNkgzTWFQUm90QXp0ZGJwSXNwTmcwUGowR1VjLVZMeHBvUlE2d1RkbWRjQWNMZlZwZHd5UkZSZ3I2eGRuT0NvOG1teTBqYkpWUFJBM3RURzJhS2JkeUk?oc=5,1773657034,From Kylie Jenner to Heidi Klum: Two-pieces and cut-outs trend at the Vanity Fair Oscar Party - BreakingNews.ie,From Kylie Jenner to Heidi Klum: Two-pieces and cut-outs trend at the Vanity Fair Oscar Party - BreakingNews.ie
gnews,fashion trend,news.google.com,https://news.google.com/rss/articles/CBMioAFBVV95cUxNUUROSmR0MFFMUUg4NFNuYXJmNHd1cEs3N3QyektXRHNDRTVlU3l3Q1FXd2ZoMDRidzRYam5hZzdpd0pnc1A1UkhHRXp0RTZGOUxxNTJlSjBGbFRaNlk1ZTNxelpKSkRTdWFkb2ltNWRjSUNVZE1YZExCQ2F3Rlc3czBGR0w5VE4yZl9BbGdDLVBFalJtU2swWXAyTHJOZHRQ?oc=5,1771401600,Let Fall 2026 Model-Off-Duty Style Be Your Winter Fashion Inspiration - Vogue,Let Fall 2026 Model-Off-Duty Style Be Your Winter Fashion Inspiration - Vogue
gnews,fashion trend,news.google.com,https://news.google.com/rss/articles/CBMiU0FVX3lxTE1kdjVpaUhQSXloMm9LeGd5UDNvdHRTY1Vpd0NtUnliWVpjd29xNUVXcjQ1VGE2SU1kbDVDYlhIaVhoeDg4bDF4YXFIZWwxRXY0UXZJ?oc=5,1773650568,Windbreaker jackets are emerging as a new trend item in the fashion industry this spring. The 2026 S.. - 매일경제,Windbreaker jackets are emerging as a new trend item in the fashion industry this spring. The 2026 S.. - 매일경제
gnews,fashion trend,news.google.com,https://news.google.com/rss/articles/CBMikwFBVV95cUxPTGZVeFU1WlY3WTExUkl0dmtmazFDQy03bGE2SjVDNVBfdHBPTm42V0h5c1JhVld0N2wzODNTUnNSU0VlbE1BQmNacDQ3U1ptQTFQNXZ0NXJ3MjBOcXIwYjM5Y0F4VW5pYmxsTHE0ZWJNY3pSTnFVOEpYVHFOM2JBZTJXMnBUdXpCa2tHRGRrRXk1aXc?oc=5,1773385200,You Can Spot a Fashion Girl When Her Trench Coat Has This Detail - ELLE,You Can Spot a Fashion Girl When Her Trench Coat Has This Detail - ELLE
