source,query,domain,url,created_utc,title,text
gnews,fashion trend,news.google.com,https://news.google.com/rss/articles/CBMikgFBVV95cUxQYmwxbzBVcVVPNnRiaEtleURaal9VcUpMd0FZOVItRU1aSnZraWRYNURpZUluT3loc3dIbzR6ZWVyekQyVUVjd3pYRjZKdmtZZlo1UTVJczdna0hybHU0RHNaM0ptczdWUnBaVFRWalQ5dG1hemFpYTd1ZV92VEcyNC1ncHgtb1RFcklPakIwc1prZw?oc=5,1775300400,Spring runway report: The six designers with the most wearable collections - The Globe and Mail,Spring runway report: The six designers with the most wearable collections - The Globe and Mail
gnews,fashion trend,news.google.com,https://news.google.com/rss/articles/CBMijgFBVV95cUxNazJYNVNINU9MUmtQNkVkM3dlNDIzSE5pXzJhMFVRSHdsRkg1cXVneVEwM1BUYnBHMlNPZjlsUUNsZ1RsNjQ3Q1JIZ3RMUjc4WjcxOWwtZHFRbHFHQXQyUTlmdlFsY092LWlPR0NZYlhUNnFmb3FsWnpUQ0JYVGFxdERkbWF0YVBOZ1RmNDFR?oc=5,1773817200,The 11 Fashion Trends That Define the Fall 2026 Season - vogue.com,The 11 Fashion Trends That Define the Fall 2026 Season - vogue.com
gnews,fashion trend,news.google.com,https://news.google.com/rss/articles/CBMihwFBVV95cUxOak1DRkZKZ3J0RUU0UC1lajRlZFRSb1VWdndOR0tsLWxEeUQ4VUtmVE5COS1QZ18wb0k2R0UxQ1djM1pCZFhLbmlvTzJDWW5XUmFFSFZOaFFfMFRzdVFSMFdHcFc0c3AwNXNOUmZ4M1pNSGJDMUtTcGV4UmlEbUN4V0V2akhXXzA?oc=5,1775151000,The Celebrity Outfits Everyone Is Talking About (and Copying) Right Now - ELLE,The Celebrity Outfits Everyone Is Talking About (and Copying) Right Now - ELLE
gnews,fashion trend,news.google.com,https://news.google.com/rss/articles/CBMihwFBVV95cUxPVjB6bFdrcklyNndxTk1pLXZZQnpmN1lqUHFsZFBKTVQ5RnIwU0VqYVFNV0lXTnZ1U0pjSi1KV0swNzlUUlJTWGxac0xOMzVNR3l5azNQVzRFek56bjBSTUdKQzFoQUEwSVFnQUxGX2FXNVBzaGdxcjFrWEFpMXRaYVhEMThBS1E?oc=5,1775066238,How to Style a Miniskirt Like a Grown-Up - Harper's BAZAAR,How to Style a Miniskirt Like a Grown-Up - Harper's BAZAAR
gnews,fashion trend,news.google.com,https://news.google.com/rss/articles/CBMiswFBVV95cUxNcURGWDFibEwta3R0WEZadUZTclo4VXVmYnQ1NDlQalBQcEtXbk9SS3FfcTFQblJ1d1ZtWDhac1JTNjF3dW9GR3Zrc3NZMnphcU02S0xKMDJuTDY4V3JUX1ZyNEJYdkQ3N1hBUVRfZEhGVTNfMjJETjV0bmFueThfc2M2bmVMSEw4MVJaRWY5d241b0lLYW9DQkFtVUREdlFteXl6aEtBWlRuQW9TaktZMm1qZw?oc=5,1774649888,"LSU women's basketball fans turn game day into fashion trend, boosting local businesses - WBRZ","LSU women's basketball fans turn game day into fashion trend, boosting local businesses - WBRZ"
gnews,fashion trend,news.google.com,https://news.google.com/rss/articles/CBMia0FVX3lxTE5ia3VCRGlDOVVJU1QyX3BMQXAxeVlENjJVVC0wdWxncXlLZzdoajFpTk5XWTFzLVR5eUVSRXZqTy11Y2RaWU1ZUWIyWlI1b002YlRMaDFuRmpQUldaRFdNd2I3cmlSUGJxVDU4?oc=5,1773903600,5 Spring Fashion Trends Everyone's About to Be Wearing—And How to Style Them Now - Camille Styles,5 Spring Fashion Trends Everyone's About to Be Wearing—And How to Style Them Now - Camille Styles
gnews,fashion trend,news.google.com,https://news.google.com/rss/articles/CBMiggFBVV95cUxNdGp5S2NUZUs0bDVRd2RFQXI0dFF3UVpMZnE0OHFneGVCcV9mR0V0N3VfcUxHb3FVem5zdEt5Tzl5OGRHSlF4cjJGdFBYZVRCWldtV3JmZHBHaVRmN0tXV1dPcGxMVXRyUWdubGEyS1A0VnYxeWc1OFFPWW5fckw4MGZB?oc=5,1775286000,"On Every Block in Brooklyn, I Keep Seeing These 5 Bag Trends - Who What Wear","On Every Block in Brooklyn, I Keep Seeing These 5 Bag Trends - Who What Wear"
gnews,fashion trend,news.google.com,https://news.google.com/rss/articles/CBMie0FVX3lxTE1KYUJnN0VRUzdLRXp3bXF0OTBNZmNLNnFCdS1Rek9EX0g4TmdQQl94MENjNUxmMEJvekY0ZGdBRnVhQ3daZkxWQWV2NExmUUlOY3Q0RE1XaGpzc0I1STIzQzZTZkJXRHltekpzd1NuMm5wWkh3dEhWVi1iQQ?oc=5,1773644400,It’s Nice to See (Some) Actresses Wearing Dresses They Can Breathe In - The New York Times,It’s Nice to See (Some) Actresses Wearing Dresses They Can Breathe In - The New York Times
gnews,fashion trend,news.google.com,https://news.google.com/rss/articles/CBMie0FVX3lxTE9IY0M2amlpWjFoYzNqaHIzQVRfZmZEUjdodXNlS3k5blA0N05aaV9BRXNMblA3ci13c0J5WjBSSmJKR0Y4TEZHVGpaMUxfaFhRR3FpZEpoSzRuX3B4M3FmU21maWFWN1hQdHVxejB3Z3IxSzZDT2xPVmdqcw?oc=5,1775282100,H&M Called It—These 5 Dress Trends Will Define Spring 2026 - Who What Wear,H&M Called It—These 5 Dress Trends Will Define Spring 2026 - Who What Wear
gnews,fashion trend,news.google.com,https://news.google.com/rss/articles/CBMiX0FVX3lxTFB2T2M5VnI2NmFNbTZEQUtDVE1qTzRFT1dKTTZHNHpfdFdLRFhZN0lGZnN0TWRUNHAxbXpRUEhiMkMtbFBpSHBHLUJVRnA0dHJldGVnTW0yLUZ2UEItMUtR0gFkQVVfeXFMTU5wV0Zmc3h3c191dlNqSVFHY3c0QThnQ2NDWl9sQlNIb3U4RzRlNUVfaVA5VnhFNi1ISUhRaDhFYk9SWVAzYmg5SDNHWUZOT2pSMzdkdDRQNVo1bjk5WUtyZ01BOA?oc=5,1775155387,Invigorating Spring-Ready Fashion Campaigns - Trend Hunter,Invigorating Spring-Ready Fashion Campaigns - Trend Hunter
gnews,fashion trend,news.google.com,https://news.google.com/rss/articles/CBMijgFBVV95cUxOVE42UGRtTnk5Qi00aGVQLTBuY0ZhZ0VrSmZyLVN0ckhQMEZvTUZOb1kwRnRFeVZGZDUzN08yZ25FVDMzUEZ6Z2VrSGp5aTloT3Y1M0xuQnpKS2FqZV9uQmxTZlRLcnVhUFhFelJIZ1gtQWdVOFpVS191N0REY21yek5JZ1ZFT3VDNzFNQTNR?oc=5,1775054658,The 6 biggest jewellery trends to know this spring – and the ones to forget - Cosmopolitan,The 6 biggest jewellery trends to know this spring – and the ones to forget - Cosmopolitan
gnews,fashion trend,news.google.com,https://news.google.com/rss/articles/CBMiqAFBVV95cUxPRTVOWWZyc0dZUEtWZVZVbXRwZG9tUXVTY0tKdnF4RWg3OF8ycWNWU3l3dW11elZ6RlJ4aGZiTWF1cDdBcXphNXk3RDIyM1BFLWpBcHo4ak9LeDVTQ1dEM2JJbTBpXzNSY19seGlaczBnRVBYTElzVjhFdDA5amt1dzgxdWpMU29GdWlRYTB1WFhhcGIzRjdHaHB4endfai1URWo5Z25jZXU?oc=5,1775067353,This “Anti-Pastel” Color Combo Is Everywhere Right Now - Marie Claire,This “Anti-Pastel” Color Combo Is Everywhere Right Now - Marie Claire
gnews,fashion trend,news.google.com,https://news.google.com/rss/articles/CBMilAFBVV95cUxPYUo2RjdqVnFPU2dLa0JkZnRzR3M0dVFhNXFSQ1BqdzVpTzNPTU5zMUZQWGNuaGUyMUdEc1Y5d1VUcTBNeDBQN00ydnJPalVHX1o2Z0RzbU85N1JRb2ZzZUtNblVncUoyaTNzYmFybWxENXA5Q3lwTF9pRC1ZRWhjSjdQcmJwU01JUUtUdU1ZMzIxR1hz?oc=5,1772438400,Breaking away from the fast fashion trend cycle - The DePaulia,Breaking away from the fast fashion trend cycle - The DePaulia
gnews,fashion trend,news.google.com,https://news.google.com/rss/articles/CBMisgFBVV95cUxPQTdUdzRxb2oxaGxxQ010QU9KQkNPcjdoWTZGVE9GVWo0OFVKR2wyakxXcVMyNkJhTWYza0pwckpzemg2OV9aeGxFeVJyUlA4dk5IdDJsbHBvcVVGcHdYQ2YxeThKN0s0Q1NQeFBsYURmZ2pKR2VXLU55MUV1eEhQM1BnVTJOV2Y3OHdSa2NzNmZTU201Z3dWWmIxOTJCSzZVN29LWVBpVnNmNlNEeWV3NTNn?oc=5,1775142656,I Can’t Get Enough of Spring’s Jacket Trends—5 I'm Shopping in Nordstrom's Sale - Marie Claire,I Can’t Get Enough of Spring’s Jacket Trends—5 I'm Shopping in Nordstrom's Sale - Marie Claire
gnews,fashion trend,news.google.com,https://news.google.com/rss/articles/CBMiY0FVX3lxTE9EQXBCWk9fNHYxREc5Ry1GZ2VYbVFfYWtWeF9ONEE5YUpNWXpNS3lRSEFYejgyaWVfS1UwVDZ0ZGlRd25HSmlmSkxQNGQ1aU1Nd2dvOE9maDRHU0VkTXNocG1EVdIBaEFVX3lxTE5INzVLbF82UDFOZW9TQUxJREJ0M2g1WXlpTjRhQ0VWb19hd1lCTmhGWTRSM2FYT0NnNFIyOTRYeHdrbWRQU1JJUkJwWEVMaXRoc2lKU19EN2VReEEwT3k0YkpJV1FNZ0o1?oc=5,1775112629,Actor-Fronted Sophisticated Fashion Campaigns - Trend Hunter,Actor-Fronted Sophisticated Fashion Campaigns - Trend Hunter
gnews,fashion trend,news.google.com,https://news.google.com/rss/articles/CBMigwFBVV95cUxQSlViV25ISnVCbUU4VVRUX3YtRGFMZERFcjhVLWhBTHUxNXAxX2dYVVJGT3NJcVdyLXJIMmg0WHpsNVVFT3dtR3VaMUhSb0RtQ2JuSVRSck5QU3dOU0V6WGQzRE5wUnJQLU9HN1FadFVwbGRUQ05SS0lzYlNoeXdoYVhORQ?oc=5,1775203200,"Not denim, not leather, Anita Rani gives a masterclass in how to wear spring's biggest jacket trend - Woman & Home","Not denim, not leather, Anita Rani gives a masterclass in how to wear spring's biggest jacket trend - Woman & Home"
gnews,fashion trend,news.google.com,https://news.google.com/rss/articles/CBMingFBVV95cUxNNGMxMkVlVjRXWUhnbjhfOXFOMWdfS2ZrY2xEbllsUENtOHJGc2ZLMTNNM0xfY1h5SWk0QjNEdGFTdnVUTG9hdDZlbDl5RTdyUjZ4c2JmT2Znd0RjM2xyY3VRUnk5anF3SV9aNGpDRWlpaEJsRmFNN3A1b0s0aWVJTzJGRWlNamFwMERGZlBJVDJtcE1WUnZTVThwSS1Cdw?oc=5,1775296931,Balloon trousers are the spring surprise trend that you need now - 7 of the best to shop from £16 - Good Housekeeping,Balloon trousers are the spring surprise trend that you need now - 7 of the best to shop from £16 - Good Housekeeping
gnews,fashion trend,news.google.com,https://news.google.com/rss/articles/CBMie0FVX3lxTE56MXpsUDVwbjNSVld1bHZ0RkViNjRFVnNvcEFjNEh0VU9RMTkyVXVSOXZKMzY5dU5KOTdLMGlzVElYNklKaDc1ejk2dUtNeTZYWVQ1NXVHV3I0cWV3NlMxVUY5U3RuajJoZ3FJQkl2UkxVMnJWR0ZIYUY1RQ?oc=5,1775115900,H&M Called It: 5 Blouse Trends to Make Your Jeans and Linen Trousers Look Chicest This Spring - Who What Wear,H&M Called It: 5 Blouse Trends to Make Your Jeans and Linen Trousers Look Chicest This Spring - Who What Wear
gnews,fashion trend,news.google.com,https://news.google.com/rss/articles/CBMizgFBVV95cUxOenNnZ2NfRFVBWEFkcXVxcHdDUzJLRnVSaVJnc1IycVFYdllLS1ZlUGVobHduMmFFc2w1emstcU9UX2FkMWVibHlRZ2h3eWdWejBBQmxyeF9SdEhZZU9ScW1EVTlDajF6YjdmR3lwckhqWjRCRE9DMGtWTW9oSW9LQkRMdDhDQ195Qk5ZU0Z0NjlBQUx3RENyeTA3aUp6MF9WR04wUnR4UnN6RWNqUUVzVHljOUpJQXBoSlNsbUc5bWpEa3Yyb2N1MFZpOXdNdw?oc=5,1775386800,"At the recent Tokyo Fashion Week, street style goes bold with layers and colours - thestar.com.my","At the recent Tokyo Fashion Week, street style goes bold with layers and colours - thestar.com.my"
gnews,fashion trend,news.google.com,https://news.google.com/rss/articles/CBMinAFBVV95cUxQZXI5aDhUUmtqUzRkbDRKMThrYzVwcnNWZ0JXWjV5UzJMMW8xVHRwSU1oYk9pbmhOTDZ1d2J2STBybUhLSHh5elNqUzFmYWd1LUFWcmd3NzNFQWJ6NUJpQWhVa1EzSkN2MERPRjM0Ui1BQjkwTi0zdGpyeGZMZm9sVTFZa25uamo5YlB1UkZlZUVqY2NCTzdXMnpXWVk?oc=5,1774422000,"8 Dated Fashion Trends to Abandon This Spring, and What You Should Be Buying Instead - Real Simple","8 Dated Fashion Trends to Abandon This Spring, and What You Should Be Buying Instead - Real Simple"
gnews,fashion trend,news.google.com,https://news.google.com/rss/articles/CBMiiAFBVV95cUxQVjF0VjhyQnREakxYZU9ETnFtNWoyM1YwcV9xbGxZYlRVaTZqSWlhc3NKZHhoeExNV29TaldJaG04c1VOVzJQcEdPbGhXV2RTUHU2a1hsS2J1OG1OZ1pWempSNW9fcElIQ2FJNFZ0RW0teDczdk4tallZVnVMd2p3cWtnTGZvM3FW?oc=5,1774335600,Prep! It Coats! Sex Appeal! 10 Trends Set to Define Spring 2026 Fashion - Who What Wear,Prep! It Coats! Sex Appeal! 10 Trends Set to Define Spring 2026 Fashion - Who What Wear
gnews,fashion trend,news.google.com,https://news.google.com/rss/articles/CBMiiwFBVV95cUxQVmZkYjhuc2xSUkcwcDBZWjY5cGpDeERVZlZiX05Rc2UzVmhmMXhQcS0xQ0thNjRnWGE3ektxZTV5WEl1cmJXRmVhOWs3bFdxTjJ0d0h4cnQxOEVmb2NoZTRLblJhNWhPbjFzakNUbUVlMXAwaHdObUR2c2RGaXplNFRvYmN5STltWTRR?oc=5,1775322145,"Deer print is spring's new trending animal print, Next's £35 satin midi skirt is the easy way to wear the look - Cosmopolitan","Deer print is spring's new trending animal print, Next's £35 satin midi skirt is the easy way to wear the look - Cosmopolitan"
gnews,fashion trend,news.google.com,https://news.google.com/rss/articles/CBMiZEFVX3lxTE9KZjRhRnlHZVJ6REd3MjkxSXQxRnMtRXRHd1dFWUxwdWlJZWdfQUh3LVhIZXRpMjFnQ2NhVFlfSDQtMkJyaTFWQ3QxQmxqd2g0LXE2OHVSV2lWa1dKUFNDdGlHNzU?oc=5,1772870400,"17 Spring Fashion Trends to Try, From CBK-Inspired Minimalism to Texturemaxxing - Teen Vogue","17 Spring Fashion Trends to Try, From CBK-Inspired Minimalism to Texturemaxxing - Teen Vogue"
gnews,fashion trend,news.google.com,https://news.google.com/rss/articles/CBMiwwFBVV95cUxNMUlZSGRKWEcxaUNGellYYVRUMkNSUWRZZU83SC1rNkVhczE3eHl5dkstZHFvRXBydjdSTnZhQmFtclNKRVYyMHIzNlczNHo2NE13SVYzWVRDNlBzVU5ySDMyNE1yRHNVQWMtdGZDa05yY2tuczlwMnNfMkpaRmM3a2duaW1BQlc4RFZRcU9sN2ZUcWtoQnM3UHhaU2JQNzJySXRUWnNUVEQzQmZEMUhQOXMxQUZic3gtbldDVDhENWQ2c2M?oc=5,1775113237,"Move over, It Girl. It’s the era of the Lit Girl: Have books become the new fashion trend? - The Straits Times","Move over, It Girl. It’s the era of the Lit Girl: Have books become the new fashion trend? - The Straits Times"
gnews,fashion trend,news.google.com,https://news.google.com/rss/articles/CBMivAFBVV95cUxNbmRMX2tPempTQTZKWHRDcU9YcnNBS2VEbnlkS0Z4UEtQdktxYTdnYkdoNmtjanMtMHR4MkRvY2ZQT3FSc2xVWXVjSzhZUWlyc0ZtQ1drWGJlU3JEMERfWE54Wm9jVHdBeERnbVlyeUtwZThaU3NNN1BWbnY5bE42cXdXQ0NiWTR0WWZvMDZFREQyaWpWRHM1amllMHFLZ1hvUlQwTkFNOERKc1Y5c3B1UmxMQ0daUW44empwRw?oc=5,1773385200,These Fall Runway Trends Look Straight Out of Carolyn Bessette Kennedy’s Closet - ELLE,These Fall Runway Trends Look Straight Out of Carolyn Bessette Kennedy’s Closet - ELLE
gnews,fashion trend,news.google.com,https://news.google.com/rss/articles/CBMiggFBVV95cUxOcVlmNFJoT01mOWJmOFNBanVROUcwcVk1cnh2WjJxNFhaVi1lRTJzWlZ1WDlSV2VEMGZlUmNqNndKYTNSY1hwMXYwT0k1aVdraVlMZnNKb0VHbXJpRWliYjhHX3A4WmlSbXUwTTl3UmVGN2o4OXY1c2dNdmFhMzJWT2J3?oc=5,1772956800,16 Spring/Summer 2026 Trends Everyone's Talking About - Who What Wear,16 Spring/Summer 2026 Trends Everyone's Talking About - Who What Wear
gnews,fashion trend,news.google.com,https://news.google.com/rss/articles/CBMilwFBVV95cUxNTUVFeXdHVGp5V3dYZFhmZTA5VTh1ZFFlMUM5MmRZcnZqTllxTTJjelczVW1zeUJXTVpjSlVtMHlEQVVCSE9RcWc1S25mYm9wQzVzeTg4dzlJaDNZSVlDLWdVdmw5cXM1QllZdl82TDFWYk42aTNJTVlta1pZV2twRmdnOFZiNEVydWg2NmJWYUpmWDBoQkUw?oc=5,1775056390,"Embroidered blouses are a pretty spring update, and M&S's £36 red and pink collared design ticks off 3 trends - Cosmopolitan","Embroidered blouses are a pretty spring update, and M&S's £36 red and pink collared design ticks off 3 trends - Cosmopolitan"
gnews,fashion trend,news.google.com,https://news.google.com/rss/articles/CBMimAFBVV95cUxOcjhjNGl0d19hT3lGbjNNRmJ0WkRNYlV5WVgtdEY2dEkyY1hFSmJVTzNVSDAxNnBxbTh0eWVIX0kxenhxTXVGZmZWRy15eU8zbGVTd0JJQzdTYnFYQWpLaWNRQUJrcm92cjRna3B1Y1FmRllOU0ZRa1pEYjBualoxV1dIcGo4NjBmLTVzc3M3ZnVLRG9PT0pqYQ?oc=5,1775137280,"Drop-waist dresses are the flattering, easy-to-wear spring trend – get the look with Primark's £16 design - Cosmopolitan","Drop-waist dresses are the flattering, easy-to-wear spring trend – get the look with Primark's £16 design - Cosmopolitan"
gnews,fashion trend,news.google.com,https://news.google.com/rss/articles/CBMihgFBVV95cUxQX19hQ3dkQUl3alhaQ296N3Uxd05sRHZiZi1kZ2kyaFhpUThIWHlsMVlNN0ttZFk4aExiQjIxeWt2S2hZdFZlTDRZNk92aDAwaEI5TG1USnZqWGx6R3A4YmhSTzlOSXJhaWlaYjhrei1tcWtvbWJNUjFDbnlkYndETzYyVmNwUQ?oc=5,1773212400,Paris Fashion Week Just Made Getting Dressed A Lot More Fun - The Zoe Report,Paris Fashion Week Just Made Getting Dressed A Lot More Fun - The Zoe Report
gnews,fashion trend,news.google.com,https://news.google.com/rss/articles/CBMif0FVX3lxTFBEXzZaUEVpT0Q1dnNpTDg0blFuckVRX1BlbWhWVjZHV0swNlB2S3hvVExpN2dDcmsxUFNKdXhTY0pzR3BncUI5RlFPeW85SXhfenFseEhkajc0R0JydzBobThCaklJcGg5X0taSmw5UHNKWldZTHhTck5MbFRnQmc?oc=5,1774249200,Challenge Accepted! 14 Vogue Editors Curate Spring’s Top Trends Under $300 - vogue.com,Challenge Accepted! 14 Vogue Editors Curate Spring’s Top Trends Under $300 - vogue.com
gnews,fashion trend,news.google.com,https://news.google.com/rss/articles/CBMilwFBVV95cUxPc3VmbE5PSXh1SldvR1NXR2dQbUFJVzBWVTdCdDJuRU1SdEdNc2xDSXlHOVdGOFRydENoTjY1NFlOZ2FNMWJRWTlFR3VQNVBjZFpNYjEyX0h4V1ZsNUh3d3FEajU4VnlTRi14N3R6aEFlWWNpTl95ZGV3VXlrbnBLMkZVaGt3T0p0d0lEMlZ3S3JJUWZzZjVV?oc=5,1771833600,Hulu’s New Hit Already Kicked Off a Fashion Trend. I’m Telling You: You Can’t Pull It Off. - Slate,Hulu’s New Hit Already Kicked Off a Fashion Trend. I’m Telling You: You Can’t Pull It Off. - Slate
gnews,fashion trend,news.google.com,https://news.google.com/rss/articles/CBMinAFBVV95cUxNdmVmdU1HcTdQcGVXZDN4TzNaYW4xZkViMEdLLWc2Mmg0d3VZQ1AwUVhEa3AyNTk0ODM2S2hsYjRld3UyaU9WLXdJTFJkZGNsanpYRWF0NEY2VkZVd0tRcV8wRFplYlVIOHlxZnRnZ0w1U2g1NWxhZzF3aXZkVFA5X05vdm0xcS1XWWE0TWRhSnVoTFUyOXhsM2JFdEw?oc=5,1773039600,A Fashion Trend Defining the 2020s? Tech Billionaires Crowding the Culture - Good On You,A Fashion Trend Defining the 2020s? Tech Billionaires Crowding the Culture - Good On You
gnews,streetwear trend,news.google.com,https://news.google.com/rss/articles/CBMiXkFVX3lxTE5KcVVBMC1HR1JVSVhjZjlwX09sZTJOczdsYUVNQ21hZmtKemgxYUd1WUREMDJ1WnkyeXpldkxHVFhCQWUtSVd5a001T0lJckFjcVI1NFdROHBkLUwwV1E?oc=5,1773126000,Bonjour Paris! 10+ Street Style Looks to Recreate Now - vogue.com,Bonjour Paris! 10+ Street Style Looks to Recreate Now - vogue.com
gnews,streetwear trend,news.google.com,https://news.google.com/rss/articles/CBMic0FVX3lxTE9mNVBidGJ4UGxHRmNZY0cwQzZfR2tjcjMtaVBEX3VzTzRrWEZRTG9rcEhIR2xGYnEycUNIT29YbG1SYWhhZkxYRnZ0T3J1LTk3dlFTUnpfbmp0R2hqRkpxMS1YbnFqZ0FVM1RZdVhLdDl0UjDSAXhBVV95cUxNZFI3RWZJb1MySHJlZ3dOaFZ2aG91S1NlbmpGYXprek9BUWVsblpzbDYtaWF6TXRjV3RvS01tTkVNdVo5S01jc1FOVEdPQl85QlVvcUhOemtPcFp3NjNXNTRVRG1ZVmxpb3hDVy16eFpsWXJHZDNBNi0?oc=5,1774422000,New York Streetwear Collections - Trend Hunter,New York Streetwear Collections - Trend Hunter
gnews,streetwear trend,news.google.com,https://news.google.com/rss/articles/CBMiowFBVV95cUxOdGttVEFyMEx1SGJuOVV3eUxpSGhDWDhPRXZucDFQRGhIYnlNWXFCS0JEY1drdXgwejNlVHNNcVY2LVVkWkxwVm4tdWgxSHM4b3U0eXpCTWdhOGh0X2ZrcTQteC1ZTDB0anV3M3B4dkVQMThxZmxRRTlnZl9neGN0clZTY2JtVzVjUnBwa1lfWlg2djlmXy1qbi1QVWl6azRTQ0lN?oc=5,1773817200,Y2K Beanies: The Retro Streetwear Trend Making a Huge Comeback - OCNJ Daily,Y2K Beanies: The Retro Streetwear Trend Making a Huge Comeback - OCNJ Daily
gnews,streetwear trend,news.google.com,https://news.google.com/rss/articles/CBMif0FVX3lxTE5tbjFhSnY0RFZ2Tngtck9yUDlkeWJkZ2ZQWXFyNGZNaTBJb3lKeVdKNEN6am95QW5TeUY5VVVVTzZkdk9WOTlSdXNyMm9nX090RmdFbDZLbGI3R0t2NFZQQV9ROVZDT08wclkxdDktc1lhOVFqSTIzZXVQLTk0TzTSAYQBQVVfeXFMTnptS3Ffbm1LcHFXRURzS0d6dkNtSTFkanpfdThUeDlFWHVxRWlDOTR6eTB6WFFmV05VbVNkeEZ5SURUTkVsb1dZZVlleHhLcUJjN1VnaGd5NE40SW1oaDg5ZnpMNk4zWTRZNlRSMDBYVnh2ME44VGNtUVJ3QThELTZvNXVO?oc=5,1774335600,Americana Luxury Streetwear Collections - Trend Hunter,Americana Luxury Streetwear Collections - Trend Hunter
gnews,runway trend,news.google.com,https://news.google.com/rss/articles/CBMiggFBVV95cUxNeVRuYklMUVNJaDVIM2M1QTZscjVsMHduQUN4MUdDWndZTDFUeWZ3eWxLbnd0cmRIcG1tWFJmd3Utbko2NHBNbFNMVXlPeDlkUU82SWNMT00yNU1EanV5UzduR1hMR3VrRnI3T3p5WElDaWdIbHN0T05kZjRtZ1hIYml3?oc=5,1775051250,The Fall 2026 Trends I’m Shopping and Styling Ahead of Time - Marie Claire,The Fall 2026 Trends I’m Shopping and Styling Ahead of Time - Marie Claire
gnews,runway trend,news.google.com,https://news.google.com/rss/articles/CBMiakFVX3lxTFBOdTZEMlM5UnRfMlVNbkRxYmVzYldhdFp3cGsxMnF3c2E2QW9Lc3hFT1FoeURvZXlJeEpCYnpTQzVKaU5sRzYxaVFqNW9aOWdHdzFYQjlmSWRMUWx3bFdjTEQtc2tfcHg5a2c?oc=5,1775246327,The 14 Biggest Fall 2026 Fashion Trends We Saw on the Runways - W Magazine,The 14 Biggest Fall 2026 Fashion Trends We Saw on the Runways - W Magazine
gnews,runway trend,news.google.com,https://news.google.com/rss/articles/CBMiYEFVX3lxTE1MaHZlVFBNaEZTcExQSW51TUhsU1N5S2t4TzQ2em5faTAzTm9aejA2cGJKYkJiYkFqNUFiSUxOY1c3MDA5M1NUcXo3aXkzTjk4bG5YLXI5bTdJbFl4UzB3Vw?oc=5,1773990000,The Fall/Winter 2026 Runway Trend Report - Coveteur,The Fall/Winter 2026 Runway Trend Report - Coveteur
gnews,runway trend,news.google.com,https://news.google.com/rss/articles/CBMijgFBVV95cUxNbFR4THAwYTFFU2FtR3hWQnJ4TzJobzVrc0lqUkM0ZWwzVlZNbjdjWFBaU1dka2ZTRWhYb3J5QTF5OFJ6alQ5anlnTmF3MUVRTVVRUUx4amJaTnpBMHRRWHJJSk5MN0JKQVFoZDVtZUZHNkNFYm1fWGllV3JqSm1KWFdNTk5wQ2ZlX08yM3pn?oc=5,1775264400,Every Major Trend to Know From Paris Fashion Week - Who What Wear,Every Major Trend to Know From Paris Fashion Week - Who What Wear
gnews,runway trend,news.google.com,https://news.google.com/rss/articles/CBMioAFBVV95cUxOTjJQX2tFbEkwR01GaUhGUklQOUw3ckFEYWRGMW43WXVJak15elVLRlY4MXR3T0d6SFE5YkdMMEZobktMS1Fkc21vQjY1SVBkX1JoazZIM3MzSmg5dWdXUnliQ1FYczRMU3RHbUZ4bTJPdjNZNFV1VlVBdUFpMUFEaThoekNuWk10X1NLZEVMXy16dFpMbHkxRTdrODBMWnZO?oc=5,1774906675,The Los Angeles fashion trend of the year is politics - Annenberg Media,The Los Angeles fashion trend of the year is politics - Annenberg Media
gnews,runway trend,news.google.com,https://news.google.com/rss/articles/CBMilwFBVV95cUxPMUw0UnVaUkRnZWpaaF9DNGw1c1VjMThDNXYwbGlDMFZ5bmZpNXdTY0dWNWhiZjY3THg5UFE2eTJEVHhOYzk3Uk1SVFVyaFhZdVBERGoyUlMyRG5qaGY5WG9KMjhmZ29FeFlTb2dNdWtTS2FvUlJSaUJWNVdYRWZJanBHVk1XMU9aRTdZVWgySmpaYkh4VDR3?oc=5,1775248196,These Are the 6 Key Fashion Trends to Pay Attention to This Season - Town & Country Magazine,These Are the 6 Key Fashion Trends to Pay Attention to This Season - Town & Country Magazine
gnews,runway trend,news.google.com,https://news.google.com/rss/articles/CBMiuwJBVV95cUxQaHpJc3pHZmdVb1dfWk8xQVhVNWxJc1hndEkxZ0d0Mnk2bDI5eXlGTm9WVVJ3Y083d1U3bUV5V3RGTGFQOVkyeGZuYl83ZlNrVF9vZGZ0UkZZYlJkbHRlWUxJSlRmTUtSRjFiLVZUR2tmRlptMVgtcXp4cERVQWVPQkNXWWlDbC11cE9LaXdGbWVIdFJSSHJQUEh2VGhnYnJFOVBkMG53S0JsTFl1bE95T1poUXJUamhQaWdnX0pLRW9oS2xrRkZFQ3JDM2lvY2J4OXE1MkxpTHhPUS1ndUJMS041MjhvZ3VGMmpsSWpOb0JuMkhra2Rva0l1d3daR2k0VGNmY1JUTXFTaWhZT3pIdC1wZjVjT3VrbTdIVWhpc2N4Q0R1emQ5WGdQX2RTRjVGYi1mZ1pSaVllQ2_SAcACQVVfeXFMUDc5TUxSTk5NNWVuWS1RRmk0SDktSi12NHN5MFM2UWV4NVlMUzdIZVVvYUVvQzNLVUh6REdfNUpUaS03SktqcnBfaFA0X3pLLXNtSUVrVGZiSHZGclNUWk9hcDRkeGo4dVFQZ0Flb2RYcDJkWlB1RzJVNVJsR3RFeGVPQlZKbVhoUXp2Q3B2ejBzcnBuOU9CRWhRNFJOWFlrS2QyN3Y1bE1vMmE2azN6UGozMVdCRkl2c1hRZkZKV3F6c1hraEwtY0VUbGs3Y1V5TU5vSVpnOEowR19fR2h0bE01bUpnRWJVaXRsTW4yMU45UHUwUTNXZm5yaVRITGV5cGJRN3BaT2FteUxydkh6Y3VqNTY2SHppOXpkdUd3QVB3NGsxVk10MDhSWGlsYWFodGY2dmpQeEdCdjJfSXJCQU0?oc=5,1775379240,"Move over rings, 2026 is all about wrist fashion trend: 5 rules for perfect bracelet stacking, according - The Times of India","Move over rings, 2026 is all about wrist fashion trend: 5 rules for perfect bracelet stacking, according - The Times of India"
gnews,runway trend,news.google.com,https://news.google.com/rss/articles/CBMieEFVX3lxTE9nc2ktNnQxVzlMTjl1MjR5MFYwSkMtVjI1Z0VhZlBLU0JqVlBjdHUyejJCVDV3OE9xYmF3ckhxR2VXLTk1Y3ZScXZfN0VPSU1ManFXYmFUWWxKTDN6cjFXTzk2OGxSVWxDOHIyeXZmRG9jUktfd2FIMg?oc=5,1775104200,The Vogue Business TikTok Trend Tracker - vogue.com,The Vogue Business TikTok Trend Tracker - vogue.com
gnews,runway trend,news.google.com,https://news.google.com/rss/articles/CBMixAFBVV95cUxOc2RyNmJFeEdXZGUzWjUzS1VyM04yZGJiQ1prOEpvTTFzZ0lCWHZLMEhmTk9seW11SkdCa1drNzI0V3BMX293SFQtQmdpdEt2NmxYXzdQQ0MxQ3VhY2VWUVVUX2Zza2c2bGVXc2FwNlM0ejUxSzdrT0tUYlZsWHZCZnlwbDdrMThvSnJfNXJ1aUh3UzhHZjZWWmI2Wndrczk1WWI0WTh5X2lBNktkYnpKS3hScDMzT09nRjRpUUl6ajhGUXVU?oc=5,1775316360,Zendaya Introduces the Fur-Trim Trend to Bridal Fashion - Harper's BAZAAR,Zendaya Introduces the Fur-Trim Trend to Bridal Fashion - Harper's BAZAAR
gnews,runway trend,news.google.com,https://news.google.com/rss/articles/CBMiqAFBVV95cUxPdldSRDBTZVRPUTRYV1dORldKNXNNWFVJYnRFeE5acU5wNFpnRHY3WFJkZ09fMWFGZG5pU2FZeEVTMzVYV3FBWFNzcUdjajdTYW53bG1acDNWMTVCUTNiQUdyVEk5TDhscERnRXQ5aGxDR21pMEYxWmRZYjNEY1lEcldUZFNLbmRTWXdKTWxWYXJCWTg2RldKb29RM2lHSndIQW9SOVFWUVM?oc=5,1774989073,Emma Chamberlain Shares the One Fashion Trend from Her Early YouTube Days She Wants to Come Back (Exclusive) - yahoo.com,Emma Chamberlain Shares the One Fashion Trend from Her Early YouTube Days She Wants to Come Back (Exclusive) - yahoo.com
gnews,runway trend,news.google.com,https://news.google.com/rss/articles/CBMijwFBVV95cUxNTEZIVU96bGRKYnRmY2tHeHA0a2NxYjIycDh0VjUwWTlWME0xaG1SOTlQYmlrNUdmQUtmbnhzQ19lU2ZZQUI3VjJpSGJqa1JjTnBmNW1uUzZtdkg1MEFnY0NSZmdpLWdic2p0d195VlYxMXQxWUdieXJEVFotdDJOY21HSlZqM2JGeWc3TXZWaw?oc=5,1775155811,Forget Basic White Sneakers—These 6 Styles Are Blowing Up in 2026 - ELLE,Forget Basic White Sneakers—These 6 Styles Are Blowing Up in 2026 - ELLE
gnews,runway trend,news.google.com,https://news.google.com/rss/articles/CBMigAFBVV95cUxQR1FuRFkyMU1tbnY2ZzVZbXRtRnJwdU9ZVFZwb2JlN2ZNR2hxcWliMWMzRmdlOWpXVkttRXAwT1V0RGV4VDhFU3BfWWJ6TFZXX0lQUC1ONzhlMmotU09lTG5MdkpITGtpTHpyak9rT0lhQ2JGZkYwRV9rbm5MQmhiUQ?oc=5,1775044271,8 Looks for Wearing Spring Fashion Trends (Well) - Vogue Arabia,8 Looks for Wearing Spring Fashion Trends (Well) - Vogue Arabia
gnews,runway trend,news.google.com,https://news.google.com/rss/articles/CBMigwFBVV95cUxOUnZRQl83dXdWYXJOOTNaaHVvRjVaYVBDaTFmUmpvaXI5aDFfTFhmWjd0eDBKTG91S3l2blMxek02YnlVRkRwZERESE5JbVpGajU0cElQSXloaGFHTkx3OV9veEpxd2UxRTRpWDVwRmRLMUlKVnctVGVuTEJnRjMzOTllQQ?oc=5,1774863600,I Got the Tucker Carlson Merch. I Don’t Think He’d Like My Friends’ Reactions. - Slate,I Got the Tucker Carlson Merch. I Don’t Think He’d Like My Friends’ Reactions. - Slate
gnews,runway trend,news.google.com,https://news.google.com/rss/articles/CBMia0FVX3lxTFBnOHV3aWI3MXphWGVnQ0NZbTVCUlVTYUtKWklFTVZDWWJ5V2JVRXJ5U2Zxb1FmMmhybGhPVWV5VEwyV0djX3FoWWRtUzNKbUlGVWdQNjYwb0lkSTRqLV81YXhNNDBYUWUzdFlr?oc=5,1775152800,The Handbag Trends Everyone Will Be Carrying This Spring 2026 - Refinery29,The Handbag Trends Everyone Will Be Carrying This Spring 2026 - Refinery29
gnews,runway trend,news.google.com,https://news.google.com/rss/articles/CBMidkFVX3lxTE9LN2t1d1FVNG9jN2RxWHJZZDJnQmxfVXlMVF8xeXVpQVpsQ1BIMmJvZlV4RE81ZExkYVVYOEc2MGhrZGpSRkdpS3FvaFZRRU1JNXRrSVIwYUdkVHdEckI5bng0Z2FSMXFHMjN0TGRPQnllMG9TWFE?oc=5,1775026800,No Neutrals Here: 8 Print Trends Fashion People Are Wearing This Spring - Who What Wear,No Neutrals Here: 8 Print Trends Fashion People Are Wearing This Spring - Who What Wear
gnews,runway trend,news.google.com,https://news.google.com/rss/articles/CBMijgFBVV95cUxNazJYNVNINU9MUmtQNkVkM3dlNDIzSE5pXzJhMFVRSHdsRkg1cXVneVEwM1BUYnBHMlNPZjlsUUNsZ1RsNjQ3Q1JIZ3RMUjc4WjcxOWwtZHFRbHFHQXQyUTlmdlFsY092LWlPR0NZYlhUNnFmb3FsWnpUQ0JYVGFxdERkbWF0YVBOZ1RmNDFR?oc=5,1773817200,The 11 Fashion Trends That Define the Fall 2026 Season - vogue.com,The 11 Fashion Trends That Define the Fall 2026 Season - vogue.com
gnews,runway trend,news.google.com,https://news.google.com/rss/articles/CBMiaEFVX3lxTE54ZmNrMU5NSy1NcWstNGVnRU5SVWJtb3ZVUkFnU1pzV012TDNRLXBNTjZ6OGVBMVNkc09KVzNacTlzT1hROFFJYzItZVJVRWFKLWUybXpxaTJnZGNaOUY4a1Y1OTMybS1t?oc=5,1774882882,Celebrities and Designers Agree: Cobalt Blue Is the New ‘It’ Color - vogue.com,Celebrities and Designers Agree: Cobalt Blue Is the New ‘It’ Color - vogue.com
gnews,runway trend,news.google.com,https://news.google.com/rss/articles/CBMie0FVX3lxTE85bVN4R0JLeWpfUkdoTURvQzJFWWpIbHc5cWR0MWRVNk82ZW5wMXp5eC1VaGktX0JQTUV1RXNEYWJiZ2dITE9NbVUzZ2t0X2Z3bmlIOFBSX0pGSmotbGlVSTh6aWNPYXdoRlBpM0Q0Q1JUMVU5M3QxWVMxUQ?oc=5,1775192400,Fashion Editors Agree: These Dated Trends Won’t Make It to Spring 2026 - Who What Wear,Fashion Editors Agree: These Dated Trends Won’t Make It to Spring 2026 - Who What Wear
