source,query,url,created_utc,title,text
youtube,men's fashion trends,https://www.youtube.com/watch?v=kAPv4eJ7u3o,1779963457,#pinterestinspired #fashiontrends #styleinspiration #dresstoimpress #everydayfashion #viralshorts,"Upgrade your everyday style with this premium men's shirt — designed for comfort, confidence, and a modern look. Made with soft ..."
youtube,men's fashion trends,https://www.youtube.com/watch?v=fQo2BNeJhoE,1779963526,men&#39;s Fashion Wear Deils#trending #fashion https://chat.whatsapp.com/IqyQ0qAaBaO05ESSJKNTOz Open,news #trending #fashiontrends WhatsApp link :https://chat.whatsapp.com/IqyQ0qAaBaO05ESSJKNTOz WhatsApp nambar ...
youtube,men's fashion trends,https://www.youtube.com/watch?v=r8QdZsqc52U,1779960381,Stylish Men Formal Outfit Ideas 2026 ✨👬🔥 Elegant Gentleman Fashion Trends❤️✨🔥#ytshorts,"Discover the most stylish and elegant men formal outfit ideas for 2026 ✨ From luxury suits to classy gentleman styles, these ..."
youtube,men's fashion trends,https://www.youtube.com/watch?v=ey0kvgs4Zyg,1779960157,#summerfashion #boysoutfit #fashion #trendingshorts,Your Style Request     outfit ideas     outfit ideas for girls   outfit ideas from meesho outfit ideas men outfit ideas for women     ...
youtube,men's fashion trends,https://www.youtube.com/watch?v=qMmRnPttBxg,1779957016,Top Wearable Summer 2026 Fashion Trends 5 #shorts,"fashion #summerfashion #womensfashion Top Wearable Summer 2026 Fashion Trends ☀️ In today's video, we're talking about ..."
youtube,men's fashion trends,https://www.youtube.com/watch?v=oyH1XF7MC14,1779956270,Top 10 Viral Men Fashion Trends 🔥 | Stylish Outfit Ideas 2026 #mensfashion #outfit #fashion #trend,Top 10 Viral Men Fashion Finds | Stylish Outfit Ideas 2026 Level up your look with these Top 10 viral men's fashion styles ...
youtube,men's fashion trends,https://www.youtube.com/watch?v=rHj6_iwJYk0,1779955485,Men’s Street Style Fashion 2026 | Classy Casual Outfit Ideas for Men 😎,Effortless street style with a modern classy vibe ✨ Olive shirt + beige wide pants = perfect minimal fashion combo ...
youtube,men's fashion trends,https://www.youtube.com/watch?v=icqxBlPLDVE,1779952692,!! men&#39;s vegan shoes 👟🤯✨!!#fashiontrends #fashion #menfashion #cooking #shoes,"Step into style with the ultimate Men's Vegan Shoes Collection! From running and training shoes to casual sneakers, dress ..."
youtube,men's fashion trends,https://www.youtube.com/watch?v=5KhLW2x_PAo,1779951084,The Outfit 💚| Classy Casual Look || #ootdguide #styleinspo #fashiontrends #ytshorts #fyp #meeshohaul,"""The Outfit || Classy Casual Look || #ootdguide #styleinspo #fashiontrends #ytshorts #fyp #meeshohaul"" Elevate your style ..."
youtube,men's fashion trends,https://www.youtube.com/watch?v=N6_-ef4bK38,1779950244,RKYMART UNIQUE COLLECTION MEN&#39;S &amp; OMENS 2026,"Product Range: This includes a wide variety of clothing items such as shirts, trousers, jackets, suits, jeans, dresses, skirts, etc., ..."
youtube,men's fashion trends,https://www.youtube.com/watch?v=qeApKSK2ZxE,1779943455,#mensfashion #latestafricaprint #fashion #abayakaftan #fashionstyle #fashiontrends #worldtailor,Trusted by fashion lovers across Ghana Quality you can see. Style you can feel. 0595966404 ...
youtube,men's fashion trends,https://www.youtube.com/watch?v=djraouBSJXI,1779940264,#trend #fashion #clothing #mensfashion #shortsfeed #outfit #fashionformen #ootd #meeshoparorderka,MenShirt #FashionForMen #StylishShirts #MenStyle #ShirtFashion #CasualWear #OfficeWear #TrendyShirts #Men'sFashion ...
youtube,men's fashion trends,https://www.youtube.com/watch?v=1-s8vT3-Lr0,1779939258,👉 “Girls Notice Boys Who Dress Like This 👀🔥”,"Welcome to Dapper Society ✨ Elevate your style with the latest men's fashion trends, outfit ideas, and grooming tips. From school ..."
youtube,men's fashion trends,https://www.youtube.com/watch?v=oZwKoUe5vJQ,1779936661,fashion show #mensfashion #hoodieq #outfitideas #styleish #styly #fashionshorts #fashion #trending,"Welcome to Fashion Xpress — your fast and stylish destination for the latest fashion trends! Yahan aapko milte hain outfit ideas, ..."
youtube,men's fashion trends,https://www.youtube.com/watch?v=dEoqbI82Bd0,1779933873,Top 5 Trend 🔥 Shirts Combo...(छपरी के जैसे ड्रेस पहनना आज से बंद कर दो) #mensfashion #trend,Top 5 Trend Shirts Combo...(छपरी के जैसे ड्रेस पहनना आज से बंद कर दो) #mensfashion #trend ...
youtube,men's fashion trends,https://www.youtube.com/watch?v=fZU8PgMP8YQ,1779933678,THINGS THAT LOOK GOOD ON MEN? #fashiontrends #fashion #ootdguide,
youtube,men's fashion trends,https://www.youtube.com/watch?v=B6L6cIVOCvE,1779932972,𝐬𝐭𝐫𝐚𝐢𝐠𝐡𝐭 𝐟𝐢𝐭 𝐣𝐞𝐚𝐧𝐬 👖 #fashion #outfitinspo #shorts #streetstyle #fashiontrends,"""If this channel has helped you at all, please consider Subscribe → ‪@Endouk_Fs‬ °• If you are confused about where to use these ..."
youtube,men's fashion trends,https://www.youtube.com/watch?v=_fdCy5usW9w,1779930320,Premium Timex Watch for Men 😍⌚🔥 #shorts #mensfashion #fashiontrends #mensstyle #casualwear #ootd,Stylish Timex watch with premium luxury look ✨⌚ Perfect men's accessory for office wear & casual outfits Comment “LINK” ...
youtube,men's fashion trends,https://www.youtube.com/watch?v=0zyuj6btvVo,1779928097,Pack of 3 T-Shirts Under ₹500 For Men #menfashion #fashion,Pack Of 3 T-Shirts Under ₹500 For Men #menfashion #fashion #styly #fashionaccessories #style #stylish #fashiontrends ...
youtube,men's fashion trends,https://www.youtube.com/watch?v=IlmCWt1C7g8,1779921212,Why Are Rhinestone Jeans Becoming The Default Men’s Fashion Trend Now?! 😭😭 #holyshabazz,"What's good, Shabazz Squad?! This is Holy Shabazz, your go-to source for dope content that sparks thought and ignites ..."
youtube,men's fashion trends,https://www.youtube.com/watch?v=HU2Ijunl7O8,1779916022,🔥 Upgrade your everyday style with this Men’s Long Sleeve Polo Shirt,Upgrade your everyday style with this Men's Long Sleeve Polo Shirt featuring bold 3D striped detailing and modern streetwear ...
youtube,men's fashion trends,https://www.youtube.com/watch?v=lecZgc8Mxig,1779906637,&quot;DM&quot; MILDIN Men Regular Fit Striped SpreadFull sleeve FormalShirt #fashiontrends #meesho#viral#love,fashiontrends #meesho.
youtube,men's fashion trends,https://www.youtube.com/watch?v=WP8a9zQjzUc,1779899663,Carbon fiber version #fashiontrends #watch #Men&#39;s Watches#Luxury Watches#watchesandwonders,
youtube,men's fashion trends,https://www.youtube.com/watch?v=rHT8AHyBq1g,1779897624,Які тренди чоловічої моди мають зникнути?,"По питаннях реклами, співпраці: https://t.me/dolce_vita1703 0:00 - вступ 0:05 - діловий одяг 02:03 - шорти а спекотну погоду ..."
youtube,men's fashion trends,https://www.youtube.com/watch?v=JphodlO5ktQ,1779895803,"PRIMEIRA VEZ NA RUA TERESA EM PETRÓPOLIS: preços, tendências inverno, roupas femininas e masculinas","No vídeo de hoje, visito a Rua Teresa em Petrópolis pela primeira vez. Mostro preços, o que está em alta nas lojas para o inverno ..."
youtube,women's fashion trends,https://www.youtube.com/watch?v=s9Rf13Z7-LQ,1779963935,saree collection for women #fashiontrends #latestinbeautylineupproducts,
youtube,women's fashion trends,https://www.youtube.com/watch?v=s3fhOVedNhc,1779963006,Ritu mam🥰🌺#talentedrituinsan#viralvideo#viralchannel#haryanvisong#newdesign#fashiontrends#style#yt,viralchannel​​#viralvideo​​​​​​​​​​​​​​​​​​​​​​​​​#talentedrituinsan​​​​​​​​​​​​​​​​​​​​​​​​​# ...
youtube,women's fashion trends,https://www.youtube.com/watch?v=URZun4gVsco,1779962937,#women #fashion #trends,
youtube,women's fashion trends,https://www.youtube.com/watch?v=kwzm0Ri2L18,1779960811,Women Knitted Fashion | Latest Girls Sweater Fashion Trends 2026 ❄️🔥 #shorts,Women Knitted Fashion ✨ Trendy + Comfortable = Perfect Winter Look ❄️ Discover our soft knitted sweater designed for ...
youtube,women's fashion trends,https://www.youtube.com/watch?v=XMUyx8WeuXI,1779960617,Morya Ho Bappa Morya #trending #fashiontrends #hindisong #shorts,
youtube,women's fashion trends,https://www.youtube.com/watch?v=JYbK4RVh2F0,1779960417,Latest Sleeveless Fancy Handwork Top for Women | Trending Fashion Reel #ytshorts #womenfashion,"Cotton Sleeveless handwork top * Length 28"" * size - 36-44 (s-m-l-xl-xxl) * handwork tagai Detailing on neck and armhole ..."
youtube,women's fashion trends,https://www.youtube.com/watch?v=lIKo3um-nqY,1779959563,Trendy Fashion Outfit for Women’s New Design 👠 Viral Stiletto High Heels Mules Shoes 2026,"Welcome to Trendy Fashion Outfit ✨ Discover the latest women's fashion trends, stylish outfits, viral stiletto high heels, elegant ..."
youtube,women's fashion trends,https://www.youtube.com/watch?v=lKN8KbrgRlM,1779958836,Urban style vibes: modern outfits and street fashion trends #fashion #style #streetoutfit #shorts,Street fashion is all about freedom and creativity. Here you'll find beautiful streetwear outfits—from denim and hoodies to skirts ...
youtube,women's fashion trends,https://www.youtube.com/watch?v=CVx3yhS5hBg,1779957250,#PartyWearSaree #SareeCollection #DesignerSaree #TrendingSaree #Fashion #WomenFashion #StylishSaree,Party Wear Saree Collection 2026 | Latest Designer Sarees For Wedding Party | Beautiful Stylish Women Fashion Saree ...
youtube,women's fashion trends,https://www.youtube.com/watch?v=qMmRnPttBxg,1779957016,Top Wearable Summer 2026 Fashion Trends 5 #shorts,"fashion #summerfashion #womensfashion Top Wearable Summer 2026 Fashion Trends ☀️ In today's video, we're talking about ..."
youtube,women's fashion trends,https://www.youtube.com/watch?v=YjXUydNwGlw,1779953407,Ritu man😍🤭#talentedrituinsan#viralvideo#viralchannel#haryanvisong#newdesign#fashiontrends#style#yt,viralchannel​​#viralvideo​​​​​​​​​​​​​​​​​​​​​​​​#talentedrituinsan​​​​​​​​​​​​​​​​​​​​​​​​# ...
youtube,women's fashion trends,https://www.youtube.com/watch?v=LmKQdUNO6do,1779952676,Patent Leather Buckle Mules #mules #fashion #shortsfeed,Elegant Shoes Step into the world of trending women footwear latest stylish & comfortable shoes collection for modern ladies ...
youtube,women's fashion trends,https://www.youtube.com/watch?v=kXPNx8es17Y,1779952028,Women Unboxing Low-Heel Loafers Flat Shoes for Daily Wear #flats #fashion #shortsfeed,Elegant Shoes Step into the world of trending women footwear latest stylish & comfortable shoes collection for modern ladies ...
youtube,women's fashion trends,https://www.youtube.com/watch?v=gxplq0QNyuo,1779949831,Mariacarla walk🔥 #fashiontrends #trendingshorts #model #runway #viralshorts,
youtube,women's fashion trends,https://www.youtube.com/watch?v=jdtLQ4fZpr4,1779947880,New trending suit #shorts #fashiontrends #fashion,
youtube,women's fashion trends,https://www.youtube.com/watch?v=mkgoRWc0uZA,1779940056,Mesh Rhinestone Flat Shoes #flats #fashion #shortsfeed,Elegant Shoes Step into the world of trending women footwear latest stylish & comfortable shoes collection for modern ladies ...
youtube,women's fashion trends,https://www.youtube.com/watch?v=ign_R0FzOHw,1779939198,Trending New blouse Sleeves design New Latest Blouse neck designs बाजू में खूबसूरत डिजाइन#shortsfeed,Trending New blouse Sleeves design New Latest Blouse neck designs बाजू में खूबसूरत डिजाइन#shortsfeed ...
youtube,women's fashion trends,https://www.youtube.com/watch?v=SeOzLcVqyiU,1779939012,New trending back neck blouse design💯followformore#fashiontrends#differentunique#stylish#perfectlook,ytshorts #viralshorts #shortvideo #shortsfeed #simpleyetclass #subscribetomychannel #traditional #uniquecollectionofficial.
youtube,women's fashion trends,https://www.youtube.com/watch?v=OVw-LGPINHc,1779938642,OOTD 🤍 #StyleInspo #fashionstyle #fashion #fashiontrends #chicoutfits,
youtube,women's fashion trends,https://www.youtube.com/watch?v=x-ofKW9-v-E,1779937464,Stylish Knitted Sweater Design 2026 🧶💖 Winter Fashion Trends for Women ❄️ #fashion,
youtube,women's fashion trends,https://www.youtube.com/watch?v=G0WtW87hbas,1779935410,The outfit 🤍||Shirt look 😍#ootdguide #fashion #fashiontrends #styleinspo #ootd #shorts #shirts #song,Classy black & white outfit inspiration ✨ This elegant white button-down shirt paired with black wide-leg trousers creates the ...
youtube,women's fashion trends,https://www.youtube.com/watch?v=SVOmdF7TiJo,1779935292,Trendwomanfashion | Cozy &amp; Chic Women&#39;s Sweater Looks 2026 🧶💖 #fashion,Trendwomanfashion ✨ Trendy + Comfortable = Perfect Winter Look ❄️ Discover our soft knitted sweater designed for modern ...
youtube,women's fashion trends,https://www.youtube.com/watch?v=rk7-nsi_3uw,1779934853,Trendwomanfashion | Cozy &amp; Chic Women&#39;s Sweater Looks 2026 🧶💖 #fashion,Trendwomanfashion ✨ Trendy + Comfortable = Perfect Winter Look ❄️ Discover our soft knitted sweater designed for modern ...
youtube,women's fashion trends,https://www.youtube.com/watch?v=fCR2D3BS4XA,1779931807,Jhumka Gira Jhumka Shorts✨️❣️ #earringsdesign #jhumka #trendingshorts #fashiontrends #summerfashion,Jhumka Gira Jhumka Shorts✨️❣️ #earringsdesign #jhumka #trendingshorts #fashiontrends #summerfashion #shorts ...
youtube,women's fashion trends,https://www.youtube.com/watch?v=RuEuHtnkhrg,1779931480,Stylish Knitted Sweater Design 2026 🧶💖 Winter Fashion Trends for Women ❄️ #fashion,
youtube,streetwear 2025,https://www.youtube.com/watch?v=5xFGahukEoo,1779913809,What Brands are overhyped and what brands are underrated?,Clip from Compex Con. 2025. We want to know your thoughts on the streetwear game! #interview #fashion #streetwear #artist.
youtube,streetwear 2025,https://www.youtube.com/watch?v=TAa0EPbjFK4,1779707014,Oversized Plain Black T-Shirt Style 🖤 | Trending Men’s Fashion 2025 #oversizedtees #oversizedshirt,Stylish oversized plain black t-shirt for men Perfect streetwear outfit idea with comfortable oversized fit and premium casual ...
youtube,streetwear 2025,https://www.youtube.com/watch?v=LrFbZaeHc2M,1779580072,OVERNIGHT EDGE #memecoin2025  #streetwear #WALLSTREETVIBE,The market is like a baby… quiet for a moment… then suddenly full of energy again.” #OvernightEdge #WallStreetVibe ...
youtube,streetwear 2025,https://www.youtube.com/watch?v=ScVq18k4hgI,1779525075,🔥 CR7 Inspired Outfit 2025 ⚽ | Ronaldo Style Fashion 😎 | Black Tee + Baggy Pants + Jordans #Shorts,CR7 Inspired Outfit 2025 Oversized Black T-Shirt White Baggy Pants Air Jordan Sneakers ⌚ Luxury Watch ...
youtube,streetwear 2025,https://www.youtube.com/watch?v=hXzZdpt94LA,1779493103,Brawl Stars Loading Screen Streetwear 2025 Csupo,Telegram channel: https://t.me/zetexgram Telegram chat: https://t.me/+Kmf_QszLkIdkNTBk Other social networks: ...
youtube,streetwear 2025,https://www.youtube.com/watch?v=ulfpKHjD1G4,1779451742,Czy to najlepsze Jordan 4? | Black Cat 2025 | Street-Zone.pl,Po oryginalne sneakersy i streetwear zapraszamy na Street-Zone.pl Kod Rabatowy ZONE30 na 30zł.
youtube,streetwear 2025,https://www.youtube.com/watch?v=WL9yTkITYRc,1779449495,🔥 Cristiano Ronaldo Inspired Men’s Fashion 2025 ⚽👕✨#outfit #cr7 #ronaldo #shorts,Upgrade your style with this Cristiano Ronaldo inspired outfit Blue striped shirt White baggy pants Nike white sneakers ...
youtube,streetwear 2025,https://www.youtube.com/watch?v=OsB053QVODQ,1779186285,Halloween In Tokyo 2025,Tokyo Japan 2025 During Halloween.
youtube,streetwear 2025,https://www.youtube.com/watch?v=qQKCpNlGW9A,1778936692,Where to buy Fire Graphic-Tees 🔥#streetwear #teeshirt,"Streetwear inspo 2025 From hoodies, jorts, caps to the latest sneaker drops – this Short brings you the best streetwear ..."
youtube,streetwear 2025,https://www.youtube.com/watch?v=kikMRKkuoIQ,1778929539,👟✨ Estas son mis mejores adquisiciones del 2025 ¿Cuál de estas te pondrías tú y cuál dejarías en...,Estas son mis mejores adquisiciones del 2025 ¿Cuál de estas te pondrías tú y cuál dejarías en la tienda? Los leo abajo.
youtube,streetwear 2025,https://www.youtube.com/watch?v=Acc_yNb2Gd4,1778814257,Stop Buying Skinny Jeans! The BEST Designer Baggy Jeans of 2025 #baggyjeans #widelegpant,Contact- 9569909437 (NO COD) ❌ • Baggy Jeans • Wide Leg Jeans • Designer Jeans • Denim Trends • How to Style Baggy ...
youtube,streetwear 2025,https://www.youtube.com/watch?v=kCpcF5twY_0,1778772610,Fire Denim you must cop🔥#streetwear #denim,"Streetwear inspo 2025 From hoodies, jorts, caps to the latest sneaker drops – this Short brings you the best streetwear ..."
youtube,streetwear 2025,https://www.youtube.com/watch?v=VyTuywH7Hp4,1778696408,BAGGY TRACKS  #explore #fashion #stylestudio #viral #youtubeshorts #fypシ #vijay #ipl2025 #viralshort,
youtube,streetwear 2025,https://www.youtube.com/watch?v=YH1PFfwJIFQ,1778671155,Unveiling the Dodgers Mamba Edition |  Dodgers 2025 World Series Champions Mamba Jersey🔥,"Stand out with this bold tribute to Kobe Bryant. The '24' number that honor a legend, and the stylish crocodile print that makes this ..."
youtube,streetwear 2025,https://www.youtube.com/watch?v=3q6KF6y1R00,1778642086,WEARING WHO DECIDES WAR IN 2020 vs 2025  Shout out Ev Bravado man!!!!,WEARING WHO DECIDES WAR IN 2020 vs 2025 Shout out Ev Bravado man!!!!
youtube,streetwear 2025,https://www.youtube.com/watch?v=dB3RJKVHgPo,1778599834,Is ComplexCon Actually Worth the Hype? (2025 Recap),Come with Streetwearhouse to COMPLEXCON in 2025 to interview some of the most popular brands and owners. 00:00 Intro ...
youtube,streetwear 2025,https://www.youtube.com/watch?v=o2AYYDoh6o4,1778572343,Elegant Street Glam Look Taking Over 2025 ✨🔥#fashion #Fashion2025 #StreetStyle #GlamLook,"Elegant Street Glam Look Taking Over 2025 ✨  #fashion #Fashion2025 #StreetStyle #GlamLook Confidence, style, and ..."
youtube,streetwear 2025,https://www.youtube.com/watch?v=Bmb11JuZfW4,1778525983,Started at 15 years old,streetwear #fashionstartup #teenpreneur #2025 #aesthetic #clothingbrand #fashion #startup #zynth.
youtube,streetwear 2025,https://www.youtube.com/watch?v=1QtY_hS4uoE,1778479212,2025✨️,
youtube,streetwear 2025,https://www.youtube.com/watch?v=42YXd2gv2-A,1778389804,justin with the paparazzi in 2010vs 2025#justinbieber #paparazzi #2010 #2025 #celebrity,
youtube,streetwear 2025,https://www.youtube.com/watch?v=CccIvYVutVE,1778374945,Trending Baggy Jeans &amp; Shacket Styles for 2025 | Celebrity Look Breakdown,Trending Baggy Jeans & Shacket Styles for 2025 | Celebrity Look Breakdown Looking for the best casual outfit ideas?
youtube,streetwear 2025,https://www.youtube.com/watch?v=ByhD-OujjDw,1778348012,opening offers 11/05//2025 🔜 #clothing#viral #tranding #newshop #newshorts,opening offers on 11/05/2026   visit over stor WhatsApp app :- https://chat.whatsapp.com/CknGlKvZZB9BwV4zhGNYOf instagram ...
youtube,streetwear 2025,https://www.youtube.com/watch?v=vtRoHWmd4zA,1778269881,Best t-shirt brands to check out in 2025. Pt. #Shorts #flyshtdrew,Best t-shirt brands to check out in 2025. Pt. Best t-shirt brands to check out in 2025. Pt. Best t-shirt brands to check out in 2025.
youtube,streetwear 2025,https://www.youtube.com/watch?v=p4IgAhCy_Ss,1778259671,Shoe of winter 2025 🥷 Nike P-6000  #wintershoes2025#uktrainers#p6000#nikep6000 #sneakerdaily,The Nike P-6000 is a modern throwback that channels early-2000s running culture into today's streetwear scene. Inspired by ...
youtube,streetwear 2025,https://www.youtube.com/watch?v=Fr1KuYwqx70,1778253511,Jordan 4 undefeated 2025 #fyp #sneakers #ootd #streetwear #jordan4,"short #sneakerhead #unboxing Leave me size!!! Hello! My friend, if want this goods add our whatsapp:+86 152 6026 8083."
