source,domain,url,created_utc,title,text,query
gnews,news.google.com,https://news.google.com/rss/articles/CBMiXEFVX3lxTE83SGY0TU1WVnJOVVpRU0VTczJvUWpaZWt1MzQ0MHVjb3V2TjktekpKOUZrWGl6Qm9HWjVPanAxcHFETlRtZjRCWXlnY3VwYzkyZVNEcTlEWjktQjhs?oc=5,1781211878,"If You Try One Trend This Summer, Make It This Lush, Romantic, Trim Trend - instyle.com","If You Try One Trend This Summer, Make It This Lush, Romantic, Trim Trend - instyle.com",fashion trend
gnews,news.google.com,https://news.google.com/rss/articles/CBMijgFBVV95cUxQOG5ZYWdLQ0lnckViWnNmNEpmNG8zcVl2bW9GUnVZSjd2U2UxX1FhdlU1QXRZMUx4bmJPNW16aEtDNFpCbW1ySTg4cXlQOUVnNWNLNlZEUzZDWnVENnhYUl91QnZQWEZfNmVrcHl3cm94Q0RxemVjN2xVb3RETzBmNDRXdjB1UExDTDF5dm9n?oc=5,1781301094,"How Latinas are reclaiming the World Cup aesthetic through fashion, beauty, and culture - HOLA","How Latinas are reclaiming the World Cup aesthetic through fashion, beauty, and culture - HOLA",fashion trend
gnews,news.google.com,https://news.google.com/rss/articles/CBMidEFVX3lxTFBFU2JXMVZIcllvbXY5VDFyNlFyRWUxUW9tc1BpUkxFWGphM1UxVUZsZ2w2U1FyZHllMXRRWE03d0Z2dG5MWmQteGRRR3Ayel9XWGlMTkRBQ1VYMjJWZ0g5cXRCa2NVNXJTT0JMUmR5SlBBU2Zk?oc=5,1781161200,"Say Goodbye to Barrel Jeans, and Hello to the Denim Trends Taking Over 2026 - ELLE","Say Goodbye to Barrel Jeans, and Hello to the Denim Trends Taking Over 2026 - ELLE",fashion trend
gnews,news.google.com,https://news.google.com/rss/articles/CBMiigFBVV95cUxPdFVfeHRTQ0JnY2plYktERkRlUFhDaWdIUm51TEVNN3NJWDdqRDlwSkhiQmFmRXJQak8weEs3cWVHVS00cVN0bWhMcG5HbGFZaXZzS3liaFZJeTRoZW5tZ3oyaFE3T0hfSnZqVFFobE5mN3ZZZEpReWFRWVNNME5XYnZ3MlZxQXJJR0E?oc=5,1781143200,I'm Bored of Black—These Colour Pairings Are Far Cooler in Summer 2026 - Who What Wear,I'm Bored of Black—These Colour Pairings Are Far Cooler in Summer 2026 - Who What Wear,fashion trend
gnews,news.google.com,https://news.google.com/rss/articles/CBMiogFBVV95cUxNLTk4aWc2R2RQTHk5ZGpYYlpfOU1IWUxQdHk4TkczcW42dElGenRHYXNoQlQyVlBfNF9ZTFVLbUM0VjhZNXRQaHNnYV8xUWhkdG52Q1RtNEd4SG9pR09RWGRzdkZ2NEFDRng5NzE1TUtZVXJBa3Z1aVhGc0kzU0tpRmtjYjBCalBMcGZzZHhMU1V1djYweXY1Uno3ZnZZaGxjNWc?oc=5,1781187770,"Soccer, ATL style: 7 homegrown pieces to get you World Cup ready - uatl.com","Soccer, ATL style: 7 homegrown pieces to get you World Cup ready - uatl.com",fashion trend
gnews,news.google.com,https://news.google.com/rss/articles/CBMiYEFVX3lxTFBsUmZLVnFOeUJVYVNZWmkybHBiWTUwdkM4bkZHVHRYSy1uYXMtN1JlekZJNEthMnhza3oyaUNSUVVMYllsdDlxUHRCNEJyRVo3UG1LUFBpaHZsUFd4MGk2Rw?oc=5,1781194542,Dileiny Baron Isn’t Chasing Summer Trends—and That’s Exactly Why Her Style Works - PureWow,Dileiny Baron Isn’t Chasing Summer Trends—and That’s Exactly Why Her Style Works - PureWow,fashion trend
gnews,news.google.com,https://news.google.com/rss/articles/CBMilAFBVV95cUxNY1MtdEQ0b0p6WS13Q2N3M2NHSG9WZjk2X1cxTHFaNXpmYk1vREd4ZDVZMk9ja1Q2Q2VEQkdOWTJHY1VUbXVTSTlDcDFYSkNlc2otU29ROVhRaGI3cjFyejA5eHphTjg1bWhULWxqQkt3NEY5cGJlM2tCMUNOVDRoaHZEYTFFYWdLY0dEU24zWjd1SENP?oc=5,1781092800,Personal Style Is Escaping the Algorithm - ELLE,Personal Style Is Escaping the Algorithm - ELLE,fashion trend
gnews,news.google.com,https://news.google.com/rss/articles/CBMiXkFVX3lxTE1JdkwyS2JoangtY2duYUtPNkp1YkkyMDd0eHFyVXVDZllLNGp6ZldiMmN0SzVlUFBrczMwM2dYR2RHNXlIal9jRGJ0OGxhUTI0cktaTm1XdXUzUDBDS1HSAWNBVV95cUxNXzZVT0V0bTVoSXc1M09tYnVHVUtmVC1rTXFKQk53ck8wcEdDOGpNb1ZONERIMnNKRUwzaXg4cTlHaUw5MUc5dlVJSVhpQktMY2paMmt3U3R4Sm9VMkxyMUx5bTA?oc=5,1781324175,Festival-Inspired Resale Marketplaces - Trend Hunter,Festival-Inspired Resale Marketplaces - Trend Hunter,fashion trend
gnews,news.google.com,https://news.google.com/rss/articles/CBMiiwFBVV95cUxPT3ZER3NpczhFVFdpQXk1M2pKRWQ2T21JVF9lZERrWWFtU0dQclFDbG5xQkQxSW0zNXA1R21yWVJxNVF1TER0bGV1UV80aUxyT2NJMkM2RU5sQlRzV3Y3UFJVQVkzVG9aOWN6VDAyYWVBMHFoQ2pMeHNvODllcGhRdlQwR1VWejNUaW53?oc=5,1781299920,Fashion People Are Styling Their World Cup Looks With These 4 Staples - Cosmopolitan,Fashion People Are Styling Their World Cup Looks With These 4 Staples - Cosmopolitan,fashion trend
gnews,news.google.com,https://news.google.com/rss/articles/CBMikgFBVV95cUxQRGs3SG9OWnlQeFhsaW1BRHRPdmhlM25rdjdIcnVjckxCUnJIdWc4YXlJLWUwNjVmSTVUa1pXTF9SLXpoQU9LbFdxWXBwN0NWMU1LMk1wZjg0SnNjTXlEdjVnRUxUOHhJSktpaE9zYk1fN2dKeExMdHJpUzNqSFZiUDZMVzk4dEVKX0lzb2lvdDEzdw?oc=5,1781092800,Why Little Luxuries Feel So Good Right Now - ELLE,Why Little Luxuries Feel So Good Right Now - ELLE,fashion trend
gnews,news.google.com,https://news.google.com/rss/articles/CBMiZkFVX3lxTFB3WnZFdm5XUnVSNlFtNEhiSUZmTWQ0bVdyNHhncUlwQjZNcEw3U3R6ZU1Dbi0yWnI2c2xIc2ZtYUJ4R09lNmN4eUZZNmlfWndOT0YzQ2g5b3RYNGRoVVNmVnNmV0prUdIBa0FVX3lxTFBOb2tBXzFVSHdKa2t3RUc0RWc5b1lsa1d4TEdKc0NaVFJ5aGIzRlpjMEFaVzNIOU9ySFhkTVJNVTRRbExvRUQwSF9ZMGhGNVdOd3N0VjlPM3JnSmo3b3hTMnVhT0JURm1BNmRn?oc=5,1781314875,Summertime Cityscape Fashion Ranges - Trend Hunter,Summertime Cityscape Fashion Ranges - Trend Hunter,fashion trend
gnews,news.google.com,https://news.google.com/rss/articles/CBMilgFBVV95cUxPcE85S3ZCOENNQ2tFdDV5dFlpc2lDTTBwZUNtSkdwU1h6aWRHTEZDUng4b2tqbDFHNkFnODhRQVhrQnZsQ1c1QXdzZ1VSdFB3bFJpTUhpY1ZwNmdUOGhsd09xalNaTm5QQTh3WU1hZ1lCSF95MGVabkluNjU2RmxFTnpvWlpXUmJOU3l5aHo1V0MySjlpalE?oc=5,1781297505,The 2026 Jewelry Trend It Girls Are Wearing to Make Their Summer Outfits Dramatically Cooler - Who What Wear,The 2026 Jewelry Trend It Girls Are Wearing to Make Their Summer Outfits Dramatically Cooler - Who What Wear,fashion trend
gnews,news.google.com,https://news.google.com/rss/articles/CBMiiAFBVV95cUxNcmVkMVJRSENxaTN2M2U1WXg5V3dWTDRsWEZjbGdMdDZ0M2JPeWdaZ0FYc2ROOGRUNE1YMmp1Zm1ueHlUSDAzcTZNWmVQamtnTHFkRkU0bUw3Wkd1ZDRqYzFiV1NrakFHQ1U4a0ZQQkp1RWpKRnZvMlpqQmt4bENtSUp4QV8wdXZL?oc=5,1781244049,"There's a summer dress for everyone – 6 best trending styles to shop now, from drop-waists to linen shifts - Cosmopolitan","There's a summer dress for everyone – 6 best trending styles to shop now, from drop-waists to linen shifts - Cosmopolitan",fashion trend
gnews,news.google.com,https://news.google.com/rss/articles/CBMiRkFVX3lxTE83cXc1NXRvN0tZVHl1U3RWelJYaDlmZURPWmxZVG41WWpzTE1JOWV2VXFodlFnSGF3TGRCbTA1cHB2VlpnNUHSAUtBVV95cUxPX1hZNXZQZjNXZ2d6RGtMR20tQjN3SjVkQTFYU0lMRmprQm5oZkRLQndZWTZ1a3NZNDQzNWdyU3hPU1JORmZfN20zYXc?oc=5,1780966800,New wedding fashion trend: the skirt suit replaces the dress - Наша Ніва,New wedding fashion trend: the skirt suit replaces the dress - Наша Ніва,fashion trend
gnews,news.google.com,https://news.google.com/rss/articles/CBMiXEFVX3lxTE1ibzFwYUxmWGdocVA0ZV84dExOV1VaWU0zbkJ4bzltNE1iOUdaMUl5VnFoQUZMSFJNalRKVFJFb0NNc0Q4dU0yRE9rTTBIc083bXZqMEZKclN3cDBt?oc=5,1781185478,Fashion Trends 2026: Guide for Ecommerce Brands - Shopify,Fashion Trends 2026: Guide for Ecommerce Brands - Shopify,fashion trend
gnews,news.google.com,https://news.google.com/rss/articles/CBMickFVX3lxTE50bk01WlZlRk1NUTJEMVppNFAzdEUzbkpabEgzNm85U09ka2h6S3BSeVM1UUFyTGl4MEpzZUdjYlpDRnE4bHdoTW5xWm5fa0ZBTEg2VXRRSlNaazZPRWFwckFOTjE2NjZUeFZjSXBSOHJ2Zw?oc=5,1781179225,The Disney Collaboration Fashion Editors Are Actually Wearing - The Zoe Report,The Disney Collaboration Fashion Editors Are Actually Wearing - The Zoe Report,fashion trend
gnews,news.google.com,https://news.google.com/rss/articles/CBMihAFBVV95cUxPTWhEcnB2ajVUVnJlR0hWRnFUZ0UxSHJnZWpJbGdtcFNCQ3gzUUY1T1JxQnlXTDNFbjVnMkRWZC1pbFFHU0piemdPS1Ntd3QxeG1oNW9rQWpDenowUmJKSEpYLUUyMkdfS3hVZkQ2WnRnRnphQlpaWkVIQlU4TXI4dEFuZDQ?oc=5,1781245200,"5 Chic Summer Blouse Trends That You Can Shop at H&M, Zara and M&S Right Now - Who What Wear","5 Chic Summer Blouse Trends That You Can Shop at H&M, Zara and M&S Right Now - Who What Wear",fashion trend
gnews,news.google.com,https://news.google.com/rss/articles/CBMitwFBVV95cUxOLXE2Sm5HSHNUcjR4NE9sQTludkdLMGNrQUJrTC1uSHFIbkVUSEQtSXRWd1paY05tb0pRVkVHYkd5OE5WQ2Q3Q3hIZFBlNTM3VUJqc3RNcVkxSlplRFpPV0VfOVB3N084Y0lRMEdEYXJpVnRiZ0c1OFFCdXh4RHNmTkI5OENCdG5xNmJIQXZmNHQ5ek81RGxIc1JmTkFiWXZzZGF2bjBCUjhjWTZpek95enAyWEU4bTg?oc=5,1781326876,K-Style Heatwave: The Secret Wardrobe Essentials Every Korean Man is Wearing in 2026! - Dojeon Media,K-Style Heatwave: The Secret Wardrobe Essentials Every Korean Man is Wearing in 2026! - Dojeon Media,fashion trend
gnews,news.google.com,https://news.google.com/rss/articles/CBMifEFVX3lxTFBselMxWDVWTy0zUjBzd3MyRnp3dC1DZk41RlNGQkhCNGdjODZaS01Tdk1VbDlyajVwaFNhSW9FeVJtU04zZkVjbWcxbzl6c1dRR1RMY1RmUVhKdDVkdlpFTGE3M2dRS3FkSzNsa0k1elhINkNqeW5SZ2ZoLUfSAYIBQVVfeXFMTVNidkluYUN4SWhabHY5YmJSSk5XTWtwUWhjY0QxNUp0RVdIdHNCQ0xMdGJVSVZuSUZ5M1YydjZONDRhMG5WZGt1UjVwUGF5dDRWdlhSZmczNG9uWHZnM3hXbDF4YWVOWmRKRGptazRsMEh2SVJWRi14eTBWTVlkRUdUdw?oc=5,1781056800,Mint Is Having a Main Character Moment Across Fashion and Beauty Trends - Prestige Online - Singapore,Mint Is Having a Main Character Moment Across Fashion and Beauty Trends - Prestige Online - Singapore,fashion trend
gnews,news.google.com,https://news.google.com/rss/articles/CBMif0FVX3lxTFBiZXFIbVAtNndYYXBibWJ4OVc4Y3g1Qng1LW1wVXpORkxtX0c5WTQxNnppakk4WUNOVXpBTmc2amdaM2dRLUdVaHZtaFNTd3ZjakgyNU05UUptcG05Yzh6TXdzcmlWSWpYMm94R2VUQlByQ1pOVlE4bV9JaVVKUFU?oc=5,1781280845,Queen Mary proves the shirtdress trend is perfect for every age - HOLA,Queen Mary proves the shirtdress trend is perfect for every age - HOLA,fashion trend
gnews,news.google.com,https://news.google.com/rss/articles/CBMibkFVX3lxTE9YanNWa2lEVl9ZeGVESGtENDZzWXY0LXM0MFJ1anVUVXJIUEtlRnR2UlQ4bHVIVlZyTVVzNzFCaHNsSFltX1hhZnM2eTdHajFrVjA1UGlLbGlHWDZLb0k1UFUxdnRDazFMdEZHUTFR?oc=5,1779778800,Pinterest Summer 2026 Trend Report: From sports to street style - Pinterest Newsroom,Pinterest Summer 2026 Trend Report: From sports to street style - Pinterest Newsroom,fashion trend
gnews,news.google.com,https://news.google.com/rss/articles/CBMiuwFBVV95cUxNNVA0WEVBbmIwNzJrOTFBSTRKTktOaTlXeVhRMjlPb2pfNUR6cWtkQ2xiTGZxSjVTWmxwa2N5RGZhdVhabWkzY2NSMEd0c1FoeHlkSGtYSGM1TUo2NUpsckx2LVExRDNURERuLUVUVEV5Y0xuc3E5LWp0LTlGb1ozRUdpcUhRU1ZtT1gtZkRZNEtuaEZ4RnBYNHQtb3dEMHJiaVJITHk1d1RTOXRlYVYzX3VySEFXRDJlX0FZ?oc=5,1781123145,Fashion People in Their 20s and 60s Are Wearing the French-Girl Shoe Trend With Dresses - Who What Wear,Fashion People in Their 20s and 60s Are Wearing the French-Girl Shoe Trend With Dresses - Who What Wear,fashion trend
gnews,news.google.com,https://news.google.com/rss/articles/CBMickFVX3lxTFB2VFY1YW83ejhjZGZvYWpvUGhtN0pqOW9OTXZsc2EtWXF4MFUyNWh5dzRaNVBncFBFemlucTBtUk9pcVpNUldfQUljV0hXNFVReC1lMlFhMEphSXZtd0FLa1JyUG9NLUV5VXNNdVRRdWcwdw?oc=5,1779951600,8 Summer Fashion Trends – Thoughts? - Cup of Jo,8 Summer Fashion Trends – Thoughts? - Cup of Jo,fashion trend
gnews,news.google.com,https://news.google.com/rss/articles/CBMic0FVX3lxTE9yU1J4Qm5NMDNoMWd4LVVfbDhjX0Y3SzVvR3J4TmtoeEdOdmFCNGFESkMzcm8yZTVzd19kSGp3Rm1majc2eUtWT1BldVRKY0xINHJTTTZXYmRLeTJFUFFlMERvcldNa04xZDJtVlM2MFA3LWM?oc=5,1781024028,"Actually Yes, Cargo Pants Can Be Polished - glamour.com","Actually Yes, Cargo Pants Can Be Polished - glamour.com",fashion trend
gnews,news.google.com,https://news.google.com/rss/articles/CBMicEFVX3lxTFBsV1loektySGo1dmhuSHk1Wm81Uno2d1dyWmZJazFmbTlQeGpFeTN6ZUVDcVJpam52R2FqSFpmOUNaVWx2cU9Tc2tvWU1zYXdmcFB2VW9SalVHYUNxU1ZzWTZRcWFBY0tjdFc3SHlfekc?oc=5,1780885800,"I'm a Fashion Writer in L.A., and I’m Seeing These 5 Early Summer Trends on Every SoCal Cool Girl - instyle.com","I'm a Fashion Writer in L.A., and I’m Seeing These 5 Early Summer Trends on Every SoCal Cool Girl - instyle.com",fashion trend
gnews,news.google.com,https://news.google.com/rss/articles/CBMiggFBVV95cUxNMC1XTV9CRlZ3WWs1akxqYlg2NE44ZVo1cmlhQ2tPMENwdlFMWTlXVkwwY0ZiYlB2X2wxcWxCc0R3YzJMYUUxVmtaQlZ3ODlXVkJ0U19FMFFSeEgtNW1RMTBmbmRLS0xCUkpDV01SSjkwSVdsSjBVRUtxNVQ5VVJqd3dR?oc=5,1781179200,What Stylish Women Are Wearing to the 2026 FIFA World Cup - ELLE,What Stylish Women Are Wearing to the 2026 FIFA World Cup - ELLE,fashion trend
gnews,news.google.com,https://news.google.com/rss/articles/CBMihAFBVV95cUxNZmxVX1Y1RGdmYXh1dGtVWE5Fb0xkN1ZWZEpBRFBubjBsQ2pLNDlKU1AxUVRrRnVtYUxacm1VOG1sc0p4bnJIdXZKOG9DaGJJSVB2dWpiNklDdGpnV08wSjJqb2hEdHhXU3JyeU1aVTE2Z1lYb05BV1NIcmkwd05JT3A0dFY?oc=5,1781125753,Why the Safety Pin Will Always Be in Style - Harper's BAZAAR,Why the Safety Pin Will Always Be in Style - Harper's BAZAAR,fashion trend
gnews,news.google.com,https://news.google.com/rss/articles/CBMirAFBVV95cUxPM0cybE9HUUhLTGtsbjhQUXB6ZzEwS0tvcndIc19jVXBqOThjSW9la2g2akV3ZExDZW9aZ3VxM1lyLWdIQVBaV05jUXE0ekpSZHBiRUx0YmZrek91NFJIX05pdXltSEVrWVdmaG5OYndkU2szdTZFODBxYmR4b0ZYTG9JS2p1ajUya1g3dURCZldfVmltQUUtb180dlBFTklIb25yZFU0ZlluTmtR?oc=5,1781112430,Jelly Sandals Are Summer's Biggest Footwear Trend — Here's How To Style them - L'OFFICIEL USA,Jelly Sandals Are Summer's Biggest Footwear Trend — Here's How To Style them - L'OFFICIEL USA,fashion trend
gnews,news.google.com,https://news.google.com/rss/articles/CBMilwFBVV95cUxNRFNsVWVYZUJIUjVxX3VxTXJCeUhoNUFHMFZKQzVFSzUxbkV4elR6dG40djVZbGl6Qmdyc1hpTURpaTE2akJNa0JVVlZURzUwN0g5NExRS2N2T0VBNHMzWGpMTklGdndMXy0ya3A2TUw5Z2dzSUNhUW1LdjJjZUl1WlQ5eHUwa2l3d2lObms2UDVHVVpySUFr?oc=5,1781267807,"Goodbye florals, hello foliage - M&S’s red leaf midaxi is the £40 dress you'll wear all summer for chic style - Good Housekeeping","Goodbye florals, hello foliage - M&S’s red leaf midaxi is the £40 dress you'll wear all summer for chic style - Good Housekeeping",fashion trend
gnews,news.google.com,https://news.google.com/rss/articles/CBMiVkFVX3lxTFAxeHZHR3FLWmF6Wkg0aVJMYzVZTURqdVI5eXFBbFhHR0dOQzFOZFM2S3R3U1pOQ0dCMUtrTnZCYzdOWXcxSV9qc05VdXRTdGl4cEJVZnJ30gFbQVVfeXFMTXRSeTBETXlMNUhja0ZNbWlpczNidnl1blpwOGhmaUx5aWg3RllDNGV4RFZnb3Zsc3A4Rm5HN1IzMGJaVmhhZTNMUlFOYkpERFRnV2NWSl9ud19GMA?oc=5,1781302873,Urban Metropolis-Inspired High-End Fashion - Trend Hunter,Urban Metropolis-Inspired High-End Fashion - Trend Hunter,fashion trend
gnews,news.google.com,https://news.google.com/rss/articles/CBMiXEFVX3lxTE9FdVZoak5WTmpWMlB2UkdHQ1lYSDRkeWVSY2tzTjdKamw5UmFxRUNFT3E5NHA4THlBdXVIcWRyWWpNSWZYOVdTa2I1RGV1Znd2QUtWSU5jOThqLTYx?oc=5,1781310074,Effortlessly Chic Summer Clutches: Varonica Beard Spotlights Its Anchor Clutch Silhouette - Trend Hunter,Effortlessly Chic Summer Clutches: Varonica Beard Spotlights Its Anchor Clutch Silhouette - Trend Hunter,fashion trend
gnews,news.google.com,https://news.google.com/rss/articles/CBMilgFBVV95cUxNTFlmczJpSm1udW5fLWM5SFQ4eFNJV2k4bWFwY3h5LVdqeDFxR3AzZ1Zad1VVeXcxRURKVGxtT2FmUDJGeVYwbE85OEQ0eFctLUttNnAxemx3eld3Nm1MVU9KNjBORi1fb0F2aEQwOGRKYWVLLXNYYmxranRDczVObUNtN1FDZ2pXaGdoamNrWTNTcHlDVmc?oc=5,1779433200,Which fashion trend would you ban? | Talk Pittsburgh - CBS News,Which fashion trend would you ban? | Talk Pittsburgh - CBS News,fashion trend
gnews,news.google.com,https://news.google.com/rss/articles/CBMikAFBVV95cUxOeWxGOGpJN1ppclVibUFkOVFfTk1kNjdvalByUll0cllHNktTaXhHQVhMcDA2YVVEV2pCajc4REdjVlZFVVJwV3JkR2Z1dklOdmxjb1I1SGRQQy1uQ281ZHFWdUQ4dlhuQTRGcklUeEZwSm4wUnV2d202cDN2MlV1SW84Vkt0akRnb3VPeFJuSks?oc=5,1781196363,The Fashion-Person Guide to Styling Summer Denim With the Right Shoes - Marie Claire,The Fashion-Person Guide to Styling Summer Denim With the Right Shoes - Marie Claire,fashion trend
gnews,news.google.com,https://news.google.com/rss/articles/CBMilAFBVV95cUxQZnZaUHJsZHMtUG9Jd0xTNVNidDQ2RVZLSFREMndWSkNIZmY1TUhVMldyX3BacTRzbXMwYnZlY09vd2RnUUhfLUtUSmJfSWlqSWtiWDE2bm9qOUZqMUNBSEZJcEE1V1ZuSjZ1dDNGSDZvbHRvZXZjV0FxYlpHVGVWdkZ4SU9udTJhOFhvTWZmM2cxNHJK?oc=5,1779346800,Mermaidcore Is Out—The Summer Siren Trend Is In for 2026 - ELLE,Mermaidcore Is Out—The Summer Siren Trend Is In for 2026 - ELLE,fashion trend
gnews,news.google.com,https://news.google.com/rss/articles/CBMiYkFVX3lxTFBQSlprd1dOLXBNcjVNSldmUmhlUy05dkEzOVZ0ZUs5YTRpWElEekp5VHNjVVlYYVZmX1lUNlhBaS1GdFhXcDVJbWNRbDgyYVQtbWprd0VuYkNYR0lDLVV4RVhn0gFnQVVfeXFMUFlOV3FXMER6ajBOc1B0ME81UlhFZ0t3WE1lNUNJUUJxbDB1TG5HZDZrTTF1YWFvT2pza2h5c00xaGQzSzMwMmdyTnZLbjJpeTc5UGo4cGE0eVItR1drb1BvbGRKaEFSTQ?oc=5,1781213101,Luxury Branded Beach Clubs - Trend Hunter,Luxury Branded Beach Clubs - Trend Hunter,fashion trend
gnews,news.google.com,https://news.google.com/rss/articles/CBMikwFBVV95cUxPVWk1anhsSjFWOWplTXlQT0tHYjg1V1VoMUlhSGRxc1RXZG9iVHJPZ2dScE9JQkJHLTlmS05CbHNmZEtINUJkbV9MY256S1NwU3JGdGNvdEZwQmxvWi1pSmhydVZVQzlZY1hTY1BpVjNMcXl2a05Oc3FxQXVpazNWTVRkRG5hU2FodjZGRFRRX3A4V2s?oc=5,1781061420,Asics will spin off trendy shoe brand Onitsuka Tiger - The Japan Times,Asics will spin off trendy shoe brand Onitsuka Tiger - The Japan Times,fashion trend
gnews,news.google.com,https://news.google.com/rss/articles/CBMigAFBVV95cUxOX3RhbTdnY2FmT0dHOWw4YXJYeHRmd1hRaWNvWmxNT3VqQzVmWXpla1d0cEhlWnJFMmpCYlNMQktRY3pUeGJvNVhLanhEZ3laZ2JtMjlMWUZlVlpXZE9vNmd2ajhzcEdXaFM3Zm1wVmpTdnJEYkpzeXNTR0xTZXRxXw?oc=5,1779606000,"You May Disagree: I Know These 7 Fashion Trends Are ""Dated"" in Summer 2026 - Who What Wear","You May Disagree: I Know These 7 Fashion Trends Are ""Dated"" in Summer 2026 - Who What Wear",fashion trend
gnews,news.google.com,https://news.google.com/rss/articles/CBMivgFBVV95cUxPMEdqdVp2YTF1eHhSaTQyOFVSMXI4Si1kZ2xJeDF3RFpPbTB4amJLX080dlRiQ2lIelR0X1JqaFZnZGcyYS1laWZDNWp4bG5rcGF0eUZwVHZ0QXJ3b2FVNUhoWnJ3UXBnbTlGcG1TYUg4X2lnTjFnVVhKQW5qMUJHRzZNY2Z3TXk4MmZQT0ZIc0ZoSlFjQ09Ga0M5a0xUcjlhaFI3OVNrWkFIUW1ycmV2M3p2bFpreWN6MjRMUHln?oc=5,1779865200,"From Taylor Swift to Rihanna, here are 2026’s hottest celebrity fashion trends - The Daily Northwestern","From Taylor Swift to Rihanna, here are 2026’s hottest celebrity fashion trends - The Daily Northwestern",fashion trend
gnews,news.google.com,https://news.google.com/rss/articles/CBMiXEFVX3lxTE1GWnZzNGNFdW1GN25RbmxfLVY1SUxuMDFGYWN5N3JpSnJzUG1ta05IQlB6c29aOHJzWVNmenNyaktJYjcyWG0teHV4RVBwTW0tVDVzZGFkX20zbTBW0gFiQVVfeXFMTk44MnN5RTVmOFcyZWxTX0RKZHEwc3k3c2tzRC0xTlRDNG1velZ0Z1JNZG1QcGVLZk1LWmZwNGZ5a2pZcEZnekh0ZzZVNTZBNVhOTUh4LWcxNjdOelJJSXdrREE?oc=5,1781258838,Monochrome Soccer Sneakers - Trend Hunter,Monochrome Soccer Sneakers - Trend Hunter,fashion trend
gnews,news.google.com,https://news.google.com/rss/articles/CBMijgFBVV95cUxQNnVCcjB0OUJTYmNEYnlQUlNWVzZkSFlvWTVXdTh1djBQWlNNZkxEdVVpMmwzbmdPOVlpSmNncHJtWEZGQjVvcWstNTlFN29TS1NhV1FEWm9Xb2NqdHJ5MHJ0X19CVjQwOWo5VDdaa2F6YzFhZ2xYNjVBdjBkQmhiZ2RQeFNUS1ZIb3JjcEJB?oc=5,1781247600,"Not Jean Shorts, Not Linen Pants—the Anti-Basic Trend Every Cool Girl Will Be Wearing This Summer - Who What Wear","Not Jean Shorts, Not Linen Pants—the Anti-Basic Trend Every Cool Girl Will Be Wearing This Summer - Who What Wear",fashion trend
gnews,news.google.com,https://news.google.com/rss/articles/CBMijgFBVV95cUxNYzUzZTBSaVpzeFF1TDJUMUJ5aGU1OVBqdzVFaDM1c1VlYWtaQWVVWE5Oa0M2WTVteWRPOGxLYnBGbFVjZnFlbGpXSXAxU21MX2JoN25RbUZxM3lqNHVPV0hMbXRJMFFib1h5UXBWS2p0VjN6SHdJQUg2OWVIVjlnZ0RuQW15VDVTdTE2QzFn?oc=5,1781196780,7 Summer Midi Skirt Trends That Are Stylishly Flattering—Shop the Best High Street Buys for Under $35 - Cosmopolitan,7 Summer Midi Skirt Trends That Are Stylishly Flattering—Shop the Best High Street Buys for Under $35 - Cosmopolitan,fashion trend
gnews,news.google.com,https://news.google.com/rss/articles/CBMimwFBVV95cUxPb2R4QTBKU2F0OFdySUFta2gwLVp3SzltVkJrSlhuS2Y3dlgzVmNoTHFyQ0Z6enVmQmtZUF9SSzE4VE11SDhEUm1oc0JnanM1MUYzWTBDOC1hTFpmblZXVzEtbjQ2T2h3WWJLSVBIS1R6MHlmNXp6akVpWGd4M253YW5ybVZPRHdpN2N3ZUNIY2JsS3NLUU5BRndUcw?oc=5,1781209146,The 7 Best World Cup Fashion Collabs Scoring All the Style Goals - Marie Claire,The 7 Best World Cup Fashion Collabs Scoring All the Style Goals - Marie Claire,fashion trend
gnews,news.google.com,https://news.google.com/rss/articles/CBMiY0FVX3lxTE5wQ0lLTWphOTNRZ3VvNmV1cjhxYUZ2YlVGNWJmZzl5RU5YZ0lsSXlJeHZWbjk5QThBZGhOQjZVQVR0cXlKeUMyTXdZcWpxZ0RsN0FJMno4dTFaS1BNZzc5b0VhNNIBaEFVX3lxTE5PT3gxWmN1bXJRZ1BwMXVaM2I1SWxvNEhkSHVYRDdITFVYR296VG9oZW44MDV4WUhVdFdGbXdiekltSWpvZlBIU1Zjc21zUVlKVEJZc080bGtrbnpjNTVxR2ZqSWp1TVpf?oc=5,1781231835,Reimagined Creative Campaigns - Trend Hunter,Reimagined Creative Campaigns - Trend Hunter,fashion trend
gnews,news.google.com,https://news.google.com/rss/articles/CBMingFBVV95cUxPeFFjR01UWFduY1lCQ3d3NGppX1VNUTcxb05sS1F3VzJLMF8zOFVCNnRpMlNubVFZcVBsM3hBeGlGT09WOGd1akNyOFp2WUR2STVZU3Jsa2FGWXFOWFprYVdHeVhLQ1VHMXJEMHdBMnUzMzRXT1JXZzBiaUdsUFJWVGJIZXN3d1JEcDVnMHRkQVhJaTI3aU5SbV9PblFzdw?oc=5,1781120532,5 Elegant Short Hairstyle Ideas That Are Perfect for Any Heat Wave - Harper's BAZAAR,5 Elegant Short Hairstyle Ideas That Are Perfect for Any Heat Wave - Harper's BAZAAR,fashion trend
gnews,news.google.com,https://news.google.com/rss/articles/CBMiggFBVV95cUxNVDhYNi1iRndqd0x5RTRQT21RNmwxV0pZS1Ewa19hckJ4OV9zSHFSS211SDVFbU5BUG9ieHZjWktLalp6SEpNWEZMd1BUY0swX0M1T0xkUlBQbFAtMngzNFBZX1FtcDVIVGRDdzZVWE1EdHFGdnlRTDRDZDNKNHRHRUR3?oc=5,1779951600,"Capri Pants, Bleached Denim and Summer Suiting: 7 Luxury Trends That Will Define Summer 2026 Style - Who What Wear","Capri Pants, Bleached Denim and Summer Suiting: 7 Luxury Trends That Will Define Summer 2026 Style - Who What Wear",fashion trend
gnews,news.google.com,https://news.google.com/rss/articles/CBMi3gFBVV95cUxNSlFYQkxNTEF1SldRMDllUWgzX3FkTHk0enJ0U3JWMndOVUxNVkgxZWg3T09LNGtpWGFOOVBMSGtoXzVGa2l0NThJcWRsT0FNSFR5VHRBODhZWGYyTHlFcHlEWkIzelVoc2lfVWVxdG5QUy0tOTZkeWZfLVJiN1Y4TVo3VktqcFQ1TDhmSS0xMS02RXlLa0ExVXNGNEdldEVHNEQxMzhIbUQ1UkFiT0hSd1BBVVp4c0J4WmZyRnd3QVpuZXNkVWNuVk0zRnhaeUctVFQtemctbUw3Y0tsaXfSAeMBQVVfeXFMUC1GUVA0MXNET2JiYnJkWWhHbXdYYkRUQzAzMkFxQ1BabXl2ZTJoRWozSWc1UFByRmlWOUhmbGg5bFNLajNIUVFmWVBFVC1RcVd1UWFxZHc4VW1OVjEyNHRyNTVkNWU5bmlVLWR0N1ZnMTN1VXBibVBzdm8yOG5fMldtUm1wSzdpMUF1RDdDSUpaT09adGg2NzVoQ21iTldVamhGeUJycHpNOU94RkpTcjN4bkhrY2gyRGp4RGVtaFVQVS1xUkloZmxxZGhKV0NoSkpQSklZcFkxVVNHaGZRbVlZNG8?oc=5,1781173020,Long shorts’ stylish comeback - The Times of India,Long shorts’ stylish comeback - The Times of India,fashion trend
gnews,news.google.com,https://news.google.com/rss/articles/CBMiigFBVV95cUxQTXV3Q1Y1dWN5b3hRRS1HZXd1OEdrOFNMYXRpUXV5cFlpalhuNWVyQnZZTmJVWVJYVUxwMFZwWTBCWW5CeHBGSHNONURMVnBybGZycWcza25GQk9TZHNqY09IT3ZXckg0T0czYmVKN0ptUVZVMGZ1ZVMwcGJCZVVoUXRIMnhPMkwtdkE?oc=5,1781157635,"Printed tees are the easy, on-trend way to elevate basic tops this summer – get the look with M&S's £18 style - Cosmopolitan","Printed tees are the easy, on-trend way to elevate basic tops this summer – get the look with M&S's £18 style - Cosmopolitan",fashion trend
gnews,news.google.com,https://news.google.com/rss/articles/CBMifkFVX3lxTFAtV2xPM0tNaFVSRU5SM1ZtMVhFaXZESXo3Z2pjSlFSczRkdHA0eTdvcWYwQkZTSGhJYm5xT3BQdW9jc1ZEdWlXQVppYl96d3NKSDZqNm9jNVVLU2JsOV9KN3M3a0s0V2tIMUxReld5Z0RxajJvXy0tTWwtbFgyQQ?oc=5,1779433200,Everyone Stylish Is Wearing These Summer Skirt Trends - ELLE,Everyone Stylish Is Wearing These Summer Skirt Trends - ELLE,fashion trend
gnews,news.google.com,https://news.google.com/rss/articles/CBMinAFBVV95cUxPZ2Ftb0otbGpQM041M1U2U0dlVFoybTNFbFJOQ1FhUUp2X0tMYXlmb19ZLUVRMWlqYjNuOWRmd3F3Z3lid1A3NFZCUTdBNlJPYk5fa250UGFvX1lIbGxESmhNdmFIamVPRTI1QU9YTnFuWUdYeTJSSkY2ZW55Q08xcmRGd2lobzlDRGFxRkFKOWtBaTRCMjIxTU1laE0?oc=5,1781192478,M&S's World Cup tops are the £15 proof that chic football shirts actually exist - Good Housekeeping,M&S's World Cup tops are the £15 proof that chic football shirts actually exist - Good Housekeeping,fashion trend
gnews,news.google.com,https://news.google.com/rss/articles/CBMiigFBVV95cUxQREwwN3Y3T3hGUlpHTHhoT2V5TTNlWGdqS2swZEp2dFlDZ2tMUE8wRHlxaHJXTzFYdm5SM09zc2xNY1JTNFV1ZkdrSXVEYXRkRVJnX1BZN2VhWkc0SEN3cTVwbFd6MWJsdUJnd2J6LTZ3X3IzZnphWklhQXlwdXptcVp2MlNJeGoxYWc?oc=5,1781193649,"7 shoe trends to wear with summer dresses this season, from wedge sandals to ballet flats – starting from £23 - Cosmopolitan","7 shoe trends to wear with summer dresses this season, from wedge sandals to ballet flats – starting from £23 - Cosmopolitan",fashion trend
gnews,news.google.com,https://news.google.com/rss/articles/CBMingFBVV95cUxNXzZSVkM5enpmWEUwX1BSQ0FYNXpWMUF2d2h5enRoRl9QNm1QS2theTgwVkhCLU1UTDJGUTFzRlVzN1dqMWNpWTB5d1dSWTgycjF5c2lpcE1HRWpiWlpYcVFXeTI1Z1VpYUZOTFA4endERUNPTXNrdGwwTldEeHRRRlB1SzFMWDlfOVNlY2puaEdDNGFSaWlsd3NqRm5Pdw?oc=5,1780124400,"12 Europe Fashion Trends That Haven't Made It to the U.S. Yet, According to an American in Italy - Travel + Leisure","12 Europe Fashion Trends That Haven't Made It to the U.S. Yet, According to an American in Italy - Travel + Leisure",fashion trend
gnews,news.google.com,https://news.google.com/rss/articles/CBMi_gFBVV95cUxOMlZCLTB6MXB6UHVyYzE4c1NRV2xBSExGSGYtQldPbXZuUE5OVjFBYTc0NTBuWjhWaXk1UzhidXZhcGpZUEM0Y0VwTmhCTTZwc3d4bzQ1aElXQ1U2WkZ0MElWdHRMUHA2RG5VVy1nQmRkd19yN25nTWdIQkw5WmxIVWlqM0c2Q280ZFljRVpzS3NXNkl0bzhxZXJkSG9pZDJjc0d2VzQwMmp4bFNRVkhKeVpFUDlIeWJob2lVbFRBQXg0OEtZbURnNFRyT3Ixb3ZMNlp4VUp1OTVjY2NhcVA2ZG56Vk1JT0IzcTRaTkltcnJKbVhDOTNXWE1taUtrdw?oc=5,1780038000,Jennifer Lopez's Versace premiere look fuels archival fashion trend - MSN,Jennifer Lopez's Versace premiere look fuels archival fashion trend - MSN,fashion trend
gnews,news.google.com,https://news.google.com/rss/articles/CBMiakFVX3lxTE1OYXJ0eGE4bzZuQTNmaGJjcGhXZ1NIZU5qQlgyRWthV0Izc0E5dzYwcHVPLXVranBUbEllTk9Xd2RuTEhEQ0Z3QWkzOXVIeHIyZEY0TWFDZWJVQktZbXhRbmRaQmNnRE1JZXc?oc=5,1778137200,"4 Easy, Breezy Fashion Trends for Summer 2026 - StyleBlueprint","4 Easy, Breezy Fashion Trends for Summer 2026 - StyleBlueprint",fashion trend
gnews,news.google.com,https://news.google.com/rss/articles/CBMiowFBVV95cUxNVFBacmpDeGZKTUNUUVg1V2xsdmFvRWF5ZU41LW1DSkN4Zk1tWWVYb1VuTkd1clFYN1pVaXkySlRWT2t4LW9OdFJkQjJybE4xRUxUak9fSWxIYmZ3djk0UndYbWw2MzNsWnl6R1VENjUtb0NSNVV3SUZqUkZDZEVmakQtLUg2VW5kMGt1WTRTSDRZVk85MVVtajNuTUJWWFdwVDZR?oc=5,1780038000,The Runways Called It—These Are the Fashion Trends Dominating Spring And Summer This Year - Cosmopolitan,The Runways Called It—These Are the Fashion Trends Dominating Spring And Summer This Year - Cosmopolitan,fashion trend
gnews,news.google.com,https://news.google.com/rss/articles/CBMiuAFBVV95cUxNQlUzWUlrR0VMWVlCUl9oS0s0VnFVTGplT0Y5QmJCdGVzbEpPVFcweUxvZDluMW5ELXk2bjk3akJzMUdNYThzeGVZWmZoVml3QXAtb3E4Mmp6TkZXUUZ3VGFsQXFXdDluTmpYZkl3N1VVWVpfYkE0Q1RxWmhmaERFdWRtaG9ZVHBfOEg2VG53eFluQVN4MnBnNXVTblprSXh6MTJST1JBVGN4bi0yQVBVWGhLUHdCYmQ2?oc=5,1781099997,How Fashion's Most Timeless Print Found New Life In 2026 - Brut,How Fashion's Most Timeless Print Found New Life In 2026 - Brut,fashion trend
