source,query,domain,url,created_utc,title,text
gnews,fashion trend,news.google.com,https://news.google.com/rss/articles/CBMigwFBVV95cUxQOWlkSVVSTE5BNDF3VkVHMzlTYV83S3N3bmlQREloZnVoT1pIY25nSXRNYVNiMkk4VFNSNGlXbVR5SUZvZnVQT0FSTW9lQktUa0MzMFpZcGlaNUcxNU1fNy1CNk43VV9SeTZ2b2FxZWpQTFJpdXhsMnlKd1VCOWhjVHpRdw?oc=5,1762979895,The Burgundy Bag Trend Taking Over Every Fashion Girl’s Wardrobe This Season - ELLE,The Burgundy Bag Trend Taking Over Every Fashion Girl’s Wardrobe This Season - ELLE
gnews,fashion trend,news.google.com,https://news.google.com/rss/articles/CBMi9AFBVV95cUxPYW9RMjdwLXZvZWMyQlppZjdkekZ0MnZtUS1wSmljSHFjS3NlZEJwRFlLdzgwaDN5NlZPN0JsWXNXeUdoQkUzbm10cjV0a2c3VGdOb0F5bzRrTXgzai1FUUI4cVljN29kODRMb3VIVnNWSjBqTEdsVDNVbmVZMWlfOXItUlNfV1ZSTzh1SWxWUkUyZFpoTzdadVBrNnpkclhVU0RTU25jeUhKdkpHT3BkaEtaSG1EUjE5djhLWU02WXJZNXhMTXU2SUNRSzJqVDlwVXBIRHJYc2tnWUdVZVlmbkVZZmkwV2ZoY2s4TFp3NDFjb3NN?oc=5,1762637797,"Kids Sandals Shoes Fancy Sandals for Girls Fashion Trend Platform Beach Sandals Girls Jelly Shoes for Girls (Beige, 8-9 Years) - The San Joaquin Valley Sun","Kids Sandals Shoes Fancy Sandals for Girls Fashion Trend Platform Beach Sandals Girls Jelly Shoes for Girls (Beige, 8-9 Years) - The San Joaquin Valley Sun"
gnews,fashion trend,news.google.com,https://news.google.com/rss/articles/CBMiqwFBVV95cUxQMGJmMWtITmNpMS1zdEhMeDYyV0g4RmI0cXhxYUNnZDdtbmthem5LRXRjdXF1MEl0MHdONzNJWl9YNHBwX0g2UFhpUXlkQmFRNHRCSm9wSVdGdzdHZEx6bFR1TFNaWEg2bzJYVE04OXQ5eUtTQ0xZbUtIY0p5dXh1Wnc5N1QxZWRQZ0w0aW44SDlIV0laVHZOblE3MFU0YTVNeXVIWHF2UVJDd3c?oc=5,1762548307,The Gen Z Fashion Trend That's Baffling Apparel Retailers - Forbes,The Gen Z Fashion Trend That's Baffling Apparel Retailers - Forbes
gnews,fashion trend,news.google.com,https://news.google.com/rss/articles/CBMiekFVX3lxTE1HUlJka0NpTVNrM1IzRHdKakF2a295dWtiWjk5dnE4UDV6Q0JqallGTVh6d3VON1kwWE5pVmVyR0ZieWxtTDFEdFNoNHRYNUN3LTlyeWthSXlTZFpSZUw4RG91aUhKMDYyaDZVQmhBaHU5TmxDM3pNdUxn?oc=5,1762842600,It's Not Brown—This Unexpected Suede Colour Is Winning Over the Fashion Crowd - Who What Wear,It's Not Brown—This Unexpected Suede Colour Is Winning Over the Fashion Crowd - Who What Wear
gnews,fashion trend,news.google.com,https://news.google.com/rss/articles/CBMimwFBVV95cUxNOFB1WFB1ckJTR0w4cWhzWC1uWjdXSEQwTWdIMU9XSGxoUnF5OWJpa2I1ejdDX1NEeURtNGlrdzVISFk3Z1NiMUJkU3lobTRIQnhJRkxmMHdCRVFIdkdYZ2RELWx2SWFGa2JZQno0VF9fR01jZHFkLUJ4NzhoX04xOWpJT3JCb1QwQ2JnejBSeTlxeDlkMkNpM2VKVQ?oc=5,1762979178,Spring 2026 Trend: Utlity [PHOTOS] - WWD,Spring 2026 Trend: Utlity [PHOTOS] - WWD
gnews,fashion trend,news.google.com,https://news.google.com/rss/articles/CBMiuAFBVV95cUxObW5fdDFSdEljMElCX3ptQTU3Q08yZkFwd3NoUExiaHE4X0JuT2Q3bHhMYnJFelRhS2VRc0JzbUdDRnhXclBQWFZZRnhWa1RtZE8tcUlYVzNyaVRrek5wZThEeUoycjNhNUU4N1JteGFEV3JyV1RyclAzdkpQUFdGSldOcFh5RmZzM3M5ejBiZEd2Y01DemFYMmNGcVgxRVVGc1NFSjBkTVdiZDVvbWdJZ1RnZTJXbmJH?oc=5,1762979293,"Sponsored Love: The Quiet Statement, How Elevated Casual Wear Is Redefining Luxury - Harlem World Magazine","Sponsored Love: The Quiet Statement, How Elevated Casual Wear Is Redefining Luxury - Harlem World Magazine"
gnews,fashion trend,news.google.com,https://news.google.com/rss/articles/CBMikAFBVV95cUxQNlc0VHM2N0ozZWozRzVmMGZaQTRVQ3dncm9kbDk2T1VhYy1mRG91c2dVYmJTUENkUFZVS0FRN3lHLVJkVXZoMEFEY0FmeF9PUFk5YmNSYUNkc3djeW95cVFoZTUzS0hob1ZDS0czb1ppMFZRQzRLR0FXWFJjM2V3UmowTVN0SjVPeG0zY1ZvRDc?oc=5,1762971025,"Lili Reinhart Says She Is ""Not a Fashion Girl,"" But Her Trendy Winter Jacket Disagrees - Marie Claire","Lili Reinhart Says She Is ""Not a Fashion Girl,"" But Her Trendy Winter Jacket Disagrees - Marie Claire"
gnews,fashion trend,news.google.com,https://news.google.com/rss/articles/CBMibkFVX3lxTE1sWFBTRWJMOXBqdHNBcHN1eU92UVBRUzR2dS1KSXBhM09yckxQNlh2eTlLM2ZHQjR0amh0elJNckNaZVpfVUpCNmtMYTFYeU55eVBmcnBOUzd6MWRFaGhZcnRaeG5qODNjQWlqZVNB?oc=5,1762923720,Time to ditch fast fashion — and fast - The Rider News,Time to ditch fast fashion — and fast - The Rider News
gnews,fashion trend,news.google.com,https://news.google.com/rss/articles/CBMihAFBVV95cUxPVWRGZ01BV0JaRjJkOXljQUtJcnd6VkU4Si1jb3Nha20yd2g1OTBBaVpFOFpnRVR0dnhMekZDaXVoSy1Rc1ZSSUp5Q2J0cTJlejNfOUVqMnlKSnZkdkVhejNmcWR5RkIzSUZQdmRDOFA1TUE3Y2hIMTZkMEM0OWhKZWVvM0o?oc=5,1762804257,"Alexa Chung Loves Fake Merch That Means ""Absolutely Nothing"" and Dresses Over Jeans - instyle.com","Alexa Chung Loves Fake Merch That Means ""Absolutely Nothing"" and Dresses Over Jeans - instyle.com"
gnews,fashion trend,news.google.com,https://news.google.com/rss/articles/CBMiXEFVX3lxTE94UExZZTdrSE1TWUx4cDc5aXV1cUxIb3FpZzhrN2Zwb2hIakV1aE03X0ZiVXU0SS1pZDRma2RheWd5b3NaZHdDWXJTTFg2NmxacFRKUjA2TUU0aVNN?oc=5,1762066800,Granny Print Is the Next Grandma-Inspired Fashion Trend Emerging in 2025 - glamour.com,Granny Print Is the Next Grandma-Inspired Fashion Trend Emerging in 2025 - glamour.com
gnews,fashion trend,news.google.com,https://news.google.com/rss/articles/CBMikAFBVV95cUxNN1BxOVZSTDNYTDJuVU1iYU1md0QyY0ZfZGNBOS1VTzA3U2V3bElzNzhfWlA3dmZacWVVcGtjV2JYRm54djB0ZTIySjBpQnU5eFg5Z3BOSUw2Sk5nUjFUR3JfUjRneGtTMlRTSDRkNDFHajNrR0lhWHhGOFU0bVZ6U0FBcHpIS0FhRmJKSGNVZ04?oc=5,1762546566,TikTok Turns Bull Nose Rings into 2025 Fashion Trend - AGDAILY,TikTok Turns Bull Nose Rings into 2025 Fashion Trend - AGDAILY
gnews,fashion trend,news.google.com,https://news.google.com/rss/articles/CBMigwFBVV95cUxPcks2VEVlTTlOZ1RhYmY5NUFQNGJkVXhsR1JxZmdKdW1LNTM2TUtIRG5Cd1YxbzBUekVCZ1pCelVMS1pzcmZpR2l1VkIzWGkwSGYxLUpsNTR2cW1feUJ4UkJMQ0JNUlBUTm1JMFVwa1pzYndVb1hIUkFWRHMyWGc5NDlsNA?oc=5,1762978283,The Wrong Color Combo That’s Suddenly So Right - ELLE,The Wrong Color Combo That’s Suddenly So Right - ELLE
gnews,fashion trend,news.google.com,https://news.google.com/rss/articles/CBMihgFBVV95cUxQekxId0dEUUJYdURHQkRmUlpfdUxpaVh4OVAwaHYtSDg2ZHhQWlZiT3luQ1lBejNia1dYWG1TallsR2xBMmxwYkVRRXpQVXNpdE9vS2xaeDYzbzFjc1piaThHVE0xeWdWZGFlTVNhbEN2bl9qbVJuVThiNV9fODVNcVc3OGtqZw?oc=5,1762952400,Here Are the 4 Trends I'm Most Excited to Wear for Winter in NYC - Who What Wear,Here Are the 4 Trends I'm Most Excited to Wear for Winter in NYC - Who What Wear
gnews,fashion trend,news.google.com,https://news.google.com/rss/articles/CBMi1AFBVV95cUxNbktBR3ZCeS1QMlowY3BaTjItUThncm83c2k1NDdMdDdXemZYMzFURWFfMk4tRHZxTDNycER1bThabGZtUlhrVVc1NmNkU1g3QW5jTExPbk5nUUlsTXdCN1NlYU1kV05rYk1aNnRCZlllUDNlNVdLTWlJOG9nczVFQy1yQnVqbEpXNjVoTGdfMTZFT0FhRkZfV3cwWjdkNjNyeGlxbkVBeDNQSDk5dHRIQ0tFYzI3d3lYU1JDMG12TnpnSkdPX2hHRjN0T05OTm9xWUxZWA?oc=5,1762980525,"Sponsored Love: From Streetwear To Smartwear, How Harlem’s Fashion Scene Is Embracing Tech And Lifestyle - Harlem World Magazine","Sponsored Love: From Streetwear To Smartwear, How Harlem’s Fashion Scene Is Embracing Tech And Lifestyle - Harlem World Magazine"
gnews,fashion trend,news.google.com,https://news.google.com/rss/articles/CBMinwFBVV95cUxPa19BeXdmcWZmZEFKbmNRTHVUbDhaU25nblNEX1M1cE5yeEx2amlMTUFzLS1hcHRTUXBPdzl6bmFFU3FkTVRpZU9oMFhXaVEzT0dBbnpXX3R4cWs0VVBRZ2w2bmlOazZpWmNnUDBzN3RycmVVWXQ4bUluOEp5X3ZnR3p3OHpZQUFacFp3T2h6V0ZySUxsR2o2R1ladE5ucVk?oc=5,1762866000,Winter’s Leather Trend Is More Than a Passing Fad—It’s the Foundation of My Capsule Wardrobe - Marie Claire,Winter’s Leather Trend Is More Than a Passing Fad—It’s the Foundation of My Capsule Wardrobe - Marie Claire
gnews,fashion trend,news.google.com,https://news.google.com/rss/articles/CBMilgFBVV95cUxQZWs5YzZJTzZlTUE3cWlBLXRfMUd0eFB2aFo1RjlORW9YZTNJRmQ1Rm91UHdDZkJPUHRrcG9BY0Qydjh2dmwzejdBeXBiWjhuZzI1T3l5d1FaZEFPWk53WDNHeEVVSlVmeUxwZ1ZoMTAzeHdfSWxETzN5ZnB2bElIdWJlMzNaYjJUbTNZU1hSdk9obGhaUnc?oc=5,1762923772,Spring 2026 Trend: Surf & Swim [PHOTOS] - WWD,Spring 2026 Trend: Surf & Swim [PHOTOS] - WWD
gnews,fashion trend,news.google.com,https://news.google.com/rss/articles/CBMikwFBVV95cUxNY3cyX3RzTFRQd3I2ajJuWEFKMnB2SjZKRmYzWlV1T1RNbmZqNG81YlJNb0lpV3I5WFZoZGNBVVM5UERidDZHNHRDTUp2Q19KWEFoOXJwMmswQXFyQ2k0YVF1cjh5SDlfNnQ1N29CTmk3djI2Tnh5NS1JX3ltOEpuUk04N3I5bWtGclF3bmQtUmhwRUk?oc=5,1762899351,The Trend the Fashion Crowd Goes Wild for Every Winter—Like Clockwork - ELLE,The Trend the Fashion Crowd Goes Wild for Every Winter—Like Clockwork - ELLE
gnews,fashion trend,news.google.com,https://news.google.com/rss/articles/CBMilwFBVV95cUxQc3d1eHZ1b2lHbDZWRTM2RUI4eUFnTW5XcHNSM1JMdERsazFFOFVxWTdWOVQtMl91SW9oR2Zwem9KNTRvVzlQN1Z3eHFmNEFSellIbHhDUC1RQnN0WHo3azhpRmhvVzF0N1BuVHBGcWZSdVhXM0dkWHRPSnphcnc3a19YYXBIRU5wdzhaa0FObzNtUngtRXM0?oc=5,1762882584,Jennifer Lawrence Urges Fashion Girls to Revive a Summer Accessory for Fall - Marie Claire,Jennifer Lawrence Urges Fashion Girls to Revive a Summer Accessory for Fall - Marie Claire
gnews,fashion trend,news.google.com,https://news.google.com/rss/articles/CBMif0FVX3lxTE93VWdDSkFvUzZLTnNDcUJySTFtTVhRdnFpM3JWWVVSVEs2by1BSFR6ZW1KQ2l2NmM0NHhZZHJfd190VVp6TnR1SWhtakJ3OEU0a3lOYXZsN2Zod2FIbTlFOHl6b3pERlRFbGJ2T2QwbU03bWRrSzBwY1dFMXFxdDA?oc=5,1762693200,"Suddenly, Everyone With Great Taste Is Styling These 7 ""Dated"" Fall Dress Trends - Who What Wear","Suddenly, Everyone With Great Taste Is Styling These 7 ""Dated"" Fall Dress Trends - Who What Wear"
gnews,fashion trend,news.google.com,https://news.google.com/rss/articles/CBMifEFVX3lxTE9LWXZlSnVVaVlFNVQtOE1udC1xTkdqWUh2RUdxSmJDRngySGdNV0hzS08wMDNqOVlFSllXVksyNnktZFBncjJPYnIwTFhDamx1QXZvdjVraloyblR1QzZfTGNaa0JNOUpZUDFNeFlEcDBQdzU5ZEl0N051c1g?oc=5,1762880716,"Square Toes, Dance Flats, and More Spring 2026 Shoe Trends to Know - ELLE","Square Toes, Dance Flats, and More Spring 2026 Shoe Trends to Know - ELLE"
gnews,fashion trend,news.google.com,https://news.google.com/rss/articles/CBMilAFBVV95cUxPcUtTZGV5M1laM0h4bVBVS3E5R3Ffd0ctcDRCSmc2NTQxNFVtc00xaFdrS0sxel9XdmlqUTA5a3ItdkxIZkJZLVpCcmJmMHcwMjFDU0V4RTB0UGx3dlZwbUV3VTlNZU1IVzFtc0llSGFzVVdKVGhhNi1SODdfa2JFVjdiT2pVdmlNN0pQbXRoa1JIS2xv?oc=5,1762974087,Thomas Tuchel issues verdict on 'crazy' new England fashion trend ahead of latest World Cup qualifier - London Evening Standard,Thomas Tuchel issues verdict on 'crazy' new England fashion trend ahead of latest World Cup qualifier - London Evening Standard
gnews,fashion trend,news.google.com,https://news.google.com/rss/articles/CBMiekFVX3lxTE9QUXNwN0NpbmpkODl6Y2V4QVU0dGVubjdTdDduQ2ZFM3duRkNPZ0N1MFdocVpBYThDVldZcHRXTUx2VTZ4SmdDWENWUUxaSEtTcnNGTlRZak1XUVNHQkZNOGlMcFZZcDNwSGpFQVRZM3lLVm51UnJpUGJn?oc=5,1762805546,Can Sarah Jessica Parker Make the Wide-Open Bag Trend Happen? - Vogue,Can Sarah Jessica Parker Make the Wide-Open Bag Trend Happen? - Vogue
gnews,fashion trend,news.google.com,https://news.google.com/rss/articles/CBMihwFBVV95cUxQQk14UDBhb3pyWXJzLTZxQU5ZdDJmVjdLc21BcWRqRVpUdkoyRVBLUHN2LVc1LW43Rl9WZWRBTnRGQ01MYWJqUmhlTTBaUkxJaHZiNTRjaG9SM2NwT0YyVnphdzI2YkNHZHc1V3ZteE44WURzQ1VJNDdrbEdERTdSUF9fQkg5YkE?oc=5,1762383705,Fashion’s It Girls Are Already Wearing These Spring 2026 Fashion Trends - ELLE,Fashion’s It Girls Are Already Wearing These Spring 2026 Fashion Trends - ELLE
gnews,fashion trend,news.google.com,https://news.google.com/rss/articles/CBMivgFBVV95cUxNM1c0ZThEMmNQMnlYeF8zQ25ZX0ZTS1A2dnVDNFdYTlNUblFnMVhWSUlSMUJWV1NvQklaT3lKcGdlR08wUFpjODBPMDB3ang0aGpVREJhX0V3Z19kTG1zNGpuZURKZHRCMW0xeHJ3cVBmZzRubFBaa1kxOHdRRXdFNlU4ZDBsYmdia1dRcXNBVFZNaHpxZkdrRDROcy01V0x5Qzk3blZKVEJyUllUWDQ5VW5IRkwwN3pSRDEyS1J3?oc=5,1762883100,Jennifer Lawrence Gives the Scarf-as-Belt Trend a Fall Refresh - Harper's BAZAAR,Jennifer Lawrence Gives the Scarf-as-Belt Trend a Fall Refresh - Harper's BAZAAR
gnews,fashion trend,news.google.com,https://news.google.com/rss/articles/CBMihAFBVV95cUxOUUVBUEVDdTBUdmxjWWtFNzI2TFAyX2NTNEI0M2pya2dfOURnb19MRTBONHpLalNNb2pHcG13T0FhVGR3bTRRbDhoUEtpX2RZclFWQXp3U3dFbl9DTVRFTFJVMkwtemFnYi1FeHhVUTJpOGo2a1BPZkIyOVdKaEZHYnE0UWs?oc=5,1762156800,The Winter Trends to Start Wearing Now—Before the Mainstream Catches On - Marie Claire,The Winter Trends to Start Wearing Now—Before the Mainstream Catches On - Marie Claire
gnews,fashion trend,news.google.com,https://news.google.com/rss/articles/CBMihwFBVV95cUxQc0lMOHl0MUQ2eTk3WV9vRGRsTzBySmN2ZHNrUWVEWko3cFVXeGRwQXN3U05Jd1hNcGtBZlBRZGFxRmpqM0Zwc3R2VXVJYzJESGtBRHYzbU52Z3duWUtqcUVMT21yUU9DOGMwWGhNLTljWDhwakdCcTlCX0FJTENrVExBU3FkYVU?oc=5,1762934100,The 7 Chic Winter Knitwear Trends Defining 2025 - Who What Wear,The 7 Chic Winter Knitwear Trends Defining 2025 - Who What Wear
gnews,fashion trend,news.google.com,https://news.google.com/rss/articles/CBMiswFBVV95cUxNVmprT2lJTDJlTUNlalgxYkd3ZGUxZ3B5YTFwaklCU0doZVRsNndPQ3d2bUlaX2xYMUtEZXQ5V2Zsa2FZVkFiRDljZ28yUlU4endzMTVQeVpiajczTzR3YmFiMGw0ZUJxTDFPejZjUldEZzUyLWlGZkZvM2N3STVnWmZSX1BXSmwzRWpaQ1NZRmh2OE9hamdmNEhBUzRPWFp3RElzNlZDb0U3THFsZVRVM2dYQQ?oc=5,1762889810,Hailey Bieber's Vintage Chanel Skirt Set Sprouts a Last-Minute Fall 2025 Color Trend - Marie Claire,Hailey Bieber's Vintage Chanel Skirt Set Sprouts a Last-Minute Fall 2025 Color Trend - Marie Claire
gnews,fashion trend,news.google.com,https://news.google.com/rss/articles/CBMiqgFBVV95cUxOR2FXcmFpbTgtQVhFbUh3a0FPYWxqVlBiR1VJLTFNc3ItWE5SNXp1dTlsVjVQc29iZENoVWRLOEZWcnAxMWZmcmN2VUhDLVpDVWZkM1FkUnBuWnlrOFRzN2tJVU9SSl9kQy1oTkFxaElldGFFQmN4R3pZakkyczR4bWhwY1hvMnU0c0V1aEh6Sm9jTlRDa2JYRU9KZnJBcGRYcGt4MWlzWHl1Zw?oc=5,1762898108,Elle Fanning Will Persuade Anyone to Wear-Test This Divisive Layering Trend - Marie Claire,Elle Fanning Will Persuade Anyone to Wear-Test This Divisive Layering Trend - Marie Claire
gnews,fashion trend,news.google.com,https://news.google.com/rss/articles/CBMiggFBVV95cUxQejBIaVlmWXIxMl81RGJlNjVJalhTcGpMYXdvOWxvalBlV0dFY0hiZXdSamJtR3B3Vkw4ODFDSEZfQXE5RUMyQ1UwZ01mcWkxdURoWVhCcFNPd2JfdENyXzdmVEw4WDdHYXVGR0E3TjVXLWR5bW9XXzYxYzc5aUJqaFB3?oc=5,1762156800,12 Autumn/Winter 2025 Fashion Trends That Will Dominate This Season - Who What Wear,12 Autumn/Winter 2025 Fashion Trends That Will Dominate This Season - Who What Wear
gnews,fashion trend,news.google.com,https://news.google.com/rss/articles/CBMiogFBVV95cUxNM2V4M0hXMllfRWR4UWpvVFVOZW5wenNsWEVjX1BCU2N6YmdCajFkcGRXMmRjQmRBekx5RGhvOTRkZmRGWHhTOU94WjJIMFdnUmxDUVpGT05wcHhsaDh4SkYxcmNuNHBndDFtSmVodVB1b1p4YldlQU80RExIM1l3S05KWkg2V2hLdF93WjAwekY2U19wdG5QTmxQTzI1TWVFWEE?oc=5,1762716600,Lauren Boebert Desperately Needs To Follow This Fashion Trend To Save Her Dated Jeans & Blazers - thelist.com,Lauren Boebert Desperately Needs To Follow This Fashion Trend To Save Her Dated Jeans & Blazers - thelist.com
gnews,fashion trend,news.google.com,https://news.google.com/rss/articles/CBMiekFVX3lxTFAyNGZwVWhKbnhxbnljRjNwSTdvVFd4OFR3dUJqLVlhUG5JdHB2OThkUkJXV1lIY2JKVlZyelFsSTlKWE01Rm5ZLWF3UjdIMEVtWGlGM3h1bXY5T3B3SzlMUnBSUFc5TDVRdGtFUzREREc2aWZfVWd3aDZ3?oc=5,1762769023,What’s With All the Retro Sneakers? - The New York Times,What’s With All the Retro Sneakers? - The New York Times
gnews,fashion trend,news.google.com,https://news.google.com/rss/articles/CBMipwFBVV95cUxOdzZEcTRwb1dKMVg5U3VoZjZ4Y0hXeW5sbkdrUEZicDVfa19vSElwaFFvOV9EWDEtV0JibHV6LUFFcncxQ0h3RXNLYjg3SG56SmJadjdlNjQ2dXlZRGtocEFKVUFNT2g4S2hGcENkaXNqM3I1RzNiWkpBT25WV3IyWmlLZnZtRnFONGdVb3ZyOVVZeHdpTmVNZWtmUnNxM2FpUUF4VW9NOA?oc=5,1762816152,Ariana Greenblatt Signals the Arrival of Penny Lane Coat Season - Marie Claire,Ariana Greenblatt Signals the Arrival of Penny Lane Coat Season - Marie Claire
gnews,fashion trend,news.google.com,https://news.google.com/rss/articles/CBMipAFBVV95cUxNRFUzUFNXak5nUGhiclEtLXItZGctaGJUaGpwcjNQd0dQZS00cXFlSFpwSXNaN3lZQ0g1OUprMzhPTVBMVmcwdmxNUHRDaWxGSU1WVVZ4NUZIUXlhU01DaUh3OEtqRElXLXhEWENaWFhKemdJYnFVV0dxNW53Q3hTazRFQ1dtRHc0ZlNoeVg5WWk5dTFXZ19sdTVGU2Rlc3p3OG14ZA?oc=5,1762789152,Fashion People Are Swapping Slingbacks for the Bow-Heel Shoe Trend - Who What Wear,Fashion People Are Swapping Slingbacks for the Bow-Heel Shoe Trend - Who What Wear
gnews,fashion trend,news.google.com,https://news.google.com/rss/articles/CBMiqAFBVV95cUxPSmhVdzkyWHROdkVjdUluYlRDSEFPUWVQbWVWUEN0N19QbEpzS3N5d0RnNmxFbGxLUGZCTmhoZVlRTWpMMmQ1V3FaZHFJaTZZSW9lT1MwYkdFM3FXd2U0bGJMLUQyMnBRb0YxUFk2WnVuS2hOdjFKSlBOaFczSFFLTENLT2lGeGpBUkpCSUVMVFdFM0FlT2ZfbnF0ekVHQWx4MjBqSHhRYmo?oc=5,1762799449,Bella Hadid's Take on the Rising Brocade Trend Involves Vintage Prada - Marie Claire,Bella Hadid's Take on the Rising Brocade Trend Involves Vintage Prada - Marie Claire
gnews,fashion trend,news.google.com,https://news.google.com/rss/articles/CBMinwFBVV95cUxNM282aTV6LVI1WDZPQ3RnUGpWQnhaWHJJczBvZW1sTG1sT21wSzJuYnRDcnNRUXdXUWRESFBGTzk2MEMzOGYtc09Gek13TFlnWlM5eXZlRXhBTVlSOUtKSE5uMHpKMU1pTmxFWjlDaW1tTWc4Yk9NclJJeWFlZWhJS0RmdU9RLXl0SXpoVkVTVjJaeU5DVzlNNHN6a0dMY0k?oc=5,1762887215,"‘Ralph Lauren Christmas’ Shopping List — How to Master This Trending, Old Money–Coded Holiday Aesthetic - WWD","‘Ralph Lauren Christmas’ Shopping List — How to Master This Trending, Old Money–Coded Holiday Aesthetic - WWD"
gnews,fashion trend,news.google.com,https://news.google.com/rss/articles/CBMiwwFBVV95cUxQdzkzTmRPLV9OZXZScnBSNU5oZnNwT2FwYVcxMElaY1RmckZLV3BwUEIxeUlUNW5xTVduVENJT1daNklWVkFYZmh6bVpxbGxzalVQams2UW9zVjUwcXdaM2ZCQkJLR0Z5SENNU2FkdjlDRGYybVFuZnp1NnRsa2stTnQtaWZ2SEgyalRqeTh5SEpNMFcxc3V5cjJrWjF1V3RwM3JDN0hucUJDTDJtcXViellScm12XzRJWmVOanY3aFJTaUk?oc=5,1762861789,Buh-Bye Boring Black Coats—This Is the Far Cooler Coat Trend Fashion Experts Are Wearing Instead - Who What Wear,Buh-Bye Boring Black Coats—This Is the Far Cooler Coat Trend Fashion Experts Are Wearing Instead - Who What Wear
gnews,fashion trend,news.google.com,https://news.google.com/rss/articles/CBMiqgFBVV95cUxQNEdIbll5WGp3OGI3OUpna3dJdnR3cUVyQmVkbUlkR1pNbVFIRE9XUTNYTnVBMTBGQVRKVkQwcVlIclQyQjlnRUlwT3pJbzdsRW1QNWJMWWo3ZXlSN1MzVTd0VU5OVmFWd0RaeHpNTldVQ2dtNDNwYVczQjJIckM3NE9rWmtFWmxQaWZvSkQzdVg5X2lsbEtReWNNc0JEMFRwQTVvSm1zbnk1Zw?oc=5,1762862400,Ludovic de Saint Sernin Brings His Sultry Touch to a New Zara Collaboration - ELLE,Ludovic de Saint Sernin Brings His Sultry Touch to a New Zara Collaboration - ELLE
gnews,fashion trend,news.google.com,https://news.google.com/rss/articles/CBMiugFBVV95cUxPRnVweHROdVpCUl8ydUN0THZmSzd4dVpqZXhsUG1MeUxqYTAtMXZQN1dQdUFBZ0l2djN4YWdWRS11NzZxTERTNDBOSzVfeXFLOHhFOUFodjM3aEpIZ2E0VUFraWg2ZmtTU21YM1FRNy1vT2c2eFZmcVRiMDVZbjZ0dERHZmNTdzhlS1cwTTAyNmdIcHYxbW56RVZIaWlRZk9sYWFJU2huWEVpOEhhTHpFaENnSWJyUXBUb0E?oc=5,1762767840,"‘It makes you feel glam’: shaggy, Studio 54-style coats are partying again - The Guardian","‘It makes you feel glam’: shaggy, Studio 54-style coats are partying again - The Guardian"
gnews,fashion trend,news.google.com,https://news.google.com/rss/articles/CBMijAFBVV95cUxPMUg4dk1ZOUZaenRfcVhfSnFGWjlqd3diUHJnMUtqOVZWdUFGWXJBaC13ck56Tlp4YVd0dzZ6X3RoR0tWME5pRHQ0LTZ2VXlsQlc1X2Znd1FmbkhMMDlKeUl0VGJSeDV4RGdjNlJqT1hjLVdKSjVMVFYyWFBRaDVDMDhVUU9hSXlDdU1Tcw?oc=5,1762650000,"Yes, You Need a New Winter Coat — Choose a Classic Style Inspired by Taylor Swift and Gigi Hadid from $39 - People.com","Yes, You Need a New Winter Coat — Choose a Classic Style Inspired by Taylor Swift and Gigi Hadid from $39 - People.com"
gnews,fashion trend,news.google.com,https://news.google.com/rss/articles/CBMihgFBVV95cUxPVElyYnB5eVR5OHg3ZEtxMkQ1dE14N2ZIQ1p5b3FQbnRWY0tpc19wVC1kZlJnLS1iRmxROWpIZjloX0RtV0tCLThVQkpLZkk0X0tMSF9Tc2Q0SzQzMlBRR28yeEczSjVlR2lTeGNmYi1US2Y4N3NSWHp6NmhRajFpbUZVSlBPQQ?oc=5,1761548400,I Can't Stop Thinking About These Runway Trends—So I'm Making Them My Own This Fall - Marie Claire,I Can't Stop Thinking About These Runway Trends—So I'm Making Them My Own This Fall - Marie Claire
gnews,fashion trend,news.google.com,https://news.google.com/rss/articles/CBMiggFBVV95cUxNZlVCdGhCbkZGWnVrT21YaFdmOHlMbGpOLUtlWHBlbTRFbDd5a1RlQk5YckJtNC1Jc3lOTjVlYVdCbDNRYVdFVE44eFlUM3dzNkVtUDVTUlZGM3MxMmJWUE9qVHFPamcxdWlURlhyV3JRVW9sMHNwejRWdXNTZVJ3S3RR?oc=5,1762329600,6 Fall Fashion Trends That Are *Actually* Wearable - Katie Couric Media,6 Fall Fashion Trends That Are *Actually* Wearable - Katie Couric Media
gnews,fashion trend,news.google.com,https://news.google.com/rss/articles/CBMijwFBVV95cUxQdWszU19HOVB1eGdwbjBCODhSWm5xSnNPMjRKQWR2OFNxMjJ6TnQ0QklKaHkzYTFvV0xXNC1QdTZKUV92TmJSWG4zMVJ0d3ZYYW1PaUhQLU9teEYxcFRxaUhKRXZGUlBlQmVkUEJzSElUQ0tQak0zTzFsQW9TcnZha3hCRlVZSkdkMFY3NG12Yw?oc=5,1762938000,Struggling to style pink for autumn? Helen Skelton just gave us a masterclass in wearing the trending shade - Woman & Home,Struggling to style pink for autumn? Helen Skelton just gave us a masterclass in wearing the trending shade - Woman & Home
gnews,fashion trend,news.google.com,https://news.google.com/rss/articles/CBMinAFBVV95cUxPX3FVeEhZaUhzRE1ZUWdZcEg4UzBLeXdVdklITmZzcGFKSkF1TWljakwzXzRfOFVJdGNRV1NrNFJQTWpPZlFib3FSNjlndzNaZ3pmWTJITG0yQ1JUTXpDWTMwZ08wSTZaTUZmM3doUWVfSXFsUXVNMzR2YTVISUZZX2U3NVU0TDc1c1F3TVlMQkpHY0FrZ0o0bWRPRmM?oc=5,1762800480,Everything Worth Buying From Nordstrom’s Secret Early Black Friday Sale - Harper's BAZAAR,Everything Worth Buying From Nordstrom’s Secret Early Black Friday Sale - Harper's BAZAAR
gnews,fashion trend,news.google.com,https://news.google.com/rss/articles/CBMibkFVX3lxTE9YMmhvMHJrUjVESFhCaE5DeUtlbVF2bkl0MTAyeTlSd2V4bEEtTFN3MFdHcU5hQURBamx2UkpJNDdpUU5ycFA4V1ZNWlo0aVl0OXJ0X0lRbU9jcUZocVZqMEdIM0kyaFFseWVXMTVB?oc=5,1762363685,10 Fall Trends GQ Staffers Are Shopping Right Now - GQ,10 Fall Trends GQ Staffers Are Shopping Right Now - GQ
gnews,fashion trend,news.google.com,https://news.google.com/rss/articles/CBMiggFBVV95cUxOZ3k1a053U1ZQdEsxbFFMcWQtdkpDX1RIMkR0WkdJbElQWWtPaEc2Vm43bHkxcUpSLXRSekJZeHlfUE55Sm5DMWhXd2NJVXdzbGx5QXJzVno2ZkhydHhEclRZam1ENDlIX1JLOFh6Sk1remcxMEJhNGFMNHNwdXhTVXNB?oc=5,1762495200,How to Nail the Coffeecore Fashion Trend - Vogue Arabia,How to Nail the Coffeecore Fashion Trend - Vogue Arabia
gnews,fashion trend,news.google.com,https://news.google.com/rss/articles/CBMimAFBVV95cUxPc0x2VXpkX2luMExyd2tvTWdhQ0FDUjJSYWlxMVp0Zks5bUtmbG9aVFZWc2xVR1QtcERkOGpJRVZHRF9nLWlPZVhGV1VuLWU1aTJoSHR3RmFOOXNWdmphVTR4R3M0M0F0VFJ3bjByWUV3OGdXblBIdDhKUEtla3V3V015U0x4YzdmRUtTZmVjWHh2Z3NiYTA3SA?oc=5,1761289200,"12 Fashion Trends That Are ‘Out’ for Fall—and the Stylish Pieces You Should Wear Instead, From $18 at Amazon - Travel + Leisure","12 Fashion Trends That Are ‘Out’ for Fall—and the Stylish Pieces You Should Wear Instead, From $18 at Amazon - Travel + Leisure"
gnews,fashion trend,news.google.com,https://news.google.com/rss/articles/CBMirAFBVV95cUxPZVMxX013STNpMTc0TXpPVFF0aF9HZThaS2ZkY1NHdzNrNDVtR2NxUU1UVnNFYjFicXF5WjZFNVpoN3Jfblh1MFRiMzJ1VUticUltZmtuVXQwamowZ19Vd29kU2U4T0phc1Z1TkdiMm9NZ2dFLXdCY3MwSWQyZmNiRzhKT2F5Rm10SXRYeW5ocjJNREVCbWVpZk40TnZ0NW13QnVCdVFQcG9ybUZM?oc=5,1762927200,Anne Hathaway's retro birthday dress championed the 'underwear as outerwear' trend - HELLO! Magazine,Anne Hathaway's retro birthday dress championed the 'underwear as outerwear' trend - HELLO! Magazine
gnews,fashion trend,news.google.com,https://news.google.com/rss/articles/CBMivgFBVV95cUxQanJQc3lBLXRfX1VFWkZHWi1TS1ZlQVpuUVF4Mm5sQVJocmVoYkp2X19fTnRRNG1CTzBjNVN5X19nY0hoVkdITG5jc0tVN2ZCVExfWHZsSFJHREk4QmEwZE92YUNyb3hMRlFjMlZ5WFB3ZUJmMmlNZGd3MzU5ZEZuWmh2dzl6dmVjNXVmVnpNNndxcWZfVzRVWjhCdTBfMXF4TkZsMERlS0l0QnRzTS1vdVpSSDlJVTFCZTJCOU9B?oc=5,1762794194,Millie Bobby Brown Gives the Naked Dress Trend a Festive Flair - Marie Claire,Millie Bobby Brown Gives the Naked Dress Trend a Festive Flair - Marie Claire
gnews,fashion trend,news.google.com,https://news.google.com/rss/articles/CBMid0FVX3lxTE5pYXZST3hiRHZQb0VWWGRSeGc1RHdNNTJQTEVNNjVPTjF0UVNhM1RUSHRSaWk0bVBjUzVLVGpTMDZNa25hZDJzc3ZIaHpYSG56c3NWN3cxanQ5VzBLVk0yNy1zdkM4bmtEd3k5bFQwMVRIdzR4eEpv?oc=5,1762298322,"Sorry, These 7 Color Trends Simply Aren't Making It to 2026 - Who What Wear","Sorry, These 7 Color Trends Simply Aren't Making It to 2026 - Who What Wear"
gnews,fashion trend,news.google.com,https://news.google.com/rss/articles/CBMijgFBVV95cUxQR1lySllzeF9QbVdGUXhkRExQQ3VORWJNYzdlN2NGTWoxamplUDV3WXhLLW5lV21jYmUyWmd4WFJCOUNxSnNUZXl2MTBWVl9yWGU1NUhHM1ZvVVlyT1hwOEl2V0U4SW8yYzc5Tk1xU0dweFVneTlVMFhXWFNlMENSYjBnRE5aZGVHMlpkUENn?oc=5,1762312247,QUIZ! Which Fall Fashion Trend Matches Your Vibe? - Girls' Life,QUIZ! Which Fall Fashion Trend Matches Your Vibe? - Girls' Life
gnews,fashion trend,news.google.com,https://news.google.com/rss/articles/CBMikwFBVV95cUxQT0tUSDhoRnV5ZGFJWlpwbkhqaW5zS0dackRTZm1DZ3VEMlNhRlBzd192MFVqOFdVT19BR0huSC00WXhCdXQ4WFNQSGVZVkdqRy10VVIxVlpXYkVPbUJpLXVwbExwSG84Y3FTV1dISnQwdDdTWmVMR2t6NTBjWXF4NWZsMDBseGRVbUZzOXJsTWVkRmM?oc=5,1762936552,Leather trench coats are in this fall — How to choose yours like a pro - RBC-Ukraine,Leather trench coats are in this fall — How to choose yours like a pro - RBC-Ukraine
gnews,fashion trend,news.google.com,https://news.google.com/rss/articles/CBMipAFBVV95cUxPV0UwS0p3N2paenA4MFQ4azdxRkNiSXFqc0Nkdm5JVTRTU1NyUFVGNjI0dmFvTG02LVdrUzlLNndwTzI5bDZsU2ZSTnByRHBXamtvR19YcVlyeFc3d1ZsbDI5djV0eVFTdXNOUjF0ZWhXT2dDcTFRT0lkZ3FrbVIxUGdnQlROOGZTVnBrY0hIY1RRaXNmXzdiMXJoX0EycmVtZXhocg?oc=5,1762798897,How to Dress for Fall: Hottest Autumnal Trends Revealed - NationalWorld,How to Dress for Fall: Hottest Autumnal Trends Revealed - NationalWorld
gnews,fashion trend,news.google.com,https://news.google.com/rss/articles/CBMiY0FVX3lxTE5vczJqYUttNGY2cklaN3hyZ1hReFdkSmpYdXRsbThyeWdPZlVYektVR1c4TkUyLXllUURON2ZKbnZCeFNNMWNEWlROYm5GZ242eHprWVRNU3Y3eVN4R2hQUkFjMA?oc=5,1759474800,I Just Got Back From Paris–Here’s What All of the French Girls Are Wearing - Camille Styles,I Just Got Back From Paris–Here’s What All of the French Girls Are Wearing - Camille Styles
gnews,fashion trend,news.google.com,https://news.google.com/rss/articles/CBMicEFVX3lxTE5OUHFIc094WDR1c3IzY1RMMFJQcFZWVjBiVU83NnMtd2JITTZ5THJoOHBONlZrTW5FYlNpUk1TQWE4OEtHSEZOQm1GVVExSk45d1U0M1hNbnBiTjN5eVkzUnVXM2d2ZUJVNnRVUXkxWU8?oc=5,1760684400,The Biggest Spring 2026 Fashion Trends Allow You to Choose Your Own Style Adventure - Marie Claire,The Biggest Spring 2026 Fashion Trends Allow You to Choose Your Own Style Adventure - Marie Claire
gnews,fashion trend,news.google.com,https://news.google.com/rss/articles/CBMiZkFVX3lxTE5LaUlMc1VCNXJ1QUlBX0JXOFNJWkxFVVRHRGQtVGZJSGdUM19za24yWWhsaUx5dllfRjd2cDNqdE5zRHd1ZXdHSXhfZG83WUxGa3RCWHpUZGdHWkN0VnF4MXNYZzRudw?oc=5,1760943600,Fashion’s New Obsession? Clothes That Swallow You Whole - glamour.com,Fashion’s New Obsession? Clothes That Swallow You Whole - glamour.com
