source,domain,url,created_utc,title,text,query
rss,www.nytimes.com,https://www.nytimes.com/2026/06/11/style/world-cup-fashion-mike-amiri.html,1781292378,Mike Amiri Knows What Travis Kelce and Marcus Rashford Want to Wear,"Mike Amiri Knows What Travis Kelce and Marcus Rashford Want to Wear

How Amiri built a brand on the culture of sports.",
rss,www.nytimes.com,https://www.nytimes.com/2026/06/11/style/julie-macklowe-pro-tax-socialite.html,1781295075,The Pro-Tax Socialite,"The Pro-Tax Socialite

Julie Macklowe’s unlikely crusade.",
rss,www.nytimes.com,https://www.nytimes.com/2026/06/11/style/nyc-restaurants-knicks-games-reservations.html,1781189858,These NYC Reservations Are Impossible to Get. Except During a Knicks Game.,"These NYC Reservations Are Impossible to Get. Except During a Knicks Game.

Some New Yorkers tried their luck at hot spots like Bong, Via Carota and Ha’s Snack Bar.",
rss,www.nytimes.com,https://www.nytimes.com/2026/06/10/style/backrooms-gen-z-anxiety.html,1781109972,"‘Backrooms,’ Liminal Spaces and Gen Z Anxiety","‘Backrooms,’ Liminal Spaces and Gen Z Anxiety

“Backrooms,” a horror movie about an uncanny labyrinthine space, plays on a generation’s fears about where digital life and the real world collide.",
rss,www.nytimes.com,https://www.nytimes.com/2026/06/10/style/graham-platner-primary-style.html,1781123899,Graham Platner Tucked in His Shirt on Primary Night,"Graham Platner Tucked in His Shirt on Primary Night

On election night, the Democratic candidate from Maine wore a button-up, a deviation from the candidate’s unvarnished image.",
rss,www.nytimes.com,https://www.nytimes.com/2026/06/10/style/gosh-chinatown-club.html,1781393304,"Gosh, a Club Where Bosch’s Little Creatures Might Go for Cocktails","Gosh, a Club Where Bosch’s Little Creatures Might Go for Cocktails

Gosh, a new nightclub in Lower Manhattan by way of Italy, has its own quirky logic.",
rss,www.nytimes.com,https://www.nytimes.com/2026/06/10/style/biohacking-fitness-tracking-fitbit-whoop.html,1781099154,"They Tracked Fitness, Food and Sleep Obsessively. Now They’re Tuning Out.","They Tracked Fitness, Food and Sleep Obsessively. Now They’re Tuning Out.

As some online lean into biohacking and wellness metrics, reformed optimizers are canceling Pilates and having that extra glass of wine.",
rss,www.nytimes.com,https://www.nytimes.com/2026/06/11/style/when-dc-goes-hgtv.html,1781190599,"Trump’s D.C. Renovations, HGTV Style","Trump’s D.C. Renovations, HGTV Style

President Trump brings a particular brand of reality TV-style renovations to the nation’s capital.",
rss,www.nytimes.com,https://www.nytimes.com/2026/06/13/style/us-paraguay-fans-world-cup-fashion.html,1781377661,What U.S. and Paraguay Fans Have in Common,"What U.S. and Paraguay Fans Have in Common

At the first U.S. home World Cup match against Paraguay, the colors and the chants were loud in Los Angeles.",
rss,www.nytimes.com,https://www.nytimes.com/2026/06/13/arts/david-plowden-dead.html,1781369779,"David Plowden, Who Photographed a Disappearing America, Dies at 93","David Plowden, Who Photographed a Disappearing America, Dies at 93

With his haunting images of steam locomotives, steel mills and Midwestern farms, the celebrated lensman revealed the poetry in the artifacts of manual labor.",
rss,www.nytimes.com,https://www.nytimes.com/2026/06/13/style/knicks-nba-championship-final-1970s.html,1781362340,"It Was 1973, and the Knicks Were Heading to Game 5 …","It Was 1973, and the Knicks Were Heading to Game 5 …

Lifelong fans reminisced on the team’s last championship win. “When the Knicks won, it was like a different New York City,” one said.",
rss,www.nytimes.com,https://www.nytimes.com/2026/06/13/style/josh-hart-knicks-braids.html,1781372608,"From New York to Texas, a Knicks Guard’s Braids Bring Style to the Court","From New York to Texas, a Knicks Guard’s Braids Bring Style to the Court

Josh Hart is known for his intricate braids, which often feature New York’s logo. For the finals, he is working with hairstylists he has known for years.",
rss,www.nytimes.com,https://www.nytimes.com/2026/06/13/style/knicks-nba-finals-weddings.html,1781354450,"Knicks Fever is Shaping Weddings, Too","Knicks Fever is Shaping Weddings, Too

The overlap of the N.B.A. finals with peak wedding season is presenting a dilemma for some couples.",
rss,www.nytimes.com,https://www.nytimes.com/2026/06/13/style/madeline-cash-profile-lost-lambs.html,1781367212,Madeline Cash Isn’t Playing Around. Or Is She?,"Madeline Cash Isn’t Playing Around. Or Is She?

Her debut novel taps into a microgeneration’s blurring of performance and reality.",
rss,www.nytimes.com,https://www.nytimes.com/2026/06/12/style/modern-love-how-to-eat-pizza-with-a-male-model.html,1781294468,How to Eat Pizza With a Male Model,"How to Eat Pizza With a Male Model

Order slices, fold them in half, flirt with male model, hope it makes your boyfriend jealous.",
rss,www.nytimes.com,https://www.nytimes.com/2026/06/12/style/danit-hetsroni-joshua-raikin-wedding.html,1781280421,A Teen Summer Romance and the Journal He Kept for Her,"A Teen Summer Romance and the Journal He Kept for Her

When Danit Hetsroni and Joshua Raikin met at summer camp, both had already navigated challenges that forced them to grow up quickly.",
rss,www.nytimes.com,https://www.nytimes.com/2026/06/12/style/evelyn-ivey-thomas-rotelli-wedding.html,1781236815,"A Veterinarian, a Life Coach and a Highly Persuasive Pair of Donkeys","A Veterinarian, a Life Coach and a Highly Persuasive Pair of Donkeys

Dr. Evelyn Ivey knew Thomas Rotelli had the qualities she wanted in a mate, but watching how animals gravitated to him clinched it.",
rss,www.nytimes.com,https://www.nytimes.com/2026/06/12/style/laura-nolan-matthew-macnabb-wedding.html,1781284480,Matthew MacNabb and Laura Nolan of ‘Dancing with the Stars Ireland’ Marry,"Matthew MacNabb and Laura Nolan of ‘Dancing with the Stars Ireland’ Marry

Laura Nolan developed a crush on Matthew MacNabb when he was on “Love Island UK.” Then they became dance partners on another show.",
rss,www.nytimes.com,https://www.nytimes.com/2026/06/12/style/lexie-riegelhaupt-gabe-greenberg-wedding.html,1781271123,"‘Darling, I Love You, but Give Me Park Avenue’","‘Darling, I Love You, but Give Me Park Avenue’

Lexie Riegelhaupt and Gabe Greenberg sang the “Green Acres” theme song as she left Park Avenue for his home in Carroll Gardens, Brooklyn.",
rss,www.nytimes.com,https://www.nytimes.com/2026/06/12/style/yazmany-arbodela-danny-mefford-wedding.html,1781236804,A Celebration and a ‘Love Ritual’ Shaped by Their Community,"A Celebration and a ‘Love Ritual’ Shaped by Their Community

At the wedding of Danny Mefford and Yazmany Arboleda, guests made various contributions, including decorating the church and forming a choir.",
rss,www.nytimes.com,https://www.nytimes.com/2026/06/11/t-magazine/the-four-suits-you-should-have.html,1781232342,The Four Suits You Should Have in Your Closet,"The Four Suits You Should Have in Your Closet

Suits are back, and no matter the season or occasion, these styles are guaranteed to carry you through.",
rss,www.nytimes.com,https://www.nytimes.com/2026/06/11/arts/design/william-coupon-dead.html,1781211118,"William Coupon, Who Wanted to ‘Photograph Everyone in the World,’ Dies at 73","William Coupon, Who Wanted to ‘Photograph Everyone in the World,’ Dies at 73

Self-taught, he became a go-to portraitist for politicians, rock stars and other celebrities. He also documented Indigenous people and inmates on death row.",
rss,www.nytimes.com,https://www.nytimes.com/2026/06/11/well/mind/trigger-trauma-meaning.html,1781168711,What Does ‘Triggered’ Really Mean?,"What Does ‘Triggered’ Really Mean?

This popular term is often misused, experts say, which may cause more harm than good.",
rss,www.nytimes.com,https://www.nytimes.com/2026/06/11/style/running-around-nyc-with-deli-boys-mob-boss-auntie.html,1781168440,Running Around N.Y.C. With ‘Deli Boys’ Mob Boss Auntie,"Running Around N.Y.C. With ‘Deli Boys’ Mob Boss Auntie

Poorna Jagannathan, who plays Lucky Auntie in “Deli Boys” on Hulu, is finally over the impostor syndrome.",
rss,www.nytimes.com,https://www.nytimes.com/2026/06/10/style/taylor-swift-msg-knicks.html,1781140896,Taylor Swift and Haim Sisters Appear at MSG for Knicks Game,"Taylor Swift and Haim Sisters Appear at MSG for Knicks Game

The musician, who is believed to be planning a wedding in the city, showed up in a musical take on Knicks gear.",
rss,www.nytimes.com,https://www.nytimes.com/2026/06/10/briefing/the-good-list-pigeons-knicks.html,1781122304,The Good List: 6 Things to Add Joy to Your Day,"The Good List: 6 Things to Add Joy to Your Day

Dancing pigeons, mystery stew and a nostalgia machine.",
rss,www.nytimes.com,https://www.nytimes.com/2026/06/10/style/tiny-modern-love-stories-the-right-answers-in-life.html,1781108690,Tiny Love Stories: ‘The “Right” Answers in Life’,"Tiny Love Stories: ‘The “Right” Answers in Life’

Modern Love in miniature, featuring reader-submitted stories of no more than 100 words.",
rss,www.nytimes.com,https://www.nytimes.com/2026/06/10/style/diljeet-taylor-byu-track-coach.html,1781210989,"Diljeet Dosanjh Taylor, B.Y.U. Track Coach, Won’t Change for Her ‘Haters’","Diljeet Dosanjh Taylor, B.Y.U. Track Coach, Won’t Change for Her ‘Haters’

Diljeet Dosanjh Taylor, an outspoken feminist in Mormon country, has helped make Brigham Young University into a running powerhouse.",
rss,www.nytimes.com,https://www.nytimes.com/2026/06/10/style/indiscreet-comments-drunkenness-affairs.html,1781096403,My Sister-in-Law Made an Indecent Suggestion After a Night of Drinking. Help!,"My Sister-in-Law Made an Indecent Suggestion After a Night of Drinking. Help!

A reader is unsure whether to tell his wife about her sister’s drunken musings, including an imagined scenario in which they might rekindle their long-ago love affair.",
rss,www.nytimes.com,https://www.nytimes.com/2026/06/10/style/knicks-fans-msg-nba-finals-fashion.html,1781114983,"For the NBA Finals, These Knicks Fans Show Out in Style","For the NBA Finals, These Knicks Fans Show Out in Style

Fans want to support their team, but they’re not willing to squelch their sense of style.",
rss,www.nytimes.com,https://www.nytimes.com/2026/06/09/style/tribeca-festival-artists-dinner-knicks-sofia-coppola.html,1781030646,"At the Tribeca Festival Artists Dinner, Celebrities Cheered on the Knicks","At the Tribeca Festival Artists Dinner, Celebrities Cheered on the Knicks

Actors cheered on the Knicks at Chanel’s annual Tribeca Festival Artists Dinner, which became something of an unofficial celebrity watch party.",
rss,www.nytimes.com,https://www.nytimes.com/2026/06/09/style/los-angeles-clothes-retail.html,1781105515,The Joy of Shopping in Los Angeles,"The Joy of Shopping in Los Angeles

Men, they’re not afraid to spend! Plus, have we hit Knicks merch overload?",
rss,www.nytimes.com,https://www.nytimes.com/2026/06/09/science/space/prada-axiom-lcvg-artemis-iii.html,1781110989,Artemis Astronauts to Wear Prada Spacesuits,"Artemis Astronauts to Wear Prada Spacesuits

Prada and Axiom Space unveiled the bodysuit that will go to the moon.",
rss,www.nytimes.com,https://www.nytimes.com/2026/06/09/style/street-style-look-pinstripe-trousers.html,1781010003,Street Style Look of the Week: Pinstripes From London,"Street Style Look of the Week: Pinstripes From London

Statement trousers were judged to be worth the splurge in a London boutique.",
rss,www.nytimes.com,https://www.nytimes.com/2026/06/09/style/taylor-swift-travis-kelce-wedding-betting.html,1781013545,Taylor Swift’s Wedding Has Users Placing Bets on Polymarket and Kalshi,"Taylor Swift’s Wedding Has Users Placing Bets on Polymarket and Kalshi

Call it “parasociality exploded” or an invasion of privacy, but that hasn’t stopped bettors on prediction market sites.",
rss,www.nytimes.com,https://www.nytimes.com/2026/06/09/style/butt-magazine-instagram-meta-nudity.html,1781203075,How Much Nudity Does Instagram Allow? Butt Magazine Would Like to Know,"How Much Nudity Does Instagram Allow? Butt Magazine Would Like to Know

The only thing consistent about the social media platform’s rules on showing naked body parts appears to be its inconsistency in enforcing them.",
rss,www.nytimes.com,https://www.nytimes.com/2026/06/08/style/tony-awards-red-carpet-memorable-fashion.html,1780931203,"Unforgettable Looks at the Tony Awards: Cole Escola, Sarah Paulson and More","Unforgettable Looks at the Tony Awards: Cole Escola, Sarah Paulson and More

Shrunken suits, bouncy wigs and gloves that came with a manicure were some of the looks that stood out on the red carpet.",
rss,www.nytimes.com,https://www.nytimes.com/2026/06/08/style/tony-awards-after-parties.html,1781017335,"At the Tony Awards After-Parties, a ‘Harry Potter’ Reunion and Winner Celebrations","At the Tony Awards After-Parties, a ‘Harry Potter’ Reunion and Winner Celebrations

A crowd that included Daniel Radcliffe, Cole Escola and Carrie Coon celebrated with whiskey ice cream at Rockefeller Center and show tunes at the Carlyle hotel.",
rss,www.nytimes.com,https://www.nytimes.com/2026/06/08/style/nyc-knicks-nba-finals.html,1780909301,"While New York Celebrates the Knicks’ Finals Appearance, Some Residents Shrug","While New York Celebrates the Knicks’ Finals Appearance, Some Residents Shrug

Not everyone in the city is being swept up in the team’s championship drive. Some are just trying to see a Broadway show, or spin some yarn.",
rss,www.nytimes.com,https://www.nytimes.com/2026/06/08/fashion/crop-top-styling.html,1780909261,What’s the Best Way to Wear a Crop Top?,"What’s the Best Way to Wear a Crop Top?

A reader wonders whether they are for teenagers only.",
rss,www.nytimes.com,https://www.nytimes.com/2026/06/07/style/tony-awards-2026-red-carpet-looks.html,1780895735,Tony Awards 2026 Red Carpet: See the Looks of Broadway’s Biggest Stars,"Tony Awards 2026 Red Carpet: See the Looks of Broadway’s Biggest Stars

Here’s what Broadway’s biggest names wore to walk the blue carpet at the 79th Tony Awards.",
rss,www.nytimes.com,https://www.nytimes.com/2026/06/07/style/bruce-springsteen-talks-about-his-place-in-american-music.html,1780856513,Bruce Springsteen Talks About His Place in American Music,"Bruce Springsteen Talks About His Place in American Music

As he opens an expansive cultural center not far from the Jersey Shore boardwalk, the singer describes himself as “a small link in a big chain.”",
rss,www.nytimes.com,https://www.nytimes.com/2026/06/07/business/creep-boss-recruiter-unpaid-work.html,1780822905,My Boss Is a Manipulative Creep. What Can I Do?,"My Boss Is a Manipulative Creep. What Can I Do?

Plus: How much unpaid work can a recruiter demand? And what on earth is that smell?",
rss,www.nytimes.com,https://www.nytimes.com/2026/06/07/style/zegna-malibu-mens-wear.html,1780822899,Zegna Reimagines the Malibu Beach Bum,"Zegna Reimagines the Malibu Beach Bum

The Italian men’s wear label relocates its range of soft tailoring and nubby knits to coastal California.",
rss,www.nytimes.com,https://www.nytimes.com/2026/06/07/style/groom-hair-makeup-concierge-therapy-glam-squad.html,1780822854,"No Longer ‘Supporting Cast,’ Grooms Now Want Glam Squads, Too","No Longer ‘Supporting Cast,’ Grooms Now Want Glam Squads, Too

The wedding industry is seeing an emerging ecosystem of services for grooms, from day-of hair and makeup to concierges and even therapists.",
rss,www.nytimes.com,https://www.nytimes.com/2026/06/07/style/giovanna-flores-indie-designer-flores-paper.html,1780822831,The Niche Designer Dressing the A-List in Scraps,"The Niche Designer Dressing the A-List in Scraps

‘It’ girls are lining up for Giovanna Flores scraps.",
rss,www.nytimes.com,https://www.nytimes.com/2026/06/06/style/springsteen-opens-his-music-center-in-new-jersey.html,1781212934,Bruce Springsteen Opens His Music Center,"Bruce Springsteen Opens His Music Center

Jon Bon Jovi, Public Enemy and others joined him to ring in the Bruce Springsteen Center for American Music, a $50 million archive and cultural hub.",
gnews,news.google.com,https://news.google.com/rss/articles/CBMifEFVX3lxTE9udlNLX3hhVmdPUlNqcDlaQURDb0s2TG5aMzlSdlVVNll4SWFpUmFCcnFzMWFqQmhmVGdzWkJtRF9Mbmw5LUs1NWxHWXp1Y1FaQ3M0QXRhNFpTN3hzRGpJdUxoM0htdXJRdUstWWtOTG01TWxpckJYel9rOGU?oc=5,1781391600,5 Gen Z Fashion Trends Gen X Will Never Understand - women.com,5 Gen Z Fashion Trends Gen X Will Never Understand - women.com,fashion trend
gnews,news.google.com,https://news.google.com/rss/articles/CBMirAFBVV95cUxNdUp4eVVvbks5dGZLc0hxaDI5YWJoUTFHUVdWcGpkV0pDak1fWG00MDNqNzhXMFhwQ2xXZVZuM1EyU2FMZUZTWWllUGFfOFhZOXNxRVZ1U1JoSkQxMXl3TjdmczNjZkJpWmptY2hrcHcxY2xPQU45ZGVTazlNMVhmR0NPa3V1amY1YnF3Z1JoZEowa1RWM1pfa0tjQ1p5akpZd3JZZXpmQzdCZWZf?oc=5,1781379461,Mary-Kate and Ashley Olsen’s Style Evolution—in Honor of Their 40th Birthday - Harper's BAZAAR,Mary-Kate and Ashley Olsen’s Style Evolution—in Honor of Their 40th Birthday - Harper's BAZAAR,fashion trend
gnews,news.google.com,https://news.google.com/rss/articles/CBMizgFBVV95cUxPS2x0UG9CWkVWVDROZ0pYX2xqTWhGdHlNT3VzNXhiU05wZ3o5YmdwWVpwbmJvOW5nWnFZUExWaUFaQk9pU0NINUQ2SmlNSVYzRjV6dlppa01XZWgxQ0pELThlOUhmOHZZeFI5Z2ozdHl2ZFBUTXkzQ21yaFZIUFZoWWF1aWNWU054SWdPa3hicmZ6RGRuRy1vNjVqMXBhRkRIQndySXNxRlpNbkVUbVBTb0NPYTZpS3NJTVpwN245SG5xYmpWRWswUkNYUHhNZw?oc=5,1781185602,Purdue retail behavior experts: Rethinking the fast fashion system through behavioral science - Purdue University,Purdue retail behavior experts: Rethinking the fast fashion system through behavioral science - Purdue University,fashion trend
gnews,news.google.com,https://news.google.com/rss/articles/CBMiiAFBVV95cUxNVHVxZlBYNk5jZ0Q2YnNUdmxWMzVFWWxMZVFKN3dHQ1FNdEFOYmJ1b2FlTmFvQnpMcXF6SlJmcWVTRThvZVBTYmZKM3ZVRllOM2hWQmk0dzNwZHFtUng2bTA2TUM0OFZTNTZsSWdqOXp0d0xTM3dYZ0llOTJYT2ExQ3pUMmhxUHV4?oc=5,1781074800,5 Trends Cool Fashion People Are Wearing for Summer 2026 - Who What Wear,5 Trends Cool Fashion People Are Wearing for Summer 2026 - Who What Wear,fashion trend
gnews,news.google.com,https://news.google.com/rss/articles/CBMif0FVX3lxTFBDNGZGQURXZkJQeTZYWnMtMXFHdzZKeUlyUF9fWUpnNUFTd1dKWXViXzFwb3RWRmJobWtVTllnU0R5Zlo3dE5Id1JkZzhfVTZveG40WVN3VlRNRFpQOU1NVHFvXzdOanA0UjJFZE1PaEtxTGl4bGRFRFVScHhFZ2vSAYQBQVVfeXFMUDAzMjV1SjFXXy1jQnMyOGxudUhPbmI5Sld1SnpJcWRVdUVsbTNyeW1nQmRiU1VxbExvQXh2WjlqbFZmZjdoZGxmMVZEdWpHOUhlVUlyNTNRbEQ4dHRmd01Mb1ZMWlV6MHZWOGNYZ3dHVzBaWlVTbjV2cDdpUk1Jc1hOUFFB?oc=5,1781169994,"6 fashion trends that are taking over for the summer season - ABC News - Breaking News, Latest News and Videos","6 fashion trends that are taking over for the summer season - ABC News - Breaking News, Latest News and Videos",fashion trend
gnews,news.google.com,https://news.google.com/rss/articles/CBMigwFBVV95cUxOREMtWktDcFJWQWVGQ2VVYm9mMFpVSzNmZW9FYjR1LXhMSDE3dnk3aG8xRy0xM0RVUXdGTU1CQWJ1dFRQbjk1WldhTzdmbFpZUGZhYjk3Ry1RNkVzNFo4R01icjVZRy1uNkNLZHJkeUZOTXdremFIZENkU1ViUjk4eFJmQQ?oc=5,1781161200,"Trending today, but not tomorrow - The Daily Cardinal","Trending today, but not tomorrow - The Daily Cardinal",fashion trend
gnews,news.google.com,https://news.google.com/rss/articles/CBMib0FVX3lxTE55N1BXeU9CbnFjR1dFYmVLOUhCWDRIU0ttbjNCQS1KYUZuakFOcHVFT1NOQWtqdGZ6Rl8yalZHS2tuSjNUNzJDTE5PVGdza1lLOXJEbHJ0aHZhS3FJRG5rbzRXVU96Mi05anJUaHRZa9IBdEFVX3lxTE9raVc3RDhDRF80QUVXRlN4dllEZ1A2ZjBSUEtrUlVjS0VndEEzeHVBR0ZyOTQ3M3VndzZQVjMzSDM4VU1Qdk1OUl9iNlZrRktEenhMZDBDTUttRlIyc2dCZl9CR3hZY2l6bTN5ejVmdXFfVkl4?oc=5,1781363788,High-Profile Luxury Brand Collaborations - Trend Hunter,High-Profile Luxury Brand Collaborations - Trend Hunter,fashion trend
gnews,news.google.com,https://news.google.com/rss/articles/CBMijAFBVV95cUxPdnNKUXkySFU0RERTZlg3emctYzlOYmZrbXk4ZDh6MF9yeVhScGVmWVlOekZRTlFObVFTUFJYVWNvRE8wRUlISDY0Si1MT2dsOE9nTUJKSnhLb1g5c2duRXlmVTJleVJVTmRIRW16XzU5b1ktQjNFdG5GWFFQVUZUTktqbkN5cWIzVWdSOA?oc=5,1781035475,Want to Stay on Trend? Stop Brushing Your Hair. - The New York Times,Want to Stay on Trend? Stop Brushing Your Hair. - The New York Times,fashion trend
gnews,news.google.com,https://news.google.com/rss/articles/CBMikAFBVV95cUxNLWZZWVRHTmlqUnFUa1Z4T0Fvdk1CMzQxNmxGQTVmZU54RWdMUDRLSmZEVTA0UnhLTmhaRi1ZNGR1MmxoTVVQalk5bUN6OHFiYWNEUV9hMHFmSlBlQVlxdmM4bll6VmNhZFpYRnJyU3ZzcnNUYkk5THBlTVBLOUhvOFpoWE91QzBXTVFlb19xb3k?oc=5,1781179226,"Soccer Jerseys, Sneakerinas, and the Sporty Trend Taking Over Summer 2026 - ELLE","Soccer Jerseys, Sneakerinas, and the Sporty Trend Taking Over Summer 2026 - ELLE",fashion trend
gnews,news.google.com,https://news.google.com/rss/articles/CBMimAFBVV95cUxNNVpYS3kwM0hBTWhrNHlTeVpNcmNUWlJBM19pek90Um9QNU5Ic3FNLUUyUDgwNEtnYTNPWE8zM1I4TGRHQmthNzVJT1FLSVYwZS1jNWl5MEwzbWctVXhOYWNkQWV2ajlWSDJKaEl4UEptaEtTYW9vRVpGQkhWOW9iaFRPVDBxdWt0ZGlUZzJHTVFOMzlkVnJ1Mw?oc=5,1781205900,Everyone Says They Want Timeless Style Right Now. What’s So Wrong About Dressing Like It’s 2026? - Cosmopolitan,Everyone Says They Want Timeless Style Right Now. What’s So Wrong About Dressing Like It’s 2026? - Cosmopolitan,fashion trend
gnews,news.google.com,https://news.google.com/rss/articles/CBMibEFVX3lxTE1vMEVRcVRnN1lwd2xDcVZaVm5yZG9GLW1HZV9qdWgtZTdnNHdwX1YtTGdBQ0xLVERYdDVIQXVFNlVvT0ZiM0lCVGlCNExBb3lyM2NHNHlydGRUUHJuTUg1Y3p4Y3lnWU9iWXhNUQ?oc=5,1781189280,The Tumblr Girl (& Her Aesthetic) Never Really Left - Refinery29,The Tumblr Girl (& Her Aesthetic) Never Really Left - Refinery29,fashion trend
gnews,news.google.com,https://news.google.com/rss/articles/CBMiiwFBVV95cUxOWFBYa0RRODk5M3E0T19xXzVkMHBiWm5DY1dUS21tdUFLb0t6ZmxOSlNWanNJeERoNmF3al94eTFkeXQ2cGNjbERzWDh1OUtsNFgwZDdpUU9VRFlDTjZmcUNHMU1ZLU5yb19zOEY0REhNSUtzalZfLTE3b1RKN1psSHBmV0t0SE92M2RV?oc=5,1781304379,How Animal-print Swimsuits Are Bringing Maximalism Back to the Beach - WWD,How Animal-print Swimsuits Are Bringing Maximalism Back to the Beach - WWD,fashion trend
gnews,news.google.com,https://news.google.com/rss/articles/CBMihAFBVV95cUxPTG14UW00YjNVUVZfV0lZcXEwbWxHR2ExdnZQZFd1UDF5aXJjOG0tXzVteGE4VGZKUjdKZDdLOGt2dXRFUHJhS2xMQXd3QW8zWm55SGFyVlFrZmxIQV9fRXJ4M2Q5bFFEZkpIVmFFXzVPR3lxc0JzaERBd2RMazVWSWNDTzA?oc=5,1781113725,7 Wearable Summer Trends You’ll Actually Want to Try - Katie Couric Media,7 Wearable Summer Trends You’ll Actually Want to Try - Katie Couric Media,fashion trend
gnews,news.google.com,https://news.google.com/rss/articles/CBMihgFBVV95cUxQVk0yX1F0NE5sUTBTc19xLU8tQ2hZek5DNkQ4dkFQUTQwbFkyTG1UUFZadi1mdTVjdzVsbWFvbm5xUEdSbVczT2pHdHRfR1ZaNjlmSVB0S0E5RlQwc09uMEN6dGY5MnQzdjIwVjBiMDZXeXI2VmY5ZnZfZFdqWlgwQ3lZMFpjQQ?oc=5,1781200000,Madonna’s Fashion Inspiration for Confessions II ? The Queen of Pop Herself - Vogue,Madonna’s Fashion Inspiration for Confessions II ? The Queen of Pop Herself - Vogue,fashion trend
gnews,news.google.com,https://news.google.com/rss/articles/CBMilgFBVV95cUxOSTFZcnJYMEdrUW1jbXkyR1ZtYldBR3BSMzBoY1Z0Q09la0JlSXF3LWRURHI5d2RqSkpWLU9oc2FUNDk3NGl3QmNPWGRIVWlERXdUREJSaDRnTXhVeC1QUmtzTWhsMkRwWGN0UFY3dU5hMzA4Ni1JU0RZUWVOTGtVQlFWaG1lY1NFS1ZEUlV1WThTMWpIWXc?oc=5,1781178720,"6 staples that will take over office fashion this summer — and 5 that are on their way out, according to stylists - Business Insider","6 staples that will take over office fashion this summer — and 5 that are on their way out, according to stylists - Business Insider",fashion trend
gnews,news.google.com,https://news.google.com/rss/articles/CBMiX0FVX3lxTE1aQ0lDZjQtaHdZYmlZSjVfeUllUGlITW9yMFF3dGtSRHlrY0hTbml5MEcwdDRPakdQUllFMFJLdVRnSnotYTRlRzFGOUVqdVVyRU0xMXR2NldkR1ViYVJF0gFkQVVfeXFMTXktdWZiNm1pS3BVZ0FsYnNIWFBCbGUzREduTktHQWVKRXotRUs0OGhTS0lNT1ZRT0FVN1dYSHNCbjhJbXJ6akVKN0RWaDM2WWpNVldhM280dlRRV0JTcThIXy1uag?oc=5,1781359588,Playful Tennis-Inspired Fashion Campaigns - Trend Hunter,Playful Tennis-Inspired Fashion Campaigns - Trend Hunter,fashion trend
gnews,news.google.com,https://news.google.com/rss/articles/CBMigAFBVV95cUxQLU5xNF85MVNRcFZrd2FIbmg0UjdpbVpCeW95MFpHbVdOMzlsTElybW1LY1FGREtuU2c5cmUzSnVNUjlKV1h4aDV4ZGtncFZzUzBqVW5GWFBQMmZrNUp1TkpZSE5rNHJIaDRsaDhxTFFILU5hRFMyUks2S2M1TkwwRw?oc=5,1781161200,"8 Destinations, 16 Trends: What to Pack for the Ultimate 2026 Vacation Wardrobe - Who What Wear","8 Destinations, 16 Trends: What to Pack for the Ultimate 2026 Vacation Wardrobe - Who What Wear",fashion trend
gnews,news.google.com,https://news.google.com/rss/articles/CBMiYkFVX3lxTE5IUmxqeGVtM2Vtem1VWGJXWkEyNGZKcFdlVlVqeXRRNEJJazFyRDBsTUZUVkQ0VTBDRmdUVklOZ1N3YVViVmxSQ0FSbUt2TTk0VkNiOHpONU9kLWlaRXVmbkFn0gFnQVVfeXFMUEctaVZqT3l6Z09LRU9jbkpFRURzZ25JRS1CZEc1X1VfUDRiSm54UGJmT3ZIWFFvLVJhVmgwYmVIR1VVVTBHX0dMd0JYVlNKM1RnV0diRmEzcHdHSFJ0QXhSbnEwTEd4VQ?oc=5,1781367388,Timeless Menswear Fashion Silhouettes - Trend Hunter,Timeless Menswear Fashion Silhouettes - Trend Hunter,fashion trend
gnews,news.google.com,https://news.google.com/rss/articles/CBMiX0FVX3lxTE84dmJuNmZ6eGR4MTFldXZFUk1wNHh0SFZ6dmxyM004RHljOWJ1dWFDMWQ2d1FjVll4dmhueW8wT2gtbXJKOTV0Q3Vka05QZmtjV0gzWk9RUV9tU2FZZm1R0gFkQVVfeXFMTVQ3X2Nid3BwM1FWUEoxNnlad3Nyc2hiNlBxSTJtdXZYYUFkSE1wcXpLSUFHVTg3aFVRaW56UDBFV2VoLTdqbms1cjM1Y2lIbVBJbHB5bVM4THhiTndCRjFrbDF5RA?oc=5,1781363188,Summer-Ready Contemporary Fashion Films - Trend Hunter,Summer-Ready Contemporary Fashion Films - Trend Hunter,fashion trend
gnews,news.google.com,https://news.google.com/rss/articles/CBMiY0FVX3lxTE4tSFFkaG5aOFI3Q2dSeldITGhKVE1ZdkhsTHNiTzRfcjRCQnl6SHl6WHRrdVd1U3ZiR1RnMjUtY05zdDFQRnVudjIwWHBKanVRSEVOU2tDMWdLOGFBT1A4TW1FNNIBaEFVX3lxTFB4Ty1sdlVMRV8ycVJpUUVOLV9FWElfcHhDNmlFbkhOdEJWTGxZTm1mcVJWaEVTMHJLcE5rM193WTBaaVJUbW1fSTFqT0dWVEtoMmZqVHRvSWZRaEtIbXZYOGh2aXdhNk9D?oc=5,1781321775,Magazine-Style Fashion Columns - Trend Hunter,Magazine-Style Fashion Columns - Trend Hunter,fashion trend
