source,query,url,created_utc,title,text
youtube,men's fashion trends,https://www.youtube.com/watch?v=_9jqUy_R148,1781857042,luxury fashion,"Welcome to Luxe Lane ⚡ Gen Z fashion starts here. Discover trendy men's outfits, streetwear styles, clean fits, and modern ..."
youtube,men's fashion trends,https://www.youtube.com/watch?v=9_l4F5KcEOQ,1781847030,Upgrade your style with these trendy men&#39;s shirts!  #fashiontrends #mensfashion #trending #shorts,"Upgrade your style with these trendy men's shirts! From casual looks to smart formal wear, find the perfect shirt for every occasion."
youtube,men's fashion trends,https://www.youtube.com/watch?v=lPZ1fexkXaA,1781846404,Top 5 Trending College Outfits for Men 2026 | Gen Z Campus Fashion Ideas #fashion #trending #fyp,Upgrade your college style with these Top 5 Trending College Outfits for Men! From oversized streetwear and flannel layers to ...
youtube,men's fashion trends,https://www.youtube.com/watch?v=0tBB3ihlcf4,1781843152,Aaryan Kelvin ka Red Outfit Look Price Dekhne Ke Liye Video End Tak Watch Karo! #fashion,Aaryan Kelvin ka classy Red Shirt + Black Pants + Black Watch look simple hote hue bhi premium vibe deta hai. ❤️ Red Shirt ...
youtube,men's fashion trends,https://www.youtube.com/watch?v=kGKLpyS6Ihk,1781842685,Aaryan Kelvin Outfit Price Reveal 💸 | Expensive Fashion Breakdown 👕😱#aaryankelvin #shortsfeed,"COSTIFY OUTFIT BRAND Welcome to costify outfit brand– your ultimate destination for fashion, style, elegance, and outfit ..."
youtube,men's fashion trends,https://www.youtube.com/watch?v=_VtJBn4lf1k,1781838260,Shades of Blue for Men #fashiontrends #outfitideas #style #menfashion   #hlehlefits,
youtube,men's fashion trends,https://www.youtube.com/watch?v=9lQ1JaRlYbc,1781831900,Royal Men&#39;s Fashion Look 👑,credit -By volmora office Outfits Trending Men's Style ✨ Smart Dressing Tips 🕶️ Fashion Inspiration Office & Party Looks ...
youtube,men's fashion trends,https://www.youtube.com/watch?v=tgK-Bw5PvPM,1781823573,5 got me my new favorite tote bag #fyp #bags #vintage... #Shorts #wwiiiillllllll,5 got me my new favorite tote bag #fyp #bags #vintage... 5 got me my new favorite tote bag #fyp #bags #vintage... 5 got me my ...
youtube,men's fashion trends,https://www.youtube.com/watch?v=FPrifWkEtF4,1781820036,"Top 2026 Trends: Men&#39;s Fashion, DIY Home Improvement &amp; Lifestyle Essentials","Top 2026 Trends: Men's Fashion, DIY Home Improvement & Lifestyle Essentials ------- https://amzn.to/4v40lUB Cricut ..."
youtube,men's fashion trends,https://www.youtube.com/watch?v=u9DmLCUS_wk,1781815607,Fashion Clean Boy Aesthetics #fashion #fashiontrends,"Minimalist Style: “Clean lines, neutral tones, and effortless style that never goes out of fashion.” #fashion #fashiontrends ..."
youtube,men's fashion trends,https://www.youtube.com/watch?v=Tcxm-bhvo5A,1781805614,Cherry Bandana Energy 🍒 #outfitinspo #streetstyle #fashion,"Get ready to elevate your style with the Cherry Bandana Energy, a unique fusion of street style and fashion. In this outfit inspiration ..."
youtube,men's fashion trends,https://www.youtube.com/watch?v=bBp3i8bQfxI,1781802208,@BalaJiGarmentsKarnal-hr #shortsfeed #fashion #karnal #clothing #shorts #shortvideo #garmentsshop,"Welcome to Balaji Garments Karnal At Balaji Garments Karnal, we bring you the latest fashion trends, premium-quality clothing, ..."
youtube,men's fashion trends,https://www.youtube.com/watch?v=QAX2SOgRnEE,1781802027,What to Wear on a Date for Men 👔❤️ | Stylish First Date Outfit Ideas,MensFashion #DateOutfit #MensStyle #StyleTips #MasculineStyle #ClassyMen #ModernGentleman #Menswear #FashionInspo ...
youtube,men's fashion trends,https://www.youtube.com/watch?v=kopsrdKQwyI,1781801001,90s Fashion That Set The Tone Back In The Day‼️,90s Fashion That Set The Tone Back In The Day‼️ #youtubeshorts #blackcommunity #funnyshorts #comedyshorts #fypシ ...
youtube,men's fashion trends,https://www.youtube.com/watch?v=0sAQsrVTSsg,1781798571,🚀Trending Clothes For Boys 2026✨ #shorts #mensfashion #style,Trending Clothes For Boys 2026✨ #shorts #mensfashion FOLLOW ME ✓ TRENDING OUTFITS IDEAS @har_shstyle ...
youtube,men's fashion trends,https://www.youtube.com/watch?v=RgexEyqqlPY,1781794993,The Handsome Bag Buyer: A Twist on Male Fashion,Uncover the secret behind the most handsome man's obsession with bags. Discover top picks and the story of my husband's ...
youtube,men's fashion trends,https://www.youtube.com/watch?v=TLMOST3qLoM,1781794687,🔥 Football Jersey Jeans Ultimate Streetwear Look ⚽👕| Men&#39;s Fashion Tips 2026 #stylelook #stylefinder,Football Jersey + Jeans = Ultimate Streetwear Look ⚽   | Men's Fashion Tips 2026 . . Football jersey sirf match dekhne ke liye ...
youtube,men's fashion trends,https://www.youtube.com/watch?v=-nuk6SaEM9w,1781793662,Dye art shirt #shirt #fashion #fashiontrends #fashionblogger #dyestyle #mensfashion #clothing ￼,
youtube,men's fashion trends,https://www.youtube.com/watch?v=SUTIQDSTa5c,1781793125,Simple But Stylish Outfit Ideas ✨ #Shorts,"Upgrade your everyday style with simple yet stylish outfit inspiration. Clean fits, modern fashion, and effortless looks that never go ..."
youtube,men's fashion trends,https://www.youtube.com/watch?v=fxgbolbPkIw,1781790928,#clothing #ai #fashiontrends #fashion #stylish #style #summer #youtubeshorts #tshirt #fyp,
youtube,men's fashion trends,https://www.youtube.com/watch?v=stRQB4rHhOI,1781788702,Boys Shirts Year 10-15 #fashiontrends #mensfashion #tshirtdesign #fashion #virelshirts,
youtube,men's fashion trends,https://www.youtube.com/watch?v=blZDreaDElg,1781788260,Polo with Flared Trouser | Office outfits | Party Outfits #fashion #fashiontrends #mensfashion #ootd,
youtube,men's fashion trends,https://www.youtube.com/watch?v=YxgRFU3IEL4,1781785056,"Elevate your style with Gokulam Fashion—where elegance, quality, and timeless trends meet occasion.","Elevate your style with Gokulam Fashion—where elegance, quality, and timeless trends meet every occasion. .. Follow us ..."
youtube,men's fashion trends,https://www.youtube.com/watch?v=rcQZeqjLks8,1781783424,Stylish Digital Print Shirts for Men &amp; Kids | New Fashion Trends 2026#shorts #viralvideo,DigitalPrintShirts #MensFashion #KidsFashion #PrintedShirts #FashionTrends #CasualWear #MensStyle #KidsClothing ...
youtube,men's fashion trends,https://www.youtube.com/watch?v=EQVUOUaVbGM,1781782212,🔥 Effortless Men’s Fashion 2026 | Casual Luxury Look,Effortless Men's Fashion 2026 | Casual Luxury Look Description Upgrade your style with this clean and modern men's fashion ...
youtube,women's fashion trends,https://www.youtube.com/watch?v=a__Rycw21JE,1781855891,मुझे घर का पता पक्का दो 🥹.. @RaniSingh_0007 #shorts #bhojpuri #fashiontrends #viralreels #trend,मुझे घर का पता पक्का दो .. @RaniSingh_0007 #shorts #bhojpuri #fashiontrends #viralreels #trend.
youtube,women's fashion trends,https://www.youtube.com/watch?v=TkwPq2dA6PQ,1781855739,parcel me aaye cotton suit 😍 #fashion #onlineshopping #trending #shorts #suits #fashiontrends #dress,
youtube,women's fashion trends,https://www.youtube.com/watch?v=IO1g5KGtVKQ,1781854477,🔥 Most Beautiful Embroidered Sarees of 2026 | Women&#39;s Fashion  trends  #saree #fashion #viral,https://affiliate.meesho.com/collection/NDcxNzE2Mjo6Ojo6Om5vcm1hbA== Most Beautiful Embroidered Sarees of 2026 ...
youtube,women's fashion trends,https://www.youtube.com/watch?v=Hp6LhFlfn1M,1781849130,🔥 Top 5 Women&#39;s Fashion Trends You Must Try in 2026! #Shorts #Fashion #WomensFashion #FashionTrends,"Welcome to StyleBloom USA Daily fashion trends, outfit ideas, and style inspiration for women. Subscribe for more fashion ..."
youtube,women's fashion trends,https://www.youtube.com/watch?v=7823SIedJak,1781847560,ideas for women western dress 👗♥️#fashion #fashiontrends #reels #viral #shortvideo #onlineshopping,ideas for women western dress ♥️#fashion #fashiontrends #reels #viral #shortvideo #onlineshopping.
youtube,women's fashion trends,https://www.youtube.com/watch?v=fmmUFSQUAmw,1781847350,Elegant Summer Fashion Outfit Transformation | Casual Chic Style for Women #Shorts#fashion,"Discover this elegant and trendy summer outfit idea! Perfect casual chic fashion inspiration with stylish top, printed pants, hat, and ..."
youtube,women's fashion trends,https://www.youtube.com/watch?v=-ucuGHLP6Ds,1781847002,✨ My Choice or My Bestie&#39;s Choice? Vote Now! #ytshorts #trending #fashion #style #ootd#fypシ,"My Choice vs My Bestie Choice – Fashion Edition! ✨ Who has the better fashion sense? In this fun fashion challenge, watch us ..."
youtube,women's fashion trends,https://www.youtube.com/watch?v=oj_jg3mgeKo,1781843860,The Outfit 🤍|| Kurti Look|| #ootdguide #styleinspo #fashiontrends #song #fyp #meeshohaul #ytshorts,The Outfit || Kurti Look|| #ootdguide #styleinspo #fashiontrends #song #fyp #meeshohaul #ytshorts Upgrade your style with this ...
youtube,women's fashion trends,https://www.youtube.com/watch?v=gY_YdI_K-n0,1781843720,"✨ Latest Women Fashion Collection 2026 | Dresses, Shoes, Bags &amp; Necklaces","Fashion lovers ke liye latest women dresses, stylish shoes, trendy bags aur beautiful necklaces ki collection. Rozana naye fashion ..."
youtube,women's fashion trends,https://www.youtube.com/watch?v=T9jdDGAWKRU,1781840114,Elegant Blue &amp; White Summer Outfit Ideas 💙🤍 | Women&#39;s Fashion Inspiration #Shorts,Elegant Blue & White Summer Outfit Ideas | Women's Fashion Inspiration #Shorts Description: Looking for a classy and ...
youtube,women's fashion trends,https://www.youtube.com/watch?v=qkjloxIL6nk,1781838022,Latest Women&#39;s Fashion Trends 2026 😍✨ | Stylish Outfit Ideas Every Girl Will Love 💖 #shorts #fashion,"Discover the latest women's fashion trends with this stunning outfit inspiration. Perfect for girls who love trendy, elegant, and ..."
youtube,women's fashion trends,https://www.youtube.com/watch?v=pI9dAz_IweE,1781836193,Wait For The Transformation 😍✨ | Which Outfit Wins? 👗🔥 #shorts  #fashion #outfit #glowup,"Wait for the transformation ✨ Which outfit is your favorite? Comment: 1️⃣ 2️⃣ or 3️⃣ Fashion inspiration, outfit ideas, ..."
youtube,women's fashion trends,https://www.youtube.com/watch?v=2mPl7l0lM3o,1781836207,Women&#39;s Top Collection | Stylish Outfit Inspiration | Must-Have Fashion Trends #fashion,"women's top collection, latest women's tops 2026, trendy tops for women, stylish ladies tops casual tops for girls, fashionable ..."
youtube,women's fashion trends,https://www.youtube.com/watch?v=DpUVw63Njws,1781828232,na churii #viralvideo #love #fashiontrends #wedding #fashion #trendingshorts,
youtube,women's fashion trends,https://www.youtube.com/watch?v=MVpIQ6C3ONk,1781827228,50 Stunning Long Lace Dress Styles for Classy Ladies | Fashion Trends 2026,"Discover the beauty of elegant fashion with these stunning long lace dress styles! In this video, you'll see gorgeous lace dress ..."
youtube,women's fashion trends,https://www.youtube.com/watch?v=QoV8PK3oOMg,1781816400,Casual Women Top,"Welcome to handprudcts  ✨ This made channel is all about the latest Moda Blouses designs, modern fashion trends, and stylish ..."
youtube,women's fashion trends,https://www.youtube.com/watch?v=vZCgfvgDDkU,1781816225,🔥 Top Fashion Trends Every Girl Needs in 2026! #Shorts,"Discover the latest USA women's fashion trends! ✨ Follow StyleBloom USA for daily outfit ideas, style tips, and fashion inspiration."
youtube,women's fashion trends,https://www.youtube.com/watch?v=xh3b2Q0pOwI,1781810284,Los ZAPATOS PLANOS más TENDENCIA del verano 2026,publi(regalo). Las bailarinas caladas y las bailarinas de red son uno de los zapatos más tendencia del verano 2026. Te enseño ...
youtube,women's fashion trends,https://www.youtube.com/watch?v=rIZYmqo7r3k,1781809818,#humor #brasil  #foryou #fyp #love #crazyfashion #shorts #viral #youtubeshorts #fashiontrends,
youtube,women's fashion trends,https://www.youtube.com/watch?v=DukwxkYQqEg,1781809503,#humor #usa #foryou #fyp #love #crazyfashion #shorts #viral #youtubeshorts #fashiontrends,
youtube,women's fashion trends,https://www.youtube.com/watch?v=88DdPSCH9ws,1781808364,Victoria Beckham’s WAG style and uniform are unmatched #fashiontrends #worldcup #victoriabeckham,
youtube,women's fashion trends,https://www.youtube.com/watch?v=K-qOn6-Xrmw,1781805696,#JK #uniform #short #skirt#trendingshorts #fashiontrends,
youtube,women's fashion trends,https://www.youtube.com/watch?v=V9EcfSVvlQg,1781805615,#humor #usa #foryou #fyp #love #crazyfashion #shorts #viral #youtubeshorts #fashiontrends,
youtube,women's fashion trends,https://www.youtube.com/watch?v=VP195aCzvbI,1781802818,Formal Fashion trends ⭐️ #fashion #dress #partywear #shorts,Formal Fashion trends #fashion #dress #partywear #formalwear #fashionstyle #fashiontrends #womensfashion ...
youtube,women's fashion trends,https://www.youtube.com/watch?v=md4U4NvypiA,1781802016,#humor #usa #foryou #fyp #love #crazyfashion #shorts #viral #youtubeshorts #fashiontrends,
youtube,streetwear 2025,https://www.youtube.com/watch?v=gBBoT1ZX1UU,1781845372,Bottines Plateforme Punk Goth Lacets – Femme 2025,"Step out in style with our Bottines Plateforme Punk Goth Lacets! At just $62.12, embrace your edgy side without breaking the bank!"
youtube,streetwear 2025,https://www.youtube.com/watch?v=wH32s0Ua1lc,1781484030,2025 pakai sistem pre-order ❌-#alinsideproduction 📠0895410501555#Screenprinting #streetwear #dtf,
youtube,streetwear 2025,https://www.youtube.com/watch?v=s7oHmltSWQI,1781385826,Teaser#1 magazine2025/2026 2e édition #fashion #wondacoutures #business #mode,
youtube,streetwear 2025,https://www.youtube.com/watch?v=IAhcpreya2U,1781361071,Jordan 4 black cat 2025💫💫#viral #jordans #FYP #blackcat #streetwear,"short #sneakerhead #unboxing Leave me size!!! Hello! My friend, if want this goods add our whatsapp:+86 152 6026 8083."
youtube,streetwear 2025,https://www.youtube.com/watch?v=pl8iapqEUsw,1781263765,People think oversized is a 2025 trend. The 90s would disagree.,fashion #streetwear #oversized People think oversized clothing is a new trend. The 90s would disagree. Fashion doesn't move ...
youtube,streetwear 2025,https://www.youtube.com/watch?v=oPHuQHVhEF8,1781257518,2025🎞️,
youtube,streetwear 2025,https://www.youtube.com/watch?v=huDGV5Hfa4M,1781121920,Inside the Bold Golf Show at Ireland Fashion Week 2025 ⛳️,"Kicking off Ireland Fashion Week 2025, and taking over Teeling Whiskey Distillery in the process, Bold Gold redefine classic Golf ..."
youtube,streetwear 2025,https://www.youtube.com/watch?v=GbM0NA3mCnY,1781121625,Inside the Bolf Golf Show at Ireland Fashion Week 2025 ⛳️,"Kicking off Ireland Fashion Week 2025, and taking over Teeling Whiskey Distillery in the process, Bold Gold redefine classic Golf ..."
youtube,streetwear 2025,https://www.youtube.com/watch?v=INDdxvvfM2g,1781121448,Behind-the-scenes at the Ireland Fashion Week 2025 Bold Golf Sportswear Show ⛳️,"Kicking off Ireland Fashion Week 2025, and taking over Teeling Whiskey Distillery in the process, Bold Gold redefine classic Golf ..."
youtube,streetwear 2025,https://www.youtube.com/watch?v=ttzwemi4E8s,1781097730,🔥 New Trending Black Denim Shorts 2025 | Stylish Streetwear Fashion You Need to See! 😍🖤#shorts,Discover the latest black denim shorts making waves in street fashion! ✨ Featuring a bold graphic design and modern ...
youtube,streetwear 2025,https://www.youtube.com/watch?v=pov9SUIAc2o,1780928559,Stylish Black &amp; Yellow Track Pant 🔥 New Trending Jogger 2025,Latest Black Track Pant with Yellow Side Stripes Looking for a stylish and comfortable track pant? This premium black jogger ...
youtube,streetwear 2025,https://www.youtube.com/watch?v=HZ9p7GsT58U,1780908547,The Aura Jacket | ETHCC Cannes 2025,
youtube,streetwear 2025,https://www.youtube.com/watch?v=a1vLkzJMInY,1780833600,2025 Streetwear Trends,"Streetwear fashion in 2025 evolves into a dynamic and futuristic style driven by urban culture, comfort, and sustainability. Discover ..."
youtube,streetwear 2025,https://www.youtube.com/watch?v=TXqZGGorAMI,1780762521,Recreating the worst outfit from 2025.     #fashiontrends #fashion #streetwear,
youtube,streetwear 2025,https://www.youtube.com/watch?v=yUbjCBjijeA,1780755670,Vintage Washed Shacket for Men 🔥 | Best Men&#39;s Shacket 2025 | Indian Streetwear Brand  #shacket,Vintage Washed Shacket for Men | Incroy & Merv SS25 Collection Looking for the perfect shacket outfit for men? This vintage ...
youtube,streetwear 2025,https://www.youtube.com/watch?v=r3QcBa7o32k,1780695360,Sneaker Con 2025 Legit Check | MIH DINO Mesh Hat,"At Sneaker Con 2025, one of the most recognized legit check personalities took a closer look at our MIH ART IS A CRIME DINO™ ..."
youtube,streetwear 2025,https://www.youtube.com/watch?v=pS8JObNfhcc,1780645071,2025,"Don't forget to follow us on Instagram @lifted.limited for more content, and subscribe to our channel for the latest updates. DM TO ..."
youtube,streetwear 2025,https://www.youtube.com/watch?v=MY46sKbeMDI,1780623479,POV: 2026 NFL Draft Rookies Pull Up To Showroom LA 🏈🔥,POV: The 2026 NFL Draft's hottest rookie class just pulled up to Showroom LA for a PRIVATE Rookie Premiere — and the energy ...
youtube,streetwear 2025,https://www.youtube.com/watch?v=tS9jeYnObOY,1780565144,Best shorts summer 2025#shorts # summer2025#шорты #baggy#bestshorts,
youtube,streetwear 2025,https://www.youtube.com/watch?v=MXc7iRYfgF4,1780563621,Established in 2025. Made for eternity. | DELVASTRO,Rate the fit from 1 to 10. Secure early access via Link in Bio.
youtube,streetwear 2025,https://www.youtube.com/watch?v=OUugQobmnXs,1780557993,"AmaxluluE Streetwear 2025, warme Luxus-koreanische Damen-Wi... — Top Pick 2026 | Unbeatable Price!","AmaxluluE Streetwear 2025, warme Luxus-koreanische Damen-Winterjacke, Damen-Kapuze, langer, übergroßer, gepolsterter ..."
youtube,streetwear 2025,https://www.youtube.com/watch?v=HEjTE631KdQ,1780557191,Men’s White Graphic Chunky Sneakers | Ultra Cushion Streetwear Platform Shoes 2025 #shoes #撈底 #nike,Looking for versatile streetwear sneakers that match every outfit? Our new graphic platform chunky shoes are crafted for modern ...
youtube,streetwear 2025,https://www.youtube.com/watch?v=oTF-1GwKqF0,1780506432,Eigenen Style finden | Part 2 (Hose) | 26.05.2025,Song: sakuracloud - miffy cafe Music provided by NoCopyrightSounds Free Download/Stream: Watch:
youtube,streetwear 2025,https://www.youtube.com/watch?v=6I2CgIIiftI,1780502671,Jerseys Under ₹999 in India 2025🔥|Link in bio.#shorts #shoes #drip #fashion #amazonfinds #streetwear,
youtube,streetwear 2025,https://www.youtube.com/watch?v=Kacb2mavPx8,1780497928,AJ 12 Flu Game 2025 On-Hand &amp; In-Depth Review! #sneakerslovers #sneakers,THE HOLY GRAIL IS IN THE BUILDING! AJ 12 Flu Game 2025 On-Hand & In-Depth Review! The wait is officially over! Today ...
