source,query,url,created_utc,title,text
youtube,men's fashion trends,https://www.youtube.com/watch?v=dEoqbI82Bd0,1779933873,Top 5 Trend 🔥 Shirts Combo...(छपरी के जैसे ड्रेस पहनना आज से बंद कर दो) #mensfashion #trend,Top 5 Trend Shirts Combo...(छपरी के जैसे ड्रेस पहनना आज से बंद कर दो) #mensfashion #trend ...
youtube,men's fashion trends,https://www.youtube.com/watch?v=fZU8PgMP8YQ,1779933678,THINGS THAT LOOK GOOD ON MEN? #fashiontrends #fashion #ootdguide,
youtube,men's fashion trends,https://www.youtube.com/watch?v=B6L6cIVOCvE,1779932972,𝐬𝐭𝐫𝐚𝐢𝐠𝐡𝐭 𝐟𝐢𝐭 𝐣𝐞𝐚𝐧𝐬 👖 #fashion #outfitinspo #shorts #streetstyle #fashiontrends,"""If this channel has helped you at all, please consider Subscribe → ‪@Endouk_Fs‬ °• If you are confused about where to use these ..."
youtube,men's fashion trends,https://www.youtube.com/watch?v=0zyuj6btvVo,1779928097,Pack of 3 T-Shirts Under ₹500 For Men #menfashion #fashion,Pack Of 3 T-Shirts Under ₹500 For Men #menfashion #fashion #styly #fashionaccessories #style #stylish #fashiontrends ...
youtube,men's fashion trends,https://www.youtube.com/watch?v=IlmCWt1C7g8,1779921212,Why Are Rhinestone Jeans Becoming The Default Men’s Fashion Trend Now?! 😭😭 #holyshabazz,"What's good, Shabazz Squad?! This is Holy Shabazz, your go-to source for dope content that sparks thought and ignites ..."
youtube,men's fashion trends,https://www.youtube.com/watch?v=HU2Ijunl7O8,1779916022,🔥 Upgrade your everyday style with this Men’s Long Sleeve Polo Shirt,Upgrade your everyday style with this Men's Long Sleeve Polo Shirt featuring bold 3D striped detailing and modern streetwear ...
youtube,men's fashion trends,https://www.youtube.com/watch?v=lecZgc8Mxig,1779906637,&quot;DM&quot; MILDIN Men Regular Fit Striped SpreadFull sleeve FormalShirt #fashiontrends #meesho#viral#love,fashiontrends #meesho.
youtube,men's fashion trends,https://www.youtube.com/watch?v=WP8a9zQjzUc,1779899663,Carbon fiber version #fashiontrends #watch #Men&#39;s Watches#Luxury Watches#watchesandwonders,
youtube,men's fashion trends,https://www.youtube.com/watch?v=rHT8AHyBq1g,1779897624,Які тренди чоловічої моди мають зникнути?,"По питаннях реклами, співпраці: https://t.me/dolce_vita1703 0:00 - вступ 0:05 - діловий одяг 02:03 - шорти а спекотну погоду ..."
youtube,men's fashion trends,https://www.youtube.com/watch?v=JphodlO5ktQ,1779895803,"PRIMEIRA VEZ NA RUA TERESA EM PETRÓPOLIS: preços, tendências inverno, roupas femininas e masculinas","No vídeo de hoje, visito a Rua Teresa em Petrópolis pela primeira vez. Mostro preços, o que está em alta nas lojas para o inverno ..."
youtube,men's fashion trends,https://www.youtube.com/watch?v=2OmgzP5PXAY,1779891525,Boys Ye Mistakes Mat Karo ❌ | Out of Trend &amp; Unattractive Looks #shorts,"Some boys fashion & grooming mistakes are now completely out of trend ❌ In this video, learn what styles can make your look ..."
youtube,men's fashion trends,https://www.youtube.com/watch?v=UiNA3ylO1SM,1779890957,mens fashion: batik outfit #ootd #fashiontrends,
youtube,men's fashion trends,https://www.youtube.com/watch?v=fARhEj9PbjY,1779885012,Men&#39;s Summer Shirts 2026 🔥 Premium Collection Drop | Vadodara| The HUB  #mensfashion  #shorts,"Our summer 2026 shirt collection just dropped — structured silhouettes, unexpected details, and that rare balance of classic and ..."
youtube,men's fashion trends,https://www.youtube.com/watch?v=7BQsS_CRPaU,1779883202,👔 Tendances homme à la Galerie Quimper 🤩,"Direction la boutique Les États d'Amérique pour des looks homme ultra tendance Avec Alain, on te montre des idées de tenues ..."
youtube,men's fashion trends,https://www.youtube.com/watch?v=PknEHfat1jU,1779880953,【2026年夏トレンドアイテム】 今年の夏に流行るトレンドを16個解説します,CLEL #ファッション #服 #コーデ #メンズ #メンズファッション ...
youtube,men's fashion trends,https://www.youtube.com/watch?v=8IzlLY5Zg80,1779879081,Men&#39;s Outfit Combo Collection #outfit #fashiontrends,Trending outfits collection Men's outfit Outfit combo Best quality outfits Affordable price New trending outfits Gen-Z outfits collection ...
youtube,men's fashion trends,https://www.youtube.com/watch?v=-I0bjTk5fuQ,1779876457,Upgrade Your Style Game in Seconds ⚡🖤 #mensfashion#menswear #streetwear #viralshorts,"Comment “LINK” for product link ❌ No Subscribe = No Link ⚠️ Save this Short for later! Best men's fashion inspiration, ..."
youtube,men's fashion trends,https://www.youtube.com/watch?v=B1DfD-NaGEA,1779870603,Top Wearable Summer 2026 Fashion Trends 4 #shorts,"fashion #summerfashion #womensfashion Top Wearable Summer 2026 Fashion Trends ☀️ In today's video, we're talking about ..."
youtube,men's fashion trends,https://www.youtube.com/watch?v=nSpcI1a-S98,1779870136,Must-Have Smart Casual Shirts For Men 👔 | Summer Fashion #shorts,Must-Have Smart Casual Shirts For Men | Summer Fashion #shorts Upgrade your summer wardrobe with these premium knit ...
youtube,men's fashion trends,https://www.youtube.com/watch?v=JY2FmemezoM,1779869738,New🔥.                            #trend #outfitideas #outfit #new #fashion #clothing #fashiontrends,
youtube,men's fashion trends,https://www.youtube.com/watch?v=7yzSjnNUSUk,1779868783,#mensfashion #latestafricaprint #fashion #abayakaftan #fashionstyle #fashiontrends #worldtailor,Luxury Fashion Brand in Ghana | Designer Clothing Brand | Premium Men's Wear | Luxury Women's Fashion | Corporate Wear ...
youtube,men's fashion trends,https://www.youtube.com/watch?v=3KCJmdyNFd4,1779863502,JAAT 😱 VS RAJPUT 🔥Who is best✅#jaat #rajput #fashion  #royallook #alluringlooks #rajasthanistyle,kurta design for men cutting and stitching : wedding dress for boys kurta pajama : pakistani kurta pajama new design : punjabi ...
youtube,men's fashion trends,https://www.youtube.com/watch?v=XTFeMpsz4A4,1779852857,Majestic stylish shirt for men #styly#fashiontrends #comfortable#mensfashion#shirt#weekendcasual,Catalog Name:*Trendy Designer Men Shirts* Fabric: Cotton Blend Sleeve Length: Long Sleeves Pattern: Solid Net Quantity (N): 1 ...
youtube,men's fashion trends,https://www.youtube.com/watch?v=Pqh3Mo456Q8,1779850219,fashion show #styly #mensfashion #outfitideas #styleish #mensstyle #fashionshorts #youtube #fashion,"Welcome to Fashion Xpress — your fast and stylish destination for the latest fashion trends! Yahan aapko milte hain outfit ideas, ..."
youtube,men's fashion trends,https://www.youtube.com/watch?v=Ix2okf0ZVlE,1779800401,MEN’S ITALIAN FASHION Smart Casual Trends  Streetwear &amp; Luxury Outfits,Step into the stylish streets of Milan and discover the best men's fashion trends of May 2026. From luxury menswear and smart ...
youtube,women's fashion trends,https://www.youtube.com/watch?v=gnj3leQpxTo,1779926896,Stylish Knitted Sweater Design 2026 🧶💖 Winter Fashion Trends for Women ❄️ #fashion,
youtube,women's fashion trends,https://www.youtube.com/watch?v=Hr56gHvvems,1779913748,"LIOR FALL26 - Navy, Cream &amp; Denim Women’s Fall Fashion Trends You Don’t Want To Miss",
youtube,women's fashion trends,https://www.youtube.com/watch?v=k-DcUBKuEBI,1779912022,#humor #usa #foryou #fyp #love #crazyfashion #shorts #viral #youtubeshorts #fashiontrends,
youtube,women's fashion trends,https://www.youtube.com/watch?v=cleB6CfJ4kY,1779910247,#dress #fashiontrends #moda #tikuvchilik Nostandart qomatlar bilan ishlashni bilmaysizmi?,
youtube,women's fashion trends,https://www.youtube.com/watch?v=q6C8n2LdNLc,1779908945,Laser Cut Slingback Heels #heels #fashion #shortsfeed,Elegant Shoes Step into the world of trending women footwear latest stylish & comfortable shoes collection for modern ladies ...
youtube,women's fashion trends,https://www.youtube.com/watch?v=QpKG6U0lC-s,1779907753,Tendencias Verano 2026 ☀️ #moda #zara #tendencias #fashion #zarasummer #trends #modaverano,Tendencias de Moda Verano 2026.
youtube,women's fashion trends,https://www.youtube.com/watch?v=obIeeELHO5g,1779904364,Cosplaying my highschool self 🫣 #youtubeshorts #shortvideo #shorts #fashion #fashiontrends,
youtube,women's fashion trends,https://www.youtube.com/watch?v=DhJNPo3HqVs,1779898511,What Everyone Is Wearing (And Why It Looks Cheap On You),Everyone is wearing these trends right now… but some of them can secretly make your outfits look way cheaper instead of ...
youtube,women's fashion trends,https://www.youtube.com/watch?v=lun3_0_IWkk,1779897624,НА PLUS-SIZE НЕ ШЬЮТ СТИЛЬНЫЕ ВЕЩИ ? #стиль #мода #тренды,
youtube,women's fashion trends,https://www.youtube.com/watch?v=HJSgzQId6i8,1779895199,“Stylish Cord Set Look Under ₹999 😍🔥” #shorts #trending #viral #cordset #stylish #look #ytshorts,Stylish Cord Set Look Under ₹999 ” #shorts #trending #viral #cordset #stylish #look #ytshorts #fyp “Stylish cord set outfit ...
youtube,women's fashion trends,https://www.youtube.com/watch?v=_PG93jWa3Tc,1779893566,Trending Footwear &amp; Style Searches 2026 | Ladies Shoes &amp; Sandals Fashion Trends,"Discover the Top Footwear & Style Searches of 2026! In this video, we explore the most popular and highly searched ladies shoes ..."
youtube,women's fashion trends,https://www.youtube.com/watch?v=rnoy9ho6CFI,1779891380,Stradivarius Summer Collection 2026 | Stradivarius Haul | Shopping in Switzerland #women #fashion,Stradivarius Summer Collection 2026 | Stradivarius Haul 2026 | Stradivarius Shopping in Switzerland | Stradivarius Spring ...
youtube,women's fashion trends,https://www.youtube.com/watch?v=IyorvT5Vybo,1779890797,Square Buckle Square Toe Flats #flats #fashion #shortsfeed,Elegant Shoes Step into the world of trending women footwear latest stylish & comfortable shoes collection for modern ladies ...
youtube,women's fashion trends,https://www.youtube.com/watch?v=vGqyzdWxeT8,1779890418,Tunik Panjang Wanita Katun  Kekinian #tunikkaos #fashiontrends #kaoswanita #fashion #kaostunikpolos,Tunik Panjang Wanita Katun Kekinian #tunikkaos #fashiontrends #kaoswanita #fashion #kaostunikpolos.
youtube,women's fashion trends,https://www.youtube.com/watch?v=vIL5dofpBYw,1779888857,#hastag Saree collection for women #fashiontrends #latestinbeautylineupproducts,
youtube,women's fashion trends,https://www.youtube.com/watch?v=t3IqenQYbus,1779888631,#humor #brazil #foryou #fyp #love #crazyfashion #shorts #viral #youtubeshorts #fashiontrends,
youtube,women's fashion trends,https://www.youtube.com/watch?v=7alac1NTUmU,1779887421,✨Wedding Guest Outfit Collection 2026 💖 #shorts #dress #fashion #trending #weddingguest #viral #yt,Wedding Guest Outfit Collection 2026 Pinterest Inspired #shorts​ #dress​ #fashion​ #trending​ #weddingguest​ #viral​ ...
youtube,women's fashion trends,https://www.youtube.com/watch?v=_KKXnGoOrKo,1779887404,Ritu mam🌺🥰#talentedrituinsan#viralvideo#viralchannel#haryanvisong#newdesign#fashiontrends#style#yt,viralchannel​​#viralvideo​​​​​​​​​​​​​​​​​​​​​​​​#talentedrituinsan​​​​​​​​​​​​​​​​​​​​​​​​# ...
youtube,women's fashion trends,https://www.youtube.com/watch?v=0W337nKu8WY,1779886345,Love dressing up to work ✨#ootd #fashion #corporate #outfit #office #fashiontrends #formals #fyp,"Corporate fits ✨ “FOLLOW” for more such content     #officeoutfits #fitcheck #ootd #corporatefits #fyp (Office fit check, what I ..."
youtube,women's fashion trends,https://www.youtube.com/watch?v=D2_QCogvZn4,1779885429,Trendy Indo Western OOTD 2026 💙 Teal Palazzo Set | Stylish Shrug Outfit | Party Wear Fashion #viral,"Welcome to Dhruvi Style Studio Looking for a stylish and trendy Indo western outfit idea for parties, weddings, festive looks ..."
youtube,women's fashion trends,https://www.youtube.com/watch?v=rFjyurHpkk8,1779884874,Trendy black &amp; white printed pretty outfit 👀🌻#fashiontrends #lifestyleshorts #zudioshoppingvlog,
youtube,women's fashion trends,https://www.youtube.com/watch?v=4KBfg0Psnio,1779884886,Trending New blouse Sleeves design New Latest Blouse neck designs बाजू में खूबसूरत डिजाइन#shortsfeed,Trending New blouse Sleeves design New Latest Blouse neck designs बाजू में खूबसूरत डिजाइन#shortsfeed ...
youtube,women's fashion trends,https://www.youtube.com/watch?v=iELm21DfUKY,1779884444,Premium Cotton Farshi Salwar ✨ Mirror Work Lace | Bottom Work | Pure Dupatta 💖 ytshorts #ytviral,Premium Cotton Farshi Salwar ✨ Mirror Work Lace | Bottom Work | Pure Dupatta For order WhatsApp 9796552525 Discover ...
youtube,women's fashion trends,https://www.youtube.com/watch?v=REsj4DCosK0,1779882680,pretty outfits for women 😍#fashion #collegehaul #outfitideas #fypシ゚viral #meesho,"Your one-stop destination for fashion inspiration Discover trendy outfit ideas, beautiful ethnic wear, western styles, casual ..."
youtube,women's fashion trends,https://www.youtube.com/watch?v=i7xVxpzNb8s,1779882376,Effortless style for everyday #casual  #fashion #style #fashiontrends,
youtube,streetwear 2025,https://www.youtube.com/watch?v=5xFGahukEoo,1779913809,What Brands are overhyped and what brands are underrated?,Clip from Compex Con. 2025. We want to know your thoughts on the streetwear game! #interview #fashion #streetwear #artist.
youtube,streetwear 2025,https://www.youtube.com/watch?v=TAa0EPbjFK4,1779707014,Oversized Plain Black T-Shirt Style 🖤 | Trending Men’s Fashion 2025 #oversizedtees #oversizedshirt,Stylish oversized plain black t-shirt for men Perfect streetwear outfit idea with comfortable oversized fit and premium casual ...
youtube,streetwear 2025,https://www.youtube.com/watch?v=LrFbZaeHc2M,1779580072,OVERNIGHT EDGE #memecoin2025  #streetwear #WALLSTREETVIBE,The market is like a baby… quiet for a moment… then suddenly full of energy again.” #OvernightEdge #WallStreetVibe ...
youtube,streetwear 2025,https://www.youtube.com/watch?v=ScVq18k4hgI,1779525075,🔥 CR7 Inspired Outfit 2025 ⚽ | Ronaldo Style Fashion 😎 | Black Tee + Baggy Pants + Jordans #Shorts,CR7 Inspired Outfit 2025 Oversized Black T-Shirt White Baggy Pants Air Jordan Sneakers ⌚ Luxury Watch ...
youtube,streetwear 2025,https://www.youtube.com/watch?v=hXzZdpt94LA,1779493103,Brawl Stars Loading Screen Streetwear 2025 Csupo,Telegram channel: https://t.me/zetexgram Telegram chat: https://t.me/+Kmf_QszLkIdkNTBk Other social networks: ...
youtube,streetwear 2025,https://www.youtube.com/watch?v=ulfpKHjD1G4,1779451742,Czy to najlepsze Jordan 4? | Black Cat 2025 | Street-Zone.pl,Po oryginalne sneakersy i streetwear zapraszamy na Street-Zone.pl Kod Rabatowy ZONE30 na 30zł.
youtube,streetwear 2025,https://www.youtube.com/watch?v=WL9yTkITYRc,1779449495,🔥 Cristiano Ronaldo Inspired Men’s Fashion 2025 ⚽👕✨#outfit #cr7 #ronaldo #shorts,Upgrade your style with this Cristiano Ronaldo inspired outfit Blue striped shirt White baggy pants Nike white sneakers ...
youtube,streetwear 2025,https://www.youtube.com/watch?v=OsB053QVODQ,1779186285,Halloween In Tokyo 2025,Tokyo Japan 2025 During Halloween.
youtube,streetwear 2025,https://www.youtube.com/watch?v=qQKCpNlGW9A,1778936692,Where to buy Fire Graphic-Tees 🔥#streetwear #teeshirt,"Streetwear inspo 2025 From hoodies, jorts, caps to the latest sneaker drops – this Short brings you the best streetwear ..."
youtube,streetwear 2025,https://www.youtube.com/watch?v=kikMRKkuoIQ,1778929539,👟✨ Estas son mis mejores adquisiciones del 2025 ¿Cuál de estas te pondrías tú y cuál dejarías en...,Estas son mis mejores adquisiciones del 2025 ¿Cuál de estas te pondrías tú y cuál dejarías en la tienda? Los leo abajo.
youtube,streetwear 2025,https://www.youtube.com/watch?v=Acc_yNb2Gd4,1778814257,Stop Buying Skinny Jeans! The BEST Designer Baggy Jeans of 2025 #baggyjeans #widelegpant,Contact- 9569909437 (NO COD) ❌ • Baggy Jeans • Wide Leg Jeans • Designer Jeans • Denim Trends • How to Style Baggy ...
youtube,streetwear 2025,https://www.youtube.com/watch?v=kCpcF5twY_0,1778772610,Fire Denim you must cop🔥#streetwear #denim,"Streetwear inspo 2025 From hoodies, jorts, caps to the latest sneaker drops – this Short brings you the best streetwear ..."
youtube,streetwear 2025,https://www.youtube.com/watch?v=VyTuywH7Hp4,1778696408,BAGGY TRACKS  #explore #fashion #stylestudio #viral #youtubeshorts #fypシ #vijay #ipl2025 #viralshort,
youtube,streetwear 2025,https://www.youtube.com/watch?v=YH1PFfwJIFQ,1778671155,Unveiling the Dodgers Mamba Edition |  Dodgers 2025 World Series Champions Mamba Jersey🔥,"Stand out with this bold tribute to Kobe Bryant. The '24' number that honor a legend, and the stylish crocodile print that makes this ..."
youtube,streetwear 2025,https://www.youtube.com/watch?v=3q6KF6y1R00,1778642086,WEARING WHO DECIDES WAR IN 2020 vs 2025  Shout out Ev Bravado man!!!!,WEARING WHO DECIDES WAR IN 2020 vs 2025 Shout out Ev Bravado man!!!!
youtube,streetwear 2025,https://www.youtube.com/watch?v=dB3RJKVHgPo,1778599834,Is ComplexCon Actually Worth the Hype? (2025 Recap),Come with Streetwearhouse to COMPLEXCON in 2025 to interview some of the most popular brands and owners. 00:00 Intro ...
youtube,streetwear 2025,https://www.youtube.com/watch?v=o2AYYDoh6o4,1778572343,Elegant Street Glam Look Taking Over 2025 ✨🔥#fashion #Fashion2025 #StreetStyle #GlamLook,"Elegant Street Glam Look Taking Over 2025 ✨  #fashion #Fashion2025 #StreetStyle #GlamLook Confidence, style, and ..."
youtube,streetwear 2025,https://www.youtube.com/watch?v=Bmb11JuZfW4,1778525983,Started at 15 years old,streetwear #fashionstartup #teenpreneur #2025 #aesthetic #clothingbrand #fashion #startup #zynth.
youtube,streetwear 2025,https://www.youtube.com/watch?v=1QtY_hS4uoE,1778479212,2025✨️,
youtube,streetwear 2025,https://www.youtube.com/watch?v=42YXd2gv2-A,1778389804,justin with the paparazzi in 2010vs 2025#justinbieber #paparazzi #2010 #2025 #celebrity,
youtube,streetwear 2025,https://www.youtube.com/watch?v=CccIvYVutVE,1778374945,Trending Baggy Jeans &amp; Shacket Styles for 2025 | Celebrity Look Breakdown,Trending Baggy Jeans & Shacket Styles for 2025 | Celebrity Look Breakdown Looking for the best casual outfit ideas?
youtube,streetwear 2025,https://www.youtube.com/watch?v=ByhD-OujjDw,1778348012,opening offers 11/05//2025 🔜 #clothing#viral #tranding #newshop #newshorts,opening offers on 11/05/2026   visit over stor WhatsApp app :- https://chat.whatsapp.com/CknGlKvZZB9BwV4zhGNYOf instagram ...
youtube,streetwear 2025,https://www.youtube.com/watch?v=vtRoHWmd4zA,1778269881,Best t-shirt brands to check out in 2025. Pt. #Shorts #flyshtdrew,Best t-shirt brands to check out in 2025. Pt. Best t-shirt brands to check out in 2025. Pt. Best t-shirt brands to check out in 2025.
youtube,streetwear 2025,https://www.youtube.com/watch?v=p4IgAhCy_Ss,1778259671,Shoe of winter 2025 🥷 Nike P-6000  #wintershoes2025#uktrainers#p6000#nikep6000 #sneakerdaily,The Nike P-6000 is a modern throwback that channels early-2000s running culture into today's streetwear scene. Inspired by ...
youtube,streetwear 2025,https://www.youtube.com/watch?v=Fr1KuYwqx70,1778253511,Jordan 4 undefeated 2025 #fyp #sneakers #ootd #streetwear #jordan4,"short #sneakerhead #unboxing Leave me size!!! Hello! My friend, if want this goods add our whatsapp:+86 152 6026 8083."
