source,domain,url,created_utc,title,text
rss,www.nytimes.com,https://www.nytimes.com/2026/05/08/style/why-everyone-was-so-mad-about-the-met-gala.html,1778343759,Why Everyone Was So Mad About the Met Gala,"Why Everyone Was So Mad About the Met Gala

Plus, a remembrance of Ted Turner and a tank top quandary."
rss,www.nytimes.com,https://www.nytimes.com/2026/05/09/style/courtney-barnett-creature-of-habit.html,1778329858,"A Beloved Indie Worrier Is Back, Chiller Than Ever","A Beloved Indie Worrier Is Back, Chiller Than Ever

The singer-songwriter Courtney Barnett transplanted herself across an ocean to shake things up, not to figure things out."
rss,www.nytimes.com,https://www.nytimes.com/2026/05/09/style/pharma-drugs-merch-swag-vintage.html,1778511845,"Hunting For Lexapro Clocks, Viagra Neckties and Other Vintage Pharmaceutical Merch","Hunting For Lexapro Clocks, Viagra Neckties and Other Vintage Pharmaceutical Merch

The days of giving pharmaceutical-branded swag to health care professionals are largely over. Now those items are hot on the thrifting scene."
rss,www.nytimes.com,https://www.nytimes.com/2026/05/09/style/her-response-to-ai-getting-naked-onstage.html,1778330652,‘Old Woman Naked’ is Pamela Redmond’s Answer to A.I. Concerns,"‘Old Woman Naked’ is Pamela Redmond’s Answer to A.I. Concerns

The writer Pamela Redmond talks about her new play, “Old Woman Naked,” why her kids won’t see it and whether she’d have done the show without GLP-1s."
rss,www.nytimes.com,https://www.nytimes.com/2026/05/09/style/mile-end-kicks-barbie-ferreira-indie-sleaze.html,1778317302,How ‘Mile End Kicks’ Nailed the Indie Sleaze Look,"How ‘Mile End Kicks’ Nailed the Indie Sleaze Look

The film follows a music critic (played by Barbie Ferreira) who moves to Montreal in 2011. Clothes unearthed via Craigslist and vintage piles bring the era to life."
rss,www.nytimes.com,https://www.nytimes.com/2026/05/08/style/america-first-united-fuentes.html,1778264719,Can They Build ‘America First’ Without Nick Fuentes?,"Can They Build ‘America First’ Without Nick Fuentes?

A small group of candidates and influencers met to forge a shaky new political movement — without its de facto leader and his groypers."
rss,www.nytimes.com,https://www.nytimes.com/2026/05/08/style/ted-turner-relationships-wives-jane-fonda.html,1778231061,The Many Love Lives of Ted Turner,"The Many Love Lives of Ted Turner

Known as a playboy, the media mogul gave his paramours and three ex-wives plenty of stories to tell. He also managed to stay friendly with many of them."
rss,www.nytimes.com,https://www.nytimes.com/2026/05/07/style/caleb-hearon-devil-wears-prada-2.html,1778195827,"In ‘The Devil Wears Prada 2,’ Caleb Hearon Gets the Job ‘a Million Girls Would Kill For’","In ‘The Devil Wears Prada 2,’ Caleb Hearon Gets the Job ‘a Million Girls Would Kill For’

Caleb Hearon is circling the mainstream with a role in “The Devil Wears Prada 2,” but does his podcast-friendly personality translate into Hollywood stardom?"
rss,www.nytimes.com,https://www.nytimes.com/2026/05/11/style/the-pitt-joy-kwon-irene-choi-work-life-balance.html,1778547912,"On ‘The Pitt,’ She Clocked Out on Time. In Real Life, It Started a Debate.","On ‘The Pitt,’ She Clocked Out on Time. In Real Life, It Started a Debate.

When Joy Kwon, a third-year medical student on TV, set a boundary, she stirred a work-life balance debate among medical professionals and fans."
rss,www.nytimes.com,https://www.nytimes.com/2026/05/11/fashion/white-pants-see-through-garments.html,1778490058,What Can I Do About See-Through White Pants?,"What Can I Do About See-Through White Pants?

A reader loves the style, but hates the consequences."
rss,www.nytimes.com,https://www.nytimes.com/2026/05/10/style/nyc-design-events-products.html,1778433570,A Panorama of Design during the NYCxDesign Festival,"A Panorama of Design during the NYCxDesign Festival

A look at news, products and events during the NYCxDesign Festival."
rss,www.nytimes.com,https://www.nytimes.com/2026/05/10/arts/design/mexico-chocolate-museum.html,1778504075,A Monument to Chocolate Is Wrapped in Layers of Mexican History,"A Monument to Chocolate Is Wrapped in Layers of Mexican History

Combining a colonial house and a contemporary addition, the new Museum of Cacao & Chocolate sits on a grisly Aztec souvenir."
rss,www.nytimes.com,https://www.nytimes.com/2026/05/10/realestate/parc-beaufort-coop-new-york.html,1778432967,"Before SoHo, This Building Was at the Heart of New York’s Arts District","Before SoHo, This Building Was at the Heart of New York’s Arts District

A West Side co-op built for artists and later turned into offices is being reborn as a luxury condominium named Parc Beaufort."
rss,www.nytimes.com,https://www.nytimes.com/2026/05/10/style/grab-some-seeds-throw-them-at-the-soil-youre-a-gardener-now.html,1778418559,Chaos Gardening: A Laid-Back Way to Garden,"Chaos Gardening: A Laid-Back Way to Garden

Welcome to chaos gardening, a laid-back way to turn a patch of ground into a riot of color."
rss,www.nytimes.com,https://www.nytimes.com/2026/05/10/style/dirty-soda-mormon-wives-utah-tiktok.html,1778403657,"Thanks to ‘Mormon Wives,’ Dirty Soda Is a National Obsession","Thanks to ‘Mormon Wives,’ Dirty Soda Is a National Obsession

The colorful drinks have become a hit across the country, inspiring new menu items at Dunkin’ and McDonald’s and a genre of TikTok recipes."
rss,www.nytimes.com,https://www.nytimes.com/2026/05/10/style/jewelry-titanium-wallace-chan.html,1778403651,"To Jewelry Makers, Titanium Is More Appealing Than Ever","To Jewelry Makers, Titanium Is More Appealing Than Ever

As gold and silver prices continue to soar, the metal’s relatively inexpensive cost has attracted new users."
rss,www.nytimes.com,https://www.nytimes.com/2026/05/10/style/jewelry-daniel-brush-exhibition-paris.html,1778403643,Jewelry Among the Exhibits at a Daniel Brush Retrospective,"Jewelry Among the Exhibits at a Daniel Brush Retrospective

More than 75 artworks, some described as never displayed in public before, are to go on view June 8 at L’Ecole, School of Jewelry Arts in Paris."
rss,www.nytimes.com,https://www.nytimes.com/2026/05/10/style/fringe-jewelry-trend.html,1778403637,"In Jewelry, the Resurgence of Fringe Echoes Freedom of 1920s","In Jewelry, the Resurgence of Fringe Echoes Freedom of 1920s

Once a symbol of Jazz Age liberation, fringe now reflects a desire for comfort and joy in jewelry."
rss,www.nytimes.com,https://www.nytimes.com/2026/05/10/style/jewelry-hirotaka-tokyo-alysa-liu.html,1778403636,Hirotaka Inoue’s Jewelry Made the Olympics,"Hirotaka Inoue’s Jewelry Made the Olympics

Alysa Liu wore an earring by Hirotaka Inoue during her gold medal-winning skate, sparking new interest in the Japanese designer’s brand."
rss,www.nytimes.com,https://www.nytimes.com/2026/05/10/style/bangles-are-back.html,1778403630,The Return of the Statement Bangle,"The Return of the Statement Bangle

Structured, sculptural bangles and cuffs have proliferated on runways and wrists as alternative metals and natural materials have gained luxe appeal."
rss,www.nytimes.com,https://www.nytimes.com/2026/05/10/style/5-books-jewelry-lovers.html,1778403629,5 New Books for Jewelry Lovers,"5 New Books for Jewelry Lovers

A menagerie of jewels and family businesses are among the topics of these recent and upcoming releases."
rss,www.nytimes.com,https://www.nytimes.com/2026/05/10/style/jewelry-brooches.html,1778403623,Brooches Now Are Seen Almost Anywhere on Clothing,"Brooches Now Are Seen Almost Anywhere on Clothing

The decorative pins are still seen on men’s lapels, but they also may turn up pretty much anywhere on clothing these days."
rss,www.nytimes.com,https://www.nytimes.com/2026/05/10/fashion/ana-katerina-jewelry.html,1778403615,A Designer Who Tells Stories Through Her Jewelry,"A Designer Who Tells Stories Through Her Jewelry

Ana-Katarina Vinkler-Petrovic says she has spent her career finding beauty in the messy and the complex."
rss,www.nytimes.com,https://www.nytimes.com/2026/05/09/style/matilda-geddings-gray-auction.html,1778317237,A Louisiana Dynasty’s Treasures Come to Market,"A Louisiana Dynasty’s Treasures Come to Market

Jewelry and art collected by the businesswoman and philanthropist Matilda Geddings Gray and her niece, Matilda Gray Stream, will be offered at auction."
rss,www.nytimes.com,https://www.nytimes.com/2026/05/08/well/mind/body-dysmorphic-disorder-bdd-symptoms.html,1778252895,What Is Body Dysmorphic Disorder?,"What Is Body Dysmorphic Disorder?

It may look like vanity, but it’s a debilitating mental health condition."
rss,www.nytimes.com,https://www.nytimes.com/2026/05/08/style/modern-love-mothers-day-writing-about-my-mother.html,1778212821,Writing About My Mother as if She Were Dead,"Writing About My Mother as if She Were Dead

I needed distance to write honestly about my childhood. But fiction didn’t protect any of us from pain."
rss,www.nytimes.com,https://www.nytimes.com/2026/05/08/style/shanae-strachan-lance-growth-wedding.html,1778212819,They Met One Night in Queens. A Year in St. Lucia Followed.,"They Met One Night in Queens. A Year in St. Lucia Followed.

A chance meeting in Queens led Shanae Strachan and Lance Growth to build a life between New York and St. Lucia before marrying in Manhattan."
rss,www.nytimes.com,https://www.nytimes.com/2026/05/08/style/adam-mena-jesse-stowell-wedding.html,1778261261,"Unmistakable Love of Austin, the Texas Longhorns and Each Other","Unmistakable Love of Austin, the Texas Longhorns and Each Other

Adam Mena and Jesse Stowell brought Austin, Texas, alive at their wedding with a taco truck, burnt orange hues and two miniature shaggy Highland cows."
rss,www.nytimes.com,https://www.nytimes.com/2026/05/08/style/nandika-chatterjee-abigail-braggins-wedding.html,1778252320,She Had Seen Her in Photos. Then They Met in Real Life.,"She Had Seen Her in Photos. Then They Met in Real Life.

Nandika Chatterjee had heard about Abigail Braggins from a roommate and thought she was “cute.” A wave in Little Italy sealed their fate."
rss,www.nytimes.com,https://www.nytimes.com/2026/05/08/style/negarin-sadr-matt-sornson-canceled-wedding-redemption.html,1778258121,A Second Chance Led Them Back to Each Other,"A Second Chance Led Them Back to Each Other

When Matt Sornson and Negarin Sadr first met, they didn’t quite hit it off. But after reconnecting years later online, they built a strong foundation that would later be tested."
rss,www.nytimes.com,https://www.nytimes.com/2026/05/07/style/club-cartegena-four-seasons.html,1778172402,"In Cartagena, a Place for Monks and Movie Lovers Is Now a Hotel","In Cartagena, a Place for Monks and Movie Lovers Is Now a Hotel

In Cartagena, Colombia, historic buildings, including a monastery and a nightclub, were transformed into a Four Seasons."
rss,www.nytimes.com,https://www.nytimes.com/2026/05/07/movies/pizza-hut-architecture-documentary.html,1778172053,This Film Provides a Trapezoidal Window into Former Pizza Huts,"This Film Provides a Trapezoidal Window into Former Pizza Huts

A documentary about the popular chain presents its repurposed buildings as protective shells where new businesses can grow."
rss,www.nytimes.com,https://www.nytimes.com/2026/05/07/arts/costume-institute-met-museum-conde.html,1778144519,A Fashion Revolution at the Met,"A Fashion Revolution at the Met

With “Costume Art,” the dress department moves out of the basement to become the gateway to the museum."
rss,www.nytimes.com,https://www.nytimes.com/2026/05/07/well/mind/wedding-single-guest-sadness.html,1778144499,I’m Unhappily Single. Do I Have to Attend My Friend’s Wedding?,"I’m Unhappily Single. Do I Have to Attend My Friend’s Wedding?

Our Ask the Therapist columnist, Lori Gottlieb, advises a reader who doesn’t want to be reminded of her loneliness yet again."
rss,www.nytimes.com,https://www.nytimes.com/2026/05/06/style/chris-smalls-amazon-met-gala-arrest.html,1778104520,Former Amazon Union Leader Who Was Arrested at Met Gala Has No Regrets,"Former Amazon Union Leader Who Was Arrested at Met Gala Has No Regrets

Christian Smalls, a longtime Amazon antagonist, was charged with trespassing and another misdemeanor, and spent 24 hours in jail. The union disavowed his actions."
rss,www.nytimes.com,https://www.nytimes.com/2026/05/06/briefing/the-good-list-angine-birds.html,1778095152,The Good List: 6 Things to Add Some Delight to Your Day,"The Good List: 6 Things to Add Some Delight to Your Day

Buried treasure, birds on the move and secret library access."
rss,www.nytimes.com,https://www.nytimes.com/2026/05/06/style/tiny-modern-love-stories-i-was-drunk-when-he-told-me.html,1778090407,Tiny Love Stories: ‘I Could Feel Him Watching Me’,"Tiny Love Stories: ‘I Could Feel Him Watching Me’

Modern Love in miniature, featuring reader-submitted stories of no more than 100 words."
rss,www.nytimes.com,https://www.nytimes.com/2026/05/06/realestate/design-charleston-jailhouse-magazine.html,1778206710,A Southern Magazine Now Calls a Historic Charleston Jail Home,"A Southern Magazine Now Calls a Historic Charleston Jail Home

Based in Charleston, S.C., Garden & Gun recently moved to a restored landmark on Magazine Street, of all places."
rss,www.nytimes.com,https://www.nytimes.com/2026/05/06/style/elective-surgery-rescheduling-priorities.html,1778072403,My Mother Won’t Reschedule Her Elective Surgery So I Can Be There. Help!,"My Mother Won’t Reschedule Her Elective Surgery So I Can Be There. Help!

A reader wants her mother to pick another date for a hip-replacement surgery so that she doesn’t have to miss an important work conference. Cue the cutting email from Mom."
rss,www.nytimes.com,https://www.nytimes.com/2026/05/06/style/wedding-dress-white-bridal-color-analysis.html,1778058118,Having Trouble Choosing the Right White for Your Wedding? This Color Analyst Can Help.,"Having Trouble Choosing the Right White for Your Wedding? This Color Analyst Can Help.

Megan Bentley, a color analyst, shares how identifying your color season, the hues that are most complementary or flattering, can elevate your wedding wardrobe."
rss,www.nytimes.com,https://www.nytimes.com/2026/05/05/realestate/indiana-schoolhouse-homestead-renovation.html,1778014057,"For an Indiana Couple, This Schoolhouse Became Their Home","For an Indiana Couple, This Schoolhouse Became Their Home

Stacie Grissom and Sean Wilson’s 9,000-square-foot Indiana schoolhouse is a lesson in courage."
rss,www.nytimes.com,https://www.nytimes.com/2026/05/05/style/heidi-klum-outfit-met-gala.html,1778011253,How Heidi Klum Got Her 2026 Met Gala Statue Look,"How Heidi Klum Got Her 2026 Met Gala Statue Look

“I could eat and use my hands quite comfortably,” Klum said of her intricate Roman statue ensemble, which was inspired by a marble sculpture by Raffaele Monti."
rss,www.nytimes.com,https://www.nytimes.com/2026/05/05/style/street-style-look-ralph-lauren-loyalist.html,1778006717,Street Style Look of the Week: A Brand Loyalist Steps Out in Blue,"Street Style Look of the Week: A Brand Loyalist Steps Out in Blue

A boutique owner with a closet bursting with Ralph Lauren stepped out in blue."
rss,www.nytimes.com,https://www.nytimes.com/2026/05/05/arts/design/donlyn-lyndon-dead.html,1778006188,"Donlyn Lyndon, Last Surviving Creator of the Sea Ranch, Dies at 90","Donlyn Lyndon, Last Surviving Creator of the Sea Ranch, Dies at 90

With his classmates Charles Moore, William Turnbull Jr. and Richard Whitaker, he designed an icon of modern architecture on a windswept bluff in Northern California."
rss,www.nytimes.com,https://www.nytimes.com/2026/05/05/style/fashion-art-met-gala.html,1778026125,Was It Art? Was It Fashion? Was It Good?,"Was It Art? Was It Fashion? Was It Good?

Guests at the Met Gala had different interpretations of the night’s dress code."
rss,www.nytimes.com,https://www.nytimes.com/2026/05/05/style/met-gala-after-party-nyc.html,1777996459,Inside the Met Gala After-Parties: See the Stars and Their Looks,"Inside the Met Gala After-Parties: See the Stars and Their Looks

Models, designers, D.J.s and performers kept the night going into the early morning."
rss,www.nytimes.com,https://www.nytimes.com/2026/05/05/style/met-gala-recap.html,1777989574,Need to Catch Up on the Met Gala? Read This.,"Need to Catch Up on the Met Gala? Read This.

We’ve got your morning-after recap."
rss,www.nytimes.com,https://www.nytimes.com/2026/05/05/style/met-gala-cocktail-party.html,1777987388,Mingling With Jeff Bezos and Stevie Nicks at the 2026 Met Gala Cocktail Party,"Mingling With Jeff Bezos and Stevie Nicks at the 2026 Met Gala Cocktail Party

An exclusive glimpse inside the party, where guests had many interpretations for the “Fashion Is Art” dress code."
rss,www.nytimes.com,https://www.nytimes.com/2026/05/04/style/met-gala-2026-red-carpet.html,1777996781,Our 15 Favorite Looks at the 2026 Met Gala,"Our 15 Favorite Looks at the 2026 Met Gala

Regardless of the theme, these people just looked great."
rss,www.nytimes.com,https://www.nytimes.com/2026/05/04/style/met-gala-nipples-naked-dressing.html,1778004955,Kylie Jenner’s Nipple-Forward Look Pointed to a Met Gala Red Carpet Trend,"Kylie Jenner’s Nipple-Forward Look Pointed to a Met Gala Red Carpet Trend

Nipples both faux and flesh were abundant on the Met Gala carpet."
rss,www.nytimes.com,https://www.nytimes.com/2026/05/04/style/met-gala-first-timers.html,1777948836,Connor Storrie and Alysa Liu Are Among the First-Time Met Gala Attendees,"Connor Storrie and Alysa Liu Are Among the First-Time Met Gala Attendees

Some of those making their Met debuts also happened to have the evening’s most arresting looks."
rss,www.nytimes.com,https://www.nytimes.com/2026/05/04/style/bad-bunny-met-gala.html,1777947398,No Reverse-Aging for Bad Bunny at the Met Gala,"No Reverse-Aging for Bad Bunny at the Met Gala

The singer, 32, said it took “53 years” to prepare his look."
rss,www.nytimes.com,https://www.nytimes.com/2026/05/04/style/met-gala-bezos-zuckerberg-red-carpet.html,1777987748,Jeff Bezos and Mark Zuckerberg Were Notably Missing From the Met Gala Carpet,"Jeff Bezos and Mark Zuckerberg Were Notably Missing From the Met Gala Carpet

No Bezos. No Zuckerberg."
