source,query,url,created_utc,title,text
youtube,men's fashion trends,https://www.youtube.com/watch?v=DYV-xiAKLmU,1778543144,Is Streetwear DEAD in 2026 👀 What Stylish Men Wear Now,"Streetwear isn't dead… but men's fashion is changing fast in 2026. The loud hypebeast era is fading, and modern style is shifting ..."
youtube,men's fashion trends,https://www.youtube.com/watch?v=zDdcQrtIZOg,1778528069,Westside Premium Linen Shirt|#westside#linen #linenshirts#styling#fashion#fashiontrends #mensfashion,
youtube,men's fashion trends,https://www.youtube.com/watch?v=q_HHHxULYyA,1778526327,Fashion Trends That Are Officially DEAD in 2026!,"Are your outfits secretly making you look outdated? In this video, we break down men's fashion trends that are officially DEAD in ..."
youtube,men's fashion trends,https://www.youtube.com/watch?v=sVC1OiuoKe4,1778519278,Stylish Shoes For Men 2026 👟 | Best Quality #shoes #trending #fashiontrends #mensfootwear #loafers,Welcome to our channel We provide the best quality shoes with latest designs and affordable prices Product: Stylish ...
youtube,men's fashion trends,https://www.youtube.com/watch?v=HPFJqCW9P4I,1778515145,Must Try colour combinations for men #fashion #colourcombo #outfits #fashiontrends #shorts,
youtube,men's fashion trends,https://www.youtube.com/watch?v=epeVkMaVfxE,1778515007,Maiden voyage for this suit and shirt from Collaro #fashiontrends #mensfashion #gqmenswear,
youtube,men's fashion trends,https://www.youtube.com/watch?v=i0mE_VmQrSY,1778512741,Power Transforming Prabhas Outfit Look Recreated with Black Minimal oversized #trending #prabhas,Welcome to Trisholic Fashions. This is Power Transforming Transition reel creates a Celebrity Outfit look of Rebel Star Prabhas ...
youtube,men's fashion trends,https://www.youtube.com/watch?v=vjfgjxzSEZY,1778511489,Formal Look #fashiontrends,fashioninfluencer #fashion #fashionstyle #fashionblogger #trendingfashion #mensfashion.
youtube,men's fashion trends,https://www.youtube.com/watch?v=5IamjN_lVos,1778511453,Men’s wear Lower wholesale market #shortsfeed #fashion #clothing #fashiontrends #wholesale #lower,
youtube,men's fashion trends,https://www.youtube.com/watch?v=bqR7s4Q6co4,1778509936,Japan Fashion Magazines To Know 👀 #menswear #mensfashion #shorts #fashion #style #streetwear #denim,"I grew up on fashion magazine culture, and arguably, I feel like Japanese fashion magazines have long dictated and propelled ..."
youtube,men's fashion trends,https://www.youtube.com/watch?v=Gmb0siZHnf0,1778509298,Do you agree #fashiontrends #outfitinspo #womenfashion #fitcheck #mensfashion #basicoutfit #outfit,
youtube,men's fashion trends,https://www.youtube.com/watch?v=ANkMbsmHGyY,1778508151,Adidas Men’s T-shirt #fashionblogger #fashion #mensfashion #myntrahaul #myntra #fashionstyle #shorts,Adidas Men's T-shirt #fashionblogger #fashion #mensfashion #myntrahaul #myntra #fashion style #fashiontrends #mensstyle ...
youtube,men's fashion trends,https://www.youtube.com/watch?v=ZViL7WUN2Qo,1778506062,Luxury Outfit for Man | Mens fashion 2026 #fashion #fashiontrends #fashionstyle,"Looking for rich and classy linen outfit combinations for men? In this video, I'm sharing premium-looking linen outfit color ..."
youtube,men's fashion trends,https://www.youtube.com/watch?v=8AsiAbAADe8,1778503687,Latest Matching Color Outfit Ideas for Men 2026 | Men&#39;s Fashion &amp; Styling Tips #shorts,2026 ke latest men's fashion trends me matching color outfits kaise style kare? Is video me aap dekhenge best color combinations ...
youtube,men's fashion trends,https://www.youtube.com/watch?v=6-8FJfHqwhI,1778502900,men tshirt under 250 | polo tshirt | styling my brother series day 1🌻🤎 #menwears #meeshohaul,men tshirt under 250 | polo tshirt | styling my brother series day 1     #menwears #meeshohaul Transforming my brother's look ...
youtube,men's fashion trends,https://www.youtube.com/watch?v=0_pyH9Vsuf8,1778500341,Korean Pants Collection for Men 👖🔥 | Trending Fashion 2026#fashion #shorts #menswear #viral #reach,Upgrade your wardrobe with the latest Korean Pants Collection for Men ✨ Discover premium Korean-style pants designed for ...
youtube,men's fashion trends,https://www.youtube.com/watch?v=l_ojg-LM_Qo,1778499617,beautiful jodhpuri suit for men 💙 #jodhpuri #mensfashion #fashiontrends #menswear #mensstyle #style,beautiful jodhpuri suit for men #jodhpuri #mensfashion #fashiontrends #menswear #mensstyle #style #vikashgayakwad.
youtube,men's fashion trends,https://www.youtube.com/watch?v=2K14bi9Ks3A,1778494063,Super 140’s Counts Premium Suiting Fabric | Billionaire Fabrics | Office Wear Fabric 2026,menswear #premiumfabrics #luxurysuiting #mensfashion #menssuits #weddingfashion #formalwear #pantshirtcollection ...
youtube,men's fashion trends,https://www.youtube.com/watch?v=yDcePR-VoXI,1778493695,FAM shop #mensfashion #newera #neweracap #fashion #clothes #fashiontrends #fashionstyle,
youtube,men's fashion trends,https://www.youtube.com/watch?v=7Xd5k8ZPKlA,1778488203,Stay Stylish 😎 Clean &amp; Classy Vibes 🔥,"Mr Blendin Upgrade your style with trendy, affordable outfits that turn heads everywhere you go Stay Stylish Clean & Classy ..."
youtube,men's fashion trends,https://www.youtube.com/watch?v=VmOtUA3x3yw,1778483511,balaji fashion point Mandrella || #fashion #tshirtdesign #fashiontrends #motivation #idealtopmaking,
youtube,men's fashion trends,https://www.youtube.com/watch?v=1GFDF_nEjMY,1778481993,RKYMART UNIQUE COLLECTION MEN&#39;S &amp; OMENS 2026,"Product Range: This includes a wide variety of clothing items such as shirts, trousers, jackets, suits, jeans, dresses, skirts, etc., ..."
youtube,men's fashion trends,https://www.youtube.com/watch?v=NjL2Jrtu724,1778481638,wait heppened to bts boy #bts #btsmember #love #fashiontrends,"Disclaimer (Copyright Notice): All videos, songs, images, and graphics used in this video belong to their respective owners."
youtube,men's fashion trends,https://www.youtube.com/watch?v=8M2SjuaZ22Y,1778475206,MAD MAD LELA Menswear Teaser 2026 | Bold New Mens Fashion Collection Coming Soon 🔥| #shorts,"Mad, Mad LELA is entering menswear. Sharper silhouettes. Wilder energy. Unapologetic style. This is not regular fashion. This is ..."
youtube,men's fashion trends,https://www.youtube.com/watch?v=VP8d91UIjpU,1778472036,#automobile #lifeisbutadream #fashiontrends #viralvideo #trendingnews #youtubeshorts,"Get ready to laugh out loud! This hilarious video will brighten your day and leave you in splits. If you enjoy funny moments, crazy ..."
youtube,women's fashion trends,https://www.youtube.com/watch?v=l-DpScxlwT8,1778541142,Kylie Jenner #kyliejenner #fashion #trends #style,
youtube,women's fashion trends,https://www.youtube.com/watch?v=RByng9khRuY,1778532987,Wie findet ihr die Fashion Trends? #fashiontrends,
youtube,women's fashion trends,https://www.youtube.com/watch?v=dCwI8SYZ21Y,1778530112,42den 52ye✅️#abuneolun #fashionstyle #fashiontrends #fashiontrends ##4##2##pa##🛍🛍🛍72azn💸💸💸,
youtube,women's fashion trends,https://www.youtube.com/watch?v=lVdvpJ4fOSw,1778527833,Trending African print dresses for 2026 | Latest African Fashion #fashionstyle #latestafricaprint,"Discover Cute Ankara Styles Pictures for 2025 — featuring elegant African Kitenge dress styles and designs, classy Chitenge ..."
youtube,women's fashion trends,https://www.youtube.com/watch?v=advdlqqC0Ug,1778526751,PRETTY PARTY GUEST#trending #wedding #fashiontrends #nigerianwedding #entertainment #fashion,
youtube,women's fashion trends,https://www.youtube.com/watch?v=gMqo3zpjee4,1778524218,Stylish Co-ord Set design for Summer Fashion 🌸@makecreativethings #youtubeshorts #summerfashion,Stylish Co-ord Set design for Summer Fashion ‎⁨@makecreativethings⁩ Looking for stylish summer co-ord sets? Check out ...
youtube,women's fashion trends,https://www.youtube.com/watch?v=tx8VXX4ZhUo,1778522457,Best Fashion Trends 2026//Very Stylish and Beautiful   Outfits for Ladies  #fashionhub#trends#style,Best Fashion Trends 2026//Very Stylish and Beautiful Outfits for Ladies #fashionhub#trends#style Sound and Music YT Studio ...
youtube,women's fashion trends,https://www.youtube.com/watch?v=J0IG9okZxsc,1778520743,2026 Hit Code Unstitched Lawn Collection 💖 | #trending  #shortsvideo  #fashion  #viral,Embroidered summer collection with elegant colors and premium lawn summer fabric ✨ Limited stock available — order fast ...
youtube,women's fashion trends,https://www.youtube.com/watch?v=hqN2kgbVoac,1778519875,#2026 #fashion #fashiontrends #мода #модныепоказы #мода #одежда #outfitconsira,
youtube,women's fashion trends,https://www.youtube.com/watch?v=bqLIYMzY8tU,1778515256,❤️ H&amp;M NEW SPRING SUMMER 2026 COLLECTION ARRIVALS 🧡 MODERN WOMEN&#39;S FASHION,H&M NEW SPRING-SUMMER 2026 COLLECTION ARRIVALS MODERN WOMEN'S FASHION H&M is a popular fashion brand ...
youtube,women's fashion trends,https://www.youtube.com/watch?v=eLEBrbJtfHw,1778514947,40dan 52ye✅️#abuneolun #fashion #qadingeyimleri #fashiontrends #dress ##3##9##pa##🛍🛍69azn💸,
youtube,women's fashion trends,https://www.youtube.com/watch?v=Z1sd1sxKnIU,1778511656,#humor #usa #foryou #fyp #love #crazyfashion #shorts #viral #youtubeshorts #fashiontrends,
youtube,women's fashion trends,https://www.youtube.com/watch?v=GwxAQumBWXo,1778511365,Stylish Red One Piece Dress 🔥 | Fashion Inspiration,"Discover the latest trending red dress fashion for girls and women. ❤️ In this video, check out elegant and stylish outfit ideas ..."
youtube,women's fashion trends,https://www.youtube.com/watch?v=N2tL-pLywGI,1778511289,Smooth Fit Ensemble | Women Modern Trends #fashion,A smooth fit ensemble crafted for women who appreciate clean styling and modern fashion trends in daily wear. Hashtags: ...
youtube,women's fashion trends,https://www.youtube.com/watch?v=17u2YrSIKGE,1778510803,Latest Fashion Trends 2026: Stunning Dress Designs You Need to See! #fashion #shorts,
youtube,women's fashion trends,https://www.youtube.com/watch?v=GBvbaYGimgE,1778509369,Do you agree #rhinestones #skinnyjeans #fashion #outfitinspo #fashiontrends #womenfashion #outfit,
youtube,women's fashion trends,https://www.youtube.com/watch?v=Gmb0siZHnf0,1778509298,Do you agree #fashiontrends #outfitinspo #womenfashion #fitcheck #mensfashion #basicoutfit #outfit,
youtube,women's fashion trends,https://www.youtube.com/watch?v=7yPxSafHXbk,1778508337,fav dresses lately ft newme dresses🎀 #fashion #fashiontrends #fashionstyle #dressstyle,
youtube,women's fashion trends,https://www.youtube.com/watch?v=TPYzm_PXdsQ,1778508121,#meesho #reel vs reality #trendingshorts #trend #meeshodress#fashiontrends#fashion #youtubeshorts,
youtube,women's fashion trends,https://www.youtube.com/watch?v=owXcm6kkBVw,1778508153,2026 Cozy Women Knitted Sweater 🧶 Stylish Winter Outfit Ideas #viral  #FashionTrends,"Stay warm and stylish this winter with this beautiful Women's Knitted Sweater ❄️   Designed with soft premium knit fabric, trendy ..."
youtube,women's fashion trends,https://www.youtube.com/watch?v=3BpEwaDPRb4,1778508012,Stradivarius Spring Fashion Trends 2026 | Summer Outfits for Women #new #shopping @stradivarius,
youtube,women's fashion trends,https://www.youtube.com/watch?v=4PttXV0BK6M,1778508013,💘 DEICHMANN 2026 ARRIVALS 💖 Feminine Fashion Trends Everyone Is Talking About!,DEICHMANN 2026 ARRIVALS Feminine Fashion Trends Everyone Is Talking About! Welcome to my Deichmann Shoe Haul ...
youtube,women's fashion trends,https://www.youtube.com/watch?v=k1C3aB8oiFY,1778505061,Trending Footwear &amp; Style Searches 2026 | Ladies Shoes &amp; Sandals Fashion Trends,"Discover the Top Footwear & Style Searches of 2026! In this video, we explore the most popular and highly searched ladies shoes ..."
youtube,women's fashion trends,https://www.youtube.com/watch?v=txts-vagpA4,1778504513,Celana Jumbo Wanita #fashiontrends #celanawanita #fashionblogger #celanajumbo #fashion #celana,Celana Jumbo Wanita #fashiontrends #celanawanita #fashionblogger #celanajumbo #fashion #celana.
youtube,women's fashion trends,https://www.youtube.com/watch?v=nvPybC9i9WE,1778501790,NEW #trending #fashiontrends #dress #bridalwear #saree,
youtube,streetwear 2025,https://www.youtube.com/watch?v=Bmb11JuZfW4,1778525983,Started at 15 years old,streetwear #fashionstartup #teenpreneur #2025 #aesthetic #clothingbrand #fashion #startup #zynth.
youtube,streetwear 2025,https://www.youtube.com/watch?v=CccIvYVutVE,1778374945,Trending Baggy Jeans &amp; Shacket Styles for 2025 | Celebrity Look Breakdown,Trending Baggy Jeans & Shacket Styles for 2025 | Celebrity Look Breakdown Looking for the best casual outfit ideas?
youtube,streetwear 2025,https://www.youtube.com/watch?v=fyFilOQZZ8Q,1778289808,Young Style Letter Printed T-shirt Streetwear Loose 2025 Summer Fas... — Top Rated 2026 | Buy Now!,Young Style Letter Printed T-shirt Streetwear Loose 2025 Summer Fashion Backless Women's Clothing Korean Casual V-Neck ...
youtube,streetwear 2025,https://www.youtube.com/watch?v=vtRoHWmd4zA,1778269881,Best t-shirt brands to check out in 2025. Pt. #Shorts #flyshtdrew,Best t-shirt brands to check out in 2025. Pt. Best t-shirt brands to check out in 2025. Pt. Best t-shirt brands to check out in 2025.
youtube,streetwear 2025,https://www.youtube.com/watch?v=p4IgAhCy_Ss,1778259671,Shoe of winter 2025 🥷 Nike P-6000  #wintershoes2025#uktrainers#p6000#nikep6000 #sneakerdaily,The Nike P-6000 is a modern throwback that channels early-2000s running culture into today's streetwear scene. Inspired by ...
youtube,streetwear 2025,https://www.youtube.com/watch?v=Fr1KuYwqx70,1778253511,Jordan 4 undefeated 2025 #fyp #sneakers #ootd #streetwear #jordan4,"short #sneakerhead #unboxing Leave me size!!! Hello! My friend, if want this goods add our whatsapp:+86 152 6026 8083."
youtube,streetwear 2025,https://www.youtube.com/watch?v=lGqzRsZb6sU,1778187965,5 Men’s Essentials for the fall 🍁 #mensfashion #menstyle #fashion #fashion2025 #mensfashiontips,5 Men's Essentials for the fall #mensfashion #menstyle #fashion #fashion2025 #mensfashiontips depop abercrombie uniqlo.
youtube,streetwear 2025,https://www.youtube.com/watch?v=v3oGltYQL-s,1778155732,in 2025? These 3 brands dont miss. jortstok denimshorts... #shorts #Shorts #flyshtdrew,in 2025? These 3 brands dont miss. jortstok denimshorts... in 2025? These 3 brands dont miss. jortstok denimshorts... in 2025?
youtube,streetwear 2025,https://www.youtube.com/watch?v=DVM4_FIF_AU,1778155756,Premium Suede Leather Jacket 😍 | Winter Fashion 2025Men’s Luxury Brown Jacket 🔥,BUY now -: https://myntr.it/X5n1hp5 Looking for a classy and premium jacket under budget? This brown suede jacket gives a ...
youtube,streetwear 2025,https://www.youtube.com/watch?v=mxopKV-x50o,1778138650,Demna on Streetwear and Reality (2025),Demna was appointed Gucci's Artistic Director in March 2025 after a decade at Balenciaga. His position on fashion has been ...
youtube,streetwear 2025,https://www.youtube.com/watch?v=6REHrpo6Ca0,1778096251,Off white galaxy new dragon animal 2025 #tshirt #fasion #offwhite,
youtube,streetwear 2025,https://www.youtube.com/watch?v=E4HhpHAM2ZI,1778058940,Young Style Letter Printed T-shirt Streetwear Loose 2025 Summer Fas... — Top Rated 2026 | Buy Now!,Young Style Letter Printed T-shirt Streetwear Loose 2025 Summer Fashion Backless Women's Clothing Korean Casual V-Neck ...
youtube,streetwear 2025,https://www.youtube.com/watch?v=P-zJsag1d0o,1777928998,Wearing Rick owens in 2020vs 2025 #CapCut #fashion #rickowens #fyp,Wearing Rick owens in 2020vs 2025 #CapCut #fashion #rickowens #fyp.
youtube,streetwear 2025,https://www.youtube.com/watch?v=gjIV0A_aI4Y,1777914940,"Docker Cap Collection 2025 | নগর শিল্পো | Corduroy, Charcoal, Off-White &amp; More",Nogor Shilpo-এর নতুন Docker Cap Collection এসে গেছে! বাংলাদেশের সবচেয়ে Bold ও Stylish Cap ...
youtube,streetwear 2025,https://www.youtube.com/watch?v=HuLLWb6dUOQ,1777879786,SHEIN MEN Fashion Picks #SHEIN2025 #SHEINMEN #SHEINSTYLE,
youtube,streetwear 2025,https://www.youtube.com/watch?v=iR0jkPITgb4,1777836751,3 brands to buy rugs from in 2025. if your room feels... #shorts #flyshtdreww #Shorts #flyshtdrew,3 brands to buy rugs from in 2025. if your room feels... 3 brands to buy rugs from in 2025. if your room feels... 3 brands to buy rugs ...
youtube,streetwear 2025,https://www.youtube.com/watch?v=1RMbGdCbwCU,1777809993,3 brands to buy figurines from 2025. best spots to find... #Shorts #flyshtdrew,3 brands to buy figurines from 2025. best spots to find... 3 brands to buy figurines from 2025. best spots to find... 3 brands to buy ...
youtube,streetwear 2025,https://www.youtube.com/watch?v=wRwi_Tmvvpg,1777777770,WEARING WHO DECIDES WAR IN 2020 vs 2025  Shout out Ev Bravado man!!!!,WEARING WHO DECIDES WAR IN 2020 vs 2025 Shout out Ev Bravado man!!!!
youtube,streetwear 2025,https://www.youtube.com/watch?v=wL0X7l7Y1wA,1777744897,2025/26 Bayern Munich Third Jersey#championsleague #fyp #bayernmunich #footballjersey #bestzv #ucl,
youtube,streetwear 2025,https://www.youtube.com/watch?v=30qL1OVxxeg,1777743101,Umboxing Jordan 1 High Sbb (2025) #dc #recenzja #streetwear #umboxing #jordan1highsbb #jordan1high,
youtube,streetwear 2025,https://www.youtube.com/watch?v=__lWAhDpMuU,1777732226,"AwakyCool — Stay Awaky, Stay Cool | Birmingham Lifestyle Brand | Official Intro 2025",Welcome to AwakyCool — Birmingham's boldest lifestyle brand. Born in Birmingham. Built for those who live life on their own ...
youtube,streetwear 2025,https://www.youtube.com/watch?v=PrVZFB_T0ko,1777674941,Air Jordan 4 Retro White Cement (2025),OG energy returns The Air Jordan 4 Retro White Cement (2025) brings back one of the most legendary Jordan colorways ever ...
youtube,streetwear 2025,https://www.youtube.com/watch?v=P22FKf-H8mQ,1777665494,best jorts for summer outfits 2025 streetwear denim shorts... #Shorts #flyshtdrew,best jorts for summer outfits 2025 streetwear denim shorts... best jorts for summer outfits 2025 streetwear denim shorts... best jorts ...
youtube,streetwear 2025,https://www.youtube.com/watch?v=3vCu9_8kqOA,1777662005,Panama Third Away Football Jersey 2025 Black 🇵🇦🔥 Would You Rock This All-Black Panama Kit?#soccer,
youtube,streetwear 2025,https://www.youtube.com/watch?v=D2jI_pLKQHs,1777621803,Jordan 4 black cat 2025 #fyp #sneakers #streetwear #fashion #jordan4s,"short #sneakerhead #unboxing Leave me size!!! Hello! My friend, if want this goods add our whatsapp:+86 152 6026 8083."
