source,query,domain,url,created_utc,title,text
gnews,runway trend,news.google.com,https://news.google.com/rss/articles/CBMiYEFVX3lxTFBCaGJVUHFjVkNZMVZEaklNV1RNdHlXcXdnbDFxbG8zY2tadnBOYVhndVFIOUNUWUJVMU84Q0tPQkNWWU1udEpCQmxmSXF5QzdBSS1uazBQbTZwanVHNnRHNw?oc=5,1775088000,The Fresh Bag Trend Fashion Insiders Will Wear in 2026 - Who What Wear,The Fresh Bag Trend Fashion Insiders Will Wear in 2026 - Who What Wear
gnews,runway trend,news.google.com,https://news.google.com/rss/articles/CBMiiwFBVV95cUxOeHAtdVlreTBmei02MHpTQlVYODhvVGJfTnFHNTVzR0ZTc28tOFFPdTVQemJITnZDdzNhSzdiZzhiVjVDUzRnQ1dHZG8xWllhR0tjcUhrcGZ0aS10X19ERkVLRGRsQUQ2WGxaV2NlMHR2M2dGeUVVS2thRGV6NVZsV1A1WmlUaVpTVHpZ?oc=5,1775026800,This Is How Fashion People Are Wearing Spring's Sporty Jacket Trend - Who What Wear,This Is How Fashion People Are Wearing Spring's Sporty Jacket Trend - Who What Wear
gnews,runway trend,news.google.com,https://news.google.com/rss/articles/CBMimAFBVV95cUxPa3QwUkdtMTduZkY1SHVJN0ZqaWpDTUVvYmdtZ0F2azFhM0hEM180T1RLRWlIMlpMNjRER1p3TVA3UXllSFJFYmhuYTVaSjZubFVUcXItV1E2NllpMmRXZGowREd5UGhoZ3hOdUhyXzdGcGgyY3NjaXh3M0poNkJPUUNTQ0FEWW9Kb0lzVXZfQlFTWnV2MmdPeg?oc=5,1773817200,The math that explains why Y2K is back in fashion - Scientific American,The math that explains why Y2K is back in fashion - Scientific American
gnews,runway trend,news.google.com,https://news.google.com/rss/articles/CBMiakFVX3lxTE1YZ3k3Rk1mLUhlRnkyNFY3a3BlM2FBaUozVnV2Nk40cWRkNWxfMGxQQzFkOXNZMDhRd0ZlcG4zcWp2WGdDQ2pjUVduanhWMl9FZ0t3R2o3LThyV1NBdXZNUmNsNFZ2azVhYnc?oc=5,1774422000,The Return of Romance: How Soft Fashion Is Set to Define 2026 - Who What Wear,The Return of Romance: How Soft Fashion Is Set to Define 2026 - Who What Wear
gnews,runway trend,news.google.com,https://news.google.com/rss/articles/CBMi3gFBVV95cUxPNktZQ0R4ZVp1OGZGTnJJUmtwWjRYZWVYaXQ2eG5iNl9KckxZWVh2ZjZjNVpZQTNkRkc2b0lkekVZRkpULU1lSFlZSFR2RlNMcWstTTNlUk9mX2dTMGhOaEVab1R4WVdkSXQ0aUVVNThGcy1vSnk3V19SM19ZaHY1VGFDS0pMaWpubHVRZUNFNTFPa21DY0txb3hYVE5LOFA3QkRUSEYzeXRVbS12cE9WMzJHc1hBNFVrcm9Tc0xqY3hxVHZSWmd0bXhHMENTQUk2d3VfNTlkZUhLdTZEZWc?oc=5,1774789447,‘Leverage the local’: The fashion trend that explains why everyone around you is channeling their inner tourist - Fast Company,‘Leverage the local’: The fashion trend that explains why everyone around you is channeling their inner tourist - Fast Company
gnews,runway trend,news.google.com,https://news.google.com/rss/articles/CBMilwFBVV95cUxPd01QU05aazFqc0ZFdXVVcjd6S1dQc1NNZnV2c0c1eGduNzdEeFZuU2dZRG1pYUE5VzFQS1NFMG5iRWVja3I4YTZ5VzZZcXhEY1AxYWZIcDRoSTlodzNGYUQ1eWNmaEZ5aThhVU1iUVhkZnlxaXVBcmszcnY0LUpkUmRsa0JkNDdkRHl1Q2lTM3N3X0g1VWgw?oc=5,1773730800,Why Fashion Is Suddenly Obsessed With the 18th Century - ELLE,Why Fashion Is Suddenly Obsessed With the 18th Century - ELLE
gnews,runway trend,news.google.com,https://news.google.com/rss/articles/CBMiiwFBVV95cUxOdmhxR3V3aXp5Y0psYzRPZlZLeG84akp3enRkdnBxUXpqcnFvLXJtclp2dGhxdUVGRjFCU0VQTWFDbF9mbWxfRDJmUnhjWlo5UzdSNzlpbGlvQmxkaEtvSDNGa1FZNkVTYUNTZVp1dUNaNlRaMktIcVE2QWp6OE9sSmpUR1BmY2VEM0VZ?oc=5,1774861240,Trends That Are Big in Japan - The New York Times,Trends That Are Big in Japan - The New York Times
gnews,runway trend,news.google.com,https://news.google.com/rss/articles/CBMieEFVX3lxTE9jd0hIdjAwVnhPN1dJWVBVODhsUGN3dU5Nbm9yYU5vYVNRR25fdW8tZ2hhenZiR2NmZ1JiQmFJcVpnVS05QlNCQUx2YTZpdHhPTHUxOVRLSkdoQXVYVzdmX3RXTGd1XzU2eTZvLVBkd3JYejI0Q1lwWA?oc=5,1774076400,Here's Why the Riviera Fashion Trend Should be On Your Moodboard in 2026 - Who What Wear,Here's Why the Riviera Fashion Trend Should be On Your Moodboard in 2026 - Who What Wear
gnews,runway trend,news.google.com,https://news.google.com/rss/articles/CBMikgFBVV95cUxQYmwxbzBVcVVPNnRiaEtleURaal9VcUpMd0FZOVItRU1aSnZraWRYNURpZUluT3loc3dIbzR6ZWVyekQyVUVjd3pYRjZKdmtZZlo1UTVJczdna0hybHU0RHNaM0ptczdWUnBaVFRWalQ5dG1hemFpYTd1ZV92VEcyNC1ncHgtb1RFcklPakIwc1prZw?oc=5,1775300400,Spring runway report: The six designers with the most wearable collections - The Globe and Mail,Spring runway report: The six designers with the most wearable collections - The Globe and Mail
gnews,runway trend,news.google.com,https://news.google.com/rss/articles/CBMilwFBVV95cUxQSW5YV0EzYzhmRXJsVEhkXzVNZzd1T2xvVVFEclNzM0ZzYldDOEtNM0xUMk5PNDU1T21rVzRob1ZsX1kxMVFqcXcwTHQzWkJsZlFYaXNGeVV4aTZRdFBfNVd3Y2ktRUwyVHlETDVrRjlLY0VpcVJmZFJKdGZHTEJiZDhtR09VTlpNUVltSmphaS1lSlRnX1hr?oc=5,1774508400,Vintage to Vibrant: Spring 2026 fashion trend predictions - thelantern.com,Vintage to Vibrant: Spring 2026 fashion trend predictions - thelantern.com
gnews,runway trend,news.google.com,https://news.google.com/rss/articles/CBMif0FVX3lxTFBZa2NXYnZtWkIxdkNjeHJmNWpFS2hFYk5VYlRXQ1JmUUxVMTFrbUJUb0MzSXJONGNXR3NoRWtOS1RsSGI3a3VKWFM0NlA0VnRCdmFyakk4di1XbW5RaDU4T1phZHpTZnhTWXhYMlNtZHhVUVpacjRpaVVGUFFsOUU?oc=5,1775051099,"Not Barn, Not Suede—The Elegant Jacket Trend Fashion People Are Pairing With Leggings and Capris - Who What Wear","Not Barn, Not Suede—The Elegant Jacket Trend Fashion People Are Pairing With Leggings and Capris - Who What Wear"
gnews,runway trend,news.google.com,https://news.google.com/rss/articles/CBMitgFBVV95cUxPc2xVYy03YnVEQ08tQzBya1c0M0phblJfNXMxT0t0RkQyUmdHbDAzV0Z0VDNrLTdQQ2RFUkZndDRRTTZpa2QtdHBLRW92MURfVFR3OUtFXzY4eVp0bVVzQ0I0b2hHajBUc1ZhTjVNRXluU3ZnaTdGVF9tVXdtUGNORm5IX3lYeTZFbjZUZW9nRE1fb2VfVldqcHhqa01ZdjhfcEg5dnhsMy1sZ1BJangzeDRGNVg5Zw?oc=5,1775065140,Zendaya’s Latest Bridal Look Is Alive With Layered Ruffles - Harper's BAZAAR,Zendaya’s Latest Bridal Look Is Alive With Layered Ruffles - Harper's BAZAAR
gnews,runway trend,news.google.com,https://news.google.com/rss/articles/CBMif0FVX3lxTE1rV1BQTHFRNjctMVp6MjMyLUk4WUJsRzU5S2dKa1J2NmdfWjlDcDVKMi1pcVNvN1ltTE9FVVJaYmR6aHVVMXhsX3pjel9rSEtrdkdOM1ZrME10eGtqTGdfNjBlR3dwMDVaMkJjcDNfM2UxemtUa0hYTndDYTRuTjg?oc=5,1773990000,RIP Quiet Luxury: FW26 Wants to Be Seen - hypebeast.com,RIP Quiet Luxury: FW26 Wants to Be Seen - hypebeast.com
gnews,runway trend,news.google.com,https://news.google.com/rss/articles/CBMihgFBVV95cUxPSnhSQXpBZU5MNlVKaEhvYS16djBMSXY0YlRDdlJ2LXNFUHF3Z2FOVUhfYkxJLTJNdXJnNGY0RnB3bHZ4YVM2WlVvNy1ZY0t5YzlIRFBwcERsd1F6aXYya3NGVHdfNlNZcE1yWl9uSnpSUkxnMjdaZlJMcXZWTXdOcjFvN0lPdw?oc=5,1774987894,Plaid Is Spring’s Surprise Trend Taking Over—Here’s Why - ELLE,Plaid Is Spring’s Surprise Trend Taking Over—Here’s Why - ELLE
gnews,runway trend,news.google.com,https://news.google.com/rss/articles/CBMilwFBVV95cUxNR2I3cVhVbWpTWlByZTJQbVcwekZQNXRkdHBhZ1NoS3lQbWpvNjFraGVFUUJ4TDRRb29TamxhZzl4S0NQVVg3ZEotUFQ3dUUwY285aGNDRmxsWks1dnNJdHdtS1VFcHJveGJfcEJoczVQTFVYNTgzRE9OUHk5ekd5WWVXTFozbTJsX2FsSFE0cFJYS3YtUVFn?oc=5,1775115229,9 Street Style Trends To Try For Spring/Summer 2026 - Harper's Bazaar Singapore,9 Street Style Trends To Try For Spring/Summer 2026 - Harper's Bazaar Singapore
gnews,runway trend,news.google.com,https://news.google.com/rss/articles/CBMiggFBVV95cUxOcVlmNFJoT01mOWJmOFNBanVROUcwcVk1cnh2WjJxNFhaVi1lRTJzWlZ1WDlSV2VEMGZlUmNqNndKYTNSY1hwMXYwT0k1aVdraVlMZnNKb0VHbXJpRWliYjhHX3A4WmlSbXUwTTl3UmVGN2o4OXY1c2dNdmFhMzJWT2J3?oc=5,1772956800,16 Spring/Summer 2026 Trends Everyone's Talking About - Who What Wear,16 Spring/Summer 2026 Trends Everyone's Talking About - Who What Wear
gnews,runway trend,news.google.com,https://news.google.com/rss/articles/CBMickFVX3lxTE5LQWN5clh4NDFJeERSeGxacWdFeTRsWWFocmw3ZXRJZkp4a1lyMktOYTFHSmF2Y0JwcjVOdjFWbHQ5SEZEdjl1LXFkaVlSQ0I3ZzNsR1ZsTnM5OEtxUGFqWXFGZ01xdDdRMHhrTk5FSks2UQ?oc=5,1773903600,20 Fashion Month Trends for Fall 2026—From Cartoon Fringe to Jazzy Jacquards - instyle.com,20 Fashion Month Trends for Fall 2026—From Cartoon Fringe to Jazzy Jacquards - instyle.com
gnews,runway trend,news.google.com,https://news.google.com/rss/articles/CBMijgFBVV95cUxPU183ZVNLUWVPRXZyclVwcFZCcmN0LUZPUVhBVUhmN1JLUUlWdnZ2VWR1b3BOMENUT1hPUnpBc2k0cThxbTVqUkFRV0MtdzIwM1Y1UzJJandaN2ZVR29vbDhDNGZ4Vl9mUHlYaDVZYlphd0U3N1pKMlRBYkFMZjIzUm1wTzdoWjM1cVRXOTZ3?oc=5,1774076400,Six defining trends and takeaways from the A/W 2026 shows - wallpaper.com,Six defining trends and takeaways from the A/W 2026 shows - wallpaper.com
gnews,runway trend,news.google.com,https://news.google.com/rss/articles/CBMitwFBVV95cUxNRXZ5RE56VGx3Vmd6WXdyREQyQnlVYUlBTVFYcHYwMDEyN0tldko5eGxETVV6VGVOZkRiN0VQSW96VkdzMDEzOVFjY2NmTjc5d1ZaZUp2R2hUQVRnMXFzeFhKQTd3UkZJbjktckh1cHljSjhxcUZ6ZnlIY3YtbDBfMWJ6R1prTEd5T2tJMjdXYjNINlpUOFRBNnhlTHB0SnB3TVZSa2NvazZJeG80aWV4TXpzbVRZa2M?oc=5,1773644400,The Real World: Fashion Week Edition—12 Top Street Style Trends of the Fall 2026 Season - vogue.com,The Real World: Fashion Week Edition—12 Top Street Style Trends of the Fall 2026 Season - vogue.com
gnews,runway trend,news.google.com,https://news.google.com/rss/articles/CBMidEFVX3lxTE9VNGVrWnFONUFOUWo1YjV6TUYyTV9mQkkyTFQyTDNYNHAza1NEcUEtZlhVb2N4OURIWDBxcGs4SFZYNUs5SGNBMTN0MUZ4aHFyeFJWS05YM0IyUW02YjNJTzB1dFczWFc0Rm9STFVfTi0tYU04?oc=5,1774455915,"New Fashion Trend: ""Toothpaste Dressing"" - onnj.com","New Fashion Trend: ""Toothpaste Dressing"" - onnj.com"
gnews,runway trend,news.google.com,https://news.google.com/rss/articles/CBMieEFVX3lxTE5CZ0NHamd3MUotdnlrVGNNeTA4RkFvMWVNdzRraGdTdUNIRTZyUUdNNXBVcjk2TEI3SjlwYmYwckRtN0tSS0czNFlXY0ZCVGN6YlpzV3NONi1IeklLVmFXLVpKdmdHZzNucHhFOW8ybHNTR2h0MnlhMQ?oc=5,1773707612,Why Models Over 40 Became Fashion Month’s Standout Runway Trend - AOL.com,Why Models Over 40 Became Fashion Month’s Standout Runway Trend - AOL.com
gnews,runway trend,news.google.com,https://news.google.com/rss/articles/CBMiXkFVX3lxTE5KcVVBMC1HR1JVSVhjZjlwX09sZTJOczdsYUVNQ21hZmtKemgxYUd1WUREMDJ1WnkyeXpldkxHVFhCQWUtSVd5a001T0lJckFjcVI1NFdROHBkLUwwV1E?oc=5,1773126000,Bonjour Paris! 10+ Street Style Looks to Recreate Now - vogue.com,Bonjour Paris! 10+ Street Style Looks to Recreate Now - vogue.com
gnews,runway trend,news.google.com,https://news.google.com/rss/articles/CBMiZEFVX3lxTE9KZjRhRnlHZVJ6REd3MjkxSXQxRnMtRXRHd1dFWUxwdWlJZWdfQUh3LVhIZXRpMjFnQ2NhVFlfSDQtMkJyaTFWQ3QxQmxqd2g0LXE2OHVSV2lWa1dKUFNDdGlHNzU?oc=5,1772870400,"17 Spring Fashion Trends to Try, From CBK-Inspired Minimalism to Texturemaxxing - Teen Vogue","17 Spring Fashion Trends to Try, From CBK-Inspired Minimalism to Texturemaxxing - Teen Vogue"
gnews,runway trend,news.google.com,https://news.google.com/rss/articles/CBMie0FVX3lxTE1KYUJnN0VRUzdLRXp3bXF0OTBNZmNLNnFCdS1Rek9EX0g4TmdQQl94MENjNUxmMEJvekY0ZGdBRnVhQ3daZkxWQWV2NExmUUlOY3Q0RE1XaGpzc0I1STIzQzZTZkJXRHltekpzd1NuMm5wWkh3dEhWVi1iQQ?oc=5,1773644400,It’s Nice to See (Some) Actresses Wearing Dresses They Can Breathe In - The New York Times,It’s Nice to See (Some) Actresses Wearing Dresses They Can Breathe In - The New York Times
gnews,runway trend,news.google.com,https://news.google.com/rss/articles/CBMiwwFBVV95cUxNMUlZSGRKWEcxaUNGellYYVRUMkNSUWRZZU83SC1rNkVhczE3eHl5dkstZHFvRXBydjdSTnZhQmFtclNKRVYyMHIzNlczNHo2NE13SVYzWVRDNlBzVU5ySDMyNE1yRHNVQWMtdGZDa05yY2tuczlwMnNfMkpaRmM3a2duaW1BQlc4RFZRcU9sN2ZUcWtoQnM3UHhaU2JQNzJySXRUWnNUVEQzQmZEMUhQOXMxQUZic3gtbldDVDhENWQ2c2M?oc=5,1775113237,"Move over, It Girl. It’s the era of the Lit Girl: Have books become the new fashion trend? - The Straits Times","Move over, It Girl. It’s the era of the Lit Girl: Have books become the new fashion trend? - The Straits Times"
gnews,runway trend,news.google.com,https://news.google.com/rss/articles/CBMikAFBVV95cUxOOURBVWcxcUh5MVlMZHZiY0NDQnU0V2xPazZMczQtNVQ0QzFVNHJ4TzZDZDdUNms2RHdabU03YUgzbjhNZ1RpOGd3MjBQYldrc19pS0hIVW5TalZ1cFFydHFKQTkxYnRjaEd1UHNnZ001bXJNaEdDLUhXcVZDZktvbVg0WWNjRE80MTRxRU5PZVA?oc=5,1774611045,Soft Unstructured Bags: The New FW 2026 Runway Trend - nssmag.com,Soft Unstructured Bags: The New FW 2026 Runway Trend - nssmag.com
gnews,runway trend,news.google.com,https://news.google.com/rss/articles/CBMieEFVX3lxTE42TktlXy1lRzF2UmMwSEpEdjJYNFVXbDhIai1UTFFLUkFKUFZpUXlPeGJ1cW8wbXhwTUp1NDhhck9FOE5HczhMbDBNTUlXcUh4VUhaRktoQ0NBVmZtaW13QUw4ek05M1RjRjlYTXZTX05BVThxQXJzag?oc=5,1773126000,Why Models Over 40 Became Fashion Month’s Standout Runway Trend - ELLE,Why Models Over 40 Became Fashion Month’s Standout Runway Trend - ELLE
gnews,runway trend,news.google.com,https://news.google.com/rss/articles/CBMikAFBVV95cUxOdlJ4MkZOaDZXTkZRZVFWM3pFamd4aE5od3dBZ212SGR5VTZHLVhhRVlhS0tPRXJiVTl3RXVRcnh5TlNrM2h4ZzZ3aGZpVFRBLTNnSGQyMFptMTh5bzg0MHY1RTZBZWZCWnVIN0J4OVRPbXhhamxXSkViTGVaZEVKSGlWSXFGcFVzUVdwNFY0ZWU?oc=5,1772524800,5 Runway Trends From Milan Fashion Week to Know About Now - Who What Wear,5 Runway Trends From Milan Fashion Week to Know About Now - Who What Wear
gnews,runway trend,news.google.com,https://news.google.com/rss/articles/CBMiswFBVV95cUxNcURGWDFibEwta3R0WEZadUZTclo4VXVmYnQ1NDlQalBQcEtXbk9SS3FfcTFQblJ1d1ZtWDhac1JTNjF3dW9GR3Zrc3NZMnphcU02S0xKMDJuTDY4V3JUX1ZyNEJYdkQ3N1hBUVRfZEhGVTNfMjJETjV0bmFueThfc2M2bmVMSEw4MVJaRWY5d241b0lLYW9DQkFtVUREdlFteXl6aEtBWlRuQW9TaktZMm1qZw?oc=5,1774649888,"LSU women's basketball fans turn game day into fashion trend, boosting local businesses - WBRZ","LSU women's basketball fans turn game day into fashion trend, boosting local businesses - WBRZ"
gnews,runway trend,news.google.com,https://news.google.com/rss/articles/CBMiigFBVV95cUxPZ3N4SjdZbUZpWm93bUN5MFlIZWRsYlcyWkNEN3FLc3F5YmM3cTl4SDBoYmR5Yjh1TXI3ZHkydUVTVEU2b09ZSlpZWmw0eHMxQVNJT0dwbHFGaFhTdHRlRmtzVnY0YlUwTDAxdTN4TnNEZ095UmlWZ1F2eFVKdi12WDBUdm5Tekp1Umc?oc=5,1773903600,The Best Spring Trends of 2026 - Harper's BAZAAR,The Best Spring Trends of 2026 - Harper's BAZAAR
gnews,runway trend,news.google.com,https://news.google.com/rss/articles/CBMiVEFVX3lxTFB0TVdSbmdhUTdwVkRrQVd0eDVmSGwwek5ZYjdza0lfMzNNS1F5VHdPWUI3TWxQWWJXYlFqd3EyaWJnOExqWGM0SzZHTTNycEhoNXh5Mw?oc=5,1773126000,Shopping Your Closet Is the Ultimate Slow Fashion Trend - the-ethos.co,Shopping Your Closet Is the Ultimate Slow Fashion Trend - the-ethos.co
gnews,runway trend,news.google.com,https://news.google.com/rss/articles/CBMiiwFBVV95cUxPc04tc2FlamlzTWRyUDRVUTJnUmR0dFhfUGNJLW5COHk0RGl0eWdEZzE0RE5TQTdyeUI1X3F1ZFk1WDR0a2hjaDNtSnA4VVVFQTJRaVdfUmFfa0NzWGxpVzVScVdQcjJ4NklMTzVSLXRMTWU2eFdOR3hnWWVtMm1wdG5odXJYb3Zycmo4?oc=5,1772092800,Cobalt blue: the fashion trend taking over runways and red carpets - hyphenonline.com,Cobalt blue: the fashion trend taking over runways and red carpets - hyphenonline.com
gnews,runway trend,news.google.com,https://news.google.com/rss/articles/CBMilAFBVV95cUxPYUo2RjdqVnFPU2dLa0JkZnRzR3M0dVFhNXFSQ1BqdzVpTzNPTU5zMUZQWGNuaGUyMUdEc1Y5d1VUcTBNeDBQN00ydnJPalVHX1o2Z0RzbU85N1JRb2ZzZUtNblVncUoyaTNzYmFybWxENXA5Q3lwTF9pRC1ZRWhjSjdQcmJwU01JUUtUdU1ZMzIxR1hz?oc=5,1772438400,Breaking away from the fast fashion trend cycle - The DePaulia,Breaking away from the fast fashion trend cycle - The DePaulia
gnews,runway trend,news.google.com,https://news.google.com/rss/articles/CBMikAFBVV95cUxNZVZIUERLNHF3RUhrQldGVVU3T1JnRzFaZVNCQjRkOXcySVJDNmpNbkM0ZDNqelprdkt0WkpJWlRrRml6UmhabVBIN3NOUS00a2U1TjY2MTRIZXozTHgxQXJKb0NCMHhMcnNrQThFYk9BMW1xejJ0U3l6SDh1WjRNaWgzZS10YVJJNTYxVTVjSEU?oc=5,1772006400,Spring 2026 Fashion Trend: Poppy Red Takes Over the Runway - Modern Luxury,Spring 2026 Fashion Trend: Poppy Red Takes Over the Runway - Modern Luxury
gnews,runway trend,news.google.com,https://news.google.com/rss/articles/CBMinAFBVV95cUxNdmVmdU1HcTdQcGVXZDN4TzNaYW4xZkViMEdLLWc2Mmg0d3VZQ1AwUVhEa3AyNTk0ODM2S2hsYjRld3UyaU9WLXdJTFJkZGNsanpYRWF0NEY2VkZVd0tRcV8wRFplYlVIOHlxZnRnZ0w1U2g1NWxhZzF3aXZkVFA5X05vdm0xcS1XWWE0TWRhSnVoTFUyOXhsM2JFdEw?oc=5,1773039600,A Fashion Trend Defining the 2020s? Tech Billionaires Crowding the Culture - Good On You,A Fashion Trend Defining the 2020s? Tech Billionaires Crowding the Culture - Good On You
gnews,runway trend,news.google.com,https://news.google.com/rss/articles/CBMijgFBVV95cUxQRE5aaWNzclhuTHE3bVFLdmtVcE5MVmFyZFBYbVVHYUNkY3BWMW9UaUc4aHkxamViZU9uNU1zVVZnVl9wekdmNk9yUGRkUk1xWllxdDVCMmFEaUVBZHd4eUE2RDNsczBEZHZSMVJUYlhpUXNuWFJhdTZZamxYR1YwLTRCbmx5alhLNUZaSFNR?oc=5,1773126000,Why Models Over 40 Became Fashion Month’s Standout Runway Trend - yahoo.com,Why Models Over 40 Became Fashion Month’s Standout Runway Trend - yahoo.com
gnews,runway trend,news.google.com,https://news.google.com/rss/articles/CBMimgFBVV95cUxNaDh6ckpfNzFaVGNGTnFzMEM3eFJ5RFh1eUdzeHRKZjNqRTRDVGV2N2lLb0s1WHQ3czdaNjNKWXlwdUtiYll3NUE0c0ktN1pGMURUekw3QTd3OVpqNXNyQkZldVN1ZG9Tcjd4dUhfMlJQM21GQjkwcUt5bmtHcUU2RnQtZkFBczF0dnpnNjQ2ejRCTTF1NG5JSVh3?oc=5,1772697600,The Biggest Runway Trends from Fashion Week FW26 - Hypebae,The Biggest Runway Trends from Fashion Week FW26 - Hypebae
gnews,runway trend,news.google.com,https://news.google.com/rss/articles/CBMimAFBVV95cUxQZDZVSDdmaE8yemY3QUZwd2JwZnpmVFAtOS0xX2pDRlpqR29VSFhaUHNCQTMxUFlfMlBST0o5NzBBSEFESGV4X05BU1BkOHJWR3hkcXhkYWF4dEN5YzJHOHkyeGp1VDdiX05Rejl3NHd5eEpJUzZncHg3bzRHSlFyU2JwZGc2cGs1czBPTkJTOFFNNFVOM3RWUg?oc=5,1773385200,5 Trends That Defined Paris Fashion Week A/W 2026 - Vogue Arabia,5 Trends That Defined Paris Fashion Week A/W 2026 - Vogue Arabia
gnews,runway trend,news.google.com,https://news.google.com/rss/articles/CBMingFBVV95cUxPazFZRmg2WDBEalVwZzRNQnByRTQtTDdaSTB0YVhkOUdBc21zZnhPUEpGNjVxUVE4QW14bEUxWGR5ZktaYnBZN2ZyQzVnSEpUal9fOUQ4RkdoOGw0b1p5RTFSbXpHOFhIV0RNN2JJaTVrOGxjMHlrQTZFVFhKY2VvWkVQSFQ0eXI4bGRaV0RIRzRkODlOOWRQMXpEQmlnUQ?oc=5,1772092800,Spring 2026 Fashion Moves Beyond the Capsule Wardrobe - ELLE,Spring 2026 Fashion Moves Beyond the Capsule Wardrobe - ELLE
gnews,runway trend,news.google.com,https://news.google.com/rss/articles/CBMikgFBVV95cUxQNzJKLWJuQlZrR0oydDRNOGtwNWtJMGJ2Njh3ZGIyV0pEQ1dlNkpaT2V2S1pZUTdPYmtoTE50cl80ck81RWpXeTVRNmlrSE5PQmo1aVZjZDNYT0NVbGIzWV82MTl1TXBoNWVhX2kzQ0JyNmZEZmNxbmxKbjR0NWd1RWVQV2czUFJzSERGejc0aHRRdw?oc=5,1772092800,8 Chic Trends From London Fashion Week Worth Knowing About - Who What Wear,8 Chic Trends From London Fashion Week Worth Knowing About - Who What Wear
gnews,runway trend,news.google.com,https://news.google.com/rss/articles/CBMif0FVX3lxTE1Pdld0WnAzbjNUR1F1MXdIWEFLUm50ZVRYNFlQWHFRRWxmNjNueFNYT1pkMGdkaWtkWEVteFZfSGVjQVp3S21jWlNqM1FEOHN5TmJ4b3FMTURMeXU0SGVuejFNMi0tOGxMZEhMTUZBb0doWTZvbngzUVdIbVVkMVE?oc=5,1773039600,Fall 2026's Fashion Trends Aren't Reinventing the Wheel—They're Perfecting It - Marie Claire,Fall 2026's Fashion Trends Aren't Reinventing the Wheel—They're Perfecting It - Marie Claire
gnews,runway trend,news.google.com,https://news.google.com/rss/articles/CBMilAFBVV95cUxNMVFiRVdrRUdlSTRWSHNtOTRaVzdEWVpJYWhOWF92SGlOM3A3VkpNSmRDSklKRlRlUFFaVTRZT3Ffc1JwZENmcHZYRk9EZU45Z2NFdG92UzcwQ01nSGhtQUM2RmhVbWtFcHdXWTBCU0NwVXhzcUhoR243WlVsb2xCaEhiSHlUYktPd18yZ3NEX0Z6bnVl?oc=5,1772006400,Minimalism Is Out. London’s Fall 2026 Runways Are All About Bold Classics. - ELLE,Minimalism Is Out. London’s Fall 2026 Runways Are All About Bold Classics. - ELLE
gnews,runway trend,news.google.com,https://news.google.com/rss/articles/CBMipgFBVV95cUxOcXI2alJSdDNCLTdBeDhzckdhZGZuN3J0dmI4ak9LSzU3b2h3bUhoY1pwdGVOYjFWS2ZEbUdCNjN5ejV2dHF4MHlTaXpGZDhiS2xCbDBBVzRnQk52QUp6dm9fMkJON2FFZ254ZTAxUVhEQ2V0aHdXZU5LS3plUzZId2NVbFB0YkxpNU1ETkgxenEwOE1OTjRMNUFydGxmZXFaeWJTOF9R?oc=5,1772524800,"Top Fall 2026 Trends From Milan Fashion Week: Black, Power Suiting, and Lace [PHOTOS] - WWD","Top Fall 2026 Trends From Milan Fashion Week: Black, Power Suiting, and Lace [PHOTOS] - WWD"
gnews,runway trend,news.google.com,https://news.google.com/rss/articles/CBMimAFBVV95cUxQREVINnExaXd1N1NvemFCZ28wY1lwYXRTUFM3WWc2YlRSb0szU1lBN0pVVWE3ZC0wZFJIS0JFR0JYUzRrWnJqejI2cnNzT0ZmTl9MNkV0dDRJRE1zdnpVMWx0VVBZVXdpeXB5blRuVUY0Y3FNUm0wVWhucVBtLUxDZTFlM1dPSEZiaHViM3U1TnlBNEVOZ2JNMA?oc=5,1772697600,"These Are the Fashion Trends That Will Dominate Spring 2026, According to the Runways - Cosmopolitan","These Are the Fashion Trends That Will Dominate Spring 2026, According to the Runways - Cosmopolitan"
