source,query,domain,url,created_utc,title,text
gnews,runway trend,news.google.com,https://news.google.com/rss/articles/CBMieEFVX3lxTE8xWmM2czJKX2FiR2ZFcVNWekdaLUlEODRpRUUtSmdYaEdqbmtPbHBTd3Bwa01TeUcwZG13YWZBTW9IWnhlSlNhNHZEUWY3R1I4RWd5eDhpSzdEYVZaRDJoR3ZYUjJUUGpfdF9qZ3VzdUt0WGFxSWlBaw?oc=5,1777783500,Everyone Knows I Have Excellent Taste In Shoes—7 Summer Trends That Get My Approval - Who What Wear,Everyone Knows I Have Excellent Taste In Shoes—7 Summer Trends That Get My Approval - Who What Wear
gnews,runway trend,news.google.com,https://news.google.com/rss/articles/CBMirAFBVV95cUxQcVpuNVBuYlhfS3NUQ0tBdHhMNGQzaG5zbV9ESTVGSUxQZ2lJQkY5OEo2YzhuUGVkWS1qZ0dTV1Z2ZzFGSlBDSUhzNTZpNFMxUzdHWmZ3TzREaDBaUUY3a3p2M3Q2S1NYRjVfVTVGYkhNclhMT2tPZXNvLVVSQzBxbWVaVDVydVNLaVpNTU5VQTE3SEh4UVVuLTRSbUkzcVFCQ1R2TDRtekZrS0st?oc=5,1776679200,What old old fashion trend would you bring back (+100 years old)? Roundtable - dailycampus.com,What old old fashion trend would you bring back (+100 years old)? Roundtable - dailycampus.com
gnews,runway trend,news.google.com,https://news.google.com/rss/articles/CBMiswFBVV95cUxQTHdSNVlHTzdZYWdwckdidU1Vekc3VjVWMkVLNUs2bjdKT0g4MjlFM2FtSGJfS3p3enNXbWpFTmJYMGx3T0JwaDMwdkFvREZva1IzMWVCVjR4c2J4Q0p6bm9tQWhzYUM3ZXVFMFBHUXRmcHdzMTF0MlByeDIxYjJfaG5nOGNDVTF2dzc2NHV5eTRPbWktTkRtaTkxMi1EcUhHaHRxQkJjaFZxUFJIVmwtR0JDWdIBxwFBVV95cUxON2IxVWRCZjU1NFM1VVhuM2d5WEs4WGIzVjlJNVNJZkJBNkNob1ZnemROUkRoLWNZbUdNQXhUbDlFYU9lb1phWEFXRDViMzJwQ3hNTFpMR1VveW04QWF0N01ZM0Jma0wtZXpwdnR5SzhvanI3cEVtcnRVcU1pbTJTblJmMUpmM0t5d3JvUk5OYjhaUW44UDczc1RVX3NmVXQ2Rm41eTZ6RXgtOGV5NlJGSmo0eDVSc3NCelBXV3FpQUxpRUpCN2hz?oc=5,1776927600,Vintage fashion trend offers sustainable alternative to fast fashion in Las Vegas - FOX5 Vegas,Vintage fashion trend offers sustainable alternative to fast fashion in Las Vegas - FOX5 Vegas
gnews,runway trend,news.google.com,https://news.google.com/rss/articles/CBMigwFBVV95cUxNRTlsaXdrUlRaTzc4WjZ1V0NWbzZVQ1loZW1vTXFvTllHWVh4ZEpnTV9HS2N2aGF2WVU4aVMtN3hLMXhlY3phWFJ5V2RiR3RTWlNyYnE1a1I0R3VIb0xNV0t1ZEFtZXFtdE9rMHhPWVZ1d3E2dUlOc1NRbEtCd3I2WXNGSQ?oc=5,1777546464,Red-and-Black Flip-Flops Are Officially the Shoes of the Summer - Who What Wear,Red-and-Black Flip-Flops Are Officially the Shoes of the Summer - Who What Wear
gnews,runway trend,news.google.com,https://news.google.com/rss/articles/CBMimAFBVV95cUxQRzlacEZMTzFhd2N6cFNMSm5GM2FaMUpKeEVfRF9YTGx5cnowaTRvY1FaWFYxU3AwS1ZCQ0VSV2c5RDlpSV9NUnFpTUhYQ0FabGxJZzBOYUppN2hqRXUxdndDbWctVnB5bE56aDlWM2JIcnhzSWlsYXh3TFlWLUF1Zk5hdVZXY2c1MlY2NEdtU2d6Vmx5VHRJQQ?oc=5,1777873696,Is the Kashmiri Pheran a Fashion Trend or a Timeless Identity? - Kashmir Life,Is the Kashmiri Pheran a Fashion Trend or a Timeless Identity? - Kashmir Life
gnews,runway trend,news.google.com,https://news.google.com/rss/articles/CBMiuwFBVV95cUxNLTBxd2NzVXJTQ1k3R2lvbFZmVUFPOXlwR21SemVjM1ZhUVVfVDduSFUzUm9rcmNiQjNvWUl2TDRLaGo4dHFnT2Rfdl9WbGJTVlFGcHV0bkVZWGZJTU9hR0RxejEwTUtFUEoybFJoNVFhcEt6Nk8tS213VXMwS09CV1kwdWhwdkYyOVVmMDZfOG55V3FiRzZvcUhoU05FeFluMzlvc2o3ZXp4LU83U2dsLXFIaGZGbVp2c2pr?oc=5,1776927600,Vintage fashion trend offers sustainable alternative to fast fashion in Las Vegas - FOX5 Vegas,Vintage fashion trend offers sustainable alternative to fast fashion in Las Vegas - FOX5 Vegas
gnews,runway trend,news.google.com,https://news.google.com/rss/articles/CBMihgFBVV95cUxObGRiQzAwdnFWQ2FkcEJZaFAyQmMtVzFJTkxzaE9RZEROcUtfa1pDT0NsNkhPTHpsSzdETV9OaGFOT3QweWVOMGNYb2Fuc2x2bUx1bmlidXVKX3E2WHlteDY0ZFQ5a0ZvQVd2eDAtQVpVbnZOSS1JcmgtWDlFR1Bwcnd2Q3hhUQ?oc=5,1775890800,10 Trends Set to Define Fall 2026 Fashion - Who What Wear,10 Trends Set to Define Fall 2026 Fashion - Who What Wear
gnews,runway trend,news.google.com,https://news.google.com/rss/articles/CBMioAFBVV95cUxOTjJQX2tFbEkwR01GaUhGUklQOUw3ckFEYWRGMW43WXVJak15elVLRlY4MXR3T0d6SFE5YkdMMEZobktMS1Fkc21vQjY1SVBkX1JoazZIM3MzSmg5dWdXUnliQ1FYczRMU3RHbUZ4bTJPdjNZNFV1VlVBdUFpMUFEaThoekNuWk10X1NLZEVMXy16dFpMbHkxRTdrODBMWnZO?oc=5,1774854000,The Los Angeles fashion trend of the year is politics - Annenberg Media,The Los Angeles fashion trend of the year is politics - Annenberg Media
gnews,runway trend,news.google.com,https://news.google.com/rss/articles/CBMilgFBVV95cUxOa3dWb2dLNGpVZmVMUkU1N1lYbmJ5RXNSX3Q2b0xhVnA3OTF1NU9WSHZ0bDNvMk5ITUxmZ3dydnhTZmxqZVY4RkxlVHAtci1vRThJMm00QTE1bUQzczUycmoxaW1WR05vVUw0VE5GYVRnUTBDQzZVRFU3aEw2OGNxOXlvVTBpb3UyRElmRHVkcDlmajM0ZVE?oc=5,1777481220,Is the Naked Shoe the New Naked Dress? - ELLE,Is the Naked Shoe the New Naked Dress? - ELLE
gnews,runway trend,news.google.com,https://news.google.com/rss/articles/CBMieEFVX3lxTE9jd0hIdjAwVnhPN1dJWVBVODhsUGN3dU5Nbm9yYU5vYVNRR25fdW8tZ2hhenZiR2NmZ1JiQmFJcVpnVS05QlNCQUx2YTZpdHhPTHUxOVRLSkdoQXVYVzdmX3RXTGd1XzU2eTZvLVBkd3JYejI0Q1lwWA?oc=5,1776322800,Here's Why the Riviera Fashion Trend Should be On Your Moodboard in 2026 - Who What Wear,Here's Why the Riviera Fashion Trend Should be On Your Moodboard in 2026 - Who What Wear
gnews,runway trend,news.google.com,https://news.google.com/rss/articles/CBMiiAFBVV95cUxOUU5GUm1KM19sWExIMHd4c3NTdHpFYUx4OVRtR0tpSUowQWlRRFVBYUxNanZfN1dYRWpYVWdoZEJ5RHR6cjgyVmsxVUNVSk5VVXlYbG9lZXMyUHQyWnkzY0trRzNvWUhHNVhqT0UzTFRabnIzaERJTmdsTGVkbW9hSE1MRnFsZ0tj?oc=5,1774594800,How to Style the Best Fall Runway Trends for Less - The Cut,How to Style the Best Fall Runway Trends for Less - The Cut
gnews,runway trend,news.google.com,https://news.google.com/rss/articles/CBMigwFBVV95cUxOZWNzLUJaSkZXeGZyWWFaa0FaUjJfQ2lNdzEzOC1laVdIUl9icW5aNzVKY0xRUF9oSG9TN3NEX0ZYZV9FMVl4LU1FVk5tLVgtMF9CclJpb0ljSXF6QzcwdlJDcmdvZkc2SEh1cUlLRU5FRUlQbS1TUVpELUxQcUwyT2Ridw?oc=5,1777880030,"Charlie Kirk Assassination Audio Used in 'Gross' TikTok Fashion Trend, TPUSA Responds - International Business Times UK","Charlie Kirk Assassination Audio Used in 'Gross' TikTok Fashion Trend, TPUSA Responds - International Business Times UK"
gnews,runway trend,news.google.com,https://news.google.com/rss/articles/CBMic0FVX3lxTE1DS3JyTktQOE43XzgzZmdKcHBhQ3VWZWs3bi1yMFZINURsVlREVVVOdDNYTUhaVjYzcjdXcmg5MHNUSTZvMW1NS3NpdFN0VTYweEhwQ0c0Rzc1bERzcXNIMi00RnJqQjFwX2IxVF9rRlFGYXM?oc=5,1777100400,The Key Spring/Summer 2026 Trends To Know (And Shop) Now - British Vogue,The Key Spring/Summer 2026 Trends To Know (And Shop) Now - British Vogue
gnews,runway trend,news.google.com,https://news.google.com/rss/articles/CBMiYEFVX3lxTE1Fd05zSlgyaVhfc2FrWi1rOVhnS09hMTRta083eGIxVDgxdURNcHBlVFFZRHVqNElkYnl1QktWSUJUMlB6bHN1MHRrVVFVU2x2ckZUVWZOQ3lYN25tVHA4UA?oc=5,1776582000,How to Style Butter Yellow—The Shade We’re Melting for This Spring - Vogue,How to Style Butter Yellow—The Shade We’re Melting for This Spring - Vogue
gnews,runway trend,news.google.com,https://news.google.com/rss/articles/CBMijgFBVV95cUxNbFR4THAwYTFFU2FtR3hWQnJ4TzJobzVrc0lqUkM0ZWwzVlZNbjdjWFBaU1dka2ZTRWhYb3J5QTF5OFJ6alQ5anlnTmF3MUVRTVVRUUx4amJaTnpBMHRRWHJJSk5MN0JKQVFoZDVtZUZHNkNFYm1fWGllV3JqSm1KWFdNTk5wQ2ZlX08yM3pn?oc=5,1775286000,Every Major Trend to Know From Paris Fashion Week - Who What Wear,Every Major Trend to Know From Paris Fashion Week - Who What Wear
gnews,runway trend,news.google.com,https://news.google.com/rss/articles/CBMidEFVX3lxTE12ZDdENm5abDMzY2owd0NPOUpvVGlnMmNYN0xkLTZsMnBGYkN3Sm5wUERYendfVDRvTFAxd2huMTcxVG1NNGs4Vy1oaDYwcEM5UWc0d2lTY1Z6TkRneF9fYThhSGc0LTR2Skh3bUM3RWtMNnNk?oc=5,1777706497,Coastal Grandmother vs Beach Luxe: The Seaside Fashion Trend That Owns Summer 2026 - Elle India,Coastal Grandmother vs Beach Luxe: The Seaside Fashion Trend That Owns Summer 2026 - Elle India
gnews,runway trend,news.google.com,https://news.google.com/rss/articles/CBMia0FVX3lxTFBxdGR4SHN5aGEtczhhdWlYdjR6MlJZeFpkTmV4TThHbHE0MGVMVFVLNU4zMDVWNkJROGxFR2JncklXT3lfMktjSnNNa0tQM2NjU0xlLURFM3NGQkVHczZnUUtrcHI5aW9MbnVJ?oc=5,1775631600,I’m Convinced These Spring 2026 Trends Will Be Everywhere - Refinery29,I’m Convinced These Spring 2026 Trends Will Be Everywhere - Refinery29
gnews,runway trend,news.google.com,https://news.google.com/rss/articles/CBMilwFBVV95cUxNQ0I1UGpIWUlZQ0Z0T0Rxb2x0dVgza19YV1VndXZ1RnJ1ck5xS1h4eGc1YkJoMkR4R0x0dUhIRGdhcC1LbjM2SWI2UHA2N0ozc3hadWdKa1RWaThFZUx2R2RwSlk1RjJVNXJnQW5Uc2tsRDBNNklQclFyLTlvTl93QjI4OEVrYUFCQ0Q1QmRGR0V1NmRqZXJ3?oc=5,1775718000,"Coachella 2026 Trends To Watch For: Western, Boho and More - WWD","Coachella 2026 Trends To Watch For: Western, Boho and More - WWD"
gnews,runway trend,news.google.com,https://news.google.com/rss/articles/CBMiggFBVV95cUxNeVRuYklMUVNJaDVIM2M1QTZscjVsMHduQUN4MUdDWndZTDFUeWZ3eWxLbnd0cmRIcG1tWFJmd3Utbko2NHBNbFNMVXlPeDlkUU82SWNMT00yNU1EanV5UzduR1hMR3VrRnI3T3p5WElDaWdIbHN0T05kZjRtZ1hIYml3?oc=5,1775026800,The Fall 2026 Trends I’m Shopping and Styling Ahead of Time - Marie Claire,The Fall 2026 Trends I’m Shopping and Styling Ahead of Time - Marie Claire
gnews,runway trend,news.google.com,https://news.google.com/rss/articles/CBMidkFVX3lxTE9ZLTVFUUxnTHBLU1BEaXVyZEs3RzFzbjZlekY4ZmRWSnNsZlpXbWNEWng5YjloYVJPSnlWNEhveVByUFlScDNWX3lzNUFqNnV6ZHQ0UTF6SG1nMjU3Q2pqYlBQTWgxeG44UDJaUTU4QnlaN2lZQlE?oc=5,1776582000,Spotted: Polka Dots Are Everywhere for Spring 2026 – Shop 16 of the Freshest Takes on the Playful Pattern - Homes and Gardens,Spotted: Polka Dots Are Everywhere for Spring 2026 – Shop 16 of the Freshest Takes on the Playful Pattern - Homes and Gardens
gnews,runway trend,news.google.com,https://news.google.com/rss/articles/CBMifEFVX3lxTE04OWhwVUhhQWhKZHBLVExjVGFhTWc5TUQ3Y0RZenZwVnZ4T1ZsMTc1SVMtVG04NURacEljVkJDQXpGdHNJLVRTWkdoOGYtdmUzQzBBOVRnR1RGTVYtemVKRmpvaGp5VGZ6bUNTT3hEVGM4QlFuWF96LXpadVI?oc=5,1776322800,Ponchos! Skullcaps! Fringe Boots! Here Are the Biggest Trends I Spotted at Coachella 2026 - Who What Wear,Ponchos! Skullcaps! Fringe Boots! Here Are the Biggest Trends I Spotted at Coachella 2026 - Who What Wear
gnews,runway trend,news.google.com,https://news.google.com/rss/articles/CBMilwFBVV95cUxQSW5YV0EzYzhmRXJsVEhkXzVNZzd1T2xvVVFEclNzM0ZzYldDOEtNM0xUMk5PNDU1T21rVzRob1ZsX1kxMVFqcXcwTHQzWkJsZlFYaXNGeVV4aTZRdFBfNVd3Y2ktRUwyVHlETDVrRjlLY0VpcVJmZFJKdGZHTEJiZDhtR09VTlpNUVltSmphaS1lSlRnX1hr?oc=5,1774508400,Vintage to Vibrant: Spring 2026 fashion trend predictions - The Lantern,Vintage to Vibrant: Spring 2026 fashion trend predictions - The Lantern
gnews,runway trend,news.google.com,https://news.google.com/rss/articles/CBMiakFVX3lxTE1YZ3k3Rk1mLUhlRnkyNFY3a3BlM2FBaUozVnV2Nk40cWRkNWxfMGxQQzFkOXNZMDhRd0ZlcG4zcWp2WGdDQ2pjUVduanhWMl9FZ0t3R2o3LThyV1NBdXZNUmNsNFZ2azVhYnc?oc=5,1774335600,The Return of Romance: How Soft Fashion Is Set to Define 2026 - Who What Wear,The Return of Romance: How Soft Fashion Is Set to Define 2026 - Who What Wear
gnews,runway trend,news.google.com,https://news.google.com/rss/articles/CBMioAFBVV95cUxNTlVuVE9KMmN2WEFMX3hZZ0lLb1RBTnlTS0VidzNrOTRjQ19ZV1NwOXRRZzFla0pMa1RNdER5YjVPUmVvc3lXX3Nib0hCczFhUXIteFB4dmZYb2FiZHZNRWwtWGEtZlpfa2IwM1pmVTA1THNMNk1BcjRIanh3LWhCX3BwS2FqS25XS2hqMnZrVTh0bUR5cmRLeUtUc2V1Q3dV?oc=5,1774940400,Emma Chamberlain Shares the One Fashion Trend from Her Early YouTube Days She Wants to Come Back (Exclusive) - People.com,Emma Chamberlain Shares the One Fashion Trend from Her Early YouTube Days She Wants to Come Back (Exclusive) - People.com
gnews,runway trend,news.google.com,https://news.google.com/rss/articles/CBMiekFVX3lxTE5zdUxTWURrUkstZDRZc0xWWlhKMTRzX1p0eHB6TEMzbUk3WkM4UGxJdGUtbVN6STJObmZpNTFoZ3g2aEVsT0xtOUhSQlN5dUVRZlN3SVdfMHIxakMzV2F5X3Y1N2Q1YWlXSTJFenJpWWVsVUFIM2hXODlB?oc=5,1776409200,‘Printmaxxing’ is the new fashion trend replacing quiet luxury: 9 ways to make it work for you - Harper's BAZAAR,‘Printmaxxing’ is the new fashion trend replacing quiet luxury: 9 ways to make it work for you - Harper's BAZAAR
gnews,runway trend,news.google.com,https://news.google.com/rss/articles/CBMi3gFBVV95cUxPNktZQ0R4ZVp1OGZGTnJJUmtwWjRYZWVYaXQ2eG5iNl9KckxZWVh2ZjZjNVpZQTNkRkc2b0lkekVZRkpULU1lSFlZSFR2RlNMcWstTTNlUk9mX2dTMGhOaEVab1R4WVdkSXQ0aUVVNThGcy1vSnk3V19SM19ZaHY1VGFDS0pMaWpubHVRZUNFNTFPa21DY0txb3hYVE5LOFA3QkRUSEYzeXRVbS12cE9WMzJHc1hBNFVrcm9Tc0xqY3hxVHZSWmd0bXhHMENTQUk2d3VfNTlkZUhLdTZEZWc?oc=5,1774767600,‘Leverage the local’: The fashion trend that explains why everyone around you is channeling their inner tourist - Fast Company,‘Leverage the local’: The fashion trend that explains why everyone around you is channeling their inner tourist - Fast Company
gnews,runway trend,news.google.com,https://news.google.com/rss/articles/CBMibkFVX3lxTE81UHNiS183X0tsQlllZ3VzSDRCUkdRT1ZSV3BVR0R2ZEpwOFhCbkZWaFk0Ml9IRURQREFzakRNbXVEUzhkMnpkY0ZJX2doX2g3cDI0dl92WWx1U0h0YmNWNkM1QmVPUmdxTW84UGNB?oc=5,1774854000,13 Fall 2026 Styling Tricks to Try This Spring - Vogue,13 Fall 2026 Styling Tricks to Try This Spring - Vogue
gnews,runway trend,news.google.com,https://news.google.com/rss/articles/CBMidEFVX3lxTE9VNGVrWnFONUFOUWo1YjV6TUYyTV9mQkkyTFQyTDNYNHAza1NEcUEtZlhVb2N4OURIWDBxcGs4SFZYNUs5SGNBMTN0MUZ4aHFyeFJWS05YM0IyUW02YjNJTzB1dFczWFc0Rm9STFVfTi0tYU04?oc=5,1774422000,"New Fashion Trend: ""Toothpaste Dressing"" - On New Jersey","New Fashion Trend: ""Toothpaste Dressing"" - On New Jersey"
gnews,runway trend,news.google.com,https://news.google.com/rss/articles/CBMibkFVX3lxTE1DUkpzMnNJVmtCbU1sY1pubFBPeEtFZXJJd1I3S0Y3cUpzWTFSX29GSFZPRUdzSVFKWUVPcUVBRFI3WHQ0NzFEa0s2bWhVTVlJOHpVUzZiWVdVR0wwLWxPeTBiUG1VdnFQbGgwcVZn?oc=5,1775458800,9 Spring Trends GQ Staffers Are Shopping Right Now - GQ,9 Spring Trends GQ Staffers Are Shopping Right Now - GQ
gnews,runway trend,news.google.com,https://news.google.com/rss/articles/CBMijgFBVV95cUxNVDUxeHBOOHBDT0tiU24zdGxkYU9seUl2NllTaWtaVUpJcTVFbld6dFJJMTdHYXZfeVdVSnU1LVhsMk1kMDdBMW00cjNvemcyaHA4eEFzQTdRTjNZSjRyTUJaSlpBQVpYYnN3YTRBdnJHMW4wRkZ2QUFOYUxORnVLQll0alFZYy1PSlBRTnBR?oc=5,1774422000,The Most Intriguing Menswear Trends From the Fall 2026 Women’s Shows - Vogue,The Most Intriguing Menswear Trends From the Fall 2026 Women’s Shows - Vogue
gnews,runway trend,news.google.com,https://news.google.com/rss/articles/CBMiaEFVX3lxTE54ZmNrMU5NSy1NcWstNGVnRU5SVWJtb3ZVUkFnU1pzV012TDNRLXBNTjZ6OGVBMVNkc09KVzNacTlzT1hROFFJYzItZVJVRWFKLWUybXpxaTJnZGNaOUY4a1Y1OTMybS1t?oc=5,1774854000,Celebrities and Designers Agree: Cobalt Blue Is the New ‘It’ Color - Vogue,Celebrities and Designers Agree: Cobalt Blue Is the New ‘It’ Color - Vogue
