source,query,url,created_utc,title,text
youtube,men's fashion trends,https://www.youtube.com/watch?v=pi94dmCzLZw,1773583280,#lifeisbutadream #ekmotahathighumechala #duet #news #fashiontrends #summerfashion #unfrezzmyaccount,lifeisbutadream #ekmotahathighumechala #duet #news #fashiontrends #summerfashion #unfrezzmyaccount.
youtube,men's fashion trends,https://www.youtube.com/watch?v=1cnDHCEnp7s,1773583204,The Style Hack  How to Find the Perfect Fitting Trousers | Men’s Fashion #fashion,The Essentials: The ONLY 3 Pants Every Man Needs in 2026! The Shopping Guide: Don't Buy Jeans Until You Watch This!
youtube,men's fashion trends,https://www.youtube.com/watch?v=kIU5JSQBr8Y,1773581462,35 Ways to Style Loafers for Spring 2026 | Men&#39;s Fashion,"Loafers are one of the most versatile and stylish footwear choices every man should have in his wardrobe, especially during the ..."
youtube,men's fashion trends,https://www.youtube.com/watch?v=RXAOdt1O6ko,1773580231,5 Blue Shirt Best Combination Outfit,5 Blue Shirt Best Combination Outfit #mensfashion Your Queries:- 1. Best formal outfits for men 2025 2. Summer formal outfit ...
youtube,men's fashion trends,https://www.youtube.com/watch?v=Wt7sEB36e64,1773580161,Stylish and Classy T-Shirts For Men #menfashion #fashion,Stylish and Classy T-Shirts Under Budget #mensfashion #fashion #styly #stylish #style #fashionstyle #fashiontrends #meesho.
youtube,men's fashion trends,https://www.youtube.com/watch?v=hhMVpP0c43A,1773577861,mens caps correct names #fashiontrends #fashion #fashionstyle,MY FASHION INSTAGRAM = https://www.instagram.com/stylesaiyan01?utm_source=qr&igsh=MTdhdDBwdzM1OXFyYQ== MY ...
youtube,men's fashion trends,https://www.youtube.com/watch?v=NVvR4kfIxqM,1773569365,best colour combination #hoodieq #fashion #mensfashion #ootdguide #mensstyle #fashiontrends #best,"Welcome to Fashion Xpress — your fast and stylish destination for the latest fashion trends! Yahan aapko milte hain outfit ideas, ..."
youtube,men's fashion trends,https://www.youtube.com/watch?v=4aWFCTb2mPo,1773567129,the outfit ideas #youtubeshorts #shortvideo #fashion #fashiontrends #outfitinspo,
youtube,men's fashion trends,https://www.youtube.com/watch?v=6IufUQxeE04,1773565012,Casual men&#39;s outfits #fashiontrends #fashionstyle #mensfashion,
youtube,men's fashion trends,https://www.youtube.com/watch?v=IZs_2w7uNsw,1773561036,baggy jeans for men | fashion haul | #mensfashion #shorts,baggy jeans for men | fashion haul | #mensfashion #shorts . . . . Looking for trendy men's jeans? Check out these stylish baggy ...
youtube,men's fashion trends,https://www.youtube.com/watch?v=qWsZVJkrCTA,1773554743,Coat pant #fashion #fashiontrends  #shorts #mensfashion #viral  #trending #explore,
youtube,men's fashion trends,https://www.youtube.com/watch?v=vW6mjktMBnU,1773554055,Cargo Pant Straight fit Pattern #fashion #clothing #fashiontrends #viral  #viralvideo #viralshorts,
youtube,men's fashion trends,https://www.youtube.com/watch?v=gxOg9sZMDL0,1773553202,The Outfit✨ #ootdguide #fyp #song #styleinspo #fashion #fashiontrends #ytshorts #mensfashion #style,The Outfit✨ #ootdguide #fyp #song #styleinspo #fashion #fashiontrends #ytshorts #rich #mensfashion #style.
youtube,men's fashion trends,https://www.youtube.com/watch?v=sCHllAotpPc,1773547930,#reels #ytshorts #oldmoney #fashionstyle #fashiontrends #mensfashion #shorts #fashionaesthetic,
youtube,men's fashion trends,https://www.youtube.com/watch?v=Kw_bGVeoJH4,1773547664,Oversized Cotton T-shirt for men #fashion #tshirt #mensclothing,Oversized Cotton T-shirt for men #fashion #tshirt https://amzn.in/d/0cXaBgZH .... #viral #shorts #fashion #fashiontrends keywords...
youtube,men's fashion trends,https://www.youtube.com/watch?v=YIuv2cXe6yg,1773547033,TOP 3 GREY PANT MATCHING SHIRT COLOR COMBINATION || IDEAS FOR MEN #GREYPANT || LATEST MEN&#39;S FASHION,TOP 5 GREY PANT MATCHING SHIRT COLOR COMBINATION || IDEAS FOR MEN #GREYPANT || LATEST MEN'S FASHION top ...
youtube,men's fashion trends,https://www.youtube.com/watch?v=RXGY1mWzFqQ,1773546620,Best Jeans For Boys To Look Rich🤑|Men Bottom| #menwear #shorts,Best Jeans For Boys To Look Rich  |Men Bottom| #menwear #shorts Here is your product link (press long on the link to open) ...
youtube,men's fashion trends,https://www.youtube.com/watch?v=u6LtW49fezs,1773546234,तारा खातिर जिला जाम कब #trending #shorts #viral #song #photoshoo #fashiontrends #love #🤣🤣💫💪,
youtube,men's fashion trends,https://www.youtube.com/watch?v=aQtNtj4kL1I,1773543281,"@redmaster, cargo and tshirt, best quality and good comfortable #mensfashion #fashiontrends",
youtube,men's fashion trends,https://www.youtube.com/watch?v=8ZOBFzzyxCM,1773537625,#mensfashion #aestheic #reels #trending #usa #fashionstyle #fashiontrends #oldmoney #fyp,
youtube,men's fashion trends,https://www.youtube.com/watch?v=ktQirVOuuYY,1773537173,NEW Men’s Fashion MAGAZINE? 👀 #mensfashion #menswear #fashionmagazine #shorts #style #fashion,My new men's fashion magazine is the brainchild of almost 15 years experience in the fashion industry. This is been a dream of ...
youtube,men's fashion trends,https://www.youtube.com/watch?v=9uAnQHCFEcM,1773535370,#review #rating #ratingthings #2026 #purchases #mensstyle #fashion #trends #men #shorts #viral #fyp,
youtube,men's fashion trends,https://www.youtube.com/watch?v=gOc5kxFJNzk,1773521033,#fashiontrends #men #aestheic #aestheic #ytshorts  #fashionstyle #shortvideo #trending  #usa,
youtube,men's fashion trends,https://www.youtube.com/watch?v=DYXC67BBspk,1773516885,Perfect Coat Pant  #shortsDesigner  | Perfect Fitting SuitStylish Coat Design | Mens Fashion 2026,mens fashion mens style fashion trends men outfit ideas menswear style stylish men outfit fashion style men designer outfit style ...
youtube,men's fashion trends,https://www.youtube.com/watch?v=s9bXsuBjceU,1773515127,Best shirt under 400/- Comment for link #fashion #fashionstyle #fashiontrends #streetfashion #men,
youtube,women's fashion trends,https://www.youtube.com/watch?v=Myd5MShxxgY,1773579639,"Older Women, Timeless Style | Fashion That Inspires 💃 #styleafter50 #fashiontips #fashiontrends",
youtube,women's fashion trends,https://www.youtube.com/watch?v=TvjrTNxs_CU,1773576649,This Cheb Hasni fashion stunning #duo #fashiontrends #arabicsongs 3,This Cheb Hasni fashion duo is absolutely stunning #duo #fashiontrends #arabicsongs #arabicsongs Dive into the world of Cheb ...
youtube,women's fashion trends,https://www.youtube.com/watch?v=6qhRDN_y_24,1773576634,This Cheb Hasni fashion stunning #duo #fashiontrends #arabicsongs 3,This Cheb Hasni fashion duo is absolutely stunning #duo #fashiontrends #arabicsongs #arabicsongs Dive into the world of Cheb ...
youtube,women's fashion trends,https://www.youtube.com/watch?v=L7M3d3VaEFw,1773575646,Revamp Your Wardrobe: Spring Fashion Trends for Women&#39;s Preferences,Description: Dive into the latest spring fashion trends tailored for women's preferences! Get inspired with our top picks for a stylish ...
youtube,women's fashion trends,https://www.youtube.com/watch?v=GYCHAys_jNg,1773575552,Top Women Fashion Trends 2026 | Stylish Girls Outfit IdeasCute &amp; Stylish Short Dress Look |,Top Women Fashion Trends 2026 | Stylish Girls Outfit IdeaCute & Stylish Short Dress Look | A women's short red dress is a stylish ...
youtube,women's fashion trends,https://www.youtube.com/watch?v=KAjupio_S-4,1773573472,"March 13, 2026#fashiontrends #viral #video #girl #trendingshorts",
youtube,women's fashion trends,https://www.youtube.com/watch?v=upewteo-mvM,1773570413,Beautiful bridal dress @makeuprewaj #fashiontrends #makeup #dress #wedding #earrings #fashion 😍,
youtube,women's fashion trends,https://www.youtube.com/watch?v=2Fu8Q_xcBsg,1773568486,Wie gefallen euch die Tops und werdet ihr diese tragen?👀 #fashiontrends #fashioninspo #fashiontips,
youtube,women's fashion trends,https://www.youtube.com/watch?v=3dZ8awkq6GA,1773568007,2026 Women’s Fashion Trends You Need to Know,
youtube,women's fashion trends,https://www.youtube.com/watch?v=M1mwuLiKYdQ,1773566967,Must-See Women’s Fashion Trends 2026,
youtube,women's fashion trends,https://www.youtube.com/watch?v=8m-B04LOp8w,1773567005,Khai apna marda ke kamai🫣😎#shorts #ytshorts #bhojpuri #fashiontrends #trending #youtubeshorts,Khai apna marda ke kamai    #shorts #ytshorts #bhojpuri #fashiontrends #trending #youtubeshorts . . . Please support me   ...
youtube,women's fashion trends,https://www.youtube.com/watch?v=fzGp8O8Kjvc,1773565166,NEW SHALL NIGTHY🌙🔥 Dm 9048397539 #glowwithme #trending #viralshort #trending #fashiontrends,
youtube,women's fashion trends,https://www.youtube.com/watch?v=RFkn6Cc0_ys,1773561242,#wedding #fashiontrends #fashion #dress #eidoutfit,
youtube,women's fashion trends,https://www.youtube.com/watch?v=A_suxaVBgWQ,1773559809,These Anarkali 😍💕 #gift #fashion #trending #indianfashion #fashionshorts #viral #fashiontrends #fyp,
youtube,women's fashion trends,https://www.youtube.com/watch?v=jatZ3LDBVW4,1773559538,fashion ✨#fashionstyle 🎀❤#dreess👗#womenfashion 👸#fashiontrends💞 #shorts_video 📸💫,
youtube,women's fashion trends,https://www.youtube.com/watch?v=C5_dRB22pCI,1773558220,Fashion Tips For Older Women Over 50+ 🌷🌸 #styleafter50 #fashiontrends #fashionstyles,
youtube,women's fashion trends,https://www.youtube.com/watch?v=WliLVkzoFf0,1773557773,#ahmedabad #trending #clothing #dress #trend #fashion #fashiontrends #wedding #saree #online #ootd,A suit for your special day. ✨ Pan India free delivery! For inquiry wa.me/919978871216 wa.me/917700020272 #fashionista ...
youtube,women's fashion trends,https://www.youtube.com/watch?v=xhUbGJ1wL9Y,1773556982,Women’s Winter Accessories You Need |❄️ Viral Fashion Trend#shortsfeed #winterfashion,"Stay warm and stylish with the latest Winter Fashion Accessories for Women ❄️ In this short video, discover trending winter ..."
youtube,women's fashion trends,https://www.youtube.com/watch?v=6I-ZOHJU9p4,1773556715,Gown 🩷 #fashion #fashiontrends #wedding #indiandesignerwear #fashionstyles #saree,
youtube,women's fashion trends,https://www.youtube.com/watch?v=BQida2KnuE0,1773556523,Women’s Winter Accessories You Need ❄️| Viral Fashion Trend #shortsfeed #amazonfashion,"Stay warm and stylish with the latest Winter Fashion Accessories for Women ❄️ In this short video, discover trending winter ..."
youtube,women's fashion trends,https://www.youtube.com/watch?v=D06tclF4JAA,1773554412,Viral Chinese Street Fashion Look! #Shorts #shortvideo #beautiful #chinesegirl #fashion,Viral Chinese Street Fashion Look! #Shorts #shortvideo #beautiful #chinesegirl #fashion Your Queries :- asian fashion trends ...
youtube,women's fashion trends,https://www.youtube.com/watch?v=eVILViuhJoQ,1773554440,Desi kurti styling || Daily style || #shorts #ootdguide #fashiontrends #outfitideas,Desi kurti styling || Daily style || #shorts #ootdguide #fashiontrends #outfitideas Stylish casual outfit inspiration for everyday ...
youtube,women's fashion trends,https://www.youtube.com/watch?v=pgHjJfgcPNQ,1773553528,How to wore stylish scarf| Women outfit ideas #outfitblog #fashiontrends #wore #styleideas,
youtube,women's fashion trends,https://www.youtube.com/watch?v=gxOg9sZMDL0,1773553202,The Outfit✨ #ootdguide #fyp #song #styleinspo #fashion #fashiontrends #ytshorts #mensfashion #style,The Outfit✨ #ootdguide #fyp #song #styleinspo #fashion #fashiontrends #ytshorts #rich #mensfashion #style.
youtube,women's fashion trends,https://www.youtube.com/watch?v=2wv5hx7_cfY,1773553045,ഇഷ്ട്ടായോ 🥰 #trending #fashion #kurtisbusiness #fashionstyle #fashiontrends,
youtube,streetwear 2025,https://www.youtube.com/watch?v=pcsChpPUJbw,1773521146,Where to buy the best Streetwearhoodies in 2026🔥#streetwear #hoodies,"Streetwear inspo 2025 From hoodies, jorts, caps to the latest sneaker drops – this Short brings you the best streetwear ..."
youtube,streetwear 2025,https://www.youtube.com/watch?v=xkySoJWwVK4,1773477281,Black cat 2025 🐈‍⬛ #fyp #sneakers #streetwear #ootd #jordan4s,"short #sneakerhead #unboxing Leave me size!!! Hello! My friend, if want this goods add our whatsapp:+86 152 6026 8083."
youtube,streetwear 2025,https://www.youtube.com/watch?v=qr27RJi9Va0,1773415174,Zudio haul #zudiofashion #trends2025 #zudioootd,Zudio #ZudioIndia #ZudioStyle #ZudioWinterCollection #ZudioWinter2025 #ZudioLookbook #ZudioOOTD #ZudioFinds ...
youtube,streetwear 2025,https://www.youtube.com/watch?v=SdlQVkB_y2U,1773349610,Best Streetwearbrands in 2026🔥 #streetwear #streetwearbrands,"Streetwear inspo 2025 From hoodies, jorts, caps to the latest sneaker drops – this Short brings you the best streetwear ..."
youtube,streetwear 2025,https://www.youtube.com/watch?v=k4TOkYVTx-4,1773314100,Isis Fashion Awards 2025 – Luxury Collection Unveiled ✨,Step into the world of street fashion and style inspiration ✨. Today's video showcases stunning outfit looks that turn everyday ...
youtube,streetwear 2025,https://www.youtube.com/watch?v=V_TiKiFrYQI,1773252385,Where to buy the best Denims in 2026💯#streetwear #denims,"Streetwear inspo 2025 From hoodies, jorts, caps to the latest sneaker drops – this Short brings you the best streetwear ..."
youtube,streetwear 2025,https://www.youtube.com/watch?v=rZZw6zQbPQI,1773087119,Best Streetwearhoodie you mus buy for 2026🔥#streetwear #hoodies,"Streetwear inspo 2025 From hoodies, jorts, caps to the latest sneaker drops – this Short brings you the best streetwear ..."
youtube,streetwear 2025,https://www.youtube.com/watch?v=j1t-ie8czHU,1773086428,"Fashion Trips at the end of 2025 w/ Represent Clo, Sevenstore &amp; Adidas and Duke + Dexter",Closing out 2025 with a Manchester fashion vlog. In this video I head to the Represent Manchester store to check out the ...
youtube,streetwear 2025,https://www.youtube.com/watch?v=J3yhw4SjCBo,1772989141,Thermolite® 후드 스웨트셔츠: 2025 겨울 경량 &amp; 따뜻한 후드티 유니,Thermolite® 후드 스웨트셔츠: 2025 겨울 경량 & 따뜻한 후드티 유니섹스 단색 두꺼운 후드티 가을 및 겨울용 shop now: ...
youtube,streetwear 2025,https://www.youtube.com/watch?v=opsb6Tcq0dw,1772945509,2025 Djessi windbreaker #djessi #parisstyle #streetwear #clothingbrand #clothing #fashion #music,
youtube,streetwear 2025,https://www.youtube.com/watch?v=dUNujBny3zA,1772937040,Transform Your Home🏡 with These Must-HaveGadgets &amp; Tools of 2025!#shorts#gadget🔥🙏,Transform Your Home with These Must-Have Gadgets & Tools of 2025! #shorts #gadget Transform Your Home with These ...
youtube,streetwear 2025,https://www.youtube.com/watch?v=j12yUNOFn-o,1772896324,MRMRDurban Est.2025 – Streetwear drops you can’t miss! 🔥👕🧥 coming soon,"Level up your streetwear game with MRMRDurban Est.2025! Shop our hoodies, T-shirts, caps, and more. Limited drops."
youtube,streetwear 2025,https://www.youtube.com/watch?v=ybRe-Xpm2-Q,1772892943,2025 Camel Car Cigarette TShirt Vintage Cotton Tshirts Short Sleeve Streetwear Womens Men Motorspor,2025 Camel Car Cigarette TShirt Vintage Cotton Tshirts Short Sleeve Streetwear Womens Men Motorspor Buy here ...
youtube,streetwear 2025,https://www.youtube.com/watch?v=9_qZe14T_UM,1772842832,@fonkicheff  en Aguascalientes 2025  #dj #nestorsalazar #concertphotography #streetwear,Tuve la oportunidad de tomar fotos en la presentación de Fonki Cheff en Aguascalientes.
youtube,streetwear 2025,https://www.youtube.com/watch?v=akZSW1wfaCU,1772802916,2025 Hot Anime Arcane Jinx T Shirt Hip Hop Washed Cotton TShirt Men Women Tops Oversized Streetwear,2025 Hot Anime Arcane Jinx T Shirt Hip Hop Washed Cotton TShirt Men Women Tops Oversized Streetwear Buy here ...
youtube,streetwear 2025,https://www.youtube.com/watch?v=mN2y1kTz-MM,1772800327,Winter 2025 Hoodie,"Cold-weather go-to. Feels like your favorite weekend plan in hoodie form — relaxed fit, easy layer. Winter 2025 Hoodie - $29 (L)."
youtube,streetwear 2025,https://www.youtube.com/watch?v=Gx4drux2-Lk,1772794359,Womens Y2K Cropped Tank Top Sexy Graphic TShirt Fashion Printed Sweatshirt Streetwear Summer 2025 T,Womens Y2K Cropped Tank Top Sexy Graphic TShirt Fashion Printed Sweatshirt Streetwear Summer 2025 T Buy here ...
youtube,streetwear 2025,https://www.youtube.com/watch?v=uf7Oy3pZ8LQ,1772784149,😤 Men&#39;s streetwear in 2025 has completely changed — and most guys haven&#39;t caught up yet.,The oversized-everything era isn't dead. But it has evolved. The fits winning right now are mixing relaxed volume with unexpected ...
youtube,streetwear 2025,https://www.youtube.com/watch?v=oJe38aJ2Vig,1772753790,Best of TikTok dances if 2025 #streetwear #fashion,
youtube,streetwear 2025,https://www.youtube.com/watch?v=YP6WnIQ1a7o,1772749848,Do you prefer March 2025 dance trend or March 2026 dance trend #dancetrends,
youtube,streetwear 2025,https://www.youtube.com/watch?v=7LSPTxBUqeE,1772749565,Good Graphic Shirts you must buy for 2026🔥#streetwear #graphictee,"Streetwear inspo 2025 From hoodies, jorts, caps to the latest sneaker drops – this Short brings you the best streetwear ..."
youtube,streetwear 2025,https://www.youtube.com/watch?v=diXPLIuY6Tg,1772746957,Men&#39;s Straight Cargo Pants 2025 Spring / Summer: Elastic Waist Streetwear,"Exclusive deal alert! Men's Straight Cargo Pants 2025 Spring / Summer: Elastic Waist Streetwear, available for a limited time at the ..."
youtube,streetwear 2025,https://www.youtube.com/watch?v=aRwswuWxH5w,1772737845,Thermolite® 후드 스웨트셔츠: 2025 겨울 경량 &amp; 따뜻한 후드티 유니,Thermolite® 후드 스웨트셔츠: 2025 겨울 경량 & 따뜻한 후드티 유니섹스 단색 두꺼운 후드티 가을 및 겨울용 shop now: ...
youtube,streetwear 2025,https://www.youtube.com/watch?v=Ve5FIwhcmC8,1772722558,"&quot;2025 Streetwear Vibes: Edgy Graphics, Bold Cargoes, and Celebrity Style Icons",
youtube,streetwear 2025,https://www.youtube.com/watch?v=79I4roMWnFk,1772720151,2025 Vintage High Waist Flare Jeans Women Autumn Streetwear Y2K Denim Trousers Female Sexy Slim Fit,2025 Vintage High Waist Flare Jeans Women Autumn Streetwear Y2K Denim Trousers Female Sexy Slim Fit Buy here ...
