source,domain,url,created_utc,title,text,query
gnews,news.google.com,https://news.google.com/rss/articles/CBMijwFBVV95cUxQMHB4WDJqajBSSndPTHNaUkxmYVBFdjRMWDJhcE5zdXhuMVVRakRCbWl0aTRzUUlmckMxaVBqZzhoUGFOamd5NzNqemVwbmhFbVh4MWlsTXhXVVNtNXlhN0dJVmNab3NaRm5PTGFrQmJERTNEQUtfXzlNcUZaZWc4bkJ4dmVGQk96RVJGYnZ2UQ?oc=5,1781209347,Did Taylor Swift just predict 2026's most controversial trend? Introducing slit jeans - HELLO! Magazine,Did Taylor Swift just predict 2026's most controversial trend? Introducing slit jeans - HELLO! Magazine,fashion trend
gnews,news.google.com,https://news.google.com/rss/articles/CBMid0FVX3lxTFBQQ1JCdFBvNmhBeG9aR0p5NHd3azJ4Tk1iNFhKanlVenNDRW42Ulh2SDQyRTFWWndMQU1HeV9NVk15NmhkdGhVZllMR0M2NXJNd3A4cDZ6TXZvNzN0Z2V5TzRsYUptY0pJVzRDOVVxaVVjVC1pc3FV?oc=5,1780988406,33 expert-approved fashion trends set to define 2026 - Stylist,33 expert-approved fashion trends set to define 2026 - Stylist,fashion trend
gnews,news.google.com,https://news.google.com/rss/articles/CBMihgFBVV95cUxQZTQ4UDFsa05PVDBrTnlvRzdGUW52UWZid1lnbW55VTAybUV5ZzlLalVTZEUtYml2QzVFN1M4WUlRdktMS2FxbnotT3J5a210TnMxR19MeURGRl94ZlFmZE5sdVBPV0F4Q0lVa0dWUXV6QjZEY3hVZkJreTRsNWhJVUZJUEdwZw?oc=5,1777705200,"'The Devil Wears Prada' showed us how trends spread. 20 years later, what's changed? - NPR","'The Devil Wears Prada' showed us how trends spread. 20 years later, what's changed? - NPR",fashion trend
gnews,news.google.com,https://news.google.com/rss/articles/CBMijgFBVV95cUxPQ0RSekhweU5IOXRpeVctak5WU3djR2ltVXFEaUFHeEJ3ZEpjWGJ4MmFMZjFwSnBCS1IzR21Cb1p1T1V5Tlhwam5Uek45QlBFUGwtYmhRbnpnY0UzMzhDUk9pbEs1dEI5RWJnU21sNmhUT3FWTVdpbUpqT1k1d3NLUFFNTXFLNXR0OWtGX3pR?oc=5,1779087600,Fashion’s It Girls Are Already Wearing These Spring 2026 Fashion Trends - ELLE,Fashion’s It Girls Are Already Wearing These Spring 2026 Fashion Trends - ELLE,fashion trend
gnews,news.google.com,https://news.google.com/rss/articles/CBMimAFBVV95cUxNS2NSRi15R2dySWpCQkpZZlhtd2ttTVVHZWRFUkV4NkdmcG5aZmFueFJxaEJZLTI3RjkzbjJKTUdsS0pOa2hsZEYwaHVEa3lCdThZUkZvS2ZfUjVyNDdwQTFpSzE1MXRxQ3ZFeW1QUGZuclZnaGJOTzU0RmxHUXZWaTEzZEhneWxacFRfbm5SMWF1ekU5MHhzYg?oc=5,1781278339,Slingback ballet flats are the perfect summer shoe – and M&S has a chic suede pair for just £40 - Cosmopolitan,Slingback ballet flats are the perfect summer shoe – and M&S has a chic suede pair for just £40 - Cosmopolitan,fashion trend
gnews,news.google.com,https://news.google.com/rss/articles/CBMiekFVX3lxTE16bUc1bXVNREdzbXBOWnktTFhOSHREWXByaXR5RVM1TEJzWnpMcHRVbG1IOFg4NW5IekdOYWlwOTJZMGtuY0NPQ1haV2Fqdk5NYlE3ZmFoT0I3Q2JiNjVnbHhfS1JWa3Z5WkFWMEJvQkVTMnFDRmtycFhn?oc=5,1779519600,"Not Gen Z, Not Millennials—6 Elegant Summer Trends That Look Chicest on Over 50s - Who What Wear","Not Gen Z, Not Millennials—6 Elegant Summer Trends That Look Chicest on Over 50s - Who What Wear",fashion trend
gnews,news.google.com,https://news.google.com/rss/articles/CBMic0FVX3lxTE1DS3JyTktQOE43XzgzZmdKcHBhQ3VWZWs3bi1yMFZINURsVlREVVVOdDNYTUhaVjYzcjdXcmg5MHNUSTZvMW1NS3NpdFN0VTYweEhwQ0c0Rzc1bERzcXNIMi00RnJqQjFwX2IxVF9rRlFGYXM?oc=5,1780556400,The Key Spring/Summer 2026 Trends To Know (And Shop) Now - British Vogue,The Key Spring/Summer 2026 Trends To Know (And Shop) Now - British Vogue,fashion trend
gnews,news.google.com,https://news.google.com/rss/articles/CBMijgFBVV95cUxQSldsQnBDNDBSdktySjVpWl9MUElEb0J5Sm5rOVR6UEJ2MldYZ0NSLUtIdWZ5QXpGY19SdzIxb1AyaDhqdXY0ZjRzUmdLTGJFcmFBOW1Ra3hGLURNRGJKREZwdzFjYl9BcTZHbjBLaFNWVUp6aTZ0MERRNWRxRnlDU0pVWlRQY0FLeldtVC1R?oc=5,1780210800,My Goal Is to Look Expensive This Summer—7 M&S Trends I'll be Shopping to Achieve a Polished Capsule - Who What Wear,My Goal Is to Look Expensive This Summer—7 M&S Trends I'll be Shopping to Achieve a Polished Capsule - Who What Wear,fashion trend
gnews,news.google.com,https://news.google.com/rss/articles/CBMiiAFBVV95cUxOSThiTlhnUjhsNUdVRU15TVdhOTFuanBTRDBhamJrNlJzS3VLazNLOU9fTmltSnQtNkNGRW9JMzBCa3hZVHFzZk5faHhHMExUME03QWdPSHVXWGMzMXB1UGJtRlhvVmRtVmljM3h2RVVLYmotUThnZkZFV1FOdlBnT2YxUWlEdjdv?oc=5,1781156889,"Sidestep the Denim Cut-Offs, This Is How to Wear a Football Shirt Like a Fashion Expert - Marie Claire UK","Sidestep the Denim Cut-Offs, This Is How to Wear a Football Shirt Like a Fashion Expert - Marie Claire UK",fashion trend
gnews,news.google.com,https://news.google.com/rss/articles/CBMiZ0FVX3lxTFBZUmdWY0NOb0ZYVnptZGhrUUN4a1dRVkRyZ1Jnd1cyR05TaEIzbWdsYUtiZTllWWxCck0wMU4yemxhVW1mdGJHemt5aTR5T2FORWNTOXVDVWkyWldWeTQ5SFZlRnFMc2M?oc=5,1777618800,I’m 40—Here Are The Trends I’m Skipping This Season and What I’m Wearing Instead - The Everymom,I’m 40—Here Are The Trends I’m Skipping This Season and What I’m Wearing Instead - The Everymom,fashion trend
gnews,news.google.com,https://news.google.com/rss/articles/CBMidEFVX3lxTE9MWG45WWNWZGJYYnZLV0FxdTJ4N3BwTk5ZRUdweVR1RmFNWHhqeTh6QlZidjFqUW5Qd3VMLW5FdzNZb09mWXk1c29ZSUQ1Z0RkVEtPU0hNSGljd0dKSmc4RllySXI3X0NfS0ttUXF1SDNCSEY3?oc=5,1780630593,Where to shop the football-inspired fashion trend ahead of the World Cup - RUSSH,Where to shop the football-inspired fashion trend ahead of the World Cup - RUSSH,fashion trend
gnews,news.google.com,https://news.google.com/rss/articles/CBMiY0FVX3lxTE1ObDAtaHZoQ1hrY2NDMDVnSGVVLVZ0emN2UkxRaTRWblFVQ2RzX01KMzZWdko5ak94ZUVLMXQyc0dQd2ItLVhRa2RTNFJPYXJHZnVLTnJKNXRzLVdIZjRxckRTWQ?oc=5,1777878000,Aprons Have Gone High Fashion—But It’s Giving Me the ‘Trad Wife’ Ick - PureWow,Aprons Have Gone High Fashion—But It’s Giving Me the ‘Trad Wife’ Ick - PureWow,fashion trend
gnews,news.google.com,https://news.google.com/rss/articles/CBMi-wFBVV95cUxOQnVvd21WWklkM1ZUZ2hHZGZJbHhwcVhzbnUzdElrczNQWFpVajViNDJBcWhocmVTbm4zV0Y1YUFCbUs1NWpLYzJvY2RUT1ItTm9GZW9Vc2RTYll5R1lhR0swNnNPMzVtZkI5N25qY0ZHakNBeTVnTzJTcWYtUXFOaUdWSGlWQTV5VTNUVTV0MDRBaXpYZEw5RTFjSExRWmpLTXF3NHZic3cxekJVMHJPbzYtNnlWM0MzbjNIRkVXMlIxZ3dYc0x2NExfOEJCbmJuMk5wU0hTM0VyWUp4TWFoaGhaWE1MS1REazJmN2d3ZjRxY1VmbGltNjRTYw?oc=5,1779174000,Meghan Markle’s unseen wedding photos spark fashion trend revival - MSN,Meghan Markle’s unseen wedding photos spark fashion trend revival - MSN,fashion trend
gnews,news.google.com,https://news.google.com/rss/articles/CBMivgFBVV95cUxQeW9OOExlQjEtZURlaUdsVTN1MG00a3JvYnVBV3lhRVpmcXd3MnpVZWY4a19ZWWN6a1ZQVElqb1dMMmp6eGd0Rmo3UmVYSVB3OVQ0bUdLV1Bnd3MtNC12OTlxMXdsbkJ2ZjhBS3JLcTRGQ2FoaEFNMU1lTkVqM1lCQUdnd3RyOUNMWWJiRXhiM2d6N3JzZXc0aVdIeVE5alNVall6ekEteklBNFMyZ2hKeU5xOXFmNUpJVVdYV3d3?oc=5,1781253983,Puma unveils its new Big Logo Collection inspired by the big logo streetwear trend of the ’90s - GolfWRX,Puma unveils its new Big Logo Collection inspired by the big logo streetwear trend of the ’90s - GolfWRX,streetwear trend
gnews,news.google.com,https://news.google.com/rss/articles/CBMicEFVX3lxTE5UYnVCSXZPQjdxVzBDdldDYklCbXVzUWI0RFJGeWllTXh1WGs1TnYyZ2dHaU9NLUwyTXZrckJpMWJ4WGRGVXFTelctZ3p5bDFOYnBBS01RZVJJZTFELTl1NEJsR0N3Mk1wNUJMaEJQZnPSAXZBVV95cUxPem5PczQ3dUl2YmdnVVUtWE5IeHppV1lQdVlNNDAzdjZValBHUmhnTHVYNm91bGFhOE5MeVJqVnJuSlJLOGliY3V6OHhqOWZZMHNOaUhXYWxIMXpUU3dZLS05Qm80U192QVFJNEJkSWp6VEZmNk1n?oc=5,1780964376,Soccer Streetwear Collaborations - Trend Hunter,Soccer Streetwear Collaborations - Trend Hunter,streetwear trend
gnews,news.google.com,https://news.google.com/rss/articles/CBMikwFBVV95cUxQMkkwci11dFVBWTQxaDlWajJKcXZHNjBQb3NaM1pJd25EX3ZMN1JYRDBNWlZFX0tqLTN1a282NklpYnBNcUdOWndScy1OdWRYRFdST0RKR29WVkNSLUEwQXhXbEJCMGRlZWN6RVlmX295RGtxYmhpbVVCbUxyZDVMck1vc1paM2tkVTA5QXRtWkV6RTg?oc=5,1779778800,Is It Just Us? Or Are Swimsuits Officially Streetwear Now? - Cosmopolitan,Is It Just Us? Or Are Swimsuits Officially Streetwear Now? - Cosmopolitan,streetwear trend
gnews,news.google.com,https://news.google.com/rss/articles/CBMiakFVX3lxTFBFdFdmNFhONjVpS2Q5NEVkTXhXWkZPaW9OckhYdXBCM3kyai12QjFXbWFrajFaZUJNM29PTzVXMEhZM2U3b05uSGRPeV94UEtqaDhPQ1VXLW9kUEgzWUpSQnhXbFg3M1JxRnc?oc=5,1779433200,"For Men, It’s Going to Be a Big Shorts Summer - Vogue","For Men, It’s Going to Be a Big Shorts Summer - Vogue",streetwear trend
gnews,news.google.com,https://news.google.com/rss/articles/CBMioAFBVV95cUxQVG1WakxaazlfeHVaOUtiY1NaUmpDTjVtbzRLWDVOY2thWThHMmhWTENvV1BwcmdzLWZLSkZrcVpDZHZ5YXBJbEk1NmtCS19LeGJYMV9vczJTWXNHVWZnRXpvMEhqZUtJcXZMOG40ZmppT0NpMXZFblNuWk5RVWJERWVTU05VdjBJcFBhZjh0RUR1WWFRWl9oU3NLMEFteXZ0?oc=5,1777878000,Top Summer Spring 2026 Trends: From Runway to Streetwear - Social Life Magazine,Top Summer Spring 2026 Trends: From Runway to Streetwear - Social Life Magazine,streetwear trend
gnews,news.google.com,https://news.google.com/rss/articles/CBMicEFVX3lxTE4zV3lNZzBGejBFMnZsQ1JIVUJNQktVb3JXMkRybXZXcTczeHZUT2piY3dWNlVrRHE2LUJkV1pybHFialhEbG50WjlfX2ZjWEFjVlhYWVRuNWFrcGJBbnB2QmV3eUtjaElRNUI0bEZhRmE?oc=5,1781268527,Racer Fashion: Motorsport Style Meets Streetwear Trends - Heuritech,Racer Fashion: Motorsport Style Meets Streetwear Trends - Heuritech,streetwear trend
gnews,news.google.com,https://news.google.com/rss/articles/CBMiYkFVX3lxTE82c1JhTFBNX3RTMjdJUUVkQUxJRXAwYnJESHg2QVBBZ0MyTzRCeVlPbGRuX0xGb3M0bEtRa0JMVHZzWmNvSzhlMmVnRnZJSE5XUkRZV1U0WHJMOVJwbHF0dTJR0gFnQVVfeXFMUHF1aG1YTFF0TGxyNmRBd3BoRkxqUm9Bcl9yM2w5Y29icGdNZldzMWxKb1VhYTJGOGZjbzgwRTdXcFdwM0pKRzZMV05nVXZZbFNvaEdhMXc3c2RIeWJBa3l0UnVKR3hGZw?oc=5,1779951600,Sun Faded Streetwear - Trend Hunter,Sun Faded Streetwear - Trend Hunter,streetwear trend
gnews,news.google.com,https://news.google.com/rss/articles/CBMiW0FVX3lxTE03UzF0ZnFJM1gzc0htUURvWDJZTHY1cjNjSk42c2FhWmVLWmZIN0pzNXZrOXRVR3hsWWxCTkdKSDFHTzJpaEdxaXNZendGRU53OHhnTzVBVnc5MEXSAWBBVV95cUxQNHBtS1pSZXVnWHpCZzN1QUxlelM2T2VTWmE3WDNXZlJMUjV6R0oxZmJaVXZEVXVjcEExNWtsWlBHZXJZZW9nejV2cDJvNXcxTUJ5NVh6V1FmclhKb2RFUjY?oc=5,1778223600,Comic Streetwear Capsule - Trend Hunter,Comic Streetwear Capsule - Trend Hunter,streetwear trend
gnews,news.google.com,https://news.google.com/rss/articles/CBMikwFBVV95cUxPLWJuaER5dGxOSGM1QkctdGowY09ITmdjaUF6c0phUzgtVzFQLURudk52M3NyMFNpTWpEQnF3WUdiZGp1ZGgtdEhmeTkyc3d2cG5rWWpHMFFYdWJybkxzX2lTZU1sbThrRHR0bjhsMnhFV1gzRkFPU09rVVBKVE4tbzdYOFRqdUpETTdXbmViWW56V2s?oc=5,1779362644,Music and Entertainment Shaping Streetwear Trends in 2026 - stupidDOPE,Music and Entertainment Shaping Streetwear Trends in 2026 - stupidDOPE,streetwear trend
gnews,news.google.com,https://news.google.com/rss/articles/CBMijAFBVV95cUxPdnNKUXkySFU0RERTZlg3emctYzlOYmZrbXk4ZDh6MF9yeVhScGVmWVlOekZRTlFObVFTUFJYVWNvRE8wRUlISDY0Si1MT2dsOE9nTUJKSnhLb1g5c2duRXlmVTJleVJVTmRIRW16XzU5b1ktQjNFdG5GWFFQVUZUTktqbkN5cWIzVWdSOA?oc=5,1781035475,Want to Stay on Trend? Stop Brushing Your Hair. - The New York Times,Want to Stay on Trend? Stop Brushing Your Hair. - The New York Times,runway trend
gnews,news.google.com,https://news.google.com/rss/articles/CBMihgFBVV95cUxQVHpHbzVERFBsSi1lTG1uRzBybFdUM0dZeHFTaDFCbXBGcTlPUFR4RU96dXFDdXRYTThtVTVENXdEN2doQzhJMXRlaWpNZUE5YkNFdEhBU3FCQ0dYVjhMeEd1OWRvZ0I1QzdSeVVNd1dTZ3A1U2pxZlh6OFlvVk5WVE5mSTN2dw?oc=5,1780953848,The Runway-Approved Jacket Trends Set to Define Summer 2026 - ELLE,The Runway-Approved Jacket Trends Set to Define Summer 2026 - ELLE,runway trend
gnews,news.google.com,https://news.google.com/rss/articles/CBMiiAFBVV95cUxNVHVxZlBYNk5jZ0Q2YnNUdmxWMzVFWWxMZVFKN3dHQ1FNdEFOYmJ1b2FlTmFvQnpMcXF6SlJmcWVTRThvZVBTYmZKM3ZVRllOM2hWQmk0dzNwZHFtUng2bTA2TUM0OFZTNTZsSWdqOXp0d0xTM3dYZ0llOTJYT2ExQ3pUMmhxUHV4?oc=5,1781074800,5 Trends Cool Fashion People Are Wearing for Summer 2026 - Who What Wear,5 Trends Cool Fashion People Are Wearing for Summer 2026 - Who What Wear,runway trend
gnews,news.google.com,https://news.google.com/rss/articles/CBMiZEFVX3lxTE9RREFnNFFSSTVjaENKOEtIM2RyZ3VlclZxRjFtSlU5MUlxZ1pqU2J3cXV2TWluUW81RGJSY1JmZ2tqbjFsbjFOTUVrakc3UUFSRHN4V3RRU184dHhOMzl3NnBROXQ?oc=5,1780038000,Vogue Staffers Predict the Summer Trends You’ll Be Seeing Everywhere - Vogue,Vogue Staffers Predict the Summer Trends You’ll Be Seeing Everywhere - Vogue,runway trend
gnews,news.google.com,https://news.google.com/rss/articles/CBMifEFVX3lxTFBselMxWDVWTy0zUjBzd3MyRnp3dC1DZk41RlNGQkhCNGdjODZaS01Tdk1VbDlyajVwaFNhSW9FeVJtU04zZkVjbWcxbzl6c1dRR1RMY1RmUVhKdDVkdlpFTGE3M2dRS3FkSzNsa0k1elhINkNqeW5SZ2ZoLUfSAYIBQVVfeXFMTVNidkluYUN4SWhabHY5YmJSSk5XTWtwUWhjY0QxNUp0RVdIdHNCQ0xMdGJVSVZuSUZ5M1YydjZONDRhMG5WZGt1UjVwUGF5dDRWdlhSZmczNG9uWHZnM3hXbDF4YWVOWmRKRGptazRsMEh2SVJWRi14eTBWTVlkRUdUdw?oc=5,1781056800,Mint Is Having a Main Character Moment Across Fashion and Beauty Trends - Prestige Online - Singapore,Mint Is Having a Main Character Moment Across Fashion and Beauty Trends - Prestige Online - Singapore,runway trend
gnews,news.google.com,https://news.google.com/rss/articles/CBMirAFBVV95cUxPM0cybE9HUUhLTGtsbjhQUXB6ZzEwS0tvcndIc19jVXBqOThjSW9la2g2akV3ZExDZW9aZ3VxM1lyLWdIQVBaV05jUXE0ekpSZHBiRUx0YmZrek91NFJIX05pdXltSEVrWVdmaG5OYndkU2szdTZFODBxYmR4b0ZYTG9JS2p1ajUya1g3dURCZldfVmltQUUtb180dlBFTklIb25yZFU0ZlluTmtR?oc=5,1781112430,Jelly Sandals Are Summer's Biggest Footwear Trend — Here's How To Style them - L'OFFICIEL USA,Jelly Sandals Are Summer's Biggest Footwear Trend — Here's How To Style them - L'OFFICIEL USA,runway trend
gnews,news.google.com,https://news.google.com/rss/articles/CBMicEFVX3lxTFBsV1loektySGo1dmhuSHk1Wm81Uno2d1dyWmZJazFmbTlQeGpFeTN6ZUVDcVJpam52R2FqSFpmOUNaVWx2cU9Tc2tvWU1zYXdmcFB2VW9SalVHYUNxU1ZzWTZRcWFBY0tjdFc3SHlfekc?oc=5,1780885800,"I'm a Fashion Writer in L.A., and I’m Seeing These 5 Early Summer Trends on Every SoCal Cool Girl - instyle.com","I'm a Fashion Writer in L.A., and I’m Seeing These 5 Early Summer Trends on Every SoCal Cool Girl - instyle.com",runway trend
gnews,news.google.com,https://news.google.com/rss/articles/CBMiRkFVX3lxTE83cXc1NXRvN0tZVHl1U3RWelJYaDlmZURPWmxZVG41WWpzTE1JOWV2VXFodlFnSGF3TGRCbTA1cHB2VlpnNUHSAUtBVV95cUxPX1hZNXZQZjNXZ2d6RGtMR20tQjN3SjVkQTFYU0lMRmprQm5oZkRLQndZWTZ1a3NZNDQzNWdyU3hPU1JORmZfN20zYXc?oc=5,1780966800,New wedding fashion trend: the skirt suit replaces the dress - Наша Ніва,New wedding fashion trend: the skirt suit replaces the dress - Наша Ніва,runway trend
gnews,news.google.com,https://news.google.com/rss/articles/CBMilgFBVV95cUxNTFlmczJpSm1udW5fLWM5SFQ4eFNJV2k4bWFwY3h5LVdqeDFxR3AzZ1Zad1VVeXcxRURKVGxtT2FmUDJGeVYwbE85OEQ0eFctLUttNnAxemx3eld3Nm1MVU9KNjBORi1fb0F2aEQwOGRKYWVLLXNYYmxranRDczVObUNtN1FDZ2pXaGdoamNrWTNTcHlDVmc?oc=5,1779433200,Which fashion trend would you ban? | Talk Pittsburgh - CBS News,Which fashion trend would you ban? | Talk Pittsburgh - CBS News,runway trend
gnews,news.google.com,https://news.google.com/rss/articles/CBMiowFBVV95cUxNVFBacmpDeGZKTUNUUVg1V2xsdmFvRWF5ZU41LW1DSkN4Zk1tWWVYb1VuTkd1clFYN1pVaXkySlRWT2t4LW9OdFJkQjJybE4xRUxUak9fSWxIYmZ3djk0UndYbWw2MzNsWnl6R1VENjUtb0NSNVV3SUZqUkZDZEVmakQtLUg2VW5kMGt1WTRTSDRZVk85MVVtajNuTUJWWFdwVDZR?oc=5,1780038000,The Runways Called It—These Are the Fashion Trends Dominating Spring And Summer This Year - Cosmopolitan,The Runways Called It—These Are the Fashion Trends Dominating Spring And Summer This Year - Cosmopolitan,runway trend
gnews,news.google.com,https://news.google.com/rss/articles/CBMikAFBVV95cUxNLWZZWVRHTmlqUnFUa1Z4T0Fvdk1CMzQxNmxGQTVmZU54RWdMUDRLSmZEVTA0UnhLTmhaRi1ZNGR1MmxoTVVQalk5bUN6OHFiYWNEUV9hMHFmSlBlQVlxdmM4bll6VmNhZFpYRnJyU3ZzcnNUYkk5THBlTVBLOUhvOFpoWE91QzBXTVFlb19xb3k?oc=5,1781179226,"Soccer Jerseys, Sneakerinas, and the Sporty Trend Taking Over Summer 2026 - ELLE","Soccer Jerseys, Sneakerinas, and the Sporty Trend Taking Over Summer 2026 - ELLE",runway trend
gnews,news.google.com,https://news.google.com/rss/articles/CBMigAFBVV95cUxOX3RhbTdnY2FmT0dHOWw4YXJYeHRmd1hRaWNvWmxNT3VqQzVmWXpla1d0cEhlWnJFMmpCYlNMQktRY3pUeGJvNVhLanhEZ3laZ2JtMjlMWUZlVlpXZE9vNmd2ajhzcEdXaFM3Zm1wVmpTdnJEYkpzeXNTR0xTZXRxXw?oc=5,1779606000,"You May Disagree: I Know These 7 Fashion Trends Are ""Dated"" in Summer 2026 - Who What Wear","You May Disagree: I Know These 7 Fashion Trends Are ""Dated"" in Summer 2026 - Who What Wear",runway trend
gnews,news.google.com,https://news.google.com/rss/articles/CBMilAFBVV95cUxQZnZaUHJsZHMtUG9Jd0xTNVNidDQ2RVZLSFREMndWSkNIZmY1TUhVMldyX3BacTRzbXMwYnZlY09vd2RnUUhfLUtUSmJfSWlqSWtiWDE2bm9qOUZqMUNBSEZJcEE1V1ZuSjZ1dDNGSDZvbHRvZXZjV0FxYlpHVGVWdkZ4SU9udTJhOFhvTWZmM2cxNHJK?oc=5,1779346800,Mermaidcore Is Out—The Summer Siren Trend Is In for 2026 - ELLE,Mermaidcore Is Out—The Summer Siren Trend Is In for 2026 - ELLE,runway trend
gnews,news.google.com,https://news.google.com/rss/articles/CBMihgFBVV95cUxQZTQ4UDFsa05PVDBrTnlvRzdGUW52UWZid1lnbW55VTAybUV5ZzlLalVTZEUtYml2QzVFN1M4WUlRdktMS2FxbnotT3J5a210TnMxR19MeURGRl94ZlFmZE5sdVBPV0F4Q0lVa0dWUXV6QjZEY3hVZkJreTRsNWhJVUZJUEdwZw?oc=5,1777705200,"'The Devil Wears Prada' showed us how trends spread. 20 years later, what's changed? - NPR","'The Devil Wears Prada' showed us how trends spread. 20 years later, what's changed? - NPR",runway trend
gnews,news.google.com,https://news.google.com/rss/articles/CBMiggFBVV95cUxNVDhYNi1iRndqd0x5RTRQT21RNmwxV0pZS1Ewa19hckJ4OV9zSHFSS211SDVFbU5BUG9ieHZjWktLalp6SEpNWEZMd1BUY0swX0M1T0xkUlBQbFAtMngzNFBZX1FtcDVIVGRDdzZVWE1EdHFGdnlRTDRDZDNKNHRHRUR3?oc=5,1779951600,"Capri Pants, Bleached Denim and Summer Suiting: 7 Luxury Trends That Will Define Summer 2026 Style - Who What Wear","Capri Pants, Bleached Denim and Summer Suiting: 7 Luxury Trends That Will Define Summer 2026 Style - Who What Wear",runway trend
gnews,news.google.com,https://news.google.com/rss/articles/CBMiZEFVX3lxTE9KZjRhRnlHZVJ6REd3MjkxSXQxRnMtRXRHd1dFWUxwdWlJZWdfQUh3LVhIZXRpMjFnQ2NhVFlfSDQtMkJyaTFWQ3QxQmxqd2g0LXE2OHVSV2lWa1dKUFNDdGlHNzU?oc=5,1778828400,"19 Summer Fashion Trends to Try, From Tied Sweaters to Bandanas - Teen Vogue","19 Summer Fashion Trends to Try, From Tied Sweaters to Bandanas - Teen Vogue",runway trend
gnews,news.google.com,https://news.google.com/rss/articles/CBMic0FVX3lxTE1DS3JyTktQOE43XzgzZmdKcHBhQ3VWZWs3bi1yMFZINURsVlREVVVOdDNYTUhaVjYzcjdXcmg5MHNUSTZvMW1NS3NpdFN0VTYweEhwQ0c0Rzc1bERzcXNIMi00RnJqQjFwX2IxVF9rRlFGYXM?oc=5,1780556400,The Key Spring/Summer 2026 Trends To Know (And Shop) Now - British Vogue,The Key Spring/Summer 2026 Trends To Know (And Shop) Now - British Vogue,runway trend
gnews,news.google.com,https://news.google.com/rss/articles/CBMiigFBVV95cUxNX2dpcEhKUDdnMFp6dXlwb2RKd3QzbDV4UzVycEowaFNmWWh4dDhxUlBSUjBMMmZscnBvb25oVjU2eXdmaDZMenpFS0NfWW9iVTJzbU1ZX2NDMVpEUlFJbU9OclVQbnNncThzbS1lZGVGUVVqMzByd2FQT0c3ZG1vaHVYMFBjUUk4UWc?oc=5,1779433200,I'm a Stylist—Here's How I'm Styling the Trend You'll See Everywhere This Summer - Who What Wear,I'm a Stylist—Here's How I'm Styling the Trend You'll See Everywhere This Summer - Who What Wear,runway trend
gnews,news.google.com,https://news.google.com/rss/articles/CBMib0FVX3lxTFB0X0hPU3Y1eWpLZ2NjYVI4a0R4T05hakc4bll1aGZWNzM0dnZmSHV2SFZCZWs0c1VISndoM0hSdHRwMnRWeEtEVVdKT0lwdFBxdGNaYW1nS2VWWGtOaW0yQTlBREpqaEEzS3VRWE9Cbw?oc=5,1777791600,Ahead of the Curve: 9 Fall 2026 Trends to Add to Your Spring Wardrobe Before They're Everywhere - Who What Wear,Ahead of the Curve: 9 Fall 2026 Trends to Add to Your Spring Wardrobe Before They're Everywhere - Who What Wear,runway trend
gnews,news.google.com,https://news.google.com/rss/articles/CBMihAFBVV95cUxNNzF2RFlMSDlCSjFKTk5DckVyM0lzbU1YTzEyM0xKTVBvWTZYR3cxQUJmODVUb1UzUEdXYjU3WDBqd09sYzJ6Z051RVdaMjZ2US1WX0t3T3ZISlNBQmZ3Wmw3MFpiUFdIYVJLVGJxNC16QWRYb2Nlc0F0blYzZVdnWG4tSGw?oc=5,1779865200,I Guarantee These 8 Exquisite Summer Fashion Trends Will Earn You Compliments - Marie Claire,I Guarantee These 8 Exquisite Summer Fashion Trends Will Earn You Compliments - Marie Claire,runway trend
gnews,news.google.com,https://news.google.com/rss/articles/CBMiXkFVX3lxTE1ZYmRZbkM1UUJxV2lMVXFuaDlmV2puVnZZZE9jUS1IVkNVYXQ0cnBRaGhBU2dqeE9mMmVfMDRHU3pfaEJzeFUyUFRnNDdUZVdpMk1lalk3ZmROT3dVMVE?oc=5,1778655600,I’m a Fashion Editor—I Found All My Favorite Summer Trends for Under $150 - glamour.com,I’m a Fashion Editor—I Found All My Favorite Summer Trends for Under $150 - glamour.com,runway trend
gnews,news.google.com,https://news.google.com/rss/articles/CBMiXkFVX3lxTE5KcVVBMC1HR1JVSVhjZjlwX09sZTJOczdsYUVNQ21hZmtKemgxYUd1WUREMDJ1WnkyeXpldkxHVFhCQWUtSVd5a001T0lJckFjcVI1NFdROHBkLUwwV1E?oc=5,1778828400,G’Day From Down Under! 10+ Sydney Fashion Week Street Style Looks to Recreate Now - Vogue,G’Day From Down Under! 10+ Sydney Fashion Week Street Style Looks to Recreate Now - Vogue,runway trend
gnews,news.google.com,https://news.google.com/rss/articles/CBMiYEFVX3lxTE5UQVg5bmNOM2Z4VThRRjJwZzNTU3BmdDBYVURiUlZwdWVZV0FxdFQwQXN2cGpvb3JpME0teV9NWWltWF8wZW9lNnB4Zm9vb0FPSG16YU4yRlNzNWE1eXFoTQ?oc=5,1777705200,10 Statement Trends to Try This Spring - Vogue,10 Statement Trends to Try This Spring - Vogue,runway trend
youtube,,https://www.youtube.com/watch?v=tCy7YYvz3FM,1781390001,#clothing #ai #fashiontrends #fashion #stylish #style #summer #youtubeshorts #tshirt #fyp,,men's fashion trends
youtube,,https://www.youtube.com/watch?v=WNhdYSYOtHA,1781382472,ronaldo ❤️✨ #football #edit #fashion #trends,football #edit #ronaldo #fashion #trending #trend.,men's fashion trends
youtube,,https://www.youtube.com/watch?v=jrE6FW8ShM0,1781381028,Best Casual Men&#39;s Fashion Look,Men's Fashion Ideas 2026 | Casual Streetwear Outfit Premium Check Pattern T-Shirt for Men ✓ Trendy Streetwear Look ...,men's fashion trends
youtube,,https://www.youtube.com/watch?v=b5s3dOO70gM,1781377800,💎 Rings for Men That Redefine Luxury | PRISTINE ROCKS ✨ #mensrings #millionaire,Elevate your style with these stunning men's diamond rings from PRISTINE ROCKS. Crafted for those who appreciate bold ...,men's fashion trends
youtube,,https://www.youtube.com/watch?v=hqnNqEFN9Po,1781374479,plusize fashion ideas for men&#39;s #fashionstyle #fashiontrends #plussize #plussizefashion  #viral,,men's fashion trends
youtube,,https://www.youtube.com/watch?v=oUwmaOErUMs,1781370772,👗 Most Stylish Next Gen Trouser Design For Modern Men.#shorts #trousers #design #fashion,Trending Next Gen Trouser Design New Style Trouser Design Latest Trouser Design Modern Trouser Design Premium Trouser ...,men's fashion trends
youtube,,https://www.youtube.com/watch?v=W6AeJziAIbQ,1781364641,Fashion Trends &amp; Style Inspiration,"Welcome to Trend Era! Discover the latest fashion trends, outfit inspiration, style tips, and accessories for women and men.",men's fashion trends
youtube,,https://www.youtube.com/watch?v=ZwiAnh88r7Y,1781362844,✨Simple is Sexy in 2026 🔥#mensfashion #fashion #shorts #viral #trendingshorts,Simple is Sexy in 2026 #mensfashion #fashion #shorts #viral #trendingshorts #Shorts #YouTubeShorts #ViralShorts ...,men's fashion trends
youtube,,https://www.youtube.com/watch?v=PRPeuSbDxQQ,1781359973,Fit Check ✅ #mensfashion #mensstyle #streetstyle #streetwear #fashion #style #ootd #outfit #fashion,Elevate your everyday style with this effortlessly cool streetwear look! Featuring a classic black oversized shirt paired with ...,men's fashion trends
youtube,,https://www.youtube.com/watch?v=BR5HMQXSCCc,1781358305,Most Premium &amp; Stylish Embroidery Shirt Collection 2026 || Rowson Men&#39;s Fashion Collection,Most Premium & Stylish Embroidery Shirt Collection 2026 || Rowson Men's Fashion Collection Welcome to Rowson Men's ...,men's fashion trends
youtube,,https://www.youtube.com/watch?v=yPfZh-vX2zc,1781357750,Waffle tee. #fashiontrends #mensfashion #crazy #ootd #outfit #fashion #streetwear #fashionstyle,,men's fashion trends
youtube,,https://www.youtube.com/watch?v=nDmNqF66-sU,1781357412,best colour combination 🔥,"Best Color Combinations for Men: Master Your Outfit Colors! color combination for men, best color combination, men outfit ...",men's fashion trends
youtube,,https://www.youtube.com/watch?v=_3Xrk4UW_RY,1781355628,wait for end..😱 | The Perfect Casual Streetwear Combination #shorts #fashion #ootd #trending #yt,A perfect blend of smart casual and modern street style. This outfit combines a burgundy gradient shirt with clean white trousers ...,men's fashion trends
youtube,,https://www.youtube.com/watch?v=l5SLhVzGXq0,1781355613,The Ultimate Men&#39;s Style Upgrade 🔥,youtubeshorts #viralshorts #fashion #mensfashion #style #ootd #outfitideas #fashiontrends #mensstyle #streetstyle.,men's fashion trends
youtube,,https://www.youtube.com/watch?v=F6az5dglsHM,1781353806,cheap vs expensive things for men #fashiontrends #fashionstyle,cheap vs expensive things for men #fashiontrends #fashionstyle MY FASHION INSTAGRAM ...,men's fashion trends
youtube,,https://www.youtube.com/watch?v=6MftkuHeYgo,1781353589,Summer Outfit Ideas for Men 2027 | Stylish &amp; Comfortable Men&#39;s Fashion Trends #everydaycasual,Title: Summer Outfit Ideas for Men 2027 | Stylish & Comfortable Men's Fashion Trends Description: Upgrade your summer style ...,men's fashion trends
youtube,,https://www.youtube.com/watch?v=vN4rDTUGMTs,1781351374,The Golden Rule of Dressing Well After 50,"The Golden Rule of Dressing Well After 50 What is the real secret to dressing well after 50? Most style advice focuses on trends, ...",men's fashion trends
youtube,,https://www.youtube.com/watch?v=BizTtzvDS_c,1781349320,Luxury Men&#39;s Fashion and Lifestyle.,luxurymenswear #luxurymenswatches #luxurymenshoesfashion #springmensfashion #mensfashion #mensstyle #menswear ...,men's fashion trends
youtube,,https://www.youtube.com/watch?v=jn1RW2dw3tA,1781344895,subscribe krlo guys🧿💗#outfit #outfitideas #outfitstyle #fashion #fashionstyle #fashiontrends #meesho,,men's fashion trends
youtube,,https://www.youtube.com/watch?v=vV64br-2I4M,1781340084,stylishfits 💗✅ which one is fav 🩷 #fashiontrends #oldmoneyaesthetic #trendingnow #viralcontent #dres,"Effortless style meets modern fashion. This look features a Gray Floral Printed Shirt paired with Black Trousers, creating the ...",men's fashion trends
youtube,,https://www.youtube.com/watch?v=sUtlkAqhI60,1781337883,Spit the 7 differences ✨🔥 #chennaifashion #fashiontrends #mensfashion,,men's fashion trends
youtube,,https://www.youtube.com/watch?v=sFMsLPYHWJk,1781329810,Comment down for link. ❤️ #mensfashion #fashion #stylingtips #fashiontrends,,men's fashion trends
