source,query,domain,url,created_utc,title,text
gnews,fashion trend,news.google.com,https://news.google.com/rss/articles/CBMi6AFBVV95cUxNOFVoS0FpY2kzOFNxLVFTMTljamdnWWE4TzBOQk42Rm1Dc1ZOVGNrSTMzazcxUE5OSkdDUjA2VHNZTnd5VTl5SEoyQW93dW9mSHFqdmlQMGYxbEFJMHdZVlBreGdDR2RVRTN5NGNzRy1XT2ZVMC1ycmczX2ZCdzBiZ3Yxd2JESnFsb2Z0UEJPWUZ0d3RscVl3MDlGQ25ya2NfUFlmQ1M0d2ZLbXp5aFU3bDhyUE4xa2NCOTFfeUJwTWpkMVlsVFphZGowRFNsNTFPUEJiSXlHSE5mczF0OXdZaXNDeE1LWUZY0gHuAUFVX3lxTE5tRWI4RXV3aF91SHNKNGV5NXRCYXZySXV0d2l3ZTNQT0Y1dlo5dElRaVR1R24tczBJWEN3eHlmWDZHX1haU09xWW1XU19JUWl4YTh5RVJTcm5oRVJqNTVheGo1NzZINVRJU0pMaWlmSnc5cks3Tk5pSkc0VGkwY3ZNZ3VUaEh2MEppUDB4MjRmazFwb2JZZ0dKbjV3djJFaW40d1Foa052M2FFRWd6NTM1RkZxaW5WUXB5WGFNVUlkVWE2eG5SY3VEZTU2U0Vfd2pwZEQwcXM0NzdNclNobDhqRUJ6eEx0X0xPVGdLdWc?oc=5,1763271057,Aussies torn over ‘gross’ activewear trend - News.com.au,Aussies torn over ‘gross’ activewear trend - News.com.au
gnews,fashion trend,news.google.com,https://news.google.com/rss/articles/CBMijwFBVV95cUxQS1pOdnBYT1pJSjJnRzlSeEg5dEJ4VTU5dE8tODJvWTc5NUJyWWNNb1N5bmZMbkJwYy1EZXYzNVoycTExTlBBc1lfejZRcWd1N2NERGxMQjVPM0pVdDVsWTdJeENwXzh6VUdwc0c3dTlvbHZVblpGX04yUW9aOU9wa1N2elNMMDB1ZFhibzh2SQ?oc=5,1759906800,"Out of All the Fall Trends, These Are the 6 Our Editors Are *Actually* Buying Into - Marie Claire","Out of All the Fall Trends, These Are the 6 Our Editors Are *Actually* Buying Into - Marie Claire"
gnews,fashion trend,news.google.com,https://news.google.com/rss/articles/CBMiggFBVV95cUxPVlB3TTlGZDBOV0hydi1PRTZzc2JMem15eU1hZ1hTeHItZ25meGJ4eXFRU1pqdzI0NHdKUkxZTG5FOUJZbWhUZ0JTR1Y0NTRWTmlNSjI0V3JJUHgwUkkxYWJIUDRDSzB0Zm9yWU93NFJ5VGhWblFweHNWbE9kSzI1Q0x3?oc=5,1761116400,News Just In: These Are the Winter 2025 Fashion Trends I've Already Spotted French Women Wearing - Who What Wear,News Just In: These Are the Winter 2025 Fashion Trends I've Already Spotted French Women Wearing - Who What Wear
gnews,fashion trend,news.google.com,https://news.google.com/rss/articles/CBMidEFVX3lxTFAxNGZVS25UWjRlT0NLbUlwN0EzVzg5MUJaOTY4eFo2d3Flc1JqbFlPWC0tNklXM0JSaGhROXdrMmpEd1duZU5SbUdvSXJqOFVxOFd4YW1uQm51aFJ4ZzBpQU9PSzdSYTU1cy1FVUhSSEp6RHhr?oc=5,1759993200,Why Is Everyone Talking About Brown? - The New York Times,Why Is Everyone Talking About Brown? - The New York Times
gnews,streetwear trend,news.google.com,https://news.google.com/rss/articles/CBMieEFVX3lxTE9OYWtrUk5hQmM5MEVTR0IxVUJUQnZWNmt3cG43Tnp6Vjd2M3pqZXdBNkM2cUJ5YmR3dHItd25JSnRrRGowUW9qSHZ0ZEtuY29ueVRja2JpeHZXbzFnUUlUbVdSYmxidmdHMEZpT3FqZk5pZWplU1oxc9IBeEFVX3lxTE9OYWtrUk5hQmM5MEVTR0IxVUJUQnZWNmt3cG43Tnp6Vjd2M3pqZXdBNkM2cUJ5YmR3dHItd25JSnRrRGowUW9qSHZ0ZEtuY29ueVRja2JpeHZXbzFnUUlUbVdSYmxidmdHMEZpT3FqZk5pZWplU1oxcw?oc=5,1763387032,Holiday Character Streetwear - Trend Hunter,Holiday Character Streetwear - Trend Hunter
gnews,streetwear trend,news.google.com,https://news.google.com/rss/articles/CBMibkFVX3lxTE9YMmhvMHJrUjVESFhCaE5DeUtlbVF2bkl0MTAyeTlSd2V4bEEtTFN3MFdHcU5hQURBamx2UkpJNDdpUU5ycFA4V1ZNWlo0aVl0OXJ0X0lRbU9jcUZocVZqMEdIM0kyaFFseWVXMTVB?oc=5,1762329600,10 Fall Trends GQ Staffers Are Shopping Right Now - GQ,10 Fall Trends GQ Staffers Are Shopping Right Now - GQ
gnews,streetwear trend,news.google.com,https://news.google.com/rss/articles/CBMizwFBVV95cUxNbmxRVC11dXNQdmxPRkV3cjh2SFkzN0JDcUdSUkNaX0JoZ2tONVJyWGZiVGZ4a0lDOW5JTENhZm5yS1NXT0FLeG1BeHZPV3NUTlB0SzVlSGZZYUZ0czgxUnA1ZU16ZkFkSkkxOG5Nc3lVT2taanZBVk11OW4wRFc5Y3YwaE1DSVZZR1R2cm5sc09HZnk0UEZoQWJlc281ZFM2NTc3eU9aaGdnS0lfdV9PQWs1eWpvUVI4SUVqUENMZlZ1ckc4SlpGLTBuVVFvVmc?oc=5,1760511600,TICAL Athletics Sets New Trend with Streetwear Fitness Apparel Collection Launch - Naples Daily News,TICAL Athletics Sets New Trend with Streetwear Fitness Apparel Collection Launch - Naples Daily News
gnews,streetwear trend,news.google.com,https://news.google.com/rss/articles/CBMilwFBVV95cUxPYjFfbENZSTNsMWhHWGR4eGQzbXp4QVRMVk8wOG9xb2llV2cxX1hfN0YtUEo3VDZjRmR5MjBwTW9kdGtIeDZwaXlsOHE0NXRSQ3lETHgxVEI1THQ4RlhwVmhZOVdlRWlrWWd3VUZFRElsWVlfWnJSSWwxS29ibUlESEhrb2NDdjJvbFdjVjNXMzgzRmtkQ0tJ?oc=5,1760831049,How Female Skateboarding Is Shaping Streetwear and Fashion Trends - vocal.media,How Female Skateboarding Is Shaping Streetwear and Fashion Trends - vocal.media
gnews,streetwear trend,news.google.com,https://news.google.com/rss/articles/CBMiZ0FVX3lxTE5wdjFWemZlQlYzY3U3eHlweHNfdGttN0JOTC1DZDRaQnRTU2trUHV2OUpsdU84UkxkU1F2NUdHeGp2TE9ROGRTYU96UFJZcnRRQ0U3MHc0NEstQlRKU1ZubHRBQjdoUVnSAWxBVV95cUxQZ0hoZ051bVZWVjFjeFNSUnowMDRHUnVMaWRzb0JyTkVFUGxfZUl0UWJrSzRsaW10RHc0aGJhbU1kNV9xWUJjcFlpcXE3NW5VbjBrWXF3S21ka3ZWVWpreHBuMmJsS0lVdldMako?oc=5,1761721200,Rap Group Streetwear Collaboration - Trend Hunter,Rap Group Streetwear Collaboration - Trend Hunter
gnews,streetwear trend,news.google.com,https://news.google.com/rss/articles/CBMijwFBVV95cUxNMk5qZVNqelBNdEpZQ3JubFlTYjdOeFlKZTRKS3l0SFVRNUlNdlhiSHdXOWtFcmtDVkVwV2VRdGNHT0tEVTlMMXJPZWFqamk1S3NVYUF5NVUyQ0ZJSXhEN1FiaVViUXdLV0lQTXM2MjR0TlZva1Q2R1dzLU9BazhTYkNHdXBKNmpoMVZxOFFuUQ?oc=5,1759820610,How to Style Streetwear: Trends & Tips for 2025 - vocal.media,How to Style Streetwear: Trends & Tips for 2025 - vocal.media
gnews,streetwear trend,news.google.com,https://news.google.com/rss/articles/CBMib0FVX3lxTE9JeWVaZXA1N3FRdEdrNHV0WGNabGRhZWJ4MWF2S2ozN1BwOFA2Z1IwY0JVTi1QM3BGNmJ5YmlZeDZIdXhJMlczUGVTcHpHNXpEcDNDaFQ3NXNRajdTNlExTFphdVVkYkxieVZhZDFkY9IBdEFVX3lxTE5GOEtOVEdaWUtSODN3WVNlNkR4WGFBcHF0SzNVajZQZWVkNWNzOWlQRFJBMXhzTEl4aUlzLUJkQ0M2N01MclpITTVsRk9xNDd6bDVSU1B1NTlKVnZiemhib2dQeTlWWkJvTHhJbTRHMm1ITno4?oc=5,1760511600,Basketball-Player Streetwear Campaigns - Trend Hunter,Basketball-Player Streetwear Campaigns - Trend Hunter
gnews,streetwear trend,news.google.com,https://news.google.com/rss/articles/CBMizgFBVV95cUxObXZzVVpvVWhLVVhJYXJSMVdISHQ1UlFuaGhMMEQxUTIyTC0yV1pBby1VTmd5Y2p6ck95Uzk2M1FiN0Q0V1BNMGZ2YURRUWxwcWdtWXU5TDNwOXZsU1kzZmQ1c3NYa0NudXYxSmlJS2lMQ3hjWGotOV9MT3lyYnFmaUVESWF5WVByeXNJMVVFMzNrY1lMT0JpbnhoRFZDVGVRQmpucm5nUnZaQ25ZMnoxRTJISUJrYTVrVkpVV2wxbG10RGVTM19GeXJxS3MxUQ?oc=5,1760511600,TICAL Athletics Sets New Trend with Streetwear Fitness Apparel Collection Launch - Worcester Telegram,TICAL Athletics Sets New Trend with Streetwear Fitness Apparel Collection Launch - Worcester Telegram
gnews,runway trend,news.google.com,https://news.google.com/rss/articles/CBMifEFVX3lxTE9ndVBlLTlsYy1uTjJ3eWhmWXRPcHYyckpRM0hHMnJieUR0UnF5UGNjczZOTDNuTVI2Z3lIUEZpektKamtkdXEyY204dVlJQ09wVGpkTG5kM1ZibVpzNXU4MXNZSmxRZkpFYjUxQlJsdjVhNTFoTV9QREZodWU?oc=5,1763337600,The State of Fashion 2026: When the rules change - McKinsey & Company,The State of Fashion 2026: When the rules change - McKinsey & Company
gnews,runway trend,news.google.com,https://news.google.com/rss/articles/CBMigAFBVV95cUxNblYxcUwwclltbmtwQjJqendvcjVIeHVrQjVfSUhDdjlhNnZEWE5qa0RiNHExaElCWWpCMUVPbUFhekxzN2s1M1U1TS1vRERCbjZ4SUh3WXN3VTBSY25VcElRT1hQUjQ1UFVmQ0psdGZpc0pRSWM3cGNqa21JaTc4Wg?oc=5,1763278200,We’re Almost In The New Year—5 Winter Fashion Trends I’m Leaving Behind In 2025 - Who What Wear,We’re Almost In The New Year—5 Winter Fashion Trends I’m Leaving Behind In 2025 - Who What Wear
gnews,runway trend,news.google.com,https://news.google.com/rss/articles/CBMickFVX3lxTE5fVDdzZ2UtLVRSVlNFbTFpRGgxYzZuWnpMTFp1Yl91YUEtMFBJbFB4QjE5cWdXck1wcTdqaHJPV3Z2NnYycHV0a1JtVlVXUS0xV3VPbVVyNWFkdFc5MEZfV3U2dWZCWi1JTG5DYV80ZWVVZw?oc=5,1763149952,It’s the Season of the Ugly Shoe - ELLE,It’s the Season of the Ugly Shoe - ELLE
gnews,runway trend,news.google.com,https://news.google.com/rss/articles/CBMikAFBVV95cUxPeDZjSWFUNlBjOU5PZVJxYWhtdWhrcWx5ZGJDaG9LcVFmM1VzWlk2XzZOVUdQRlFZSm5HMk04b1M0VTAtOFJWWU94YkxfdmlOdGtYSEd2VUp0RmNOWDRyOGZuYTJGOVdIUENoWDVlcFdmS0lrWkVUZ0kwRElfcUdOaE9VdjNVY2RIZTRIdFI0Zlk?oc=5,1763383778,Gloves Fashion Trend 2026: Layering & Opera Gloves from Runways - nssmag.com,Gloves Fashion Trend 2026: Layering & Opera Gloves from Runways - nssmag.com
gnews,runway trend,news.google.com,https://news.google.com/rss/articles/CBMijAFBVV95cUxPRVI3Ym9HbEJScDBEUmJxdkZraElxSXpCYzU3X0lsSkNzYjdUQnFFcDdaWmxxdHNNSG9QZk5WX3NGYU9uRnBRRHg2QlhySEh1OWdBMmZmb3owaElXNmlPVzNqTzZqRjV2bUg4MTF0NWNCOU1HcUMyN0ZLSV9hOVh1aEx5bzRJb2VsMGRCeQ?oc=5,1763156860,5 Winter Shoe Trends I’m Spotting Everywhere Right Now - Cosmopolitan,5 Winter Shoe Trends I’m Spotting Everywhere Right Now - Cosmopolitan
gnews,runway trend,news.google.com,https://news.google.com/rss/articles/CBMihgFBVV95cUxPVElyYnB5eVR5OHg3ZEtxMkQ1dE14N2ZIQ1p5b3FQbnRWY0tpc19wVC1kZlJnLS1iRmxROWpIZjloX0RtV0tCLThVQkpLZkk0X0tMSF9Tc2Q0SzQzMlBRR28yeEczSjVlR2lTeGNmYi1US2Y4N3NSWHp6NmhRajFpbUZVSlBPQQ?oc=5,1761548400,I Can't Stop Thinking About These Runway Trends—So I'm Making Them My Own This Fall - Marie Claire,I Can't Stop Thinking About These Runway Trends—So I'm Making Them My Own This Fall - Marie Claire
gnews,runway trend,news.google.com,https://news.google.com/rss/articles/CBMiggFBVV95cUxNZlVCdGhCbkZGWnVrT21YaFdmOHlMbGpOLUtlWHBlbTRFbDd5a1RlQk5YckJtNC1Jc3lOTjVlYVdCbDNRYVdFVE44eFlUM3dzNkVtUDVTUlZGM3MxMmJWUE9qVHFPamcxdWlURlhyV3JRVW9sMHNwejRWdXNTZVJ3S3RR?oc=5,1762329600,6 Fall Fashion Trends That Are *Actually* Wearable - Katie Couric Media,6 Fall Fashion Trends That Are *Actually* Wearable - Katie Couric Media
gnews,runway trend,news.google.com,https://news.google.com/rss/articles/CBMiXEFVX3lxTE94UExZZTdrSE1TWUx4cDc5aXV1cUxIb3FpZzhrN2Zwb2hIakV1aE03X0ZiVXU0SS1pZDRma2RheWd5b3NaZHdDWXJTTFg2NmxacFRKUjA2TUU0aVNN?oc=5,1762066800,Granny Print Is the Next Grandma-Inspired Fashion Trend Emerging in 2025 - glamour.com,Granny Print Is the Next Grandma-Inspired Fashion Trend Emerging in 2025 - glamour.com
gnews,runway trend,news.google.com,https://news.google.com/rss/articles/CBMiqwFBVV95cUxQMGJmMWtITmNpMS1zdEhMeDYyV0g4RmI0cXhxYUNnZDdtbmthem5LRXRjdXF1MEl0MHdONzNJWl9YNHBwX0g2UFhpUXlkQmFRNHRCSm9wSVdGdzdHZEx6bFR1TFNaWEg2bzJYVE04OXQ5eUtTQ0xZbUtIY0p5dXh1Wnc5N1QxZWRQZ0w0aW44SDlIV0laVHZOblE3MFU0YTVNeXVIWHF2UVJDd3c?oc=5,1762502400,The Gen Z Fashion Trend That's Baffling Apparel Retailers - Forbes,The Gen Z Fashion Trend That's Baffling Apparel Retailers - Forbes
gnews,runway trend,news.google.com,https://news.google.com/rss/articles/CBMiY0FVX3lxTE9BR3ZGSm0tTUNUUHhGSkVzU2hzUnF5eVlDSjNUUVRTa212QkhfbjlhRG9WX255YS16amhpbE9sbkJCRVd2Uzg0VG9zZ3h6akRwUE01Z3dncTBPczJDcXhUYnhYMA?oc=5,1759906800,The Spring/Summer 2026 Runway Trend Report - Coveteur,The Spring/Summer 2026 Runway Trend Report - Coveteur
gnews,runway trend,news.google.com,https://news.google.com/rss/articles/CBMihwFBVV95cUxOQ0REcGhoX2pQZmpsaTVxd0x4ajI0TmpJNFdPdGJyakNWZjJBaS03M1lUd0UwZXV0cXVMYVc0ME9UeFJPbThPU3ZBT1dyRzBjS2pid3JGclBmMUMwVWFlVktZQU9TamlTeGZKbVlBN1NoUEJ2V29OZi04eUlGSDh3WGVlQVFpbjA?oc=5,1763277385,Is a Reform council setting a new fashion trend? - NewsBiscuit,Is a Reform council setting a new fashion trend? - NewsBiscuit
gnews,runway trend,news.google.com,https://news.google.com/rss/articles/CBMibkFVX3lxTE9YMmhvMHJrUjVESFhCaE5DeUtlbVF2bkl0MTAyeTlSd2V4bEEtTFN3MFdHcU5hQURBamx2UkpJNDdpUU5ycFA4V1ZNWlo0aVl0OXJ0X0lRbU9jcUZocVZqMEdIM0kyaFFseWVXMTVB?oc=5,1762329600,10 Fall Trends GQ Staffers Are Shopping Right Now - GQ,10 Fall Trends GQ Staffers Are Shopping Right Now - GQ
gnews,runway trend,news.google.com,https://news.google.com/rss/articles/CBMiggFBVV95cUxQUEVZZWZqcmhSMDMzRGFpcy1XSXdmWTAwY0YxVGJvNHdyS3ZMT3NXY1hBeERvWUdCOWd6UEIybGxJcFBISEliTFRHZWg4NnlGcWowbVItTERkdEpDSWtfNFcyQWNQa2t3SHc5bDZrZUVYcFhjYkNHYmoybzRYMjNrcUxB?oc=5,1763114400,"If I See You Wearing One of These 6 Specific Shoe Colors, I Know You're a Fashion Person - Who What Wear","If I See You Wearing One of These 6 Specific Shoe Colors, I Know You're a Fashion Person - Who What Wear"
gnews,runway trend,news.google.com,https://news.google.com/rss/articles/CBMihAFBVV95cUxOUUVBUEVDdTBUdmxjWWtFNzI2TFAyX2NTNEI0M2pya2dfOURnb19MRTBONHpLalNNb2pHcG13T0FhVGR3bTRRbDhoUEtpX2RZclFWQXp3U3dFbl9DTVRFTFJVMkwtemFnYi1FeHhVUTJpOGo2a1BPZkIyOVdKaEZHYnE0UWs?oc=5,1762156800,The Winter Trends to Start Wearing Now—Before the Mainstream Catches On - Marie Claire,The Winter Trends to Start Wearing Now—Before the Mainstream Catches On - Marie Claire
gnews,runway trend,news.google.com,https://news.google.com/rss/articles/CBMiZkFVX3lxTE5LaUlMc1VCNXJ1QUlBX0JXOFNJWkxFVVRHRGQtVGZJSGdUM19za24yWWhsaUx5dllfRjd2cDNqdE5zRHd1ZXdHSXhfZG83WUxGa3RCWHpUZGdHWkN0VnF4MXNYZzRudw?oc=5,1760943600,Fashion’s New Obsession? Clothes That Swallow You Whole - glamour.com,Fashion’s New Obsession? Clothes That Swallow You Whole - glamour.com
gnews,runway trend,news.google.com,https://news.google.com/rss/articles/CBMiggFBVV95cUxNWUtDdXdGTFVoaXhaMk5nU3dhUTdpQk9RNHRfaVpuQ2p6cVVIREtKVzNDUkR4c0lYQ1JINFp3RjkwX19tUWdMV29VUlhfZHJnQ0hwYkxHSjdQZVV0VHFOdTZXZm1MM0RhYkFKRGQ2cHlkMG4zQVlkYkctaGZyR2V0ZU93?oc=5,1763280000,"The Runways in New York, London, Milan, and Paris Confirmed These 6 Coat Trends Will Be Major in 2026 - Who What Wear","The Runways in New York, London, Milan, and Paris Confirmed These 6 Coat Trends Will Be Major in 2026 - Who What Wear"
gnews,runway trend,news.google.com,https://news.google.com/rss/articles/CBMiggFBVV95cUxQejBIaVlmWXIxMl81RGJlNjVJalhTcGpMYXdvOWxvalBlV0dFY0hiZXdSamJtR3B3Vkw4ODFDSEZfQXE5RUMyQ1UwZ01mcWkxdURoWVhCcFNPd2JfdENyXzdmVEw4WDdHYXVGR0E3TjVXLWR5bW9XXzYxYzc5aUJqaFB3?oc=5,1762156800,12 Autumn/Winter 2025 Fashion Trends That Will Dominate This Season - Who What Wear,12 Autumn/Winter 2025 Fashion Trends That Will Dominate This Season - Who What Wear
gnews,runway trend,news.google.com,https://news.google.com/rss/articles/CBMihAFBVV95cUxQRFpWbWo4dThmb3dtY1hrX19oaVNjM2VUems1M1ptX3B2SVhZTVVQZGd3SEY0RGZFVTdQZ09ZWm9nSXZyVU1QZmxfRkNCY3dBUjNDTmk0ZDMzRDl0VndyQVVCLWdTYWtjT0JpY21zOG1JZkxPNk51cjdRV0lYRzZqdU1ybUo?oc=5,1763100000,"Sorry to My Heels, But I'll Be Wearing These 5 Winter Flat-Shoe Trends From Now Until Spring 2026 - Who What Wear","Sorry to My Heels, But I'll Be Wearing These 5 Winter Flat-Shoe Trends From Now Until Spring 2026 - Who What Wear"
gnews,runway trend,news.google.com,https://news.google.com/rss/articles/CBMikAFBVV95cUxQaEJiWm83SmZaQkFkTDIwa2c1RGtHNXlzcDdLek1QRnlySjRLakxYZjgtV2I3ZHh0R0FQcVFFM2hFdDExeW9FZzZMbU9zMlpyRzdveFBfWHNOcEVtOS14WndXQ2xVc1NvektTR1gxUFF0U0dVZkZsUjNOaGlETEpDZG1RcEdGWTZpNWtTWGVhaTI?oc=5,1759993200,I Just Got Back From Paris Fashion Week—These Are 6 Key Trends I Know Will Matter Next Season - Who What Wear,I Just Got Back From Paris Fashion Week—These Are 6 Key Trends I Know Will Matter Next Season - Who What Wear
gnews,runway trend,news.google.com,https://news.google.com/rss/articles/CBMioAFBVV95cUxQcFpUZHZMWXdJd0FWRmthQjVhckdYcnhZSDE0TmNBX1pDdWt1dFJGbVNwMkZHOGxjalJZb3QyVUtUZHZCTjZLdTZDOHR1QXFLcGxZSjNqUHlDNUtUN21NNXd2ckdHT0dFbnByMk1aMWlJY1o0clBLM3lYZGJqc0c5SFllMXoxQVdlaF9WdjJFdi1HdTFiOXVUNFhMLWdELXdl?oc=5,1760338800,Our Favorite Trends from Paris Fashion Week - Harper's BAZAAR,Our Favorite Trends from Paris Fashion Week - Harper's BAZAAR
gnews,runway trend,news.google.com,https://news.google.com/rss/articles/CBMiZEFVX3lxTE9KZjRhRnlHZVJ6REd3MjkxSXQxRnMtRXRHd1dFWUxwdWlJZWdfQUh3LVhIZXRpMjFnQ2NhVFlfSDQtMkJyaTFWQ3QxQmxqd2g0LXE2OHVSV2lWa1dKUFNDdGlHNzU?oc=5,1759820400,15 Fashion Trends To Try Out in 2025 - Teen Vogue,15 Fashion Trends To Try Out in 2025 - Teen Vogue
gnews,runway trend,news.google.com,https://news.google.com/rss/articles/CBMihgFBVV95cUxNaVBySmRXRTczOG9WNkpiZWZmOVNhVlhRZS15Sl85Uk9hSmhsUmVSam9FakpXNVZ4Y2xiU1lvS2ZtZmR4OENMQTVSU29HaHRzMkw0aklNN0xrOGJPZVBKdjJ2STQydEJsTkQxWG5ENkpaZ2dyNXpSWFBTaUNqZXNCSXhWSE1TQQ?oc=5,1763444617,Bella Hadid Sheer Dress Ignites New Wave of Transparent Fashion Trend - Zoom Bangla News,Bella Hadid Sheer Dress Ignites New Wave of Transparent Fashion Trend - Zoom Bangla News
gnews,runway trend,news.google.com,https://news.google.com/rss/articles/CBMicEFVX3lxTE5OUHFIc094WDR1c3IzY1RMMFJQcFZWVjBiVU83NnMtd2JITTZ5THJoOHBONlZrTW5FYlNpUk1TQWE4OEtHSEZOQm1GVVExSk45d1U0M1hNbnBiTjN5eVkzUnVXM2d2ZUJVNnRVUXkxWU8?oc=5,1760684400,The Biggest Spring 2026 Fashion Trends Allow You to Choose Your Own Style Adventure - Marie Claire,The Biggest Spring 2026 Fashion Trends Allow You to Choose Your Own Style Adventure - Marie Claire
gnews,runway trend,news.google.com,https://news.google.com/rss/articles/CBMigAFBVV95cUxOcThXX2FoMGh2cTVFWmRyWU5hekhCMlB3bEwzMjFIM2xXeU9GVU12NzM3X2o2VlR0WEtqUnRKRUpZUkFXSE9McWhYeXJrZV9tQnJrUkVabEFoOTdLSVkybGwzUUt5VHVsQkk5Y1RYYzQ1RWNVdG9Yc3BvMHlIV0xuZw?oc=5,1759906800,Spring 2026 Fashion Is Running It Back to the '80s - Marie Claire,Spring 2026 Fashion Is Running It Back to the '80s - Marie Claire
gnews,runway trend,news.google.com,https://news.google.com/rss/articles/CBMiX0FVX3lxTE5NdTNacTFZOXNvZmJmbGhLQVRUampoYVJsVmVQamQ2Zk5nTnVtZE96WmdBVlhPeW05QXQxanJLV0VsWlVZdGQ0eUY0RlE5aFR2VEcxZk1nODNBbEJnMDg4?oc=5,1760338800,"Horse Girls, Rejoice: Equestrian Fashion is This Fall’s Defining Aesthetic - The Everygirl","Horse Girls, Rejoice: Equestrian Fashion is This Fall’s Defining Aesthetic - The Everygirl"
gnews,runway trend,news.google.com,https://news.google.com/rss/articles/CBMikAFBVV95cUxNN1BxOVZSTDNYTDJuVU1iYU1md0QyY0ZfZGNBOS1VTzA3U2V3bElzNzhfWlA3dmZacWVVcGtjV2JYRm54djB0ZTIySjBpQnU5eFg5Z3BOSUw2Sk5nUjFUR3JfUjRneGtTMlRTSDRkNDFHajNrR0lhWHhGOFU0bVZ6U0FBcHpIS0FhRmJKSGNVZ04?oc=5,1762502400,TikTok Turns Bull Nose Rings into 2025 Fashion Trend - AGDAILY,TikTok Turns Bull Nose Rings into 2025 Fashion Trend - AGDAILY
gnews,runway trend,news.google.com,https://news.google.com/rss/articles/CBMiggFBVV95cUxOZ3k1a053U1ZQdEsxbFFMcWQtdkpDX1RIMkR0WkdJbElQWWtPaEc2Vm43bHkxcUpSLXRSekJZeHlfUE55Sm5DMWhXd2NJVXdzbGx5QXJzVno2ZkhydHhEclRZam1ENDlIX1JLOFh6Sk1remcxMEJhNGFMNHNwdXhTVXNB?oc=5,1762495200,How to Nail the Coffeecore Fashion Trend - Vogue Arabia,How to Nail the Coffeecore Fashion Trend - Vogue Arabia
gnews,runway trend,news.google.com,https://news.google.com/rss/articles/CBMifkFVX3lxTE52dTVmdHJ6Nzc4QXpnY2RDUUVWQ2Z2ZGtYYm9sVmV3ZktCOVFUbFphZWZNc2phNC1CeEtDcDd2Qi1XZjU2a0ZxQ0JVNFNjMWJEcWEzMzdZeXVuTDhhNGxKb0dPZEw2ZkNkNE1VUXZpVG03a24tZklxcjM3bE03UQ?oc=5,1759820400,The Best Fall Fashion Trends to Shop Right Now - Harper's BAZAAR,The Best Fall Fashion Trends to Shop Right Now - Harper's BAZAAR
gnews,runway trend,news.google.com,https://news.google.com/rss/articles/CBMimgFBVV95cUxQVXBtSHN6VGp5eEF5QUFwZzlLSEZzbGRuZ1ZlbHNRaThtRUZhanFfc252WXpnZTU1UkdISjNOaGhWQ0E5ZXhaUU5pcEhsX1JQUWU1Z2x0eW9hRzVtaWVqMm1POUJSUnFUYUxuQlpEcl9MbGtoSEtlTzc3SVVPeUlTVnpOV2VORDR4OU5Xd1pBQjI5ZnJKT1BiMUZR?oc=5,1759906800,Parisian It Girls Have Spoken: These Are the Street-Style Trends to Know for Fall - Marie Claire,Parisian It Girls Have Spoken: These Are the Street-Style Trends to Know for Fall - Marie Claire
gnews,runway trend,news.google.com,https://news.google.com/rss/articles/CBMifEFVX3lxTE51TGNCN1E1TW92VThxVm81Z1RkbllVZVkwdHgyRXBtY2R5UmNIcF8wOHh3UGl2SUh3RGdNVkdSdGVmRE1uZEJOYTlXa0dVZVFBWVdteHpFbXk0TzM2c2laWWZaVmpyWC03bXgweDJMQjlKdVNaaGVLUTZFYnI?oc=5,1760079600,These Are the 6 Biggest Trends to Know From Paris Fashion Week - Who What Wear,These Are the 6 Biggest Trends to Know From Paris Fashion Week - Who What Wear
gnews,runway trend,news.google.com,https://news.google.com/rss/articles/CBMikgFBVV95cUxQamFqR1VyTzdlcGluVFZlY2JFMVJSSFpoTnBxNE9yQmJMdXg1UlgweXY1dkktQUdwSTdTOEFibDRUZzRtOU5OV2UtMWdkMkJkRXh0N1oyOHBBcXdtWHl0N1phNzlwNF9uQU01RlpEbEZVeXJCY25NY0JPbXZBeGNyLS1YTlUzLWNCUjEzTG9SZWxwUQ?oc=5,1760684400,Fashion Insiders Say Chocolate Brown Is the Color of Fall 2025 - ELLE,Fashion Insiders Say Chocolate Brown Is the Color of Fall 2025 - ELLE
gnews,runway trend,news.google.com,https://news.google.com/rss/articles/CBMifkFVX3lxTE9CdUY5enkwOHV4aU54aHo1alg5RGRDSkt6SjNJM2UtLVNCbExGM3BOMDdsOHh2YjJjcVhabkxuZnZtYkF0Vi1lNTN3djAzX25KSnM3SjVhZUoxanluaUpkYlZXSTFKNEdXOFNVQ0VkVGJfS1hQYXlCSER3SkUwQQ?oc=5,1760857200,7 Minimalist Trends To Steal From The Most Recent Runways - Who What Wear,7 Minimalist Trends To Steal From The Most Recent Runways - Who What Wear
gnews,runway trend,news.google.com,https://news.google.com/rss/articles/CBMihAFBVV95cUxQdGtLczgzN1NNZFlkNzEydDJWcWllMWZoS0ltQ2x5LVFhSlJHZ2ZYU1ZLUzIwRG5HUURJblJCRWNPUmFlMzV1emZtMjYxZmRBcjQzTmxkZWp5ZGltdlQ1c0lPbzlWN2d0M04xTnlreWM3VkUyYm1YaUI2U0lnOUd1WmM2a28?oc=5,1759820400,The Unexpected Handbag Trend Taking Over Fall Fashion - ELLE,The Unexpected Handbag Trend Taking Over Fall Fashion - ELLE
gnews,runway trend,news.google.com,https://news.google.com/rss/articles/CBMiowFBVV95cUxQdWVTbkpzSEh2Y24tbjlwbEwwTE9fQ2ozREtpeEpvTE5icTYxejMxSzRLSEtRU01McU1RZ29RaThBcEdpdmtWeklnTW14eDJKX2Z5VmhWdUJ5ZFc1bWY1R3dDNl9sMDZfeTRLVnBfZTVMYUJ4QWxlZ21zazJRTkNoZzhLRE1palJ4dWVrbHBqbmNnUEpscUg2ZUlIYi1tQ1puVTI4?oc=5,1760079600,The 2025 Fall Fashion Trend Inspo You Need For This Weird Weather - Girls' Life,The 2025 Fall Fashion Trend Inspo You Need For This Weird Weather - Girls' Life
gnews,runway trend,news.google.com,https://news.google.com/rss/articles/CBMipAFBVV95cUxQbTVXdmktV0NQOUE5azRoY0ptb2xOVU0xeDNxUzMzT0dxclpzMDhtSWoyYlJzN2VFOXlxWmQ4QlhlUkhKeGJSR202ejd5ZWtMNDF4TFJKamFCLUtsX3FKV0phSGVuVVo4RW9sbE1FQmJsY2ZuYzZ4bDMwb19xdENENkVJR2U5VkpOeFZnQTFmZVQzTFF0bzZjQnMzbS1FWGYtTEhGYw?oc=5,1762959513,This very old-school fashion trend is back — and even Kate Middleton is wearing it - AOL.com,This very old-school fashion trend is back — and even Kate Middleton is wearing it - AOL.com
gnews,runway trend,news.google.com,https://news.google.com/rss/articles/CBMi3AFBVV95cUxOMUxwZ2oyREpBcGtFcWNydTQ1d0UtZE5rMnRQZjh6ODY1MHV6NG1kbFhVVmx4aV9TcURVMklIdmh6VUxkeWExdmJDVWlGN1V5eWVpR0xZbnRCOUZRR1JUUDVYYUhSblozbHFYMHRZcVJpUVlOR0pjWlNOWGU4ZDk2bkJ2V2Q1MmoweVJpNGxtdFQ5WG5wZUpFN3lpcm80WjlxNnJackdWemxzNUhKOGdwa1ZpMlRqM005WGhmRlFTTFk1VU5nMnBBQ2xNX0syal9JUHRyRG02N21hS3dj?oc=5,1760511600,"The Spring 2026 Accessory Trend Report: 175 Bags, Statement Belts, and Nouveau Flip-Flops That You’ll Want Next Season - Vogue","The Spring 2026 Accessory Trend Report: 175 Bags, Statement Belts, and Nouveau Flip-Flops That You’ll Want Next Season - Vogue"
gnews,runway trend,news.google.com,https://news.google.com/rss/articles/CBMimwFBVV95cUxObzA3T1laRTZqSTZmZnFuY3hXQjg3dWtkeUJVb1hPTFE4WEpnMjRDSTJKM0gwbkJROEJpamJhS2pHemkxSnpwN0ZJWjZmT1RXNnZCdFNndFBlVjhZdjItVDdjUHNjSDZIUk9JZGs2REhCWmRSMGJ3YTA0alRUSnZneWFadEhlZzQ2ekFxUDJVMlBiYmJ2RV9XTFlMRQ?oc=5,1760450784,Layers with texture are this fall’s fashion trend - Golf Digest,Layers with texture are this fall’s fashion trend - Golf Digest
gnews,runway trend,news.google.com,https://news.google.com/rss/articles/CBMirAFBVV95cUxPcXI3WmdENm9iOF9rckNQWmZRYllKblF0S3ZmanVuZ2pQYmwySmtjMlpTMmxFcERKTlNXTDRpNmlScWRvYktLbWRoMFJxUzYyN0REdnljTHNNbWI4NUxwbkhibE5nVUh6ZFo1SGthTWJFSGxwRXhPTFB4bzJsekRURlF5Ykg2ZVVHTjRIRW1Rb2gtUTBwUUhkV3JwR09zdGR1YTRSSV9iZFVBblNG?oc=5,1760598000,"Opulent, Humble, High-and-Low: 10 Jewelry Trends From the Spring 2026 Collections - Vogue","Opulent, Humble, High-and-Low: 10 Jewelry Trends From the Spring 2026 Collections - Vogue"
gnews,runway trend,news.google.com,https://news.google.com/rss/articles/CBMiogFBVV95cUxNSUZMTVBIY0JxMjVEMVFQajhxREhtOGRYb0l2S0kwenpYV2Vfb1paZmJZTGQ0RkluQUt3Y0J3TWt2OFNoR3JRNl82Zm0zdWhOMXlsNEdpZlhVMmNYdXkwVGYzTnk5bEFFd0Q0TWo3ZlFneS1lSllBUEluakp6WUEwOEdseWRxV0daaWNmcjlValQxWFlsSjJmdVp3Tzd5LWVpbkE?oc=5,1760079600,A New Fall Color Has Entered the Chat: Burgundy—Here’s How To Style the Wine Red Trend - E! News,A New Fall Color Has Entered the Chat: Burgundy—Here’s How To Style the Wine Red Trend - E! News
gnews,runway trend,news.google.com,https://news.google.com/rss/articles/CBMipgFBVV95cUxQRF9ua0VUcm1sM0h1VDRtVGUwNnVCWUpVR2R4eVVtLVlVYTJuT3VFV0RuX1BuQ3FpZUl6Q2x0WGtxeHAzMzJ0emNDWF9RQzVFaXBMeWFCSlJTMFNUU0dabElPYk0tUjZsVUdScWFKSzZxb3VxM1pNcmowVW4xQjVkQi1yTW9MTUVjNFdQTk9SM0VaY1Rfb1UyUHBXcEc4OE83cllFN0hn?oc=5,1760338800,What Are You Wearing? The 11 Street Style Trends of the Spring 2026 Season - Vogue,What Are You Wearing? The 11 Street Style Trends of the Spring 2026 Season - Vogue
gnews,runway trend,news.google.com,https://news.google.com/rss/articles/CBMiZkFVX3lxTE1jOURfZmdoRnB6VFFRWjdjdWJSLVpob1ROU3VvWm9iVU9fRHBzOGpVelNYN0lFR1VBYldVZDFLamhKbnlpY0UwdTJNSzZkdE8tbWNqUVJIRW5OTG1wd2s3aGtLSmhfZw?oc=5,1760511600,How to Nail the Western Boots Trend Without Going Full Cowgirl - Vogue,How to Nail the Western Boots Trend Without Going Full Cowgirl - Vogue
