source,query,domain,url,created_utc,title,text
gnews,fashion trend,news.google.com,https://news.google.com/rss/articles/CBMijgFBVV95cUxQRXBqR1dOaURJaFFxZF8xME1XRmxpNmhILXpQUjZtbnNkTlF5UFdWd0hhYlBfMHB5eVh6c3ZaSlpNM2ZudW9tY0xPR0dCNDc2Yk9iejBpMFIyQ0xJSmtBNXQ0SDZVLUw4Q1pEUXVSSUFONzRvVm1YTzR5ek9uU1psaW5ib3dNamNxdllpSXNB?oc=5,1774875387,3-31-26 is smoking returning as a fashion trend? - radioplusinfo.com,3-31-26 is smoking returning as a fashion trend? - radioplusinfo.com
gnews,fashion trend,news.google.com,https://news.google.com/rss/articles/CBMidkFVX3lxTFA5WWhxN1JpVVpzTlJCQ2VwZDloNkF0NHU5VmUxaTE4c3NwZ1lISEZBbDdjWGVMZ1VOX0RUUlUwbHdXRUp0R3B5MWNhZ01fTFU5Q2FrMllFYVpXNVF3M0k2TG1Pd1pQb3FpWXdmWkNKWUlYa1Jfc1E?oc=5,1775005449,The ’90s Are Back—These 5 Handbag Trends Prove It - elle.com,The ’90s Are Back—These 5 Handbag Trends Prove It - elle.com
gnews,fashion trend,news.google.com,https://news.google.com/rss/articles/CBMiswFBVV95cUxNcURGWDFibEwta3R0WEZadUZTclo4VXVmYnQ1NDlQalBQcEtXbk9SS3FfcTFQblJ1d1ZtWDhac1JTNjF3dW9GR3Zrc3NZMnphcU02S0xKMDJuTDY4V3JUX1ZyNEJYdkQ3N1hBUVRfZEhGVTNfMjJETjV0bmFueThfc2M2bmVMSEw4MVJaRWY5d241b0lLYW9DQkFtVUREdlFteXl6aEtBWlRuQW9TaktZMm1qZw?oc=5,1774649888,"LSU women's basketball fans turn game day into fashion trend, boosting local businesses - WBRZ","LSU women's basketball fans turn game day into fashion trend, boosting local businesses - WBRZ"
gnews,fashion trend,news.google.com,https://news.google.com/rss/articles/CBMiekFVX3lxTE1QNTNsT2FUZG9EdU5GQ19PeTJiUnZwTTBiM0FuVVFmZnlsS0FhZEp6aFNTV2FReGdUZjNWUFp5NHFJRkNsQTFDWUczMXo4Y0tFc0tpR1JVcnJBdURpczFVUHBrU2xySk9QNEtNNENEdWt0UkNOazBxMjRn?oc=5,1774335600,11 Sneaker Trends to Have on Your Radar for Spring 2026 - Vogue,11 Sneaker Trends to Have on Your Radar for Spring 2026 - Vogue
gnews,fashion trend,news.google.com,https://news.google.com/rss/articles/CBMihgFBVV95cUxNTUktZE5wMkpWVHR2LUtnRzc3X25Wd2U0M1pZbVNrSUhNVnNZOGtXSndDVWlaY3oteFdfa3JZUVBkQWlfMkNRYlZHMUFXcHJ1ancxVzV6cHJGbGR5WmZMRDVMMDl5dUtDS2JNLVMtM05FV01xSWxyOGR2Wmp3R1NIN3pNZUhWQQ?oc=5,1775217581,"Ballet Flats Redefine Menswear as Fashion Embraces Softer, Gender-Fluid Styles - The Impressive Times","Ballet Flats Redefine Menswear as Fashion Embraces Softer, Gender-Fluid Styles - The Impressive Times"
gnews,fashion trend,news.google.com,https://news.google.com/rss/articles/CBMiakFVX3lxTE9DenZITE91UVV1d1Q2SjhxX3NzeEZFbWc1RXRnckVGWnVHbFJNMjZSb0RyX2p6VkpMRkJvTnZMRnVWWUN6NVgzcmF0ZmFGbFZ4Q2JVMG9NNnBOUDRWRDhzTjdkRXRkRTRMVHc?oc=5,1773298800,7 Spring Fashion Trends — Thoughts? - Cup of Jo,7 Spring Fashion Trends — Thoughts? - Cup of Jo
gnews,fashion trend,news.google.com,https://news.google.com/rss/articles/CBMikgFBVV95cUxNRkYwOVhZVDNFVE5HTzFlTkV0TllJOE1FTlBDeERJRGlxdUhTWEZESjl3WEp3X0puWXJiOHlnNk1iMVpHTXlqOFRuMHEteHZ1clFNQV9jZm5xMjJpemY4VFVac2h6UGN0b2g3SUliRDVYTWFHMXVmWVhkMV9mcFhQT1o4cnVvOTU1UW1Gd3c5blZvdw?oc=5,1774980754,Jeans Don't Have to Be Blue—Here's How to Style the Latest Denim Trend for Spring - Town & Country Magazine,Jeans Don't Have to Be Blue—Here's How to Style the Latest Denim Trend for Spring - Town & Country Magazine
gnews,fashion trend,news.google.com,https://news.google.com/rss/articles/CBMimgFBVV95cUxNeDQ4LV9WY1d4VmJGOVlnRExuSVdQM3dYNHBJSTJWZnB1QllkdEdjNnNZaVhfaWZaRWRBdzRsekFrWFlIZlFpOWxURTNrZ3BjVDdLS0lTdkEzZWJqaUppRExNRHB2NzM1ck1mOXJQeHBSOHhpQWY0OFJ5SHJQSG0xSWlDU0pwd1d0WktMVmpHbUFGRE44MC1sYkRR?oc=5,1775134557,Why Bubble Dress Fashion Trends Are Suddenly Everywhere Again - Elle India,Why Bubble Dress Fashion Trends Are Suddenly Everywhere Again - Elle India
gnews,fashion trend,news.google.com,https://news.google.com/rss/articles/CBMiZEFVX3lxTE1NWXgxd2VfZ19XcUozdGQwX08zR2sxTjBFTDBvOFRsZkxEMDE0V1VJR0JpRmQ3ZEdrSUNrZ1p4bHdBSUdIQnN6Sms3ME5HUjNGX2MxdjY5bnlHb3haVnpIbEdoWmU?oc=5,1775196000,"Peep-Toe Sandals Are Back—and This Time, They’re Actually Cool - Marie Claire UK","Peep-Toe Sandals Are Back—and This Time, They’re Actually Cool - Marie Claire UK"
gnews,fashion trend,news.google.com,https://news.google.com/rss/articles/CBMiqAFBVV95cUxPRTVOWWZyc0dZUEtWZVZVbXRwZG9tUXVTY0tKdnF4RWg3OF8ycWNWU3l3dW11elZ6RlJ4aGZiTWF1cDdBcXphNXk3RDIyM1BFLWpBcHo4ak9LeDVTQ1dEM2JJbTBpXzNSY19seGlaczBnRVBYTElzVjhFdDA5amt1dzgxdWpMU29GdWlRYTB1WFhhcGIzRjdHaHB4endfai1URWo5Z25jZXU?oc=5,1775067353,This “Anti-Pastel” Color Combo Is Everywhere Right Now - Marie Claire,This “Anti-Pastel” Color Combo Is Everywhere Right Now - Marie Claire
gnews,fashion trend,news.google.com,https://news.google.com/rss/articles/CBMijgFBVV95cUxNazJYNVNINU9MUmtQNkVkM3dlNDIzSE5pXzJhMFVRSHdsRkg1cXVneVEwM1BUYnBHMlNPZjlsUUNsZ1RsNjQ3Q1JIZ3RMUjc4WjcxOWwtZHFRbHFHQXQyUTlmdlFsY092LWlPR0NZYlhUNnFmb3FsWnpUQ0JYVGFxdERkbWF0YVBOZ1RmNDFR?oc=5,1773817200,The 11 Fashion Trends That Define the Fall 2026 Season - Vogue,The 11 Fashion Trends That Define the Fall 2026 Season - Vogue
gnews,fashion trend,news.google.com,https://news.google.com/rss/articles/CBMiX0FVX3lxTFB2T2M5VnI2NmFNbTZEQUtDVE1qTzRFT1dKTTZHNHpfdFdLRFhZN0lGZnN0TWRUNHAxbXpRUEhiMkMtbFBpSHBHLUJVRnA0dHJldGVnTW0yLUZ2UEItMUtR0gFkQVVfeXFMTU5wV0Zmc3h3c191dlNqSVFHY3c0QThnQ2NDWl9sQlNIb3U4RzRlNUVfaVA5VnhFNi1ISUhRaDhFYk9SWVAzYmg5SDNHWUZOT2pSMzdkdDRQNVo1bjk5WUtyZ01BOA?oc=5,1775155387,Invigorating Spring-Ready Fashion Campaigns - Trend Hunter,Invigorating Spring-Ready Fashion Campaigns - Trend Hunter
gnews,fashion trend,news.google.com,https://news.google.com/rss/articles/CBMia0FVX3lxTE5ia3VCRGlDOVVJU1QyX3BMQXAxeVlENjJVVC0wdWxncXlLZzdoajFpTk5XWTFzLVR5eUVSRXZqTy11Y2RaWU1ZUWIyWlI1b002YlRMaDFuRmpQUldaRFdNd2I3cmlSUGJxVDU4?oc=5,1773903600,5 Spring Fashion Trends Everyone's About to Be Wearing—And How to Style Them Now - Camille Styles,5 Spring Fashion Trends Everyone's About to Be Wearing—And How to Style Them Now - Camille Styles
gnews,fashion trend,news.google.com,https://news.google.com/rss/articles/CBMisgFBVV95cUxPQTdUdzRxb2oxaGxxQ010QU9KQkNPcjdoWTZGVE9GVWo0OFVKR2wyakxXcVMyNkJhTWYza0pwckpzemg2OV9aeGxFeVJyUlA4dk5IdDJsbHBvcVVGcHdYQ2YxeThKN0s0Q1NQeFBsYURmZ2pKR2VXLU55MUV1eEhQM1BnVTJOV2Y3OHdSa2NzNmZTU201Z3dWWmIxOTJCSzZVN29LWVBpVnNmNlNEeWV3NTNn?oc=5,1775142656,I Can’t Get Enough of Spring’s Jacket Trends—5 I'm Shopping in Nordstrom's Sale - Marie Claire,I Can’t Get Enough of Spring’s Jacket Trends—5 I'm Shopping in Nordstrom's Sale - Marie Claire
gnews,fashion trend,news.google.com,https://news.google.com/rss/articles/CBMiiAFBVV95cUxOeDRvWF9sYjYxMWduYkFzSEtVNjVVbENzaUgzNWdJd1FDSUpEVGVscXk0bDJSX2c0OXFodklBVjhsWFRzdEtHMzVkc1YtSDFKTGg4OV83VUVubEdvTVBOT19FNHNtUUc0MHVQSndLZE5jOXFGMUlYUE1TaGd6bllsVFlXV0hXblN5?oc=5,1774903973,"Just in Time for “The Devil Wears Prada 2,” Cerulean Is Trending - Harper's BAZAAR","Just in Time for “The Devil Wears Prada 2,” Cerulean Is Trending - Harper's BAZAAR"
gnews,fashion trend,news.google.com,https://news.google.com/rss/articles/CBMiY0FVX3lxTE9EQXBCWk9fNHYxREc5Ry1GZ2VYbVFfYWtWeF9ONEE5YUpNWXpNS3lRSEFYejgyaWVfS1UwVDZ0ZGlRd25HSmlmSkxQNGQ1aU1Nd2dvOE9maDRHU0VkTXNocG1EVdIBaEFVX3lxTE5INzVLbF82UDFOZW9TQUxJREJ0M2g1WXlpTjRhQ0VWb19hd1lCTmhGWTRSM2FYT0NnNFIyOTRYeHdrbWRQU1JJUkJwWEVMaXRoc2lKU19EN2VReEEwT3k0YkpJV1FNZ0o1?oc=5,1775112629,Actor-Fronted Sophisticated Fashion Campaigns - Trend Hunter,Actor-Fronted Sophisticated Fashion Campaigns - Trend Hunter
gnews,fashion trend,news.google.com,https://news.google.com/rss/articles/CBMie0FVX3lxTE1KYUJnN0VRUzdLRXp3bXF0OTBNZmNLNnFCdS1Rek9EX0g4TmdQQl94MENjNUxmMEJvekY0ZGdBRnVhQ3daZkxWQWV2NExmUUlOY3Q0RE1XaGpzc0I1STIzQzZTZkJXRHltekpzd1NuMm5wWkh3dEhWVi1iQQ?oc=5,1773644400,It’s Nice to See (Some) Actresses Wearing Dresses They Can Breathe In - The New York Times,It’s Nice to See (Some) Actresses Wearing Dresses They Can Breathe In - The New York Times
gnews,fashion trend,news.google.com,https://news.google.com/rss/articles/CBMilAFBVV95cUxPUmZmVGpnUTE5bmUtZzY3MExmcDg3OXJwbkFsS29YeVRvbE94bUotMDlnNS1LRG5SOU04R0ZzVS1rd3dSVHlCUmlkLWV5YWxBTUZPNU9aQlpKcWI5OThRTnRaZEVydFVjZ0FsZkljLURWU1J0ZTk3alRjYkNBTlllcmF5UEswWk5fWk5DN0t1WklwMTZ6?oc=5,1775081120,"When Everyone Is Wearing This Backless Hybrid Shoe Trend, Selena Gomez Is the Reason - Marie Claire","When Everyone Is Wearing This Backless Hybrid Shoe Trend, Selena Gomez Is the Reason - Marie Claire"
gnews,fashion trend,news.google.com,https://news.google.com/rss/articles/CBMiX0FVX3lxTE9xb1llb2t5QWF1cjhKamU3LUF6VEpPY2ZZY04zR21TejNNUVhBM1hTRzJVSHZvM1N0dVVyU3JGU2lVTThzTTdLTXUzckNhdmctN1lNbVRWdFM3TmhXRkVJ0gFkQVVfeXFMTmd3VFVHQ2NaYW1sZUMtenFlYU1wV2FEUFJCbXBNYW1SODhmbXdZM293ajI3dWtPVmpSSnRFMlpCM1Y5Zy10YVJhb3E4ZlFWYVBPYlRkTlpkYzdLa3h1NWU2T0UwQw?oc=5,1775013136,Ultra-Sophisticated Luxury Fashion Capsules - Trend Hunter,Ultra-Sophisticated Luxury Fashion Capsules - Trend Hunter
gnews,fashion trend,news.google.com,https://news.google.com/rss/articles/CBMipgFBVV95cUxQbnhkM2VvRy1uek5PakJoMHpHM3lwVHhRSHhna082R0pIOVdhaUUxRTRmd3VURXdwVnQ5c2VQSHRHVFFaMG93TWNDYWp6U3o0a05uQzM4RWc2aW1hd3FVSndTOHJKU0JVaVdxalVJR0RrVmR4VFh6MERydmNLcndnel95cHBGMmJRS05FUFRka0VmWjA2d0xnSS1iM0RvTTJiSjRfMGp3?oc=5,1775035969,Synthetic Eden - Spring/Summer 2027 Colours (Superzoom) - FashionNetwork - The World's Fashion Business News,Synthetic Eden - Spring/Summer 2027 Colours (Superzoom) - FashionNetwork - The World's Fashion Business News
gnews,fashion trend,news.google.com,https://news.google.com/rss/articles/CBMibEFVX3lxTE01R1BhUUptaHZrMGk4YzYyRlVoUHJqdlVmcEV0aDkwNkEzQW1FTVF6WjVCSGFzOVdZNENkVGJiSFc4dkZfLURhb3h1VjNMd0hXVUZIMy1Mck9sMDFGVWRrM2NTaUQ3VFhnajJQYtIBckFVX3lxTE1HWFBLVTN3ZzJERGVKbVUtTlFnX1pxNmkya1M2M2JWeFNkNFFmZHQ4TG5maXJvVm9RLVNZYTduVTdCZVdiRHlFSGM5a3llLWk5MUlmV2xfR0VqMjJuaDlDSkE4MnJ2amFLVzM4MDRXU3pXUQ?oc=5,1775151487,Women-Empowering Photograph Campaigns - Trend Hunter,Women-Empowering Photograph Campaigns - Trend Hunter
gnews,fashion trend,news.google.com,https://news.google.com/rss/articles/CBMihgFBVV95cUxQRXRvcnA3WHpRd2YxZG4xaG5mc1prS2Jpem9DMjJIZXF4WnFKTzFMNHpjVkdtUUZWaVFHeVhtWTZ4ekxoUFNYaktoV1JYN2gzT20zUklCUlhTRkE0dmlfXy03LVlHN0czbUExUFI4Njl1QWlUcy05Q0pDN25WZ1FEM0ljdTBvQQ?oc=5,1775134800,Clodagh McKenna proves that double denim is the spring trend that doesn't go out of fashion - Woman & Home,Clodagh McKenna proves that double denim is the spring trend that doesn't go out of fashion - Woman & Home
gnews,fashion trend,news.google.com,https://news.google.com/rss/articles/CBMitwFBVV95cUxNRXZ5RE56VGx3Vmd6WXdyREQyQnlVYUlBTVFYcHYwMDEyN0tldko5eGxETVV6VGVOZkRiN0VQSW96VkdzMDEzOVFjY2NmTjc5d1ZaZUp2R2hUQVRnMXFzeFhKQTd3UkZJbjktckh1cHljSjhxcUZ6ZnlIY3YtbDBfMWJ6R1prTEd5T2tJMjdXYjNINlpUOFRBNnhlTHB0SnB3TVZSa2NvazZJeG80aWV4TXpzbVRZa2M?oc=5,1773644400,The Real World: Fashion Week Edition—12 Top Street Style Trends of the Fall 2026 Season - Vogue,The Real World: Fashion Week Edition—12 Top Street Style Trends of the Fall 2026 Season - Vogue
gnews,fashion trend,news.google.com,https://news.google.com/rss/articles/CBMiZEFVX3lxTE9KZjRhRnlHZVJ6REd3MjkxSXQxRnMtRXRHd1dFWUxwdWlJZWdfQUh3LVhIZXRpMjFnQ2NhVFlfSDQtMkJyaTFWQ3QxQmxqd2g0LXE2OHVSV2lWa1dKUFNDdGlHNzU?oc=5,1772870400,"17 Spring Fashion Trends to Try, From CBK-Inspired Minimalism to Texturemaxxing - Teen Vogue","17 Spring Fashion Trends to Try, From CBK-Inspired Minimalism to Texturemaxxing - Teen Vogue"
gnews,fashion trend,news.google.com,https://news.google.com/rss/articles/CBMijgFBVV95cUxQUmk1TFRTRnZTckd5UzJ5X2hRNmRkMHloYXd1NHlvV0FsaHFxb2MwdHVVaU1ETW1XT3JNbmkzTEpnOTh6WTRwXzR3Vl85emhBMDNBUXFLNVVUcmhYR2t0NlhhWnhCV3BJY3RGZ3d5a3pYVkd4dGhGUWdfb0ttOUluM2hNRmhNSW1KTVZrbUJB?oc=5,1775113347,Rugby tops are trending and Next's £19 blue & brown striped style is in the biggest colour combo of the season - Cosmopolitan,Rugby tops are trending and Next's £19 blue & brown striped style is in the biggest colour combo of the season - Cosmopolitan
gnews,fashion trend,news.google.com,https://news.google.com/rss/articles/CBMimAFBVV95cUxOcjhjNGl0d19hT3lGbjNNRmJ0WkRNYlV5WVgtdEY2dEkyY1hFSmJVTzNVSDAxNnBxbTh0eWVIX0kxenhxTXVGZmZWRy15eU8zbGVTd0JJQzdTYnFYQWpLaWNRQUJrcm92cjRna3B1Y1FmRllOU0ZRa1pEYjBualoxV1dIcGo4NjBmLTVzc3M3ZnVLRG9PT0pqYQ?oc=5,1775137280,"Drop-waist dresses are the flattering, easy-to-wear spring trend – get the look with Primark's £16 design - Cosmopolitan","Drop-waist dresses are the flattering, easy-to-wear spring trend – get the look with Primark's £16 design - Cosmopolitan"
gnews,fashion trend,news.google.com,https://news.google.com/rss/articles/CBMilwFBVV95cUxNTUVFeXdHVGp5V3dYZFhmZTA5VTh1ZFFlMUM5MmRZcnZqTllxTTJjelczVW1zeUJXTVpjSlVtMHlEQVVCSE9RcWc1S25mYm9wQzVzeTg4dzlJaDNZSVlDLWdVdmw5cXM1QllZdl82TDFWYk42aTNJTVlta1pZV2twRmdnOFZiNEVydWg2NmJWYUpmWDBoQkUw?oc=5,1775056390,"Embroidered blouses are a pretty spring update, and M&S's £36 red and pink collared design ticks off 3 trends - Cosmopolitan","Embroidered blouses are a pretty spring update, and M&S's £36 red and pink collared design ticks off 3 trends - Cosmopolitan"
gnews,fashion trend,news.google.com,https://news.google.com/rss/articles/CBMilAFBVV95cUxPYUo2RjdqVnFPU2dLa0JkZnRzR3M0dVFhNXFSQ1BqdzVpTzNPTU5zMUZQWGNuaGUyMUdEc1Y5d1VUcTBNeDBQN00ydnJPalVHX1o2Z0RzbU85N1JRb2ZzZUtNblVncUoyaTNzYmFybWxENXA5Q3lwTF9pRC1ZRWhjSjdQcmJwU01JUUtUdU1ZMzIxR1hz?oc=5,1772438400,Breaking away from the fast fashion trend cycle - The DePaulia,Breaking away from the fast fashion trend cycle - The DePaulia
gnews,fashion trend,news.google.com,https://news.google.com/rss/articles/CBMiiAFBVV95cUxQVjF0VjhyQnREakxYZU9ETnFtNWoyM1YwcV9xbGxZYlRVaTZqSWlhc3NKZHhoeExNV29TaldJaG04c1VOVzJQcEdPbGhXV2RTUHU2a1hsS2J1OG1OZ1pWempSNW9fcElIQ2FJNFZ0RW0teDczdk4tallZVnVMd2p3cWtnTGZvM3FW?oc=5,1774335600,Prep! It Coats! Sex Appeal! 10 Trends Set to Define Spring 2026 Fashion - Who What Wear,Prep! It Coats! Sex Appeal! 10 Trends Set to Define Spring 2026 Fashion - Who What Wear
gnews,fashion trend,news.google.com,https://news.google.com/rss/articles/CBMikwFBVV95cUxPaTg3UHlabF9GQlFTSVdjdlAtSUpyUVdZclFYUmlNR2t4V3BJMXVqVDAwUk9wLVhBanNuRkRMNnR1cl9Lc3JaRE9kVXpSVjhKYlNmclZRbGxqT2ZyN0dxbkRwc0dTa01keTNrbEM4SzNpRUlMSk9sZUY4VzR1Nk92NnZ3SU1ieno2dkk0aGdNeUtCQTg?oc=5,1774950909,"A leather jacket and jeans is a failsafe formula, these 10 outfit ideas will help you nail spring dressing - Cosmopolitan","A leather jacket and jeans is a failsafe formula, these 10 outfit ideas will help you nail spring dressing - Cosmopolitan"
gnews,fashion trend,news.google.com,https://news.google.com/rss/articles/CBMiggFBVV95cUxOcVlmNFJoT01mOWJmOFNBanVROUcwcVk1cnh2WjJxNFhaVi1lRTJzWlZ1WDlSV2VEMGZlUmNqNndKYTNSY1hwMXYwT0k1aVdraVlMZnNKb0VHbXJpRWliYjhHX3A4WmlSbXUwTTl3UmVGN2o4OXY1c2dNdmFhMzJWT2J3?oc=5,1772956800,16 Spring/Summer 2026 Trends Everyone's Talking About - Who What Wear,16 Spring/Summer 2026 Trends Everyone's Talking About - Who What Wear
gnews,fashion trend,news.google.com,https://news.google.com/rss/articles/CBMivAFBVV95cUxNbmRMX2tPempTQTZKWHRDcU9YcnNBS2VEbnlkS0Z4UEtQdktxYTdnYkdoNmtjanMtMHR4MkRvY2ZQT3FSc2xVWXVjSzhZUWlyc0ZtQ1drWGJlU3JEMERfWE54Wm9jVHdBeERnbVlyeUtwZThaU3NNN1BWbnY5bE42cXdXQ0NiWTR0WWZvMDZFREQyaWpWRHM1amllMHFLZ1hvUlQwTkFNOERKc1Y5c3B1UmxMQ0daUW44empwRw?oc=5,1773385200,These Fall Runway Trends Look Straight Out of Carolyn Bessette Kennedy’s Closet - elle.com,These Fall Runway Trends Look Straight Out of Carolyn Bessette Kennedy’s Closet - elle.com
gnews,fashion trend,news.google.com,https://news.google.com/rss/articles/CBMiwwFBVV95cUxNMUlZSGRKWEcxaUNGellYYVRUMkNSUWRZZU83SC1rNkVhczE3eHl5dkstZHFvRXBydjdSTnZhQmFtclNKRVYyMHIzNlczNHo2NE13SVYzWVRDNlBzVU5ySDMyNE1yRHNVQWMtdGZDa05yY2tuczlwMnNfMkpaRmM3a2duaW1BQlc4RFZRcU9sN2ZUcWtoQnM3UHhaU2JQNzJySXRUWnNUVEQzQmZEMUhQOXMxQUZic3gtbldDVDhENWQ2c2M?oc=5,1775113080,"Move over, It Girl. It’s the era of the Lit Girl: Have books become the new fashion trend? - The Straits Times","Move over, It Girl. It’s the era of the Lit Girl: Have books become the new fashion trend? - The Straits Times"
gnews,fashion trend,news.google.com,https://news.google.com/rss/articles/CBMilgFBVV95cUxPUU5ES05WLUtPQTdNTWZyNXdzSmlVUmlTUF92aGxVU3AzREwwek85MDZRWU4wYzNhbVZwZExUZ0U5Smh6MEp1ZzZmVmhNUU43bFhhRkJ3TzF5bE15TGJyY0lBSHFicTZqWnNTTVJnQVF5ay05SVVvSTQ0bHRnYnl4SHR0alB3ZEhHMlNGZjg5RGo3aWR0VkE?oc=5,1774940400,7 shoes to wear with straight leg jeans for perfect spring style - Cosmopolitan,7 shoes to wear with straight leg jeans for perfect spring style - Cosmopolitan
gnews,fashion trend,news.google.com,https://news.google.com/rss/articles/CBMinAFBVV95cUxNdmVmdU1HcTdQcGVXZDN4TzNaYW4xZkViMEdLLWc2Mmg0d3VZQ1AwUVhEa3AyNTk0ODM2S2hsYjRld3UyaU9WLXdJTFJkZGNsanpYRWF0NEY2VkZVd0tRcV8wRFplYlVIOHlxZnRnZ0w1U2g1NWxhZzF3aXZkVFA5X05vdm0xcS1XWWE0TWRhSnVoTFUyOXhsM2JFdEw?oc=5,1773039600,A Fashion Trend Defining the 2020s? Tech Billionaires Crowding the Culture - goodonyou.eco,A Fashion Trend Defining the 2020s? Tech Billionaires Crowding the Culture - goodonyou.eco
gnews,fashion trend,news.google.com,https://news.google.com/rss/articles/CBMikAFBVV95cUxOekt1SlNLMDBaaEl5MzhHQndtQlZNSzR4OHljUXhPOHgwSlN6Ym92OGhiMEZtdTl0bDZvY1M3QWlFUmlQaWJrTGRLWC1qY3JZZlF5SlBEX2ZwYmZmTlhpS2Z4TFRqemJ4eWJmekZuaVkzamJxUkt5MnlsTnBuZ0VaZkExMGhQLTZ5SHh0ZXBLX3k?oc=5,1773298800,"I Just Got Back From Paris, These 5 Trends Will Be Huge Next Season - Who What Wear","I Just Got Back From Paris, These 5 Trends Will Be Huge Next Season - Who What Wear"
gnews,fashion trend,news.google.com,https://news.google.com/rss/articles/CBMiigFBVV95cUxPZ3N4SjdZbUZpWm93bUN5MFlIZWRsYlcyWkNEN3FLc3F5YmM3cTl4SDBoYmR5Yjh1TXI3ZHkydUVTVEU2b09ZSlpZWmw0eHMxQVNJT0dwbHFGaFhTdHRlRmtzVnY0YlUwTDAxdTN4TnNEZ095UmlWZ1F2eFVKdi12WDBUdm5Tekp1Umc?oc=5,1773903600,The Best Spring Trends of 2026 - Harper's BAZAAR,The Best Spring Trends of 2026 - Harper's BAZAAR
gnews,fashion trend,news.google.com,https://news.google.com/rss/articles/CBMimAFBVV95cUxQREVINnExaXd1N1NvemFCZ28wY1lwYXRTUFM3WWc2YlRSb0szU1lBN0pVVWE3ZC0wZFJIS0JFR0JYUzRrWnJqejI2cnNzT0ZmTl9MNkV0dDRJRE1zdnpVMWx0VVBZVXdpeXB5blRuVUY0Y3FNUm0wVWhucVBtLUxDZTFlM1dPSEZiaHViM3U1TnlBNEVOZ2JNMA?oc=5,1772697600,"These Are the Fashion Trends That Will Dominate Spring 2026, According to the Runways - Cosmopolitan","These Are the Fashion Trends That Will Dominate Spring 2026, According to the Runways - Cosmopolitan"
gnews,fashion trend,news.google.com,https://news.google.com/rss/articles/CBMif0FVX3lxTFBEXzZaUEVpT0Q1dnNpTDg0blFuckVRX1BlbWhWVjZHV0swNlB2S3hvVExpN2dDcmsxUFNKdXhTY0pzR3BncUI5RlFPeW85SXhfenFseEhkajc0R0JydzBobThCaklJcGg5X0taSmw5UHNKWldZTHhTck5MbFRnQmc?oc=5,1774249200,Challenge Accepted! 14 Vogue Editors Curate Spring’s Top Trends Under $300 - Vogue,Challenge Accepted! 14 Vogue Editors Curate Spring’s Top Trends Under $300 - Vogue
gnews,streetwear trend,news.google.com,https://news.google.com/rss/articles/CBMiowFBVV95cUxOdGttVEFyMEx1SGJuOVV3eUxpSGhDWDhPRXZucDFQRGhIYnlNWXFCS0JEY1drdXgwejNlVHNNcVY2LVVkWkxwVm4tdWgxSHM4b3U0eXpCTWdhOGh0X2ZrcTQteC1ZTDB0anV3M3B4dkVQMThxZmxRRTlnZl9neGN0clZTY2JtVzVjUnBwa1lfWlg2djlmXy1qbi1QVWl6azRTQ0lN?oc=5,1773817200,Y2K Beanies: The Retro Streetwear Trend Making a Huge Comeback - OCNJ Daily,Y2K Beanies: The Retro Streetwear Trend Making a Huge Comeback - OCNJ Daily
gnews,runway trend,news.google.com,https://news.google.com/rss/articles/CBMioAFBVV95cUxOTjJQX2tFbEkwR01GaUhGUklQOUw3ckFEYWRGMW43WXVJak15elVLRlY4MXR3T0d6SFE5YkdMMEZobktMS1Fkc21vQjY1SVBkX1JoazZIM3MzSmg5dWdXUnliQ1FYczRMU3RHbUZ4bTJPdjNZNFV1VlVBdUFpMUFEaThoekNuWk10X1NLZEVMXy16dFpMbHkxRTdrODBMWnZO?oc=5,1774906675,The Los Angeles fashion trend of the year is politics - Annenberg Media,The Los Angeles fashion trend of the year is politics - Annenberg Media
gnews,runway trend,news.google.com,https://news.google.com/rss/articles/CBMiYEFVX3lxTE1MaHZlVFBNaEZTcExQSW51TUhsU1N5S2t4TzQ2em5faTAzTm9aejA2cGJKYkJiYkFqNUFiSUxOY1c3MDA5M1NUcXo3aXkzTjk4bG5YLXI5bTdJbFl4UzB3Vw?oc=5,1773990000,The Fall/Winter 2026 Runway Trend Report - coveteur.com,The Fall/Winter 2026 Runway Trend Report - coveteur.com
gnews,runway trend,news.google.com,https://news.google.com/rss/articles/CBMiggFBVV95cUxNeVRuYklMUVNJaDVIM2M1QTZscjVsMHduQUN4MUdDWndZTDFUeWZ3eWxLbnd0cmRIcG1tWFJmd3Utbko2NHBNbFNMVXlPeDlkUU82SWNMT00yNU1EanV5UzduR1hMR3VrRnI3T3p5WElDaWdIbHN0T05kZjRtZ1hIYml3?oc=5,1775051250,The Fall 2026 Trends I’m Shopping and Styling Ahead of Time - Marie Claire,The Fall 2026 Trends I’m Shopping and Styling Ahead of Time - Marie Claire
gnews,runway trend,news.google.com,https://news.google.com/rss/articles/CBMibkFVX3lxTE81UHNiS183X0tsQlllZ3VzSDRCUkdRT1ZSV3BVR0R2ZEpwOFhCbkZWaFk0Ml9IRURQREFzakRNbXVEUzhkMnpkY0ZJX2doX2g3cDI0dl92WWx1U0h0YmNWNkM1QmVPUmdxTW84UGNB?oc=5,1774904354,13 Fall 2026 Styling Tricks to Try This Spring - Vogue,13 Fall 2026 Styling Tricks to Try This Spring - Vogue
gnews,runway trend,news.google.com,https://news.google.com/rss/articles/CBMioAFBVV95cUxNTlVuVE9KMmN2WEFMX3hZZ0lLb1RBTnlTS0VidzNrOTRjQ19ZV1NwOXRRZzFla0pMa1RNdER5YjVPUmVvc3lXX3Nib0hCczFhUXIteFB4dmZYb2FiZHZNRWwtWGEtZlpfa2IwM1pmVTA1THNMNk1BcjRIanh3LWhCX3BwS2FqS25XS2hqMnZrVTh0bUR5cmRLeUtUc2V1Q3dV?oc=5,1774989073,Emma Chamberlain Shares the One Fashion Trend from Her Early YouTube Days She Wants to Come Back (Exclusive) - People.com,Emma Chamberlain Shares the One Fashion Trend from Her Early YouTube Days She Wants to Come Back (Exclusive) - People.com
gnews,runway trend,news.google.com,https://news.google.com/rss/articles/CBMigwFBVV95cUxOUnZRQl83dXdWYXJOOTNaaHVvRjVaYVBDaTFmUmpvaXI5aDFfTFhmWjd0eDBKTG91S3l2blMxek02YnlVRkRwZERESE5JbVpGajU0cElQSXloaGFHTkx3OV9veEpxd2UxRTRpWDVwRmRLMUlKVnctVGVuTEJnRjMzOTllQQ?oc=5,1774863600,Tucker Carlson's merch has become a major fashion trend for ... liberals. - Slate,Tucker Carlson's merch has become a major fashion trend for ... liberals. - Slate
gnews,runway trend,news.google.com,https://news.google.com/rss/articles/CBMi3gFBVV95cUxPNktZQ0R4ZVp1OGZGTnJJUmtwWjRYZWVYaXQ2eG5iNl9KckxZWVh2ZjZjNVpZQTNkRkc2b0lkekVZRkpULU1lSFlZSFR2RlNMcWstTTNlUk9mX2dTMGhOaEVab1R4WVdkSXQ0aUVVNThGcy1vSnk3V19SM19ZaHY1VGFDS0pMaWpubHVRZUNFNTFPa21DY0txb3hYVE5LOFA3QkRUSEYzeXRVbS12cE9WMzJHc1hBNFVrcm9Tc0xqY3hxVHZSWmd0bXhHMENTQUk2d3VfNTlkZUhLdTZEZWc?oc=5,1774789811,‘Leverage the local’: The fashion trend that explains why everyone around you is channeling their inner tourist - Fast Company,‘Leverage the local’: The fashion trend that explains why everyone around you is channeling their inner tourist - Fast Company
gnews,runway trend,news.google.com,https://news.google.com/rss/articles/CBMiiwFBVV95cUxOdmhxR3V3aXp5Y0psYzRPZlZLeG84akp3enRkdnBxUXpqcnFvLXJtclp2dGhxdUVGRjFCU0VQTWFDbF9mbWxfRDJmUnhjWlo5UzdSNzlpbGlvQmxkaEtvSDNGa1FZNkVTYUNTZVp1dUNaNlRaMktIcVE2QWp6OE9sSmpUR1BmY2VEM0VZ?oc=5,1774861240,Trends That Are Big in Japan - The New York Times,Trends That Are Big in Japan - The New York Times
gnews,runway trend,news.google.com,https://news.google.com/rss/articles/CBMidkFVX3lxTE9LN2t1d1FVNG9jN2RxWHJZZDJnQmxfVXlMVF8xeXVpQVpsQ1BIMmJvZlV4RE81ZExkYVVYOEc2MGhrZGpSRkdpS3FvaFZRRU1JNXRrSVIwYUdkVHdEckI5bng0Z2FSMXFHMjN0TGRPQnllMG9TWFE?oc=5,1775026800,No Neutrals Here: 8 Print Trends Fashion People Are Wearing This Spring - Who What Wear,No Neutrals Here: 8 Print Trends Fashion People Are Wearing This Spring - Who What Wear
gnews,runway trend,news.google.com,https://news.google.com/rss/articles/CBMia0FVX3lxTFBnOHV3aWI3MXphWGVnQ0NZbTVCUlVTYUtKWklFTVZDWWJ5V2JVRXJ5U2Zxb1FmMmhybGhPVWV5VEwyV0djX3FoWWRtUzNKbUlGVWdQNjYwb0lkSTRqLV81YXhNNDBYUWUzdFlr?oc=5,1775152800,The Handbag Trends Everyone Will Be Carrying This Spring 2026 - refinery29.com,The Handbag Trends Everyone Will Be Carrying This Spring 2026 - refinery29.com
gnews,runway trend,news.google.com,https://news.google.com/rss/articles/CBMihgFBVV95cUxPSnhSQXpBZU5MNlVKaEhvYS16djBMSXY0YlRDdlJ2LXNFUHF3Z2FOVUhfYkxJLTJNdXJnNGY0RnB3bHZ4YVM2WlVvNy1ZY0t5YzlIRFBwcERsd1F6aXYya3NGVHdfNlNZcE1yWl9uSnpSUkxnMjdaZlJMcXZWTXdOcjFvN0lPdw?oc=5,1774987894,Plaid Is Spring’s Surprise Trend Taking Over—Here’s Why - elle.com,Plaid Is Spring’s Surprise Trend Taking Over—Here’s Why - elle.com
gnews,runway trend,news.google.com,https://news.google.com/rss/articles/CBMinAFBVV95cUxPbk94Y0dkVHBRZmlhNkJvQndKU3V2UERLd1drUWozT2VWUmI1OUZuNVh4QnFSb3Z0UDdWZVNHRlloUTQxU184UFJYS2toSHloc2FyanZPTGpNTE0yaE5OdDVXYmNHQzNna2dUMG9TTTVYZU9ZWjFfYXhqdmxZOFNCQUswY1VZQmpEaGZhcDJiT2tfeXhGRUtXVy1XWjM?oc=5,1774868400,"I’m an NYC Fashion Writer—These Are the 7 Spring Trends I’m Seeing Everywhere Right Now, From $16 - Travel + Leisure","I’m an NYC Fashion Writer—These Are the 7 Spring Trends I’m Seeing Everywhere Right Now, From $16 - Travel + Leisure"
gnews,runway trend,news.google.com,https://news.google.com/rss/articles/CBMilwFBVV95cUxNR2I3cVhVbWpTWlByZTJQbVcwekZQNXRkdHBhZ1NoS3lQbWpvNjFraGVFUUJ4TDRRb29TamxhZzl4S0NQVVg3ZEotUFQ3dUUwY285aGNDRmxsWks1dnNJdHdtS1VFcHJveGJfcEJoczVQTFVYNTgzRE9OUHk5ekd5WWVXTFozbTJsX2FsSFE0cFJYS3YtUVFn?oc=5,1775115229,9 Street Style Trends To Try For Spring/Summer 2026 - Harper's Bazaar Singapore,9 Street Style Trends To Try For Spring/Summer 2026 - Harper's Bazaar Singapore
gnews,runway trend,news.google.com,https://news.google.com/rss/articles/CBMimAFBVV95cUxPa3QwUkdtMTduZkY1SHVJN0ZqaWpDTUVvYmdtZ0F2azFhM0hEM180T1RLRWlIMlpMNjRER1p3TVA3UXllSFJFYmhuYTVaSjZubFVUcXItV1E2NllpMmRXZGowREd5UGhoZ3hOdUhyXzdGcGgyY3NjaXh3M0poNkJPUUNTQ0FEWW9Kb0lzVXZfQlFTWnV2MmdPeg?oc=5,1773817200,The math that explains why Y2K is back in fashion - Scientific American,The math that explains why Y2K is back in fashion - Scientific American
gnews,runway trend,news.google.com,https://news.google.com/rss/articles/CBMiY0FVX3lxTE5CNlJBcF9MaFNiVG5KOTdXeGlaUlROVXRXOTIycjVlZk1SOVQtcW5aTmtrWlQzTk5vdmwxUHB3amJZUDFhLWlxR01xdHF5dWYybW5Yejl0X0lNRG1wM1F6REdnVQ?oc=5,1774968893,10 Spring Trends To Know This Season - coveteur.com,10 Spring Trends To Know This Season - coveteur.com
gnews,runway trend,news.google.com,https://news.google.com/rss/articles/CBMiYEFVX3lxTFBCaGJVUHFjVkNZMVZEaklNV1RNdHlXcXdnbDFxbG8zY2tadnBOYVhndVFIOUNUWUJVMU84Q0tPQkNWWU1udEpCQmxmSXF5QzdBSS1uazBQbTZwanVHNnRHNw?oc=5,1775088000,The Fresh Bag Trend Fashion Insiders Will Wear in 2026 - Who What Wear,The Fresh Bag Trend Fashion Insiders Will Wear in 2026 - Who What Wear
