source,query,url,created_utc,title,text
youtube,men's fashion trends,https://www.youtube.com/watch?v=jaGLKwwKIyI,1776095890,इंडो वेस्टर्न #fashion #fashiontrends #wedding,
youtube,men's fashion trends,https://www.youtube.com/watch?v=EqMOqcxOrEo,1776095484,Rate unc #outfit 1-10 #fashion #outfitinspo #fitcheck #streetwear #styleinspo #fashiontrends #ootd,
youtube,men's fashion trends,https://www.youtube.com/watch?v=8j71AiiMyt0,1776094350,Ranking The Best Add Some Color Trend Moments 🔥 #shorts #fashion #trend #viral #outfit,"Ranking the best and most creative ""Add Some Color"" trend videos! From sleek minimalist looks to high-fashion surprises, these ..."
youtube,men's fashion trends,https://www.youtube.com/watch?v=cEYzZz7Xp9w,1776093360,location mate:- 6355343206 #fashion #fashiontrends #summerfashion #fashionstyle,
youtube,men's fashion trends,https://www.youtube.com/watch?v=HVXp1z1Wp0k,1776091593,10 Trendy Striped Shirts Every Man Needs 🎀✨#shorts #meesho #menshirts #stripedshirts #fyp #ootd #yt,10 Trendy Striped Shirts Every Man Needs ✨ #shorts #meesho #menshirts #stripedshirts #fyp #ootd #ytshorts #outfitinspo #yt ...
youtube,men's fashion trends,https://www.youtube.com/watch?v=niQFt6pis2E,1776091430,funny short #trending #funny #fashiontrends #viral #automobile #comedy,funny short trending shorts viral shorts comedy shorts.
youtube,men's fashion trends,https://www.youtube.com/watch?v=BivpEqcFROA,1776090327,Check Shirts For Men #shirts #fashiontrends #shortvideo,"Check Shirts for men Subscribe for more Details: Multiple colours Fabric: Cotton Size : M, XL Premium Quality Free Delivery ..."
youtube,men's fashion trends,https://www.youtube.com/watch?v=XsSTiEqVKfo,1776088974,Latest Men&#39;s Summer Fashion Trends 2026,Latest Men's Summer Fashion Trends 2026 Summer vibrations on! Comfort meets style with our new printed shirt collection.
youtube,men's fashion trends,https://www.youtube.com/watch?v=fGaXzWKMesI,1776088260,Best Quality casual shirts for Summer | Everyday style |#fashiontrends #outfitideas #ootdguide #men,Best Quality casual shirts for Summer | Everyday style |#fashiontrends #outfitideas #ootdguide #men Stop wearing the same ...
youtube,men's fashion trends,https://www.youtube.com/watch?v=FixNmVk8cI0,1776087004,Jinu Collection Best Quality Shirts | Latest Fashion 2026 👕✨#jinucollection #shorts #fashion #viral,"Jinu Collection Best Quality Shirts | Latest Fashion 2026 ✨#jinucollection #shorts #fashion #viral ""Namaste Doston! ​Aaj ke ..."
youtube,men's fashion trends,https://www.youtube.com/watch?v=zRXdK3sJxLo,1776079686,summer special #mensfashion #hoodieq #mensfashiontrends #fashion #fashiontrends #fashionstyle #best,"Welcome to Fashion Xpress — your fast and stylish destination for the latest fashion trends! Yahan aapko milte hain outfit ideas, ..."
youtube,men's fashion trends,https://www.youtube.com/watch?v=L0L_HYqRK4M,1776076214,T-shirts for men’s / men’s T-shirts /imported T-shirts #shorts,Designer Imported Tshirts unisex collections ➡️ Size :- M to 3XL ➡️For any queries what's up on:- 9898208222 ...
youtube,men's fashion trends,https://www.youtube.com/watch?v=_zq0PopqGVU,1776076031,“Royal Jodhpuri Look 😎👑 | Men’s Fashion 🔥” #jodhpuricouture #mensfashion  #jodhpurisuit #royallook,Royal Jodhpuri Look | Men's Fashion ” Royal Jodhpuri Style Look ✨ Traditional + Modern combo that gives pure ...
youtube,men's fashion trends,https://www.youtube.com/watch?v=cN356Uf1UR8,1776070860,#cleanboy #aesthetic #mensfashion #reels #usa #ytshorts #fashiontrends,
youtube,men's fashion trends,https://www.youtube.com/watch?v=rGECdWvjNgY,1776069797,Shoot For Air Polo Collection❤️ #model #fashion #fashionstyle #fashiontrends #fashionblogger,
youtube,men's fashion trends,https://www.youtube.com/watch?v=_YwQaZfsEJY,1776067973,Street style done right 💯😎 #smartcasual#mensstyle #outfitinspo #dailyoutfits#shorts#viral#ootd#yt,Effortless street style with a classy twist This layered outfit featuring a check shirt over a neutral tee paired with brown trousers ...
youtube,men's fashion trends,https://www.youtube.com/watch?v=7eRGc60iRZY,1776063246,Under ₹300 T-Shirts #menfashion #fashion,Under ₹300 T-Shirts #menfashion #styly #stylish #fashiontrends #fashionstyle #trending #tshirt.
youtube,men's fashion trends,https://www.youtube.com/watch?v=DJmW-JyRAj0,1776058163,Soft fabric drop shoulder t shirts for mens under 500₹branded t shirts❤️#fashionstyle #fashiontrends,
youtube,men's fashion trends,https://www.youtube.com/watch?v=6peASy3_JEc,1776050974,suit#mensfashion#clothing #fashion#casual#fashionstyle#mensagem #fashionblogger #fashiontrends,"Welcome to your ultimate destination for men's fashion, style inspiration, and modern wardrobe essentials. This channel brings ..."
youtube,men's fashion trends,https://www.youtube.com/watch?v=kfb4hSaR42A,1776049140,Best outfit for men 🌞 #shorts #ytshorts #trending #fashion #fashiontrends #viral #explore,Best outfit for men #shorts #ytshorts #trending #fashion #fashiontrends #viral #explore #youtubeshorts #youtube #shorts ...
youtube,men's fashion trends,https://www.youtube.com/watch?v=0sC3QPHKvec,1776048555,suit#mensfashion#clothing #fashion#casual#fashionstyle#mensagem #fashionblogger #fashiontrends,"Welcome to your ultimate destination for men's fashion, style inspiration, and modern wardrobe essentials. This channel brings ..."
youtube,men's fashion trends,https://www.youtube.com/watch?v=aj9M7O_mbRs,1776048231,suit#mensfashion#clothing #fashion#casual#fashionstyle#mensagem #fashionblogger #fashiontrends,"Welcome to your ultimate destination for men's fashion, style inspiration, and modern wardrobe essentials. This channel brings ..."
youtube,men's fashion trends,https://www.youtube.com/watch?v=gAGni-plvj0,1776047091,suit#mensfashion#clothing #fashion#casual#fashionstyle#mensagem #fashionblogger #fashiontrends,"Welcome to your ultimate destination for men's fashion, style inspiration, and modern wardrobe essentials. This channel brings ..."
youtube,men's fashion trends,https://www.youtube.com/watch?v=UKYKe7VZke4,1776046989,suit#mensfashion#clothing #fashion#casual#fashionstyle#mensagem #fashionblogger #fashiontrends,"Welcome to your ultimate destination for men's fashion, style inspiration, and modern wardrobe essentials. This channel brings ..."
youtube,men's fashion trends,https://www.youtube.com/watch?v=Kn-VgQahGWw,1776045921,kuch log #shortsfeed #ekmotahathighumechala #funny #fashiontrends #ytshorts,
youtube,women's fashion trends,https://www.youtube.com/watch?v=A7uL2w-to6w,1776101210,Glow Up!😍☀️ #fashiontrends #fashion #womensfashion,
youtube,women's fashion trends,https://www.youtube.com/watch?v=nm5XgMYS2sQ,1776098284,लेहनी बलम जी के सांग सात फेरा 🫣 #visualreel #ilovegadgets #fashiontrends #gadgets #trendinggadgets,लेहनी बलम जी के सांग सात फेरा #visualreel #ilovegadgets #fashiontrends #gadgets ...
youtube,women's fashion trends,https://www.youtube.com/watch?v=2OX_mkjwdZY,1776096428,💖✨New Summer Outfit😎#shorts #new#ootd #fashion #trend #unboxing#outfit #stylewithanupam#latest#viral,Latest fashion trends summer clothes women's outfits. under budget shopping Style with Anupam ✨New Summer ...
youtube,women's fashion trends,https://www.youtube.com/watch?v=fdC6dJOT9uk,1776096144,Trending Footwear &amp; Style Searches 2026 | Ladies Shoes &amp; Sandals Fashion Trends,"Discover the Top Footwear & Style Searches of 2026! In this video, we explore the most popular and highly searched ladies shoes ..."
youtube,women's fashion trends,https://www.youtube.com/watch?v=9MlspBx0pVQ,1776096014,🧡 H&amp;M NEW SPRING SUMMER 2026 ARRIVALS 💐 ELEGANT MODERN WOMEN’S FASHION,H&M NEW SPRING-SUMMER 2026 ARRIVALS ELEGANT MODERN WOMEN'S FASHION H&M is a popular fashion brand ...
youtube,women's fashion trends,https://www.youtube.com/watch?v=IawNPvvbsG8,1776095405,"korean fashion chinese fashionjapanese fashion street fashion tik tok, Stree#shortvideos #tiktok #","korean fashion chinese fashionjapanese fashion street fashion tik tok, Stree#shortvideos #tiktok # orean fashion chinese ..."
youtube,women's fashion trends,https://www.youtube.com/watch?v=IkwewZA7UwA,1776094212,"Trendy Women’s Summer Wardrobe with Premium Casual Wear, Party Fashion, and Daily Style Ideas","Trendy Women's Summer Wardrobe with Premium Casual Wear, Party Fashion, and Daily Style Ideas Welcome to our trendy ..."
youtube,women's fashion trends,https://www.youtube.com/watch?v=jksZ74yvpv4,1776092996,Saree recreation ideas/old saree to beautiful gown #fashiontrends #designer#sareerecreation#youtube,Saree recreation ideas/old saree to beautiful gown #fashiontrends#designer#sareerecreation#youtube#shortvideo #diy ...
youtube,women's fashion trends,https://www.youtube.com/watch?v=-eqU5nEwRD0,1776092966,trending suits 😲💕 #fashiontrends #newsuitdesignforkarwachauth,
youtube,women's fashion trends,https://www.youtube.com/watch?v=UX2UOEdAjHI,1776092275,Asian Fashion Walk 2026 🔥 Street Style Trends You Can’t Miss!,"Step into the world of Asian street fashion where style meets confidence! This video captures stunning outfit ideas, modern ..."
youtube,women's fashion trends,https://www.youtube.com/watch?v=IdRUf8n2p4M,1776090700,#humor #usa #foryou #fyp #love #crazyfashion #shorts #viral #youtubeshorts #fashiontrends,
youtube,women's fashion trends,https://www.youtube.com/watch?v=qK5Xy792FbA,1776090090,DM 👉 9217729469 ✅ #fashion #dressess #fashionstyles #dress #indianfashion #fashiontrends #wedding,
youtube,women's fashion trends,https://www.youtube.com/watch?v=9_sd-DAkP_0,1776089317,सास कभी माँ नहीं बन सकती#viral #comedy #fashiontrends #funny #sorts,वीडियो पसंद आए तो प्लीज वीडियो को लाइक करें.
youtube,women's fashion trends,https://www.youtube.com/watch?v=xXuySegVR8E,1776089256,Grwm ft.spring outfits ✨😽#riyajain #fashion #ootd #grwm #fashiontrends #shortvideo #prettylook,
youtube,women's fashion trends,https://www.youtube.com/watch?v=C1njqSLQdhY,1776088800,What the girlies are wearing this spring #styleinspo #spring2026 #fashiontrends,
youtube,women's fashion trends,https://www.youtube.com/watch?v=VBAc3Be6A-k,1776088882,Latest Outfit Trends 2026 | Stylish Printed Suit for Women #fashion #dress,"Explore the latest outfit trends with this stylish printed suit. Designed with attention to detail, this outfit is perfect for enhancing your ..."
youtube,women's fashion trends,https://www.youtube.com/watch?v=RiURja7v-S0,1776087728,How Red Changes Everything: 5 Neutral Looks Instantly Transformed #fashiontrends #outfitideas #ootd,"Grey cargo, total black, white lace, beige monochrome and black boucle — five different looks connected by red accessories: ..."
youtube,women's fashion trends,https://www.youtube.com/watch?v=5URPLfpyQ9g,1776087112,Dress🍷✨#fashion#dress#ytshorts#viralvideo#shortsfeed#weddingdress#viralvideo#trending#fashiontrends,
youtube,women's fashion trends,https://www.youtube.com/watch?v=iXQmbftl6A4,1776087060,Style Sakhi | Ladies Fashion &amp; Footwear Trends🧡💛💚 #shoes,"Welcome to Style Sakhi Your go-to destination for latest ladies fashion, trendy footwear, and daily styling ideas. Here you'll find ..."
youtube,women's fashion trends,https://www.youtube.com/watch?v=ibUhoJPejtg,1776084019,Fashion Trends Delhi #tshirts #shorts #ytshorts #mensfashion #womensfashion,Fashion Trends Delhi #tshirts #shorts #ytshorts #mensfashion #womensfashion.
youtube,women's fashion trends,https://www.youtube.com/watch?v=87ACQTeZnQQ,1776081612,Best Fashion Trends 2026//Most Beautiful and Trendy Outfits for Ladies #fashionhub#trends#style,Best Fashion Trends 2026//Most Beautiful and Trendy Outfits for Ladies #fashionhub#trends#style Sound and Music YT Studio ...
youtube,women's fashion trends,https://www.youtube.com/watch?v=nxrKvnO20mI,1776078146,How to Make Monochrome Outfits Look Expensive 👀 #ootd #fashion #fashiontrends #style #whattowear,"Monochrome outfits don't have to be boring It's all about structure, texture, and one intentional detail. #MonochromeOutfits ..."
youtube,women's fashion trends,https://www.youtube.com/watch?v=DkjRUVrM1cU,1776076502,Itne kam price me kese #shortsviral #viralvideo #fashiontrends #viralvideo,
youtube,women's fashion trends,https://www.youtube.com/watch?v=tWNpIL9bknc,1776075672,colours available ✨️🏃‍♀️🥳💃💓#shivshahipaithani #fashiontrends #saree#onlineshopping#shorts #viralreel,
youtube,women's fashion trends,https://www.youtube.com/watch?v=9GjUrTAMYPg,1776074749,top-fasonlar toplami #shorts #fashion #onlineshopping #dress #sale #trend2026,Trend 2026 – Modali Ayollar Liboslari Ayollarning go'zalligi va uslubi yangi darajaga chiqmoqda! 2026-yilning eng so'nggi ...
youtube,streetwear 2025,https://www.youtube.com/watch?v=390D7JOFV8c,1775846272,👀 Essa calça destruiu meu guarda-roupa: Cargo Jogger com bolso de verdade,"Essa calça destruiu meu guarda-roupa: Cargo Jogger com bolso de verdade, elastano e 6 cores que viraram febre em 2025!"
youtube,streetwear 2025,https://www.youtube.com/watch?v=3nmRqywGA74,1775844650,styling yeezys in 2025,
youtube,streetwear 2025,https://www.youtube.com/watch?v=8IMLh9EzLtM,1775572211,Influencer Brands Fail in 2 Years… But Overlays Didn’t 😳 | Rahul Saraswat,Influencer Brands Fail in 2 Years… But Overlays Didn't | Rahul Saraswat * This Video Is inspired * Connect With Me ...
youtube,streetwear 2025,https://www.youtube.com/watch?v=oj5XnIydoPA,1775541653,Styling the gamma 11s (2025) 🔥🔥 #styling #outfit #ootd #streetwear #jordan11,"short #sneakerhead #unboxing Leave me size!!! Hello! My friend, if want this goods add our whatsapp:+86 152 6026 8083."
youtube,streetwear 2025,https://www.youtube.com/watch?v=068pFB_MPgc,1775530901,Jordan 4 undefeated 2025 #fyp #sneakers #ootd #streetwear #jordan4,"short #sneakerhead #unboxing Leave me size!!! Hello! My friend, if want this goods add our whatsapp:+86 152 6026 8083."
youtube,streetwear 2025,https://www.youtube.com/watch?v=_LiyMn5i0i4,1775393250,H.M 2025 Army Lower 🔥 Heavy Quality | Full Review,"Army Lower ek premium quality lower hai jo heavy cotton fabric ke sath aata hai. Agar aapko strong, durable aur branded look ..."
youtube,streetwear 2025,https://www.youtube.com/watch?v=j55RwvvSK1k,1775362702,DWP 2025 STEVE ANGELO #dwp2025 #kaosdwp2025 #kaosdwp #steveangelo #sablonmurahjakarta,
youtube,streetwear 2025,https://www.youtube.com/watch?v=HfLwDPIUDnk,1775162618,OOTD | Streetwear on a Budget | June 4 2025,"I believe you don't need to spend a fortune to look elevated, confident, and timeless at any age Grab my FREE Thrift Store ..."
youtube,streetwear 2025,https://www.youtube.com/watch?v=q2nF9KvtmYo,1775161422,OOTD | Streetwear on a Budget | May 28 2025,"I believe you don't need to spend a fortune to look elevated, confident, and timeless at any age Grab my FREE Thrift Store ..."
youtube,streetwear 2025,https://www.youtube.com/watch?v=lqjXlwX4EkM,1775079127,2025 fashion regrets #hourscollection #fashiontips #howtodress #streetwear,
youtube,streetwear 2025,https://www.youtube.com/watch?v=KpnkyTbP5ys,1775069672,Y2K Streetwear Outfit | Starboy Tee + Stacked Jeans Fit Check 2025,"The ""Starboy"" tee + stacked denim combo is LIVE ⭐ Full fit breakdown: • Starboy Longsleeve Tee (Heather Gray) • Stacked Cargo ..."
youtube,streetwear 2025,https://www.youtube.com/watch?v=AUAeTvlIVa8,1775053804,MXDVS pop-up in Amsterdam 2025. #streetwear #fashion #clothingbrand #pop-up,At our last MXDVS pop-up in Amsterdam we got to meet some amazing people in line. It was inspiring to hear your stories and see ...
youtube,streetwear 2025,https://www.youtube.com/watch?v=ZMrIsc14j6E,1775037456,ADIDAS performance real madrid jersey 2025/26 away #edit,
youtube,streetwear 2025,https://www.youtube.com/watch?v=uZZL63kKxuI,1774994449,The massive secret in Kendrick&#39;s Super Bowl outfit... 🤫🏈,You won't believe the hidden details in Kendrick Lamar's Super Bowl outfit... Kendrick completely shut down the 2025 Super ...
youtube,streetwear 2025,https://www.youtube.com/watch?v=GbzxeCvtksg,1774985666,Ai in 2025 vs Ai in 2026 😂🔥 #ai #tech #blackbox,ai #tech #blackbox.
youtube,streetwear 2025,https://www.youtube.com/watch?v=aDv8zBxsR_A,1774905909,Jordan 4 Undefeated 2025 Review #jordan4 #sneakers #undefeated #trending #fashion #sneakerhead #nike,Jordan 4 Undefeated 2025 Review #jordan4 #sneakers #undefeated #trending #fashion #sneakerhead #nike #whitesville ...
youtube,streetwear 2025,https://www.youtube.com/watch?v=bK8CIlYYuhc,1774879241,Different values in 2025 vs 2015 ⬆️⬇️,
youtube,streetwear 2025,https://www.youtube.com/watch?v=rOJq97nLToE,1774867503,The Future of Streetwear: 2026 Market Intelligence #streetwearcommunity #fashionbusiness ,"The Future of Streetwear: 2025-2026 Market Intelligence The global streetwear market is shifting from ""Marketing-led Hype"" to ..."
youtube,streetwear 2025,https://www.youtube.com/watch?v=4R7yRN7I14c,1774865526,best outfit for 2025 #fashion #shorts #oldmoney,best outfit for 2025 #fashion #shorts #oldmoney.
youtube,streetwear 2025,https://www.youtube.com/watch?v=juoKj_DSL3A,1774794752,Westside collection #zudioindia #trends2025,Zudio #ZudioIndia #ZudioStyle #ZudioWinterCollection #ZudioWinter2025 #ZudioLookbook #ZudioOOTD #ZudioFinds ...
youtube,streetwear 2025,https://www.youtube.com/watch?v=a5PGoY3zxLA,1774792393,The Best Hats for 2025: Top Picks for Style &amp; Fit! #Hats #NewEra #Streetwear #Fashion #Snapback,"Looking for the perfect hat to complete your fit? Whether you're into classic New Era 59FIFTY fitteds, vintage Dad Hats, or the ..."
youtube,streetwear 2025,https://www.youtube.com/watch?v=TNwUS1bNi5Q,1774742440,Lesser Care performs &quot;Streetwear&quot; live @ Genghis Cohen&#39;s 3/7/2025 Los Angeles ,"Lesser Care ""STREETWEAR"" March 7th 2025 Los Angeles @ Genghis Cohen's."
youtube,streetwear 2025,https://www.youtube.com/watch?v=qrw47mcDcLE,1774727499,Shocking Summer Street Styles You NEED to See ! 😍🔥 2025 Fashion Trends Revealed !,"This summer, the streetwear scene is all about that effortless vibe. Picture this: oversized graphic tees paired with relaxed-fit cargo ..."
youtube,streetwear 2025,https://www.youtube.com/watch?v=1i_brhSWlFc,1774707731,NiZED Alien Drip – Von einer anderen Welt | Streetwear Berlin 2025 #nized #streetwear #BerlinFashion,"NiZED trifft nicht – NiZED landet. Dieses Piece kommt von einem anderen Stern. Kein Mensch trägt das so. Zu weird für die Norm, ..."
youtube,streetwear 2025,https://www.youtube.com/watch?v=oeLrB-tkvLU,1774705723,Where to buy good graphic Shirts 🔥#streetwear #graphicshirts,"Streetwear inspo 2025 From hoodies, jorts, caps to the latest sneaker drops – this Short brings you the best streetwear ..."
