source,query,domain,url,created_utc,title,text
gnews,fashion trend,news.google.com,https://news.google.com/rss/articles/CBMijgFBVV95cUxPaEt2MmhxVUZGZTBNaUVteTJ2ZFdMRktMT2V1ZmFrdWpra25NSlBiYnpKNmM3a0ZPNmpSY2diaDBsdHVjQ1AzZFNOeURUOV9LbkNsZEl4QnhIeV80ck5EZzNRRFJpMk1HaHBMS1Y0YmdhMHd3VUlySWdpRjIzdkJibGN4clVKb3N2RGpoRWR3?oc=5,1758974425,Italian Girls Are Keeping This Hair Trend Alive At MFW - The Zoe Report,Italian Girls Are Keeping This Hair Trend Alive At MFW - The Zoe Report
gnews,fashion trend,news.google.com,https://news.google.com/rss/articles/CBMihAFBVV95cUxQNy1vU1RUcXdqVW9rWWlsTUpXcV9UY19Zc2wtTnZwMHYyc2oweGFvR3Z0V1JIT2Y2SHdScXVtZzJaV2hNcUpjejdRMTlxYlhEZnRHck5ySFc3Rm1kbk1VWjdxZ09HQkZWdkJ3dDRkV3VRVm5ITDNDTHRHRWdwTFU3RjZtZHo?oc=5,1758836250,The Fall 2025 Color Trends to Refresh Your Autumn Wardrobe - Harper's BAZAAR,The Fall 2025 Color Trends to Refresh Your Autumn Wardrobe - Harper's BAZAAR
gnews,fashion trend,news.google.com,https://news.google.com/rss/articles/CBMilwFBVV95cUxQekdqbWdKLVFLZlZVNVdfbmRNTnVRSnB6Rjc0UXlNVnVSUG1EUEd3OGQ3M2pUS05LMmpTRU1jSXFmRTNjY1NtMXFmY0VUT1FGakJkZ0FkQThfNWtDYjZYa0FZMTFKTm9tSjVQVGtEcXVCMkRRN3ZLRG1ndFVPN1FPR1VqN3A1Y01zTVEtMGVsUUdYeWxMMGhR?oc=5,1758722400,September Is My Season Opener—4 Outfits That Embody My Fall Style - Marie Claire,September Is My Season Opener—4 Outfits That Embody My Fall Style - Marie Claire
gnews,fashion trend,news.google.com,https://news.google.com/rss/articles/CBMieEFVX3lxTE5xYUdxSThDMTU5dDNkTjFhckozdEhFX3ROMHc5a2hXOERwMFYwOTZmWkNjRVhZRWZ0VG56M0NRSWpzR1VOeTdwQldTNDJGVDlxcnd4dElPTGd3MERFLXVyWS05d3gwRDdLV2Ixd2p0bnhpVi1XeVctZg?oc=5,1758896060,The One Fashion Trend Every Woman in L.A. Is Wearing This Fall - PureWow,The One Fashion Trend Every Woman in L.A. Is Wearing This Fall - PureWow
gnews,fashion trend,news.google.com,https://news.google.com/rss/articles/CBMi5AFBVV95cUxOYnlCVEtlay00MGJEY3p5Y2liMHBadVhRUVhiemk0VV82R1pZQnFiVUZuYW40aVpIXzBZWDN2TEFUY3ZxVi1mc0NJRFVEaUs5cDVUVC10THo1dkdQRVktaXhjWDJxYTNCREhRTlNjMGp1b2c5UVpyd05lR2NnS1gwTVJmSzNLUEpJeGdnSGgzdy12RkxRTDBVS3RzaHlUbVFqUjdBd3ZETU1sZGNOSjJYY2VMNmR5cWxxZXdJLXZrUlh1QXh5UFpHZE54TDZ4VF94X2o2WUppVnNJT0ItYVdrRVYxRTjSAewBQVVfeXFMTko1RmhreEwzcWVqMzRldFMyTmRMYjFQVzJoS2xueXRSSlplZ21FZGhMeVdMcGRZSkItQzZ4bkRwRm5XRXJxaV9IZ2tLX2F4X3kzbGJleWhGSHFFVGdXYldJTGROTzRtMzR2R0RMNmdRUHJHVXprYmtOMnY5bXAwbllocXF1bGkzcmo3MEZlUXJrRHRHM1gtLWt3VzlVOHdPazg0emJSNlRYRldhb3g4cF95RnNacEljS1NXc0hZVFZhX2dLV0hYbTBPbGplVzByNzlrSU5CcW9ycUx4bWE4N3hBSGkwbzMxVVEyWkk?oc=5,1758981600,Durga Puja in USA 2025: Festive looks matching with fall fashion trends - The Times of India,Durga Puja in USA 2025: Festive looks matching with fall fashion trends - The Times of India
gnews,fashion trend,news.google.com,https://news.google.com/rss/articles/CBMisAFBVV95cUxQQzJveXN3dlVWYi04OGJnUk5lcE16MDRsN1Voenl5MGpwbkVLOGdfa25kTGQ0QU9CWGM5bm8xUUptTTVMLWpsNGNNSll2UDhDb0pXX0dkalUtX2E3SEV2SXZJdjdlUnJSQ3l1ZHNlcV92aDJNaDQzWF9sYUtNbDltSGZMdDJ2MnNHa0stSVdENmlUX2VLUHV5RENFTmJGUUw2c1BoRU9EQVh3Ul9KN3loLQ?oc=5,1758827803,PinkPantheress and Latto Wore These Controversial Y2K Fashion Trends at NikeSKIMS Launch - Teen Vogue,PinkPantheress and Latto Wore These Controversial Y2K Fashion Trends at NikeSKIMS Launch - Teen Vogue
gnews,fashion trend,news.google.com,https://news.google.com/rss/articles/CBMilgFBVV95cUxQSDNKLUlHbFN5blZpYVA3OGFPMDdmaWhpN1ZrTU54bFJjR3I4UFQ4Q1ZjRnBNSE5HbHRpLUtQQWIxVDRuUkdVYlE3eWpQN05BQ2pqYnV0SkpyOWVtLWRhVk9ZeXgxc1J0TXc3dGNQb3JYQ2g4dVBNb2piaUpEOXFtMm5Ta0R4WlJqM19uaVE5b21Kd3BPSHc?oc=5,1758965728,The Chic Eyewear Trend We’re Embracing Right Now - ELLE Canada Magazine,The Chic Eyewear Trend We’re Embracing Right Now - ELLE Canada Magazine
gnews,fashion trend,news.google.com,https://news.google.com/rss/articles/CBMilgFBVV95cUxQSU90MW5DalZIQkdfLWl2Y0tvT0llaWtFOHFrSVF0aURqWHFLVlBjdmdXM2E1WVlVQlFEYXJFUE5GUzJzSVI3R2VQWm5FeE9iYWlRVFlXUkpKRnhBSERKTVVhS2FDOU5xQjlXYnpHa2EtZEc5Ui1FcVlSbHdZY21kY0FOd2cwQ3JBemtWTzdFSlNkcEhuaUE?oc=5,1758877322,"Sylvie MacMillan’s Hot New Nail Trend, NikeSkims and More Fashion News - The New York Times","Sylvie MacMillan’s Hot New Nail Trend, NikeSkims and More Fashion News - The New York Times"
gnews,fashion trend,news.google.com,https://news.google.com/rss/articles/CBMifEFVX3lxTFBDa2hrRUo5YlRiVmR5bmZhMktNWkQ2Nnk4WmQ3UVRXbHBJU2g2RUVxbURabGhuc1dRRlRDdjdRbjBfVlIwYV9fVXJXX1VLckhwb0pjLUJreDZiU0tDYzYwNTBMaTZ0ZFJ0S3JIa3JseWtyR2E1R1QwZE1sZ1A?oc=5,1758938400,This Low-Effort Pants Trend Is Here For Anyone Tired Of Leggings In Fall 2025 - glam.com,This Low-Effort Pants Trend Is Here For Anyone Tired Of Leggings In Fall 2025 - glam.com
gnews,fashion trend,news.google.com,https://news.google.com/rss/articles/CBMirwFBVV95cUxOeThUc2lIWkV4bEJZbTREQWt3N2t6bTRwX1htMzNxOV9QZjN5eFd0ck5lRkxQSlZaTFlqRUI1TFN3S09MX3FtV3hlU2diZ0hwaFNfYXhJYW9BZEpnb3ZUdnJGRThsNExXclQzbXM4bWJWUlFUS3NDMGJ0dml1S1RQMUFXRDl4M3FTNlBrRVJSd0tCWHVuVGZJcDU0ckdHbDVNZ21Bamx2YmZUOW5lNlN3?oc=5,1758897628,5 Ideas for Using New York Fashion Week Trends in a Promotional Products Campaign - members.asicentral.com,5 Ideas for Using New York Fashion Week Trends in a Promotional Products Campaign - members.asicentral.com
gnews,fashion trend,news.google.com,https://news.google.com/rss/articles/CBMihAFBVV95cUxOMEFsTXVyQ25UZXdQMzBvMTNnQTNUMnNGZi1idHAwcHc3dXp4SHJlY2Jna0JjSk9lRUJ4UGlBTG5KRzhNb09UN19nQlZQVllxNndTTHdpczVYRzgyQmhZTzRNdWN2elZieE5VOFF2WEpyS3IwZnMyUk5iLW9vRnJIc0NlY3E?oc=5,1758911226,Eclectic Midi-Length Skirts Are a Milan Street Style Go-To - Fashionista,Eclectic Midi-Length Skirts Are a Milan Street Style Go-To - Fashionista
gnews,fashion trend,news.google.com,https://news.google.com/rss/articles/CBMipAFBVV95cUxOTEFJUXRVbjlFZ0s1NDctemo5T2lONnNKWUdjODlVMm1OY0J6VjdoM1RhZ1V4SVp5c19KWFlhalM1LTRFS09nRkwtcWNNVDJNcC0xalFmZWV3MnBFQlMyYU5XWWlnMGRDRm1CWHFhNUtXUFMtNTdBQWdEZjJNWUtUcEtldXhyRmlfU01jajZBLUZnYklMajY3NWJVTXBsVDNSQ1NzYg?oc=5,1758625200,"Suede Is Fall’s Biggest Fashion Trend—Shop Our 30 Favorite Styles at Nordstrom, Amazon, and More From $23 - Travel + Leisure","Suede Is Fall’s Biggest Fashion Trend—Shop Our 30 Favorite Styles at Nordstrom, Amazon, and More From $23 - Travel + Leisure"
gnews,fashion trend,news.google.com,https://news.google.com/rss/articles/CBMiXkFVX3lxTFBoXzFnVC1VaHZuQ2pocjNXUTE0SVU1bWxGOGh6RWJhaXhWY0FqdElvV1NIQTBuVm9qWlZGTnZvenF0X0Ixa0l0WlBYcVVZcVVwZUJVbG1ueE9FQ094RXc?oc=5,1757574000,9 Fall Fashion Trends Our Editors Are Buying Right Now - glamour.com,9 Fall Fashion Trends Our Editors Are Buying Right Now - glamour.com
gnews,fashion trend,news.google.com,https://news.google.com/rss/articles/CBMiXEFVX3lxTE52QUVQSXFlNmVhek5SbGdxREUzN0x1YW5zVzNGZGItdHFKbHNLVVhwcGdTU2RzaUp0RmMyNnFqM1lSZ2kxQTg5VnBRVV96clBia1RWY0lRcDVveEc3?oc=5,1758974425,This Nautical Hat Trend Is Sweeping Fashion Month Street Style - The Zoe Report,This Nautical Hat Trend Is Sweeping Fashion Month Street Style - The Zoe Report
gnews,fashion trend,news.google.com,https://news.google.com/rss/articles/CBMijgFBVV95cUxNZ29HcW91dXRzVW45ZFhtdEZoZXZPM0tnYmVjdFdlNHcySGhxN2tuMDViUXZGbDNBcm5kaEpQSGtOWFd4OVhyeXRFZWE5dElFd19jUkIwLV9TMWZSV1h4Q1A2ZERfVlVaTW1xZ0FKa2tOQzgwSmdZb1BMYWw5V2ZqaEFYcERhWUl1Wkt5R093?oc=5,1758911405,3 Minimalist Fall Outfits I’m Wearing on Repeat in 2025 - Marie Claire,3 Minimalist Fall Outfits I’m Wearing on Repeat in 2025 - Marie Claire
gnews,fashion trend,news.google.com,https://news.google.com/rss/articles/CBMiqgFBVV95cUxPNEdkUzNDWlB3UkVHYlg1MDVlMFJsWWJ0TXRpSEliZmltSlVlVlBZWERaQ3pCUjVWbGJqcWcxdDcxQnVwdTkxcEIzeUtzTEFBX1RxT1hJRkFQUkZZUWxqbWNrVFhibXBGS2pVazJaeGdaRXI4bC1vUFJMdzB2ZDdpc2Q1OHFmVkNvdW0tUkRJUjk3dHFqUzRLb2g1MEFIeWJyTXNZUHRETlJmZw?oc=5,1758922425,Outfit Ideas From Milan Street Style That You Can Wear Tomorrow - Harper's BAZAAR,Outfit Ideas From Milan Street Style That You Can Wear Tomorrow - Harper's BAZAAR
gnews,fashion trend,news.google.com,https://news.google.com/rss/articles/CBMiggFBVV95cUxPVlB5VFY4em1tT09vNmltSXNCSG93ZkIzUlhrUzRWeE1hYll6dWRHWmtqdERka3dFSWYyU1ZDNjYxRHVIeTlUQ0tQT3dMbEc0bTZKMDVyY09QelkxSUVtQ1UxS1JnNVNjTnB6RDhibkVfZzdNZTNiaXFlR1FyTjIxNFFn?oc=5,1758920600,This Very Americana Trend Is All Over Milan Fashion Week - Marie Claire,This Very Americana Trend Is All Over Milan Fashion Week - Marie Claire
gnews,fashion trend,news.google.com,https://news.google.com/rss/articles/CBMimgFBVV95cUxPRzZTa01Qc0xJNnBONnFaUTAyYXQzZklDUTdhRk5ZbGJmanJURHRqaF9oai1mZS1ZZUQxXy0wcDF6OUpMZXNkaE9qMjRsc3NqZHlLLUYtWmZMZ0piaUJreHREWHNNOExkbGdsOHJ4MzBWVi1URGhGOEwxUXZ3UWNlcmZ1LWJ5ZVBDelNvalZzQzl0QklsYWxsNDJR?oc=5,1758877017,Live From Milan: The Best Celebrity Front Row Looks I've Spotted at Fashion Week - Marie Claire,Live From Milan: The Best Celebrity Front Row Looks I've Spotted at Fashion Week - Marie Claire
gnews,fashion trend,news.google.com,https://news.google.com/rss/articles/CBMijAFBVV95cUxPUUU2ckNvN01INWl2d2xtbmhUendqbmVpYVI0UmRYeWJVSE9JRnVJek41SzRJa1BBZ25uUTdxT3R5cGdIaWxneGJqOGJPXzZxY2ZReWwyMDVOYWFTZUkxVEdKLW9nTkV5QlFqQVBoRUJKd3hnR281b09rWERXSHZEMnVNNzVKR2NHX1I5Xw?oc=5,1758913932,I'm Building My Fall Wardrobe Around These Under-$100 Minimalist Finds - Marie Claire,I'm Building My Fall Wardrobe Around These Under-$100 Minimalist Finds - Marie Claire
gnews,fashion trend,news.google.com,https://news.google.com/rss/articles/CBMipwFBVV95cUxOUW1HaVhKTEFJOW9ZWExPdVFrenowajU1dmVobm12R0RGWFZERTRhSDBwUUhXX3UwdFQ4YV9UV2x5OGlXRENnbHdVcWZxOHlCdi1zMTU3UUZjWmZPdlZkdUg0Nkxid2N6NVg1d1ZKVnhITFBUNm9OOW1mZU1UdllIdUU5TWxtd3JoMDZrUGxMaVFvRC1nOVhYMC1CZFI3c2lUZUVrNF8zVdIBtgFBVV95cUxOVW5rd1ljRzBKcjJVaHVqLU1ORHU1WHJkbFV3UV9GQnNwTGUtakg4MDROUm1qdnZ3MTNWckx5ZFNNYk5GTzhiQUQ1VG5NRW5vS3dId0J0NENSWVRTU29IVVhCenRWMjd6ME5HR2hQT1BYbEVjc0NhX216My1xMFpkcTlGc3FPRVdBR0tvU3U0U28zQ1YxaFNqMHNsMmhEYlFib3A4eW1TUVFpWGRYYzc5ekFwN19Udw?oc=5,1758968030,Kylie Jenner stuns in a peekaboo bra and lace jumpsuit - embracing the sultry new trend - HELLO! Magazine,Kylie Jenner stuns in a peekaboo bra and lace jumpsuit - embracing the sultry new trend - HELLO! Magazine
gnews,fashion trend,news.google.com,https://news.google.com/rss/articles/CBMikwFBVV95cUxPR29Vc2I3bHFzUnFLZEJfSnU2ekRERm9zeHl3OUlVTEdYN2FtdTkwTmJXSS15WWZHcVFJTnBFUFBpTUc4bnJvTUxwaWJ0NTB1MnpqeFdEZWJsekZmekh6RDJTUjJHV3F6NF9wcDUzNjFiZ1I4NzdjRmprUm1IZ2Z5bDQ4c1o0MzBzdG1RVDFKakJJTW8?oc=5,1758808800,Here’s How a New York It-Girl Shops H&M’s New São Paulo-Inspired Collection - Marie Claire,Here’s How a New York It-Girl Shops H&M’s New São Paulo-Inspired Collection - Marie Claire
gnews,fashion trend,news.google.com,https://news.google.com/rss/articles/CBMisgFBVV95cUxNVlg5OGY1WkNhOFN4cEFRUjlaTHpKaUNiazJJdnh2Qks4Q212eVdyR2c4Q3p6Zk90UmdMa1UtTlhBUWh2VlRNTy1EX0xMMkNMWHR6R2tRblh3WlMtMXk2WjNyeUtEWllwMDJWbnprNkFYZzltSFA0QTEwTjZPTnVCWjgyOS1iTUVBNGVTOURhVllKZF9qUzJ6RF9ZVzZIZVhuT1B1SFVqZzFWOWhEZEVGVVZR?oc=5,1758910563,Naomi Campbell Can't Get Through Fashion Week Without These New Balance 9060 Sneakers - Marie Claire,Naomi Campbell Can't Get Through Fashion Week Without These New Balance 9060 Sneakers - Marie Claire
gnews,fashion trend,news.google.com,https://news.google.com/rss/articles/CBMickFVX3lxTE1IWnFuSTM1M2dYVk8tZGoxbFhYU3l3VEltbllDaEZBaFB2emxFTVhXdGhnUEZObVh1YlM2NGdsTlFxYW9taWQtN0RsSGhYVUpKMC1LbXVCT3FNNXFzNXdwMWxrYi1qdWZqNEhvSVZiV1ZYZw?oc=5,1758912825,"The IYKYK Jacket Color Trend People With Taste Are Wearing More Than Black, Navy, and Even Red This Fall - Who What Wear","The IYKYK Jacket Color Trend People With Taste Are Wearing More Than Black, Navy, and Even Red This Fall - Who What Wear"
gnews,fashion trend,news.google.com,https://news.google.com/rss/articles/CBMiyAFBVV95cUxQNkYyYkRncElRYjVfMjZwc2dIXzhZNmUya29IM3pwbm5yZ3RfQlNhS2NtLXc0bUFCSElFcnBVa3ZOakVSanU2a1NkQnlNMXNRMDVRZHhGZmNxR2llUWM2a2g0U3g2eWhkdWhDZ3N0OVc5aEx0SGV4TkZMQjBwY2lqWnRmc1JpTV9XNkoyalEzZnVFZUJsLUc5QnNRbTRtM3h1VGJMa1QyVHJMMmJfcTItMVhrOWFqVFlvUzJuWk1VNUNiVHh5TFVFM9IBzgFBVV95cUxPUzZoYUZITEhwNG5wUl9Ebmp4RUxkUnZsR2RCV053S2s1YVhkUDlsTW5VNHljMlpEUlloRTVhMlI1c3Zfc3l1NzFnOF9oU3U0N0ZsTlI0NjNZQWVMcEdLLUdKcGNycjVlc2VIc1RURmM2dks5TXd4ME5DQUE1ZXFDcTNUOVhlVzFpQ2hDQVJ4bmI4MTVWRmpNTzRBWGt1RDVTbFRhMnplVFpWMGN2Y2Vha2ZJdG5BTjIxckxZZ1pkX0ppYUFiaFNtOTdGUmlLQQ?oc=5,1758945242,BLACKPINK’s Jennie shows how to wear the ‘low-rise’ trend like a fashion icon - The Korea Times,BLACKPINK’s Jennie shows how to wear the ‘low-rise’ trend like a fashion icon - The Korea Times
gnews,fashion trend,news.google.com,https://news.google.com/rss/articles/CBMilwFBVV95cUxNQmJFVVE1MEJ3X2haamF3VjJRR3otcGFYbE5hVHQ1TkFwX2dIMWY4UjUwc1hnZlJCcmMwMWk1RlRSR3dXWHAtYnNVUjdFZFpybUxRX3g2TzlkNEl1cG1fcFNxZVdsdmJLcTltRkloZzMwN2RFTnFmeG1wRTJ6ZTB6c0NQMFZUc1h0MUY2RkRSbjlzaXd6WTRR?oc=5,1758729183,The 8 Trends From London Fashion Week to Incorporate Into Your Wardrobe Now - ELLE,The 8 Trends From London Fashion Week to Incorporate Into Your Wardrobe Now - ELLE
gnews,fashion trend,news.google.com,https://news.google.com/rss/articles/CBMifEFVX3lxTFBQQlZWcC1hTU1rM1gxYmpZakxnaWxWV3U1UUtCMGRQYWUzd201ZGZRd0piQkJLNEFNZm5YS3JnOUNUUUVIM3RtelhXdmVpT29OcncyR3d4VFAyT1lJVUdzekJXTnZRTGlBamVOdmx5TmVqN09CQnRySmtGUFo?oc=5,1758814389,Ladylike Elegance At Goodwood Revival 2025: The Vintage Fashion Trend to Know - Grazia Daily UK,Ladylike Elegance At Goodwood Revival 2025: The Vintage Fashion Trend to Know - Grazia Daily UK
gnews,fashion trend,news.google.com,https://news.google.com/rss/articles/CBMixAFBVV95cUxQdU5mYmZ5UnNJV0c5bl9lZ0J6dU15X1R4WDZIT1hHNTRtY0phNEYwc0lSUkdZX1lDRjdHOUdrSWU5djdjTXNVUWJtWTU5aFdvVUxkSnVJWHdqWWdKUVV6TkJxWTZOcVRvM0w0N1dPZ0gyaVByTHBqOV9kLTFqcnBxVUN5ZEFYa1UyWWtkTFNaLVZMNVRKSl9vR3FZb0ROckkzNzZaTFF0dVRjclA5cVRFRTBIcWQ5MUNyOER2NVBmSE9oNHY1?oc=5,1758820180,Ashley Graham Makes Her Grand Milan Fashion Week Comeback in a Dark Brown Boss Midi Dress - Marie Claire,Ashley Graham Makes Her Grand Milan Fashion Week Comeback in a Dark Brown Boss Midi Dress - Marie Claire
gnews,fashion trend,news.google.com,https://news.google.com/rss/articles/CBMic0FVX3lxTE91S01DOFdvanFrOHluUWZZV2hzX2tzOFY5TW1xWThXd0VVemFldl9RT2xLWUp2OThrUFBLeWJIaTg1NjAtdklWYWNIMjFkWWlPV0w4TTc2UE1UdUhfOXRGckNhZXNHWngtbTQ4TjR0UXVWRVk?oc=5,1758783600,Cooler Than a Trench—This Coat Trend Is Quietly Taking Over for Fall - Who What Wear,Cooler Than a Trench—This Coat Trend Is Quietly Taking Over for Fall - Who What Wear
gnews,fashion trend,news.google.com,https://news.google.com/rss/articles/CBMisAFBVV95cUxQbVhhSU9jWWRzYW5pWFlDVmhORnVkQWRwQlROVG1nb1FzajdOM3dDNG5ZZm1RT2pWSXpwWE50by1jMmdja0hZRDRIRGM2eGY1Ym9GaFlxXy1xOTFMVmxma2pQSVBmRF8wLVhQbVV4X0wyX044QUlwUnA1aEtwYkF2b2xlY1pXRjhkWWZqNlFvNWl1T1hXNmdOT1kxWmh0OU5oNDFkZjJ3dnR5M19ZM0p3MA?oc=5,1758850200,Prada injects glamour into its collection inspired by uniform - The Guardian,Prada injects glamour into its collection inspired by uniform - The Guardian
gnews,fashion trend,news.google.com,https://news.google.com/rss/articles/CBMitgFBVV95cUxPRDJyQUMtT1Utd3J4LXdPTGk0M2xyUXJmVDNja091dHFUOC1HSzFDbjZlOWIyUkh1TEZOeFNWUEtzeXJKcXE1dTZBYW5qajF2b0Y2NVlwTTc0WEtrWDAwaTNZWW5KcWlJS1RfSnVOeVB6aENZMHZBbmJIcTlqY1hnRGN6LUE0V1dYRGRfLS1FS2g3LVN0eEJfU1JKRlRjc0tWaGMteUdyc0IweHpIcTJqazhWVXVjdw?oc=5,1758895228,Love Island USA's Olandria Carthen Is Taking The Peakaboo Bra Trend to the Next Level - Teen Vogue,Love Island USA's Olandria Carthen Is Taking The Peakaboo Bra Trend to the Next Level - Teen Vogue
gnews,fashion trend,news.google.com,https://news.google.com/rss/articles/CBMiiwFBVV95cUxQbk9mbGtpVDdMQUpGZ3ZwSlRXZUVSdXZXTkE4ck5zNlRELVpwaXp6blpaWVFEOTlpdVhDUWpTdnF1a1NacjJDclhWcmVuZ1M3WmRrT1NlaXpYWHpHZ2E3YXJHbDFWRTNLdm5qOTA1TUFETnJVQUcwTDBkUXJHbXVCSnpNaVVTSi0tdUR3?oc=5,1758909260,"The ""Boring"" Fall 2025 Pant Trend Well-Dressed People Are Trading Black Trousers For - Who What Wear","The ""Boring"" Fall 2025 Pant Trend Well-Dressed People Are Trading Black Trousers For - Who What Wear"
gnews,fashion trend,news.google.com,https://news.google.com/rss/articles/CBMiowFBVV95cUxPbU9HQmE0akVhSEdsNlJVVS1WQlhmWklfUzh1LXl5U2xMWmRDLWJOWlRieWIyTnUzQ2M5Ul8zb1hmcEx2dnhwcHFOR3VlMWJydENJYmpMZ3Yyb1dJTkdXci1NTm5KWnlmdjhtUVJBSjNOVWpBdnJUd1FHX1FGSE5KWThTeG9zUGkwNUJVTUh6SU5XTHQzREJNTHh1ODQ3Y0lZU0h30gGoAUFVX3lxTE5ZZkttZ0FtZXp5UFF2ZmR1SGt0LVZYTDNuQk5lbjFlUmZKSi14aWlZZjN3NXdQSElVajZpODFMRGVhNkpRM1NSdUwzSk5tSjVlWW4yQzAzQWcweUxLc2pLc0hZbVVxclo3M0h0TVhpWDd4SXhRTXlHUUwyMjFBRGtPVzhwRkVYbXV5UWlCWFVrQkliazdablIzYUdXRVQzTjBlbWZSSk9QTw?oc=5,1758848539,The Wednesday Effect: The Resurgence of Goth Dark Academia Style - Prestige Hong Kong,The Wednesday Effect: The Resurgence of Goth Dark Academia Style - Prestige Hong Kong
gnews,fashion trend,news.google.com,https://news.google.com/rss/articles/CBMimAFBVV95cUxObEVrbXpMZ29DcWZ0b0ZyMThjYXJxYlZtTEF0bnY0amwyaW05TjVCd3ltUVpEWU5jQzhEenVQOGh5OTZZbVhfSkstUV9SNU94RFN2MmNnX0s5blFuWWxhT24xRnNobUxnQ0pVQjlSOUgtMjdQR3hvT0tkVWhia2RJa1QxWDFiUG1lWVpzd2ZSLVF0c29sOTlXWQ?oc=5,1758833322,Take Our Word For it: This Citrus Shade Is Replacing Butter Yellow - The Zoe Report,Take Our Word For it: This Citrus Shade Is Replacing Butter Yellow - The Zoe Report
gnews,fashion trend,news.google.com,https://news.google.com/rss/articles/CBMihAFBVV95cUxNczZEcHpJelFwOGFGVTF6VjJkam12STBlU3RJZ2MtVWROV3dDc1ZEeEFtT3gxNW80eGwwSk5kdGNwT2dnMnFCZ3k5eWJ2eDVTWmdvMEZwTTNUbmRzcFRQUHZWbEl6VzFNUkk1SWZMLW4zV2t3elVfSm0tNEZjQlZQaHpodXQ?oc=5,1758814651,Bella Hadid Ushers in Fall With the Season's Biggest Coat Trend - instyle.com,Bella Hadid Ushers in Fall With the Season's Biggest Coat Trend - instyle.com
gnews,fashion trend,news.google.com,https://news.google.com/rss/articles/CBMilwFBVV95cUxNQURGeGZucEh0bVE2YXBmdHY3ZG9GN0pJS0lBUjNFZm51RVFJNGRSbU15UUx3b1lwdVBDaGpONXM3bjQ2ek8yazlhVkxWa2h1QlRyenBycGxFS2dfYnRlRWJqcDFmOFh2ZzJ4T2FJT3U2VEdRbjlXTkJhN0poSUxvcnNZME5vRG5GRTVha1piUVBibjNYanIw?oc=5,1758652438,24 Trending Fall Pieces I'd Grab Before They're Gone for the Season - Marie Claire,24 Trending Fall Pieces I'd Grab Before They're Gone for the Season - Marie Claire
gnews,fashion trend,news.google.com,https://news.google.com/rss/articles/CBMipgFBVV95cUxONTRwa2M4TVJQcTBiMHZZMkFKOGxJQmVyQVhsaDVDVmQ3eHR2TUpxcG1PUXVYMnBFc2UzYXMyeHVQQmdybUJfcUF2eUdsb2VPUmtUdV9YSUYyYU90bE8wX1gxRno1Y25NaEtEUkdGcE5fRnhsMUJGckM0UC1yY21xLXEzbjNRcGVob0l2NjlmLTRMck5MRFhBOEhUZGp1ejBTNUZsaVlB?oc=5,1758747479,Bella Hadid Starts Paris Fashion Week Early With a New Coach Bag - Marie Claire,Bella Hadid Starts Paris Fashion Week Early With a New Coach Bag - Marie Claire
gnews,fashion trend,news.google.com,https://news.google.com/rss/articles/CBMirgFBVV95cUxQR2xSeU9GR3hWQm9aUF9tQlh1aWZ6NWJ0Yk9pV3l1TmNhZkJscFg5eEJETXdRRlgwQXhvWnRTcmZ6YVhzU3YxMmJPVk9fWTQ0akZTbGhRY2I4TkFJNFRfRll4OThUR25XUmFxR1B6S2VSSFpSdGh5dXRXNkx2bWRKTG45LUw2blF4WEhxbDZTcXNHOG5ueFJNSDd0VlhfZnNWVDdaWGZhbmxib1p5RXc?oc=5,1758658620,"Exclusive | Stacy London talks fall’s top trends, from leopard print to the surprising shade that’s the ‘new black’ - Page Six","Exclusive | Stacy London talks fall’s top trends, from leopard print to the surprising shade that’s the ‘new black’ - Page Six"
gnews,fashion trend,news.google.com,https://news.google.com/rss/articles/CBMigAFBVV95cUxQMkFta21JQ3JwYVFoQk1RdlJTUENWdTdDcW43YnBrcHVzY1AtT00wWTZ4ZnZpWFBUVTRZb3R3ZU03YjlWa1ByVHVjRjlDSWhNX212QTY1NkVldjdPUUp1RFU2UUFUcUpDd0xuS3FBY3ljZDctd3dJaTlUZk5iLXkxTA?oc=5,1758697200,*Not* Ankle Boots—The Rich-Looking Shoe Trend That’s Quietly Taking Over for Fall 2025 - Who What Wear,*Not* Ankle Boots—The Rich-Looking Shoe Trend That’s Quietly Taking Over for Fall 2025 - Who What Wear
gnews,fashion trend,news.google.com,https://news.google.com/rss/articles/CBMiggFBVV95cUxNR2dCQXEtNy1qUVZodGFMcUdOaTFxSWVYNVpCNFpLcGN2NXdDMU9fNXBtaDJEUVhzdzF6UmFQcVpkaGJ3dG9yYTd2eFNma2xlOG5DaWxadUpnWjJKNzdiQzRzdWJuemY5NVBmTmhsM2MtVzh1ZTlELTQ2eFdJdU1DeW9B?oc=5,1758801600,Croc-Embossed Boots Are the Top Shoe Trend for Fall 2025 - Who What Wear,Croc-Embossed Boots Are the Top Shoe Trend for Fall 2025 - Who What Wear
gnews,fashion trend,news.google.com,https://news.google.com/rss/articles/CBMimgFBVV95cUxOODhlZGUzRkxJM1BNZEVucVBZRGYtd1RzQ3FmUFY5ZGtmVm5aTE9LQUVVaGhiWURfVXlnR25uYzJmUjhTTmdlcjRUdzQwcXhHU2Q4N0tpZFFmdzlyYjRzbmhESXh4Qm5fMkFTNjdldzVpdDgxUW50dzJLWER1Q0x6RHQ5eTJxZmR5YllTQ1hDNmJqdGw3bjF5NF9R?oc=5,1757487600,6 fall fashion trends you'll be seeing everywhere this season - CBC,6 fall fashion trends you'll be seeing everywhere this season - CBC
gnews,fashion trend,news.google.com,https://news.google.com/rss/articles/CBMiZkFVX3lxTFBIZFNIZzA3c1Q0QkN0djVMQjBKMVp2aEIwa0lSVlRBZWxLWWo3eGpKLXlkUlZVWEJ0dTBjNkFja3ZwTUExLU1ad0txeU9jZ1pPcGRIbUstMjBxSk1KSk5QcVlCQ3Y3dw?oc=5,1757660400,Why Sporty Collegiate Is the Trend Defining Fall - PureWow,Why Sporty Collegiate Is the Trend Defining Fall - PureWow
gnews,fashion trend,news.google.com,https://news.google.com/rss/articles/CBMiUEFVX3lxTE9UcnBraVlCcEdMV1RJT3BjWE1pYldyRzlkWUw0eGlfd0doREpqVUkzVFAzUUszZWJob3c5ZHFHUVRkLXFjTXh3UnZ3STVKaVZY?oc=5,1758729575,How to thrift fall's biggest fashion trends - CBC,How to thrift fall's biggest fashion trends - CBC
gnews,fashion trend,news.google.com,https://news.google.com/rss/articles/CBMiV0FVX3lxTE11Y1NBN01vYm9EWHBRaVoyT1hTcWhFb3hrQnpXbUV5ZUVTNUQxaF8zdHNUcllVanBFc3h0SEw0SVpKcGdMZk8zRDIwN1pYV05Ybk5TTndQRQ?oc=5,1758712293,Millennials and Gen Z Finally Agree on Something—These 16 '00s Trends Are Making a Comeback - Who What Wear,Millennials and Gen Z Finally Agree on Something—These 16 '00s Trends Are Making a Comeback - Who What Wear
gnews,fashion trend,news.google.com,https://news.google.com/rss/articles/CBMikwFBVV95cUxNZDg3TDdlOTVEUHdoV2lha1ZHSmRQMy1sMnFyWFFhQmx1TkJnd1BsbGpqM0ltTEZsbThjR25ZcUNGcXB5MW5NQXpzSUhQVG1ld3VheTVLY2Q5YVlYY1FyOHBzckIteV9OTVpORHRmV1lJR1pqd2NIVVNHZmVUVmlkN0o5R3Z2SEhtSWdPMzY1T3AzbW8?oc=5,1758820312,How to Style Ladies Jeans Fashion This Autumn - fashion.ie,How to Style Ladies Jeans Fashion This Autumn - fashion.ie
gnews,fashion trend,news.google.com,https://news.google.com/rss/articles/CBMirgJBVV95cUxQUnFqOW1sb1pjbElnbHNRcmpZRzBybkdPaXpZaVpUWHQ4Z2hzT1J2N3VXTUtGc3ZmZjJuWmpIV3F3MXFvRzIxUmNyWEhINGRDV2g3TkJBVVBvUEw4OXdNeE5LTWNScjVjcW9ENW1SSTlsT3N0cTdBTnE4a2JoYy1zT0dYYnN2SGpBMlRuWXFLaExjam5QeFBzR2pwV0ZGVEFhZ0ZGeVVMam1tV1FiTEdQNWlZYWVfUVE3TUZHMXlTMGdreThhellQNTRXdnl1eWRQV09rX0ZleWRmbGQxX3M0OWI2eEJZS04yQU9NSXVKbmtSNjVMSzdRNW5SSzZxbEJDQUVURk4ySnJYMmJ1bWVqYW9sZllaNFptOG1vUE5MOUxNcGRyTkViSnBRQWtaUQ?oc=5,1758941160,"Define a New Trend in Autumn Fashion, COOFANDY, Zeagoo, PINSPARK Joint Pop-up Event Successfully Concludes at American Dream Mall - The Globe and Mail","Define a New Trend in Autumn Fashion, COOFANDY, Zeagoo, PINSPARK Joint Pop-up Event Successfully Concludes at American Dream Mall - The Globe and Mail"
gnews,fashion trend,news.google.com,https://news.google.com/rss/articles/CBMibkFVX3lxTE9YMmhvMHJrUjVESFhCaE5DeUtlbVF2bkl0MTAyeTlSd2V4bEEtTFN3MFdHcU5hQURBamx2UkpJNDdpUU5ycFA4V1ZNWlo0aVl0OXJ0X0lRbU9jcUZocVZqMEdIM0kyaFFseWVXMTVB?oc=5,1757919600,10 Fall Trends GQ Staffers Are Shopping Right Now - GQ,10 Fall Trends GQ Staffers Are Shopping Right Now - GQ
gnews,fashion trend,news.google.com,https://news.google.com/rss/articles/CBMigAFBVV95cUxOa1VSZ3RsYk00QlBOVU9WaURQcDJ5S010bEFDcmhTRThQN2RaR2VySklrOG5UUjlqSHEyN0FhOVhFYTltMEZWWnd4bGRGY3Z4aXoxbUZ5ZHhuUFV6a0pmc3pOWlRZdUVFSU9yNGhvNlBEazN3dmJmS1doTkloVVk3QQ?oc=5,1758797251,Millennials furious as Gen Z bring back ‘camel toe’ trend on unexpected body part - tyla.com,Millennials furious as Gen Z bring back ‘camel toe’ trend on unexpected body part - tyla.com
gnews,fashion trend,news.google.com,https://news.google.com/rss/articles/CBMilAFBVV95cUxOd3c2cHpzS1Z0MHBFeWdjUHlaakFXbDdFSjRHNHdOMzVveDF0SWN1UWRkd0ZsenNWOVdkN0s2R3FPNE1hM2kzTUU0YlpxWTFpelZGeDJEdnJDZDFXNWpwY3o2em9jVm9Bc3g1RDhnZjlyeUFvcUFhZDc3NC1pYllJa1VSaW1RVmt3ZElidm1CZHdTZW8w?oc=5,1757487600,The Fisherman Core Fashion Trend Will Lure You in This Fall - The Pioneer Woman,The Fisherman Core Fashion Trend Will Lure You in This Fall - The Pioneer Woman
gnews,fashion trend,news.google.com,https://news.google.com/rss/articles/CBMiY0FVX3lxTE5iYkFYM0ZPSGt6WGQzSHlPb0taQlppUTRTcWx0YmFhUnlnZjBzOG9NRVZRdHcyN1h3MUh1bVAyTml6M0w5QXBEMGxtdVdGUm1hUnVjMHpWMVJucUYyaEtld3VPTQ?oc=5,1758958891,Why Jenna Ortega’s Wednesday Style Is Defining a New Fashion Trend - Zoom Bangla News,Why Jenna Ortega’s Wednesday Style Is Defining a New Fashion Trend - Zoom Bangla News
gnews,fashion trend,news.google.com,https://news.google.com/rss/articles/CBMieEFVX3lxTE9qQU5CaWROTDdtOUdBUkVTMkpEWXRQYjdyN1hsUzFHR0pPbDhmeGZVcTJLZ3pISkNMbC0zS0lqa2VZYjNYQWZkM21BdWdUNzBMZThuM1VOdzVZNEg5bFpSNm5vVklPQnZPYWtHMUdXanpPdy1HYXlmeA?oc=5,1758697200,The Italian Bob Is Officially The Haircut Of Autumn 2025 – Here’s How To Style It - ELLE,The Italian Bob Is Officially The Haircut Of Autumn 2025 – Here’s How To Style It - ELLE
gnews,fashion trend,news.google.com,https://news.google.com/rss/articles/CBMie0FVX3lxTE1wenNLa0s2UnRLd01iMjZSTHcycTVtTVlLV2tQQjBLWjJiaDZCNUNSektnYVBlRTY0ZzlibFNoQWRFUHRfSXFYYXhxelRudFI3dXFtVEFJQXBOSmh0T195eE9GNlUzaW9CVWJTRjJ4TmZ1SzVQN1hlOFd2WQ?oc=5,1757833200,Think catwalk fashion is unrelatable? Think again. Here are the most wearable autumn/winter fashion trends 2025 - Woman & Home,Think catwalk fashion is unrelatable? Think again. Here are the most wearable autumn/winter fashion trends 2025 - Woman & Home
gnews,fashion trend,news.google.com,https://news.google.com/rss/articles/CBMie0FVX3lxTE5WZ0N2c3cxVjJiMFhpVVdIa29zblR1Z2JqUkplZlhlMWFNTU5BbWJvSW5ZcXRnQ0FQbTBqdUhtamg5a1I5VXljV3gxUU5FcDFkZnA2TFJBWld4WkN6UWU3dHdhWkFYb1FFeEZuZWJxa3p1YW9udE5mUjNYYw?oc=5,1758758594,The best street style at Milan Fashion Week SS26 - RUSSH,The best street style at Milan Fashion Week SS26 - RUSSH
gnews,fashion trend,news.google.com,https://news.google.com/rss/articles/CBMiogFBVV95cUxOdHVGck5KMjljWnZVbE5PV2d5aTc1WU5oYUhmc1REWmhpYzJKVWZ2UVFrTmZ2TGh3Q0lKd2x4d25BLVFua1VmTS1TMnN1bUNqRVJUYmd2RFdOY1A3dVJOX2hHdTk4cmdUUnN3eWZKM2wxRU5Lck1tYWQ5TVBJeWdfcmxGc2pXamt1Y2t2M3NQdUNkazA4TUdjZjAtM2tNMndoeWc?oc=5,1755846000,The Minimalist's Guide to Styling Fall's Most Out-There Trends - Marie Claire,The Minimalist's Guide to Styling Fall's Most Out-There Trends - Marie Claire
