source,query,url,created_utc,title,text
youtube,men's fashion trends,https://www.youtube.com/watch?v=Te874GgE9-Q,1761550223,Best Linen Outfit Combo For Men&#39;s Under budget #shorts #fashiontrends,
youtube,men's fashion trends,https://www.youtube.com/watch?v=BB_hgAgKjqA,1761547248,Black Minimalist Men&#39;s Fashion | Stylish Outfit Ideas 2025 #shorts,"Discover the most trendy black outfits, modern looks, and minimal aesthetic styles for men in 2025. Perfect for those who love ..."
youtube,men's fashion trends,https://www.youtube.com/watch?v=TDwnyXF6Cbk,1761546616,Subscribe us for the ultimate men’s fashion guide — where style meets class #mensfashion #menswear,"Welcome to The Trends Thread – Your Ultimate Fashion Guide! Stay ahead of the curve with the latest fashion trends, expert ..."
youtube,men's fashion trends,https://www.youtube.com/watch?v=88HVIrbvadg,1761540375,How Did 1960s Counterculture Change Men&#39;s Fashion? - I&#39;m a 60s Baby,How Did 1960s Counterculture Change Men's Fashion? Have you ever wondered how fashion evolved during the vibrant 1960s ...
youtube,men's fashion trends,https://www.youtube.com/watch?v=6aODv6yWX94,1761540180,Just Woww...👀💗🙈#viralshort #fashion #fashiontrends #attractive #fashionideas #explore #outfit,Just Woww...      #viralshort #fashion #fashiontrends #attractive #fashionideas #explore #outfit @Meesho #viralshort #fashion ...
youtube,men's fashion trends,https://www.youtube.com/watch?v=EsOu_BBZfRg,1761537202,Top Five Formal outfits #internationaltrends #trendssin9 #fashion #internationaltrends #fashion,Top Five Formal outfits #internationaltrends #trendssin9 #fashion #internationaltrends #fashion ✓ Attractive Formal Outfit Ideas ...
youtube,men's fashion trends,https://www.youtube.com/watch?v=-TZ7CmZ2ce4,1761536073,🤫Best Color combinations | men&#39;s wear #mensfashion #menswear #mensoutfit #fashion #trendingsong 🙀,Best Color combinations | men's wear #mensfashion #menswear #mensoutfit #fashion #trendingsong #fashiontrends ...
youtube,men's fashion trends,https://www.youtube.com/watch?v=SSghQacc_64,1761514146,Men’s Necklace Trends 2025 | From Silver Chains to Modern Pendants,Men's fashion in 2025 is all about statement accessories — and necklaces are taking the spotlight! ⚡ From sleek silver chains ...
youtube,men's fashion trends,https://www.youtube.com/watch?v=aJoc_24HROM,1761506883,Walk Like a Legend 🖤 | The Art of Men’s Elegance | Cinematic Fashion Vibes 2025 #shorts,"Confidence isn't spoken — it's walked. This cinematic men's fashion clip captures the essence of modern luxury: power, silence, ..."
youtube,men's fashion trends,https://www.youtube.com/watch?v=3N9JGJj7qco,1761505402,The Power of Style 💥 | Walking Like a King in All Black | Luxury Men’s Fashion 2025 #shorts,"Step into the world of luxury and confidence. In this cinematic fashion short, we capture the essence of masculine elegance — an ..."
youtube,men's fashion trends,https://www.youtube.com/watch?v=WxT-GmMASA4,1761496212,Must buy cargo for men 🔥,"fashion, outfit ideas, dress styling, fashion tips, wardrobe essentials, outfit inspiration, casual dresses, formal wear, summer ..."
youtube,men's fashion trends,https://www.youtube.com/watch?v=c2-m3Ful_k0,1761494966,Trending Shirt Available | Chath Puja Offer @fashionzonemenswear #trending #viralshort #trend,Trending Shirt Available | Chath Puja Offer @fashionzonemenswear #trending #viralshort #trend @fashionzonemenswear chath ...
youtube,men's fashion trends,https://www.youtube.com/watch?v=GerCXKU3U6c,1761489014,Best Blue Linen Shirt For Men&#39;s Under budget #shorts #fashiontrends,
youtube,men's fashion trends,https://www.youtube.com/watch?v=4lYqWkoQbxQ,1761487213,Men’s style #shortsfeed #fashion trends#primarkcollection  ion,
youtube,men's fashion trends,https://www.youtube.com/watch?v=0m-9hQ_loDk,1761485700,Level Up Your Style: Men’s Suit Inspiration #shorts #groomstylehub,Level Up Your Style: Men's Suit Inspiration #shorts #groomstylehub Want to elevate your style game? Check out this classic ...
youtube,men's fashion trends,https://www.youtube.com/watch?v=cB0QWm2QJgY,1761483697,#bollywood #love #hindisong #song #bollywoodsongs #fashiontrends #fashion #ootdguide #streetstyle,
youtube,men's fashion trends,https://www.youtube.com/watch?v=X2LL-bQznEU,1761481484,Indian Men’s Fashion and Grooming Trends | Kariz Misha,Indian Men's Fashion and Grooming Trends | Kariz Misha #IndianMensFashion #MensGrooming #KarizMisha Indian men's ...
youtube,men's fashion trends,https://www.youtube.com/watch?v=f7tUEJCTgpE,1761480074,Stylish Fall Menswear Trends and Swiss Watches.,fallmenswear #autumnmensfashion #wintermensfashion #mensfashiontrends #italianmenswear #mensfashion #mensstyle ...
youtube,men's fashion trends,https://www.youtube.com/watch?v=BEOFYTRThyY,1761479244,The Ultimate Guide to Timeless Men’s Fashion. #punjabisong #music #song #punjabimusic #humblemusic,The Ultimate Guide to Timeless Men's Fashion is here to revolutionize your wardrobe with classic wardrobe essentials and casual ...
youtube,men's fashion trends,https://www.youtube.com/watch?v=Ri9hdVNHFv4,1761476818,KURTA PAJAMA - TRADITIONAL😎 #fashion #fashiontrends #fashionstyle #transition #diwali #clothing,Level up your style game with the best fashion and grooming tips for both men and women From classy outfit ideas and ...
youtube,men's fashion trends,https://www.youtube.com/watch?v=qKYfxezaq7U,1761476485,Fall 2025 Fashion Trends Every Man Over 30 Will Regret Buying,"If you're a man over 30, this is your warning — not every trend this fall is worth your money. In this video, we're breaking down the ..."
youtube,men's fashion trends,https://www.youtube.com/watch?v=sZF1AOz6Fu0,1761471006,TOP WINTER OUTFIT  TRENDS THIS YEAR | best winter outfit | men&#39;s fashion🔥| under ₹1000,10 MUST HAVE WINTER CLOTHES FOR MEN | best winter outfit under budget | HINDI Top Winter outfit Trends This Year ...
youtube,men's fashion trends,https://www.youtube.com/watch?v=LzUz14aaMG8,1761470092,Men’s Fashion 2025 😎 | Trendy Looks That Turn Heads 🚶‍♂️🔥,Get ready to upgrade your wardrobe with the hottest men's fashion trends of 2025 — from plaid shirts and short-fit chinos to ...
youtube,men's fashion trends,https://www.youtube.com/watch?v=KEfCidzwQw4,1761463752,“New Arrival Polo T-Shirts 😎 | Men’s Fashion 2025 | Pioneer Trends Vizag” #vizag #shoes,"Hi, Hello! This is Pioneer Shoes Store We have new collections updated daily! Follow us on Instagram, YouTube, and all social ..."
youtube,men's fashion trends,https://www.youtube.com/watch?v=wSehquwhc4U,1761463836,Best Polo T Shirt combo for men Under budget #shorts #fashiontrends,
youtube,women's fashion trends,https://www.youtube.com/watch?v=7jm5_NQmHo8,1761550557,नादी लागू नको माझ्या #love #fashiontrends #song #summerfashion #motivation,नादी लागू नको माझ्या #love #fashiontrends #song #summerfashion #motivation.
youtube,women's fashion trends,https://www.youtube.com/watch?v=Z4osydORtUM,1761549407,“Crop Top Skirt Set | Latest Women’s Fashion Trends 2025 | Elegant Partywear &amp; Festive Collection |,"Hi, Hello! This is Pioneer Shoes Store We have new collections updated daily! Follow us on Instagram, YouTube, and all social ..."
youtube,women's fashion trends,https://www.youtube.com/watch?v=81WCrK24y24,1761549000,Nind hamari piya tune churai || Indian_Idol_Performance| #indianidol15#comedy#trending#fashiontrends,Nind hamari piya tune churai || Indian_Idol_Performance| #indianidol15#comedy#trending#fashiontrends#performence #funny ...
youtube,women's fashion trends,https://www.youtube.com/watch?v=CAonFEw_pCw,1761547389,Falak Tak 😘 #love #song #bollywood #somabit #fashiontrends #youtubeshorts #shortsviral #shorts,Falak Tak #love #song #bollywood #somabit #fashiontrends #youtubeshorts #shortsviral #shorts #trend #trendingshorts ...
youtube,women's fashion trends,https://www.youtube.com/watch?v=htyPnTbQIlg,1761546925,Latest Fashion Trends 2025 | Stylish Dress Ideas | #ZonishaNaeem,"Discover the latest fashion trends of 2025 — featuring elegant, modern, and stylish dresses for every occasion. From party wear to ..."
youtube,women's fashion trends,https://www.youtube.com/watch?v=eAZaLyAOd7Q,1761546621,Coca-Cola 2 #viralsong# nehakakkar#trending #dance #fashiontrends #ytshorts #djremix,Coca-Cola 2 #viralsong# nehakakkar#trending #dance #fashiontrends #ytshorts #djremix.
youtube,women's fashion trends,https://www.youtube.com/watch?v=sccTpZ5l0zM,1761545982,"Price, 299 sale New sale market new suj kapda#fashionsale  #fashiontrends #fashionstyle #shorts","Price, 299 sale New sale market new suj kapda#fashionsale #fashiontrends #fashionstyle #shorts 🛍️ New Market Fashion 2025 ..."
youtube,women's fashion trends,https://www.youtube.com/watch?v=1LkWNzt8g04,1761544397,9 mini dresses for b&#39;day🥂🎀 #fashion #fashiontrends #outfitideas #koreanfashion #milkmaid #fyp #viral,korean mini dresses for b'day https://www.wishlink.com/fashionnguide/collection/631842 Comment for links Focus on the ...
youtube,women's fashion trends,https://www.youtube.com/watch?v=Fq3ORx7aMVk,1761536317,Fancy long qameez design #weddingdress #dress #fashion #fancydress #fashiontrends #aafashiontrends,
youtube,women's fashion trends,https://www.youtube.com/watch?v=js7D3Q_cOh0,1761527863,How to style our hourglass body shape. ✅#ootdguide #fashiontrends #dressootd #curvydenim #outfitblog,Main Keywords hourglass body shape how to style hourglass body hourglass body outfits fashion for hourglass body styling tips ...
youtube,women's fashion trends,https://www.youtube.com/watch?v=SRFRARZfrCc,1761524168,#Middle-aged and elderly women&#39;s clothing #Fashionable and versatile,"Discover the latest jeans, trousers, tops, shirts, dresses, kurti, dupatta, abaya, casual wear, office wear, party wear outfit ideas for ..."
youtube,women's fashion trends,https://www.youtube.com/watch?v=bxwvqPVqRHE,1761522435,VESTIDOS ELEGANTES TENDÊNCIAS 2026. MODA  FEMININA.,"Moda de tendências 2026, Vestidos Casamento Hermosos e elegantes. Vestidos com blazer , saias com blazer. Conjuntos ..."
youtube,women's fashion trends,https://www.youtube.com/watch?v=WiBZvDNZiJ0,1761516011,2025 Hottest Fall Fashion Trends,"HEY GWURL! WELCOME! FIRST, LET'S MAKE SURE YOU ARE **SUBSCRIBED** AND DON'T FORGET TO CLICK YOUR ..."
youtube,women's fashion trends,https://www.youtube.com/watch?v=uq9rp14ceWc,1761511804,Plus Size Beauty || #ytshorts #shortsfeed #fashiontrends,"Credit Goes to Real Owner ✨ Welcome to ""Fashion Frontier — Where Plus Size Beauty Meets High Fashion! ✨ Here, we ..."
youtube,women's fashion trends,https://www.youtube.com/watch?v=pnrKaA-LJKw,1761511200,"Plus Size, Perfect Style: Rocking the Latest Fashion Trends || #ytshorts #shortsfeed #fashiontrends","Credit Goes to Real Owner ✨ Welcome to ""Fashion Frontier — Where Plus Size Beauty Meets High Fashion! ✨ Here, we ..."
youtube,women's fashion trends,https://www.youtube.com/watch?v=kSteeJO3Hh8,1761508015,Muslim vs Hindu#trending #shorts #video #bollywood #actress#fashiontrends #look #similar#song#viral,Muslim vs Hindu#trending #shorts #video #bollywood #actress#fashiontrends #look #similar#song#viral#ytshorts #ytvideo ...
youtube,women's fashion trends,https://www.youtube.com/watch?v=iBwUFn7PG2c,1761503071,বাজারে গিয়েছিলো ফিরে এসে ছেলের কান্ড #motivation #motivation #respecta #fashiontrends #love,বাজারে গিয়েছিলো ফিরে এসে ছেলের কান্ড #motivation #motivation #respecta #fashiontrends ...
youtube,women's fashion trends,https://www.youtube.com/watch?v=Q4f-J0OagJE,1761500202,Tendencias Moda Otoño-Invierno 🤗 Precios Increíbles ,FORMAS DE REALIZAR TUS PEDIDOS… Y SI QUIERES SER LA PRIMERA EN RECIBIR LOS VÍDEOS SUSCRÍBETE A ...
youtube,women's fashion trends,https://www.youtube.com/watch?v=GBHmXfbK6Bo,1761500114,how to look tall #fashiontips #fashiontrends #clothingstyle @venusdiaries222,"hey everyone,welcome back to our channel. this video serves #fashiontips for #shortheight girls #howtolookstylish & tall by ..."
youtube,women's fashion trends,https://www.youtube.com/watch?v=aa51tiRIzgA,1761494096,zim zim pani ma #song #newsong #hindisong #love #coversong #trending #maharastrachi #fashiontrends,"YouTube copyright concerns the legal protection of content, especially audio and video, and how it applies to content uploaded ..."
youtube,women's fashion trends,https://www.youtube.com/watch?v=jd6kDE22oGo,1761494153,#korean #bollywoodsongs #fashiontrends,
youtube,women's fashion trends,https://www.youtube.com/watch?v=Z5kYNhvLUvc,1761493503,"Price, 299 sale New sale market new suj kapda#fashionsale  #fashiontrends #fashionstyle #shorts","Price, 299 sale New sale market new suj kapda#fashionsale #fashiontrends #fashionstyle #shorts 🛍️ New Market Fashion 2025 ..."
youtube,women's fashion trends,https://www.youtube.com/watch?v=P6SeqN5tqpk,1761491472,Women&#39;s twin overweight oversized chiffon five point jagar round sleeve #fashiontrends #fashion,
youtube,women's fashion trends,https://www.youtube.com/watch?v=vsFF5Cunv84,1761490282,#fashiontrends #africanfashion #fashion,
youtube,women's fashion trends,https://www.youtube.com/watch?v=Ff9MR-8tFgY,1761489902,ladies suit ki aasan cutting ✂️🪡 shorts video #dress #womensfashion #fashion #fashiontrends,ladies suit ki aasan cutting ✂️   shorts video #dress #womensfashion #fashion #fashiontrends #frock #frockdesign #diy #ideas ...
youtube,streetwear 2025,https://www.youtube.com/watch?v=BKPv9rwT_IY,1761536836,COMING SOON! HADE 2025 #shorts #streetwear #viral #clothing #fypシ #sneakers #views #shirts #trending,
youtube,streetwear 2025,https://www.youtube.com/watch?v=PVHdOpCt6h0,1761528863,PURPLE BAPE SHARK HOODIE IN 2025?! | IS IT STILL HYPE? #bape #streetwear #fashion #outfitideas,
youtube,streetwear 2025,https://www.youtube.com/watch?v=OP62GYQ3u18,1761511194,KAOS DENIM (new StreetWear for you to check out) #fashion #streetwear #whattowear #style,
youtube,streetwear 2025,https://www.youtube.com/watch?v=k9dvzzZWUhI,1761505278,Diese Jacken...🤯 #peso #zara #systemic #pufferjacke #winterjacke #streetwear,
youtube,streetwear 2025,https://www.youtube.com/watch?v=mjFMOx-9i94,1761498072,OOTD Challenge 2025 💖 | Viral Street Style for Girls 👗,Discover the latest **viral street styles** and **OOTD ideas** from around the world! From casual **streetwear** to chic outfits ...
youtube,streetwear 2025,https://www.youtube.com/watch?v=t_8nDfV2tpw,1761495980,Finding new clothes is tough work in 2025. #fashion #jacket #gorpcore #streetwear #fashionbrand,
youtube,streetwear 2025,https://www.youtube.com/watch?v=M6G2nFp2NY4,1761487086,2025 American Hip-hop Oversized T-shirt Y2K Streetwear Men Casual High Street Harajuku Trendy Pure C,2025 American Hip-hop Oversized T-shirt Y2K Streetwear Men Casual High Street Harajuku Trendy Pure Cotton Round Neck top ...
youtube,streetwear 2025,https://www.youtube.com/watch?v=WkFtv0Z-OFs,1761480445,🍂 Stockholm Streetstyle Inspo 🍁 | Chic Autumn Fashion Trends 2025,"Discover the latest stockholm fashion trends for autumn 2025, where swedish fashion meets casual elegance. In this video, we'll ..."
youtube,streetwear 2025,https://www.youtube.com/watch?v=SP6_IP7IM3U,1761472840,Unboxing the Adidas Superstar 82 DENIM 2025 – Vintage Style Meets Modern Streetwear!,UNBOXING Adidas Superstar 82 DENIM 2025 #SneakerReview #shoes #LifestyleKicks #jordan #nike #UrbanOutfits #EerieStyle ...
youtube,streetwear 2025,https://www.youtube.com/watch?v=KNQwe0iH9Dg,1761471556,"2025 YOUNGLA American streetwear brand men&#39;s sports pants, gym sports and fitness loose straight pri","2025 YOUNGLA American streetwear brand men's sports pants, gym sports and fitness loose straight print casual trousers Buy on ..."
youtube,streetwear 2025,https://www.youtube.com/watch?v=dSIRTdS76bs,1761469946,MRIB CLOTHING | BANJARA HILL HYDERABAD TELENGANA | #2025 #fashion #banjarahillshyderabad #export,
youtube,streetwear 2025,https://www.youtube.com/watch?v=5cUyI57YAdI,1761464124,Chinese Fashion 2025 | Viral Streetwear Inspiration part: 33 #fashiontrends #chinesestreetfashion,"Experience the future of Chinese Fashion 2025 — from Shanghai to Tokyo, Seoul, New York, and Paris. This short showcases the ..."
youtube,streetwear 2025,https://www.youtube.com/watch?v=xtliYeHrymo,1761462705,Blugi gri cu sclipici. #jeans #blugi #fashion #2025,
youtube,streetwear 2025,https://www.youtube.com/watch?v=rfeIJ4ZeqSk,1761461045,Sarojini Nagar Market Street | Winter Collection 2025 With Shop No. | Sarojini Market Haul ,"Sarojini Nagar Market Street | Winter Collection 2025 With Shop No. | Sarojini Market Haul sarojini nagar,sarojini nagar market ..."
youtube,streetwear 2025,https://www.youtube.com/watch?v=NYbGAlJdrRk,1761437100,Fashion PADU Padan Jaket eps 2  #fashion #style #streetwear #quotes,Fashion PADU Padan Jaket eps 2 Semua materi video hasil dari Ai #ai #streetfashion #jaketwanita #chineseindonesianstyle ...
youtube,streetwear 2025,https://www.youtube.com/watch?v=SZEM6u4pPKw,1761433318,AIR JORDAN UPCOMING Releases | NOVEMBER 2025 Lineup,Experience the evolution of flight with Jordan Brand's November 2025 lineup — where timeless heritage meets modern ...
youtube,streetwear 2025,https://www.youtube.com/watch?v=ryIdk8QfXGs,1761418846,“FASHION HAUL 2025 👗 | USA Influencer Style You’ll Love 💖 | Aesthetic Outfit Inspiration 🔥”,FASHION HAUL 2025 | USA Influencer Style You'll Love | Aesthetic Outfit Inspiration ✨ Step into the world of 2025 fashion ...
youtube,streetwear 2025,https://www.youtube.com/watch?v=rGbePE8YWsI,1761413085,25 октября 2025 г.,
youtube,streetwear 2025,https://www.youtube.com/watch?v=710NLCoE2ZA,1761411609,BEST SHEIN OUTFIT FINDS 🔥 | Affordable Streetwear Looks 2025,"Discover the best streetwear outfits from SHEIN that will completely upgrade your style without breaking the bank! In this video, I'm ..."
youtube,streetwear 2025,https://www.youtube.com/watch?v=AnOwOxpcvsY,1761409093,Torba modular #fashion #streetwear #ootd,
youtube,streetwear 2025,https://www.youtube.com/watch?v=sRNzcK8g820,1761403589,🔥🖤 Trendy Hoodie for Men &amp; Women 😎✨ | Streetwear Vibes 2025 🌟🧥 #shorts,"Upgrade your wardrobe with this stylish hoodie – perfect for men & women! Comfortable, cozy, and totally on-trend for ..."
youtube,streetwear 2025,https://www.youtube.com/watch?v=mptNDqzmYRY,1761403524,Novedades Bershka otoño invierno 2025/2026#fashion #haul #sale #shorts #explorepage #explore,Novedades Bershka otoño invierno 2025/2026 --- ¡Razones para renovar tu armario YA! Las últimas novedades de Bershka ...
youtube,streetwear 2025,https://www.youtube.com/watch?v=96PnkBzLWhg,1761403373,“Luxury Streetwear You NEED in 2025 👑✨ #outfitinspo” Ms collection #tranding n,"Step into 2025's most exclusive luxury streetwear looks ✨ From high-end designer drops to next-level street style, this collection ..."
youtube,streetwear 2025,https://www.youtube.com/watch?v=DR2pqLzo_88,1761402610,"Winter Collection 2025 Wholesale Market﻿ | Hoodies, Sweaters &amp; Warm T-Shirts at Factory Price!﻿ 🧥","Winter Collection 2025 Wholesale Market﻿ | Hoodies, Sweaters & Warm T-Shirts at Factory Price!﻿ Join My Whatsapp Channel ..."
youtube,streetwear 2025,https://www.youtube.com/watch?v=u5NXt0cKVXM,1761401904,New hoodie collection 2025 । Premium zero nine hoodie । #fashion #hoodie #trending #streetwear,"New Hoodie Drop Alert! This winter, express your style with colors! Introducing our latest collection of Zero Nine Hoodies ..."
