source,query,domain,url,created_utc,title,text
gnews,fashion trend,news.google.com,https://news.google.com/rss/articles/CBMiY0FVX3lxTE1ObDAtaHZoQ1hrY2NDMDVnSGVVLVZ0emN2UkxRaTRWblFVQ2RzX01KMzZWdko5ak94ZUVLMXQyc0dQd2ItLVhRa2RTNFJPYXJHZnVLTnJKNXRzLVdIZjRxckRTWQ?oc=5,1777904332,Aprons Have Gone High Fashion—But It’s Giving Me the ‘Trad Wife’ Ick - PureWow,Aprons Have Gone High Fashion—But It’s Giving Me the ‘Trad Wife’ Ick - PureWow
gnews,fashion trend,news.google.com,https://news.google.com/rss/articles/CBMiigFBVV95cUxNNktyQ2pVLWc1Vzg0bHdYNGd5ZV9MZ3YwakFjeXZoYlRwcGsxYzFmQWdJSEFZdW5sQmdHaWo1Ynl0aGR3djdTSVRYcmhCbjVRaHIwLWlBQ1IyNnJDYV8tYmZWSi1tWndad2Z4SnFtSUNTTGdjdlp4YXA0YWhFaWpGMG1zVk9uWU1aUnc?oc=5,1777900131,From Church Fits to Couture: How Black Style Defines Met Gala Fashion as Art - EBONY Magazine,From Church Fits to Couture: How Black Style Defines Met Gala Fashion as Art - EBONY Magazine
gnews,fashion trend,news.google.com,https://news.google.com/rss/articles/CBMipAFBVV95cUxPU0dKb25KMGROTVRzUGtCRU9Ndk8tR0hVZGd5TlNUa2dyclROVTNMZkd0a0ZYSjRvSld3YWFza0hSS3dWNnZnUllOczYxdHBEb2NuS3VScHRIT1hDUGFVOXRYeG5TbXhOdmN3THF0OG5KMWJqdUhuUlZFMG1Zb2hLaGl0bzdZQ1dReFVsUEZ5STRucEtaejBMZDBXdGQ4bVNfS1owdA?oc=5,1777791600,"Kentucky Derby 2026 fashion trends: Designers weigh in on hats, Zendaya and JFK Jr. - The New York Times","Kentucky Derby 2026 fashion trends: Designers weigh in on hats, Zendaya and JFK Jr. - The New York Times"
gnews,fashion trend,news.google.com,https://news.google.com/rss/articles/CBMiYEFVX3lxTE5UQVg5bmNOM2Z4VThRRjJwZzNTU3BmdDBYVURiUlZwdWVZV0FxdFQwQXN2cGpvb3JpME0teV9NWWltWF8wZW9lNnB4Zm9vb0FPSG16YU4yRlNzNWE1eXFoTQ?oc=5,1777771412,10 Statement Trends to Try This Spring - Vogue,10 Statement Trends to Try This Spring - Vogue
gnews,fashion trend,news.google.com,https://news.google.com/rss/articles/CBMipgFBVV95cUxQYXl2cUdIUGdVcnZ3TXN5Q05uYUhYSlQ2YWhWZzRwczh1Rk8xRXlKWFVKOWJuNkJJd2tybDBTMnpJQ0hfVUNScGtnUDMxUTRpdGVoSlVBS2l1YnZycm5DZmkwQlZVRUFDZW45NWVlMzJtWC03SGNyRmUtSUJLcEN1S19KOTRwelJYTVRvbnZhZTFGeXh0Ny12UUxiMUFkTzZzQWktOFVB?oc=5,1777708800,Not Ballet Flats—Jennifer Lawrence Just Styled Her LBD With an Even More Elegant Shoe - Who What Wear,Not Ballet Flats—Jennifer Lawrence Just Styled Her LBD With an Even More Elegant Shoe - Who What Wear
gnews,fashion trend,news.google.com,https://news.google.com/rss/articles/CBMiZ0FVX3lxTFBZUmdWY0NOb0ZYVnptZGhrUUN4a1dRVkRyZ1Jnd1cyR05TaEIzbWdsYUtiZTllWWxCck0wMU4yemxhVW1mdGJHemt5aTR5T2FORWNTOXVDVWkyWldWeTQ5SFZlRnFMc2M?oc=5,1777672236,I’m 40—Here Are The Trends I’m Skipping This Season and What I’m Wearing Instead - The Everymom,I’m 40—Here Are The Trends I’m Skipping This Season and What I’m Wearing Instead - The Everymom
gnews,fashion trend,news.google.com,https://news.google.com/rss/articles/CBMiggJBVV95cUxOVWd6ajhtYXhmSms3VExsWXJqRVB0NW9sbDFlZ0tFODNXWTRfYzN3OEl1RlNxNGNFRlQyMXZuQ1FXa0tJSkhBOVk1MXBHeEtMcFZHTC1KTzdXU0xjLWIzV3VVd3ZRZXZ4RERRNlh3VnlVcVZXcFc4dmJOWkxqeS1ZYzhNb2tYbVRuTEpnV3NXU3NGT1pEbjN6TG80UnNSU3IxRU4zTXh5eEVod1JCRzRNWjk5YUdqTkdsNnAzVTd2YTVzVjRCdnQxa0dOZHJRZDZ4VFZHdVRxajBkZFFGLVZWdmRaRFo2WWVwSUNRVHpVeExTZE5WVDQ4UHBPUEtRWlZsTHc?oc=5,1777748542,"Big hats, bold dresses top fashion trends at 2026 Kentucky Derby - The Courier-Journal","Big hats, bold dresses top fashion trends at 2026 Kentucky Derby - The Courier-Journal"
gnews,fashion trend,news.google.com,https://news.google.com/rss/articles/CBMitwFBVV95cUxPVUxVWE9MUEt1SXlqYXBEREx5SVRuOHh5Mk44d2FDM2hoOGd4VVBPSzVNUHRjWWVUdUd1OW5HTnhlcjVVUWZxWEpaZ25KdmhwZkZjVlN6WFdqOWdRY1Nwd3lqY2hndHBCNXRUZW9wYlN2MWdEdnkwd09wZmM4Zm1GRkZHalhTc0k4V2toRlQtdTdKM3lvaThJZng0ZC1Na0RCYVBPZnc2WUlvVlp0emRJdlBSalVPdGM?oc=5,1777460820,Which Derby fashion trend needs to get the boot? - WDRB,Which Derby fashion trend needs to get the boot? - WDRB
gnews,fashion trend,news.google.com,https://news.google.com/rss/articles/CBMimgFBVV95cUxPaXA0akNVUm1yaXVEaFkta29KeS1MWnRBa001b2xJak9QZUdzdkxrb29SZUtveFpVemh1R3pZbTQzYkdSNERHdnNuR2JlUTlackVKTWppWnVHOHdITDR3UGJUS0I4RUFjQlFBb2Z5TW1Ja3BZR2NPQm1WRklGUXBMd0lKc19Nei1yZ29XLVBEaDg1Rm9NVmVmMWJ3?oc=5,1777412993,National fashion-trend store opens new location in State College - WJAC,National fashion-trend store opens new location in State College - WJAC
gnews,fashion trend,news.google.com,https://news.google.com/rss/articles/CBMickFVX3lxTE96OVN3bkU4TzV6TDViUGw2YVlHazYwSmFJbm5jbk9UZExWMEE1dUNWR0hIbkJmYWpMakhSeENybm1DcVdOTEF6b1RXNTBUX25HOVJuaUw0VmhSUVYtckE0MHdaZk5PMG9vbzFzblYzZmxSUQ?oc=5,1777708800,The ’90s style moments that keep guys trawling eBay - British GQ,The ’90s style moments that keep guys trawling eBay - British GQ
gnews,fashion trend,news.google.com,https://news.google.com/rss/articles/CBMi1wFBVV95cUxOSEIxV3hwaHpLa25uc0hfMFRISHk3WktLSWFPNlkwTkRhMENmYW9VMDBwY3hSZC04cFFiSmdlZk9peWdTR21TOGt2cmNVSVg0a3c3R1hDdko5ZEZmb185bjVzNXVPbkdQVXliektpUTd4dzdjckppUGxOXzJMZTlxQ29CSk5RdzEwVlI4N25HTnhVc1lHMUFCUnp1M3k1b0VsX2ZWZkVzWlF5ZXZsRWV5V25GQ2s1UTlSWWs5OVItMk8xbXVyVG80UTJuVUVjZ2xsMERRSm1vQdIB3AFBVV95cUxPeUdUcGZHU0FRNFpBak5SUWZ5VzZZbi0wRXRqMHZrWmJWbFE3aFVrYzFzbWNMZG96ZURxT3FCS1EwYWlRWkd3UXhtN21iN09oRjVEOFRqLTBkUEFDYzY3NF84VUR5TER6R1NsZXQ1UFJIS08zTTNDX1pKZnJjdGxVWHJPQlpiSVZodDZUOTRObERVc1lYYU5yUnVxSGMtVmJJRUwzOV9DeEstWWJXTXI0RmRSdFl4RTJ1aC1kWVZ5OWs0dTlJbkp0V2E0WERtLUpRazJwME5SR0piWkRN?oc=5,1777391520,Celebs From Travis Scott to Rihanna Are Fueling This Luxury Fashion Trend - Mansion Global,Celebs From Travis Scott to Rihanna Are Fueling This Luxury Fashion Trend - Mansion Global
gnews,fashion trend,news.google.com,https://news.google.com/rss/articles/CBMic0FVX3lxTE1OMHVCSC1hUnRzU0s4YjdNNkNvSWptWlNsRFdzVkFaLUN3M0YwVlZyT1dDZWk2Zml3RDhNbU1rWkJfbElCRGpKdVlNOENLVHpFRzkwcTVYWUZleEFOUW45OFFBT1FsWE12TUJxQ1dsRXJYRDg?oc=5,1777878000,6 Chic Summer Top Trends That'll Be Everywhere by Memorial Day - Who What Wear,6 Chic Summer Top Trends That'll Be Everywhere by Memorial Day - Who What Wear
gnews,fashion trend,news.google.com,https://news.google.com/rss/articles/CBMiiAFBVV95cUxQUkhXb1RON1Z6cU9ubEJ2MTdfTDhvaW5DbWgwQ25jazlrSnNuX3BmSHZvTGhWRDcxVjBDbVpQQXdhcmFGNy11VXFEd21LbEM5SU1zdU9OWlZSZDVvZEJEZnZESUNVLWJrUUxIREFvbzNxZTBIYXp0S1dUbG5FT3g2YS1vT0Y3bzFZ?oc=5,1777874400,6 Summer Shoe Trends That Give Your Ballet Flats a Break - Who What Wear,6 Summer Shoe Trends That Give Your Ballet Flats a Break - Who What Wear
gnews,fashion trend,news.google.com,https://news.google.com/rss/articles/CBMihgFBVV95cUxNSGZTWUNfVm5JcHFYQWI0WS1oSjlSSmY0dm5NTkRKRVhFNUJtZGVtS2ZwalZzSjJ1TmUyd1RsX1NpSVdsTHVsVElVSjBrb1dnMkVUWkJOR3FnTVJUbko2RTZHYlFXd0s1M2pDQ3NkV2pQemY0N0E0VDFqR2FOWVVtWFFRc3lqdw?oc=5,1777532400,French Women Are the Absolute Chicest—5 Spring Trends You’ll Never See Them Wear - Who What Wear,French Women Are the Absolute Chicest—5 Spring Trends You’ll Never See Them Wear - Who What Wear
gnews,fashion trend,news.google.com,https://news.google.com/rss/articles/CBMieEFVX3lxTE1sT3o4eldPNjYtbU91UV9lbTdIT3RRNTJDN2tQcWMyaUE3Mzl6c2F4N3d6ZVVTd2FpSFFZYlFaXzM2X0pmUXBsLVNvOU8yazBZamVqVXRFMTNHbUpEb1p6aWlya1NvYVBYTnMxSlJ3RlA4SXlmWkIwQg?oc=5,1777791600,Hear Me Out: These 5 Outdated Sandal Trends Should Be Skipped for 2026 - Who What Wear,Hear Me Out: These 5 Outdated Sandal Trends Should Be Skipped for 2026 - Who What Wear
gnews,fashion trend,news.google.com,https://news.google.com/rss/articles/CBMiekFVX3lxTE5CZGFRWFdPUmRDZk9PUl85Y3dBQno5VVpzTE5MWXh5bEtRaVBPdTZsRUVtb254YWtlcjNoQVMzMllOclNOcXJ6NDgwVURMTjREVTA0QVk5emZrY05rZmFscEVib0tNLW9sOXdVSXdzMVlSVXoxVkhfcnJ3?oc=5,1777791600,"According to the Runways, This Is *the* Color Combo of 2026 - Who What Wear","According to the Runways, This Is *the* Color Combo of 2026 - Who What Wear"
gnews,fashion trend,news.google.com,https://news.google.com/rss/articles/CBMiiwFBVV95cUxOZ0ZuUmZGbU13UVYtZUV4ZHRqXzZYNllySnkwdjUyUm5MWFhjWl9JaEMteVBvakpCTTk5SDlRa3luNWo5ak5xeG5EQ1NlaHZUS1c4ZEtmaU1ONlNaQ2UyVU90VU03bTZKc2RZOTUxYUJ6Vy1lUFZJU2tmYVRldWZzSloxTVZrVDlSNmJz?oc=5,1777618800,I'm Packing Up My NYC Life and Moving to L.A.—Here's Every Trend I'm Getting Rid of in the Move - Who What Wear,I'm Packing Up My NYC Life and Moving to L.A.—Here's Every Trend I'm Getting Rid of in the Move - Who What Wear
gnews,fashion trend,news.google.com,https://news.google.com/rss/articles/CBMigAFBVV95cUxQTVAzZXNZOGQyXzhtRDMyd0xVc1lTQmh1Nkg4bi12LTRVdV83a0VObWR5a25ZUGRoUS02M1doMWdZb1Q1STg5cFI4NFBITU5IdG45QzJ2Yl96SHlVVE9YbkZfdUt1RXpXUmZIcE83Mm9Tb2dTeERNcTBUQlh0UHM2MA?oc=5,1777705200,This Boot Trend Is Slowly Replacing My Love for Riding Boots - Who What Wear,This Boot Trend Is Slowly Replacing My Love for Riding Boots - Who What Wear
gnews,fashion trend,news.google.com,https://news.google.com/rss/articles/CBMieEFVX3lxTE8xWmM2czJKX2FiR2ZFcVNWekdaLUlEODRpRUUtSmdYaEdqbmtPbHBTd3Bwa01TeUcwZG13YWZBTW9IWnhlSlNhNHZEUWY3R1I4RWd5eDhpSzdEYVZaRDJoR3ZYUjJUUGpfdF9qZ3VzdUt0WGFxSWlBaw?oc=5,1777783500,Everyone Knows I Have Excellent Taste In Shoes—7 Summer Trends That Get My Approval - Who What Wear,Everyone Knows I Have Excellent Taste In Shoes—7 Summer Trends That Get My Approval - Who What Wear
gnews,fashion trend,news.google.com,https://news.google.com/rss/articles/CBMiZEFVX3lxTE5hYzFHYnloQ2M1MXQxNkd3SE1rWmVtUUt6QTU3Z1hvUHhNUkZVcVd0NG9vbUpDWHBqamswN01XNnIxV2pDaVg0RWoxM3NwWG45TmZ5Q3NSb1k0TzBJUkV3MlFOaFTSAWpBVV95cUxOMUg3d2NnNUhDTFhoSHdwYzBSVGZuSnB1Y091T3ZqaExhSnJYcS1RQlREZnZ5cjI4TFFIRU5Ubm5DaFJsM0V6VzN6dUNSdk16ZWpqLVJnc1NIVVVHR2tuazY1Y0x4Wm9HZ2ZB?oc=5,1777818044,Top 100 Fashion Trends in May - Trend Hunter,Top 100 Fashion Trends in May - Trend Hunter
gnews,fashion trend,news.google.com,https://news.google.com/rss/articles/CBMilgFBVV95cUxOa3dWb2dLNGpVZmVMUkU1N1lYbmJ5RXNSX3Q2b0xhVnA3OTF1NU9WSHZ0bDNvMk5ITUxmZ3dydnhTZmxqZVY4RkxlVHAtci1vRThJMm00QTE1bUQzczUycmoxaW1WR05vVUw0VE5GYVRnUTBDQzZVRFU3aEw2OGNxOXlvVTBpb3UyRElmRHVkcDlmajM0ZVE?oc=5,1777481220,Is the Naked Shoe the New Naked Dress? - ELLE,Is the Naked Shoe the New Naked Dress? - ELLE
gnews,fashion trend,news.google.com,https://news.google.com/rss/articles/CBMirAFBVV95cUxQcVpuNVBuYlhfS3NUQ0tBdHhMNGQzaG5zbV9ESTVGSUxQZ2lJQkY5OEo2YzhuUGVkWS1qZ0dTV1Z2ZzFGSlBDSUhzNTZpNFMxUzdHWmZ3TzREaDBaUUY3a3p2M3Q2S1NYRjVfVTVGYkhNclhMT2tPZXNvLVVSQzBxbWVaVDVydVNLaVpNTU5VQTE3SEh4UVVuLTRSbUkzcVFCQ1R2TDRtekZrS0st?oc=5,1776679200,What old old fashion trend would you bring back (+100 years old)? Roundtable - dailycampus.com,What old old fashion trend would you bring back (+100 years old)? Roundtable - dailycampus.com
gnews,fashion trend,news.google.com,https://news.google.com/rss/articles/CBMimAFBVV95cUxQRzlacEZMTzFhd2N6cFNMSm5GM2FaMUpKeEVfRF9YTGx5cnowaTRvY1FaWFYxU3AwS1ZCQ0VSV2c5RDlpSV9NUnFpTUhYQ0FabGxJZzBOYUppN2hqRXUxdndDbWctVnB5bE56aDlWM2JIcnhzSWlsYXh3TFlWLUF1Zk5hdVZXY2c1MlY2NEdtU2d6Vmx5VHRJQQ?oc=5,1777873696,Is the Kashmiri Pheran a Fashion Trend or a Timeless Identity? - Kashmir Life,Is the Kashmiri Pheran a Fashion Trend or a Timeless Identity? - Kashmir Life
gnews,fashion trend,news.google.com,https://news.google.com/rss/articles/CBMihAFBVV95cUxOSUFxNVp1MXJiNUlFUnpTZjFhajZ6TGw0YlYwblVUdWhMYk9zZVJOVndJY25zWkZDUGZFaTBkU0NqdXZETW9RTTVoSEFHNXhnSHgwVG81SnhGdHdRZGtvUnZyMnN1aVlrdEFSLV9CVzdNOFRCSXV4bGpfVGNTTEhxbkIwbFQ?oc=5,1777446000,"Ahead of the Met Gala, Tracing Lewis Hamilton’s Style Evolution - Vogue","Ahead of the Met Gala, Tracing Lewis Hamilton’s Style Evolution - Vogue"
gnews,fashion trend,news.google.com,https://news.google.com/rss/articles/CBMiogFBVV95cUxPbVZjSm5HU2ZuVE5ycnRFdjc4TG82ZTVVODVIRnNRYXZJeVpWU2NneTJzQXdNS2hZdlZ1V1ktUUVJa0pXbGNtQTVmV3ZqendhMlV5VnBESDR1ckxPRGxuSC1yZ3ZXcWozU3BkRVUxejRaVmJ3SFlIVEFqWXZpc0dNMWlHSlFTTl9oanpDXzBLbnFMM1V1QWFzRXVEeXV0dWlwRmc?oc=5,1777583400,"Beach Bags Are About to Get Dramatically Bigger, Thanks to Chanel - WWD","Beach Bags Are About to Get Dramatically Bigger, Thanks to Chanel - WWD"
gnews,fashion trend,news.google.com,https://news.google.com/rss/articles/CBMigwFBVV95cUxOM3Ytd0EtVWVjcXltLUFKR2FvbjJ3M0lSS0NYTDVfbDMtbE1VaUxoLUZqcXZVUlRmY19HQTFIT3RQaTZud3JvNzcxb0ptdW9rT1pkQ09TYWlwVXBfRkREU3dibkRycWpEYU9hSTR0T1l3Y2ZyNTQ4dWtwMXlLLVRhQ1Y4RQ?oc=5,1777712400,"Sorry, Jeans—Fashion Insiders in London are Switching Stovepipes For This Trending Trouser Style - Who What Wear","Sorry, Jeans—Fashion Insiders in London are Switching Stovepipes For This Trending Trouser Style - Who What Wear"
gnews,fashion trend,news.google.com,https://news.google.com/rss/articles/CBMihgFBVV95cUxQbDN6Q1hnanNqVGhUQmVkT3F1cmRoRi16RFh6bDJlbVJxTmh4cXZDcXl2OEM5VlBpX09JcUpPT3M1SU9rcHRRc09nTDZiRzVmUXFYUzRqdFNYemtuQUt4aHhHQkI2OXFiTF93TGtRdGM0bDA0ZEFlem9iQmg0ZDdyUVB0OUF0UQ?oc=5,1777698000,5 Chic Summer Trends I'll Be Wearing with My Jeans in 2026 - Who What Wear,5 Chic Summer Trends I'll Be Wearing with My Jeans in 2026 - Who What Wear
gnews,fashion trend,news.google.com,https://news.google.com/rss/articles/CBMilgFBVV95cUxNVmVMQzNmTVBwVmJDOGEwVzExd3h3eHpobkI1d0d1THg0eGEtQ3JhWlJQVDBrT2x2blhhaXlnUGc0cV83TlVYa1pJQ19wb2xROEZWMldYVlBPcVNXN1BoV0FRRXRCU1ZlNmRBYVNzQ3Z5cWUzc2FsLVFYaFJQMTYxUjBrd293Q3NxOGhLeG1MNVk4VmtycUE?oc=5,1777417461,Tennis and futuristic eyewear: the next sport-fashion trend - nss sports,Tennis and futuristic eyewear: the next sport-fashion trend - nss sports
gnews,fashion trend,news.google.com,https://news.google.com/rss/articles/CBMifEFVX3lxTE02WS1hOExUQmEwQjhNVXJWb2dod0ZXRm5qcVlyMTJpR1VuS2FUR3FGLXUtVncwbE5EV0xHMzlXaFcyTHR1X1p5TTZrcEttSUIwa0MxTW54TjhSSnQ5MEctTm9VVExLVnlOQ1lyV0xzY3ZyV0syajNWTFNkemk?oc=5,1777791600,5 French Girl Linen Trends That are Far More Chic Than White Cotton Dresses - Who What Wear,5 French Girl Linen Trends That are Far More Chic Than White Cotton Dresses - Who What Wear
gnews,fashion trend,news.google.com,https://news.google.com/rss/articles/CBMigAFBVV95cUxNNXFHV3dhT0xfNzJCQzEyWHdBVTFxZUtUTENOcjRpQlB5NmpvYzhXTFdQZklxWUtaNGQ5d3JZcDE3QlYtdU5hTVJleGM5MTBRa0VDTjhKY2lpSE5nQnZKYlVadktLSnZMdzlPQWVMdmZEMVhJa1NJLTBLejZxUFJUQg?oc=5,1777661488,"This Summer’s Shoe Trends Have Something for Everyone, From CBK Stans to Maximalists - Marie Claire","This Summer’s Shoe Trends Have Something for Everyone, From CBK Stans to Maximalists - Marie Claire"
gnews,fashion trend,news.google.com,https://news.google.com/rss/articles/CBMikAFBVV95cUxNci1oaDBNNVVwQWdjOTRfY0hkS241NTNSSlg5R093R1BScGNPT3ZKN2YyQmJBRzlZYlJfbG13YTZWcjZ6SGxjMTAtc1RtV3ZDS0V2VGRKYUk2OUJQSmNwU21Ydnl2VEZTeHFUYUxwVkVBUmdaR083S2F1aFRMbFpYWFVNX0VJTnNBenJkV0MxRkU?oc=5,1777751347,Sorry to the Black Pieces in My Closet—I'm Obsessed With This Equally Chic Color for Spring and Summer - Who What Wear,Sorry to the Black Pieces in My Closet—I'm Obsessed With This Equally Chic Color for Spring and Summer - Who What Wear
gnews,fashion trend,news.google.com,https://news.google.com/rss/articles/CBMiuwFBVV95cUxNLTBxd2NzVXJTQ1k3R2lvbFZmVUFPOXlwR21SemVjM1ZhUVVfVDduSFUzUm9rcmNiQjNvWUl2TDRLaGo4dHFnT2Rfdl9WbGJTVlFGcHV0bkVZWGZJTU9hR0RxejEwTUtFUEoybFJoNVFhcEt6Nk8tS213VXMwS09CV1kwdWhwdkYyOVVmMDZfOG55V3FiRzZvcUhoU05FeFluMzlvc2o3ZXp4LU83U2dsLXFIaGZGbVp2c2pr?oc=5,1776927600,Vintage fashion trend offers sustainable alternative to fast fashion in Las Vegas - FOX5 Vegas,Vintage fashion trend offers sustainable alternative to fast fashion in Las Vegas - FOX5 Vegas
gnews,fashion trend,news.google.com,https://news.google.com/rss/articles/CBMifEFVX3lxTE1ScUdBZ3Z5ZXBqZThvOHlYNG02QWtmZkE5OTZBWHBuWV83cDdocFo1NUdjTHVvS2pXMlF2ak01bkFmdTk2ZjZCRS1xU1NqOGFRUVVTc00ydzI4TTVJbmRDdGIzYWRXejllNkZCd2ZMdUgxZUd2a0Ntc29mY3I?oc=5,1777634046,"Style Over Fashion, Régis - Roker Report","Style Over Fashion, Régis - Roker Report"
gnews,fashion trend,news.google.com,https://news.google.com/rss/articles/CBMiYkFVX3lxTFA5WnNFb29VbFBTUFFYSGtJbHZpSGFaRlIxOFlGMERnUWNwUGwtekNWX3JFWDFaWmUtV0dyOFlCWkpxZzlTU0h2QVdRR1djQU1xX2tpNV9NMjRQaUNXY0NqcFdB?oc=5,1777646130,The Low-Rise Skirt Is Set To Become A Summer Essential For 2026 - British Vogue,The Low-Rise Skirt Is Set To Become A Summer Essential For 2026 - British Vogue
gnews,fashion trend,news.google.com,https://news.google.com/rss/articles/CBMitAFBVV95cUxNNWdER0FiUGtXY3ZqRjU0MFJOSUxxdm43a0lyczlXbjBNZGo3QXNoOFpjbE90ZVBfelhvemdDM2wxV0JMc1lNNFlVM3FCUlpRT0laUHhWWnhQc2x5UWItWGFCZkNhTnJlM1MxbVAweVlnb29NNjdKWTdSTjB3MlczSmlCZzRTYnN1Znc0em5aNmhWUkZleHhlbjhaM0s1dXlIbUFQWnEwaUVfWVRzZ0x5NU1CU0U?oc=5,1776927600,Vintage fashion trend offers sustainable alternative to fast fashion in Las Vegas - WOWT,Vintage fashion trend offers sustainable alternative to fast fashion in Las Vegas - WOWT
gnews,fashion trend,news.google.com,https://news.google.com/rss/articles/CBMidEFVX3lxTE5xeWxQV2Y4dE5rV191bUJRNE1ibUlDdXZQMGMtTkRSdkpXc0J6dzJYcjV1Q2owTXktaXlwOEJXbGd4aU0zcUoyVnNQS1dIS0htZUh1ODYtZlhhbzZkTHZJMmlFMmE1XzY3d0lZU2U0bnM3OE1U?oc=5,1777701600,Expect To See These 6 Microtrends Everywhere This Summer - Who What Wear,Expect To See These 6 Microtrends Everywhere This Summer - Who What Wear
gnews,fashion trend,news.google.com,https://news.google.com/rss/articles/CBMimAFBVV95cUxPRHE1cGNNWm9mNENEVzl1VlZHX0prc1VWQjhPUFV6ZlJ2NWRBYTRuUDB1LWlvcGNiMWFMNkVXVzdYakNMYUNsSjZXR042X2VuM3Nrc3JaUFI0QjFLMGVGbmdmbktHX096R3hZdXVzdEtyLV9Ha1ZZSWZqdnVrS3NhdkY3NF9fWUNxRzhnbzU3SEVXaXctUWZUXw?oc=5,1777676063,White Jeans Plus This Flat-Shoe Trend Is the Ticket to Looking Like a Fashion Person Right Now - Who What Wear,White Jeans Plus This Flat-Shoe Trend Is the Ticket to Looking Like a Fashion Person Right Now - Who What Wear
gnews,fashion trend,news.google.com,https://news.google.com/rss/articles/CBMifEFVX3lxTE9USWpYTG9yZHUtb2F4SmpEbWg3SU1CdlRmSFlVWWlmaHEydnA2TUFKZzhuaHlEdnRicGNjbnlJQlBRMVpjZmZENk52VmowQ0lHZUFoNjRldHVRSkEwX1dUeVJhNWVPVmpJVm9PMWctVDBZZ0dQRzRfYW9lbkQ?oc=5,1777723200,I'm Confident That These 5 Anti-Denim Trends Will Quietly Replace My Jeans This Summer - Who What Wear,I'm Confident That These 5 Anti-Denim Trends Will Quietly Replace My Jeans This Summer - Who What Wear
gnews,fashion trend,news.google.com,https://news.google.com/rss/articles/CBMitAFBVV95cUxNbVlwb0VfQ0RUTGg5c0lvelFMSWNzZDF2VnlWaElZOV82ay1Ld0dBVzRjTXNvLWZDMnJGNWpVVDF4M2hUMEU3NVFnaUZ5bU82dUpyU0ZQT0xWNG1pUEtfVDNEekNUZjZoeGZndWdzLUFvX3JUYTFpNnZpd0NRekFzQVQ5b2ZRZ0l1WFBvdm5oTXBBdVZsTy1iNktBbWNPbFJWUk1mQVcwQnhNaWR3azdVcnQxUlE?oc=5,1777005420,Vintage fashion trend offers sustainable alternative to fast fashion in Las Vegas - KTIV,Vintage fashion trend offers sustainable alternative to fast fashion in Las Vegas - KTIV
gnews,fashion trend,news.google.com,https://news.google.com/rss/articles/CBMitAFBVV95cUxQMmVuOG9TX1JYTmVCN2F5TXZZR3l2aVlJN05BU2lsN1h1Nm5udlZwVXMycnNWSV9uN1Z6MjRWVTZ4U25fRVRRenJvRDB6MXBKY19LVFlNSXQ3eFotZnphSWpGeEltWHdoNm52TkR1N2U4TVRmcFRlTnlGc0hMRHBFT3B6SU5JcXpjWVdjVlJfV2JTNkZLcnpvV3FEckczMXRjdV94dmRIaFQ0STR0cXBjYi1jRHg?oc=5,1777005420,Vintage fashion trend offers sustainable alternative to fast fashion in Las Vegas - WFSB,Vintage fashion trend offers sustainable alternative to fast fashion in Las Vegas - WFSB
gnews,fashion trend,news.google.com,https://news.google.com/rss/articles/CBMigwFBVV95cUxOZWNzLUJaSkZXeGZyWWFaa0FaUjJfQ2lNdzEzOC1laVdIUl9icW5aNzVKY0xRUF9oSG9TN3NEX0ZYZV9FMVl4LU1FVk5tLVgtMF9CclJpb0ljSXF6QzcwdlJDcmdvZkc2SEh1cUlLRU5FRUlQbS1TUVpELUxQcUwyT2Ridw?oc=5,1777880030,"Charlie Kirk Assassination Audio Used in 'Gross' TikTok Fashion Trend, TPUSA Responds - International Business Times UK","Charlie Kirk Assassination Audio Used in 'Gross' TikTok Fashion Trend, TPUSA Responds - International Business Times UK"
gnews,fashion trend,news.google.com,https://news.google.com/rss/articles/CBMic0FVX3lxTFB4ekI4M0RHVDBON25BRXZ1MXFOcGY0YmlDU2Q3d1lkYmV5RHg3a2ZuVXZNaVpQZU12N2RjcDgyelZjYlNBZlFDLXlKRndIS1RqUHczaFhRd25jYTV6RnBoSi1CU3U1UzcyMTgwcXM1QUl0NFU?oc=5,1777883400,"The Best Pouch Bags To Carry Now, From $19.90 - Harper's Bazaar Singapore","The Best Pouch Bags To Carry Now, From $19.90 - Harper's Bazaar Singapore"
gnews,fashion trend,news.google.com,https://news.google.com/rss/articles/CBMikgFBVV95cUxNczh2MklxN3Rjb05oQ0duZlF6aVRnVnMwNG5EOXdQV2NKMTBhdFo5MHhmTkJQa0NMY0NMdVJoZ2NibG9jZnVPVVVXc0ZRMk9ETm5Gd20xWEVLVnE1Um50ZnJsR3hnd1lZVWdrQlpTTjRKOXd0cnNZTWdTOTFRTUR1VjV5WGEtRkV2NlJEZjNMc2dmdw?oc=5,1777705200,"Not Spring, Not Summer—These 6 Outfits Were Made for Wearing Between Seasons - Who What Wear","Not Spring, Not Summer—These 6 Outfits Were Made for Wearing Between Seasons - Who What Wear"
gnews,fashion trend,news.google.com,https://news.google.com/rss/articles/CBMia0FVX3lxTE1ydkc2dGFOWG50cEw2clpHRjVBUERhNUM4UTRRY0lSTkNNNjlmTzZ3blpMV3NHOUtQNVRzN1hZamR0dXUwdmhncm9VTWhDaGNNRl9ROUxCbWM0VXIwLWlibC12ZURkYl9jdUdv?oc=5,1777667201,Suki Waterhouse Styles a Naked Dress With the Summer 2026 Comfortable Boot Trend Cameron Diaz Loves - instyle.com,Suki Waterhouse Styles a Naked Dress With the Summer 2026 Comfortable Boot Trend Cameron Diaz Loves - instyle.com
gnews,fashion trend,news.google.com,https://news.google.com/rss/articles/CBMifkFVX3lxTE9EZ3hpSk1mS1FqS3RPTlRxX3ZIdmtaaVlUdC1DVm52WW9Fc3IxVWFmaDRxcVB4aUVDTEtKVGtHOEZmY0lQVTc3dHNjRG1USy1BREN1elJtUFVrckNXbjZqNkpFdGRrR3l2Smk5RWl0YUg2WWU0ZWY0WVJJb2hPdw?oc=5,1777663510,This “Dated” '90s Shoe Trend Is Back - Harper's BAZAAR,This “Dated” '90s Shoe Trend Is Back - Harper's BAZAAR
gnews,fashion trend,news.google.com,https://news.google.com/rss/articles/CBMitAFBVV95cUxNNE16YlliQ0wtb0R3clZVSDdYTXRCb0VPa0QyT25YblNZZGY3X3pJVldVNWJ5TmdqQV9OVVE1SEh3UjkxaUowV2lUTXlOcEp5UWdhY2dROWFESFRVZWtrS1ozbk5uRFQ2WXBMZzdnZ1hxb1UyTk5QbGZydlUwRTFJbmxWVmZpZ2gwbDY1RUUzOXBES0Q2MU81S3k4eHREWnYtZ0pwWnFieEYtNGNuS0JpQWtWYjE?oc=5,1777005420,Vintage fashion trend offers sustainable alternative to fast fashion in Las Vegas - WRDW,Vintage fashion trend offers sustainable alternative to fast fashion in Las Vegas - WRDW
gnews,fashion trend,news.google.com,https://news.google.com/rss/articles/CBMieEFVX3lxTE9jd0hIdjAwVnhPN1dJWVBVODhsUGN3dU5Nbm9yYU5vYVNRR25fdW8tZ2hhenZiR2NmZ1JiQmFJcVpnVS05QlNCQUx2YTZpdHhPTHUxOVRLSkdoQXVYVzdmX3RXTGd1XzU2eTZvLVBkd3JYejI0Q1lwWA?oc=5,1776322800,Here's Why the Riviera Fashion Trend Should be On Your Moodboard in 2026 - Who What Wear,Here's Why the Riviera Fashion Trend Should be On Your Moodboard in 2026 - Who What Wear
gnews,fashion trend,news.google.com,https://news.google.com/rss/articles/CBMiuAFBVV95cUxOV1Z4ek8wNHhJMkRVdVEwckU5Z3RIZ1paTnFRRlVzTWh0MmxlVVlkU0tXWEpBOGhtVl9NRFhlWExOX0pRUlNnbndTLXpQa2RJS1MtT1dtOUJ1cXVDcHZZeDhJM2dhVGg2aVVib3FzNlJ6SDhTbWM4azdQQVNCN2RBRW5TSzhwcjNvRE1HWnJBX2VIbWN2SVVMM0lmeUR4Tkp3UGIxT0F6THcwbDU1RFk1S3R5SDdmTEVs?oc=5,1776927600,"Vintage fashion trend offers sustainable alternative to fast fashion in Las Vegas - KOLN | Nebraska Local News, Weather, Sports | Lincoln, NE","Vintage fashion trend offers sustainable alternative to fast fashion in Las Vegas - KOLN | Nebraska Local News, Weather, Sports | Lincoln, NE"
gnews,fashion trend,news.google.com,https://news.google.com/rss/articles/CBMitgFBVV95cUxOdml0VmZQNWUxbzhOS19wOGRTMWQ2azg4eGpOVFZYajhHcEFnU3dySW9HUXlpQzdQc2hDUU1XbEZJTEZyUGZtR2xNRzMwZHpQVTNBWEhoM2wtV1V5N056QXNXV2VYZGw1alkySDZaU2E0MUNhT1F0elJpcmNwV0lnNWZsX2ticE1NMkVqMlE4VjhHbzc2ZnczVFJJRUstYktlTlQzRzZROF80R0JCTklNRzNkNlBBZw?oc=5,1777005420,Vintage fashion trend offers sustainable alternative to fast fashion in Las Vegas - WIS News 10,Vintage fashion trend offers sustainable alternative to fast fashion in Las Vegas - WIS News 10
gnews,fashion trend,news.google.com,https://news.google.com/rss/articles/CBMiZ0FVX3lxTE1nMkYzNXMzNGt3b2txMUpReGNEdTgxOWZBVXRtM0FYb2luVHg4dkUtVFhyY3NIX3FEUHV2RngyVWt0SGJrLUZEN1pyWDRFdWFGLS1uWUh4NHRVNkFNek54cGVCRjNac3PSAWxBVV95cUxQZXE2MkFfd3VMWHpSSjAzWEZ3WjQ5WmNwRU1kbGtFcFMxLU1scnY5MFZ5TU1iUm5SY3FWRGtGQ3FaQkptS05lLUhIZE55SmVod2JRQ3hKZDRCYmltcV9YMjZPN2ROM2k2ZWstelY?oc=5,1777827944,Car Racing-Inspired Fashion Capsules - Trend Hunter,Car Racing-Inspired Fashion Capsules - Trend Hunter
gnews,fashion trend,news.google.com,https://news.google.com/rss/articles/CBMiswFBVV95cUxNTVVCVUNtejhSNlQzcHdGZG1vbkpCUWpib1hxVURnRVc5aXljQ1k0WVpreVRROVVHR3NwQ1VkY0w1T2pLQnFxUnBRMDZETllIVUZlNWhtMHg3eE0xTnR4ZzdkY2VnRjhVWWhlaEdRV1ozYnlVbHVuRVdrVFlncmd0YWhFTWRVYS16ODV4ZVQ3QldWR0Jzdnd4MzQ2WWNaeTc1ZjI1YWEwR3RIb2tFRXdhQnVHWQ?oc=5,1777005420,Vintage fashion trend offers sustainable alternative to fast fashion in Las Vegas - WABI,Vintage fashion trend offers sustainable alternative to fast fashion in Las Vegas - WABI
gnews,fashion trend,news.google.com,https://news.google.com/rss/articles/CBMilgFBVV95cUxNcktmSDQtS0l6ME9lOTJ5cktBbmxrYktKZUNsWER0ZmtVVlJSbUhXTFktRXVHNWhxVzc3b0M1VEF4Ul8zZ2JHMnhjSC1KX2FQNTdNcnZGQXdjX1k5RkM4eDBWRUNUam9rVFlRbERaZ0dyV2d6NzZrX09Lc0E3cjQyeTJGNHJoaXRqTUpWdEJSV0lvX0d0YVE?oc=5,1776063600,Fashion Girls Are Swapping Denim Shorts for This Spring Trend—And I’m Loving This $23 Cider Pair - cosmopolitan.com,Fashion Girls Are Swapping Denim Shorts for This Spring Trend—And I’m Loving This $23 Cider Pair - cosmopolitan.com
gnews,fashion trend,news.google.com,https://news.google.com/rss/articles/CBMitwFBVV95cUxQNXFGNGZDZ3gyNVV1blhYWC1wV3d5c1U0QmNtT2F1NXdTTl83ZHFfYzlQenNxZlhhU3BYQ3paM3FnbVJ1LTNucFdWN0ZzaFpVWG9LZUZBUlVodzRzY1NESWFPUldpU29BSk9QUy1LOXhJYWc3NjNQMmQ3UURtSC1BR0UxVl9jS1UxWU5pbWdYX3Yzcm1lbFNNanhmUmRUVk5uTVZ1WFBaaHl6Q2xlWjM0b3M3Q1EyZjg?oc=5,1777005420,Vintage fashion trend offers sustainable alternative to fast fashion in Las Vegas - WWNY,Vintage fashion trend offers sustainable alternative to fast fashion in Las Vegas - WWNY
gnews,fashion trend,news.google.com,https://news.google.com/rss/articles/CBMitAFBVV95cUxNeHJFRWxDdm83RUVjclM4eE02a21JVndFRmxwQjRWZUV6UUdGb040YXkxOE9kZWdqWURwb2FKWVVnYjM2cUFWLWZPRkhpV0x3VENlS0RLRkFsU1puRVFfN29IWFFhREUxMGlDUlJ4RzR3eEJHUlR5TmV1alFDXzgzNjhYcFdXeXNsckpHUVpOWXJPaUw4ZEVTWWRvcFZwMU5fdHNJc1p4Y3lnU3JjRFdEU1NLNGQ?oc=5,1776927600,Vintage fashion trend offers sustainable alternative to fast fashion in Las Vegas - WSMV,Vintage fashion trend offers sustainable alternative to fast fashion in Las Vegas - WSMV
